[I 2026-07-01 05:10:10,433] Trial 63 finished with value: 0.7673045665041249 and parameters: {'num_nodes': [32], 'dropout': 0.26490889733836087, 'learning_rate': 0.00011436427374279337, 'batch_norm': False}. Best is trial 20 with value: 0.7756578342073788.

5:	[0s / 0s],		train_loss: 4.3981
16:	[0s / 6s],		train_loss: 4.3200
70:	[0s / 11s],		train_loss: 4.1035
6:	[0s / 1s],		train_loss: 4.3961
15:	[0s / 3s],		train_loss: 4.1932
71:	[0s / 11s],		train_loss: 4.0582
7:	[0s / 1s],		train_loss: 4.3668
16:	[0s / 3s],		train_loss: 4.1815
72:	[0s / 11s],		train_loss: 4.0443
17:	[0s / 6s],		train_loss: 4.2873
8:	[0s / 1s],		train_loss: 4.3223
17:	[0s / 3s],		train_loss: 4.1551
73:	[0s / 11s],		train_loss: 4.0506
9:	[0s / 1s],		train_loss: 4.3514
84:	[0s / 56s],		train_loss: 3.8804
74:	[0s / 11s],		train_loss: 4.0434
18:	[0s / 3s],		train_loss: 4.1248
10:	[0s / 1s],		train_loss: 4.3183
18:	[0s / 7s],		train_loss: 4.2938
75:	[0s / 11s],		train_loss: 4.0215
19:	[0s / 4s],		train_loss: 4.1414
11:	[0s / 1s],		train_loss: 4.3216
76:	[0s / 11s],		train_loss: 4.0400
12:	[0s / 2s],		train_loss: 4.3019
20:	[0s / 4s],		train_loss: 4.1091
19:	[0s / 7s],		train_loss: 4.2979
77:	[0s / 12s],		train_loss: 4.0036
13:	[0s / 2s],		train_loss: 4.2875
59:	[1s / 1m:13s],		train_loss: 4.1014
21:	[0s / 4s],		train_loss: 4.0980
87:	[2s / 3m:25s],		train_loss: 4.0856
78:	[0s / 12s],		train_loss: 3.9952
14:	[0s / 2s],		train_loss: 4.2783
85:	[0s / 57s],		train_loss: 3.8518
20:	[0s / 7s],		train_loss: 4.2868
22:	[0s / 4s],		train_loss: 4.1113
79:	[0s / 12s],		train_loss: 4.0158
15:	[0s / 2s],		train_loss: 4.2834
80:	[0s / 12s],		train_loss: 4.0290
23:	[0s / 4s],		train_loss: 4.0967
16:	[0s / 2s],		train_loss: 4.2838
81:	[0s / 12s],		train_loss: 4.0218
21:	[0s / 8s],		train_loss: 4.2672
17:	[0s / 2s],		train_loss: 4.2621
24:	[0s / 5s],		train_loss: 4.0604
47:	[4s / 3m:25s],		train_loss: 4.2027
82:	[0s / 12s],		train_loss: 3.9977
18:	[0s / 3s],		train_loss: 4.2603
25:	[0s / 5s],		train_loss: 4.0412
86:	[0s / 58s],		train_loss: 3.8538
83:	[0s / 13s],		train_loss: 3.9974
22:	[0s / 8s],		train_loss: 4.2772
19:	[0s / 3s],		train_loss: 4.2028
26:	[0s / 5s],		train_loss: 4.0190
84:	[0s / 13s],		train_loss: 4.0047
20:	[0s / 3s],		train_loss: 4.2048
85:	[0s / 13s],		train_loss: 4.0065
27:	[0s / 5s],		train_loss: 4.0081
21:	[0s / 3s],		train_loss: 4.2216
60:	[1s / 1m:14s],		train_loss: 4.1193
23:	[0s / 9s],		train_loss: 4.2752
86:	[0s / 13s],		train_loss: 4.0122
28:	[0s / 5s],		train_loss: 4.0201
22:	[0s / 3s],		train_loss: 4.2111
87:	[0s / 13s],		train_loss: 3.9833
23:	[0s / 3s],		train_loss: 4.1960
29:	[0s / 5s],		train_loss: 3.9824
87:	[0s / 59s],		train_loss: 3.8715
88:	[0s / 13s],		train_loss: 3.9647
24:	[0s / 9s],		train_loss: 4.2542
24:	[0s / 3s],		train_loss: 4.1868
30:	[0s / 6s],		train_loss: 3.9748
89:	[0s / 13s],		train_loss: 3.9579
25:	[0s / 4s],		train_loss: 4.1719
90:	[0s / 14s],		train_loss: 3.9702
31:	[0s / 6s],		train_loss: 3.9673
25:	[0s / 9s],		train_loss: 4.2576
26:	[0s / 4s],		train_loss: 4.1557
91:	[0s / 14s],		train_loss: 3.9304
32:	[0s / 6s],		train_loss: 3.9547
27:	[0s / 4s],		train_loss: 4.1659
92:	[0s / 14s],		train_loss: 3.9615
88:	[0s / 59s],		train_loss: 3.7934
28:	[0s / 4s],		train_loss: 4.1497
33:	[0s / 6s],		train_loss: 3.9353
26:	[0s / 10s],		train_loss: 4.2244
93:	[0s / 14s],		train_loss: 3.9549
61:	[1s / 1m:16s],		train_loss: 4.1026
29:	[0s / 4s],		train_loss: 4.1607
34:	[0s / 6s],		train_loss: 3.8992
94:	[0s / 14s],		train_loss: 3.9520
30:	[0s / 4s],		train_loss: 4.1460
88:	[2s / 3m:27s],		train_loss: 4.0749
27:	[0s / 10s],		train_loss: 4.2304
95:	[0s / 14s],		train_loss: 3.9558
35:	[0s / 7s],		train_loss: 3.9066
31:	[0s / 5s],		train_loss: 4.1193
96:	[0s / 15s],		train_loss: 3.9360
36:	[0s / 7s],		train_loss: 3.8968
89:	[0s / 1m:0s],		train_loss: 3.8454
32:	[0s / 5s],		train_loss: 4.1392
97:	[0s / 15s],		train_loss: 3.9195
28:	[0s / 10s],		train_loss: 4.2372
37:	[0s / 7s],		train_loss: 3.8687
33:	[0s / 5s],		train_loss: 4.1128
98:	[0s / 15s],		train_loss: 3.9011
34:	[0s / 5s],		train_loss: 4.0858
38:	[0s / 7s],		train_loss: 3.8533
99:	[0s / 15s],		train_loss: 3.8813
29:	[0s / 11s],		train_loss: 4.2303
35:	[0s / 5s],		train_loss: 4.0949
39:	[0s / 7s],		train_loss: 3.8403
36:	[0s / 5s],		train_loss: 4.0803
0:	[0s / 0s],		train_loss: 5.0590
90:	[0s / 1m:1s],		train_loss: 3.8138
62:	[1s / 1m:17s],		train_loss: 4.1071
37:	[0s / 5s],		train_loss: 4.0618
40:	[0s / 8s],		train_loss: 3.8160
1:	[0s / 0s],		train_loss: 4.6016
30:	[0s / 11s],		train_loss: 4.1969
2:	[0s / 0s],		train_loss: 4.5086
38:	[0s / 6s],		train_loss: 4.0395
41:	[0s / 8s],		train_loss: 3.7920
3:	[0s / 0s],		train_loss: 4.4673
39:	[0s / 6s],		train_loss: 4.0545
31:	[0s / 11s],		train_loss: 4.2198
42:	[0s / 8s],		train_loss: 3.7818
4:	[0s / 0s],		train_loss: 4.3913
91:	[0s / 1m:1s],		train_loss: 3.8017
40:	[0s / 6s],		train_loss: 4.0267
5:	[0s / 0s],		train_loss: 4.3645
43:	[0s / 8s],		train_loss: 3.7544
41:	[0s / 6s],		train_loss: 4.0469
32:	[0s / 12s],		train_loss: 4.1946
6:	[0s / 1s],		train_loss: 4.3682
42:	[0s / 6s],		train_loss: 4.0279
44:	[0s / 8s],		train_loss: 3.7361
7:	[0s / 1s],		train_loss: 4.3622
43:	[0s / 6s],		train_loss: 4.0241
45:	[0s / 9s],		train_loss: 3.7454
8:	[0s / 1s],		train_loss: 4.3144
63:	[1s / 1m:18s],		train_loss: 4.1172
33:	[0s / 12s],		train_loss: 4.1861
44:	[0s / 7s],		train_loss: 3.9744
92:	[0s / 1m:2s],		train_loss: 3.7971
9:	[0s / 1s],		train_loss: 4.3271
46:	[0s / 9s],		train_loss: 3.7362
45:	[0s / 7s],		train_loss: 3.9965
10:	[0s / 1s],		train_loss: 4.2895
46:	[0s / 7s],		train_loss: 3.9794
34:	[0s / 12s],		train_loss: 4.1795
47:	[0s / 9s],		train_loss: 3.7200
11:	[0s / 1s],		train_loss: 4.2871
47:	[0s / 7s],		train_loss: 3.9742
12:	[0s / 1s],		train_loss: 4.2699
89:	[2s / 3m:30s],		train_loss: 4.0300
48:	[4s / 3m:30s],		train_loss: 4.1911
48:	[0s / 9s],		train_loss: 3.6931
48:	[0s / 7s],		train_loss: 3.9650
13:	[0s / 2s],		train_loss: 4.2612
35:	[0s / 13s],		train_loss: 4.1773
93:	[0s / 1m:3s],		train_loss: 3.8284
49:	[0s / 7s],		train_loss: 3.9638
14:	[0s / 2s],		train_loss: 4.2251
49:	[0s / 10s],		train_loss: 3.6701
50:	[0s / 7s],		train_loss: 3.9432
15:	[0s / 2s],		train_loss: 4.2034
50:	[0s / 10s],		train_loss: 3.6609
36:	[0s / 13s],		train_loss: 4.1766
51:	[0s / 8s],		train_loss: 3.9192
64:	[1s / 1m:19s],		train_loss: 4.0956
16:	[0s / 2s],		train_loss: 4.2530
52:	[0s / 8s],		train_loss: 3.9292
17:	[0s / 2s],		train_loss: 4.2240
51:	[0s / 10s],		train_loss: 3.6327
94:	[0s / 1m:3s],		train_loss: 3.8301
53:	[0s / 8s],		train_loss: 3.9193
37:	[0s / 13s],		train_loss: 4.1868
18:	[0s / 2s],		train_loss: 4.2004
52:	[0s / 10s],		train_loss: 3.6566
54:	[0s / 8s],		train_loss: 3.9101
19:	[0s / 2s],		train_loss: 4.1955
53:	[0s / 10s],		train_loss: 3.5984
20:	[0s / 3s],		train_loss: 4.1721
55:	[0s / 8s],		train_loss: 3.9302
38:	[0s / 14s],		train_loss: 4.1563
21:	[0s / 3s],		train_loss: 4.1728
56:	[0s / 8s],		train_loss: 3.9078
54:	[0s / 11s],		train_loss: 3.5749
95:	[0s / 1m:4s],		train_loss: 3.8782
22:	[0s / 3s],		train_loss: 4.1633
57:	[0s / 9s],		train_loss: 3.8864
39:	[0s / 14s],		train_loss: 4.1017
55:	[0s / 11s],		train_loss: 3.5906
23:	[0s / 3s],		train_loss: 4.1454
58:	[0s / 9s],		train_loss: 3.9004
65:	[1s / 1m:20s],		train_loss: 4.0651
24:	[0s / 3s],		train_loss: 4.1166
59:	[0s / 9s],		train_loss: 3.8864
56:	[0s / 11s],		train_loss: 3.5800
25:	[0s / 3s],		train_loss: 4.1010
40:	[0s / 14s],		train_loss: 4.1397
60:	[0s / 9s],		train_loss: 3.8651
96:	[0s / 1m:4s],		train_loss: 3.8485
57:	[0s / 11s],		train_loss: 3.5924
26:	[0s / 3s],		train_loss: 4.1128
61:	[0s / 9s],		train_loss: 3.8532
27:	[0s / 4s],		train_loss: 4.0819
62:	[0s / 9s],		train_loss: 3.8540
58:	[0s / 11s],		train_loss: 3.5663
41:	[0s / 15s],		train_loss: 4.1318
28:	[0s / 4s],		train_loss: 4.0944
63:	[0s / 9s],		train_loss: 3.8339
90:	[2s / 3m:32s],		train_loss: 4.0496
29:	[0s / 4s],		train_loss: 4.0770
59:	[0s / 12s],		train_loss: 3.5395
64:	[0s / 10s],		train_loss: 3.8640
30:	[0s / 4s],		train_loss: 4.0511
42:	[0s / 15s],		train_loss: 4.0961
97:	[0s / 1m:5s],		train_loss: 3.7860
60:	[0s / 12s],		train_loss: 3.5482
65:	[0s / 10s],		train_loss: 3.8402
31:	[0s / 4s],		train_loss: 4.0612
66:	[0s / 10s],		train_loss: 3.7996
32:	[0s / 4s],		train_loss: 4.0119
61:	[0s / 12s],		train_loss: 3.5153
43:	[0s / 15s],		train_loss: 4.0966
67:	[0s / 10s],		train_loss: 3.8330
66:	[1s / 1m:21s],		train_loss: 4.0702
33:	[0s / 4s],		train_loss: 4.0185
68:	[0s / 10s],		train_loss: 3.7988
62:	[0s / 12s],		train_loss: 3.4990
34:	[0s / 4s],		train_loss: 4.0167
69:	[0s / 10s],		train_loss: 3.7774
44:	[0s / 16s],		train_loss: 4.1019
35:	[0s / 5s],		train_loss: 3.9986
98:	[0s / 1m:6s],		train_loss: 3.8138
63:	[0s / 12s],		train_loss: 3.4880
70:	[0s / 10s],		train_loss: 3.7856
36:	[0s / 5s],		train_loss: 3.9881
64:	[0s / 13s],		train_loss: 3.4799
71:	[0s / 11s],		train_loss: 3.8058
37:	[0s / 5s],		train_loss: 3.9978
45:	[0s / 16s],		train_loss: 4.0869
72:	[0s / 11s],		train_loss: 3.7972
38:	[0s / 5s],		train_loss: 3.9410
65:	[0s / 13s],		train_loss: 3.4689
73:	[0s / 11s],		train_loss: 3.7618
39:	[0s / 5s],		train_loss: 3.9439
66:	[0s / 13s],		train_loss: 3.4338
46:	[0s / 16s],		train_loss: 4.0874
99:	[0s / 1m:6s],		train_loss: 3.8452
40:	[0s / 5s],		train_loss: 3.9156
74:	[0s / 11s],		train_loss: 3.7544
67:	[1s / 1m:23s],		train_loss: 4.0820
41:	[0s / 5s],		train_loss: 3.9134
67:	[0s / 13s],		train_loss: 3.4014
75:	[0s / 11s],		train_loss: 3.7587
42:	[0s / 6s],		train_loss: 3.8875
47:	[0s / 17s],		train_loss: 4.0980
76:	[0s / 11s],		train_loss: 3.6961
68:	[0s / 14s],		train_loss: 3.4098
43:	[0s / 6s],		train_loss: 3.8879
77:	[0s / 12s],		train_loss: 3.7342
44:	[0s / 6s],		train_loss: 3.8769
91:	[2s / 3m:34s],		train_loss: 4.0615
69:	[0s / 14s],		train_loss: 3.4089
78:	[0s / 12s],		train_loss: 3.7391
48:	[0s / 17s],		train_loss: 4.0696
0:	[0s / 0s],		train_loss: 4.7051
45:	[0s / 6s],		train_loss: 3.8691
79:	[0s / 12s],		train_loss: 3.7121
49:	[4s / 3m:35s],		train_loss: 4.1954
70:	[0s / 14s],		train_loss: 3.3833
46:	[0s / 6s],		train_loss: 3.8532
80:	[0s / 12s],		train_loss: 3.7092
49:	[0s / 18s],		train_loss: 4.0680
47:	[0s / 6s],		train_loss: 3.8735
71:	[0s / 14s],		train_loss: 3.4362
81:	[0s / 12s],		train_loss: 3.7254
68:	[1s / 1m:24s],		train_loss: 4.0673
48:	[0s / 7s],		train_loss: 3.8320
82:	[0s / 12s],		train_loss: 3.6780
72:	[0s / 14s],		train_loss: 3.3808
49:	[0s / 7s],		train_loss: 3.8217
50:	[0s / 18s],		train_loss: 4.0558
1:	[0s / 1s],		train_loss: 4.5404
83:	[0s / 12s],		train_loss: 3.6841
50:	[0s / 7s],		train_loss: 3.8165
73:	[0s / 15s],		train_loss: 3.3569
84:	[0s / 13s],		train_loss: 3.6724
51:	[0s / 7s],		train_loss: 3.8059
51:	[0s / 18s],		train_loss: 4.0454
85:	[0s / 13s],		train_loss: 3.6682
74:	[0s / 15s],		train_loss: 3.3517
52:	[0s / 7s],		train_loss: 3.7781
86:	[0s / 13s],		train_loss: 3.6655
53:	[0s / 7s],		train_loss: 3.7912
75:	[0s / 15s],		train_loss: 3.3544
87:	[0s / 13s],		train_loss: 3.6266
2:	[0s / 1s],		train_loss: 4.4289
54:	[0s / 7s],		train_loss: 3.7990
52:	[0s / 19s],		train_loss: 4.0370
76:	[0s / 15s],		train_loss: 3.3773
69:	[0s / 1m:25s],		train_loss: 4.0609
88:	[0s / 13s],		train_loss: 3.6666
55:	[0s / 7s],		train_loss: 3.7510
89:	[0s / 13s],		train_loss: 3.6571
77:	[0s / 15s],		train_loss: 3.3577
56:	[0s / 8s],		train_loss: 3.7250
92:	[1s / 3m:36s],		train_loss: 4.0533
53:	[0s / 19s],		train_loss: 4.0398
90:	[0s / 13s],		train_loss: 3.6500
57:	[0s / 8s],		train_loss: 3.7383
78:	[0s / 16s],		train_loss: 3.3480
91:	[0s / 14s],		train_loss: 3.6417
58:	[0s / 8s],		train_loss: 3.7504
3:	[0s / 2s],		train_loss: 4.4030
79:	[0s / 16s],		train_loss: 3.3567
92:	[0s / 14s],		train_loss: 3.6112
59:	[0s / 8s],		train_loss: 3.6999
54:	[0s / 19s],		train_loss: 4.0669
93:	[0s / 14s],		train_loss: 3.5814
60:	[0s / 8s],		train_loss: 3.6785
80:	[0s / 16s],		train_loss: 3.3445
94:	[0s / 14s],		train_loss: 3.5945
61:	[0s / 8s],		train_loss: 3.6917
55:	[0s / 20s],		train_loss: 4.0489
81:	[0s / 16s],		train_loss: 3.2928
62:	[0s / 8s],		train_loss: 3.6873
95:	[0s / 14s],		train_loss: 3.6100
4:	[0s / 3s],		train_loss: 4.3736
63:	[0s / 9s],		train_loss: 3.6979
96:	[0s / 14s],		train_loss: 3.5697
82:	[0s / 17s],		train_loss: 3.2810
56:	[0s / 20s],		train_loss: 4.0009
70:	[1s / 1m:26s],		train_loss: 4.0283
64:	[0s / 9s],		train_loss: 3.6524
97:	[0s / 15s],		train_loss: 3.5876
83:	[0s / 17s],		train_loss: 3.3021
65:	[0s / 9s],		train_loss: 3.6562
98:	[0s / 15s],		train_loss: 3.5470
57:	[0s / 20s],		train_loss: 4.0228
84:	[0s / 17s],		train_loss: 3.2602
66:	[0s / 9s],		train_loss: 3.6551
99:	[0s / 15s],		train_loss: 3.5466
5:	[0s / 3s],		train_loss: 4.3582
67:	[0s / 9s],		train_loss: 3.6262
85:	[0s / 17s],		train_loss: 3.2882
93:	[1s / 3m:38s],		train_loss: 4.0368
68:	[0s / 9s],		train_loss: 3.6113
58:	[0s / 21s],		train_loss: 3.9970
0:	[0s / 0s],		train_loss: 4.6890
86:	[0s / 17s],		train_loss: 3.2635
69:	[0s / 10s],		train_loss: 3.6119
1:	[0s / 0s],		train_loss: 4.4737
70:	[0s / 10s],		train_loss: 3.5841
59:	[0s / 21s],		train_loss: 3.9999
71:	[1s / 1m:27s],		train_loss: 4.0655
87:	[0s / 18s],		train_loss: 3.2438
2:	[0s / 0s],		train_loss: 4.4319
6:	[0s / 4s],		train_loss: 4.3358
50:	[3s / 3m:38s],		train_loss: 4.1518
71:	[0s / 10s],		train_loss: 3.5755
3:	[0s / 0s],		train_loss: 4.4123
72:	[0s / 10s],		train_loss: 3.5740
88:	[0s / 18s],		train_loss: 3.2394
60:	[0s / 21s],		train_loss: 3.9639
4:	[0s / 0s],		train_loss: 4.3772
73:	[0s / 10s],		train_loss: 3.5766
89:	[0s / 18s],		train_loss: 3.2388
5:	[0s / 1s],		train_loss: 4.3421
74:	[0s / 10s],		train_loss: 3.5534
6:	[0s / 1s],		train_loss: 4.3147
61:	[0s / 22s],		train_loss: 3.9831
75:	[0s / 11s],		train_loss: 3.5593
90:	[0s / 18s],		train_loss: 3.2048
7:	[0s / 5s],		train_loss: 4.3350
76:	[0s / 11s],		train_loss: 3.5127
7:	[0s / 1s],		train_loss: 4.3117
91:	[0s / 19s],		train_loss: 3.2001
77:	[0s / 11s],		train_loss: 3.5192
8:	[0s / 1s],		train_loss: 4.3095
62:	[0s / 22s],		train_loss: 3.9869
78:	[0s / 11s],		train_loss: 3.4933
92:	[0s / 19s],		train_loss: 3.1557
9:	[0s / 1s],		train_loss: 4.2794
79:	[0s / 11s],		train_loss: 3.5236
10:	[0s / 1s],		train_loss: 4.2831
72:	[1s / 1m:28s],		train_loss: 4.0277
93:	[0s / 19s],		train_loss: 3.1768
8:	[0s / 5s],		train_loss: 4.2983
63:	[0s / 22s],		train_loss: 3.9839
80:	[0s / 11s],		train_loss: 3.5110
11:	[0s / 1s],		train_loss: 4.2380
81:	[0s / 11s],		train_loss: 3.4701
94:	[0s / 19s],		train_loss: 3.1705
12:	[0s / 2s],		train_loss: 4.2522
82:	[0s / 11s],		train_loss: 3.4726
64:	[0s / 23s],		train_loss: 3.9288
94:	[2s / 3m:40s],		train_loss: 4.0106
95:	[0s / 19s],		train_loss: 3.1460
13:	[0s / 2s],		train_loss: 4.2491
83:	[0s / 12s],		train_loss: 3.4569
84:	[0s / 12s],		train_loss: 3.4529
14:	[0s / 2s],		train_loss: 4.2311
96:	[0s / 20s],		train_loss: 3.1520
65:	[0s / 23s],		train_loss: 3.9379
9:	[0s / 6s],		train_loss: 4.3188
85:	[0s / 12s],		train_loss: 3.4420
15:	[0s / 2s],		train_loss: 4.2131
97:	[0s / 20s],		train_loss: 3.1522
86:	[0s / 12s],		train_loss: 3.4604
16:	[0s / 2s],		train_loss: 4.2143
87:	[0s / 12s],		train_loss: 3.4502
98:	[0s / 20s],		train_loss: 3.0990
66:	[0s / 23s],		train_loss: 3.8991
17:	[0s / 2s],		train_loss: 4.1782
73:	[1s / 1m:29s],		train_loss: 4.0331
88:	[0s / 12s],		train_loss: 3.3938
18:	[0s / 3s],		train_loss: 4.1667
99:	[0s / 20s],		train_loss: 3.0829
89:	[0s / 12s],		train_loss: 3.4008
10:	[0s / 7s],		train_loss: 4.2678
19:	[0s / 3s],		train_loss: 4.1763
67:	[0s / 24s],		train_loss: 3.9504
90:	[0s / 13s],		train_loss: 3.3996
20:	[0s / 3s],		train_loss: 4.1467
91:	[0s / 13s],		train_loss: 3.4107
0:	[0s / 0s],		train_loss: 5.3323
21:	[0s / 3s],		train_loss: 4.1601
92:	[0s / 13s],		train_loss: 3.3947
68:	[0s / 24s],		train_loss: 3.9239
1:	[0s / 0s],		train_loss: 4.6972
93:	[0s / 13s],		train_loss: 3.4146
22:	[0s / 3s],		train_loss: 4.1441
11:	[0s / 7s],		train_loss: 4.2773
94:	[0s / 13s],		train_loss: 3.4191
23:	[0s / 3s],		train_loss: 4.1178
2:	[0s / 0s],		train_loss: 4.5914
69:	[0s / 24s],		train_loss: 3.9171
74:	[1s / 1m:30s],		train_loss: 4.0067
95:	[0s / 13s],		train_loss: 3.4092
24:	[0s / 4s],		train_loss: 4.0745
3:	[0s / 0s],		train_loss: 4.5907
96:	[0s / 13s],		train_loss: 3.4004
25:	[0s / 4s],		train_loss: 4.1063
51:	[3s / 3m:42s],		train_loss: 4.1613
97:	[0s / 14s],		train_loss: 3.4158
70:	[0s / 25s],		train_loss: 3.9331
95:	[2s / 3m:42s],		train_loss: 4.0383
4:	[0s / 1s],		train_loss: 4.5400
26:	[0s / 4s],		train_loss: 4.0604
12:	[0s / 8s],		train_loss: 4.2721
98:	[0s / 14s],		train_loss: 3.3905
27:	[0s / 4s],		train_loss: 4.0851
99:	[0s / 14s],		train_loss: 3.3455
5:	[0s / 1s],		train_loss: 4.4876
28:	[0s / 4s],		train_loss: 4.0738
71:	[0s / 25s],		train_loss: 3.9046
29:	[0s / 4s],		train_loss: 4.0271
6:	[0s / 1s],		train_loss: 4.4905
0:	[0s / 0s],		train_loss: 4.6869
30:	[0s / 5s],		train_loss: 4.0526
1:	[0s / 0s],		train_loss: 4.5257
72:	[0s / 26s],		train_loss: 3.9107
7:	[0s / 1s],		train_loss: 4.4969
13:	[0s / 9s],		train_loss: 4.2608
31:	[0s / 5s],		train_loss: 4.0241
75:	[1s / 1m:32s],		train_loss: 4.0360
2:	[0s / 0s],		train_loss: 4.4426
8:	[0s / 2s],		train_loss: 4.4386
32:	[0s / 5s],		train_loss: 4.0124
3:	[0s / 0s],		train_loss: 4.3662
73:	[0s / 26s],		train_loss: 3.8639
33:	[0s / 5s],		train_loss: 3.9749
9:	[0s / 2s],		train_loss: 4.4375
4:	[0s / 0s],		train_loss: 4.3775
34:	[0s / 5s],		train_loss: 4.0016
5:	[0s / 0s],		train_loss: 4.3394
10:	[0s / 2s],		train_loss: 4.4336
74:	[0s / 26s],		train_loss: 3.8649
6:	[0s / 1s],		train_loss: 4.3489
35:	[0s / 5s],		train_loss: 3.9688
14:	[0s / 9s],		train_loss: 4.2457
11:	[0s / 2s],		train_loss: 4.4348
7:	[0s / 1s],		train_loss: 4.2659
36:	[0s / 5s],		train_loss: 3.9266
8:	[0s / 1s],		train_loss: 4.3127
37:	[0s / 6s],		train_loss: 3.9499
75:	[0s / 27s],		train_loss: 3.8668
12:	[0s / 2s],		train_loss: 4.4198
9:	[0s / 1s],		train_loss: 4.2748
38:	[0s / 6s],		train_loss: 3.9339
76:	[1s / 1m:33s],		train_loss: 4.0109
13:	[0s / 3s],		train_loss: 4.3817
96:	[2s / 3m:44s],		train_loss: 4.0035
10:	[0s / 1s],		train_loss: 4.2253
15:	[0s / 10s],		train_loss: 4.2350
39:	[0s / 6s],		train_loss: 3.9179
76:	[0s / 27s],		train_loss: 3.8660
11:	[0s / 1s],		train_loss: 4.2654
14:	[0s / 3s],		train_loss: 4.3848
40:	[0s / 6s],		train_loss: 3.9062
12:	[0s / 1s],		train_loss: 4.2418
41:	[0s / 6s],		train_loss: 3.8903
15:	[0s / 3s],		train_loss: 4.3832
13:	[0s / 2s],		train_loss: 4.2355
77:	[0s / 27s],		train_loss: 3.8546
42:	[0s / 6s],		train_loss: 3.8694
14:	[0s / 2s],		train_loss: 4.1964
16:	[0s / 10s],		train_loss: 4.2304
16:	[0s / 3s],		train_loss: 4.3431
43:	[0s / 7s],		train_loss: 3.8721
15:	[0s / 2s],		train_loss: 4.1977
44:	[0s / 7s],		train_loss: 3.8501
17:	[0s / 4s],		train_loss: 4.3320
78:	[0s / 28s],		train_loss: 3.8362
16:	[0s / 2s],		train_loss: 4.1810
77:	[1s / 1m:34s],		train_loss: 4.0092
45:	[0s / 7s],		train_loss: 3.8608
17:	[0s / 2s],		train_loss: 4.1722
17:	[0s / 11s],		train_loss: 4.2250
18:	[0s / 4s],		train_loss: 4.3278
46:	[0s / 7s],		train_loss: 3.8203
18:	[0s / 2s],		train_loss: 4.1587
79:	[0s / 28s],		train_loss: 3.8357
47:	[0s / 7s],		train_loss: 3.8159
19:	[0s / 4s],		train_loss: 4.3279
19:	[0s / 3s],		train_loss: 4.1708
48:	[0s / 7s],		train_loss: 3.7943
20:	[0s / 3s],		train_loss: 4.1243
20:	[0s / 4s],		train_loss: 4.3109
52:	[3s / 3m:46s],		train_loss: 4.1424
49:	[0s / 8s],		train_loss: 3.7711
80:	[0s / 29s],		train_loss: 3.8217
21:	[0s / 3s],		train_loss: 4.1362
18:	[0s / 12s],		train_loss: 4.1990
21:	[0s / 4s],		train_loss: 4.2925
97:	[1s / 3m:46s],		train_loss: 4.0065
50:	[0s / 8s],		train_loss: 3.7738
22:	[0s / 3s],		train_loss: 4.1281
22:	[0s / 5s],		train_loss: 4.2908
51:	[0s / 8s],		train_loss: 3.7817
78:	[1s / 1m:35s],		train_loss: 4.0183
23:	[0s / 3s],		train_loss: 4.0975
81:	[0s / 29s],		train_loss: 3.8455
52:	[0s / 8s],		train_loss: 3.7955
24:	[0s / 3s],		train_loss: 4.1018
23:	[0s / 5s],		train_loss: 4.2613
25:	[0s / 3s],		train_loss: 4.1102
53:	[0s / 8s],		train_loss: 3.7548
19:	[0s / 12s],		train_loss: 4.2095
82:	[0s / 29s],		train_loss: 3.7950
24:	[0s / 5s],		train_loss: 4.2808
26:	[0s / 4s],		train_loss: 4.0682
54:	[0s / 8s],		train_loss: 3.7682
27:	[0s / 4s],		train_loss: 4.0822
55:	[0s / 8s],		train_loss: 3.7478
25:	[0s / 5s],		train_loss: 4.2668
83:	[0s / 30s],		train_loss: 3.8212
28:	[0s / 4s],		train_loss: 4.0558
56:	[0s / 9s],		train_loss: 3.7255
26:	[0s / 6s],		train_loss: 4.2895
29:	[0s / 4s],		train_loss: 4.0699
57:	[0s / 9s],		train_loss: 3.7135
20:	[0s / 13s],		train_loss: 4.1881
79:	[1s / 1m:36s],		train_loss: 3.9977
30:	[0s / 4s],		train_loss: 4.0410
27:	[0s / 6s],		train_loss: 4.2834
58:	[0s / 9s],		train_loss: 3.6864
84:	[0s / 30s],		train_loss: 3.7749
31:	[0s / 4s],		train_loss: 4.0181
59:	[0s / 9s],		train_loss: 3.6980
28:	[0s / 6s],		train_loss: 4.2583
32:	[0s / 5s],		train_loss: 3.9912
60:	[0s / 9s],		train_loss: 3.6701
85:	[0s / 30s],		train_loss: 3.7985
33:	[0s / 5s],		train_loss: 3.9657
29:	[0s / 6s],		train_loss: 4.2383
61:	[0s / 9s],		train_loss: 3.7037
21:	[0s / 13s],		train_loss: 4.1592
34:	[0s / 5s],		train_loss: 3.9917
62:	[0s / 10s],		train_loss: 3.6669
30:	[0s / 6s],		train_loss: 4.2494
35:	[0s / 5s],		train_loss: 3.9701
86:	[0s / 31s],		train_loss: 3.8009
63:	[0s / 10s],		train_loss: 3.6614
31:	[0s / 7s],		train_loss: 4.2071
36:	[0s / 5s],		train_loss: 3.9603
64:	[0s / 10s],		train_loss: 3.6256
37:	[0s / 5s],		train_loss: 3.9386
32:	[0s / 7s],		train_loss: 4.1957
65:	[0s / 10s],		train_loss: 3.6491
87:	[0s / 31s],		train_loss: 3.7779
80:	[1s / 1m:37s],		train_loss: 4.0047
98:	[2s / 3m:48s],		train_loss: 4.0519
22:	[0s / 14s],		train_loss: 4.1723
38:	[0s / 5s],		train_loss: 3.9401
66:	[0s / 10s],		train_loss: 3.6687
33:	[0s / 7s],		train_loss: 4.2213
39:	[0s / 6s],		train_loss: 3.9413
67:	[0s / 10s],		train_loss: 3.6145
34:	[0s / 7s],		train_loss: 4.2166
40:	[0s / 6s],		train_loss: 3.9571
88:	[0s / 32s],		train_loss: 3.7489
68:	[0s / 11s],		train_loss: 3.6392
41:	[0s / 6s],		train_loss: 3.9308
35:	[0s / 8s],		train_loss: 4.1850
69:	[0s / 11s],		train_loss: 3.6193
23:	[0s / 15s],		train