8:	[0s / 1s],		train_loss: 4.3183[I 2026-06-28 07:17:57,103] Trial 92 finished with value: 0.7454860152727942 and parameters: {'num_nodes': [32], 'dropout': 0.02680521761666667, 'learning_rate': 0.0010794271049935332, 'batch_norm': True}. Best is trial 62 with value: 0.7726715122519704.
/scratch.hpc/luca.cotugno/Foundation_model_clinical_data/test_tabular_model.py:481: UserWarning: Choices for a categorical distribution should be a tuple of None, bool, int, float and str for persistent storage but contains [32] which is of type list.
  num_nodes  = trial.suggest_categorical("num_nodes", [[32], [64], [128], [64, 32], [128, 64]])
/scratch.hpc/luca.cotugno/Foundation_model_clinical_data/test_tabular_model.py:481: UserWarning: Choices for a categorical distribution should be a tuple of None, bool, int, float and str for persistent storage but contains [64] which is of type list.
  num_nodes  = trial.suggest_categorical("num_nodes", [[32], [64], [128], [64, 32], [128, 64]])
/scratch.hpc/luca.cotugno/Foundation_model_clinical_data/test_tabular_model.py:481: UserWarning: Choices for a categorical distribution should be a tuple of None, bool, int, float and str for persistent storage but contains [128] which is of type list.
  num_nodes  = trial.suggest_categorical("num_nodes", [[32], [64], [128], [64, 32], [128, 64]])
/scratch.hpc/luca.cotugno/Foundation_model_clinical_data/test_tabular_model.py:481: UserWarning: Choices for a categorical distribution should be a tuple of None, bool, int, float and str for persistent storage but contains [64, 32] which is of type list.
  num_nodes  = trial.suggest_categorical("num_nodes", [[32], [64], [128], [64, 32], [128, 64]])
/scratch.hpc/luca.cotugno/Foundation_model_clinical_data/test_tabular_model.py:481: UserWarning: Choices for a categorical distribution should be a tuple of None, bool, int, float and str for persistent storage but contains [128, 64] which is of type list.
  num_nodes  = trial.suggest_categorical("num_nodes", [[32], [64], [128], [64, 32], [128, 64]])
[I 2026-06-28 07:17:59,548] Trial 91 finished with value: 0.7705362345508633 and parameters: {'num_nodes': [64], 'dropout': 0.2580257386089639, 'learning_rate': 0.0010506345801132141, 'batch_norm': True}. Best is trial 62 with value: 0.7726715122519704.
/scratch.hpc/luca.cotugno/Foundation_model_clinical_data/test_tabular_model.py:481: UserWarning: Choices for a categorical distribution should be a tuple of None, bool, int, float and str for persistent storage but contains [32] which is of type list.
  num_nodes  = trial.suggest_categorical("num_nodes", [[32], [64], [128], [64, 32], [128, 64]])
/scratch.hpc/luca.cotugno/Foundation_model_clinical_data/test_tabular_model.py:481: UserWarning: Choices for a categorical distribution should be a tuple of None, bool, int, float and str for persistent storage but contains [64] which is of type list.
  num_nodes  = trial.suggest_categorical("num_nodes", [[32], [64], [128], [64, 32], [128, 64]])
/scratch.hpc/luca.cotugno/Foundation_model_clinical_data/test_tabular_model.py:481: UserWarning: Choices for a categorical distribution should be a tuple of None, bool, int, float and str for persistent storage but contains [128] which is of type list.
  num_nodes  = trial.suggest_categorical("num_nodes", [[32], [64], [128], [64, 32], [128, 64]])
/scratch.hpc/luca.cotugno/Foundation_model_clinical_data/test_tabular_model.py:481: UserWarning: Choices for a categorical distribution should be a tuple of None, bool, int, float and str for persistent storage but contains [64, 32] which is of type list.
  num_nodes  = trial.suggest_categorical("num_nodes", [[32], [64], [128], [64, 32], [128, 64]])
/scratch.hpc/luca.cotugno/Foundation_model_clinical_data/test_tabular_model.py:481: UserWarning: Choices for a categorical distribution should be a tuple of None, bool, int, float and str for persistent storage but contains [128, 64] which is of type list.
  num_nodes  = trial.suggest_categorical("num_nodes", [[32], [64], [128], [64, 32], [128, 64]])
[I 2026-06-28 07:18:06,111] Trial 94 finished with value: 0.7407688533137057 and parameters: {'num_nodes': [32], 'dropout': 0.2917793905080909, 'learning_rate': 0.0010396270392695132, 'batch_norm': True}. Best is trial 62 with value: 0.7726715122519704.
/scratch.hpc/luca.cotugno/Foundation_model_clinical_data/test_tabular_model.py:481: UserWarning: Choices for a categorical distribution should be a tuple of None, bool, int, float and str for persistent storage but contains [32] which is of type list.
  num_nodes  = trial.suggest_categorical("num_nodes", [[32], [64], [128], [64, 32], [128, 64]])
/scratch.hpc/luca.cotugno/Foundation_model_clinical_data/test_tabular_model.py:481: UserWarning: Choices for a categorical distribution should be a tuple of None, bool, int, float and str for persistent storage but contains [64] which is of type list.
  num_nodes  = trial.suggest_categorical("num_nodes", [[32], [64], [128], [64, 32], [128, 64]])
/scratch.hpc/luca.cotugno/Foundation_model_clinical_data/test_tabular_model.py:481: UserWarning: Choices for a categorical distribution should be a tuple of None, bool, int, float and str for persistent storage but contains [128] which is of type list.
  num_nodes  = trial.suggest_categorical("num_nodes", [[32], [64], [128], [64, 32], [128, 64]])
/scratch.hpc/luca.cotugno/Foundation_model_clinical_data/test_tabular_model.py:481: UserWarning: Choices for a categorical distribution should be a tuple of None, bool, int, float and str for persistent storage but contains [64, 32] which is of type list.
  num_nodes  = trial.suggest_categorical("num_nodes", [[32], [64], [128], [64, 32], [128, 64]])
/scratch.hpc/luca.cotugno/Foundation_model_clinical_data/test_tabular_model.py:481: UserWarning: Choices for a categorical distribution should be a tuple of None, bool, int, float and str for persistent storage but contains [128, 64] which is of type list.
  num_nodes  = trial.suggest_categorical("num_nodes", [[32], [64], [128], [64, 32], [128, 64]])
[I 2026-06-28 07:18:08,791] Trial 4 finished with value: 0.7331727083141657 and parameters: {'num_nodes': [128], 'dropout': 0.03965559766563651, 'learning_rate': 0.0001721427735367982, 'batch_norm': False}. Best is trial 62 with value: 0.7726715122519704.
/scratch.hpc/luca.cotugno/Foundation_model_clinical_data/test_tabular_model.py:481: UserWarning: Choices for a categorical distribution should be a tuple of None, bool, int, float and str for persistent storage but contains [32] which is of type list.
  num_nodes  = trial.suggest_categorical("num_nodes", [[32], [64], [128], [64, 32], [128, 64]])
/scratch.hpc/luca.cotugno/Foundation_model_clinical_data/test_tabular_model.py:481: UserWarning: Choices for a categorical distribution should be a tuple of None, bool, int, float and str for persistent storage but contains [64] which is of type list.
  num_nodes  = trial.suggest_categorical("num_nodes", [[32], [64], [128], [64, 32], [128, 64]])
/scratch.hpc/luca.cotugno/Foundation_model_clinical_data/test_tabular_model.py:481: UserWarning: Choices for a categorical distribution should be a tuple of None, bool, int, float and str for persistent storage but contains [128] which is of type list.
  num_nodes  = trial.suggest_categorical("num_nodes", [[32], [64], [128], [64, 32], [128, 64]])
/scratch.hpc/luca.cotugno/Foundation_model_clinical_data/test_tabular_model.py:481: UserWarning: Choices for a categorical distribution should be a tuple of None, bool, int, float and str for persistent storage but contains [64, 32] which is of type list.
  num_nodes  = trial.suggest_categorical("num_nodes", [[32], [64], [128], [64, 32], [128, 64]])
/scratch.hpc/luca.cotugno/Foundation_model_clinical_data/test_tabular_model.py:481: UserWarning: Choices for a categorical distribution should be a tuple of None, bool, int, float and str for persistent storage but contains [128, 64] which is of type list.
  num_nodes  = trial.suggest_categorical("num_nodes", [[32], [64], [128], [64, 32], [128, 64]])
[I 2026-06-28 07:18:12,529] Trial 83 finished with value: 0.7497182353482381 and parameters: {'num_nodes': [32], 'dropout': 0.22930642497138634, 'learning_rate': 0.0022343377959853474, 'batch_norm': True}. Best is trial 62 with value: 0.7726715122519704.
/scratch.hpc/luca.cotugno/Foundation_model_clinical_data/test_tabular_model.py:481: UserWarning: Choices for a categorical distribution should be a tuple of None, bool, int, float and str for persistent storage but contains [32] which is of type list.
  num_nodes  = trial.suggest_categorical("num_nodes", [[32], [64], [128], [64, 32], [128, 64]])
/scratch.hpc/luca.cotugno/Foundation_model_clinical_data/test_tabular_model.py:481: UserWarning: Choices for a categorical distribution should be a tuple of None, bool, int, float and str for persistent storage but contains [64] which is of type list.
  num_nodes  = trial.suggest_categorical("num_nodes", [[32], [64], [128], [64, 32], [128, 64]])
/scratch.hpc/luca.cotugno/Foundation_model_clinical_data/test_tabular_model.py:481: UserWarning: Choices for a categorical distribution should be a tuple of None, bool, int, float and str for persistent storage but contains [128] which is of type list.
  num_nodes  = trial.suggest_categorical("num_nodes", [[32], [64], [128], [64, 32], [128, 64]])
/scratch.hpc/luca.cotugno/Foundation_model_clinical_data/test_tabular_model.py:481: UserWarning: Choices for a categorical distribution should be a tuple of None, bool, int, float and str for persistent storage but contains [64, 32] which is of type list.
  num_nodes  = trial.suggest_categorical("num_nodes", [[32], [64], [128], [64, 32], [128, 64]])
/scratch.hpc/luca.cotugno/Foundation_model_clinical_data/test_tabular_model.py:481: UserWarning: Choices for a categorical distribution should be a tuple of None, bool, int, float and str for persistent storage but contains [128, 64] which is of type list.
  num_nodes  = trial.suggest_categorical("num_nodes", [[32], [64], [128], [64, 32], [128, 64]])
[I 2026-06-28 07:18:12,728] Trial 95 finished with value: 0.7601971969209066 and parameters: {'num_nodes': [32], 'dropout': 0.1416599362990487, 'learning_rate': 0.0001104958139548078, 'batch_norm': True}. Best is trial 62 with value: 0.7726715122519704.
[I 2026-06-28 07:18:15,934] Trial 93 finished with value: 0.7428389609593032 and parameters: {'num_nodes': [32], 'dropout': 0.0560575098712295, 'learning_rate': 0.0035152936948316476, 'batch_norm': True}. Best is trial 62 with value: 0.7726715122519704.
[I 2026-06-28 07:18:18,069] Trial 96 finished with value: 0.7001832428619622 and parameters: {'num_nodes': [64], 'dropout': 0.12227559664044557, 'learning_rate': 0.0006856162911177713, 'batch_norm': True}. Best is trial 62 with value: 0.7726715122519704.
[I 2026-06-28 07:18:20,110] Trial 97 finished with value: 0.7361801146992977 and parameters: {'num_nodes': [64], 'dropout': 0.14553982449127478, 'learning_rate': 0.0006606989259303127, 'batch_norm': True}. Best is trial 62 with value: 0.7726715122519704.
[I 2026-06-28 07:18:20,460] Trial 54 finished with value: 0.752476462109363 and parameters: {'num_nodes': [32], 'dropout': 0.10349929039744915, 'learning_rate': 0.0012322453092139167, 'batch_norm': True}. Best is trial 62 with value: 0.7726715122519704.
[I 2026-06-28 07:18:24,003] Trial 89 finished with value: 0.7419994173030331 and parameters: {'num_nodes': [64], 'dropout': 0.2716519021713874, 'learning_rate': 0.00013056979375843295, 'batch_norm': True}. Best is trial 62 with value: 0.7726715122519704.
[I 2026-06-28 07:18:25,728] Trial 99 finished with value: 0.7611306621277639 and parameters: {'num_nodes': [64], 'dropout': 0.1604724796618433, 'learning_rate': 0.005708428437988748, 'batch_norm': True}. Best is trial 62 with value: 0.7726715122519704.
[I 2026-06-28 07:18:27,285] Trial 98 finished with value: 0.7520777747109516 and parameters: {'num_nodes': [64], 'dropout': 0.2608021808082933, 'learning_rate': 0.001643010140753346, 'batch_norm': True}. Best is trial 62 with value: 0.7726715122519704.
[I 2026-06-28 07:18:29,499] A new study created in memory with name: rsf_tuning_tabdpt_4_-1_seed123
[I 2026-06-28 07:19:47,330] Trial 2 finished with value: 0.7647020473280423 and parameters: {'n_estimators': 50, 'max_depth': 4, 'min_samples_split': 12, 'min_samples_leaf': 5, 'max_features': 'log2'}. Best is trial 2 with value: 0.7647020473280423.
[I 2026-06-28 07:20:53,599] Trial 7 finished with value: 0.7692638094452828 and parameters: {'n_estimators': 100, 'max_depth': 4, 'min_samples_split': 8, 'min_samples_leaf': 12, 'max_features': 'log2'}. Best is trial 7 with value: 0.7692638094452828.
[I 2026-06-28 07:21:19,070] Trial 8 finished with value: 0.7670835977902587 and parameters: {'n_estimators': 50, 'max_depth': 5, 'min_samples_split': 19, 'min_samples_leaf': 10, 'max_features': 'log2'}. Best is trial 7 with value: 0.7692638094452828.
[I 2026-06-28 07:24:25,586] Trial 5 finished with value: 0.7740345804195133 and parameters: {'n_estimators': 150, 'max_depth': 9, 'min_samples_split': 8, 'min_samples_leaf': 15, 'max_features': 'log2'}. Best is trial 5 with value: 0.7740345804195133.
[I 2026-06-28 07:26:31,600] Trial 9 finished with value: 0.7678640253571847 and parameters: {'n_estimators': 100, 'max_depth': 3, 'min_samples_split': 13, 'min_samples_leaf': 8, 'max_features': 'sqrt'}. Best is trial 5 with value: 0.7740345804195133.
[I 2026-06-28 07:26:45,493] Trial 4 finished with value: 0.7695667764122959 and parameters: {'n_estimators': 150, 'max_depth': 3, 'min_samples_split': 9, 'min_samples_leaf': 4, 'max_features': 'sqrt'}. Best is trial 5 with value: 0.7740345804195133.
[I 2026-06-28 07:29:43,161] Trial 1 finished with value: 0.7710547660730688 and parameters: {'n_estimators': 300, 'max_depth': 8, 'min_samples_split': 6, 'min_samples_leaf': 14, 'max_features': 'log2'}. Best is trial 5 with value: 0.7740345804195133.
[I 2026-06-28 07:30:46,765] Trial 6 finished with value: 0.7749626564450469 and parameters: {'n_estimators': 100, 'max_depth': 9, 'min_samples_split': 15, 'min_samples_leaf': 13, 'max_features': 'sqrt'}. Best is trial 6 with value: 0.7749626564450469.
[I 2026-06-28 07:30:59,310] Trial 3 finished with value: 0.7711985795067774 and parameters: {'n_estimators': 150, 'max_depth': 5, 'min_samples_split': 11, 'min_samples_leaf': 5, 'max_features': 'sqrt'}. Best is trial 6 with value: 0.7749626564450469.
[I 2026-06-28 07:31:04,594] Trial 12 finished with value: 0.7698524857672638 and parameters: {'n_estimators': 200, 'max_depth': 4, 'min_samples_split': 9, 'min_samples_leaf': 12, 'max_features': 'log2'}. Best is trial 6 with value: 0.7749626564450469.
[I 2026-06-28 07:32:51,301] Trial 13 finished with value: 0.7767632006350801 and parameters: {'n_estimators': 50, 'max_depth': 8, 'min_samples_split': 18, 'min_samples_leaf': 14, 'max_features': 'sqrt'}. Best is trial 13 with value: 0.7767632006350801.
[I 2026-06-28 07:34:11,824] Trial 16 finished with value: 0.770211060595311 and parameters: {'n_estimators': 100, 'max_depth': 6, 'min_samples_split': 12, 'min_samples_leaf': 10, 'max_features': 'log2'}. Best is trial 13 with value: 0.7767632006350801.
[I 2026-06-28 07:35:54,261] Trial 15 finished with value: 0.7734746667842741 and parameters: {'n_estimators': 50, 'max_depth': 6, 'min_samples_split': 20, 'min_samples_leaf': 9, 'max_features': 'sqrt'}. Best is trial 13 with value: 0.7767632006350801.
[I 2026-06-28 07:36:41,946] Trial 0 finished with value: 0.7746846171398768 and parameters: {'n_estimators': 200, 'max_depth': 6, 'min_samples_split': 15, 'min_samples_leaf': 14, 'max_features': 'sqrt'}. Best is trial 13 with value: 0.7767632006350801.
[I 2026-06-28 07:39:42,873] Trial 18 finished with value: 0.7724315400117735 and parameters: {'n_estimators': 50, 'max_depth': 10, 'min_samples_split': 17, 'min_samples_leaf': 13, 'max_features': 'sqrt'}. Best is trial 13 with value: 0.7767632006350801.
[I 2026-06-28 07:41:00,150] Trial 19 finished with value: 0.7724315400117735 and parameters: {'n_estimators': 50, 'max_depth': 10, 'min_samples_split': 17, 'min_samples_leaf': 13, 'max_features': 'sqrt'}. Best is trial 13 with value: 0.7767632006350801.
[I 2026-06-28 07:45:49,292] Trial 10 finished with value: 0.7751237274908007 and parameters: {'n_estimators': 200, 'max_depth': 9, 'min_samples_split': 19, 'min_samples_leaf': 10, 'max_features': 'sqrt'}. Best is trial 13 with value: 0.7767632006350801.
[I 2026-06-28 07:47:45,564] Trial 11 finished with value: 0.7758082794352542 and parameters: {'n_estimators': 200, 'max_depth': 8, 'min_samples_split': 15, 'min_samples_leaf': 7, 'max_features': 'sqrt'}. Best is trial 13 with value: 0.7767632006350801.
[I 2026-06-28 07:49:44,885] Trial 21 finished with value: 0.7762013694873914 and parameters: {'n_estimators': 100, 'max_depth': 10, 'min_samples_split': 17, 'min_samples_leaf': 12, 'max_features': 'sqrt'}. Best is trial 13 with value: 0.7767632006350801.
[I 2026-06-28 07:50:38,151] Trial 14 finished with value: 0.7701343600973329 and parameters: {'n_estimators': 250, 'max_depth': 5, 'min_samples_split': 19, 'min_samples_leaf': 3, 'max_features': 'sqrt'}. Best is trial 13 with value: 0.7767632006350801.
[I 2026-06-28 07:50:52,711] Trial 22 finished with value: 0.7745791539551571 and parameters: {'n_estimators': 100, 'max_depth': 8, 'min_samples_split': 16, 'min_samples_leaf': 15, 'max_features': 'sqrt'}. Best is trial 13 with value: 0.7767632006350801.
[I 2026-06-28 08:02:00,874] Trial 27 finished with value: 0.7745791539551571 and parameters: {'n_estimators': 100, 'max_depth': 8, 'min_samples_split': 17, 'min_samples_leaf': 15, 'max_features': 'sqrt'}. Best is trial 13 with value: 0.7767632006350801.
[I 2026-06-28 08:05:03,998] Trial 17 finished with value: 0.7742129090773122 and parameters: {'n_estimators': 250, 'max_depth': 10, 'min_samples_split': 16, 'min_samples_leaf': 8, 'max_features': 'sqrt'}. Best is trial 13 with value: 0.7767632006350801.
[I 2026-06-28 08:07:28,139] Trial 20 finished with value: 0.7763758631202913 and parameters: {'n_estimators': 250, 'max_depth': 10, 'min_samples_split': 16, 'min_samples_leaf': 13, 'max_features': 'sqrt'}. Best is trial 13 with value: 0.7767632006350801.
[I 2026-06-28 08:08:37,448] Trial 23 finished with value: 0.7772943515835776 and parameters: {'n_estimators': 250, 'max_depth': 8, 'min_samples_split': 15, 'min_samples_leaf': 15, 'max_features': 'sqrt'}. Best is trial 23 with value: 0.7772943515835776.
[I 2026-06-28 08:15:38,408] Trial 24 finished with value: 0.7744219179343022 and parameters: {'n_estimators': 250, 'max_depth': 8, 'min_samples_split': 18, 'min_samples_leaf': 7, 'max_features': 'sqrt'}. Best is trial 23 with value: 0.7772943515835776.
[I 2026-06-28 08:20:42,759] Trial 28 finished with value: 0.7743202897744813 and parameters: {'n_estimators': 250, 'max_depth': 8, 'min_samples_split': 14, 'min_samples_leaf': 7, 'max_features': 'sqrt'}. Best is trial 23 with value: 0.7772943515835776.
[I 2026-06-28 08:22:38,280] Trial 26 finished with value: 0.7764410585435726 and parameters: {'n_estimators': 300, 'max_depth': 8, 'min_samples_split': 17, 'min_samples_leaf': 15, 'max_features': 'sqrt'}. Best is trial 23 with value: 0.7772943515835776.
[I 2026-06-28 08:23:08,719] Trial 25 finished with value: 0.7747037922643712 and parameters: {'n_estimators': 300, 'max_depth': 8, 'min_samples_split': 16, 'min_samples_leaf': 7, 'max_features': 'sqrt'}. Best is trial 23 with value: 0.7772943515835776.
[I 2026-06-28 08:32:36,573] Trial 30 finished with value: 0.7733097607136215 and parameters: {'n_estimators': 250, 'max_depth': 7, 'min_samples_split': 14, 'min_samples_leaf': 6, 'max_features': 'sqrt'}. Best is trial 23 with value: 0.7772943515835776.
[I 2026-06-28 08:33:36,125] Trial 31 finished with value: 0.7751218099783513 and parameters: {'n_estimators': 250, 'max_depth': 7, 'min_samples_split': 14, 'min_samples_leaf': 12, 'max_features': 'sqrt'}. Best is trial 23 with value: 0.7772943515835776.
[I 2026-06-28 08:34:06,209] Trial 29 finished with value: 0.7732349777280929 and parameters: {'n_estimators': 300, 'max_depth': 7, 'min_samples_split': 14, 'min_samples_leaf': 7, 'max_features': 'sqrt'}. Best is trial 23 with value: 0.7772943515835776.
[I 2026-06-28 08:39:14,983] Trial 32 finished with value: 0.7744583506708417 and parameters: {'n_estimators': 300, 'max_depth': 7, 'min_samples_split': 14, 'min_samples_leaf': 14, 'max_features': 'sqrt'}. Best is trial 23 with value: 0.7772943515835776.
[I 2026-06-28 08:46:37,432] Trial 33 finished with value: 0.7744583506708417 and parameters: {'n_estimators': 300, 'max_depth': 7, 'min_samples_split': 14, 'min_samples_leaf': 14, 'max_features': 'sqrt'}. Best is trial 23 with value: 0.7772943515835776.
[I 2026-06-28 08:51:27,487] Trial 34 finished with value: 0.7744583506708417 and parameters: {'n_estimators': 300, 'max_depth': 7, 'min_samples_split': 14, 'min_samples_leaf': 14, 'max_features': 'sqrt'}. Best is trial 23 with value: 0.7772943515835776.
[I 2026-06-28 08:53:22,764] Trial 35 finished with value: 0.7744583506708417 and parameters: {'n_estimators': 300, 'max_depth': 7, 'min_samples_split': 20, 'min_samples_leaf': 14, 'max_features': 'sqrt'}. Best is trial 23 with value: 0.7772943515835776.
[I 2026-06-28 08:53:51,655] Trial 36 finished with value: 0.7744583506708417 and parameters: {'n_estimators': 300, 'max_depth': 7, 'min_samples_split': 20, 'min_samples_leaf': 14, 'max_features': 'sqrt'}. Best is trial 23 with value: 0.7772943515835776.
[I 2026-06-28 09:01:44,378] Trial 44 finished with value: 0.7740882707680979 and parameters: {'n_estimators': 200, 'max_depth': 9, 'min_samples_split': 11, 'min_samples_leaf': 15, 'max_features': 'log2'}. Best is trial 23 with value: 0.7772943515835776.
