[I 2026-07-01 12:38:28,365] Trial 28 finished with value: 0.7745101235069769 and parameters: {'n_estimators': 150, 'max_depth': 7, 'min_samples_split': 18, 'min_samples_leaf': 3, 'max_features': 'sqrt'}. Best is trial 20 with value: 0.7778350900943224.
[I 2026-07-01 12:38:28,897] Trial 31 finished with value: 0.7754113543582182 and parameters: {'n_estimators': 250, 'max_depth': 7, 'min_samples_split': 18, 'min_samples_leaf': 13, 'max_features': 'log2'}. Best is trial 20 with value: 0.7778350900943224.
[I 2026-07-01 12:41:55,962] Trial 32 finished with value: 0.775116057441003 and parameters: {'n_estimators': 150, 'max_depth': 7, 'min_samples_split': 18, 'min_samples_leaf': 13, 'max_features': 'log2'}. Best is trial 20 with value: 0.7778350900943224.
[I 2026-07-01 12:44:05,141] Trial 33 finished with value: 0.7748840384346195 and parameters: {'n_estimators': 200, 'max_depth': 5, 'min_samples_split': 15, 'min_samples_leaf': 14, 'max_features': 'log2'}. Best is trial 20 with value: 0.7778350900943224.
[I 2026-07-01 12:47:09,331] Trial 34 finished with value: 0.7741707238034243 and parameters: {'n_estimators': 100, 'max_depth': 5, 'min_samples_split': 16, 'min_samples_leaf': 13, 'max_features': 'sqrt'}. Best is trial 20 with value: 0.7778350900943224.
[I 2026-07-01 13:03:15,698] Trial 36 finished with value: 0.7751333150530479 and parameters: {'n_estimators': 250, 'max_depth': 5, 'min_samples_split': 10, 'min_samples_leaf': 10, 'max_features': 'sqrt'}. Best is trial 20 with value: 0.7778350900943224.
[I 2026-07-01 13:03:17,375] Trial 37 finished with value: 0.7753921792337237 and parameters: {'n_estimators': 250, 'max_depth': 5, 'min_samples_split': 10, 'min_samples_leaf': 9, 'max_features': 'sqrt'}. Best is trial 20 with value: 0.7778350900943224.
[I 2026-07-01 13:03:17,908] Trial 35 finished with value: 0.7753921792337237 and parameters: {'n_estimators': 250, 'max_depth': 5, 'min_samples_split': 11, 'min_samples_leaf': 9, 'max_features': 'sqrt'}. Best is trial 20 with value: 0.7778350900943224.
[I 2026-07-01 13:03:37,478] Trial 38 finished with value: 0.7776222462124336 and parameters: {'n_estimators': 250, 'max_depth': 7, 'min_samples_split': 10, 'min_samples_leaf': 14, 'max_features': 'sqrt'}. Best is trial 20 with value: 0.7778350900943224.
[I 2026-07-01 13:08:01,496] Trial 39 finished with value: 0.7778945329802553 and parameters: {'n_estimators': 250, 'max_depth': 9, 'min_samples_split': 10, 'min_samples_leaf': 14, 'max_features': 'sqrt'}. Best is trial 39 with value: 0.7778945329802553.
[I 2026-07-01 13:20:14,821] Trial 40 finished with value: 0.7756222807276576 and parameters: {'n_estimators': 250, 'max_depth': 9, 'min_samples_split': 16, 'min_samples_leaf': 9, 'max_features': 'sqrt'}. Best is trial 39 with value: 0.7778945329802553.
[I 2026-07-01 13:21:33,179] Trial 41 finished with value: 0.7778945329802553 and parameters: {'n_estimators': 250, 'max_depth': 9, 'min_samples_split': 10, 'min_samples_leaf': 14, 'max_features': 'sqrt'}. Best is trial 39 with value: 0.7778945329802553.
[I 2026-07-01 13:26:22,503] Trial 43 finished with value: 0.7751946754514304 and parameters: {'n_estimators': 250, 'max_depth': 9, 'min_samples_split': 11, 'min_samples_leaf': 6, 'max_features': 'log2'}. Best is trial 39 with value: 0.7778945329802553.
[I 2026-07-01 13:26:22,514] Trial 44 finished with value: 0.778230097658909 and parameters: {'n_estimators': 250, 'max_depth': 9, 'min_samples_split': 15, 'min_samples_leaf': 6, 'max_features': 'log2'}. Best is trial 44 with value: 0.778230097658909.
[I 2026-07-01 13:26:29,993] Trial 42 finished with value: 0.7778945329802553 and parameters: {'n_estimators': 250, 'max_depth': 9, 'min_samples_split': 10, 'min_samples_leaf': 14, 'max_features': 'sqrt'}. Best is trial 44 with value: 0.778230097658909.
[I 2026-07-01 13:26:47,826] Trial 45 finished with value: 0.7789606699021493 and parameters: {'n_estimators': 300, 'max_depth': 9, 'min_samples_split': 16, 'min_samples_leaf': 14, 'max_features': 'log2'}. Best is trial 45 with value: 0.7789606699021493.
[I 2026-07-01 13:26:54,642] Trial 46 finished with value: 0.7746999572394724 and parameters: {'n_estimators': 300, 'max_depth': 6, 'min_samples_split': 8, 'min_samples_leaf': 6, 'max_features': 'sqrt'}. Best is trial 45 with value: 0.7789606699021493.
[I 2026-07-01 13:26:58,216] Trial 47 finished with value: 0.7773883096936007 and parameters: {'n_estimators': 300, 'max_depth': 9, 'min_samples_split': 9, 'min_samples_leaf': 14, 'max_features': 'sqrt'}. Best is trial 45 with value: 0.7789606699021493.
[I 2026-07-01 13:51:34,865] Trial 48 finished with value: 0.7773883096936007 and parameters: {'n_estimators': 300, 'max_depth': 9, 'min_samples_split': 8, 'min_samples_leaf': 14, 'max_features': 'sqrt'}. Best is trial 45 with value: 0.7789606699021493.
[I 2026-07-01 13:54:15,340] Trial 49 finished with value: 0.7773883096936007 and parameters: {'n_estimators': 300, 'max_depth': 9, 'min_samples_split': 9, 'min_samples_leaf': 14, 'max_features': 'sqrt'}. Best is trial 45 with value: 0.7789606699021493.
[I 2026-07-01 14:04:10,233] Trial 50 finished with value: 0.7760920712777728 and parameters: {'n_estimators': 300, 'max_depth': 9, 'min_samples_split': 9, 'min_samples_leaf': 12, 'max_features': 'sqrt'}. Best is trial 45 with value: 0.7789606699021493.
[I 2026-07-01 14:07:07,250] Trial 51 finished with value: 0.7760920712777728 and parameters: {'n_estimators': 300, 'max_depth': 9, 'min_samples_split': 9, 'min_samples_leaf': 12, 'max_features': 'sqrt'}. Best is trial 45 with value: 0.7789606699021493.
[I 2026-07-01 14:11:37,038] Trial 53 finished with value: 0.7760920712777728 and parameters: {'n_estimators': 300, 'max_depth': 9, 'min_samples_split': 9, 'min_samples_leaf': 12, 'max_features': 'sqrt'}. Best is trial 45 with value: 0.7789606699021493.
[I 2026-07-01 14:11:38,478] Trial 56 finished with value: 0.778481291789787 and parameters: {'n_estimators': 300, 'max_depth': 10, 'min_samples_split': 9, 'min_samples_leaf': 12, 'max_features': 'log2'}. Best is trial 45 with value: 0.7789606699021493.
[I 2026-07-01 14:11:38,510] Trial 54 finished with value: 0.7760920712777728 and parameters: {'n_estimators': 300, 'max_depth': 9, 'min_samples_split': 9, 'min_samples_leaf': 12, 'max_features': 'sqrt'}. Best is trial 45 with value: 0.7789606699021493.
[I 2026-07-01 14:11:38,510] Trial 52 finished with value: 0.7760920712777728 and parameters: {'n_estimators': 300, 'max_depth': 9, 'min_samples_split': 9, 'min_samples_leaf': 12, 'max_features': 'sqrt'}. Best is trial 45 with value: 0.7789606699021493.
[I 2026-07-01 14:11:40,740] Trial 55 finished with value: 0.776558026802989 and parameters: {'n_estimators': 300, 'max_depth': 10, 'min_samples_split': 12, 'min_samples_leaf': 12, 'max_features': 'sqrt'}. Best is trial 45 with value: 0.7789606699021493.
[I 2026-07-01 14:11:41,357] Trial 57 finished with value: 0.778481291789787 and parameters: {'n_estimators': 300, 'max_depth': 10, 'min_samples_split': 11, 'min_samples_leaf': 12, 'max_features': 'log2'}. Best is trial 45 with value: 0.7789606699021493.
[I 2026-07-01 14:20:10,162] Trial 58 finished with value: 0.776634727300967 and parameters: {'n_estimators': 250, 'max_depth': 10, 'min_samples_split': 12, 'min_samples_leaf': 12, 'max_features': 'sqrt'}. Best is trial 45 with value: 0.7789606699021493.
[I 2026-07-01 14:30:42,654] Trial 64 finished with value: 0.7761591842135035 and parameters: {'n_estimators': 250, 'max_depth': 10, 'min_samples_split': 11, 'min_samples_leaf': 15, 'max_features': 'log2'}. Best is trial 45 with value: 0.7789606699021493.
[I 2026-07-01 14:31:20,361] Trial 62 finished with value: 0.7761591842135035 and parameters: {'n_estimators': 250, 'max_depth': 10, 'min_samples_split': 12, 'min_samples_leaf': 15, 'max_features': 'log2'}. Best is trial 45 with value: 0.7789606699021493.
[I 2026-07-01 14:31:22,148] Trial 63 finished with value: 0.7761591842135035 and parameters: {'n_estimators': 250, 'max_depth': 10, 'min_samples_split': 12, 'min_samples_leaf': 15, 'max_features': 'log2'}. Best is trial 45 with value: 0.7789606699021493.
[I 2026-07-01 14:32:14,480] Trial 65 finished with value: 0.7754669622192522 and parameters: {'n_estimators': 250, 'max_depth': 10, 'min_samples_split': 12, 'min_samples_leaf': 10, 'max_features': 'log2'}. Best is trial 45 with value: 0.7789606699021493.
[I 2026-07-01 14:32:35,651] Trial 61 finished with value: 0.7771486206374195 and parameters: {'n_estimators': 250, 'max_depth': 10, 'min_samples_split': 12, 'min_samples_leaf': 8, 'max_features': 'log2'}. Best is trial 45 with value: 0.7789606699021493.
[I 2026-07-01 14:37:19,356] Trial 59 finished with value: 0.776634727300967 and parameters: {'n_estimators': 250, 'max_depth': 10, 'min_samples_split': 12, 'min_samples_leaf': 12, 'max_features': 'sqrt'}. Best is trial 45 with value: 0.7789606699021493.
[I 2026-07-01 14:37:56,428] Trial 60 finished with value: 0.7787228983584176 and parameters: {'n_estimators': 250, 'max_depth': 10, 'min_samples_split': 12, 'min_samples_leaf': 15, 'max_features': 'sqrt'}. Best is trial 45 with value: 0.7789606699021493.
[I 2026-07-01 14:38:10,072] Trial 66 finished with value: 0.7777468845216478 and parameters: {'n_estimators': 300, 'max_depth': 10, 'min_samples_split': 15, 'min_samples_leaf': 8, 'max_features': 'log2'}. Best is trial 45 with value: 0.7789606699021493.
/var/spool/slurmd/job66119/slurm_script: line 15: 424499 Killed                  .venv/bin/python3 "$@"
