[I 2026-07-01 05:07:48,118] Trial 30 finished with value: 0.7533332566626798 and parameters: {'num_nodes': [64, 32], 'dropout': 0.21971440040081724, 'learning_rate': 0.00022636672186949805, 'batch_norm': False}. Best is trial 20 with value: 0.7756578342073788.
/scratch.hpc/luca.cotugno/Foundation_model_clinical_data/test_tabular_model.py:481: UserWarning: Choices for a categorical distribution should be a tuple of None, bool, int, float and str for persistent storage but contains [32] which is of type list.
  num_nodes  = trial.suggest_categorical("num_nodes", [[32], [64], [128], [64, 32], [128, 64]])
/scratch.hpc/luca.cotugno/Foundation_model_clinical_data/test_tabular_model.py:481: UserWarning: Choices for a categorical distribution should be a tuple of None, bool, int, float and str for persistent storage but contains [64] which is of type list.
  num_nodes  = trial.suggest_categorical("num_nodes", [[32], [64], [128], [64, 32], [128, 64]])
/scratch.hpc/luca.cotugno/Foundation_model_clinical_data/test_tabular_model.py:481: UserWarning: Choices for a categorical distribution should be a tuple of None, bool, int, float and str for persistent storage but contains [128] which is of type list.
  num_nodes  = trial.suggest_categorical("num_nodes", [[32], [64], [128], [64, 32], [128, 64]])
/scratch.hpc/luca.cotugno/Foundation_model_clinical_data/test_tabular_model.py:481: UserWarning: Choices for a categorical distribution should be a tuple of None, bool, int, float and str for persistent storage but contains [64, 32] which is of type list.
  num_nodes  = trial.suggest_categorical("num_nodes", [[32], [64], [128], [64, 32], [128, 64]])
/scratch.hpc/luca.cotugno/Foundation_model_clinical_data/test_tabular_model.py:481: UserWarning: Choices for a categorical distribution should be a tuple of None, bool, int, float and str for persistent storage but contains [128, 64] which is of type list.
  num_nodes  = trial.suggest_categorical("num_nodes", [[32], [64], [128], [64, 32], [128, 64]])

47:	[0s / 6s],		train_loss: 4.2784
64:	[0s / 14s],		train_loss: 4.0703
22:	[0s / 3s],		train_loss: 4.1235
48:	[0s / 6s],		train_loss: 4.2451
49:	[0s / 18s],		train_loss: 4.1907
65:	[0s / 14s],		train_loss: 4.0696
23:	[0s / 3s],		train_loss: 4.1068
49:	[0s / 7s],		train_loss: 4.2716
82:	[0s / 1m:2s],		train_loss: 4.0061
50:	[0s / 7s],		train_loss: 4.2388
24:	[0s / 4s],		train_loss: 4.0943
66:	[0s / 15s],		train_loss: 4.0665
51:	[0s / 7s],		train_loss: 4.1946
15:	[3s / 1m:3s],		train_loss: 4.3126
25:	[0s / 4s],		train_loss: 4.0555
50:	[0s / 19s],		train_loss: 4.2088
52:	[0s / 7s],		train_loss: 4.2697
67:	[0s / 15s],		train_loss: 4.0713
26:	[0s / 4s],		train_loss: 4.1324
47:	[1s / 1m:3s],		train_loss: 4.0757
53:	[0s / 7s],		train_loss: 4.1996
26:	[2s / 1m:3s],		train_loss: 4.1788
27:	[0s / 4s],		train_loss: 4.0657
68:	[0s / 15s],		train_loss: 3.9865
51:	[0s / 19s],		train_loss: 4.1817
54:	[0s / 7s],		train_loss: 4.2274
83:	[0s / 1m:3s],		train_loss: 4.0151
28:	[0s / 4s],		train_loss: 4.0877
55:	[0s / 7s],		train_loss: 4.2178
69:	[0s / 15s],		train_loss: 4.0183
29:	[0s / 4s],		train_loss: 4.0683
56:	[0s / 8s],		train_loss: 4.2081
52:	[0s / 19s],		train_loss: 4.2107
70:	[0s / 15s],		train_loss: 3.9628
30:	[0s / 4s],		train_loss: 4.0333
57:	[0s / 8s],		train_loss: 4.2381
31:	[0s / 5s],		train_loss: 4.0417
58:	[0s / 8s],		train_loss: 4.2285
71:	[0s / 16s],		train_loss: 4.0070
84:	[0s / 1m:4s],		train_loss: 4.0100
59:	[0s / 8s],		train_loss: 4.2183
32:	[0s / 5s],		train_loss: 4.0499
53:	[0s / 20s],		train_loss: 4.1885
60:	[0s / 8s],		train_loss: 4.2225
33:	[0s / 5s],		train_loss: 4.0131
72:	[0s / 16s],		train_loss: 3.9837
48:	[1s / 1m:4s],		train_loss: 4.0190
61:	[0s / 8s],		train_loss: 4.2304
34:	[0s / 5s],		train_loss: 4.0130
54:	[0s / 20s],		train_loss: 4.2151
73:	[0s / 16s],		train_loss: 3.9823
62:	[0s / 8s],		train_loss: 4.2431
35:	[0s / 5s],		train_loss: 4.0000
85:	[0s / 1m:4s],		train_loss: 4.0890
63:	[0s / 9s],		train_loss: 4.2067
36:	[0s / 6s],		train_loss: 3.9820
74:	[0s / 16s],		train_loss: 3.9623
55:	[0s / 21s],		train_loss: 4.1731
64:	[0s / 9s],		train_loss: 4.2539
37:	[0s / 6s],		train_loss: 3.9844
65:	[0s / 9s],		train_loss: 4.2434
75:	[0s / 17s],		train_loss: 3.9660
38:	[0s / 6s],		train_loss: 3.9569
66:	[0s / 9s],		train_loss: 4.2306
56:	[0s / 21s],		train_loss: 4.1902
27:	[1s / 1m:5s],		train_loss: 4.1557
86:	[0s / 1m:5s],		train_loss: 4.0244
39:	[0s / 6s],		train_loss: 3.9107
76:	[0s / 17s],		train_loss: 3.9499
67:	[0s / 9s],		train_loss: 4.1883
40:	[0s / 6s],		train_loss: 3.9490
68:	[0s / 9s],		train_loss: 4.2054
77:	[0s / 17s],		train_loss: 3.9384
49:	[1s / 1m:5s],		train_loss: 4.0238
41:	[0s / 6s],		train_loss: 3.9405
57:	[0s / 21s],		train_loss: 4.2222
69:	[0s / 10s],		train_loss: 4.2426
42:	[0s / 6s],		train_loss: 3.9320
78:	[0s / 17s],		train_loss: 3.9469
70:	[0s / 10s],		train_loss: 4.1798
43:	[0s / 7s],		train_loss: 3.9308
71:	[0s / 10s],		train_loss: 4.1960
79:	[0s / 18s],		train_loss: 3.9468
87:	[0s / 1m:6s],		train_loss: 4.0040
58:	[0s / 22s],		train_loss: 4.1916
44:	[0s / 7s],		train_loss: 3.9553
72:	[0s / 10s],		train_loss: 4.2438
80:	[0s / 18s],		train_loss: 3.9325
73:	[0s / 10s],		train_loss: 4.2206
45:	[0s / 7s],		train_loss: 3.9160
74:	[0s / 10s],		train_loss: 4.1617
46:	[0s / 7s],		train_loss: 3.9183
59:	[0s / 22s],		train_loss: 4.1668
81:	[0s / 18s],		train_loss: 3.8698
75:	[0s / 10s],		train_loss: 4.1666
47:	[0s / 7s],		train_loss: 3.9394
76:	[0s / 10s],		train_loss: 4.1737
82:	[0s / 18s],		train_loss: 3.8812
48:	[0s / 7s],		train_loss: 3.8802
88:	[0s / 1m:6s],		train_loss: 3.9786
77:	[0s / 11s],		train_loss: 4.1484
60:	[0s / 22s],		train_loss: 4.1997
49:	[0s / 7s],		train_loss: 3.8876
83:	[0s / 18s],		train_loss: 3.8871
78:	[0s / 11s],		train_loss: 4.1607
50:	[1s / 1m:7s],		train_loss: 4.0261
50:	[0s / 8s],		train_loss: 3.9231
79:	[0s / 11s],		train_loss: 4.2356
16:	[4s / 1m:7s],		train_loss: 4.3143
61:	[0s / 23s],		train_loss: 4.1667
84:	[0s / 19s],		train_loss: 3.9087
51:	[0s / 8s],		train_loss: 3.8629
80:	[0s / 11s],		train_loss: 4.1829
89:	[0s / 1m:7s],		train_loss: 4.0041
28:	[1s / 1m:7s],		train_loss: 4.1662
52:	[0s / 8s],		train_loss: 3.9409
81:	[0s / 11s],		train_loss: 4.1842
85:	[0s / 19s],		train_loss: 3.8620
53:	[0s / 8s],		train_loss: 3.8772
82:	[0s / 11s],		train_loss: 4.2462
62:	[0s / 23s],		train_loss: 4.1778
86:	[0s / 19s],		train_loss: 3.8642
83:	[0s / 11s],		train_loss: 4.1971
54:	[0s / 8s],		train_loss: 3.8750
84:	[0s / 12s],		train_loss: 4.1753
55:	[0s / 8s],		train_loss: 3.8591
87:	[0s / 19s],		train_loss: 3.8552
85:	[0s / 12s],		train_loss: 4.1258
63:	[0s / 23s],		train_loss: 4.2756
90:	[0s / 1m:8s],		train_loss: 3.9861
56:	[0s / 9s],		train_loss: 3.8687
88:	[0s / 20s],		train_loss: 3.8661
51:	[1s / 1m:8s],		train_loss: 4.0238
86:	[0s / 12s],		train_loss: 4.2029
57:	[0s / 9s],		train_loss: 3.8655
87:	[0s / 12s],		train_loss: 4.2061
89:	[0s / 20s],		train_loss: 3.8683
64:	[0s / 24s],		train_loss: 4.2362
58:	[0s / 9s],		train_loss: 3.8289
88:	[0s / 12s],		train_loss: 4.1452
59:	[0s / 9s],		train_loss: 3.8409
89:	[0s / 12s],		train_loss: 4.2147
90:	[0s / 20s],		train_loss: 3.8417
91:	[0s / 1m:8s],		train_loss: 4.0039
65:	[0s / 24s],		train_loss: 4.2107
60:	[0s / 9s],		train_loss: 3.8084
90:	[0s / 12s],		train_loss: 4.1348
91:	[0s / 20s],		train_loss: 3.8516
61:	[0s / 9s],		train_loss: 3.7894
91:	[0s / 13s],		train_loss: 4.2038
92:	[0s / 13s],		train_loss: 4.1501
62:	[0s / 10s],		train_loss: 3.8139
92:	[0s / 21s],		train_loss: 3.8467
66:	[0s / 25s],		train_loss: 4.2129
93:	[0s / 13s],		train_loss: 4.1708
92:	[0s / 1m:9s],		train_loss: 3.9943
63:	[0s / 10s],		train_loss: 3.7822
52:	[1s / 1m:9s],		train_loss: 4.0552
29:	[1s / 1m:9s],		train_loss: 4.1598
93:	[0s / 21s],		train_loss: 3.8286
94:	[0s / 13s],		train_loss: 4.1766
64:	[0s / 10s],		train_loss: 3.7919
67:	[0s / 25s],		train_loss: 4.2021
95:	[0s / 13s],		train_loss: 4.1321
94:	[0s / 21s],		train_loss: 3.8099
65:	[0s / 10s],		train_loss: 3.8404
96:	[0s / 13s],		train_loss: 4.0876
66:	[0s / 10s],		train_loss: 3.8008
95:	[0s / 21s],		train_loss: 3.8026
93:	[0s / 1m:9s],		train_loss: 4.0123
97:	[0s / 13s],		train_loss: 4.1655
68:	[0s / 25s],		train_loss: 4.2029
67:	[0s / 10s],		train_loss: 3.7864
98:	[0s / 14s],		train_loss: 4.1917
96:	[0s / 21s],		train_loss: 3.8115
68:	[0s / 11s],		train_loss: 3.7624
99:	[0s / 14s],		train_loss: 4.1329
97:	[0s / 22s],		train_loss: 3.8103
69:	[0s / 11s],		train_loss: 3.7585
69:	[0s / 26s],		train_loss: 4.1832
53:	[1s / 1m:10s],		train_loss: 4.0534
0:	[0s / 0s],		train_loss: 5.6049
70:	[0s / 11s],		train_loss: 3.7901
98:	[0s / 22s],		train_loss: 3.7950
94:	[0s / 1m:10s],		train_loss: 4.0017
1:	[0s / 0s],		train_loss: 4.9280
71:	[0s / 11s],		train_loss: 3.7514
70:	[0s / 26s],		train_loss: 4.1875
99:	[0s / 22s],		train_loss: 3.7573
17:	[3s / 1m:10s],		train_loss: 4.3564
2:	[0s / 0s],		train_loss: 4.7591
72:	[0s / 11s],		train_loss: 3.7347
3:	[0s / 0s],		train_loss: 4.7128
73:	[0s / 11s],		train_loss: 3.7405
0:	[0s / 0s],		train_loss: 4.8986
71:	[0s / 27s],		train_loss: 4.1705
4:	[0s / 0s],		train_loss: 4.6630
74:	[0s / 12s],		train_loss: 3.7687
95:	[0s / 1m:11s],		train_loss: 3.9625
1:	[0s / 0s],		train_loss: 4.4728
5:	[0s / 1s],		train_loss: 4.6473
75:	[0s / 12s],		train_loss: 3.7440
72:	[0s / 27s],		train_loss: 4.1670
2:	[0s / 0s],		train_loss: 4.4069
6:	[0s / 1s],		train_loss: 4.5722
76:	[0s / 12s],		train_loss: 3.7414
3:	[0s / 0s],		train_loss: 4.3774
7:	[0s / 1s],		train_loss: 4.5617
77:	[0s / 12s],		train_loss: 3.7099
54:	[1s / 1m:11s],		train_loss: 4.0405
30:	[2s / 1m:11s],		train_loss: 4.1578
73:	[0s / 27s],		train_loss: 4.1803
4:	[0s / 0s],		train_loss: 4.3362
8:	[0s / 1s],		train_loss: 4.5480
78:	[0s / 12s],		train_loss: 3.7696
96:	[0s / 1m:11s],		train_loss: 4.0255
5:	[0s / 1s],		train_loss: 4.3409
9:	[0s / 1s],		train_loss: 4.5173
79:	[0s / 12s],		train_loss: 3.7332
10:	[0s / 1s],		train_loss: 4.5293
6:	[0s / 1s],		train_loss: 4.3500
80:	[0s / 13s],		train_loss: 3.7189
74:	[0s / 28s],		train_loss: 4.1698
11:	[0s / 1s],		train_loss: 4.5011
81:	[0s / 13s],		train_loss: 3.6727
7:	[0s / 1s],		train_loss: 4.3162
12:	[0s / 2s],		train_loss: 4.5033
82:	[0s / 13s],		train_loss: 3.7183
8:	[0s / 1s],		train_loss: 4.3427
75:	[0s / 28s],		train_loss: 4.1888
13:	[0s / 2s],		train_loss: 4.4752
83:	[0s / 13s],		train_loss: 3.7116
9:	[0s / 1s],		train_loss: 4.3142
97:	[0s / 1m:12s],		train_loss: 4.0431
14:	[0s / 2s],		train_loss: 4.4717
84:	[0s / 13s],		train_loss: 3.7344
10:	[0s / 2s],		train_loss: 4.3151
76:	[0s / 28s],		train_loss: 4.1729
15:	[0s / 2s],		train_loss: 4.4869
85:	[0s / 13s],		train_loss: 3.7378
16:	[0s / 2s],		train_loss: 4.4613
11:	[0s / 2s],		train_loss: 4.2915
86:	[0s / 14s],		train_loss: 3.7734
55:	[1s / 1m:13s],		train_loss: 4.0288
17:	[0s / 2s],		train_loss: 4.4605
77:	[0s / 29s],		train_loss: 4.1708
12:	[0s / 2s],		train_loss: 4.2939
87:	[0s / 14s],		train_loss: 3.7769
18:	[0s / 3s],		train_loss: 4.4359
98:	[0s / 1m:13s],		train_loss: 4.0202
13:	[0s / 2s],		train_loss: 4.3255
88:	[0s / 14s],		train_loss: 3.7940
19:	[0s / 3s],		train_loss: 4.4416
89:	[0s / 14s],		train_loss: 3.7703
14:	[0s / 2s],		train_loss: 4.3103
78:	[0s / 29s],		train_loss: 4.1886
20:	[0s / 3s],		train_loss: 4.4267
90:	[0s / 14s],		train_loss: 3.7242
15:	[0s / 3s],		train_loss: 4.2989
21:	[0s / 3s],		train_loss: 4.4210
91:	[0s / 15s],		train_loss: 3.7378
16:	[0s / 3s],		train_loss: 4.2653
79:	[0s / 30s],		train_loss: 4.1791
22:	[0s / 3s],		train_loss: 4.4242
99:	[0s / 1m:14s],		train_loss: 4.0215
92:	[0s / 15s],		train_loss: 3.7323
23:	[0s / 3s],		train_loss: 4.4071
17:	[0s / 3s],		train_loss: 4.2697
31:	[2s / 1m:14s],		train_loss: 4.1508
93:	[0s / 15s],		train_loss: 3.7065
24:	[0s / 4s],		train_loss: 4.4099
80:	[0s / 30s],		train_loss: 4.1657
18:	[0s / 3s],		train_loss: 4.2618
94:	[0s / 15s],		train_loss: 3.7103
25:	[0s / 4s],		train_loss: 4.3871
19:	[0s / 3s],		train_loss: 4.2552
56:	[1s / 1m:14s],		train_loss: 3.9870
95:	[0s / 15s],		train_loss: 3.7198
26:	[0s / 4s],		train_loss: 4.4003
20:	[0s / 3s],		train_loss: 4.2920
81:	[0s / 30s],		train_loss: 4.1552
96:	[0s / 15s],		train_loss: 3.7452
27:	[0s / 4s],		train_loss: 4.3652
21:	[0s / 4s],		train_loss: 4.2242
0:	[0s / 0s],		train_loss: 4.8208
97:	[0s / 16s],		train_loss: 3.7323
28:	[0s / 4s],		train_loss: 4.3746
22:	[0s / 4s],		train_loss: 4.2501
82:	[0s / 31s],		train_loss: 4.1744
98:	[0s / 16s],		train_loss: 3.7076
29:	[0s / 4s],		train_loss: 4.3514
23:	[0s / 4s],		train_loss: 4.2296
99:	[0s / 16s],		train_loss: 3.6975
30:	[0s / 5s],		train_loss: 4.3571
24:	[0s / 4s],		train_loss: 4.2023
83:	[0s / 31s],		train_loss: 4.1581
18:	[4s / 1m:15s],		train_loss: 4.3084
31:	[0s / 5s],		train_loss: 4.3443
0:	[0s / 0s],		train_loss: 5.7271
1:	[0s / 1s],		train_loss: 4.5174
25:	[0s / 4s],		train_loss: 4.1908
32:	[0s / 5s],		train_loss: 4.3662
57:	[1s / 1m:15s],		train_loss: 3.9940
1:	[0s / 0s],		train_loss: 4.9983
33:	[0s / 5s],		train_loss: 4.3382
26:	[0s / 5s],		train_loss: 4.2728
84:	[0s / 31s],		train_loss: 4.1559
2:	[0s / 0s],		train_loss: 4.7600
34:	[0s / 5s],		train_loss: 4.3423
27:	[0s / 5s],		train_loss: 4.2517
3:	[0s / 0s],		train_loss: 4.7174
35:	[0s / 5s],		train_loss: 4.3632
28:	[0s / 5s],		train_loss: 4.2349
85:	[0s / 32s],		train_loss: 4.1675
4:	[0s / 0s],		train_loss: 4.6608
36:	[0s / 6s],		train_loss: 4.3243
2:	[0s / 2s],		train_loss: 4.4587
29:	[0s / 5s],		train_loss: 4.2453
5:	[0s / 0s],		train_loss: 4.6041
37:	[0s / 6s],		train_loss: 4.3073
30:	[0s / 5s],		train_loss: 4.1951
6:	[0s / 1s],		train_loss: 4.6097
38:	[0s / 6s],		train_loss: 4.3282
86:	[0s / 32s],		train_loss: 4.1587
7:	[0s / 1s],		train_loss: 4.5678
31:	[0s / 5s],		train_loss: 4.1830
39:	[0s / 6s],		train_loss: 4.3606
40:	[0s / 6s],		train_loss: 4.3161
8:	[0s / 1s],		train_loss: 4.5560
32:	[0s / 6s],		train_loss: 4.1857
32:	[2s / 1m:17s],		train_loss: 4.1776
87:	[0s / 33s],		train_loss: 4.1648
41:	[0s / 6s],		train_loss: 4.3072
9:	[0s / 1s],		train_loss: 4.5646
3:	[0s / 2s],		train_loss: 4.4384
33:	[0s / 6s],		train_loss: 4.1748
58:	[1s / 1m:17s],		train_loss: 3.9910
42:	[0s / 6s],		train_loss: 4.2998
10:	[0s / 1s],		train_loss: 4.5430
34:	[0s / 6s],		train_loss: 4.2079
43:	[0s / 7s],		train_loss: 4.2991
88:	[0s / 33s],		train_loss: 4.1500
11:	[0s / 1s],		train_loss: 4.5209
35:	[0s / 6s],		train_loss: 4.1959
44:	[0s / 7s],		train_loss: 4.3001
12:	[0s / 2s],		train_loss: 4.4938
36:	[0s / 6s],		train_loss: 4.1687
45:	[0s / 7s],		train_loss: 4.2822
13:	[0s / 2s],		train_loss: 4.4805
89:	[0s / 33s],		train_loss: 4.1582
4:	[0s / 3s],		train_loss: 4.4350
46:	[0s / 7s],		train_loss: 4.2939
14:	[0s / 2s],		train_loss: 4.4514
37:	[0s / 7s],		train_loss: 4.2440
47:	[0s / 7s],		train_loss: 4.2997
15:	[0s / 2s],		train_loss: 4.4857
38:	[0s / 7s],		train_loss: 4.1948
48:	[0s / 7s],		train_loss: 4.2939
16:	[0s / 2s],		train_loss: 4.4666
90:	[0s / 34s],		train_loss: 4.1541
39:	[0s / 7s],		train_loss: 4.2163
49:	[0s / 8s],		train_loss: 4.2852
17:	[0s / 2s],		train_loss: 4.4296
40:	[0s / 7s],		train_loss: 4.2287
50:	[0s / 8s],		train_loss: 4.2920
18:	[0s / 2s],		train_loss: 4.4392
91:	[0s / 34s],		train_loss: 4.1592
5:	[0s / 4s],		train_loss: 4.4180
41:	[0s / 7s],		train_loss: 4.1824
51:	[0s / 8s],		train_loss: 4.2604
19:	[0s / 3s],		train_loss: 4.4517
59:	[1s / 1m:18s],		train_loss: 3.9966
52:	[0s / 8s],		train_loss: 4.2485
42:	[0s / 7s],		train_loss: 4.2133
20:	[0s / 3s],		train_loss: 4.4417
92:	[0s / 34s],		train_loss: 4.1624
53:	[0s / 8s],		train_loss: 4.2285
21:	[0s / 3s],		train_loss: 4.4194
43:	[0s / 8s],		train_loss: 4.2026
54:	[0s / 8s],		train_loss: 4.2301
22:	[0s / 3s],		train_loss: 4.4234
44:	[0s / 8s],		train_loss: 4.1765
93:	[0s / 35s],		train_loss: 4.1942
55:	[0s / 8s],		train_loss: 4.2428
23:	[0s / 3s],		train_loss: 4.4373
45:	[0s / 8s],		train_loss: 4.1284
6:	[0s / 5s],		train_loss: 4.4305
56:	[0s / 9s],		train_loss: 4.2560
24:	[0s / 3s],		train_loss: 4.4132
46:	[0s / 8s],		train_loss: 4.1603
57:	[0s / 9s],		train_loss: 4.2300
94:	[0s / 35s],		train_loss: 4.1542
25:	[0s / 4s],		train_loss: 4.4213
58:	[0s / 9s],		train_loss: 4.2281
47:	[0s / 8s],		train_loss: 4.1724
26:	[0s / 4s],		train_loss: 4.4394
59:	[0s / 9s],		train_loss: 4.2277
33:	[2s / 1m:19s],		train_loss: 4.1811
48:	[0s / 9s],		train_loss: 4.1596
27:	[0s / 4s],		train_loss: 4.4135
95:	[0s / 35s],		train_loss: 4.1554
60:	[0s / 9s],		train_loss: 4.2002
60:	[1s / 1m:19s],		train_loss: 4.0117
28:	[0s / 4s],		train_loss: 4.3839
49:	[0s / 9s],		train_loss: 4.1566
61:	[0s / 9s],		train_loss: 4.2403
7:	[0s / 5s],		train_loss: 4.3901
29:	[0s / 4s],		train_loss: 4.3940
50:	[0s / 9s],		train_loss: 4.1777
62:	[0s / 10s],		train_loss: 4.2058
96:	[0s / 36s],		train_loss: 4.1469
30:	[0s / 4s],		train_loss: 4.3657
51:	[0s / 9s],		train_loss: 4.1511
63:	[0s / 10s],		train_loss: 4.2187
31:	[0s / 4s],		train_loss: 4.3538
64:	[0s / 10s],		train_loss: 4.2121
52:	[0s / 9s],		train_loss: 4.1753
32:	[0s / 5s],		train_loss: 4.3419
65:	[0s / 10s],		train_loss: 4.2154
97:	[0s / 36s],		train_loss: 4.1439
53:	[0s / 9s],		train_loss: 4.1703
33:	[0s / 5s],		train_loss: 4.3417
66:	[0s / 10s],		train_loss: 4.2078
54:	[0s / 10s],		train_loss: 4.1992
34:	[0s / 5s],		train_loss: 4.3455
8:	[0s / 6s],		train_loss: 4.3933
67:	[0s / 10s],		train_loss: 4.2236
35:	[0s / 5s],		train_loss: 4.3825
98:	[0s / 37s],		train_loss: 4.1670
55:	[0s / 10s],		train_loss: 4.1596
68:	[0s / 10s],		train_loss: 4.1716
36:	[0s / 5s],		train_loss: 4.3503
69:	[0s / 10s],		train_loss: 4.1923
56:	[0s / 10s],		train_loss: 4.1343
37:	[0s / 5s],		train_loss: 4.3769
61:	[1s / 1m:21s],		train_loss: 4.0690
70:	[0s / 11s],		train_loss: 4.1897
99:	[0s / 37s],		train_loss: 4.1207
57:	[0s / 10s],		train_loss: 4.0930
19:	[5s / 1m:21s],		train_loss: 4.2932
71:	[0s / 11s],		train_loss: 4.1844
38:	[0s / 6s],		train_loss: 4.3626
9:	[0s / 7s],		train_loss: 4.3772
72:	[0s / 11s],		train_loss: 4.1746
58:	[0s / 10s],		train_loss: 4.1228
39:	[0s / 6s],		train_loss: 4.3356
73:	[0s / 11s],		train_loss: 4.1623
40:	[0s / 6s],		train_loss: 4.3386
0:	[0s / 0s],		train_loss: 4.7649
59:	[0s / 11s],		train_loss: 4.0699
74:	[0s / 11s],		train_loss: 4.2027
41:	[0s / 6s],		train_loss: 4.3168
60:	[0s / 11s],		train_loss: 4.0679
75:	[0s / 11s],		train_loss: 4.1590
42:	[0s / 6s],		train_loss: 4.3662
61:	[0s / 11s],		train_loss: 4.0742
10:	[0s / 8s],		train_loss: 4.3880
34:	[2s / 1m:22s],		train_loss: 4.1536
76:	[0s / 12s],		train_loss: 4.1654
1:	[0s / 0s],		train_loss: 4.4884
43:	[0s / 6s],		train_loss: 4.3246
62:	[0s / 11s],		train_loss: 4.0825
77:	[0s / 12s],		train_loss: 4.1716
44:	[0s / 7s],		train_loss: 4.2980
78:	[0s / 12s],		train_loss: 4.1393
63:	[0s / 11s],		train_loss: 4.0661
62:	[1s / 1m:22s],		train_loss: 4.0327
45:	[0s / 7s],		train_loss: 4.3525
2:	[0s / 1s],		train_loss: 4.4679
79:	[0s / 12s],		train_loss: 4.1394
64:	[0s / 12s],		train_loss: 4.0614
46:	[0s / 7s],		train_loss: 4.2995
80:	[0s / 12s],		train_loss: 4.1165
11:	[0s / 8s],		train_loss: 4.3896
65:	[0s / 12s],		train_loss: 4.1166
47:	[0s / 7s],		train_loss: 4.3149
81:	[0s / 12s],		train_loss: 4.1661
3:	[0s / 1s],		train_loss: 4.4272
48:	[0s / 7s],		train_loss: 4.3016
66:	[0s / 12s],		train_loss: 4.1387
82:	[0s / 13s],		train_loss: 4.1173
49:	[0s / 7s],		train_loss: 4.3251
83:	[0s / 13s],		train_loss: 4.1291
67:	[0s / 12s],		train_loss: 4.0957
50:	[0s / 8s],		train_loss: 4.3108
4:	[0s / 1s],		train_loss: 4.3984
84:	[0s / 13s],		train_loss: 4.1116
68:	[0s / 12s],		train_loss: 4.0904
51:	[0s / 8s],		train_loss: 4.2846
12:	[0s / 9s],		train_loss: 4.3890
85:	[0s / 13s],		train_loss: 4.1275
69:	[0s / 13s],		train_loss: 4.0748
52:	[0s / 8s],		train_loss: 4.2876
86:	[0s / 13s],		train_loss: 4.1445
5:	[0s / 2s],		train_loss: 4.3641
63:	[1s / 1m:23s],		train_loss: 4.0467
53:	[0s / 8s],		train_loss: 4.2875
70:	[0s / 13s],		train_loss: 4.0482
87:	[0s / 13s],		train_loss: 4.0686
54:	[0s / 8s],		train_loss: 4.2918
88:	[0s / 13s],		train_loss: 4.0947
71:	[0s / 13s],		train_loss: 4.0666
6:	[0s / 2s],		train_loss: 4.3654
89:	[0s / 14s],		train_loss: 4.0962
55:	[0s / 8s],		train_loss: 4.2805
72:	[0s / 13s],		train_loss: 4.0820
13:	[0s / 10s],		train_loss: 4.3524
90:	[0s / 14s],		train_loss: 4.1051
56:	[0s / 9s],		train_loss: 4.3003
73:	[0s / 13s],		train_loss: 4.0893
91:	[0s / 14s],		train_loss: 4.0817
57:	[0s / 9s],		train_loss: 4.2820
7:	[0s / 3s],		train_loss: 4.3576
74:	[0s / 13s],		train_loss: 4.0529
92:	[0s / 14s],		train_loss: 4.0900
58:	[0s / 9s],		train_loss: 4.2891
35:	[2s / 1m:24s],		train_loss: 4.1466
75:	[0s / 14s],		train_loss: 4.0252
93:	[0s / 14s],		train_loss: 4.0841
59:	[0s / 9s],		train_loss: 4.2692
8:	[0s / 3s],		train_loss: 4.3404
94:	[0s / 14s],		train_loss: 4.0723
76:	[0s / 14s],		train_loss: 4.0331
14:	[0s / 10s],		train_loss: 4.3821
60:	[0s / 9s],		train_loss: 4.2587
95:	[0s / 15s],		train_loss: 4.0770
77:	[0s / 14s],		train_loss: 4.0989
61:	[0s / 9s],		train_loss: 4.2648
64:	[1s / 1m:25s],		train_loss: 4.0176
96:	[0s / 15s],		train_loss: 4.0687
9:	[0s / 3s],		train_loss: 4.3427
78:	[0s / 14s],		train_loss: 4.0597
62:	[0s / 10s],		train_loss: 4.2554
97:	[0s / 15s],		train_loss: 4.0703
63:	[0s / 10s],		train_loss: 4.2407
79:	[0s / 14s],		train_loss: 4.0877
98:	[0s / 15s],		train_loss: 4.0753
64:	[0s / 10s],		train_loss: 4.2257
10:	[0s / 4s],		train_loss: 4.3288
80:	[0s / 15s],		train_loss: 4.0098
15:	[0s / 11s],		train_loss: 4.3490
99:	[0s / 15s],		train_loss: 4.0430
65:	[0s / 10s],		train_loss: 4.2341
20:	[4s / 1m:26s],		train_loss: 4.2967
81:	[0s / 15s],		train_loss: 4.0019
66:	[0s / 10s],		train_loss: 4.2495
11:	[0s / 4s],		train_loss: 4.3189
0:	[0s / 0s],		train_loss: 5.1551
82:	[0s / 15s],		train_loss: 4.0338
67:	[0s / 10s],		train_loss: 4.2221
1:	[0s / 0s],		train_loss: 4.7011
83:	[0s / 15s],		train_loss: 4.0543
68:	[0s / 11s],		train_loss: 4.2208
2:	[0s / 0s],		train_loss: 4.6271
12:	[0s / 4s],		train_loss: 4.3049
69:	[0s / 11s],		train_loss: 4.2368
3:	[0s / 0s],		train_loss: 4.6127
84:	[0s / 15s],		train_loss: 4.0402
65:	[1s / 1m:26s],		train_loss: 4.0045
16:	[0s / 12s],		train_loss: 4.3357
4:	[0s / 0s],		tr