[I 2026-06-08 21:07:13,971] Trial 96 finished with value: 0.7998921972909299 and parameters: {'num_nodes': [64, 32], 'dropout': 0.07038292247528516, 'learning_rate': 0.00011720685901635152, 'batch_norm': False}. Best is trial 66 with value: 0.8081241912194147.
/scratch.hpc/luca.cotugno/Foundation_model_clinical_data/test_tabular_model_tmp.py:476: UserWarning: Choices for a categorical distribution should be a tuple of None, bool, int, float and str for persistent storage but contains [32] which is of type list.
  num_nodes  = trial.suggest_categorical("num_nodes", [[32], [64], [128], [64, 32], [128, 64]])
/scratch.hpc/luca.cotugno/Foundation_model_clinical_data/test_tabular_model_tmp.py:476: UserWarning: Choices for a categorical distribution should be a tuple of None, bool, int, float and str for persistent storage but contains [64] which is of type list.
  num_nodes  = trial.suggest_categorical("num_nodes", [[32], [64], [128], [64, 32], [128, 64]])
/scratch.hpc/luca.cotugno/Foundation_model_clinical_data/test_tabular_model_tmp.py:476: UserWarning: Choices for a categorical distribution should be a tuple of None, bool, int, float and str for persistent storage but contains [128] which is of type list.
  num_nodes  = trial.suggest_categorical("num_nodes", [[32], [64], [128], [64, 32], [128, 64]])
/scratch.hpc/luca.cotugno/Foundation_model_clinical_data/test_tabular_model_tmp.py:476: UserWarning: Choices for a categorical distribution should be a tuple of None, bool, int, float and str for persistent storage but contains [64, 32] which is of type list.
  num_nodes  = trial.suggest_categorical("num_nodes", [[32], [64], [128], [64, 32], [128, 64]])
/scratch.hpc/luca.cotugno/Foundation_model_clinical_data/test_tabular_model_tmp.py:476: UserWarning: Choices for a categorical distribution should be a tuple of None, bool, int, float and str for persistent storage but contains [128, 64] which is of type list.
  num_nodes  = trial.suggest_categorical("num_nodes", [[32], [64], [128], [64, 32], [128, 64]])
[I 2026-06-08 21:07:16,006] Trial 95 finished with value: 0.8045926244415965 and parameters: {'num_nodes': [64, 32], 'dropout': 0.14474045267265295, 'learning_rate': 0.00012581827278321283, 'batch_norm': False}. Best is trial 66 with value: 0.8081241912194147.
[I 2026-06-08 21:07:16,868] Trial 97 finished with value: 0.800542605233871 and parameters: {'num_nodes': [64, 32], 'dropout': 0.06769112098171279, 'learning_rate': 0.00014396090108903173, 'batch_norm': False}. Best is trial 66 with value: 0.8081241912194147.
[I 2026-06-08 21:07:39,048] Trial 98 finished with value: 0.8048385770250617 and parameters: {'num_nodes': [64, 32], 'dropout': 0.0716701476412533, 'learning_rate': 0.0001505865270599485, 'batch_norm': False}. Best is trial 66 with value: 0.8081241912194147.
[I 2026-06-08 21:07:44,579] Trial 99 finished with value: 0.8001472592293382 and parameters: {'num_nodes': [64, 32], 'dropout': 0.0914234884844121, 'learning_rate': 0.0001480544368240273, 'batch_norm': False}. Best is trial 66 with value: 0.8081241912194147.
[I 2026-06-08 21:07:55,494] A new study created in memory with name: rsf_tuning_tabicl_4_NaN_seed789
[I 2026-06-08 21:12:54,760] Trial 2 finished with value: 0.737223202992151 and parameters: {'n_estimators': 50, 'max_depth': 10, 'min_samples_split': 17, 'min_samples_leaf': 12, 'max_features': 'log2'}. Best is trial 2 with value: 0.737223202992151.
[I 2026-06-08 21:36:58,170] Trial 0 finished with value: 0.7517824010085526 and parameters: {'n_estimators': 150, 'max_depth': 6, 'min_samples_split': 19, 'min_samples_leaf': 10, 'max_features': 'sqrt'}. Best is trial 0 with value: 0.7517824010085526.
[I 2026-06-08 21:38:39,144] Trial 3 finished with value: 0.763954244465107 and parameters: {'n_estimators': 150, 'max_depth': 7, 'min_samples_split': 13, 'min_samples_leaf': 10, 'max_features': 'sqrt'}. Best is trial 3 with value: 0.763954244465107.
[I 2026-06-08 21:41:28,698] Trial 4 finished with value: 0.7517824010085526 and parameters: {'n_estimators': 150, 'max_depth': 6, 'min_samples_split': 7, 'min_samples_leaf': 10, 'max_features': 'sqrt'}. Best is trial 3 with value: 0.763954244465107.
[I 2026-06-08 21:47:54,251] Trial 7 finished with value: 0.7473799307248343 and parameters: {'n_estimators': 50, 'max_depth': 3, 'min_samples_split': 10, 'min_samples_leaf': 5, 'max_features': 'sqrt'}. Best is trial 3 with value: 0.763954244465107.
[I 2026-06-08 22:01:03,170] Trial 1 finished with value: 0.7631367325911592 and parameters: {'n_estimators': 300, 'max_depth': 5, 'min_samples_split': 8, 'min_samples_leaf': 10, 'max_features': 'sqrt'}. Best is trial 3 with value: 0.763954244465107.
[I 2026-06-08 22:10:24,660] Trial 6 finished with value: 0.7660444885616399 and parameters: {'n_estimators': 150, 'max_depth': 10, 'min_samples_split': 17, 'min_samples_leaf': 7, 'max_features': 'sqrt'}. Best is trial 6 with value: 0.7660444885616399.
[I 2026-06-08 22:10:34,715] Trial 9 finished with value: 0.7565759576642458 and parameters: {'n_estimators': 100, 'max_depth': 9, 'min_samples_split': 8, 'min_samples_leaf': 7, 'max_features': 'log2'}. Best is trial 6 with value: 0.7660444885616399.
[I 2026-06-08 22:14:04,320] Trial 5 finished with value: 0.7562471728696002 and parameters: {'n_estimators': 200, 'max_depth': 6, 'min_samples_split': 15, 'min_samples_leaf': 12, 'max_features': 'sqrt'}. Best is trial 6 with value: 0.7660444885616399.
[I 2026-06-08 22:16:41,903] Trial 12 finished with value: 0.722875254441736 and parameters: {'n_estimators': 50, 'max_depth': 3, 'min_samples_split': 7, 'min_samples_leaf': 13, 'max_features': 'log2'}. Best is trial 6 with value: 0.7660444885616399.
[I 2026-06-08 22:19:22,398] Trial 10 finished with value: 0.7593044002714046 and parameters: {'n_estimators': 100, 'max_depth': 8, 'min_samples_split': 14, 'min_samples_leaf': 8, 'max_features': 'log2'}. Best is trial 6 with value: 0.7660444885616399.
[I 2026-06-08 22:25:09,399] Trial 8 finished with value: 0.7619129516079043 and parameters: {'n_estimators': 300, 'max_depth': 3, 'min_samples_split': 8, 'min_samples_leaf': 5, 'max_features': 'sqrt'}. Best is trial 6 with value: 0.7660444885616399.
[I 2026-06-08 22:40:52,481] Trial 13 finished with value: 0.7711385587079804 and parameters: {'n_estimators': 250, 'max_depth': 8, 'min_samples_split': 19, 'min_samples_leaf': 4, 'max_features': 'log2'}. Best is trial 13 with value: 0.7711385587079804.
[I 2026-06-08 23:04:13,892] Trial 15 finished with value: 0.7585832202481173 and parameters: {'n_estimators': 200, 'max_depth': 8, 'min_samples_split': 12, 'min_samples_leaf': 15, 'max_features': 'sqrt'}. Best is trial 13 with value: 0.7711385587079804.
[I 2026-06-08 23:06:13,572] Trial 16 finished with value: 0.7606242513339867 and parameters: {'n_estimators': 250, 'max_depth': 10, 'min_samples_split': 20, 'min_samples_leaf': 3, 'max_features': 'log2'}. Best is trial 13 with value: 0.7711385587079804.
[I 2026-06-08 23:12:40,219] Trial 11 finished with value: 0.7613938590539374 and parameters: {'n_estimators': 300, 'max_depth': 10, 'min_samples_split': 14, 'min_samples_leaf': 11, 'max_features': 'sqrt'}. Best is trial 13 with value: 0.7711385587079804.
[I 2026-06-08 23:13:02,881] Trial 14 finished with value: 0.7677365784601982 and parameters: {'n_estimators': 250, 'max_depth': 8, 'min_samples_split': 12, 'min_samples_leaf': 3, 'max_features': 'sqrt'}. Best is trial 13 with value: 0.7711385587079804.
[I 2026-06-08 23:29:05,115] Trial 17 finished with value: 0.7606242513339867 and parameters: {'n_estimators': 250, 'max_depth': 10, 'min_samples_split': 20, 'min_samples_leaf': 3, 'max_features': 'log2'}. Best is trial 13 with value: 0.7711385587079804.
[I 2026-06-08 23:31:03,355] Trial 18 finished with value: 0.7634979770311361 and parameters: {'n_estimators': 250, 'max_depth': 9, 'min_samples_split': 17, 'min_samples_leaf': 3, 'max_features': 'log2'}. Best is trial 13 with value: 0.7711385587079804.
[I 2026-06-08 23:36:27,452] Trial 20 finished with value: 0.776359849722313 and parameters: {'n_estimators': 250, 'max_depth': 8, 'min_samples_split': 11, 'min_samples_leaf': 3, 'max_features': 'log2'}. Best is trial 20 with value: 0.776359849722313.
[I 2026-06-08 23:36:34,374] Trial 19 finished with value: 0.7716249298452826 and parameters: {'n_estimators': 250, 'max_depth': 8, 'min_samples_split': 18, 'min_samples_leaf': 3, 'max_features': 'log2'}. Best is trial 20 with value: 0.776359849722313.
[I 2026-06-08 23:52:50,222] Trial 21 finished with value: 0.7737253830238149 and parameters: {'n_estimators': 250, 'max_depth': 8, 'min_samples_split': 5, 'min_samples_leaf': 5, 'max_features': 'log2'}. Best is trial 20 with value: 0.776359849722313.
[I 2026-06-08 23:54:24,753] Trial 22 finished with value: 0.7737253830238149 and parameters: {'n_estimators': 250, 'max_depth': 8, 'min_samples_split': 5, 'min_samples_leaf': 5, 'max_features': 'log2'}. Best is trial 20 with value: 0.776359849722313.
[I 2026-06-08 23:54:33,613] Trial 23 finished with value: 0.7775608565995694 and parameters: {'n_estimators': 200, 'max_depth': 7, 'min_samples_split': 5, 'min_samples_leaf': 5, 'max_features': 'log2'}. Best is trial 23 with value: 0.7775608565995694.
[I 2026-06-08 23:54:47,500] Trial 24 finished with value: 0.7775608565995694 and parameters: {'n_estimators': 200, 'max_depth': 7, 'min_samples_split': 5, 'min_samples_leaf': 5, 'max_features': 'log2'}. Best is trial 23 with value: 0.7775608565995694.
[I 2026-06-09 00:11:29,708] Trial 25 finished with value: 0.7775608565995694 and parameters: {'n_estimators': 200, 'max_depth': 7, 'min_samples_split': 10, 'min_samples_leaf': 5, 'max_features': 'log2'}. Best is trial 23 with value: 0.7775608565995694.
[I 2026-06-09 00:13:05,153] Trial 26 finished with value: 0.7715050385746237 and parameters: {'n_estimators': 200, 'max_depth': 7, 'min_samples_split': 5, 'min_samples_leaf': 6, 'max_features': 'log2'}. Best is trial 23 with value: 0.7775608565995694.
[I 2026-06-09 00:13:07,145] Trial 27 finished with value: 0.7715050385746237 and parameters: {'n_estimators': 200, 'max_depth': 7, 'min_samples_split': 5, 'min_samples_leaf': 6, 'max_features': 'log2'}. Best is trial 23 with value: 0.7775608565995694.
[I 2026-06-09 00:13:38,476] Trial 28 finished with value: 0.772514952378559 and parameters: {'n_estimators': 200, 'max_depth': 7, 'min_samples_split': 6, 'min_samples_leaf': 7, 'max_features': 'log2'}. Best is trial 23 with value: 0.7775608565995694.
[I 2026-06-09 00:25:20,852] Trial 32 finished with value: 0.7738389917824743 and parameters: {'n_estimators': 150, 'max_depth': 5, 'min_samples_split': 10, 'min_samples_leaf': 8, 'max_features': 'log2'}. Best is trial 23 with value: 0.7775608565995694.
[I 2026-06-09 00:26:46,540] Trial 29 finished with value: 0.771337504921301 and parameters: {'n_estimators': 200, 'max_depth': 5, 'min_samples_split': 6, 'min_samples_leaf': 7, 'max_features': 'log2'}. Best is trial 23 with value: 0.7775608565995694.
[I 2026-06-09 00:28:31,777] Trial 30 finished with value: 0.7757781938196835 and parameters: {'n_estimators': 200, 'max_depth': 5, 'min_samples_split': 10, 'min_samples_leaf': 8, 'max_features': 'log2'}. Best is trial 23 with value: 0.7775608565995694.
[I 2026-06-09 00:28:49,527] Trial 31 finished with value: 0.771337504921301 and parameters: {'n_estimators': 200, 'max_depth': 5, 'min_samples_split': 10, 'min_samples_leaf': 7, 'max_features': 'log2'}. Best is trial 23 with value: 0.7775608565995694.
[I 2026-06-09 00:33:21,161] Trial 33 finished with value: 0.7680931110161754 and parameters: {'n_estimators': 100, 'max_depth': 5, 'min_samples_split': 9, 'min_samples_leaf': 6, 'max_features': 'log2'}. Best is trial 23 with value: 0.7775608565995694.
[I 2026-06-09 00:41:45,835] Trial 35 finished with value: 0.7774875606262408 and parameters: {'n_estimators': 150, 'max_depth': 6, 'min_samples_split': 9, 'min_samples_leaf': 4, 'max_features': 'log2'}. Best is trial 23 with value: 0.7775608565995694.
[I 2026-06-09 00:42:00,808] Trial 36 finished with value: 0.7774875606262408 and parameters: {'n_estimators': 150, 'max_depth': 6, 'min_samples_split': 9, 'min_samples_leaf': 4, 'max_features': 'log2'}. Best is trial 23 with value: 0.7775608565995694.
[I 2026-06-09 00:43:52,440] Trial 34 finished with value: 0.7761069786143292 and parameters: {'n_estimators': 200, 'max_depth': 6, 'min_samples_split': 10, 'min_samples_leaf': 4, 'max_features': 'log2'}. Best is trial 23 with value: 0.7775608565995694.
[I 2026-06-09 00:54:05,148] Trial 40 finished with value: 0.7777728913795559 and parameters: {'n_estimators': 150, 'max_depth': 4, 'min_samples_split': 7, 'min_samples_leaf': 4, 'max_features': 'log2'}. Best is trial 40 with value: 0.7777728913795559.
[I 2026-06-09 00:54:44,380] Trial 38 finished with value: 0.7762650884996524 and parameters: {'n_estimators': 150, 'max_depth': 6, 'min_samples_split': 7, 'min_samples_leaf': 4, 'max_features': 'log2'}. Best is trial 40 with value: 0.7777728913795559.
[I 2026-06-09 00:55:07,124] Trial 39 finished with value: 0.7762650884996524 and parameters: {'n_estimators': 150, 'max_depth': 6, 'min_samples_split': 7, 'min_samples_leaf': 4, 'max_features': 'log2'}. Best is trial 40 with value: 0.7777728913795559.
[I 2026-06-09 00:59:12,496] Trial 37 finished with value: 0.7781435595875321 and parameters: {'n_estimators': 300, 'max_depth': 6, 'min_samples_split': 11, 'min_samples_leaf': 4, 'max_features': 'log2'}. Best is trial 37 with value: 0.7781435595875321.
[I 2026-06-09 01:01:33,238] Trial 42 finished with value: 0.7673988934402198 and parameters: {'n_estimators': 100, 'max_depth': 4, 'min_samples_split': 6, 'min_samples_leaf': 9, 'max_features': 'log2'}. Best is trial 37 with value: 0.7781435595875321.
[I 2026-06-09 01:02:04,031] Trial 43 finished with value: 0.7673988934402198 and parameters: {'n_estimators': 100, 'max_depth': 4, 'min_samples_split': 6, 'min_samples_leaf': 9, 'max_features': 'log2'}. Best is trial 37 with value: 0.7781435595875321.
[I 2026-06-09 01:04:13,884] Trial 41 finished with value: 0.7747049313530856 and parameters: {'n_estimators': 150, 'max_depth': 4, 'min_samples_split': 7, 'min_samples_leaf': 9, 'max_features': 'log2'}. Best is trial 37 with value: 0.7781435595875321.
[I 2026-06-09 01:19:47,302] Trial 44 finished with value: 0.7799644409820823 and parameters: {'n_estimators': 300, 'max_depth': 4, 'min_samples_split': 6, 'min_samples_leaf': 5, 'max_features': 'log2'}. Best is trial 44 with value: 0.7799644409820823.
[I 2026-06-09 01:29:08,997] Trial 45 finished with value: 0.7778613700902168 and parameters: {'n_estimators': 300, 'max_depth': 7, 'min_samples_split': 6, 'min_samples_leaf': 5, 'max_features': 'log2'}. Best is trial 44 with value: 0.7799644409820823.
[I 2026-06-09 01:29:37,117] Trial 46 finished with value: 0.7778613700902168 and parameters: {'n_estimators': 300, 'max_depth': 7, 'min_samples_split': 8, 'min_samples_leaf': 5, 'max_features': 'log2'}. Best is trial 44 with value: 0.7799644409820823.
[I 2026-06-09 01:31:44,389] Trial 47 finished with value: 0.7778613700902168 and parameters: {'n_estimators': 300, 'max_depth': 7, 'min_samples_split': 8, 'min_samples_leaf': 5, 'max_features': 'log2'}. Best is trial 44 with value: 0.7799644409820823.
[I 2026-06-09 01:38:54,511] Trial 48 finished with value: 0.7815502517193141 and parameters: {'n_estimators': 300, 'max_depth': 4, 'min_samples_split': 8, 'min_samples_leaf': 6, 'max_features': 'log2'}. Best is trial 48 with value: 0.7815502517193141.
[I 2026-06-09 02:15:30,051] Trial 49 finished with value: 0.7606022625419881 and parameters: {'n_estimators': 300, 'max_depth': 4, 'min_samples_split': 8, 'min_samples_leaf': 6, 'max_features': 'sqrt'}. Best is trial 48 with value: 0.7815502517193141.
[I 2026-06-09 02:15:47,587] Trial 50 finished with value: 0.7606022625419881 and parameters: {'n_estimators': 300, 'max_depth': 4, 'min_samples_split': 8, 'min_samples_leaf': 6, 'max_features': 'sqrt'}. Best is trial 48 with value: 0.7815502517193141.
[I 2026-06-09 02:24:59,678] Trial 52 finished with value: 0.7606022625419881 and parameters: {'n_estimators': 300, 'max_depth': 4, 'min_samples_split': 8, 'min_samples_leaf': 6, 'max_features': 'sqrt'}. Best is trial 48 with value: 0.7815502517193141.
[I 2026-06-09 02:31:25,897] Trial 54 finished with value: 0.7725981956625537 and parameters: {'n_estimators': 300, 'max_depth': 3, 'min_samples_split': 8, 'min_samples_leaf': 6, 'max_features': 'log2'}. Best is trial 48 with value: 0.7815502517193141.
[I 2026-06-09 02:32:42,662] Trial 51 finished with value: 0.7634822707511372 and parameters: {'n_estimators': 300, 'max_depth': 9, 'min_samples_split': 8, 'min_samples_leaf': 6, 'max_features': 'sqrt'}. Best is trial 48 with value: 0.7815502517193141.
[I 2026-06-09 02:40:05,440] Trial 55 finished with value: 0.771968373834594 and parameters: {'n_estimators': 300, 'max_depth': 3, 'min_samples_split': 11, 'min_samples_leaf': 5, 'max_features': 'log2'}. Best is trial 48 with value: 0.7815502517193141.
[I 2026-06-09 02:47:57,408] Trial 57 finished with value: 0.771968373834594 and parameters: {'n_estimators': 300, 'max_depth': 3, 'min_samples_split': 11, 'min_samples_leaf': 5, 'max_features': 'log2'}. Best is trial 48 with value: 0.7815502517193141.
[I 2026-06-09 02:53:15,269] Trial 53 finished with value: 0.7611930804412836 and parameters: {'n_estimators': 300, 'max_depth': 3, 'min_samples_split': 15, 'min_samples_leaf': 6, 'max_features': 'sqrt'}. Best is trial 48 with value: 0.7815502517193141.
[I 2026-06-09 02:59:17,593] Trial 56 finished with value: 0.7708558456679986 and parameters: {'n_estimators': 300, 'max_depth': 9, 'min_samples_split': 11, 'min_samples_leaf': 5, 'max_features': 'log2'}. Best is trial 48 with value: 0.7815502517193141.
[I 2026-06-09 03:04:34,453] Trial 58 finished with value: 0.7746970782130861 and parameters: {'n_estimators': 300, 'max_depth': 7, 'min_samples_split': 13, 'min_samples_leaf': 5, 'max_features': 'log2'}. Best is trial 48 with value: 0.7815502517193141.
[I 2026-06-09 03:11:50,710] Trial 59 finished with value: 0.7763242488209819 and parameters: {'n_estimators': 300, 'max_depth': 7, 'min_samples_split': 14, 'min_samples_leaf': 7, 'max_features': 'log2'}. Best is trial 48 with value: 0.7815502517193141.
[I 2026-06-09 03:16:47,320] Trial 60 finished with value: 0.7763242488209819 and parameters: {'n_estimators': 300, 'max_depth': 7, 'min_samples_split': 13, 'min_samples_leaf': 7, 'max_features': 'log2'}. Best is trial 48 with value: 0.7815502517193141.
[I 2026-06-09 03:22:31,702] Trial 61 finished with value: 0.774415935801104 and parameters: {'n_estimators': 300, 'max_depth': 7, 'min_samples_split': 13, 'min_samples_leaf': 14, 'max_features': 'log2'}. Best is trial 48 with value: 0.7815502517193141.
[I 2026-06-09 03:25:55,454] Trial 62 finished with value: 0.7787152681794955 and parameters: {'n_estimators': 300, 'max_depth': 6, 'min_samples_split': 9, 'min_samples_leaf': 4, 'max_features': 'log2'}. Best is trial 48 with value: 0.7815502517193141.
[I 2026-06-09 03:30:24,018] Trial 63 finished with value: 0.7746112172157582 and parameters: {'n_estimators': 250, 'max_depth': 6, 'min_samples_split': 9, 'min_samples_leaf': 3, 'max_features': 'log2'}. Best is trial 48 with value: 0.7815502517193141.
[I 2026-06-09 03:31:00,991] Trial 64 finished with value: 0.7848108754471055 and parameters: {'n_estimators': 250, 'max_depth': 4, 'min_samples_split': 7, 'min_samples_leaf': 4, 'max_features': 'log2'}. Best is trial 64 with value: 0.7848108754471055.
[I 2026-06-09 03:36:39,325] Trial 65 finished with value: 0.7848108754471055 and parameters: {'n_estimators': 250, 'max_depth': 4, 'min_samples_split': 6, 'min_samples_leaf': 4, 'max_features': 'log2'}. Best is trial 64 with value: 0.7848108754471055.
[I 2026-06-09 03:44:22,421] Trial 66 finished with value: 0.7746112172157582 and parameters: {'n_estimators': 250, 'max_depth': 6, 'min_samples_split': 9, 'min_samples_leaf': 3, 'max_features': 'log2'}. Best is trial 64 with value: 0.7848108754471055.
[I 2026-06-09 03:46:57,483] Trial 68 finished with value: 0.776368226404979 and parameters: {'n_estimators': 250, 'max_depth': 5, 'min_samples_split': 6, 'min_samples_leaf': 11, 'max_features': 'log2'}. Best is trial 64 with value: 0.7848108754471055.
[I 2026-06-09 03:51:50,372] Trial 67 finished with value: 0.7795278063981103 and parameters: {'n_estimators': 300, 'max_depth': 6, 'min_samples_split': 6, 'min_samples_leaf': 4, 'max_features': 'log2'}. Best is trial 64 with value: 0.7848108754471055.
[I 2026-06-09 03:52:58,698] Trial 69 finished with value: 0.7769022399249449 and parameters: {'n_estimators': 250, 'max_depth': 5, 'min_samples_split': 6, 'min_samples_leaf': 3, 'max_features': 'log2'}. Best is trial 64 with value: 0.7848108754471055.
[I 2026-06-09 04:00:31,162] Trial 70 finished with value: 0.7779032535035475 and parameters: {'n_estimators': 250, 'max_depth': 5, 'min_samples_split': 6, 'min_samples_leaf': 4, 'max_features': 'log2'}. Best is trial 64 with value: 0.7848108754471055.
[I 2026-06-09 04:03:20,608] Trial 71 finished with value: 0.7779032535035475 and parameters: {'n_estimators': 250, 'max_depth': 5, 'min_samples_split': 6, 'min_samples_leaf': 4, 'max_features': 'log2'}. Best is trial 64 with value: 0.7848108754471055.
[I 2026-06-09 04:07:06,180] Trial 73 finished with value: 0.7848108754471055 and parameters: {'n_estimators': 250, 'max_depth': 4, 'min_samples_split': 7, 'min_samples_leaf': 4, 'max_features': 'log2'}. Best is trial 64 with value: 0.7848108754471055.
[I 2026-06-09 04:07:42,933] Trial 72 finished with value: 0.7779032535035475 and parameters: {'n_estimators': 250, 'max_depth': 5, 'min_samples_split': 7, 'min_samples_leaf': 4, 'max_features': 'log2'}. Best is trial 64 with value: 0.7848108754471055.
