ENV CHECKPOINT PATH: 
DEFAULT PATH: /scratch.hpc/luca.cotugno/Foundation_model_clinical_data/src/models_diff/tabdpt1_1.pth
ENV CHECKPOINT PATH: 
DEFAULT PATH: /scratch.hpc/luca.cotugno/Foundation_model_clinical_data/src/models_diff/tabdpt1_1.pth
ENV CHECKPOINT PATH: 
DEFAULT PATH: /scratch.hpc/luca.cotugno/Foundation_model_clinical_data/src/models_diff/tabdpt1_1.pth
ENV CHECKPOINT PATH: 
DEFAULT PATH: /scratch.hpc/luca.cotugno/Foundation_model_clinical_data/src/models_diff/tabdpt1_1.pth
[I 2026-06-27 23:13:08,386] A new study created in memory with name: rsf_tuning_tabdpt_2_-1_seed123
[I 2026-06-27 23:15:22,590] Trial 2 finished with value: 0.7748917084844174 and parameters: {'n_estimators': 50, 'max_depth': 8, 'min_samples_split': 8, 'min_samples_leaf': 8, 'max_features': 'log2'}. Best is trial 2 with value: 0.7748917084844174.
[I 2026-06-27 23:16:44,875] Trial 3 finished with value: 0.7716012571211619 and parameters: {'n_estimators': 150, 'max_depth': 4, 'min_samples_split': 20, 'min_samples_leaf': 5, 'max_features': 'log2'}. Best is trial 2 with value: 0.7748917084844174.
[I 2026-06-27 23:16:58,883] Trial 6 finished with value: 0.769392282779396 and parameters: {'n_estimators': 50, 'max_depth': 4, 'min_samples_split': 14, 'min_samples_leaf': 7, 'max_features': 'sqrt'}. Best is trial 2 with value: 0.7748917084844174.
[I 2026-06-27 23:19:12,381] Trial 1 finished with value: 0.7776433388493775 and parameters: {'n_estimators': 150, 'max_depth': 9, 'min_samples_split': 5, 'min_samples_leaf': 13, 'max_features': 'log2'}. Best is trial 1 with value: 0.7776433388493775.
[I 2026-06-27 23:24:04,569] Trial 5 finished with value: 0.7759751030183564 and parameters: {'n_estimators': 100, 'max_depth': 7, 'min_samples_split': 14, 'min_samples_leaf': 10, 'max_features': 'sqrt'}. Best is trial 1 with value: 0.7776433388493775.
[I 2026-06-27 23:24:09,584] Trial 0 finished with value: 0.7773921447184996 and parameters: {'n_estimators': 250, 'max_depth': 10, 'min_samples_split': 13, 'min_samples_leaf': 10, 'max_features': 'log2'}. Best is trial 1 with value: 0.7776433388493775.
[I 2026-06-27 23:26:24,624] Trial 7 finished with value: 0.7762128745620881 and parameters: {'n_estimators': 300, 'max_depth': 9, 'min_samples_split': 18, 'min_samples_leaf': 5, 'max_features': 'log2'}. Best is trial 1 with value: 0.7776433388493775.
[I 2026-06-27 23:27:42,315] Trial 10 finished with value: 0.7720672126463781 and parameters: {'n_estimators': 150, 'max_depth': 4, 'min_samples_split': 7, 'min_samples_leaf': 3, 'max_features': 'sqrt'}. Best is trial 1 with value: 0.7776433388493775.
[I 2026-06-27 23:29:07,232] Trial 11 finished with value: 0.7729070830992371 and parameters: {'n_estimators': 200, 'max_depth': 10, 'min_samples_split': 5, 'min_samples_leaf': 3, 'max_features': 'log2'}. Best is trial 1 with value: 0.7776433388493775.
[I 2026-06-27 23:29:38,641] Trial 12 finished with value: 0.7719732545363551 and parameters: {'n_estimators': 300, 'max_depth': 3, 'min_samples_split': 9, 'min_samples_leaf': 12, 'max_features': 'log2'}. Best is trial 1 with value: 0.7776433388493775.
[I 2026-06-27 23:31:18,960] Trial 16 finished with value: 0.772928175736181 and parameters: {'n_estimators': 50, 'max_depth': 9, 'min_samples_split': 5, 'min_samples_leaf': 14, 'max_features': 'log2'}. Best is trial 1 with value: 0.7776433388493775.
[I 2026-06-27 23:33:27,793] Trial 14 finished with value: 0.7764295534688759 and parameters: {'n_estimators': 150, 'max_depth': 10, 'min_samples_split': 20, 'min_samples_leaf': 6, 'max_features': 'log2'}. Best is trial 1 with value: 0.7776433388493775.
[I 2026-06-27 23:35:21,270] Trial 4 finished with value: 0.7744180829094033 and parameters: {'n_estimators': 200, 'max_depth': 7, 'min_samples_split': 8, 'min_samples_leaf': 4, 'max_features': 'sqrt'}. Best is trial 1 with value: 0.7776433388493775.
[I 2026-06-27 23:38:46,118] Trial 15 finished with value: 0.7766136346640231 and parameters: {'n_estimators': 250, 'max_depth': 9, 'min_samples_split': 9, 'min_samples_leaf': 6, 'max_features': 'log2'}. Best is trial 1 with value: 0.7776433388493775.
[I 2026-06-27 23:41:19,750] Trial 19 finished with value: 0.7761074113773684 and parameters: {'n_estimators': 250, 'max_depth': 6, 'min_samples_split': 11, 'min_samples_leaf': 15, 'max_features': 'log2'}. Best is trial 1 with value: 0.7776433388493775.
[I 2026-06-27 23:41:52,047] Trial 18 finished with value: 0.77690317904389 and parameters: {'n_estimators': 250, 'max_depth': 10, 'min_samples_split': 11, 'min_samples_leaf': 14, 'max_features': 'log2'}. Best is trial 1 with value: 0.7776433388493775.
[I 2026-06-27 23:43:22,026] Trial 8 finished with value: 0.7747785752498998 and parameters: {'n_estimators': 250, 'max_depth': 8, 'min_samples_split': 16, 'min_samples_leaf': 15, 'max_features': 'sqrt'}. Best is trial 1 with value: 0.7776433388493775.
[I 2026-06-27 23:45:15,409] Trial 20 finished with value: 0.7758830624207828 and parameters: {'n_estimators': 250, 'max_depth': 9, 'min_samples_split': 11, 'min_samples_leaf': 15, 'max_features': 'log2'}. Best is trial 1 with value: 0.7776433388493775.
[I 2026-06-27 23:46:35,463] Trial 21 finished with value: 0.7761074113773684 and parameters: {'n_estimators': 250, 'max_depth': 6, 'min_samples_split': 12, 'min_samples_leaf': 15, 'max_features': 'log2'}. Best is trial 1 with value: 0.7776433388493775.
[I 2026-06-27 23:46:38,941] Trial 24 finished with value: 0.7716511124448475 and parameters: {'n_estimators': 100, 'max_depth': 6, 'min_samples_split': 12, 'min_samples_leaf': 11, 'max_features': 'log2'}. Best is trial 1 with value: 0.7776433388493775.
[I 2026-06-27 23:48:06,122] Trial 17 finished with value: 0.7776548439240741 and parameters: {'n_estimators': 200, 'max_depth': 6, 'min_samples_split': 10, 'min_samples_leaf': 15, 'max_features': 'sqrt'}. Best is trial 17 with value: 0.7776548439240741.
[I 2026-06-27 23:49:08,795] Trial 25 finished with value: 0.7744660207206395 and parameters: {'n_estimators': 100, 'max_depth': 8, 'min_samples_split': 14, 'min_samples_leaf': 11, 'max_features': 'log2'}. Best is trial 17 with value: 0.7776548439240741.
[I 2026-06-27 23:49:16,752] Trial 9 finished with value: 0.7769491993426767 and parameters: {'n_estimators': 250, 'max_depth': 10, 'min_samples_split': 7, 'min_samples_leaf': 12, 'max_features': 'sqrt'}. Best is trial 17 with value: 0.7776548439240741.
[I 2026-06-27 23:49:26,042] Trial 23 finished with value: 0.7759252476946706 and parameters: {'n_estimators': 200, 'max_depth': 8, 'min_samples_split': 16, 'min_samples_leaf': 11, 'max_features': 'log2'}. Best is trial 17 with value: 0.7776548439240741.
[I 2026-06-27 23:50:25,570] Trial 26 finished with value: 0.7744660207206395 and parameters: {'n_estimators': 100, 'max_depth': 8, 'min_samples_split': 14, 'min_samples_leaf': 11, 'max_features': 'log2'}. Best is trial 17 with value: 0.7776548439240741.
[I 2026-06-27 23:52:00,442] Trial 13 finished with value: 0.7773307843201172 and parameters: {'n_estimators': 300, 'max_depth': 6, 'min_samples_split': 9, 'min_samples_leaf': 14, 'max_features': 'sqrt'}. Best is trial 17 with value: 0.7776548439240741.
[I 2026-06-27 23:52:02,386] Trial 22 finished with value: 0.7771965584486558 and parameters: {'n_estimators': 250, 'max_depth': 10, 'min_samples_split': 12, 'min_samples_leaf': 11, 'max_features': 'log2'}. Best is trial 17 with value: 0.7776548439240741.
[I 2026-06-27 23:54:11,326] Trial 27 finished with value: 0.7778696053184125 and parameters: {'n_estimators': 200, 'max_depth': 8, 'min_samples_split': 15, 'min_samples_leaf': 12, 'max_features': 'log2'}. Best is trial 27 with value: 0.7778696053184125.
[I 2026-06-28 00:04:33,764] Trial 28 finished with value: 0.7762780699853694 and parameters: {'n_estimators': 200, 'max_depth': 5, 'min_samples_split': 14, 'min_samples_leaf': 12, 'max_features': 'sqrt'}. Best is trial 27 with value: 0.7778696053184125.
[I 2026-06-28 00:05:40,176] Trial 29 finished with value: 0.7749895016193392 and parameters: {'n_estimators': 200, 'max_depth': 5, 'min_samples_split': 16, 'min_samples_leaf': 13, 'max_features': 'sqrt'}. Best is trial 27 with value: 0.7778696053184125.
[I 2026-06-28 00:05:46,025] Trial 30 finished with value: 0.7749895016193392 and parameters: {'n_estimators': 200, 'max_depth': 5, 'min_samples_split': 16, 'min_samples_leaf': 13, 'max_features': 'sqrt'}. Best is trial 27 with value: 0.7778696053184125.
[I 2026-06-28 00:06:58,547] Trial 32 finished with value: 0.7749895016193392 and parameters: {'n_estimators': 200, 'max_depth': 5, 'min_samples_split': 10, 'min_samples_leaf': 13, 'max_features': 'sqrt'}. Best is trial 27 with value: 0.7778696053184125.
[I 2026-06-28 00:08:32,197] Trial 34 finished with value: 0.7749895016193392 and parameters: {'n_estimators': 200, 'max_depth': 5, 'min_samples_split': 16, 'min_samples_leaf': 13, 'max_features': 'sqrt'}. Best is trial 27 with value: 0.7778696053184125.
[I 2026-06-28 00:08:35,575] Trial 33 finished with value: 0.7749895016193392 and parameters: {'n_estimators': 200, 'max_depth': 5, 'min_samples_split': 6, 'min_samples_leaf': 13, 'max_features': 'sqrt'}. Best is trial 27 with value: 0.7778696053184125.
[I 2026-06-28 00:10:18,501] Trial 31 finished with value: 0.7773288668076678 and parameters: {'n_estimators': 200, 'max_depth': 7, 'min_samples_split': 10, 'min_samples_leaf': 13, 'max_features': 'sqrt'}. Best is trial 27 with value: 0.7778696053184125.
[I 2026-06-28 00:10:35,213] Trial 35 finished with value: 0.7749895016193392 and parameters: {'n_estimators': 200, 'max_depth': 5, 'min_samples_split': 16, 'min_samples_leaf': 13, 'max_features': 'sqrt'}. Best is trial 27 with value: 0.7778696053184125.
[I 2026-06-28 00:11:06,297] Trial 38 finished with value: 0.7773327018325666 and parameters: {'n_estimators': 150, 'max_depth': 7, 'min_samples_split': 6, 'min_samples_leaf': 9, 'max_features': 'log2'}. Best is trial 27 with value: 0.7778696053184125.
[I 2026-06-28 00:12:21,931] Trial 39 finished with value: 0.7773327018325666 and parameters: {'n_estimators': 150, 'max_depth': 7, 'min_samples_split': 18, 'min_samples_leaf': 9, 'max_features': 'log2'}. Best is trial 27 with value: 0.7778696053184125.
[I 2026-06-28 00:13:58,214] Trial 40 finished with value: 0.7769549518800251 and parameters: {'n_estimators': 150, 'max_depth': 7, 'min_samples_split': 6, 'min_samples_leaf': 8, 'max_features': 'log2'}. Best is trial 27 with value: 0.7778696053184125.
[I 2026-06-28 00:14:02,201] Trial 41 finished with value: 0.7773327018325666 and parameters: {'n_estimators': 150, 'max_depth': 7, 'min_samples_split': 18, 'min_samples_leaf': 9, 'max_features': 'log2'}. Best is trial 27 with value: 0.7778696053184125.
[I 2026-06-28 00:16:04,124] Trial 43 finished with value: 0.7779175431296488 and parameters: {'n_estimators': 150, 'max_depth': 7, 'min_samples_split': 13, 'min_samples_leaf': 10, 'max_features': 'log2'}. Best is trial 43 with value: 0.7779175431296488.
[I 2026-06-28 00:16:51,495] Trial 42 finished with value: 0.7779405532790422 and parameters: {'n_estimators': 150, 'max_depth': 9, 'min_samples_split': 13, 'min_samples_leaf': 9, 'max_features': 'log2'}. Best is trial 42 with value: 0.7779405532790422.
[I 2026-06-28 00:17:33,451] Trial 44 finished with value: 0.7779405532790422 and parameters: {'n_estimators': 150, 'max_depth': 9, 'min_samples_split': 13, 'min_samples_leaf': 9, 'max_features': 'log2'}. Best is trial 42 with value: 0.7779405532790422.
[I 2026-06-28 00:18:55,467] Trial 45 finished with value: 0.7756932286882873 and parameters: {'n_estimators': 150, 'max_depth': 9, 'min_samples_split': 13, 'min_samples_leaf': 8, 'max_features': 'log2'}. Best is trial 42 with value: 0.7779405532790422.
[I 2026-06-28 00:20:12,257] Trial 36 finished with value: 0.7756702185388938 and parameters: {'n_estimators': 150, 'max_depth': 7, 'min_samples_split': 16, 'min_samples_leaf': 13, 'max_features': 'sqrt'}. Best is trial 42 with value: 0.7779405532790422.
[I 2026-06-28 00:20:18,360] Trial 46 finished with value: 0.7760652261034805 and parameters: {'n_estimators': 150, 'max_depth': 9, 'min_samples_split': 13, 'min_samples_leaf': 10, 'max_features': 'log2'}. Best is trial 42 with value: 0.7779405532790422.
[I 2026-06-28 00:21:43,915] Trial 37 finished with value: 0.7771064353635316 and parameters: {'n_estimators': 150, 'max_depth': 7, 'min_samples_split': 18, 'min_samples_leaf': 9, 'max_features': 'sqrt'}. Best is trial 42 with value: 0.7779405532790422.
[I 2026-06-28 00:21:50,158] Trial 50 finished with value: 0.7733001731513742 and parameters: {'n_estimators': 100, 'max_depth': 9, 'min_samples_split': 13, 'min_samples_leaf': 8, 'max_features': 'log2'}. Best is trial 42 with value: 0.7779405532790422.
[I 2026-06-28 00:22:16,943] Trial 48 finished with value: 0.7760652261034805 and parameters: {'n_estimators': 150, 'max_depth': 9, 'min_samples_split': 13, 'min_samples_leaf': 10, 'max_features': 'log2'}. Best is trial 42 with value: 0.7779405532790422.
[I 2026-06-28 00:22:49,268] Trial 51 finished with value: 0.7736376553424773 and parameters: {'n_estimators': 100, 'max_depth': 8, 'min_samples_split': 13, 'min_samples_leaf': 10, 'max_features': 'log2'}. Best is trial 42 with value: 0.7779405532790422.
[I 2026-06-28 00:23:01,073] Trial 49 finished with value: 0.7760652261034805 and parameters: {'n_estimators': 150, 'max_depth': 9, 'min_samples_split': 13, 'min_samples_leaf': 10, 'max_features': 'log2'}. Best is trial 42 with value: 0.7779405532790422.
[I 2026-06-28 00:24:07,189] Trial 52 finished with value: 0.7736376553424773 and parameters: {'n_estimators': 100, 'max_depth': 8, 'min_samples_split': 15, 'min_samples_leaf': 10, 'max_features': 'log2'}. Best is trial 42 with value: 0.7779405532790422.
[I 2026-06-28 00:24:11,840] Trial 53 finished with value: 0.7736376553424773 and parameters: {'n_estimators': 100, 'max_depth': 8, 'min_samples_split': 15, 'min_samples_leaf': 10, 'max_features': 'log2'}. Best is trial 42 with value: 0.7779405532790422.
[I 2026-06-28 00:24:58,516] Trial 57 finished with value: 0.7772272386478469 and parameters: {'n_estimators': 50, 'max_depth': 8, 'min_samples_split': 15, 'min_samples_leaf': 7, 'max_features': 'log2'}. Best is trial 42 with value: 0.7779405532790422.
[I 2026-06-28 00:25:36,902] Trial 54 finished with value: 0.7736376553424773 and parameters: {'n_estimators': 100, 'max_depth': 8, 'min_samples_split': 15, 'min_samples_leaf': 10, 'max_features': 'log2'}. Best is trial 42 with value: 0.7779405532790422.
[I 2026-06-28 00:25:42,259] Trial 55 finished with value: 0.7736376553424773 and parameters: {'n_estimators': 100, 'max_depth': 8, 'min_samples_split': 15, 'min_samples_leaf': 10, 'max_features': 'log2'}. Best is trial 42 with value: 0.7779405532790422.
[I 2026-06-28 00:26:10,820] Trial 56 finished with value: 0.7736376553424773 and parameters: {'n_estimators': 100, 'max_depth': 8, 'min_samples_split': 15, 'min_samples_leaf': 10, 'max_features': 'log2'}. Best is trial 42 with value: 0.7779405532790422.
[I 2026-06-28 00:26:48,222] Trial 47 finished with value: 0.77756472083895 and parameters: {'n_estimators': 300, 'max_depth': 9, 'min_samples_split': 13, 'min_samples_leaf': 8, 'max_features': 'log2'}. Best is trial 42 with value: 0.7779405532790422.
[I 2026-06-28 00:29:02,300] Trial 58 finished with value: 0.7786538679102374 and parameters: {'n_estimators': 150, 'max_depth': 8, 'min_samples_split': 15, 'min_samples_leaf': 7, 'max_features': 'log2'}. Best is trial 58 with value: 0.7786538679102374.
[I 2026-06-28 00:30:11,595] Trial 59 finished with value: 0.7775321231273093 and parameters: {'n_estimators': 150, 'max_depth': 8, 'min_samples_split': 8, 'min_samples_leaf': 7, 'max_features': 'log2'}. Best is trial 58 with value: 0.7786538679102374.
[I 2026-06-28 00:31:10,211] Trial 60 finished with value: 0.7759425053067157 and parameters: {'n_estimators': 150, 'max_depth': 10, 'min_samples_split': 15, 'min_samples_leaf': 7, 'max_features': 'log2'}. Best is trial 58 with value: 0.7786538679102374.
[I 2026-06-28 00:31:52,231] Trial 61 finished with value: 0.7732349777280929 and parameters: {'n_estimators': 150, 'max_depth': 10, 'min_samples_split': 8, 'min_samples_leaf': 7, 'max_features': 'log2'}. Best is trial 58 with value: 0.7786538679102374.
[I 2026-06-28 00:32:07,887] Trial 62 finished with value: 0.7771217754631272 and parameters: {'n_estimators': 150, 'max_depth': 10, 'min_samples_split': 8, 'min_samples_leaf': 12, 'max_features': 'log2'}. Best is trial 58 with value: 0.7786538679102374.
[I 2026-06-28 00:32:45,339] Trial 64 finished with value: 0.7771217754631272 and parameters: {'n_estimators': 150, 'max_depth': 10, 'min_samples_split': 11, 'min_samples_leaf': 12, 'max_features': 'log2'}. Best is trial 58 with value: 0.7786538679102374.
[I 2026-06-28 00:33:10,309] Trial 65 finished with value: 0.776352852970898 and parameters: {'n_estimators': 150, 'max_depth': 10, 'min_samples_split': 8, 'min_samples_leaf': 14, 'max_features': 'log2'}. Best is trial 58 with value: 0.7786538679102374.
[I 2026-06-28 00:34:02,486] Trial 63 finished with value: 0.7759674329685585 and parameters: {'n_estimators': 200, 'max_depth': 10, 'min_samples_split': 8, 'min_samples_leaf': 14, 'max_features': 'log2'}. Best is trial 58 with value: 0.7786538679102374.
[I 2026-06-28 00:35:30,611] Trial 66 finished with value: 0.7743682275857176 and parameters: {'n_estimators': 200, 'max_depth': 6, 'min_samples_split': 17, 'min_samples_leaf': 7, 'max_features': 'log2'}. Best is trial 58 with value: 0.7786538679102374.
[I 2026-06-28 00:36:44,521] Trial 67 finished with value: 0.7754324469951621 and parameters: {'n_estimators': 200, 'max_depth': 6, 'min_samples_split': 12, 'min_samples_leaf': 6, 'max_features': 'log2'}. Best is trial 58 with value: 0.7786538679102374.
[I 2026-06-28 00:37:29,492] Trial 68 finished with value: 0.7752119330634755 and parameters: {'n_estimators': 200, 'max_depth': 6, 'min_samples_split': 12, 'min_samples_leaf': 14, 'max_features': 'log2'}. Best is trial 58 with value: 0.7786538679102374.
[I 2026-06-28 00:38:28,833] Trial 69 finished with value: 0.7738562517617146 and parameters: {'n_estimators': 200, 'max_depth': 6, 'min_samples_split': 17, 'min_samples_leaf': 4, 'max_features': 'log2'}. Best is trial 58 with value: 0.7786538679102374.
[I 2026-06-28 00:38:40,605] Trial 70 finished with value: 0.7745944940547527 and parameters: {'n_estimators': 200, 'max_depth': 6, 'min_samples_split': 17, 'min_samples_leaf': 6, 'max_features': 'log2'}. Best is trial 58 with value: 0.7786538679102374.
[I 2026-06-28 00:39:18,573] Trial 71 finished with value: 0.7745944940547527 and parameters: {'n_estimators': 200, 'max_depth': 6, 'min_samples_split': 17, 'min_samples_leaf': 6, 'max_features': 'log2'}. Best is trial 58 with value: 0.7786538679102374.
[I 2026-06-28 00:39:46,945] Trial 72 finished with value: 0.7748130904739899 and parameters: {'n_estimators': 200, 'max_depth': 6, 'min_samples_split': 12, 'min_samples_leaf': 5, 'max_features': 'log2'}. Best is trial 58 with value: 0.7786538679102374.
[I 2026-06-28 00:40:36,845] Trial 73 finished with value: 0.7754324469951621 and parameters: {'n_estimators': 200, 'max_depth': 6, 'min_samples_split': 12, 'min_samples_leaf': 6, 'max_features': 'log2'}. Best is trial 58 with value: 0.7786538679102374.
[I 2026-06-28 00:44:34,627] Trial 74 finished with value: 0.7775321231273093 and parameters: {'n_estimators': 200, 'max_depth': 9, 'min_samples_split': 12, 'min_samples_leaf': 4, 'max_features': 'log2'}. Best is trial 58 with value: 0.7786538679102374.
[I 2026-06-28 00:56:36,204] Trial 77 finished with value: 0.7756893936633884 and parameters: {'n_estimators': 150, 'max_depth': 9, 'min_samples_split': 14, 'min_samples_leaf': 15, 'max_features': 'sqrt'}. Best is trial 58 with value: 0.7786538679102374.
[I 2026-06-28 01:03:27,316] Trial 75 finished with value: 0.7737373659898487 and parameters: {'n_estimators': 200, 'max_depth': 9, 'min_samples_split': 14, 'min_samples_leaf': 6, 'max_features': 'sqrt'}. Best is trial 58 with value: 0.7786538679102374.
[I 2026-06-28 01:04:30,682] Trial 76 finished with value: 0.774958821420148 and parameters: {'n_estimators': 200, 'max_depth': 9, 'min_samples_split': 14, 'min_samples_leaf': 5, 'max_features': 'sqrt'}. Best is trial 58 with value: 0.7786538679102374.
[I 2026-06-28 01:09:04,143] Trial 84 finished with value: 0.7720000997106474 and parameters: {'n_estimators': 300, 'max_depth': 3, 'min_samples_split': 11, 'min_samples_leaf': 9, 'max_features': 'log2'}. Best is trial 58 with value: 0.7786538679102374.
[I 2026-06-28 01:10:09,115] Trial 85 finished with value: 0.7720058522479957 and parameters: {'n_estimators': 300, 'max_depth': 3, 'min_samples_split': 10, 'min_samples_leaf': 8, 'max_features': 'log2'}. Best is trial 58 with value: 0.7786538679102374.
[I 2026-06-28 01:12:33,093] Trial 80 finished with value: 0.7754765497814995 and parameters: {'n_estimators': 250, 'max_depth': 9, 'min_samples_split': 14, 'min_samples_leaf': 8, 'max_features': 'sqrt'}. Best is trial 58 with value: 0.7786538679102374.
[I 2026-06-28 01:17:38,176] Trial 78 finished with value: 0.7755494152545785 and parameters: {'n_estimators': 300, 'max_depth': 9, 'min_samples_split': 11, 'min_samples_leaf': 8, 'max_features': 'sqrt'}. Best is trial 58 with value: 0.7786538679102374.
[I 2026-06-28 01:18:08,192] Trial 79 finished with value: 0.7755494152545785 and parameters: {'n_estimators': 300, 'max_depth': 9, 'min_samples_split': 14, 'min_samples_leaf': 8, 'max_features': 'sqrt'}. Best is trial 58 with value: 0.7786538679102374.
[I 2026-06-28 01:18:32,340] Trial 88 finished with value: 0.7775321231273093 and parameters: {'n_estimators': 150, 'max_depth': 8, 'min_samples_split': 7, 'min_samples_leaf': 7, 'max_features': 'log2'}. Best is trial 58 with value: 0.7786538679102374.
