[I 2026-06-08 20:42:59,420] Trial 1 finished with value: 0.759680121097162 and parameters: {'num_nodes': [128], 'dropout': 0.05510734722910491, 'learning_rate': 0.002875925265345302, 'batch_norm': False}. Best is trial 3 with value: 0.774498178649546.
/scratch.hpc/luca.cotugno/Foundation_model_clinical_data/test_tabular_model_tmp.py:476: UserWarning: Choices for a categorical distribution should be a tuple of None, bool, int, float and str for persistent storage but contains [32] which is of type list.
  num_nodes  = trial.suggest_categorical("num_nodes", [[32], [64], [128], [64, 32], [128, 64]])
/scratch.hpc/luca.cotugno/Foundation_model_clinical_data/test_tabular_model_tmp.py:476: UserWarning: Choices for a categorical distribution should be a tuple of None, bool, int, float and str for persistent storage but contains [64] which is of type list.
  num_nodes  = trial.suggest_categorical("num_nodes", [[32], [64], [128], [64, 32], [128, 64]])
/scratch.hpc/luca.cotugno/Foundation_model_clinical_data/test_tabular_model_tmp.py:476: UserWarning: Choices for a categorical distribution should be a tuple of None, bool, int, float and str for persistent storage but contains [128] which is of type list.
  num_nodes  = trial.suggest_categorical("num_nodes", [[32], [64], [128], [64, 32], [128, 64]])
/scratch.hpc/luca.cotugno/Foundation_model_clinical_data/test_tabular_model_tmp.py:476: UserWarning: Choices for a categorical distribution should be a tuple of None, bool, int, float and str for persistent storage but contains [64, 32] which is of type list.
  num_nodes  = trial.suggest_categorical("num_nodes", [[32], [64], [128], [64, 32], [128, 64]])
/scratch.hpc/luca.cotugno/Foundation_model_clinical_data/test_tabular_model_tmp.py:476: UserWarning: Choices for a categorical distribution should be a tuple of None, bool, int, float and str for persistent storage but contains [128, 64] which is of type list.
  num_nodes  = trial.suggest_categorical("num_nodes", [[32], [64], [128], [64, 32], [128, 64]])
STARTED  model=tabicl  seed=789  tuning=True  shap=False


Preprocess: Replace NaN with -1
Loading existing folds from tmp/splits/OrmoniTirodei_seed789.pkl
X_train shape: (5161, 76), X_test shape: (1291, 76)
Generating TABICL Embeddings...
Warming up TabICL model (triggering checkpoint load)...
ARRIVATO QUI 1
Loading TabICL model checkpoint 'tabicl-classifier-v1.1-0506.ckpt'...
ARRIVATO QUI
Performing dummy prediction to ensure model is loaded...
Warming up TabICL model (triggering checkpoint load)...
ARRIVATO QUI 1
Loading TabICL model checkpoint 'tabicl-classifier-v1.1-0506.ckpt'...
ARRIVATO QUI
Performing dummy prediction to ensure model is loaded...
Successfully generated embeddings with shape: (5161, 512)
  [ckpt] Loading TABICL DeepSurv Tuned from checkpoints/tabicl/OrmoniTirodei/-1/seed789/fold1
C-index train: 0.9174
C-index test:  0.7440
  [ckpt] Loading TABICL RSF Tuned from checkpoints/tabicl/OrmoniTirodei/-1/seed789/fold1
C-index train: 0.9516
C-index test:  0.7361
  [ckpt] Loading DeepSurv Simple from checkpoints/tabicl/OrmoniTirodei/-1/seed789/fold1/tabicl_deepsurv_simple.pt
C-index TRAIN: 0.9265
C-index TEST:  0.7326
  [ckpt] Loading DeepSurv Vanilla from checkpoints/tabicl/OrmoniTirodei/-1/seed789/fold1/tabicl_deepsurv_vanilla.pt
C-index TRAIN: 0.9231
C-index TEST:  0.7367
  [ckpt] Loading TABICL RSF from checkpoints/tabicl/OrmoniTirodei/-1/seed789/fold1/tabicl_rsf.pkl
C-index train: 0.9646
C-index test:  0.7324
  [ckpt] Loading TABICL Cox (embedding) from checkpoints/tabicl/OrmoniTirodei/-1/seed789/fold1/tabicl_tab_cox.pkl
C-index train: 0.9277
C-index test:  0.7478
  [ckpt] Loading DeepSurv Vanilla baseline from checkpoints/tabicl/OrmoniTirodei/-1/seed789/fold1/deepsurv_vanilla_baseline.pt
C-index TRAIN: 0.8016
C-index TEST:  0.7913
  [ckpt] Loading DeepSurv Simple baseline from checkpoints/tabicl/OrmoniTirodei/-1/seed789/fold1/deepsurv_simple_baseline.pt
C-index TRAIN: 0.7902
C-index TEST:  0.7799
  [ckpt] Loading RSF baseline from checkpoints/tabicl/OrmoniTirodei/-1/seed789/fold1/rsf_baseline.pkl
C-index train: 0.9077
C-index test:  0.7904
  [ckpt] Loading Cox baseline from checkpoints/tabicl/OrmoniTirodei/-1/seed789/fold1/tabicl_cox.pkl
C-index train: 0.8016
C-index test:  0.7899
X_train shape: (5161, 76), X_test shape: (1291, 76)
Generating TABICL Embeddings...
Warming up TabICL model (triggering checkpoint load)...
ARRIVATO QUI 1
Loading TabICL model checkpoint 'tabicl-classifier-v1.1-0506.ckpt'...
ARRIVATO QUI
Performing dummy prediction to ensure model is loaded...
Warming up TabICL model (triggering checkpoint load)...
ARRIVATO QUI 1
Loading TabICL model checkpoint 'tabicl-classifier-v1.1-0506.ckpt'...
ARRIVATO QUI
Performing dummy prediction to ensure model is loaded...
Successfully generated embeddings with shape: (5161, 512)
  [ckpt] Loading TABICL DeepSurv Tuned from checkpoints/tabicl/OrmoniTirodei/-1/seed789/fold2
C-index train: 0.9160
C-index test:  0.7526
  [ckpt] Loading TABICL RSF Tuned from checkpoints/tabicl/OrmoniTirodei/-1/seed789/fold2
C-index train: 0.9626
C-index test:  0.7483
  [ckpt] Loading DeepSurv Simple from checkpoints/tabicl/OrmoniTirodei/-1/seed789/fold2/tabicl_deepsurv_simple.pt
C-index TRAIN: 0.9261
C-index TEST:  0.7520
  [ckpt] Loading DeepSurv Vanilla from checkpoints/tabicl/OrmoniTirodei/-1/seed789/fold2/tabicl_deepsurv_vanilla.pt
C-index TRAIN: 0.9240
C-index TEST:  0.7600
  [ckpt] Loading TABICL RSF from checkpoints/tabicl/OrmoniTirodei/-1/seed789/fold2/tabicl_rsf.pkl
C-index train: 0.9651
C-index test:  0.7491
  [ckpt] Loading TABICL Cox (embedding) from checkpoints/tabicl/OrmoniTirodei/-1/seed789/fold2/tabicl_tab_cox.pkl
C-index train: 0.9290
C-index test:  0.7545
  [ckpt] Loading DeepSurv Vanilla baseline from checkpoints/tabicl/OrmoniTirodei/-1/seed789/fold2/deepsurv_vanilla_baseline.pt
C-index TRAIN: 0.8056
C-index TEST:  0.7930
  [ckpt] Loading DeepSurv Simple baseline from checkpoints/tabicl/OrmoniTirodei/-1/seed789/fold2/deepsurv_simple_baseline.pt
C-index TRAIN: 0.7800
C-index TEST:  0.7865
  [ckpt] Loading RSF baseline from checkpoints/tabicl/OrmoniTirodei/-1/seed789/fold2/rsf_baseline.pkl
C-index train: 0.9079
C-index test:  0.7860
  [ckpt] Loading Cox baseline from checkpoints/tabicl/OrmoniTirodei/-1/seed789/fold2/tabicl_cox.pkl
C-index train: 0.7995
C-index test:  0.7954
X_train shape: (5162, 76), X_test shape: (1290, 76)
Generating TABICL Embeddings...
Warming up TabICL model (triggering checkpoint load)...
ARRIVATO QUI 1
Loading TabICL model checkpoint 'tabicl-classifier-v1.1-0506.ckpt'...
ARRIVATO QUI
Performing dummy prediction to ensure model is loaded...
Warming up TabICL model (triggering checkpoint load)...
ARRIVATO QUI 1
Loading TabICL model checkpoint 'tabicl-classifier-v1.1-0506.ckpt'...
ARRIVATO QUI
Performing dummy prediction to ensure model is loaded...
Successfully generated embeddings with shape: (5162, 512)
  [ckpt] Loading TABICL DeepSurv Tuned from checkpoints/tabicl/OrmoniTirodei/-1/seed789/fold3
C-index train: 0.9161
C-index test:  0.7481
  [ckpt] Loading TABICL RSF Tuned from checkpoints/tabicl/OrmoniTirodei/-1/seed789/fold3
C-index train: 0.9427
C-index test:  0.7437
  [ckpt] Loading DeepSurv Simple from checkpoints/tabicl/OrmoniTirodei/-1/seed789/fold3/tabicl_deepsurv_simple.pt
C-index TRAIN: 0.9199
C-index TEST:  0.7190
  [ckpt] Loading DeepSurv Vanilla from checkpoints/tabicl/OrmoniTirodei/-1/seed789/fold3/tabicl_deepsurv_vanilla.pt
C-index TRAIN: 0.9244
C-index TEST:  0.7447
  [ckpt] Loading TABICL RSF from checkpoints/tabicl/OrmoniTirodei/-1/seed789/fold3/tabicl_rsf.pkl
C-index train: 0.9648
C-index test:  0.7425
  [ckpt] Loading TABICL Cox (embedding) from checkpoints/tabicl/OrmoniTirodei/-1/seed789/fold3/tabicl_tab_cox.pkl
C-index train: 0.9260
C-index test:  0.7366
  [ckpt] Loading DeepSurv Vanilla baseline from checkpoints/tabicl/OrmoniTirodei/-1/seed789/fold3/deepsurv_vanilla_baseline.pt
C-index TRAIN: 0.8092
C-index TEST:  0.7890
  [ckpt] Loading DeepSurv Simple baseline from checkpoints/tabicl/OrmoniTirodei/-1/seed789/fold3/deepsurv_simple_baseline.pt
C-index TRAIN: 0.7688
C-index TEST:  0.7613
  [ckpt] Loading RSF baseline from checkpoints/tabicl/OrmoniTirodei/-1/seed789/fold3/rsf_baseline.pkl
C-index train: 0.9068
C-index test:  0.7919
  [ckpt] Loading Cox baseline from checkpoints/tabicl/OrmoniTirodei/-1/seed789/fold3/tabicl_cox.pkl
C-index train: 0.8004
C-index test:  0.7942
X_train shape: (5162, 76), X_test shape: (1290, 76)
Generating TABICL Embeddings...
Warming up TabICL model (triggering checkpoint load)...
ARRIVATO QUI 1
Loading TabICL model checkpoint 'tabicl-classifier-v1.1-0506.ckpt'...
ARRIVATO QUI
Performing dummy prediction to ensure model is loaded...
Warming up TabICL model (triggering checkpoint load)...
ARRIVATO QUI 1
Loading TabICL model checkpoint 'tabicl-classifier-v1.1-0506.ckpt'...
ARRIVATO QUI
Performing dummy prediction to ensure model is loaded...
Successfully generated embeddings with shape: (5162, 512)
  [ckpt] Loading TABICL DeepSurv Tuned from checkpoints/tabicl/OrmoniTirodei/-1/seed789/fold4
C-index train: 0.9233
C-index test:  0.7524
  [ckpt] Loading TABICL RSF Tuned from checkpoints/tabicl/OrmoniTirodei/-1/seed789/fold4
C-index train: 0.9541
C-index test:  0.7489
  [ckpt] Loading DeepSurv Simple from checkpoints/tabicl/OrmoniTirodei/-1/seed789/fold4/tabicl_deepsurv_simple.pt
C-index TRAIN: 0.9194
C-index TEST:  0.7399
  [ckpt] Loading DeepSurv Vanilla from checkpoints/tabicl/OrmoniTirodei/-1/seed789/fold4/tabicl_deepsurv_vanilla.pt
C-index TRAIN: 0.9235
C-index TEST:  0.7569
  [ckpt] Loading TABICL RSF from checkpoints/tabicl/OrmoniTirodei/-1/seed789/fold4/tabicl_rsf.pkl
C-index train: 0.9659
C-index test:  0.7515
  [ckpt] Loading TABICL Cox (embedding) from checkpoints/tabicl/OrmoniTirodei/-1/seed789/fold4/tabicl_tab_cox.pkl
C-index train: 0.9269
C-index test:  0.7528
  [ckpt] Loading DeepSurv Vanilla baseline from checkpoints/tabicl/OrmoniTirodei/-1/seed789/fold4/deepsurv_vanilla_baseline.pt
C-index TRAIN: 0.8017
C-index TEST:  0.7995
  [ckpt] Loading DeepSurv Simple baseline from checkpoints/tabicl/OrmoniTirodei/-1/seed789/fold4/deepsurv_simple_baseline.pt
C-index TRAIN: 0.7860
C-index TEST:  0.7865
  [ckpt] Loading RSF baseline from checkpoints/tabicl/OrmoniTirodei/-1/seed789/fold4/rsf_baseline.pkl
C-index train: 0.9091
C-index test:  0.8077
  [ckpt] Loading Cox baseline from checkpoints/tabicl/OrmoniTirodei/-1/seed789/fold4/tabicl_cox.pkl
C-index train: 0.7983
C-index test:  0.8027
X_train shape: (5162, 76), X_test shape: (1290, 76)
Generating TABICL Embeddings...
Warming up TabICL model (triggering checkpoint load)...
ARRIVATO QUI 1
Loading TabICL model checkpoint 'tabicl-classifier-v1.1-0506.ckpt'...
ARRIVATO QUI
Performing dummy prediction to ensure model is loaded...
Warming up TabICL model (triggering checkpoint load)...
ARRIVATO QUI 1
Loading TabICL model checkpoint 'tabicl-classifier-v1.1-0506.ckpt'...
ARRIVATO QUI
Performing dummy prediction to ensure model is loaded...
Successfully generated embeddings with shape: (5162, 512)
  [ckpt] Loading TABICL DeepSurv Tuned from checkpoints/tabicl/OrmoniTirodei/-1/seed789/fold5
C-index train: 0.9282
C-index test:  0.7371
  [ckpt] Loading TABICL RSF Tuned from checkpoints/tabicl/OrmoniTirodei/-1/seed789/fold5
C-index train: 0.9428
C-index test:  0.7267
  [ckpt] Loading DeepSurv Simple from checkpoints/tabicl/OrmoniTirodei/-1/seed789/fold5/tabicl_deepsurv_simple.pt
C-index TRAIN: 0.9176
C-index TEST:  0.7334
  [ckpt] Loading DeepSurv Vanilla from checkpoints/tabicl/OrmoniTirodei/-1/seed789/fold5/tabicl_deepsurv_vanilla.pt
C-index TRAIN: 0.9203
C-index TEST:  0.7382
  [ckpt] Loading TABICL RSF from checkpoints/tabicl/OrmoniTirodei/-1/seed789/fold5/tabicl_rsf.pkl
C-index train: 0.9669
C-index test:  0.7239
  [ckpt] Loading TABICL Cox (embedding) from checkpoints/tabicl/OrmoniTirodei/-1/seed789/fold5/tabicl_tab_cox.pkl
C-index train: 0.9266
C-index test:  0.7352
  [ckpt] Loading DeepSurv Vanilla baseline from checkpoints/tabicl/OrmoniTirodei/-1/seed789/fold5/deepsurv_vanilla_baseline.pt
C-index TRAIN: 0.8047
C-index TEST:  0.7849
  [ckpt] Loading DeepSurv Simple baseline from checkpoints/tabicl/OrmoniTirodei/-1/seed789/fold5/deepsurv_simple_baseline.pt
C-index TRAIN: 0.7966
C-index TEST:  0.7780
  [ckpt] Loading RSF baseline from checkpoints/tabicl/OrmoniTirodei/-1/seed789/fold5/rsf_baseline.pkl
C-index train: 0.9103
C-index test:  0.7930
  [ckpt] Loading Cox baseline from checkpoints/tabicl/OrmoniTirodei/-1/seed789/fold5/tabicl_cox.pkl
C-index train: 0.8033
C-index test:  0.7838


Preprocess: Keep NaN
Loading existing folds from tmp/splits/OrmoniTirodei_seed789.pkl
X_train shape: (5161, 76), X_test shape: (1291, 76)
Generating TABICL Embeddings...
Warming up TabICL model (triggering checkpoint load)...
ARRIVATO QUI 1
Loading TabICL model checkpoint 'tabicl-classifier-v1.1-0506.ckpt'...
ARRIVATO QUI
Performing dummy prediction to ensure model is loaded...
Warming up TabICL model (triggering checkpoint load)...
ARRIVATO QUI 1
Loading TabICL model checkpoint 'tabicl-classifier-v1.1-0506.ckpt'...
ARRIVATO QUI
Performing dummy prediction to ensure model is loaded...
Successfully generated embeddings with shape: (5161, 512)
  [ckpt] Loading TABICL DeepSurv Tuned from checkpoints/tabicl/OrmoniTirodei/NaN/seed789/fold1
C-index train: 0.9214
C-index test:  0.7538
  [ckpt] Loading TABICL RSF Tuned from checkpoints/tabicl/OrmoniTirodei/NaN/seed789/fold1
C-index train: 0.9600
C-index test:  0.7439
  [ckpt] Loading DeepSurv Simple from checkpoints/tabicl/OrmoniTirodei/NaN/seed789/fold1/tabicl_deepsurv_simple.pt
C-index TRAIN: 0.9234
C-index TEST:  0.7241
  [ckpt] Loading DeepSurv Vanilla from checkpoints/tabicl/OrmoniTirodei/NaN/seed789/fold1/tabicl_deepsurv_vanilla.pt
C-index TRAIN: 0.9211
C-index TEST:  0.7543
  [ckpt] Loading TABICL RSF from checkpoints/tabicl/OrmoniTirodei/NaN/seed789/fold1/tabicl_rsf.pkl
C-index train: 0.9626
C-index test:  0.7441
  [ckpt] Loading TABICL Cox (embedding) from checkpoints/tabicl/OrmoniTirodei/NaN/seed789/fold1/tabicl_tab_cox.pkl
C-index train: 0.9254
C-index test:  0.7422
X_train shape: (5161, 76), X_test shape: (1291, 76)
Generating TABICL Embeddings...
Warming up TabICL model (triggering checkpoint load)...
ARRIVATO QUI 1
Loading TabICL model checkpoint 'tabicl-classifier-v1.1-0506.ckpt'...
ARRIVATO QUI
Performing dummy prediction to ensure model is loaded...
Warming up TabICL model (triggering checkpoint load)...
ARRIVATO QUI 1
Loading TabICL model checkpoint 'tabicl-classifier-v1.1-0506.ckpt'...
ARRIVATO QUI
Performing dummy prediction to ensure model is loaded...
Successfully generated embeddings with shape: (5161, 512)
  [ckpt] Loading TABICL DeepSurv Tuned from checkpoints/tabicl/OrmoniTirodei/NaN/seed789/fold2
C-index train: 0.9097
C-index test:  0.7336
  [ckpt] Loading TABICL RSF Tuned from checkpoints/tabicl/OrmoniTirodei/NaN/seed789/fold2
C-index train: 0.9387
C-index test:  0.7414
  [ckpt] Loading DeepSurv Simple from checkpoints/tabicl/OrmoniTirodei/NaN/seed789/fold2/tabicl_deepsurv_simple.pt
C-index TRAIN: 0.9250
C-index TEST:  0.7485
  [ckpt] Loading DeepSurv Vanilla from checkpoints/tabicl/OrmoniTirodei/NaN/seed789/fold2/tabicl_deepsurv_vanilla.pt
C-index TRAIN: 0.9185
C-index TEST:  0.7443
  [ckpt] Loading TABICL RSF from checkpoints/tabicl/OrmoniTirodei/NaN/seed789/fold2/tabicl_rsf.pkl
C-index train: 0.9632
C-index test:  0.7396
  [ckpt] Loading TABICL Cox (embedding) from checkpoints/tabicl/OrmoniTirodei/NaN/seed789/fold2/tabicl_tab_cox.pkl
C-index train: 0.9267
C-index test:  0.7466
X_train shape: (5162, 76), X_test shape: (1290, 76)
Generating TABICL Embeddings...
Warming up TabICL model (triggering checkpoint load)...
ARRIVATO QUI 1
Loading TabICL model checkpoint 'tabicl-classifier-v1.1-0506.ckpt'...
ARRIVATO QUI
Performing dummy prediction to ensure model is loaded...
Warming up TabICL model (triggering checkpoint load)...
ARRIVATO QUI 1
Loading TabICL model checkpoint 'tabicl-classifier-v1.1-0506.ckpt'...
ARRIVATO QUI
Performing dummy prediction to ensure model is loaded...
Successfully generated embeddings with shape: (5162, 512)
  [ckpt] Loading TABICL DeepSurv Tuned from checkpoints/tabicl/OrmoniTirodei/NaN/seed789/fold3
C-index train: 0.9151
C-index test:  0.7453
  [ckpt] Loading TABICL RSF Tuned from checkpoints/tabicl/OrmoniTirodei/NaN/seed789/fold3
C-index train: 0.9450
C-index test:  0.7533
  [ckpt] Loading DeepSurv Simple from checkpoints/tabicl/OrmoniTirodei/NaN/seed789/fold3/tabicl_deepsurv_simple.pt
C-index TRAIN: 0.9204
C-index TEST:  0.7413
  [ckpt] Loading DeepSurv Vanilla from checkpoints/tabicl/OrmoniTirodei/NaN/seed789/fold3/tabicl_deepsurv_vanilla.pt
C-index TRAIN: 0.9231
C-index TEST:  0.7361
  [ckpt] Loading TABICL RSF from checkpoints/tabicl/OrmoniTirodei/NaN/seed789/fold3/tabicl_rsf.pkl
C-index train: 0.9629
C-index test:  0.7531
  [ckpt] Loading TABICL Cox (embedding) from checkpoints/tabicl/OrmoniTirodei/NaN/seed789/fold3/tabicl_tab_cox.pkl
C-index train: 0.9240
C-index test:  0.7384
X_train shape: (5162, 76), X_test shape: (1290, 76)
Generating TABICL Embeddings...
Warming up TabICL model (triggering checkpoint load)...
ARRIVATO QUI 1
Loading TabICL model checkpoint 'tabicl-classifier-v1.1-0506.ckpt'...
ARRIVATO QUI
Performing dummy prediction to ensure model is loaded...
Warming up TabICL model (triggering checkpoint load)...
ARRIVATO QUI 1
Loading TabICL model checkpoint 'tabicl-classifier-v1.1-0506.ckpt'...
ARRIVATO QUI
Performing dummy prediction to ensure model is loaded...
Successfully generated embeddings with shape: (5162, 512)
  [ckpt] Loading TABICL DeepSurv Tuned from checkpoints/tabicl/OrmoniTirodei/NaN/seed789/fold4
C-index train: 0.9186
C-index test:  0.7697
  [ckpt] Loading TABICL RSF Tuned from checkpoints/tabicl/OrmoniTirodei/NaN/seed789/fold4
C-index train: 0.9643
C-index test:  0.7681
  [ckpt] Loading DeepSurv Simple from checkpoints/tabicl/OrmoniTirodei/NaN/seed789/fold4/tabicl_deepsurv_simple.pt
C-index TRAIN: 0.9193
C-index TEST:  0.7616
  [ckpt] Loading DeepSurv Vanilla from checkpoints/tabicl/OrmoniTirodei/NaN/seed789/fold4/tabicl_deepsurv_vanilla.pt
C-index TRAIN: 0.9180
C-index TEST:  0.7693
  [ckpt] Loading TABICL RSF from checkpoints/tabicl/OrmoniTirodei/NaN/seed789/fold4/tabicl_rsf.pkl
C-index train: 0.9650
C-index test:  0.7698
  [ckpt] Loading TABICL Cox (embedding) from checkpoints/tabicl/OrmoniTirodei/NaN/seed789/fold4/tabicl_tab_cox.pkl
C-index train: 0.9247
C-index test:  0.7604
X_train shape: (5162, 76), X_test shape: (1290, 76)
Generating TABICL Embeddings...
Warming up TabICL model (triggering checkpoint load)...
ARRIVATO QUI 1
Loading TabICL model checkpoint 'tabicl-classifier-v1.1-0506.ckpt'...
ARRIVATO QUI
Performing dummy prediction to ensure model is loaded...
Warming up TabICL model (triggering checkpoint load)...
ARRIVATO QUI 1
Loading TabICL model checkpoint 'tabicl-classifier-v1.1-0506.ckpt'...
ARRIVATO QUI
Performing dummy prediction to ensure model is loaded...
Successfully generated embeddings with shape: (5162, 512)
  [ckpt] Loading TABICL DeepSurv Tuned from checkpoints/tabicl/OrmoniTirodei/NaN/seed789/fold5
C-index train: 0.9143
C-index test:  0.7300
  [ckpt] Loading TABICL RSF Tuned from checkpoints/tabicl/OrmoniTirodei/NaN/seed789/fold5
C-index train: 0.9474
C-index test:  0.7355
  [ckpt] Loading DeepSurv Simple from checkpoints/tabicl/OrmoniTirodei/NaN/seed789/fold5/tabicl_deepsurv_simple.pt
C-index TRAIN: 0.9210
C-index TEST:  0.7436
  [ckpt] Loading DeepSurv Vanilla from checkpoints/tabicl/OrmoniTirodei/NaN/seed789/fold5/tabicl_deepsurv_vanilla.pt
C-index TRAIN: 0.9162
C-index TEST:  0.7448
  [ckpt] Loading TABICL RSF from checkpoints/tabicl/OrmoniTirodei/NaN/seed789/fold5/tabicl_rsf.pkl
C-index train: 0.9641
C-index test:  0.7343
  [ckpt] Loading TABICL Cox (embedding) from checkpoints/tabicl/OrmoniTirodei/NaN/seed789/fold5/tabicl_tab_cox.pkl
C-index train: 0.9254
C-index test:  0.7376

  Preprocess: -1 | Seed: 789
  TABICL Train Tuned DeepSurv → mean: 0.920228 | std: 0.004822 | min: 0.916026 | max: 0.928249
  TABICL Test Tuned DeepSurv → mean: 0.746826 | std: 0.005779 | min: 0.737126 | max: 0.752553
  TABICL Train Tuned RSF → mean: 0.950749 | std: 0.007476 | min: 0.942713 | max: 0.962554
  TABICL Test Tuned RSF → mean: 0.740755 | std: 0.008377 | min: 0.726736 | max: 0.748927
  TABICL Train Vanilla → mean: 0.923052 | std: 0.001423 | min: 0.920331 | max: 0.924362
  TABICL Test Vanilla → mean: 0.747294 | std: 0.009536 | min: 0.736713 | max: 0.759975
  TABICL Train Simple → mean: 0.921918 | std: 0.003688 | min: 0.917603 | max: 0.926528
  TABICL Test Simple → mean: 0.735389 | std: 0.010715 | min: 0.719042 | max: 0.751964
  TABICL Train RSF → mean: 0.965437 | std: 0.000849 | min: 0.964566 | max: 0.966855
  TABICL Test RSF → mean: 0.739875 | std: 0.010402 | min: 0.723859 | max: 0.751524
  TABICL Train Cox → mean: 0.927255 | std: 0.001035 | min: 0.925999 | max: 0.928996
  TABICL Test Cox → mean: 0.745363 | std: 0.008045 | min: 0.735222 | max: 0.754462
  Train DeepSurv Vanilla → mean: 0.804569 | std: 0.002805 | min: 0.801619 | max: 0.809178
  Test DeepSurv Vanilla → mean: 0.791557 | std: 0.004820 | min: 0.784918 | max: 0.799513
  Train DeepSurv Simple → mean: 0.784336 | std: 0.009465 | min: 0.768797 | max: 0.796596
  Test DeepSurv Simple → mean: 0.778431 | std: 0.009232 | min: 0.761289 | max: 0.786521
  Train RSF  → mean: 0.908336 | std: 0.001237 | min: 0.906757 | max: 0.910304
  Test RSF   → mean: 0.793778 | std: 0.007340 | min: 0.785953 | max: 0.807657
  Train Cox  → mean: 0.800624 | std: 0.001737 | min: 0.798275 | max: 0.803311
  Test Cox   → mean: 0.793181 | std: 0.006248 | min: 0.783771 | max: 0.802659

  Preprocess: NaN | Seed: 789
  TABICL Train Tuned DeepSurv → mean: 0.915797 | std: 0.003982 | min: 0.909657 | max: 0.921368
  TABICL Test Tuned DeepSurv → mean: 0.746485 | std: 0.014352 | min: 0.730003 | max: 0.769677
  TABICL Train Tuned RSF → mean: 0.951080 | std: 0.00956