[I 2026-07-01 11:30:44,081] Trial 24 finished with value: 0.7483640399300764 and parameters: {'num_nodes': [64], 'dropout': 0.24575631802076492, 'learning_rate': 0.008435811655876434, 'batch_norm': False}. Best is trial 14 with value: 0.765014030729598.
/scratch.hpc/luca.cotugno/Foundation_model_clinical_data/test_tabular_model.py:481: UserWarning: Choices for a categorical distribution should be a tuple of None, bool, int, float and str for persistent storage but contains [32] which is of type list.
  num_nodes  = trial.suggest_categorical("num_nodes", [[32], [64], [128], [64, 32], [128, 64]])
/scratch.hpc/luca.cotugno/Foundation_model_clinical_data/test_tabular_model.py:481: UserWarning: Choices for a categorical distribution should be a tuple of None, bool, int, float and str for persistent storage but contains [64] which is of type list.
  num_nodes  = trial.suggest_categorical("num_nodes", [[32], [64], [128], [64, 32], [128, 64]])
/scratch.hpc/luca.cotugno/Foundation_model_clinical_data/test_tabular_model.py:481: UserWarning: Choices for a categorical distribution should be a tuple of None, bool, int, float and str for persistent storage but contains [128] which is of type list.
  num_nodes  = trial.suggest_categorical("num_nodes", [[32], [64], [128], [64, 32], [128, 64]])
/scratch.hpc/luca.cotugno/Foundation_model_clinical_data/test_tabular_model.py:481: UserWarning: Choices for a categorical distribution should be a tuple of None, bool, int, float and str for persistent storage but contains [64, 32] which is of type list.
  num_nodes  = trial.suggest_categorical("num_nodes", [[32], [64], [128], [64, 32], [128, 64]])
/scratch.hpc/luca.cotugno/Foundation_model_clinical_data/test_tabular_model.py:481: UserWarning: Choices for a categorical distribution should be a tuple of None, bool, int, float and str for persistent storage but contains [128, 64] which is of type list.
  num_nodes  = trial.suggest_categorical("num_nodes", [[32], [64], [128], [64, 32], [128, 64]])

48:	[0s / 10s],		train_loss: 4.0826
61:	[0s / 12s],		train_loss: 3.3260
82:	[0s / 12s],		train_loss: 3.7626
84:	[0s / 32s],		train_loss: 3.8694
49:	[0s / 10s],		train_loss: 4.0345
62:	[0s / 12s],		train_loss: 3.2876
83:	[0s / 12s],		train_loss: 3.7637
50:	[0s / 32s],		train_loss: 4.1648
84:	[0s / 12s],		train_loss: 3.7134
50:	[0s / 10s],		train_loss: 4.0192
63:	[0s / 12s],		train_loss: 3.3462
85:	[0s / 12s],		train_loss: 3.7173
85:	[0s / 32s],		train_loss: 3.8892
51:	[0s / 11s],		train_loss: 4.0259
64:	[0s / 13s],		train_loss: 3.3533
21:	[0s / 32s],		train_loss: 4.2207
86:	[0s / 13s],		train_loss: 3.7229
86:	[0s / 32s],		train_loss: 3.8733
87:	[0s / 13s],		train_loss: 3.7143
52:	[0s / 11s],		train_loss: 4.0290
65:	[0s / 13s],		train_loss: 3.2967
51:	[0s / 32s],		train_loss: 4.1493
88:	[0s / 13s],		train_loss: 3.7519
66:	[0s / 13s],		train_loss: 3.2668
53:	[0s / 11s],		train_loss: 3.9984
89:	[0s / 13s],		train_loss: 3.7064
87:	[0s / 33s],		train_loss: 3.8041
67:	[0s / 13s],		train_loss: 3.3010
54:	[0s / 11s],		train_loss: 3.9961
90:	[0s / 13s],		train_loss: 3.7169
52:	[0s / 33s],		train_loss: 4.1547
91:	[0s / 13s],		train_loss: 3.7082
88:	[0s / 33s],		train_loss: 3.8026
68:	[0s / 13s],		train_loss: 3.2809
55:	[0s / 11s],		train_loss: 4.0222
92:	[0s / 13s],		train_loss: 3.6717
69:	[0s / 14s],		train_loss: 3.2466
56:	[0s / 12s],		train_loss: 4.0091
22:	[1s / 33s],		train_loss: 4.1952
93:	[0s / 14s],		train_loss: 3.7418
89:	[0s / 33s],		train_loss: 3.8659
70:	[0s / 14s],		train_loss: 3.3491
57:	[0s / 12s],		train_loss: 3.9969
94:	[0s / 14s],		train_loss: 3.7921
15:	[2s / 34s],		train_loss: 4.1687
53:	[0s / 34s],		train_loss: 4.1831
95:	[0s / 14s],		train_loss: 3.6932
90:	[0s / 34s],		train_loss: 3.8519
71:	[0s / 14s],		train_loss: 3.2644
58:	[0s / 12s],		train_loss: 4.0525
96:	[0s / 14s],		train_loss: 3.7207
72:	[0s / 14s],		train_loss: 3.2389
59:	[0s / 12s],		train_loss: 3.9826
91:	[0s / 34s],		train_loss: 3.8273
97:	[0s / 14s],		train_loss: 3.6706
73:	[0s / 14s],		train_loss: 3.2595
98:	[0s / 14s],		train_loss: 3.6588
60:	[0s / 12s],		train_loss: 3.9941
54:	[0s / 34s],		train_loss: 4.1577
99:	[0s / 15s],		train_loss: 3.7014
23:	[1s / 34s],		train_loss: 4.1782
92:	[0s / 34s],		train_loss: 3.8168
61:	[0s / 13s],		train_loss: 3.9789
74:	[0s / 15s],		train_loss: 3.2144
75:	[0s / 15s],		train_loss: 3.3317
62:	[0s / 13s],		train_loss: 4.0040
93:	[0s / 35s],		train_loss: 3.8284
0:	[0s / 0s],		train_loss: 4.8553
76:	[0s / 15s],		train_loss: 3.2486
63:	[0s / 13s],		train_loss: 3.9352
1:	[0s / 0s],		train_loss: 4.6705
77:	[0s / 15s],		train_loss: 3.2422
94:	[0s / 35s],		train_loss: 3.8515
64:	[0s / 13s],		train_loss: 3.9474
55:	[0s / 35s],		train_loss: 4.1788
2:	[0s / 0s],		train_loss: 4.5676
78:	[0s / 15s],		train_loss: 3.1928
65:	[0s / 13s],		train_loss: 3.9507
3:	[0s / 0s],		train_loss: 4.5711
12:	[3s / 35s],		train_loss: 4.4162
79:	[0s / 16s],		train_loss: 3.2487
95:	[0s / 35s],		train_loss: 3.7777
66:	[0s / 14s],		train_loss: 3.9063
4:	[0s / 0s],		train_loss: 4.5956
80:	[0s / 16s],		train_loss: 3.1992
5:	[0s / 1s],		train_loss: 4.5282
67:	[0s / 14s],		train_loss: 3.9386
24:	[1s / 35s],		train_loss: 4.1796
81:	[0s / 16s],		train_loss: 3.1901
6:	[0s / 1s],		train_loss: 4.5341
56:	[0s / 36s],		train_loss: 4.1871
96:	[0s / 36s],		train_loss: 3.8257
68:	[0s / 14s],		train_loss: 3.9441
82:	[0s / 16s],		train_loss: 3.1862
16:	[2s / 36s],		train_loss: 4.1704
7:	[0s / 1s],		train_loss: 4.4732
69:	[0s / 14s],		train_loss: 3.9266
83:	[0s / 16s],		train_loss: 3.2129
8:	[0s / 1s],		train_loss: 4.4780
97:	[0s / 36s],		train_loss: 3.8191
70:	[0s / 14s],		train_loss: 3.9333
84:	[0s / 16s],		train_loss: 3.1424
9:	[0s / 1s],		train_loss: 4.4944
71:	[0s / 15s],		train_loss: 3.8849
85:	[0s / 17s],		train_loss: 3.1628
57:	[0s / 36s],		train_loss: 4.1233
10:	[0s / 1s],		train_loss: 4.4286
98:	[0s / 36s],		train_loss: 3.8306
86:	[0s / 17s],		train_loss: 3.0845
11:	[0s / 2s],		train_loss: 4.4371
72:	[0s / 15s],		train_loss: 3.8838
25:	[1s / 37s],		train_loss: 4.1875
87:	[0s / 17s],		train_loss: 3.0891
12:	[0s / 2s],		train_loss: 4.4247
73:	[0s / 15s],		train_loss: 3.9073
99:	[0s / 37s],		train_loss: 3.8049
88:	[0s / 17s],		train_loss: 3.1039
13:	[0s / 2s],		train_loss: 4.4160
74:	[0s / 15s],		train_loss: 3.8860
58:	[0s / 37s],		train_loss: 4.1403
89:	[0s / 17s],		train_loss: 3.1920
14:	[0s / 2s],		train_loss: 4.4082
75:	[0s / 16s],		train_loss: 3.8987
15:	[0s / 2s],		train_loss: 4.4208
90:	[0s / 18s],		train_loss: 3.2924
0:	[0s / 0s],		train_loss: 4.5178
76:	[0s / 16s],		train_loss: 3.8789
16:	[0s / 2s],		train_loss: 4.3718
91:	[0s / 18s],		train_loss: 3.2007
77:	[0s / 16s],		train_loss: 3.8670
17:	[0s / 3s],		train_loss: 4.4019
92:	[0s / 18s],		train_loss: 3.1817
59:	[0s / 38s],		train_loss: 4.0937
1:	[0s / 0s],		train_loss: 4.3531
26:	[1s / 38s],		train_loss: 4.1712
78:	[0s / 16s],		train_loss: 3.8444
18:	[0s / 3s],		train_loss: 4.3604
93:	[0s / 18s],		train_loss: 3.1283
79:	[0s / 16s],		train_loss: 3.8680
19:	[0s / 3s],		train_loss: 4.3780
94:	[0s / 18s],		train_loss: 3.1451
2:	[0s / 1s],		train_loss: 4.3143
80:	[0s / 16s],		train_loss: 3.8754
20:	[0s / 3s],		train_loss: 4.3802
95:	[0s / 18s],		train_loss: 3.0933
17:	[2s / 38s],		train_loss: 4.1673
81:	[0s / 17s],		train_loss: 3.8528
21:	[0s / 3s],		train_loss: 4.3609
96:	[0s / 19s],		train_loss: 3.0927
60:	[0s / 38s],		train_loss: 4.1102
22:	[0s / 4s],		train_loss: 4.3395
3:	[0s / 1s],		train_loss: 4.3105
82:	[0s / 17s],		train_loss: 3.8502
97:	[0s / 19s],		train_loss: 3.1050
23:	[0s / 4s],		train_loss: 4.3488
83:	[0s / 17s],		train_loss: 3.7937
98:	[0s / 19s],		train_loss: 3.1441
24:	[0s / 4s],		train_loss: 4.3476
4:	[0s / 1s],		train_loss: 4.3122
84:	[0s / 17s],		train_loss: 3.8592
99:	[0s / 19s],		train_loss: 3.1169
27:	[1s / 39s],		train_loss: 4.2041
61:	[0s / 39s],		train_loss: 4.1006
25:	[0s / 4s],		train_loss: 4.3326
85:	[0s / 17s],		train_loss: 3.8505
5:	[0s / 2s],		train_loss: 4.2930
26:	[0s / 4s],		train_loss: 4.3304
0:	[0s / 0s],		train_loss: 4.6278
86:	[0s / 18s],		train_loss: 3.8065
27:	[0s / 4s],		train_loss: 4.3311
1:	[0s / 0s],		train_loss: 4.4482
87:	[0s / 18s],		train_loss: 3.8747
6:	[0s / 2s],		train_loss: 4.2866
28:	[0s / 5s],		train_loss: 4.3036
2:	[0s / 0s],		train_loss: 4.3935
62:	[0s / 40s],		train_loss: 4.1400
88:	[0s / 18s],		train_loss: 3.8115
29:	[0s / 5s],		train_loss: 4.3187
3:	[0s / 0s],		train_loss: 4.3903
89:	[0s / 18s],		train_loss: 3.8140
7:	[0s / 3s],		train_loss: 4.2796
30:	[0s / 5s],		train_loss: 4.3216
4:	[0s / 0s],		train_loss: 4.3513
13:	[4s / 40s],		train_loss: 4.3827
90:	[0s / 18s],		train_loss: 3.8403
31:	[0s / 5s],		train_loss: 4.2994
28:	[1s / 40s],		train_loss: 4.1327
5:	[0s / 1s],		train_loss: 4.3412
8:	[0s / 3s],		train_loss: 4.2810
32:	[0s / 5s],		train_loss: 4.3158
91:	[0s / 19s],		train_loss: 3.7920
6:	[0s / 1s],		train_loss: 4.3288
63:	[0s / 40s],		train_loss: 4.0996
33:	[0s / 5s],		train_loss: 4.2994
92:	[0s / 19s],		train_loss: 3.8053
7:	[0s / 1s],		train_loss: 4.2875
34:	[0s / 6s],		train_loss: 4.2891
9:	[0s / 3s],		train_loss: 4.2639
8:	[0s / 1s],		train_loss: 4.2811
93:	[0s / 19s],		train_loss: 3.8150
35:	[0s / 6s],		train_loss: 4.2575
9:	[0s / 1s],		train_loss: 4.2916
94:	[0s / 19s],		train_loss: 3.7807
10:	[0s / 3s],		train_loss: 4.2575
36:	[0s / 6s],		train_loss: 4.2809
18:	[2s / 41s],		train_loss: 4.1214
10:	[0s / 1s],		train_loss: 4.2765
64:	[0s / 41s],		train_loss: 4.0741
95:	[0s / 19s],		train_loss: 3.7964
37:	[0s / 6s],		train_loss: 4.2874
11:	[0s / 2s],		train_loss: 4.2434
11:	[0s / 4s],		train_loss: 4.2633
96:	[0s / 20s],		train_loss: 3.7881
38:	[0s / 6s],		train_loss: 4.2926
29:	[1s / 41s],		train_loss: 4.1366
12:	[0s / 2s],		train_loss: 4.2357
97:	[0s / 20s],		train_loss: 3.7307
39:	[0s / 7s],		train_loss: 4.2552
13:	[0s / 2s],		train_loss: 4.2523
12:	[0s / 4s],		train_loss: 4.2493
98:	[0s / 20s],		train_loss: 3.7794
40:	[0s / 7s],		train_loss: 4.2617
65:	[0s / 42s],		train_loss: 4.1522
14:	[0s / 2s],		train_loss: 4.2273
41:	[0s / 7s],		train_loss: 4.2457
99:	[0s / 20s],		train_loss: 3.7261
15:	[0s / 2s],		train_loss: 4.1924
13:	[0s / 5s],		train_loss: 4.2771
42:	[0s / 7s],		train_loss: 4.2607
16:	[0s / 3s],		train_loss: 4.1932
43:	[0s / 7s],		train_loss: 4.2754
0:	[0s / 0s],		train_loss: 5.4315
17:	[0s / 3s],		train_loss: 4.2011
44:	[0s / 7s],		train_loss: 4.2570
1:	[0s / 0s],		train_loss: 4.9017
66:	[0s / 42s],		train_loss: 4.1135
14:	[0s / 5s],		train_loss: 4.2708
18:	[0s / 3s],		train_loss: 4.2077
45:	[0s / 8s],		train_loss: 4.2558
2:	[0s / 0s],		train_loss: 4.6728
30:	[1s / 43s],		train_loss: 4.1873
19:	[0s / 3s],		train_loss: 4.1731
46:	[0s / 8s],		train_loss: 4.2746
3:	[0s / 0s],		train_loss: 4.5936
15:	[0s / 5s],		train_loss: 4.2506
47:	[0s / 8s],		train_loss: 4.2609
20:	[0s / 3s],		train_loss: 4.1864
67:	[0s / 43s],		train_loss: 4.0996
4:	[0s / 1s],		train_loss: 4.5313
48:	[0s / 8s],		train_loss: 4.2375
21:	[0s / 4s],		train_loss: 4.1554
16:	[0s / 6s],		train_loss: 4.2453
5:	[0s / 1s],		train_loss: 4.5194
49:	[0s / 8s],		train_loss: 4.2210
22:	[0s / 4s],		train_loss: 4.1169
50:	[0s / 8s],		train_loss: 4.2316
6:	[0s / 1s],		train_loss: 4.4894
23:	[0s / 4s],		train_loss: 4.1946
17:	[0s / 6s],		train_loss: 4.2582
68:	[0s / 44s],		train_loss: 4.1021
19:	[2s / 44s],		train_loss: 4.1348
51:	[0s / 9s],		train_loss: 4.2343
24:	[0s / 4s],		train_loss: 4.1538
7:	[0s / 1s],		train_loss: 4.4771
52:	[0s / 9s],		train_loss: 4.2239
25:	[0s / 4s],		train_loss: 4.1338
8:	[0s / 1s],		train_loss: 4.4765
18:	[0s / 7s],		train_loss: 4.2696
31:	[1s / 44s],		train_loss: 4.1201
53:	[0s / 9s],		train_loss: 4.2540
26:	[0s / 4s],		train_loss: 4.1323
9:	[0s / 2s],		train_loss: 4.4557
54:	[0s / 9s],		train_loss: 4.2130
27:	[0s / 5s],		train_loss: 4.1291
10:	[0s / 2s],		train_loss: 4.4142
19:	[0s / 7s],		train_loss: 4.2305
69:	[0s / 44s],		train_loss: 4.1224
55:	[0s / 9s],		train_loss: 4.1815
28:	[0s / 5s],		train_loss: 4.0804
56:	[0s / 10s],		train_loss: 4.1959
11:	[0s / 2s],		train_loss: 4.4146
29:	[0s / 5s],		train_loss: 4.0768
20:	[0s / 7s],		train_loss: 4.2549
57:	[0s / 10s],		train_loss: 4.1873
12:	[0s / 2s],		train_loss: 4.3993
30:	[0s / 5s],		train_loss: 4.0919
14:	[4s / 45s],		train_loss: 4.3890
58:	[0s / 10s],		train_loss: 4.2298
13:	[0s / 2s],		train_loss: 4.3939
31:	[0s / 5s],		train_loss: 4.0542
70:	[0s / 45s],		train_loss: 4.1132
32:	[1s / 45s],		train_loss: 4.0868
21:	[0s / 8s],		train_loss: 4.2542
59:	[0s / 10s],		train_loss: 4.1882
14:	[0s / 3s],		train_loss: 4.3771
32:	[0s / 6s],		train_loss: 4.0634
60:	[0s / 10s],		train_loss: 4.1926
33:	[0s / 6s],		train_loss: 4.0710
15:	[0s / 3s],		train_loss: 4.3877
61:	[0s / 11s],		train_loss: 4.1283
22:	[0s / 8s],		train_loss: 4.2595
20:	[1s / 46s],		train_loss: 4.0965
34:	[0s / 6s],		train_loss: 4.0799
71:	[0s / 46s],		train_loss: 4.0916
16:	[0s / 3s],		train_loss: 4.3626
62:	[0s / 11s],		train_loss: 4.1546
35:	[0s / 6s],		train_loss: 4.0476
63:	[0s / 11s],		train_loss: 4.1557
17:	[0s / 3s],		train_loss: 4.3706
23:	[0s / 9s],		train_loss: 4.2520
33:	[0s / 46s],		train_loss: 4.1061
36:	[0s / 6s],		train_loss: 4.0009
64:	[0s / 11s],		train_loss: 4.1645
18:	[0s / 4s],		train_loss: 4.3545
37:	[0s / 7s],		train_loss: 3.9947
65:	[0s / 11s],		train_loss: 4.1606
19:	[0s / 4s],		train_loss: 4.3295
72:	[0s / 46s],		train_loss: 4.1077
24:	[0s / 9s],		train_loss: 4.2383
38:	[0s / 7s],		train_loss: 3.9994
66:	[0s / 11s],		train_loss: 4.1527
20:	[0s / 4s],		train_loss: 4.3391
39:	[0s / 7s],		train_loss: 3.9758
67:	[0s / 12s],		train_loss: 4.1546
21:	[0s / 4s],		train_loss: 4.3350
68:	[0s / 12s],		train_loss: 4.1277
40:	[0s / 7s],		train_loss: 3.9547
25:	[0s / 9s],		train_loss: 4.2365
22:	[0s / 4s],		train_loss: 4.3338
69:	[0s / 12s],		train_loss: 4.1294
41:	[0s / 7s],		train_loss: 3.9405
73:	[0s / 47s],		train_loss: 4.0610
70:	[0s / 12s],		train_loss: 4.1313
23:	[0s / 5s],		train_loss: 4.3163
42:	[0s / 7s],		train_loss: 3.9531
26:	[0s / 10s],		train_loss: 4.2327
34:	[1s / 47s],		train_loss: 4.1026
71:	[0s / 12s],		train_loss: 4.1217
21:	[1s / 47s],		train_loss: 4.0781
24:	[0s / 5s],		train_loss: 4.3116
43:	[0s / 8s],		train_loss: 3.9781
72:	[0s / 12s],		train_loss: 4.0803
44:	[0s / 8s],		train_loss: 3.9667
25:	[0s / 5s],		train_loss: 4.3265
27:	[0s / 10s],		train_loss: 4.2216
73:	[0s / 13s],		train_loss: 4.1288
45:	[0s / 8s],		train_loss: 3.9700
26:	[0s / 5s],		train_loss: 4.3035
74:	[0s / 13s],		train_loss: 4.1407
74:	[0s / 48s],		train_loss: 4.1068
46:	[0s / 8s],		train_loss: 3.9220
28:	[0s / 11s],		train_loss: 4.2122
27:	[0s / 5s],		train_loss: 4.3223
75:	[0s / 13s],		train_loss: 4.0789
47:	[0s / 8s],		train_loss: 3.8950
15:	[3s / 48s],		train_loss: 4.3925
28:	[0s / 6s],		train_loss: 4.3249
76:	[0s / 13s],		train_loss: 4.0913
48:	[0s / 9s],		train_loss: 3.8997
77:	[0s / 13s],		train_loss: 4.0834
29:	[0s / 6s],		train_loss: 4.2905
29:	[0s / 11s],		train_loss: 4.1973
35:	[1s / 48s],		train_loss: 4.0978
49:	[0s / 9s],		train_loss: 3.9372
78:	[0s / 13s],		train_loss: 4.0975
75:	[0s / 48s],		train_loss: 4.1039
30:	[0s / 6s],		train_loss: 4.2925
50:	[0s / 9s],		train_loss: 3.8982
79:	[0s / 14s],		train_loss: 4.0991
30:	[0s / 11s],		train_loss: 4.1794
31:	[0s / 6s],		train_loss: 4.2477
51:	[0s / 9s],		train_loss: 3.9084
80:	[0s / 14s],		train_loss: 4.0965
32:	[0s / 6s],		train_loss: 4.2740
81:	[0s / 14s],		train_loss: 4.0899
52:	[0s / 9s],		train_loss: 3.8899
31:	[0s / 12s],		train_loss: 4.2068
33:	[0s / 7s],		train_loss: 4.2684
76:	[0s / 49s],		train_loss: 4.1105
82:	[0s / 14s],		train_loss: 4.0667
53:	[0s / 10s],		train_loss: 3.8989
83:	[0s / 14s],		train_loss: 4.0652
34:	[0s / 7s],		train_loss: 4.2692
54:	[0s / 10s],		train_loss: 3.8768
32:	[0s / 12s],		train_loss: 4.1938
22:	[2s / 49s],		train_loss: 4.0765
36:	[1s / 49s],		train_loss: 4.0876
84:	[0s / 15s],		train_loss: 4.0781
35:	[0s / 7s],		train_loss: 4.2577
55:	[0s / 10s],		train_loss: 3.8895
85:	[0s / 15s],		train_loss: 4.0851
56:	[0s / 10s],		train_loss: 3.8897
36:	[0s / 7s],		train_loss: 4.2531
77:	[0s / 50s],		train_loss: 4.0732
33:	[0s / 12s],		train_loss: 4.2172
86:	[0s / 15s],		train_loss: 4.0686
57:	[0s / 10s],		train_loss: 3.8711
37:	[0s / 7s],		train_loss: 4.2487
87:	[0s / 15s],		train_loss: 4.0631
58:	[0s / 10s],		train_loss: 3.8236
38:	[0s / 8s],		train_loss: 4.2445
34:	[0s / 13s],		train_loss: 4.1953
88:	[0s / 15s],		train_loss: 4.0888
59:	[0s / 11s],		train_loss: 3.8422
78:	[0s / 50s],		train_loss: 4.1457
39:	[0s / 8s],		train_loss: 4.2399
89:	[0s / 15s],		train_loss: 4.0445
60:	[0s / 11s],		train_loss: 3.8397
35:	[0s / 13s],		train_loss: 4.2049
40:	[0s / 8s],		train_loss: 4.2187
37:	[1s / 50s],		train_loss: 4.1170
90:	[0s / 16s],		train_loss: 4.0425
61:	[0s / 11s],		train_loss: 3.8326
41:	[0s / 8s],		train_loss: 4.2283
91:	[0s / 16s],		train_loss: 4.0458
62:	[0s / 11s],		train_loss: 3.8552
36:	[0s / 13s],		train_loss: 4.2136
92:	[0s / 16s],		train_loss: 4.0134
42:	[0s / 8s],		train_loss: 4.2435
63:	[0s / 11s],		train_loss: 3.8543
79:	[0s / 51s],		train_loss: 4.1670
93:	[0s / 16s],		train_loss: 4.0311
43:	[0s / 9s],		train_loss: 4.2231
64:	[0s / 12s],		train_loss: 3.8526
94:	[0s / 16s],		train_loss: 4.0292
37:	[0s / 14s],		train_loss: 4.1911
44:	[0s / 9s],		train_loss: 4.2196
65:	[0s / 12s],		train_loss: 3.8551
95:	[0s / 16s],		train_loss: 4.0369
45:	[0s / 9s],		train_loss: 4.2275
66:	[0s / 12s],		train_loss: 3.8338
38:	[0s / 14s],		train_loss: 4.2065
96:	[0s / 17s],		train_loss: 4.0133
38:	[1s / 52s],		train_loss: 4.1048
46:	[0s / 9s],		train_loss: 4.2039
67:	[0s / 12s],		train_loss: 3.7878
80:	[0s / 52s],		train_loss: 4.1010
23:	[2s / 52s],		train_loss: 4.0509
97:	[0s / 17s],		train_loss: 4.0002
47:	[0s / 9s],		train_loss: 4.2217
68:	[0s / 12s],		train_loss: 3.8199
39:	[0s / 14s],		train_loss: 4.1876
98:	[0s / 17s],		train_loss: 3.9729
48:	[0s / 9s],		train_loss: 4.2076
69:	[0s / 12s],		train_loss: 3.7931
99:	[0s / 17s],		train_loss: 4.0141
40:	[0s / 15s],		train_loss: 4.1683
81:	[0s / 52s],		train_loss: 4.0393
49:	[0s / 10s],		train_loss: 4.1972
70:	[0s / 13s],		train_loss: 3.7754
0:	[0s / 0s],		train_loss: 4.5387
50:	[0s / 10s],		train_loss: 4.2023
71:	[0s / 13s],		train_loss: 3.7848
1:	[0s / 0s],		train_loss: 4.3997
41:	[0s / 15s],		train_loss: 4.1948
16:	[4s / 53s],		train_loss: 4.3657
2:	[0s / 0s],		train_loss: 4.3587
51:	[0s / 10s],		train_loss: 4.1746
72:	[0s / 13s],		train_loss: 3.7925
3:	[0s / 0s],		train_loss: 4.3398
39:	[1s / 53s],		train_loss: 4.0578
52:	[0s / 10s],		train_loss: 4.1859
73:	[0s / 13s],		train_loss: 3.8084
82:	[0s / 53s],		train_loss: 4.0494
42:	[0s / 15s],		train_loss: 4.1850
4:	[0s / 0s],		train_loss: 4.3168
53:	[0s / 11s],		train_loss: 4.1972
74:	[0s / 14s],		train_loss: 3.7619
5:	[0s / 0s],		train_loss: 4.3180
43:	[0s / 16s],		train_loss: 4.2004
6:	[0s / 1s],		train_loss: 4.3121
54:	[0s / 11s],		train_loss: 4.1940
75:	[0s / 14s],		train_loss: 3.7929
7:	[0s / 1s],		train_loss: 4.2769
76:	[0s / 14s],		train_loss: 3.7623
55:	[0s / 11s],		train_loss: 4.1986
44:	[0s / 16s],		train_loss: 4.1818
8:	[0s / 1s],		train_loss: 4.2912
83:	[0s / 54s],		train_loss: 4.0038
24:	[2s / 54s],		train_loss: 4.0414
77:	[0s / 14s],		train_loss: 3.7833
9:	[0s / 1s],		train_loss: 4.2661
56:	[0s / 11s],		train_loss: 4.1863
45:	[0s / 16s],		train_loss: 4.1879
10:	[0s / 1s],		train_loss: 4.2880
78:	[0s / 14s],		train_loss: 3.7670
40:	[1s / 54s],		train_loss: 4.0877
57:	[0s / 11s],		train_loss: 4.1717
11:	[0s / 1s],		train_loss: 4.2734
79:	[0s / 15s],		train_loss: 3.7417
12:	[0s / 1s],		train_loss: 4.2765
58:	[0s / 12s],		train_loss: 4.1496
46:	[0s / 17s],		train_loss: 4.1663
84:	[0s / 54s],		train_loss: 4.0546
80:	[0s / 15s],		train_loss: 3.7019
13:	[0s / 2s],		train_loss: 4.2556
59:	[0s / 12s],		train_loss: 4.1587
14:	[0s / 2s],		train_loss: 4.2504
81:	[0s / 15s],		train_loss: 3.7476
47:	[0s / 17s],		train_loss: 4.1244
60:	[0s / 12s],		train_loss: 4.1827
15:	[0s / 2s],		train_loss: 4.2502
82:	[0s / 15s],		train_loss: 3.7497
16:	[0s / 2s],		train_loss: 4.2332
85:	[0s / 55s],		train_loss: 4.0406
61:	[0s / 12s],		train_loss: 4.1354
48:	[0s / 17s],		train_loss: 4.1657
83:	[0s / 15s],		train_loss: 3.7412
17:	[0s / 2s],		train_loss: 4.2266
41:	[1s / 55s],		train_loss: 4.0492
62:	[0s / 13s],		train_loss: 4.1551
18:	[0s / 2s],		train_loss: 4.2414
84:	[0s / 16s],		train_loss: 3.7438
25:	[1s / 55s],		train_loss: 4.0235
19:	[0s / 3s],		train_loss: 4.2352
49:	[0s / 18s],		train_loss: 4.1690
63:	[0s / 13s],		train_loss: 4.1556
85:	[0s / 16s],		train_loss: 3.7233
20:	[0s / 3s],		train_loss: 4.2005
86:	[0s / 55s],		train_loss: 4.0138
64:	[0s / 13s],		train_loss: 4.1181
21:	[0s / 3s],		train_loss: 4.2249
86:	[0s / 16s],		train_loss: 3.6879
50:	[0s / 18s],		train_loss: 4.2061
22:	[0s / 3s],		train_loss: 4.1808
65:	[0s / 13s],		train_loss: 4.1265
87:	[0s / 16s],		train_loss: 3.7527
51:	[0s / 18s],		train_loss: 4.1545
23:	[0s / 3s],		train_loss: 4.1929
66:	[0s / 13s],		train_loss: 4.1373
88:	[0s / 16s],		train_loss: 3.7134
24:	[0s / 3s],		train_loss: 4.2061
42:	[1s / 56s],		train_loss: 4.0159
87:	[0s / 56s],		train_loss: 4.0259
67:	[0s / 14s],		train_loss: 4.1212
25:	[0s / 4s],		train_loss: 4.1872
89:	[0s / 17s],		train_loss: 3.6688
52:	[0s / 19s],		train_loss: 4.1576
26:	[0s / 4s],		train_loss: 4.1721
17:	[3s / 56s],		train_loss: 4.3500
68:	[0s / 14s],		train_loss: 4.1426
90:	[0s / 17s],		train_loss: 3.6910
27:	[0s / 4s],		train_loss: 4.1720
53:	[0s / 19s],		train_loss: 4.1635
69:	[0s / 14s],		train_loss: 4.1226
91:	[0s / 17s],		train_loss: 3.7011
28:	[0s / 4s],		train_loss: 4.1339
88:	[0s / 57s],		train_loss: 4.0148
29:	[0s / 4s],		train_loss: 4.1632
70:	[0s / 14s],		train_loss: 4.1231
92:	[0s / 17s],		train_loss: 3.7023
54:	[0s / 20s],		train_loss: 4.1304
30:	[0s / 4s],		train_loss: 4.1643
93:	[0s / 17s],		train_loss: 3.6705
71:	[0s / 15s],		train_loss: 4.1209
31:	[0s / 4s],		train_loss: 4.1426
43:	[1s / 57s],		train_loss: 4.0377
55:	[0s / 20s],		train_loss: 4.1695
94:	[0s / 18s],		train_loss: 3.6739
89:	[0s / 57s],		train_loss: 3.9991
72:	[0s / 15s],		train_loss: 4.0971
32:	[0s / 5s],		train_loss: 4.1736
26:	[2s / 57s],		train_loss: 4