[I 2026-06-28 09:03:24,966] Trial 37 finished with value: 0.7744583506708417 and parameters: {'n_estimators': 300, 'max_depth': 7, 'min_samples_split': 20, 'min_samples_leaf': 14, 'max_features': 'sqrt'}. Best is trial 23 with value: 0.7772943515835776.
[I 2026-06-28 09:04:20,896] Trial 38 finished with value: 0.7744583506708417 and parameters: {'n_estimators': 300, 'max_depth': 7, 'min_samples_split': 18, 'min_samples_leaf': 14, 'max_features': 'sqrt'}. Best is trial 23 with value: 0.7772943515835776.
[I 2026-06-28 09:09:33,174] Trial 46 finished with value: 0.7741208684797386 and parameters: {'n_estimators': 150, 'max_depth': 9, 'min_samples_split': 18, 'min_samples_leaf': 11, 'max_features': 'log2'}. Best is trial 23 with value: 0.7772943515835776.
[I 2026-06-28 09:09:48,269] Trial 39 finished with value: 0.7765848719772813 and parameters: {'n_estimators': 300, 'max_depth': 9, 'min_samples_split': 18, 'min_samples_leaf': 14, 'max_features': 'sqrt'}. Best is trial 23 with value: 0.7772943515835776.
[I 2026-06-28 09:10:31,400] Trial 47 finished with value: 0.7741208684797386 and parameters: {'n_estimators': 150, 'max_depth': 9, 'min_samples_split': 18, 'min_samples_leaf': 11, 'max_features': 'log2'}. Best is trial 23 with value: 0.7772943515835776.
[I 2026-06-28 09:14:37,822] Trial 42 finished with value: 0.7738696743488607 and parameters: {'n_estimators': 200, 'max_depth': 9, 'min_samples_split': 18, 'min_samples_leaf': 15, 'max_features': 'sqrt'}. Best is trial 23 with value: 0.7772943515835776.
[I 2026-06-28 09:14:54,942] Trial 40 finished with value: 0.7765848719772813 and parameters: {'n_estimators': 300, 'max_depth': 9, 'min_samples_split': 18, 'min_samples_leaf': 14, 'max_features': 'sqrt'}. Best is trial 23 with value: 0.7772943515835776.
[I 2026-06-28 09:16:38,152] Trial 43 finished with value: 0.7738696743488607 and parameters: {'n_estimators': 200, 'max_depth': 9, 'min_samples_split': 18, 'min_samples_leaf': 15, 'max_features': 'sqrt'}. Best is trial 23 with value: 0.7772943515835776.
[I 2026-06-28 09:20:08,765] Trial 45 finished with value: 0.7759252476946706 and parameters: {'n_estimators': 150, 'max_depth': 9, 'min_samples_split': 18, 'min_samples_leaf': 11, 'max_features': 'sqrt'}. Best is trial 23 with value: 0.7772943515835776.
[I 2026-06-28 09:22:07,679] Trial 41 finished with value: 0.7765848719772813 and parameters: {'n_estimators': 300, 'max_depth': 9, 'min_samples_split': 18, 'min_samples_leaf': 14, 'max_features': 'sqrt'}. Best is trial 23 with value: 0.7772943515835776.
[I 2026-06-28 09:28:34,637] Trial 48 finished with value: 0.7751812528642842 and parameters: {'n_estimators': 150, 'max_depth': 10, 'min_samples_split': 16, 'min_samples_leaf': 13, 'max_features': 'sqrt'}. Best is trial 23 with value: 0.7772943515835776.
[I 2026-06-28 09:40:07,014] Trial 49 finished with value: 0.7756203632152082 and parameters: {'n_estimators': 250, 'max_depth': 9, 'min_samples_split': 5, 'min_samples_leaf': 13, 'max_features': 'sqrt'}. Best is trial 23 with value: 0.7772943515835776.
[I 2026-06-28 09:40:48,026] Trial 50 finished with value: 0.7756203632152082 and parameters: {'n_estimators': 250, 'max_depth': 9, 'min_samples_split': 16, 'min_samples_leaf': 13, 'max_features': 'sqrt'}. Best is trial 23 with value: 0.7772943515835776.
[I 2026-06-28 09:44:25,184] Trial 52 finished with value: 0.773401801311195 and parameters: {'n_estimators': 250, 'max_depth': 9, 'min_samples_split': 19, 'min_samples_leaf': 15, 'max_features': 'sqrt'}. Best is trial 23 with value: 0.7772943515835776.
[I 2026-06-28 09:44:44,935] Trial 51 finished with value: 0.7756203632152082 and parameters: {'n_estimators': 250, 'max_depth': 9, 'min_samples_split': 16, 'min_samples_leaf': 13, 'max_features': 'sqrt'}. Best is trial 23 with value: 0.7772943515835776.
[I 2026-06-28 09:44:51,791] Trial 53 finished with value: 0.7751409851028458 and parameters: {'n_estimators': 250, 'max_depth': 8, 'min_samples_split': 19, 'min_samples_leaf': 13, 'max_features': 'sqrt'}. Best is trial 23 with value: 0.7772943515835776.
[I 2026-06-28 09:48:17,128] Trial 54 finished with value: 0.7751409851028458 and parameters: {'n_estimators': 250, 'max_depth': 8, 'min_samples_split': 6, 'min_samples_leaf': 13, 'max_features': 'sqrt'}. Best is trial 23 with value: 0.7772943515835776.
[I 2026-06-28 09:51:21,243] Trial 57 finished with value: 0.7740806007183002 and parameters: {'n_estimators': 300, 'max_depth': 8, 'min_samples_split': 19, 'min_samples_leaf': 12, 'max_features': 'log2'}. Best is trial 23 with value: 0.7772943515835776.
[I 2026-06-28 09:52:09,846] Trial 55 finished with value: 0.7756203632152082 and parameters: {'n_estimators': 250, 'max_depth': 9, 'min_samples_split': 19, 'min_samples_leaf': 13, 'max_features': 'sqrt'}. Best is trial 23 with value: 0.7772943515835776.
[I 2026-06-28 09:58:56,400] Trial 56 finished with value: 0.7756683010264445 and parameters: {'n_estimators': 250, 'max_depth': 9, 'min_samples_split': 19, 'min_samples_leaf': 12, 'max_features': 'sqrt'}. Best is trial 23 with value: 0.7772943515835776.
[I 2026-06-28 09:59:29,457] Trial 62 finished with value: 0.7710547660730688 and parameters: {'n_estimators': 300, 'max_depth': 8, 'min_samples_split': 17, 'min_samples_leaf': 14, 'max_features': 'log2'}. Best is trial 23 with value: 0.7772943515835776.
[I 2026-06-28 10:13:50,963] Trial 58 finished with value: 0.7764410585435726 and parameters: {'n_estimators': 300, 'max_depth': 8, 'min_samples_split': 19, 'min_samples_leaf': 15, 'max_features': 'sqrt'}. Best is trial 23 with value: 0.7772943515835776.
[I 2026-06-28 10:17:28,679] Trial 59 finished with value: 0.7764410585435726 and parameters: {'n_estimators': 300, 'max_depth': 8, 'min_samples_split': 19, 'min_samples_leaf': 15, 'max_features': 'sqrt'}. Best is trial 23 with value: 0.7772943515835776.
[I 2026-06-28 10:17:46,882] Trial 60 finished with value: 0.7764410585435726 and parameters: {'n_estimators': 300, 'max_depth': 8, 'min_samples_split': 19, 'min_samples_leaf': 15, 'max_features': 'sqrt'}. Best is trial 23 with value: 0.7772943515835776.
[I 2026-06-28 10:18:15,354] Trial 61 finished with value: 0.7764832438174605 and parameters: {'n_estimators': 300, 'max_depth': 8, 'min_samples_split': 15, 'min_samples_leaf': 14, 'max_features': 'sqrt'}. Best is trial 23 with value: 0.7772943515835776.
[I 2026-06-28 10:24:23,968] Trial 63 finished with value: 0.7764410585435726 and parameters: {'n_estimators': 300, 'max_depth': 8, 'min_samples_split': 15, 'min_samples_leaf': 15, 'max_features': 'sqrt'}. Best is trial 23 with value: 0.7772943515835776.
[I 2026-06-28 10:25:15,806] Trial 64 finished with value: 0.7764410585435726 and parameters: {'n_estimators': 300, 'max_depth': 8, 'min_samples_split': 15, 'min_samples_leaf': 15, 'max_features': 'sqrt'}. Best is trial 23 with value: 0.7772943515835776.
[I 2026-06-28 10:32:05,853] Trial 65 finished with value: 0.7764410585435726 and parameters: {'n_estimators': 300, 'max_depth': 8, 'min_samples_split': 15, 'min_samples_leaf': 15, 'max_features': 'sqrt'}. Best is trial 23 with value: 0.7772943515835776.
[I 2026-06-28 10:36:30,627] Trial 66 finished with value: 0.7754612096819039 and parameters: {'n_estimators': 300, 'max_depth': 10, 'min_samples_split': 15, 'min_samples_leaf': 15, 'max_features': 'sqrt'}. Best is trial 23 with value: 0.7772943515835776.
[I 2026-06-28 10:41:26,713] Trial 67 finished with value: 0.7737335309649498 and parameters: {'n_estimators': 300, 'max_depth': 6, 'min_samples_split': 15, 'min_samples_leaf': 15, 'max_features': 'sqrt'}. Best is trial 23 with value: 0.7772943515835776.
[I 2026-06-28 10:45:02,553] Trial 68 finished with value: 0.7737335309649498 and parameters: {'n_estimators': 300, 'max_depth': 6, 'min_samples_split': 17, 'min_samples_leaf': 15, 'max_features': 'sqrt'}. Best is trial 23 with value: 0.7772943515835776.
[I 2026-06-28 10:45:24,251] Trial 69 finished with value: 0.7737335309649498 and parameters: {'n_estimators': 300, 'max_depth': 6, 'min_samples_split': 15, 'min_samples_leaf': 15, 'max_features': 'sqrt'}. Best is trial 23 with value: 0.7772943515835776.
slurmstepd-slurmng-n1.cs.unibo.it: error: *** JOB 63097 ON slurmng-n1.cs.unibo.it CANCELLED AT 2026-06-28T10:46:11 ***
