52:	[0s / 34s],		train_loss: 2.4442[I 2026-06-07 08:33:52,960] Trial 96 finished with value: 0.7278483911838102 and parameters: {'num_nodes': [64, 32], 'dropout': 0.22388572951268604, 'learning_rate': 0.0018399312622907967, 'batch_norm': False}. Best is trial 56 with value: 0.8080908770070512.
/scratch.hpc/luca.cotugno/Foundation_model_clinical_data/test_tabular_model_tmp.py:476: UserWarning: Choices for a categorical distribution should be a tuple of None, bool, int, float and str for persistent storage but contains [32] which is of type list.
  num_nodes  = trial.suggest_categorical("num_nodes", [[32], [64], [128], [64, 32], [128, 64]])
/scratch.hpc/luca.cotugno/Foundation_model_clinical_data/test_tabular_model_tmp.py:476: UserWarning: Choices for a categorical distribution should be a tuple of None, bool, int, float and str for persistent storage but contains [64] which is of type list.
  num_nodes  = trial.suggest_categorical("num_nodes", [[32], [64], [128], [64, 32], [128, 64]])
/scratch.hpc/luca.cotugno/Foundation_model_clinical_data/test_tabular_model_tmp.py:476: UserWarning: Choices for a categorical distribution should be a tuple of None, bool, int, float and str for persistent storage but contains [128] which is of type list.
  num_nodes  = trial.suggest_categorical("num_nodes", [[32], [64], [128], [64, 32], [128, 64]])
/scratch.hpc/luca.cotugno/Foundation_model_clinical_data/test_tabular_model_tmp.py:476: UserWarning: Choices for a categorical distribution should be a tuple of None, bool, int, float and str for persistent storage but contains [64, 32] which is of type list.
  num_nodes  = trial.suggest_categorical("num_nodes", [[32], [64], [128], [64, 32], [128, 64]])
/scratch.hpc/luca.cotugno/Foundation_model_clinical_data/test_tabular_model_tmp.py:476: UserWarning: Choices for a categorical distribution should be a tuple of None, bool, int, float and str for persistent storage but contains [128, 64] which is of type list.
  num_nodes  = trial.suggest_categorical("num_nodes", [[32], [64], [128], [64, 32], [128, 64]])
[I 2026-06-07 08:34:15,624] Trial 97 finished with value: 0.7957219345979547 and parameters: {'num_nodes': [64, 32], 'dropout': 0.16999009015467323, 'learning_rate': 0.0036447994251443024, 'batch_norm': False}. Best is trial 56 with value: 0.8080908770070512.
[I 2026-06-07 08:34:21,111] Trial 93 finished with value: 0.798048984385004 and parameters: {'num_nodes': [64, 32], 'dropout': 0.15976544159808395, 'learning_rate': 0.003690238545919557, 'batch_norm': False}. Best is trial 56 with value: 0.8080908770070512.
[I 2026-06-07 08:34:29,825] Trial 98 finished with value: 0.8013109142565049 and parameters: {'num_nodes': [64, 32], 'dropout': 0.17188626499234066, 'learning_rate': 0.000659151829883834, 'batch_norm': False}. Best is trial 56 with value: 0.8080908770070512.
[I 2026-06-07 08:34:30,038] Trial 99 finished with value: 0.7911230116880832 and parameters: {'num_nodes': [64, 32], 'dropout': 0.1966070573405428, 'learning_rate': 0.0006909409969769579, 'batch_norm': False}. Best is trial 56 with value: 0.8080908770070512.
[I 2026-06-07 08:34:37,740] A new study created in memory with name: rsf_tuning_tabicl_5_NaN_seed77
[I 2026-06-07 08:37:27,151] Trial 1 finished with value: 0.7669025749922516 and parameters: {'n_estimators': 50, 'max_depth': 4, 'min_samples_split': 14, 'min_samples_leaf': 6, 'max_features': 'log2'}. Best is trial 1 with value: 0.7669025749922516.
[I 2026-06-07 08:46:50,731] Trial 4 finished with value: 0.7517418264518885 and parameters: {'n_estimators': 50, 'max_depth': 9, 'min_samples_split': 7, 'min_samples_leaf': 3, 'max_features': 'sqrt'}. Best is trial 1 with value: 0.7669025749922516.
[I 2026-06-07 08:49:34,571] Trial 3 finished with value: 0.7560110551269487 and parameters: {'n_estimators': 100, 'max_depth': 5, 'min_samples_split': 17, 'min_samples_leaf': 6, 'max_features': 'sqrt'}. Best is trial 1 with value: 0.7669025749922516.
[I 2026-06-07 08:58:44,782] Trial 2 finished with value: 0.756801866324898 and parameters: {'n_estimators': 150, 'max_depth': 8, 'min_samples_split': 8, 'min_samples_leaf': 10, 'max_features': 'sqrt'}. Best is trial 1 with value: 0.7669025749922516.
[I 2026-06-07 09:02:51,995] Trial 5 finished with value: 0.775219573794386 and parameters: {'n_estimators': 300, 'max_depth': 4, 'min_samples_split': 11, 'min_samples_leaf': 9, 'max_features': 'log2'}. Best is trial 5 with value: 0.775219573794386.
[I 2026-06-07 09:06:23,182] Trial 6 finished with value: 0.7609972754839628 and parameters: {'n_estimators': 100, 'max_depth': 7, 'min_samples_split': 7, 'min_samples_leaf': 4, 'max_features': 'sqrt'}. Best is trial 5 with value: 0.775219573794386.
[I 2026-06-07 09:08:17,348] Trial 0 finished with value: 0.7647411290930566 and parameters: {'n_estimators': 200, 'max_depth': 8, 'min_samples_split': 9, 'min_samples_leaf': 9, 'max_features': 'sqrt'}. Best is trial 5 with value: 0.775219573794386.
[I 2026-06-07 09:27:55,557] Trial 10 finished with value: 0.7753886780757084 and parameters: {'n_estimators': 250, 'max_depth': 7, 'min_samples_split': 13, 'min_samples_leaf': 4, 'max_features': 'log2'}. Best is trial 10 with value: 0.7753886780757084.
[I 2026-06-07 09:33:42,048] Trial 7 finished with value: 0.756296647651597 and parameters: {'n_estimators': 200, 'max_depth': 8, 'min_samples_split': 18, 'min_samples_leaf': 3, 'max_features': 'sqrt'}. Best is trial 10 with value: 0.7753886780757084.
[I 2026-06-07 09:35:48,019] Trial 8 finished with value: 0.7544197471917171 and parameters: {'n_estimators': 200, 'max_depth': 7, 'min_samples_split': 20, 'min_samples_leaf': 6, 'max_features': 'sqrt'}. Best is trial 10 with value: 0.7753886780757084.
[I 2026-06-07 09:55:38,810] Trial 12 finished with value: 0.7559566066896187 and parameters: {'n_estimators': 150, 'max_depth': 5, 'min_samples_split': 19, 'min_samples_leaf': 10, 'max_features': 'sqrt'}. Best is trial 10 with value: 0.7753886780757084.
[I 2026-06-07 09:58:21,710] Trial 9 finished with value: 0.7650225332763719 and parameters: {'n_estimators': 300, 'max_depth': 7, 'min_samples_split': 10, 'min_samples_leaf': 4, 'max_features': 'sqrt'}. Best is trial 10 with value: 0.7753886780757084.
[I 2026-06-07 10:01:11,687] Trial 13 finished with value: 0.7731018437078548 and parameters: {'n_estimators': 300, 'max_depth': 10, 'min_samples_split': 14, 'min_samples_leaf': 15, 'max_features': 'log2'}. Best is trial 10 with value: 0.7753886780757084.
[I 2026-06-07 10:08:56,793] Trial 11 finished with value: 0.7589531031420936 and parameters: {'n_estimators': 250, 'max_depth': 6, 'min_samples_split': 11, 'min_samples_leaf': 3, 'max_features': 'sqrt'}. Best is trial 10 with value: 0.7753886780757084.
[I 2026-06-07 10:09:11,165] Trial 14 finished with value: 0.7755368406503657 and parameters: {'n_estimators': 300, 'max_depth': 3, 'min_samples_split': 12, 'min_samples_leaf': 15, 'max_features': 'log2'}. Best is trial 14 with value: 0.7755368406503657.
[I 2026-06-07 10:12:03,957] Trial 15 finished with value: 0.7755368406503657 and parameters: {'n_estimators': 300, 'max_depth': 3, 'min_samples_split': 13, 'min_samples_leaf': 15, 'max_features': 'log2'}. Best is trial 14 with value: 0.7755368406503657.
[I 2026-06-07 10:12:21,143] Trial 16 finished with value: 0.7770100897142713 and parameters: {'n_estimators': 250, 'max_depth': 3, 'min_samples_split': 12, 'min_samples_leaf': 14, 'max_features': 'log2'}. Best is trial 16 with value: 0.7770100897142713.
[I 2026-06-07 10:19:53,902] Trial 17 finished with value: 0.7764964943583043 and parameters: {'n_estimators': 250, 'max_depth': 3, 'min_samples_split': 13, 'min_samples_leaf': 13, 'max_features': 'log2'}. Best is trial 16 with value: 0.7770100897142713.
[I 2026-06-07 10:20:07,387] Trial 18 finished with value: 0.7762949304316504 and parameters: {'n_estimators': 250, 'max_depth': 3, 'min_samples_split': 15, 'min_samples_leaf': 15, 'max_features': 'log2'}. Best is trial 16 with value: 0.7770100897142713.
[I 2026-06-07 10:23:12,047] Trial 19 finished with value: 0.7762949304316504 and parameters: {'n_estimators': 250, 'max_depth': 3, 'min_samples_split': 5, 'min_samples_leaf': 15, 'max_features': 'log2'}. Best is trial 16 with value: 0.7770100897142713.
[I 2026-06-07 10:23:16,345] Trial 20 finished with value: 0.7764964943583043 and parameters: {'n_estimators': 250, 'max_depth': 3, 'min_samples_split': 5, 'min_samples_leaf': 13, 'max_features': 'log2'}. Best is trial 16 with value: 0.7770100897142713.
[I 2026-06-07 10:33:30,736] Trial 21 finished with value: 0.7745447272970958 and parameters: {'n_estimators': 250, 'max_depth': 4, 'min_samples_split': 16, 'min_samples_leaf': 13, 'max_features': 'log2'}. Best is trial 16 with value: 0.7770100897142713.
[I 2026-06-07 10:33:34,820] Trial 22 finished with value: 0.7761781804169913 and parameters: {'n_estimators': 250, 'max_depth': 4, 'min_samples_split': 16, 'min_samples_leaf': 12, 'max_features': 'log2'}. Best is trial 16 with value: 0.7770100897142713.
[I 2026-06-07 10:36:44,709] Trial 24 finished with value: 0.7745447272970958 and parameters: {'n_estimators': 250, 'max_depth': 4, 'min_samples_split': 5, 'min_samples_leaf': 13, 'max_features': 'log2'}. Best is trial 16 with value: 0.7770100897142713.
[I 2026-06-07 10:36:46,824] Trial 23 finished with value: 0.7745447272970958 and parameters: {'n_estimators': 250, 'max_depth': 4, 'min_samples_split': 16, 'min_samples_leaf': 13, 'max_features': 'log2'}. Best is trial 16 with value: 0.7770100897142713.
[I 2026-06-07 10:46:05,265] Trial 26 finished with value: 0.7731699042545171 and parameters: {'n_estimators': 200, 'max_depth': 5, 'min_samples_split': 5, 'min_samples_leaf': 13, 'max_features': 'log2'}. Best is trial 16 with value: 0.7770100897142713.
[I 2026-06-07 10:46:15,618] Trial 25 finished with value: 0.7731699042545171 and parameters: {'n_estimators': 200, 'max_depth': 5, 'min_samples_split': 5, 'min_samples_leaf': 13, 'max_features': 'log2'}. Best is trial 16 with value: 0.7770100897142713.
[I 2026-06-07 10:49:14,986] Trial 27 finished with value: 0.7731699042545171 and parameters: {'n_estimators': 200, 'max_depth': 5, 'min_samples_split': 10, 'min_samples_leaf': 13, 'max_features': 'log2'}. Best is trial 16 with value: 0.7770100897142713.
[I 2026-06-07 10:49:16,097] Trial 28 finished with value: 0.7724447976612302 and parameters: {'n_estimators': 200, 'max_depth': 5, 'min_samples_split': 9, 'min_samples_leaf': 12, 'max_features': 'log2'}. Best is trial 16 with value: 0.7770100897142713.
[I 2026-06-07 10:52:57,425] Trial 30 finished with value: 0.7647432232637231 and parameters: {'n_estimators': 150, 'max_depth': 3, 'min_samples_split': 9, 'min_samples_leaf': 11, 'max_features': 'log2'}. Best is trial 16 with value: 0.7770100897142713.
[I 2026-06-07 10:54:41,825] Trial 29 finished with value: 0.7698553556320626 and parameters: {'n_estimators': 200, 'max_depth': 3, 'min_samples_split': 9, 'min_samples_leaf': 11, 'max_features': 'log2'}. Best is trial 16 with value: 0.7770100897142713.
[I 2026-06-07 10:55:48,381] Trial 31 finished with value: 0.7647432232637231 and parameters: {'n_estimators': 150, 'max_depth': 3, 'min_samples_split': 7, 'min_samples_leaf': 11, 'max_features': 'log2'}. Best is trial 16 with value: 0.7770100897142713.
[I 2026-06-07 10:55:56,673] Trial 32 finished with value: 0.7647432232637231 and parameters: {'n_estimators': 150, 'max_depth': 3, 'min_samples_split': 7, 'min_samples_leaf': 11, 'max_features': 'log2'}. Best is trial 16 with value: 0.7770100897142713.
[I 2026-06-07 11:05:33,939] Trial 34 finished with value: 0.7770100897142713 and parameters: {'n_estimators': 250, 'max_depth': 3, 'min_samples_split': 15, 'min_samples_leaf': 14, 'max_features': 'log2'}. Best is trial 16 with value: 0.7770100897142713.
[I 2026-06-07 11:06:43,466] Trial 35 finished with value: 0.7770100897142713 and parameters: {'n_estimators': 250, 'max_depth': 3, 'min_samples_split': 15, 'min_samples_leaf': 14, 'max_features': 'log2'}. Best is trial 16 with value: 0.7770100897142713.
[I 2026-06-07 11:09:49,927] Trial 36 finished with value: 0.7768990986689451 and parameters: {'n_estimators': 250, 'max_depth': 4, 'min_samples_split': 14, 'min_samples_leaf': 14, 'max_features': 'log2'}. Best is trial 16 with value: 0.7770100897142713.
[I 2026-06-07 11:13:59,866] Trial 33 finished with value: 0.7712092369679759 and parameters: {'n_estimators': 300, 'max_depth': 6, 'min_samples_split': 7, 'min_samples_leaf': 8, 'max_features': 'log2'}. Best is trial 16 with value: 0.7770100897142713.
[I 2026-06-07 11:19:30,899] Trial 40 finished with value: 0.7712867212826376 and parameters: {'n_estimators': 100, 'max_depth': 4, 'min_samples_split': 14, 'min_samples_leaf': 14, 'max_features': 'log2'}. Best is trial 16 with value: 0.7770100897142713.
[I 2026-06-07 11:21:40,737] Trial 37 finished with value: 0.7788754722354853 and parameters: {'n_estimators': 300, 'max_depth': 4, 'min_samples_split': 14, 'min_samples_leaf': 14, 'max_features': 'log2'}. Best is trial 37 with value: 0.7788754722354853.
[I 2026-06-07 11:22:51,626] Trial 38 finished with value: 0.7788754722354853 and parameters: {'n_estimators': 300, 'max_depth': 4, 'min_samples_split': 14, 'min_samples_leaf': 14, 'max_features': 'log2'}. Best is trial 37 with value: 0.7788754722354853.
[I 2026-06-07 11:26:01,269] Trial 39 finished with value: 0.7788754722354853 and parameters: {'n_estimators': 300, 'max_depth': 4, 'min_samples_split': 14, 'min_samples_leaf': 14, 'max_features': 'log2'}. Best is trial 37 with value: 0.7788754722354853.
[I 2026-06-07 11:35:59,765] Trial 41 finished with value: 0.7788754722354853 and parameters: {'n_estimators': 300, 'max_depth': 4, 'min_samples_split': 15, 'min_samples_leaf': 14, 'max_features': 'log2'}. Best is trial 37 with value: 0.7788754722354853.
[I 2026-06-07 11:37:46,348] Trial 42 finished with value: 0.7788754722354853 and parameters: {'n_estimators': 300, 'max_depth': 4, 'min_samples_split': 15, 'min_samples_leaf': 14, 'max_features': 'log2'}. Best is trial 37 with value: 0.7788754722354853.
[I 2026-06-07 11:42:23,239] Trial 44 finished with value: 0.7788754722354853 and parameters: {'n_estimators': 300, 'max_depth': 4, 'min_samples_split': 12, 'min_samples_leaf': 14, 'max_features': 'log2'}. Best is trial 37 with value: 0.7788754722354853.
[I 2026-06-07 11:43:52,574] Trial 43 finished with value: 0.7791670855007999 and parameters: {'n_estimators': 300, 'max_depth': 6, 'min_samples_split': 12, 'min_samples_leaf': 14, 'max_features': 'log2'}. Best is trial 43 with value: 0.7791670855007999.
[I 2026-06-07 11:52:29,925] Trial 45 finished with value: 0.7777692265808894 and parameters: {'n_estimators': 300, 'max_depth': 4, 'min_samples_split': 12, 'min_samples_leaf': 12, 'max_features': 'log2'}. Best is trial 43 with value: 0.7791670855007999.
[I 2026-06-07 11:53:53,502] Trial 46 finished with value: 0.7777692265808894 and parameters: {'n_estimators': 300, 'max_depth': 4, 'min_samples_split': 15, 'min_samples_leaf': 12, 'max_features': 'log2'}. Best is trial 43 with value: 0.7791670855007999.
[I 2026-06-07 12:30:25,722] Trial 47 finished with value: 0.7562469110982669 and parameters: {'n_estimators': 300, 'max_depth': 6, 'min_samples_split': 17, 'min_samples_leaf': 12, 'max_features': 'sqrt'}. Best is trial 43 with value: 0.7791670855007999.
[I 2026-06-07 12:31:48,750] Trial 48 finished with value: 0.7562469110982669 and parameters: {'n_estimators': 300, 'max_depth': 6, 'min_samples_split': 17, 'min_samples_leaf': 12, 'max_features': 'sqrt'}. Best is trial 43 with value: 0.7791670855007999.
[I 2026-06-07 12:41:06,275] Trial 49 finished with value: 0.7600179889260256 and parameters: {'n_estimators': 300, 'max_depth': 6, 'min_samples_split': 17, 'min_samples_leaf': 8, 'max_features': 'sqrt'}. Best is trial 43 with value: 0.7791670855007999.
[I 2026-06-07 12:41:08,024] Trial 50 finished with value: 0.7539506529624138 and parameters: {'n_estimators': 300, 'max_depth': 6, 'min_samples_split': 17, 'min_samples_leaf': 15, 'max_features': 'sqrt'}. Best is trial 43 with value: 0.7791670855007999.
[I 2026-06-07 12:45:14,508] Trial 53 finished with value: 0.7599826497960278 and parameters: {'n_estimators': 50, 'max_depth': 8, 'min_samples_split': 13, 'min_samples_leaf': 15, 'max_features': 'log2'}. Best is trial 43 with value: 0.7791670855007999.
[I 2026-06-07 12:59:45,764] Trial 54 finished with value: 0.7769263228876101 and parameters: {'n_estimators': 300, 'max_depth': 5, 'min_samples_split': 13, 'min_samples_leaf': 14, 'max_features': 'log2'}. Best is trial 43 with value: 0.7791670855007999.
[I 2026-06-07 13:04:07,631] Trial 55 finished with value: 0.7769263228876101 and parameters: {'n_estimators': 300, 'max_depth': 5, 'min_samples_split': 14, 'min_samples_leaf': 14, 'max_features': 'log2'}. Best is trial 43 with value: 0.7791670855007999.
[I 2026-06-07 13:16:13,940] Trial 52 finished with value: 0.7620205396258973 and parameters: {'n_estimators': 300, 'max_depth': 5, 'min_samples_split': 11, 'min_samples_leaf': 15, 'max_features': 'sqrt'}. Best is trial 43 with value: 0.7791670855007999.
[I 2026-06-07 13:18:30,654] Trial 56 finished with value: 0.7769263228876101 and parameters: {'n_estimators': 300, 'max_depth': 5, 'min_samples_split': 14, 'min_samples_leaf': 14, 'max_features': 'log2'}. Best is trial 43 with value: 0.7791670855007999.
[I 2026-06-07 13:19:16,182] Trial 51 finished with value: 0.7634655173858049 and parameters: {'n_estimators': 300, 'max_depth': 8, 'min_samples_split': 11, 'min_samples_leaf': 15, 'max_features': 'sqrt'}. Best is trial 43 with value: 0.7791670855007999.
[I 2026-06-07 13:28:29,461] Trial 57 finished with value: 0.7804330116687189 and parameters: {'n_estimators': 300, 'max_depth': 9, 'min_samples_split': 11, 'min_samples_leaf': 15, 'max_features': 'log2'}. Best is trial 57 with value: 0.7804330116687189.
[I 2026-06-07 13:40:33,587] Trial 58 finished with value: 0.7754357969157054 and parameters: {'n_estimators': 300, 'max_depth': 9, 'min_samples_split': 14, 'min_samples_leaf': 14, 'max_features': 'log2'}. Best is trial 57 with value: 0.7804330116687189.
[I 2026-06-07 13:42:40,981] Trial 59 finished with value: 0.7804330116687189 and parameters: {'n_estimators': 300, 'max_depth': 9, 'min_samples_split': 16, 'min_samples_leaf': 15, 'max_features': 'log2'}. Best is trial 57 with value: 0.7804330116687189.
[I 2026-06-07 13:44:38,363] Trial 60 finished with value: 0.7745447272970958 and parameters: {'n_estimators': 300, 'max_depth': 9, 'min_samples_split': 15, 'min_samples_leaf': 5, 'max_features': 'log2'}. Best is trial 57 with value: 0.7804330116687189.
[I 2026-06-07 13:52:52,107] Trial 61 finished with value: 0.7804330116687189 and parameters: {'n_estimators': 300, 'max_depth': 9, 'min_samples_split': 11, 'min_samples_leaf': 15, 'max_features': 'log2'}. Best is trial 57 with value: 0.7804330116687189.
[I 2026-06-07 14:03:24,548] Trial 63 finished with value: 0.7733217316278408 and parameters: {'n_estimators': 250, 'max_depth': 9, 'min_samples_split': 18, 'min_samples_leaf': 5, 'max_features': 'log2'}. Best is trial 57 with value: 0.7804330116687189.
[I 2026-06-07 14:04:42,047] Trial 62 finished with value: 0.7804330116687189 and parameters: {'n_estimators': 300, 'max_depth': 9, 'min_samples_split': 11, 'min_samples_leaf': 15, 'max_features': 'log2'}. Best is trial 57 with value: 0.7804330116687189.
[I 2026-06-07 14:09:58,734] Trial 64 finished with value: 0.7731018437078548 and parameters: {'n_estimators': 300, 'max_depth': 10, 'min_samples_split': 16, 'min_samples_leaf': 15, 'max_features': 'log2'}. Best is trial 57 with value: 0.7804330116687189.
[I 2026-06-07 14:17:12,731] Trial 65 finished with value: 0.7804330116687189 and parameters: {'n_estimators': 300, 'max_depth': 9, 'min_samples_split': 11, 'min_samples_leaf': 15, 'max_features': 'log2'}. Best is trial 57 with value: 0.7804330116687189.
[I 2026-06-07 14:28:20,899] Trial 66 finished with value: 0.7731018437078548 and parameters: {'n_estimators': 300, 'max_depth': 10, 'min_samples_split': 11, 'min_samples_leaf': 15, 'max_features': 'log2'}. Best is trial 57 with value: 0.7804330116687189.
[I 2026-06-07 14:29:34,209] Trial 67 finished with value: 0.7731018437078548 and parameters: {'n_estimators': 300, 'max_depth': 10, 'min_samples_split': 10, 'min_samples_leaf': 15, 'max_features': 'log2'}. Best is trial 57 with value: 0.7804330116687189.
[I 2026-06-07 14:35:10,305] Trial 68 finished with value: 0.7731018437078548 and parameters: {'n_estimators': 300, 'max_depth': 10, 'min_samples_split': 10, 'min_samples_leaf': 15, 'max_features': 'log2'}. Best is trial 57 with value: 0.7804330116687189.
[I 2026-06-07 14:37:48,834] Trial 69 finished with value: 0.7810068144313489 and parameters: {'n_estimators': 250, 'max_depth': 9, 'min_samples_split': 10, 'min_samples_leaf': 15, 'max_features': 'log2'}. Best is trial 69 with value: 0.7810068144313489.
[I 2026-06-07 14:48:30,083] Trial 70 finished with value: 0.7810068144313489 and parameters: {'n_estimators': 250, 'max_depth': 9, 'min_samples_split': 10, 'min_samples_leaf': 15, 'max_features': 'log2'}. Best is trial 69 with value: 0.7810068144313489.
[I 2026-06-07 14:49:46,933] Trial 71 finished with value: 0.7810068144313489 and parameters: {'n_estimators': 250, 'max_depth': 9, 'min_samples_split': 10, 'min_samples_leaf': 15, 'max_features': 'log2'}. Best is trial 69 with value: 0.7810068144313489.
[I 2026-06-07 14:55:32,200] Trial 72 finished with value: 0.7810068144313489 and parameters: {'n_estimators': 250, 'max_depth': 9, 'min_samples_split': 12, 'min_samples_leaf': 15, 'max_features': 'log2'}. Best is trial 69 with value: 0.7810068144313489.
[I 2026-06-07 14:58:15,651] Trial 73 finished with value: 0.7810068144313489 and parameters: {'n_estimators': 250, 'max_depth': 9, 'min_samples_split': 8, 'min_samples_leaf': 15, 'max_features': 'log2'}. Best is trial 69 with value: 0.7810068144313489.
