[I 2026-06-28 01:39:04,616] Trial 63 finished with value: 0.7698749501640751 and parameters: {'num_nodes': [32], 'dropout': 0.2709156004611408, 'learning_rate': 0.009726296584912001, 'batch_norm': True}. Best is trial 52 with value: 0.779334192044653.
/scratch.hpc/luca.cotugno/Foundation_model_clinical_data/test_tabular_model.py:481: UserWarning: Choices for a categorical distribution should be a tuple of None, bool, int, float and str for persistent storage but contains [32] which is of type list.
  num_nodes  = trial.suggest_categorical("num_nodes", [[32], [64], [128], [64, 32], [128, 64]])
/scratch.hpc/luca.cotugno/Foundation_model_clinical_data/test_tabular_model.py:481: UserWarning: Choices for a categorical distribution should be a tuple of None, bool, int, float and str for persistent storage but contains [64] which is of type list.
  num_nodes  = trial.suggest_categorical("num_nodes", [[32], [64], [128], [64, 32], [128, 64]])
/scratch.hpc/luca.cotugno/Foundation_model_clinical_data/test_tabular_model.py:481: UserWarning: Choices for a categorical distribution should be a tuple of None, bool, int, float and str for persistent storage but contains [128] which is of type list.
  num_nodes  = trial.suggest_categorical("num_nodes", [[32], [64], [128], [64, 32], [128, 64]])
/scratch.hpc/luca.cotugno/Foundation_model_clinical_data/test_tabular_model.py:481: UserWarning: Choices for a categorical distribution should be a tuple of None, bool, int, float and str for persistent storage but contains [64, 32] which is of type list.
  num_nodes  = trial.suggest_categorical("num_nodes", [[32], [64], [128], [64, 32], [128, 64]])
/scratch.hpc/luca.cotugno/Foundation_model_clinical_data/test_tabular_model.py:481: UserWarning: Choices for a categorical distribution should be a tuple of None, bool, int, float and str for persistent storage but contains [128, 64] which is of type list.
  num_nodes  = trial.suggest_categorical("num_nodes", [[32], [64], [128], [64, 32], [128, 64]])

17:	[0s / 2s],		train_loss: 4.2706
99:	[0s / 13s],		train_loss: 3.6157
16:	[0s / 9s],		train_loss: 4.2462
18:	[0s / 2s],		train_loss: 4.2630
81:	[0s / 14s],		train_loss: 4.0480
72:	[1s / 1m:8s],		train_loss: 4.1795
38:	[0s / 12s],		train_loss: 4.2099
6:	[1s / 12s],		train_loss: 4.3128
0:	[0s / 0s],		train_loss: 4.5864
19:	[0s / 3s],		train_loss: 4.2718
82:	[0s / 14s],		train_loss: 4.0618
1:	[0s / 0s],		train_loss: 4.3948
20:	[0s / 3s],		train_loss: 4.2743
83:	[0s / 15s],		train_loss: 4.0828
2:	[0s / 0s],		train_loss: 4.3316
39:	[0s / 13s],		train_loss: 4.1796
21:	[0s / 3s],		train_loss: 4.2465
17:	[0s / 10s],		train_loss: 4.2491
3:	[0s / 0s],		train_loss: 4.3026
84:	[0s / 15s],		train_loss: 4.0495
22:	[0s / 3s],		train_loss: 4.2510
4:	[0s / 0s],		train_loss: 4.3211
85:	[0s / 15s],		train_loss: 4.0409
40:	[0s / 13s],		train_loss: 4.2373
23:	[0s / 3s],		train_loss: 4.2418
5:	[0s / 0s],		train_loss: 4.3254
86:	[0s / 15s],		train_loss: 4.0500
24:	[0s / 3s],		train_loss: 4.2803
73:	[0s / 1m:9s],		train_loss: 4.1644
6:	[0s / 0s],		train_loss: 4.3073
25:	[0s / 3s],		train_loss: 4.2614
87:	[0s / 15s],		train_loss: 4.0339
7:	[0s / 1s],		train_loss: 4.2924
41:	[0s / 13s],		train_loss: 4.2285
18:	[0s / 10s],		train_loss: 4.2211
26:	[0s / 4s],		train_loss: 4.2625
88:	[0s / 15s],		train_loss: 4.0142
8:	[0s / 1s],		train_loss: 4.2981
27:	[0s / 4s],		train_loss: 4.2536
9:	[0s / 1s],		train_loss: 4.2938
89:	[0s / 16s],		train_loss: 4.0881
42:	[0s / 14s],		train_loss: 4.2332
28:	[0s / 4s],		train_loss: 4.2340
10:	[0s / 1s],		train_loss: 4.3050
90:	[0s / 16s],		train_loss: 4.0897
29:	[0s / 4s],		train_loss: 4.2261
11:	[0s / 1s],		train_loss: 4.2675
91:	[0s / 16s],		train_loss: 4.0011
19:	[0s / 11s],		train_loss: 4.2037
30:	[0s / 4s],		train_loss: 4.2283
43:	[0s / 14s],		train_loss: 4.2132
12:	[0s / 1s],		train_loss: 4.3002
92:	[0s / 16s],		train_loss: 4.0375
31:	[0s / 4s],		train_loss: 4.2299
13:	[0s / 1s],		train_loss: 4.2685
74:	[0s / 1m:10s],		train_loss: 4.1045
7:	[1s / 14s],		train_loss: 4.2996
14:	[0s / 2s],		train_loss: 4.2969
32:	[0s / 4s],		train_loss: 4.2394
93:	[0s / 16s],		train_loss: 4.0110
44:	[0s / 14s],		train_loss: 4.1960
15:	[0s / 2s],		train_loss: 4.2808
33:	[0s / 5s],		train_loss: 4.2298
94:	[0s / 17s],		train_loss: 4.0741
20:	[0s / 12s],		train_loss: 4.2477
16:	[0s / 2s],		train_loss: 4.2654
34:	[0s / 5s],		train_loss: 4.2068
95:	[0s / 17s],		train_loss: 4.0473
45:	[0s / 15s],		train_loss: 4.2089
17:	[0s / 2s],		train_loss: 4.2438
35:	[0s / 5s],		train_loss: 4.2108
96:	[0s / 17s],		train_loss: 4.0226
18:	[0s / 2s],		train_loss: 4.2344
36:	[0s / 5s],		train_loss: 4.2180
19:	[0s / 2s],		train_loss: 4.2690
97:	[0s / 17s],		train_loss: 4.0537
46:	[0s / 15s],		train_loss: 4.1877
37:	[0s / 5s],		train_loss: 4.1903
20:	[0s / 2s],		train_loss: 4.2315
75:	[0s / 1m:11s],		train_loss: 4.1048
63:	[4s / 3m:0s],		train_loss: 4.1486
38:	[0s / 5s],		train_loss: 4.2078
98:	[0s / 17s],		train_loss: 4.0388
21:	[0s / 12s],		train_loss: 4.2336
21:	[0s / 3s],		train_loss: 4.2408
39:	[0s / 5s],		train_loss: 4.2136
47:	[0s / 15s],		train_loss: 4.1734
99:	[0s / 17s],		train_loss: 4.1852
22:	[0s / 3s],		train_loss: 4.2654
40:	[0s / 6s],		train_loss: 4.2369
23:	[0s / 3s],		train_loss: 4.2412
41:	[0s / 6s],		train_loss: 4.2104
0:	[0s / 0s],		train_loss: 4.6511
48:	[0s / 16s],		train_loss: 4.1651
24:	[0s / 3s],		train_loss: 4.2435
42:	[0s / 6s],		train_loss: 4.1817
22:	[0s / 13s],		train_loss: 4.1960
1:	[0s / 0s],		train_loss: 4.5207
25:	[0s / 3s],		train_loss: 4.2222
43:	[0s / 6s],		train_loss: 4.2061
26:	[0s / 3s],		train_loss: 4.2705
76:	[0s / 1m:12s],		train_loss: 4.1220
8:	[1s / 16s],		train_loss: 4.2980
49:	[0s / 16s],		train_loss: 4.1682
2:	[0s / 0s],		train_loss: 4.4402
44:	[0s / 6s],		train_loss: 4.2019
27:	[0s / 4s],		train_loss: 4.2617
45:	[0s / 6s],		train_loss: 4.2154
3:	[0s / 0s],		train_loss: 4.3845
28:	[0s / 4s],		train_loss: 4.2554
46:	[0s / 7s],		train_loss: 4.2003
50:	[0s / 16s],		train_loss: 4.1766
4:	[0s / 0s],		train_loss: 4.3450
29:	[0s / 4s],		train_loss: 4.2558
23:	[0s / 14s],		train_loss: 4.1616
47:	[0s / 7s],		train_loss: 4.1947
30:	[0s / 4s],		train_loss: 4.2560
5:	[0s / 1s],		train_loss: 4.3701
48:	[0s / 7s],		train_loss: 4.1864
31:	[0s / 4s],		train_loss: 4.2181
51:	[0s / 17s],		train_loss: 4.1687
6:	[0s / 1s],		train_loss: 4.3350
49:	[0s / 7s],		train_loss: 4.2216
32:	[0s / 4s],		train_loss: 4.2471
50:	[0s / 7s],		train_loss: 4.1885
7:	[0s / 1s],		train_loss: 4.3120
24:	[0s / 14s],		train_loss: 4.1962
33:	[0s / 4s],		train_loss: 4.2181
77:	[1s / 1m:13s],		train_loss: 4.0657
52:	[0s / 17s],		train_loss: 4.1774
51:	[0s / 7s],		train_loss: 4.1831
34:	[0s / 5s],		train_loss: 4.2270
8:	[0s / 1s],		train_loss: 4.3084
52:	[0s / 7s],		train_loss: 4.1767
35:	[0s / 5s],		train_loss: 4.2231
9:	[0s / 1s],		train_loss: 4.2877
53:	[0s / 8s],		train_loss: 4.1553
36:	[0s / 5s],		train_loss: 4.2108
53:	[0s / 17s],		train_loss: 4.1446
10:	[0s / 2s],		train_loss: 4.2818
37:	[0s / 5s],		train_loss: 4.2002
54:	[0s / 8s],		train_loss: 4.2149
25:	[0s / 15s],		train_loss: 4.1717
38:	[0s / 5s],		train_loss: 4.2357
55:	[0s / 8s],		train_loss: 4.1838
11:	[0s / 2s],		train_loss: 4.2752
54:	[0s / 18s],		train_loss: 4.1470
39:	[0s / 5s],		train_loss: 4.2451
56:	[0s / 8s],		train_loss: 4.1823
12:	[0s / 2s],		train_loss: 4.3002
40:	[0s / 5s],		train_loss: 4.2119
57:	[0s / 8s],		train_loss: 4.1838
78:	[1s / 1m:14s],		train_loss: 4.1050
9:	[2s / 18s],		train_loss: 4.3086
13:	[0s / 2s],		train_loss: 4.2706
41:	[0s / 6s],		train_loss: 4.2271
58:	[0s / 8s],		train_loss: 4.1550
55:	[0s / 18s],		train_loss: 4.1882
26:	[0s / 15s],		train_loss: 4.1429
42:	[0s / 6s],		train_loss: 4.2125
14:	[0s / 2s],		train_loss: 4.2642
59:	[0s / 9s],		train_loss: 4.1537
43:	[0s / 6s],		train_loss: 4.2110
60:	[0s / 9s],		train_loss: 4.1504
15:	[0s / 3s],		train_loss: 4.2357
64:	[3s / 3m:4s],		train_loss: 4.1230
56:	[0s / 19s],		train_loss: 4.1925
44:	[0s / 6s],		train_loss: 4.1858
61:	[0s / 9s],		train_loss: 4.1705
16:	[0s / 3s],		train_loss: 4.2242
45:	[0s / 6s],		train_loss: 4.1756
62:	[0s / 9s],		train_loss: 4.1820
27:	[0s / 16s],		train_loss: 4.1595
46:	[0s / 6s],		train_loss: 4.1864
57:	[0s / 19s],		train_loss: 4.1541
17:	[0s / 3s],		train_loss: 4.2089
63:	[0s / 9s],		train_loss: 4.2018
79:	[0s / 1m:15s],		train_loss: 4.1308
47:	[0s / 6s],		train_loss: 4.1830
64:	[0s / 9s],		train_loss: 4.1704
18:	[0s / 3s],		train_loss: 4.1980
48:	[0s / 7s],		train_loss: 4.1913
65:	[0s / 9s],		train_loss: 4.1709
58:	[0s / 19s],		train_loss: 4.1694
19:	[0s / 3s],		train_loss: 4.2313
49:	[0s / 7s],		train_loss: 4.1795
28:	[0s / 16s],		train_loss: 4.1818
66:	[0s / 10s],		train_loss: 4.1796
50:	[0s / 7s],		train_loss: 4.1763
20:	[0s / 4s],		train_loss: 4.1991
67:	[0s / 10s],		train_loss: 4.2082
59:	[0s / 20s],		train_loss: 4.1726
51:	[0s / 7s],		train_loss: 4.1691
68:	[0s / 10s],		train_loss: 4.1461
21:	[0s / 4s],		train_loss: 4.1870
52:	[0s / 7s],		train_loss: 4.1633
69:	[0s / 10s],		train_loss: 4.1664
10:	[1s / 19s],		train_loss: 4.2937
53:	[0s / 7s],		train_loss: 4.1585
22:	[0s / 4s],		train_loss: 4.1699
29:	[0s / 17s],		train_loss: 4.1827
60:	[0s / 20s],		train_loss: 4.1647
80:	[0s / 1m:16s],		train_loss: 4.1080
70:	[0s / 10s],		train_loss: 4.1491
54:	[0s / 7s],		train_loss: 4.1598
23:	[0s / 4s],		train_loss: 4.1526
71:	[0s / 10s],		train_loss: 4.1623
55:	[0s / 8s],		train_loss: 4.1617
61:	[0s / 20s],		train_loss: 4.1575
72:	[0s / 10s],		train_loss: 4.1511
24:	[0s / 4s],		train_loss: 4.1591
56:	[0s / 8s],		train_loss: 4.1373
73:	[0s / 11s],		train_loss: 4.1670
57:	[0s / 8s],		train_loss: 4.1558
30:	[0s / 18s],		train_loss: 4.1620
25:	[0s / 4s],		train_loss: 4.1470
74:	[0s / 11s],		train_loss: 4.1628
62:	[0s / 21s],		train_loss: 4.1357
58:	[0s / 8s],		train_loss: 4.1633
26:	[0s / 5s],		train_loss: 4.1423
75:	[0s / 11s],		train_loss: 4.1575
59:	[0s / 8s],		train_loss: 4.1779
27:	[0s / 5s],		train_loss: 4.1288
76:	[0s / 11s],		train_loss: 4.1624
60:	[0s / 8s],		train_loss: 4.1753
63:	[0s / 21s],		train_loss: 4.1687
81:	[0s / 1m:17s],		train_loss: 4.1427
77:	[0s / 11s],		train_loss: 4.1544
61:	[0s / 8s],		train_loss: 4.1199
28:	[0s / 5s],		train_loss: 4.1373
31:	[0s / 18s],		train_loss: 4.0943
78:	[0s / 11s],		train_loss: 4.1636
62:	[0s / 9s],		train_loss: 4.1096
29:	[0s / 5s],		train_loss: 4.1144
64:	[0s / 21s],		train_loss: 4.1625
79:	[0s / 11s],		train_loss: 4.1628
63:	[0s / 9s],		train_loss: 4.1351
80:	[0s / 12s],		train_loss: 4.1308
64:	[0s / 9s],		train_loss: 4.1276
30:	[0s / 5s],		train_loss: 4.0923
65:	[0s / 9s],		train_loss: 4.1219
65:	[0s / 22s],		train_loss: 4.1925
81:	[0s / 12s],		train_loss: 4.1379
31:	[0s / 6s],		train_loss: 4.0595
32:	[0s / 19s],		train_loss: 4.1065
66:	[0s / 9s],		train_loss: 4.1285
82:	[0s / 12s],		train_loss: 4.1483
32:	[0s / 6s],		train_loss: 4.0749
67:	[0s / 9s],		train_loss: 4.1558
83:	[0s / 12s],		train_loss: 4.1392
11:	[1s / 21s],		train_loss: 4.3025
66:	[0s / 22s],		train_loss: 4.1373
68:	[0s / 9s],		train_loss: 4.1398
33:	[0s / 6s],		train_loss: 4.0343
84:	[0s / 12s],		train_loss: 4.1938
82:	[1s / 1m:18s],		train_loss: 4.1329
69:	[0s / 9s],		train_loss: 4.1532
85:	[0s / 12s],		train_loss: 4.1477
34:	[0s / 6s],		train_loss: 4.0955
33:	[0s / 19s],		train_loss: 4.1168
70:	[0s / 10s],		train_loss: 4.1090
86:	[0s / 13s],		train_loss: 4.1213
67:	[0s / 22s],		train_loss: 4.1495
35:	[0s / 6s],		train_loss: 4.0864
71:	[0s / 10s],		train_loss: 4.1110
87:	[0s / 13s],		train_loss: 4.1299
65:	[3s / 3m:8s],		train_loss: 4.1182
72:	[0s / 10s],		train_loss: 4.1102
36:	[0s / 7s],		train_loss: 4.0816
88:	[0s / 13s],		train_loss: 4.1558
68:	[0s / 23s],		train_loss: 4.1555
73:	[0s / 10s],		train_loss: 4.1404
34:	[0s / 20s],		train_loss: 4.1266
89:	[0s / 13s],		train_loss: 4.1297
37:	[0s / 7s],		train_loss: 4.0597
74:	[0s / 10s],		train_loss: 4.1991
90:	[0s / 13s],		train_loss: 4.1435
38:	[0s / 7s],		train_loss: 4.0581
69:	[0s / 23s],		train_loss: 4.1494
75:	[0s / 10s],		train_loss: 4.1586
91:	[0s / 13s],		train_loss: 4.1345
83:	[1s / 1m:19s],		train_loss: 4.1032
76:	[0s / 11s],		train_loss: 4.1456
39:	[0s / 7s],		train_loss: 4.0100
92:	[0s / 13s],		train_loss: 4.1929
77:	[0s / 11s],		train_loss: 4.1587
70:	[0s / 23s],		train_loss: 4.1612
35:	[0s / 20s],		train_loss: 4.1282
40:	[0s / 7s],		train_loss: 4.0306
93:	[0s / 14s],		train_loss: 4.1584
78:	[0s / 11s],		train_loss: 4.1743
94:	[0s / 14s],		train_loss: 4.1523
41:	[0s / 8s],		train_loss: 4.0158
79:	[0s / 11s],		train_loss: 4.1806
95:	[0s / 14s],		train_loss: 4.1431
71:	[0s / 24s],		train_loss: 4.1307
80:	[0s / 11s],		train_loss: 4.1791
12:	[1s / 23s],		train_loss: 4.3114
42:	[0s / 8s],		train_loss: 3.9938
96:	[0s / 14s],		train_loss: 4.1370
81:	[0s / 11s],		train_loss: 4.1362
36:	[0s / 21s],		train_loss: 4.1052
43:	[0s / 8s],		train_loss: 4.0228
97:	[0s / 14s],		train_loss: 4.1335
82:	[0s / 11s],		train_loss: 4.1429
72:	[0s / 24s],		train_loss: 4.1536
84:	[1s / 1m:20s],		train_loss: 4.1294
98:	[0s / 14s],		train_loss: 4.1311
83:	[0s / 12s],		train_loss: 4.1735
44:	[0s / 8s],		train_loss: 4.0257
84:	[0s / 12s],		train_loss: 4.2013
99:	[0s / 14s],		train_loss: 4.1432
45:	[0s / 8s],		train_loss: 4.0012
85:	[0s / 12s],		train_loss: 4.1211
73:	[0s / 25s],		train_loss: 4.1265
46:	[0s / 9s],		train_loss: 3.9819
37:	[0s / 22s],		train_loss: 4.0889
0:	[0s / 0s],		train_loss: 4.5372
86:	[0s / 12s],		train_loss: 4.1700
47:	[0s / 9s],		train_loss: 3.9642
1:	[0s / 0s],		train_loss: 4.4000
87:	[0s / 12s],		train_loss: 4.1361
74:	[0s / 25s],		train_loss: 4.1303
48:	[0s / 9s],		train_loss: 3.9870
88:	[0s / 12s],		train_loss: 4.1397
2:	[0s / 0s],		train_loss: 4.3518
89:	[0s / 12s],		train_loss: 4.1434
3:	[0s / 0s],		train_loss: 4.3539
49:	[0s / 9s],		train_loss: 3.9535
38:	[0s / 22s],		train_loss: 4.1002
90:	[0s / 13s],		train_loss: 4.1616
4:	[0s / 0s],		train_loss: 4.3500
85:	[1s / 1m:21s],		train_loss: 4.1064
75:	[0s / 25s],		train_loss: 4.1412
50:	[0s / 9s],		train_loss: 3.9540
91:	[0s / 13s],		train_loss: 4.1256
5:	[0s / 0s],		train_loss: 4.3135
92:	[0s / 13s],		train_loss: 4.1549
51:	[0s / 9s],		train_loss: 3.9481
6:	[0s / 1s],		train_loss: 4.3393
76:	[0s / 26s],		train_loss: 4.1122
93:	[0s / 13s],		train_loss: 4.1434
7:	[0s / 1s],		train_loss: 4.3350
52:	[0s / 10s],		train_loss: 3.9801
39:	[0s / 23s],		train_loss: 4.1252
94:	[0s / 13s],		train_loss: 4.1380
8:	[0s / 1s],		train_loss: 4.3442
53:	[0s / 10s],		train_loss: 3.9612
95:	[0s / 13s],		train_loss: 4.0949
13:	[2s / 26s],		train_loss: 4.2734
9:	[0s / 1s],		train_loss: 4.3147
77:	[0s / 26s],		train_loss: 4.0947
96:	[0s / 13s],		train_loss: 4.1287
54:	[0s / 10s],		train_loss: 3.9464
10:	[0s / 1s],		train_loss: 4.3023
97:	[0s / 14s],		train_loss: 4.1537
86:	[1s / 1m:22s],		train_loss: 4.0873
55:	[0s / 10s],		train_loss: 3.9070
11:	[0s / 1s],		train_loss: 4.2974
98:	[0s / 14s],		train_loss: 4.1725
66:	[3s / 3m:12s],		train_loss: 4.1432
78:	[0s / 26s],		train_loss: 4.1342
12:	[0s / 1s],		train_loss: 4.2997
40:	[0s / 23s],		train_loss: 4.0524
56:	[0s / 10s],		train_loss: 3.9437
99:	[0s / 14s],		train_loss: 4.1724
13:	[0s / 2s],		train_loss: 4.2975
57:	[0s / 11s],		train_loss: 3.9372
14:	[0s / 2s],		train_loss: 4.2857
0:	[0s / 0s],		train_loss: 4.9983
79:	[0s / 27s],		train_loss: 4.1546
58:	[0s / 11s],		train_loss: 3.9165
15:	[0s / 2s],		train_loss: 4.2715
1:	[0s / 0s],		train_loss: 4.5889
16:	[0s / 2s],		train_loss: 4.2975
59:	[0s / 11s],		train_loss: 3.9574
2:	[0s / 0s],		train_loss: 4.5427
41:	[0s / 24s],		train_loss: 4.0684
80:	[0s / 27s],		train_loss: 4.1268
17:	[0s / 2s],		train_loss: 4.2824
3:	[0s / 0s],		train_loss: 4.4874
60:	[0s / 11s],		train_loss: 3.9147
87:	[1s / 1m:23s],		train_loss: 4.1219
18:	[0s / 2s],		train_loss: 4.2821
4:	[0s / 0s],		train_loss: 4.4803
61:	[0s / 11s],		train_loss: 3.9350
19:	[0s / 2s],		train_loss: 4.2560
5:	[0s / 0s],		train_loss: 4.4638
81:	[0s / 28s],		train_loss: 4.1320
62:	[0s / 12s],		train_loss: 3.9345
6:	[0s / 0s],		train_loss: 4.3995
20:	[0s / 3s],		train_loss: 4.2868
7:	[0s / 1s],		train_loss: 4.4402
21:	[0s / 3s],		train_loss: 4.2810
63:	[0s / 12s],		train_loss: 3.8918
42:	[0s / 25s],		train_loss: 4.0679
8:	[0s / 1s],		train_loss: 4.4130
22:	[0s / 3s],		train_loss: 4.2783
82:	[0s / 28s],		train_loss: 4.1289
64:	[0s / 12s],		train_loss: 3.9110
9:	[0s / 1s],		train_loss: 4.3626
23:	[0s / 3s],		train_loss: 4.2672
65:	[0s / 12s],		train_loss: 3.9190
10:	[0s / 1s],		train_loss: 4.3919
24:	[0s / 3s],		train_loss: 4.2678
14:	[2s / 28s],		train_loss: 4.2603
83:	[0s / 28s],		train_loss: 4.1194
11:	[0s / 1s],		train_loss: 4.4002
25:	[0s / 3s],		train_loss: 4.2909
66:	[0s / 12s],		train_loss: 3.8825
43:	[0s / 25s],		train_loss: 4.0376
12:	[0s / 1s],		train_loss: 4.3810
88:	[1s / 1m:25s],		train_loss: 4.1004
26:	[0s / 3s],		train_loss: 4.2955
67:	[0s / 13s],		train_loss: 3.8953
13:	[0s / 1s],		train_loss: 4.3496
27:	[0s / 4s],		train_loss: 4.2722
84:	[0s / 29s],		train_loss: 4.1284
14:	[0s / 2s],		train_loss: 4.3454
68:	[0s / 13s],		train_loss: 3.8680
28:	[0s / 4s],		train_loss: 4.2809
15:	[0s / 2s],		train_loss: 4.3435
29:	[0s / 4s],		train_loss: 4.2439
69:	[0s / 13s],		train_loss: 3.8688
16:	[0s / 2s],		train_loss: 4.3623
44:	[0s / 26s],		train_loss: 4.0568
30:	[0s / 4s],		train_loss: 4.2565
85:	[0s / 29s],		train_loss: 4.1111
17:	[0s / 2s],		train_loss: 4.3570
70:	[0s / 13s],		train_loss: 3.8220
31:	[0s / 4s],		train_loss: 4.2968
18:	[0s / 2s],		train_loss: 4.4102
71:	[0s / 13s],		train_loss: 3.8116
32:	[0s / 4s],		train_loss: 4.2630
19:	[0s / 2s],		train_loss: 4.4071
86:	[0s / 29s],		train_loss: 4.1095
89:	[1s / 1m:26s],		train_loss: 4.1039
33:	[0s / 4s],		train_loss: 4.2684
72:	[0s / 14s],		train_loss: 3.8425
20:	[0s / 2s],		train_loss: 4.3655
45:	[0s / 27s],		train_loss: 3.9996
34:	[0s / 5s],		train_loss: 4.2551
21:	[0s / 3s],		train_loss: 4.3214
73:	[0s / 14s],		train_loss: 3.8231
35:	[0s / 5s],		train_loss: 4.2321
22:	[0s / 3s],		train_loss: 4.3380
87:	[0s / 30s],		train_loss: 4.0859
74:	[0s / 14s],		train_loss: 3.8700
36:	[0s / 5s],		train_loss: 4.2869
23:	[0s / 3s],		train_loss: 4.3186
37:	[0s / 5s],		train_loss: 4.2666
75:	[0s / 14s],		train_loss: 3.8628
24:	[0s / 3s],		train_loss: 4.3030
38:	[0s / 5s],		train_loss: 4.2527
88:	[0s / 30s],		train_loss: 4.1161
25:	[0s / 3s],		train_loss: 4.3153
76:	[0s / 14s],		train_loss: 3.8372
39:	[0s / 5s],		train_loss: 4.2764
46:	[0s / 27s],		train_loss: 4.0153
26:	[0s / 3s],		train_loss: 4.3061
77:	[0s / 14s],		train_loss: 3.7912
40:	[0s / 5s],		train_loss: 4.2298
27:	[0s / 3s],		train_loss: 4.3101
90:	[1s / 1m:27s],		train_loss: 4.0644
89:	[0s / 31s],		train_loss: 4.1011
41:	[0s / 6s],		train_loss: 4.2472
78:	[0s / 15s],		train_loss: 3.8112
15:	[2s / 30s],		train_loss: 4.2835
28:	[0s / 3s],		train_loss: 4.2857
42:	[0s / 6s],		train_loss: 4.2545
29:	[0s / 4s],		train_loss: 4.2763
79:	[0s / 15s],		train_loss: 3.8118
67:	[4s / 3m:16s],		train_loss: 4.1364
43:	[0s / 6s],		train_loss: 4.2452
30:	[0s / 4s],		train_loss: 4.2894
90:	[0s / 31s],		train_loss: 4.0892
80:	[0s / 15s],		train_loss: 3.8491
47:	[0s / 28s],		train_loss: 4.0186
44:	[0s / 6s],		train_loss: 4.2440
31:	[0s / 4s],		train_loss: 4.2992
81:	[0s / 15s],		train_loss: 3.7983
45:	[0s / 6s],		train_loss: 4.2530
32:	[0s / 4s],		train_loss: 4.3409
46:	[0s / 6s],		train_loss: 4.2257
33:	[0s / 4s],		train_loss: 4.3261
82:	[0s / 15s],		train_loss: 3.8437
91:	[0s / 31s],		train_loss: 4.1225
47:	[0s / 6s],		train_loss: 4.2327
34:	[0s / 4s],		train_loss: 4.2998
83:	[0s / 15s],		train_loss: 3.8525
48:	[0s / 6s],		train_loss: 4.2442
35:	[0s / 4s],		train_loss: 4.2795
91:	[1s / 1m:28s],		train_loss: 4.0460
48:	[0s / 29s],		train_loss: 3.9950
92:	[0s / 32s],		train_loss: 4.1699
36:	[0s / 4s],		train_loss: 4.3141
49:	[0s / 7s],		train_loss: 4.2495
84:	[0s / 16s],		train_loss: 3.8016
37:	[0s / 5s],		train_loss: 4.2718
50:	[0s / 7s],		train_loss: 4.2407
85:	[0s / 16s],		train_loss: 3.8035
38:	[0s / 5s],		train_loss: 4.2858
51:	[0s / 7s],		train_loss: 4.2343
86:	[0s / 16s],		train_loss: 3.8599
93:	[0s / 32s],		train_loss: 4.1175
39:	[0s / 5s],		train_loss: 4.2956
52:	[0s / 7s],		train_loss: 4.2752
40:	[0s / 5s],		train_loss: 4.2749
53:	[0s / 7s],		train_loss: 4.2338
87:	[0s / 16s],		train_loss: 3.8187
49:	[0s / 29s],		train_loss: 4.0128
41:	[0s / 5s],		train_loss: 4.2565
54:	[0s / 7s],		train_loss: 4.2377
88:	[0s / 16s],		train_loss: 3.7855
94:	[0s / 32s],		train_loss: 4.1063
42:	[0s / 5s],		train_loss: 4.2565
55:	[0s / 8s],		train_loss: 4.2490
89:	[0s / 17s],		train_loss: 3.7559
43:	[0s / 5s],		train_loss: 4.2895
56:	[0s / 8s],		train_loss: 4.2244
92:	[1s / 1m:29s],		train_loss: 4.0893
90:	[0s / 17s],		train_loss: 3.7508
95:	[0s / 33s],		train_loss: 4.1197
44:	[0s / 6s],		train_loss: 4.3126
57:	[0s / 8s],		train_loss: 4.2327
50:	[0s / 30s],		train_loss: 4.0155
45:	[0s / 6s],		train_loss: 4.2824
91:	[0s / 17s],		train_loss: 3.7276
58:	[0s / 8s],		train_loss: 4.2433
46:	[0s / 6s],		train_loss: 4.3307
16:	[2s / 33s],		train_loss: 4.3016
59:	[0s / 8s],		train_loss: 4.2513
92:	[0s / 17s],		train_loss: 3.7415
96:	[0s / 33s],		train_loss: 4.0954
47:	[0s / 6s],		train_loss: 4.2862
60:	[0s / 8s],		train_loss: 4.2339
93:	[0s / 17s],		train_loss: 3.7036
48:	[0s / 6s],		train_loss: 4.2824
61:	[0s / 8s],		train_loss: 4.2436
51:	[0s / 30s],		train_loss: 3.9452
97:	[0s / 33s],		train_loss: 4.0942
49:	[0s / 6s],		train_loss: 4.2941
94:	[0s / 17s],		train_loss: 3.7447
93:	[0s / 1m:30s],		train_loss: 4.0703
62:	[0s / 9s],		train_loss: 4.2371
50:	[0s / 6s],		train_loss: 4.2933
63:	[0s / 9s],		train_loss: 4.2409
95:	[0s / 18s],		train_loss: 3.7403
51:	[0s / 7s],		train_loss: 4.2499
98:	[0s / 34s],		train_loss: 4.1296
64:	[0s / 9s],		train_loss: 4.2253
96:	[0s / 18s],		train_loss: 3.7749
52:	[0s / 7s],		train_loss: 4.2628
52:	[0s / 31s],		train_loss: 4.0171
65:	[0s / 9s],		train_loss: 4.2365
53:	[0s / 7s],		train_loss: 4.3012
97:	[0s / 18s],		train_loss: 3.6943
66:	[0s / 9s],		train_loss: 4.2355
99:	[0s / 34s],		train_loss: 4.1155
54:	[0s / 7s],		train_loss: 4.2607
98:	[0s / 18s],		train_loss: 3.7216
67:	[0s / 9s],		train_loss: 4.2485
55:	[0s / 7s],		train_loss: 