[I 2026-06-07 08:29:36,151] Trial 78 finished with value: 0.7874522019132768 and parameters: {'num_nodes': [64, 32], 'dropout': 0.1739095377776722, 'learning_rate': 0.0007811693992513941, 'batch_norm': False}. Best is trial 56 with value: 0.8080908770070512.
/scratch.hpc/luca.cotugno/Foundation_model_clinical_data/test_tabular_model_tmp.py:476: UserWarning: Choices for a categorical distribution should be a tuple of None, bool, int, float and str for persistent storage but contains [32] which is of type list.
  num_nodes  = trial.suggest_categorical("num_nodes", [[32], [64], [128], [64, 32], [128, 64]])
/scratch.hpc/luca.cotugno/Foundation_model_clinical_data/test_tabular_model_tmp.py:476: UserWarning: Choices for a categorical distribution should be a tuple of None, bool, int, float and str for persistent storage but contains [64] which is of type list.
  num_nodes  = trial.suggest_categorical("num_nodes", [[32], [64], [128], [64, 32], [128, 64]])
/scratch.hpc/luca.cotugno/Foundation_model_clinical_data/test_tabular_model_tmp.py:476: UserWarning: Choices for a categorical distribution should be a tuple of None, bool, int, float and str for persistent storage but contains [128] which is of type list.
  num_nodes  = trial.suggest_categorical("num_nodes", [[32], [64], [128], [64, 32], [128, 64]])
/scratch.hpc/luca.cotugno/Foundation_model_clinical_data/test_tabular_model_tmp.py:476: UserWarning: Choices for a categorical distribution should be a tuple of None, bool, int, float and str for persistent storage but contains [64, 32] which is of type list.
  num_nodes  = trial.suggest_categorical("num_nodes", [[32], [64], [128], [64, 32], [128, 64]])
/scratch.hpc/luca.cotugno/Foundation_model_clinical_data/test_tabular_model_tmp.py:476: UserWarning: Choices for a categorical distribution should be a tuple of None, bool, int, float and str for persistent storage but contains [128, 64] which is of type list.
  num_nodes  = trial.suggest_categorical("num_nodes", [[32], [64], [128], [64, 32], [128, 64]])

48:	[0s / 19s],		train_loss: 2.4774
74:	[0s / 32s],		train_loss: 2.4812
49:	[0s / 20s],		train_loss: 2.4865
28:	[1s / 32s],		train_loss: 2.4595
75:	[0s / 32s],		train_loss: 2.4917
65:	[0s / 43s],		train_loss: 2.4176
50:	[0s / 20s],		train_loss: 2.5066
76:	[0s / 33s],		train_loss: 2.4726
51:	[0s / 21s],		train_loss: 2.4841
66:	[0s / 43s],		train_loss: 2.4166
77:	[0s / 33s],		train_loss: 2.4871
52:	[0s / 21s],		train_loss: 2.4844
29:	[1s / 33s],		train_loss: 2.4513
78:	[0s / 33s],		train_loss: 2.4824
67:	[0s / 44s],		train_loss: 2.4318
53:	[0s / 21s],		train_loss: 2.4843
79:	[0s / 34s],		train_loss: 2.4688
54:	[0s / 22s],		train_loss: 2.4793
68:	[0s / 45s],		train_loss: 2.4239
80:	[0s / 34s],		train_loss: 2.4727
30:	[1s / 34s],		train_loss: 2.4597
55:	[0s / 22s],		train_loss: 2.4859
81:	[0s / 35s],		train_loss: 2.4865
56:	[0s / 23s],		train_loss: 2.4758
69:	[0s / 45s],		train_loss: 2.4309
82:	[0s / 35s],		train_loss: 2.4924
57:	[0s / 23s],		train_loss: 2.4998
31:	[1s / 35s],		train_loss: 2.4545
70:	[0s / 46s],		train_loss: 2.4323
83:	[0s / 36s],		train_loss: 2.4640
58:	[0s / 23s],		train_loss: 2.4839
84:	[0s / 36s],		train_loss: 2.4857
59:	[0s / 24s],		train_loss: 2.4879
71:	[0s / 47s],		train_loss: 2.4258
85:	[0s / 36s],		train_loss: 2.4696
60:	[0s / 24s],		train_loss: 2.4598
32:	[1s / 36s],		train_loss: 2.4679
72:	[0s / 47s],		train_loss: 2.4470
86:	[0s / 37s],		train_loss: 2.4847
61:	[0s / 25s],		train_loss: 2.4608
87:	[0s / 37s],		train_loss: 2.4776
62:	[0s / 25s],		train_loss: 2.4995
73:	[0s / 48s],		train_loss: 2.4126
63:	[0s / 25s],		train_loss: 2.4790
88:	[0s / 38s],		train_loss: 2.4613
33:	[1s / 37s],		train_loss: 2.4569
64:	[0s / 26s],		train_loss: 2.4921
89:	[0s / 38s],		train_loss: 2.4656
74:	[0s / 49s],		train_loss: 2.4249
65:	[0s / 26s],		train_loss: 2.4968
90:	[0s / 39s],		train_loss: 2.4628
34:	[0s / 38s],		train_loss: 2.4531
75:	[0s / 49s],		train_loss: 2.4262
66:	[0s / 27s],		train_loss: 2.5007
91:	[0s / 39s],		train_loss: 2.4592
67:	[0s / 27s],		train_loss: 2.4826
92:	[0s / 39s],		train_loss: 2.4681
76:	[0s / 50s],		train_loss: 2.4110
68:	[0s / 27s],		train_loss: 2.4835
35:	[1s / 40s],		train_loss: 2.4448
93:	[0s / 40s],		train_loss: 2.4836
77:	[0s / 51s],		train_loss: 2.4067
69:	[0s / 28s],		train_loss: 2.4815
94:	[0s / 40s],		train_loss: 2.4683
70:	[0s / 28s],		train_loss: 2.4710
95:	[0s / 41s],		train_loss: 2.4719
78:	[0s / 51s],		train_loss: 2.4144
71:	[0s / 29s],		train_loss: 2.4827
36:	[1s / 41s],		train_loss: 2.4485
96:	[0s / 41s],		train_loss: 2.4746
72:	[0s / 29s],		train_loss: 2.4786
79:	[0s / 52s],		train_loss: 2.4096
97:	[0s / 41s],		train_loss: 2.4738
73:	[0s / 29s],		train_loss: 2.4741
98:	[0s / 42s],		train_loss: 2.4681
80:	[0s / 52s],		train_loss: 2.4114
74:	[0s / 30s],		train_loss: 2.4650
37:	[1s / 42s],		train_loss: 2.4467
99:	[0s / 42s],		train_loss: 2.4693
75:	[0s / 30s],		train_loss: 2.4876
81:	[0s / 53s],		train_loss: 2.4038
0:	[0s / 0s],		train_loss: 2.8522
76:	[0s / 31s],		train_loss: 2.4651
82:	[0s / 54s],		train_loss: 2.4123
38:	[1s / 43s],		train_loss: 2.4478
1:	[0s / 0s],		train_loss: 2.6126
77:	[0s / 31s],		train_loss: 2.4820
2:	[0s / 1s],		train_loss: 2.5821
83:	[0s / 54s],		train_loss: 2.4095
78:	[0s / 32s],		train_loss: 2.4618
3:	[0s / 1s],		train_loss: 2.5542
79:	[0s / 32s],		train_loss: 2.4632
84:	[0s / 55s],		train_loss: 2.4072
39:	[1s / 44s],		train_loss: 2.4447
4:	[0s / 2s],		train_loss: 2.5348
80:	[0s / 32s],		train_loss: 2.4760
85:	[0s / 55s],		train_loss: 2.4055
5:	[0s / 2s],		train_loss: 2.5348
81:	[0s / 33s],		train_loss: 2.4589
6:	[0s / 2s],		train_loss: 2.5481
82:	[0s / 33s],		train_loss: 2.4790
86:	[0s / 56s],		train_loss: 2.4040
40:	[1s / 45s],		train_loss: 2.4347
7:	[0s / 3s],		train_loss: 2.5178
83:	[0s / 34s],		train_loss: 2.4717
87:	[0s / 57s],		train_loss: 2.4118
8:	[0s / 3s],		train_loss: 2.5192
84:	[0s / 34s],		train_loss: 2.4618
9:	[0s / 4s],		train_loss: 2.5061
88:	[0s / 57s],		train_loss: 2.4089
41:	[1s / 46s],		train_loss: 2.4500
85:	[0s / 34s],		train_loss: 2.4438
10:	[0s / 4s],		train_loss: 2.5007
86:	[0s / 35s],		train_loss: 2.4674
89:	[0s / 58s],		train_loss: 2.3993
11:	[0s / 4s],		train_loss: 2.5049
87:	[0s / 35s],		train_loss: 2.4740
42:	[1s / 48s],		train_loss: 2.4411
90:	[0s / 58s],		train_loss: 2.4024
12:	[0s / 5s],		train_loss: 2.5006
88:	[0s / 36s],		train_loss: 2.4682
13:	[0s / 5s],		train_loss: 2.4870
89:	[0s / 36s],		train_loss: 2.4771
91:	[0s / 59s],		train_loss: 2.4083
14:	[0s / 6s],		train_loss: 2.5041
43:	[1s / 49s],		train_loss: 2.4584
90:	[0s / 37s],		train_loss: 2.4682
92:	[0s / 1m:0s],		train_loss: 2.3941
15:	[0s / 6s],		train_loss: 2.4982
91:	[0s / 37s],		train_loss: 2.4591
16:	[0s / 7s],		train_loss: 2.4768
93:	[0s / 1m:0s],		train_loss: 2.4115
92:	[0s / 37s],		train_loss: 2.4698
44:	[1s / 50s],		train_loss: 2.4424
17:	[0s / 7s],		train_loss: 2.4842
93:	[0s / 38s],		train_loss: 2.4596
94:	[0s / 1m:1s],		train_loss: 2.4043
18:	[0s / 7s],		train_loss: 2.4865
94:	[0s / 38s],		train_loss: 2.4441
95:	[0s / 1m:1s],		train_loss: 2.4104
19:	[0s / 8s],		train_loss: 2.4795
95:	[0s / 39s],		train_loss: 2.4801
45:	[1s / 51s],		train_loss: 2.4409
20:	[0s / 8s],		train_loss: 2.4768
96:	[0s / 39s],		train_loss: 2.4722
96:	[0s / 1m:2s],		train_loss: 2.3921
21:	[0s / 9s],		train_loss: 2.4888
97:	[0s / 39s],		train_loss: 2.4420
97:	[0s / 1m:2s],		train_loss: 2.3965
22:	[0s / 9s],		train_loss: 2.4781
98:	[0s / 40s],		train_loss: 2.4645
46:	[1s / 52s],		train_loss: 2.4362
23:	[0s / 9s],		train_loss: 2.4965
98:	[0s / 1m:3s],		train_loss: 2.3871
99:	[0s / 40s],		train_loss: 2.4749
24:	[0s / 10s],		train_loss: 2.4647
99:	[0s / 1m:4s],		train_loss: 2.3891
0:	[0s / 0s],		train_loss: 2.9813
47:	[1s / 53s],		train_loss: 2.4325
25:	[0s / 10s],		train_loss: 2.4659
1:	[0s / 0s],		train_loss: 2.6347
0:	[0s / 0s],		train_loss: 2.9332
26:	[0s / 11s],		train_loss: 2.4915
2:	[0s / 1s],		train_loss: 2.6021
27:	[0s / 11s],		train_loss: 2.4824
48:	[1s / 54s],		train_loss: 2.4343
3:	[0s / 1s],		train_loss: 2.5700
1:	[0s / 1s],		train_loss: 2.6505
28:	[0s / 12s],		train_loss: 2.4731
4:	[0s / 2s],		train_loss: 2.5681
2:	[0s / 1s],		train_loss: 2.6177
29:	[0s / 12s],		train_loss: 2.4738
5:	[0s / 2s],		train_loss: 2.5531
49:	[1s / 55s],		train_loss: 2.4382
30:	[0s / 13s],		train_loss: 2.4654
3:	[0s / 2s],		train_loss: 2.5797
6:	[0s / 3s],		train_loss: 2.5453
31:	[0s / 13s],		train_loss: 2.4620
7:	[0s / 3s],		train_loss: 2.5419
4:	[0s / 2s],		train_loss: 2.5849
32:	[0s / 13s],		train_loss: 2.4601
8:	[0s / 3s],		train_loss: 2.5542
50:	[1s / 56s],		train_loss: 2.4352
33:	[0s / 14s],		train_loss: 2.4590
5:	[0s / 3s],		train_loss: 2.5587
9:	[0s / 4s],		train_loss: 2.5458
34:	[0s / 14s],		train_loss: 2.4735
10:	[0s / 4s],		train_loss: 2.5323
6:	[0s / 4s],		train_loss: 2.5464
35:	[0s / 15s],		train_loss: 2.4661
51:	[1s / 57s],		train_loss: 2.4237
11:	[0s / 5s],		train_loss: 2.5467
7:	[0s / 4s],		train_loss: 2.5642
36:	[0s / 15s],		train_loss: 2.4608
12:	[0s / 5s],		train_loss: 2.5528
37:	[0s / 15s],		train_loss: 2.4540
8:	[0s / 5s],		train_loss: 2.5671
13:	[0s / 5s],		train_loss: 2.5207
52:	[1s / 59s],		train_loss: 2.4252
38:	[0s / 16s],		train_loss: 2.4634
14:	[0s / 6s],		train_loss: 2.5369
9:	[0s / 5s],		train_loss: 2.5340
39:	[0s / 16s],		train_loss: 2.4620
15:	[0s / 6s],		train_loss: 2.5265
40:	[0s / 17s],		train_loss: 2.4674
10:	[0s / 6s],		train_loss: 2.5438
16:	[0s / 7s],		train_loss: 2.5365
53:	[1s / 1m:0s],		train_loss: 2.4173
41:	[0s / 17s],		train_loss: 2.4611
17:	[0s / 7s],		train_loss: 2.5108
11:	[0s / 6s],		train_loss: 2.5459
42:	[0s / 17s],		train_loss: 2.4642
18:	[0s / 7s],		train_loss: 2.5297
12:	[0s / 7s],		train_loss: 2.5452
43:	[0s / 18s],		train_loss: 2.4472
19:	[0s / 8s],		train_loss: 2.5085
54:	[1s / 1m:1s],		train_loss: 2.4427
44:	[0s / 18s],		train_loss: 2.4576
20:	[0s / 8s],		train_loss: 2.5116
13:	[0s / 8s],		train_loss: 2.5497
45:	[0s / 19s],		train_loss: 2.4438
21:	[0s / 9s],		train_loss: 2.5052
14:	[0s / 8s],		train_loss: 2.5388
55:	[1s / 1m:2s],		train_loss: 2.4224
46:	[0s / 19s],		train_loss: 2.4546
22:	[0s / 9s],		train_loss: 2.5016
47:	[0s / 19s],		train_loss: 2.4470
15:	[0s / 9s],		train_loss: 2.5395
23:	[0s / 9s],		train_loss: 2.5129
48:	[0s / 20s],		train_loss: 2.4586
24:	[0s / 10s],		train_loss: 2.5029
16:	[0s / 9s],		train_loss: 2.5270
56:	[1s / 1m:3s],		train_loss: 2.4367
49:	[0s / 20s],		train_loss: 2.4547
25:	[0s / 10s],		train_loss: 2.5116
17:	[0s / 10s],		train_loss: 2.5315
50:	[0s / 21s],		train_loss: 2.4570
26:	[0s / 11s],		train_loss: 2.5279
51:	[0s / 21s],		train_loss: 2.4514
27:	[0s / 11s],		train_loss: 2.5169
18:	[0s / 10s],		train_loss: 2.5168
57:	[1s / 1m:4s],		train_loss: 2.4049
52:	[0s / 22s],		train_loss: 2.4416
28:	[0s / 11s],		train_loss: 2.4925
19:	[0s / 11s],		train_loss: 2.5257
53:	[0s / 22s],		train_loss: 2.4494
29:	[0s / 12s],		train_loss: 2.4935
54:	[0s / 22s],		train_loss: 2.4488
30:	[0s / 12s],		train_loss: 2.5013
20:	[0s / 12s],		train_loss: 2.5199
58:	[1s / 1m:5s],		train_loss: 2.4204
55:	[0s / 23s],		train_loss: 2.4334
31:	[0s / 13s],		train_loss: 2.4857
21:	[0s / 12s],		train_loss: 2.5323
56:	[0s / 23s],		train_loss: 2.4396
32:	[0s / 13s],		train_loss: 2.5037
59:	[1s / 1m:6s],		train_loss: 2.4204
57:	[0s / 24s],		train_loss: 2.4437
22:	[0s / 13s],		train_loss: 2.5142
33:	[0s / 13s],		train_loss: 2.5033
58:	[0s / 24s],		train_loss: 2.4354
34:	[0s / 14s],		train_loss: 2.5133
23:	[0s / 13s],		train_loss: 2.5179
59:	[0s / 24s],		train_loss: 2.4387
35:	[0s / 14s],		train_loss: 2.5188
60:	[1s / 1m:7s],		train_loss: 2.4302
24:	[0s / 14s],		train_loss: 2.5146
60:	[0s / 25s],		train_loss: 2.4355
36:	[0s / 15s],		train_loss: 2.5029
61:	[0s / 25s],		train_loss: 2.4371
37:	[0s / 15s],		train_loss: 2.4979
25:	[0s / 15s],		train_loss: 2.4982
62:	[0s / 26s],		train_loss: 2.4425
38:	[0s / 16s],		train_loss: 2.4798
61:	[1s / 1m:9s],		train_loss: 2.4235
26:	[0s / 15s],		train_loss: 2.5057
63:	[0s / 26s],		train_loss: 2.4493
39:	[0s / 16s],		train_loss: 2.4969
27:	[0s / 16s],		train_loss: 2.5097
64:	[0s / 26s],		train_loss: 2.4121
40:	[0s / 16s],		train_loss: 2.4809
62:	[1s / 1m:10s],		train_loss: 2.4310
65:	[0s / 27s],		train_loss: 2.4295
41:	[0s / 17s],		train_loss: 2.4908
28:	[0s / 16s],		train_loss: 2.5065
66:	[0s / 27s],		train_loss: 2.4391
42:	[0s / 17s],		train_loss: 2.4989
29:	[0s / 17s],		train_loss: 2.5039
67:	[0s / 28s],		train_loss: 2.4432
43:	[0s / 18s],		train_loss: 2.4868
63:	[1s / 1m:11s],		train_loss: 2.4328
68:	[0s / 28s],		train_loss: 2.4321
44:	[0s / 18s],		train_loss: 2.4822
30:	[0s / 17s],		train_loss: 2.5228
69:	[0s / 29s],		train_loss: 2.4389
45:	[0s / 18s],		train_loss: 2.4829
31:	[0s / 18s],		train_loss: 2.5338
70:	[0s / 29s],		train_loss: 2.4231
46:	[0s / 19s],		train_loss: 2.4768
64:	[1s / 1m:12s],		train_loss: 2.4238
32:	[0s / 19s],		train_loss: 2.4994
71:	[0s / 29s],		train_loss: 2.4359
47:	[0s / 19s],		train_loss: 2.4895
72:	[0s / 30s],		train_loss: 2.4394
48:	[0s / 20s],		train_loss: 2.4900
33:	[0s / 19s],		train_loss: 2.5016
65:	[1s / 1m:13s],		train_loss: 2.4092
73:	[0s / 30s],		train_loss: 2.4218
49:	[0s / 20s],		train_loss: 2.4885
34:	[0s / 20s],		train_loss: 2.5175
74:	[0s / 31s],		train_loss: 2.4225
50:	[0s / 21s],		train_loss: 2.4746
75:	[0s / 31s],		train_loss: 2.4347
51:	[0s / 21s],		train_loss: 2.4741
35:	[0s / 20s],		train_loss: 2.5140
66:	[1s / 1m:14s],		train_loss: 2.4088
76:	[0s / 31s],		train_loss: 2.4230
52:	[0s / 21s],		train_loss: 2.4851
36:	[0s / 21s],		train_loss: 2.4946
77:	[0s / 32s],		train_loss: 2.4285
53:	[0s / 22s],		train_loss: 2.4850
37:	[0s / 22s],		train_loss: 2.5018
78:	[0s / 32s],		train_loss: 2.4162
54:	[0s / 22s],		train_loss: 2.4950
67:	[1s / 1m:15s],		train_loss: 2.3996
79:	[0s / 33s],		train_loss: 2.4192
55:	[0s / 23s],		train_loss: 2.4966
38:	[0s / 22s],		train_loss: 2.5000
80:	[0s / 33s],		train_loss: 2.4227
56:	[0s / 23s],		train_loss: 2.4990
39:	[0s / 23s],		train_loss: 2.5265
68:	[1s / 1m:16s],		train_loss: 2.4184
81:	[0s / 34s],		train_loss: 2.4380
57:	[0s / 23s],		train_loss: 2.4741
82:	[0s / 34s],		train_loss: 2.4216
40:	[0s / 23s],		train_loss: 2.5046
58:	[0s / 24s],		train_loss: 2.4740
83:	[0s / 34s],		train_loss: 2.4136
59:	[0s / 24s],		train_loss: 2.4844
41:	[0s / 24s],		train_loss: 2.5036
69:	[1s / 1m:17s],		train_loss: 2.4259
84:	[0s / 35s],		train_loss: 2.4251
60:	[0s / 25s],		train_loss: 2.4938
42:	[0s / 24s],		train_loss: 2.5162
85:	[0s / 35s],		train_loss: 2.4279
61:	[0s / 25s],		train_loss: 2.4906
86:	[0s / 36s],		train_loss: 2.4228
62:	[0s / 25s],		train_loss: 2.4738
70:	[1s / 1m:19s],		train_loss: 2.4019
43:	[0s / 25s],		train_loss: 2.4982
87:	[0s / 36s],		train_loss: 2.4207
63:	[0s / 26s],		train_loss: 2.4729
44:	[0s / 26s],		train_loss: 2.5048
88:	[0s / 36s],		train_loss: 2.4176
64:	[0s / 26s],		train_loss: 2.4743
71:	[1s / 1m:20s],		train_loss: 2.4053
89:	[0s / 37s],		train_loss: 2.4180
45:	[0s / 26s],		train_loss: 2.4910
65:	[0s / 27s],		train_loss: 2.4698
90:	[0s / 37s],		train_loss: 2.4060
66:	[0s / 27s],		train_loss: 2.4885
46:	[0s / 27s],		train_loss: 2.5083
91:	[0s / 38s],		train_loss: 2.4107
67:	[0s / 28s],		train_loss: 2.4938
72:	[1s / 1m:21s],		train_loss: 2.4162
47:	[0s / 27s],		train_loss: 2.4997
92:	[0s / 38s],		train_loss: 2.4351
68:	[0s / 28s],		train_loss: 2.4805
93:	[0s / 38s],		train_loss: 2.4096
69:	[0s / 28s],		train_loss: 2.4821
48:	[0s / 28s],		train_loss: 2.4855
70:	[0s / 29s],		train_loss: 2.4792
94:	[0s / 39s],		train_loss: 2.4063
73:	[1s / 1m:22s],		train_loss: 2.4149
49:	[0s / 28s],		train_loss: 2.5002
71:	[0s / 29s],		train_loss: 2.4651
95:	[0s / 39s],		train_loss: 2.4216
72:	[0s / 30s],		train_loss: 2.5048
96:	[0s / 40s],		train_loss: 2.4007
50:	[0s / 29s],		train_loss: 2.4854
74:	[1s / 1m:23s],		train_loss: 2.4105
73:	[0s / 30s],		train_loss: 2.4889
97:	[0s / 40s],		train_loss: 2.4314
51:	[0s / 30s],		train_loss: 2.5024
74:	[0s / 30s],		train_loss: 2.4961
98:	[0s / 41s],		train_loss: 2.4145
75:	[0s / 31s],		train_loss: 2.4671
99:	[0s / 41s],		train_loss: 2.4153
52:	[0s / 30s],		train_loss: 2.4909
75:	[1s / 1m:24s],		train_loss: 2.4088
76:	[0s / 31s],		train_loss: 2.4755
0:	[0s / 0s],		train_loss: 2.9864
53:	[0s / 31s],		train_loss: 2.4944
77:	[0s / 32s],		train_loss: 2.4730
1:	[0s / 0s],		train_loss: 2.6456
78:	[0s / 32s],		train_loss: 2.4748
76:	[1s / 1m:25s],		train_loss: 2.3997
2:	[0s / 1s],		train_loss: 2.6146
54:	[0s / 32s],		train_loss: 2.4995
79:	[0s / 32s],		train_loss: 2.4706
3:	[0s / 1s],		train_loss: 2.5942
80:	[0s / 33s],		train_loss: 2.4867
55:	[0s / 32s],		train_loss: 2.4999
4:	[0s / 2s],		train_loss: 2.6051
81:	[0s / 33s],		train_loss: 2.4791
77:	[1s / 1m:26s],		train_loss: 2.4168
5:	[0s / 2s],		train_loss: 2.5796
56:	[0s / 33s],		train_loss: 2.4874
82:	[0s / 34s],		train_loss: 2.4708
6:	[0s / 3s],		train_loss: 2.5827
83:	[0s / 34s],		train_loss: 2.4725
57:	[0s / 34s],		train_loss: 2.4997
7:	[0s / 3s],		train_loss: 2.5840
84:	[0s / 35s],		train_loss: 2.4578
78:	[1s / 1m:28s],		train_loss: 2.4070
8:	[0s / 3s],		train_loss: 2.5820
58:	[0s / 34s],		train_loss: 2.4932
85:	[0s / 35s],		train_loss: 2.4602
9:	[0s / 4s],		train_loss: 2.5658
86:	[0s / 35s],		train_loss: 2.4800
59:	[0s / 35s],		train_loss: 2.4926
10:	[0s / 4s],		train_loss: 2.5440
79:	[1s / 1m:29s],		train_loss: 2.3956
87:	[0s / 36s],		train_loss: 2.4650
11:	[0s / 5s],		train_loss: 2.5393
88:	[0s / 36s],		train_loss: 2.4786
60:	[0s / 36s],		train_loss: 2.4903
12:	[0s / 5s],		train_loss: 2.5351
89:	[0s / 37s],		train_loss: 2.4609
61:	[0s / 36s],		train_loss: 2.4935
80:	[1s / 1m:30s],		train_loss: 2.3941
13:	[0s / 6s],		train_loss: 2.5410
90:	[0s / 37s],		train_loss: 2.4725
14:	[0s / 6s],		train_loss: 2.5263
91:	[0s / 37s],		train_loss: 2.4587
62:	[0s / 37s],		train_loss: 2.4866
15:	[0s / 6s],		train_loss: 2.5378
92:	[0s / 38s],		train_loss: 2.4711
81:	[1s / 1m:31s],		train_loss: 2.4060
93:	[0s / 38s],		train_loss: 2.4724
16:	[0s / 7s],		train_loss: 2.5255
63:	[0s / 38s],		train_loss: 2.5057
94:	[0s / 39s],		train_loss: 2.4675
17:	[0s / 7s],		train_loss: 2.5104
64:	[0s / 38s],		train_loss: 2.4941
95:	[0s / 39s],		train_loss: 2.4754
18:	[0s / 8s],		train_loss: 2.5383
82:	[1s / 1m:32s],		train_loss: 2.3948
96:	[0s / 39s],		train_loss: 2.4678
19:	[0s / 8s],		train_loss: 2.5492
65:	[0s / 39s],		train_loss: 2.4909
97:	[0s / 40s],		train_loss: 2.4849
20:	[0s / 9s],		train_loss: 2.5254
66:	[0s / 40s],		train_loss: 2.4886
98:	[0s / 40s],		train_loss: 2.4558
83:	[1s / 1m:33s],		train_loss: 2.3891
21:	[0s / 9s],		train_loss: 2.5388
99:	[0s / 41s],		train_loss: 2.4736
67:	[0s / 40s],		train_loss: 2.4882
22:	[0s / 9s],		train_loss: 2.5312
0:	[0s / 0s],		train_loss: 2.9590
23:	[0s / 10s],		train_loss: 2.5179
84:	[1s / 1m:34s],		train_loss: 2.3983
68:	[0s / 41s],		train_loss: 2.4886
1:	[0s / 0s],		train_loss: 2.6474
24:	[0s / 10s],		train_loss: 2.5415
2:	[0s / 1s],		train_loss: 2.6280
25:	[0s / 11s],		train_loss: 2.5294
69:	[0s / 42s],		train_loss: 2.4879
3:	[0s / 1s],		train_loss: 2.5993
26:	[0s / 11s],		train_loss: 2.5182
85:	[1s / 1m:36s],		train_loss: 2.3989
4:	[0s / 2s],		train_loss: 2.5975
70:	[0s / 42s],		train_loss: 2.5017
27:	[0s / 12s],		train_loss: 2.5113
5:	[0s / 2s],		train_loss: 2.5757
28:	[0s / 12s],		train_loss: 2.5097
71:	[0s / 43s],		train_loss: 2.5135
6:	[0s / 2s],		train_loss: 2.5723
29:	[0s / 12s],		train_loss: 2.5197
86:	[1s / 1m:37s],		train_loss: 2.4072
7:	[0s / 3s],		train_loss: 2.5462
72:	[0s / 44s],		train_loss: 2.4888
30:	[0s / 13s],		train_loss: 2.5124
8:	[0s / 3s],		train_loss: 2.5654
31:	[0s / 13s],		train_loss: 2.5150
73:	[0s / 44s],		train_loss: 2.4882
9:	[0s / 4s],		train_loss: 2.5578
87:	[1s / 1m:38s],		train_loss: 2.3906
32:	[0s / 14s],		train_loss: 2.5157
10:	[0s / 4s],		train_loss: 2.5508
74:	[0s / 45s],		train_loss: 2.4692
33:	[0s / 14s],		train_loss: 2.5090
11:	[0s / 4s],		train_loss: 2.5514
34:	[0s / 14s],		train_loss: 2.5042
75:	[0s / 45s],		train_loss: 2.4755
88:	[1s / 1m:39s],		train_loss: 2.3942
12:	[0s / 5s],		train_loss: 2.5492
35:	[0s / 15s],		train_loss: 2.5097
13:	[0s / 5s],		train_loss: 2.5451
76:	[0s / 46s],		train_loss: 2.4798
36:	[0s / 15s],		train_loss: 2.5143
14:	[0s / 6s],		train_loss: 2.5459
89:	[1s / 1m:40s],		train_loss: 2.3889
37:	[0s / 16s],		train_loss: 2.5003
15:	[0s / 6s],		train_loss: 2.5189
77:	[0s / 47s],		train_loss: 2.4913
38:	[0s / 16s],		train_loss: 2.5267
16:	[0s / 6s],		train_loss: 2.5736
39:	[0s / 17s],		train_loss: 2.5017
78:	[0s / 47s],		train_loss: 2.4777
17:	[0s / 7s],		train_loss: 2.5538
90:	[1s / 1m:41s],		train_loss: 2.4067
40:	[0s / 17s],		train_loss: 2.4942
18:	[0s / 7s],		train_loss: 2.5576
79:	[0s / 48s],		train_loss: 2.4859
41:	[0s / 17s],		train_loss: 2.4936
19:	[0s / 8s],		train_loss: 2.5518
42:	[0s / 18s],		train_loss: 2.5065
20:	[0s / 8s],		train_loss: 2.5533
80:	[0s / 49s],		train_loss: 2.4802
91:	[1s / 1m:42s],		train_loss: 2.4058
43:	[0s / 18s],		train_loss: 2.4980
21:	[0s / 8s],		train_loss: 2.5426
81:	[0s / 49s],		train_loss: 2.4976
44:	[0s / 19s],		train_loss: 2.4870
22:	[0s / 9s],		train_loss: 2.5472
92:	[1s / 1m:43s],		train_loss: 2.4007
45:	[0s / 19s],		train_loss: 2.4872
23:	[0s / 9s],		train_loss: 2.5302
82:	[0s / 50s],		train_loss: 2.4778
46:	[0s / 20s],		train_loss: 2.4870
24:	[0s / 10s],		train_loss: 2.5392
83:	[0s / 51s],		train_loss: 2.4907
25:	[0s / 10s],		train_loss: 2.5375
47:	[0s / 20s],		train_loss: 2.5063
93:	[1s / 1m:45s],		train_loss: 2.3897
26:	[0s / 10s],		train_loss: 2.5220
48:	[0s / 20s],		train_loss: 2.4917
84:	[0s / 51s],		train_loss: 2.4920
27:	[0s / 11s],		train_loss: 2.5197
49:	[0s / 21s],		train_loss: 2.4967
28:	[0s / 11s],		train_loss: 2.5471
50:	[0s / 21s],		train_loss: 2.4912
85:	[0s / 52s],		train_loss: 2.4616
94:	[1s / 1m:46s],		train_loss: 2.4018
29:	[0s / 12s],		train_loss: 2.5304
51:	[0s / 22s],		train_loss: 2.5003
86:	[0s / 53s],		train_loss: 2.4830
30:	[0s / 12s],		train_loss: 2.5328
52:	[0s / 22s],		train_loss: 2.4843
31:	[0s / 12s],		train_loss: 2.5297
53:	[0s / 22s],		train_loss: 2.4854
87:	[0s / 53s],		train_loss: 2.4734
95:	[1s / 1m:47s],		train_loss: 2.4054
32:	[0s / 13s],	