[I 2026-06-28 01:36:59,732] Trial 32 finished with value: 0.7494268868647836 and parameters: {'num_nodes': [128], 'dropout': 0.2057103558136538, 'learning_rate': 0.005304886430339833, 'batch_norm': False}. Best is trial 14 with value: 0.7751259315484406.
/scratch.hpc/luca.cotugno/Foundation_model_clinical_data/test_tabular_model.py:481: UserWarning: Choices for a categorical distribution should be a tuple of None, bool, int, float and str for persistent storage but contains [32] which is of type list.
  num_nodes  = trial.suggest_categorical("num_nodes", [[32], [64], [128], [64, 32], [128, 64]])
/scratch.hpc/luca.cotugno/Foundation_model_clinical_data/test_tabular_model.py:481: UserWarning: Choices for a categorical distribution should be a tuple of None, bool, int, float and str for persistent storage but contains [64] which is of type list.
  num_nodes  = trial.suggest_categorical("num_nodes", [[32], [64], [128], [64, 32], [128, 64]])
/scratch.hpc/luca.cotugno/Foundation_model_clinical_data/test_tabular_model.py:481: UserWarning: Choices for a categorical distribution should be a tuple of None, bool, int, float and str for persistent storage but contains [128] which is of type list.
  num_nodes  = trial.suggest_categorical("num_nodes", [[32], [64], [128], [64, 32], [128, 64]])
/scratch.hpc/luca.cotugno/Foundation_model_clinical_data/test_tabular_model.py:481: UserWarning: Choices for a categorical distribution should be a tuple of None, bool, int, float and str for persistent storage but contains [64, 32] which is of type list.
  num_nodes  = trial.suggest_categorical("num_nodes", [[32], [64], [128], [64, 32], [128, 64]])
/scratch.hpc/luca.cotugno/Foundation_model_clinical_data/test_tabular_model.py:481: UserWarning: Choices for a categorical distribution should be a tuple of None, bool, int, float and str for persistent storage but contains [128, 64] which is of type list.
  num_nodes  = trial.suggest_categorical("num_nodes", [[32], [64], [128], [64, 32], [128, 64]])

96:	[0s / 57s],		train_loss: 3.7522
36:	[0s / 8s],		train_loss: 3.1605
64:	[0s / 8s],		train_loss: 4.0338
58:	[0s / 19s],		train_loss: 4.1978
99:	[0s / 12s],		train_loss: 4.1662
65:	[0s / 8s],		train_loss: 4.0101
37:	[0s / 9s],		train_loss: 3.1545
66:	[0s / 8s],		train_loss: 4.0308
59:	[0s / 19s],		train_loss: 4.2354
0:	[0s / 0s],		train_loss: 5.3802
67:	[0s / 9s],		train_loss: 3.9823
38:	[0s / 9s],		train_loss: 3.1578
97:	[0s / 58s],		train_loss: 3.7380
1:	[0s / 0s],		train_loss: 4.9373
43:	[1s / 58s],		train_loss: 4.0716
68:	[0s / 9s],		train_loss: 4.0104
2:	[0s / 0s],		train_loss: 4.6966
60:	[0s / 20s],		train_loss: 4.1657
24:	[3s / 58s],		train_loss: 4.2469
69:	[0s / 9s],		train_loss: 3.9800
39:	[0s / 9s],		train_loss: 3.0973
3:	[0s / 0s],		train_loss: 4.5749
70:	[0s / 9s],		train_loss: 4.0235
4:	[0s / 0s],		train_loss: 4.4863
61:	[0s / 20s],		train_loss: 4.2095
71:	[0s / 9s],		train_loss: 4.0141
40:	[0s / 9s],		train_loss: 3.1053
5:	[0s / 0s],		train_loss: 4.4889
98:	[0s / 58s],		train_loss: 3.7997
72:	[0s / 9s],		train_loss: 3.9690
6:	[0s / 1s],		train_loss: 4.4302
41:	[0s / 10s],		train_loss: 3.0615
62:	[0s / 20s],		train_loss: 4.2147
73:	[0s / 9s],		train_loss: 3.9514
7:	[0s / 1s],		train_loss: 4.3999
34:	[1s / 59s],		train_loss: 4.1285
44:	[0s / 59s],		train_loss: 4.1124
74:	[0s / 10s],		train_loss: 4.0052
8:	[0s / 1s],		train_loss: 4.4076
42:	[0s / 10s],		train_loss: 3.1049
75:	[0s / 10s],		train_loss: 3.9619
63:	[0s / 21s],		train_loss: 4.1783
9:	[0s / 1s],		train_loss: 4.3893
99:	[0s / 59s],		train_loss: 3.7625
76:	[0s / 10s],		train_loss: 4.0445
10:	[0s / 1s],		train_loss: 4.3887
43:	[0s / 10s],		train_loss: 3.1314
77:	[0s / 10s],		train_loss: 3.9803
11:	[0s / 1s],		train_loss: 4.3193
64:	[0s / 21s],		train_loss: 4.1603
78:	[0s / 10s],		train_loss: 3.9450
12:	[0s / 1s],		train_loss: 4.3200
44:	[0s / 10s],		train_loss: 3.1301
45:	[0s / 59s],		train_loss: 4.1505
79:	[0s / 10s],		train_loss: 3.8828
13:	[0s / 2s],		train_loss: 4.3318
80:	[0s / 10s],		train_loss: 3.9306
0:	[0s / 0s],		train_loss: 4.9382
14:	[0s / 2s],		train_loss: 4.3197
45:	[0s / 11s],		train_loss: 3.0237
65:	[0s / 21s],		train_loss: 4.1510
81:	[0s / 11s],		train_loss: 3.9733
15:	[0s / 2s],		train_loss: 4.3229
35:	[1s / 1m:0s],		train_loss: 4.0903
46:	[0s / 11s],		train_loss: 3.0543
16:	[0s / 2s],		train_loss: 4.3002
82:	[0s / 11s],		train_loss: 4.0007
66:	[0s / 22s],		train_loss: 4.1860
17:	[0s / 2s],		train_loss: 4.2853
83:	[0s / 11s],		train_loss: 3.9221
18:	[0s / 2s],		train_loss: 4.2657
84:	[0s / 11s],		train_loss: 3.9285
47:	[0s / 11s],		train_loss: 2.9739
1:	[0s / 1s],		train_loss: 4.5928
19:	[0s / 2s],		train_loss: 4.2690
85:	[0s / 11s],		train_loss: 3.9452
67:	[0s / 22s],		train_loss: 4.1869
46:	[0s / 1m:0s],		train_loss: 4.1488
48:	[0s / 11s],		train_loss: 2.9575
20:	[0s / 2s],		train_loss: 4.2781
86:	[0s / 11s],		train_loss: 3.9194
21:	[0s / 3s],		train_loss: 4.2650
87:	[0s / 11s],		train_loss: 3.9230
25:	[2s / 1m:1s],		train_loss: 4.2337
49:	[0s / 12s],		train_loss: 2.8935
68:	[0s / 22s],		train_loss: 4.1272
22:	[0s / 3s],		train_loss: 4.2344
88:	[0s / 12s],		train_loss: 3.9370
2:	[0s / 1s],		train_loss: 4.5486
23:	[0s / 3s],		train_loss: 4.2265
89:	[0s / 12s],		train_loss: 3.9155
50:	[0s / 12s],		train_loss: 2.9465
24:	[0s / 3s],		train_loss: 4.2138
69:	[0s / 23s],		train_loss: 4.1966
90:	[0s / 12s],		train_loss: 3.8776
25:	[0s / 3s],		train_loss: 4.2239
91:	[0s / 12s],		train_loss: 3.8727
51:	[0s / 12s],		train_loss: 2.9183
3:	[0s / 2s],		train_loss: 4.5761
47:	[0s / 1m:1s],		train_loss: 4.1072
26:	[0s / 3s],		train_loss: 4.2227
70:	[0s / 23s],		train_loss: 4.1647
92:	[0s / 12s],		train_loss: 3.8804
36:	[1s / 1m:1s],		train_loss: 4.1092
27:	[0s / 3s],		train_loss: 4.1998
93:	[0s / 12s],		train_loss: 3.8858
52:	[0s / 13s],		train_loss: 2.9062
28:	[0s / 4s],		train_loss: 4.2125
71:	[0s / 23s],		train_loss: 4.1372
94:	[0s / 12s],		train_loss: 3.8509
29:	[0s / 4s],		train_loss: 4.1558
53:	[0s / 13s],		train_loss: 2.9039
4:	[0s / 2s],		train_loss: 4.5455
95:	[0s / 13s],		train_loss: 3.8812
30:	[0s / 4s],		train_loss: 4.1862
96:	[0s / 13s],		train_loss: 3.9035
72:	[0s / 24s],		train_loss: 4.1615
31:	[0s / 4s],		train_loss: 4.1918
54:	[0s / 13s],		train_loss: 2.9547
97:	[0s / 13s],		train_loss: 3.8908
32:	[0s / 4s],		train_loss: 4.1347
48:	[0s / 1m:2s],		train_loss: 4.0703
98:	[0s / 13s],		train_loss: 3.8440
33:	[0s / 4s],		train_loss: 4.1481
55:	[0s / 13s],		train_loss: 2.8908
73:	[0s / 24s],		train_loss: 4.1608
5:	[0s / 3s],		train_loss: 4.5501
99:	[0s / 13s],		train_loss: 3.8531
34:	[0s / 4s],		train_loss: 4.1676
35:	[0s / 4s],		train_loss: 4.1465
56:	[0s / 14s],		train_loss: 2.8754
0:	[0s / 0s],		train_loss: 5.5742
74:	[0s / 24s],		train_loss: 4.1460
36:	[0s / 5s],		train_loss: 4.1286
1:	[0s / 0s],		train_loss: 4.5616
37:	[0s / 5s],		train_loss: 4.1485
6:	[0s / 3s],		train_loss: 4.5251
57:	[0s / 14s],		train_loss: 2.8653
2:	[0s / 0s],		train_loss: 4.4748
38:	[0s / 5s],		train_loss: 4.1110
75:	[0s / 25s],		train_loss: 4.1630
49:	[0s / 1m:3s],		train_loss: 4.0499
3:	[0s / 0s],		train_loss: 4.4423
37:	[1s / 1m:3s],		train_loss: 4.1229
39:	[0s / 5s],		train_loss: 4.1070
58:	[0s / 14s],		train_loss: 2.8553
4:	[0s / 0s],		train_loss: 4.4581
40:	[0s / 5s],		train_loss: 4.1063
5:	[0s / 0s],		train_loss: 4.4507
76:	[0s / 25s],		train_loss: 4.1367
41:	[0s / 5s],		train_loss: 4.0947
59:	[0s / 14s],		train_loss: 2.7384
7:	[0s / 4s],		train_loss: 4.4782
6:	[0s / 0s],		train_loss: 4.4877
42:	[0s / 5s],		train_loss: 4.0750
7:	[0s / 0s],		train_loss: 4.4333
77:	[0s / 25s],		train_loss: 4.1282
43:	[0s / 5s],		train_loss: 4.0878
60:	[0s / 14s],		train_loss: 2.8334
26:	[2s / 1m:3s],		train_loss: 4.2492
8:	[0s / 1s],		train_loss: 4.4560
44:	[0s / 5s],		train_loss: 4.0952
9:	[0s / 1s],		train_loss: 4.4286
61:	[0s / 15s],		train_loss: 2.7998
45:	[0s / 6s],		train_loss: 4.0933
78:	[0s / 25s],		train_loss: 4.0978
10:	[0s / 1s],		train_loss: 4.4010
8:	[0s / 4s],		train_loss: 4.5182
46:	[0s / 6s],		train_loss: 4.0631
11:	[0s / 1s],		train_loss: 4.4000
62:	[0s / 15s],		train_loss: 2.7929
47:	[0s / 6s],		train_loss: 4.0396
50:	[0s / 1m:4s],		train_loss: 4.0326
12:	[0s / 1s],		train_loss: 4.4012
48:	[0s / 6s],		train_loss: 4.0553
79:	[0s / 26s],		train_loss: 4.2003
13:	[0s / 1s],		train_loss: 4.3439
63:	[0s / 15s],		train_loss: 2.7598
49:	[0s / 6s],		train_loss: 4.0384
14:	[0s / 1s],		train_loss: 4.4046
50:	[0s / 6s],		train_loss: 4.0276
9:	[0s / 5s],		train_loss: 4.5102
64:	[0s / 15s],		train_loss: 2.7104
15:	[0s / 1s],		train_loss: 4.3729
80:	[0s / 26s],		train_loss: 4.1562
51:	[0s / 6s],		train_loss: 4.0096
38:	[1s / 1m:4s],		train_loss: 4.1075
16:	[0s / 1s],		train_loss: 4.3244
52:	[0s / 6s],		train_loss: 4.0158
65:	[0s / 16s],		train_loss: 2.7705
17:	[0s / 2s],		train_loss: 4.3662
53:	[0s / 7s],		train_loss: 4.0143
81:	[0s / 26s],		train_loss: 4.1339
18:	[0s / 2s],		train_loss: 4.3247
51:	[0s / 1m:5s],		train_loss: 4.0727
54:	[0s / 7s],		train_loss: 4.0069
66:	[0s / 16s],		train_loss: 2.7970
10:	[0s / 5s],		train_loss: 4.5164
55:	[0s / 7s],		train_loss: 3.9877
19:	[0s / 2s],		train_loss: 4.3616
56:	[0s / 7s],		train_loss: 3.9849
82:	[0s / 27s],		train_loss: 4.1131
20:	[0s / 2s],		train_loss: 4.3618
67:	[0s / 16s],		train_loss: 2.7898
57:	[0s / 7s],		train_loss: 3.9818
21:	[0s / 2s],		train_loss: 4.3702
58:	[0s / 7s],		train_loss: 3.9939
68:	[0s / 16s],		train_loss: 2.7042
22:	[0s / 2s],		train_loss: 4.3606
11:	[0s / 6s],		train_loss: 4.4537
83:	[0s / 27s],		train_loss: 4.1525
59:	[0s / 7s],		train_loss: 3.9922
23:	[0s / 2s],		train_loss: 4.3646
69:	[0s / 16s],		train_loss: 2.7294
60:	[0s / 7s],		train_loss: 3.9599
24:	[0s / 2s],		train_loss: 4.4291
84:	[0s / 27s],		train_loss: 4.1312
61:	[0s / 7s],		train_loss: 3.9341
25:	[0s / 3s],		train_loss: 4.4346
70:	[0s / 17s],		train_loss: 2.7182
62:	[0s / 7s],		train_loss: 3.9605
26:	[0s / 3s],		train_loss: 4.3955
12:	[0s / 6s],		train_loss: 4.5522
52:	[0s / 1m:5s],		train_loss: 4.0706
63:	[0s / 8s],		train_loss: 3.9326
85:	[0s / 27s],		train_loss: 4.0964
27:	[0s / 3s],		train_loss: 4.3746
39:	[1s / 1m:6s],		train_loss: 4.0877
71:	[0s / 17s],		train_loss: 2.7445
64:	[0s / 8s],		train_loss: 3.9559
28:	[0s / 3s],		train_loss: 4.3972
65:	[0s / 8s],		train_loss: 3.9237
29:	[0s / 3s],		train_loss: 4.4092
27:	[2s / 1m:6s],		train_loss: 4.2444
72:	[0s / 17s],		train_loss: 2.7427
86:	[0s / 28s],		train_loss: 4.1187
66:	[0s / 8s],		train_loss: 3.9187
30:	[0s / 3s],		train_loss: 4.3766
13:	[0s / 6s],		train_loss: 4.5500
67:	[0s / 8s],		train_loss: 3.9103
73:	[0s / 17s],		train_loss: 2.8055
31:	[0s / 3s],		train_loss: 4.3943
68:	[0s / 8s],		train_loss: 3.9240
87:	[0s / 28s],		train_loss: 4.1780
32:	[0s / 3s],		train_loss: 4.3960
69:	[0s / 8s],		train_loss: 3.8945
74:	[0s / 17s],		train_loss: 2.7587
53:	[0s / 1m:6s],		train_loss: 4.1003
33:	[0s / 3s],		train_loss: 4.4100
70:	[0s / 8s],		train_loss: 3.8878
88:	[0s / 28s],		train_loss: 4.1154
34:	[0s / 4s],		train_loss: 4.4323
14:	[0s / 7s],		train_loss: 4.5182
71:	[0s / 9s],		train_loss: 3.8812
75:	[0s / 18s],		train_loss: 2.7140
35:	[0s / 4s],		train_loss: 4.3594
72:	[0s / 9s],		train_loss: 3.8676
89:	[0s / 28s],		train_loss: 4.1364
36:	[0s / 4s],		train_loss: 4.3349
76:	[0s / 18s],		train_loss: 2.6436
73:	[0s / 9s],		train_loss: 3.8715
37:	[0s / 4s],		train_loss: 4.3871
74:	[0s / 9s],		train_loss: 3.8382
15:	[0s / 7s],		train_loss: 4.5105
38:	[0s / 4s],		train_loss: 4.3831
77:	[0s / 18s],		train_loss: 2.6585
90:	[0s / 29s],		train_loss: 4.1928
75:	[0s / 9s],		train_loss: 3.8437
39:	[0s / 4s],		train_loss: 4.3758
76:	[0s / 9s],		train_loss: 3.8212
40:	[1s / 1m:7s],		train_loss: 4.0885
78:	[0s / 18s],		train_loss: 2.6293
54:	[0s / 1m:7s],		train_loss: 4.0552
40:	[0s / 4s],		train_loss: 4.3652
77:	[0s / 9s],		train_loss: 3.8337
91:	[0s / 29s],		train_loss: 4.1154
41:	[0s / 4s],		train_loss: 4.3878
78:	[0s / 9s],		train_loss: 3.7951
16:	[0s / 8s],		train_loss: 4.4926
79:	[0s / 19s],		train_loss: 2.6860
42:	[0s / 5s],		train_loss: 4.3797
79:	[0s / 10s],		train_loss: 3.8078
92:	[0s / 29s],		train_loss: 4.1112
43:	[0s / 5s],		train_loss: 4.3804
80:	[0s / 10s],		train_loss: 3.8238
80:	[0s / 19s],		train_loss: 2.7341
44:	[0s / 5s],		train_loss: 4.3947
81:	[0s / 10s],		train_loss: 3.8058
45:	[0s / 5s],		train_loss: 4.3993
82:	[0s / 10s],		train_loss: 3.8066
81:	[0s / 19s],		train_loss: 2.6346
93:	[0s / 30s],		train_loss: 4.1153
17:	[0s / 8s],		train_loss: 4.4917
46:	[0s / 5s],		train_loss: 4.3414
83:	[0s / 10s],		train_loss: 3.7786
55:	[0s / 1m:8s],		train_loss: 4.0295
47:	[0s / 5s],		train_loss: 4.3851
84:	[0s / 10s],		train_loss: 3.7924
82:	[0s / 19s],		train_loss: 2.6265
94:	[0s / 30s],		train_loss: 4.1075
48:	[0s / 5s],		train_loss: 4.3725
85:	[0s / 10s],		train_loss: 3.7831
28:	[2s / 1m:8s],		train_loss: 4.2156
18:	[0s / 9s],		train_loss: 4.4922
86:	[0s / 10s],		train_loss: 3.7670
49:	[0s / 6s],		train_loss: 4.3669
83:	[0s / 20s],		train_loss: 2.6328
41:	[1s / 1m:8s],		train_loss: 4.0739
87:	[0s / 11s],		train_loss: 3.7600
95:	[0s / 30s],		train_loss: 4.1275
50:	[0s / 6s],		train_loss: 4.3768
88:	[0s / 11s],		train_loss: 3.7568
84:	[0s / 20s],		train_loss: 2.6375
51:	[0s / 6s],		train_loss: 4.3696
89:	[0s / 11s],		train_loss: 3.7257
52:	[0s / 6s],		train_loss: 4.3290
96:	[0s / 31s],		train_loss: 4.1336
85:	[0s / 20s],		train_loss: 2.6691
90:	[0s / 11s],		train_loss: 3.7478
19:	[0s / 9s],		train_loss: 4.5127
56:	[0s / 1m:9s],		train_loss: 4.0273
53:	[0s / 6s],		train_loss: 4.3888
91:	[0s / 11s],		train_loss: 3.7196
54:	[0s / 6s],		train_loss: 4.3311
86:	[0s / 20s],		train_loss: 2.6953
97:	[0s / 31s],		train_loss: 4.0856
92:	[0s / 11s],		train_loss: 3.7168
55:	[0s / 6s],		train_loss: 4.3537
93:	[0s / 11s],		train_loss: 3.7043
56:	[0s / 6s],		train_loss: 4.3835
87:	[0s / 20s],		train_loss: 2.6172
94:	[0s / 11s],		train_loss: 3.7268
57:	[0s / 7s],		train_loss: 4.3790
20:	[0s / 10s],		train_loss: 4.4824
98:	[0s / 31s],		train_loss: 4.1087
95:	[0s / 12s],		train_loss: 3.7229
58:	[0s / 7s],		train_loss: 4.3624
88:	[0s / 21s],		train_loss: 2.6843
96:	[0s / 12s],		train_loss: 3.6836
59:	[0s / 7s],		train_loss: 4.3565
99:	[0s / 32s],		train_loss: 4.0940
97:	[0s / 12s],		train_loss: 3.6802
57:	[0s / 1m:10s],		train_loss: 4.0417
89:	[0s / 21s],		train_loss: 2.6125
60:	[0s / 7s],		train_loss: 4.3631
42:	[1s / 1m:10s],		train_loss: 4.0715
98:	[0s / 12s],		train_loss: 3.6730
21:	[0s / 10s],		train_loss: 4.4669
61:	[0s / 7s],		train_loss: 4.3444
99:	[0s / 12s],		train_loss: 3.6866
90:	[0s / 21s],		train_loss: 2.6109
62:	[0s / 7s],		train_loss: 4.3467
0:	[0s / 0s],		train_loss: 6.5423
0:	[0s / 0s],		train_loss: 5.1583
63:	[0s / 7s],		train_loss: 4.3664
91:	[0s / 22s],		train_loss: 2.5901
1:	[0s / 0s],		train_loss: 4.7587
64:	[0s / 8s],		train_loss: 4.3562
22:	[0s / 11s],		train_loss: 4.4400
1:	[0s / 0s],		train_loss: 4.6480
2:	[0s / 0s],		train_loss: 4.5705
65:	[0s / 8s],		train_loss: 4.3820
58:	[0s / 1m:11s],		train_loss: 4.0465
92:	[0s / 22s],		train_loss: 2.6399
3:	[0s / 0s],		train_loss: 4.4962
66:	[0s / 8s],		train_loss: 4.3421
4:	[0s / 0s],		train_loss: 4.4628
67:	[0s / 8s],		train_loss: 4.3422
2:	[0s / 0s],		train_loss: 4.5596
93:	[0s / 22s],		train_loss: 2.6509
23:	[0s / 11s],		train_loss: 4.4811
5:	[0s / 0s],		train_loss: 4.3938
29:	[2s / 1m:11s],		train_loss: 4.1991
68:	[0s / 8s],		train_loss: 4.3458
43:	[1s / 1m:11s],		train_loss: 4.0506
6:	[0s / 0s],		train_loss: 4.4175
69:	[0s / 8s],		train_loss: 4.3780
94:	[0s / 22s],		train_loss: 2.6296
3:	[0s / 1s],		train_loss: 4.4838
7:	[0s / 1s],		train_loss: 4.3798
70:	[0s / 8s],		train_loss: 4.3598
8:	[0s / 1s],		train_loss: 4.3750
71:	[0s / 9s],		train_loss: 4.3490
95:	[0s / 23s],		train_loss: 2.6648
24:	[0s / 12s],		train_loss: 4.4973
59:	[0s / 1m:11s],		train_loss: 4.0480
9:	[0s / 1s],		train_loss: 4.3714
4:	[0s / 1s],		train_loss: 4.4562
72:	[0s / 9s],		train_loss: 4.3390
10:	[0s / 1s],		train_loss: 4.3509
96:	[0s / 23s],		train_loss: 2.6327
73:	[0s / 9s],		train_loss: 4.3497
11:	[0s / 1s],		train_loss: 4.3321
74:	[0s / 9s],		train_loss: 4.3607
5:	[0s / 1s],		train_loss: 4.4457
12:	[0s / 1s],		train_loss: 4.3364
97:	[0s / 23s],		train_loss: 2.5888
75:	[0s / 9s],		train_loss: 4.3436
25:	[0s / 12s],		train_loss: 4.5120
13:	[0s / 1s],		train_loss: 4.3070
76:	[0s / 9s],		train_loss: 4.3753
14:	[0s / 1s],		train_loss: 4.3060
98:	[0s / 23s],		train_loss: 2.6239
6:	[0s / 2s],		train_loss: 4.3985
77:	[0s / 9s],		train_loss: 4.3597
44:	[1s / 1m:12s],		train_loss: 4.0689
15:	[0s / 2s],		train_loss: 4.3043
60:	[0s / 1m:12s],		train_loss: 4.0237
78:	[0s / 9s],		train_loss: 4.3207
99:	[0s / 24s],		train_loss: 2.5984
16:	[0s / 2s],		train_loss: 4.3013
79:	[0s / 10s],		train_loss: 4.3710
26:	[0s / 13s],		train_loss: 4.4934
7:	[0s / 2s],		train_loss: 4.3829
17:	[0s / 2s],		train_loss: 4.2815
80:	[0s / 10s],		train_loss: 4.3521
18:	[0s / 2s],		train_loss: 4.2904
0:	[0s / 0s],		train_loss: 5.3586
81:	[0s / 10s],		train_loss: 4.3247
19:	[0s / 2s],		train_loss: 4.2653
8:	[0s / 2s],		train_loss: 4.4038
1:	[0s / 0s],		train_loss: 4.7317
82:	[0s / 10s],		train_loss: 4.3484
20:	[0s / 2s],		train_loss: 4.2527
2:	[0s / 0s],		train_loss: 4.5816
83:	[0s / 10s],		train_loss: 4.3131
27:	[0s / 14s],		train_loss: 4.4675
21:	[0s / 2s],		train_loss: 4.2516
9:	[0s / 3s],		train_loss: 4.4243
84:	[0s / 10s],		train_loss: 4.3299
22:	[0s / 3s],		train_loss: 4.2462
3:	[0s / 0s],		train_loss: 4.4834
61:	[0s / 1m:13s],		train_loss: 4.0298
85:	[0s / 10s],		train_loss: 4.3521
23:	[0s / 3s],		train_loss: 4.2009
4:	[0s / 0s],		train_loss: 4.4474
86:	[0s / 11s],		train_loss: 4.3046
10:	[0s / 3s],		train_loss: 4.3958
24:	[0s / 3s],		train_loss: 4.2177
30:	[2s / 1m:13s],		train_loss: 4.1755
5:	[0s / 1s],		train_loss: 4.4231
87:	[0s / 11s],		train_loss: 4.3439
28:	[0s / 14s],		train_loss: 4.4595
25:	[0s / 3s],		train_loss: 4.2358
88:	[0s / 11s],		train_loss: 4.3499
26:	[0s / 3s],		train_loss: 4.2055
11:	[0s / 3s],		train_loss: 4.3838
6:	[0s / 1s],		train_loss: 4.4194
45:	[1s / 1m:14s],		train_loss: 4.0441
89:	[0s / 11s],		train_loss: 4.3089
27:	[0s / 3s],		train_loss: 4.1842
7:	[0s / 1s],		train_loss: 4.3811
28:	[0s / 3s],		train_loss: 4.1990
90:	[0s / 11s],		train_loss: 4.3021
12:	[0s / 4s],		train_loss: 4.3791
8:	[0s / 1s],		train_loss: 4.3772
29:	[0s / 15s],		train_loss: 4.5034
29:	[0s / 3s],		train_loss: 4.1880
91:	[0s / 11s],		train_loss: 4.3541
62:	[0s / 1m:14s],		train_loss: 4.0389
9:	[0s / 1s],		train_loss: 4.3474
30:	[0s / 4s],		train_loss: 4.1610
92:	[0s / 11s],		train_loss: 4.3619
31:	[0s / 4s],		train_loss: 4.1496
93:	[0s / 12s],		train_loss: 4.2922
13:	[0s / 4s],		train_loss: 4.3964
10:	[0s / 1s],		train_loss: 4.3935
32:	[0s / 4s],		train_loss: 4.1555
94:	[0s / 12s],		train_loss: 4.3649
30:	[0s / 15s],		train_loss: 4.4910
11:	[0s / 2s],		train_loss: 4.3178
33:	[0s / 4s],		train_loss: 4.1359
95:	[0s / 12s],		train_loss: 4.3240
14:	[0s / 4s],		train_loss: 4.3860
34:	[0s / 4s],		train_loss: 4.1413
12:	[0s / 2s],		train_loss: 4.3285
96:	[0s / 12s],		train_loss: 4.2921
35:	[0s / 4s],		train_loss: 4.1329
97:	[0s / 12s],		train_loss: 4.3598
13:	[0s / 2s],		train_loss: 4.3340
15:	[0s / 5s],		train_loss: 4.3889
36:	[0s / 4s],		train_loss: 4.1141
63:	[0s / 1m:15s],		train_loss: 4.0178
98:	[0s / 12s],		train_loss: 4.3510
31:	[0s / 16s],		train_loss: 4.4919
37:	[0s / 4s],		train_loss: 4.0999
14:	[0s / 2s],		train_loss: 4.2941
99:	[0s / 12s],		train_loss: 4.3249
38:	[0s / 5s],		train_loss: 4.0835
16:	[0s / 5s],		train_loss: 4.4270
15:	[0s / 2s],		train_loss: 4.3130
39:	[0s / 5s],		train_loss: 4.0827
0:	[0s / 0s],		train_loss: 4.8483
16:	[0s / 2s],		train_loss: 4.2893
40:	[0s / 5s],		train_loss: 4.0920
17:	[0s / 5s],		train_loss: 4.3838
1:	[0s / 0s],		train_loss: 4.4523
41:	[0s / 5s],		train_loss: 4.0535
17:	[0s / 3s],		train_loss: 4.2501
32:	[0s / 16s],		train_loss: 4.4220
46:	[1s / 1m:16s],		train_loss: 4.0368
2:	[0s / 0s],		train_loss: 4.4192
42:	[0s / 5s],		train_loss: 4.0712
18:	[0s / 3s],		train_loss: 4.2483
18:	[0s / 5s],		train_loss: 4.3982
3:	[0s / 0s],		train_loss: 4.3962
43:	[0s / 5s],		train_loss: 4.0650
64:	[0s / 1m:16s],		train_loss: 4.0183
4:	[0s / 0s],		train_loss: 4.4108
19:	[0s / 3s],		train_loss: 4.2603
44:	[0s / 5s],		train_loss: 4.0290
19:	[0s / 6s],		train_loss: 4.3812
33:	[0s / 17s],		train_loss: 4.4746
5:	[0s / 0s],		train_loss: 4.3544
45:	[0s / 5s],		train_loss: 4.0243
20:	[0s / 3s],		train_loss: 4.2519
6:	[0s / 0s],		train_loss: 4.3586
46:	[0s / 6s],		train_loss: 4.0479
21:	[0s / 3s],		train_loss: 4.2491
7:	[0s / 1s],		train_loss: 4.3551
47:	[0s / 6s],		train_loss: 4.0410
20:	[0s / 6s],		train_loss: 4.3751
48:	[0s / 6s],		train_loss: 4.0394
8:	[0s / 1s],		train_loss: 4.3603
22:	[0s / 4s],		train_loss: 4.2185
31:	[3s / 1m:17s],		train_loss: 4.1992
34:	[0s / 17s],		train_loss: 4.4762
49:	[0s / 6s],		train_loss: 4.0025
9:	[0s / 1s],		train_loss: 4.3570
23:	[0s / 4s],		train_loss: 4.1864
21:	[0s / 6s],		train_loss: 4.4021
50:	[0s / 6s],		train_loss: 4.0194
65:	[0s / 1m:17s],		train_loss: 3.9802
10:	[0s / 1s],		train_loss: 4.3545
24:	[0s / 4s],		train_loss: 4.2007
51:	[0s / 6s],		train_loss: 4.0182
11:	[0s / 1s],		train_loss: 4.3533
52:	[0s / 6s],		train_loss: 3.9973
22:	[0s / 7s],		train_loss: 4.3481
25:	[0s / 4s],		train_loss: 4.1969
12:	[0s / 1s],		train_loss: 4.3235
47:	[1s / 1m:17s],		train_loss: 3.9889
35:	[0s / 18s],		train_loss: 4.4566
53:	[0s / 6s],		train_loss: 3.9593
13:	[0s / 1s],		train_loss: 4.3035
26:	[0s / 4s],		train_loss: 4.2045
54:	[0s / 7s],		train_loss: 3.9929
14:	[0s / 1s],		train_loss: 4.3111
23:	[0s / 7s],		train_loss: 4.3362
27:	[0s / 4s],		train_loss: 4.1984
55:	[0s / 7s],		train_loss: 3.9564
15:	[0s / 2s],		train_loss: 4.3229
56:	[0s / 7s],		train_loss: 3.9728
28:	[0s / 5s],		train_loss: 4.1989
16:	[0s / 2s],		train_loss: 4.3294
24:	[0s / 7s],		train_loss: 4.3695
66:	[0s / 1m:18s],		train_loss: 4.0050
57:	[0s / 7s],		train_loss: 3.9661
36:	[0s / 18s],		train_loss: 4.4543
29:	[0s / 5s],		train_loss: 4.1791
17:	[0s / 2s],		train_loss: 4.3415
58:	[0s / 7s],		train_loss: 3.9440
18:	[0s / 2s],		train_loss: 4.2910
30:	[0s / 5s],		train