[I 2026-06-07 00:13:14,932] Trial 69 finished with value: 0.8081783268145054 and parameters: {'num_nodes': [64, 32], 'dropout': 0.16464952795680382, 'learning_rate': 0.00010576487361357033, 'batch_norm': False}. Best is trial 13 with value: 0.8124644084489007.
/scratch.hpc/luca.cotugno/Foundation_model_clinical_data/test_tabular_model_tmp.py:476: UserWarning: Choices for a categorical distribution should be a tuple of None, bool, int, float and str for persistent storage but contains [32] which is of type list.
  num_nodes  = trial.suggest_categorical("num_nodes", [[32], [64], [128], [64, 32], [128, 64]])
/scratch.hpc/luca.cotugno/Foundation_model_clinical_data/test_tabular_model_tmp.py:476: UserWarning: Choices for a categorical distribution should be a tuple of None, bool, int, float and str for persistent storage but contains [64] which is of type list.
  num_nodes  = trial.suggest_categorical("num_nodes", [[32], [64], [128], [64, 32], [128, 64]])
/scratch.hpc/luca.cotugno/Foundation_model_clinical_data/test_tabular_model_tmp.py:476: UserWarning: Choices for a categorical distribution should be a tuple of None, bool, int, float and str for persistent storage but contains [128] which is of type list.
  num_nodes  = trial.suggest_categorical("num_nodes", [[32], [64], [128], [64, 32], [128, 64]])
/scratch.hpc/luca.cotugno/Foundation_model_clinical_data/test_tabular_model_tmp.py:476: UserWarning: Choices for a categorical distribution should be a tuple of None, bool, int, float and str for persistent storage but contains [64, 32] which is of type list.
  num_nodes  = trial.suggest_categorical("num_nodes", [[32], [64], [128], [64, 32], [128, 64]])
/scratch.hpc/luca.cotugno/Foundation_model_clinical_data/test_tabular_model_tmp.py:476: UserWarning: Choices for a categorical distribution should be a tuple of None, bool, int, float and str for persistent storage but contains [128, 64] which is of type list.
  num_nodes  = trial.suggest_categorical("num_nodes", [[32], [64], [128], [64, 32], [128, 64]])

71:	[0s / 40s],		train_loss: 2.4356
80:	[0s / 34s],		train_loss: 2.4408
42:	[0s / 19s],		train_loss: 2.4837
53:	[0s / 55s],		train_loss: 2.4713
81:	[0s / 34s],		train_loss: 2.4398
72:	[0s / 41s],		train_loss: 2.4252
43:	[0s / 19s],		train_loss: 2.4830
82:	[0s / 34s],		train_loss: 2.4377
73:	[0s / 41s],		train_loss: 2.4194
44:	[0s / 19s],		train_loss: 2.4712
83:	[0s / 35s],		train_loss: 2.4258
54:	[0s / 56s],		train_loss: 2.4615
45:	[0s / 20s],		train_loss: 2.4886
74:	[0s / 42s],		train_loss: 2.4192
84:	[0s / 35s],		train_loss: 2.4417
46:	[0s / 20s],		train_loss: 2.4824
85:	[0s / 36s],		train_loss: 2.4399
75:	[0s / 43s],		train_loss: 2.4277
55:	[1s / 57s],		train_loss: 2.4576
47:	[0s / 21s],		train_loss: 2.4621
86:	[0s / 36s],		train_loss: 2.4410
76:	[0s / 43s],		train_loss: 2.4256
87:	[0s / 36s],		train_loss: 2.4348
48:	[0s / 21s],		train_loss: 2.4747
77:	[0s / 44s],		train_loss: 2.4187
88:	[0s / 37s],		train_loss: 2.4375
56:	[1s / 58s],		train_loss: 2.4631
49:	[0s / 22s],		train_loss: 2.4708
89:	[0s / 37s],		train_loss: 2.4279
50:	[0s / 22s],		train_loss: 2.4570
78:	[0s / 44s],		train_loss: 2.4285
90:	[0s / 38s],		train_loss: 2.4414
51:	[0s / 23s],		train_loss: 2.4686
57:	[1s / 59s],		train_loss: 2.4572
79:	[0s / 45s],		train_loss: 2.4249
91:	[0s / 38s],		train_loss: 2.4385
52:	[0s / 23s],		train_loss: 2.4711
80:	[0s / 45s],		train_loss: 2.4277
92:	[0s / 39s],		train_loss: 2.4240
53:	[0s / 23s],		train_loss: 2.4690
93:	[0s / 39s],		train_loss: 2.4282
58:	[1s / 1m:0s],		train_loss: 2.4582
81:	[0s / 46s],		train_loss: 2.4238
54:	[0s / 24s],		train_loss: 2.4702
94:	[0s / 39s],		train_loss: 2.4136
55:	[0s / 24s],		train_loss: 2.4692
82:	[0s / 46s],		train_loss: 2.4171
95:	[0s / 40s],		train_loss: 2.4327
59:	[1s / 1m:1s],		train_loss: 2.4595
56:	[0s / 25s],		train_loss: 2.4698
96:	[0s / 40s],		train_loss: 2.4299
83:	[0s / 47s],		train_loss: 2.4066
57:	[0s / 25s],		train_loss: 2.4925
97:	[0s / 41s],		train_loss: 2.4243
84:	[0s / 48s],		train_loss: 2.4163
58:	[0s / 26s],		train_loss: 2.4650
98:	[0s / 41s],		train_loss: 2.4179
60:	[1s / 1m:2s],		train_loss: 2.4551
59:	[0s / 26s],		train_loss: 2.4632
85:	[0s / 48s],		train_loss: 2.4114
99:	[0s / 41s],		train_loss: 2.4229
60:	[0s / 27s],		train_loss: 2.4674
86:	[0s / 49s],		train_loss: 2.4150
0:	[0s / 0s],		train_loss: 5.1604
61:	[0s / 1m:3s],		train_loss: 2.4531
61:	[0s / 27s],		train_loss: 2.4587
1:	[0s / 0s],		train_loss: 3.4074
87:	[0s / 49s],		train_loss: 2.4182
62:	[0s / 28s],		train_loss: 2.4681
2:	[0s / 1s],		train_loss: 2.9966
88:	[0s / 50s],		train_loss: 2.4111
62:	[0s / 1m:4s],		train_loss: 2.4461
63:	[0s / 28s],		train_loss: 2.4666
3:	[0s / 1s],		train_loss: 2.8677
89:	[0s / 50s],		train_loss: 2.4105
64:	[0s / 28s],		train_loss: 2.4736
4:	[0s / 2s],		train_loss: 2.7876
65:	[0s / 29s],		train_loss: 2.4714
5:	[0s / 2s],		train_loss: 2.7155
63:	[1s / 1m:5s],		train_loss: 2.4476
90:	[0s / 51s],		train_loss: 2.4193
66:	[0s / 29s],		train_loss: 2.4654
6:	[0s / 2s],		train_loss: 2.6898
91:	[0s / 52s],		train_loss: 2.4136
67:	[0s / 30s],		train_loss: 2.4571
7:	[0s / 3s],		train_loss: 2.6595
64:	[1s / 1m:6s],		train_loss: 2.4518
92:	[0s / 52s],		train_loss: 2.4068
8:	[0s / 3s],		train_loss: 2.6689
68:	[0s / 30s],		train_loss: 2.4534
9:	[0s / 4s],		train_loss: 2.6367
69:	[0s / 31s],		train_loss: 2.4599
93:	[0s / 53s],		train_loss: 2.4100
10:	[0s / 4s],		train_loss: 2.6272
65:	[1s / 1m:7s],		train_loss: 2.4408
70:	[0s / 31s],		train_loss: 2.4702
94:	[0s / 53s],		train_loss: 2.4050
11:	[0s / 4s],		train_loss: 2.6148
71:	[0s / 31s],		train_loss: 2.4671
95:	[0s / 54s],		train_loss: 2.4079
12:	[0s / 5s],		train_loss: 2.6102
72:	[0s / 32s],		train_loss: 2.4635
66:	[1s / 1m:8s],		train_loss: 2.4440
13:	[0s / 5s],		train_loss: 2.6013
73:	[0s / 32s],		train_loss: 2.4707
96:	[0s / 54s],		train_loss: 2.3964
14:	[0s / 6s],		train_loss: 2.6014
74:	[0s / 33s],		train_loss: 2.4545
97:	[0s / 55s],		train_loss: 2.3997
15:	[0s / 6s],		train_loss: 2.5942
67:	[1s / 1m:9s],		train_loss: 2.4516
75:	[0s / 33s],		train_loss: 2.4643
16:	[0s / 7s],		train_loss: 2.5811
98:	[0s / 56s],		train_loss: 2.4048
76:	[0s / 34s],		train_loss: 2.4659
17:	[0s / 7s],		train_loss: 2.5780
99:	[0s / 56s],		train_loss: 2.4027
77:	[0s / 34s],		train_loss: 2.4632
68:	[1s / 1m:11s],		train_loss: 2.4474
18:	[0s / 7s],		train_loss: 2.5700
78:	[0s / 35s],		train_loss: 2.4521
0:	[0s / 0s],		train_loss: 4.0563
19:	[0s / 8s],		train_loss: 2.5714
79:	[0s / 35s],		train_loss: 2.4755
20:	[0s / 8s],		train_loss: 2.5655
69:	[1s / 1m:12s],		train_loss: 2.4438
1:	[0s / 1s],		train_loss: 3.0474
80:	[0s / 36s],		train_loss: 2.4637
21:	[0s / 9s],		train_loss: 2.5616
2:	[0s / 1s],		train_loss: 2.8344
81:	[0s / 36s],		train_loss: 2.4580
22:	[0s / 9s],		train_loss: 2.5511
70:	[1s / 1m:13s],		train_loss: 2.4426
82:	[0s / 36s],		train_loss: 2.4392
3:	[0s / 2s],		train_loss: 2.7753
23:	[0s / 10s],		train_loss: 2.5402
83:	[0s / 37s],		train_loss: 2.4639
24:	[0s / 10s],		train_loss: 2.5403
4:	[0s / 2s],		train_loss: 2.7322
84:	[0s / 37s],		train_loss: 2.4534
25:	[0s / 10s],		train_loss: 2.5365
71:	[1s / 1m:14s],		train_loss: 2.4452
5:	[0s / 3s],		train_loss: 2.6990
85:	[0s / 38s],		train_loss: 2.4603
26:	[0s / 11s],		train_loss: 2.5383
27:	[0s / 11s],		train_loss: 2.5286
86:	[0s / 38s],		train_loss: 2.4557
6:	[0s / 3s],		train_loss: 2.6649
72:	[1s / 1m:15s],		train_loss: 2.4367
28:	[0s / 12s],		train_loss: 2.5289
87:	[0s / 39s],		train_loss: 2.4503
7:	[0s / 4s],		train_loss: 2.6368
29:	[0s / 12s],		train_loss: 2.5253
88:	[0s / 39s],		train_loss: 2.4437
8:	[0s / 5s],		train_loss: 2.6441
30:	[0s / 12s],		train_loss: 2.5206
89:	[0s / 39s],		train_loss: 2.4816
73:	[1s / 1m:16s],		train_loss: 2.4387
31:	[0s / 13s],		train_loss: 2.5115
9:	[0s / 5s],		train_loss: 2.6172
90:	[0s / 40s],		train_loss: 2.4490
32:	[0s / 13s],		train_loss: 2.5199
91:	[0s / 40s],		train_loss: 2.4500
10:	[0s / 6s],		train_loss: 2.5989
74:	[0s / 1m:17s],		train_loss: 2.4476
33:	[0s / 14s],		train_loss: 2.5165
92:	[0s / 41s],		train_loss: 2.4461
11:	[0s / 6s],		train_loss: 2.5919
34:	[0s / 14s],		train_loss: 2.5161
93:	[0s / 41s],		train_loss: 2.4446
75:	[0s / 1m:18s],		train_loss: 2.4447
35:	[0s / 15s],		train_loss: 2.5040
12:	[0s / 7s],		train_loss: 2.5811
94:	[0s / 42s],		train_loss: 2.4511
36:	[0s / 15s],		train_loss: 2.5077
13:	[0s / 7s],		train_loss: 2.5720
95:	[0s / 42s],		train_loss: 2.4509
37:	[0s / 15s],		train_loss: 2.4920
76:	[1s / 1m:19s],		train_loss: 2.4445
96:	[0s / 43s],		train_loss: 2.4579
14:	[0s / 8s],		train_loss: 2.5554
38:	[0s / 16s],		train_loss: 2.5091
97:	[0s / 43s],		train_loss: 2.4489
15:	[0s / 8s],		train_loss: 2.5499
39:	[0s / 16s],		train_loss: 2.4958
98:	[0s / 43s],		train_loss: 2.4560
77:	[1s / 1m:20s],		train_loss: 2.4431
40:	[0s / 17s],		train_loss: 2.4987
16:	[0s / 9s],		train_loss: 2.5452
99:	[0s / 44s],		train_loss: 2.4546
41:	[0s / 17s],		train_loss: 2.5028
17:	[0s / 10s],		train_loss: 2.5498
42:	[0s / 18s],		train_loss: 2.4959
78:	[0s / 1m:21s],		train_loss: 2.4452
0:	[0s / 0s],		train_loss: 4.6609
43:	[0s / 18s],		train_loss: 2.4944
18:	[0s / 10s],		train_loss: 2.5489
1:	[0s / 1s],		train_loss: 3.4420
44:	[0s / 18s],		train_loss: 2.4843
79:	[1s / 1m:22s],		train_loss: 2.4366
2:	[0s / 1s],		train_loss: 3.0989
19:	[0s / 11s],		train_loss: 2.5291
45:	[0s / 19s],		train_loss: 2.4974
3:	[0s / 2s],		train_loss: 2.9356
46:	[0s / 19s],		train_loss: 2.4869
20:	[0s / 12s],		train_loss: 2.5349
47:	[0s / 20s],		train_loss: 2.4866
80:	[1s / 1m:23s],		train_loss: 2.4245
4:	[0s / 2s],		train_loss: 2.8329
21:	[0s / 12s],		train_loss: 2.5306
48:	[0s / 20s],		train_loss: 2.4779
5:	[0s / 3s],		train_loss: 2.7837
49:	[0s / 20s],		train_loss: 2.4837
22:	[0s / 13s],		train_loss: 2.5306
6:	[0s / 3s],		train_loss: 2.7464
81:	[1s / 1m:24s],		train_loss: 2.4330
50:	[0s / 21s],		train_loss: 2.4829
7:	[0s / 4s],		train_loss: 2.7113
51:	[0s / 21s],		train_loss: 2.4844
23:	[0s / 13s],		train_loss: 2.5187
8:	[0s / 4s],		train_loss: 2.6836
52:	[0s / 22s],		train_loss: 2.4865
82:	[1s / 1m:25s],		train_loss: 2.4329
24:	[0s / 14s],		train_loss: 2.5172
53:	[0s / 22s],		train_loss: 2.4713
9:	[0s / 4s],		train_loss: 2.6513
54:	[0s / 22s],		train_loss: 2.4923
25:	[0s / 15s],		train_loss: 2.5156
10:	[0s / 5s],		train_loss: 2.6392
83:	[1s / 1m:26s],		train_loss: 2.4320
55:	[0s / 23s],		train_loss: 2.4757
11:	[0s / 5s],		train_loss: 2.6258
26:	[0s / 15s],		train_loss: 2.5193
56:	[0s / 23s],		train_loss: 2.4763
12:	[0s / 6s],		train_loss: 2.6220
57:	[0s / 24s],		train_loss: 2.4698
84:	[0s / 1m:27s],		train_loss: 2.4226
27:	[0s / 16s],		train_loss: 2.5126
13:	[0s / 6s],		train_loss: 2.6040
58:	[0s / 24s],		train_loss: 2.4655
59:	[0s / 24s],		train_loss: 2.4804
28:	[0s / 17s],		train_loss: 2.5074
14:	[0s / 7s],		train_loss: 2.5985
85:	[1s / 1m:28s],		train_loss: 2.4317
60:	[0s / 25s],		train_loss: 2.4721
15:	[0s / 7s],		train_loss: 2.5841
29:	[0s / 17s],		train_loss: 2.5085
61:	[0s / 25s],		train_loss: 2.4661
16:	[0s / 8s],		train_loss: 2.5811
62:	[0s / 26s],		train_loss: 2.4597
30:	[0s / 18s],		train_loss: 2.5053
86:	[0s / 1m:29s],		train_loss: 2.4226
17:	[0s / 8s],		train_loss: 2.6012
63:	[0s / 26s],		train_loss: 2.4738
31:	[0s / 19s],		train_loss: 2.5016
64:	[0s / 26s],		train_loss: 2.4685
18:	[0s / 9s],		train_loss: 2.5719
87:	[0s / 1m:30s],		train_loss: 2.4227
65:	[0s / 27s],		train_loss: 2.4640
32:	[0s / 19s],		train_loss: 2.4930
19:	[0s / 9s],		train_loss: 2.5515
66:	[0s / 27s],		train_loss: 2.4537
20:	[0s / 10s],		train_loss: 2.5453
33:	[0s / 20s],		train_loss: 2.5028
67:	[0s / 28s],		train_loss: 2.4806
88:	[1s / 1m:31s],		train_loss: 2.4313
21:	[0s / 10s],		train_loss: 2.5533
68:	[0s / 28s],		train_loss: 2.4596
34:	[0s / 21s],		train_loss: 2.5030
22:	[0s / 11s],		train_loss: 2.5512
69:	[0s / 29s],		train_loss: 2.4580
89:	[1s / 1m:32s],		train_loss: 2.4206
35:	[0s / 21s],		train_loss: 2.4971
70:	[0s / 29s],		train_loss: 2.4738
23:	[0s / 11s],		train_loss: 2.5336
71:	[0s / 29s],		train_loss: 2.4582
24:	[0s / 12s],		train_loss: 2.5254
36:	[0s / 22s],		train_loss: 2.4988
72:	[0s / 30s],		train_loss: 2.4564
90:	[1s / 1m:33s],		train_loss: 2.4188
25:	[0s / 12s],		train_loss: 2.5230
73:	[0s / 30s],		train_loss: 2.4510
37:	[0s / 22s],		train_loss: 2.4877
26:	[0s / 13s],		train_loss: 2.5175
74:	[0s / 31s],		train_loss: 2.4584
38:	[0s / 23s],		train_loss: 2.4877
91:	[1s / 1m:34s],		train_loss: 2.4276
75:	[0s / 31s],		train_loss: 2.4524
27:	[0s / 13s],		train_loss: 2.5248
76:	[0s / 31s],		train_loss: 2.4540
39:	[0s / 24s],		train_loss: 2.4873
28:	[0s / 14s],		train_loss: 2.5258
77:	[0s / 32s],		train_loss: 2.4449
29:	[0s / 14s],		train_loss: 2.5082
92:	[1s / 1m:35s],		train_loss: 2.4323
40:	[0s / 24s],		train_loss: 2.4812
78:	[0s / 32s],		train_loss: 2.4549
30:	[0s / 15s],		train_loss: 2.5169
79:	[0s / 33s],		train_loss: 2.4502
41:	[0s / 25s],		train_loss: 2.4869
31:	[0s / 15s],		train_loss: 2.5240
80:	[0s / 33s],		train_loss: 2.4556
93:	[1s / 1m:36s],		train_loss: 2.4260
81:	[0s / 33s],		train_loss: 2.4453
32:	[0s / 16s],		train_loss: 2.4995
42:	[0s / 26s],		train_loss: 2.4824
82:	[0s / 34s],		train_loss: 2.4456
33:	[0s / 16s],		train_loss: 2.4976
43:	[0s / 26s],		train_loss: 2.4856
94:	[1s / 1m:37s],		train_loss: 2.4304
83:	[0s / 34s],		train_loss: 2.4536
34:	[0s / 17s],		train_loss: 2.4963
84:	[0s / 35s],		train_loss: 2.4493
44:	[0s / 27s],		train_loss: 2.4891
35:	[0s / 17s],		train_loss: 2.5127
85:	[0s / 35s],		train_loss: 2.4506
95:	[0s / 1m:38s],		train_loss: 2.4220
45:	[0s / 28s],		train_loss: 2.4707
36:	[0s / 18s],		train_loss: 2.5148
86:	[0s / 35s],		train_loss: 2.4518
87:	[0s / 36s],		train_loss: 2.4606
37:	[0s / 18s],		train_loss: 2.4940
46:	[0s / 28s],		train_loss: 2.4831
96:	[0s / 1m:39s],		train_loss: 2.4328
88:	[0s / 36s],		train_loss: 2.4488
38:	[0s / 19s],		train_loss: 2.5115
47:	[0s / 29s],		train_loss: 2.4850
89:	[0s / 37s],		train_loss: 2.4411
39:	[0s / 19s],		train_loss: 2.5024
90:	[0s / 37s],		train_loss: 2.4413
97:	[1s / 1m:40s],		train_loss: 2.4298
48:	[0s / 30s],		train_loss: 2.4813
40:	[0s / 20s],		train_loss: 2.5037
91:	[0s / 37s],		train_loss: 2.4466
41:	[0s / 20s],		train_loss: 2.4864
92:	[0s / 38s],		train_loss: 2.4343
49:	[0s / 30s],		train_loss: 2.4716
98:	[1s / 1m:41s],		train_loss: 2.4274
93:	[0s / 38s],		train_loss: 2.4368
42:	[0s / 21s],		train_loss: 2.4848
50:	[0s / 31s],		train_loss: 2.4740
94:	[0s / 39s],		train_loss: 2.4429
43:	[0s / 21s],		train_loss: 2.4956
95:	[0s / 39s],		train_loss: 2.4471
51:	[0s / 31s],		train_loss: 2.4685
99:	[1s / 1m:42s],		train_loss: 2.4140
44:	[0s / 22s],		train_loss: 2.4833
96:	[0s / 40s],		train_loss: 2.4401
52:	[0s / 32s],		train_loss: 2.4635
45:	[0s / 22s],		train_loss: 2.4945
97:	[0s / 40s],		train_loss: 2.4470
0:	[1s / 1s],		train_loss: 4.3269
46:	[0s / 23s],		train_loss: 2.4984
98:	[0s / 40s],		train_loss: 2.4456
53:	[0s / 33s],		train_loss: 2.4659
99:	[0s / 41s],		train_loss: 2.4426
47:	[0s / 23s],		train_loss: 2.4865
54:	[0s / 34s],		train_loss: 2.4617
1:	[1s / 2s],		train_loss: 3.0952
48:	[0s / 24s],		train_loss: 2.4809
0:	[0s / 0s],		train_loss: 4.2844
55:	[0s / 34s],		train_loss: 2.4727
1:	[0s / 0s],		train_loss: 3.4112
49:	[0s / 24s],		train_loss: 2.4815
2:	[0s / 1s],		train_loss: 3.1094
56:	[0s / 35s],		train_loss: 2.4660
50:	[0s / 25s],		train_loss: 2.4623
2:	[1s / 3s],		train_loss: 2.8389
3:	[0s / 1s],		train_loss: 3.0388
51:	[0s / 25s],		train_loss: 2.4889
57:	[0s / 35s],		train_loss: 2.4623
4:	[0s / 2s],		train_loss: 2.9286
52:	[0s / 26s],		train_loss: 2.4683
58:	[0s / 36s],		train_loss: 2.4592
5:	[0s / 2s],		train_loss: 2.8708
3:	[1s / 4s],		train_loss: 2.7516
53:	[0s / 26s],		train_loss: 2.4599
59:	[0s / 36s],		train_loss: 2.4605
6:	[0s / 3s],		train_loss: 2.8226
54:	[0s / 27s],		train_loss: 2.4646
7:	[0s / 3s],		train_loss: 2.7600
60:	[0s / 37s],		train_loss: 2.4629
55:	[0s / 27s],		train_loss: 2.4688
4:	[1s / 5s],		train_loss: 2.6990
8:	[0s / 4s],		train_loss: 2.7210
56:	[0s / 28s],		train_loss: 2.4756
61:	[0s / 38s],		train_loss: 2.4727
9:	[0s / 4s],		train_loss: 2.6854
57:	[0s / 28s],		train_loss: 2.4635
62:	[0s / 38s],		train_loss: 2.4599
10:	[0s / 5s],		train_loss: 2.6454
5:	[1s / 6s],		train_loss: 2.6630
58:	[0s / 29s],		train_loss: 2.4727
11:	[0s / 5s],		train_loss: 2.6455
63:	[0s / 39s],		train_loss: 2.4550
59:	[0s / 29s],		train_loss: 2.4704
12:	[0s / 5s],		train_loss: 2.6068
64:	[0s / 40s],		train_loss: 2.4491
60:	[0s / 30s],		train_loss: 2.4561
6:	[1s / 8s],		train_loss: 2.6403
13:	[0s / 6s],		train_loss: 2.6053
61:	[0s / 30s],		train_loss: 2.4723
65:	[0s / 40s],		train_loss: 2.4526
14:	[0s / 6s],		train_loss: 2.5998
62:	[0s / 31s],		train_loss: 2.4510
15:	[0s / 7s],		train_loss: 2.5706
66:	[0s / 41s],		train_loss: 2.4503
7:	[1s / 9s],		train_loss: 2.6310
63:	[0s / 31s],		train_loss: 2.4672
16:	[0s / 7s],		train_loss: 2.5770
67:	[0s / 41s],		train_loss: 2.4578
64:	[0s / 32s],		train_loss: 2.4626
17:	[0s / 8s],		train_loss: 2.5620
68:	[0s / 42s],		train_loss: 2.4564
65:	[0s / 32s],		train_loss: 2.4546
18:	[0s / 8s],		train_loss: 2.5694
8:	[1s / 10s],		train_loss: 2.6070
66:	[0s / 33s],		train_loss: 2.4548
69:	[0s / 42s],		train_loss: 2.4491
19:	[0s / 9s],		train_loss: 2.5594
67:	[0s / 33s],		train_loss: 2.4510
20:	[0s / 9s],		train_loss: 2.5401
70:	[0s / 43s],		train_loss: 2.4509
68:	[0s / 33s],		train_loss: 2.4602
9:	[1s / 11s],		train_loss: 2.5920
21:	[0s / 10s],		train_loss: 2.5517
71:	[0s / 44s],		train_loss: 2.4600
69:	[0s / 34s],		train_loss: 2.4374
22:	[0s / 10s],		train_loss: 2.5303
72:	[0s / 44s],		train_loss: 2.4540
70:	[0s / 34s],		train_loss: 2.4605
23:	[0s / 10s],		train_loss: 2.5350
10:	[1s / 12s],		train_loss: 2.5834
71:	[0s / 35s],		train_loss: 2.4507
24:	[0s / 11s],		train_loss: 2.5331
73:	[0s / 45s],		train_loss: 2.4512
72:	[0s / 35s],		train_loss: 2.4423
25:	[0s / 11s],		train_loss: 2.5222
74:	[0s / 45s],		train_loss: 2.4475
11:	[1s / 13s],		train_loss: 2.5708
26:	[0s / 12s],		train_loss: 2.5331
73:	[0s / 36s],		train_loss: 2.4432
75:	[0s / 46s],		train_loss: 2.4480
27:	[0s / 12s],		train_loss: 2.5315
74:	[0s / 36s],		train_loss: 2.4546
28:	[0s / 13s],		train_loss: 2.5139
76:	[0s / 47s],		train_loss: 2.4505
75:	[0s / 37s],		train_loss: 2.4377
12:	[1s / 15s],		train_loss: 2.5679
29:	[0s / 13s],		train_loss: 2.5075
76:	[0s / 37s],		train_loss: 2.4475
77:	[0s / 47s],		train_loss: 2.4488
30:	[0s / 14s],		train_loss: 2.5095
77:	[0s / 38s],		train_loss: 2.4447
78:	[0s / 48s],		train_loss: 2.4368
31:	[0s / 14s],		train_loss: 2.5140
13:	[1s / 16s],		train_loss: 2.5603
78:	[0s / 38s],		train_loss: 2.4400
32:	[0s / 14s],		train_loss: 2.5008
79:	[0s / 48s],		train_loss: 2.4483
79:	[0s / 39s],		train_loss: 2.4368
33:	[0s / 15s],		train_loss: 2.5066
80:	[0s / 49s],		train_loss: 2.4360
14:	[1s / 17s],		train_loss: 2.5543
80:	[0s / 39s],		train_loss: 2.4457
34:	[0s / 15s],		train_loss: 2.4868
81:	[0s / 40s],		train_loss: 2.4432
81:	[0s / 50s],		train_loss: 2.4442
35:	[0s / 16s],		train_loss: 2.4817
82:	[0s / 40s],		train_loss: 2.4348
82:	[0s / 50s],		train_loss: 2.4470
36:	[0s / 16s],		train_loss: 2.5041
15:	[1s / 18s],		train_loss: 2.5575
83:	[0s / 41s],		train_loss: 2.4393
37:	[0s / 17s],		train_loss: 2.4962
83:	[0s / 51s],		train_loss: 2.4487
84:	[0s / 41s],		train_loss: 2.4372
38:	[0s / 17s],		train_loss: 2.4858
16:	[1s / 19s],		train_loss: 2.5469
84:	[0s / 51s],		train_loss: 2.4347
85:	[0s / 42s],		train_loss: 2.4421
39:	[0s / 18s],		train_loss: 2.4878
86:	[0s / 42s],		train_loss: 2.4395
85:	[0s / 52s],		train_loss: 2.4492
40:	[0s / 18s],		train_loss: 2.4758
87:	[0s / 42s],		train_loss: 2.4373
41:	[0s / 19s],		train_loss: 2.4915
17:	[1s / 20s],		train_loss: 2.5336
86:	[0s / 52s],		train_loss: 2.4417
88:	[0s / 43s],		train_loss: 2.4285
42:	[0s / 19s],		train_loss: 2.4847
87:	[0s / 53s],		train_loss: 2.4495
89:	[0s / 43s],		train_loss: 2.4367
43:	[0s / 19s],		train_loss: 2.4830
18:	[1s / 21s],		train_loss: 2.5428
88:	[0s / 54s],		train_loss: 2.4373
44:	[0s / 20s],		train_loss: 2.4884
90:	[0s / 44s],		train_loss: 2.4401
45:	[0s / 20s],		train_loss: 2.4972
91:	[0s / 44s],		train_loss: 2.4252
89:	[0s / 54s],		train_loss: 2.4263
19:	[1s / 22s],		train_loss: 2.5349
46:	[0s / 21s],		train_loss: 2.4780
92:	[0s / 45s],		train_loss: 2.4236
90:	[0s / 55s],		train_loss: 2.4412
47:	[0s / 21s],		train_loss: 2.4672
93:	[0s / 45s],		train_loss: 2.4240
91:	[0s / 55s],		train_loss: 2.4308
48:	[0s / 22s],		train_loss: 2.4718
94:	[0s / 46s],		train_loss: 2.4308
20:	[1s / 24s],		train_loss: 2.5341
49:	[0s / 22s],		train_loss: 2.4780
92:	[0s / 56s],		train_loss: 2.4388
95:	[0s / 46s],		train_loss: 2.4152
50:	[0s / 23s],		train_loss: 2.4664
96:	[0s / 47s],		train_loss: 2.4263
93:	[0s / 57s],		train_loss: 2.4442
51:	[0s / 23s],		train_loss: 2.4775
21:	[1s / 25s],		train_loss: 2.5203
97:	[0s / 47s],		train_loss: 2.4068
94:	[0s / 57s],		train_loss: 2.4448
52:	[0s / 24s],		train_loss: 2.4820
98:	[0s / 48s],		train_loss: 2.4322
95:	[0s / 58s],		train_loss: 2.4415
53:	[0s / 24s],		train_loss: 2.4754
99:	[0s / 48s],		train_loss: 2.4293
22:	[1s / 26s],		train_loss: 2.5137
54:	[0s / 25s],		train_loss: 2.4675
96:	[0s / 58s],		train_loss: 2.4429
0:	[0s / 0s],		train_loss: 3.9356
55:	[0s / 25s],		train_loss: 2.4643
97:	[0s / 59s],		train_loss: 2.4362
1:	[0s / 0s],		train_loss: 2.9603
23:	[1s / 27s],		train_loss: 2.5182
56:	[0s / 25s],		train_loss: 2.4790
98:	[0s / 59s],		train_loss: 2.4255
2:	[0s / 1s],		train_loss: 2.7878
57:	[0s / 26s],		train_loss: 2.4579
99:	[0s / 1m:0s],		train_loss: 2.4417
3:	[0s / 1s],		train_loss: 2.7212
24:	[0s / 28s],		train_loss: 2.5071
58:	[0s / 26s],		train_loss: 2.4739
4:	[0s / 2s],		train_loss: 2.6829
59:	[0s / 27s],		train_loss: 2.4634
0:	[0s / 0s],		train_loss: 3.8514
5:	[0s / 2s],		train_loss: 2.6501
60:	[0s / 27s],		train_loss: 2.4589
25:	[1s / 29s],		train_loss: 2.5172
1:	[0s / 1s],		train_loss: 3.0031
6:	[0s / 3s],		train_loss: 2.6297
61:	[0s / 28s],		train_loss: 2.4665
7:	[0s / 3s],		train_loss: 2.6036
2:	[0s / 1s],		train_loss: 2.8337
62:	[0s / 28s],		train_loss: 2.4523
8:	[0s / 4s],		train_loss: 2.5964
63:	[0s / 29s],		train_loss: 2.46