[I 2026-06-07 00:09:17,815] Trial 53 finished with value: 0.8009782926674377 and parameters: {'num_nodes': [32], 'dropout': 0.22268169371623175, 'learning_rate': 0.002170654194374661, 'batch_norm': False}. Best is trial 13 with value: 0.8124644084489007.
/scratch.hpc/luca.cotugno/Foundation_model_clinical_data/test_tabular_model_tmp.py:476: UserWarning: Choices for a categorical distribution should be a tuple of None, bool, int, float and str for persistent storage but contains [32] which is of type list.
  num_nodes  = trial.suggest_categorical("num_nodes", [[32], [64], [128], [64, 32], [128, 64]])
/scratch.hpc/luca.cotugno/Foundation_model_clinical_data/test_tabular_model_tmp.py:476: UserWarning: Choices for a categorical distribution should be a tuple of None, bool, int, float and str for persistent storage but contains [64] which is of type list.
  num_nodes  = trial.suggest_categorical("num_nodes", [[32], [64], [128], [64, 32], [128, 64]])
/scratch.hpc/luca.cotugno/Foundation_model_clinical_data/test_tabular_model_tmp.py:476: UserWarning: Choices for a categorical distribution should be a tuple of None, bool, int, float and str for persistent storage but contains [128] which is of type list.
  num_nodes  = trial.suggest_categorical("num_nodes", [[32], [64], [128], [64, 32], [128, 64]])
/scratch.hpc/luca.cotugno/Foundation_model_clinical_data/test_tabular_model_tmp.py:476: UserWarning: Choices for a categorical distribution should be a tuple of None, bool, int, float and str for persistent storage but contains [64, 32] which is of type list.
  num_nodes  = trial.suggest_categorical("num_nodes", [[32], [64], [128], [64, 32], [128, 64]])
/scratch.hpc/luca.cotugno/Foundation_model_clinical_data/test_tabular_model_tmp.py:476: UserWarning: Choices for a categorical distribution should be a tuple of None, bool, int, float and str for persistent storage but contains [128, 64] which is of type list.
  num_nodes  = trial.suggest_categorical("num_nodes", [[32], [64], [128], [64, 32], [128, 64]])

40:	[0s / 17s],		train_loss: 2.4263
53:	[1s / 1m:4s],		train_loss: 2.3988
26:	[0s / 11s],		train_loss: 2.4419
41:	[0s / 18s],		train_loss: 2.4179
27:	[0s / 11s],		train_loss: 2.4488
29:	[0s / 19s],		train_loss: 2.4656
42:	[0s / 18s],		train_loss: 2.4110
28:	[0s / 11s],		train_loss: 2.4557
30:	[0s / 20s],		train_loss: 2.4761
54:	[1s / 1m:5s],		train_loss: 2.3891
43:	[0s / 18s],		train_loss: 2.4063
29:	[0s / 12s],		train_loss: 2.4417
44:	[0s / 19s],		train_loss: 2.4174
30:	[0s / 12s],		train_loss: 2.4485
31:	[0s / 21s],		train_loss: 2.4721
45:	[0s / 19s],		train_loss: 2.4134
31:	[0s / 13s],		train_loss: 2.4372
55:	[1s / 1m:6s],		train_loss: 2.3878
32:	[0s / 13s],		train_loss: 2.4399
46:	[0s / 20s],		train_loss: 2.4049
32:	[0s / 21s],		train_loss: 2.4643
33:	[0s / 13s],		train_loss: 2.4295
47:	[0s / 20s],		train_loss: 2.4170
33:	[0s / 22s],		train_loss: 2.4539
34:	[0s / 14s],		train_loss: 2.4300
56:	[1s / 1m:7s],		train_loss: 2.4040
48:	[0s / 21s],		train_loss: 2.4070
35:	[0s / 14s],		train_loss: 2.4305
49:	[0s / 21s],		train_loss: 2.4072
34:	[0s / 23s],		train_loss: 2.4627
36:	[0s / 15s],		train_loss: 2.4282
50:	[0s / 21s],		train_loss: 2.4029
57:	[1s / 1m:8s],		train_loss: 2.4006
37:	[0s / 15s],		train_loss: 2.4307
51:	[0s / 22s],		train_loss: 2.3975
35:	[0s / 23s],		train_loss: 2.4551
38:	[0s / 15s],		train_loss: 2.4253
52:	[0s / 22s],		train_loss: 2.4187
36:	[0s / 24s],		train_loss: 2.4565
39:	[0s / 16s],		train_loss: 2.4227
53:	[0s / 23s],		train_loss: 2.3938
58:	[1s / 1m:9s],		train_loss: 2.3966
40:	[0s / 16s],		train_loss: 2.4106
54:	[0s / 23s],		train_loss: 2.4028
37:	[0s / 25s],		train_loss: 2.4447
41:	[0s / 17s],		train_loss: 2.4320
55:	[0s / 24s],		train_loss: 2.3848
42:	[0s / 17s],		train_loss: 2.4150
38:	[0s / 25s],		train_loss: 2.4579
59:	[1s / 1m:10s],		train_loss: 2.4019
56:	[0s / 24s],		train_loss: 2.3933
43:	[0s / 17s],		train_loss: 2.4105
57:	[0s / 24s],		train_loss: 2.3988
39:	[0s / 26s],		train_loss: 2.4521
44:	[0s / 18s],		train_loss: 2.4191
58:	[0s / 25s],		train_loss: 2.3993
60:	[1s / 1m:11s],		train_loss: 2.3772
45:	[0s / 18s],		train_loss: 2.4136
59:	[0s / 25s],		train_loss: 2.3805
40:	[0s / 27s],		train_loss: 2.4584
46:	[0s / 19s],		train_loss: 2.4218
60:	[0s / 26s],		train_loss: 2.4016
47:	[0s / 19s],		train_loss: 2.4234
41:	[0s / 27s],		train_loss: 2.4562
61:	[0s / 26s],		train_loss: 2.3909
61:	[1s / 1m:13s],		train_loss: 2.3973
48:	[0s / 19s],		train_loss: 2.4137
62:	[0s / 27s],		train_loss: 2.3840
42:	[0s / 28s],		train_loss: 2.4309
49:	[0s / 20s],		train_loss: 2.4115
63:	[0s / 27s],		train_loss: 2.3778
50:	[0s / 20s],		train_loss: 2.4164
62:	[1s / 1m:14s],		train_loss: 2.3859
43:	[0s / 29s],		train_loss: 2.4460
64:	[0s / 27s],		train_loss: 2.3756
51:	[0s / 21s],		train_loss: 2.4188
65:	[0s / 28s],		train_loss: 2.3955
52:	[0s / 21s],		train_loss: 2.4058
44:	[0s / 29s],		train_loss: 2.4287
66:	[0s / 28s],		train_loss: 2.3765
63:	[1s / 1m:15s],		train_loss: 2.3915
53:	[0s / 22s],		train_loss: 2.4051
67:	[0s / 29s],		train_loss: 2.3758
45:	[0s / 30s],		train_loss: 2.4393
54:	[0s / 22s],		train_loss: 2.3887
68:	[0s / 29s],		train_loss: 2.3806
55:	[0s / 22s],		train_loss: 2.3947
46:	[0s / 31s],		train_loss: 2.4486
64:	[1s / 1m:16s],		train_loss: 2.3877
69:	[0s / 30s],		train_loss: 2.3807
56:	[0s / 23s],		train_loss: 2.3915
70:	[0s / 30s],		train_loss: 2.3758
57:	[0s / 23s],		train_loss: 2.3998
47:	[0s / 31s],		train_loss: 2.4304
71:	[0s / 30s],		train_loss: 2.3724
58:	[0s / 24s],		train_loss: 2.3986
65:	[1s / 1m:17s],		train_loss: 2.3873
48:	[0s / 32s],		train_loss: 2.4328
72:	[0s / 31s],		train_loss: 2.3731
59:	[0s / 24s],		train_loss: 2.3939
73:	[0s / 31s],		train_loss: 2.3761
60:	[0s / 24s],		train_loss: 2.3920
49:	[0s / 33s],		train_loss: 2.4292
74:	[0s / 32s],		train_loss: 2.3777
66:	[1s / 1m:18s],		train_loss: 2.3778
61:	[0s / 25s],		train_loss: 2.3871
62:	[0s / 25s],		train_loss: 2.3928
75:	[0s / 32s],		train_loss: 2.3776
50:	[0s / 33s],		train_loss: 2.4324
63:	[0s / 26s],		train_loss: 2.3902
76:	[0s / 32s],		train_loss: 2.3650
51:	[0s / 34s],		train_loss: 2.4267
67:	[1s / 1m:19s],		train_loss: 2.3891
64:	[0s / 26s],		train_loss: 2.3889
77:	[0s / 33s],		train_loss: 2.3741
65:	[0s / 26s],		train_loss: 2.3786
78:	[0s / 33s],		train_loss: 2.3736
52:	[0s / 35s],		train_loss: 2.4222
66:	[0s / 27s],		train_loss: 2.3955
79:	[0s / 34s],		train_loss: 2.3543
68:	[1s / 1m:20s],		train_loss: 2.3851
67:	[0s / 27s],		train_loss: 2.3878
53:	[0s / 35s],		train_loss: 2.4145
80:	[0s / 34s],		train_loss: 2.3535
68:	[0s / 28s],		train_loss: 2.3923
81:	[0s / 35s],		train_loss: 2.3648
54:	[0s / 36s],		train_loss: 2.4244
69:	[0s / 28s],		train_loss: 2.3798
82:	[0s / 35s],		train_loss: 2.3616
69:	[1s / 1m:22s],		train_loss: 2.3723
70:	[0s / 28s],		train_loss: 2.3811
55:	[0s / 37s],		train_loss: 2.4247
83:	[0s / 36s],		train_loss: 2.3563
71:	[0s / 29s],		train_loss: 2.3760
84:	[0s / 36s],		train_loss: 2.3477
56:	[0s / 37s],		train_loss: 2.4320
72:	[0s / 29s],		train_loss: 2.3848
70:	[1s / 1m:23s],		train_loss: 2.3735
85:	[0s / 36s],		train_loss: 2.3566
73:	[0s / 30s],		train_loss: 2.3817
57:	[0s / 38s],		train_loss: 2.4194
86:	[0s / 37s],		train_loss: 2.3488
74:	[0s / 30s],		train_loss: 2.3706
87:	[0s / 37s],		train_loss: 2.3449
71:	[1s / 1m:24s],		train_loss: 2.3696
75:	[0s / 31s],		train_loss: 2.3792
58:	[0s / 39s],		train_loss: 2.4155
88:	[0s / 38s],		train_loss: 2.3470
76:	[0s / 31s],		train_loss: 2.3794
89:	[0s / 38s],		train_loss: 2.3582
59:	[0s / 39s],		train_loss: 2.4154
77:	[0s / 31s],		train_loss: 2.3738
72:	[1s / 1m:25s],		train_loss: 2.3788
90:	[0s / 38s],		train_loss: 2.3516
78:	[0s / 32s],		train_loss: 2.3764
60:	[0s / 40s],		train_loss: 2.4216
91:	[0s / 39s],		train_loss: 2.3438
79:	[0s / 32s],		train_loss: 2.3658
92:	[0s / 39s],		train_loss: 2.3526
80:	[0s / 33s],		train_loss: 2.3790
61:	[0s / 41s],		train_loss: 2.4133
73:	[1s / 1m:26s],		train_loss: 2.3660
93:	[0s / 40s],		train_loss: 2.3408
81:	[0s / 33s],		train_loss: 2.3796
62:	[0s / 41s],		train_loss: 2.4087
94:	[0s / 40s],		train_loss: 2.3542
82:	[0s / 33s],		train_loss: 2.3628
95:	[0s / 41s],		train_loss: 2.3545
83:	[0s / 34s],		train_loss: 2.3773
74:	[1s / 1m:27s],		train_loss: 2.3562
63:	[0s / 42s],		train_loss: 2.4023
84:	[0s / 34s],		train_loss: 2.3643
96:	[0s / 41s],		train_loss: 2.3434
85:	[0s / 35s],		train_loss: 2.3626
97:	[0s / 41s],		train_loss: 2.3367
64:	[0s / 43s],		train_loss: 2.4173
75:	[1s / 1m:28s],		train_loss: 2.3731
86:	[0s / 35s],		train_loss: 2.3604
98:	[0s / 42s],		train_loss: 2.3371
65:	[0s / 44s],		train_loss: 2.4152
87:	[0s / 35s],		train_loss: 2.3659
99:	[0s / 42s],		train_loss: 2.3446
88:	[0s / 36s],		train_loss: 2.3656
76:	[1s / 1m:29s],		train_loss: 2.3632
66:	[0s / 44s],		train_loss: 2.4074
0:	[0s / 0s],		train_loss: 3.8411
89:	[0s / 36s],		train_loss: 2.3641
1:	[0s / 0s],		train_loss: 3.1463
90:	[0s / 37s],		train_loss: 2.3543
67:	[0s / 45s],		train_loss: 2.4049
2:	[0s / 1s],		train_loss: 2.9089
91:	[0s / 37s],		train_loss: 2.3719
77:	[1s / 1m:30s],		train_loss: 2.3701
92:	[0s / 37s],		train_loss: 2.3571
3:	[0s / 1s],		train_loss: 2.7681
68:	[0s / 46s],		train_loss: 2.4209
93:	[0s / 38s],		train_loss: 2.3568
4:	[0s / 2s],		train_loss: 2.6994
69:	[0s / 46s],		train_loss: 2.4008
94:	[0s / 38s],		train_loss: 2.3637
78:	[1s / 1m:32s],		train_loss: 2.3649
5:	[0s / 2s],		train_loss: 2.6495
95:	[0s / 39s],		train_loss: 2.3604
6:	[0s / 3s],		train_loss: 2.6318
70:	[0s / 47s],		train_loss: 2.4007
96:	[0s / 39s],		train_loss: 2.3482
7:	[0s / 3s],		train_loss: 2.6007
79:	[1s / 1m:33s],		train_loss: 2.3607
97:	[0s / 39s],		train_loss: 2.3575
71:	[0s / 48s],		train_loss: 2.4105
8:	[0s / 4s],		train_loss: 2.5816
98:	[0s / 40s],		train_loss: 2.3601
99:	[0s / 40s],		train_loss: 2.3588
9:	[0s / 4s],		train_loss: 2.5638
72:	[0s / 49s],		train_loss: 2.4048
80:	[1s / 1m:34s],		train_loss: 2.3687
0:	[0s / 0s],		train_loss: 2.8628
10:	[0s / 5s],		train_loss: 2.5598
73:	[0s / 49s],		train_loss: 2.4020
1:	[0s / 0s],		train_loss: 2.6657
11:	[0s / 5s],		train_loss: 2.5690
2:	[0s / 1s],		train_loss: 2.6245
81:	[1s / 1m:35s],		train_loss: 2.3509
74:	[0s / 50s],		train_loss: 2.4034
12:	[0s / 6s],		train_loss: 2.5407
3:	[0s / 1s],		train_loss: 2.5898
13:	[0s / 6s],		train_loss: 2.5331
75:	[0s / 51s],		train_loss: 2.3971
4:	[0s / 2s],		train_loss: 2.5924
14:	[0s / 7s],		train_loss: 2.5384
82:	[1s / 1m:36s],		train_loss: 2.3708
5:	[0s / 2s],		train_loss: 2.5805
15:	[0s / 7s],		train_loss: 2.5368
76:	[0s / 51s],		train_loss: 2.3945
6:	[0s / 3s],		train_loss: 2.5792
16:	[0s / 7s],		train_loss: 2.5160
77:	[0s / 52s],		train_loss: 2.3978
7:	[0s / 3s],		train_loss: 2.5898
17:	[0s / 8s],		train_loss: 2.5077
83:	[1s / 1m:37s],		train_loss: 2.3434
8:	[0s / 3s],		train_loss: 2.5837
18:	[0s / 8s],		train_loss: 2.5044
78:	[0s / 53s],		train_loss: 2.3854
9:	[0s / 4s],		train_loss: 2.5656
19:	[0s / 9s],		train_loss: 2.5056
79:	[0s / 53s],		train_loss: 2.3960
10:	[0s / 4s],		train_loss: 2.5661
84:	[1s / 1m:39s],		train_loss: 2.3478
20:	[0s / 9s],		train_loss: 2.5031
11:	[0s / 5s],		train_loss: 2.5526
21:	[0s / 10s],		train_loss: 2.5072
80:	[0s / 54s],		train_loss: 2.3954
12:	[0s / 5s],		train_loss: 2.5279
22:	[0s / 10s],		train_loss: 2.4979
13:	[0s / 6s],		train_loss: 2.5445
81:	[0s / 55s],		train_loss: 2.3870
85:	[1s / 1m:40s],		train_loss: 2.3541
23:	[0s / 11s],		train_loss: 2.4944
14:	[0s / 6s],		train_loss: 2.5518
24:	[0s / 11s],		train_loss: 2.4872
82:	[0s / 56s],		train_loss: 2.3918
15:	[0s / 6s],		train_loss: 2.5405
25:	[0s / 11s],		train_loss: 2.5020
86:	[1s / 1m:41s],		train_loss: 2.3501
16:	[0s / 7s],		train_loss: 2.5553
83:	[0s / 56s],		train_loss: 2.3818
26:	[0s / 12s],		train_loss: 2.4852
17:	[0s / 7s],		train_loss: 2.5473
27:	[0s / 12s],		train_loss: 2.4773
18:	[0s / 8s],		train_loss: 2.5768
84:	[0s / 57s],		train_loss: 2.3826
87:	[1s / 1m:42s],		train_loss: 2.3321
28:	[0s / 13s],		train_loss: 2.5004
19:	[0s / 8s],		train_loss: 2.5471
29:	[0s / 13s],		train_loss: 2.4661
85:	[0s / 58s],		train_loss: 2.3774
20:	[0s / 9s],		train_loss: 2.5702
30:	[0s / 14s],		train_loss: 2.4776
21:	[0s / 9s],		train_loss: 2.5564
86:	[0s / 58s],		train_loss: 2.3931
88:	[1s / 1m:44s],		train_loss: 2.3487
31:	[0s / 14s],		train_loss: 2.4820
22:	[0s / 10s],		train_loss: 2.5509
32:	[0s / 15s],		train_loss: 2.4752
87:	[0s / 59s],		train_loss: 2.3991
23:	[0s / 10s],		train_loss: 2.5540
33:	[0s / 15s],		train_loss: 2.4729
24:	[0s / 10s],		train_loss: 2.5490
89:	[1s / 1m:45s],		train_loss: 2.3374
88:	[0s / 1m:0s],		train_loss: 2.3808
34:	[0s / 16s],		train_loss: 2.4851
25:	[0s / 11s],		train_loss: 2.5463
35:	[0s / 16s],		train_loss: 2.4728
89:	[0s / 1m:0s],		train_loss: 2.3774
26:	[0s / 11s],		train_loss: 2.5265
36:	[0s / 16s],		train_loss: 2.4534
27:	[0s / 12s],		train_loss: 2.5388
90:	[1s / 1m:46s],		train_loss: 2.3635
90:	[0s / 1m:1s],		train_loss: 2.3676
28:	[0s / 12s],		train_loss: 2.5804
37:	[0s / 17s],		train_loss: 2.4662
29:	[0s / 13s],		train_loss: 2.5429
38:	[0s / 17s],		train_loss: 2.4483
91:	[0s / 1m:2s],		train_loss: 2.3739
91:	[1s / 1m:47s],		train_loss: 2.3493
30:	[0s / 13s],		train_loss: 2.5442
39:	[0s / 18s],		train_loss: 2.4579
92:	[0s / 1m:3s],		train_loss: 2.3838
31:	[0s / 13s],		train_loss: 2.5511
40:	[0s / 18s],		train_loss: 2.4585
32:	[0s / 14s],		train_loss: 2.5553
41:	[0s / 19s],		train_loss: 2.4627
93:	[0s / 1m:3s],		train_loss: 2.3691
92:	[1s / 1m:48s],		train_loss: 2.3500
33:	[0s / 14s],		train_loss: 2.5287
42:	[0s / 19s],		train_loss: 2.4588
34:	[0s / 15s],		train_loss: 2.5493
43:	[0s / 20s],		train_loss: 2.4452
94:	[0s / 1m:4s],		train_loss: 2.3649
35:	[0s / 15s],		train_loss: 2.5498
44:	[0s / 20s],		train_loss: 2.4517
93:	[1s / 1m:50s],		train_loss: 2.3478
95:	[0s / 1m:5s],		train_loss: 2.3781
36:	[0s / 16s],		train_loss: 2.5657
45:	[0s / 21s],		train_loss: 2.4589
37:	[0s / 16s],		train_loss: 2.5524
46:	[0s / 21s],		train_loss: 2.4526
96:	[0s / 1m:5s],		train_loss: 2.3755
38:	[0s / 17s],		train_loss: 2.5413
47:	[0s / 21s],		train_loss: 2.4456
94:	[1s / 1m:51s],		train_loss: 2.3431
39:	[0s / 17s],		train_loss: 2.5702
97:	[0s / 1m:6s],		train_loss: 2.3661
48:	[0s / 22s],		train_loss: 2.4280
40:	[0s / 17s],		train_loss: 2.5601
49:	[0s / 22s],		train_loss: 2.4443
98:	[0s / 1m:7s],		train_loss: 2.3799
41:	[0s / 18s],		train_loss: 2.5492
95:	[1s / 1m:52s],		train_loss: 2.3455
50:	[0s / 23s],		train_loss: 2.4316
42:	[0s / 18s],		train_loss: 2.5536
99:	[0s / 1m:8s],		train_loss: 2.3690
51:	[0s / 23s],		train_loss: 2.4194
43:	[0s / 19s],		train_loss: 2.5439
52:	[0s / 24s],		train_loss: 2.4317
44:	[0s / 19s],		train_loss: 2.5498
96:	[1s / 1m:54s],		train_loss: 2.3424
0:	[0s / 0s],		train_loss: 2.9576
53:	[0s / 24s],		train_loss: 2.4534
45:	[0s / 20s],		train_loss: 2.5467
54:	[0s / 25s],		train_loss: 2.4390
1:	[0s / 1s],		train_loss: 2.6297
46:	[0s / 20s],		train_loss: 2.5563
55:	[0s / 25s],		train_loss: 2.4314
47:	[0s / 21s],		train_loss: 2.5387
97:	[1s / 1m:55s],		train_loss: 2.3380
2:	[0s / 2s],		train_loss: 2.5793
56:	[0s / 26s],		train_loss: 2.4274
48:	[0s / 21s],		train_loss: 2.5351
57:	[0s / 26s],		train_loss: 2.4277
49:	[0s / 22s],		train_loss: 2.5454
3:	[0s / 2s],		train_loss: 2.5787
58:	[0s / 27s],		train_loss: 2.4298
98:	[1s / 1m:56s],		train_loss: 2.3586
50:	[0s / 22s],		train_loss: 2.5409
4:	[0s / 3s],		train_loss: 2.5437
59:	[0s / 27s],		train_loss: 2.4344
51:	[0s / 22s],		train_loss: 2.5472
60:	[0s / 28s],		train_loss: 2.4151
52:	[0s / 23s],		train_loss: 2.5398
5:	[0s / 4s],		train_loss: 2.5422
99:	[1s / 1m:57s],		train_loss: 2.3343
61:	[0s / 28s],		train_loss: 2.4194
53:	[0s / 23s],		train_loss: 2.5212
6:	[0s / 5s],		train_loss: 2.5549
54:	[0s / 24s],		train_loss: 2.5468
62:	[0s / 29s],		train_loss: 2.4440
55:	[0s / 24s],		train_loss: 2.5580
63:	[0s / 29s],		train_loss: 2.4150
7:	[0s / 5s],		train_loss: 2.5515
0:	[1s / 1s],		train_loss: 2.8128
56:	[0s / 25s],		train_loss: 2.5425
64:	[0s / 29s],		train_loss: 2.4115
57:	[0s / 25s],		train_loss: 2.5391
65:	[0s / 30s],		train_loss: 2.4094
8:	[0s / 6s],		train_loss: 2.5448
58:	[0s / 26s],		train_loss: 2.5313
66:	[0s / 30s],		train_loss: 2.4229
9:	[0s / 7s],		train_loss: 2.5355
1:	[1s / 2s],		train_loss: 2.6474
59:	[0s / 26s],		train_loss: 2.5284
67:	[0s / 31s],		train_loss: 2.4201
60:	[0s / 26s],		train_loss: 2.5770
68:	[0s / 31s],		train_loss: 2.4115
10:	[0s / 7s],		train_loss: 2.5276
61:	[0s / 27s],		train_loss: 2.5418
69:	[0s / 32s],		train_loss: 2.4046
2:	[1s / 3s],		train_loss: 2.6392
11:	[0s / 8s],		train_loss: 2.5378
62:	[0s / 27s],		train_loss: 2.5804
70:	[0s / 32s],		train_loss: 2.4190
63:	[0s / 28s],		train_loss: 2.5598
71:	[0s / 33s],		train_loss: 2.4058
12:	[0s / 9s],		train_loss: 2.5214
64:	[0s / 28s],		train_loss: 2.5561
72:	[0s / 33s],		train_loss: 2.4056
3:	[1s / 5s],		train_loss: 2.6049
65:	[0s / 29s],		train_loss: 2.5579
13:	[0s / 10s],		train_loss: 2.4926
73:	[0s / 33s],		train_loss: 2.4048
66:	[0s / 29s],		train_loss: 2.5512
74:	[0s / 34s],		train_loss: 2.4041
14:	[0s / 10s],		train_loss: 2.5110
67:	[0s / 29s],		train_loss: 2.5381
75:	[0s / 34s],		train_loss: 2.3937
4:	[1s / 6s],		train_loss: 2.5766
68:	[0s / 30s],		train_loss: 2.5302
76:	[0s / 35s],		train_loss: 2.3891
15:	[0s / 11s],		train_loss: 2.5034
69:	[0s / 30s],		train_loss: 2.5335
77:	[0s / 35s],		train_loss: 2.4073
70:	[0s / 31s],		train_loss: 2.5245
16:	[0s / 12s],		train_loss: 2.5033
78:	[0s / 36s],		train_loss: 2.4008
71:	[0s / 31s],		train_loss: 2.5355
5:	[1s / 7s],		train_loss: 2.5540
79:	[0s / 36s],		train_loss: 2.3972
17:	[0s / 12s],		train_loss: 2.4907
72:	[0s / 32s],		train_loss: 2.5455
80:	[0s / 37s],		train_loss: 2.4022
73:	[0s / 32s],		train_loss: 2.5148
18:	[0s / 13s],		train_loss: 2.4875
81:	[0s / 37s],		train_loss: 2.3912
74:	[0s / 33s],		train_loss: 2.5243
6:	[1s / 9s],		train_loss: 2.5453
82:	[0s / 38s],		train_loss: 2.3900
19:	[0s / 14s],		train_loss: 2.5079
75:	[0s / 33s],		train_loss: 2.5237
83:	[0s / 38s],		train_loss: 2.3928
76:	[0s / 33s],		train_loss: 2.5210
20:	[0s / 14s],		train_loss: 2.5170
84:	[0s / 38s],		train_loss: 2.3866
77:	[0s / 34s],		train_loss: 2.5171
7:	[1s / 10s],		train_loss: 2.5489
85:	[0s / 39s],		train_loss: 2.3904
78:	[0s / 34s],		train_loss: 2.5150
21:	[0s / 15s],		train_loss: 2.4967
86:	[0s / 39s],		train_loss: 2.3749
79:	[0s / 35s],		train_loss: 2.5370
22:	[0s / 16s],		train_loss: 2.5011
87:	[0s / 40s],		train_loss: 2.3824
80:	[0s / 35s],		train_loss: 2.5175
8:	[1s / 11s],		train_loss: 2.5268
81:	[0s / 36s],		train_loss: 2.5441
88:	[0s / 40s],		train_loss: 2.3835
23:	[0s / 17s],		train_loss: 2.5013
82:	[0s / 36s],		train_loss: 2.5078
89:	[0s / 41s],		train_loss: 2.3757
24:	[0s / 17s],		train_loss: 2.4919
83:	[0s / 36s],		train_loss: 2.5658
90:	[0s / 41s],		train_loss: 2.3911
9:	[1s / 13s],		train_loss: 2.5447
84:	[0s / 37s],		train_loss: 2.5279
91:	[0s / 42s],		train_loss: 2.3892
25:	[0s / 18s],		train_loss: 2.4917
85:	[0s / 37s],		train_loss: 2.5121
92:	[0s / 42s],		train_loss: 2.3779
86:	[0s / 38s],		train_loss: 2.5316
26:	[0s / 19s],		train_loss: 2.4732
93:	[0s / 43s],		train_loss: 2.3809
10:	[1s / 14s],		train_loss: 2.5069
87:	[0s / 38s],		train_loss: 2.5137
94:	[0s / 43s],		train_loss: 2.3681
27:	[0s / 19s],		train_loss: 2.4866
88:	[0s / 39s],		train_loss: 2.5282
95:	[0s / 43s],		train_loss: 2.3867
89:	[0s / 39s],		train_loss: 2.5339
96:	[0s / 44s],		train_loss: 2.3797
28:	[0s / 20s],		train_loss: 2.4843
11:	[1s / 16s],		train_loss: 2.5151
90:	[0s / 39s],		train_loss: 2.5385
97:	[0s / 44s],		train_loss: 2.3672
29:	[0s / 21s],		train_loss: 2.4760
91:	[0s / 40s],		train_loss: 2.5466
98:	[0s / 45s],		train_loss: 2.3692
92:	[0s / 40s],		train_loss: 2.5186
30:	[0s / 21s],		train_loss: 2.4967
99:	[0s / 45s],		train_loss: 2.3702
12:	[1s / 17s],		train_loss: 2.5073
93:	[0s / 41s],		train_loss: 2.5295
0:	[0s / 0s],		train_loss: 2.8902
94:	[0s / 41s],		train_loss: 2.5160
31:	[0s / 22s],		train_loss: 2.4864
95:	[0s / 42s],		train_loss: 2.5353
1:	[0s / 1s],		train_loss: 2.7304
32:	[0s / 23s],		train_loss: 2.4663
13:	[1s / 18s],		train_loss: 2.4965
96:	[0s / 42s],		train_loss: 2.5304
2:	[0s / 1s],		train_loss: 2.6945
97:	[0s / 43s],		train_loss: 2.5314
33:	[0s / 24s],		train_loss: 2.4814
3:	[0s / 2s],		train_loss: 2.6751
98:	[0s / 43s],		train_loss: 2.5085
4:	[0s / 2s],		train_loss: 2.6533
14:	[1s / 20s],		train_loss: 2.4765
99:	[0s / 43s],		train_loss: 2.5395
34:	[0s / 24s],		train_loss: 2.4708
5:	[0s / 3s],		train_loss: 2.6164
0:	[0s / 0s],		train_loss: 3.8685
35:	[0s / 25s],		train_loss: 2.4780
1:	[0s / 0s],		train_loss: 2.8647
6:	[0s / 3s],		train_loss: 2.6280
15:	[1s / 21s],		train_loss: 2.4937
2:	[0s / 1s],		train_loss: 2.7552
36:	[0s / 26s],		train_loss: 2.4754
7:	[0s / 4s],		train_loss: 2.5883
3:	[0s / 1s],		train_loss: 2.6931
8:	[0s / 4s],		train_loss: 2.5629
4:	[0s / 2s],		train_loss: 2.6553
37:	[0s / 27s],		train_loss: 2.4761
16:	[1s / 22s],		train_loss: 2.5016
9:	[0s / 5s],		train_loss: 2.5653
5:	[0s / 2s],		train_loss: 2.6175
38:	[0s / 27s],		train_loss: 2.4714
6:	[0s / 2s],		train_loss: 2.6205
10:	[0s / 5s],		train_loss: 2.5453
7:	[0s / 3s],		train_loss: 2.6005
11:	[0s / 6s],		train_loss: 2.5545
39:	[0s / 28s],		train_loss: 2.4619
17:	[1s / 24s],		train_loss: 2.4898
8:	[0s / 3s],		train_loss: 2.5722
12:	[0s / 7s],		train_loss: 2.5239
9:	[0s / 4s],		train_loss: 2.5747
40:	[0s / 29s],		train_loss: 2.4675
13:	[0s / 7s],		train_loss: 2.5276
10:	[0s / 4s],		train_loss: 2.5620
41:	[0s / 30s],		train_loss: 2.4594
18:	[1s / 25s],		train_loss: 2.4942
11:	[0s / 5s],		train_loss: 2.5556
14:	[0s / 8s],		train_loss: 2.5226
12:	[0s / 5s],		train_loss: 2.5513
15:	[0s / 8s],		train_loss: 2.5158
42:	[0s / 30s],		train_loss: 2.4700
13:	[0s / 5s],		train_loss: 2.5344
16:	[0s / 9s],		train_loss: 2.5098
19:	[1s / 26s],		train_loss: 2.4794
14:	[0s / 6s],		train_loss: 2.5334
43:	[0s / 31s],		train_loss: 2.4620
17:	[0s / 9s],		train_loss: 2.5028
15:	[0s / 6s],		train_loss: 2.5071
16:	[0s / 7s],		train_loss: 2.5204
18:	[0s / 10s],		train_loss: 2.4967
44:	[0s / 32s],		train_loss: 2.4587
17:	[0s / 7s],		train_loss: 2.5154
20:	[1s / 28s],		train_loss: 2