[I 2026-06-07 08:26:09,973] Trial 60 finished with value: 0.763566952717763 and parameters: {'num_nodes': [64, 32], 'dropout': 0.08600456400193872, 'learning_rate': 0.0015684609342750786, 'batch_norm': False}. Best is trial 56 with value: 0.8080908770070512.
/scratch.hpc/luca.cotugno/Foundation_model_clinical_data/test_tabular_model_tmp.py:476: UserWarning: Choices for a categorical distribution should be a tuple of None, bool, int, float and str for persistent storage but contains [32] which is of type list.
  num_nodes  = trial.suggest_categorical("num_nodes", [[32], [64], [128], [64, 32], [128, 64]])
/scratch.hpc/luca.cotugno/Foundation_model_clinical_data/test_tabular_model_tmp.py:476: UserWarning: Choices for a categorical distribution should be a tuple of None, bool, int, float and str for persistent storage but contains [64] which is of type list.
  num_nodes  = trial.suggest_categorical("num_nodes", [[32], [64], [128], [64, 32], [128, 64]])
/scratch.hpc/luca.cotugno/Foundation_model_clinical_data/test_tabular_model_tmp.py:476: UserWarning: Choices for a categorical distribution should be a tuple of None, bool, int, float and str for persistent storage but contains [128] which is of type list.
  num_nodes  = trial.suggest_categorical("num_nodes", [[32], [64], [128], [64, 32], [128, 64]])
/scratch.hpc/luca.cotugno/Foundation_model_clinical_data/test_tabular_model_tmp.py:476: UserWarning: Choices for a categorical distribution should be a tuple of None, bool, int, float and str for persistent storage but contains [64, 32] which is of type list.
  num_nodes  = trial.suggest_categorical("num_nodes", [[32], [64], [128], [64, 32], [128, 64]])
/scratch.hpc/luca.cotugno/Foundation_model_clinical_data/test_tabular_model_tmp.py:476: UserWarning: Choices for a categorical distribution should be a tuple of None, bool, int, float and str for persistent storage but contains [128, 64] which is of type list.
  num_nodes  = trial.suggest_categorical("num_nodes", [[32], [64], [128], [64, 32], [128, 64]])

94:	[0s / 48s],		train_loss: 2.4106
81:	[0s / 34s],		train_loss: 2.4255
17:	[0s / 6s],		train_loss: 2.4845
20:	[1s / 21s],		train_loss: 2.5441
95:	[0s / 48s],		train_loss: 2.4225
82:	[0s / 35s],		train_loss: 2.4412
18:	[0s / 7s],		train_loss: 2.4956
83:	[0s / 35s],		train_loss: 2.4007
96:	[0s / 49s],		train_loss: 2.4019
19:	[0s / 7s],		train_loss: 2.4981
21:	[1s / 22s],		train_loss: 2.5232
84:	[0s / 35s],		train_loss: 2.4056
20:	[0s / 8s],		train_loss: 2.4835
97:	[0s / 49s],		train_loss: 2.4128
85:	[0s / 36s],		train_loss: 2.4026
21:	[0s / 8s],		train_loss: 2.5066
98:	[0s / 50s],		train_loss: 2.4088
86:	[0s / 36s],		train_loss: 2.4164
22:	[0s / 8s],		train_loss: 2.4924
22:	[0s / 23s],		train_loss: 2.5204
99:	[0s / 50s],		train_loss: 2.4062
87:	[0s / 37s],		train_loss: 2.4157
23:	[0s / 9s],		train_loss: 2.4840
88:	[0s / 37s],		train_loss: 2.4051
24:	[0s / 9s],		train_loss: 2.4900
23:	[0s / 24s],		train_loss: 2.5384
0:	[0s / 0s],		train_loss: 3.1500
89:	[0s / 38s],		train_loss: 2.4128
25:	[0s / 10s],		train_loss: 2.4837
1:	[0s / 1s],		train_loss: 2.7610
90:	[0s / 38s],		train_loss: 2.4098
26:	[0s / 10s],		train_loss: 2.4894
24:	[0s / 25s],		train_loss: 2.5343
27:	[0s / 10s],		train_loss: 2.4797
91:	[0s / 38s],		train_loss: 2.4090
2:	[0s / 1s],		train_loss: 2.7494
28:	[0s / 11s],		train_loss: 2.4813
92:	[0s / 39s],		train_loss: 2.4282
3:	[0s / 2s],		train_loss: 2.7140
29:	[0s / 11s],		train_loss: 2.4839
93:	[0s / 39s],		train_loss: 2.4171
25:	[1s / 26s],		train_loss: 2.5266
30:	[0s / 12s],		train_loss: 2.4643
94:	[0s / 40s],		train_loss: 2.4186
4:	[0s / 2s],		train_loss: 2.7021
31:	[0s / 12s],		train_loss: 2.4802
95:	[0s / 40s],		train_loss: 2.4044
5:	[0s / 3s],		train_loss: 2.6701
32:	[0s / 12s],		train_loss: 2.4853
26:	[0s / 27s],		train_loss: 2.5155
96:	[0s / 40s],		train_loss: 2.4130
33:	[0s / 13s],		train_loss: 2.4794
97:	[0s / 41s],		train_loss: 2.4050
6:	[0s / 4s],		train_loss: 2.6707
34:	[0s / 13s],		train_loss: 2.4738
98:	[0s / 41s],		train_loss: 2.4185
27:	[0s / 28s],		train_loss: 2.5203
7:	[0s / 4s],		train_loss: 2.6707
35:	[0s / 14s],		train_loss: 2.4705
99:	[0s / 42s],		train_loss: 2.4008
36:	[0s / 14s],		train_loss: 2.4753
8:	[0s / 5s],		train_loss: 2.6511
0:	[0s / 0s],		train_loss: 3.8709
28:	[1s / 29s],		train_loss: 2.5314
37:	[0s / 14s],		train_loss: 2.4874
9:	[0s / 5s],		train_loss: 2.6501
1:	[0s / 0s],		train_loss: 2.9482
38:	[0s / 15s],		train_loss: 2.4698
2:	[0s / 1s],		train_loss: 2.8779
39:	[0s / 15s],		train_loss: 2.4541
10:	[0s / 6s],		train_loss: 2.6379
29:	[1s / 30s],		train_loss: 2.4977
40:	[0s / 16s],		train_loss: 2.4681
3:	[0s / 1s],		train_loss: 2.8660
41:	[0s / 16s],		train_loss: 2.4682
11:	[0s / 7s],		train_loss: 2.6389
4:	[0s / 2s],		train_loss: 2.8147
42:	[0s / 16s],		train_loss: 2.4711
5:	[0s / 2s],		train_loss: 2.8245
30:	[1s / 31s],		train_loss: 2.5114
12:	[0s / 7s],		train_loss: 2.6431
43:	[0s / 17s],		train_loss: 2.4598
6:	[0s / 3s],		train_loss: 2.7777
44:	[0s / 17s],		train_loss: 2.4675
13:	[0s / 8s],		train_loss: 2.6123
7:	[0s / 3s],		train_loss: 2.7830
31:	[1s / 32s],		train_loss: 2.5154
45:	[0s / 18s],		train_loss: 2.4492
8:	[0s / 3s],		train_loss: 2.7753
14:	[0s / 8s],		train_loss: 2.6148
46:	[0s / 18s],		train_loss: 2.4689
9:	[0s / 4s],		train_loss: 2.7560
47:	[0s / 18s],		train_loss: 2.4525
15:	[0s / 9s],		train_loss: 2.6075
32:	[1s / 33s],		train_loss: 2.5212
48:	[0s / 19s],		train_loss: 2.4682
10:	[0s / 4s],		train_loss: 2.7663
16:	[0s / 10s],		train_loss: 2.6153
49:	[0s / 19s],		train_loss: 2.4625
11:	[0s / 5s],		train_loss: 2.7296
50:	[0s / 19s],		train_loss: 2.4484
12:	[0s / 5s],		train_loss: 2.7557
17:	[0s / 10s],		train_loss: 2.6007
33:	[1s / 34s],		train_loss: 2.4892
51:	[0s / 20s],		train_loss: 2.4766
13:	[0s / 6s],		train_loss: 2.7212
52:	[0s / 20s],		train_loss: 2.4444
18:	[0s / 11s],		train_loss: 2.5935
14:	[0s / 6s],		train_loss: 2.7239
53:	[0s / 21s],		train_loss: 2.4527
34:	[1s / 35s],		train_loss: 2.5006
19:	[0s / 11s],		train_loss: 2.6051
15:	[0s / 6s],		train_loss: 2.7038
54:	[0s / 21s],		train_loss: 2.4498
16:	[0s / 7s],		train_loss: 2.7280
55:	[0s / 21s],		train_loss: 2.4870
20:	[0s / 12s],		train_loss: 2.5979
35:	[1s / 37s],		train_loss: 2.4984
17:	[0s / 7s],		train_loss: 2.7183
56:	[0s / 22s],		train_loss: 2.4589
21:	[0s / 13s],		train_loss: 2.5739
57:	[0s / 22s],		train_loss: 2.4624
18:	[0s / 8s],		train_loss: 2.6753
58:	[0s / 22s],		train_loss: 2.4632
22:	[0s / 13s],		train_loss: 2.5604
19:	[0s / 8s],		train_loss: 2.7010
36:	[1s / 38s],		train_loss: 2.5045
59:	[0s / 23s],		train_loss: 2.4583
20:	[0s / 9s],		train_loss: 2.6865
23:	[0s / 14s],		train_loss: 2.5723
60:	[0s / 23s],		train_loss: 2.4589
21:	[0s / 9s],		train_loss: 2.6929
61:	[0s / 24s],		train_loss: 2.4553
37:	[0s / 38s],		train_loss: 2.5004
24:	[0s / 14s],		train_loss: 2.5677
22:	[0s / 9s],		train_loss: 2.6754
62:	[0s / 24s],		train_loss: 2.4521
23:	[0s / 10s],		train_loss: 2.6777
25:	[0s / 15s],		train_loss: 2.5667
63:	[0s / 24s],		train_loss: 2.4614
38:	[1s / 40s],		train_loss: 2.4915
24:	[0s / 10s],		train_loss: 2.6883
64:	[0s / 25s],		train_loss: 2.4420
26:	[0s / 16s],		train_loss: 2.5620
65:	[0s / 25s],		train_loss: 2.4610
25:	[0s / 11s],		train_loss: 2.6809
66:	[0s / 26s],		train_loss: 2.4714
27:	[0s / 16s],		train_loss: 2.5733
26:	[0s / 11s],		train_loss: 2.6916
39:	[0s / 41s],		train_loss: 2.4755
67:	[0s / 26s],		train_loss: 2.4511
27:	[0s / 12s],		train_loss: 2.6858
28:	[0s / 17s],		train_loss: 2.5467
68:	[0s / 26s],		train_loss: 2.4483
28:	[0s / 12s],		train_loss: 2.6625
69:	[0s / 27s],		train_loss: 2.4528
40:	[0s / 42s],		train_loss: 2.4886
29:	[0s / 18s],		train_loss: 2.5360
29:	[0s / 13s],		train_loss: 2.6719
70:	[0s / 27s],		train_loss: 2.4575
30:	[0s / 18s],		train_loss: 2.5515
71:	[0s / 28s],		train_loss: 2.4476
30:	[0s / 13s],		train_loss: 2.6892
41:	[1s / 43s],		train_loss: 2.4800
72:	[0s / 28s],		train_loss: 2.4463
31:	[0s / 14s],		train_loss: 2.6445
31:	[0s / 19s],		train_loss: 2.5544
73:	[0s / 28s],		train_loss: 2.4424
32:	[0s / 14s],		train_loss: 2.6716
32:	[0s / 19s],		train_loss: 2.5387
74:	[0s / 29s],		train_loss: 2.4323
42:	[1s / 44s],		train_loss: 2.4733
33:	[0s / 14s],		train_loss: 2.6416
75:	[0s / 29s],		train_loss: 2.4520
33:	[0s / 20s],		train_loss: 2.5317
34:	[0s / 15s],		train_loss: 2.6874
76:	[0s / 30s],		train_loss: 2.4384
35:	[0s / 15s],		train_loss: 2.6657
77:	[0s / 30s],		train_loss: 2.4692
34:	[0s / 21s],		train_loss: 2.5435
43:	[1s / 45s],		train_loss: 2.4911
36:	[0s / 16s],		train_loss: 2.6267
78:	[0s / 30s],		train_loss: 2.4493
35:	[0s / 21s],		train_loss: 2.5243
79:	[0s / 31s],		train_loss: 2.4433
37:	[0s / 16s],		train_loss: 2.6331
44:	[1s / 46s],		train_loss: 2.4917
80:	[0s / 31s],		train_loss: 2.4514
38:	[0s / 17s],		train_loss: 2.6374
36:	[0s / 22s],		train_loss: 2.5088
81:	[0s / 31s],		train_loss: 2.4365
39:	[0s / 17s],		train_loss: 2.6130
37:	[0s / 22s],		train_loss: 2.5187
82:	[0s / 32s],		train_loss: 2.4612
45:	[1s / 47s],		train_loss: 2.4905
40:	[0s / 18s],		train_loss: 2.6320
83:	[0s / 32s],		train_loss: 2.4527
38:	[0s / 23s],		train_loss: 2.5268
41:	[0s / 18s],		train_loss: 2.6452
84:	[0s / 33s],		train_loss: 2.4566
42:	[0s / 18s],		train_loss: 2.6277
85:	[0s / 33s],		train_loss: 2.4385
46:	[1s / 48s],		train_loss: 2.4929
39:	[0s / 24s],		train_loss: 2.5077
43:	[0s / 19s],		train_loss: 2.6112
86:	[0s / 33s],		train_loss: 2.4450
40:	[0s / 24s],		train_loss: 2.5145
87:	[0s / 34s],		train_loss: 2.4411
44:	[0s / 19s],		train_loss: 2.5924
47:	[1s / 49s],		train_loss: 2.4683
88:	[0s / 34s],		train_loss: 2.4414
45:	[0s / 20s],		train_loss: 2.6297
41:	[0s / 25s],		train_loss: 2.5233
89:	[0s / 34s],		train_loss: 2.4442
46:	[0s / 20s],		train_loss: 2.6215
42:	[0s / 26s],		train_loss: 2.4901
90:	[0s / 35s],		train_loss: 2.4450
48:	[0s / 50s],		train_loss: 2.4765
47:	[0s / 21s],		train_loss: 2.6172
91:	[0s / 35s],		train_loss: 2.4322
43:	[0s / 26s],		train_loss: 2.5056
48:	[0s / 21s],		train_loss: 2.6044
92:	[0s / 36s],		train_loss: 2.4428
49:	[0s / 22s],		train_loss: 2.6018
49:	[1s / 51s],		train_loss: 2.4813
93:	[0s / 36s],		train_loss: 2.4430
44:	[0s / 27s],		train_loss: 2.4858
50:	[0s / 22s],		train_loss: 2.6072
94:	[0s / 36s],		train_loss: 2.4292
45:	[0s / 27s],		train_loss: 2.5154
51:	[0s / 22s],		train_loss: 2.5744
95:	[0s / 37s],		train_loss: 2.4308
50:	[1s / 52s],		train_loss: 2.4676
96:	[0s / 37s],		train_loss: 2.4450
52:	[0s / 23s],		train_loss: 2.5763
46:	[0s / 28s],		train_loss: 2.4979
97:	[0s / 38s],		train_loss: 2.4288
53:	[0s / 23s],		train_loss: 2.5944
47:	[0s / 29s],		train_loss: 2.4877
98:	[0s / 38s],		train_loss: 2.4477
51:	[0s / 53s],		train_loss: 2.4737
54:	[0s / 24s],		train_loss: 2.5853
99:	[0s / 38s],		train_loss: 2.4332
48:	[0s / 29s],		train_loss: 2.4926
55:	[0s / 24s],		train_loss: 2.5736
0:	[0s / 0s],		train_loss: 3.0337
56:	[0s / 25s],		train_loss: 2.5734
49:	[0s / 30s],		train_loss: 2.4987
52:	[1s / 54s],		train_loss: 2.4594
1:	[0s / 0s],		train_loss: 2.8361
57:	[0s / 25s],		train_loss: 2.5752
50:	[0s / 30s],		train_loss: 2.4990
2:	[0s / 1s],		train_loss: 2.8122
58:	[0s / 25s],		train_loss: 2.5804
3:	[0s / 1s],		train_loss: 2.7817
53:	[1s / 55s],		train_loss: 2.4645
51:	[0s / 31s],		train_loss: 2.4917
59:	[0s / 26s],		train_loss: 2.5753
4:	[0s / 2s],		train_loss: 2.7587
60:	[0s / 26s],		train_loss: 2.5616
52:	[0s / 31s],		train_loss: 2.4824
5:	[0s / 2s],		train_loss: 2.7567
61:	[0s / 27s],		train_loss: 2.5865
54:	[1s / 56s],		train_loss: 2.4697
6:	[0s / 2s],		train_loss: 2.7115
53:	[0s / 32s],		train_loss: 2.4786
62:	[0s / 27s],		train_loss: 2.5767
7:	[0s / 3s],		train_loss: 2.6754
54:	[0s / 33s],		train_loss: 2.4809
63:	[0s / 28s],		train_loss: 2.5648
8:	[0s / 3s],		train_loss: 2.6717
55:	[1s / 57s],		train_loss: 2.4650
64:	[0s / 28s],		train_loss: 2.5613
55:	[0s / 33s],		train_loss: 2.4804
9:	[0s / 4s],		train_loss: 2.6804
65:	[0s / 28s],		train_loss: 2.5628
10:	[0s / 4s],		train_loss: 2.6347
56:	[0s / 34s],		train_loss: 2.4766
66:	[0s / 29s],		train_loss: 2.5483
11:	[0s / 4s],		train_loss: 2.6210
56:	[1s / 58s],		train_loss: 2.4406
57:	[0s / 34s],		train_loss: 2.4806
67:	[0s / 29s],		train_loss: 2.5445
12:	[0s / 5s],		train_loss: 2.5926
68:	[0s / 30s],		train_loss: 2.5474
58:	[0s / 35s],		train_loss: 2.4814
13:	[0s / 5s],		train_loss: 2.6056
57:	[1s / 59s],		train_loss: 2.4513
69:	[0s / 30s],		train_loss: 2.5630
14:	[0s / 6s],		train_loss: 2.5947
59:	[0s / 35s],		train_loss: 2.4696
70:	[0s / 31s],		train_loss: 2.5365
15:	[0s / 6s],		train_loss: 2.5934
60:	[0s / 36s],		train_loss: 2.4666
71:	[0s / 31s],		train_loss: 2.5501
16:	[0s / 7s],		train_loss: 2.5453
58:	[1s / 1m:0s],		train_loss: 2.4604
72:	[0s / 31s],		train_loss: 2.5596
61:	[0s / 37s],		train_loss: 2.4736
17:	[0s / 7s],		train_loss: 2.5447
73:	[0s / 32s],		train_loss: 2.5385
18:	[0s / 7s],		train_loss: 2.5323
62:	[0s / 37s],		train_loss: 2.4677
59:	[1s / 1m:2s],		train_loss: 2.4728
19:	[0s / 8s],		train_loss: 2.5274
74:	[0s / 32s],		train_loss: 2.5276
63:	[0s / 38s],		train_loss: 2.4664
20:	[0s / 8s],		train_loss: 2.5329
75:	[0s / 33s],		train_loss: 2.5447
21:	[0s / 9s],		train_loss: 2.5103
76:	[0s / 33s],		train_loss: 2.5327
64:	[0s / 38s],		train_loss: 2.4664
60:	[1s / 1m:3s],		train_loss: 2.4533
22:	[0s / 9s],		train_loss: 2.5063
77:	[0s / 34s],		train_loss: 2.5287
65:	[0s / 39s],		train_loss: 2.4696
23:	[0s / 9s],		train_loss: 2.5145
78:	[0s / 34s],		train_loss: 2.5207
66:	[0s / 39s],		train_loss: 2.4748
24:	[0s / 10s],		train_loss: 2.5101
61:	[1s / 1m:4s],		train_loss: 2.4414
79:	[0s / 35s],		train_loss: 2.5202
25:	[0s / 10s],		train_loss: 2.5126
80:	[0s / 35s],		train_loss: 2.5369
67:	[0s / 40s],		train_loss: 2.4748
26:	[0s / 11s],		train_loss: 2.5085
81:	[0s / 35s],		train_loss: 2.5169
68:	[0s / 41s],		train_loss: 2.4581
62:	[1s / 1m:5s],		train_loss: 2.4672
27:	[0s / 11s],		train_loss: 2.4973
82:	[0s / 36s],		train_loss: 2.5036
69:	[0s / 41s],		train_loss: 2.4641
28:	[0s / 11s],		train_loss: 2.4895
83:	[0s / 36s],		train_loss: 2.5216
29:	[0s / 12s],		train_loss: 2.5051
84:	[0s / 37s],		train_loss: 2.5257
70:	[0s / 42s],		train_loss: 2.4702
63:	[1s / 1m:6s],		train_loss: 2.4479
30:	[0s / 12s],		train_loss: 2.5088
85:	[0s / 37s],		train_loss: 2.5305
71:	[0s / 42s],		train_loss: 2.4495
31:	[0s / 13s],		train_loss: 2.5133
86:	[0s / 37s],		train_loss: 2.5223
32:	[0s / 13s],		train_loss: 2.4975
64:	[1s / 1m:7s],		train_loss: 2.4314
72:	[0s / 43s],		train_loss: 2.4682
87:	[0s / 38s],		train_loss: 2.4985
33:	[0s / 13s],		train_loss: 2.5040
88:	[0s / 38s],		train_loss: 2.5124
73:	[0s / 43s],		train_loss: 2.4452
34:	[0s / 14s],		train_loss: 2.4867
89:	[0s / 39s],		train_loss: 2.4952
65:	[1s / 1m:8s],		train_loss: 2.4475
35:	[0s / 15s],		train_loss: 2.4973
74:	[0s / 44s],		train_loss: 2.4507
90:	[0s / 39s],		train_loss: 2.4973
36:	[0s / 15s],		train_loss: 2.4899
75:	[0s / 45s],		train_loss: 2.4552
91:	[0s / 40s],		train_loss: 2.5055
37:	[0s / 15s],		train_loss: 2.4902
66:	[1s / 1m:9s],		train_loss: 2.4590
92:	[0s / 40s],		train_loss: 2.4992
38:	[0s / 16s],		train_loss: 2.5119
76:	[0s / 45s],		train_loss: 2.4519
93:	[0s / 41s],		train_loss: 2.4948
39:	[0s / 16s],		train_loss: 2.4941
77:	[0s / 46s],		train_loss: 2.4574
67:	[1s / 1m:10s],		train_loss: 2.4554
40:	[0s / 17s],		train_loss: 2.4921
94:	[0s / 41s],		train_loss: 2.5148
78:	[0s / 47s],		train_loss: 2.4714
41:	[0s / 17s],		train_loss: 2.4938
95:	[0s / 42s],		train_loss: 2.4812
42:	[0s / 17s],		train_loss: 2.4808
96:	[0s / 42s],		train_loss: 2.4984
79:	[0s / 47s],		train_loss: 2.4519
68:	[1s / 1m:11s],		train_loss: 2.4447
43:	[0s / 18s],		train_loss: 2.4798
97:	[0s / 42s],		train_loss: 2.4981
80:	[0s / 48s],		train_loss: 2.4346
44:	[0s / 18s],		train_loss: 2.4879
98:	[0s / 43s],		train_loss: 2.4906
45:	[0s / 19s],		train_loss: 2.4935
69:	[1s / 1m:13s],		train_loss: 2.4472
99:	[0s / 43s],		train_loss: 2.4857
81:	[0s / 48s],		train_loss: 2.4704
46:	[0s / 19s],		train_loss: 2.4802
0:	[0s / 0s],		train_loss: 2.8049
82:	[0s / 49s],		train_loss: 2.4671
47:	[0s / 20s],		train_loss: 2.4893
70:	[1s / 1m:14s],		train_loss: 2.4494
1:	[0s / 0s],		train_loss: 2.6703
48:	[0s / 20s],		train_loss: 2.4716
83:	[0s / 50s],		train_loss: 2.4507
2:	[0s / 1s],		train_loss: 2.6367
49:	[0s / 20s],		train_loss: 2.4855
84:	[0s / 50s],		train_loss: 2.4465
3:	[0s / 1s],		train_loss: 2.6403
50:	[0s / 21s],		train_loss: 2.4666
71:	[1s / 1m:15s],		train_loss: 2.4383
4:	[0s / 2s],		train_loss: 2.5875
51:	[0s / 21s],		train_loss: 2.4823
85:	[0s / 51s],		train_loss: 2.4530
5:	[0s / 2s],		train_loss: 2.5947
52:	[0s / 22s],		train_loss: 2.4765
86:	[0s / 51s],		train_loss: 2.4580
6:	[0s / 2s],		train_loss: 2.5849
53:	[0s / 22s],		train_loss: 2.4695
72:	[1s / 1m:16s],		train_loss: 2.4267
87:	[0s / 52s],		train_loss: 2.4481
7:	[0s / 3s],		train_loss: 2.5860
54:	[0s / 22s],		train_loss: 2.4777
8:	[0s / 3s],		train_loss: 2.5647
55:	[0s / 23s],		train_loss: 2.4836
88:	[0s / 52s],		train_loss: 2.4505
9:	[0s / 4s],		train_loss: 2.5737
56:	[0s / 23s],		train_loss: 2.4799
73:	[1s / 1m:17s],		train_loss: 2.4411
89:	[0s / 53s],		train_loss: 2.4269
10:	[0s / 4s],		train_loss: 2.5596
57:	[0s / 24s],		train_loss: 2.4786
11:	[0s / 5s],		train_loss: 2.5372
90:	[0s / 54s],		train_loss: 2.4402
58:	[0s / 24s],		train_loss: 2.4826
74:	[1s / 1m:18s],		train_loss: 2.4314
59:	[0s / 24s],		train_loss: 2.4839
12:	[0s / 5s],		train_loss: 2.5346
91:	[0s / 54s],		train_loss: 2.4348
60:	[0s / 25s],		train_loss: 2.4790
13:	[0s / 5s],		train_loss: 2.5123
92:	[0s / 55s],		train_loss: 2.4360
61:	[0s / 25s],		train_loss: 2.4734
75:	[1s / 1m:19s],		train_loss: 2.4281
14:	[0s / 6s],		train_loss: 2.5192
62:	[0s / 26s],		train_loss: 2.4582
15:	[0s / 6s],		train_loss: 2.5160
93:	[0s / 55s],		train_loss: 2.4338
63:	[0s / 26s],		train_loss: 2.4640
16:	[0s / 7s],		train_loss: 2.5179
94:	[0s / 56s],		train_loss: 2.4453
76:	[1s / 1m:20s],		train_loss: 2.4329
64:	[0s / 26s],		train_loss: 2.4844
17:	[0s / 7s],		train_loss: 2.5034
95:	[0s / 56s],		train_loss: 2.4475
65:	[0s / 27s],		train_loss: 2.4704
18:	[0s / 8s],		train_loss: 2.5174
66:	[0s / 27s],		train_loss: 2.4638
19:	[0s / 8s],		train_loss: 2.4936
96:	[0s / 57s],		train_loss: 2.4352
77:	[1s / 1m:21s],		train_loss: 2.4209
67:	[0s / 28s],		train_loss: 2.4801
20:	[0s / 8s],		train_loss: 2.4988
97:	[0s / 58s],		train_loss: 2.4382
68:	[0s / 28s],		train_loss: 2.4681
21:	[0s / 9s],		train_loss: 2.4991
98:	[0s / 58s],		train_loss: 2.4473
69:	[0s / 29s],		train_loss: 2.4774
78:	[1s / 1m:22s],		train_loss: 2.4426
22:	[0s / 9s],		train_loss: 2.4853
70:	[0s / 29s],		train_loss: 2.4756
99:	[0s / 59s],		train_loss: 2.4384
23:	[0s / 10s],		train_loss: 2.4901
71:	[0s / 29s],		train_loss: 2.4839
24:	[0s / 10s],		train_loss: 2.4992
79:	[1s / 1m:24s],		train_loss: 2.4168
0:	[0s / 0s],		train_loss: 2.8680
72:	[0s / 30s],		train_loss: 2.4719
25:	[0s / 11s],		train_loss: 2.4975
1:	[0s / 0s],		train_loss: 2.6281
73:	[0s / 30s],		train_loss: 2.4622
26:	[0s / 11s],		train_loss: 2.4634
74:	[0s / 31s],		train_loss: 2.4638
80:	[1s / 1m:25s],		train_loss: 2.4372
2:	[0s / 1s],		train_loss: 2.5871
27:	[0s / 12s],		train_loss: 2.4757
75:	[0s / 31s],		train_loss: 2.4688
3:	[0s / 2s],		train_loss: 2.5612
28:	[0s / 12s],		train_loss: 2.4799
76:	[0s / 31s],		train_loss: 2.4664
81:	[1s / 1m:26s],		train_loss: 2.4289
29:	[0s / 12s],		train_loss: 2.4818
4:	[0s / 2s],		train_loss: 2.5722
77:	[0s / 32s],		train_loss: 2.4617
30:	[0s / 13s],		train_loss: 2.4920
78:	[0s / 32s],		train_loss: 2.4585
5:	[0s / 3s],		train_loss: 2.5554
31:	[0s / 13s],		train_loss: 2.4913
82:	[0s / 1m:27s],		train_loss: 2.4126
79:	[0s / 33s],		train_loss: 2.4640
6:	[0s / 3s],		train_loss: 2.5572
32:	[0s / 14s],		train_loss: 2.4597
80:	[0s / 33s],		train_loss: 2.4837
7:	[0s / 4s],		train_loss: 2.5573
81:	[0s / 34s],		train_loss: 2.4538
33:	[0s / 14s],		train_loss: 2.4672
83:	[1s / 1m:28s],		train_loss: 2.4217
8:	[0s / 4s],		train_loss: 2.5577
82:	[0s / 34s],		train_loss: 2.4637
34:	[0s / 15s],		train_loss: 2.4910
83:	[0s / 34s],		train_loss: 2.4695
35:	[0s / 15s],		train_loss: 2.4797
9:	[0s / 5s],		train_loss: 2.5420
84:	[0s / 35s],		train_loss: 2.4706
36:	[0s / 15s],		train_loss: 2.4658
84:	[1s / 1m:29s],		train_loss: 2.4243
10:	[0s / 5s],		train_loss: 2.5374
85:	[0s / 35s],		train_loss: 2.4654
37:	[0s / 16s],		train_loss: 2.4672
11:	[0s / 6s],		train_loss: 2.5498
86:	[0s / 36s],		train_loss: 2.4602
38:	[0s / 16s],		train_loss: 2.4839
12:	[0s / 6s],		train_loss: 2.5412
87:	[0s / 36s],		train_loss: 2.4567
85:	[1s / 1m:30s],		train_loss: 2.4264
39:	[0s / 17s],		train_loss: 2.4906
88:	[0s / 36s],		train_loss: 2.4641
13:	[0s / 7s],		train_loss: 2.5698
40:	[0s / 17s],		train_loss: 2.4692
89:	[0s / 37s],		train_loss: 2.4633
14:	[0s / 7s],		train_loss: 2.5326
86:	[1s / 1m:31s],		train_loss: 2.4189
41:	[0s / 18s],		train_loss: 2.4555
90:	[0s / 37s],		train_loss: 2.4641
42:	[0s / 18s],		train_loss: 2.4750
15:	[0s / 8s],		train_loss: 2.5305
91:	[0s / 38s],		train_loss: 2.4654
43:	[0s / 18s],		train_loss: 2.4647
16:	[0s / 8s],		train_loss: 2.5442
87:	[1s / 1m:32s],		train_loss: 2.4178
92:	[0s / 38s],		train_loss: 2.4634
44:	[0s / 19s],		train_loss: 2.4628
93:	[0s / 39s],		train_loss: 2.4658
17:	[0s / 9s],		train_loss: 2.5221
45:	[0s / 19s],		train_loss: 2.4650
94:	[0s / 39s],		train_loss: 2.4558
18:	[0s / 9s],		train_loss: 2.5112
88:	[1s / 1m:33s],		train_loss: 2.4357
46:	[0s / 20s],		train_loss: 2.4659
95:	[0s / 39s],		train_loss: 2.4659
19:	[0s / 10s],		train_loss: 2.5249
47:	[0s / 20s],		train_loss: 2.4506
96:	[0s / 40s],		train_loss: 2.4607
48:	[0s / 21s],		train_loss: 2.4658
20:	[0s / 10s],		train_loss: 2.5297
97:	[0s / 40s],		train_loss: 2.4560
89:	[1s / 1m:34s],		train_loss: 2.4353
49:	[0s / 21s],		train_loss: 2.4673
98:	[0s / 41s],		train_loss: 2.4617
21:	[0s / 11s],		train_loss: 2.5221
50:	[0s / 22s],		train_loss: 2.4661
99:	[0s / 41s],		train_loss: 2.4763
90:	[1s / 1m:35s],		train_loss: 2.4225
22:	[0s / 11s],		train_loss: 2.5164
51:	[0s / 22s],		train_loss: 2.4554
0:	[0s / 0s],		train_loss: 3.1088
23:	[0s / 12s],		train_loss: 2.5179
1:	[0s / 0s],		train_loss: 2.