[I 2026-06-08 20:59:49,456] Trial 68 finished with value: 0.8028595045968407 and parameters: {'num_nodes': [64, 32], 'dropout': 0.1957321560437571, 'learning_rate': 0.0001342063720275116, 'batch_norm': False}. Best is trial 59 with value: 0.8069842205151002.
/scratch.hpc/luca.cotugno/Foundation_model_clinical_data/test_tabular_model_tmp.py:476: UserWarning: Choices for a categorical distribution should be a tuple of None, bool, int, float and str for persistent storage but contains [32] which is of type list.
  num_nodes  = trial.suggest_categorical("num_nodes", [[32], [64], [128], [64, 32], [128, 64]])
/scratch.hpc/luca.cotugno/Foundation_model_clinical_data/test_tabular_model_tmp.py:476: UserWarning: Choices for a categorical distribution should be a tuple of None, bool, int, float and str for persistent storage but contains [64] which is of type list.
  num_nodes  = trial.suggest_categorical("num_nodes", [[32], [64], [128], [64, 32], [128, 64]])
/scratch.hpc/luca.cotugno/Foundation_model_clinical_data/test_tabular_model_tmp.py:476: UserWarning: Choices for a categorical distribution should be a tuple of None, bool, int, float and str for persistent storage but contains [128] which is of type list.
  num_nodes  = trial.suggest_categorical("num_nodes", [[32], [64], [128], [64, 32], [128, 64]])
/scratch.hpc/luca.cotugno/Foundation_model_clinical_data/test_tabular_model_tmp.py:476: UserWarning: Choices for a categorical distribution should be a tuple of None, bool, int, float and str for persistent storage but contains [64, 32] which is of type list.
  num_nodes  = trial.suggest_categorical("num_nodes", [[32], [64], [128], [64, 32], [128, 64]])
/scratch.hpc/luca.cotugno/Foundation_model_clinical_data/test_tabular_model_tmp.py:476: UserWarning: Choices for a categorical distribution should be a tuple of None, bool, int, float and str for persistent storage but contains [128, 64] which is of type list.
  num_nodes  = trial.suggest_categorical("num_nodes", [[32], [64], [128], [64, 32], [128, 64]])

51:	[1s / 1m:11s],		train_loss: 2.4210
72:	[0s / 41s],		train_loss: 2.4551
51:	[0s / 43s],		train_loss: 2.4194
65:	[0s / 30s],		train_loss: 2.3432
73:	[0s / 41s],		train_loss: 2.4490
66:	[0s / 30s],		train_loss: 2.3471
52:	[0s / 44s],		train_loss: 2.4448
74:	[0s / 42s],		train_loss: 2.4487
67:	[0s / 30s],		train_loss: 2.3419
52:	[1s / 1m:12s],		train_loss: 2.4320
68:	[0s / 31s],		train_loss: 2.3388
75:	[0s / 42s],		train_loss: 2.4409
53:	[0s / 45s],		train_loss: 2.4247
69:	[0s / 31s],		train_loss: 2.3514
76:	[0s / 43s],		train_loss: 2.4312
70:	[0s / 32s],		train_loss: 2.3420
54:	[0s / 46s],		train_loss: 2.4216
77:	[0s / 44s],		train_loss: 2.4309
53:	[1s / 1m:14s],		train_loss: 2.4224
71:	[0s / 32s],		train_loss: 2.3441
78:	[0s / 44s],		train_loss: 2.4388
72:	[0s / 33s],		train_loss: 2.3510
55:	[0s / 47s],		train_loss: 2.4303
73:	[0s / 33s],		train_loss: 2.3406
79:	[0s / 45s],		train_loss: 2.4156
74:	[0s / 34s],		train_loss: 2.3439
56:	[0s / 47s],		train_loss: 2.4223
54:	[1s / 1m:15s],		train_loss: 2.4198
80:	[0s / 45s],		train_loss: 2.4278
75:	[0s / 34s],		train_loss: 2.3358
81:	[0s / 46s],		train_loss: 2.4197
57:	[0s / 48s],		train_loss: 2.4306
76:	[0s / 35s],		train_loss: 2.3263
82:	[0s / 46s],		train_loss: 2.4319
77:	[0s / 35s],		train_loss: 2.3355
55:	[1s / 1m:17s],		train_loss: 2.4179
58:	[0s / 49s],		train_loss: 2.4210
78:	[0s / 35s],		train_loss: 2.3186
83:	[0s / 47s],		train_loss: 2.4215
79:	[0s / 36s],		train_loss: 2.3179
84:	[0s / 48s],		train_loss: 2.4285
59:	[0s / 50s],		train_loss: 2.4252
80:	[0s / 36s],		train_loss: 2.3219
85:	[0s / 48s],		train_loss: 2.4385
56:	[1s / 1m:18s],		train_loss: 2.4193
81:	[0s / 37s],		train_loss: 2.3168
60:	[0s / 51s],		train_loss: 2.4188
86:	[0s / 49s],		train_loss: 2.4320
82:	[0s / 37s],		train_loss: 2.3259
83:	[0s / 38s],		train_loss: 2.3126
87:	[0s / 49s],		train_loss: 2.4135
61:	[0s / 52s],		train_loss: 2.4210
57:	[1s / 1m:19s],		train_loss: 2.4296
84:	[0s / 38s],		train_loss: 2.3162
88:	[0s / 50s],		train_loss: 2.4318
85:	[0s / 39s],		train_loss: 2.3258
62:	[0s / 52s],		train_loss: 2.4105
89:	[0s / 50s],		train_loss: 2.4125
86:	[0s / 39s],		train_loss: 2.3169
87:	[0s / 40s],		train_loss: 2.3067
90:	[0s / 51s],		train_loss: 2.4201
63:	[0s / 53s],		train_loss: 2.4197
58:	[1s / 1m:21s],		train_loss: 2.4326
88:	[0s / 40s],		train_loss: 2.2993
91:	[0s / 52s],		train_loss: 2.4258
64:	[0s / 54s],		train_loss: 2.4241
89:	[0s / 40s],		train_loss: 2.3183
92:	[0s / 52s],		train_loss: 2.4137
90:	[0s / 41s],		train_loss: 2.2985
59:	[1s / 1m:22s],		train_loss: 2.4107
65:	[0s / 55s],		train_loss: 2.4237
93:	[0s / 53s],		train_loss: 2.3883
91:	[0s / 41s],		train_loss: 2.3059
92:	[0s / 42s],		train_loss: 2.3028
94:	[0s / 53s],		train_loss: 2.4077
66:	[0s / 56s],		train_loss: 2.4158
93:	[0s / 42s],		train_loss: 2.3090
95:	[0s / 54s],		train_loss: 2.4142
60:	[1s / 1m:24s],		train_loss: 2.4151
94:	[0s / 43s],		train_loss: 2.3094
96:	[0s / 54s],		train_loss: 2.4031
67:	[0s / 57s],		train_loss: 2.4135
95:	[0s / 43s],		train_loss: 2.2849
97:	[0s / 55s],		train_loss: 2.4154
96:	[0s / 44s],		train_loss: 2.2957
68:	[0s / 57s],		train_loss: 2.4156
61:	[1s / 1m:25s],		train_loss: 2.4092
97:	[0s / 44s],		train_loss: 2.2882
98:	[0s / 56s],		train_loss: 2.3933
98:	[0s / 45s],		train_loss: 2.2829
69:	[0s / 58s],		train_loss: 2.4099
99:	[0s / 56s],		train_loss: 2.4209
99:	[0s / 45s],		train_loss: 2.2934
0:	[0s / 0s],		train_loss: 4.1856
62:	[1s / 1m:27s],		train_loss: 2.4116
70:	[0s / 59s],		train_loss: 2.4105
0:	[0s / 0s],		train_loss: 3.8795
1:	[0s / 1s],		train_loss: 3.0855
1:	[0s / 0s],		train_loss: 3.0318
71:	[0s / 1m:0s],		train_loss: 2.4122
2:	[0s / 1s],		train_loss: 2.8814
2:	[0s / 1s],		train_loss: 2.8421
63:	[1s / 1m:28s],		train_loss: 2.4135
3:	[0s / 2s],		train_loss: 2.8056
3:	[0s / 1s],		train_loss: 2.7288
72:	[0s / 1m:1s],		train_loss: 2.4076
4:	[0s / 2s],		train_loss: 2.7351
4:	[0s / 2s],		train_loss: 2.6983
5:	[0s / 2s],		train_loss: 2.6877
5:	[0s / 2s],		train_loss: 2.6510
73:	[0s / 1m:2s],		train_loss: 2.4063
6:	[0s / 3s],		train_loss: 2.6557
64:	[1s / 1m:30s],		train_loss: 2.4096
6:	[0s / 3s],		train_loss: 2.6230
7:	[0s / 3s],		train_loss: 2.6289
74:	[0s / 1m:3s],		train_loss: 2.4107
7:	[0s / 3s],		train_loss: 2.6230
8:	[0s / 4s],		train_loss: 2.6102
8:	[0s / 4s],		train_loss: 2.5924
75:	[0s / 1m:3s],		train_loss: 2.4114
9:	[0s / 4s],		train_loss: 2.5950
9:	[0s / 4s],		train_loss: 2.5848
65:	[1s / 1m:31s],		train_loss: 2.4013
10:	[0s / 5s],		train_loss: 2.5900
10:	[0s / 5s],		train_loss: 2.5769
76:	[0s / 1m:4s],		train_loss: 2.4102
11:	[0s / 5s],		train_loss: 2.5649
11:	[0s / 5s],		train_loss: 2.5618
12:	[0s / 6s],		train_loss: 2.5654
12:	[0s / 6s],		train_loss: 2.5460
66:	[1s / 1m:33s],		train_loss: 2.4172
77:	[0s / 1m:5s],		train_loss: 2.4045
13:	[0s / 6s],		train_loss: 2.5564
13:	[0s / 6s],		train_loss: 2.5593
14:	[0s / 6s],		train_loss: 2.5277
14:	[0s / 7s],		train_loss: 2.5403
78:	[0s / 1m:6s],		train_loss: 2.4013
15:	[0s / 7s],		train_loss: 2.5362
15:	[0s / 7s],		train_loss: 2.5432
67:	[1s / 1m:34s],		train_loss: 2.4163
16:	[0s / 7s],		train_loss: 2.5313
79:	[0s / 1m:7s],		train_loss: 2.4181
16:	[0s / 8s],		train_loss: 2.5372
17:	[0s / 8s],		train_loss: 2.5279
17:	[0s / 8s],		train_loss: 2.5324
80:	[0s / 1m:8s],		train_loss: 2.4170
18:	[0s / 8s],		train_loss: 2.5288
18:	[0s / 9s],		train_loss: 2.5307
68:	[1s / 1m:36s],		train_loss: 2.4204
19:	[0s / 9s],		train_loss: 2.5141
19:	[0s / 9s],		train_loss: 2.5208
81:	[0s / 1m:8s],		train_loss: 2.4071
20:	[0s / 9s],		train_loss: 2.5040
20:	[0s / 10s],		train_loss: 2.5103
21:	[0s / 10s],		train_loss: 2.5061
21:	[0s / 10s],		train_loss: 2.5149
82:	[0s / 1m:9s],		train_loss: 2.4104
22:	[0s / 10s],		train_loss: 2.5074
69:	[1s / 1m:37s],		train_loss: 2.3966
22:	[0s / 11s],		train_loss: 2.5077
23:	[0s / 11s],		train_loss: 2.5003
83:	[0s / 1m:10s],		train_loss: 2.4022
23:	[0s / 11s],		train_loss: 2.4975
24:	[0s / 11s],		train_loss: 2.5054
24:	[0s / 12s],		train_loss: 2.5080
70:	[1s / 1m:39s],		train_loss: 2.4033
25:	[0s / 12s],		train_loss: 2.4993
84:	[0s / 1m:11s],		train_loss: 2.3994
25:	[0s / 12s],		train_loss: 2.4929
26:	[0s / 12s],		train_loss: 2.4960
26:	[0s / 13s],		train_loss: 2.4874
85:	[0s / 1m:12s],		train_loss: 2.4195
27:	[0s / 13s],		train_loss: 2.4789
27:	[0s / 13s],		train_loss: 2.5020
71:	[1s / 1m:40s],		train_loss: 2.4179
28:	[0s / 13s],		train_loss: 2.4825
28:	[0s / 14s],		train_loss: 2.4975
86:	[0s / 1m:13s],		train_loss: 2.4069
29:	[0s / 14s],		train_loss: 2.4793
29:	[0s / 14s],		train_loss: 2.4904
30:	[0s / 14s],		train_loss: 2.4867
87:	[0s / 1m:14s],		train_loss: 2.3989
30:	[0s / 15s],		train_loss: 2.4880
31:	[0s / 14s],		train_loss: 2.4658
72:	[1s / 1m:42s],		train_loss: 2.4186
31:	[0s / 15s],		train_loss: 2.4653
32:	[0s / 15s],		train_loss: 2.4847
88:	[0s / 1m:15s],		train_loss: 2.3944
32:	[0s / 16s],		train_loss: 2.4774
33:	[0s / 15s],		train_loss: 2.4925
33:	[0s / 16s],		train_loss: 2.4824
34:	[0s / 16s],		train_loss: 2.4658
73:	[1s / 1m:43s],		train_loss: 2.3901
89:	[0s / 1m:15s],		train_loss: 2.3999
34:	[0s / 17s],		train_loss: 2.4713
35:	[0s / 16s],		train_loss: 2.4704
35:	[0s / 17s],		train_loss: 2.4854
36:	[0s / 17s],		train_loss: 2.4615
90:	[0s / 1m:16s],		train_loss: 2.4096
36:	[0s / 18s],		train_loss: 2.4671
37:	[0s / 17s],		train_loss: 2.4544
74:	[1s / 1m:44s],		train_loss: 2.3963
91:	[0s / 1m:17s],		train_loss: 2.3946
38:	[0s / 18s],		train_loss: 2.4594
37:	[0s / 18s],		train_loss: 2.4570
39:	[0s / 18s],		train_loss: 2.4523
38:	[0s / 18s],		train_loss: 2.4742
92:	[0s / 1m:18s],		train_loss: 2.3990
40:	[0s / 19s],		train_loss: 2.4619
39:	[0s / 19s],		train_loss: 2.4777
75:	[1s / 1m:46s],		train_loss: 2.3925
41:	[0s / 19s],		train_loss: 2.4627
40:	[0s / 19s],		train_loss: 2.4645
93:	[0s / 1m:19s],		train_loss: 2.4006
42:	[0s / 20s],		train_loss: 2.4573
41:	[0s / 20s],		train_loss: 2.4704
43:	[0s / 20s],		train_loss: 2.4464
42:	[0s / 20s],		train_loss: 2.4577
94:	[0s / 1m:20s],		train_loss: 2.4039
76:	[1s / 1m:47s],		train_loss: 2.3957
44:	[0s / 21s],		train_loss: 2.4585
43:	[0s / 21s],		train_loss: 2.4578
45:	[0s / 21s],		train_loss: 2.4519
95:	[0s / 1m:20s],		train_loss: 2.3883
44:	[0s / 21s],		train_loss: 2.4563
46:	[0s / 21s],		train_loss: 2.4606
45:	[0s / 22s],		train_loss: 2.4589
77:	[1s / 1m:49s],		train_loss: 2.3957
96:	[0s / 1m:21s],		train_loss: 2.4014
47:	[0s / 22s],		train_loss: 2.4439
46:	[0s / 22s],		train_loss: 2.4499
48:	[0s / 22s],		train_loss: 2.4502
47:	[0s / 23s],		train_loss: 2.4581
97:	[0s / 1m:22s],		train_loss: 2.3846
49:	[0s / 23s],		train_loss: 2.4519
48:	[0s / 23s],		train_loss: 2.4467
78:	[1s / 1m:50s],		train_loss: 2.3912
50:	[0s / 23s],		train_loss: 2.4543
49:	[0s / 24s],		train_loss: 2.4486
98:	[0s / 1m:23s],		train_loss: 2.4037
51:	[0s / 24s],		train_loss: 2.4424
50:	[0s / 24s],		train_loss: 2.4536
52:	[0s / 24s],		train_loss: 2.4394
99:	[0s / 1m:24s],		train_loss: 2.3872
51:	[0s / 25s],		train_loss: 2.4443
53:	[0s / 25s],		train_loss: 2.4448
79:	[1s / 1m:52s],		train_loss: 2.4119
52:	[0s / 25s],		train_loss: 2.4427
54:	[0s / 25s],		train_loss: 2.4298
0:	[0s / 0s],		train_loss: 2.8236
53:	[0s / 26s],		train_loss: 2.4190
55:	[0s / 26s],		train_loss: 2.4485
1:	[0s / 1s],		train_loss: 2.6214
54:	[0s / 26s],		train_loss: 2.4446
56:	[0s / 26s],		train_loss: 2.4372
80:	[1s / 1m:53s],		train_loss: 2.4131
55:	[0s / 27s],		train_loss: 2.4403
57:	[0s / 27s],		train_loss: 2.4432
2:	[0s / 2s],		train_loss: 2.5743
56:	[0s / 27s],		train_loss: 2.4351
58:	[0s / 27s],		train_loss: 2.4445
3:	[0s / 2s],		train_loss: 2.5934
59:	[0s / 28s],		train_loss: 2.4272
57:	[0s / 28s],		train_loss: 2.4385
81:	[1s / 1m:55s],		train_loss: 2.3962
60:	[0s / 28s],		train_loss: 2.4449
58:	[0s / 28s],		train_loss: 2.4319
4:	[0s / 3s],		train_loss: 2.5524
61:	[0s / 28s],		train_loss: 2.4321
59:	[0s / 29s],		train_loss: 2.4361
62:	[0s / 29s],		train_loss: 2.4187
60:	[0s / 29s],		train_loss: 2.4293
5:	[0s / 4s],		train_loss: 2.5757
82:	[1s / 1m:56s],		train_loss: 2.4042
63:	[0s / 29s],		train_loss: 2.4300
61:	[0s / 30s],		train_loss: 2.4249
6:	[0s / 5s],		train_loss: 2.5404
64:	[0s / 30s],		train_loss: 2.4296
62:	[0s / 30s],		train_loss: 2.4355
65:	[0s / 30s],		train_loss: 2.4252
63:	[0s / 31s],		train_loss: 2.4270
7:	[0s / 5s],		train_loss: 2.5378
83:	[1s / 1m:58s],		train_loss: 2.3982
66:	[0s / 31s],		train_loss: 2.4292
64:	[0s / 31s],		train_loss: 2.4196
8:	[0s / 6s],		train_loss: 2.5520
67:	[0s / 31s],		train_loss: 2.4234
65:	[0s / 32s],		train_loss: 2.4255
68:	[0s / 32s],		train_loss: 2.4306
66:	[0s / 32s],		train_loss: 2.4218
9:	[0s / 7s],		train_loss: 2.5338
84:	[1s / 1m:59s],		train_loss: 2.4088
69:	[0s / 32s],		train_loss: 2.4367
67:	[0s / 33s],		train_loss: 2.4229
10:	[0s / 7s],		train_loss: 2.5352
70:	[0s / 33s],		train_loss: 2.4148
68:	[0s / 33s],		train_loss: 2.4140
71:	[0s / 33s],		train_loss: 2.4043
69:	[0s / 34s],		train_loss: 2.4280
11:	[0s / 8s],		train_loss: 2.5223
85:	[1s / 2m:1s],		train_loss: 2.3942
72:	[0s / 34s],		train_loss: 2.4088
70:	[0s / 34s],		train_loss: 2.4254
12:	[0s / 9s],		train_loss: 2.5233
73:	[0s / 34s],		train_loss: 2.4203
71:	[0s / 35s],		train_loss: 2.4151
74:	[0s / 35s],		train_loss: 2.4228
13:	[0s / 10s],		train_loss: 2.5011
72:	[0s / 35s],		train_loss: 2.4228
86:	[1s / 2m:2s],		train_loss: 2.3876
75:	[0s / 35s],		train_loss: 2.4226
73:	[0s / 36s],		train_loss: 2.4149
76:	[0s / 35s],		train_loss: 2.4027
14:	[0s / 10s],		train_loss: 2.5190
74:	[0s / 36s],		train_loss: 2.4254
77:	[0s / 36s],		train_loss: 2.4149
75:	[0s / 37s],		train_loss: 2.4133
15:	[0s / 11s],		train_loss: 2.5119
87:	[1s / 2m:3s],		train_loss: 2.3995
78:	[0s / 36s],		train_loss: 2.4199
76:	[0s / 37s],		train_loss: 2.4222
79:	[0s / 37s],		train_loss: 2.4084
16:	[0s / 12s],		train_loss: 2.5080
77:	[0s / 37s],		train_loss: 2.4096
80:	[0s / 37s],		train_loss: 2.4126
17:	[0s / 12s],		train_loss: 2.5462
78:	[0s / 38s],		train_loss: 2.4206
88:	[1s / 2m:5s],		train_loss: 2.3854
81:	[0s / 38s],		train_loss: 2.3966
79:	[0s / 39s],		train_loss: 2.4078
82:	[0s / 38s],		train_loss: 2.4033
18:	[0s / 13s],		train_loss: 2.5305
80:	[0s / 39s],		train_loss: 2.4044
83:	[0s / 39s],		train_loss: 2.4030
19:	[0s / 14s],		train_loss: 2.5055
81:	[0s / 39s],		train_loss: 2.4000
84:	[0s / 39s],		train_loss: 2.3950
89:	[1s / 2m:6s],		train_loss: 2.3801
85:	[0s / 40s],		train_loss: 2.3950
82:	[0s / 40s],		train_loss: 2.4065
20:	[0s / 15s],		train_loss: 2.5105
86:	[0s / 40s],		train_loss: 2.4035
83:	[0s / 40s],		train_loss: 2.4105
21:	[0s / 15s],		train_loss: 2.5318
87:	[0s / 41s],		train_loss: 2.4097
84:	[0s / 41s],		train_loss: 2.4084
90:	[1s / 2m:8s],		train_loss: 2.3802
88:	[0s / 41s],		train_loss: 2.4098
22:	[0s / 16s],		train_loss: 2.5161
85:	[0s / 41s],		train_loss: 2.3989
89:	[0s / 42s],		train_loss: 2.3943
86:	[0s / 42s],		train_loss: 2.3970
23:	[0s / 17s],		train_loss: 2.5247
90:	[0s / 42s],		train_loss: 2.4102
87:	[0s / 42s],		train_loss: 2.4005
91:	[1s / 2m:9s],		train_loss: 2.3931
91:	[0s / 42s],		train_loss: 2.4156
24:	[0s / 17s],		train_loss: 2.5116
88:	[0s / 43s],		train_loss: 2.4008
92:	[0s / 43s],		train_loss: 2.3825
89:	[0s / 43s],		train_loss: 2.3934
25:	[0s / 18s],		train_loss: 2.5162
93:	[0s / 43s],		train_loss: 2.3963
92:	[1s / 2m:11s],		train_loss: 2.3819
90:	[0s / 44s],		train_loss: 2.3845
94:	[0s / 44s],		train_loss: 2.3867
26:	[0s / 19s],		train_loss: 2.5077
91:	[0s / 44s],		train_loss: 2.4100
95:	[0s / 44s],		train_loss: 2.3916
92:	[0s / 45s],		train_loss: 2.3939
27:	[0s / 20s],		train_loss: 2.5072
96:	[0s / 45s],		train_loss: 2.4066
93:	[1s / 2m:12s],		train_loss: 2.3746
93:	[0s / 45s],		train_loss: 2.3888
97:	[0s / 45s],		train_loss: 2.3935
28:	[0s / 20s],		train_loss: 2.5010
94:	[0s / 46s],		train_loss: 2.3960
98:	[0s / 46s],		train_loss: 2.3927
29:	[0s / 21s],		train_loss: 2.4910
95:	[0s / 46s],		train_loss: 2.3871
99:	[0s / 46s],		train_loss: 2.4073
94:	[1s / 2m:14s],		train_loss: 2.3854
96:	[0s / 47s],		train_loss: 2.3858
0:	[0s / 0s],		train_loss: 2.8851
30:	[0s / 22s],		train_loss: 2.5013
97:	[0s / 47s],		train_loss: 2.4028
1:	[0s / 0s],		train_loss: 2.6412
31:	[0s / 22s],		train_loss: 2.4800
98:	[0s / 48s],		train_loss: 2.3862
2:	[0s / 1s],		train_loss: 2.6139
95:	[1s / 2m:15s],		train_loss: 2.3715
99:	[0s / 48s],		train_loss: 2.3940
32:	[0s / 23s],		train_loss: 2.5098
3:	[0s / 1s],		train_loss: 2.5853
4:	[0s / 2s],		train_loss: 2.5624
0:	[0s / 0s],		train_loss: 3.6720
33:	[0s / 24s],		train_loss: 2.5049
5:	[0s / 2s],		train_loss: 2.5867
1:	[0s / 0s],		train_loss: 2.9142
96:	[1s / 2m:16s],		train_loss: 2.3773
6:	[0s / 3s],		train_loss: 2.5985
34:	[0s / 25s],		train_loss: 2.4874
2:	[0s / 1s],		train_loss: 2.7938
7:	[0s / 3s],		train_loss: 2.5585
3:	[0s / 1s],		train_loss: 2.7294
35:	[0s / 25s],		train_loss: 2.4606
8:	[0s / 4s],		train_loss: 2.5596
4:	[0s / 2s],		train_loss: 2.7041
97:	[1s / 2m:18s],		train_loss: 2.3675
9:	[0s / 4s],		train_loss: 2.5513
36:	[0s / 26s],		train_loss: 2.4902
5:	[0s / 2s],		train_loss: 2.6561
10:	[0s / 5s],		train_loss: 2.5449
6:	[0s / 3s],		train_loss: 2.6451
37:	[0s / 27s],		train_loss: 2.5210
11:	[0s / 5s],		train_loss: 2.5367
7:	[0s / 3s],		train_loss: 2.6153
98:	[1s / 2m:19s],		train_loss: 2.3793
12:	[0s / 6s],		train_loss: 2.5301
38:	[0s / 27s],		train_loss: 2.5018
8:	[0s / 4s],		train_loss: 2.6104
13:	[0s / 6s],		train_loss: 2.5444
9:	[0s / 4s],		train_loss: 2.6042
39:	[0s / 28s],		train_loss: 2.5037
14:	[0s / 7s],		train_loss: 2.5583
10:	[0s / 5s],		train_loss: 2.5731
99:	[1s / 2m:21s],		train_loss: 2.3795
15:	[0s / 7s],		train_loss: 2.5546
40:	[0s / 29s],		train_loss: 2.5169
11:	[0s / 5s],		train_loss: 2.5751
16:	[0s / 8s],		train_loss: 2.5410
12:	[0s / 6s],		train_loss: 2.5570
41:	[0s / 30s],		train_loss: 2.5039
17:	[0s / 8s],		train_loss: 2.5328
13:	[0s / 6s],		train_loss: 2.5614
18:	[0s / 9s],		train_loss: 2.5381
0:	[1s / 1s],		train_loss: 4.3428
42:	[0s / 30s],		train_loss: 2.4793
14:	[0s / 7s],		train_loss: 2.5525
19:	[0s / 9s],		train_loss: 2.5268
15:	[0s / 7s],		train_loss: 2.5512
43:	[0s / 31s],		train_loss: 2.4884
20:	[0s / 9s],		train_loss: 2.5205
16:	[0s / 8s],		train_loss: 2.5374
21:	[0s / 10s],		train_loss: 2.5362
1:	[1s / 2s],		train_loss: 3.2615
44:	[0s / 32s],		train_loss: 2.4830
17:	[0s / 8s],		train_loss: 2.5336
22:	[0s / 10s],		train_loss: 2.5486
18:	[0s / 9s],		train_loss: 2.5259
45:	[0s / 33s],		train_loss: 2.5008
23:	[0s / 11s],		train_loss: 2.5386
19:	[0s / 9s],		train_loss: 2.5228
2:	[1s / 3s],		train_loss: 3.0637
24:	[0s / 11s],		train_loss: 2.5458
46:	[0s / 33s],		train_loss: 2.5356
20:	[0s / 10s],		train_loss: 2.5071
25:	[0s / 12s],		train_loss: 2.5285
47:	[0s / 34s],		train_loss: 2.5498
21:	[0s / 10s],		train_loss: 2.5128
26:	[0s / 12s],		train_loss: 2.5101
3:	[1s / 5s],		train_loss: 2.9429
22:	[0s / 11s],		train_loss: 2.4985
27:	[0s / 13s],		train_loss: 2.5242
48:	[0s / 35s],		train_loss: 2.4979
23:	[0s / 11s],		train_loss: 2.5075
28:	[0s / 13s],		train_loss: 2.5270
49:	[0s / 35s],		train_loss: 2.5010
24:	[0s / 12s],		train_loss: 2.5000
29:	[0s / 14s],		train_loss: 2.5356
4:	[1s / 6s],		train_loss: 2.8492
25:	[0s / 12s],		train_loss: 2.5118
30:	[0s / 14s],		train_loss: 2.5252
50:	[0s / 36s],		train_loss: 2.4817
31:	[0s / 15s],		train_loss: 2.5224
26:	[0s / 13s],		train_loss: 2.4918
51:	[0s / 37s],		train_loss: 2.4999
32:	[0s / 15s],		train_loss: 2.5286
27:	[0s / 13s],		train_loss: 2.4974
5:	[1s / 7s],		train_loss: 2.7626
33:	[0s / 16s],		train_loss: 2.5443
28:	[0s / 14s],		train_loss: 2.4858
52:	[0s / 37s],		train_loss: 2.4690
34:	[0s / 16s],		train_loss: 2.5391
29:	[0s / 14s],		train_loss: 2.4882
53:	[0s / 38s],		train_loss: 2.4850
35:	[0s / 16s],		train_loss: 2.5139
30:	[0s / 15s],		train_loss: 2.4848
6:	[1s / 9s],		train_loss: 2.6964
36:	[0s / 17s],		train_loss: 2.5463
54:	[0s / 39s],		train_loss: 2.4761
31:	[0s / 15s],		train_loss: 2.4833
37:	[0s / 17s],		train_loss: 2.5449
32:	[0s / 16s],		train_loss: 2.4787
55:	[0s / 39s],		train_loss: 2.5026
38:	[0s / 18s],		train_loss: 2.5295
7:	[1s / 10s],		train_loss: 2.6470
33:	[0s / 16s],		train_loss: 2.4801
39:	[0s / 18s],		train_loss: 2.5342
56:	[0s / 40s],		train_loss: 2.4807
34:	[0s / 17s],		train_loss: 2.4690
40:	[0s / 19s],		train_loss: 2.5046
35:	[0s / 17s],		train_loss: 2.4775
57:	[0s / 41s],		train_loss: 2.4498
41:	[0s / 19s],		train_loss: 2.5288
8:	[1s / 11s],		train_loss: 2.6264
36:	[0s / 18s],		train_loss: 2.4529
42:	[0s / 20s],		train_loss: 2.5210
58:	[0s / 42s],		train_loss: 2.4809
37:	[0s / 18s],		train_loss: 2.4705
43:	[0s / 20s],		train_loss: 2.5124
38:	[0s / 18s],		train_loss: 2.4596
59:	[0s / 42s],		train_loss: 2.4792
44:	[0s / 21s],		train_loss: 2.5111
9:	[1s / 13s],		train_loss: 2.6094
39:	[0s / 19s],		train_loss: 2.4623
45:	[0s / 21s],		train_loss: 2.5255
60:	[0s / 43s],		train_loss: 2.4806
40:	[0s / 19s],		train_loss: 2.4632
46:	[0s / 22s],		train_loss: 2.5180
41:	[0s / 20s],		train_loss: 2.4758
61:	[0s / 44s],		train_loss: 2.4969
10:	[1s / 14s],		train_loss: 2.6047
47:	[0s / 22s],		train_loss: 2.5251
42:	[0s / 20s],		train_loss: 2.4566
48:	[0s / 23s],		train_loss: 2.5161
62:	[0s / 45s],		train_loss: 2.4821
43:	[0s / 21s],		train_loss: 2.4526
49:	[0s / 23s],		train_loss: 2.5109
44:	[0s / 21s],		train_loss: 2.4567
63:	[0s / 45s],		train_loss: 2.4770
11:	[1s / 16s],		train_loss: 2.5861
50:	[0s / 24s],		train_loss: 2.5240
45:	[0s / 22s],		train_loss: 2.4546
51:	[0s / 24s],		train_loss: 2.5095
64:	[0s / 46s],		train_loss: 2.4951
46:	[0s / 22s],		train_loss: 2.4554
52:	[0s / 25s],		train_loss: 2.5117
12:	[1s / 17s],		train_loss: 2.5661
47:	[0s / 23s],		train_loss: 2.4423
65:	[0s / 47s],		train_loss: 2.4785
53:	[0s / 25s],		train_loss: 2.5216
48:	[0s / 23s],		train_loss: 2.4493
54:	[0s / 25s],		train_loss: 2.5260
66:	[0s / 47s],		train_loss: 2.4777
49:	[0s / 24s],		train_loss: 2.4390
55:	[0s / 26s],		train_loss: 2.5038
13:	[1s / 18s],		train_loss: 2.5567
50:	[0s / 24s],		train_loss: 2.4497
67:	[0s / 48s],		train_loss: 2.4951
56:	[0s / 26s],		train_loss: 2.5038
51:	[0s / 25s],		train_loss: 2.4434
57:	[0s / 27s],		train_loss: 2.5052
68:	[0s /