[I 2026-06-08 20:51:36,970] Trial 37 finished with value: 0.8062533899813753 and parameters: {'num_nodes': [64, 32], 'dropout': 0.09567578781180999, 'learning_rate': 0.00018094536127901594, 'batch_norm': False}. Best is trial 37 with value: 0.8062533899813753.
/scratch.hpc/luca.cotugno/Foundation_model_clinical_data/test_tabular_model_tmp.py:476: UserWarning: Choices for a categorical distribution should be a tuple of None, bool, int, float and str for persistent storage but contains [32] which is of type list.
  num_nodes  = trial.suggest_categorical("num_nodes", [[32], [64], [128], [64, 32], [128, 64]])
/scratch.hpc/luca.cotugno/Foundation_model_clinical_data/test_tabular_model_tmp.py:476: UserWarning: Choices for a categorical distribution should be a tuple of None, bool, int, float and str for persistent storage but contains [64] which is of type list.
  num_nodes  = trial.suggest_categorical("num_nodes", [[32], [64], [128], [64, 32], [128, 64]])
/scratch.hpc/luca.cotugno/Foundation_model_clinical_data/test_tabular_model_tmp.py:476: UserWarning: Choices for a categorical distribution should be a tuple of None, bool, int, float and str for persistent storage but contains [128] which is of type list.
  num_nodes  = trial.suggest_categorical("num_nodes", [[32], [64], [128], [64, 32], [128, 64]])
/scratch.hpc/luca.cotugno/Foundation_model_clinical_data/test_tabular_model_tmp.py:476: UserWarning: Choices for a categorical distribution should be a tuple of None, bool, int, float and str for persistent storage but contains [64, 32] which is of type list.
  num_nodes  = trial.suggest_categorical("num_nodes", [[32], [64], [128], [64, 32], [128, 64]])
/scratch.hpc/luca.cotugno/Foundation_model_clinical_data/test_tabular_model_tmp.py:476: UserWarning: Choices for a categorical distribution should be a tuple of None, bool, int, float and str for persistent storage but contains [128, 64] which is of type list.
  num_nodes  = trial.suggest_categorical("num_nodes", [[32], [64], [128], [64, 32], [128, 64]])

5:	[0s / 3s],		train_loss: 2.4993
10:	[0s / 4s],		train_loss: 2.4766
93:	[0s / 44s],		train_loss: 2.3405
32:	[1s / 33s],		train_loss: 2.4417
11:	[0s / 5s],		train_loss: 2.4864
6:	[0s / 4s],		train_loss: 2.5127
94:	[0s / 45s],		train_loss: 2.3445
12:	[0s / 5s],		train_loss: 2.4674
95:	[0s / 45s],		train_loss: 2.3363
7:	[0s / 4s],		train_loss: 2.5028
13:	[0s / 6s],		train_loss: 2.4663
33:	[0s / 34s],		train_loss: 2.4434
96:	[0s / 45s],		train_loss: 2.3544
8:	[0s / 5s],		train_loss: 2.4933
14:	[0s / 6s],		train_loss: 2.4485
97:	[0s / 46s],		train_loss: 2.3492
15:	[0s / 7s],		train_loss: 2.4633
9:	[0s / 5s],		train_loss: 2.4944
34:	[1s / 35s],		train_loss: 2.4493
98:	[0s / 46s],		train_loss: 2.3425
16:	[0s / 7s],		train_loss: 2.4607
10:	[0s / 6s],		train_loss: 2.4789
99:	[0s / 47s],		train_loss: 2.3386
17:	[0s / 8s],		train_loss: 2.4528
35:	[0s / 36s],		train_loss: 2.4333
11:	[0s / 7s],		train_loss: 2.4682
18:	[0s / 8s],		train_loss: 2.4483
0:	[0s / 0s],		train_loss: 2.9356
19:	[0s / 9s],		train_loss: 2.4484
1:	[0s / 0s],		train_loss: 2.6068
12:	[0s / 7s],		train_loss: 2.4638
36:	[1s / 37s],		train_loss: 2.4406
20:	[0s / 9s],		train_loss: 2.4332
2:	[0s / 1s],		train_loss: 2.5572
13:	[0s / 8s],		train_loss: 2.4707
21:	[0s / 9s],		train_loss: 2.4383
3:	[0s / 1s],		train_loss: 2.5399
14:	[0s / 8s],		train_loss: 2.4579
22:	[0s / 10s],		train_loss: 2.4325
37:	[1s / 38s],		train_loss: 2.4414
4:	[0s / 2s],		train_loss: 2.5186
23:	[0s / 10s],		train_loss: 2.4367
15:	[0s / 9s],		train_loss: 2.4513
5:	[0s / 2s],		train_loss: 2.5186
24:	[0s / 11s],		train_loss: 2.4277
6:	[0s / 3s],		train_loss: 2.4925
38:	[1s / 39s],		train_loss: 2.4425
16:	[0s / 10s],		train_loss: 2.4584
25:	[0s / 11s],		train_loss: 2.4518
7:	[0s / 3s],		train_loss: 2.4910
17:	[0s / 10s],		train_loss: 2.4685
26:	[0s / 12s],		train_loss: 2.4378
8:	[0s / 4s],		train_loss: 2.4857
39:	[1s / 40s],		train_loss: 2.4367
27:	[0s / 12s],		train_loss: 2.4227
18:	[0s / 11s],		train_loss: 2.4453
9:	[0s / 4s],		train_loss: 2.4742
28:	[0s / 13s],		train_loss: 2.4320
19:	[0s / 11s],		train_loss: 2.4472
10:	[0s / 5s],		train_loss: 2.4854
29:	[0s / 13s],		train_loss: 2.4326
40:	[1s / 41s],		train_loss: 2.4395
20:	[0s / 12s],		train_loss: 2.4462
11:	[0s / 5s],		train_loss: 2.4710
30:	[0s / 13s],		train_loss: 2.4205
12:	[0s / 6s],		train_loss: 2.4675
31:	[0s / 14s],		train_loss: 2.4167
21:	[0s / 13s],		train_loss: 2.4376
41:	[1s / 43s],		train_loss: 2.4310
13:	[0s / 6s],		train_loss: 2.4636
32:	[0s / 14s],		train_loss: 2.4220
22:	[0s / 13s],		train_loss: 2.4335
33:	[0s / 15s],		train_loss: 2.4125
14:	[0s / 7s],		train_loss: 2.4613
23:	[0s / 14s],		train_loss: 2.4314
42:	[1s / 44s],		train_loss: 2.4316
34:	[0s / 15s],		train_loss: 2.4236
15:	[0s / 7s],		train_loss: 2.4516
24:	[0s / 14s],		train_loss: 2.4360
35:	[0s / 16s],		train_loss: 2.4153
16:	[0s / 8s],		train_loss: 2.4582
43:	[1s / 45s],		train_loss: 2.4365
36:	[0s / 16s],		train_loss: 2.4287
17:	[0s / 8s],		train_loss: 2.4527
25:	[0s / 15s],		train_loss: 2.4296
37:	[0s / 17s],		train_loss: 2.4106
18:	[0s / 9s],		train_loss: 2.4587
26:	[0s / 15s],		train_loss: 2.4404
38:	[0s / 17s],		train_loss: 2.3901
19:	[0s / 9s],		train_loss: 2.4427
44:	[1s / 46s],		train_loss: 2.4283
27:	[0s / 16s],		train_loss: 2.4191
39:	[0s / 18s],		train_loss: 2.3996
20:	[0s / 9s],		train_loss: 2.4368
40:	[0s / 18s],		train_loss: 2.4025
21:	[0s / 10s],		train_loss: 2.4452
28:	[0s / 17s],		train_loss: 2.4180
45:	[0s / 47s],		train_loss: 2.4309
41:	[0s / 18s],		train_loss: 2.4087
22:	[0s / 10s],		train_loss: 2.4417
29:	[0s / 17s],		train_loss: 2.4258
42:	[0s / 19s],		train_loss: 2.4060
23:	[0s / 11s],		train_loss: 2.4284
30:	[0s / 18s],		train_loss: 2.4094
46:	[1s / 48s],		train_loss: 2.4256
43:	[0s / 19s],		train_loss: 2.4002
24:	[0s / 11s],		train_loss: 2.4366
44:	[0s / 20s],		train_loss: 2.3924
31:	[0s / 19s],		train_loss: 2.4431
25:	[0s / 12s],		train_loss: 2.4180
45:	[0s / 20s],		train_loss: 2.3999
47:	[1s / 49s],		train_loss: 2.4204
26:	[0s / 12s],		train_loss: 2.4305
32:	[0s / 19s],		train_loss: 2.4197
46:	[0s / 21s],		train_loss: 2.3819
27:	[0s / 13s],		train_loss: 2.4136
33:	[0s / 20s],		train_loss: 2.4295
47:	[0s / 21s],		train_loss: 2.3897
48:	[1s / 50s],		train_loss: 2.4190
28:	[0s / 13s],		train_loss: 2.4348
48:	[0s / 22s],		train_loss: 2.3865
34:	[0s / 20s],		train_loss: 2.4110
29:	[0s / 14s],		train_loss: 2.4268
49:	[0s / 22s],		train_loss: 2.3717
35:	[0s / 21s],		train_loss: 2.4183
30:	[0s / 14s],		train_loss: 2.4271
50:	[0s / 22s],		train_loss: 2.4032
49:	[1s / 51s],		train_loss: 2.4181
31:	[0s / 15s],		train_loss: 2.4280
51:	[0s / 23s],		train_loss: 2.4038
36:	[0s / 21s],		train_loss: 2.4192
32:	[0s / 15s],		train_loss: 2.4132
52:	[0s / 23s],		train_loss: 2.3893
50:	[0s / 52s],		train_loss: 2.4189
37:	[0s / 22s],		train_loss: 2.4267
53:	[0s / 24s],		train_loss: 2.3869
33:	[0s / 16s],		train_loss: 2.4122
38:	[0s / 23s],		train_loss: 2.4115
54:	[0s / 24s],		train_loss: 2.3738
34:	[0s / 16s],		train_loss: 2.4051
51:	[1s / 53s],		train_loss: 2.4210
55:	[0s / 25s],		train_loss: 2.3694
39:	[0s / 23s],		train_loss: 2.4200
35:	[0s / 16s],		train_loss: 2.4173
56:	[0s / 25s],		train_loss: 2.3602
36:	[0s / 17s],		train_loss: 2.4195
40:	[0s / 24s],		train_loss: 2.4143
57:	[0s / 25s],		train_loss: 2.3814
52:	[1s / 54s],		train_loss: 2.4190
37:	[0s / 17s],		train_loss: 2.4061
41:	[0s / 24s],		train_loss: 2.4098
58:	[0s / 26s],		train_loss: 2.3560
38:	[0s / 18s],		train_loss: 2.4125
42:	[0s / 25s],		train_loss: 2.4070
59:	[0s / 26s],		train_loss: 2.3814
39:	[0s / 18s],		train_loss: 2.3997
53:	[1s / 55s],		train_loss: 2.4143
60:	[0s / 27s],		train_loss: 2.3779
43:	[0s / 26s],		train_loss: 2.4158
40:	[0s / 19s],		train_loss: 2.4141
61:	[0s / 27s],		train_loss: 2.3783
44:	[0s / 26s],		train_loss: 2.4095
41:	[0s / 19s],		train_loss: 2.3992
62:	[0s / 28s],		train_loss: 2.3741
54:	[1s / 56s],		train_loss: 2.4099
42:	[0s / 20s],		train_loss: 2.4032
45:	[0s / 27s],		train_loss: 2.4157
63:	[0s / 28s],		train_loss: 2.3655
43:	[0s / 20s],		train_loss: 2.3887
64:	[0s / 29s],		train_loss: 2.3683
46:	[0s / 27s],		train_loss: 2.4056
55:	[1s / 57s],		train_loss: 2.4121
44:	[0s / 21s],		train_loss: 2.3994
65:	[0s / 29s],		train_loss: 2.3668
47:	[0s / 28s],		train_loss: 2.4165
45:	[0s / 21s],		train_loss: 2.4088
66:	[0s / 29s],		train_loss: 2.3814
48:	[0s / 28s],		train_loss: 2.3883
56:	[1s / 58s],		train_loss: 2.4124
67:	[0s / 30s],		train_loss: 2.3798
46:	[0s / 22s],		train_loss: 2.4128
68:	[0s / 30s],		train_loss: 2.3827
47:	[0s / 22s],		train_loss: 2.4103
49:	[0s / 29s],		train_loss: 2.3967
69:	[0s / 31s],		train_loss: 2.3719
48:	[0s / 23s],		train_loss: 2.3941
57:	[1s / 59s],		train_loss: 2.3997
50:	[0s / 30s],		train_loss: 2.3958
70:	[0s / 31s],		train_loss: 2.3580
49:	[0s / 23s],		train_loss: 2.3796
51:	[0s / 30s],		train_loss: 2.4009
71:	[0s / 32s],		train_loss: 2.3621
50:	[0s / 24s],		train_loss: 2.3869
58:	[1s / 1m:0s],		train_loss: 2.4090
72:	[0s / 32s],		train_loss: 2.3564
52:	[0s / 31s],		train_loss: 2.3940
51:	[0s / 24s],		train_loss: 2.3912
73:	[0s / 33s],		train_loss: 2.3616
52:	[0s / 24s],		train_loss: 2.3948
53:	[0s / 31s],		train_loss: 2.3911
74:	[0s / 33s],		train_loss: 2.3326
59:	[1s / 1m:2s],		train_loss: 2.4163
53:	[0s / 25s],		train_loss: 2.3845
75:	[0s / 33s],		train_loss: 2.3450
54:	[0s / 32s],		train_loss: 2.3999
54:	[0s / 25s],		train_loss: 2.3718
76:	[0s / 34s],		train_loss: 2.3516
55:	[0s / 33s],		train_loss: 2.3989
55:	[0s / 26s],		train_loss: 2.3954
60:	[1s / 1m:3s],		train_loss: 2.4036
77:	[0s / 34s],		train_loss: 2.3477
56:	[0s / 26s],		train_loss: 2.3844
56:	[0s / 33s],		train_loss: 2.3946
78:	[0s / 35s],		train_loss: 2.3491
57:	[0s / 27s],		train_loss: 2.3822
57:	[0s / 34s],		train_loss: 2.3864
79:	[0s / 35s],		train_loss: 2.3541
61:	[1s / 1m:4s],		train_loss: 2.3964
58:	[0s / 27s],		train_loss: 2.3731
80:	[0s / 36s],		train_loss: 2.3549
58:	[0s / 34s],		train_loss: 2.3862
59:	[0s / 28s],		train_loss: 2.3656
81:	[0s / 36s],		train_loss: 2.3421
62:	[1s / 1m:5s],		train_loss: 2.4011
59:	[0s / 35s],		train_loss: 2.3898
60:	[0s / 28s],		train_loss: 2.3746
82:	[0s / 37s],		train_loss: 2.3490
61:	[0s / 29s],		train_loss: 2.3743
83:	[0s / 37s],		train_loss: 2.3415
60:	[0s / 36s],		train_loss: 2.3845
63:	[1s / 1m:6s],		train_loss: 2.4100
62:	[0s / 29s],		train_loss: 2.3771
84:	[0s / 37s],		train_loss: 2.3227
61:	[0s / 36s],		train_loss: 2.3796
63:	[0s / 30s],		train_loss: 2.3543
85:	[0s / 38s],		train_loss: 2.3363
62:	[0s / 37s],		train_loss: 2.3819
64:	[0s / 30s],		train_loss: 2.3680
86:	[0s / 38s],		train_loss: 2.3433
64:	[1s / 1m:7s],		train_loss: 2.3928
63:	[0s / 37s],		train_loss: 2.3832
87:	[0s / 39s],		train_loss: 2.3404
65:	[0s / 31s],		train_loss: 2.3694
88:	[0s / 39s],		train_loss: 2.3367
66:	[0s / 31s],		train_loss: 2.3606
64:	[0s / 38s],		train_loss: 2.3710
65:	[1s / 1m:8s],		train_loss: 2.4086
89:	[0s / 40s],		train_loss: 2.3451
67:	[0s / 32s],		train_loss: 2.3599
65:	[0s / 39s],		train_loss: 2.3761
90:	[0s / 40s],		train_loss: 2.3515
68:	[0s / 32s],		train_loss: 2.3661
66:	[1s / 1m:9s],		train_loss: 2.3958
66:	[0s / 39s],		train_loss: 2.3806
91:	[0s / 41s],		train_loss: 2.3519
69:	[0s / 32s],		train_loss: 2.3629
92:	[0s / 41s],		train_loss: 2.3117
67:	[0s / 40s],		train_loss: 2.3725
70:	[0s / 33s],		train_loss: 2.3711
93:	[0s / 41s],		train_loss: 2.3428
67:	[1s / 1m:10s],		train_loss: 2.4024
71:	[0s / 33s],		train_loss: 2.3611
68:	[0s / 40s],		train_loss: 2.3759
94:	[0s / 42s],		train_loss: 2.3311
72:	[0s / 34s],		train_loss: 2.3480
69:	[0s / 41s],		train_loss: 2.3774
95:	[0s / 42s],		train_loss: 2.3258
73:	[0s / 34s],		train_loss: 2.3598
68:	[1s / 1m:11s],		train_loss: 2.3904
96:	[0s / 43s],		train_loss: 2.3153
70:	[0s / 41s],		train_loss: 2.3864
74:	[0s / 35s],		train_loss: 2.3694
97:	[0s / 43s],		train_loss: 2.3320
71:	[0s / 42s],		train_loss: 2.3731
75:	[0s / 35s],		train_loss: 2.3724
69:	[1s / 1m:12s],		train_loss: 2.3971
98:	[0s / 44s],		train_loss: 2.3471
72:	[0s / 43s],		train_loss: 2.3510
76:	[0s / 36s],		train_loss: 2.3530
99:	[0s / 44s],		train_loss: 2.3152
73:	[0s / 43s],		train_loss: 2.3811
77:	[0s / 36s],		train_loss: 2.3441
70:	[1s / 1m:13s],		train_loss: 2.3890
0:	[0s / 0s],		train_loss: 3.0224
78:	[0s / 37s],		train_loss: 2.3467
74:	[0s / 44s],		train_loss: 2.3716
1:	[0s / 0s],		train_loss: 2.6343
79:	[0s / 37s],		train_loss: 2.3516
2:	[0s / 1s],		train_loss: 2.5746
75:	[0s / 44s],		train_loss: 2.3538
71:	[1s / 1m:14s],		train_loss: 2.3897
80:	[0s / 38s],		train_loss: 2.3333
3:	[0s / 1s],		train_loss: 2.5540
76:	[0s / 45s],		train_loss: 2.3563
81:	[0s / 38s],		train_loss: 2.3756
4:	[0s / 2s],		train_loss: 2.5268
72:	[1s / 1m:15s],		train_loss: 2.3942
5:	[0s / 2s],		train_loss: 2.5191
82:	[0s / 39s],		train_loss: 2.3545
77:	[0s / 46s],		train_loss: 2.3765
6:	[0s / 3s],		train_loss: 2.5123
83:	[0s / 39s],		train_loss: 2.3480
78:	[0s / 46s],		train_loss: 2.3774
7:	[0s / 3s],		train_loss: 2.5007
84:	[0s / 40s],		train_loss: 2.3363
73:	[1s / 1m:16s],		train_loss: 2.3955
79:	[0s / 47s],		train_loss: 2.3681
8:	[0s / 3s],		train_loss: 2.4765
85:	[0s / 40s],		train_loss: 2.3509
9:	[0s / 4s],		train_loss: 2.4957
80:	[0s / 47s],		train_loss: 2.3754
86:	[0s / 41s],		train_loss: 2.3478
74:	[1s / 1m:17s],		train_loss: 2.3916
10:	[0s / 4s],		train_loss: 2.4912
87:	[0s / 41s],		train_loss: 2.3615
81:	[0s / 48s],		train_loss: 2.3794
11:	[0s / 5s],		train_loss: 2.4896
88:	[0s / 42s],		train_loss: 2.3364
82:	[0s / 49s],		train_loss: 2.3622
75:	[1s / 1m:18s],		train_loss: 2.3885
12:	[0s / 5s],		train_loss: 2.4797
89:	[0s / 42s],		train_loss: 2.3336
13:	[0s / 6s],		train_loss: 2.4866
83:	[0s / 49s],		train_loss: 2.3610
90:	[0s / 42s],		train_loss: 2.3500
14:	[0s / 6s],		train_loss: 2.4780
76:	[1s / 1m:19s],		train_loss: 2.3820
91:	[0s / 43s],		train_loss: 2.3435
84:	[0s / 50s],		train_loss: 2.3418
15:	[0s / 7s],		train_loss: 2.4669
92:	[0s / 43s],		train_loss: 2.3386
16:	[0s / 7s],		train_loss: 2.4692
85:	[0s / 50s],		train_loss: 2.3598
77:	[1s / 1m:20s],		train_loss: 2.3861
93:	[0s / 44s],		train_loss: 2.3345
17:	[0s / 7s],		train_loss: 2.4689
86:	[0s / 51s],		train_loss: 2.3605
94:	[0s / 44s],		train_loss: 2.3469
18:	[0s / 8s],		train_loss: 2.4672
78:	[0s / 1m:21s],		train_loss: 2.3873
87:	[0s / 52s],		train_loss: 2.3643
95:	[0s / 45s],		train_loss: 2.3234
19:	[0s / 8s],		train_loss: 2.4669
20:	[0s / 9s],		train_loss: 2.4683
96:	[0s / 45s],		train_loss: 2.3305
88:	[0s / 52s],		train_loss: 2.3372
21:	[0s / 9s],		train_loss: 2.4513
97:	[0s / 46s],		train_loss: 2.3250
79:	[1s / 1m:22s],		train_loss: 2.3870
89:	[0s / 53s],		train_loss: 2.3562
22:	[0s / 10s],		train_loss: 2.4623
98:	[0s / 46s],		train_loss: 2.3301
90:	[0s / 53s],		train_loss: 2.3570
23:	[0s / 10s],		train_loss: 2.4454
99:	[0s / 47s],		train_loss: 2.3141
80:	[0s / 1m:23s],		train_loss: 2.3824
24:	[0s / 11s],		train_loss: 2.4497
91:	[0s / 54s],		train_loss: 2.3454
0:	[0s / 0s],		train_loss: 3.2454
25:	[0s / 11s],		train_loss: 2.4576
92:	[0s / 55s],		train_loss: 2.3343
81:	[1s / 1m:24s],		train_loss: 2.3821
1:	[0s / 0s],		train_loss: 2.7629
26:	[0s / 11s],		train_loss: 2.4361
93:	[0s / 55s],		train_loss: 2.3466
2:	[0s / 1s],		train_loss: 2.6462
27:	[0s / 12s],		train_loss: 2.4669
82:	[0s / 1m:25s],		train_loss: 2.3862
3:	[0s / 1s],		train_loss: 2.6068
94:	[0s / 56s],		train_loss: 2.3524
28:	[0s / 12s],		train_loss: 2.4534
4:	[0s / 2s],		train_loss: 2.5695
29:	[0s / 13s],		train_loss: 2.4520
95:	[0s / 56s],		train_loss: 2.3382
5:	[0s / 2s],		train_loss: 2.5375
83:	[1s / 1m:26s],		train_loss: 2.3726
30:	[0s / 13s],		train_loss: 2.4443
96:	[0s / 57s],		train_loss: 2.3362
6:	[0s / 3s],		train_loss: 2.5339
31:	[0s / 14s],		train_loss: 2.4584
97:	[0s / 57s],		train_loss: 2.3443
7:	[0s / 3s],		train_loss: 2.5178
32:	[0s / 14s],		train_loss: 2.4541
84:	[1s / 1m:27s],		train_loss: 2.3814
33:	[0s / 15s],		train_loss: 2.4463
8:	[0s / 4s],		train_loss: 2.4962
98:	[0s / 58s],		train_loss: 2.3225
34:	[0s / 15s],		train_loss: 2.4341
9:	[0s / 4s],		train_loss: 2.4988
99:	[0s / 59s],		train_loss: 2.3394
85:	[1s / 1m:29s],		train_loss: 2.3731
35:	[0s / 16s],		train_loss: 2.4317
10:	[0s / 5s],		train_loss: 2.4847
36:	[0s / 16s],		train_loss: 2.4323
0:	[0s / 0s],		train_loss: 3.2192
11:	[0s / 5s],		train_loss: 2.4823
86:	[1s / 1m:30s],		train_loss: 2.3775
37:	[0s / 16s],		train_loss: 2.4296
12:	[0s / 6s],		train_loss: 2.4811
1:	[0s / 1s],		train_loss: 2.7803
38:	[0s / 17s],		train_loss: 2.4426
13:	[0s / 6s],		train_loss: 2.4906
2:	[0s / 1s],		train_loss: 2.6737
87:	[0s / 1m:31s],		train_loss: 2.3754
39:	[0s / 17s],		train_loss: 2.4446
14:	[0s / 7s],		train_loss: 2.4825
3:	[0s / 2s],		train_loss: 2.6129
40:	[0s / 18s],		train_loss: 2.4371
15:	[0s / 7s],		train_loss: 2.4778
41:	[0s / 18s],		train_loss: 2.4281
88:	[0s / 1m:31s],		train_loss: 2.3725
4:	[0s / 2s],		train_loss: 2.5772
16:	[0s / 8s],		train_loss: 2.4781
42:	[0s / 19s],		train_loss: 2.4391
17:	[0s / 8s],		train_loss: 2.4706
5:	[0s / 3s],		train_loss: 2.5545
43:	[0s / 19s],		train_loss: 2.4186
89:	[1s / 1m:32s],		train_loss: 2.3630
18:	[0s / 9s],		train_loss: 2.4465
6:	[0s / 4s],		train_loss: 2.5419
44:	[0s / 20s],		train_loss: 2.4346
19:	[0s / 9s],		train_loss: 2.4664
45:	[0s / 20s],		train_loss: 2.4310
7:	[0s / 4s],		train_loss: 2.5328
90:	[0s / 1m:33s],		train_loss: 2.3767
20:	[0s / 9s],		train_loss: 2.4622
46:	[0s / 20s],		train_loss: 2.4291
8:	[0s / 5s],		train_loss: 2.5375
21:	[0s / 10s],		train_loss: 2.4523
47:	[0s / 21s],		train_loss: 2.4366
22:	[0s / 10s],		train_loss: 2.4493
9:	[0s / 5s],		train_loss: 2.4990
48:	[0s / 21s],		train_loss: 2.4352
91:	[1s / 1m:34s],		train_loss: 2.3637
23:	[0s / 11s],		train_loss: 2.4403
49:	[0s / 22s],		train_loss: 2.4298
10:	[0s / 6s],		train_loss: 2.4938
24:	[0s / 11s],		train_loss: 2.4554
50:	[0s / 22s],		train_loss: 2.4329
92:	[1s / 1m:36s],		train_loss: 2.3797
11:	[0s / 7s],		train_loss: 2.4857
51:	[0s / 23s],		train_loss: 2.4288
25:	[0s / 12s],		train_loss: 2.4422
12:	[0s / 7s],		train_loss: 2.4861
52:	[0s / 23s],		train_loss: 2.4248
26:	[0s / 12s],		train_loss: 2.4392
53:	[0s / 23s],		train_loss: 2.4151
13:	[0s / 8s],		train_loss: 2.4863
93:	[1s / 1m:37s],		train_loss: 2.3648
27:	[0s / 13s],		train_loss: 2.4502
54:	[0s / 24s],		train_loss: 2.4055
28:	[0s / 13s],		train_loss: 2.4449
14:	[0s / 8s],		train_loss: 2.4809
55:	[0s / 24s],		train_loss: 2.4016
29:	[0s / 14s],		train_loss: 2.4410
94:	[1s / 1m:38s],		train_loss: 2.3695
15:	[0s / 9s],		train_loss: 2.4778
56:	[0s / 25s],		train_loss: 2.4123
30:	[0s / 14s],		train_loss: 2.4352
16:	[0s / 9s],		train_loss: 2.4693
57:	[0s / 25s],		train_loss: 2.4136
31:	[0s / 15s],		train_loss: 2.4318
95:	[1s / 1m:39s],		train_loss: 2.3632
58:	[0s / 26s],		train_loss: 2.4145
17:	[0s / 10s],		train_loss: 2.4637
32:	[0s / 15s],		train_loss: 2.4306
59:	[0s / 26s],		train_loss: 2.4202
18:	[0s / 11s],		train_loss: 2.4615
33:	[0s / 16s],		train_loss: 2.4362
96:	[0s / 1m:40s],		train_loss: 2.3619
60:	[0s / 27s],		train_loss: 2.4190
34:	[0s / 16s],		train_loss: 2.4325
19:	[0s / 11s],		train_loss: 2.4565
61:	[0s / 27s],		train_loss: 2.4270
35:	[0s / 17s],		train_loss: 2.4150
62:	[0s / 28s],		train_loss: 2.4222
20:	[0s / 12s],		train_loss: 2.4571
97:	[1s / 1m:41s],		train_loss: 2.3640
36:	[0s / 17s],		train_loss: 2.4319
63:	[0s / 28s],		train_loss: 2.4235
21:	[0s / 12s],		train_loss: 2.4597
37:	[0s / 17s],		train_loss: 2.4137
64:	[0s / 28s],		train_loss: 2.4000
98:	[1s / 1m:42s],		train_loss: 2.3670
22:	[0s / 13s],		train_loss: 2.4560
38:	[0s / 18s],		train_loss: 2.4189
65:	[0s / 29s],		train_loss: 2.4180
66:	[0s / 29s],		train_loss: 2.4162
39:	[0s / 18s],		train_loss: 2.4278
23:	[0s / 13s],		train_loss: 2.4443
99:	[1s / 1m:43s],		train_loss: 2.3782
67:	[0s / 30s],		train_loss: 2.3930
40:	[0s / 19s],		train_loss: 2.4202
24:	[0s / 14s],		train_loss: 2.4540
68:	[0s / 30s],		train_loss: 2.3935
41:	[0s / 20s],		train_loss: 2.4056
25:	[0s / 15s],		train_loss: 2.4561
69:	[0s / 31s],		train_loss: 2.3970
42:	[0s / 20s],		train_loss: 2.4009
0:	[1s / 1s],		train_loss: 3.4439
26:	[0s / 15s],		train_loss: 2.4469
70:	[0s / 31s],		train_loss: 2.3942
43:	[0s / 20s],		train_loss: 2.4120
71:	[0s / 32s],		train_loss: 2.3955
27:	[0s / 16s],		train_loss: 2.4480
44:	[0s / 21s],		train_loss: 2.4162
1:	[1s / 2s],		train_loss: 2.7409
72:	[0s / 32s],		train_loss: 2.4193
45:	[0s / 21s],		train_loss: 2.4159
28:	[0s / 16s],		train_loss: 2.4326
73:	[0s / 33s],		train_loss: 2.4112
46:	[0s / 22s],		train_loss: 2.4010
29:	[0s / 17s],		train_loss: 2.4245
2:	[1s / 3s],		train_loss: 2.6664
74:	[0s / 33s],		train_loss: 2.4123
47:	[0s / 22s],		train_loss: 2.4100
75:	[0s / 33s],		train_loss: 2.3944
30:	[0s / 18s],		train_loss: 2.4242
48:	[0s / 23s],		train_loss: 2.4077
76:	[0s / 34s],		train_loss: 2.4036
3:	[1s / 4s],		train_loss: 2.6218
31:	[0s / 18s],		train_loss: 2.4379
49:	[0s / 23s],		train_loss: 2.4177
77:	[0s / 34s],		train_loss: 2.4028
50:	[0s / 24s],		train_loss: 2.3987
32:	[0s / 19s],		train_loss: 2.4279
78:	[0s / 35s],		train_loss: 2.3883
4:	[1s / 5s],		train_loss: 2.5807
51:	[0s / 24s],		train_loss: 2.4017
33:	[0s / 19s],		train_loss: 2.4153
79:	[0s / 35s],		train_loss: 2.4065
52:	[0s / 25s],		train_loss: 2.3984
80:	[0s / 36s],		train_loss: 2.3959
34:	[0s / 20s],		train_loss: 2.4273
53:	[0s / 25s],		train_loss: 2.4029
81:	[0s / 36s],		train_loss: 2.3935
5:	[1s / 6s],		train_loss: 2.5690
35:	[0s / 20s],		train_loss: 2.4295
54:	[0s / 26s],		train_loss: 2.3902
82:	[0s / 36s],		train_loss: 2.3922
36:	[0s / 21s],		train_loss: 2.4216
55:	[0s / 26s],		train_loss: 2.3886
83:	[0s / 37s],		train_loss: 2.3906
6:	[1s / 7s],		train_loss: 2.5436
84:	[0s / 37s],		train_loss: 2.3871
56:	[0s / 27s],		train_loss: 2.3905
37:	[0s / 22s],		train_loss: 2.4172
85:	[0s / 38s],		train_loss: 2.3955
57:	[0s / 27s],		train_loss: 2.3896
38:	[0s / 22s],		train_loss: 2.4160
7:	[1s / 8s],		train_loss: 2.5388
86:	[0s / 38s],		train_loss: 2.3851
58:	[0s / 27s],		train_loss: 2.3968
39:	[0s / 23s],		train_loss: 2.4172
87:	[0s / 39s],		train_loss: 2.4027
59:	[0s / 28s],		train_loss: 2.3823
