[I 2026-06-09 04:14:08,784] Trial 74 finished with value: 0.7848108754471055 and parameters: {'n_estimators': 250, 'max_depth': 4, 'min_samples_split': 7, 'min_samples_leaf': 4, 'max_features': 'log2'}. Best is trial 64 with value: 0.7848108754471055.
[I 2026-06-09 04:17:05,228] Trial 75 finished with value: 0.7848108754471055 and parameters: {'n_estimators': 250, 'max_depth': 4, 'min_samples_split': 7, 'min_samples_leaf': 4, 'max_features': 'log2'}. Best is trial 64 with value: 0.7848108754471055.
[I 2026-06-09 04:21:03,614] Trial 76 finished with value: 0.7848108754471055 and parameters: {'n_estimators': 250, 'max_depth': 4, 'min_samples_split': 7, 'min_samples_leaf': 4, 'max_features': 'log2'}. Best is trial 64 with value: 0.7848108754471055.
[I 2026-06-09 04:24:12,443] Trial 77 finished with value: 0.7806413816500389 and parameters: {'n_estimators': 300, 'max_depth': 4, 'min_samples_split': 5, 'min_samples_leaf': 3, 'max_features': 'log2'}. Best is trial 64 with value: 0.7848108754471055.
[I 2026-06-09 04:27:55,948] Trial 78 finished with value: 0.7835501847058528 and parameters: {'n_estimators': 250, 'max_depth': 4, 'min_samples_split': 7, 'min_samples_leaf': 3, 'max_features': 'log2'}. Best is trial 64 with value: 0.7848108754471055.
[I 2026-06-09 04:31:17,001] Trial 79 finished with value: 0.7826130433325794 and parameters: {'n_estimators': 250, 'max_depth': 4, 'min_samples_split': 5, 'min_samples_leaf': 3, 'max_features': 'log2'}. Best is trial 64 with value: 0.7848108754471055.
[I 2026-06-09 04:35:12,487] Trial 80 finished with value: 0.7835501847058528 and parameters: {'n_estimators': 250, 'max_depth': 4, 'min_samples_split': 7, 'min_samples_leaf': 3, 'max_features': 'log2'}. Best is trial 64 with value: 0.7848108754471055.
[I 2026-06-09 04:38:02,996] Trial 81 finished with value: 0.7835501847058528 and parameters: {'n_estimators': 250, 'max_depth': 4, 'min_samples_split': 7, 'min_samples_leaf': 3, 'max_features': 'log2'}. Best is trial 64 with value: 0.7848108754471055.
[I 2026-06-09 04:41:51,238] Trial 82 finished with value: 0.7835501847058528 and parameters: {'n_estimators': 250, 'max_depth': 4, 'min_samples_split': 7, 'min_samples_leaf': 3, 'max_features': 'log2'}. Best is trial 64 with value: 0.7848108754471055.
[I 2026-06-09 04:42:23,649] Trial 83 finished with value: 0.771604511681284 and parameters: {'n_estimators': 250, 'max_depth': 3, 'min_samples_split': 7, 'min_samples_leaf': 3, 'max_features': 'log2'}. Best is trial 64 with value: 0.7848108754471055.
[I 2026-06-09 04:49:09,027] Trial 85 finished with value: 0.771604511681284 and parameters: {'n_estimators': 250, 'max_depth': 3, 'min_samples_split': 7, 'min_samples_leaf': 3, 'max_features': 'log2'}. Best is trial 64 with value: 0.7848108754471055.
[I 2026-06-09 04:49:13,726] Trial 84 finished with value: 0.7835501847058528 and parameters: {'n_estimators': 250, 'max_depth': 4, 'min_samples_split': 7, 'min_samples_leaf': 3, 'max_features': 'log2'}. Best is trial 64 with value: 0.7848108754471055.
[I 2026-06-09 04:52:48,951] Trial 86 finished with value: 0.771604511681284 and parameters: {'n_estimators': 250, 'max_depth': 3, 'min_samples_split': 7, 'min_samples_leaf': 3, 'max_features': 'log2'}. Best is trial 64 with value: 0.7848108754471055.
[I 2026-06-09 04:56:23,072] Trial 87 finished with value: 0.7835501847058528 and parameters: {'n_estimators': 250, 'max_depth': 4, 'min_samples_split': 7, 'min_samples_leaf': 3, 'max_features': 'log2'}. Best is trial 64 with value: 0.7848108754471055.
[I 2026-06-09 05:03:01,379] Trial 88 finished with value: 0.7848108754471055 and parameters: {'n_estimators': 250, 'max_depth': 4, 'min_samples_split': 7, 'min_samples_leaf': 4, 'max_features': 'log2'}. Best is trial 64 with value: 0.7848108754471055.
[I 2026-06-09 05:03:16,656] Trial 89 finished with value: 0.7848108754471055 and parameters: {'n_estimators': 250, 'max_depth': 4, 'min_samples_split': 7, 'min_samples_leaf': 4, 'max_features': 'log2'}. Best is trial 64 with value: 0.7848108754471055.
[I 2026-06-09 05:06:53,136] Trial 90 finished with value: 0.7848108754471055 and parameters: {'n_estimators': 250, 'max_depth': 4, 'min_samples_split': 7, 'min_samples_leaf': 4, 'max_features': 'log2'}. Best is trial 64 with value: 0.7848108754471055.
[I 2026-06-09 05:10:22,817] Trial 91 finished with value: 0.7848108754471055 and parameters: {'n_estimators': 250, 'max_depth': 4, 'min_samples_split': 5, 'min_samples_leaf': 4, 'max_features': 'log2'}. Best is trial 64 with value: 0.7848108754471055.
[I 2026-06-09 05:14:06,179] Trial 93 finished with value: 0.7828810971778956 and parameters: {'n_estimators': 200, 'max_depth': 4, 'min_samples_split': 5, 'min_samples_leaf': 4, 'max_features': 'log2'}. Best is trial 64 with value: 0.7848108754471055.
[I 2026-06-09 05:16:48,324] Trial 92 finished with value: 0.7848108754471055 and parameters: {'n_estimators': 250, 'max_depth': 4, 'min_samples_split': 5, 'min_samples_leaf': 4, 'max_features': 'log2'}. Best is trial 64 with value: 0.7848108754471055.
[I 2026-06-09 05:20:32,528] Trial 94 finished with value: 0.7848108754471055 and parameters: {'n_estimators': 250, 'max_depth': 4, 'min_samples_split': 8, 'min_samples_leaf': 4, 'max_features': 'log2'}. Best is trial 64 with value: 0.7848108754471055.
[I 2026-06-09 05:21:24,734] Trial 95 finished with value: 0.7828810971778956 and parameters: {'n_estimators': 200, 'max_depth': 4, 'min_samples_split': 5, 'min_samples_leaf': 4, 'max_features': 'log2'}. Best is trial 64 with value: 0.7848108754471055.
[I 2026-06-09 05:27:43,172] Trial 96 finished with value: 0.7848108754471055 and parameters: {'n_estimators': 250, 'max_depth': 4, 'min_samples_split': 5, 'min_samples_leaf': 4, 'max_features': 'log2'}. Best is trial 64 with value: 0.7848108754471055.
[I 2026-06-09 05:29:56,465] Trial 97 finished with value: 0.7848108754471055 and parameters: {'n_estimators': 250, 'max_depth': 4, 'min_samples_split': 6, 'min_samples_leaf': 4, 'max_features': 'log2'}. Best is trial 64 with value: 0.7848108754471055.
[I 2026-06-09 05:30:35,969] Trial 98 finished with value: 0.7686679608641386 and parameters: {'n_estimators': 250, 'max_depth': 3, 'min_samples_split': 6, 'min_samples_leaf': 4, 'max_features': 'log2'}. Best is trial 64 with value: 0.7848108754471055.
