[I 2026-06-07 17:00:13,167] Trial 99 finished with value: 0.7810068144313489 and parameters: {'n_estimators': 250, 'max_depth': 9, 'min_samples_split': 6, 'min_samples_leaf': 15, 'max_features': 'log2'}. Best is trial 69 with value: 0.7810068144313489.

37:	[0s / 15s],		train_loss: 2.4672
31:	[1s / 36s],		train_loss: 2.5308
97:	[0s / 41s],		train_loss: 2.4049
38:	[0s / 15s],		train_loss: 2.4695
53:	[0s / 35s],		train_loss: 2.4382
98:	[0s / 42s],		train_loss: 2.4063
39:	[0s / 16s],		train_loss: 2.4599
99:	[0s / 42s],		train_loss: 2.4019
40:	[0s / 16s],		train_loss: 2.4503
54:	[0s / 35s],		train_loss: 2.4422
32:	[1s / 37s],		train_loss: 2.5354
41:	[0s / 17s],		train_loss: 2.4635
0:	[0s / 0s],		train_loss: 2.9513
55:	[0s / 36s],		train_loss: 2.4414
42:	[0s / 17s],		train_loss: 2.4647
1:	[0s / 0s],		train_loss: 2.6543
33:	[1s / 38s],		train_loss: 2.4992
43:	[0s / 17s],		train_loss: 2.4562
56:	[0s / 37s],		train_loss: 2.4282
2:	[0s / 1s],		train_loss: 2.6307
44:	[0s / 18s],		train_loss: 2.4582
3:	[0s / 1s],		train_loss: 2.6004
57:	[0s / 37s],		train_loss: 2.4400
45:	[0s / 18s],		train_loss: 2.4604
4:	[0s / 2s],		train_loss: 2.6045
34:	[1s / 39s],		train_loss: 2.5118
46:	[0s / 19s],		train_loss: 2.4540
58:	[0s / 38s],		train_loss: 2.4435
5:	[0s / 2s],		train_loss: 2.6116
47:	[0s / 19s],		train_loss: 2.4528
6:	[0s / 2s],		train_loss: 2.5524
59:	[0s / 39s],		train_loss: 2.4351
48:	[0s / 20s],		train_loss: 2.4552
35:	[1s / 40s],		train_loss: 2.5090
7:	[0s / 3s],		train_loss: 2.5557
49:	[0s / 20s],		train_loss: 2.4499
60:	[0s / 39s],		train_loss: 2.4511
8:	[0s / 3s],		train_loss: 2.5639
50:	[0s / 20s],		train_loss: 2.4417
9:	[0s / 4s],		train_loss: 2.5522
36:	[1s / 41s],		train_loss: 2.5045
61:	[0s / 40s],		train_loss: 2.4322
51:	[0s / 21s],		train_loss: 2.4593
10:	[0s / 4s],		train_loss: 2.5658
52:	[0s / 21s],		train_loss: 2.4605
62:	[0s / 41s],		train_loss: 2.4279
11:	[0s / 5s],		train_loss: 2.5264
53:	[0s / 22s],		train_loss: 2.4373
12:	[0s / 5s],		train_loss: 2.5461
37:	[1s / 42s],		train_loss: 2.5081
54:	[0s / 22s],		train_loss: 2.4564
63:	[0s / 41s],		train_loss: 2.4400
13:	[0s / 5s],		train_loss: 2.5341
55:	[0s / 22s],		train_loss: 2.4432
14:	[0s / 6s],		train_loss: 2.5255
64:	[0s / 42s],		train_loss: 2.4341
56:	[0s / 23s],		train_loss: 2.4627
38:	[1s / 44s],		train_loss: 2.5164
15:	[0s / 6s],		train_loss: 2.5255
57:	[0s / 23s],		train_loss: 2.4470
65:	[0s / 43s],		train_loss: 2.4269
16:	[0s / 7s],		train_loss: 2.5432
58:	[0s / 24s],		train_loss: 2.4530
17:	[0s / 7s],		train_loss: 2.5232
66:	[0s / 43s],		train_loss: 2.4371
59:	[0s / 24s],		train_loss: 2.4417
39:	[1s / 45s],		train_loss: 2.4997
18:	[0s / 8s],		train_loss: 2.5249
60:	[0s / 24s],		train_loss: 2.4398
67:	[0s / 44s],		train_loss: 2.4422
19:	[0s / 8s],		train_loss: 2.5116
61:	[0s / 25s],		train_loss: 2.4368
20:	[0s / 8s],		train_loss: 2.5121
62:	[0s / 25s],		train_loss: 2.4269
68:	[0s / 45s],		train_loss: 2.4525
40:	[1s / 46s],		train_loss: 2.4972
21:	[0s / 9s],		train_loss: 2.5246
63:	[0s / 26s],		train_loss: 2.4343
69:	[0s / 45s],		train_loss: 2.4455
22:	[0s / 9s],		train_loss: 2.5173
64:	[0s / 26s],		train_loss: 2.4516
23:	[0s / 10s],		train_loss: 2.5001
65:	[0s / 26s],		train_loss: 2.4201
41:	[1s / 47s],		train_loss: 2.4930
70:	[0s / 46s],		train_loss: 2.4127
66:	[0s / 27s],		train_loss: 2.4305
24:	[0s / 10s],		train_loss: 2.5228
67:	[0s / 27s],		train_loss: 2.4079
25:	[0s / 10s],		train_loss: 2.4993
71:	[0s / 47s],		train_loss: 2.4327
42:	[1s / 48s],		train_loss: 2.5012
68:	[0s / 28s],		train_loss: 2.4253
26:	[0s / 11s],		train_loss: 2.5039
72:	[0s / 47s],		train_loss: 2.4260
69:	[0s / 28s],		train_loss: 2.4419
27:	[0s / 11s],		train_loss: 2.4999
70:	[0s / 29s],		train_loss: 2.4273
28:	[0s / 12s],		train_loss: 2.5093
73:	[0s / 48s],		train_loss: 2.4266
43:	[1s / 49s],		train_loss: 2.5073
71:	[0s / 29s],		train_loss: 2.4298
29:	[0s / 12s],		train_loss: 2.5062
72:	[0s / 29s],		train_loss: 2.4170
74:	[0s / 49s],		train_loss: 2.4275
30:	[0s / 13s],		train_loss: 2.4924
73:	[0s / 30s],		train_loss: 2.4189
31:	[0s / 13s],		train_loss: 2.4824
44:	[1s / 50s],		train_loss: 2.4910
75:	[0s / 49s],		train_loss: 2.4256
74:	[0s / 30s],		train_loss: 2.4182
32:	[0s / 13s],		train_loss: 2.4878
75:	[0s / 31s],		train_loss: 2.4253
33:	[0s / 14s],		train_loss: 2.4857
76:	[0s / 50s],		train_loss: 2.3982
76:	[0s / 31s],		train_loss: 2.4256
34:	[0s / 14s],		train_loss: 2.4966
45:	[1s / 52s],		train_loss: 2.4851
77:	[0s / 31s],		train_loss: 2.4260
77:	[0s / 51s],		train_loss: 2.4081
35:	[0s / 15s],		train_loss: 2.4988
78:	[0s / 32s],		train_loss: 2.4447
36:	[0s / 15s],		train_loss: 2.4984
78:	[0s / 51s],		train_loss: 2.4176
79:	[0s / 32s],		train_loss: 2.4176
46:	[1s / 53s],		train_loss: 2.4919
37:	[0s / 15s],		train_loss: 2.4926
80:	[0s / 33s],		train_loss: 2.4211
79:	[0s / 52s],		train_loss: 2.4113
38:	[0s / 16s],		train_loss: 2.4967
81:	[0s / 33s],		train_loss: 2.4136
39:	[0s / 16s],		train_loss: 2.5174
47:	[1s / 54s],		train_loss: 2.4842
80:	[0s / 53s],		train_loss: 2.4240
82:	[0s / 33s],		train_loss: 2.4160
40:	[0s / 17s],		train_loss: 2.4838
83:	[0s / 34s],		train_loss: 2.4202
41:	[0s / 17s],		train_loss: 2.4891
81:	[0s / 53s],		train_loss: 2.4162
84:	[0s / 34s],		train_loss: 2.4377
42:	[0s / 18s],		train_loss: 2.4925
48:	[1s / 55s],		train_loss: 2.4915
85:	[0s / 35s],		train_loss: 2.4154
82:	[0s / 54s],		train_loss: 2.4354
43:	[0s / 18s],		train_loss: 2.4886
86:	[0s / 35s],		train_loss: 2.4116
83:	[0s / 54s],		train_loss: 2.4333
44:	[0s / 18s],		train_loss: 2.4747
87:	[0s / 35s],		train_loss: 2.4117
49:	[1s / 56s],		train_loss: 2.5039
45:	[0s / 19s],		train_loss: 2.4845
88:	[0s / 36s],		train_loss: 2.4144
84:	[0s / 55s],		train_loss: 2.4268
46:	[0s / 19s],		train_loss: 2.4844
89:	[0s / 36s],		train_loss: 2.4175
85:	[0s / 56s],		train_loss: 2.4218
47:	[0s / 20s],		train_loss: 2.4918
90:	[0s / 37s],		train_loss: 2.4015
50:	[1s / 57s],		train_loss: 2.4971
48:	[0s / 20s],		train_loss: 2.4588
91:	[0s / 37s],		train_loss: 2.4237
86:	[0s / 56s],		train_loss: 2.4071
92:	[0s / 37s],		train_loss: 2.4161
49:	[0s / 21s],		train_loss: 2.4976
87:	[0s / 57s],		train_loss: 2.4135
93:	[0s / 38s],		train_loss: 2.4002
50:	[0s / 21s],		train_loss: 2.4845
51:	[1s / 58s],		train_loss: 2.4950
94:	[0s / 38s],		train_loss: 2.4000
51:	[0s / 21s],		train_loss: 2.4732
88:	[0s / 58s],		train_loss: 2.4176
95:	[0s / 39s],		train_loss: 2.4197
52:	[0s / 22s],		train_loss: 2.4704
52:	[1s / 59s],		train_loss: 2.5038
96:	[0s / 39s],		train_loss: 2.4288
53:	[0s / 22s],		train_loss: 2.4627
89:	[0s / 58s],		train_loss: 2.4079
97:	[0s / 39s],		train_loss: 2.4092
54:	[0s / 23s],		train_loss: 2.4673
90:	[0s / 59s],		train_loss: 2.4196
98:	[0s / 40s],		train_loss: 2.4143
55:	[0s / 23s],		train_loss: 2.4765
53:	[1s / 1m:1s],		train_loss: 2.4893
99:	[0s / 40s],		train_loss: 2.4005
56:	[0s / 24s],		train_loss: 2.4754
91:	[0s / 1m:0s],		train_loss: 2.4271
0:	[0s / 0s],		train_loss: 2.9327
57:	[0s / 24s],		train_loss: 2.4684
92:	[0s / 1m:0s],		train_loss: 2.4158
54:	[1s / 1m:2s],		train_loss: 2.5141
1:	[0s / 0s],		train_loss: 2.6486
58:	[0s / 24s],		train_loss: 2.4683
2:	[0s / 1s],		train_loss: 2.6165
59:	[0s / 25s],		train_loss: 2.4641
93:	[0s / 1m:1s],		train_loss: 2.3998
3:	[0s / 1s],		train_loss: 2.5873
60:	[0s / 25s],		train_loss: 2.4791
55:	[1s / 1m:3s],		train_loss: 2.4866
4:	[0s / 2s],		train_loss: 2.5522
94:	[0s / 1m:2s],		train_loss: 2.4290
61:	[0s / 26s],		train_loss: 2.4599
5:	[0s / 2s],		train_loss: 2.5541
62:	[0s / 26s],		train_loss: 2.4946
95:	[0s / 1m:2s],		train_loss: 2.4082
6:	[0s / 2s],		train_loss: 2.5666
56:	[1s / 1m:4s],		train_loss: 2.5090
63:	[0s / 27s],		train_loss: 2.4855
7:	[0s / 3s],		train_loss: 2.5582
96:	[0s / 1m:3s],		train_loss: 2.4118
64:	[0s / 27s],		train_loss: 2.4627
8:	[0s / 3s],		train_loss: 2.5530
65:	[0s / 27s],		train_loss: 2.4881
97:	[0s / 1m:4s],		train_loss: 2.4097
57:	[1s / 1m:5s],		train_loss: 2.4884
9:	[0s / 4s],		train_loss: 2.5348
66:	[0s / 28s],		train_loss: 2.4717
10:	[0s / 4s],		train_loss: 2.5301
98:	[0s / 1m:4s],		train_loss: 2.4090
67:	[0s / 28s],		train_loss: 2.4634
11:	[0s / 4s],		train_loss: 2.5394
68:	[0s / 29s],		train_loss: 2.4575
58:	[1s / 1m:6s],		train_loss: 2.5132
99:	[0s / 1m:5s],		train_loss: 2.4078
12:	[0s / 5s],		train_loss: 2.5248
69:	[0s / 29s],		train_loss: 2.4761
13:	[0s / 5s],		train_loss: 2.5215
0:	[0s / 0s],		train_loss: 3.0985
70:	[0s / 30s],		train_loss: 2.4601
14:	[0s / 6s],		train_loss: 2.5221
59:	[1s / 1m:7s],		train_loss: 2.5051
71:	[0s / 30s],		train_loss: 2.4809
15:	[0s / 6s],		train_loss: 2.5314
1:	[0s / 1s],		train_loss: 2.6752
72:	[0s / 30s],		train_loss: 2.4627
16:	[0s / 7s],		train_loss: 2.5799
73:	[0s / 31s],		train_loss: 2.4529
2:	[0s / 1s],		train_loss: 2.6301
17:	[0s / 7s],		train_loss: 2.5380
60:	[1s / 1m:8s],		train_loss: 2.4878
74:	[0s / 31s],		train_loss: 2.4738
18:	[0s / 7s],		train_loss: 2.5336
3:	[0s / 2s],		train_loss: 2.6079
75:	[0s / 32s],		train_loss: 2.4617
19:	[0s / 8s],		train_loss: 2.5148
76:	[0s / 32s],		train_loss: 2.4722
20:	[0s / 8s],		train_loss: 2.5273
61:	[1s / 1m:10s],		train_loss: 2.5012
4:	[0s / 3s],		train_loss: 2.5876
77:	[0s / 33s],		train_loss: 2.4766
21:	[0s / 9s],		train_loss: 2.5131
5:	[0s / 3s],		train_loss: 2.5661
78:	[0s / 33s],		train_loss: 2.4795
22:	[0s / 9s],		train_loss: 2.5175
62:	[1s / 1m:11s],		train_loss: 2.4967
23:	[0s / 9s],		train_loss: 2.5302
79:	[0s / 33s],		train_loss: 2.4416
6:	[0s / 4s],		train_loss: 2.5355
24:	[0s / 10s],		train_loss: 2.5351
80:	[0s / 34s],		train_loss: 2.4700
7:	[0s / 5s],		train_loss: 2.5486
25:	[0s / 10s],		train_loss: 2.5254
81:	[0s / 34s],		train_loss: 2.4739
63:	[1s / 1m:12s],		train_loss: 2.4879
26:	[0s / 11s],		train_loss: 2.5056
82:	[0s / 35s],		train_loss: 2.4788
8:	[0s / 5s],		train_loss: 2.5322
27:	[0s / 11s],		train_loss: 2.4932
83:	[0s / 35s],		train_loss: 2.4673
9:	[0s / 6s],		train_loss: 2.5310
28:	[0s / 11s],		train_loss: 2.5242
64:	[1s / 1m:13s],		train_loss: 2.4906
84:	[0s / 36s],		train_loss: 2.4663
29:	[0s / 12s],		train_loss: 2.5254
85:	[0s / 36s],		train_loss: 2.4678
10:	[0s / 7s],		train_loss: 2.5347
30:	[0s / 12s],		train_loss: 2.5063
86:	[0s / 36s],		train_loss: 2.4626
31:	[0s / 13s],		train_loss: 2.5062
65:	[1s / 1m:14s],		train_loss: 2.4929
11:	[0s / 7s],		train_loss: 2.5135
87:	[0s / 37s],		train_loss: 2.4541
32:	[0s / 13s],		train_loss: 2.5036
88:	[0s / 37s],		train_loss: 2.4601
12:	[0s / 8s],		train_loss: 2.5113
33:	[0s / 13s],		train_loss: 2.5084
89:	[0s / 38s],		train_loss: 2.4658
66:	[1s / 1m:15s],		train_loss: 2.4849
34:	[0s / 14s],		train_loss: 2.4774
13:	[0s / 8s],		train_loss: 2.5246
90:	[0s / 38s],		train_loss: 2.4754
35:	[0s / 14s],		train_loss: 2.4912
91:	[0s / 38s],		train_loss: 2.4412
14:	[0s / 9s],		train_loss: 2.5053
36:	[0s / 15s],		train_loss: 2.4988
92:	[0s / 39s],		train_loss: 2.4474
67:	[1s / 1m:16s],		train_loss: 2.4859
37:	[0s / 15s],		train_loss: 2.4967
15:	[0s / 10s],		train_loss: 2.5039
93:	[0s / 39s],		train_loss: 2.4498
38:	[0s / 15s],		train_loss: 2.5233
94:	[0s / 40s],		train_loss: 2.4571
16:	[0s / 10s],		train_loss: 2.5043
39:	[0s / 16s],		train_loss: 2.5042
68:	[1s / 1m:18s],		train_loss: 2.5062
95:	[0s / 40s],		train_loss: 2.4601
40:	[0s / 16s],		train_loss: 2.4743
17:	[0s / 11s],		train_loss: 2.5117
96:	[0s / 41s],		train_loss: 2.4468
41:	[0s / 17s],		train_loss: 2.4949
97:	[0s / 41s],		train_loss: 2.4476
42:	[0s / 17s],		train_loss: 2.4952
18:	[0s / 12s],		train_loss: 2.4957
69:	[1s / 1m:19s],		train_loss: 2.4791
98:	[0s / 41s],		train_loss: 2.4599
43:	[0s / 17s],		train_loss: 2.4958
19:	[0s / 12s],		train_loss: 2.4923
99:	[0s / 42s],		train_loss: 2.4531
44:	[0s / 18s],		train_loss: 2.4887
45:	[0s / 18s],		train_loss: 2.4913
0:	[0s / 0s],		train_loss: 3.1519
70:	[1s / 1m:20s],		train_loss: 2.5198
20:	[0s / 13s],		train_loss: 2.4895
46:	[0s / 19s],		train_loss: 2.4716
1:	[0s / 0s],		train_loss: 2.6810
21:	[0s / 14s],		train_loss: 2.5141
47:	[0s / 19s],		train_loss: 2.5018
2:	[0s / 1s],		train_loss: 2.6154
48:	[0s / 20s],		train_loss: 2.4941
71:	[1s / 1m:21s],		train_loss: 2.4774
3:	[0s / 1s],		train_loss: 2.5880
22:	[0s / 14s],		train_loss: 2.5024
49:	[0s / 20s],		train_loss: 2.4935
4:	[0s / 2s],		train_loss: 2.5796
50:	[0s / 20s],		train_loss: 2.4832
23:	[0s / 15s],		train_loss: 2.4944
5:	[0s / 2s],		train_loss: 2.5549
72:	[1s / 1m:22s],		train_loss: 2.4979
51:	[0s / 21s],		train_loss: 2.5035
6:	[0s / 2s],		train_loss: 2.5409
24:	[0s / 16s],		train_loss: 2.4910
52:	[0s / 21s],		train_loss: 2.4929
7:	[0s / 3s],		train_loss: 2.5282
53:	[0s / 22s],		train_loss: 2.4940
25:	[0s / 16s],		train_loss: 2.4920
8:	[0s / 3s],		train_loss: 2.5478
73:	[1s / 1m:23s],		train_loss: 2.5046
54:	[0s / 22s],		train_loss: 2.4757
9:	[0s / 4s],		train_loss: 2.5222
26:	[0s / 17s],		train_loss: 2.4898
55:	[0s / 22s],		train_loss: 2.4785
10:	[0s / 4s],		train_loss: 2.5179
56:	[0s / 23s],		train_loss: 2.4754
74:	[1s / 1m:24s],		train_loss: 2.5121
11:	[0s / 5s],		train_loss: 2.5123
27:	[0s / 18s],		train_loss: 2.4768
57:	[0s / 23s],		train_loss: 2.4749
12:	[0s / 5s],		train_loss: 2.5324
58:	[0s / 24s],		train_loss: 2.5009
28:	[0s / 18s],		train_loss: 2.4810
13:	[0s / 5s],		train_loss: 2.5203
59:	[0s / 24s],		train_loss: 2.4869
75:	[1s / 1m:26s],		train_loss: 2.4892
29:	[0s / 19s],		train_loss: 2.4799
14:	[0s / 6s],		train_loss: 2.5195
60:	[0s / 24s],		train_loss: 2.4722
15:	[0s / 6s],		train_loss: 2.5210
61:	[0s / 25s],		train_loss: 2.4735
30:	[0s / 19s],		train_loss: 2.4842
16:	[0s / 7s],		train_loss: 2.5061
62:	[0s / 25s],		train_loss: 2.4758
76:	[1s / 1m:27s],		train_loss: 2.4970
17:	[0s / 7s],		train_loss: 2.5120
31:	[0s / 20s],		train_loss: 2.4839
63:	[0s / 26s],		train_loss: 2.5027
18:	[0s / 7s],		train_loss: 2.5033
64:	[0s / 26s],		train_loss: 2.4773
32:	[0s / 21s],		train_loss: 2.4776
77:	[1s / 1m:28s],		train_loss: 2.4829
19:	[0s / 8s],		train_loss: 2.5150
65:	[0s / 26s],		train_loss: 2.4611
20:	[0s / 8s],		train_loss: 2.5051
66:	[0s / 27s],		train_loss: 2.4781
33:	[0s / 21s],		train_loss: 2.4750
21:	[0s / 9s],		train_loss: 2.4923
67:	[0s / 27s],		train_loss: 2.4752
34:	[0s / 22s],		train_loss: 2.4683
78:	[1s / 1m:29s],		train_loss: 2.4647
22:	[0s / 9s],		train_loss: 2.4921
68:	[0s / 28s],		train_loss: 2.4696
23:	[0s / 10s],		train_loss: 2.4858
69:	[0s / 28s],		train_loss: 2.4795
35:	[0s / 23s],		train_loss: 2.4679
70:	[0s / 28s],		train_loss: 2.4754
24:	[0s / 10s],		train_loss: 2.4897
79:	[1s / 1m:30s],		train_loss: 2.4677
71:	[0s / 29s],		train_loss: 2.4697
25:	[0s / 10s],		train_loss: 2.4689
36:	[0s / 23s],		train_loss: 2.4773
72:	[0s / 29s],		train_loss: 2.4901
26:	[0s / 11s],		train_loss: 2.4738
37:	[0s / 24s],		train_loss: 2.4727
73:	[0s / 30s],		train_loss: 2.4785
27:	[0s / 11s],		train_loss: 2.4816
80:	[1s / 1m:31s],		train_loss: 2.4882
74:	[0s / 30s],		train_loss: 2.4854
28:	[0s / 12s],		train_loss: 2.4815
38:	[0s / 25s],		train_loss: 2.4641
75:	[0s / 30s],		train_loss: 2.4818
29:	[0s / 12s],		train_loss: 2.4841
39:	[0s / 25s],		train_loss: 2.4620
76:	[0s / 31s],		train_loss: 2.4815
81:	[1s / 1m:32s],		train_loss: 2.5030
30:	[0s / 12s],		train_loss: 2.4797
77:	[0s / 31s],		train_loss: 2.4575
31:	[0s / 13s],		train_loss: 2.4743
40:	[0s / 26s],		train_loss: 2.4697
78:	[0s / 32s],		train_loss: 2.4901
32:	[0s / 13s],		train_loss: 2.4911
82:	[1s / 1m:33s],		train_loss: 2.4746
79:	[0s / 32s],		train_loss: 2.4830
41:	[0s / 27s],		train_loss: 2.4466
33:	[0s / 14s],		train_loss: 2.4750
80:	[0s / 32s],		train_loss: 2.4626
34:	[0s / 14s],		train_loss: 2.4579
42:	[0s / 28s],		train_loss: 2.4546
81:	[0s / 33s],		train_loss: 2.4785
83:	[1s / 1m:35s],		train_loss: 2.4904
35:	[0s / 15s],		train_loss: 2.4785
82:	[0s / 34s],		train_loss: 2.4798
43:	[0s / 28s],		train_loss: 2.4530
36:	[0s / 15s],		train_loss: 2.4698
83:	[0s / 34s],		train_loss: 2.4622
37:	[0s / 16s],		train_loss: 2.4698
44:	[0s / 29s],		train_loss: 2.4596
84:	[0s / 34s],		train_loss: 2.4737
84:	[1s / 1m:36s],		train_loss: 2.5017
38:	[0s / 16s],		train_loss: 2.4752
85:	[0s / 35s],		train_loss: 2.4608
45:	[0s / 30s],		train_loss: 2.4482
39:	[0s / 17s],		train_loss: 2.4740
86:	[0s / 35s],		train_loss: 2.4589
40:	[0s / 17s],		train_loss: 2.4629
87:	[0s / 36s],		train_loss: 2.4767
85:	[1s / 1m:37s],		train_loss: 2.5026
46:	[0s / 30s],		train_loss: 2.4499
41:	[0s / 17s],		train_loss: 2.4722
88:	[0s / 36s],		train_loss: 2.4724
42:	[0s / 18s],		train_loss: 2.4657
47:	[0s / 31s],		train_loss: 2.4631
89:	[0s / 36s],		train_loss: 2.4748
86:	[1s / 1m:38s],		train_loss: 2.4764
43:	[0s / 18s],		train_loss: 2.4418
90:	[0s / 37s],		train_loss: 2.4523
48:	[0s / 32s],		train_loss: 2.4489
44:	[0s / 19s],		train_loss: 2.4703
91:	[0s / 37s],		train_loss: 2.4654
45:	[0s / 19s],		train_loss: 2.4633
92:	[0s / 38s],		train_loss: 2.4823
49:	[0s / 32s],		train_loss: 2.4540
87:	[1s / 1m:39s],		train_loss: 2.4832
46:	[0s / 20s],		train_loss: 2.4676
93:	[0s / 38s],		train_loss: 2.4542
50:	[0s / 33s],		train_loss: 2.4407
47:	[0s / 20s],		train_loss: 2.4574
94:	[0s / 38s],		train_loss: 2.4532
95:	[0s / 39s],		train_loss: 2.4574
48:	[0s / 20s],		train_loss: 2.4629
88:	[1s / 1m:40s],		train_loss: 2.4850
51:	[0s / 34s],		train_loss: 2.4538
96:	[0s / 39s],		train_loss: 2.4823
49:	[0s / 21s],		train_loss: 2.4485
97:	[0s / 40s],		train_loss: 2.4718
52:	[0s / 34s],		train_loss: 2.4482
50:	[0s / 21s],		train_loss: 2.4461
89:	[1s / 1m:41s],		train_loss: 2.4714
98:	[0s / 40s],		train_loss: 2.4795
51:	[0s / 22s],		train_loss: 2.4471
53:	[0s / 35s],		train_loss: 2.4437
99:	[0s / 40s],		train_loss: 2.4629
52:	[0s / 22s],		train_loss: 2.4696
54:	[0s / 35s],		train_loss: 2.4486
90:	[0s / 1m:42s],		train_loss: 2.4608
53:	[0s / 22s],		train_loss: 2.4536
55:	[0s / 36s],		train_loss: 2.4589
54:	[0s / 23s],		train_loss: 2.4530
91:	[0s / 1m:43s],		train_loss: 2.4843
56:	[0s / 36s],		train_loss: 2.4526
55:	[0s / 23s],		train_loss: 2.4476
92:	[0s / 1m:43s],		train_loss: 2.4921
57:	[0s / 36s],		train_loss: 2.4558
56:	[0s / 24s],		train_loss: 2.4476
58:	[0s / 37s],		train_loss: 2.4359
57:	[0s / 24s],		train_loss: 2.4485
93:	[0s / 1m:44s],		train_loss: 2.4953
59:	[0s / 37s],		train_loss: 2.4188
58:	[0s / 24s],		train_loss: 2.4441
60:	[0s / 38s],		train_loss: 2.4459
94:	[0s / 1m:45s],		train_loss: 2.4812
59:	[0s / 25s],		train_loss: 2.4542
61:	[0s / 38s],		train_loss: 2.4516
60:	[0s / 25s],		train_loss: 2.4536
95:	[0s / 1m:45s],		train_loss: 2.4785
62:	[0s / 38s],		train_loss: 2.4339
61:	[0s / 25s],		train_loss: 2.4490
63:	[0s / 39s],		train_loss: 2.4285
62:	[0s / 26s],		train_loss: 2.4460
96:	[0s / 1m:46s],		train_loss: 2.4792
64:	[0s / 39s],		train_loss: 2.4454
63:	[0s / 26s],		train_loss: 2.4421
97:	[0s / 1m:46s],		train_loss: 2.4778
65:	[0s / 39s],		train_loss: 2.4315
64:	[0s / 26s],		train_loss: 2.4265
66:	[0s / 40s],		train_loss: 2.4302
65:	[0s / 27s],		train_loss: 2.4381
98:	[0s / 1m:47s],		train_loss: 2.4697
67:	[0s / 40s],		train_loss: 2.4290
66:	[0s / 27s],		train_loss: 2.4401
68:	[0s / 40s],		train_loss: 2.4249
67:	[0s / 27s],		train_loss: 2.4304
99:	[0s / 1m:47s],		train_loss: 2.4764
69:	[0s / 41s],		train_loss: 2.4243
68:	[0s / 28s],		train_loss: 2.4429
70:	[0s / 41s],		train_loss: 2.4398
69:	[0s / 28s],		train_loss: 2.4406
71:	[0s / 41s],		train_loss: 2.4275
70:	[0s / 28s],		train_loss: 2.4479
72:	[0s / 42s],		train_loss: 2.4178
71:	[0s / 29s],		train_loss: 2.4378
73:	[0s / 42s],		train_loss: 2.4260
72:	[0s / 29s],		train_loss: 2.4518
74:	[0s / 42s],		train_loss: 2.4295
73:	[0s / 29s],		train_loss: 2.4463
75:	[0s / 42s],		train_loss: 2.4125
74:	[0s / 29s],		train_loss: 2.4278
76:	[0s / 43s],		train_loss: 2.4286
75:	[0s / 30s],		train_loss: 2.4419
77:	[0s / 43s],		train_loss: 2.4370
76:	[0s / 30s],		train_loss: 2.4349
78:	[0s / 43s],		train_loss: 2.4095
77:	[0s / 30s],		train_loss: 2.4332
79:	[0s / 44s],		train_loss: 2.4182
78:	[0s / 31s],		train_loss: 2.4377
80:	[0s / 44s],		train_loss: 2.4166
79:	[0s / 31s],		train_loss: 2.4473
80:	[0s / 31s],		train_loss: 2.4157
81:	[0s / 44s],		train_loss: 2.4137
81:	[0s / 31s],		train_loss: 2.4319
82:	[0s / 44s],		train_loss: 2.4439
82:	[0s / 32s],		train_loss: 2.4292
83:	[0s / 45s],		train_loss: 2.4059
83:	[0s / 32s],		train_loss: 2.4354
84:	[0s / 45s],		train_loss: 2.4241
84:	[0s / 32s],		train_loss: 2.4277
85:	[0s / 45s],		train_loss: 2.4172
85:	[0s / 32s],		train_loss: 2.4313
86:	[0s / 46s],		train_loss: 2.4226
86:	[0s / 33s],		train_loss: 2.4331
87:	[0s / 46s],		train_loss: 2.4145
87:	[0s / 33s],		train_loss: 2.4092
88:	[0s / 46s],		train_loss: 2.4032
88:	[0s / 33s],		train_loss: 2.4289
89:	[0s / 46s],		train_loss: 2.4101
89:	[0s / 34s],		train_loss: 2.4206
90:	[0s / 47s],		train_loss: 2.4140
90:	[0s / 34s],		train_loss: 2.4222
91:	[0s / 47s],		train_loss: 2.4096
91:	[0s / 34s],		train_loss: 2.4193
92:	[0s / 47s],		train_loss: 2.4072
92:	[0s / 34s],		train_loss: 2.4048
93:	[0s / 47s],		train_loss: 2.4078
93:	[0s / 35s],		train_loss: 2.4114
94:	[0s / 48s],		train_loss: 2.3914
94:	[0s / 35s],		train_loss: 2.4113
95:	[0s / 48s],		train_loss: 2.4196
95:	[0s / 35s],		train_loss: 2.4060
96:	[0s / 48s],		train_loss: 2.4225
96:	[0s / 36s],		train_loss: 2.4287
97:	[0s / 49s],		train_loss: 2.4054
97:	[0s / 36s],		train_loss: 2.4141
98:	[0s / 49s],		train_loss: 2.4135
98:	[0s / 36s],		train_loss: 2.4194
99:	[0s / 49s],		train_loss: 2.4078
99:	[0s / 36s],		train_loss: 2.3926
Best parameters: {'num_nodes': [64], 'dropout': 0.25108711766318015, 'learning_rate': 0.0017683309923216726, 'batch_norm': False}
  [ckpt] Params saved → checkpoints/tabicl/HURRAH/NaN/seed77/fold5/tabicl_deepsurv_tuned_params.json
0:	[0s / 0s],		train_loss: 2.1510,	val_loss: 7.3480
1:	[0s / 0s],		train_loss: 1.9564,	val_loss: 7.6131
2:	[0s / 0s],		train_loss: 1.9292,	val_loss: 7.4786
3:	[0s / 1s],		train_loss: 1.9398,	val_loss: 7.6109
4:	[0s / 1s],		train_loss: 1.9180,	val_loss: 7.7884
5:	[0s / 1s],		train_loss: 1.9055,	val_loss: 7.8737
6:	[0s / 2s],		train_loss: 1.9048,	val_loss: 8.1319
7:	[0s / 2s],		train_loss: 1.8978,	val_loss: 7.9347
8:	[0s / 2s],		train_loss: 1.8935,	val_loss: 8.0944
9:	[0s / 3s],		train_loss: 1.8983,	val_loss: 8.1412
10:	[0s / 3s],		t