[I 2026-06-06 19:46:45,779] Trial 52 finished with value: 0.7566332855862421 and parameters: {'n_estimators': 250, 'max_depth': 6, 'min_samples_split': 20, 'min_samples_leaf': 13, 'max_features': 'sqrt'}. Best is trial 45 with value: 0.7782163320181942.
[I 2026-06-06 19:59:12,992] Trial 53 finished with value: 0.7628398838991782 and parameters: {'n_estimators': 300, 'max_depth': 7, 'min_samples_split': 20, 'min_samples_leaf': 12, 'max_features': 'sqrt'}. Best is trial 45 with value: 0.7782163320181942.
[I 2026-06-06 20:07:54,222] Trial 56 finished with value: 0.7628671081178432 and parameters: {'n_estimators': 250, 'max_depth': 6, 'min_samples_split': 14, 'min_samples_leaf': 15, 'max_features': 'sqrt'}. Best is trial 45 with value: 0.7782163320181942.
[I 2026-06-06 20:08:55,630] Trial 58 finished with value: 0.7795717839821074 and parameters: {'n_estimators': 300, 'max_depth': 7, 'min_samples_split': 17, 'min_samples_leaf': 15, 'max_features': 'log2'}. Best is trial 58 with value: 0.7795717839821074.
[I 2026-06-06 20:20:39,094] Trial 59 finished with value: 0.7795717839821074 and parameters: {'n_estimators': 300, 'max_depth': 7, 'min_samples_split': 17, 'min_samples_leaf': 15, 'max_features': 'log2'}. Best is trial 58 with value: 0.7795717839821074.
[I 2026-06-06 20:30:07,536] Trial 60 finished with value: 0.7795717839821074 and parameters: {'n_estimators': 300, 'max_depth': 7, 'min_samples_split': 17, 'min_samples_leaf': 15, 'max_features': 'log2'}. Best is trial 58 with value: 0.7795717839821074.
[I 2026-06-06 20:31:20,999] Trial 57 finished with value: 0.7667109583762638 and parameters: {'n_estimators': 300, 'max_depth': 7, 'min_samples_split': 20, 'min_samples_leaf': 13, 'max_features': 'sqrt'}. Best is trial 58 with value: 0.7795717839821074.
[I 2026-06-06 20:31:23,494] Trial 61 finished with value: 0.7740808684944588 and parameters: {'n_estimators': 300, 'max_depth': 7, 'min_samples_split': 17, 'min_samples_leaf': 13, 'max_features': 'log2'}. Best is trial 58 with value: 0.7795717839821074.
[I 2026-06-06 20:42:41,595] Trial 62 finished with value: 0.7740808684944588 and parameters: {'n_estimators': 300, 'max_depth': 7, 'min_samples_split': 17, 'min_samples_leaf': 13, 'max_features': 'log2'}. Best is trial 58 with value: 0.7795717839821074.
[I 2026-06-06 20:52:30,117] Trial 63 finished with value: 0.7740808684944588 and parameters: {'n_estimators': 300, 'max_depth': 7, 'min_samples_split': 19, 'min_samples_leaf': 13, 'max_features': 'log2'}. Best is trial 58 with value: 0.7795717839821074.
[I 2026-06-06 20:53:30,815] Trial 64 finished with value: 0.7795717839821074 and parameters: {'n_estimators': 300, 'max_depth': 7, 'min_samples_split': 17, 'min_samples_leaf': 15, 'max_features': 'log2'}. Best is trial 58 with value: 0.7795717839821074.
[I 2026-06-06 20:53:33,723] Trial 65 finished with value: 0.7795717839821074 and parameters: {'n_estimators': 300, 'max_depth': 7, 'min_samples_split': 19, 'min_samples_leaf': 15, 'max_features': 'log2'}. Best is trial 58 with value: 0.7795717839821074.
[I 2026-06-06 21:04:08,639] Trial 66 finished with value: 0.7795717839821074 and parameters: {'n_estimators': 300, 'max_depth': 7, 'min_samples_split': 17, 'min_samples_leaf': 15, 'max_features': 'log2'}. Best is trial 58 with value: 0.7795717839821074.
[I 2026-06-06 21:15:33,149] Trial 67 finished with value: 0.7718196877172702 and parameters: {'n_estimators': 300, 'max_depth': 8, 'min_samples_split': 19, 'min_samples_leaf': 15, 'max_features': 'log2'}. Best is trial 58 with value: 0.7795717839821074.
[I 2026-06-06 21:16:40,439] Trial 68 finished with value: 0.7718196877172702 and parameters: {'n_estimators': 300, 'max_depth': 8, 'min_samples_split': 19, 'min_samples_leaf': 15, 'max_features': 'log2'}. Best is trial 58 with value: 0.7795717839821074.
[I 2026-06-06 21:16:52,168] Trial 69 finished with value: 0.7741892418264519 and parameters: {'n_estimators': 300, 'max_depth': 8, 'min_samples_split': 19, 'min_samples_leaf': 14, 'max_features': 'log2'}. Best is trial 58 with value: 0.7795717839821074.
[I 2026-06-06 21:26:52,781] Trial 70 finished with value: 0.7741892418264519 and parameters: {'n_estimators': 300, 'max_depth': 8, 'min_samples_split': 19, 'min_samples_leaf': 14, 'max_features': 'log2'}. Best is trial 58 with value: 0.7795717839821074.
[I 2026-06-06 21:38:49,557] Trial 71 finished with value: 0.7741892418264519 and parameters: {'n_estimators': 300, 'max_depth': 8, 'min_samples_split': 19, 'min_samples_leaf': 14, 'max_features': 'log2'}. Best is trial 58 with value: 0.7795717839821074.
[I 2026-06-06 21:39:01,377] Trial 72 finished with value: 0.7727678234865428 and parameters: {'n_estimators': 300, 'max_depth': 7, 'min_samples_split': 17, 'min_samples_leaf': 14, 'max_features': 'log2'}. Best is trial 58 with value: 0.7795717839821074.
[I 2026-06-06 21:39:14,184] Trial 73 finished with value: 0.7727678234865428 and parameters: {'n_estimators': 300, 'max_depth': 7, 'min_samples_split': 17, 'min_samples_leaf': 14, 'max_features': 'log2'}. Best is trial 58 with value: 0.7795717839821074.
[I 2026-06-06 21:48:38,586] Trial 74 finished with value: 0.7727678234865428 and parameters: {'n_estimators': 300, 'max_depth': 7, 'min_samples_split': 17, 'min_samples_leaf': 14, 'max_features': 'log2'}. Best is trial 58 with value: 0.7795717839821074.
[I 2026-06-06 22:00:26,039] Trial 76 finished with value: 0.7795717839821074 and parameters: {'n_estimators': 300, 'max_depth': 7, 'min_samples_split': 18, 'min_samples_leaf': 15, 'max_features': 'log2'}. Best is trial 58 with value: 0.7795717839821074.
[I 2026-06-06 22:00:29,066] Trial 75 finished with value: 0.7795717839821074 and parameters: {'n_estimators': 300, 'max_depth': 7, 'min_samples_split': 17, 'min_samples_leaf': 15, 'max_features': 'log2'}. Best is trial 58 with value: 0.7795717839821074.
[I 2026-06-06 22:01:03,935] Trial 77 finished with value: 0.7795717839821074 and parameters: {'n_estimators': 300, 'max_depth': 7, 'min_samples_split': 18, 'min_samples_leaf': 15, 'max_features': 'log2'}. Best is trial 58 with value: 0.7795717839821074.
[I 2026-06-06 22:10:07,245] Trial 78 finished with value: 0.7795717839821074 and parameters: {'n_estimators': 300, 'max_depth': 7, 'min_samples_split': 18, 'min_samples_leaf': 15, 'max_features': 'log2'}. Best is trial 58 with value: 0.7795717839821074.
[I 2026-06-06 22:22:03,601] Trial 79 finished with value: 0.7795717839821074 and parameters: {'n_estimators': 300, 'max_depth': 7, 'min_samples_split': 18, 'min_samples_leaf': 15, 'max_features': 'log2'}. Best is trial 58 with value: 0.7795717839821074.
[I 2026-06-06 22:23:04,871] Trial 80 finished with value: 0.7676323934695382 and parameters: {'n_estimators': 300, 'max_depth': 7, 'min_samples_split': 18, 'min_samples_leaf': 5, 'max_features': 'log2'}. Best is trial 58 with value: 0.7795717839821074.
[I 2026-06-06 22:23:30,840] Trial 81 finished with value: 0.7706851707586762 and parameters: {'n_estimators': 300, 'max_depth': 7, 'min_samples_split': 18, 'min_samples_leaf': 12, 'max_features': 'log2'}. Best is trial 58 with value: 0.7795717839821074.
[I 2026-06-06 22:30:18,708] Trial 82 finished with value: 0.7787178858928288 and parameters: {'n_estimators': 300, 'max_depth': 6, 'min_samples_split': 16, 'min_samples_leaf': 12, 'max_features': 'log2'}. Best is trial 58 with value: 0.7795717839821074.
[I 2026-06-06 22:42:20,581] Trial 83 finished with value: 0.7787178858928288 and parameters: {'n_estimators': 300, 'max_depth': 6, 'min_samples_split': 16, 'min_samples_leaf': 12, 'max_features': 'log2'}. Best is trial 58 with value: 0.7795717839821074.
[I 2026-06-06 22:44:55,048] Trial 84 finished with value: 0.7795717839821074 and parameters: {'n_estimators': 300, 'max_depth': 7, 'min_samples_split': 16, 'min_samples_leaf': 15, 'max_features': 'log2'}. Best is trial 58 with value: 0.7795717839821074.
[I 2026-06-06 22:44:59,740] Trial 85 finished with value: 0.7795717839821074 and parameters: {'n_estimators': 300, 'max_depth': 7, 'min_samples_split': 16, 'min_samples_leaf': 15, 'max_features': 'log2'}. Best is trial 58 with value: 0.7795717839821074.
[I 2026-06-06 22:51:45,707] Trial 86 finished with value: 0.7795717839821074 and parameters: {'n_estimators': 300, 'max_depth': 7, 'min_samples_split': 16, 'min_samples_leaf': 15, 'max_features': 'log2'}. Best is trial 58 with value: 0.7795717839821074.
[I 2026-06-06 23:04:13,338] Trial 87 finished with value: 0.7795717839821074 and parameters: {'n_estimators': 300, 'max_depth': 7, 'min_samples_split': 17, 'min_samples_leaf': 15, 'max_features': 'log2'}. Best is trial 58 with value: 0.7795717839821074.
[I 2026-06-06 23:07:48,514] Trial 89 finished with value: 0.7741892418264519 and parameters: {'n_estimators': 300, 'max_depth': 8, 'min_samples_split': 17, 'min_samples_leaf': 14, 'max_features': 'log2'}. Best is trial 58 with value: 0.7795717839821074.
[I 2026-06-06 23:07:56,692] Trial 88 finished with value: 0.7741892418264519 and parameters: {'n_estimators': 300, 'max_depth': 8, 'min_samples_split': 17, 'min_samples_leaf': 14, 'max_features': 'log2'}. Best is trial 58 with value: 0.7795717839821074.
[I 2026-06-06 23:14:21,515] Trial 90 finished with value: 0.7741892418264519 and parameters: {'n_estimators': 300, 'max_depth': 8, 'min_samples_split': 17, 'min_samples_leaf': 14, 'max_features': 'log2'}. Best is trial 58 with value: 0.7795717839821074.
[I 2026-06-06 23:14:50,007] Trial 93 finished with value: 0.7721819792425804 and parameters: {'n_estimators': 100, 'max_depth': 6, 'min_samples_split': 18, 'min_samples_leaf': 15, 'max_features': 'log2'}. Best is trial 58 with value: 0.7795717839821074.
[I 2026-06-06 23:15:13,668] Trial 92 finished with value: 0.7654921510483418 and parameters: {'n_estimators': 100, 'max_depth': 8, 'min_samples_split': 18, 'min_samples_leaf': 14, 'max_features': 'log2'}. Best is trial 58 with value: 0.7795717839821074.
[I 2026-06-06 23:27:11,576] Trial 91 finished with value: 0.7741892418264519 and parameters: {'n_estimators': 300, 'max_depth': 8, 'min_samples_split': 18, 'min_samples_leaf': 14, 'max_features': 'log2'}. Best is trial 58 with value: 0.7795717839821074.
[I 2026-06-06 23:35:49,181] Trial 94 finished with value: 0.7795717839821074 and parameters: {'n_estimators': 300, 'max_depth': 7, 'min_samples_split': 18, 'min_samples_leaf': 15, 'max_features': 'log2'}. Best is trial 58 with value: 0.7795717839821074.
[I 2026-06-06 23:36:34,919] Trial 95 finished with value: 0.7795717839821074 and parameters: {'n_estimators': 300, 'max_depth': 7, 'min_samples_split': 18, 'min_samples_leaf': 15, 'max_features': 'log2'}. Best is trial 58 with value: 0.7795717839821074.
[I 2026-06-06 23:36:53,804] Trial 96 finished with value: 0.7795717839821074 and parameters: {'n_estimators': 300, 'max_depth': 7, 'min_samples_split': 18, 'min_samples_leaf': 15, 'max_features': 'log2'}. Best is trial 58 with value: 0.7795717839821074.
[I 2026-06-06 23:45:46,677] Trial 97 finished with value: 0.7795717839821074 and parameters: {'n_estimators': 300, 'max_depth': 7, 'min_samples_split': 18, 'min_samples_leaf': 15, 'max_features': 'log2'}. Best is trial 58 with value: 0.7795717839821074.
[I 2026-06-06 23:50:03,099] Trial 98 finished with value: 0.7795717839821074 and parameters: {'n_estimators': 300, 'max_depth': 7, 'min_samples_split': 20, 'min_samples_leaf': 15, 'max_features': 'log2'}. Best is trial 58 with value: 0.7795717839821074.
[I 2026-06-06 23:50:18,359] Trial 99 finished with value: 0.7795717839821074 and parameters: {'n_estimators': 300, 'max_depth': 7, 'min_samples_split': 19, 'min_samples_leaf': 15, 'max_features': 'log2'}. Best is trial 58 with value: 0.7795717839821074.
[I 2026-06-06 23:56:03,615] A new study created in memory with name: deepsurv_tuning_tabicl_4_NaN_seed77
/scratch.hpc/luca.cotugno/Foundation_model_clinical_data/test_tabular_model_tmp.py:476: UserWarning: Choices for a categorical distribution should be a tuple of None, bool, int, float and str for persistent storage but contains [32] which is of type list.
  num_nodes  = trial.suggest_categorical("num_nodes", [[32], [64], [128], [64, 32], [128, 64]])
/scratch.hpc/luca.cotugno/Foundation_model_clinical_data/test_tabular_model_tmp.py:476: UserWarning: Choices for a categorical distribution should be a tuple of None, bool, int, float and str for persistent storage but contains [64] which is of type list.
  num_nodes  = trial.suggest_categorical("num_nodes", [[32], [64], [128], [64, 32], [128, 64]])
/scratch.hpc/luca.cotugno/Foundation_model_clinical_data/test_tabular_model_tmp.py:476: UserWarning: Choices for a categorical distribution should be a tuple of None, bool, int, float and str for persistent storage but contains [64, 32] which is of type list.
  num_nodes  = trial.suggest_categorical("num_nodes", [[32], [64], [128], [64, 32], [128, 64]])
/scratch.hpc/luca.cotugno/Foundation_model_clinical_data/test_tabular_model_tmp.py:476: UserWarning: Choices for a categorical distribution should be a tuple of None, bool, int, float and str for persistent storage but contains [128, 64] which is of type list.
  num_nodes  = trial.suggest_categorical("num_nodes", [[32], [64], [128], [64, 32], [128, 64]])
/scratch.hpc/luca.cotugno/Foundation_model_clinical_data/test_tabular_model_tmp.py:476: UserWarning: Choices for a categorical distribution should be a tuple of None, bool, int, float and str for persistent storage but contains [128] which is of type list.
  num_nodes  = trial.suggest_categorical("num_nodes", [[32], [64], [128], [64, 32], [128, 64]])
[I 2026-06-06 23:56:53,020] Trial 2 finished with value: 0.7701116338434919 and parameters: {'num_nodes': [128, 64], 'dropout': 0.04592251491873667, 'learning_rate': 0.003085107147199481, 'batch_norm': True}. Best is trial 2 with value: 0.7701116338434919.
/scratch.hpc/luca.cotugno/Foundation_model_clinical_data/test_tabular_model_tmp.py:476: UserWarning: Choices for a categorical distribution should be a tuple of None, bool, int, float and str for persistent storage but contains [32] which is of type list.
  num_nodes  = trial.suggest_categorical("num_nodes", [[32], [64], [128], [64, 32], [128, 64]])
/scratch.hpc/luca.cotugno/Foundation_model_clinical_data/test_tabular_model_tmp.py:476: UserWarning: Choices for a categorical distribution should be a tuple of None, bool, int, float and str for persistent storage but contains [64] which is of type list.
  num_nodes  = trial.suggest_categorical("num_nodes", [[32], [64], [128], [64, 32], [128, 64]])
/scratch.hpc/luca.cotugno/Foundation_model_clinical_data/test_tabular_model_tmp.py:476: UserWarning: Choices for a categorical distribution should be a tuple of None, bool, int, float and str for persistent storage but contains [128] which is of type list.
  num_nodes  = trial.suggest_categorical("num_nodes", [[32], [64], [128], [64, 32], [128, 64]])
/scratch.hpc/luca.cotugno/Foundation_model_clinical_data/test_tabular_model_tmp.py:476: UserWarning: Choices for a categorical distribution should be a tuple of None, bool, int, float and str for persistent storage but contains [64, 32] which is of type list.
  num_nodes  = trial.suggest_categorical("num_nodes", [[32], [64], [128], [64, 32], [128, 64]])
/scratch.hpc/luca.cotugno/Foundation_model_clinical_data/test_tabular_model_tmp.py:476: UserWarning: Choices for a categorical distribution should be a tuple of None, bool, int, float and str for persistent storage but contains [128, 64] which is of type list.
  num_nodes  = trial.suggest_categorical("num_nodes", [[32], [64], [128], [64, 32], [128, 64]])
[I 2026-06-06 23:56:53,171] Trial 3 finished with value: 0.639367404749982 and parameters: {'num_nodes': [64], 'dropout': 0.2706903940518767, 'learning_rate': 0.00030148840786031316, 'batch_norm': True}. Best is trial 2 with value: 0.7701116338434919.
/scratch.hpc/luca.cotugno/Foundation_model_clinical_data/test_tabular_model_tmp.py:476: UserWarning: Choices for a categorical distribution should be a tuple of None, bool, int, float and str for persistent storage but contains [32] which is of type list.
  num_nodes  = trial.suggest_categorical("num_nodes", [[32], [64], [128], [64, 32], [128, 64]])
/scratch.hpc/luca.cotugno/Foundation_model_clinical_data/test_tabular_model_tmp.py:476: UserWarning: Choices for a categorical distribution should be a tuple of None, bool, int, float and str for persistent storage but contains [64] which is of type list.
  num_nodes  = trial.suggest_categorical("num_nodes", [[32], [64], [128], [64, 32], [128, 64]])
/scratch.hpc/luca.cotugno/Foundation_model_clinical_data/test_tabular_model_tmp.py:476: UserWarning: Choices for a categorical distribution should be a tuple of None, bool, int, float and str for persistent storage but contains [128] which is of type list.
  num_nodes  = trial.suggest_categorical("num_nodes", [[32], [64], [128], [64, 32], [128, 64]])
/scratch.hpc/luca.cotugno/Foundation_model_clinical_data/test_tabular_model_tmp.py:476: UserWarning: Choices for a categorical distribution should be a tuple of None, bool, int, float and str for persistent storage but contains [64, 32] which is of type list.
  num_nodes  = trial.suggest_categorical("num_nodes", [[32], [64], [128], [64, 32], [128, 64]])
/scratch.hpc/luca.cotugno/Foundation_model_clinical_data/test_tabular_model_tmp.py:476: UserWarning: Choices for a categorical distribution should be a tuple of None, bool, int, float and str for persistent storage but contains [128, 64] which is of type list.
  num_nodes  = trial.suggest_categorical("num_nodes", [[32], [64], [128], [64, 32], [128, 64]])
[I 2026-06-06 23:56:56,369] Trial 0 finished with value: 0.7829480162948141 and parameters: {'num_nodes': [32], 'dropout': 0.0927815852919313, 'learning_rate': 0.000730515221833084, 'batch_norm': False}. Best is trial 0 with value: 0.7829480162948141.
/scratch.hpc/luca.cotugno/Foundation_model_clinical_data/test_tabular_model_tmp.py:476: UserWarning: Choices for a categorical distribution should be a tuple of None, bool, int, float and str for persistent storage but contains [32] which is of type list.
  num_nodes  = trial.suggest_categorical("num_nodes", [[32], [64], [128], [64, 32], [128, 64]])
/scratch.hpc/luca.cotugno/Foundation_model_clinical_data/test_tabular_model_tmp.py:476: UserWarning: Choices for a categorical distribution should be a tuple of None, bool, int, float and str for persistent storage but contains [64] which is of type list.
  num_nodes  = trial.suggest_categorical("num_nodes", [[32], [64], [128], [64, 32], [128, 64]])
/scratch.hpc/luca.cotugno/Foundation_model_clinical_data/test_tabular_model_tmp.py:476: UserWarning: Choices for a categorical distribution should be a tuple of None, bool, int, float and str for persistent storage but contains [128] which is of type list.
  num_nodes  = trial.suggest_categorical("num_nodes", [[32], [64], [128], [64, 32], [128, 64]])
/scratch.hpc/luca.cotugno/Foundation_model_clinical_data/test_tabular_model_tmp.py:476: UserWarning: Choices for a categorical distribution should be a tuple of None, bool, int, float and str for persistent storage but contains [64, 32] which is of type list.
  num_nodes  = trial.suggest_categorical("num_nodes", [[32], [64], [128], [64, 32], [128, 64]])
/scratch.hpc/luca.cotugno/Foundation_model_clinical_data/test_tabular_model_tmp.py:476: UserWarning: Choices for a categorical distribution should be a tuple of None, bool, int, float and str for persistent storage but contains [128, 64] which is of type list.
  num_nodes  = trial.suggest_categorical("num_nodes", [[32], [64], [128], [64, 32], [128, 64]])
