[I 2026-06-07 08:05:42,547] Trial 99 finished with value: 0.7781597894101978 and parameters: {'n_estimators': 300, 'max_depth': 8, 'min_samples_split': 17, 'min_samples_leaf': 14, 'max_features': 'log2'}. Best is trial 99 with value: 0.7781597894101978.
[I 2026-06-07 08:12:07,465] A new study created in memory with name: deepsurv_tuning_tabicl_5_NaN_seed77
/scratch.hpc/luca.cotugno/Foundation_model_clinical_data/test_tabular_model_tmp.py:476: UserWarning: Choices for a categorical distribution should be a tuple of None, bool, int, float and str for persistent storage but contains [32] which is of type list.
  num_nodes  = trial.suggest_categorical("num_nodes", [[32], [64], [128], [64, 32], [128, 64]])
/scratch.hpc/luca.cotugno/Foundation_model_clinical_data/test_tabular_model_tmp.py:476: UserWarning: Choices for a categorical distribution should be a tuple of None, bool, int, float and str for persistent storage but contains [64] which is of type list.
  num_nodes  = trial.suggest_categorical("num_nodes", [[32], [64], [128], [64, 32], [128, 64]])
/scratch.hpc/luca.cotugno/Foundation_model_clinical_data/test_tabular_model_tmp.py:476: UserWarning: Choices for a categorical distribution should be a tuple of None, bool, int, float and str for persistent storage but contains [128] which is of type list.
  num_nodes  = trial.suggest_categorical("num_nodes", [[32], [64], [128], [64, 32], [128, 64]])
/scratch.hpc/luca.cotugno/Foundation_model_clinical_data/test_tabular_model_tmp.py:476: UserWarning: Choices for a categorical distribution should be a tuple of None, bool, int, float and str for persistent storage but contains [64, 32] which is of type list.
  num_nodes  = trial.suggest_categorical("num_nodes", [[32], [64], [128], [64, 32], [128, 64]])
/scratch.hpc/luca.cotugno/Foundation_model_clinical_data/test_tabular_model_tmp.py:476: UserWarning: Choices for a categorical distribution should be a tuple of None, bool, int, float and str for persistent storage but contains [128, 64] which is of type list.
  num_nodes  = trial.suggest_categorical("num_nodes", [[32], [64], [128], [64, 32], [128, 64]])

62:	[0s / 29s],		train_loss: 2.4643
57:	[0s / 25s],		train_loss: 2.4514
78:	[0s / 1m:5s],		train_loss: 2.5887
63:	[0s / 29s],		train_loss: 2.4571
47:	[1s / 1m:7s],		train_loss: 2.5694
58:	[0s / 26s],		train_loss: 2.4506
64:	[0s / 29s],		train_loss: 2.4485
79:	[0s / 1m:6s],		train_loss: 2.5852
59:	[0s / 26s],		train_loss: 2.4638
65:	[0s / 30s],		train_loss: 2.4510
60:	[0s / 27s],		train_loss: 2.4576
66:	[0s / 30s],		train_loss: 2.4449
80:	[0s / 1m:7s],		train_loss: 2.5648
61:	[0s / 27s],		train_loss: 2.4559
48:	[1s / 1m:9s],		train_loss: 2.5947
67:	[0s / 31s],		train_loss: 2.4560
62:	[0s / 27s],		train_loss: 2.4592
68:	[0s / 31s],		train_loss: 2.4452
81:	[0s / 1m:8s],		train_loss: 2.6023
63:	[0s / 28s],		train_loss: 2.4495
69:	[0s / 32s],		train_loss: 2.4582
64:	[0s / 28s],		train_loss: 2.4480
49:	[1s / 1m:10s],		train_loss: 2.5779
70:	[0s / 32s],		train_loss: 2.4593
82:	[0s / 1m:9s],		train_loss: 2.5796
65:	[0s / 29s],		train_loss: 2.4482
71:	[0s / 33s],		train_loss: 2.4594
66:	[0s / 29s],		train_loss: 2.4438
83:	[0s / 1m:9s],		train_loss: 2.5686
72:	[0s / 33s],		train_loss: 2.4529
67:	[0s / 30s],		train_loss: 2.4514
50:	[1s / 1m:12s],		train_loss: 2.5620
73:	[0s / 34s],		train_loss: 2.4586
68:	[0s / 30s],		train_loss: 2.4502
84:	[0s / 1m:10s],		train_loss: 2.5771
74:	[0s / 34s],		train_loss: 2.4384
69:	[0s / 31s],		train_loss: 2.4482
75:	[0s / 34s],		train_loss: 2.4412
70:	[0s / 31s],		train_loss: 2.4440
85:	[0s / 1m:11s],		train_loss: 2.5603
51:	[1s / 1m:13s],		train_loss: 2.5724
76:	[0s / 35s],		train_loss: 2.4484
71:	[0s / 31s],		train_loss: 2.4518
77:	[0s / 35s],		train_loss: 2.4372
72:	[0s / 32s],		train_loss: 2.4439
86:	[0s / 1m:12s],		train_loss: 2.5679
78:	[0s / 36s],		train_loss: 2.4453
73:	[0s / 32s],		train_loss: 2.4253
79:	[0s / 36s],		train_loss: 2.4432
52:	[1s / 1m:15s],		train_loss: 2.5848
74:	[0s / 33s],		train_loss: 2.4512
87:	[0s / 1m:13s],		train_loss: 2.5692
80:	[0s / 37s],		train_loss: 2.4380
75:	[0s / 33s],		train_loss: 2.4444
81:	[0s / 37s],		train_loss: 2.4355
88:	[0s / 1m:14s],		train_loss: 2.5991
76:	[0s / 34s],		train_loss: 2.4307
82:	[0s / 38s],		train_loss: 2.4380
77:	[0s / 34s],		train_loss: 2.4255
53:	[1s / 1m:16s],		train_loss: 2.5732
89:	[0s / 1m:14s],		train_loss: 2.5665
83:	[0s / 38s],		train_loss: 2.4512
78:	[0s / 35s],		train_loss: 2.4399
84:	[0s / 39s],		train_loss: 2.4342
79:	[0s / 35s],		train_loss: 2.4464
90:	[0s / 1m:15s],		train_loss: 2.5720
80:	[0s / 35s],		train_loss: 2.4453
85:	[0s / 39s],		train_loss: 2.4179
54:	[1s / 1m:17s],		train_loss: 2.5718
81:	[0s / 36s],		train_loss: 2.4296
86:	[0s / 39s],		train_loss: 2.4272
91:	[0s / 1m:16s],		train_loss: 2.5788
82:	[0s / 36s],		train_loss: 2.4333
87:	[0s / 40s],		train_loss: 2.4379
83:	[0s / 37s],		train_loss: 2.4358
88:	[0s / 40s],		train_loss: 2.4175
55:	[1s / 1m:19s],		train_loss: 2.5734
92:	[0s / 1m:17s],		train_loss: 2.5643
84:	[0s / 37s],		train_loss: 2.4247
89:	[0s / 41s],		train_loss: 2.4339
85:	[0s / 38s],		train_loss: 2.4194
90:	[0s / 41s],		train_loss: 2.4415
93:	[0s / 1m:18s],		train_loss: 2.5720
86:	[0s / 38s],		train_loss: 2.4349
91:	[0s / 42s],		train_loss: 2.4244
56:	[1s / 1m:20s],		train_loss: 2.5653
87:	[0s / 39s],		train_loss: 2.4107
94:	[0s / 1m:19s],		train_loss: 2.5684
92:	[0s / 42s],		train_loss: 2.4194
88:	[0s / 39s],		train_loss: 2.4249
93:	[0s / 43s],		train_loss: 2.4385
89:	[0s / 39s],		train_loss: 2.4321
95:	[0s / 1m:19s],		train_loss: 2.5562
94:	[0s / 43s],		train_loss: 2.4090
57:	[1s / 1m:22s],		train_loss: 2.5778
90:	[0s / 40s],		train_loss: 2.4184
95:	[0s / 44s],		train_loss: 2.4282
96:	[0s / 1m:20s],		train_loss: 2.5710
91:	[0s / 40s],		train_loss: 2.4368
96:	[0s / 44s],		train_loss: 2.4222
92:	[0s / 41s],		train_loss: 2.4095
97:	[0s / 45s],		train_loss: 2.4093
58:	[1s / 1m:23s],		train_loss: 2.5590
97:	[0s / 1m:21s],		train_loss: 2.5730
93:	[0s / 41s],		train_loss: 2.4250
98:	[0s / 45s],		train_loss: 2.4143
94:	[0s / 42s],		train_loss: 2.4118
99:	[0s / 45s],		train_loss: 2.4240
98:	[0s / 1m:22s],		train_loss: 2.5547
95:	[0s / 42s],		train_loss: 2.4182
0:	[0s / 0s],		train_loss: 3.9679
59:	[1s / 1m:24s],		train_loss: 2.5458
96:	[0s / 43s],		train_loss: 2.4085
99:	[0s / 1m:23s],		train_loss: 2.5823
1:	[0s / 1s],		train_loss: 3.1568
97:	[0s / 43s],		train_loss: 2.4286
2:	[0s / 1s],		train_loss: 2.8922
98:	[0s / 44s],		train_loss: 2.4302
0:	[0s / 0s],		train_loss: 4.4044
60:	[1s / 1m:26s],		train_loss: 2.5508
3:	[0s / 1s],		train_loss: 2.7864
99:	[0s / 44s],		train_loss: 2.4129
1:	[0s / 1s],		train_loss: 3.0929
4:	[0s / 2s],		train_loss: 2.7140
0:	[0s / 0s],		train_loss: 4.0669
5:	[0s / 3s],		train_loss: 2.6651
1:	[0s / 0s],		train_loss: 3.0938
2:	[0s / 2s],		train_loss: 2.7918
61:	[1s / 1m:27s],		train_loss: 2.5458
6:	[0s / 3s],		train_loss: 2.6584
2:	[0s / 1s],		train_loss: 2.7949
3:	[0s / 2s],		train_loss: 2.7112
7:	[0s / 3s],		train_loss: 2.6293
3:	[0s / 1s],		train_loss: 2.7272
8:	[0s / 4s],		train_loss: 2.6221
4:	[0s / 2s],		train_loss: 2.6950
4:	[0s / 3s],		train_loss: 2.6830
62:	[1s / 1m:29s],		train_loss: 2.5458
5:	[0s / 2s],		train_loss: 2.6681
9:	[0s / 4s],		train_loss: 2.6063
6:	[0s / 3s],		train_loss: 2.6462
5:	[0s / 4s],		train_loss: 2.6639
10:	[0s / 5s],		train_loss: 2.5976
7:	[0s / 3s],		train_loss: 2.6242
11:	[0s / 5s],		train_loss: 2.5893
6:	[0s / 5s],		train_loss: 2.6540
8:	[0s / 3s],		train_loss: 2.6118
63:	[1s / 1m:30s],		train_loss: 2.5266
12:	[0s / 6s],		train_loss: 2.5763
9:	[0s / 4s],		train_loss: 2.5884
13:	[0s / 6s],		train_loss: 2.5716
7:	[0s / 5s],		train_loss: 2.6309
10:	[0s / 4s],		train_loss: 2.5731
14:	[0s / 7s],		train_loss: 2.5665
8:	[0s / 6s],		train_loss: 2.6192
11:	[0s / 5s],		train_loss: 2.5695
15:	[0s / 7s],		train_loss: 2.5570
64:	[1s / 1m:32s],		train_loss: 2.5604
12:	[0s / 5s],		train_loss: 2.5655
16:	[0s / 8s],		train_loss: 2.5406
9:	[0s / 7s],		train_loss: 2.6172
13:	[0s / 6s],		train_loss: 2.5589
17:	[0s / 8s],		train_loss: 2.5610
14:	[0s / 6s],		train_loss: 2.5433
10:	[0s / 7s],		train_loss: 2.5949
18:	[0s / 8s],		train_loss: 2.5422
65:	[1s / 1m:33s],		train_loss: 2.5579
15:	[0s / 7s],		train_loss: 2.5504
19:	[0s / 9s],		train_loss: 2.5413
11:	[0s / 8s],		train_loss: 2.5946
16:	[0s / 7s],		train_loss: 2.5479
20:	[0s / 9s],		train_loss: 2.5347
17:	[0s / 7s],		train_loss: 2.5346
12:	[0s / 9s],		train_loss: 2.5866
21:	[0s / 10s],		train_loss: 2.5197
66:	[1s / 1m:34s],		train_loss: 2.5814
18:	[0s / 8s],		train_loss: 2.5356
22:	[0s / 10s],		train_loss: 2.5258
13:	[0s / 10s],		train_loss: 2.5713
19:	[0s / 8s],		train_loss: 2.5195
23:	[0s / 11s],		train_loss: 2.5108
20:	[0s / 9s],		train_loss: 2.5120
14:	[0s / 10s],		train_loss: 2.5699
24:	[0s / 11s],		train_loss: 2.5237
21:	[0s / 9s],		train_loss: 2.5124
67:	[1s / 1m:36s],		train_loss: 2.5483
25:	[0s / 12s],		train_loss: 2.5171
22:	[0s / 10s],		train_loss: 2.5126
15:	[0s / 11s],		train_loss: 2.5504
26:	[0s / 12s],		train_loss: 2.5036
23:	[0s / 10s],		train_loss: 2.5089
16:	[0s / 12s],		train_loss: 2.5483
27:	[0s / 13s],		train_loss: 2.5141
24:	[0s / 10s],		train_loss: 2.5102
68:	[1s / 1m:37s],		train_loss: 2.5295
28:	[0s / 13s],		train_loss: 2.5136
25:	[0s / 11s],		train_loss: 2.5003
17:	[0s / 12s],		train_loss: 2.5441
29:	[0s / 14s],		train_loss: 2.5090
26:	[0s / 11s],		train_loss: 2.4980
18:	[0s / 13s],		train_loss: 2.5350
30:	[0s / 14s],		train_loss: 2.5035
27:	[0s / 12s],		train_loss: 2.4988
69:	[1s / 1m:39s],		train_loss: 2.5446
31:	[0s / 14s],		train_loss: 2.4986
28:	[0s / 12s],		train_loss: 2.5153
19:	[0s / 14s],		train_loss: 2.5253
32:	[0s / 15s],		train_loss: 2.4982
29:	[0s / 13s],		train_loss: 2.5029
20:	[0s / 14s],		train_loss: 2.5318
30:	[0s / 13s],		train_loss: 2.5055
33:	[0s / 15s],		train_loss: 2.4906
70:	[1s / 1m:40s],		train_loss: 2.5484
31:	[0s / 14s],		train_loss: 2.4911
34:	[0s / 16s],		train_loss: 2.4972
21:	[0s / 15s],		train_loss: 2.5187
32:	[0s / 14s],		train_loss: 2.5032
35:	[0s / 16s],		train_loss: 2.4907
33:	[0s / 14s],		train_loss: 2.4872
36:	[0s / 17s],		train_loss: 2.4799
22:	[0s / 16s],		train_loss: 2.5235
71:	[1s / 1m:41s],		train_loss: 2.5560
34:	[0s / 15s],		train_loss: 2.5043
37:	[0s / 17s],		train_loss: 2.4853
23:	[0s / 16s],		train_loss: 2.5235
35:	[0s / 15s],		train_loss: 2.4855
38:	[0s / 18s],		train_loss: 2.4851
36:	[0s / 16s],		train_loss: 2.4789
39:	[0s / 18s],		train_loss: 2.4731
24:	[0s / 17s],		train_loss: 2.5206
72:	[1s / 1m:43s],		train_loss: 2.5268
37:	[0s / 16s],		train_loss: 2.4872
40:	[0s / 19s],		train_loss: 2.4771
25:	[0s / 18s],		train_loss: 2.5254
38:	[0s / 17s],		train_loss: 2.4943
41:	[0s / 19s],		train_loss: 2.4805
39:	[0s / 17s],		train_loss: 2.4894
42:	[0s / 20s],		train_loss: 2.4778
26:	[0s / 19s],		train_loss: 2.5157
73:	[1s / 1m:44s],		train_loss: 2.5562
40:	[0s / 18s],		train_loss: 2.4780
43:	[0s / 20s],		train_loss: 2.4822
41:	[0s / 18s],		train_loss: 2.4835
27:	[0s / 19s],		train_loss: 2.5125
44:	[0s / 20s],		train_loss: 2.4721
42:	[0s / 18s],		train_loss: 2.4672
45:	[0s / 21s],		train_loss: 2.4725
28:	[0s / 20s],		train_loss: 2.5013
74:	[1s / 1m:46s],		train_loss: 2.5258
43:	[0s / 19s],		train_loss: 2.4722
46:	[0s / 21s],		train_loss: 2.4721
44:	[0s / 19s],		train_loss: 2.4813
29:	[0s / 21s],		train_loss: 2.5006
47:	[0s / 22s],		train_loss: 2.4578
45:	[0s / 20s],		train_loss: 2.4550
48:	[0s / 22s],		train_loss: 2.4752
30:	[0s / 21s],		train_loss: 2.4999
75:	[1s / 1m:47s],		train_loss: 2.5408
46:	[0s / 20s],		train_loss: 2.4712
49:	[0s / 23s],		train_loss: 2.4664
47:	[0s / 21s],		train_loss: 2.4617
31:	[0s / 22s],		train_loss: 2.5059
50:	[0s / 23s],		train_loss: 2.4600
48:	[0s / 21s],		train_loss: 2.4653
51:	[0s / 24s],		train_loss: 2.4628
49:	[0s / 22s],		train_loss: 2.4607
76:	[1s / 1m:48s],		train_loss: 2.5448
32:	[0s / 23s],		train_loss: 2.5065
52:	[0s / 24s],		train_loss: 2.4631
50:	[0s / 22s],		train_loss: 2.4863
33:	[0s / 24s],		train_loss: 2.4918
53:	[0s / 25s],		train_loss: 2.4599
51:	[0s / 22s],		train_loss: 2.4688
54:	[0s / 25s],		train_loss: 2.4636
52:	[0s / 23s],		train_loss: 2.4758
77:	[1s / 1m:50s],		train_loss: 2.5278
34:	[0s / 24s],		train_loss: 2.4859
55:	[0s / 26s],		train_loss: 2.4582
53:	[0s / 23s],		train_loss: 2.4550
35:	[0s / 25s],		train_loss: 2.4927
54:	[0s / 24s],		train_loss: 2.4636
56:	[0s / 26s],		train_loss: 2.4584
55:	[0s / 24s],		train_loss: 2.4611
57:	[0s / 26s],		train_loss: 2.4489
78:	[1s / 1m:51s],		train_loss: 2.5197
36:	[0s / 26s],		train_loss: 2.4818
56:	[0s / 25s],		train_loss: 2.4595
58:	[0s / 27s],		train_loss: 2.4593
57:	[0s / 25s],		train_loss: 2.4559
37:	[0s / 26s],		train_loss: 2.4855
59:	[0s / 27s],		train_loss: 2.4635
58:	[0s / 26s],		train_loss: 2.4574
60:	[0s / 28s],		train_loss: 2.4267
79:	[1s / 1m:52s],		train_loss: 2.5176
38:	[0s / 27s],		train_loss: 2.4898
59:	[0s / 26s],		train_loss: 2.4471
61:	[0s / 28s],		train_loss: 2.4469
60:	[0s / 26s],		train_loss: 2.4629
39:	[0s / 28s],		train_loss: 2.4801
62:	[0s / 29s],		train_loss: 2.4429
61:	[0s / 27s],		train_loss: 2.4498
63:	[0s / 29s],		train_loss: 2.4536
80:	[1s / 1m:54s],		train_loss: 2.5386
40:	[0s / 29s],		train_loss: 2.4798
62:	[0s / 27s],		train_loss: 2.4601
64:	[0s / 30s],		train_loss: 2.4462
63:	[0s / 28s],		train_loss: 2.4419
65:	[0s / 30s],		train_loss: 2.4515
41:	[0s / 29s],		train_loss: 2.4827
64:	[0s / 28s],		train_loss: 2.4583
66:	[0s / 31s],		train_loss: 2.4425
81:	[1s / 1m:55s],		train_loss: 2.5110
65:	[0s / 29s],		train_loss: 2.4439
42:	[0s / 30s],		train_loss: 2.4736
67:	[0s / 31s],		train_loss: 2.4349
66:	[0s / 29s],		train_loss: 2.4356
68:	[0s / 31s],		train_loss: 2.4376
43:	[0s / 31s],		train_loss: 2.4870
67:	[0s / 30s],		train_loss: 2.4445
69:	[0s / 32s],		train_loss: 2.4444
82:	[1s / 1m:56s],		train_loss: 2.5210
68:	[0s / 30s],		train_loss: 2.4337
44:	[0s / 31s],		train_loss: 2.4759
70:	[0s / 32s],		train_loss: 2.4295
69:	[0s / 30s],		train_loss: 2.4563
71:	[0s / 33s],		train_loss: 2.4397
70:	[0s / 31s],		train_loss: 2.4362
45:	[0s / 32s],		train_loss: 2.4683
72:	[0s / 33s],		train_loss: 2.4398
83:	[1s / 1m:58s],		train_loss: 2.5364
71:	[0s / 31s],		train_loss: 2.4383
46:	[0s / 33s],		train_loss: 2.4783
73:	[0s / 34s],		train_loss: 2.4283
72:	[0s / 32s],		train_loss: 2.4428
74:	[0s / 34s],		train_loss: 2.4193
73:	[0s / 32s],		train_loss: 2.4310
47:	[0s / 33s],		train_loss: 2.4749
75:	[0s / 35s],		train_loss: 2.4336
74:	[0s / 33s],		train_loss: 2.4317
84:	[1s / 1m:59s],		train_loss: 2.5383
48:	[0s / 34s],		train_loss: 2.4679
76:	[0s / 35s],		train_loss: 2.4289
75:	[0s / 33s],		train_loss: 2.4321
77:	[0s / 36s],		train_loss: 2.4362
76:	[0s / 34s],		train_loss: 2.4469
49:	[0s / 35s],		train_loss: 2.4686
78:	[0s / 36s],		train_loss: 2.4274
77:	[0s / 34s],		train_loss: 2.4289
85:	[1s / 2m:1s],		train_loss: 2.5160
79:	[0s / 37s],		train_loss: 2.4306
50:	[0s / 36s],		train_loss: 2.4654
78:	[0s / 34s],		train_loss: 2.4368
80:	[0s / 37s],		train_loss: 2.4267
79:	[0s / 35s],		train_loss: 2.4195
51:	[0s / 36s],		train_loss: 2.4694
81:	[0s / 37s],		train_loss: 2.4293
80:	[0s / 35s],		train_loss: 2.4344
86:	[1s / 2m:2s],		train_loss: 2.5281
82:	[0s / 38s],		train_loss: 2.4284
81:	[0s / 36s],		train_loss: 2.4190
52:	[0s / 37s],		train_loss: 2.4547
83:	[0s / 38s],		train_loss: 2.4282
82:	[0s / 36s],		train_loss: 2.4284
53:	[0s / 38s],		train_loss: 2.4566
83:	[0s / 37s],		train_loss: 2.4272
84:	[0s / 39s],		train_loss: 2.4157
87:	[1s / 2m:4s],		train_loss: 2.5302
84:	[0s / 37s],		train_loss: 2.4326
85:	[0s / 39s],		train_loss: 2.4274
54:	[0s / 38s],		train_loss: 2.4678
85:	[0s / 37s],		train_loss: 2.4216
86:	[0s / 40s],		train_loss: 2.4236
55:	[0s / 39s],		train_loss: 2.4644
86:	[0s / 38s],		train_loss: 2.4179
87:	[0s / 40s],		train_loss: 2.4130
88:	[1s / 2m:5s],		train_loss: 2.5239
87:	[0s / 38s],		train_loss: 2.4108
88:	[0s / 41s],		train_loss: 2.4135
56:	[0s / 40s],		train_loss: 2.4452
88:	[0s / 39s],		train_loss: 2.4237
89:	[0s / 41s],		train_loss: 2.4094
89:	[0s / 39s],		train_loss: 2.4225
57:	[0s / 41s],		train_loss: 2.4560
90:	[0s / 42s],		train_loss: 2.4066
89:	[1s / 2m:6s],		train_loss: 2.5137
90:	[0s / 40s],		train_loss: 2.4149
91:	[0s / 42s],		train_loss: 2.4145
58:	[0s / 41s],		train_loss: 2.4511
91:	[0s / 40s],		train_loss: 2.4234
92:	[0s / 42s],		train_loss: 2.4202
92:	[0s / 41s],		train_loss: 2.4257
59:	[0s / 42s],		train_loss: 2.4509
93:	[0s / 43s],		train_loss: 2.4136
90:	[1s / 2m:8s],		train_loss: 2.5005
93:	[0s / 41s],		train_loss: 2.4102
94:	[0s / 43s],		train_loss: 2.4117
60:	[0s / 43s],		train_loss: 2.4526
94:	[0s / 41s],		train_loss: 2.4006
95:	[0s / 44s],		train_loss: 2.4206
95:	[0s / 42s],		train_loss: 2.4152
61:	[0s / 43s],		train_loss: 2.4648
96:	[0s / 44s],		train_loss: 2.4175
96:	[0s / 42s],		train_loss: 2.4026
91:	[1s / 2m:9s],		train_loss: 2.5154
97:	[0s / 45s],		train_loss: 2.4068
62:	[0s / 44s],		train_loss: 2.4379
97:	[0s / 43s],		train_loss: 2.4160
98:	[0s / 45s],		train_loss: 2.4184
98:	[0s / 43s],		train_loss: 2.4127
63:	[0s / 45s],		train_loss: 2.4351
99:	[0s / 46s],		train_loss: 2.4046
92:	[1s / 2m:10s],		train_loss: 2.5146
99:	[0s / 44s],		train_loss: 2.3984
64:	[0s / 45s],		train_loss: 2.4398
0:	[0s / 0s],		train_loss: 4.6513
0:	[0s / 0s],		train_loss: 4.0423
1:	[0s / 0s],		train_loss: 3.1879
1:	[0s / 0s],		train_loss: 3.1122
65:	[0s / 46s],		train_loss: 2.4438
93:	[1s / 2m:12s],		train_loss: 2.5048
2:	[0s / 1s],		train_loss: 2.9037
2:	[0s / 1s],		train_loss: 2.8968
3:	[0s / 1s],		train_loss: 2.7811
66:	[0s / 47s],		train_loss: 2.4473
3:	[0s / 1s],		train_loss: 2.7549
4:	[0s / 2s],		train_loss: 2.7418
4:	[0s / 2s],		train_loss: 2.6869
67:	[0s / 48s],		train_loss: 2.4431
94:	[1s / 2m:13s],		train_loss: 2.5067
5:	[0s / 2s],		train_loss: 2.6814
5:	[0s / 2s],		train_loss: 2.6649
6:	[0s / 3s],		train_loss: 2.6355
6:	[0s / 3s],		train_loss: 2.6509
68:	[0s / 48s],		train_loss: 2.4259
7:	[0s / 3s],		train_loss: 2.6152
7:	[0s / 3s],		train_loss: 2.6461
69:	[0s / 49s],		train_loss: 2.4456
8:	[0s / 3s],		train_loss: 2.6051
8:	[0s / 4s],		train_loss: 2.6308
95:	[1s / 2m:15s],		train_loss: 2.5042
9:	[0s / 4s],		train_loss: 2.5834
9:	[0s / 4s],		train_loss: 2.6123
70:	[0s / 50s],		train_loss: 2.4373
10:	[0s / 4s],		train_loss: 2.5844
10:	[0s / 5s],		train_loss: 2.6011
71:	[0s / 50s],		train_loss: 2.4402
11:	[0s / 5s],		train_loss: 2.5651
11:	[0s / 5s],		train_loss: 2.5867
96:	[1s / 2m:16s],		train_loss: 2.5275
12:	[0s / 5s],		train_loss: 2.5579
12:	[0s / 6s],		train_loss: 2.5840
72:	[0s / 51s],		train_loss: 2.4310
13:	[0s / 6s],		train_loss: 2.5616
13:	[0s / 6s],		train_loss: 2.5762
14:	[0s / 6s],		train_loss: 2.5573
73:	[0s / 52s],		train_loss: 2.4285
14:	[0s / 7s],		train_loss: 2.5697
97:	[1s / 2m:17s],		train_loss: 2.5140
15:	[0s / 7s],		train_loss: 2.5478
15:	[0s / 7s],		train_loss: 2.5612
74:	[0s / 53s],		train_loss: 2.4309
16:	[0s / 7s],		train_loss: 2.5357
16:	[0s / 7s],		train_loss: 2.5545
17:	[0s / 8s],		train_loss: 2.5430
17:	[0s / 8s],		train_loss: 2.5477
75:	[0s / 53s],		train_loss: 2.4367
98:	[1s / 2m:19s],		train_loss: 2.4978
18:	[0s / 8s],		train_loss: 2.5351
18:	[0s / 8s],		train_loss: 2.5370
76:	[0s / 54s],		train_loss: 2.4260
19:	[0s / 8s],		train_loss: 2.5304
19:	[0s / 9s],		train_loss: 2.5447
20:	[0s / 9s],		train_loss: 2.5272
20:	[0s / 9s],		train_loss: 2.5352
77:	[0s / 55s],		train_loss: 2.4329
99:	[1s / 2m:20s],		train_loss: 2.5132
21:	[0s / 9s],		train_loss: 2.5275
21:	[0s / 10s],		train_loss: 2.5236
22:	[0s / 10s],		train_loss: 2.5280
78:	[0s / 56s],		train_loss: 2.4245
22:	[0s / 10s],		train_loss: 2.5229
23:	[0s / 10s],		train_loss: 2.5094
0:	[1s / 1s],		train_loss: 3.9117
23:	[0s / 11s],		train_loss: 2.5384
79:	[0s / 56s],		train_loss: 2.4329
24:	[0s / 11s],		train_loss: 2.5086
24:	[0s / 11s],		train_loss: 2.5171
25:	[0s / 11s],		train_loss: 2.5188
80:	[0s / 57s],		train_loss: 2.4266
25:	[0s / 12s],		train_loss: 2.5309
26:	[0s / 12s],		train_loss: 2.5025
1:	[1s / 2s],		train_loss: 3.2018
81:	[0s / 58s],		train_loss: 2.4292
26:	[0s / 12s],		train_loss: 2.5283
27:	[0s / 12s],		train_loss: 2.5147
27:	[0s / 13s],		train_loss: 2.5163
28:	[0s / 13s],		train_loss: 2.4988
82:	[0s / 58s],		train_loss: 2.4259
28:	[0s / 13s],		train_loss: 2.5093
29:	[0s / 13s],		train_loss: 2.5062
2:	[1s / 3s],		train_loss: 2.9699
29:	[0s / 14s],		train_loss: 2.5004
83:	[0s / 59s],		train_loss: 2.4187
30:	[0s / 13s],		train_loss: 2.5001
30:	[0s / 14s],		train_loss: 2.5101
31:	[0s / 14s],		train_loss: 2.5148
84:	[0s / 1m:0s],		train_loss: 2.4141
3:	[1s / 4s],		train_loss: 2.8172
31:	[0s / 15s],		train_loss: 2.5085
32:	[0s / 14s],		train_loss: 2.4956
85:	[0s / 1m:0s],		train_loss: 2.4146
33:	[0s / 15s],		train_loss: 2.4954
32:	[0s / 15s],		train_loss: 2.4970
34:	[0s / 15s],		train_loss: 2.4979
33:	[0s / 16s],		train_loss: 2.5094
4:	[1s / 6s],		train_loss: 2.7713
86:	[0s / 1m:1s],		train_loss: 2.4294
35:	[0s / 16s],		train_loss: 2.4908
34:	[0s / 16s],		train_loss: 2.4949
36:	[0s / 16s],		train_loss: 2.4798
87:	[0s / 1m:2s],		train_loss: 2.4132
35:	[0s / 16s],		train_loss: 2.4990
37:	[0s / 17s],		train_loss: 2.4829
5:	[1s / 7s],		train_loss: 2.7241
36:	[0s / 17s],		train_loss: 2.4785
88:	[0s / 1m:3s],		train_loss: 2.4240
38:	[0s / 17s],		train_loss: 2.4775
37:	[0s / 17s],		train_loss: 2.5002
39:	[0s / 17s],		train_loss: 2.4794
89:	[0s / 1m:3s],		train_loss: 2.4108
38:	[0s / 18s],		train_loss: 2.4709
6:	[1s / 8s],		train_loss: 2.6889
40:	[0s / 18s],		train_loss: 2.4862
39:	[0s / 18s],		train_loss: 2.4699
90:	[0s / 1m:4s],		train_loss: 2.4078
41:	[0s / 18s],		train_loss: 2.4815
40:	[0s / 19s],		train_loss: 2.4686
42:	[0s / 19s],		train_loss: 2.4725
7:	[1s / 9s],		train_loss: 2.6644
91:	[0s / 1m:5s],		train_loss: 2.4149
41:	[0s / 19s],		train_loss: 2.4886
43:	[0s / 19s],		train_loss: 2.4704
42:	[0s / 20s],		train_loss: 2.4883
44:	[0s / 20s],		train_loss: 2.4726
92:	[0s / 1m:5s],		train_loss: 2.4084
43:	[0s / 20s],		train_loss: 2.4751
45:	[0s / 20s],		train_loss: 2.4863
8:	[1s / 10s],		train_loss: 2.6471
93:	[0s / 1m:6s],		train_loss: 2.4115
44:	[0s / 21s],		train_loss: 2.4868
46:	[0