64:	[0s / 33s],		train_loss: 4.1701[I 2026-07-01 07:40:42,859] Trial 85 finished with value: 0.7644461356034193 and parameters: {'num_nodes': [128], 'dropout': 0.12891654419335363, 'learning_rate': 0.006841680810431172, 'batch_norm': True}. Best is trial 88 with value: 0.8109959804320646.
/scratch.hpc/luca.cotugno/Foundation_model_clinical_data/test_tabular_model.py:481: UserWarning: Choices for a categorical distribution should be a tuple of None, bool, int, float and str for persistent storage but contains [32] which is of type list.
  num_nodes  = trial.suggest_categorical("num_nodes", [[32], [64], [128], [64, 32], [128, 64]])
/scratch.hpc/luca.cotugno/Foundation_model_clinical_data/test_tabular_model.py:481: UserWarning: Choices for a categorical distribution should be a tuple of None, bool, int, float and str for persistent storage but contains [64] which is of type list.
  num_nodes  = trial.suggest_categorical("num_nodes", [[32], [64], [128], [64, 32], [128, 64]])
/scratch.hpc/luca.cotugno/Foundation_model_clinical_data/test_tabular_model.py:481: UserWarning: Choices for a categorical distribution should be a tuple of None, bool, int, float and str for persistent storage but contains [128] which is of type list.
  num_nodes  = trial.suggest_categorical("num_nodes", [[32], [64], [128], [64, 32], [128, 64]])
/scratch.hpc/luca.cotugno/Foundation_model_clinical_data/test_tabular_model.py:481: UserWarning: Choices for a categorical distribution should be a tuple of None, bool, int, float and str for persistent storage but contains [64, 32] which is of type list.
  num_nodes  = trial.suggest_categorical("num_nodes", [[32], [64], [128], [64, 32], [128, 64]])
/scratch.hpc/luca.cotugno/Foundation_model_clinical_data/test_tabular_model.py:481: UserWarning: Choices for a categorical distribution should be a tuple of None, bool, int, float and str for persistent storage but contains [128, 64] which is of type list.
  num_nodes  = trial.suggest_categorical("num_nodes", [[32], [64], [128], [64, 32], [128, 64]])
[I 2026-07-01 07:41:06,125] Trial 92 finished with value: 0.7950634583692069 and parameters: {'num_nodes': [64], 'dropout': 0.08550210833119647, 'learning_rate': 0.006990585571630142, 'batch_norm': False}. Best is trial 88 with value: 0.8109959804320646.
/scratch.hpc/luca.cotugno/Foundation_model_clinical_data/test_tabular_model.py:481: UserWarning: Choices for a categorical distribution should be a tuple of None, bool, int, float and str for persistent storage but contains [32] which is of type list.
  num_nodes  = trial.suggest_categorical("num_nodes", [[32], [64], [128], [64, 32], [128, 64]])
/scratch.hpc/luca.cotugno/Foundation_model_clinical_data/test_tabular_model.py:481: UserWarning: Choices for a categorical distribution should be a tuple of None, bool, int, float and str for persistent storage but contains [64] which is of type list.
  num_nodes  = trial.suggest_categorical("num_nodes", [[32], [64], [128], [64, 32], [128, 64]])
/scratch.hpc/luca.cotugno/Foundation_model_clinical_data/test_tabular_model.py:481: UserWarning: Choices for a categorical distribution should be a tuple of None, bool, int, float and str for persistent storage but contains [128] which is of type list.
  num_nodes  = trial.suggest_categorical("num_nodes", [[32], [64], [128], [64, 32], [128, 64]])
/scratch.hpc/luca.cotugno/Foundation_model_clinical_data/test_tabular_model.py:481: UserWarning: Choices for a categorical distribution should be a tuple of None, bool, int, float and str for persistent storage but contains [64, 32] which is of type list.
  num_nodes  = trial.suggest_categorical("num_nodes", [[32], [64], [128], [64, 32], [128, 64]])
/scratch.hpc/luca.cotugno/Foundation_model_clinical_data/test_tabular_model.py:481: UserWarning: Choices for a categorical distribution should be a tuple of None, bool, int, float and str for persistent storage but contains [128, 64] which is of type list.
  num_nodes  = trial.suggest_categorical("num_nodes", [[32], [64], [128], [64, 32], [128, 64]])
[I 2026-07-01 07:41:09,822] Trial 91 finished with value: 0.8019025017932416 and parameters: {'num_nodes': [32], 'dropout': 0.2082892195743679, 'learning_rate': 0.000902384887697854, 'batch_norm': False}. Best is trial 88 with value: 0.8109959804320646.
/scratch.hpc/luca.cotugno/Foundation_model_clinical_data/test_tabular_model.py:481: UserWarning: Choices for a categorical distribution should be a tuple of None, bool, int, float and str for persistent storage but contains [32] which is of type list.
  num_nodes  = trial.suggest_categorical("num_nodes", [[32], [64], [128], [64, 32], [128, 64]])
/scratch.hpc/luca.cotugno/Foundation_model_clinical_data/test_tabular_model.py:481: UserWarning: Choices for a categorical distribution should be a tuple of None, bool, int, float and str for persistent storage but contains [64] which is of type list.
  num_nodes  = trial.suggest_categorical("num_nodes", [[32], [64], [128], [64, 32], [128, 64]])
/scratch.hpc/luca.cotugno/Foundation_model_clinical_data/test_tabular_model.py:481: UserWarning: Choices for a categorical distribution should be a tuple of None, bool, int, float and str for persistent storage but contains [128] which is of type list.
  num_nodes  = trial.suggest_categorical("num_nodes", [[32], [64], [128], [64, 32], [128, 64]])
/scratch.hpc/luca.cotugno/Foundation_model_clinical_data/test_tabular_model.py:481: UserWarning: Choices for a categorical distribution should be a tuple of None, bool, int, float and str for persistent storage but contains [64, 32] which is of type list.
  num_nodes  = trial.suggest_categorical("num_nodes", [[32], [64], [128], [64, 32], [128, 64]])
/scratch.hpc/luca.cotugno/Foundation_model_clinical_data/test_tabular_model.py:481: UserWarning: Choices for a categorical distribution should be a tuple of None, bool, int, float and str for persistent storage but contains [128, 64] which is of type list.
  num_nodes  = trial.suggest_categorical("num_nodes", [[32], [64], [128], [64, 32], [128, 64]])
[I 2026-07-01 07:41:10,872] Trial 81 finished with value: 0.8052193480616854 and parameters: {'num_nodes': [128], 'dropout': 0.15748866737056932, 'learning_rate': 0.005766273342529617, 'batch_norm': False}. Best is trial 88 with value: 0.8109959804320646.
/scratch.hpc/luca.cotugno/Foundation_model_clinical_data/test_tabular_model.py:481: UserWarning: Choices for a categorical distribution should be a tuple of None, bool, int, float and str for persistent storage but contains [32] which is of type list.
  num_nodes  = trial.suggest_categorical("num_nodes", [[32], [64], [128], [64, 32], [128, 64]])
/scratch.hpc/luca.cotugno/Foundation_model_clinical_data/test_tabular_model.py:481: UserWarning: Choices for a categorical distribution should be a tuple of None, bool, int, float and str for persistent storage but contains [64] which is of type list.
  num_nodes  = trial.suggest_categorical("num_nodes", [[32], [64], [128], [64, 32], [128, 64]])
/scratch.hpc/luca.cotugno/Foundation_model_clinical_data/test_tabular_model.py:481: UserWarning: Choices for a categorical distribution should be a tuple of None, bool, int, float and str for persistent storage but contains [128] which is of type list.
  num_nodes  = trial.suggest_categorical("num_nodes", [[32], [64], [128], [64, 32], [128, 64]])
/scratch.hpc/luca.cotugno/Foundation_model_clinical_data/test_tabular_model.py:481: UserWarning: Choices for a categorical distribution should be a tuple of None, bool, int, float and str for persistent storage but contains [64, 32] which is of type list.
  num_nodes  = trial.suggest_categorical("num_nodes", [[32], [64], [128], [64, 32], [128, 64]])
/scratch.hpc/luca.cotugno/Foundation_model_clinical_data/test_tabular_model.py:481: UserWarning: Choices for a categorical distribution should be a tuple of None, bool, int, float and str for persistent storage but contains [128, 64] which is of type list.
  num_nodes  = trial.suggest_categorical("num_nodes", [[32], [64], [128], [64, 32], [128, 64]])
[I 2026-07-01 07:41:20,148] Trial 90 finished with value: 0.8029617896394882 and parameters: {'num_nodes': [64], 'dropout': 0.26720966912216126, 'learning_rate': 0.0009116298460002688, 'batch_norm': False}. Best is trial 88 with value: 0.8109959804320646.
/scratch.hpc/luca.cotugno/Foundation_model_clinical_data/test_tabular_model.py:481: UserWarning: Choices for a categorical distribution should be a tuple of None, bool, int, float and str for persistent storage but contains [32] which is of type list.
  num_nodes  = trial.suggest_categorical("num_nodes", [[32], [64], [128], [64, 32], [128, 64]])
/scratch.hpc/luca.cotugno/Foundation_model_clinical_data/test_tabular_model.py:481: UserWarning: Choices for a categorical distribution should be a tuple of None, bool, int, float and str for persistent storage but contains [64] which is of type list.
  num_nodes  = trial.suggest_categorical("num_nodes", [[32], [64], [128], [64, 32], [128, 64]])
/scratch.hpc/luca.cotugno/Foundation_model_clinical_data/test_tabular_model.py:481: UserWarning: Choices for a categorical distribution should be a tuple of None, bool, int, float and str for persistent storage but contains [128] which is of type list.
  num_nodes  = trial.suggest_categorical("num_nodes", [[32], [64], [128], [64, 32], [128, 64]])
/scratch.hpc/luca.cotugno/Foundation_model_clinical_data/test_tabular_model.py:481: UserWarning: Choices for a categorical distribution should be a tuple of None, bool, int, float and str for persistent storage but contains [64, 32] which is of type list.
  num_nodes  = trial.suggest_categorical("num_nodes", [[32], [64], [128], [64, 32], [128, 64]])
/scratch.hpc/luca.cotugno/Foundation_model_clinical_data/test_tabular_model.py:481: UserWarning: Choices for a categorical distribution should be a tuple of None, bool, int, float and str for persistent storage but contains [128, 64] which is of type list.
  num_nodes  = trial.suggest_categorical("num_nodes", [[32], [64], [128], [64, 32], [128, 64]])
[I 2026-07-01 07:41:58,953] Trial 94 finished with value: 0.7990765196225916 and parameters: {'num_nodes': [64], 'dropout': 0.26988189349573893, 'learning_rate': 0.00999741052391613, 'batch_norm': False}. Best is trial 88 with value: 0.8109959804320646.
/scratch.hpc/luca.cotugno/Foundation_model_clinical_data/test_tabular_model.py:481: UserWarning: Choices for a categorical distribution should be a tuple of None, bool, int, float and str for persistent storage but contains [32] which is of type list.
  num_nodes  = trial.suggest_categorical("num_nodes", [[32], [64], [128], [64, 32], [128, 64]])
/scratch.hpc/luca.cotugno/Foundation_model_clinical_data/test_tabular_model.py:481: UserWarning: Choices for a categorical distribution should be a tuple of None, bool, int, float and str for persistent storage but contains [64] which is of type list.
  num_nodes  = trial.suggest_categorical("num_nodes", [[32], [64], [128], [64, 32], [128, 64]])
/scratch.hpc/luca.cotugno/Foundation_model_clinical_data/test_tabular_model.py:481: UserWarning: Choices for a categorical distribution should be a tuple of None, bool, int, float and str for persistent storage but contains [128] which is of type list.
  num_nodes  = trial.suggest_categorical("num_nodes", [[32], [64], [128], [64, 32], [128, 64]])
/scratch.hpc/luca.cotugno/Foundation_model_clinical_data/test_tabular_model.py:481: UserWarning: Choices for a categorical distribution should be a tuple of None, bool, int, float and str for persistent storage but contains [64, 32] which is of type list.
  num_nodes  = trial.suggest_categorical("num_nodes", [[32], [64], [128], [64, 32], [128, 64]])
/scratch.hpc/luca.cotugno/Foundation_model_clinical_data/test_tabular_model.py:481: UserWarning: Choices for a categorical distribution should be a tuple of None, bool, int, float and str for persistent storage but contains [128, 64] which is of type list.
  num_nodes  = trial.suggest_categorical("num_nodes", [[32], [64], [128], [64, 32], [128, 64]])
[I 2026-07-01 07:42:05,732] Trial 95 finished with value: 0.7713840805954083 and parameters: {'num_nodes': [64], 'dropout': 0.14295574107609174, 'learning_rate': 0.0008834563459554738, 'batch_norm': False}. Best is trial 88 with value: 0.8109959804320646.
/scratch.hpc/luca.cotugno/Foundation_model_clinical_data/test_tabular_model.py:481: UserWarning: Choices for a categorical distribution should be a tuple of None, bool, int, float and str for persistent storage but contains [32] which is of type list.
  num_nodes  = trial.suggest_categorical("num_nodes", [[32], [64], [128], [64, 32], [128, 64]])
/scratch.hpc/luca.cotugno/Foundation_model_clinical_data/test_tabular_model.py:481: UserWarning: Choices for a categorical distribution should be a tuple of None, bool, int, float and str for persistent storage but contains [64] which is of type list.
  num_nodes  = trial.suggest_categorical("num_nodes", [[32], [64], [128], [64, 32], [128, 64]])
/scratch.hpc/luca.cotugno/Foundation_model_clinical_data/test_tabular_model.py:481: UserWarning: Choices for a categorical distribution should be a tuple of None, bool, int, float and str for persistent storage but contains [128] which is of type list.
  num_nodes  = trial.suggest_categorical("num_nodes", [[32], [64], [128], [64, 32], [128, 64]])
/scratch.hpc/luca.cotugno/Foundation_model_clinical_data/test_tabular_model.py:481: UserWarning: Choices for a categorical distribution should be a tuple of None, bool, int, float and str for persistent storage but contains [64, 32] which is of type list.
  num_nodes  = trial.suggest_categorical("num_nodes", [[32], [64], [128], [64, 32], [128, 64]])
/scratch.hpc/luca.cotugno/Foundation_model_clinical_data/test_tabular_model.py:481: UserWarning: Choices for a categorical distribution should be a tuple of None, bool, int, float and str for persistent storage but contains [128, 64] which is of type list.
  num_nodes  = trial.suggest_categorical("num_nodes", [[32], [64], [128], [64, 32], [128, 64]])
[I 2026-07-01 07:42:27,822] Trial 97 finished with value: 0.8094978819448421 and parameters: {'num_nodes': [64], 'dropout': 0.2717177245362956, 'learning_rate': 0.009893363201885328, 'batch_norm': False}. Best is trial 88 with value: 0.8109959804320646.
[I 2026-07-01 07:42:33,715] Trial 93 finished with value: 0.8083201724843345 and parameters: {'num_nodes': [64], 'dropout': 0.27620114043925686, 'learning_rate': 0.007063880883220376, 'batch_norm': False}. Best is trial 88 with value: 0.8109959804320646.
[I 2026-07-01 07:42:49,376] Trial 98 finished with value: 0.7930791805953041 and parameters: {'num_nodes': [64], 'dropout': 0.2707349046378358, 'learning_rate': 0.0010376868213751432, 'batch_norm': False}. Best is trial 88 with value: 0.8109959804320646.
[I 2026-07-01 07:42:55,146] Trial 6 finished with value: 0.7950389932445023 and parameters: {'num_nodes': [64], 'dropout': 0.24596839437617596, 'learning_rate': 0.0007508899007544648, 'batch_norm': False}. Best is trial 88 with value: 0.8109959804320646.
[I 2026-07-01 07:42:57,750] Trial 99 finished with value: 0.7970019291011097 and parameters: {'num_nodes': [64], 'dropout': 0.27344774176428394, 'learning_rate': 0.00141060253211858, 'batch_norm': False}. Best is trial 88 with value: 0.8109959804320646.
[I 2026-07-01 07:42:58,873] Trial 57 finished with value: 0.7830812731442682 and parameters: {'num_nodes': [32], 'dropout': 0.116915413532722, 'learning_rate': 0.0032333060114888386, 'batch_norm': False}. Best is trial 88 with value: 0.8109959804320646.
[I 2026-07-01 07:43:01,992] Trial 96 finished with value: 0.7941704813174938 and parameters: {'num_nodes': [64], 'dropout': 0.27537516653492755, 'learning_rate': 0.007279110668668202, 'batch_norm': False}. Best is trial 88 with value: 0.8109959804320646.
[I 2026-07-01 07:43:03,537] Trial 89 finished with value: 0.7689953474620296 and parameters: {'num_nodes': [64], 'dropout': 0.26462801981897355, 'learning_rate': 0.0069221354454849235, 'batch_norm': False}. Best is trial 88 with value: 0.8109959804320646.
/scratch.hpc/luca.cotugno/Foundation_model_clinical_data/.venv/lib/python3.12/site-packages/torchtuples/tupletree.py:146: UserWarning: The given NumPy array is not writable, and PyTorch does not support non-writable tensors. This means writing to this tensor will result in undefined behavior. You may want to copy the array to protect its data or make it writable before converting it to a tensor. This type of warning will be suppressed for the rest of this program. (Triggered internally at /pytorch/torch/csrc/utils/tensor_numpy.cpp:213.)
  return torch.from_numpy(data)
[I 2026-07-01 07:43:09,829] A new study created in memory with name: rsf_tuning_tabdpt_5_-1_seed456
[I 2026-07-01 07:48:53,073] Trial 2 finished with value: 0.8213206468474354 and parameters: {'n_estimators': 100, 'max_depth': 4, 'min_samples_split': 6, 'min_samples_leaf': 10, 'max_features': 'log2'}. Best is trial 2 with value: 0.8213206468474354.
[I 2026-07-01 07:51:12,143] Trial 5 finished with value: 0.8140899990785649 and parameters: {'n_estimators': 100, 'max_depth': 9, 'min_samples_split': 20, 'min_samples_leaf': 7, 'max_features': 'log2'}. Best is trial 2 with value: 0.8213206468474354.
[I 2026-07-01 07:52:53,214] Trial 3 finished with value: 0.8240284095192622 and parameters: {'n_estimators': 50, 'max_depth': 5, 'min_samples_split': 14, 'min_samples_leaf': 15, 'max_features': 'sqrt'}. Best is trial 3 with value: 0.8240284095192622.
[I 2026-07-01 07:53:52,800] Trial 6 finished with value: 0.8202102128515065 and parameters: {'n_estimators': 50, 'max_depth': 6, 'min_samples_split': 14, 'min_samples_leaf': 13, 'max_features': 'sqrt'}. Best is trial 3 with value: 0.8240284095192622.
[I 2026-07-01 07:57:23,673] Trial 4 finished with value: 0.821733722011409 and parameters: {'n_estimators': 200, 'max_depth': 7, 'min_samples_split': 17, 'min_samples_leaf': 7, 'max_features': 'log2'}. Best is trial 3 with value: 0.8240284095192622.
[I 2026-07-01 07:58:16,766] Trial 7 finished with value: 0.8241959431725848 and parameters: {'n_estimators': 250, 'max_depth': 5, 'min_samples_split': 8, 'min_samples_leaf': 9, 'max_features': 'log2'}. Best is trial 7 with value: 0.8241959431725848.
[I 2026-07-01 07:59:26,581] Trial 8 finished with value: 0.8224310808433644 and parameters: {'n_estimators': 150, 'max_depth': 7, 'min_samples_split': 18, 'min_samples_leaf': 12, 'max_features': 'log2'}. Best is trial 7 with value: 0.8241959431725848.
[I 2026-07-01 08:03:58,490] Trial 0 finished with value: 0.8188081655902629 and parameters: {'n_estimators': 100, 'max_depth': 6, 'min_samples_split': 12, 'min_samples_leaf': 3, 'max_features': 'sqrt'}. Best is trial 7 with value: 0.8241959431725848.
[I 2026-07-01 08:05:40,272] Trial 14 finished with value: 0.8214949865554243 and parameters: {'n_estimators': 100, 'max_depth': 5, 'min_samples_split': 17, 'min_samples_leaf': 10, 'max_features': 'log2'}. Best is trial 7 with value: 0.8241959431725848.
[I 2026-07-01 08:15:15,843] Trial 10 finished with value: 0.8225729609060219 and parameters: {'n_estimators': 300, 'max_depth': 8, 'min_samples_split': 19, 'min_samples_leaf': 12, 'max_features': 'log2'}. Best is trial 7 with value: 0.8241959431725848.
[I 2026-07-01 08:26:05,039] Trial 9 finished with value: 0.8150627413531694 and parameters: {'n_estimators': 150, 'max_depth': 8, 'min_samples_split': 7, 'min_samples_leaf': 7, 'max_features': 'sqrt'}. Best is trial 7 with value: 0.8241959431725848.
[I 2026-07-01 08:28:30,174] Trial 16 finished with value: 0.819578820395547 and parameters: {'n_estimators': 300, 'max_depth': 8, 'min_samples_split': 19, 'min_samples_leaf': 5, 'max_features': 'log2'}. Best is trial 7 with value: 0.8241959431725848.
[I 2026-07-01 08:29:09,487] Trial 12 finished with value: 0.821849424940735 and parameters: {'n_estimators': 150, 'max_depth': 7, 'min_samples_split': 5, 'min_samples_leaf': 14, 'max_features': 'sqrt'}. Best is trial 7 with value: 0.8241959431725848.
[I 2026-07-01 08:29:22,961] Trial 15 finished with value: 0.8117502869013813 and parameters: {'n_estimators': 100, 'max_depth': 9, 'min_samples_split': 7, 'min_samples_leaf': 4, 'max_features': 'sqrt'}. Best is trial 7 with value: 0.8241959431725848.
[I 2026-07-01 08:38:39,596] Trial 1 finished with value: 0.8178123874383266 and parameters: {'n_estimators': 250, 'max_depth': 7, 'min_samples_split': 15, 'min_samples_leaf': 4, 'max_features': 'sqrt'}. Best is trial 7 with value: 0.8241959431725848.
[I 2026-07-01 08:52:11,709] Trial 11 finished with value: 0.8153590665024837 and parameters: {'n_estimators': 250, 'max_depth': 8, 'min_samples_split': 12, 'min_samples_leaf': 5, 'max_features': 'sqrt'}. Best is trial 7 with value: 0.8241959431725848.
[I 2026-07-01 08:56:44,143] Trial 17 finished with value: 0.8262670779617856 and parameters: {'n_estimators': 300, 'max_depth': 3, 'min_samples_split': 6, 'min_samples_leaf': 3, 'max_features': 'sqrt'}. Best is trial 17 with value: 0.8262670779617856.
[I 2026-07-01 09:00:35,079] Trial 18 finished with value: 0.8258273021218138 and parameters: {'n_estimators': 250, 'max_depth': 3, 'min_samples_split': 10, 'min_samples_leaf': 14, 'max_features': 'sqrt'}. Best is trial 17 with value: 0.8262670779617856.
[I 2026-07-01 09:03:06,877] Trial 19 finished with value: 0.825849814456479 and parameters: {'n_estimators': 250, 'max_depth': 3, 'min_samples_split': 9, 'min_samples_leaf': 15, 'max_features': 'sqrt'}. Best is trial 17 with value: 0.8262670779617856.
[I 2026-07-01 09:03:41,767] Trial 20 finished with value: 0.825849814456479 and parameters: {'n_estimators': 250, 'max_depth': 3, 'min_samples_split': 10, 'min_samples_leaf': 15, 'max_features': 'sqrt'}. Best is trial 17 with value: 0.8262670779617856.
