[I 2026-07-01 05:08:57,286] Trial 45 finished with value: 0.7622692213328427 and parameters: {'num_nodes': [64, 32], 'dropout': 0.18579905746419623, 'learning_rate': 0.00013735619058832048, 'batch_norm': False}. Best is trial 20 with value: 0.7756578342073788.
/scratch.hpc/luca.cotugno/Foundation_model_clinical_data/test_tabular_model.py:481: UserWarning: Choices for a categorical distribution should be a tuple of None, bool, int, float and str for persistent storage but contains [32] which is of type list.
  num_nodes  = trial.suggest_categorical("num_nodes", [[32], [64], [128], [64, 32], [128, 64]])
/scratch.hpc/luca.cotugno/Foundation_model_clinical_data/test_tabular_model.py:481: UserWarning: Choices for a categorical distribution should be a tuple of None, bool, int, float and str for persistent storage but contains [64] which is of type list.
  num_nodes  = trial.suggest_categorical("num_nodes", [[32], [64], [128], [64, 32], [128, 64]])
/scratch.hpc/luca.cotugno/Foundation_model_clinical_data/test_tabular_model.py:481: UserWarning: Choices for a categorical distribution should be a tuple of None, bool, int, float and str for persistent storage but contains [128] which is of type list.
  num_nodes  = trial.suggest_categorical("num_nodes", [[32], [64], [128], [64, 32], [128, 64]])
/scratch.hpc/luca.cotugno/Foundation_model_clinical_data/test_tabular_model.py:481: UserWarning: Choices for a categorical distribution should be a tuple of None, bool, int, float and str for persistent storage but contains [64, 32] which is of type list.
  num_nodes  = trial.suggest_categorical("num_nodes", [[32], [64], [128], [64, 32], [128, 64]])
/scratch.hpc/luca.cotugno/Foundation_model_clinical_data/test_tabular_model.py:481: UserWarning: Choices for a categorical distribution should be a tuple of None, bool, int, float and str for persistent storage but contains [128, 64] which is of type list.
  num_nodes  = trial.suggest_categorical("num_nodes", [[32], [64], [128], [64, 32], [128, 64]])

28:	[0s / 11s],		train_loss: 4.2695
63:	[0s / 10s],		train_loss: 4.0706
9:	[0s / 1s],		train_loss: 4.4361
80:	[0s / 59s],		train_loss: 4.1647
98:	[0s / 21s],		train_loss: 3.8477
64:	[0s / 10s],		train_loss: 4.0604
10:	[0s / 1s],		train_loss: 4.4056
1:	[1s / 2s],		train_loss: 4.7596
99:	[0s / 21s],		train_loss: 3.8692
65:	[0s / 10s],		train_loss: 4.0546
11:	[0s / 1s],		train_loss: 4.4032
29:	[0s / 11s],		train_loss: 4.2758
66:	[0s / 10s],		train_loss: 4.0728
12:	[0s / 2s],		train_loss: 4.3880
67:	[0s / 10s],		train_loss: 4.0418
0:	[0s / 0s],		train_loss: 5.5334
13:	[0s / 2s],		train_loss: 4.3636
81:	[0s / 1m:0s],		train_loss: 4.1711
68:	[0s / 10s],		train_loss: 4.0622
30:	[0s / 12s],		train_loss: 4.2831
14:	[0s / 2s],		train_loss: 4.3830
1:	[0s / 0s],		train_loss: 4.7626
69:	[0s / 10s],		train_loss: 4.0282
56:	[2s / 2m:14s],		train_loss: 4.0963
15:	[0s / 2s],		train_loss: 4.3878
2:	[0s / 0s],		train_loss: 4.5961
70:	[0s / 11s],		train_loss: 4.0227
16:	[0s / 2s],		train_loss: 4.3524
31:	[0s / 12s],		train_loss: 4.2629
71:	[0s / 11s],		train_loss: 4.0154
17:	[0s / 2s],		train_loss: 4.3494
3:	[0s / 0s],		train_loss: 4.5866
72:	[0s / 11s],		train_loss: 3.9685
18:	[0s / 2s],		train_loss: 4.3566
4:	[0s / 1s],		train_loss: 4.5054
82:	[0s / 1m:0s],		train_loss: 4.1833
2:	[1s / 3s],		train_loss: 4.6430
73:	[0s / 11s],		train_loss: 4.0232
19:	[0s / 3s],		train_loss: 4.3413
32:	[0s / 13s],		train_loss: 4.2461
31:	[3s / 2m:15s],		train_loss: 4.2936
74:	[0s / 11s],		train_loss: 4.0005
5:	[0s / 1s],		train_loss: 4.4976
20:	[0s / 3s],		train_loss: 4.3390
75:	[0s / 11s],		train_loss: 4.0075
21:	[0s / 3s],		train_loss: 4.3154
6:	[0s / 1s],		train_loss: 4.4656
33:	[0s / 13s],		train_loss: 4.2411
22:	[0s / 3s],		train_loss: 4.3089
76:	[0s / 12s],		train_loss: 3.9719
7:	[0s / 1s],		train_loss: 4.4700
23:	[0s / 3s],		train_loss: 4.3291
77:	[0s / 12s],		train_loss: 3.9974
83:	[0s / 1m:1s],		train_loss: 4.1546
24:	[0s / 3s],		train_loss: 4.3112
78:	[0s / 12s],		train_loss: 3.9669
8:	[0s / 1s],		train_loss: 4.4279
34:	[0s / 13s],		train_loss: 4.2370
25:	[0s / 4s],		train_loss: 4.2773
79:	[0s / 12s],		train_loss: 3.9716
9:	[0s / 2s],		train_loss: 4.4101
26:	[0s / 4s],		train_loss: 4.2799
80:	[0s / 12s],		train_loss: 3.9413
10:	[0s / 2s],		train_loss: 4.4183
27:	[0s / 4s],		train_loss: 4.2766
35:	[0s / 14s],		train_loss: 4.2607
81:	[0s / 12s],		train_loss: 3.9483
3:	[1s / 5s],		train_loss: 4.5935
84:	[0s / 1m:2s],		train_loss: 4.1667
28:	[0s / 4s],		train_loss: 4.2607
11:	[0s / 2s],		train_loss: 4.3938
82:	[0s / 13s],		train_loss: 3.9531
57:	[2s / 2m:16s],		train_loss: 4.0902
29:	[0s / 4s],		train_loss: 4.2604
83:	[0s / 13s],		train_loss: 3.9801
36:	[0s / 14s],		train_loss: 4.2312
12:	[0s / 2s],		train_loss: 4.4028
30:	[0s / 4s],		train_loss: 4.2588
84:	[0s / 13s],		train_loss: 3.9257
13:	[0s / 2s],		train_loss: 4.3795
31:	[0s / 4s],		train_loss: 4.2403
85:	[0s / 13s],		train_loss: 3.9314
37:	[0s / 15s],		train_loss: 4.2362
32:	[0s / 5s],		train_loss: 4.2488
14:	[0s / 3s],		train_loss: 4.3543
86:	[0s / 13s],		train_loss: 3.9024
85:	[0s / 1m:3s],		train_loss: 4.1539
33:	[0s / 5s],		train_loss: 4.2193
87:	[0s / 13s],		train_loss: 3.9327
15:	[0s / 3s],		train_loss: 4.3427
34:	[0s / 5s],		train_loss: 4.2147
38:	[0s / 15s],		train_loss: 4.2097
88:	[0s / 13s],		train_loss: 3.9174
35:	[0s / 5s],		train_loss: 4.2217
16:	[0s / 3s],		train_loss: 4.3530
89:	[0s / 14s],		train_loss: 3.9153
36:	[0s / 5s],		train_loss: 4.1946
4:	[1s / 6s],		train_loss: 4.5356
90:	[0s / 14s],		train_loss: 3.8865
17:	[0s / 3s],		train_loss: 4.3515
37:	[0s / 5s],		train_loss: 4.2142
39:	[0s / 15s],		train_loss: 4.1959
86:	[0s / 1m:3s],		train_loss: 4.1580
91:	[0s / 14s],		train_loss: 3.9183
38:	[0s / 5s],		train_loss: 4.2019
18:	[0s / 3s],		train_loss: 4.3349
92:	[0s / 14s],		train_loss: 3.9043
39:	[0s / 6s],		train_loss: 4.1724
19:	[0s / 4s],		train_loss: 4.3660
93:	[0s / 14s],		train_loss: 3.8445
40:	[0s / 16s],		train_loss: 4.2413
40:	[0s / 6s],		train_loss: 4.1801
94:	[0s / 14s],		train_loss: 3.8572
41:	[0s / 6s],		train_loss: 4.1704
20:	[0s / 4s],		train_loss: 4.3130
95:	[0s / 14s],		train_loss: 3.8598
42:	[0s / 6s],		train_loss: 4.1624
87:	[0s / 1m:4s],		train_loss: 4.1369
41:	[0s / 16s],		train_loss: 4.2169
21:	[0s / 4s],		train_loss: 4.3018
96:	[0s / 15s],		train_loss: 3.8576
43:	[0s / 6s],		train_loss: 4.1624
97:	[0s / 15s],		train_loss: 3.8162
22:	[0s / 4s],		train_loss: 4.2895
44:	[0s / 6s],		train_loss: 4.1452
5:	[1s / 7s],		train_loss: 4.5545
98:	[0s / 15s],		train_loss: 3.8229
45:	[0s / 6s],		train_loss: 4.1408
42:	[0s / 16s],		train_loss: 4.2098
23:	[0s / 5s],		train_loss: 4.2755
58:	[2s / 2m:19s],		train_loss: 4.1191
99:	[0s / 15s],		train_loss: 3.8121
46:	[0s / 7s],		train_loss: 4.1478
88:	[0s / 1m:5s],		train_loss: 4.1655
32:	[4s / 2m:19s],		train_loss: 4.3204
24:	[0s / 5s],		train_loss: 4.2693
47:	[0s / 7s],		train_loss: 4.1199
0:	[0s / 0s],		train_loss: 4.9142
48:	[0s / 7s],		train_loss: 4.1099
25:	[0s / 5s],		train_loss: 4.2784
43:	[0s / 17s],		train_loss: 4.1840
1:	[0s / 0s],		train_loss: 4.5694
49:	[0s / 7s],		train_loss: 4.0885
2:	[0s / 0s],		train_loss: 4.5241
26:	[0s / 5s],		train_loss: 4.2926
50:	[0s / 7s],		train_loss: 4.1318
3:	[0s / 0s],		train_loss: 4.4613
44:	[0s / 17s],		train_loss: 4.1981
51:	[0s / 7s],		train_loss: 4.1125
27:	[0s / 5s],		train_loss: 4.2657
4:	[0s / 0s],		train_loss: 4.4751
89:	[0s / 1m:5s],		train_loss: 4.2067
6:	[1s / 8s],		train_loss: 4.5065
52:	[0s / 8s],		train_loss: 4.1003
28:	[0s / 6s],		train_loss: 4.2234
5:	[0s / 0s],		train_loss: 4.4108
53:	[0s / 8s],		train_loss: 4.0617
45:	[0s / 18s],		train_loss: 4.1774
6:	[0s / 1s],		train_loss: 4.4105
29:	[0s / 6s],		train_loss: 4.2288
54:	[0s / 8s],		train_loss: 4.0783
7:	[0s / 1s],		train_loss: 4.3816
55:	[0s / 8s],		train_loss: 4.0313
30:	[0s / 6s],		train_loss: 4.2365
8:	[0s / 1s],		train_loss: 4.3813
46:	[0s / 18s],		train_loss: 4.1524
56:	[0s / 8s],		train_loss: 4.0585
90:	[0s / 1m:6s],		train_loss: 4.2033
31:	[0s / 6s],		train_loss: 4.2325
9:	[0s / 1s],		train_loss: 4.3665
57:	[0s / 8s],		train_loss: 4.0505
10:	[0s / 1s],		train_loss: 4.3362
58:	[0s / 8s],		train_loss: 4.0427
47:	[0s / 18s],		train_loss: 4.1387
32:	[0s / 7s],		train_loss: 4.2332
11:	[0s / 1s],		train_loss: 4.3452
59:	[0s / 9s],		train_loss: 4.0187
59:	[2s / 2m:21s],		train_loss: 4.1125
12:	[0s / 2s],		train_loss: 4.3348
33:	[0s / 7s],		train_loss: 4.2431
7:	[1s / 10s],		train_loss: 4.5030
60:	[0s / 9s],		train_loss: 4.0105
91:	[0s / 1m:7s],		train_loss: 4.1284
48:	[0s / 19s],		train_loss: 4.1347
13:	[0s / 2s],		train_loss: 4.3178
61:	[0s / 9s],		train_loss: 4.0234
34:	[0s / 7s],		train_loss: 4.2058
14:	[0s / 2s],		train_loss: 4.3198
62:	[0s / 9s],		train_loss: 4.0047
35:	[0s / 7s],		train_loss: 4.2110
15:	[0s / 2s],		train_loss: 4.2992
63:	[0s / 9s],		train_loss: 3.9833
49:	[0s / 19s],		train_loss: 4.1285
16:	[0s / 2s],		train_loss: 4.2864
36:	[0s / 7s],		train_loss: 4.1715
64:	[0s / 9s],		train_loss: 4.0062
17:	[0s / 2s],		train_loss: 4.2841
65:	[0s / 10s],		train_loss: 3.9827
37:	[0s / 8s],		train_loss: 4.2072
18:	[0s / 2s],		train_loss: 4.2587
50:	[0s / 20s],		train_loss: 4.1651
92:	[0s / 1m:8s],		train_loss: 4.1437
66:	[0s / 10s],		train_loss: 3.9610
38:	[0s / 8s],		train_loss: 4.1929
19:	[0s / 3s],		train_loss: 4.2722
67:	[0s / 10s],		train_loss: 3.9771
20:	[0s / 3s],		train_loss: 4.2599
68:	[0s / 10s],		train_loss: 3.9139
39:	[0s / 8s],		train_loss: 4.1763
51:	[0s / 20s],		train_loss: 4.1063
69:	[0s / 10s],		train_loss: 3.9610
21:	[0s / 3s],		train_loss: 4.2450
40:	[0s / 8s],		train_loss: 4.1722
8:	[1s / 11s],		train_loss: 4.4948
70:	[0s / 10s],		train_loss: 3.9632
22:	[0s / 3s],		train_loss: 4.2386
93:	[0s / 1m:8s],		train_loss: 4.1298
52:	[0s / 20s],		train_loss: 4.1252
71:	[0s / 10s],		train_loss: 3.9363
41:	[0s / 9s],		train_loss: 4.1717
23:	[0s / 3s],		train_loss: 4.1964
72:	[0s / 11s],		train_loss: 3.9295
24:	[0s / 3s],		train_loss: 4.1954
42:	[0s / 9s],		train_loss: 4.1273
73:	[0s / 11s],		train_loss: 3.9171
25:	[0s / 4s],		train_loss: 4.1838
53:	[0s / 21s],		train_loss: 4.0920
43:	[0s / 9s],		train_loss: 4.1398
74:	[0s / 11s],		train_loss: 3.8871
26:	[0s / 4s],		train_loss: 4.1769
94:	[0s / 1m:9s],		train_loss: 4.1487
75:	[0s / 11s],		train_loss: 3.8865
27:	[0s / 4s],		train_loss: 4.1672
44:	[0s / 9s],		train_loss: 4.1126
76:	[0s / 11s],		train_loss: 3.9311
28:	[0s / 4s],		train_loss: 4.1569
54:	[0s / 21s],		train_loss: 4.1111
60:	[2s / 2m:23s],		train_loss: 4.0921
45:	[0s / 9s],		train_loss: 4.1375
77:	[0s / 11s],		train_loss: 3.8646
29:	[0s / 4s],		train_loss: 4.1487
78:	[0s / 12s],		train_loss: 3.8724
46:	[0s / 10s],		train_loss: 4.1398
30:	[0s / 4s],		train_loss: 4.1195
9:	[1s / 12s],		train_loss: 4.4816
33:	[4s / 2m:24s],		train_loss: 4.2500
55:	[0s / 22s],		train_loss: 4.0771
95:	[0s / 1m:10s],		train_loss: 4.1263
79:	[0s / 12s],		train_loss: 3.8679
31:	[0s / 5s],		train_loss: 4.1312
47:	[0s / 10s],		train_loss: 4.1315
80:	[0s / 12s],		train_loss: 3.8524
32:	[0s / 5s],		train_loss: 4.1183
48:	[0s / 10s],		train_loss: 4.1394
81:	[0s / 12s],		train_loss: 3.8262
33:	[0s / 5s],		train_loss: 4.0975
56:	[0s / 22s],		train_loss: 4.0485
82:	[0s / 12s],		train_loss: 3.8411
49:	[0s / 10s],		train_loss: 4.1202
34:	[0s / 5s],		train_loss: 4.0980
83:	[0s / 12s],		train_loss: 3.8146
96:	[0s / 1m:10s],		train_loss: 4.1285
35:	[0s / 5s],		train_loss: 4.0743
50:	[0s / 10s],		train_loss: 4.0876
84:	[0s / 12s],		train_loss: 3.8183
57:	[0s / 22s],		train_loss: 4.0559
36:	[0s / 5s],		train_loss: 4.0771
85:	[0s / 13s],		train_loss: 3.8123
51:	[0s / 11s],		train_loss: 4.0747
10:	[1s / 13s],		train_loss: 4.4700
37:	[0s / 5s],		train_loss: 4.0930
86:	[0s / 13s],		train_loss: 3.8198
38:	[0s / 6s],		train_loss: 4.0713
52:	[0s / 11s],		train_loss: 4.0777
58:	[0s / 23s],		train_loss: 4.0605
87:	[0s / 13s],		train_loss: 3.8034
39:	[0s / 6s],		train_loss: 4.0516
88:	[0s / 13s],		train_loss: 3.7650
53:	[0s / 11s],		train_loss: 4.0808
40:	[0s / 6s],		train_loss: 4.0491
97:	[0s / 1m:11s],		train_loss: 4.1367
89:	[0s / 13s],		train_loss: 3.7904
59:	[0s / 23s],		train_loss: 4.0091
41:	[0s / 6s],		train_loss: 4.0447
54:	[0s / 11s],		train_loss: 4.0824
90:	[0s / 13s],		train_loss: 3.7353
42:	[0s / 6s],		train_loss: 4.0472
91:	[0s / 13s],		train_loss: 3.7790
55:	[0s / 12s],		train_loss: 4.0637
43:	[0s / 6s],		train_loss: 4.0592
92:	[0s / 14s],		train_loss: 3.7498
60:	[0s / 24s],		train_loss: 4.0292
61:	[2s / 2m:26s],		train_loss: 4.0919
56:	[0s / 12s],		train_loss: 4.0610
44:	[0s / 7s],		train_loss: 4.0318
93:	[0s / 14s],		train_loss: 3.7835
45:	[0s / 7s],		train_loss: 4.0269
57:	[0s / 12s],		train_loss: 4.0551
98:	[0s / 1m:12s],		train_loss: 4.1230
94:	[0s / 14s],		train_loss: 3.7396
11:	[1s / 15s],		train_loss: 4.4671
61:	[0s / 24s],		train_loss: 4.0561
46:	[0s / 7s],		train_loss: 3.9830
95:	[0s / 14s],		train_loss: 3.7349
58:	[0s / 12s],		train_loss: 4.0309
47:	[0s / 7s],		train_loss: 3.9800
96:	[0s / 14s],		train_loss: 3.7174
59:	[0s / 12s],		train_loss: 4.0132
48:	[0s / 7s],		train_loss: 3.9536
97:	[0s / 14s],		train_loss: 3.7324
62:	[0s / 24s],		train_loss: 4.0555
49:	[0s / 7s],		train_loss: 3.9492
98:	[0s / 14s],		train_loss: 3.7203
60:	[0s / 13s],		train_loss: 4.0180
50:	[0s / 7s],		train_loss: 3.9131
99:	[0s / 15s],		train_loss: 3.7115
99:	[0s / 1m:13s],		train_loss: 4.1681
61:	[0s / 13s],		train_loss: 4.0561
51:	[0s / 8s],		train_loss: 3.8915
63:	[0s / 25s],		train_loss: 4.0223
0:	[0s / 0s],		train_loss: 5.0365
52:	[0s / 8s],		train_loss: 3.9069
62:	[0s / 13s],		train_loss: 4.0173
12:	[1s / 16s],		train_loss: 4.4633
1:	[0s / 0s],		train_loss: 4.6465
53:	[0s / 8s],		train_loss: 3.9173
64:	[0s / 25s],		train_loss: 4.0144
63:	[0s / 13s],		train_loss: 3.9953
2:	[0s / 0s],		train_loss: 4.4958
54:	[0s / 8s],		train_loss: 3.9232
34:	[3s / 2m:27s],		train_loss: 4.2221
3:	[0s / 0s],		train_loss: 4.4694
64:	[0s / 14s],		train_loss: 3.9962
0:	[0s / 0s],		train_loss: 4.9272
55:	[0s / 8s],		train_loss: 3.8746
4:	[0s / 0s],		train_loss: 4.4408
65:	[0s / 26s],		train_loss: 4.0275
5:	[0s / 0s],		train_loss: 4.3909
56:	[0s / 8s],		train_loss: 3.8951
65:	[0s / 14s],		train_loss: 3.9782
62:	[2s / 2m:28s],		train_loss: 4.0608
6:	[0s / 1s],		train_loss: 4.3829
57:	[0s / 9s],		train_loss: 3.8739
66:	[0s / 14s],		train_loss: 3.9670
7:	[0s / 1s],		train_loss: 4.3908
66:	[0s / 26s],		train_loss: 4.0012
58:	[0s / 9s],		train_loss: 3.8974
8:	[0s / 1s],		train_loss: 4.3433
59:	[0s / 9s],		train_loss: 3.9378
67:	[0s / 14s],		train_loss: 3.9652
1:	[0s / 1s],		train_loss: 4.6277
13:	[1s / 17s],		train_loss: 4.4455
9:	[0s / 1s],		train_loss: 4.3349
60:	[0s / 9s],		train_loss: 3.8550
67:	[0s / 26s],		train_loss: 4.0069
10:	[0s / 1s],		train_loss: 4.3299
68:	[0s / 14s],		train_loss: 3.9743
61:	[0s / 9s],		train_loss: 3.8559
11:	[0s / 1s],		train_loss: 4.2908
62:	[0s / 9s],		train_loss: 3.8319
69:	[0s / 15s],		train_loss: 3.9667
12:	[0s / 1s],		train_loss: 4.2940
68:	[0s / 27s],		train_loss: 3.9511
63:	[0s / 10s],		train_loss: 3.7851
13:	[0s / 1s],		train_loss: 4.3081
70:	[0s / 15s],		train_loss: 3.9260
2:	[0s / 2s],		train_loss: 4.5786
14:	[0s / 2s],		train_loss: 4.3121
64:	[0s / 10s],		train_loss: 3.8280
69:	[0s / 27s],		train_loss: 3.9666
15:	[0s / 2s],		train_loss: 4.2779
71:	[0s / 15s],		train_loss: 3.9664
65:	[0s / 10s],		train_loss: 3.8299
16:	[0s / 2s],		train_loss: 4.2682
66:	[0s / 10s],		train_loss: 3.7680
72:	[0s / 15s],		train_loss: 3.9311
17:	[0s / 2s],		train_loss: 4.2570
67:	[0s / 10s],		train_loss: 3.7918
70:	[0s / 27s],		train_loss: 3.9793
18:	[0s / 2s],		train_loss: 4.2686
73:	[0s / 16s],		train_loss: 3.9132
68:	[0s / 10s],		train_loss: 3.7729
19:	[0s / 2s],		train_loss: 4.2579
3:	[0s / 2s],		train_loss: 4.5541
14:	[1s / 19s],		train_loss: 4.4088
69:	[0s / 11s],		train_loss: 3.8148
74:	[0s / 16s],		train_loss: 3.9046
20:	[0s / 2s],		train_loss: 4.2449
71:	[0s / 28s],		train_loss: 3.9424
63:	[2s / 2m:30s],		train_loss: 4.0514
70:	[0s / 11s],		train_loss: 3.7724
21:	[0s / 3s],		train_loss: 4.2379
75:	[0s / 16s],		train_loss: 3.9136
22:	[0s / 3s],		train_loss: 4.2242
71:	[0s / 11s],		train_loss: 3.7462
23:	[0s / 3s],		train_loss: 4.2069
72:	[0s / 11s],		train_loss: 3.7630
76:	[0s / 16s],		train_loss: 3.9261
72:	[0s / 28s],		train_loss: 3.9600
24:	[0s / 3s],		train_loss: 4.2085
4:	[0s / 3s],		train_loss: 4.4960
73:	[0s / 11s],		train_loss: 3.7638
77:	[0s / 17s],		train_loss: 3.8636
25:	[0s / 3s],		train_loss: 4.1878
74:	[0s / 11s],		train_loss: 3.7141
73:	[0s / 29s],		train_loss: 3.9393
26:	[0s / 3s],		train_loss: 4.1846
78:	[0s / 17s],		train_loss: 3.8909
75:	[0s / 11s],		train_loss: 3.7204
27:	[0s / 3s],		train_loss: 4.1911
76:	[0s / 12s],		train_loss: 3.7218
15:	[1s / 20s],		train_loss: 4.4028
28:	[0s / 4s],		train_loss: 4.1748
79:	[0s / 17s],		train_loss: 3.8816
74:	[0s / 29s],		train_loss: 3.8968
77:	[0s / 12s],		train_loss: 3.6778
29:	[0s / 4s],		train_loss: 4.1753
5:	[0s / 4s],		train_loss: 4.4743
80:	[0s / 17s],		train_loss: 3.8890
30:	[0s / 4s],		train_loss: 4.1446
78:	[0s / 12s],		train_loss: 3.7381
31:	[0s / 4s],		train_loss: 4.1324
81:	[0s / 17s],		train_loss: 3.8570
79:	[0s / 12s],		train_loss: 3.7296
75:	[0s / 29s],		train_loss: 3.9410
32:	[0s / 4s],		train_loss: 4.1317
80:	[0s / 12s],		train_loss: 3.7299
82:	[0s / 18s],		train_loss: 3.8607
35:	[4s / 2m:32s],		train_loss: 4.1841
33:	[0s / 4s],		train_loss: 4.1299
81:	[0s / 12s],		train_loss: 3.6848
34:	[0s / 4s],		train_loss: 4.0949
76:	[0s / 30s],		train_loss: 3.9421
83:	[0s / 18s],		train_loss: 3.8469
6:	[0s / 4s],		train_loss: 4.4479
82:	[0s / 13s],		train_loss: 3.6670
35:	[0s / 5s],		train_loss: 4.0939
83:	[0s / 13s],		train_loss: 3.6618
84:	[0s / 18s],		train_loss: 3.8533
36:	[0s / 5s],		train_loss: 4.0905
16:	[1s / 21s],		train_loss: 4.3997
64:	[2s / 2m:32s],		train_loss: 4.0803
37:	[0s / 5s],		train_loss: 4.0734
77:	[0s / 30s],		train_loss: 3.9265
84:	[0s / 13s],		train_loss: 3.6537
85:	[0s / 18s],		train_loss: 3.8403
38:	[0s / 5s],		train_loss: 4.0877
85:	[0s / 13s],		train_loss: 3.6779
39:	[0s / 5s],		train_loss: 4.0671
86:	[0s / 19s],		train_loss: 3.8458
86:	[0s / 13s],		train_loss: 3.7188
78:	[0s / 31s],		train_loss: 3.9551
40:	[0s / 5s],		train_loss: 4.0672
7:	[0s / 5s],		train_loss: 4.4366
87:	[0s / 19s],		train_loss: 3.8401
87:	[0s / 14s],		train_loss: 3.6873
41:	[0s / 5s],		train_loss: 4.0550
88:	[0s / 19s],		train_loss: 3.8264
88:	[0s / 14s],		train_loss: 3.6735
42:	[0s / 6s],		train_loss: 4.0440
79:	[0s / 31s],		train_loss: 3.9059
43:	[0s / 6s],		train_loss: 4.0363
89:	[0s / 14s],		train_loss: 3.6705
89:	[0s / 19s],		train_loss: 3.8188
44:	[0s / 6s],		train_loss: 4.0284
90:	[0s / 14s],		train_loss: 3.6716
17:	[1s / 22s],		train_loss: 4.4081
80:	[0s / 31s],		train_loss: 3.9269
45:	[0s / 6s],		train_loss: 4.0051
90:	[0s / 19s],		train_loss: 3.8262
91:	[0s / 14s],		train_loss: 3.6092
8:	[0s / 6s],		train_loss: 4.4375
46:	[0s / 6s],		train_loss: 3.9988
92:	[0s / 14s],		train_loss: 3.5886
91:	[0s / 20s],		train_loss: 3.7766
47:	[0s / 6s],		train_loss: 3.9971
81:	[0s / 32s],		train_loss: 3.9184
93:	[0s / 14s],		train_loss: 3.5530
48:	[0s / 6s],		train_loss: 4.0043
92:	[0s / 20s],		train_loss: 3.7799
94:	[0s / 15s],		train_loss: 3.5487
49:	[0s / 7s],		train_loss: 3.9685
9:	[0s / 7s],		train_loss: 4.4691
82:	[0s / 32s],		train_loss: 3.9082
95:	[0s / 15s],		train_loss: 3.6036
93:	[0s / 20s],		train_loss: 3.8195
50:	[0s / 7s],		train_loss: 3.9595
96:	[0s / 15s],		train_loss: 3.5482
51:	[0s / 7s],		train_loss: 3.9732
94:	[0s / 20s],		train_loss: 3.7960
97:	[0s / 15s],		train_loss: 3.5633
52:	[0s / 7s],		train_loss: 3.9623
65:	[2s / 2m:34s],		train_loss: 4.0683
83:	[0s / 32s],		train_loss: 3.8865
53:	[0s / 7s],		train_loss: 3.9427
98:	[0s / 15s],		train_loss: 3.5646
18:	[1s / 23s],		train_loss: 4.3471
95:	[0s / 21s],		train_loss: 3.7696
10:	[0s / 7s],		train_loss: 4.4074
54:	[0s / 7s],		train_loss: 3.9332
99:	[0s / 15s],		train_loss: 3.5869
96:	[0s / 21s],		train_loss: 3.7436
84:	[0s / 33s],		train_loss: 3.8603
55:	[0s / 8s],		train_loss: 3.9208
0:	[0s / 0s],		train_loss: 5.5551
56:	[0s / 8s],		train_loss: 3.9300
97:	[0s / 21s],		train_loss: 3.7814
1:	[0s / 0s],		train_loss: 4.9303
57:	[0s / 8s],		train_loss: 3.8926
85:	[0s / 33s],		train_loss: 3.9043
98:	[0s / 21s],		train_loss: 3.7410
2:	[0s / 0s],		train_loss: 4.7520
58:	[0s / 8s],		train_loss: 3.8985
3:	[0s / 0s],		train_loss: 4.5899
59:	[0s / 8s],		train_loss: 3.8905
99:	[0s / 22s],		train_loss: 3.7514
11:	[0s / 8s],		train_loss: 4.4011
86:	[0s / 34s],		train_loss: 3.8976
4:	[0s / 0s],		train_loss: 4.5461
36:	[4s / 2m:36s],		train_loss: 4.2385
60:	[0s / 8s],		train_loss: 3.8825
19:	[1s / 25s],		train_loss: 4.3901
61:	[0s / 9s],		train_loss: 3.8777
5:	[0s / 0s],		train_loss: 4.4911
0:	[0s / 0s],		train_loss: 5.8299
87:	[0s / 34s],		train_loss: 3.8499
62:	[0s / 9s],		train_loss: 3.8414
6:	[0s / 1s],		train_loss: 4.4497
1:	[0s / 0s],		train_loss: 4.7717
63:	[0s / 9s],		train_loss: 3.8447
12:	[0s / 9s],		train_loss: 4.3736
7:	[0s / 1s],		train_loss: 4.4585
64:	[0s / 9s],		train_loss: 3.8323
8:	[0s / 1s],		train_loss: 4.4140
88:	[0s / 34s],		train_loss: 3.8042
2:	[0s / 0s],		train_loss: 4.6622
65:	[0s / 9s],		train_loss: 3.8108
9:	[0s / 1s],		train_loss: 4.4069
3:	[0s / 0s],		train_loss: 4.5787
66:	[0s / 9s],		train_loss: 3.8078
10:	[0s / 1s],		train_loss: 4.3966
89:	[0s / 35s],		train_loss: 3.8591
67:	[0s / 9s],		train_loss: 3.8106
11:	[0s / 1s],		train_loss: 4.3782
4:	[0s / 1s],		train_loss: 4.5625
13:	[0s / 9s],		train_loss: 4.3931
68:	[0s / 10s],		train_loss: 3.8043
66:	[2s / 2m:37s],		train_loss: 4.0637
12:	[0s / 2s],		train_loss: 4.3705
20:	[1s / 26s],		train_loss: 4.3672
5:	[0s / 1s],		train_loss: 4.5540
69:	[0s / 10s],		train_loss: 3.7760
90:	[0s / 35s],		train_loss: 3.8585
13:	[0s / 2s],		train_loss: 4.3541
70:	[0s / 10s],		train_loss: 3.7740
14:	[0s / 2s],		train_loss: 4.3703
6:	[0s / 1s],		train_loss: 4.5043
71:	[0s / 10s],		train_loss: 3.7844
15:	[0s / 2s],		train_loss: 4.3481
91:	[0s / 35s],		train_loss: 3.7958
7:	[0s / 1s],		train_loss: 4.4624
14:	[0s / 10s],		train_loss: 4.3649
72:	[0s