[I 2026-06-28 01:18:53,269] Trial 81 finished with value: 0.7772675064092853 and parameters: {'n_estimators': 300, 'max_depth': 9, 'min_samples_split': 14, 'min_samples_leaf': 9, 'max_features': 'sqrt'}. Best is trial 58 with value: 0.7786538679102374.
[I 2026-06-28 01:19:39,754] Trial 86 finished with value: 0.7771313630253744 and parameters: {'n_estimators': 250, 'max_depth': 9, 'min_samples_split': 10, 'min_samples_leaf': 8, 'max_features': 'log2'}. Best is trial 58 with value: 0.7786538679102374.
[I 2026-06-28 01:20:35,449] Trial 87 finished with value: 0.7782626953705497 and parameters: {'n_estimators': 250, 'max_depth': 9, 'min_samples_split': 19, 'min_samples_leaf': 8, 'max_features': 'log2'}. Best is trial 58 with value: 0.7786538679102374.
[I 2026-06-28 01:23:13,581] Trial 82 finished with value: 0.7755494152545785 and parameters: {'n_estimators': 300, 'max_depth': 9, 'min_samples_split': 14, 'min_samples_leaf': 8, 'max_features': 'sqrt'}. Best is trial 58 with value: 0.7786538679102374.
[I 2026-06-28 01:23:30,510] Trial 89 finished with value: 0.7775321231273093 and parameters: {'n_estimators': 150, 'max_depth': 8, 'min_samples_split': 5, 'min_samples_leaf': 7, 'max_features': 'log2'}. Best is trial 58 with value: 0.7786538679102374.
[I 2026-06-28 01:23:56,691] Trial 90 finished with value: 0.7758274545597488 and parameters: {'n_estimators': 150, 'max_depth': 8, 'min_samples_split': 5, 'min_samples_leaf': 9, 'max_features': 'log2'}. Best is trial 58 with value: 0.7786538679102374.
[I 2026-06-28 01:24:10,088] Trial 92 finished with value: 0.7778465951690191 and parameters: {'n_estimators': 150, 'max_depth': 7, 'min_samples_split': 9, 'min_samples_leaf': 11, 'max_features': 'log2'}. Best is trial 58 with value: 0.7786538679102374.
[I 2026-06-28 01:24:20,629] Trial 91 finished with value: 0.7758274545597488 and parameters: {'n_estimators': 150, 'max_depth': 8, 'min_samples_split': 5, 'min_samples_leaf': 9, 'max_features': 'log2'}. Best is trial 58 with value: 0.7786538679102374.
[I 2026-06-28 01:24:54,986] Trial 93 finished with value: 0.7778465951690191 and parameters: {'n_estimators': 150, 'max_depth': 7, 'min_samples_split': 9, 'min_samples_leaf': 11, 'max_features': 'log2'}. Best is trial 58 with value: 0.7786538679102374.
[I 2026-06-28 01:28:58,635] Trial 94 finished with value: 0.7776318337746808 and parameters: {'n_estimators': 250, 'max_depth': 7, 'min_samples_split': 19, 'min_samples_leaf': 9, 'max_features': 'log2'}. Best is trial 58 with value: 0.7786538679102374.
[I 2026-06-28 01:30:54,778] Trial 95 finished with value: 0.7771064353635316 and parameters: {'n_estimators': 250, 'max_depth': 7, 'min_samples_split': 13, 'min_samples_leaf': 11, 'max_features': 'log2'}. Best is trial 58 with value: 0.7786538679102374.
[I 2026-06-28 01:31:05,406] Trial 96 finished with value: 0.7771064353635316 and parameters: {'n_estimators': 250, 'max_depth': 7, 'min_samples_split': 19, 'min_samples_leaf': 11, 'max_features': 'log2'}. Best is trial 58 with value: 0.7786538679102374.
[I 2026-06-28 01:31:16,325] Trial 97 finished with value: 0.7771064353635316 and parameters: {'n_estimators': 250, 'max_depth': 7, 'min_samples_split': 20, 'min_samples_leaf': 11, 'max_features': 'log2'}. Best is trial 58 with value: 0.7786538679102374.
[I 2026-06-28 01:31:21,421] Trial 98 finished with value: 0.7771064353635316 and parameters: {'n_estimators': 250, 'max_depth': 7, 'min_samples_split': 20, 'min_samples_leaf': 11, 'max_features': 'log2'}. Best is trial 58 with value: 0.7786538679102374.
[I 2026-06-28 01:31:22,919] Trial 99 finished with value: 0.7760920712777728 and parameters: {'n_estimators': 250, 'max_depth': 7, 'min_samples_split': 19, 'min_samples_leaf': 12, 'max_features': 'log2'}. Best is trial 58 with value: 0.7786538679102374.
[I 2026-06-28 01:31:34,666] Trial 83 finished with value: 0.7755494152545785 and parameters: {'n_estimators': 300, 'max_depth': 9, 'min_samples_split': 14, 'min_samples_leaf': 8, 'max_features': 'sqrt'}. Best is trial 58 with value: 0.7786538679102374.
ENV CHECKPOINT PATH: 
DEFAULT PATH: /scratch.hpc/luca.cotugno/Foundation_model_clinical_data/src/models_diff/tabdpt1_1.pth
ENV CHECKPOINT PATH: 
DEFAULT PATH: /scratch.hpc/luca.cotugno/Foundation_model_clinical_data/src/models_diff/tabdpt1_1.pth
[I 2026-06-28 01:34:55,984] A new study created in memory with name: deepsurv_tuning_tabdpt_3_-1_seed123
/scratch.hpc/luca.cotugno/Foundation_model_clinical_data/test_tabular_model.py:481: UserWarning: Choices for a categorical distribution should be a tuple of None, bool, int, float and str for persistent storage but contains [32] which is of type list.
  num_nodes  = trial.suggest_categorical("num_nodes", [[32], [64], [128], [64, 32], [128, 64]])
/scratch.hpc/luca.cotugno/Foundation_model_clinical_data/test_tabular_model.py:481: UserWarning: Choices for a categorical distribution should be a tuple of None, bool, int, float and str for persistent storage but contains [64] which is of type list.
  num_nodes  = trial.suggest_categorical("num_nodes", [[32], [64], [128], [64, 32], [128, 64]])
/scratch.hpc/luca.cotugno/Foundation_model_clinical_data/test_tabular_model.py:481: UserWarning: Choices for a categorical distribution should be a tuple of None, bool, int, float and str for persistent storage but contains [64, 32] which is of type list.
  num_nodes  = trial.suggest_categorical("num_nodes", [[32], [64], [128], [64, 32], [128, 64]])
/scratch.hpc/luca.cotugno/Foundation_model_clinical_data/test_tabular_model.py:481: UserWarning: Choices for a categorical distribution should be a tuple of None, bool, int, float and str for persistent storage but contains [128] which is of type list.
  num_nodes  = trial.suggest_categorical("num_nodes", [[32], [64], [128], [64, 32], [128, 64]])
/scratch.hpc/luca.cotugno/Foundation_model_clinical_data/test_tabular_model.py:481: UserWarning: Choices for a categorical distribution should be a tuple of None, bool, int, float and str for persistent storage but contains [128, 64] which is of type list.
  num_nodes  = trial.suggest_categorical("num_nodes", [[32], [64], [128], [64, 32], [128, 64]])
[I 2026-06-28 01:35:13,495] Trial 4 finished with value: 0.744408792590548 and parameters: {'num_nodes': [128, 64], 'dropout': 0.13620236595311416, 'learning_rate': 0.0017521191525940018, 'batch_norm': True}. Best is trial 4 with value: 0.744408792590548.
/scratch.hpc/luca.cotugno/Foundation_model_clinical_data/test_tabular_model.py:481: UserWarning: Choices for a categorical distribution should be a tuple of None, bool, int, float and str for persistent storage but contains [32] which is of type list.
  num_nodes  = trial.suggest_categorical("num_nodes", [[32], [64], [128], [64, 32], [128, 64]])
/scratch.hpc/luca.cotugno/Foundation_model_clinical_data/test_tabular_model.py:481: UserWarning: Choices for a categorical distribution should be a tuple of None, bool, int, float and str for persistent storage but contains [64] which is of type list.
  num_nodes  = trial.suggest_categorical("num_nodes", [[32], [64], [128], [64, 32], [128, 64]])
/scratch.hpc/luca.cotugno/Foundation_model_clinical_data/test_tabular_model.py:481: UserWarning: Choices for a categorical distribution should be a tuple of None, bool, int, float and str for persistent storage but contains [128] which is of type list.
  num_nodes  = trial.suggest_categorical("num_nodes", [[32], [64], [128], [64, 32], [128, 64]])
/scratch.hpc/luca.cotugno/Foundation_model_clinical_data/test_tabular_model.py:481: UserWarning: Choices for a categorical distribution should be a tuple of None, bool, int, float and str for persistent storage but contains [64, 32] which is of type list.
  num_nodes  = trial.suggest_categorical("num_nodes", [[32], [64], [128], [64, 32], [128, 64]])
/scratch.hpc/luca.cotugno/Foundation_model_clinical_data/test_tabular_model.py:481: UserWarning: Choices for a categorical distribution should be a tuple of None, bool, int, float and str for persistent storage but contains [128, 64] which is of type list.
  num_nodes  = trial.suggest_categorical("num_nodes", [[32], [64], [128], [64, 32], [128, 64]])
[I 2026-06-28 01:35:15,401] Trial 1 finished with value: 0.735754592572147 and parameters: {'num_nodes': [64, 32], 'dropout': 0.1629409394314796, 'learning_rate': 0.0009242194847749857, 'batch_norm': True}. Best is trial 4 with value: 0.744408792590548.
/scratch.hpc/luca.cotugno/Foundation_model_clinical_data/test_tabular_model.py:481: UserWarning: Choices for a categorical distribution should be a tuple of None, bool, int, float and str for persistent storage but contains [32] which is of type list.
  num_nodes  = trial.suggest_categorical("num_nodes", [[32], [64], [128], [64, 32], [128, 64]])
/scratch.hpc/luca.cotugno/Foundation_model_clinical_data/test_tabular_model.py:481: UserWarning: Choices for a categorical distribution should be a tuple of None, bool, int, float and str for persistent storage but contains [64] which is of type list.
  num_nodes  = trial.suggest_categorical("num_nodes", [[32], [64], [128], [64, 32], [128, 64]])
/scratch.hpc/luca.cotugno/Foundation_model_clinical_data/test_tabular_model.py:481: UserWarning: Choices for a categorical distribution should be a tuple of None, bool, int, float and str for persistent storage but contains [128] which is of type list.
  num_nodes  = trial.suggest_categorical("num_nodes", [[32], [64], [128], [64, 32], [128, 64]])
/scratch.hpc/luca.cotugno/Foundation_model_clinical_data/test_tabular_model.py:481: UserWarning: Choices for a categorical distribution should be a tuple of None, bool, int, float and str for persistent storage but contains [64, 32] which is of type list.
  num_nodes  = trial.suggest_categorical("num_nodes", [[32], [64], [128], [64, 32], [128, 64]])
/scratch.hpc/luca.cotugno/Foundation_model_clinical_data/test_tabular_model.py:481: UserWarning: Choices for a categorical distribution should be a tuple of None, bool, int, float and str for persistent storage but contains [128, 64] which is of type list.
  num_nodes  = trial.suggest_categorical("num_nodes", [[32], [64], [128], [64, 32], [128, 64]])
[I 2026-06-28 01:35:22,539] Trial 6 finished with value: 0.7406155120066243 and parameters: {'num_nodes': [128, 64], 'dropout': 0.1541610289818745, 'learning_rate': 0.0007809035643790497, 'batch_norm': True}. Best is trial 4 with value: 0.744408792590548.
/scratch.hpc/luca.cotugno/Foundation_model_clinical_data/test_tabular_model.py:481: UserWarning: Choices for a categorical distribution should be a tuple of None, bool, int, float and str for persistent storage but contains [32] which is of type list.
  num_nodes  = trial.suggest_categorical("num_nodes", [[32], [64], [128], [64, 32], [128, 64]])
/scratch.hpc/luca.cotugno/Foundation_model_clinical_data/test_tabular_model.py:481: UserWarning: Choices for a categorical distribution should be a tuple of None, bool, int, float and str for persistent storage but contains [64] which is of type list.
  num_nodes  = trial.suggest_categorical("num_nodes", [[32], [64], [128], [64, 32], [128, 64]])
/scratch.hpc/luca.cotugno/Foundation_model_clinical_data/test_tabular_model.py:481: UserWarning: Choices for a categorical distribution should be a tuple of None, bool, int, float and str for persistent storage but contains [128] which is of type list.
  num_nodes  = trial.suggest_categorical("num_nodes", [[32], [64], [128], [64, 32], [128, 64]])
/scratch.hpc/luca.cotugno/Foundation_model_clinical_data/test_tabular_model.py:481: UserWarning: Choices for a categorical distribution should be a tuple of None, bool, int, float and str for persistent storage but contains [64, 32] which is of type list.
  num_nodes  = trial.suggest_categorical("num_nodes", [[32], [64], [128], [64, 32], [128, 64]])
/scratch.hpc/luca.cotugno/Foundation_model_clinical_data/test_tabular_model.py:481: UserWarning: Choices for a categorical distribution should be a tuple of None, bool, int, float and str for persistent storage but contains [128, 64] which is of type list.
  num_nodes  = trial.suggest_categorical("num_nodes", [[32], [64], [128], [64, 32], [128, 64]])
[I 2026-06-28 01:35:26,113] Trial 8 finished with value: 0.7585621952341521 and parameters: {'num_nodes': [64], 'dropout': 0.1896219862862949, 'learning_rate': 0.007550187018360769, 'batch_norm': False}. Best is trial 8 with value: 0.7585621952341521.
/scratch.hpc/luca.cotugno/Foundation_model_clinical_data/test_tabular_model.py:481: UserWarning: Choices for a categorical distribution should be a tuple of None, bool, int, float and str for persistent storage but contains [32] which is of type list.
  num_nodes  = trial.suggest_categorical("num_nodes", [[32], [64], [128], [64, 32], [128, 64]])
/scratch.hpc/luca.cotugno/Foundation_model_clinical_data/test_tabular_model.py:481: UserWarning: Choices for a categorical distribution should be a tuple of None, bool, int, float and str for persistent storage but contains [64] which is of type list.
  num_nodes  = trial.suggest_categorical("num_nodes", [[32], [64], [128], [64, 32], [128, 64]])
/scratch.hpc/luca.cotugno/Foundation_model_clinical_data/test_tabular_model.py:481: UserWarning: Choices for a categorical distribution should be a tuple of None, bool, int, float and str for persistent storage but contains [128] which is of type list.
  num_nodes  = trial.suggest_categorical("num_nodes", [[32], [64], [128], [64, 32], [128, 64]])
/scratch.hpc/luca.cotugno/Foundation_model_clinical_data/test_tabular_model.py:481: UserWarning: Choices for a categorical distribution should be a tuple of None, bool, int, float and str for persistent storage but contains [64, 32] which is of type list.
  num_nodes  = trial.suggest_categorical("num_nodes", [[32], [64], [128], [64, 32], [128, 64]])
/scratch.hpc/luca.cotugno/Foundation_model_clinical_data/test_tabular_model.py:481: UserWarning: Choices for a categorical distribution should be a tuple of None, bool, int, float and str for persistent storage but contains [128, 64] which is of type list.
  num_nodes  = trial.suggest_categorical("num_nodes", [[32], [64], [128], [64, 32], [128, 64]])
[I 2026-06-28 01:35:30,107] Trial 9 finished with value: 0.7139475419388475 and parameters: {'num_nodes': [64], 'dropout': 0.136720710018845, 'learning_rate': 0.0004382617011166889, 'batch_norm': True}. Best is trial 8 with value: 0.7585621952341521.
/scratch.hpc/luca.cotugno/Foundation_model_clinical_data/test_tabular_model.py:481: UserWarning: Choices for a categorical distribution should be a tuple of None, bool, int, float and str for persistent storage but contains [32] which is of type list.
  num_nodes  = trial.suggest_categorical("num_nodes", [[32], [64], [128], [64, 32], [128, 64]])
/scratch.hpc/luca.cotugno/Foundation_model_clinical_data/test_tabular_model.py:481: UserWarning: Choices for a categorical distribution should be a tuple of None, bool, int, float and str for persistent storage but contains [64] which is of type list.
  num_nodes  = trial.suggest_categorical("num_nodes", [[32], [64], [128], [64, 32], [128, 64]])
/scratch.hpc/luca.cotugno/Foundation_model_clinical_data/test_tabular_model.py:481: UserWarning: Choices for a categorical distribution should be a tuple of None, bool, int, float and str for persistent storage but contains [128] which is of type list.
  num_nodes  = trial.suggest_categorical("num_nodes", [[32], [64], [128], [64, 32], [128, 64]])
/scratch.hpc/luca.cotugno/Foundation_model_clinical_data/test_tabular_model.py:481: UserWarning: Choices for a categorical distribution should be a tuple of None, bool, int, float and str for persistent storage but contains [64, 32] which is of type list.
  num_nodes  = trial.suggest_categorical("num_nodes", [[32], [64], [128], [64, 32], [128, 64]])
/scratch.hpc/luca.cotugno/Foundation_model_clinical_data/test_tabular_model.py:481: UserWarning: Choices for a categorical distribution should be a tuple of None, bool, int, float and str for persistent storage but contains [128, 64] which is of type list.
  num_nodes  = trial.suggest_categorical("num_nodes", [[32], [64], [128], [64, 32], [128, 64]])
[I 2026-06-28 01:35:34,162] Trial 0 finished with value: 0.7361647805685896 and parameters: {'num_nodes': [64], 'dropout': 0.07933339621471408, 'learning_rate': 0.000537230400380443, 'batch_norm': True}. Best is trial 8 with value: 0.7585621952341521.
/scratch.hpc/luca.cotugno/Foundation_model_clinical_data/test_tabular_model.py:481: UserWarning: Choices for a categorical distribution should be a tuple of None, bool, int, float and str for persistent storage but contains [32] which is of type list.
  num_nodes  = trial.suggest_categorical("num_nodes", [[32], [64], [128], [64, 32], [128, 64]])
/scratch.hpc/luca.cotugno/Foundation_model_clinical_data/test_tabular_model.py:481: UserWarning: Choices for a categorical distribution should be a tuple of None, bool, int, float and str for persistent storage but contains [64] which is of type list.
  num_nodes  = trial.suggest_categorical("num_nodes", [[32], [64], [128], [64, 32], [128, 64]])
/scratch.hpc/luca.cotugno/Foundation_model_clinical_data/test_tabular_model.py:481: UserWarning: Choices for a categorical distribution should be a tuple of None, bool, int, float and str for persistent storage but contains [128] which is of type list.
  num_nodes  = trial.suggest_categorical("num_nodes", [[32], [64], [128], [64, 32], [128, 64]])
/scratch.hpc/luca.cotugno/Foundation_model_clinical_data/test_tabular_model.py:481: UserWarning: Choices for a categorical distribution should be a tuple of None, bool, int, float and str for persistent storage but contains [64, 32] which is of type list.
  num_nodes  = trial.suggest_categorical("num_nodes", [[32], [64], [128], [64, 32], [128, 64]])
/scratch.hpc/luca.cotugno/Foundation_model_clinical_data/test_tabular_model.py:481: UserWarning: Choices for a categorical distribution should be a tuple of None, bool, int, float and str for persistent storage but contains [128, 64] which is of type list.
  num_nodes  = trial.suggest_categorical("num_nodes", [[32], [64], [128], [64, 32], [128, 64]])
[I 2026-06-28 01:35:41,176] Trial 11 finished with value: 0.7174475572729782 and parameters: {'num_nodes': [64, 32], 'dropout': 0.054514876522220056, 'learning_rate': 0.0009828088654221998, 'batch_norm': True}. Best is trial 8 with value: 0.7585621952341521.
/scratch.hpc/luca.cotugno/Foundation_model_clinical_data/test_tabular_model.py:481: UserWarning: Choices for a categorical distribution should be a tuple of None, bool, int, float and str for persistent storage but contains [32] which is of type list.
  num_nodes  = trial.suggest_categorical("num_nodes", [[32], [64], [128], [64, 32], [128, 64]])
/scratch.hpc/luca.cotugno/Foundation_model_clinical_data/test_tabular_model.py:481: UserWarning: Choices for a categorical distribution should be a tuple of None, bool, int, float and str for persistent storage but contains [64] which is of type list.
  num_nodes  = trial.suggest_categorical("num_nodes", [[32], [64], [128], [64, 32], [128, 64]])
/scratch.hpc/luca.cotugno/Foundation_model_clinical_data/test_tabular_model.py:481: UserWarning: Choices for a categorical distribution should be a tuple of None, bool, int, float and str for persistent storage but contains [128] which is of type list.
  num_nodes  = trial.suggest_categorical("num_nodes", [[32], [64], [128], [64, 32], [128, 64]])
/scratch.hpc/luca.cotugno/Foundation_model_clinical_data/test_tabular_model.py:481: UserWarning: Choices for a categorical distribution should be a tuple of None, bool, int, float and str for persistent storage but contains [64, 32] which is of type list.
  num_nodes  = trial.suggest_categorical("num_nodes", [[32], [64], [128], [64, 32], [128, 64]])
/scratch.hpc/luca.cotugno/Foundation_model_clinical_data/test_tabular_model.py:481: UserWarning: Choices for a categorical distribution should be a tuple of None, bool, int, float and str for persistent storage but contains [128, 64] which is of type list.
  num_nodes  = trial.suggest_categorical("num_nodes", [[32], [64], [128], [64, 32], [128, 64]])
