[I 2026-06-28 01:41:06,858] Trial 90 finished with value: 0.7600735654920723 and parameters: {'num_nodes': [64, 32], 'dropout': 0.21999616939603903, 'learning_rate': 0.006113862420387742, 'batch_norm': False}. Best is trial 52 with value: 0.779334192044653.

90:	[0s / 1m:37s],		train_loss: 4.1383
20:	[0s / 2s],		train_loss: 4.3638
38:	[0s / 8s],		train_loss: 4.3634
89:	[0s / 12s],		train_loss: 4.2176
21:	[0s / 2s],		train_loss: 4.3549
39:	[0s / 8s],		train_loss: 4.2673
22:	[0s / 2s],		train_loss: 4.3237
90:	[0s / 12s],		train_loss: 4.1624
26:	[0s / 16s],		train_loss: 4.3372
8:	[0s / 2s],		train_loss: 4.4310
23:	[0s / 2s],		train_loss: 4.3500
91:	[0s / 12s],		train_loss: 4.2180
40:	[0s / 8s],		train_loss: 4.2494
24:	[0s / 2s],		train_loss: 4.3219
92:	[0s / 12s],		train_loss: 4.2146
25:	[0s / 2s],		train_loss: 4.3542
41:	[0s / 8s],		train_loss: 4.3410
93:	[0s / 12s],		train_loss: 4.1921
9:	[0s / 3s],		train_loss: 4.3587
26:	[0s / 2s],		train_loss: 4.3223
94:	[0s / 13s],		train_loss: 4.2208
27:	[0s / 3s],		train_loss: 4.3569
42:	[0s / 8s],		train_loss: 4.3319
27:	[0s / 17s],		train_loss: 4.3384
28:	[0s / 3s],		train_loss: 4.3268
95:	[0s / 13s],		train_loss: 4.1820
68:	[2s / 2m:18s],		train_loss: 4.2083
95:	[3s / 5m:4s],		train_loss: 4.0237
10:	[0s / 3s],		train_loss: 4.3700
43:	[0s / 8s],		train_loss: 4.2912
29:	[0s / 3s],		train_loss: 4.3200
96:	[0s / 13s],		train_loss: 4.2055
91:	[1s / 1m:38s],		train_loss: 4.1367
30:	[0s / 3s],		train_loss: 4.3375
97:	[0s / 13s],		train_loss: 4.1923
44:	[0s / 9s],		train_loss: 4.2921
31:	[0s / 3s],		train_loss: 4.3038
11:	[0s / 3s],		train_loss: 4.3808
98:	[0s / 13s],		train_loss: 4.2397
32:	[0s / 3s],		train_loss: 4.3174
45:	[0s / 9s],		train_loss: 4.2675
99:	[0s / 13s],		train_loss: 4.1986
33:	[0s / 3s],		train_loss: 4.3626
28:	[0s / 18s],		train_loss: 4.3244
46:	[0s / 9s],		train_loss: 4.2454
12:	[0s / 4s],		train_loss: 4.3387
34:	[0s / 3s],		train_loss: 4.2829
47:	[0s / 9s],		train_loss: 4.2517
0:	[0s / 0s],		train_loss: 4.8033
35:	[0s / 4s],		train_loss: 4.2688
1:	[0s / 0s],		train_loss: 4.4946
36:	[0s / 4s],		train_loss: 4.2667
48:	[0s / 9s],		train_loss: 4.2717
2:	[0s / 0s],		train_loss: 4.4614
37:	[0s / 4s],		train_loss: 4.2802
13:	[0s / 4s],		train_loss: 4.3397
38:	[0s / 4s],		train_loss: 4.2717
3:	[0s / 0s],		train_loss: 4.4441
49:	[0s / 10s],		train_loss: 4.2907
29:	[0s / 18s],		train_loss: 4.3154
39:	[0s / 4s],		train_loss: 4.2642
92:	[1s / 1m:39s],		train_loss: 4.1513
4:	[0s / 0s],		train_loss: 4.4452
50:	[0s / 10s],		train_loss: 4.2778
40:	[0s / 4s],		train_loss: 4.3320
14:	[0s / 4s],		train_loss: 4.3719
5:	[0s / 0s],		train_loss: 4.4284
41:	[0s / 4s],		train_loss: 4.2626
51:	[0s / 10s],		train_loss: 4.2859
6:	[0s / 0s],		train_loss: 4.4474
42:	[0s / 4s],		train_loss: 4.2599
7:	[0s / 0s],		train_loss: 4.4370
52:	[0s / 10s],		train_loss: 4.2865
15:	[0s / 5s],		train_loss: 4.3325
30:	[0s / 19s],		train_loss: 4.3447
43:	[0s / 4s],		train_loss: 4.2774
8:	[0s / 1s],		train_loss: 4.4686
69:	[1s / 2m:20s],		train_loss: 4.1884
44:	[0s / 5s],		train_loss: 4.3110
53:	[0s / 10s],		train_loss: 4.2975
9:	[0s / 1s],		train_loss: 4.4081
45:	[0s / 5s],		train_loss: 4.2784
10:	[0s / 1s],		train_loss: 4.4046
16:	[0s / 5s],		train_loss: 4.3572
54:	[0s / 11s],		train_loss: 4.3000
46:	[0s / 5s],		train_loss: 4.3150
93:	[0s / 1m:40s],		train_loss: 4.1145
11:	[0s / 1s],		train_loss: 4.3816
47:	[0s / 5s],		train_loss: 4.3059
55:	[0s / 11s],		train_loss: 4.2706
12:	[0s / 1s],		train_loss: 4.3576
31:	[0s / 19s],		train_loss: 4.2793
48:	[0s / 5s],		train_loss: 4.2716
17:	[0s / 5s],		train_loss: 4.3454
13:	[0s / 1s],		train_loss: 4.3457
56:	[0s / 11s],		train_loss: 4.2651
49:	[0s / 5s],		train_loss: 4.2952
14:	[0s / 1s],		train_loss: 4.3851
50:	[0s / 5s],		train_loss: 4.2989
57:	[0s / 11s],		train_loss: 4.2926
15:	[0s / 2s],		train_loss: 4.4027
18:	[0s / 6s],		train_loss: 4.3204
51:	[0s / 5s],		train_loss: 4.2742
16:	[0s / 2s],		train_loss: 4.3805
52:	[0s / 6s],		train_loss: 4.2414
58:	[0s / 11s],		train_loss: 4.2633
32:	[0s / 20s],		train_loss: 4.3062
17:	[0s / 2s],		train_loss: 4.3708
53:	[0s / 6s],		train_loss: 4.2778
18:	[0s / 2s],		train_loss: 4.3684
59:	[0s / 12s],		train_loss: 4.2425
19:	[0s / 6s],		train_loss: 4.3140
54:	[0s / 6s],		train_loss: 4.2704
19:	[0s / 2s],		train_loss: 4.3644
55:	[0s / 6s],		train_loss: 4.2999
60:	[0s / 12s],		train_loss: 4.2236
94:	[1s / 1m:42s],		train_loss: 4.1276
20:	[0s / 2s],		train_loss: 4.3640
56:	[0s / 6s],		train_loss: 4.2831
20:	[0s / 6s],		train_loss: 4.3230
21:	[0s / 2s],		train_loss: 4.4192
33:	[0s / 21s],		train_loss: 4.3672
61:	[0s / 12s],		train_loss: 4.2631
57:	[0s / 6s],		train_loss: 4.2608
22:	[0s / 2s],		train_loss: 4.3350
58:	[0s / 6s],		train_loss: 4.2848
62:	[0s / 12s],		train_loss: 4.2398
23:	[0s / 3s],		train_loss: 4.3475
21:	[0s / 7s],		train_loss: 4.3178
59:	[0s / 7s],		train_loss: 4.2723
24:	[0s / 3s],		train_loss: 4.3487
63:	[0s / 12s],		train_loss: 4.2622
60:	[0s / 7s],		train_loss: 4.2561
25:	[0s / 3s],		train_loss: 4.3487
61:	[0s / 7s],		train_loss: 4.2436
64:	[0s / 13s],		train_loss: 4.2339
22:	[0s / 7s],		train_loss: 4.3039
34:	[0s / 21s],		train_loss: 4.3078
26:	[0s / 3s],		train_loss: 4.3384
62:	[0s / 7s],		train_loss: 4.2368
96:	[4s / 5m:8s],		train_loss: 4.0408
70:	[2s / 2m:22s],		train_loss: 4.1819
27:	[0s / 3s],		train_loss: 4.3430
65:	[0s / 13s],		train_loss: 4.2294
63:	[0s / 7s],		train_loss: 4.2545
95:	[1s / 1m:43s],		train_loss: 4.1089
28:	[0s / 3s],		train_loss: 4.3528
64:	[0s / 7s],		train_loss: 4.2979
23:	[0s / 8s],		train_loss: 4.3252
66:	[0s / 13s],		train_loss: 4.2373
29:	[0s / 3s],		train_loss: 4.3182
65:	[0s / 7s],		train_loss: 4.2479
30:	[0s / 4s],		train_loss: 4.3159
67:	[0s / 13s],		train_loss: 4.2465
66:	[0s / 7s],		train_loss: 4.2463
31:	[0s / 4s],		train_loss: 4.3440
67:	[0s / 8s],		train_loss: 4.2299
24:	[0s / 8s],		train_loss: 4.3295
68:	[0s / 13s],		train_loss: 4.2430
35:	[0s / 22s],		train_loss: 4.3086
68:	[0s / 8s],		train_loss: 4.2474
32:	[0s / 4s],		train_loss: 4.3820
69:	[0s / 8s],		train_loss: 4.3097
33:	[0s / 4s],		train_loss: 4.3237
69:	[0s / 14s],		train_loss: 4.2643
25:	[0s / 8s],		train_loss: 4.2807
70:	[0s / 8s],		train_loss: 4.2834
34:	[0s / 4s],		train_loss: 4.2939
70:	[0s / 14s],		train_loss: 4.2290
71:	[0s / 8s],		train_loss: 4.2309
35:	[0s / 4s],		train_loss: 4.3336
72:	[0s / 8s],		train_loss: 4.2383
36:	[0s / 4s],		train_loss: 4.3112
26:	[0s / 9s],		train_loss: 4.3218
71:	[0s / 14s],		train_loss: 4.2019
73:	[0s / 8s],		train_loss: 4.2542
36:	[0s / 23s],		train_loss: 4.3025
37:	[0s / 5s],		train_loss: 4.3077
74:	[0s / 8s],		train_loss: 4.2496
38:	[0s / 5s],		train_loss: 4.2865
72:	[0s / 14s],		train_loss: 4.2277
96:	[1s / 1m:44s],		train_loss: 4.1405
75:	[0s / 9s],		train_loss: 4.2331
27:	[0s / 9s],		train_loss: 4.2917
39:	[0s / 5s],		train_loss: 4.2989
76:	[0s / 9s],		train_loss: 4.2225
73:	[0s / 14s],		train_loss: 4.2362
40:	[0s / 5s],		train_loss: 4.3108
77:	[0s / 9s],		train_loss: 4.2395
41:	[0s / 5s],		train_loss: 4.3424
74:	[0s / 15s],		train_loss: 4.2431
78:	[0s / 9s],		train_loss: 4.2369
28:	[0s / 9s],		train_loss: 4.2927
42:	[0s / 5s],		train_loss: 4.3093
37:	[0s / 23s],		train_loss: 4.3272
79:	[0s / 9s],		train_loss: 4.2684
75:	[0s / 15s],		train_loss: 4.2373
43:	[0s / 5s],		train_loss: 4.3078
71:	[2s / 2m:24s],		train_loss: 4.1947
80:	[0s / 9s],		train_loss: 4.2743
44:	[0s / 5s],		train_loss: 4.2837
29:	[0s / 10s],		train_loss: 4.2852
76:	[0s / 15s],		train_loss: 4.1992
81:	[0s / 9s],		train_loss: 4.2642
45:	[0s / 6s],		train_loss: 4.3545
82:	[0s / 10s],		train_loss: 4.2735
46:	[0s / 6s],		train_loss: 4.3300
77:	[0s / 15s],		train_loss: 4.2116
83:	[0s / 10s],		train_loss: 4.1932
47:	[0s / 6s],		train_loss: 4.3255
84:	[0s / 10s],		train_loss: 4.1999
97:	[1s / 1m:45s],		train_loss: 4.1216
30:	[0s / 10s],		train_loss: 4.2688
78:	[0s / 16s],		train_loss: 4.2612
38:	[0s / 24s],		train_loss: 4.3132
48:	[0s / 6s],		train_loss: 4.2758
85:	[0s / 10s],		train_loss: 4.1950
49:	[0s / 6s],		train_loss: 4.2929
79:	[0s / 16s],		train_loss: 4.2326
86:	[0s / 10s],		train_loss: 4.2436
31:	[0s / 10s],		train_loss: 4.2616
50:	[0s / 6s],		train_loss: 4.3313
87:	[0s / 10s],		train_loss: 4.2011
80:	[0s / 16s],		train_loss: 4.2320
51:	[0s / 6s],		train_loss: 4.2708
88:	[0s / 10s],		train_loss: 4.2502
52:	[0s / 7s],		train_loss: 4.2926
81:	[0s / 16s],		train_loss: 4.2082
89:	[0s / 10s],		train_loss: 4.2057
39:	[0s / 25s],		train_loss: 4.3286
32:	[0s / 11s],		train_loss: 4.2851
53:	[0s / 7s],		train_loss: 4.2865
90:	[0s / 11s],		train_loss: 4.2378
97:	[3s / 5m:12s],		train_loss: 4.0095
82:	[0s / 16s],		train_loss: 4.2421
91:	[0s / 11s],		train_loss: 4.2201
54:	[0s / 7s],		train_loss: 4.2911
92:	[0s / 11s],		train_loss: 4.2755
55:	[0s / 7s],		train_loss: 4.3380
83:	[0s / 17s],		train_loss: 4.2415
33:	[0s / 11s],		train_loss: 4.3254
98:	[1s / 1m:47s],		train_loss: 4.1155
93:	[0s / 11s],		train_loss: 4.2465
56:	[0s / 7s],		train_loss: 4.2845
72:	[1s / 2m:26s],		train_loss: 4.2111
40:	[0s / 25s],		train_loss: 4.3334
84:	[0s / 17s],		train_loss: 4.2281
94:	[0s / 11s],		train_loss: 4.2549
57:	[0s / 7s],		train_loss: 4.3103
95:	[0s / 11s],		train_loss: 4.2147
58:	[0s / 7s],		train_loss: 4.2544
34:	[0s / 12s],		train_loss: 4.2812
85:	[0s / 17s],		train_loss: 4.2198
96:	[0s / 11s],		train_loss: 4.2457
59:	[0s / 8s],		train_loss: 4.2856
86:	[0s / 17s],		train_loss: 4.1992
97:	[0s / 12s],		train_loss: 4.2188
60:	[0s / 8s],		train_loss: 4.2778
35:	[0s / 12s],		train_loss: 4.3153
98:	[0s / 12s],		train_loss: 4.2060
61:	[0s / 8s],		train_loss: 4.2822
87:	[0s / 17s],		train_loss: 4.2133
41:	[0s / 26s],		train_loss: 4.2980
99:	[0s / 12s],		train_loss: 4.1807
62:	[0s / 8s],		train_loss: 4.2901
88:	[0s / 18s],		train_loss: 4.1835
63:	[0s / 8s],		train_loss: 4.2679
36:	[0s / 12s],		train_loss: 4.3332
0:	[0s / 0s],		train_loss: 5.0255
89:	[0s / 18s],		train_loss: 4.1774
64:	[0s / 8s],		train_loss: 4.3034
99:	[1s / 1m:48s],		train_loss: 4.1360
1:	[0s / 0s],		train_loss: 4.6077
65:	[0s / 8s],		train_loss: 4.2647
2:	[0s / 0s],		train_loss: 4.5245
90:	[0s / 18s],		train_loss: 4.1942
37:	[0s / 13s],		train_loss: 4.2910
66:	[0s / 9s],		train_loss: 4.3408
42:	[0s / 27s],		train_loss: 4.2703
3:	[0s / 0s],		train_loss: 4.5252
91:	[0s / 18s],		train_loss: 4.2622
67:	[0s / 9s],		train_loss: 4.2653
4:	[0s / 0s],		train_loss: 4.4624
68:	[0s / 9s],		train_loss: 4.2689
5:	[0s / 0s],		train_loss: 4.4576
92:	[0s / 19s],		train_loss: 4.2211
38:	[0s / 13s],		train_loss: 4.3095
73:	[1s / 2m:28s],		train_loss: 4.2523
69:	[0s / 9s],		train_loss: 4.2373
6:	[0s / 0s],		train_loss: 4.5036
70:	[0s / 9s],		train_loss: 4.2562
93:	[0s / 19s],		train_loss: 4.1928
7:	[0s / 1s],		train_loss: 4.4234
71:	[0s / 9s],		train_loss: 4.3035
8:	[0s / 1s],		train_loss: 4.4372
43:	[0s / 28s],		train_loss: 4.2880
39:	[0s / 13s],		train_loss: 4.2771
94:	[0s / 19s],		train_loss: 4.1864
0:	[0s / 0s],		train_loss: 4.8067
72:	[0s / 9s],		train_loss: 4.3181
9:	[0s / 1s],		train_loss: 4.4629
73:	[0s / 9s],		train_loss: 4.2343
10:	[0s / 1s],		train_loss: 4.4620
95:	[0s / 19s],		train_loss: 4.2115
74:	[0s / 10s],		train_loss: 4.2426
40:	[0s / 14s],		train_loss: 4.2553
11:	[0s / 1s],		train_loss: 4.4486
12:	[0s / 1s],		train_loss: 4.4036
96:	[0s / 19s],		train_loss: 4.1784
75:	[0s / 10s],		train_loss: 4.3009
44:	[0s / 28s],		train_loss: 4.2884
13:	[0s / 1s],		train_loss: 4.4058
76:	[0s / 10s],		train_loss: 4.2951
97:	[0s / 19s],		train_loss: 4.1756
41:	[0s / 14s],		train_loss: 4.3012
14:	[0s / 1s],		train_loss: 4.3919
77:	[0s / 10s],		train_loss: 4.2756
15:	[0s / 1s],		train_loss: 4.4584
78:	[0s / 10s],		train_loss: 4.3113
98:	[0s / 20s],		train_loss: 4.1645
16:	[0s / 2s],		train_loss: 4.4065
79:	[0s / 10s],		train_loss: 4.3209
42:	[0s / 14s],		train_loss: 4.2688
45:	[0s / 28s],		train_loss: 4.3622
99:	[0s / 20s],		train_loss: 4.2121
1:	[0s / 1s],		train_loss: 4.5247
17:	[0s / 2s],		train_loss: 4.3913
80:	[0s / 10s],		train_loss: 4.3182
18:	[0s / 2s],		train_loss: 4.3948
98:	[3s / 5m:15s],		train_loss: 4.0480
81:	[0s / 10s],		train_loss: 4.2756
19:	[0s / 2s],		train_loss: 4.3596
74:	[1s / 2m:30s],		train_loss: 4.2081
82:	[0s / 11s],		train_loss: 4.2816
0:	[0s / 0s],		train_loss: 5.2231
43:	[0s / 15s],		train_loss: 4.2867
20:	[0s / 2s],		train_loss: 4.4237
83:	[0s / 11s],		train_loss: 4.2471
1:	[0s / 0s],		train_loss: 4.5495
21:	[0s / 2s],		train_loss: 4.3831
46:	[0s / 29s],		train_loss: 4.3635
84:	[0s / 11s],		train_loss: 4.2336
22:	[0s / 2s],		train_loss: 4.4127
44:	[0s / 15s],		train_loss: 4.2611
85:	[0s / 11s],		train_loss: 4.2628
2:	[0s / 0s],		train_loss: 4.5007
23:	[0s / 2s],		train_loss: 4.3844
86:	[0s / 11s],		train_loss: 4.2618
24:	[0s / 2s],		train_loss: 4.3948
3:	[0s / 0s],		train_loss: 4.4726
87:	[0s / 11s],		train_loss: 4.2819
2:	[0s / 2s],		train_loss: 4.4752
45:	[0s / 15s],		train_loss: 4.2519
25:	[0s / 3s],		train_loss: 4.3726
88:	[0s / 11s],		train_loss: 4.2378
4:	[0s / 0s],		train_loss: 4.4515
26:	[0s / 3s],		train_loss: 4.3914
47:	[0s / 30s],		train_loss: 4.3244
89:	[0s / 11s],		train_loss: 4.2579
27:	[0s / 3s],		train_loss: 4.3687
5:	[0s / 1s],		train_loss: 4.4033
46:	[0s / 16s],		train_loss: 4.2895
90:	[0s / 11s],		train_loss: 4.2572
28:	[0s / 3s],		train_loss: 4.3320
91:	[0s / 12s],		train_loss: 4.2266
29:	[0s / 3s],		train_loss: 4.3428
6:	[0s / 1s],		train_loss: 4.4085
92:	[0s / 12s],		train_loss: 4.2924
30:	[0s / 3s],		train_loss: 4.3595
47:	[0s / 16s],		train_loss: 4.2635
93:	[0s / 12s],		train_loss: 4.2699
7:	[0s / 1s],		train_loss: 4.4104
31:	[0s / 3s],		train_loss: 4.3866
48:	[0s / 30s],		train_loss: 4.3284
94:	[0s / 12s],		train_loss: 4.2393
32:	[0s / 3s],		train_loss: 4.3693
8:	[0s / 1s],		train_loss: 4.4143
95:	[0s / 12s],		train_loss: 4.2385
48:	[0s / 16s],		train_loss: 4.3237
3:	[0s / 3s],		train_loss: 4.4499
75:	[1s / 2m:31s],		train_loss: 4.2010
33:	[0s / 4s],		train_loss: 4.3767
9:	[0s / 1s],		train_loss: 4.4021
96:	[0s / 12s],		train_loss: 4.2261
34:	[0s / 4s],		train_loss: 4.3157
97:	[0s / 12s],		train_loss: 4.2034
35:	[0s / 4s],		train_loss: 4.3626
10:	[0s / 2s],		train_loss: 4.4163
49:	[0s / 17s],		train_loss: 4.2403
98:	[0s / 12s],		train_loss: 4.2554
36:	[0s / 4s],		train_loss: 4.3437
49:	[0s / 31s],		train_loss: 4.3252
37:	[0s / 4s],		train_loss: 4.3973
99:	[0s / 13s],		train_loss: 4.2195
11:	[0s / 2s],		train_loss: 4.4262
50:	[0s / 17s],		train_loss: 4.2853
38:	[0s / 4s],		train_loss: 4.3959
12:	[0s / 2s],		train_loss: 4.4101
0:	[0s / 0s],		train_loss: 4.9494
39:	[0s / 4s],		train_loss: 4.3898
40:	[0s / 4s],		train_loss: 4.3447
1:	[0s / 0s],		train_loss: 4.5492
51:	[0s / 17s],		train_loss: 4.2424
13:	[0s / 2s],		train_loss: 4.3749
41:	[0s / 5s],		train_loss: 4.3533
2:	[0s / 0s],		train_loss: 4.4849
50:	[0s / 31s],		train_loss: 4.3047
4:	[1s / 4s],		train_loss: 4.4416
42:	[0s / 5s],		train_loss: 4.3415
14:	[0s / 2s],		train_loss: 4.3966
3:	[0s / 0s],		train_loss: 4.4503
43:	[0s / 5s],		train_loss: 4.3463
52:	[0s / 18s],		train_loss: 4.2440
4:	[0s / 0s],		train_loss: 4.4328
44:	[0s / 5s],		train_loss: 4.3519
15:	[0s / 3s],		train_loss: 4.3894
5:	[0s / 0s],		train_loss: 4.4479
45:	[0s / 5s],		train_loss: 4.3773
16:	[0s / 3s],		train_loss: 4.3467
6:	[0s / 0s],		train_loss: 4.4108
51:	[0s / 32s],		train_loss: 4.3299
46:	[0s / 5s],		train_loss: 4.3390
53:	[0s / 18s],		train_loss: 4.3057
7:	[0s / 0s],		train_loss: 4.3768
47:	[0s / 5s],		train_loss: 4.3438
17:	[0s / 3s],		train_loss: 4.3676
48:	[0s / 5s],		train_loss: 4.3340
8:	[0s / 1s],		train_loss: 4.3492
99:	[3s / 5m:19s],		train_loss: 4.0645
49:	[0s / 5s],		train_loss: 4.3373
9:	[0s / 1s],		train_loss: 4.3640
18:	[0s / 3s],		train_loss: 4.3902
54:	[0s / 18s],		train_loss: 4.2730
50:	[0s / 6s],		train_loss: 4.3491
76:	[2s / 2m:33s],		train_loss: 4.2046
10:	[0s / 1s],		train_loss: 4.3249
5:	[1s / 5s],		train_loss: 4.4424
19:	[0s / 3s],		train_loss: 4.3608
52:	[0s / 33s],		train_loss: 4.3247
51:	[0s / 6s],		train_loss: 4.2897
11:	[0s / 1s],		train_loss: 4.3381
52:	[0s / 6s],		train_loss: 4.3211
12:	[0s / 1s],		train_loss: 4.3428
20:	[0s / 4s],		train_loss: 4.3603
55:	[0s / 19s],		train_loss: 4.2756
53:	[0s / 6s],		train_loss: 4.3111
13:	[0s / 1s],		train_loss: 4.3735
54:	[0s / 6s],		train_loss: 4.2985
21:	[0s / 4s],		train_loss: 4.3665
14:	[0s / 1s],		train_loss: 4.4053
55:	[0s / 6s],		train_loss: 4.3562
56:	[0s / 19s],		train_loss: 4.3156
56:	[0s / 6s],		train_loss: 4.3459
22:	[0s / 4s],		train_loss: 4.3329
15:	[0s / 2s],		train_loss: 4.3721
53:	[0s / 33s],		train_loss: 4.3219
57:	[0s / 6s],		train_loss: 4.2926
16:	[0s / 2s],		train_loss: 4.3492
23:	[0s / 4s],		train_loss: 4.3476
58:	[0s / 6s],		train_loss: 4.2857
17:	[0s / 2s],		train_loss: 4.3578
59:	[0s / 6s],		train_loss: 4.3175
57:	[0s / 19s],		train_loss: 4.3350
6:	[0s / 6s],		train_loss: 4.3938
24:	[0s / 4s],		train_loss: 4.3536
18:	[0s / 2s],		train_loss: 4.3519
60:	[0s / 7s],		train_loss: 4.3802
19:	[0s / 2s],		train_loss: 4.3636
61:	[0s / 7s],		train_loss: 4.3160
25:	[0s / 4s],		train_loss: 4.3677
62:	[0s / 7s],		train_loss: 4.3345
20:	[0s / 2s],		train_loss: 4.3416
58:	[0s / 20s],		train_loss: 4.3230
54:	[0s / 34s],		train_loss: 4.3038
63:	[0s / 7s],		train_loss: 4.2988
21:	[0s / 2s],		train_loss: 4.2938
26:	[0s / 5s],		train_loss: 4.3374
64:	[0s / 7s],		train_loss: 4.3344
22:	[0s / 2s],		train_loss: 4.3041
77:	[1s / 2m:35s],		train_loss: 4.1856
65:	[0s / 7s],		train_loss: 4.2942
59:	[0s / 20s],		train_loss: 4.3020
27:	[0s / 5s],		train_loss: 4.3488
23:	[0s / 2s],		train_loss: 4.3209
66:	[0s / 7s],		train_loss: 4.3275
24:	[0s / 3s],		train_loss: 4.3608
67:	[0s / 7s],		train_loss: 4.3150
28:	[0s / 5s],		train_loss: 4.3201
7:	[0s / 7s],		train_loss: 4.3971
55:	[0s / 34s],		train_loss: 4.2669
68:	[0s / 7s],		train_loss: 4.2953
25:	[0s / 3s],		train_loss: 4.3143
60:	[0s / 20s],		train_loss: 4.2704
29:	[0s / 5s],		train_loss: 4.3491
69:	[0s / 8s],		train_loss: 4.3477
26:	[0s / 3s],		train_loss: 4.3317
70:	[0s / 8s],		train_loss: 4.2982
27:	[0s / 3s],		train_loss: 4.3079
30:	[0s / 5s],		train_loss: 4.3091
61:	[0s / 21s],		train_loss: 4.2522
71:	[0s / 8s],		train_loss: 4.3336
28:	[0s / 3s],		train_loss: 4.3300
72:	[0s / 8s],		train_loss: 4.3267
31:	[0s / 6s],		train_loss: 4.3294
29:	[0s / 3s],		train_loss: 4.3668
73:	[0s / 8s],		train_loss: 4.3061
56:	[0s / 35s],		train_loss: 4.2418
62:	[0s / 21s],		train_loss: 4.2621
30:	[0s / 4s],		train_loss: 4.3691
74:	[0s / 8s],		train_loss: 4.3163
32:	[0s / 6s],		train_loss: 4.3111
75:	[0s / 8s],		train_loss: 4.3435
31:	[0s / 4s],		train_loss: 4.3315
8:	[1s / 8s],		train_loss: 4.4406
33:	[0s / 6s],		train_loss: 4.3473
76:	[0s / 8s],		train_loss: 4.3315
32:	[0s / 4s],		train_loss: 4.3328
63:	[0s / 21s],		train_loss: 4.2686
77:	[0s / 9s],		train_loss: 4.2786
33:	[0s / 4s],		train_loss: 4.2955
34:	[0s / 6s],		train_loss: 4.3185
78:	[0s / 9s],		train_loss: 4.3329
57:	[0s / 36s],		train_loss: 4.2891
34:	[0s / 4s],		train_loss: 4.2995
79:	[0s / 9s],		train_loss: 4.3247
35:	[0s / 7s],		train_loss: 4.3066
64:	[0s / 22s],		train_loss: 4.2371
78:	[1s / 2m:37s],		train_loss: 4.1854
0:	[3s / 3s],		train_loss: 5.6856
35:	[0s / 4s],		train_loss: 4.3002
80:	[0s / 9s],		train_loss: 4.3183
36:	[0s / 4s],		train_loss: 4.3154
81:	[0s / 9s],		train_loss: 4.3133
36:	[0s / 7s],		train_loss: 4.2895
82:	[0s / 9s],		train_loss: 4.3093
9:	[0s / 9s],		train_loss: 4.3951
37:	[0s / 5s],		train_loss: 4.3095
65:	[0s / 22s],		train_loss: 4.3123
58:	[0s / 36s],		train_loss: 4.2858
37:	[0s / 7s],		train_loss: 4.3258
83:	[0s / 9s],		train_loss: 4.2768
38:	[0s / 5s],		train_loss: 4.3144
84:	[0s / 9s],		train_loss: 4.3391
39:	[0s / 5s],		train_loss: 4.2882
38:	[0s / 7s],		train_loss: 4.3281
85:	[0s / 10s],		train_loss: 4.3350
66:	[0s / 22s],		train_loss: 4.2794
40:	[0s / 5s],		train_loss: 4.3111
86:	[0s / 10s],		train_loss: 4.2725
39:	[0s / 7s],		train_loss: 4.2773
87:	[0s / 10s],		train_loss: 4.2386
41:	[0s / 5s],		train_loss: 4.2845
40:	[0s / 8s],		train_loss: 4.2988
88:	[0s / 10s],		train_loss: 4.2553
59:	[0s / 37s],		train_loss: 4.2430
42:	[0s / 5s],		train_loss: 4.2674
67:	[0s / 23s],		train_loss: 4.2384
89:	[0s / 10s],		train_loss: 4.2906
43:	[0s / 5s],		train_loss: 4.2970
41:	[0s / 8s],		train_loss: 4.2898
90:	[0s / 10s],		train_loss: 4.2886
44:	[0s / 6s],		train_loss: 4.3280
91:	[0s / 10s],		train_loss: 4.2944
10:	[1s / 10s],		train_loss: 4.4656
42:	[0s / 8s],		train_loss: 4.2655
68:	[0s / 23s],		train_loss: 4.2669
92:	[0s / 10s],		train_loss: 4.3064
45:	[0s / 6s],		train_loss: 4.3298
93:	[0s / 11s],		train_loss: 4.2688
43:	[0s / 8s],		train_loss: 4.3104
46:	[0s / 6s],		train_loss: 4.3077
60:	[0s / 37s],		train_loss: 4.3014
94:	[0s / 11s],		train_loss: 4.2372
69:	[0s / 23s],		train_loss: 4.2513
47:	[0s / 6s],		train_loss: 4.3074
44:	[0s / 8s],		train_loss: 4.3431
95:	[0s / 11s],		train_loss: 4.3492
48:	[0s / 6s],		train_loss: 4.2902
96:	[0s / 11s],		train_loss: 4.3010
45:	[0s / 9s],		train_loss: 4.2791
49:	[0s / 6s],		train_loss: 4.3207
70:	[0s / 24s],		train_loss: 4.2833
97:	[0s / 11s],		train_loss: 4.2810
79:	[2s / 2m:39s],		train_loss: 4.2004
50:	[0s / 6s],		train_loss: 4.2999
98:	[0s / 11s],		train_loss: 4.2537
61:	[0s / 38s],		train_loss: 4.2554
46:	[0s / 9s],		train_loss: 4.3419
99:	[0s / 11s],		train_loss: 4.2598
51:	[0s / 7s],		train_loss: 4.2667
52:	[0s / 7s],		train_loss: 4.2662
71:	[0s / 24s],		train_loss: 4.2678
47:	[0s / 9s],		train_loss: 4.3350
11:	[1s / 11s],		train_loss: 4.3961
0:	[0s / 0s],		train_loss: 5.2634
53:	[0s / 7s],		train_loss: 4.2819
48:	[0s / 9s],		train_loss: 4.2825
1:	[0s / 0s],		train_loss: 4.5918
54:	[0s / 7s],		train_loss: 4.2575
2:	[0s / 0s],		train_loss: 4.5292
55:	[0s / 7s],		train_loss: 4.2792
49:	[0s / 10s],		train_loss: 4.2886
72:	[0s / 25s],		train_loss: 4.2501
62:	[0s / 39s],		train_loss: 4.2674
3:	[0s / 0s],		train_loss: 4.4810
56:	[0s / 7s],		train_loss: 4.2739
50:	[0s / 10s],		train_loss: 4.2845
4:	[0s / 0s],		train_loss: 4.4624
57:	[0s / 7s],		train_loss: 4.3479
5:	[0s / 0s],		train_loss: 4.4370
73:	[0s / 25s],		train_loss: 4.2581
58:	[0s / 8s],		train_loss: 4.2637
51:	[0s / 10s],		train_loss: 4.2805
6:	[0s / 0s],		train_loss: 4.38