[I 2026-06-28 01:35:58,787] Trial 16 finished with value: 0.7488662327107676 and parameters: {'num_nodes': [32], 'dropout': 0.17572900015856222, 'learning_rate': 0.001793996874947851, 'batch_norm': False}. Best is trial 14 with value: 0.7751259315484406.
/scratch.hpc/luca.cotugno/Foundation_model_clinical_data/test_tabular_model.py:481: UserWarning: Choices for a categorical distribution should be a tuple of None, bool, int, float and str for persistent storage but contains [32] which is of type list.
  num_nodes  = trial.suggest_categorical("num_nodes", [[32], [64], [128], [64, 32], [128, 64]])
/scratch.hpc/luca.cotugno/Foundation_model_clinical_data/test_tabular_model.py:481: UserWarning: Choices for a categorical distribution should be a tuple of None, bool, int, float and str for persistent storage but contains [64] which is of type list.
  num_nodes  = trial.suggest_categorical("num_nodes", [[32], [64], [128], [64, 32], [128, 64]])
/scratch.hpc/luca.cotugno/Foundation_model_clinical_data/test_tabular_model.py:481: UserWarning: Choices for a categorical distribution should be a tuple of None, bool, int, float and str for persistent storage but contains [128] which is of type list.
  num_nodes  = trial.suggest_categorical("num_nodes", [[32], [64], [128], [64, 32], [128, 64]])
/scratch.hpc/luca.cotugno/Foundation_model_clinical_data/test_tabular_model.py:481: UserWarning: Choices for a categorical distribution should be a tuple of None, bool, int, float and str for persistent storage but contains [64, 32] which is of type list.
  num_nodes  = trial.suggest_categorical("num_nodes", [[32], [64], [128], [64, 32], [128, 64]])
/scratch.hpc/luca.cotugno/Foundation_model_clinical_data/test_tabular_model.py:481: UserWarning: Choices for a categorical distribution should be a tuple of None, bool, int, float and str for persistent storage but contains [128, 64] which is of type list.
  num_nodes  = trial.suggest_categorical("num_nodes", [[32], [64], [128], [64, 32], [128, 64]])
STARTED  model=tabdpt  seed=123  tuning=True  shap=False


Preprocess: Replace NaN with -1
Loading existing folds from tmp/splits/OrmoniTirodei_seed123.pkl
X_train shape: (5161, 76), X_test shape: (1291, 76)
Generating TABDPT Embeddings...
<class 'dict'>
Loaded TabDPTModel from checkpoint.
<class 'dict'>
Loaded TabDPTModel from checkpoint.
Successfully generated embeddings with shape: (5161, 768)
  [ckpt] Loading TABDPT DeepSurv Tuned from checkpoints/tabdpt/OrmoniTirodei/-1/seed123/fold1
C-index train: 0.7911
C-index test:  0.7739
  [ckpt] Loading TABDPT RSF Tuned from checkpoints/tabdpt/OrmoniTirodei/-1/seed123/fold1
C-index train: 0.8675
C-index test:  0.7720
  [ckpt] Loading DeepSurv Simple from checkpoints/tabdpt/OrmoniTirodei/-1/seed123/fold1/tabdpt_deepsurv_simple.pt
C-index TRAIN: 0.7881
C-index TEST:  0.7464
  [ckpt] Loading DeepSurv Vanilla from checkpoints/tabdpt/OrmoniTirodei/-1/seed123/fold1/tabdpt_deepsurv_vanilla.pt
C-index TRAIN: 0.8090
C-index TEST:  0.7716
  [ckpt] Loading TABDPT RSF from checkpoints/tabdpt/OrmoniTirodei/-1/seed123/fold1/tabdpt_rsf.pkl
C-index train: 0.9198
C-index test:  0.7730
  [ckpt] Loading TABDPT Cox (embedding) from checkpoints/tabdpt/OrmoniTirodei/-1/seed123/fold1/tabdpt_tab_cox.pkl
C-index train: 0.8098
C-index test:  0.7713
  [ckpt] Loading DeepSurv Vanilla baseline from checkpoints/tabdpt/OrmoniTirodei/-1/seed123/fold1/deepsurv_vanilla_baseline.pt
C-index TRAIN: 0.8093
C-index TEST:  0.7892
  [ckpt] Loading DeepSurv Simple baseline from checkpoints/tabdpt/OrmoniTirodei/-1/seed123/fold1/deepsurv_simple_baseline.pt
C-index TRAIN: 0.7735
C-index TEST:  0.7463
  [ckpt] Loading RSF baseline from checkpoints/tabdpt/OrmoniTirodei/-1/seed123/fold1/rsf_baseline.pkl
C-index train: 0.9083
C-index test:  0.7925
  [ckpt] Loading Cox baseline from checkpoints/tabdpt/OrmoniTirodei/-1/seed123/fold1/tabdpt_cox.pkl
C-index train: 0.8011
C-index test:  0.7873
X_train shape: (5161, 76), X_test shape: (1291, 76)
Generating TABDPT Embeddings...
<class 'dict'>
Loaded TabDPTModel from checkpoint.
<class 'dict'>
Loaded TabDPTModel from checkpoint.
Successfully generated embeddings with shape: (5161, 768)
  [ckpt] Loading TABDPT DeepSurv Tuned from checkpoints/tabdpt/OrmoniTirodei/-1/seed123/fold2
C-index train: 0.8093
C-index test:  0.7783
[Trial 0] START
[Trial 0] fitting...
[Trial 1] START
[Trial 1] fitting...
[Trial 2] START
[Trial 2] fitting...
[Trial 3] START
[Trial 3] fitting...
[Trial 4] START
[Trial 4] fitting...
[Trial 5] START
[Trial 5] fitting...
[Trial 6] START
[Trial 6] fitting...
[Trial 7] START
[Trial 7] fitting...
[Trial 2] done
[Trial 8] START
[Trial 8] fitting...
[Trial 3] done
[Trial 9] START
[Trial 9] fitting...
[Trial 6] done
[Trial 10] START
[Trial 10] fitting...
[Trial 1] done
[Trial 11] START
[Trial 11] fitting...
[Trial 5] done
[Trial 12] START
[Trial 12] fitting...
[Trial 0] done
[Trial 13] START
[Trial 13] fitting...
[Trial 7] done
[Trial 14] START
[Trial 14] fitting...
[Trial 10] done
[Trial 15] START
[Trial 15] fitting...
[Trial 11] done
[Trial 16] START
[Trial 16] fitting...
[Trial 12] done
[Trial 17] START
[Trial 17] fitting...
[Trial 16] done
[Trial 18] START
[Trial 18] fitting...
[Trial 14] done
[Trial 19] START
[Trial 19] fitting...
[Trial 4] done
[Trial 20] START
[Trial 20] fitting...
[Trial 15] done
[Trial 21] START
[Trial 21] fitting...
[Trial 19] done
[Trial 22] START
[Trial 22] fitting...
[Trial 18] done
[Trial 23] START
[Trial 23] fitting...
[Trial 8] done
[Trial 24] START
[Trial 24] fitting...
[Trial 20] done
[Trial 25] START
[Trial 25] fitting...
[Trial 21] done
[Trial 26] START
[Trial 26] fitting...
[Trial 24] done
[Trial 27] START
[Trial 27] fitting...
[Trial 17] done
[Trial 28] START
[Trial 28] fitting...
[Trial 25] done
[Trial 29] START
[Trial 29] fitting...
[Trial 9] done
[Trial 30] START
[Trial 30] fitting...
[Trial 23] done
[Trial 31] START
[Trial 31] fitting...
[Trial 26] done
[Trial 32] START
[Trial 32] fitting...
[Trial 13] done
[Trial 22] done
[Trial 33] START
[Trial 33] fitting...
[Trial 34] START
[Trial 34] fitting...
[Trial 27] done
[Trial 35] START
[Trial 35] fitting...
[Trial 28] done
[Trial 36] START
[Trial 36] fitting...
[Trial 29] done
[Trial 37] START
[Trial 37] fitting...
[Trial 30] done
[Trial 38] START
[Trial 38] fitting...
[Trial 32] done
[Trial 39] START
[Trial 39] fitting...
[Trial 34] done
[Trial 33] done
[Trial 40] START
[Trial 40] fitting...
[Trial 41] START
[Trial 41] fitting...
[Trial 31] done
[Trial 42] START
[Trial 42] fitting...
[Trial 35] done
[Trial 43] START
[Trial 43] fitting...
[Trial 38] done
[Trial 44] START
[Trial 44] fitting...
[Trial 39] done
[Trial 45] START
[Trial 45] fitting...
[Trial 40] done
[Trial 46] START
[Trial 46] fitting...
[Trial 41] done
[Trial 47] START
[Trial 47] fitting...
[Trial 43] done
[Trial 48] START
[Trial 48] fitting...
[Trial 42] done
[Trial 49] START
[Trial 49] fitting...
[Trial 44] done
[Trial 50] START
[Trial 50] fitting...
[Trial 45] done
[Trial 51] START
[Trial 51] fitting...
[Trial 36] done
[Trial 52] START
[Trial 52] fitting...
[Trial 46] done
[Trial 53] START
[Trial 53] fitting...
[Trial 37] done
[Trial 54] START
[Trial 54] fitting...
[Trial 50] done
[Trial 55] START
[Trial 55] fitting...
[Trial 48] done
[Trial 56] START
[Trial 56] fitting...
[Trial 51] done
[Trial 57] START
[Trial 57] fitting...
[Trial 49] done
[Trial 58] START
[Trial 58] fitting...
[Trial 52] done
[Trial 59] START
[Trial 59] fitting...
[Trial 53] done
[Trial 60] START
[Trial 60] fitting...
[Trial 57] done
[Trial 61] START
[Trial 61] fitting...
[Trial 54] done
[Trial 62] START
[Trial 62] fitting...
[Trial 55] done
[Trial 63] START
[Trial 63] fitting...
[Trial 56] done
[Trial 64] START
[Trial 64] fitting...
[Trial 47] done
[Trial 65] START
[Trial 65] fitting...
[Trial 58] done
[Trial 66] START
[Trial 66] fitting...
[Trial 59] done
[Trial 67] START
[Trial 67] fitting...
[Trial 60] done
[Trial 68] START
[Trial 68] fitting...
[Trial 61] done
[Trial 69] START
[Trial 69] fitting...
[Trial 62] done
[Trial 70] START
[Trial 70] fitting...
[Trial 64] done
[Trial 71] START
[Trial 71] fitting...
[Trial 65] done
[Trial 72] START
[Trial 72] fitting...
[Trial 63] done
[Trial 73] START
[Trial 73] fitting...
[Trial 66] done
[Trial 74] START
[Trial 74] fitting...
[Trial 67] done
[Trial 75] START
[Trial 75] fitting...
[Trial 68] done
[Trial 76] START
[Trial 76] fitting...
[Trial 69] done
[Trial 77] START
[Trial 77] fitting...
[Trial 70] done
[Trial 78] START
[Trial 78] fitting...
[Trial 71] done
[Trial 79] START
[Trial 79] fitting...
[Trial 72] done
[Trial 80] START
[Trial 80] fitting...
[Trial 73] done
[Trial 81] START
[Trial 81] fitting...
[Trial 74] done
[Trial 82] START
[Trial 82] fitting...
[Trial 77] done
[Trial 83] START
[Trial 83] fitting...
[Trial 75] done
[Trial 84] START
[Trial 84] fitting...
[Trial 76] done
[Trial 85] START
[Trial 85] fitting...
[Trial 84] done
[Trial 86] START
[Trial 86] fitting...
[Trial 85] done
[Trial 87] START
[Trial 87] fitting...
[Trial 80] done
[Trial 88] START
[Trial 88] fitting...
[Trial 78] done
[Trial 89] START
[Trial 89] fitting...
[Trial 79] done
[Trial 90] START
[Trial 90] fitting...
[Trial 88] done
[Trial 91] START
[Trial 91] fitting...
[Trial 81] done
[Trial 92] START
[Trial 92] fitting...
[Trial 86] done
[Trial 93] START
[Trial 93] fitting...
[Trial 87] done
[Trial 94] START
[Trial 94] fitting...
[Trial 82] done
[Trial 95] START
[Trial 95] fitting...
[Trial 89] done
[Trial 96] START
[Trial 96] fitting...
[Trial 90] done
[Trial 97] START
[Trial 97] fitting...
[Trial 92] done
[Trial 98] START
[Trial 98] fitting...
[Trial 91] done
[Trial 99] START
[Trial 99] fitting...
[Trial 93] done
[Trial 94] done
[Trial 95] done
[Trial 96] done
[Trial 97] done
[Trial 98] done
[Trial 99] done
[Trial 83] done
  [ckpt] Params saved → checkpoints/tabdpt/OrmoniTirodei/-1/seed123/fold2/tabdpt_rsf_tuned_params.json
  [ckpt] TABDPT RSF Tuned saved → checkpoints/tabdpt/OrmoniTirodei/-1/seed123/fold2/tabdpt_rsf_tuned.pkl
C-index train: 0.8934
C-index test:  0.7644
  [surv] Saved → survival_predictions/tabdpt/OrmoniTirodei/-1/seed123/fold2/tabdpt_rsf_tuned.pkl
  [ckpt] Loading DeepSurv Simple from checkpoints/tabdpt/OrmoniTirodei/-1/seed123/fold2/tabdpt_deepsurv_simple.pt
C-index TRAIN: 0.7801
C-index TEST:  0.7497
  [ckpt] Loading DeepSurv Vanilla from checkpoints/tabdpt/OrmoniTirodei/-1/seed123/fold2/tabdpt_deepsurv_vanilla.pt
C-index TRAIN: 0.8101
C-index TEST:  0.7801
  [ckpt] Loading TABDPT RSF from checkpoints/tabdpt/OrmoniTirodei/-1/seed123/fold2/tabdpt_rsf.pkl
C-index train: 0.9197
C-index test:  0.7632
  [ckpt] Loading TABDPT Cox (embedding) from checkpoints/tabdpt/OrmoniTirodei/-1/seed123/fold2/tabdpt_tab_cox.pkl
C-index train: 0.8133
C-index test:  0.7755
  [ckpt] Loading DeepSurv Vanilla baseline from checkpoints/tabdpt/OrmoniTirodei/-1/seed123/fold2/deepsurv_vanilla_baseline.pt
C-index TRAIN: 0.8038
C-index TEST:  0.8003
  [ckpt] Loading DeepSurv Simple baseline from checkpoints/tabdpt/OrmoniTirodei/-1/seed123/fold2/deepsurv_simple_baseline.pt
C-index TRAIN: 0.7903
C-index TEST:  0.7965
  [ckpt] Loading RSF baseline from checkpoints/tabdpt/OrmoniTirodei/-1/seed123/fold2/rsf_baseline.pkl
C-index train: 0.9092
C-index test:  0.7914
  [ckpt] Loading Cox baseline from checkpoints/tabdpt/OrmoniTirodei/-1/seed123/fold2/tabdpt_cox.pkl
C-index train: 0.8003
C-index test:  0.7982
X_train shape: (5162, 76), X_test shape: (1290, 76)
Generating TABDPT Embeddings...
<class 'dict'>
Loaded TabDPTModel from checkpoint.
<class 'dict'>
Loaded TabDPTModel from checkpoint.
Successfully generated embeddings with shape: (5162, 768)
0:	[2s / 2s],		train_loss: 4.5957
0:	[2s / 2s],		train_loss: 4.5984
0:	[2s / 2s],		train_loss: 4.6703
1:	[0s / 3s],		train_loss: 4.3774
0:	[3s / 3s],		train_loss: 4.6792
0:	[3s / 3s],		train_loss: 4.6265
1:	[0s / 3s],		train_loss: 4.4765
1:	[0s / 3s],		train_loss: 4.4035
2:	[0s / 3s],		train_loss: 4.3427
0:	[3s / 3s],		train_loss: 4.5794
0:	[3s / 3s],		train_loss: 5.4433
0:	[3s / 3s],		train_loss: 4.7260
3:	[0s / 3s],		train_loss: 4.3346
2:	[0s / 3s],		train_loss: 4.3938
2:	[0s / 3s],		train_loss: 4.3222
1:	[0s / 3s],		train_loss: 4.5292
1:	[0s / 3s],		train_loss: 4.4099
4:	[0s / 3s],		train_loss: 4.2945
5:	[0s / 3s],		train_loss: 4.2983
3:	[0s / 3s],		train_loss: 4.3746
3:	[0s / 3s],		train_loss: 4.3388
2:	[0s / 3s],		train_loss: 4.3491
2:	[0s / 3s],		train_loss: 4.4471
6:	[0s / 3s],		train_loss: 4.2438
4:	[0s / 4s],		train_loss: 4.2896
4:	[0s / 4s],		train_loss: 4.3481
7:	[0s / 4s],		train_loss: 4.2087
8:	[0s / 4s],		train_loss: 4.1850
1:	[0s / 4s],		train_loss: 4.7445
1:	[0s / 4s],		train_loss: 4.4397
1:	[0s / 4s],		train_loss: 4.4484
3:	[0s / 4s],		train_loss: 4.3599
3:	[0s / 4s],		train_loss: 4.4069
5:	[0s / 4s],		train_loss: 4.3574
5:	[0s / 4s],		train_loss: 4.2545
9:	[0s / 4s],		train_loss: 4.1588
10:	[0s / 4s],		train_loss: 4.1585
4:	[0s / 4s],		train_loss: 4.3001
6:	[0s / 4s],		train_loss: 4.2679
6:	[0s / 4s],		train_loss: 4.3105
4:	[0s / 4s],		train_loss: 4.3900
11:	[0s / 4s],		train_loss: 4.1306
12:	[0s / 4s],		train_loss: 4.1302
5:	[0s / 4s],		train_loss: 4.3234
7:	[0s / 4s],		train_loss: 4.2750
7:	[0s / 4s],		train_loss: 4.2277
13:	[0s / 5s],		train_loss: 4.0954
5:	[0s / 5s],		train_loss: 4.3471
8:	[0s / 5s],		train_loss: 4.2818
8:	[0s / 5s],		train_loss: 4.2209
6:	[0s / 5s],		train_loss: 4.2861
14:	[0s / 5s],		train_loss: 4.0686
2:	[1s / 5s],		train_loss: 4.4394
2:	[1s / 5s],		train_loss: 4.4142
2:	[1s / 5s],		train_loss: 4.5563
15:	[0s / 5s],		train_loss: 4.0746
9:	[0s / 5s],		train_loss: 4.2807
9:	[0s / 5s],		train_loss: 4.2109
7:	[0s / 5s],		train_loss: 4.2626
6:	[0s / 5s],		train_loss: 4.3492
16:	[0s / 5s],		train_loss: 4.0109
17:	[0s / 5s],		train_loss: 4.0294
10:	[0s / 5s],		train_loss: 4.2724
10:	[0s / 5s],		train_loss: 4.2137
8:	[0s / 5s],		train_loss: 4.2570
18:	[0s / 5s],		train_loss: 3.9789
7:	[0s / 5s],		train_loss: 4.3074
11:	[0s / 6s],		train_loss: 4.1752
11:	[0s / 6s],		train_loss: 4.2643
9:	[0s / 6s],		train_loss: 4.2132
19:	[0s / 6s],		train_loss: 3.9390
12:	[0s / 6s],		train_loss: 4.2489
20:	[0s / 6s],		train_loss: 3.8991
12:	[0s / 6s],		train_loss: 4.1533
13:	[0s / 6s],		train_loss: 4.2361
21:	[0s / 6s],		train_loss: 3.9653
10:	[0s / 6s],		train_loss: 4.2209
8:	[0s / 6s],		train_loss: 4.2822
22:	[0s / 6s],		train_loss: 3.9049
14:	[0s / 6s],		train_loss: 4.2170
13:	[0s / 6s],		train_loss: 4.1079
23:	[0s / 6s],		train_loss: 3.8798
15:	[0s / 6s],		train_loss: 4.2321
11:	[0s / 6s],		train_loss: 4.2143
14:	[0s / 6s],		train_loss: 4.1130
24:	[0s / 6s],		train_loss: 3.8842
16:	[0s / 6s],		train_loss: 4.2115
3:	[1s / 6s],		train_loss: 4.3837
3:	[1s / 6s],		train_loss: 4.3851
3:	[1s / 6s],		train_loss: 4.4920
25:	[0s / 6s],		train_loss: 3.8785
17:	[0s / 6s],		train_loss: 4.1737
15:	[0s / 6s],		train_loss: 4.1012
9:	[0s / 7s],		train_loss: 4.2886
26:	[0s / 7s],		train_loss: 3.8246
12:	[0s / 7s],		train_loss: 4.1944
18:	[0s / 7s],		train_loss: 4.1550
16:	[0s / 7s],		train_loss: 4.0576
27:	[0s / 7s],		train_loss: 3.8129
19:	[0s / 7s],		train_loss: 4.1524
28:	[0s / 7s],		train_loss: 3.7891
20:	[0s / 7s],		train_loss: 4.1470
17:	[0s / 7s],		train_loss: 4.0393
13:	[0s / 7s],		train_loss: 4.2077
29:	[0s / 7s],		train_loss: 3.7937
21:	[0s / 7s],		train_loss: 4.1386
30:	[0s / 7s],		train_loss: 3.8084
18:	[0s / 7s],		train_loss: 4.0112
22:	[0s / 7s],		train_loss: 4.1206
10:	[0s / 7s],		train_loss: 4.2876
31:	[0s / 7s],		train_loss: 3.7590
23:	[0s / 7s],		train_loss: 4.1086
14:	[0s / 7s],		train_loss: 4.2043
19:	[0s / 7s],		train_loss: 3.9986
32:	[0s / 7s],		train_loss: 3.7599
24:	[0s / 7s],		train_loss: 4.1337
33:	[0s / 8s],		train_loss: 3.7436
20:	[0s / 8s],		train_loss: 3.9791
25:	[0s / 8s],		train_loss: 4.0939
15:	[0s / 8s],		train_loss: 4.1774
34:	[0s / 8s],		train_loss: 3.6816
11:	[0s / 8s],		train_loss: 4.2760
26:	[0s / 8s],		train_loss: 4.0957
21:	[0s / 8s],		train_loss: 3.9613
35:	[0s / 8s],		train_loss: 3.7175
27:	[0s / 8s],		train_loss: 4.1016
36:	[0s / 8s],		train_loss: 3.6992
22:	[0s / 8s],		train_loss: 3.9695
16:	[0s / 8s],		train_loss: 4.1522
28:	[0s / 8s],		train_loss: 4.1134
37:	[0s / 8s],		train_loss: 3.6984
4:	[1s / 8s],		train_loss: 4.3401
29:	[0s / 8s],		train_loss: 4.0962
4:	[1s / 8s],		train_loss: 4.3606
4:	[1s / 8s],		train_loss: 4.4474
38:	[0s / 8s],		train_loss: 3.6971
23:	[0s / 8s],		train_loss: 3.9492
30:	[0s / 8s],		train_loss: 4.0947
12:	[0s / 8s],		train_loss: 4.2610
39:	[0s / 8s],		train_loss: 3.6680
17:	[0s / 8s],		train_loss: 4.1697
40:	[0s / 9s],		train_loss: 3.6592
24:	[0s / 9s],		train_loss: 3.9117
31:	[0s / 9s],		train_loss: 4.0722
41:	[0s / 9s],		train_loss: 3.6661
32:	[0s / 9s],		train_loss: 4.0956
25:	[0s / 9s],		train_loss: 3.9184
42:	[0s / 9s],		train_loss: 3.5695
33:	[0s / 9s],		train_loss: 4.0685
18:	[0s / 9s],		train_loss: 4.1488
43:	[0s / 9s],		train_loss: 3.6226
34:	[0s / 9s],		train_loss: 4.0740
26:	[0s / 9s],		train_loss: 3.8844
13:	[0s / 9s],		train_loss: 4.2778
44:	[0s / 9s],		train_loss: 3.5887
35:	[0s / 9s],		train_loss: 4.0146
27:	[0s / 9s],		train_loss: 3.8711
19:	[0s / 9s],		train_loss: 4.1225
45:	[0s / 9s],		train_loss: 3.6226
36:	[0s / 9s],		train_loss: 4.0095
46:	[0s / 9s],		train_loss: 3.6127
28:	[0s / 9s],		train_loss: 3.8469
37:	[0s / 9s],		train_loss: 3.9975
47:	[0s / 10s],		train_loss: 3.5625
38:	[0s / 10s],		train_loss: 4.0404
20:	[0s / 10s],		train_loss: 4.1495
29:	[0s / 10s],		train_loss: 3.8592
48:	[0s / 10s],		train_loss: 3.5223
14:	[0s / 10s],		train_loss: 4.2786
39:	[0s / 10s],		train_loss: 4.0095
49:	[0s / 10s],		train_loss: 3.5857
40:	[0s / 10s],		train_loss: 3.9699
30:	[0s / 10s],		train_loss: 3.8396
50:	[0s / 10s],		train_loss: 3.5273
21:	[0s / 10s],		train_loss: 4.1301
41:	[0s / 10s],		train_loss: 3.9729
51:	[0s / 10s],		train_loss: 3.5428
31:	[0s / 10s],		train_loss: 3.8137
42:	[0s / 10s],		train_loss: 3.9862
52:	[0s / 10s],		train_loss: 3.5286
15:	[0s / 10s],		train_loss: 4.2590
43:	[0s / 10s],		train_loss: 3.9874
22:	[0s / 10s],		train_loss: 4.0728
32:	[0s / 10s],		train_loss: 3.8298
53:	[0s / 10s],		train_loss: 3.5434
44:	[0s / 10s],		train_loss: 4.0003
54:	[0s / 10s],		train_loss: 3.5529
5:	[2s / 11s],		train_loss: 4.4383
5:	[2s / 11s],		train_loss: 4.3376
5:	[2s / 11s],		train_loss: 4.3358
33:	[0s / 11s],		train_loss: 3.7738
45:	[0s / 11s],		train_loss: 3.9502
55:	[0s / 11s],		train_loss: 3.5215
23:	[0s / 11s],		train_loss: 4.0976
46:	[0s / 11s],		train_loss: 3.9537
56:	[0s / 11s],		train_loss: 3.4697
34:	[0s / 11s],		train_loss: 3.7420
47:	[0s / 11s],		train_loss: 3.9548
16:	[0s / 11s],		train_loss: 4.2397
57:	[0s / 11s],		train_loss: 3.4436
35:	[0s / 11s],		train_loss: 3.7957
48:	[0s / 11s],		train_loss: 3.9305
58:	[0s / 11s],		train_loss: 3.4638
24:	[0s / 11s],		train_loss: 4.1060
49:	[0s / 11s],		train_loss: 3.9364
59:	[0s / 11s],		train_loss: 3.5126
36:	[0s / 11s],		train_loss: 3.7313
50:	[0s / 11s],		train_loss: 3.9644
60:	[0s / 11s],		train_loss: 3.4774
17:	[0s / 11s],		train_loss: 4.2276
25:	[0s / 11s],		train_loss: 4.1101
37:	[0s / 11s],		train_loss: 3.7287
61:	[0s / 12s],		train_loss: 3.4495
51:	[0s / 12s],		train_loss: 3.8958
62:	[0s / 12s],		train_loss: 3.4456
52:	[0s / 12s],		train_loss: 3.8824
38:	[0s / 12s],		train_loss: 3.7056
63:	[0s / 12s],		train_loss: 3.4852
53:	[0s / 12s],		train_loss: 3.9413
26:	[0s / 12s],		train_loss: 4.0750
64:	[0s / 12s],		train_loss: 3.4937
39:	[0s / 12s],		train_loss: 3.7059
54:	[0s / 12s],		train_loss: 3.9077
65:	[0s / 12s],		train_loss: 3.4751
55:	[0s / 12s],		train_loss: 3.9407
18:	[0s / 12s],		train_loss: 4.2341
27:	[0s / 12s],		train_loss: 4.0868
40:	[0s / 12s],		train_loss: 3.7408
66:	[0s / 12s],		train_loss: 3.4281
56:	[0s / 12s],		train_loss: 3.8755
67:	[0s / 12s],		train_loss: 3.3754
57:	[0s / 12s],		train_loss: 3.8226
41:	[0s / 12s],		train_loss: 3.6741
28:	[0s / 12s],		train_loss: 4.0478
68:	[0s / 12s],		train_loss: 3.4089
58:	[0s / 13s],		train_loss: 3.7767
69:	[0s / 13s],		train_loss: 3.3580
59:	[0s / 13s],		train_loss: 3.8757
42:	[0s / 13s],		train_loss: 3.6574
19:	[0s / 13s],		train_loss: 4.2456
70:	[0s / 13s],		train_loss: 3.3810
60:	[0s / 13s],		train_loss: 3.8708
29:	[0s / 13s],		train_loss: 4.0494
6:	[2s / 13s],		train_loss: 4.3407
6:	[2s / 13s],		train_loss: 4.3429
6:	[2s / 13s],		train_loss: 4.4218
43:	[0s / 13s],		train_loss: 3.6485
71:	[0s / 13s],		train_loss: 3.4097
61:	[0s / 13s],		train_loss: 3.8268
72:	[0s / 13s],		train_loss: 3.3597
62:	[0s / 13s],		train_loss: 3.8210
44:	[0s / 13s],		train_loss: 3.6956
73:	[0s / 13s],		train_loss: 3.3804
63:	[0s / 13s],		train_loss: 3.8171
30:	[0s / 13s],		train_loss: 4.0418
20:	[0s / 13s],		train_loss: 4.2193
45:	[0s / 13s],		train_loss: 3.6029
74:	[0s / 13s],		train_loss: 3.3556
64:	[0s / 13s],		train_loss: 3.8338
75:	[0s / 13s],		train_loss: 3.3204
65:	[0s / 14s],		train_loss: 3.7733
46:	[0s / 14s],		train_loss: 3.6099
31:	[0s / 14s],		train_loss: 4.0248
76:	[0s / 14s],		train_loss: 3.2911
66:	[0s / 14s],		train_loss: 3.7639
77:	[0s / 14s],		train_loss: 3.3846
47:	[0s / 14s],		train_loss: 3.6231
21:	[0s / 14s],		train_loss: 4.2048
67:	[0s / 14s],		train_loss: 3.7611
78:	[0s / 14s],		train_loss: 3.4235
32:	[0s / 14s],		train_loss: 4.0085
68:	[0s / 14s],		train_loss: 3.7777
79:	[0s / 14s],		train_loss: 3.3529
48:	[0s / 14s],		train_loss: 3.6173
69:	[0s / 14s],		train_loss: 3.7876
80:	[0s / 14s],		train_loss: 3.3450
70:	[0s / 14s],		train_loss: 3.7856
49:	[0s / 14s],		train_loss: 3.5965
81:	[0s / 14s],		train_loss: 3.2938
33:	[0s / 14s],		train_loss: 4.0121
71:	[0s / 14s],		train_loss: 3.8365
82:	[0s / 15s],		train_loss: 3.3027
22:	[0s / 15s],		train_loss: 4.2446
50:	[0s / 15s],		train_loss: 3.6199
72:	[0s / 15s],		train_loss: 3.7994
83:	[0s / 15s],		train_loss: 3.2965
34:	[0s / 15s],		train_loss: 4.0031
73:	[0s / 15s],		train_loss: 3.7743
51:	[0s / 15s],		train_loss: 3.5893
84:	[0s / 15s],		train_loss: 3.2491
74:	[0s / 15s],		train_loss: 3.7626
85:	[0s / 15s],		train_loss: 3.2740
52:	[0s / 15s],		train_loss: 3.5707
7:	[2s / 15s],		train_loss: 4.4162
7:	[2s / 15s],		train_loss: 4.3342