[I 2026-06-09 12:33:57,437] Trial 62 finished with value: 0.7665010177669439 and parameters: {'n_estimators': 300, 'max_depth': 5, 'min_samples_split': 19, 'min_samples_leaf': 15, 'max_features': 'sqrt'}. Best is trial 26 with value: 0.7832538595565384.
[I 2026-06-09 12:38:55,072] Trial 63 finished with value: 0.7580656983221504 and parameters: {'n_estimators': 300, 'max_depth': 6, 'min_samples_split': 9, 'min_samples_leaf': 15, 'max_features': 'sqrt'}. Best is trial 26 with value: 0.7832538595565384.
[I 2026-06-09 12:54:50,535] Trial 70 finished with value: 0.7727353638412116 and parameters: {'n_estimators': 300, 'max_depth': 3, 'min_samples_split': 20, 'min_samples_leaf': 15, 'max_features': 'log2'}. Best is trial 26 with value: 0.7832538595565384.
[I 2026-06-09 13:00:24,844] Trial 71 finished with value: 0.7727353638412116 and parameters: {'n_estimators': 300, 'max_depth': 3, 'min_samples_split': 20, 'min_samples_leaf': 15, 'max_features': 'log2'}. Best is trial 26 with value: 0.7832538595565384.
[I 2026-06-09 13:20:39,125] Trial 69 finished with value: 0.7643749109977467 and parameters: {'n_estimators': 300, 'max_depth': 3, 'min_samples_split': 19, 'min_samples_leaf': 15, 'max_features': 'sqrt'}. Best is trial 26 with value: 0.7832538595565384.
[I 2026-06-09 13:21:45,172] Trial 72 finished with value: 0.7811382236406739 and parameters: {'n_estimators': 300, 'max_depth': 4, 'min_samples_split': 20, 'min_samples_leaf': 15, 'max_features': 'log2'}. Best is trial 26 with value: 0.7832538595565384.
[I 2026-06-09 13:22:41,864] Trial 73 finished with value: 0.7832538595565384 and parameters: {'n_estimators': 250, 'max_depth': 4, 'min_samples_split': 19, 'min_samples_leaf': 14, 'max_features': 'log2'}. Best is trial 26 with value: 0.7832538595565384.
[I 2026-06-09 13:30:37,746] Trial 68 finished with value: 0.7679130123388536 and parameters: {'n_estimators': 300, 'max_depth': 4, 'min_samples_split': 19, 'min_samples_leaf': 15, 'max_features': 'sqrt'}. Best is trial 26 with value: 0.7832538595565384.
[I 2026-06-09 13:43:25,780] Trial 75 finished with value: 0.7832538595565384 and parameters: {'n_estimators': 250, 'max_depth': 4, 'min_samples_split': 19, 'min_samples_leaf': 14, 'max_features': 'log2'}. Best is trial 26 with value: 0.7832538595565384.
[I 2026-06-09 13:46:56,341] Trial 74 finished with value: 0.7811382236406739 and parameters: {'n_estimators': 300, 'max_depth': 4, 'min_samples_split': 19, 'min_samples_leaf': 15, 'max_features': 'log2'}. Best is trial 26 with value: 0.7832538595565384.
[I 2026-06-09 13:51:52,278] Trial 77 finished with value: 0.7832538595565384 and parameters: {'n_estimators': 250, 'max_depth': 4, 'min_samples_split': 18, 'min_samples_leaf': 14, 'max_features': 'log2'}. Best is trial 26 with value: 0.7832538595565384.
[I 2026-06-09 13:52:28,667] Trial 76 finished with value: 0.7753156438737131 and parameters: {'n_estimators': 250, 'max_depth': 8, 'min_samples_split': 18, 'min_samples_leaf': 14, 'max_features': 'log2'}. Best is trial 26 with value: 0.7832538595565384.
[I 2026-06-09 14:06:06,451] Trial 78 finished with value: 0.7832538595565384 and parameters: {'n_estimators': 250, 'max_depth': 4, 'min_samples_split': 18, 'min_samples_leaf': 14, 'max_features': 'log2'}. Best is trial 26 with value: 0.7832538595565384.
[I 2026-06-09 14:10:35,182] Trial 79 finished with value: 0.7832538595565384 and parameters: {'n_estimators': 250, 'max_depth': 4, 'min_samples_split': 18, 'min_samples_leaf': 14, 'max_features': 'log2'}. Best is trial 26 with value: 0.7832538595565384.
[I 2026-06-09 14:18:40,570] Trial 81 finished with value: 0.7761818452156577 and parameters: {'n_estimators': 250, 'max_depth': 5, 'min_samples_split': 18, 'min_samples_leaf': 14, 'max_features': 'log2'}. Best is trial 26 with value: 0.7832538595565384.
[I 2026-06-09 14:24:01,279] Trial 80 finished with value: 0.7753156438737131 and parameters: {'n_estimators': 250, 'max_depth': 8, 'min_samples_split': 18, 'min_samples_leaf': 14, 'max_features': 'log2'}. Best is trial 26 with value: 0.7832538595565384.
[I 2026-06-09 14:32:11,355] Trial 82 finished with value: 0.7761818452156577 and parameters: {'n_estimators': 250, 'max_depth': 5, 'min_samples_split': 18, 'min_samples_leaf': 14, 'max_features': 'log2'}. Best is trial 26 with value: 0.7832538595565384.
[I 2026-06-09 14:39:22,894] Trial 83 finished with value: 0.7768629742249474 and parameters: {'n_estimators': 250, 'max_depth': 5, 'min_samples_split': 18, 'min_samples_leaf': 7, 'max_features': 'log2'}. Best is trial 26 with value: 0.7832538595565384.
[I 2026-06-09 14:41:55,719] Trial 84 finished with value: 0.7832538595565384 and parameters: {'n_estimators': 250, 'max_depth': 4, 'min_samples_split': 17, 'min_samples_leaf': 14, 'max_features': 'log2'}. Best is trial 26 with value: 0.7832538595565384.
[I 2026-06-09 14:46:57,784] Trial 85 finished with value: 0.7814240779366556 and parameters: {'n_estimators': 250, 'max_depth': 4, 'min_samples_split': 17, 'min_samples_leaf': 13, 'max_features': 'log2'}. Best is trial 26 with value: 0.7832538595565384.
[I 2026-06-09 14:54:38,978] Trial 86 finished with value: 0.7814240779366556 and parameters: {'n_estimators': 250, 'max_depth': 4, 'min_samples_split': 17, 'min_samples_leaf': 13, 'max_features': 'log2'}. Best is trial 26 with value: 0.7832538595565384.
[I 2026-06-09 15:01:56,505] Trial 87 finished with value: 0.7814240779366556 and parameters: {'n_estimators': 250, 'max_depth': 4, 'min_samples_split': 17, 'min_samples_leaf': 13, 'max_features': 'log2'}. Best is trial 26 with value: 0.7832538595565384.
[I 2026-06-09 15:04:11,522] Trial 88 finished with value: 0.7814240779366556 and parameters: {'n_estimators': 250, 'max_depth': 4, 'min_samples_split': 17, 'min_samples_leaf': 13, 'max_features': 'log2'}. Best is trial 26 with value: 0.7832538595565384.
[I 2026-06-09 15:08:51,652] Trial 89 finished with value: 0.7788896078874844 and parameters: {'n_estimators': 250, 'max_depth': 4, 'min_samples_split': 17, 'min_samples_leaf': 3, 'max_features': 'log2'}. Best is trial 26 with value: 0.7832538595565384.
[I 2026-06-09 15:13:13,431] Trial 90 finished with value: 0.7702616247413699 and parameters: {'n_estimators': 250, 'max_depth': 3, 'min_samples_split': 17, 'min_samples_leaf': 3, 'max_features': 'log2'}. Best is trial 26 with value: 0.7832538595565384.
[I 2026-06-09 15:21:31,703] Trial 91 finished with value: 0.7701160798800459 and parameters: {'n_estimators': 250, 'max_depth': 3, 'min_samples_split': 20, 'min_samples_leaf': 3, 'max_features': 'log2'}. Best is trial 26 with value: 0.7832538595565384.
[I 2026-06-09 15:23:22,208] Trial 92 finished with value: 0.7722798817212407 and parameters: {'n_estimators': 250, 'max_depth': 3, 'min_samples_split': 16, 'min_samples_leaf': 14, 'max_features': 'log2'}. Best is trial 26 with value: 0.7832538595565384.
[I 2026-06-09 15:27:38,262] Trial 93 finished with value: 0.7722798817212407 and parameters: {'n_estimators': 250, 'max_depth': 3, 'min_samples_split': 16, 'min_samples_leaf': 14, 'max_features': 'log2'}. Best is trial 26 with value: 0.7832538595565384.
[I 2026-06-09 15:36:34,995] Trial 94 finished with value: 0.7832538595565384 and parameters: {'n_estimators': 250, 'max_depth': 4, 'min_samples_split': 15, 'min_samples_leaf': 14, 'max_features': 'log2'}. Best is trial 26 with value: 0.7832538595565384.
[I 2026-06-09 15:46:17,312] Trial 95 finished with value: 0.7832538595565384 and parameters: {'n_estimators': 250, 'max_depth': 4, 'min_samples_split': 15, 'min_samples_leaf': 14, 'max_features': 'log2'}. Best is trial 26 with value: 0.7832538595565384.
[I 2026-06-09 15:47:14,397] Trial 96 finished with value: 0.7832538595565384 and parameters: {'n_estimators': 250, 'max_depth': 4, 'min_samples_split': 15, 'min_samples_leaf': 14, 'max_features': 'log2'}. Best is trial 26 with value: 0.7832538595565384.
[I 2026-06-09 15:50:08,451] Trial 97 finished with value: 0.7832538595565384 and parameters: {'n_estimators': 250, 'max_depth': 4, 'min_samples_split': 15, 'min_samples_leaf': 14, 'max_features': 'log2'}. Best is trial 26 with value: 0.7832538595565384.
[I 2026-06-09 15:54:39,234] Trial 98 finished with value: 0.7832538595565384 and parameters: {'n_estimators': 250, 'max_depth': 4, 'min_samples_split': 12, 'min_samples_leaf': 14, 'max_features': 'log2'}. Best is trial 26 with value: 0.7832538595565384.
