[I 2026-07-01 07:40:16,015] Trial 88 finished with value: 0.8109959804320646 and parameters: {'num_nodes': [64], 'dropout': 0.27174090522633837, 'learning_rate': 0.006834458159938727, 'batch_norm': False}. Best is trial 88 with value: 0.8109959804320646.
/scratch.hpc/luca.cotugno/Foundation_model_clinical_data/test_tabular_model.py:481: UserWarning: Choices for a categorical distribution should be a tuple of None, bool, int, float and str for persistent storage but contains [32] which is of type list.
  num_nodes  = trial.suggest_categorical("num_nodes", [[32], [64], [128], [64, 32], [128, 64]])
/scratch.hpc/luca.cotugno/Foundation_model_clinical_data/test_tabular_model.py:481: UserWarning: Choices for a categorical distribution should be a tuple of None, bool, int, float and str for persistent storage but contains [64] which is of type list.
  num_nodes  = trial.suggest_categorical("num_nodes", [[32], [64], [128], [64, 32], [128, 64]])
/scratch.hpc/luca.cotugno/Foundation_model_clinical_data/test_tabular_model.py:481: UserWarning: Choices for a categorical distribution should be a tuple of None, bool, int, float and str for persistent storage but contains [128] which is of type list.
  num_nodes  = trial.suggest_categorical("num_nodes", [[32], [64], [128], [64, 32], [128, 64]])
/scratch.hpc/luca.cotugno/Foundation_model_clinical_data/test_tabular_model.py:481: UserWarning: Choices for a categorical distribution should be a tuple of None, bool, int, float and str for persistent storage but contains [64, 32] which is of type list.
  num_nodes  = trial.suggest_categorical("num_nodes", [[32], [64], [128], [64, 32], [128, 64]])
/scratch.hpc/luca.cotugno/Foundation_model_clinical_data/test_tabular_model.py:481: UserWarning: Choices for a categorical distribution should be a tuple of None, bool, int, float and str for persistent storage but contains [128, 64] which is of type list.
  num_nodes  = trial.suggest_categorical("num_nodes", [[32], [64], [128], [64, 32], [128, 64]])

48:	[0s / 32s],		train_loss: 4.2819
53:	[0s / 29s],		train_loss: 4.1484
22:	[0s / 11s],		train_loss: 4.2450
54:	[0s / 30s],		train_loss: 4.1309
49:	[0s / 33s],		train_loss: 4.2981
23:	[0s / 12s],		train_loss: 4.2172
67:	[1s / 1m:18s],		train_loss: 4.1173
55:	[0s / 30s],		train_loss: 4.1567
24:	[0s / 12s],		train_loss: 4.2512
50:	[0s / 33s],		train_loss: 4.2574
56:	[2s / 1m:57s],		train_loss: 4.1676
43:	[4s / 2m:50s],		train_loss: 4.0526
56:	[0s / 31s],		train_loss: 4.1422
25:	[0s / 13s],		train_loss: 4.2819
51:	[0s / 34s],		train_loss: 4.2780
30:	[7s / 3m:52s],		train_loss: 4.1769
66:	[16s / 16m:37s],		train_loss: 3.8752
57:	[0s / 31s],		train_loss: 4.1117
68:	[1s / 1m:19s],		train_loss: 4.0878
26:	[0s / 13s],		train_loss: 4.2355
52:	[0s / 35s],		train_loss: 4.2884
27:	[0s / 14s],		train_loss: 4.2718
58:	[0s / 32s],		train_loss: 4.1139
53:	[0s / 35s],		train_loss: 4.2778
28:	[0s / 14s],		train_loss: 4.2639
59:	[0s / 32s],		train_loss: 4.1640
57:	[2s / 2m:0s],		train_loss: 4.1695
69:	[1s / 1m:20s],		train_loss: 4.0848
29:	[0s / 15s],		train_loss: 4.2681
54:	[0s / 36s],		train_loss: 4.2658
60:	[0s / 33s],		train_loss: 4.1470
30:	[0s / 15s],		train_loss: 4.2583
70:	[1s / 1m:21s],		train_loss: 4.0857
61:	[0s / 34s],		train_loss: 4.1784
55:	[0s / 37s],		train_loss: 4.2673
31:	[0s / 16s],		train_loss: 4.2772
62:	[0s / 34s],		train_loss: 4.1838
56:	[0s / 37s],		train_loss: 4.3039
44:	[3s / 2m:54s],		train_loss: 4.0550
32:	[0s / 16s],		train_loss: 4.2407
58:	[2s / 2m:2s],		train_loss: 4.1661
71:	[1s / 1m:22s],		train_loss: 4.1041
63:	[0s / 35s],		train_loss: 4.1663
33:	[0s / 17s],		train_loss: 4.2419
57:	[0s / 38s],		train_loss: 4.2700
64:	[0s / 35s],		train_loss: 4.1716
34:	[0s / 18s],		train_loss: 4.2353
58:	[0s / 39s],		train_loss: 4.2998
65:	[0s / 36s],		train_loss: 4.1428
72:	[1s / 1m:24s],		train_loss: 4.1373
35:	[0s / 18s],		train_loss: 4.2464
59:	[0s / 39s],		train_loss: 4.2888
66:	[0s / 36s],		train_loss: 4.1432
36:	[0s / 18s],		train_loss: 4.2204
37:	[0s / 19s],		train_loss: 4.2347
67:	[0s / 37s],		train_loss: 4.1786
59:	[2s / 2m:4s],		train_loss: 4.1472
60:	[0s / 40s],		train_loss: 4.2531
73:	[1s / 1m:25s],		train_loss: 4.0659
38:	[0s / 20s],		train_loss: 4.2180
68:	[0s / 38s],		train_loss: 4.1662
61:	[0s / 41s],		train_loss: 4.2811
39:	[0s / 20s],		train_loss: 4.1940
69:	[0s / 38s],		train_loss: 4.1349
74:	[0s / 1m:26s],		train_loss: 4.0848
62:	[0s / 41s],		train_loss: 4.2624
40:	[0s / 20s],		train_loss: 4.2130
45:	[4s / 2m:58s],		train_loss: 4.0431
70:	[0s / 39s],		train_loss: 4.1320
41:	[0s / 21s],		train_loss: 4.2012
63:	[0s / 42s],		train_loss: 4.2639
71:	[0s / 39s],		train_loss: 4.1442
60:	[1s / 2m:6s],		train_loss: 4.1385
75:	[1s / 1m:27s],		train_loss: 4.1317
31:	[7s / 4m:0s],		train_loss: 4.1835
42:	[0s / 21s],		train_loss: 4.2117
72:	[0s / 40s],		train_loss: 4.1526
64:	[0s / 43s],		train_loss: 4.2357
43:	[0s / 22s],		train_loss: 4.2033
73:	[0s / 40s],		train_loss: 4.1635
65:	[0s / 43s],		train_loss: 4.2540
76:	[1s / 1m:28s],		train_loss: 4.0810
44:	[0s / 22s],		train_loss: 4.1961
74:	[0s / 41s],		train_loss: 4.1444
45:	[0s / 23s],		train_loss: 4.1698
66:	[0s / 44s],		train_loss: 4.2418
61:	[2s / 2m:8s],		train_loss: 4.1553
75:	[0s / 41s],		train_loss: 4.1496
46:	[0s / 24s],		train_loss: 4.2150
77:	[1s / 1m:29s],		train_loss: 4.0816
67:	[0s / 45s],		train_loss: 4.2667
76:	[0s / 42s],		train_loss: 4.1139
47:	[0s / 24s],		train_loss: 4.1615
46:	[3s / 3m:2s],		train_loss: 4.0917
68:	[0s / 46s],		train_loss: 4.2553
77:	[0s / 43s],		train_loss: 4.1112
48:	[0s / 25s],		train_loss: 4.1559
78:	[1s / 1m:31s],		train_loss: 4.0829
69:	[0s / 46s],		train_loss: 4.2679
78:	[0s / 43s],		train_loss: 4.1292
49:	[0s / 25s],		train_loss: 4.2017
79:	[0s / 44s],		train_loss: 4.1471
62:	[2s / 2m:11s],		train_loss: 4.1771
50:	[0s / 26s],		train_loss: 4.1835
70:	[0s / 47s],		train_loss: 4.2736
79:	[1s / 1m:32s],		train_loss: 4.0698
80:	[0s / 44s],		train_loss: 4.0873
51:	[0s / 26s],		train_loss: 4.1991
71:	[0s / 48s],		train_loss: 4.2425
52:	[0s / 27s],		train_loss: 4.1778
81:	[0s / 45s],		train_loss: 4.1459
72:	[0s / 48s],		train_loss: 4.2339
53:	[0s / 27s],		train_loss: 4.1893
82:	[0s / 45s],		train_loss: 4.1040
80:	[1s / 1m:33s],		train_loss: 4.0829
54:	[0s / 28s],		train_loss: 4.1597
73:	[0s / 49s],		train_loss: 4.2359
83:	[0s / 46s],		train_loss: 4.1145
63:	[2s / 2m:13s],		train_loss: 4.1409
55:	[0s / 28s],		train_loss: 4.1686
84:	[0s / 46s],		train_loss: 4.1049
74:	[0s / 49s],		train_loss: 4.2583
81:	[1s / 1m:34s],		train_loss: 4.0943
47:	[4s / 3m:6s],		train_loss: 4.0539
56:	[0s / 29s],		train_loss: 4.1481
85:	[0s / 47s],		train_loss: 4.1106
75:	[0s / 50s],		train_loss: 4.2594
57:	[0s / 29s],		train_loss: 4.1808
86:	[0s / 47s],		train_loss: 4.1329
32:	[8s / 4m:8s],		train_loss: 4.1841
58:	[0s / 30s],		train_loss: 4.2024
76:	[0s / 51s],		train_loss: 4.2613
82:	[1s / 1m:35s],		train_loss: 4.0707
87:	[0s / 48s],		train_loss: 4.1359
59:	[0s / 30s],		train_loss: 4.1577
64:	[2s / 2m:15s],		train_loss: 4.1488
67:	[17s / 16m:54s],		train_loss: 3.9082
77:	[0s / 51s],		train_loss: 4.2401
88:	[0s / 49s],		train_loss: 4.1287
60:	[0s / 31s],		train_loss: 4.1548
83:	[1s / 1m:37s],		train_loss: 4.0476
89:	[0s / 49s],		train_loss: 4.1266
78:	[0s / 52s],		train_loss: 4.2387
61:	[0s / 31s],		train_loss: 4.1433
90:	[0s / 50s],		train_loss: 4.1169
62:	[0s / 32s],		train_loss: 4.1393
79:	[0s / 53s],		train_loss: 4.2591
84:	[1s / 1m:38s],		train_loss: 4.1019
91:	[0s / 50s],		train_loss: 4.1319
63:	[0s / 32s],		train_loss: 4.1546
65:	[2s / 2m:18s],		train_loss: 4.1622
80:	[0s / 53s],		train_loss: 4.2427
92:	[0s / 51s],		train_loss: 4.1292
64:	[0s / 33s],		train_loss: 4.1602
48:	[4s / 3m:11s],		train_loss: 4.0285
81:	[0s / 54s],		train_loss: 4.2520
85:	[1s / 1m:39s],		train_loss: 4.0863
93:	[0s / 51s],		train_loss: 4.1548
65:	[0s / 33s],		train_loss: 4.1537
82:	[0s / 55s],		train_loss: 4.2436
66:	[0s / 34s],		train_loss: 4.1888
94:	[0s / 52s],		train_loss: 4.1757
66:	[1s / 2m:19s],		train_loss: 4.1664
67:	[0s / 34s],		train_loss: 4.1811
95:	[0s / 52s],		train_loss: 4.1390
86:	[1s / 1m:40s],		train_loss: 4.0650
83:	[0s / 55s],		train_loss: 4.2478
68:	[0s / 35s],		train_loss: 4.2007
96:	[0s / 53s],		train_loss: 4.1027
84:	[0s / 56s],		train_loss: 4.2691
69:	[0s / 35s],		train_loss: 4.1640
87:	[1s / 1m:41s],		train_loss: 4.0566
97:	[0s / 53s],		train_loss: 4.1625
85:	[0s / 57s],		train_loss: 4.2646
70:	[0s / 36s],		train_loss: 4.1527
98:	[0s / 54s],		train_loss: 4.1146
71:	[0s / 36s],		train_loss: 4.1395
67:	[2s / 2m:21s],		train_loss: 4.1482
86:	[0s / 57s],		train_loss: 4.2331
99:	[0s / 54s],		train_loss: 4.1271
88:	[1s / 1m:42s],		train_loss: 4.0553
72:	[0s / 37s],		train_loss: 4.1308
49:	[3s / 3m:14s],		train_loss: 4.0491
87:	[0s / 58s],		train_loss: 4.2563
0:	[0s / 0s],		train_loss: 4.7852
73:	[0s / 37s],		train_loss: 4.1910
89:	[0s / 1m:43s],		train_loss: 4.0520
1:	[0s / 0s],		train_loss: 4.4598
88:	[0s / 58s],		train_loss: 4.2161
74:	[0s / 37s],		train_loss: 4.1671
33:	[7s / 4m:16s],		train_loss: 4.1678
2:	[0s / 1s],		train_loss: 4.3809
89:	[0s / 59s],		train_loss: 4.2140
75:	[0s / 38s],		train_loss: 4.1463
68:	[1s / 2m:23s],		train_loss: 4.1276
3:	[0s / 1s],		train_loss: 4.3993
90:	[0s / 1m:44s],		train_loss: 4.0680
90:	[0s / 59s],		train_loss: 4.2208
76:	[0s / 38s],		train_loss: 4.1951
4:	[0s / 1s],		train_loss: 4.4121
77:	[0s / 39s],		train_loss: 4.1628
91:	[0s / 1m:0s],		train_loss: 4.2347
5:	[0s / 2s],		train_loss: 4.3729
91:	[0s / 1m:45s],		train_loss: 4.0647
78:	[0s / 39s],		train_loss: 4.1768
92:	[0s / 1m:0s],		train_loss: 4.2097
6:	[0s / 2s],		train_loss: 4.3458
79:	[0s / 40s],		train_loss: 4.1666
69:	[1s / 2m:25s],		train_loss: 4.1476
93:	[0s / 1m:1s],		train_loss: 4.2652
7:	[0s / 3s],		train_loss: 4.3446
92:	[1s / 1m:46s],		train_loss: 4.0628
80:	[0s / 40s],		train_loss: 4.1669
50:	[3s / 3m:18s],		train_loss: 4.0244
8:	[0s / 3s],		train_loss: 4.3392
94:	[0s / 1m:2s],		train_loss: 4.2499
81:	[0s / 41s],		train_loss: 4.1840
9:	[0s / 4s],		train_loss: 4.3351
95:	[0s / 1m:2s],		train_loss: 4.1938
93:	[1s / 1m:47s],		train_loss: 4.0476
82:	[0s / 41s],		train_loss: 4.1426
10:	[0s / 4s],		train_loss: 4.2972
96:	[0s / 1m:3s],		train_loss: 4.2307
70:	[1s / 2m:27s],		train_loss: 4.1628
83:	[0s / 42s],		train_loss: 4.1713
11:	[0s / 5s],		train_loss: 4.3035
94:	[0s / 1m:48s],		train_loss: 4.0455
84:	[0s / 42s],		train_loss: 4.1565
97:	[0s / 1m:3s],		train_loss: 4.2270
12:	[0s / 5s],		train_loss: 4.3121
85:	[0s / 43s],		train_loss: 4.1440
98:	[0s / 1m:4s],		train_loss: 4.2065
13:	[0s / 6s],		train_loss: 4.3128
95:	[1s / 1m:49s],		train_loss: 4.0835
86:	[0s / 43s],		train_loss: 4.1205
99:	[0s / 1m:4s],		train_loss: 4.2272
71:	[1s / 2m:29s],		train_loss: 4.1158
14:	[0s / 6s],		train_loss: 4.3002
87:	[0s / 44s],		train_loss: 4.1388
15:	[0s / 7s],		train_loss: 4.2621
0:	[0s / 0s],		train_loss: 4.7701
51:	[3s / 3m:22s],		train_loss: 4.0397
96:	[0s / 1m:50s],		train_loss: 4.0583
88:	[0s / 44s],		train_loss: 4.1440
16:	[0s / 7s],		train_loss: 4.2878
1:	[0s / 1s],		train_loss: 4.4214
89:	[0s / 45s],		train_loss: 4.1352
17:	[0s / 8s],		train_loss: 4.2711
97:	[1s / 1m:51s],		train_loss: 4.0563
2:	[0s / 1s],		train_loss: 4.4076
90:	[0s / 45s],		train_loss: 4.1187
34:	[7s / 4m:24s],		train_loss: 4.2164
18:	[0s / 9s],		train_loss: 4.2881
72:	[2s / 2m:31s],		train_loss: 4.1416
91:	[0s / 46s],		train_loss: 4.1280
3:	[0s / 2s],		train_loss: 4.3482
19:	[0s / 9s],		train_loss: 4.2852
98:	[1s / 1m:52s],		train_loss: 4.0598
92:	[0s / 46s],		train_loss: 4.1189
4:	[0s / 2s],		train_loss: 4.3757
20:	[0s / 10s],		train_loss: 4.2675
93:	[0s / 47s],		train_loss: 4.1062
5:	[0s / 3s],		train_loss: 4.3412
21:	[0s / 10s],		train_loss: 4.2816
94:	[0s / 47s],		train_loss: 4.1433
99:	[0s / 1m:53s],		train_loss: 4.0459
68:	[16s / 17m:11s],		train_loss: 3.9029
6:	[0s / 3s],		train_loss: 4.3631
22:	[0s / 10s],		train_loss: 4.2718
73:	[1s / 2m:33s],		train_loss: 4.1452
95:	[0s / 48s],		train_loss: 4.1226
7:	[0s / 4s],		train_loss: 4.3463
52:	[3s / 3m:25s],		train_loss: 4.0151
23:	[0s / 11s],		train_loss: 4.2860
96:	[0s / 48s],		train_loss: 4.0853
0:	[0s / 0s],		train_loss: 4.7334
24:	[0s / 11s],		train_loss: 4.2943
8:	[0s / 4s],		train_loss: 4.3301
97:	[0s / 49s],		train_loss: 4.1215
25:	[0s / 12s],		train_loss: 4.2731
9:	[0s / 5s],		train_loss: 4.3199
74:	[1s / 2m:34s],		train_loss: 4.1556
98:	[0s / 49s],		train_loss: 4.1211
1:	[1s / 1s],		train_loss: 4.4513
26:	[0s / 13s],		train_loss: 4.2860
10:	[0s / 6s],		train_loss: 4.2941
99:	[0s / 50s],		train_loss: 4.0896
27:	[0s / 13s],		train_loss: 4.2562
0:	[0s / 0s],		train_loss: 4.6237
11:	[0s / 7s],		train_loss: 4.3053
2:	[1s / 3s],		train_loss: 4.3952
28:	[0s / 14s],		train_loss: 4.2498
1:	[0s / 0s],		train_loss: 4.3918
12:	[0s / 7s],		train_loss: 4.2815
75:	[1s / 2m:36s],		train_loss: 4.1271
29:	[0s / 14s],		train_loss: 4.2208
53:	[3s / 3m:29s],		train_loss: 4.0268
2:	[0s / 1s],		train_loss: 4.3605
3:	[1s / 4s],		train_loss: 4.3760
13:	[0s / 8s],		train_loss: 4.2911
30:	[0s / 15s],		train_loss: 4.2437
3:	[0s / 1s],		train_loss: 4.3087
31:	[0s / 15s],		train_loss: 4.2262
4:	[0s / 2s],		train_loss: 4.3084
14:	[0s / 8s],		train_loss: 4.3290
32:	[0s / 16s],		train_loss: 4.2149
5:	[0s / 2s],		train_loss: 4.3189
4:	[1s / 5s],		train_loss: 4.3899
15:	[0s / 9s],		train_loss: 4.2987
76:	[1s / 2m:38s],		train_loss: 4.1586
6:	[0s / 3s],		train_loss: 4.2957
33:	[0s / 16s],		train_loss: 4.2509
35:	[7s / 4m:32s],		train_loss: 4.1520
16:	[0s / 9s],		train_loss: 4.2615
7:	[0s / 3s],		train_loss: 4.2945
34:	[0s / 16s],		train_loss: 4.2019
5:	[0s / 6s],		train_loss: 4.3588
8:	[0s / 3s],		train_loss: 4.2621
35:	[0s / 17s],		train_loss: 4.2038
17:	[0s / 10s],		train_loss: 4.2611
9:	[0s / 4s],		train_loss: 4.2729
36:	[0s / 17s],		train_loss: 4.2291
18:	[0s / 11s],		train_loss: 4.2746
6:	[0s / 7s],		train_loss: 4.3646
77:	[1s / 2m:40s],		train_loss: 4.1483
10:	[0s / 4s],		train_loss: 4.2647
54:	[3s / 3m:32s],		train_loss: 3.9922
37:	[0s / 18s],		train_loss: 4.2217
19:	[0s / 11s],		train_loss: 4.2494
11:	[0s / 5s],		train_loss: 4.2978
38:	[0s / 18s],		train_loss: 4.2089
7:	[1s / 8s],		train_loss: 4.3732
12:	[0s / 5s],		train_loss: 4.2375
20:	[0s / 12s],		train_loss: 4.2701
39:	[0s / 19s],		train_loss: 4.2259
13:	[0s / 5s],		train_loss: 4.2171
40:	[0s / 19s],		train_loss: 4.2314
21:	[0s / 12s],		train_loss: 4.2586
14:	[0s / 6s],		train_loss: 4.2174
78:	[1s / 2m:41s],		train_loss: 4.1605
8:	[0s / 9s],		train_loss: 4.3375
41:	[0s / 19s],		train_loss: 4.2055
15:	[0s / 6s],		train_loss: 4.2111
22:	[0s / 13s],		train_loss: 4.3037
42:	[0s / 20s],		train_loss: 4.2504
16:	[0s / 7s],		train_loss: 4.2112
23:	[0s / 13s],		train_loss: 4.2484
9:	[0s / 10s],		train_loss: 4.3350
43:	[0s / 20s],		train_loss: 4.1640
17:	[0s / 7s],		train_loss: 4.1928
24:	[0s / 14s],		train_loss: 4.2503
44:	[0s / 21s],		train_loss: 4.1920
18:	[0s / 7s],		train_loss: 4.2080
55:	[3s / 3m:36s],		train_loss: 3.9939
79:	[2s / 2m:44s],		train_loss: 4.1172
19:	[0s / 8s],		train_loss: 4.2207
45:	[0s / 21s],		train_loss: 4.1778
25:	[0s / 15s],		train_loss: 4.2530
10:	[1s / 11s],		train_loss: 4.3294
20:	[0s / 8s],		train_loss: 4.2238
46:	[0s / 22s],		train_loss: 4.2077
26:	[0s / 15s],		train_loss: 4.2373
21:	[0s / 9s],		train_loss: 4.1977
47:	[0s / 23s],		train_loss: 4.1854
36:	[6s / 4m:38s],		train_loss: 4.1543
69:	[12s / 17m:23s],		train_loss: 3.9056
11:	[1s / 12s],		train_loss: 4.3035
27:	[0s / 16s],		train_loss: 4.2287
22:	[0s / 9s],		train_loss: 4.1743
48:	[0s / 23s],		train_loss: 4.1965
23:	[0s / 10s],		train_loss: 4.1842
28:	[0s / 16s],		train_loss: 4.2390
49:	[0s / 24s],		train_loss: 4.2338
80:	[2s / 2m:46s],		train_loss: 4.1230
12:	[1s / 13s],		train_loss: 4.3248
24:	[0s / 10s],		train_loss: 4.1808
50:	[0s / 24s],		train_loss: 4.1890
29:	[0s / 17s],		train_loss: 4.2368
25:	[0s / 11s],		train_loss: 4.1796
51:	[0s / 24s],		train_loss: 4.2054
30:	[0s / 18s],		train_loss: 4.2280
26:	[0s / 11s],		train_loss: 4.1333
13:	[1s / 14s],		train_loss: 4.2908
52:	[0s / 25s],		train_loss: 4.1932
56:	[3s / 3m:40s],		train_loss: 4.0434
31:	[0s / 18s],		train_loss: 4.2132
27:	[0s / 12s],		train_loss: 4.1534
53:	[0s / 26s],		train_loss: 4.1819
81:	[2s / 2m:48s],		train_loss: 4.1325
28:	[0s / 12s],		train_loss: 4.1531
32:	[0s / 19s],		train_loss: 4.2795
14:	[1s / 15s],		train_loss: 4.3129
54:	[0s / 26s],		train_loss: 4.1805
29:	[0s / 13s],		train_loss: 4.1518
33:	[0s / 20s],		train_loss: 4.2381
55:	[0s / 27s],		train_loss: 4.1715
30:	[0s / 13s],		train_loss: 4.1513
15:	[0s / 16s],		train_loss: 4.2857
56:	[0s / 27s],		train_loss: 4.1559
31:	[0s / 14s],		train_loss: 4.1273
34:	[0s / 20s],		train_loss: 4.2212
82:	[1s / 2m:50s],		train_loss: 4.1183
57:	[0s / 27s],		train_loss: 4.1604
32:	[0s / 14s],		train_loss: 4.1078
35:	[0s / 21s],		train_loss: 4.2201
16:	[0s / 17s],		train_loss: 4.3099
58:	[0s / 28s],		train_loss: 4.1779
33:	[0s / 15s],		train_loss: 4.1235
36:	[0s / 21s],		train_loss: 4.2338
59:	[0s / 29s],		train_loss: 4.1879
34:	[0s / 15s],		train_loss: 4.1446
57:	[3s / 3m:43s],		train_loss: 3.9959
17:	[1s / 18s],		train_loss: 4.3211
60:	[0s / 29s],		train_loss: 4.1366
35:	[0s / 16s],		train_loss: 4.1533
37:	[0s / 22s],		train_loss: 4.2077
83:	[1s / 2m:51s],		train_loss: 4.1219
36:	[0s / 16s],		train_loss: 4.1299
61:	[0s / 29s],		train_loss: 4.1839
38:	[0s / 23s],		train_loss: 4.1968
37:	[0s / 16s],		train_loss: 4.1085
62:	[0s / 30s],		train_loss: 4.1788
18:	[0s / 19s],		train_loss: 4.2646
39:	[0s / 23s],		train_loss: 4.2191
38:	[0s / 17s],		train_loss: 4.1302
37:	[7s / 4m:46s],		train_loss: 4.1654
63:	[0s / 30s],		train_loss: 4.1666
39:	[0s / 17s],		train_loss: 4.1340
64:	[0s / 31s],		train_loss: 4.1546
19:	[0s / 20s],		train_loss: 4.2486
40:	[0s / 24s],		train_loss: 4.2309
84:	[1s / 2m:53s],		train_loss: 4.1413
40:	[0s / 18s],		train_loss: 4.1179
65:	[0s / 31s],		train_loss: 4.1929
41:	[0s / 25s],		train_loss: 4.1921
41:	[0s / 18s],		train_loss: 4.1052
66:	[0s / 32s],		train_loss: 4.1415
20:	[1s / 21s],		train_loss: 4.2867
42:	[0s / 19s],		train_loss: 4.0890
42:	[0s / 25s],		train_loss: 4.2094
67:	[0s / 32s],		train_loss: 4.1336
58:	[3s / 3m:47s],		train_loss: 3.9877
43:	[0s / 19s],		train_loss: 4.1052
43:	[0s / 26s],		train_loss: 4.1960
68:	[0s / 33s],		train_loss: 4.1503
21:	[1s / 22s],		train_loss: 4.2692
85:	[1s / 2m:55s],		train_loss: 4.1141
44:	[0s / 20s],		train_loss: 4.1093
69:	[0s / 33s],		train_loss: 4.1264
44:	[0s / 27s],		train_loss: 4.1629
45:	[0s / 20s],		train_loss: 4.1120
70:	[0s / 34s],		train_loss: 4.1610
22:	[1s / 23s],		train_loss: 4.2703
46:	[0s / 21s],		train_loss: 4.0999
45:	[0s / 27s],		train_loss: 4.1833
71:	[0s / 35s],		train_loss: 4.1569
47:	[0s / 21s],		train_loss: 4.1056
46:	[0s / 28s],		train_loss: 4.1749
72:	[0s / 35s],		train_loss: 4.1224
86:	[2s / 2m:57s],		train_loss: 4.0908
48:	[0s / 22s],		train_loss: 4.0818
23:	[1s / 25s],		train_loss: 4.2675
73:	[0s / 36s],		train_loss: 4.1108
47:	[0s / 29s],		train_loss: 4.1947
49:	[0s / 23s],		train_loss: 4.1368
74:	[0s / 36s],		train_loss: 4.1295
59:	[3s / 3m:51s],		train_loss: 4.0029
48:	[0s / 30s],		train_loss: 4.1715
50:	[0s / 23s],		train_loss: 4.1330
24:	[1s / 26s],		train_loss: 4.2551
75:	[0s / 37s],		train_loss: 4.1728
51:	[0s / 23s],		train_loss: 4.0726
49:	[0s / 30s],		train_loss: 4.1987
87:	[1s / 2m:59s],		train_loss: 4.1196
76:	[0s / 37s],		train_loss: 4.1439
52:	[0s / 24s],		train_loss: 4.0927
38:	[7s / 4m:54s],		train_loss: 4.1825
25:	[1s / 27s],		train_loss: 4.2482
50:	[0s / 31s],		train_loss: 4.2325
77:	[0s / 38s],		train_loss: 4.1027
53:	[0s / 25s],		train_loss: 4.0656
78:	[0s / 39s],		train_loss: 4.1337
51:	[0s / 32s],		train_loss: 4.1945
54:	[0s / 25s],		train_loss: 4.0648
70:	[16s / 17m:40s],		train_loss: 3.8745
26:	[1s / 28s],		train_loss: 4.2212
79:	[0s / 39s],		train_loss: 4.1140
55:	[0s / 26s],		train_loss: 4.0768
52:	[0s / 32s],		train_loss: 4.1907
88:	[2s / 3m:1s],		train_loss: 4.1249
56:	[0s / 26s],		train_loss: 4.0913
80:	[0s / 40s],		train_loss: 4.1321
53:	[0s / 33s],		train_loss: 4.1877
27:	[1s / 29s],		train_loss: 4.2602
57:	[0s / 27s],		train_loss: 4.0844
81:	[0s / 40s],		train_loss: 4.1230
60:	[3s / 3m:55s],		train_loss: 3.9758
54:	[0s / 34s],		train_loss: 4.1827
58:	[0s / 27s],		train_loss: 4.0770
82:	[0s / 41s],		train_loss: 4.1061
59:	[0s / 27s],		train_loss: 4.0873
83:	[0s / 41s],		train_loss: 4.1107
55:	[0s / 34s],		train_loss: 4.1970
89:	[1s / 3m:3s],		train_loss: 4.1106
28:	[0s / 30s],		train_loss: 4.2452
60:	[0s / 28s],		train_loss: 4.0701
84:	[0s / 41s],		train_loss: 4.0970
56:	[0s / 35s],		train_loss: 4.1487
61:	[0s / 28s],		train_loss: 4.0832
85:	[0s / 42s],		train_loss: 4.1083
29:	[1s / 31s],		train_loss: 4.2495
57:	[0s / 35s],		train_loss: 4.2013
62:	[0s / 29s],		train_loss: 4.0664
86:	[0s / 43s],		train_loss: 4.1067
63:	[0s / 29s],		train_loss: 4.0524
58:	[0s / 36s],		train_loss: 4.1968
87:	[0s / 43s],		train_loss: 4.1298
90:	[2s / 3m:5s],		train_loss: 4.1241
64:	[0s / 30s],		train_loss: 4.0608
30:	[1s / 33s],		train_loss: 4.2617
88:	[0s / 44s],		train_loss: 4.1270
59:	[0s / 37s],		train_loss: 4.1930
65:	[0s / 30s],		train_loss: 4.0323
61:	[3s / 3m:58s],		train_loss: 3.9716
89:	[0s / 44s],		train_loss: 4.1050
60:	[0s / 37s],		train_loss: 4.1456
66:	[0s / 31s],		train_loss: 4.0465
31:	[1s / 34s],		train_loss: 4.2092
90:	[0s / 45s],		train_loss: 4.1013
67:	[0s / 31s],		train_loss: 4.0491
61:	[0s / 38s],		train_loss: 4.1556
91:	[0s / 45s],		train_loss: 4.1033
68:	[0s / 32s],		train_loss: 4.0528
39:	[7s / 5m:1s],		train_loss: 4.1634
91:	[2s / 3m:8s],		train_loss: 4.1091
62:	[0s / 39s],		train_loss: 4.1428
92:	[0s / 46s],		train_loss: 4.0906
69:	[0s / 32s],		train_loss: 4.0376
32:	[1s / 35s],		train_loss: 4.1997
70:	[0s / 33s],		train_loss: 4.0768
93:	[0s / 46s],		train_loss: 4.1295
63:	[0s / 39s],		train_loss: 4.1464
71:	[0s / 33s],		train_loss: 4.0819
94:	[0s / 47s],		train_loss: 4.1015
64:	[0s / 40s],		train_loss: 4.1506
33:	[0s / 36s],		train_loss: 4.2158
72:	[0s / 33s],		train_loss: 4.0358
95:	[0s / 47s],		train_loss: 4.0826
92:	[1s / 3m:9s],		train_loss: 4.0923
65:	[0s / 40s]