[I 2026-07-01 07:36:42,015] Trial 73 finished with value: 0.7865030071282004 and parameters: {'num_nodes': [128, 64], 'dropout': 0.0775893469062355, 'learning_rate': 0.009462059562469219, 'batch_norm': False}. Best is trial 3 with value: 0.8108369571214855.
/scratch.hpc/luca.cotugno/Foundation_model_clinical_data/test_tabular_model.py:481: UserWarning: Choices for a categorical distribution should be a tuple of None, bool, int, float and str for persistent storage but contains [32] which is of type list.
  num_nodes  = trial.suggest_categorical("num_nodes", [[32], [64], [128], [64, 32], [128, 64]])
/scratch.hpc/luca.cotugno/Foundation_model_clinical_data/test_tabular_model.py:481: UserWarning: Choices for a categorical distribution should be a tuple of None, bool, int, float and str for persistent storage but contains [64] which is of type list.
  num_nodes  = trial.suggest_categorical("num_nodes", [[32], [64], [128], [64, 32], [128, 64]])
/scratch.hpc/luca.cotugno/Foundation_model_clinical_data/test_tabular_model.py:481: UserWarning: Choices for a categorical distribution should be a tuple of None, bool, int, float and str for persistent storage but contains [128] which is of type list.
  num_nodes  = trial.suggest_categorical("num_nodes", [[32], [64], [128], [64, 32], [128, 64]])
/scratch.hpc/luca.cotugno/Foundation_model_clinical_data/test_tabular_model.py:481: UserWarning: Choices for a categorical distribution should be a tuple of None, bool, int, float and str for persistent storage but contains [64, 32] which is of type list.
  num_nodes  = trial.suggest_categorical("num_nodes", [[32], [64], [128], [64, 32], [128, 64]])
/scratch.hpc/luca.cotugno/Foundation_model_clinical_data/test_tabular_model.py:481: UserWarning: Choices for a categorical distribution should be a tuple of None, bool, int, float and str for persistent storage but contains [128, 64] which is of type list.
  num_nodes  = trial.suggest_categorical("num_nodes", [[32], [64], [128], [64, 32], [128, 64]])

76:	[0s / 36s],		train_loss: 4.0293
18:	[0s / 13s],		train_loss: 4.2347
77:	[0s / 36s],		train_loss: 4.0178
43:	[0s / 22s],		train_loss: 4.0916
70:	[1s / 1m:16s],		train_loss: 4.0353
19:	[0s / 13s],		train_loss: 4.2078
78:	[0s / 37s],		train_loss: 4.0303
44:	[0s / 23s],		train_loss: 4.1396
79:	[0s / 37s],		train_loss: 4.0056
20:	[0s / 14s],		train_loss: 4.2070
71:	[0s / 1m:17s],		train_loss: 4.0746
49:	[1s / 1m:36s],		train_loss: 4.2085
45:	[0s / 23s],		train_loss: 4.0747
80:	[0s / 38s],		train_loss: 4.0254
46:	[0s / 23s],		train_loss: 4.0902
21:	[0s / 15s],		train_loss: 4.2518
81:	[0s / 38s],		train_loss: 4.0359
72:	[0s / 1m:18s],		train_loss: 4.0740
47:	[0s / 24s],		train_loss: 4.1148
88:	[3s / 6m:41s],		train_loss: 3.8180
22:	[0s / 15s],		train_loss: 4.1928
82:	[0s / 39s],		train_loss: 4.0303
1:	[8s / 16s],		train_loss: 4.3932
48:	[0s / 24s],		train_loss: 4.0790
83:	[0s / 39s],		train_loss: 4.0246
23:	[0s / 16s],		train_loss: 4.2245
50:	[1s / 1m:38s],		train_loss: 4.2233
49:	[0s / 25s],		train_loss: 4.0938
73:	[1s / 1m:19s],		train_loss: 4.0489
84:	[0s / 40s],		train_loss: 4.0019
24:	[0s / 17s],		train_loss: 4.1769
50:	[0s / 26s],		train_loss: 4.0805
85:	[0s / 40s],		train_loss: 4.0189
74:	[1s / 1m:21s],		train_loss: 4.0702
51:	[0s / 26s],		train_loss: 4.0827
25:	[0s / 17s],		train_loss: 4.1872
86:	[0s / 41s],		train_loss: 4.0124
51:	[2s / 1m:40s],		train_loss: 4.2154
52:	[0s / 27s],		train_loss: 4.0881
87:	[0s / 42s],		train_loss: 4.0250
26:	[0s / 18s],		train_loss: 4.1768
53:	[0s / 27s],		train_loss: 4.0715
75:	[1s / 1m:22s],		train_loss: 4.0426
88:	[0s / 42s],		train_loss: 4.0092
27:	[0s / 19s],		train_loss: 4.1900
89:	[3s / 6m:45s],		train_loss: 3.8082
54:	[0s / 28s],		train_loss: 4.0607
89:	[0s / 42s],		train_loss: 3.9992
28:	[0s / 19s],		train_loss: 4.1764
90:	[0s / 43s],		train_loss: 4.0062
76:	[0s / 1m:23s],		train_loss: 4.0637
55:	[0s / 29s],		train_loss: 4.0390
52:	[1s / 1m:41s],		train_loss: 4.2114
29:	[0s / 20s],		train_loss: 4.1672
91:	[0s / 44s],		train_loss: 3.9865
56:	[0s / 29s],		train_loss: 4.0379
92:	[0s / 44s],		train_loss: 3.9766
30:	[0s / 21s],		train_loss: 4.1823
57:	[0s / 30s],		train_loss: 4.0761
77:	[1s / 1m:24s],		train_loss: 4.0511
93:	[0s / 45s],		train_loss: 3.9908
58:	[0s / 30s],		train_loss: 4.0636
31:	[0s / 22s],		train_loss: 4.1858
94:	[0s / 45s],		train_loss: 4.0379
53:	[2s / 1m:44s],		train_loss: 4.2004
59:	[0s / 31s],		train_loss: 4.0590
78:	[1s / 1m:25s],		train_loss: 4.0378
32:	[0s / 22s],		train_loss: 4.1672
95:	[0s / 46s],		train_loss: 3.9702
60:	[0s / 32s],		train_loss: 4.0512
96:	[0s / 46s],		train_loss: 4.0699
33:	[0s / 23s],		train_loss: 4.1567
90:	[4s / 6m:49s],		train_loss: 3.8059
61:	[0s / 32s],		train_loss: 4.0345
2:	[8s / 24s],		train_loss: 4.3706
79:	[1s / 1m:27s],		train_loss: 4.0234
97:	[0s / 47s],		train_loss: 3.9720
34:	[0s / 24s],		train_loss: 4.1660
62:	[0s / 33s],		train_loss: 4.0015
98:	[0s / 47s],		train_loss: 4.0007
54:	[2s / 1m:46s],		train_loss: 4.1951
63:	[0s / 33s],		train_loss: 4.0529
35:	[0s / 24s],		train_loss: 4.1399
99:	[0s / 48s],		train_loss: 3.9674
80:	[0s / 1m:28s],		train_loss: 4.0331
64:	[0s / 34s],		train_loss: 4.0425
36:	[0s / 25s],		train_loss: 4.1588
0:	[0s / 0s],		train_loss: 4.6284
65:	[0s / 34s],		train_loss: 4.0218
53:	[17s / 13m:11s],		train_loss: 3.9983
1:	[0s / 0s],		train_loss: 4.4010
81:	[1s / 1m:29s],		train_loss: 4.0566
37:	[0s / 26s],		train_loss: 4.1563
66:	[0s / 35s],		train_loss: 4.0365
55:	[1s / 1m:48s],		train_loss: 4.2387
2:	[0s / 1s],		train_loss: 4.3750
38:	[0s / 26s],		train_loss: 4.1562
67:	[0s / 35s],		train_loss: 4.0515
3:	[0s / 2s],		train_loss: 4.3589
82:	[1s / 1m:30s],		train_loss: 4.0210
91:	[3s / 6m:53s],		train_loss: 3.7893
39:	[0s / 27s],		train_loss: 4.1203
68:	[0s / 36s],		train_loss: 4.0439
4:	[0s / 2s],		train_loss: 4.3015
69:	[0s / 37s],		train_loss: 4.0317
5:	[0s / 3s],		train_loss: 4.2968
40:	[0s / 28s],		train_loss: 4.0968
83:	[1s / 1m:31s],		train_loss: 4.0457
6:	[0s / 3s],		train_loss: 4.3033
70:	[0s / 37s],		train_loss: 4.0579
56:	[2s / 1m:50s],		train_loss: 4.1609
41:	[0s / 29s],		train_loss: 4.1130
7:	[0s / 3s],		train_loss: 4.3222
71:	[0s / 38s],		train_loss: 4.0219
84:	[0s / 1m:32s],		train_loss: 4.0146
42:	[0s / 29s],		train_loss: 4.1384
8:	[0s / 4s],		train_loss: 4.3030
72:	[0s / 38s],		train_loss: 4.0105
9:	[0s / 4s],		train_loss: 4.2606
73:	[0s / 38s],		train_loss: 4.0706
43:	[0s / 30s],		train_loss: 4.1096
10:	[0s / 5s],		train_loss: 4.2370
85:	[0s / 1m:33s],		train_loss: 4.0280
74:	[0s / 39s],		train_loss: 4.0414
57:	[1s / 1m:52s],		train_loss: 4.1724
44:	[0s / 30s],		train_loss: 4.1195
11:	[0s / 5s],		train_loss: 4.2700
75:	[0s / 39s],		train_loss: 4.0192
12:	[0s / 6s],		train_loss: 4.2667
3:	[7s / 32s],		train_loss: 4.3371
45:	[0s / 31s],		train_loss: 4.1248
76:	[0s / 40s],		train_loss: 4.0143
86:	[1s / 1m:34s],		train_loss: 3.9983
92:	[4s / 6m:57s],		train_loss: 3.7965
13:	[0s / 6s],		train_loss: 4.2691
77:	[0s / 40s],		train_loss: 3.9827
46:	[0s / 31s],		train_loss: 4.1149
14:	[0s / 6s],		train_loss: 4.2518
78:	[0s / 41s],		train_loss: 3.9759
47:	[0s / 32s],		train_loss: 4.1134
87:	[0s / 1m:35s],		train_loss: 4.0378
15:	[0s / 7s],		train_loss: 4.2150
58:	[1s / 1m:54s],		train_loss: 4.2011
79:	[0s / 41s],		train_loss: 4.0024
16:	[0s / 7s],		train_loss: 4.2421
48:	[0s / 32s],		train_loss: 4.1037
80:	[0s / 41s],		train_loss: 3.9736
17:	[0s / 8s],		train_loss: 4.2306
88:	[1s / 1m:36s],		train_loss: 4.0521
49:	[0s / 33s],		train_loss: 4.1052
81:	[0s / 42s],		train_loss: 3.9675
18:	[0s / 8s],		train_loss: 4.2209
82:	[0s / 42s],		train_loss: 3.9845
50:	[0s / 34s],		train_loss: 4.1134
19:	[0s / 8s],		train_loss: 4.1964
89:	[1s / 1m:37s],		train_loss: 4.0150
59:	[2s / 1m:56s],		train_loss: 4.1999
83:	[0s / 43s],		train_loss: 4.0090
20:	[0s / 9s],		train_loss: 4.2185
51:	[0s / 34s],		train_loss: 4.0936
84:	[0s / 43s],		train_loss: 3.9891
21:	[0s / 9s],		train_loss: 4.2083
52:	[0s / 35s],		train_loss: 4.0919
90:	[0s / 1m:38s],		train_loss: 4.0401
22:	[0s / 10s],		train_loss: 4.2065
85:	[0s / 44s],		train_loss: 3.9566
93:	[3s / 7m:1s],		train_loss: 3.7777
53:	[0s / 35s],		train_loss: 4.1114
23:	[0s / 10s],		train_loss: 4.1978
86:	[0s / 44s],		train_loss: 4.0048
60:	[1s / 1m:57s],		train_loss: 4.1991
24:	[0s / 11s],		train_loss: 4.1775
91:	[0s / 1m:39s],		train_loss: 4.0187
87:	[0s / 45s],		train_loss: 3.9832
54:	[0s / 36s],		train_loss: 4.0836
25:	[0s / 11s],		train_loss: 4.1905
88:	[0s / 45s],		train_loss: 3.9658
55:	[0s / 37s],		train_loss: 4.0818
26:	[0s / 12s],		train_loss: 4.1780
92:	[0s / 1m:40s],		train_loss: 3.9895
89:	[0s / 46s],		train_loss: 3.9463
27:	[0s / 12s],		train_loss: 4.1640
56:	[0s / 37s],		train_loss: 4.0726
90:	[0s / 46s],		train_loss: 3.9634
28:	[0s / 12s],		train_loss: 4.1951
61:	[1s / 1m:59s],		train_loss: 4.2020
57:	[0s / 38s],		train_loss: 4.0691
93:	[1s / 1m:41s],		train_loss: 4.0182
91:	[0s / 47s],		train_loss: 3.9642
29:	[0s / 13s],		train_loss: 4.2012
4:	[7s / 39s],		train_loss: 4.3398
92:	[0s / 47s],		train_loss: 3.9519
58:	[0s / 39s],		train_loss: 4.0526
30:	[0s / 13s],		train_loss: 4.1518
94:	[1s / 1m:42s],		train_loss: 3.9960
93:	[0s / 48s],		train_loss: 3.9739
31:	[0s / 14s],		train_loss: 4.1627
94:	[4s / 7m:5s],		train_loss: 3.7749
59:	[0s / 39s],		train_loss: 4.0974
94:	[0s / 48s],		train_loss: 3.9481
62:	[1s / 2m:1s],		train_loss: 4.1693
32:	[0s / 14s],		train_loss: 4.1748
60:	[0s / 40s],		train_loss: 4.0702
95:	[0s / 48s],		train_loss: 3.9502
33:	[0s / 15s],		train_loss: 4.1612
95:	[0s / 1m:43s],		train_loss: 4.0203
96:	[0s / 49s],		train_loss: 3.9447
61:	[0s / 40s],		train_loss: 4.0448
34:	[0s / 15s],		train_loss: 4.1542
97:	[0s / 49s],		train_loss: 3.9412
35:	[0s / 15s],		train_loss: 4.1407
54:	[15s / 13m:26s],		train_loss: 3.9780
62:	[0s / 41s],		train_loss: 4.0685
96:	[0s / 1m:44s],		train_loss: 3.9857
98:	[0s / 50s],		train_loss: 3.9435
36:	[0s / 16s],		train_loss: 4.1557
63:	[1s / 2m:3s],		train_loss: 4.1775
63:	[0s / 41s],		train_loss: 4.0357
37:	[0s / 16s],		train_loss: 4.1407
99:	[0s / 50s],		train_loss: 3.9378
97:	[1s / 1m:45s],		train_loss: 3.9926
64:	[0s / 42s],		train_loss: 4.0516
38:	[0s / 17s],		train_loss: 4.1268
0:	[0s / 0s],		train_loss: 4.6798
39:	[0s / 17s],		train_loss: 4.1521
65:	[0s / 43s],		train_loss: 4.0443
95:	[3s / 7m:9s],		train_loss: 3.7711
1:	[0s / 1s],		train_loss: 4.4290
98:	[1s / 1m:46s],		train_loss: 4.0392
64:	[1s / 2m:5s],		train_loss: 4.1617
40:	[0s / 18s],		train_loss: 4.1053
2:	[0s / 1s],		train_loss: 4.3629
66:	[0s / 43s],		train_loss: 4.0569
41:	[0s / 18s],		train_loss: 4.1510
3:	[0s / 2s],		train_loss: 4.3590
67:	[0s / 44s],		train_loss: 4.0555
99:	[1s / 1m:47s],		train_loss: 4.0672
42:	[0s / 19s],		train_loss: 4.1894
4:	[0s / 2s],		train_loss: 4.3066
43:	[0s / 19s],		train_loss: 4.1600
68:	[0s / 45s],		train_loss: 4.0507
5:	[0s / 3s],		train_loss: 4.3010
65:	[2s / 2m:7s],		train_loss: 4.1757
44:	[0s / 20s],		train_loss: 4.1160
0:	[0s / 0s],		train_loss: 4.5138
69:	[0s / 45s],		train_loss: 4.0445
6:	[0s / 3s],		train_loss: 4.2809
45:	[0s / 20s],		train_loss: 4.1545
5:	[7s / 46s],		train_loss: 4.3192
7:	[0s / 4s],		train_loss: 4.2789
70:	[0s / 46s],		train_loss: 4.0530
46:	[0s / 21s],		train_loss: 4.1044
1:	[1s / 2s],		train_loss: 4.3643
8:	[0s / 4s],		train_loss: 4.2741
47:	[0s / 21s],		train_loss: 4.1139
96:	[3s / 7m:12s],		train_loss: 3.7434
71:	[0s / 47s],		train_loss: 4.0713
66:	[1s / 2m:9s],		train_loss: 4.1774
9:	[0s / 5s],		train_loss: 4.2667
48:	[0s / 22s],		train_loss: 4.1128
72:	[0s / 47s],		train_loss: 4.0161
2:	[1s / 3s],		train_loss: 4.3371
49:	[0s / 22s],		train_loss: 4.1241
10:	[0s / 5s],		train_loss: 4.2571
73:	[0s / 48s],		train_loss: 4.0210
50:	[0s / 23s],		train_loss: 4.1287
11:	[0s / 6s],		train_loss: 4.2422
3:	[1s / 4s],		train_loss: 4.3187
51:	[0s / 23s],		train_loss: 4.0711
74:	[0s / 49s],		train_loss: 4.0362
12:	[0s / 6s],		train_loss: 4.2449
67:	[1s / 2m:11s],		train_loss: 4.1688
52:	[0s / 24s],		train_loss: 4.1177
13:	[0s / 7s],		train_loss: 4.2417
75:	[0s / 49s],		train_loss: 4.0209
4:	[1s / 5s],		train_loss: 4.3401
53:	[0s / 24s],		train_loss: 4.0777
14:	[0s / 8s],		train_loss: 4.2537
76:	[0s / 50s],		train_loss: 4.0378
54:	[0s / 25s],		train_loss: 4.1290
15:	[0s / 8s],		train_loss: 4.2061
55:	[0s / 25s],		train_loss: 4.1001
77:	[0s / 51s],		train_loss: 4.0613
5:	[1s / 6s],		train_loss: 4.2940
16:	[0s / 9s],		train_loss: 4.1936
97:	[4s / 7m:17s],		train_loss: 3.7487
56:	[0s / 26s],		train_loss: 4.0999
68:	[2s / 2m:13s],		train_loss: 4.1997
17:	[0s / 9s],		train_loss: 4.2217
78:	[0s / 51s],		train_loss: 4.0297
57:	[0s / 26s],		train_loss: 4.0908
6:	[1s / 7s],		train_loss: 4.3036
18:	[0s / 10s],		train_loss: 4.2120
79:	[0s / 52s],		train_loss: 4.0462
58:	[0s / 27s],		train_loss: 4.1057
19:	[0s / 10s],		train_loss: 4.2030
59:	[0s / 27s],		train_loss: 4.0773
80:	[0s / 53s],		train_loss: 4.0159
20:	[0s / 11s],		train_loss: 4.1872
7:	[0s / 8s],		train_loss: 4.2696
60:	[0s / 28s],		train_loss: 4.0913
69:	[1s / 2m:15s],		train_loss: 4.1456
81:	[0s / 53s],		train_loss: 4.0152
21:	[0s / 11s],		train_loss: 4.1803
61:	[0s / 28s],		train_loss: 4.0798
82:	[0s / 54s],		train_loss: 3.9862
22:	[0s / 11s],		train_loss: 4.2292
62:	[0s / 29s],		train_loss: 4.0574
8:	[1s / 9s],		train_loss: 4.2444
6:	[8s / 55s],		train_loss: 4.3173
63:	[0s / 29s],		train_loss: 4.0706
23:	[0s / 12s],		train_loss: 4.1907
83:	[0s / 54s],		train_loss: 3.9916
64:	[0s / 30s],		train_loss: 4.0764
24:	[0s / 13s],		train_loss: 4.1986
9:	[1s / 10s],		train_loss: 4.2499
84:	[0s / 55s],		train_loss: 3.9505
65:	[0s / 30s],		train_loss: 4.0835
70:	[2s / 2m:17s],		train_loss: 4.1963
25:	[0s / 13s],		train_loss: 4.1450
98:	[4s / 7m:21s],		train_loss: 3.7558
85:	[0s / 56s],		train_loss: 4.0073
66:	[0s / 30s],		train_loss: 4.0644
26:	[0s / 13s],		train_loss: 4.1449
10:	[0s / 11s],		train_loss: 4.2391
67:	[0s / 31s],		train_loss: 4.0727
86:	[0s / 56s],		train_loss: 3.9973
27:	[0s / 14s],		train_loss: 4.1358
68:	[0s / 31s],		train_loss: 4.0687
28:	[0s / 14s],		train_loss: 4.1225
87:	[0s / 57s],		train_loss: 3.9681
69:	[0s / 32s],		train_loss: 4.0518
71:	[1s / 2m:19s],		train_loss: 4.1881
11:	[1s / 12s],		train_loss: 4.2477
29:	[0s / 15s],		train_loss: 4.1595
88:	[0s / 57s],		train_loss: 3.9943
70:	[0s / 32s],		train_loss: 4.0580
30:	[0s / 15s],		train_loss: 4.1570
71:	[0s / 33s],		train_loss: 4.0509
89:	[0s / 58s],		train_loss: 3.9842
12:	[1s / 13s],		train_loss: 4.2327
31:	[0s / 16s],		train_loss: 4.1661
72:	[0s / 33s],		train_loss: 4.0553
90:	[0s / 59s],		train_loss: 3.9656
32:	[0s / 17s],		train_loss: 4.1296
73:	[0s / 34s],		train_loss: 4.0520
72:	[2s / 2m:21s],		train_loss: 4.1634
55:	[18s / 13m:45s],		train_loss: 3.9778
91:	[0s / 59s],		train_loss: 4.0109
33:	[0s / 17s],		train_loss: 4.1134
13:	[1s / 15s],		train_loss: 4.1962
74:	[0s / 34s],		train_loss: 4.0152
99:	[4s / 7m:25s],		train_loss: 3.7570
34:	[0s / 18s],		train_loss: 4.1257
92:	[0s / 1m:0s],		train_loss: 3.9727
75:	[0s / 35s],		train_loss: 4.0671
35:	[0s / 18s],		train_loss: 4.1076
14:	[1s / 16s],		train_loss: 4.1956
76:	[0s / 35s],		train_loss: 4.0589
93:	[0s / 1m:1s],		train_loss: 3.9825
36:	[0s / 19s],		train_loss: 4.0970
77:	[0s / 36s],		train_loss: 4.0481
94:	[0s / 1m:1s],		train_loss: 3.9656
73:	[2s / 2m:23s],		train_loss: 4.1675
37:	[0s / 19s],		train_loss: 4.0809
78:	[0s / 36s],		train_loss: 4.0531
7:	[7s / 1m:2s],		train_loss: 4.2952
15:	[1s / 17s],		train_loss: 4.2340
95:	[0s / 1m:2s],		train_loss: 3.9891
79:	[0s / 37s],		train_loss: 4.0230
38:	[0s / 20s],		train_loss: 4.0721
80:	[0s / 37s],		train_loss: 4.0334
39:	[0s / 20s],		train_loss: 4.0954
96:	[0s / 1m:2s],		train_loss: 3.9721
16:	[1s / 18s],		train_loss: 4.1950
81:	[0s / 38s],		train_loss: 4.0282
40:	[0s / 21s],		train_loss: 4.0884
97:	[0s / 1m:3s],		train_loss: 3.9393
74:	[1s / 2m:25s],		train_loss: 4.1266
82:	[0s / 38s],		train_loss: 4.0369
41:	[0s / 21s],		train_loss: 4.1033
98:	[0s / 1m:4s],		train_loss: 4.0052
17:	[1s / 19s],		train_loss: 4.2036
0:	[3s / 3s],		train_loss: 4.6126
83:	[0s / 39s],		train_loss: 4.0388
42:	[0s / 22s],		train_loss: 4.0878
84:	[0s / 39s],		train_loss: 4.0431
43:	[0s / 22s],		train_loss: 4.0688
99:	[0s / 1m:4s],		train_loss: 3.9937
85:	[0s / 39s],		train_loss: 4.0302
18:	[0s / 20s],		train_loss: 4.1724
44:	[0s / 23s],		train_loss: 4.0520
75:	[1s / 2m:27s],		train_loss: 4.1548
0:	[0s / 0s],		train_loss: 4.5180
86:	[0s / 40s],		train_loss: 4.0190
45:	[0s / 23s],		train_loss: 4.1094
87:	[0s / 40s],		train_loss: 4.0050
1:	[0s / 1s],		train_loss: 4.3677
19:	[0s / 21s],		train_loss: 4.1516
46:	[0s / 23s],		train_loss: 4.0638
88:	[0s / 41s],		train_loss: 4.0557
47:	[0s / 24s],		train_loss: 4.0841
2:	[0s / 1s],		train_loss: 4.3436
89:	[0s / 41s],		train_loss: 4.0074
48:	[0s / 24s],		train_loss: 4.0455
20:	[0s / 22s],		train_loss: 4.1557
90:	[0s / 41s],		train_loss: 4.0307
3:	[0s / 2s],		train_loss: 4.3248
76:	[1s / 2m:28s],		train_loss: 4.1467
49:	[0s / 25s],		train_loss: 4.0249
1:	[3s / 7s],		train_loss: 4.3938
91:	[0s / 42s],		train_loss: 4.0403
4:	[0s / 2s],		train_loss: 4.3014
50:	[0s / 25s],		train_loss: 4.0409
92:	[0s / 42s],		train_loss: 4.0119
21:	[1s / 23s],		train_loss: 4.1578
5:	[0s / 3s],		train_loss: 4.2564
51:	[0s / 26s],		train_loss: 4.0603
93:	[0s / 43s],		train_loss: 3.9900
8:	[6s / 1m:9s],		train_loss: 4.2729
94:	[0s / 43s],		train_loss: 4.0022
52:	[0s / 26s],		train_loss: 4.0640
6:	[0s / 3s],		train_loss: 4.2904
77:	[1s / 2m:30s],		train_loss: 4.1593
22:	[1s / 24s],		train_loss: 4.1670
95:	[0s / 44s],		train_loss: 4.0148
53:	[0s / 27s],		train_loss: 4.0207
7:	[0s / 4s],		train_loss: 4.2743
96:	[0s / 44s],		train_loss: 3.9740
54:	[0s / 27s],		train_loss: 4.0207
23:	[1s / 25s],		train_loss: 4.1724
8:	[0s / 5s],		train_loss: 4.2541
97:	[0s / 45s],		train_loss: 4.0267
55:	[0s / 28s],		train_loss: 4.0035
98:	[0s / 45s],		train_loss: 4.0174
9:	[0s / 5s],		train_loss: 4.2341
56:	[0s / 28s],		train_loss: 3.9909
78:	[1s / 2m:32s],		train_loss: 4.1772
2:	[3s / 10s],		train_loss: 4.3520
24:	[1s / 26s],		train_loss: 4.1426
99:	[0s / 46s],		train_loss: 4.0026
57:	[0s / 29s],		train_loss: 3.9909
10:	[0s / 6s],		train_loss: 4.2279
0:	[0s / 0s],		train_loss: 4.7841
58:	[0s / 29s],		train_loss: 4.0085
11:	[0s / 7s],		train_loss: 4.2378
25:	[1s / 27s],		train_loss: 4.1658
1:	[0s / 0s],		train_loss: 4.3738
59:	[0s / 30s],		train_loss: 3.9940
12:	[0s / 7s],		train_loss: 4.2310
2:	[0s / 1s],		train_loss: 4.3548
79:	[1s / 2m:34s],		train_loss: 4.1585
60:	[0s / 30s],		train_loss: 3.9888
26:	[0s / 28s],		train_loss: 4.1298
3:	[0s / 1s],		train_loss: 4.3563
13:	[0s / 8s],		train_loss: 4.2460
61:	[0s / 31s],		train_loss: 4.0025
4:	[0s / 2s],		train_loss: 4.3120
14:	[0s / 8s],		train_loss: 4.2403
62:	[0s / 31s],		train_loss: 3.9941
56:	[14s / 13m:59s],		train_loss: 3.9740
5:	[0s / 2s],		train_loss: 4.3134
27:	[1s / 29s],		train_loss: 4.1351
63:	[0s / 32s],		train_loss: 3.9653
15:	[0s / 9s],		train_loss: 4.2026
6:	[0s / 3s],		train_loss: 4.3017
80:	[1s / 2m:36s],		train_loss: 4.1606
64:	[0s / 32s],		train_loss: 3.9546
7:	[0s / 3s],		train_loss: 4.2927
16:	[0s / 10s],		train_loss: 4.2252
3:	[3s / 14s],		train_loss: 4.3124
65:	[0s / 32s],		train_loss: 3.9971
28:	[0s / 30s],		train_loss: 4.1105
8:	[0s / 3s],		train_loss: 4.2876
9:	[6s / 1m:16s],		train_loss: 4.2748
17:	[0s / 10s],		train_loss: 4.1867
66:	[0s / 33s],		train_loss: 3.9905
9:	[0s / 4s],		train_loss: 4.3005
18:	[0s / 11s],		train_loss: 4.1913
67:	[0s / 33s],		train_loss: 3.9861
29:	[1s / 31s],		train_loss: 4.1111
10:	[0s / 4s],		train_loss: 4.2929
81:	[1s / 2m:38s],		train_loss: 4.1555
68:	[0s / 34s],		train_loss: 3.9322
11:	[0s / 5s],		train_loss: 4.2596
19:	[0s / 11s],		train_loss: 4.1939
69:	[0s / 35s],		train_loss: 3.9711
12:	[0s / 5s],		train_loss: 4.2647
30:	[1s / 32s],		train_loss: 4.1100
20:	[0s / 12s],		train_loss: 4.1815
13:	[0s / 6s],		train_loss: 4.2616
70:	[0s / 35s],		train_loss: 3.9584
21:	[0s / 13s],		train_loss: 4.1704
14:	[0s / 6s],		train_loss: 4.2472
71:	[0s / 36s],		train_loss: 3.9498
31:	[1s / 33s],		train_loss: 4.0943
82:	[2s / 2m:40s],		train_loss: 4.1904
15:	[0s / 7s],		train_loss: 4.2597
22:	[0s / 13s],		train_loss: 4.1626
72:	[0s / 36s],		train_loss: 3.9399
4:	[4s / 18s],		train_loss: 4.3186
16:	[0s / 7s],		train_loss: 4.2545
73:	[0s / 37s],		train_loss: 3.9428
23:	[0s / 14s],		train_loss: 4.1443
17:	[0s / 8s],		train_loss: 4.2637
32:	[1s / 34s],		train_loss: 4.1010
74:	[0s / 37s],		train_loss: 3.9247
24:	[0s / 15s],		train_loss: 4.1326
18:	[0s / 8s],		train_loss: 4.2631
75:	[0s / 38s],		train_loss: 3.9299
19:	[0s / 9s],		train_loss: 4.2466
83:	[1s / 2m:42s],		train_loss: 4.1717
25:	[0s / 15s],		train_loss: 4.1565
33:	[1s / 36s],		train_loss: 4.0760
76:	[0s / 38s],		train_loss: 3.9492
20:	[0s / 9s],		train_loss: 4.2250
77:	[0s / 39s],		train_loss: 3.9529
26:	[0s / 16s],		train_loss: 4.1361
21:	[0s / 9s],		train_loss: 4.2233
78:	[0s / 39s],		train_loss: 3.9332
34:	[1s / 37s],		train_loss: 4.0842
22:	[0s / 10s],		train_loss: 4.2264
27:	[0s / 16s],		train_loss: 4.1158
79:	[0s / 39s],		train_loss: 3.9819
23:	[0s / 10s],		train_loss: 4.2083
84:	[1s / 2m:44s],		train_loss: 4.1399
28:	[0s / 17s],		train_loss: 4.0988
5:	[3s / 22s],		train_loss: 4.3006
80:	[0s / 40s],		train_loss: 3.9744
24:	[0s / 11s],		train_loss: 4.2432
35:	[0s / 38s],		train_loss: 4.0891
29:	[0s / 18s],		train_loss: 4.1268
81:	[0s / 40s],		train_loss: 3.9727
25:	[0s / 11s],		train_loss: 4.2156
10:	[7s / 1m:24s],		train_loss: 4.2713
82:	[0s / 41s],		train_loss: 3.9497
26:	[0s / 12s],		train_loss: 4.2090
30:	[0s / 18s],		train_loss: 4.1281
36:	[0s / 38s],		train_loss: 4.0759
27:	[0s / 12s],		train_loss: 4.2192
83:	[0s / 41s],		train_loss: 3.9029
85:	[1s / 2m:45s],		train_loss: 4.1523
31:	[0s / 19s],		train_loss: 4.0989
28:	[0s / 12s],		train_loss: 4.1983
84:	[0s / 42s],		train_loss: 3.9179
37:	[1s / 40s],		train_loss: 4.0968
32:	[0s / 19s],		train_loss: 4.0981
29:	[0s / 13s],		train_loss: 4.1999
85:	[0s / 42s],		train_loss: 3.9171
30:	[0s / 13s],		train_loss: 4.2390
86:	[0s / 43s],		train_loss: 3.9085
33:	[0s / 20s],		train_loss: 4.089