[I 2026-07-01 07:21:58,255] Trial 10 finished with value: 0.7918806497520694 and parameters: {'num_nodes': [128], 'dropout': 0.18113276380190732, 'learning_rate': 0.0011553973992844402, 'batch_norm': False}. Best is trial 8 with value: 0.792627877124692.
/scratch.hpc/luca.cotugno/Foundation_model_clinical_data/test_tabular_model.py:481: UserWarning: Choices for a categorical distribution should be a tuple of None, bool, int, float and str for persistent storage but contains [32] which is of type list.
  num_nodes  = trial.suggest_categorical("num_nodes", [[32], [64], [128], [64, 32], [128, 64]])
/scratch.hpc/luca.cotugno/Foundation_model_clinical_data/test_tabular_model.py:481: UserWarning: Choices for a categorical distribution should be a tuple of None, bool, int, float and str for persistent storage but contains [64] which is of type list.
  num_nodes  = trial.suggest_categorical("num_nodes", [[32], [64], [128], [64, 32], [128, 64]])
/scratch.hpc/luca.cotugno/Foundation_model_clinical_data/test_tabular_model.py:481: UserWarning: Choices for a categorical distribution should be a tuple of None, bool, int, float and str for persistent storage but contains [128] which is of type list.
  num_nodes  = trial.suggest_categorical("num_nodes", [[32], [64], [128], [64, 32], [128, 64]])
/scratch.hpc/luca.cotugno/Foundation_model_clinical_data/test_tabular_model.py:481: UserWarning: Choices for a categorical distribution should be a tuple of None, bool, int, float and str for persistent storage but contains [64, 32] which is of type list.
  num_nodes  = trial.suggest_categorical("num_nodes", [[32], [64], [128], [64, 32], [128, 64]])
/scratch.hpc/luca.cotugno/Foundation_model_clinical_data/test_tabular_model.py:481: UserWarning: Choices for a categorical distribution should be a tuple of None, bool, int, float and str for persistent storage but contains [128, 64] which is of type list.
  num_nodes  = trial.suggest_categorical("num_nodes", [[32], [64], [128], [64, 32], [128, 64]])
STARTED  model=tabdpt  seed=456  tuning=True  shap=False


Preprocess: Replace NaN with -1
Loading existing folds from tmp/splits/OrmoniTirodei_seed456.pkl
X_train shape: (5161, 76), X_test shape: (1291, 76)
Generating TABDPT Embeddings...
<class 'dict'>
Loaded TabDPTModel from checkpoint.
<class 'dict'>
Loaded TabDPTModel from checkpoint.
Successfully generated embeddings with shape: (5161, 768)
  [ckpt] Loading TABDPT DeepSurv Tuned from checkpoints/tabdpt/OrmoniTirodei/-1/seed456/fold1
C-index train: 0.8015
C-index test:  0.7783
  [ckpt] Loading TABDPT RSF Tuned from checkpoints/tabdpt/OrmoniTirodei/-1/seed456/fold1
C-index train: 0.9077
C-index test:  0.7599
  [ckpt] Loading DeepSurv Simple from checkpoints/tabdpt/OrmoniTirodei/-1/seed456/fold1/tabdpt_deepsurv_simple.pt
C-index TRAIN: 0.7539
C-index TEST:  0.7531
  [ckpt] Loading DeepSurv Vanilla from checkpoints/tabdpt/OrmoniTirodei/-1/seed456/fold1/tabdpt_deepsurv_vanilla.pt
C-index TRAIN: 0.7940
C-index TEST:  0.7737
  [ckpt] Loading TABDPT RSF from checkpoints/tabdpt/OrmoniTirodei/-1/seed456/fold1/tabdpt_rsf.pkl
C-index train: 0.9203
C-index test:  0.7616
  [ckpt] Loading TABDPT Cox (embedding) from checkpoints/tabdpt/OrmoniTirodei/-1/seed456/fold1/tabdpt_tab_cox.pkl
C-index train: 0.8150
C-index test:  0.7735
  [ckpt] Loading DeepSurv Vanilla baseline from checkpoints/tabdpt/OrmoniTirodei/-1/seed456/fold1/deepsurv_vanilla_baseline.pt
C-index TRAIN: 0.8038
C-index TEST:  0.7881
  [ckpt] Loading DeepSurv Simple baseline from checkpoints/tabdpt/OrmoniTirodei/-1/seed456/fold1/deepsurv_simple_baseline.pt
C-index TRAIN: 0.7961
C-index TEST:  0.7809
  [ckpt] RSF baseline saved → checkpoints/tabdpt/OrmoniTirodei/-1/seed456/fold1/rsf_baseline.pkl
C-index train: 0.9014
C-index test:  0.7914
  [ckpt] Loading Cox baseline from checkpoints/tabdpt/OrmoniTirodei/-1/seed456/fold1/tabdpt_cox.pkl
C-index train: 0.8023
C-index test:  0.7859
X_train shape: (5161, 76), X_test shape: (1291, 76)
Generating TABDPT Embeddings...
<class 'dict'>
Loaded TabDPTModel from checkpoint.
<class 'dict'>
Loaded TabDPTModel from checkpoint.
Successfully generated embeddings with shape: (5161, 768)
  [ckpt] Loading TABDPT DeepSurv Tuned from checkpoints/tabdpt/OrmoniTirodei/-1/seed456/fold2
C-index train: 0.7935
C-index test:  0.7706
  [ckpt] Loading TABDPT RSF Tuned from checkpoints/tabdpt/OrmoniTirodei/-1/seed456/fold2
C-index train: 0.8985
C-index test:  0.7592
  [ckpt] Loading DeepSurv Simple from checkpoints/tabdpt/OrmoniTirodei/-1/seed456/fold2/tabdpt_deepsurv_simple.pt
C-index TRAIN: 0.8026
C-index TEST:  0.7507
  [ckpt] Loading DeepSurv Vanilla from checkpoints/tabdpt/OrmoniTirodei/-1/seed456/fold2/tabdpt_deepsurv_vanilla.pt
C-index TRAIN: 0.8219
C-index TEST:  0.7613
  [ckpt] Loading TABDPT RSF from checkpoints/tabdpt/OrmoniTirodei/-1/seed456/fold2/tabdpt_rsf.pkl
C-index train: 0.9179
C-index test:  0.7549
  [ckpt] Loading TABDPT Cox (embedding) from checkpoints/tabdpt/OrmoniTirodei/-1/seed456/fold2/tabdpt_tab_cox.pkl
C-index train: 0.8128
C-index test:  0.7666
  [ckpt] Loading DeepSurv Vanilla baseline from checkpoints/tabdpt/OrmoniTirodei/-1/seed456/fold2/deepsurv_vanilla_baseline.pt
C-index TRAIN: 0.8139
C-index TEST:  0.7792
  [ckpt] Loading DeepSurv Simple baseline from checkpoints/tabdpt/OrmoniTirodei/-1/seed456/fold2/deepsurv_simple_baseline.pt
C-index TRAIN: 0.7876
C-index TEST:  0.7669
  [ckpt] RSF baseline saved → checkpoints/tabdpt/OrmoniTirodei/-1/seed456/fold2/rsf_baseline.pkl
C-index train: 0.9012
C-index test:  0.7832
  [ckpt] Loading Cox baseline from checkpoints/tabdpt/OrmoniTirodei/-1/seed456/fold2/tabdpt_cox.pkl
C-index train: 0.8021
C-index test:  0.7868
X_train shape: (5162, 76), X_test shape: (1290, 76)
Generating TABDPT Embeddings...
<class 'dict'>
Loaded TabDPTModel from checkpoint.
<class 'dict'>
Loaded TabDPTModel from checkpoint.
Successfully generated embeddings with shape: (5162, 768)
  [ckpt] Loading TABDPT DeepSurv Tuned from checkpoints/tabdpt/OrmoniTirodei/-1/seed456/fold3
C-index train: 0.8024
C-index test:  0.7635
  [ckpt] Loading TABDPT RSF Tuned from checkpoints/tabdpt/OrmoniTirodei/-1/seed456/fold3
C-index train: 0.9050
C-index test:  0.7571
  [ckpt] Loading DeepSurv Simple from checkpoints/tabdpt/OrmoniTirodei/-1/seed456/fold3/tabdpt_deepsurv_simple.pt
C-index TRAIN: 0.8118
C-index TEST:  0.7185
  [ckpt] Loading DeepSurv Vanilla from checkpoints/tabdpt/OrmoniTirodei/-1/seed456/fold3/tabdpt_deepsurv_vanilla.pt
C-index TRAIN: 0.8289
C-index TEST:  0.7603
  [ckpt] Loading TABDPT RSF from checkpoints/tabdpt/OrmoniTirodei/-1/seed456/fold3/tabdpt_rsf.pkl
C-index train: 0.9186
C-index test:  0.7530
  [ckpt] Loading TABDPT Cox (embedding) from checkpoints/tabdpt/OrmoniTirodei/-1/seed456/fold3/tabdpt_tab_cox.pkl
C-index train: 0.8169
C-index test:  0.7564
  [ckpt] Loading DeepSurv Vanilla baseline from checkpoints/tabdpt/OrmoniTirodei/-1/seed456/fold3/deepsurv_vanilla_baseline.pt
C-index TRAIN: 0.8079
C-index TEST:  0.7699
  [ckpt] Loading DeepSurv Simple baseline from checkpoints/tabdpt/OrmoniTirodei/-1/seed456/fold3/deepsurv_simple_baseline.pt
C-index TRAIN: 0.7856
C-index TEST:  0.7632
  [ckpt] RSF baseline saved → checkpoints/tabdpt/OrmoniTirodei/-1/seed456/fold3/rsf_baseline.pkl
C-index train: 0.9024
C-index test:  0.7854
  [ckpt] Loading Cox baseline from checkpoints/tabdpt/OrmoniTirodei/-1/seed456/fold3/tabdpt_cox.pkl
C-index train: 0.8041
C-index test:  0.7757
X_train shape: (5162, 76), X_test shape: (1290, 76)
Generating TABDPT Embeddings...
<class 'dict'>
Loaded TabDPTModel from checkpoint.
<class 'dict'>
Loaded TabDPTModel from checkpoint.
Successfully generated embeddings with shape: (5162, 768)
  [ckpt] Loading TABDPT DeepSurv Tuned from checkpoints/tabdpt/OrmoniTirodei/-1/seed456/fold4
C-index train: 0.8062
C-index test:  0.7772
  [ckpt] Loading TABDPT RSF Tuned from checkpoints/tabdpt/OrmoniTirodei/-1/seed456/fold4
C-index train: 0.9100
C-index test:  0.7824
  [ckpt] Loading DeepSurv Simple from checkpoints/tabdpt/OrmoniTirodei/-1/seed456/fold4/tabdpt_deepsurv_simple.pt
C-index TRAIN: 0.7963
C-index TEST:  0.7745
  [ckpt] Loading DeepSurv Vanilla from checkpoints/tabdpt/OrmoniTirodei/-1/seed456/fold4/tabdpt_deepsurv_vanilla.pt
C-index TRAIN: 0.8019
C-index TEST:  0.7767
  [ckpt] Loading TABDPT RSF from checkpoints/tabdpt/OrmoniTirodei/-1/seed456/fold4/tabdpt_rsf.pkl
C-index train: 0.9179
C-index test:  0.7803
  [ckpt] Loading TABDPT Cox (embedding) from checkpoints/tabdpt/OrmoniTirodei/-1/seed456/fold4/tabdpt_tab_cox.pkl
C-index train: 0.8128
C-index test:  0.7826
  [ckpt] Loading DeepSurv Vanilla baseline from checkpoints/tabdpt/OrmoniTirodei/-1/seed456/fold4/deepsurv_vanilla_baseline.pt
C-index TRAIN: 0.8000
C-index TEST:  0.8087
  [ckpt] Loading DeepSurv Simple baseline from checkpoints/tabdpt/OrmoniTirodei/-1/seed456/fold4/deepsurv_simple_baseline.pt
C-index TRAIN: 0.7773
C-index TEST:  0.7865
  [ckpt] RSF baseline saved → checkpoints/tabdpt/OrmoniTirodei/-1/seed456/fold4/rsf_baseline.pkl
C-index train: 0.9004
C-index test:  0.8153
  [ckpt] Loading Cox baseline from checkpoints/tabdpt/OrmoniTirodei/-1/seed456/fold4/tabdpt_cox.pkl
C-index train: 0.7969
C-index test:  0.8108
X_train shape: (5162, 76), X_test shape: (1290, 76)
Generating TABDPT Embeddings...
<class 'dict'>
Loaded TabDPTModel from checkpoint.
<class 'dict'>
Loaded TabDPTModel from checkpoint.
Successfully generated embeddings with shape: (5162, 768)
  [ckpt] Loading TABDPT DeepSurv Tuned from checkpoints/tabdpt/OrmoniTirodei/-1/seed456/fold5
C-index train: 0.8229
C-index test:  0.7933
  [ckpt] Loading TABDPT RSF Tuned from checkpoints/tabdpt/OrmoniTirodei/-1/seed456/fold5
C-index train: 0.9112
C-index test:  0.7852
  [ckpt] Loading DeepSurv Simple from checkpoints/tabdpt/OrmoniTirodei/-1/seed456/fold5/tabdpt_deepsurv_simple.pt
C-index TRAIN: 0.7943
C-index TEST:  0.7834
  [ckpt] Loading DeepSurv Vanilla from checkpoints/tabdpt/OrmoniTirodei/-1/seed456/fold5/tabdpt_deepsurv_vanilla.pt
C-index TRAIN: 0.8098
C-index TEST:  0.7984
  [ckpt] Loading TABDPT RSF from checkpoints/tabdpt/OrmoniTirodei/-1/seed456/fold5/tabdpt_rsf.pkl
C-index train: 0.9208
C-index test:  0.7835
  [ckpt] Loading TABDPT Cox (embedding) from checkpoints/tabdpt/OrmoniTirodei/-1/seed456/fold5/tabdpt_tab_cox.pkl
C-index train: 0.8103
C-index test:  0.7949
  [ckpt] Loading DeepSurv Vanilla baseline from checkpoints/tabdpt/OrmoniTirodei/-1/seed456/fold5/deepsurv_vanilla_baseline.pt
C-index TRAIN: 0.8069
C-index TEST:  0.8066
  [ckpt] Loading DeepSurv Simple baseline from checkpoints/tabdpt/OrmoniTirodei/-1/seed456/fold5/deepsurv_simple_baseline.pt
C-index TRAIN: 0.7921
C-index TEST:  0.8048
  [ckpt] RSF baseline saved → checkpoints/tabdpt/OrmoniTirodei/-1/seed456/fold5/rsf_baseline.pkl
C-index train: 0.9010
C-index test:  0.8037
  [ckpt] Loading Cox baseline from checkpoints/tabdpt/OrmoniTirodei/-1/seed456/fold5/tabdpt_cox.pkl
C-index train: 0.7976
C-index test:  0.8083


Preprocess: Keep NaN
Loading existing folds from tmp/splits/OrmoniTirodei_seed456.pkl
X_train shape: (5161, 76), X_test shape: (1291, 76)
Generating TABDPT Embeddings...
<class 'dict'>
Loaded TabDPTModel from checkpoint.
<class 'dict'>
Loaded TabDPTModel from checkpoint.
Successfully generated embeddings with shape: (5161, 768)
  [ckpt] Loading TABDPT DeepSurv Tuned from checkpoints/tabdpt/OrmoniTirodei/NaN/seed456/fold1
C-index train: 0.8076
C-index test:  0.7781
  [ckpt] Loading TABDPT RSF Tuned from checkpoints/tabdpt/OrmoniTirodei/NaN/seed456/fold1
C-index train: 0.9069
C-index test:  0.7644
  [ckpt] Loading DeepSurv Simple from checkpoints/tabdpt/OrmoniTirodei/NaN/seed456/fold1/tabdpt_deepsurv_simple.pt
C-index TRAIN: 0.8079
C-index TEST:  0.7562
  [ckpt] Loading DeepSurv Vanilla from checkpoints/tabdpt/OrmoniTirodei/NaN/seed456/fold1/tabdpt_deepsurv_vanilla.pt
C-index TRAIN: 0.8100
C-index TEST:  0.7732
  [ckpt] Loading TABDPT RSF from checkpoints/tabdpt/OrmoniTirodei/NaN/seed456/fold1/tabdpt_rsf.pkl
C-index train: 0.9225
C-index test:  0.7631
  [ckpt] Loading TABDPT Cox (embedding) from checkpoints/tabdpt/OrmoniTirodei/NaN/seed456/fold1/tabdpt_tab_cox.pkl
C-index train: 0.8161
C-index test:  0.7744
X_train shape: (5161, 76), X_test shape: (1291, 76)
Generating TABDPT Embeddings...
<class 'dict'>
Loaded TabDPTModel from checkpoint.
<class 'dict'>
Loaded TabDPTModel from checkpoint.
Successfully generated embeddings with shape: (5161, 768)
  [ckpt] Loading TABDPT DeepSurv Tuned from checkpoints/tabdpt/OrmoniTirodei/NaN/seed456/fold2
C-index train: 0.8204
C-index test:  0.7565
  [ckpt] Loading TABDPT RSF Tuned from checkpoints/tabdpt/OrmoniTirodei/NaN/seed456/fold2
C-index train: 0.9177
C-index test:  0.7500
  [ckpt] Loading DeepSurv Simple from checkpoints/tabdpt/OrmoniTirodei/NaN/seed456/fold2/tabdpt_deepsurv_simple.pt
C-index TRAIN: 0.7813
C-index TEST:  0.7589
  [ckpt] Loading DeepSurv Vanilla from checkpoints/tabdpt/OrmoniTirodei/NaN/seed456/fold2/tabdpt_deepsurv_vanilla.pt
C-index TRAIN: 0.8061
C-index TEST:  0.7589
  [ckpt] Loading TABDPT RSF from checkpoints/tabdpt/OrmoniTirodei/NaN/seed456/fold2/tabdpt_rsf.pkl
C-index train: 0.9211
C-index test:  0.7528
  [ckpt] Loading TABDPT Cox (embedding) from checkpoints/tabdpt/OrmoniTirodei/NaN/seed456/fold2/tabdpt_tab_cox.pkl
C-index train: 0.8172
C-index test:  0.7632
X_train shape: (5162, 76), X_test shape: (1290, 76)
Generating TABDPT Embeddings...
<class 'dict'>
Loaded TabDPTModel from checkpoint.
<class 'dict'>
Loaded TabDPTModel from checkpoint.
Successfully generated embeddings with shape: (5162, 768)
  [ckpt] Loading TABDPT DeepSurv Tuned from checkpoints/tabdpt/OrmoniTirodei/NaN/seed456/fold3
C-index train: 0.8124
C-index test:  0.7567
  [ckpt] Loading TABDPT RSF Tuned from checkpoints/tabdpt/OrmoniTirodei/NaN/seed456/fold3
C-index train: 0.9035
C-index test:  0.7536
  [ckpt] Loading DeepSurv Simple from checkpoints/tabdpt/OrmoniTirodei/NaN/seed456/fold3/tabdpt_deepsurv_simple.pt
C-index TRAIN: 0.7940
C-index TEST:  0.7318
  [ckpt] Loading DeepSurv Vanilla from checkpoints/tabdpt/OrmoniTirodei/NaN/seed456/fold3/tabdpt_deepsurv_vanilla.pt
C-index TRAIN: 0.8094
C-index TEST:  0.7628
  [ckpt] Loading TABDPT RSF from checkpoints/tabdpt/OrmoniTirodei/NaN/seed456/fold3/tabdpt_rsf.pkl
C-index train: 0.9206
C-index test:  0.7513
  [ckpt] Loading TABDPT Cox (embedding) from checkpoints/tabdpt/OrmoniTirodei/NaN/seed456/fold3/tabdpt_tab_cox.pkl
C-index train: 0.8187
C-index test:  0.7526
X_train shape: (5162, 76), X_test shape: (1290, 76)
Generating TABDPT Embeddings...
<class 'dict'>
Loaded TabDPTModel from checkpoint.
<class 'dict'>
Loaded TabDPTModel from checkpoint.
Successfully generated embeddings with shape: (5162, 768)
  [ckpt] Loading TABDPT DeepSurv Tuned from checkpoints/tabdpt/OrmoniTirodei/NaN/seed456/fold4
C-index train: 0.8110
C-index test:  0.7906
  [ckpt] Loading TABDPT RSF Tuned from checkpoints/tabdpt/OrmoniTirodei/NaN/seed456/fold4
C-index train: 0.8998
C-index test:  0.7866
  [ckpt] Loading DeepSurv Simple from checkpoints/tabdpt/OrmoniTirodei/NaN/seed456/fold4/tabdpt_deepsurv_simple.pt
C-index TRAIN: 0.8185
C-index TEST:  0.7633
  [ckpt] Loading DeepSurv Vanilla from checkpoints/tabdpt/OrmoniTirodei/NaN/seed456/fold4/tabdpt_deepsurv_vanilla.pt
C-index TRAIN: 0.8152
C-index TEST:  0.7930
  [ckpt] Loading TABDPT RSF from checkpoints/tabdpt/OrmoniTirodei/NaN/seed456/fold4/tabdpt_rsf.pkl
C-index train: 0.9190
C-index test:  0.7866
  [ckpt] Loading TABDPT Cox (embedding) from checkpoints/tabdpt/OrmoniTirodei/NaN/seed456/fold4/tabdpt_tab_cox.pkl
C-index train: 0.8141
C-index test:  0.7854
X_train shape: (5162, 76), X_test shape: (1290, 76)
Generating TABDPT Embeddings...
<class 'dict'>
Loaded TabDPTModel from checkpoint.
<class 'dict'>
Loaded TabDPTModel from checkpoint.
Successfully generated embeddings with shape: (5162, 768)
  [ckpt] Loading TABDPT DeepSurv Tuned from checkpoints/tabdpt/OrmoniTirodei/NaN/seed456/fold5
C-index train: 0.8058
C-index test:  0.7953
  [ckpt] Loading TABDPT RSF Tuned from checkpoints/tabdpt/OrmoniTirodei/NaN/seed456/fold5
C-index train: 0.9158
C-index test:  0.7852
  [ckpt] Loading DeepSurv Simple from checkpoints/tabdpt/OrmoniTirodei/NaN/seed456/fold5/tabdpt_deepsurv_simple.pt
C-index TRAIN: 0.8006
C-index TEST:  0.7661
  [ckpt] Loading DeepSurv Vanilla from checkpoints/tabdpt/OrmoniTirodei/NaN/seed456/fold5/tabdpt_deepsurv_vanilla.pt
C-index TRAIN: 0.8242
C-index TEST:  0.7910
  [ckpt] Loading TABDPT RSF from checkpoints/tabdpt/OrmoniTirodei/NaN/seed456/fold5/tabdpt_rsf.pkl
C-index train: 0.9199
C-index test:  0.7862
  [ckpt] Loading TABDPT Cox (embedding) from checkpoints/tabdpt/OrmoniTirodei/NaN/seed456/fold5/tabdpt_tab_cox.pkl
C-index train: 0.8130
C-index test:  0.7902

  Preprocess: -1 | Seed: 456
  TABDPT Train Tuned DeepSurv → mean: 0.805303 | std: 0.009715 | min: 0.793524 | max: 0.822891
  TABDPT Test Tuned DeepSurv → mean: 0.776574 | std: 0.009895 | min: 0.763534 | max: 0.793325
  TABDPT Train Tuned RSF → mean: 0.906471 | std: 0.004518 | min: 0.898482 | max: 0.911196
  TABDPT Test Tuned RSF → mean: 0.768769 | std: 0.012333 | min: 0.757136 | max: 0.785176
  TABDPT Train Vanilla → mean: 0.811301 | std: 0.012755 | min: 0.793954 | max: 0.828895
  TABDPT Test Vanilla → mean: 0.774099 | std: 0.013811 | min: 0.760299 | max: 0.798446
  TABDPT Train Simple → mean: 0.791783 | std: 0.019914 | min: 0.753866 | max: 0.811789
  TABDPT Test Simple → mean: 0.756037 | std: 0.022522 | min: 0.718501 | max: 0.783427
  TABDPT Train RSF → mean: 0.919097 | std: 0.001233 | min: 0.917857 | max: 0.920847
  TABDPT Test RSF → mean: 0.766645 | std: 0.012798 | min: 0.753043 | max: 0.783483
  TABDPT Train Cox → mean: 0.813567 | std: 0.002229 | min: 0.810336 | max: 0.816904
  TABDPT Test Cox → mean: 0.774809 | std: 0.013201 | min: 0.756419 | max: 0.794896
  Train DeepSurv Vanilla → mean: 0.806502 | std: 0.004630 | min: 0.799952 | max: 0.813912
  Test DeepSurv Vanilla → mean: 0.790482 | std: 0.015147 | min: 0.769872 | max: 0.808685
  Train DeepSurv Simple → mean: 0.787735 | std: 0.006381 | min: 0.777283 | max: 0.796105
  Test DeepSurv Simple → mean: 0.780462 | std: 0.014894 | min: 0.763220 | max: 0.804776
  Train RSF  → mean: 0.901273 | std: 0.000678 | min: 0.900361 | max: 0.902436
  Test RSF   → mean: 0.795795 | std: 0.012058 | min: 0.783213 | max: 0.815288
  Train Cox  → mean: 0.800583 | std: 0.002834 | min: 0.796865 | max: 0.804097
  Test Cox   → mean: 0.793462 | std: 0.013693 | min: 0.775675 | max: 0.810762

  Preprocess: NaN | Seed: 456
  TABDPT Train Tuned DeepSurv → mean: 0.811428 | std: 0.005049 | min: 0.805818 | max: 0.820372
  TABDPT Test Tuned DeepSurv → mean: 0.775433 | std: 0.016385 | min: 0.756457 | max: 0.795309
  TABDPT Train Tuned RSF → mean: 0.908743 | std: 0.006960 | min: 0.899819 | max: 0.917742
  TABDPT Test Tuned RSF → mean: 0.767956 | std: 0.015389 | min: 0.749995 | max: 0.786588
  TABDPT Train Vanilla → mean: 0.812967 | std: 0.006309 | min: 0.806071 | max: 0.824166
  TABDPT Test Vanilla → mean: 0.775778 | std: 0.014060 | min: 0.758929 | max: 0.792993
  TABDPT Train Simple → mean: 0.800473 | std: 0.012537 | min: 0.781340 | max: 0.818453
  TABDPT Test Simple → mean: 0.755275 | std: 0.012220 | min: 0.731811 | max: 0.766103
  TABDPT Train RSF → mean: 0.920616 | std: 0.001152 | min: 0.919031 | max: 0.922476
  TABDPT Test RSF → mean: 0.767984 | std: 0.015588 | min: 0.751265 | max: 0.786591
  TABDPT Train Cox → mean: 0.815830 | std: 0.002068 | min: 0.812994 | max: 0.818734
  TABDPT Test Cox → mean: 0.773154 | std: 0.013894 | min: 0.752554 | max: 0.790206
Result saved in 'results/OrmoniTirodei/tabdpt/results_cv_OrmoniTirodei_tabdpt_seed456.txt'


Preprocess: Replace NaN with -1
Loading existing folds from tmp/splits/HURRAH_seed456.pkl
X_train shape: (13566, 61), X_test shape: (3392, 61)
Generating TABDPT Embeddings...
<class 'dict'>
Loaded TabDPTModel from checkpoint.
<class 'dict'>
Loaded TabDPTModel from checkpoint.
Successfully generated embeddings with shape: (13566, 768)
  [ckpt] Loading TABDPT DeepSurv Tuned from checkpoints/tabdpt/HURRAH/-1/seed456/fold1
C-index train: 0.8262
C-index test:  0.8128
  [ckpt] Loading TABDPT RSF Tuned from checkpoints/tabdpt/HURRAH/-1/seed456/fold1
C-index train: 0.8108
C-index test:  0.8259
  [ckpt] Loading DeepSurv Simple from checkpoints/tabdpt/HURRAH/-1/seed456/fold1/tabdpt_deepsurv_simple.pt
C-index TRAIN: 0.8355
C-index TEST:  0.7569
  [ckpt] Loading DeepSurv Vanilla from checkpoints/tabdpt/HURRAH/-1/seed456/fold1/tabdpt_deepsurv_vanilla.pt
C-index TRAIN: 0.8498
C-index TEST:  0.8098
  [ckpt] Loading TABDPT RSF from checkpoints/tabdpt/HURRAH/-1/seed456/fold1/tabdpt_rsf.pkl
C-index train: 0.9519
C-index test:  0.8061
  [ckpt] Loading TABDPT Cox (embedding) from checkpoints/tabdpt/HURRAH/-1/seed456/fold1/tabdpt_tab_cox.pkl
C-index train: 0.8435
C-index test:  0.7809
  [ckpt] Loading DeepSurv Vanilla baseline from checkpoints/tabdpt/HURRAH/-1/seed456/fold1/deepsurv_vanilla_baseline.pt
C-index TRAIN: 0.8599
C-index TEST:  0.8486
  [ckpt] Loading DeepSurv Simple baseline from checkpoints/tabdpt/HURRAH/-1/seed456/fold1/deepsurv_simple_baseline.pt
C-index TRAIN: 0.8374
C-index TEST:  0.8308
  [ckpt] RSF baseline saved → checkpoints/tabdpt/HURRAH/-1/seed456/fold1/rsf_baseline.pkl
C-index train: 0.9197
C-index test:  0.8490
  [ckpt] Loading Cox baseline from checkpoints/tabdpt/HURRAH/-1/seed456/fold1/tabdpt_cox.pkl
C-index train: 0.8273
C-index test:  0.8267
X_train shape: (13566, 61), X_test shape: (3392, 61)
Generating TABDPT Embeddings...
<class 'dict'>
Loaded TabDPTModel from checkpoint.
<class 'dict'>
Loaded TabDPTModel from checkpoint.
Successfully generated embeddings with shape: (13566, 768)
  [ckpt] Loading TABDPT DeepSurv Tuned from checkpoints/tabdpt/HURRAH/-1/seed456/fold2
C-index train: 0.8467
C-index test:  0.8306
  [ckpt] Loading TABDPT RSF Tuned from checkpoints/tabdpt/HURRAH/-1/seed456/fold2
C-index train: 0.8307
C-index test:  0.8267
  [ckpt] Loading DeepSurv Simple from checkpoints/tabdpt/HURR