[I 2026-06-07 08:33:39,959] Trial 94 finished with value: 0.7977754434694254 and parameters: {'num_nodes': [64, 32], 'dropout': 0.15324237704764715, 'learning_rate': 0.000904457227287717, 'batch_norm': False}. Best is trial 56 with value: 0.8080908770070512.
/scratch.hpc/luca.cotugno/Foundation_model_clinical_data/test_tabular_model_tmp.py:476: UserWarning: Choices for a categorical distribution should be a tuple of None, bool, int, float and str for persistent storage but contains [32] which is of type list.
  num_nodes  = trial.suggest_categorical("num_nodes", [[32], [64], [128], [64, 32], [128, 64]])
/scratch.hpc/luca.cotugno/Foundation_model_clinical_data/test_tabular_model_tmp.py:476: UserWarning: Choices for a categorical distribution should be a tuple of None, bool, int, float and str for persistent storage but contains [64] which is of type list.
  num_nodes  = trial.suggest_categorical("num_nodes", [[32], [64], [128], [64, 32], [128, 64]])
/scratch.hpc/luca.cotugno/Foundation_model_clinical_data/test_tabular_model_tmp.py:476: UserWarning: Choices for a categorical distribution should be a tuple of None, bool, int, float and str for persistent storage but contains [128] which is of type list.
  num_nodes  = trial.suggest_categorical("num_nodes", [[32], [64], [128], [64, 32], [128, 64]])
/scratch.hpc/luca.cotugno/Foundation_model_clinical_data/test_tabular_model_tmp.py:476: UserWarning: Choices for a categorical distribution should be a tuple of None, bool, int, float and str for persistent storage but contains [64, 32] which is of type list.
  num_nodes  = trial.suggest_categorical("num_nodes", [[32], [64], [128], [64, 32], [128, 64]])
/scratch.hpc/luca.cotugno/Foundation_model_clinical_data/test_tabular_model_tmp.py:476: UserWarning: Choices for a categorical distribution should be a tuple of None, bool, int, float and str for persistent storage but contains [128, 64] which is of type list.
  num_nodes  = trial.suggest_categorical("num_nodes", [[32], [64], [128], [64, 32], [128, 64]])

75:	[0s / 33s],		train_loss: 2.4165
94:	[0s / 35s],		train_loss: 2.4418
35:	[1s / 37s],		train_loss: 2.4848
13:	[0s / 9s],		train_loss: 2.5211
95:	[0s / 35s],		train_loss: 2.4437
76:	[0s / 34s],		train_loss: 2.4361
96:	[0s / 35s],		train_loss: 2.4491
77:	[0s / 34s],		train_loss: 2.4274
14:	[0s / 9s],		train_loss: 2.5066
97:	[0s / 36s],		train_loss: 2.4391
78:	[0s / 35s],		train_loss: 2.4219
36:	[1s / 38s],		train_loss: 2.4932
98:	[0s / 36s],		train_loss: 2.4619
15:	[0s / 10s],		train_loss: 2.5089
79:	[0s / 35s],		train_loss: 2.4259
99:	[0s / 37s],		train_loss: 2.4370
80:	[0s / 36s],		train_loss: 2.4095
16:	[0s / 11s],		train_loss: 2.5043
37:	[1s / 39s],		train_loss: 2.5072
0:	[0s / 0s],		train_loss: 3.1187
81:	[0s / 36s],		train_loss: 2.4302
1:	[0s / 0s],		train_loss: 2.6542
17:	[0s / 11s],		train_loss: 2.5061
82:	[0s / 37s],		train_loss: 2.4003
2:	[0s / 1s],		train_loss: 2.6004
83:	[0s / 37s],		train_loss: 2.4149
18:	[0s / 12s],		train_loss: 2.5003
38:	[1s / 41s],		train_loss: 2.4926
3:	[0s / 1s],		train_loss: 2.5701
84:	[0s / 38s],		train_loss: 2.4189
4:	[0s / 2s],		train_loss: 2.5666
19:	[0s / 13s],		train_loss: 2.5014
85:	[0s / 38s],		train_loss: 2.4064
5:	[0s / 2s],		train_loss: 2.5406
86:	[0s / 38s],		train_loss: 2.4278
39:	[1s / 42s],		train_loss: 2.4891
20:	[0s / 13s],		train_loss: 2.4933
6:	[0s / 2s],		train_loss: 2.5467
87:	[0s / 39s],		train_loss: 2.4155
7:	[0s / 3s],		train_loss: 2.5321
21:	[0s / 14s],		train_loss: 2.4965
8:	[0s / 3s],		train_loss: 2.5462
88:	[0s / 39s],		train_loss: 2.4350
40:	[1s / 43s],		train_loss: 2.4874
9:	[0s / 4s],		train_loss: 2.5349
89:	[0s / 40s],		train_loss: 2.4082
22:	[0s / 15s],		train_loss: 2.4970
10:	[0s / 4s],		train_loss: 2.5071
90:	[0s / 40s],		train_loss: 2.4179
23:	[0s / 15s],		train_loss: 2.4772
11:	[0s / 5s],		train_loss: 2.5103
91:	[0s / 41s],		train_loss: 2.4144
41:	[1s / 44s],		train_loss: 2.4757
12:	[0s / 5s],		train_loss: 2.5275
24:	[0s / 16s],		train_loss: 2.4777
92:	[0s / 41s],		train_loss: 2.4221
13:	[0s / 5s],		train_loss: 2.5064
93:	[0s / 41s],		train_loss: 2.4116
25:	[0s / 17s],		train_loss: 2.4993
14:	[0s / 6s],		train_loss: 2.5198
94:	[0s / 42s],		train_loss: 2.4114
42:	[1s / 45s],		train_loss: 2.4754
15:	[0s / 6s],		train_loss: 2.5000
26:	[0s / 17s],		train_loss: 2.5079
95:	[0s / 42s],		train_loss: 2.4101
16:	[0s / 7s],		train_loss: 2.4893
96:	[0s / 43s],		train_loss: 2.4089
27:	[0s / 18s],		train_loss: 2.4719
17:	[0s / 7s],		train_loss: 2.4926
43:	[1s / 47s],		train_loss: 2.4803
97:	[0s / 43s],		train_loss: 2.4046
18:	[0s / 8s],		train_loss: 2.5084
28:	[0s / 19s],		train_loss: 2.4728
98:	[0s / 44s],		train_loss: 2.3987
19:	[0s / 8s],		train_loss: 2.4859
99:	[0s / 44s],		train_loss: 2.3990
29:	[0s / 19s],		train_loss: 2.4844
44:	[1s / 48s],		train_loss: 2.4868
20:	[0s / 8s],		train_loss: 2.5023
0:	[0s / 0s],		train_loss: 3.1208
21:	[0s / 9s],		train_loss: 2.4911
30:	[0s / 20s],		train_loss: 2.4595
1:	[0s / 0s],		train_loss: 2.6438
22:	[0s / 9s],		train_loss: 2.5092
31:	[0s / 21s],		train_loss: 2.4889
45:	[1s / 49s],		train_loss: 2.4595
2:	[0s / 1s],		train_loss: 2.5925
23:	[0s / 10s],		train_loss: 2.4772
3:	[0s / 1s],		train_loss: 2.5846
24:	[0s / 10s],		train_loss: 2.4795
32:	[0s / 21s],		train_loss: 2.4864
4:	[0s / 2s],		train_loss: 2.5631
25:	[0s / 11s],		train_loss: 2.4842
46:	[1s / 50s],		train_loss: 2.4884
33:	[0s / 22s],		train_loss: 2.4687
5:	[0s / 2s],		train_loss: 2.5329
26:	[0s / 11s],		train_loss: 2.4832
27:	[0s / 11s],		train_loss: 2.4711
6:	[0s / 3s],		train_loss: 2.5302
34:	[0s / 23s],		train_loss: 2.4713
28:	[0s / 12s],		train_loss: 2.4803
7:	[0s / 3s],		train_loss: 2.5663
47:	[1s / 51s],		train_loss: 2.4989
29:	[0s / 12s],		train_loss: 2.4674
8:	[0s / 3s],		train_loss: 2.5264
35:	[0s / 23s],		train_loss: 2.4600
30:	[0s / 13s],		train_loss: 2.4727
9:	[0s / 4s],		train_loss: 2.5146
36:	[0s / 24s],		train_loss: 2.4666
31:	[0s / 13s],		train_loss: 2.4889
48:	[1s / 52s],		train_loss: 2.4742
10:	[0s / 4s],		train_loss: 2.5328
32:	[0s / 13s],		train_loss: 2.4766
11:	[0s / 5s],		train_loss: 2.5253
37:	[0s / 25s],		train_loss: 2.4585
33:	[0s / 14s],		train_loss: 2.4717
12:	[0s / 5s],		train_loss: 2.5127
49:	[1s / 54s],		train_loss: 2.4714
34:	[0s / 14s],		train_loss: 2.4671
38:	[0s / 25s],		train_loss: 2.4655
13:	[0s / 6s],		train_loss: 2.5129
35:	[0s / 15s],		train_loss: 2.4764
14:	[0s / 6s],		train_loss: 2.5137
39:	[0s / 26s],		train_loss: 2.4729
36:	[0s / 15s],		train_loss: 2.4711
15:	[0s / 6s],		train_loss: 2.5143
50:	[1s / 55s],		train_loss: 2.4933
37:	[0s / 15s],		train_loss: 2.4479
16:	[0s / 7s],		train_loss: 2.5032
40:	[0s / 27s],		train_loss: 2.4618
38:	[0s / 16s],		train_loss: 2.4649
17:	[0s / 7s],		train_loss: 2.5097
39:	[0s / 16s],		train_loss: 2.4748
51:	[1s / 56s],		train_loss: 2.4869
41:	[0s / 27s],		train_loss: 2.4660
18:	[0s / 8s],		train_loss: 2.4922
40:	[0s / 17s],		train_loss: 2.4570
19:	[0s / 8s],		train_loss: 2.4998
42:	[0s / 28s],		train_loss: 2.4638
41:	[0s / 17s],		train_loss: 2.4498
20:	[0s / 8s],		train_loss: 2.5280
42:	[0s / 17s],		train_loss: 2.4668
52:	[1s / 57s],		train_loss: 2.4828
43:	[0s / 29s],		train_loss: 2.4566
21:	[0s / 9s],		train_loss: 2.5053
43:	[0s / 18s],		train_loss: 2.4615
22:	[0s / 9s],		train_loss: 2.4819
44:	[0s / 18s],		train_loss: 2.4467
44:	[0s / 29s],		train_loss: 2.4501
23:	[0s / 10s],		train_loss: 2.4781
53:	[1s / 58s],		train_loss: 2.4795
45:	[0s / 19s],		train_loss: 2.4571
45:	[0s / 30s],		train_loss: 2.4570
24:	[0s / 10s],		train_loss: 2.4913
46:	[0s / 19s],		train_loss: 2.4652
25:	[0s / 11s],		train_loss: 2.4811
47:	[0s / 19s],		train_loss: 2.4602
46:	[0s / 31s],		train_loss: 2.4519
54:	[1s / 59s],		train_loss: 2.4884
26:	[0s / 11s],		train_loss: 2.5039
48:	[0s / 20s],		train_loss: 2.4643
47:	[0s / 31s],		train_loss: 2.4621
27:	[0s / 11s],		train_loss: 2.4899
49:	[0s / 20s],		train_loss: 2.4519
50:	[0s / 21s],		train_loss: 2.4564
28:	[0s / 12s],		train_loss: 2.4958
48:	[0s / 32s],		train_loss: 2.4472
55:	[1s / 1m:0s],		train_loss: 2.4753
51:	[0s / 21s],		train_loss: 2.4566
29:	[0s / 12s],		train_loss: 2.4994
52:	[0s / 22s],		train_loss: 2.4541
49:	[0s / 33s],		train_loss: 2.4597
30:	[0s / 13s],		train_loss: 2.4702
53:	[0s / 22s],		train_loss: 2.4598
31:	[0s / 13s],		train_loss: 2.4957
56:	[1s / 1m:1s],		train_loss: 2.4829
50:	[0s / 33s],		train_loss: 2.4604
54:	[0s / 22s],		train_loss: 2.4502
32:	[0s / 14s],		train_loss: 2.5058
55:	[0s / 23s],		train_loss: 2.4499
51:	[0s / 34s],		train_loss: 2.4419
33:	[0s / 14s],		train_loss: 2.4619
56:	[0s / 23s],		train_loss: 2.4503
57:	[1s / 1m:3s],		train_loss: 2.4899
34:	[0s / 15s],		train_loss: 2.4805
52:	[0s / 35s],		train_loss: 2.4510
57:	[0s / 24s],		train_loss: 2.4496
35:	[0s / 15s],		train_loss: 2.4620
58:	[0s / 24s],		train_loss: 2.4409
36:	[0s / 15s],		train_loss: 2.4654
53:	[0s / 35s],		train_loss: 2.4466
58:	[1s / 1m:4s],		train_loss: 2.4761
59:	[0s / 25s],		train_loss: 2.4405
37:	[0s / 16s],		train_loss: 2.4609
54:	[0s / 36s],		train_loss: 2.4418
60:	[0s / 25s],		train_loss: 2.4261
38:	[0s / 16s],		train_loss: 2.4790
61:	[0s / 25s],		train_loss: 2.4450
39:	[0s / 17s],		train_loss: 2.4634
55:	[0s / 37s],		train_loss: 2.4637
59:	[1s / 1m:5s],		train_loss: 2.4643
62:	[0s / 26s],		train_loss: 2.4367
40:	[0s / 17s],		train_loss: 2.4626
63:	[0s / 26s],		train_loss: 2.4362
56:	[0s / 37s],		train_loss: 2.4524
41:	[0s / 18s],		train_loss: 2.4686
64:	[0s / 27s],		train_loss: 2.4442
60:	[1s / 1m:6s],		train_loss: 2.4856
42:	[0s / 18s],		train_loss: 2.4578
57:	[0s / 38s],		train_loss: 2.4435
65:	[0s / 27s],		train_loss: 2.4384
43:	[0s / 18s],		train_loss: 2.4693
66:	[0s / 27s],		train_loss: 2.4202
58:	[0s / 39s],		train_loss: 2.4644
44:	[0s / 19s],		train_loss: 2.4613
67:	[0s / 28s],		train_loss: 2.4363
61:	[1s / 1m:7s],		train_loss: 2.4689
45:	[0s / 19s],		train_loss: 2.4680
68:	[0s / 28s],		train_loss: 2.4290
59:	[0s / 39s],		train_loss: 2.4264
46:	[0s / 20s],		train_loss: 2.4606
69:	[0s / 29s],		train_loss: 2.4552
60:	[0s / 40s],		train_loss: 2.4338
47:	[0s / 20s],		train_loss: 2.4577
70:	[0s / 29s],		train_loss: 2.4573
62:	[1s / 1m:9s],		train_loss: 2.4837
48:	[0s / 21s],		train_loss: 2.4725
71:	[0s / 30s],		train_loss: 2.4163
61:	[0s / 41s],		train_loss: 2.4364
49:	[0s / 21s],		train_loss: 2.4525
72:	[0s / 30s],		train_loss: 2.4350
63:	[1s / 1m:10s],		train_loss: 2.4623
50:	[0s / 21s],		train_loss: 2.4673
73:	[0s / 30s],		train_loss: 2.4346
62:	[0s / 41s],		train_loss: 2.4571
51:	[0s / 22s],		train_loss: 2.4625
74:	[0s / 31s],		train_loss: 2.4194
63:	[0s / 42s],		train_loss: 2.4466
75:	[0s / 31s],		train_loss: 2.4243
52:	[0s / 22s],		train_loss: 2.4468
64:	[1s / 1m:11s],		train_loss: 2.4744
76:	[0s / 32s],		train_loss: 2.4281
53:	[0s / 23s],		train_loss: 2.4665
64:	[0s / 43s],		train_loss: 2.4275
77:	[0s / 32s],		train_loss: 2.4273
54:	[0s / 23s],		train_loss: 2.4463
65:	[0s / 43s],		train_loss: 2.4267
78:	[0s / 33s],		train_loss: 2.4264
55:	[0s / 24s],		train_loss: 2.4529
65:	[1s / 1m:12s],		train_loss: 2.4866
79:	[0s / 33s],		train_loss: 2.4182
56:	[0s / 24s],		train_loss: 2.4457
66:	[0s / 44s],		train_loss: 2.4340
80:	[0s / 33s],		train_loss: 2.4164
57:	[0s / 25s],		train_loss: 2.4439
67:	[0s / 45s],		train_loss: 2.4253
66:	[1s / 1m:13s],		train_loss: 2.4817
81:	[0s / 34s],		train_loss: 2.4293
58:	[0s / 25s],		train_loss: 2.4441
82:	[0s / 34s],		train_loss: 2.4097
59:	[0s / 25s],		train_loss: 2.4526
68:	[0s / 45s],		train_loss: 2.4212
83:	[0s / 35s],		train_loss: 2.4153
60:	[0s / 26s],		train_loss: 2.4466
67:	[1s / 1m:14s],		train_loss: 2.4595
84:	[0s / 35s],		train_loss: 2.4199
69:	[0s / 46s],		train_loss: 2.4404
61:	[0s / 26s],		train_loss: 2.4600
85:	[0s / 35s],		train_loss: 2.4231
62:	[0s / 27s],		train_loss: 2.4443
70:	[0s / 47s],		train_loss: 2.4372
86:	[0s / 36s],		train_loss: 2.4129
63:	[0s / 27s],		train_loss: 2.4369
68:	[1s / 1m:16s],		train_loss: 2.4621
87:	[0s / 36s],		train_loss: 2.4127
71:	[0s / 47s],		train_loss: 2.4271
64:	[0s / 28s],		train_loss: 2.4482
88:	[0s / 37s],		train_loss: 2.4113
65:	[0s / 28s],		train_loss: 2.4525
72:	[0s / 48s],		train_loss: 2.4283
89:	[0s / 37s],		train_loss: 2.4263
66:	[0s / 29s],		train_loss: 2.4568
69:	[1s / 1m:17s],		train_loss: 2.4670
90:	[0s / 38s],		train_loss: 2.4124
73:	[0s / 49s],		train_loss: 2.4192
67:	[0s / 29s],		train_loss: 2.4399
91:	[0s / 38s],		train_loss: 2.4169
68:	[0s / 29s],		train_loss: 2.4376
92:	[0s / 38s],		train_loss: 2.4100
74:	[0s / 49s],		train_loss: 2.4422
70:	[1s / 1m:18s],		train_loss: 2.4539
69:	[0s / 30s],		train_loss: 2.4525
93:	[0s / 39s],		train_loss: 2.4150
75:	[0s / 50s],		train_loss: 2.4396
70:	[0s / 30s],		train_loss: 2.4361
94:	[0s / 39s],		train_loss: 2.4053
71:	[0s / 31s],		train_loss: 2.4317
95:	[0s / 40s],		train_loss: 2.4108
71:	[1s / 1m:19s],		train_loss: 2.4851
76:	[0s / 51s],		train_loss: 2.4214
72:	[0s / 31s],		train_loss: 2.4351
96:	[0s / 40s],		train_loss: 2.4135
77:	[0s / 51s],		train_loss: 2.4278
73:	[0s / 32s],		train_loss: 2.4366
97:	[0s / 41s],		train_loss: 2.4040
74:	[0s / 32s],		train_loss: 2.4339
72:	[1s / 1m:20s],		train_loss: 2.4815
98:	[0s / 41s],		train_loss: 2.4128
78:	[0s / 52s],		train_loss: 2.4121
75:	[0s / 33s],		train_loss: 2.4476
99:	[0s / 41s],		train_loss: 2.4153
76:	[0s / 33s],		train_loss: 2.4368
79:	[0s / 53s],		train_loss: 2.4157
0:	[0s / 0s],		train_loss: 3.1561
73:	[1s / 1m:22s],		train_loss: 2.4734
77:	[0s / 33s],		train_loss: 2.4261
1:	[0s / 0s],		train_loss: 2.6522
80:	[0s / 54s],		train_loss: 2.4209
78:	[0s / 34s],		train_loss: 2.4224
2:	[0s / 1s],		train_loss: 2.5981
79:	[0s / 34s],		train_loss: 2.4431
81:	[0s / 54s],		train_loss: 2.4116
3:	[0s / 1s],		train_loss: 2.5667
74:	[1s / 1m:23s],		train_loss: 2.4703
80:	[0s / 35s],		train_loss: 2.4281
4:	[0s / 2s],		train_loss: 2.5652
82:	[0s / 55s],		train_loss: 2.4119
81:	[0s / 35s],		train_loss: 2.4152
5:	[0s / 2s],		train_loss: 2.5645
82:	[0s / 36s],		train_loss: 2.4243
83:	[0s / 56s],		train_loss: 2.4112
6:	[0s / 2s],		train_loss: 2.5539
75:	[1s / 1m:24s],		train_loss: 2.4910
83:	[0s / 36s],		train_loss: 2.4356
7:	[0s / 3s],		train_loss: 2.5479
84:	[0s / 56s],		train_loss: 2.4161
84:	[0s / 36s],		train_loss: 2.4265
8:	[0s / 3s],		train_loss: 2.5626
76:	[1s / 1m:25s],		train_loss: 2.4813
85:	[0s / 37s],		train_loss: 2.4403
9:	[0s / 4s],		train_loss: 2.5434
85:	[0s / 57s],		train_loss: 2.4176
86:	[0s / 37s],		train_loss: 2.4224
10:	[0s / 4s],		train_loss: 2.5735
86:	[0s / 58s],		train_loss: 2.4044
11:	[0s / 5s],		train_loss: 2.5488
87:	[0s / 38s],		train_loss: 2.4267
77:	[1s / 1m:26s],		train_loss: 2.4658
12:	[0s / 5s],		train_loss: 2.5353
88:	[0s / 38s],		train_loss: 2.4126
87:	[0s / 58s],		train_loss: 2.4276
13:	[0s / 5s],		train_loss: 2.5399
89:	[0s / 39s],		train_loss: 2.4406
88:	[0s / 59s],		train_loss: 2.4037
78:	[1s / 1m:27s],		train_loss: 2.4650
14:	[0s / 6s],		train_loss: 2.5153
90:	[0s / 39s],		train_loss: 2.4168
15:	[0s / 6s],		train_loss: 2.5085
91:	[0s / 40s],		train_loss: 2.4372
89:	[0s / 59s],		train_loss: 2.4293
16:	[0s / 7s],		train_loss: 2.5105
92:	[0s / 40s],		train_loss: 2.4293
79:	[1s / 1m:29s],		train_loss: 2.4650
17:	[0s / 7s],		train_loss: 2.4989
90:	[0s / 1m:0s],		train_loss: 2.4363
93:	[0s / 40s],		train_loss: 2.4175
18:	[0s / 7s],		train_loss: 2.5269
94:	[0s / 41s],		train_loss: 2.4259
91:	[0s / 1m:1s],		train_loss: 2.4056
19:	[0s / 8s],		train_loss: 2.5185
95:	[0s / 41s],		train_loss: 2.4152
80:	[1s / 1m:30s],		train_loss: 2.4539
20:	[0s / 8s],		train_loss: 2.5220
92:	[0s / 1m:2s],		train_loss: 2.4129
96:	[0s / 42s],		train_loss: 2.4322
21:	[0s / 9s],		train_loss: 2.5210
97:	[0s / 42s],		train_loss: 2.4004
22:	[0s / 9s],		train_loss: 2.5176
93:	[0s / 1m:2s],		train_loss: 2.4127
81:	[1s / 1m:31s],		train_loss: 2.4837
98:	[0s / 43s],		train_loss: 2.4319
23:	[0s / 10s],		train_loss: 2.4983
99:	[0s / 43s],		train_loss: 2.4244
94:	[0s / 1m:3s],		train_loss: 2.4127
24:	[0s / 10s],		train_loss: 2.5117
82:	[1s / 1m:32s],		train_loss: 2.4771
0:	[0s / 0s],		train_loss: 3.0281
25:	[0s / 10s],		train_loss: 2.5004
95:	[0s / 1m:4s],		train_loss: 2.4017
1:	[0s / 0s],		train_loss: 2.6389
26:	[0s / 11s],		train_loss: 2.5129
96:	[0s / 1m:4s],		train_loss: 2.4018
2:	[0s / 1s],		train_loss: 2.6071
27:	[0s / 11s],		train_loss: 2.4904
83:	[1s / 1m:33s],		train_loss: 2.4437
3:	[0s / 1s],		train_loss: 2.5798
28:	[0s / 12s],		train_loss: 2.5059
97:	[0s / 1m:5s],		train_loss: 2.4043
4:	[0s / 2s],		train_loss: 2.5588
29:	[0s / 12s],		train_loss: 2.5043
5:	[0s / 2s],		train_loss: 2.5676
30:	[0s / 12s],		train_loss: 2.4979
98:	[0s / 1m:6s],		train_loss: 2.4124
84:	[1s / 1m:34s],		train_loss: 2.4555
6:	[0s / 2s],		train_loss: 2.5580
31:	[0s / 13s],		train_loss: 2.5018
99:	[0s / 1m:6s],		train_loss: 2.4084
7:	[0s / 3s],		train_loss: 2.5544
32:	[0s / 13s],		train_loss: 2.4944
85:	[1s / 1m:35s],		train_loss: 2.4822
33:	[0s / 14s],		train_loss: 2.4912
8:	[0s / 3s],		train_loss: 2.5483
0:	[0s / 0s],		train_loss: 3.0048
34:	[0s / 14s],		train_loss: 2.4843
9:	[0s / 4s],		train_loss: 2.5287
35:	[0s / 15s],		train_loss: 2.4887
10:	[0s / 4s],		train_loss: 2.5181
1:	[0s / 1s],		train_loss: 2.6322
86:	[1s / 1m:36s],		train_loss: 2.4621
36:	[0s / 15s],		train_loss: 2.4887
11:	[0s / 5s],		train_loss: 2.5391
2:	[0s / 2s],		train_loss: 2.5948
37:	[0s / 15s],		train_loss: 2.4762
12:	[0s / 5s],		train_loss: 2.5383
38:	[0s / 16s],		train_loss: 2.4983
13:	[0s / 5s],		train_loss: 2.5233
87:	[1s / 1m:37s],		train_loss: 2.4634
3:	[0s / 2s],		train_loss: 2.5672
39:	[0s / 16s],		train_loss: 2.4829
14:	[0s / 6s],		train_loss: 2.5162
40:	[0s / 17s],		train_loss: 2.4760
4:	[0s / 3s],		train_loss: 2.5721
15:	[0s / 6s],		train_loss: 2.5226
41:	[0s / 17s],		train_loss: 2.4782
88:	[1s / 1m:39s],		train_loss: 2.4661
16:	[0s / 7s],		train_loss: 2.5256
5:	[0s / 4s],		train_loss: 2.5493
42:	[0s / 17s],		train_loss: 2.4779
17:	[0s / 7s],		train_loss: 2.5185
43:	[0s / 18s],		train_loss: 2.4654
18:	[0s / 8s],		train_loss: 2.4961
6:	[0s / 4s],		train_loss: 2.5282
89:	[1s / 1m:40s],		train_loss: 2.4677
44:	[0s / 18s],		train_loss: 2.4800
19:	[0s / 8s],		train_loss: 2.5203
45:	[0s / 19s],		train_loss: 2.4826
7:	[0s / 5s],		train_loss: 2.5311
20:	[0s / 8s],		train_loss: 2.5087
46:	[0s / 19s],		train_loss: 2.4717
90:	[1s / 1m:41s],		train_loss: 2.4449
21:	[0s / 9s],		train_loss: 2.5165
8:	[0s / 6s],		train_loss: 2.5169
47:	[0s / 19s],		train_loss: 2.4699
22:	[0s / 9s],		train_loss: 2.5102
48:	[0s / 20s],		train_loss: 2.4812
9:	[0s / 6s],		train_loss: 2.5275
23:	[0s / 10s],		train_loss: 2.5080
49:	[0s / 20s],		train_loss: 2.4755
91:	[1s / 1m:42s],		train_loss: 2.4615
24:	[0s / 10s],		train_loss: 2.4984
50:	[0s / 21s],		train_loss: 2.4822
10:	[0s / 7s],		train_loss: 2.5212
25:	[0s / 11s],		train_loss: 2.4884
51:	[0s / 21s],		train_loss: 2.4683
11:	[0s / 8s],		train_loss: 2.5186
26:	[0s / 11s],		train_loss: 2.4906
92:	[1s / 1m:43s],		train_loss: 2.4766
52:	[0s / 21s],		train_loss: 2.4670
27:	[0s / 11s],		train_loss: 2.4843
53:	[0s / 22s],		train_loss: 2.4798
12:	[0s / 8s],		train_loss: 2.5071
28:	[0s / 12s],		train_loss: 2.4808
54:	[0s / 22s],		train_loss: 2.4790
13:	[0s / 9s],		train_loss: 2.5162
93:	[1s / 1m:44s],		train_loss: 2.4509
29:	[0s / 12s],		train_loss: 2.4881
55:	[0s / 23s],		train_loss: 2.4639
56:	[0s / 23s],		train_loss: 2.4547
30:	[0s / 13s],		train_loss: 2.4923
14:	[0s / 9s],		train_loss: 2.5164
57:	[0s / 23s],		train_loss: 2.4708
31:	[0s / 13s],		train_loss: 2.5063
94:	[1s / 1m:45s],		train_loss: 2.4763
15:	[0s / 10s],		train_loss: 2.5073
58:	[0s / 24s],		train_loss: 2.4576
32:	[0s / 14s],		train_loss: 2.4866
59:	[0s / 24s],		train_loss: 2.4638
33:	[0s / 14s],		train_loss: 2.4714
16:	[0s / 11s],		train_loss: 2.5032
60:	[0s / 25s],		train_loss: 2.4732
34:	[0s / 14s],		train_loss: 2.4847
95:	[1s / 1m:46s],		train_loss: 2.4570
61:	[0s / 25s],		train_loss: 2.4569
35:	[0s / 15s],		train_loss: 2.4882
17:	[0s / 11s],		train_loss: 2.5025
62:	[0s / 26s],		train_loss: 2.4721
36:	[0s / 15s],		train_loss: 2.4849
18:	[0s / 12s],		train_loss: 2.4940
63:	[0s / 26s],		train_loss: 2.4629
96:	[1s / 1m:47s],		train_loss: 2.4546
37:	[0s / 16s],		train_loss: 2.4706
64:	[0s / 26s],		train_loss: 2.4599
38:	[0s / 16s],		train_loss: 2.4806
19:	[0s / 13s],		train_loss: 2.5204
65:	[0s / 27s],		train_loss: 2.4594
39:	[0s / 16s],		train_loss: 2.4871
97:	[1s / 1m:49s],		train_loss: 2.4596
66:	[0s / 27s],		train_loss: 2.4566
40:	[0s / 17s],		train_loss: 2.4787
20:	[0s / 13s],		train_loss: 2.4934
67:	[0s / 28s],		train_loss: 2.4633
41:	[0s / 17s],		train_loss: 2.4763
21:	[0s / 14s],		train_loss: 2.4898
68:	[0s / 28s],		train_loss: 2.4710
42:	[0s / 18s],		train_loss: 2.4726
98:	[1s / 1m:50s],		train_loss: 2.4683
69:	[0s / 28s],		train_loss: 2.4586
22:	[0s / 15s],		train_loss: 2.5062
43:	[0s / 18s],		train_loss: 2.4809
70:	[0s / 29s],		train_loss: 2.4580
44:	[0s / 19s],		train_loss: 2.4704
23:	[0s / 15s],		train_loss: 2.4950
71:	[0s / 29s],		train_loss: 2.4481
99:	[1s / 1m:51s],		train_loss: 2.4480
45:	[0s / 19s],		train_loss: 2.4937
72:	[0s / 30s],		train_loss: 2.4659
24:	[0s / 16s],		train_loss: 2.4837
46:	[0s / 20s],		train_loss: 2.4557
73:	[0s / 30s],		train_loss: 2.4428
47:	[0s / 20s],		train_loss: 2.4642
25:	[0s / 17s],		train_loss: 2.4829
74:	[0s / 30s],		train_loss: 2.4494
0:	[1s / 1s],		train_loss: 2.9977
48:	[0s / 20s],		train_loss: 2.4836
75:	[0s / 31s],		train_loss: 2.4617
26:	[0s / 17s],		train_loss: 2.4866
49:	[0s / 21s],		train_loss: 2.4660
76:	[0s / 31s],		train_loss: 2.4622
50:	[0s / 21s],		train_loss: 2.4534
77:	[0s / 32s],		train_loss: 2.4614
27:	[0s / 18s],		train_loss: 2.4762
1:	[1s / 2s],		train_loss: 2.6488
51:	[0s / 22s],		train_loss: 2.4741
78:	[0s / 32s],		train_loss: 2.4581
28:	[0s / 19s],		train_loss: 2.4751
79:	[0s / 32s],		train_loss: 2.4682
52:	[0s / 22s],		train_loss: 2.4729
2:	[1s / 3s],		train_loss: 2.5860
80:	[0s / 33s],		train_loss: 2.4689
53:	[0s / 22s],		train_loss: 2.4594
29:	[0s / 19s],		train_loss: 2.4686
81:	[0s / 33s],		train_loss: 2.4488
54:	[0s / 23s],		train_loss: 2.4666
82:	[0s / 34s],		train_loss: 2.4538
30:	[0s / 20s],		train_loss: 2.4760
55:	[0s 