16:	[0s / 2s],		train_loss: 4.3573[I 2026-07-01 05:12:25,067] Trial 95 finished with value: 0.7615619345539302 and parameters: {'num_nodes': [32], 'dropout': 0.24394238781009925, 'learning_rate': 0.005109015995110026, 'batch_norm': False}. Best is trial 60 with value: 0.7825486091943448.
[I 2026-07-01 05:12:27,747] Trial 94 finished with value: 0.7767599748520256 and parameters: {'num_nodes': [32], 'dropout': 0.2407994063067858, 'learning_rate': 0.00014183359889340328, 'batch_norm': False}. Best is trial 60 with value: 0.7825486091943448.
[I 2026-07-01 05:12:30,244] Trial 54 finished with value: 0.7652823780169902 and parameters: {'num_nodes': [128], 'dropout': 0.1975068048734721, 'learning_rate': 0.00018860167214386966, 'batch_norm': False}. Best is trial 60 with value: 0.7825486091943448.
[I 2026-07-01 05:12:31,001] Trial 97 finished with value: 0.7515813322292759 and parameters: {'num_nodes': [32], 'dropout': 0.24491338133289614, 'learning_rate': 0.0001372835103472175, 'batch_norm': True}. Best is trial 60 with value: 0.7825486091943448.
[I 2026-07-01 05:12:36,261] Trial 99 finished with value: 0.7734803876468243 and parameters: {'num_nodes': [32], 'dropout': 0.2722791396823129, 'learning_rate': 0.00013842892446334513, 'batch_norm': False}. Best is trial 60 with value: 0.7825486091943448.
[I 2026-07-01 05:12:36,401] Trial 86 finished with value: 0.764023062532585 and parameters: {'num_nodes': [64], 'dropout': 0.2538911221713944, 'learning_rate': 0.00012021409189004235, 'batch_norm': False}. Best is trial 60 with value: 0.7825486091943448.
[I 2026-07-01 05:12:37,300] Trial 96 finished with value: 0.755784800809642 and parameters: {'num_nodes': [32], 'dropout': 0.24459413015737652, 'learning_rate': 0.004465578952283232, 'batch_norm': False}. Best is trial 60 with value: 0.7825486091943448.
[I 2026-07-01 05:12:40,116] Trial 98 finished with value: 0.772506670346858 and parameters: {'num_nodes': [32], 'dropout': 0.2439969780341941, 'learning_rate': 0.00014107071248694813, 'batch_norm': False}. Best is trial 60 with value: 0.7825486091943448.
/scratch.hpc/luca.cotugno/Foundation_model_clinical_data/.venv/lib/python3.12/site-packages/torchtuples/tupletree.py:146: UserWarning: The given NumPy array is not writable, and PyTorch does not support non-writable tensors. This means writing to this tensor will result in undefined behavior. You may want to copy the array to protect its data or make it writable before converting it to a tensor. This type of warning will be suppressed for the rest of this program. (Triggered internally at /pytorch/torch/csrc/utils/tensor_numpy.cpp:213.)
  return torch.from_numpy(data)
[I 2026-07-01 05:12:43,721] A new study created in memory with name: rsf_tuning_tabdpt_5_-1_seed123
[I 2026-07-01 05:17:34,948] Trial 5 finished with value: 0.7682475278470745 and parameters: {'n_estimators': 250, 'max_depth': 3, 'min_samples_split': 16, 'min_samples_leaf': 6, 'max_features': 'log2'}. Best is trial 5 with value: 0.7682475278470745.
[I 2026-07-01 05:18:29,641] Trial 0 finished with value: 0.7687345760092348 and parameters: {'n_estimators': 300, 'max_depth': 3, 'min_samples_split': 16, 'min_samples_leaf': 8, 'max_features': 'log2'}. Best is trial 0 with value: 0.7687345760092348.
[I 2026-07-01 05:18:48,697] Trial 4 finished with value: 0.7684776293410085 and parameters: {'n_estimators': 50, 'max_depth': 7, 'min_samples_split': 19, 'min_samples_leaf': 6, 'max_features': 'sqrt'}. Best is trial 0 with value: 0.7687345760092348.
[I 2026-07-01 05:21:23,275] Trial 8 finished with value: 0.7704699247759866 and parameters: {'n_estimators': 100, 'max_depth': 7, 'min_samples_split': 7, 'min_samples_leaf': 7, 'max_features': 'log2'}. Best is trial 8 with value: 0.7704699247759866.
[I 2026-07-01 05:24:54,131] Trial 11 finished with value: 0.7697930428813309 and parameters: {'n_estimators': 100, 'max_depth': 6, 'min_samples_split': 7, 'min_samples_leaf': 4, 'max_features': 'log2'}. Best is trial 8 with value: 0.7704699247759866.
[I 2026-07-01 05:25:28,708] Trial 6 finished with value: 0.7729128356365854 and parameters: {'n_estimators': 100, 'max_depth': 8, 'min_samples_split': 19, 'min_samples_leaf': 5, 'max_features': 'sqrt'}. Best is trial 6 with value: 0.7729128356365854.
[I 2026-07-01 05:29:32,493] Trial 10 finished with value: 0.7696473119351728 and parameters: {'n_estimators': 150, 'max_depth': 4, 'min_samples_split': 7, 'min_samples_leaf': 12, 'max_features': 'sqrt'}. Best is trial 6 with value: 0.7729128356365854.
[I 2026-07-01 05:29:40,803] Trial 2 finished with value: 0.7682647854591196 and parameters: {'n_estimators': 300, 'max_depth': 3, 'min_samples_split': 9, 'min_samples_leaf': 13, 'max_features': 'sqrt'}. Best is trial 6 with value: 0.7729128356365854.
[I 2026-07-01 05:30:16,373] Trial 9 finished with value: 0.7774726802413765 and parameters: {'n_estimators': 100, 'max_depth': 8, 'min_samples_split': 10, 'min_samples_leaf': 13, 'max_features': 'sqrt'}. Best is trial 9 with value: 0.7774726802413765.
[I 2026-07-01 05:34:12,284] Trial 15 finished with value: 0.7697105898460046 and parameters: {'n_estimators': 50, 'max_depth': 4, 'min_samples_split': 20, 'min_samples_leaf': 14, 'max_features': 'sqrt'}. Best is trial 9 with value: 0.7774726802413765.
[I 2026-07-01 05:50:04,777] Trial 16 finished with value: 0.7712944551292499 and parameters: {'n_estimators': 200, 'max_depth': 7, 'min_samples_split': 7, 'min_samples_leaf': 6, 'max_features': 'log2'}. Best is trial 9 with value: 0.7774726802413765.
[I 2026-07-01 05:50:23,493] Trial 3 finished with value: 0.7761936994375936 and parameters: {'n_estimators': 200, 'max_depth': 10, 'min_samples_split': 5, 'min_samples_leaf': 14, 'max_features': 'sqrt'}. Best is trial 9 with value: 0.7774726802413765.
[I 2026-07-01 05:50:44,782] Trial 12 finished with value: 0.7738294065874223 and parameters: {'n_estimators': 300, 'max_depth': 8, 'min_samples_split': 11, 'min_samples_leaf': 14, 'max_features': 'log2'}. Best is trial 9 with value: 0.7774726802413765.
[I 2026-07-01 05:50:48,776] Trial 13 finished with value: 0.7695456837753519 and parameters: {'n_estimators': 150, 'max_depth': 10, 'min_samples_split': 10, 'min_samples_leaf': 3, 'max_features': 'sqrt'}. Best is trial 9 with value: 0.7774726802413765.
[I 2026-07-01 05:51:50,832] Trial 1 finished with value: 0.7762473897861781 and parameters: {'n_estimators': 250, 'max_depth': 8, 'min_samples_split': 10, 'min_samples_leaf': 5, 'max_features': 'sqrt'}. Best is trial 9 with value: 0.7774726802413765.
[I 2026-07-01 05:51:51,190] Trial 17 finished with value: 0.7760671436159299 and parameters: {'n_estimators': 200, 'max_depth': 10, 'min_samples_split': 11, 'min_samples_leaf': 11, 'max_features': 'sqrt'}. Best is trial 9 with value: 0.7774726802413765.
[I 2026-07-01 05:51:52,254] Trial 7 finished with value: 0.7763049151596617 and parameters: {'n_estimators': 300, 'max_depth': 7, 'min_samples_split': 7, 'min_samples_leaf': 12, 'max_features': 'sqrt'}. Best is trial 9 with value: 0.7774726802413765.
[I 2026-07-01 05:51:52,261] Trial 14 finished with value: 0.7681267245627592 and parameters: {'n_estimators': 300, 'max_depth': 3, 'min_samples_split': 8, 'min_samples_leaf': 6, 'max_features': 'sqrt'}. Best is trial 9 with value: 0.7774726802413765.
[I 2026-07-01 06:07:47,209] Trial 18 finished with value: 0.7732675754397336 and parameters: {'n_estimators': 150, 'max_depth': 10, 'min_samples_split': 11, 'min_samples_leaf': 10, 'max_features': 'sqrt'}. Best is trial 9 with value: 0.7774726802413765.
[I 2026-07-01 06:26:15,035] Trial 21 finished with value: 0.7760671436159299 and parameters: {'n_estimators': 200, 'max_depth': 10, 'min_samples_split': 13, 'min_samples_leaf': 11, 'max_features': 'sqrt'}. Best is trial 9 with value: 0.7774726802413765.
[I 2026-07-01 06:26:30,532] Trial 25 finished with value: 0.7731582772301149 and parameters: {'n_estimators': 250, 'max_depth': 6, 'min_samples_split': 14, 'min_samples_leaf': 10, 'max_features': 'sqrt'}. Best is trial 9 with value: 0.7774726802413765.
[I 2026-07-01 06:26:42,101] Trial 24 finished with value: 0.7731582772301149 and parameters: {'n_estimators': 250, 'max_depth': 6, 'min_samples_split': 13, 'min_samples_leaf': 10, 'max_features': 'sqrt'}. Best is trial 9 with value: 0.7774726802413765.
[I 2026-07-01 06:26:59,160] Trial 20 finished with value: 0.7760671436159299 and parameters: {'n_estimators': 200, 'max_depth': 10, 'min_samples_split': 5, 'min_samples_leaf': 11, 'max_features': 'sqrt'}. Best is trial 9 with value: 0.7774726802413765.
[I 2026-07-01 06:27:40,947] Trial 19 finished with value: 0.7760671436159299 and parameters: {'n_estimators': 200, 'max_depth': 10, 'min_samples_split': 11, 'min_samples_leaf': 11, 'max_features': 'sqrt'}. Best is trial 9 with value: 0.7774726802413765.
[I 2026-07-01 06:28:09,605] Trial 22 finished with value: 0.7755302401300841 and parameters: {'n_estimators': 250, 'max_depth': 9, 'min_samples_split': 13, 'min_samples_leaf': 10, 'max_features': 'sqrt'}. Best is trial 9 with value: 0.7774726802413765.
[I 2026-07-01 06:28:09,748] Trial 23 finished with value: 0.7758293720721982 and parameters: {'n_estimators': 250, 'max_depth': 9, 'min_samples_split': 14, 'min_samples_leaf': 9, 'max_features': 'sqrt'}. Best is trial 9 with value: 0.7774726802413765.
[I 2026-07-01 06:28:10,745] Trial 26 finished with value: 0.7731582772301149 and parameters: {'n_estimators': 250, 'max_depth': 6, 'min_samples_split': 14, 'min_samples_leaf': 10, 'max_features': 'sqrt'}. Best is trial 9 with value: 0.7774726802413765.
[I 2026-07-01 06:32:29,325] Trial 27 finished with value: 0.7744295879841 and parameters: {'n_estimators': 100, 'max_depth': 6, 'min_samples_split': 5, 'min_samples_leaf': 15, 'max_features': 'sqrt'}. Best is trial 9 with value: 0.7774726802413765.
[I 2026-07-01 06:55:32,920] Trial 28 finished with value: 0.7756107756529609 and parameters: {'n_estimators': 250, 'max_depth': 8, 'min_samples_split': 5, 'min_samples_leaf': 15, 'max_features': 'sqrt'}. Best is trial 9 with value: 0.7774726802413765.
[I 2026-07-01 06:56:48,870] Trial 29 finished with value: 0.7756107756529609 and parameters: {'n_estimators': 250, 'max_depth': 8, 'min_samples_split': 5, 'min_samples_leaf': 15, 'max_features': 'sqrt'}. Best is trial 9 with value: 0.7774726802413765.
[I 2026-07-01 07:05:39,353] Trial 32 finished with value: 0.7756107756529609 and parameters: {'n_estimators': 250, 'max_depth': 8, 'min_samples_split': 9, 'min_samples_leaf': 15, 'max_features': 'sqrt'}. Best is trial 9 with value: 0.7774726802413765.
[I 2026-07-01 07:06:24,656] Trial 31 finished with value: 0.7756107756529609 and parameters: {'n_estimators': 250, 'max_depth': 8, 'min_samples_split': 9, 'min_samples_leaf': 15, 'max_features': 'sqrt'}. Best is trial 9 with value: 0.7774726802413765.
[I 2026-07-01 07:09:37,284] Trial 30 finished with value: 0.7748629457976756 and parameters: {'n_estimators': 250, 'max_depth': 9, 'min_samples_split': 9, 'min_samples_leaf': 15, 'max_features': 'sqrt'}. Best is trial 9 with value: 0.7774726802413765.
[I 2026-07-01 07:11:59,837] Trial 34 finished with value: 0.7760690611283794 and parameters: {'n_estimators': 300, 'max_depth': 8, 'min_samples_split': 9, 'min_samples_leaf': 15, 'max_features': 'sqrt'}. Best is trial 9 with value: 0.7774726802413765.
[I 2026-07-01 07:12:03,433] Trial 35 finished with value: 0.7766845826246527 and parameters: {'n_estimators': 300, 'max_depth': 8, 'min_samples_split': 9, 'min_samples_leaf': 13, 'max_features': 'sqrt'}. Best is trial 9 with value: 0.7774726802413765.
[I 2026-07-01 07:12:04,355] Trial 33 finished with value: 0.7766845826246527 and parameters: {'n_estimators': 300, 'max_depth': 8, 'min_samples_split': 9, 'min_samples_leaf': 13, 'max_features': 'sqrt'}. Best is trial 9 with value: 0.7774726802413765.
[I 2026-07-01 07:12:06,177] Trial 37 finished with value: 0.7756433733646015 and parameters: {'n_estimators': 300, 'max_depth': 9, 'min_samples_split': 9, 'min_samples_leaf': 8, 'max_features': 'log2'}. Best is trial 9 with value: 0.7774726802413765.
[I 2026-07-01 07:12:06,685] Trial 36 finished with value: 0.7756433733646015 and parameters: {'n_estimators': 300, 'max_depth': 9, 'min_samples_split': 9, 'min_samples_leaf': 8, 'max_features': 'log2'}. Best is trial 9 with value: 0.7774726802413765.
[I 2026-07-01 07:29:47,442] Trial 42 finished with value: 0.7723529220013461 and parameters: {'n_estimators': 300, 'max_depth': 7, 'min_samples_split': 8, 'min_samples_leaf': 13, 'max_features': 'log2'}. Best is trial 9 with value: 0.7774726802413765.
[I 2026-07-01 07:37:28,314] Trial 43 finished with value: 0.7723529220013461 and parameters: {'n_estimators': 300, 'max_depth': 7, 'min_samples_split': 8, 'min_samples_leaf': 13, 'max_features': 'log2'}. Best is trial 9 with value: 0.7774726802413765.
[I 2026-07-01 07:38:39,983] Trial 46 finished with value: 0.7746021641045504 and parameters: {'n_estimators': 50, 'max_depth': 7, 'min_samples_split': 6, 'min_samples_leaf': 13, 'max_features': 'sqrt'}. Best is trial 9 with value: 0.7774726802413765.
[I 2026-07-01 07:39:15,746] Trial 41 finished with value: 0.7767344379483384 and parameters: {'n_estimators': 300, 'max_depth': 9, 'min_samples_split': 6, 'min_samples_leaf': 13, 'max_features': 'log2'}. Best is trial 9 with value: 0.7774726802413765.
[I 2026-07-01 07:43:39,909] Trial 38 finished with value: 0.7767862107844735 and parameters: {'n_estimators': 300, 'max_depth': 9, 'min_samples_split': 9, 'min_samples_leaf': 13, 'max_features': 'sqrt'}. Best is trial 9 with value: 0.7774726802413765.
[I 2026-07-01 07:43:56,842] Trial 39 finished with value: 0.7767862107844735 and parameters: {'n_estimators': 300, 'max_depth': 9, 'min_samples_split': 6, 'min_samples_leaf': 13, 'max_features': 'sqrt'}. Best is trial 9 with value: 0.7774726802413765.
[I 2026-07-01 07:43:57,466] Trial 44 finished with value: 0.7748456881856306 and parameters: {'n_estimators': 300, 'max_depth': 7, 'min_samples_split': 8, 'min_samples_leaf': 13, 'max_features': 'sqrt'}. Best is trial 9 with value: 0.7774726802413765.
[I 2026-07-01 07:43:58,977] Trial 45 finished with value: 0.7748456881856306 and parameters: {'n_estimators': 300, 'max_depth': 7, 'min_samples_split': 8, 'min_samples_leaf': 13, 'max_features': 'sqrt'}. Best is trial 9 with value: 0.7774726802413765.
[I 2026-07-01 07:43:58,985] Trial 40 finished with value: 0.7767862107844735 and parameters: {'n_estimators': 300, 'max_depth': 9, 'min_samples_split': 6, 'min_samples_leaf': 13, 'max_features': 'sqrt'}. Best is trial 9 with value: 0.7774726802413765.
[I 2026-07-01 07:50:26,844] Trial 53 finished with value: 0.7747383074884614 and parameters: {'n_estimators': 150, 'max_depth': 9, 'min_samples_split': 6, 'min_samples_leaf': 12, 'max_features': 'log2'}. Best is trial 9 with value: 0.7774726802413765.
[I 2026-07-01 07:50:28,819] Trial 54 finished with value: 0.7747383074884614 and parameters: {'n_estimators': 150, 'max_depth': 9, 'min_samples_split': 6, 'min_samples_leaf': 12, 'max_features': 'log2'}. Best is trial 9 with value: 0.7774726802413765.
[I 2026-07-01 07:50:52,770] Trial 49 finished with value: 0.7750757896795645 and parameters: {'n_estimators': 300, 'max_depth': 9, 'min_samples_split': 6, 'min_samples_leaf': 12, 'max_features': 'log2'}. Best is trial 9 with value: 0.7774726802413765.
[I 2026-07-01 07:52:40,074] Trial 55 finished with value: 0.7720288623973891 and parameters: {'n_estimators': 50, 'max_depth': 9, 'min_samples_split': 6, 'min_samples_leaf': 14, 'max_features': 'log2'}. Best is trial 9 with value: 0.7774726802413765.
[I 2026-07-01 07:52:52,509] Trial 47 finished with value: 0.7733711211120038 and parameters: {'n_estimators': 300, 'max_depth': 5, 'min_samples_split': 6, 'min_samples_leaf': 12, 'max_features': 'sqrt'}. Best is trial 9 with value: 0.7774726802413765.
[I 2026-07-01 07:53:03,084] Trial 57 finished with value: 0.7720288623973891 and parameters: {'n_estimators': 50, 'max_depth': 9, 'min_samples_split': 10, 'min_samples_leaf': 14, 'max_features': 'log2'}. Best is trial 9 with value: 0.7774726802413765.
[I 2026-07-01 07:54:37,754] Trial 56 finished with value: 0.7743893202226615 and parameters: {'n_estimators': 100, 'max_depth': 9, 'min_samples_split': 10, 'min_samples_leaf': 14, 'max_features': 'log2'}. Best is trial 9 with value: 0.7774726802413765.
[I 2026-07-01 07:57:23,644] Trial 52 finished with value: 0.7750757896795645 and parameters: {'n_estimators': 300, 'max_depth': 9, 'min_samples_split': 6, 'min_samples_leaf': 12, 'max_features': 'log2'}. Best is trial 9 with value: 0.7774726802413765.
[I 2026-07-01 07:57:24,702] Trial 51 finished with value: 0.7750757896795645 and parameters: {'n_estimators': 300, 'max_depth': 9, 'min_samples_split': 6, 'min_samples_leaf': 12, 'max_features': 'log2'}. Best is trial 9 with value: 0.7774726802413765.
[I 2026-07-01 07:57:26,507] Trial 50 finished with value: 0.7750757896795645 and parameters: {'n_estimators': 300, 'max_depth': 9, 'min_samples_split': 10, 'min_samples_leaf': 12, 'max_features': 'log2'}. Best is trial 9 with value: 0.7774726802413765.
[I 2026-07-01 08:04:29,911] Trial 60 finished with value: 0.7740537555440079 and parameters: {'n_estimators': 100, 'max_depth': 8, 'min_samples_split': 10, 'min_samples_leaf': 14, 'max_features': 'sqrt'}. Best is trial 9 with value: 0.7774726802413765.
[I 2026-07-01 08:07:14,632] Trial 48 finished with value: 0.7763221727717067 and parameters: {'n_estimators': 300, 'max_depth': 8, 'min_samples_split': 10, 'min_samples_leaf': 12, 'max_features': 'sqrt'}. Best is trial 9 with value: 0.7774726802413765.
[I 2026-07-01 08:38:29,205] Trial 58 finished with value: 0.774864863310125 and parameters: {'n_estimators': 300, 'max_depth': 8, 'min_samples_split': 10, 'min_samples_leaf': 14, 'max_features': 'sqrt'}. Best is trial 9 with value: 0.7774726802413765.
[I 2026-07-01 08:50:02,031] Trial 61 finished with value: 0.7771543731747679 and parameters: {'n_estimators': 300, 'max_depth': 10, 'min_samples_split': 7, 'min_samples_leaf': 14, 'max_features': 'sqrt'}. Best is trial 9 with value: 0.7774726802413765.
[I 2026-07-01 08:50:07,699] Trial 59 finished with value: 0.7749856665944403 and parameters: {'n_estimators': 300, 'max_depth': 9, 'min_samples_split': 10, 'min_samples_leaf': 14, 'max_features': 'sqrt'}. Best is trial 9 with value: 0.7774726802413765.
[I 2026-07-01 08:50:10,907] Trial 63 finished with value: 0.7771543731747679 and parameters: {'n_estimators': 300, 'max_depth': 10, 'min_samples_split': 12, 'min_samples_leaf': 14, 'max_features': 'sqrt'}. Best is trial 9 with value: 0.7774726802413765.
[I 2026-07-01 08:50:23,253] Trial 64 finished with value: 0.7771543731747679 and parameters: {'n_estimators': 300, 'max_depth': 10, 'min_samples_split': 7, 'min_samples_leaf': 14, 'max_features': 'sqrt'}. Best is trial 9 with value: 0.7774726802413765.
[I 2026-07-01 08:50:25,926] Trial 62 finished with value: 0.7771543731747679 and parameters: {'n_estimators': 300, 'max_depth': 10, 'min_samples_split': 7, 'min_samples_leaf': 14, 'max_features': 'sqrt'}. Best is trial 9 with value: 0.7774726802413765.
[I 2026-07-01 08:50:26,377] Trial 65 finished with value: 0.7754957249059939 and parameters: {'n_estimators': 300, 'max_depth': 10, 'min_samples_split': 12, 'min_samples_leaf': 11, 'max_features': 'sqrt'}. Best is trial 9 with value: 0.7774726802413765.
[I 2026-07-01 08:50:26,482] Trial 66 finished with value: 0.7754957249059939 and parameters: {'n_estimators': 300, 'max_depth': 10, 'min_samples_split': 12, 'min_samples_leaf': 11, 'max_features': 'sqrt'}. Best is trial 9 with value: 0.7774726802413765.
[I 2026-07-01 08:50:29,025] Trial 67 finished with value: 0.7754803848063984 and parameters: {'n_estimators': 250, 'max_depth': 10, 'min_samples_split': 12, 'min_samples_leaf': 11, 'max_features': 'sqrt'}. Best is trial 9 with value: 0.7774726802413765.
[I 2026-07-01 09:29:02,800] Trial 72 finished with value: 0.7770450749651492 and parameters: {'n_estimators': 250, 'max_depth': 10, 'min_samples_split': 12, 'min_samples_leaf': 14, 'max_features': 'sqrt'}. Best is trial 9 with value: 0.7774726802413765.
[I 2026-07-01 09:29:07,487] Trial 74 finished with value: 0.7770450749651492 and parameters: {'n_estimators': 250, 'max_depth': 10, 'min_samples_split': 7, 'min_samples_leaf': 14, 'max_features': 'sqrt'}. Best is trial 9 with value: 0.7774726802413765.
[I 2026-07-01 09:29:07,538] Trial 71 finished with value: 0.7770450749651492 and parameters: {'n_estimators': 250, 'max_depth': 10, 'min_samples_split': 12, 'min_samples_leaf': 14, 'max_features': 'sqrt'}. Best is trial 9 with value: 0.7774726802413765.
[I 2026-07-01 09:29:07,585] Trial 75 finished with value: 0.7770450749651492 and parameters: {'n_estimators': 250, 'max_depth': 10, 'min_samples_split': 7, 'min_samples_leaf': 14, 'max_features': 'sqrt'}. Best is trial 9 with value: 0.7774726802413765.
[I 2026-07-01 09:29:09,469] Trial 73 finished with value: 0.7770450749651492 and parameters: {'n_estimators': 250, 'max_depth': 10, 'min_samples_split': 7, 'min_samples_leaf': 14, 'max_features': 'sqrt'}. Best is trial 9 with value: 0.7774726802413765.
[I 2026-07-01 09:29:09,648] Trial 69 finished with value: 0.7772943515835776 and parameters: {'n_estimators': 300, 'max_depth': 10, 'min_samples_split': 7, 'min_samples_leaf': 13, 'max_features': 'sqrt'}. Best is trial 9 with value: 0.7774726802413765.
[I 2026-07-01 09:29:09,651] Trial 70 finished with value: 0.7754803848063984 and parameters: {'n_estimators': 250, 'max_depth': 10, 'min_samples_split': 7, 'min_samples_leaf': 11, 'max_features': 'sqrt'}. Best is trial 9 with value: 0.7774726802413765.
[I 2026-07-01 09:29:09,908] Trial 68 finished with value: 0.7772943515835776 and parameters: {'n_estimators': 300, 'max_depth': 10, 'min_samples_split': 7, 'min_samples_leaf': 13, 'max_features': 'sqrt'}. Best is trial 9 with value: 0.7774726802413765.
