ENV CHECKPOINT PATH: 
DEFAULT PATH: /scratch.hpc/luca.cotugno/Foundation_model_clinical_data/src/models_diff/tabdpt1_1.pth
ENV CHECKPOINT PATH: 
DEFAULT PATH: /scratch.hpc/luca.cotugno/Foundation_model_clinical_data/src/models_diff/tabdpt1_1.pth
ENV CHECKPOINT PATH: 
DEFAULT PATH: /scratch.hpc/luca.cotugno/Foundation_model_clinical_data/src/models_diff/tabdpt1_1.pth
ENV CHECKPOINT PATH: 
DEFAULT PATH: /scratch.hpc/luca.cotugno/Foundation_model_clinical_data/src/models_diff/tabdpt1_1.pth
ENV CHECKPOINT PATH: 
DEFAULT PATH: /scratch.hpc/luca.cotugno/Foundation_model_clinical_data/src/models_diff/tabdpt1_1.pth
ENV CHECKPOINT PATH: 
DEFAULT PATH: /scratch.hpc/luca.cotugno/Foundation_model_clinical_data/src/models_diff/tabdpt1_1.pth
ENV CHECKPOINT PATH: 
DEFAULT PATH: /scratch.hpc/luca.cotugno/Foundation_model_clinical_data/src/models_diff/tabdpt1_1.pth
ENV CHECKPOINT PATH: 
DEFAULT PATH: /scratch.hpc/luca.cotugno/Foundation_model_clinical_data/src/models_diff/tabdpt1_1.pth
[I 2026-06-30 23:58:39,436] A new study created in memory with name: rsf_tuning_tabdpt_4_-1_seed123
[I 2026-06-30 23:59:42,836] Trial 4 finished with value: 0.7641900715040393 and parameters: {'n_estimators': 50, 'max_depth': 3, 'min_samples_split': 13, 'min_samples_leaf': 5, 'max_features': 'log2'}. Best is trial 4 with value: 0.7641900715040393.
[I 2026-07-01 00:05:32,994] Trial 1 finished with value: 0.7712215896561708 and parameters: {'n_estimators': 200, 'max_depth': 5, 'min_samples_split': 9, 'min_samples_leaf': 11, 'max_features': 'log2'}. Best is trial 1 with value: 0.7712215896561708.
[I 2026-07-01 00:06:10,596] Trial 2 finished with value: 0.7709032825895622 and parameters: {'n_estimators': 250, 'max_depth': 5, 'min_samples_split': 13, 'min_samples_leaf': 14, 'max_features': 'log2'}. Best is trial 1 with value: 0.7712215896561708.
[I 2026-07-01 00:08:10,752] Trial 0 finished with value: 0.7707537166185051 and parameters: {'n_estimators': 200, 'max_depth': 8, 'min_samples_split': 19, 'min_samples_leaf': 3, 'max_features': 'log2'}. Best is trial 1 with value: 0.7712215896561708.
[I 2026-07-01 00:09:56,017] Trial 7 finished with value: 0.7753710865967798 and parameters: {'n_estimators': 100, 'max_depth': 7, 'min_samples_split': 8, 'min_samples_leaf': 13, 'max_features': 'sqrt'}. Best is trial 7 with value: 0.7753710865967798.
[I 2026-07-01 00:13:05,221] Trial 8 finished with value: 0.7709013650771127 and parameters: {'n_estimators': 150, 'max_depth': 5, 'min_samples_split': 10, 'min_samples_leaf': 4, 'max_features': 'sqrt'}. Best is trial 7 with value: 0.7753710865967798.
[I 2026-07-01 00:13:08,085] Trial 6 finished with value: 0.7728150425016634 and parameters: {'n_estimators': 300, 'max_depth': 9, 'min_samples_split': 9, 'min_samples_leaf': 10, 'max_features': 'log2'}. Best is trial 7 with value: 0.7753710865967798.
[I 2026-07-01 00:13:08,104] Trial 3 finished with value: 0.7743778151479649 and parameters: {'n_estimators': 300, 'max_depth': 9, 'min_samples_split': 12, 'min_samples_leaf': 11, 'max_features': 'log2'}. Best is trial 7 with value: 0.7753710865967798.
[I 2026-07-01 00:13:29,408] Trial 11 finished with value: 0.7676780266495881 and parameters: {'n_estimators': 100, 'max_depth': 3, 'min_samples_split': 8, 'min_samples_leaf': 7, 'max_features': 'sqrt'}. Best is trial 7 with value: 0.7753710865967798.
[I 2026-07-01 00:14:10,738] Trial 14 finished with value: 0.764581244043727 and parameters: {'n_estimators': 50, 'max_depth': 3, 'min_samples_split': 12, 'min_samples_leaf': 11, 'max_features': 'log2'}. Best is trial 7 with value: 0.7753710865967798.
[I 2026-07-01 00:15:18,078] Trial 10 finished with value: 0.7736510779296235 and parameters: {'n_estimators': 250, 'max_depth': 7, 'min_samples_split': 20, 'min_samples_leaf': 12, 'max_features': 'log2'}. Best is trial 7 with value: 0.7753710865967798.
[I 2026-07-01 00:18:22,385] Trial 12 finished with value: 0.7736357378300278 and parameters: {'n_estimators': 200, 'max_depth': 8, 'min_samples_split': 18, 'min_samples_leaf': 4, 'max_features': 'log2'}. Best is trial 7 with value: 0.7753710865967798.
[I 2026-07-01 00:18:24,780] Trial 15 finished with value: 0.772335664389301 and parameters: {'n_estimators': 150, 'max_depth': 6, 'min_samples_split': 9, 'min_samples_leaf': 5, 'max_features': 'log2'}. Best is trial 7 with value: 0.7753710865967798.
[I 2026-07-01 00:18:58,528] Trial 9 finished with value: 0.7746673595278317 and parameters: {'n_estimators': 300, 'max_depth': 10, 'min_samples_split': 19, 'min_samples_leaf': 10, 'max_features': 'log2'}. Best is trial 7 with value: 0.7753710865967798.
[I 2026-07-01 00:25:43,974] Trial 17 finished with value: 0.7725389207089427 and parameters: {'n_estimators': 100, 'max_depth': 7, 'min_samples_split': 5, 'min_samples_leaf': 15, 'max_features': 'sqrt'}. Best is trial 7 with value: 0.7753710865967798.
[I 2026-07-01 00:27:33,761] Trial 16 finished with value: 0.7762013694873914 and parameters: {'n_estimators': 100, 'max_depth': 10, 'min_samples_split': 18, 'min_samples_leaf': 12, 'max_features': 'sqrt'}. Best is trial 16 with value: 0.7762013694873914.
[I 2026-07-01 00:32:44,572] Trial 20 finished with value: 0.7755225700802862 and parameters: {'n_estimators': 100, 'max_depth': 10, 'min_samples_split': 5, 'min_samples_leaf': 15, 'max_features': 'sqrt'}. Best is trial 16 with value: 0.7762013694873914.
[I 2026-07-01 00:32:44,731] Trial 19 finished with value: 0.7755225700802862 and parameters: {'n_estimators': 100, 'max_depth': 10, 'min_samples_split': 6, 'min_samples_leaf': 15, 'max_features': 'sqrt'}. Best is trial 16 with value: 0.7762013694873914.
[I 2026-07-01 00:32:45,211] Trial 21 finished with value: 0.7755225700802862 and parameters: {'n_estimators': 100, 'max_depth': 10, 'min_samples_split': 5, 'min_samples_leaf': 15, 'max_features': 'sqrt'}. Best is trial 16 with value: 0.7762013694873914.
[I 2026-07-01 00:33:39,161] Trial 13 finished with value: 0.7743931552475605 and parameters: {'n_estimators': 250, 'max_depth': 5, 'min_samples_split': 12, 'min_samples_leaf': 12, 'max_features': 'sqrt'}. Best is trial 16 with value: 0.7762013694873914.
[I 2026-07-01 00:33:55,522] Trial 18 finished with value: 0.775909907595075 and parameters: {'n_estimators': 150, 'max_depth': 10, 'min_samples_split': 6, 'min_samples_leaf': 15, 'max_features': 'sqrt'}. Best is trial 16 with value: 0.7762013694873914.
[I 2026-07-01 00:37:51,387] Trial 5 finished with value: 0.7744410930587967 and parameters: {'n_estimators': 300, 'max_depth': 9, 'min_samples_split': 17, 'min_samples_leaf': 5, 'max_features': 'sqrt'}. Best is trial 16 with value: 0.7762013694873914.
[I 2026-07-01 00:39:06,226] Trial 22 finished with value: 0.7725600133458866 and parameters: {'n_estimators': 100, 'max_depth': 10, 'min_samples_split': 16, 'min_samples_leaf': 8, 'max_features': 'sqrt'}. Best is trial 16 with value: 0.7762013694873914.
[I 2026-07-01 00:39:12,921] Trial 25 finished with value: 0.7743260423118297 and parameters: {'n_estimators': 50, 'max_depth': 9, 'min_samples_split': 15, 'min_samples_leaf': 13, 'max_features': 'sqrt'}. Best is trial 16 with value: 0.7762013694873914.
[I 2026-07-01 00:39:19,399] Trial 26 finished with value: 0.7743260423118297 and parameters: {'n_estimators': 50, 'max_depth': 9, 'min_samples_split': 16, 'min_samples_leaf': 13, 'max_features': 'sqrt'}. Best is trial 16 with value: 0.7762013694873914.
[I 2026-07-01 00:39:23,063] Trial 24 finished with value: 0.7752963036112512 and parameters: {'n_estimators': 50, 'max_depth': 10, 'min_samples_split': 16, 'min_samples_leaf': 15, 'max_features': 'sqrt'}. Best is trial 16 with value: 0.7762013694873914.
[I 2026-07-01 00:40:03,232] Trial 23 finished with value: 0.773401801311195 and parameters: {'n_estimators': 100, 'max_depth': 10, 'min_samples_split': 16, 'min_samples_leaf': 13, 'max_features': 'sqrt'}. Best is trial 16 with value: 0.7762013694873914.
[I 2026-07-01 00:40:27,424] Trial 27 finished with value: 0.7720978928455693 and parameters: {'n_estimators': 50, 'max_depth': 9, 'min_samples_split': 16, 'min_samples_leaf': 8, 'max_features': 'sqrt'}. Best is trial 16 with value: 0.7762013694873914.
[I 2026-07-01 00:52:28,692] Trial 28 finished with value: 0.7762262971492342 and parameters: {'n_estimators': 150, 'max_depth': 9, 'min_samples_split': 16, 'min_samples_leaf': 13, 'max_features': 'sqrt'}. Best is trial 28 with value: 0.7762262971492342.
[I 2026-07-01 00:57:57,619] Trial 31 finished with value: 0.7754132718706677 and parameters: {'n_estimators': 150, 'max_depth': 8, 'min_samples_split': 7, 'min_samples_leaf': 14, 'max_features': 'sqrt'}. Best is trial 28 with value: 0.7762262971492342.
[I 2026-07-01 00:57:57,824] Trial 32 finished with value: 0.7754132718706677 and parameters: {'n_estimators': 150, 'max_depth': 8, 'min_samples_split': 7, 'min_samples_leaf': 14, 'max_features': 'sqrt'}. Best is trial 28 with value: 0.7762262971492342.
[I 2026-07-01 00:57:57,935] Trial 29 finished with value: 0.7751812528642842 and parameters: {'n_estimators': 150, 'max_depth': 10, 'min_samples_split': 15, 'min_samples_leaf': 13, 'max_features': 'sqrt'}. Best is trial 28 with value: 0.7762262971492342.
[I 2026-07-01 00:57:58,035] Trial 33 finished with value: 0.7754132718706677 and parameters: {'n_estimators': 150, 'max_depth': 8, 'min_samples_split': 7, 'min_samples_leaf': 14, 'max_features': 'sqrt'}. Best is trial 28 with value: 0.7762262971492342.
[I 2026-07-01 00:57:58,158] Trial 35 finished with value: 0.7754132718706677 and parameters: {'n_estimators': 150, 'max_depth': 8, 'min_samples_split': 7, 'min_samples_leaf': 14, 'max_features': 'sqrt'}. Best is trial 28 with value: 0.7762262971492342.
[I 2026-07-01 00:57:58,210] Trial 34 finished with value: 0.7754132718706677 and parameters: {'n_estimators': 150, 'max_depth': 8, 'min_samples_split': 7, 'min_samples_leaf': 14, 'max_features': 'sqrt'}. Best is trial 28 with value: 0.7762262971492342.
[I 2026-07-01 00:57:58,317] Trial 30 finished with value: 0.7762262971492342 and parameters: {'n_estimators': 150, 'max_depth': 9, 'min_samples_split': 7, 'min_samples_leaf': 13, 'max_features': 'sqrt'}. Best is trial 28 with value: 0.7762262971492342.
[I 2026-07-01 01:06:19,234] Trial 36 finished with value: 0.7754132718706677 and parameters: {'n_estimators': 150, 'max_depth': 8, 'min_samples_split': 14, 'min_samples_leaf': 14, 'max_features': 'sqrt'}. Best is trial 28 with value: 0.7762262971492342.
[I 2026-07-01 01:15:20,166] Trial 37 finished with value: 0.7754132718706677 and parameters: {'n_estimators': 150, 'max_depth': 8, 'min_samples_split': 18, 'min_samples_leaf': 14, 'max_features': 'sqrt'}. Best is trial 28 with value: 0.7762262971492342.
[I 2026-07-01 01:17:29,439] Trial 38 finished with value: 0.7755091474931401 and parameters: {'n_estimators': 150, 'max_depth': 10, 'min_samples_split': 14, 'min_samples_leaf': 14, 'max_features': 'sqrt'}. Best is trial 28 with value: 0.7762262971492342.
[I 2026-07-01 01:22:17,960] Trial 39 finished with value: 0.7773633820317578 and parameters: {'n_estimators': 200, 'max_depth': 9, 'min_samples_split': 18, 'min_samples_leaf': 14, 'max_features': 'sqrt'}. Best is trial 39 with value: 0.7773633820317578.
[I 2026-07-01 01:22:48,396] Trial 40 finished with value: 0.7755992705782643 and parameters: {'n_estimators': 200, 'max_depth': 9, 'min_samples_split': 18, 'min_samples_leaf': 12, 'max_features': 'sqrt'}. Best is trial 39 with value: 0.7773633820317578.
[I 2026-07-01 01:22:50,492] Trial 42 finished with value: 0.7755992705782643 and parameters: {'n_estimators': 200, 'max_depth': 9, 'min_samples_split': 18, 'min_samples_leaf': 12, 'max_features': 'sqrt'}. Best is trial 39 with value: 0.7773633820317578.
[I 2026-07-01 01:22:52,577] Trial 41 finished with value: 0.7755992705782643 and parameters: {'n_estimators': 200, 'max_depth': 9, 'min_samples_split': 18, 'min_samples_leaf': 12, 'max_features': 'sqrt'}. Best is trial 39 with value: 0.7773633820317578.
[I 2026-07-01 01:22:52,957] Trial 43 finished with value: 0.7755992705782643 and parameters: {'n_estimators': 200, 'max_depth': 9, 'min_samples_split': 14, 'min_samples_leaf': 12, 'max_features': 'sqrt'}. Best is trial 39 with value: 0.7773633820317578.
[I 2026-07-01 01:31:05,951] Trial 44 finished with value: 0.7755992705782643 and parameters: {'n_estimators': 200, 'max_depth': 9, 'min_samples_split': 18, 'min_samples_leaf': 12, 'max_features': 'sqrt'}. Best is trial 39 with value: 0.7773633820317578.
[I 2026-07-01 01:40:06,951] Trial 45 finished with value: 0.7755992705782643 and parameters: {'n_estimators': 200, 'max_depth': 9, 'min_samples_split': 11, 'min_samples_leaf': 12, 'max_features': 'sqrt'}. Best is trial 39 with value: 0.7773633820317578.
[I 2026-07-01 01:42:15,596] Trial 46 finished with value: 0.7755992705782643 and parameters: {'n_estimators': 200, 'max_depth': 9, 'min_samples_split': 10, 'min_samples_leaf': 12, 'max_features': 'sqrt'}. Best is trial 39 with value: 0.7773633820317578.
[I 2026-07-01 01:46:12,175] Trial 53 finished with value: 0.7694383030781827 and parameters: {'n_estimators': 250, 'max_depth': 4, 'min_samples_split': 19, 'min_samples_leaf': 10, 'max_features': 'log2'}. Best is trial 39 with value: 0.7773633820317578.
[I 2026-07-01 01:47:08,040] Trial 47 finished with value: 0.7755992705782643 and parameters: {'n_estimators': 200, 'max_depth': 9, 'min_samples_split': 18, 'min_samples_leaf': 12, 'max_features': 'sqrt'}. Best is trial 39 with value: 0.7773633820317578.
[I 2026-07-01 01:48:06,700] Trial 50 finished with value: 0.7755302401300841 and parameters: {'n_estimators': 200, 'max_depth': 9, 'min_samples_split': 11, 'min_samples_leaf': 11, 'max_features': 'sqrt'}. Best is trial 39 with value: 0.7773633820317578.
[I 2026-07-01 01:48:06,819] Trial 48 finished with value: 0.7755302401300841 and parameters: {'n_estimators': 200, 'max_depth': 9, 'min_samples_split': 20, 'min_samples_leaf': 11, 'max_features': 'sqrt'}. Best is trial 39 with value: 0.7773633820317578.
[I 2026-07-01 01:48:09,036] Trial 49 finished with value: 0.7755302401300841 and parameters: {'n_estimators': 200, 'max_depth': 9, 'min_samples_split': 20, 'min_samples_leaf': 11, 'max_features': 'sqrt'}. Best is trial 39 with value: 0.7773633820317578.
[I 2026-07-01 01:48:14,904] Trial 54 finished with value: 0.7694383030781827 and parameters: {'n_estimators': 250, 'max_depth': 4, 'min_samples_split': 20, 'min_samples_leaf': 10, 'max_features': 'log2'}. Best is trial 39 with value: 0.7773633820317578.
[I 2026-07-01 01:48:48,893] Trial 52 finished with value: 0.7725235806093471 and parameters: {'n_estimators': 250, 'max_depth': 4, 'min_samples_split': 20, 'min_samples_leaf': 11, 'max_features': 'sqrt'}. Best is trial 39 with value: 0.7773633820317578.
[I 2026-07-01 01:51:50,790] Trial 57 finished with value: 0.7707076963197184 and parameters: {'n_estimators': 100, 'max_depth': 7, 'min_samples_split': 20, 'min_samples_leaf': 10, 'max_features': 'log2'}. Best is trial 39 with value: 0.7773633820317578.
[I 2026-07-01 01:54:40,955] Trial 51 finished with value: 0.7757239088874784 and parameters: {'n_estimators': 250, 'max_depth': 9, 'min_samples_split': 20, 'min_samples_leaf': 11, 'max_features': 'sqrt'}. Best is trial 39 with value: 0.7773633820317578.
[I 2026-07-01 01:55:12,055] Trial 56 finished with value: 0.7717163078681288 and parameters: {'n_estimators': 250, 'max_depth': 6, 'min_samples_split': 20, 'min_samples_leaf': 11, 'max_features': 'log2'}. Best is trial 39 with value: 0.7773633820317578.
[I 2026-07-01 01:59:00,740] Trial 59 finished with value: 0.7733001731513742 and parameters: {'n_estimators': 250, 'max_depth': 10, 'min_samples_split': 17, 'min_samples_leaf': 13, 'max_features': 'log2'}. Best is trial 39 with value: 0.7773633820317578.
[I 2026-07-01 02:02:05,236] Trial 61 finished with value: 0.773401801311195 and parameters: {'n_estimators': 100, 'max_depth': 10, 'min_samples_split': 17, 'min_samples_leaf': 13, 'max_features': 'sqrt'}. Best is trial 39 with value: 0.7773633820317578.
[I 2026-07-01 02:08:28,777] Trial 64 finished with value: 0.773401801311195 and parameters: {'n_estimators': 100, 'max_depth': 10, 'min_samples_split': 17, 'min_samples_leaf': 13, 'max_features': 'sqrt'}. Best is trial 39 with value: 0.7773633820317578.
[I 2026-07-01 02:10:09,392] Trial 55 finished with value: 0.7739789725584794 and parameters: {'n_estimators': 250, 'max_depth': 6, 'min_samples_split': 20, 'min_samples_leaf': 11, 'max_features': 'sqrt'}. Best is trial 39 with value: 0.7773633820317578.
[I 2026-07-01 02:11:17,980] Trial 62 finished with value: 0.7751812528642842 and parameters: {'n_estimators': 150, 'max_depth': 10, 'min_samples_split': 19, 'min_samples_leaf': 13, 'max_features': 'sqrt'}. Best is trial 39 with value: 0.7773633820317578.
[I 2026-07-01 02:12:13,268] Trial 60 finished with value: 0.775401766795971 and parameters: {'n_estimators': 250, 'max_depth': 6, 'min_samples_split': 17, 'min_samples_leaf': 13, 'max_features': 'sqrt'}. Best is trial 39 with value: 0.7773633820317578.
[I 2026-07-01 02:20:35,648] Trial 58 finished with value: 0.7763758631202913 and parameters: {'n_estimators': 250, 'max_depth': 10, 'min_samples_split': 19, 'min_samples_leaf': 13, 'max_features': 'sqrt'}. Best is trial 39 with value: 0.7773633820317578.
[I 2026-07-01 02:22:43,480] Trial 66 finished with value: 0.774885955947069 and parameters: {'n_estimators': 150, 'max_depth': 10, 'min_samples_split': 19, 'min_samples_leaf': 9, 'max_features': 'sqrt'}. Best is trial 39 with value: 0.7773633820317578.
[I 2026-07-01 02:52:51,290] Trial 63 finished with value: 0.776161101725953 and parameters: {'n_estimators': 300, 'max_depth': 10, 'min_samples_split': 19, 'min_samples_leaf': 13, 'max_features': 'sqrt'}. Best is trial 39 with value: 0.7773633820317578.
[I 2026-07-01 02:53:25,446] Trial 65 finished with value: 0.776161101725953 and parameters: {'n_estimators': 300, 'max_depth': 10, 'min_samples_split': 17, 'min_samples_leaf': 13, 'max_features': 'sqrt'}. Best is trial 39 with value: 0.7773633820317578.
[I 2026-07-01 02:53:43,282] Trial 67 finished with value: 0.776161101725953 and parameters: {'n_estimators': 300, 'max_depth': 10, 'min_samples_split': 19, 'min_samples_leaf': 13, 'max_features': 'sqrt'}. Best is trial 39 with value: 0.7773633820317578.
[I 2026-07-01 02:53:43,426] Trial 70 finished with value: 0.7754612096819039 and parameters: {'n_estimators': 300, 'max_depth': 10, 'min_samples_split': 19, 'min_samples_leaf': 15, 'max_features': 'sqrt'}. Best is trial 39 with value: 0.7773633820317578.
[I 2026-07-01 02:53:43,492] Trial 68 finished with value: 0.7754612096819039 and parameters: {'n_estimators': 300, 'max_depth': 10, 'min_samples_split': 19, 'min_samples_leaf': 15, 'max_features': 'sqrt'}. Best is trial 39 with value: 0.7773633820317578.
[I 2026-07-01 02:53:43,534] Trial 69 finished with value: 0.7754612096819039 and parameters: {'n_estimators': 300, 'max_depth': 10, 'min_samples_split': 19, 'min_samples_leaf': 15, 'max_features': 'sqrt'}. Best is trial 39 with value: 0.7773633820317578.
[I 2026-07-01 02:53:44,784] Trial 71 finished with value: 0.7754612096819039 and parameters: {'n_estimators': 300, 'max_depth': 10, 'min_samples_split': 19, 'min_samples_leaf': 15, 'max_features': 'sqrt'}. Best is trial 39 with value: 0.7773633820317578.
[I 2026-07-01 02:53:45,262] Trial 72 finished with value: 0.7754612096819039 and parameters: {'n_estimators': 300, 'max_depth': 10, 'min_samples_split': 6, 'min_samples_leaf': 15, 'max_features': 'sqrt'}. Best is trial 39 with value: 0.7773633820317578.
[I 2026-07-01 03:29:50,852] Trial 73 finished with value: 0.7754612096819039 and parameters: {'n_estimators': 300, 'max_depth': 10, 'min_samples_split': 6, 'min_samples_leaf': 15, 'max_features': 'sqrt'}. Best is trial 39 with value: 0.7773633820317578.
[I 2026-07-01 03:31:18,347] Trial 74 finished with value: 0.7754612096819039 and parameters: {'n_estimators': 300, 'max_depth': 10, 'min_samples_split': 19, 'min_samples_leaf': 15, 'max_features': 'sqrt'}. Best is trial 39 with value: 0.7773633820317578.
[I 2026-07-01 03:31:50,697] Trial 75 finished with value: 0.7754612096819039 and parameters: {'n_estimators': 300, 'max_depth': 10, 'min_samples_split': 17, 'min_samples_leaf': 15, 'max_features': 'sqrt'}. Best is trial 39 with value: 0.7773633820317578.
[I 2026-07-01 03:36:33,546] Trial 78 finished with value: 0.776161101725953 and parameters: {'n_estimators': 300, 'max_depth': 10, 'min_samples_split': 17, 'min_samples_leaf': 13, 'max_features': 'sqrt'}. Best is trial 39 with value: 0.7773633820317578.
[I 2026-07-01 03:36:52,996] Trial 76 finished with value: 0.776161101725953 and parameters: {'n_estimators': 300, 'max_depth': 10, 'min_samples_split': 17, 'min_samples_leaf': 13, 'max_features': 'sqrt'}. Best is trial 39 with value: 0.7773633820317578.
[I 2026-07-01 03:36:53,557] Trial 79 finished with value: 0.776161101725953 and parameters: {'n_estimators': 300, 'max_depth': 10, 'min_samples_split': 17, 'min_samples_leaf': 13, 'max_features': 'sqrt'}. Best is trial 39 with value: 0.7773633820317578.
[I 2026-07-01 03:36:53,803] Trial 80 finished with value: 0.776161101725953 and parameters: {'n_estimators': 300, 'max_depth': 10, 'min_samples_split': 17, 'min_samples_leaf': 13, 'max_features': 'sqrt'}. Best is trial 39 with value: 0.7773633820317578.
[I 2026-07-01 03:36:54,188] Trial 77 finished with value: 0.776161101725953 and parameters: {'n_estimators': 300, 'max_depth': 10, 'min_samples_split': 17, 'min_samples_leaf': 13, 'max_features': 'sqrt'}. Best is trial 39 with value: 0.7773633820317578.
[I 2026-07-01 04:03:37,802] Trial 81 finished with value: 0.776161101725953 and parameters: {'n_estimators': 300, 'max_depth': 10, 'min_samples_split': 17, 'min_samples_leaf': 13, 'max_features': 'sqrt'}. Best is trial 39 with value: 0.7773633820317578.
