[I 2026-06-09 05:30:50,161] Trial 99 finished with value: 0.7686679608641386 and parameters: {'n_estimators': 250, 'max_depth': 3, 'min_samples_split': 6, 'min_samples_leaf': 4, 'max_features': 'log2'}. Best is trial 64 with value: 0.7848108754471055.
[I 2026-06-09 05:34:39,446] A new study created in memory with name: deepsurv_tuning_tabicl_5_NaN_seed789
/scratch.hpc/luca.cotugno/Foundation_model_clinical_data/test_tabular_model_tmp.py:476: UserWarning: Choices for a categorical distribution should be a tuple of None, bool, int, float and str for persistent storage but contains [32] which is of type list.
  num_nodes  = trial.suggest_categorical("num_nodes", [[32], [64], [128], [64, 32], [128, 64]])
/scratch.hpc/luca.cotugno/Foundation_model_clinical_data/test_tabular_model_tmp.py:476: UserWarning: Choices for a categorical distribution should be a tuple of None, bool, int, float and str for persistent storage but contains [64] which is of type list.
  num_nodes  = trial.suggest_categorical("num_nodes", [[32], [64], [128], [64, 32], [128, 64]])
/scratch.hpc/luca.cotugno/Foundation_model_clinical_data/test_tabular_model_tmp.py:476: UserWarning: Choices for a categorical distribution should be a tuple of None, bool, int, float and str for persistent storage but contains [128] which is of type list.
  num_nodes  = trial.suggest_categorical("num_nodes", [[32], [64], [128], [64, 32], [128, 64]])
/scratch.hpc/luca.cotugno/Foundation_model_clinical_data/test_tabular_model_tmp.py:476: UserWarning: Choices for a categorical distribution should be a tuple of None, bool, int, float and str for persistent storage but contains [64, 32] which is of type list.
  num_nodes  = trial.suggest_categorical("num_nodes", [[32], [64], [128], [64, 32], [128, 64]])
/scratch.hpc/luca.cotugno/Foundation_model_clinical_data/test_tabular_model_tmp.py:476: UserWarning: Choices for a categorical distribution should be a tuple of None, bool, int, float and str for persistent storage but contains [128, 64] which is of type list.
  num_nodes  = trial.suggest_categorical("num_nodes", [[32], [64], [128], [64, 32], [128, 64]])

88:	[0s / 53s],		train_loss: 2.4161
52:	[0s / 26s],		train_loss: 2.4272
56:	[1s / 1m:0s],		train_loss: 2.4028
37:	[0s / 18s],		train_loss: 2.4569
89:	[0s / 54s],		train_loss: 2.3904
53:	[0s / 27s],		train_loss: 2.4321
38:	[0s / 18s],		train_loss: 2.4386
90:	[0s / 55s],		train_loss: 2.4030
54:	[0s / 27s],		train_loss: 2.4186
39:	[0s / 19s],		train_loss: 2.4438
57:	[1s / 1m:2s],		train_loss: 2.4125
40:	[0s / 19s],		train_loss: 2.4398
91:	[0s / 55s],		train_loss: 2.4158
55:	[0s / 28s],		train_loss: 2.4230
41:	[0s / 20s],		train_loss: 2.4435
56:	[0s / 28s],		train_loss: 2.4421
92:	[0s / 56s],		train_loss: 2.3975
58:	[1s / 1m:3s],		train_loss: 2.3895
42:	[0s / 20s],		train_loss: 2.4426
57:	[0s / 29s],		train_loss: 2.4322
93:	[0s / 56s],		train_loss: 2.4042
43:	[0s / 20s],		train_loss: 2.4354
58:	[0s / 29s],		train_loss: 2.4189
94:	[0s / 57s],		train_loss: 2.4041
44:	[0s / 21s],		train_loss: 2.4394
59:	[1s / 1m:4s],		train_loss: 2.4014
59:	[0s / 30s],		train_loss: 2.4193
45:	[0s / 21s],		train_loss: 2.4282
95:	[0s / 58s],		train_loss: 2.4135
60:	[0s / 30s],		train_loss: 2.4212
46:	[0s / 22s],		train_loss: 2.4269
60:	[1s / 1m:5s],		train_loss: 2.3983
61:	[0s / 31s],		train_loss: 2.4275
96:	[0s / 58s],		train_loss: 2.4001
47:	[0s / 22s],		train_loss: 2.4304
62:	[0s / 31s],		train_loss: 2.4142
97:	[0s / 59s],		train_loss: 2.4146
48:	[0s / 23s],		train_loss: 2.4359
61:	[1s / 1m:6s],		train_loss: 2.3979
63:	[0s / 32s],		train_loss: 2.4142
49:	[0s / 23s],		train_loss: 2.4351
98:	[0s / 1m:0s],		train_loss: 2.3978
64:	[0s / 32s],		train_loss: 2.4080
50:	[0s / 24s],		train_loss: 2.4244
99:	[0s / 1m:0s],		train_loss: 2.4118
62:	[1s / 1m:7s],		train_loss: 2.4010
65:	[0s / 33s],		train_loss: 2.4167
51:	[0s / 24s],		train_loss: 2.4214
66:	[0s / 34s],		train_loss: 2.4107
52:	[0s / 25s],		train_loss: 2.4291
0:	[0s / 0s],		train_loss: 3.7559
67:	[0s / 34s],		train_loss: 2.4097
53:	[0s / 25s],		train_loss: 2.4116
63:	[1s / 1m:8s],		train_loss: 2.3931
1:	[0s / 1s],		train_loss: 2.9285
68:	[0s / 35s],		train_loss: 2.4108
54:	[0s / 26s],		train_loss: 2.4230
69:	[0s / 35s],		train_loss: 2.3979
55:	[0s / 26s],		train_loss: 2.4172
2:	[0s / 2s],		train_loss: 2.7751
64:	[1s / 1m:9s],		train_loss: 2.4015
70:	[0s / 35s],		train_loss: 2.3900
56:	[0s / 27s],		train_loss: 2.4219
3:	[0s / 2s],		train_loss: 2.6942
71:	[0s / 36s],		train_loss: 2.4054
57:	[0s / 27s],		train_loss: 2.4312
65:	[1s / 1m:10s],		train_loss: 2.4016
58:	[0s / 28s],		train_loss: 2.4083
72:	[0s / 36s],		train_loss: 2.4089
4:	[0s / 3s],		train_loss: 2.6655
59:	[0s / 28s],		train_loss: 2.4030
73:	[0s / 37s],		train_loss: 2.4097
60:	[0s / 28s],		train_loss: 2.4067
74:	[0s / 37s],		train_loss: 2.3960
5:	[0s / 4s],		train_loss: 2.6301
66:	[1s / 1m:12s],		train_loss: 2.3833
61:	[0s / 29s],		train_loss: 2.4102
75:	[0s / 38s],		train_loss: 2.3961
6:	[0s / 5s],		train_loss: 2.6073
62:	[0s / 29s],		train_loss: 2.4092
76:	[0s / 38s],		train_loss: 2.3983
63:	[0s / 30s],		train_loss: 2.4131
7:	[0s / 5s],		train_loss: 2.5857
77:	[0s / 39s],		train_loss: 2.3980
67:	[1s / 1m:13s],		train_loss: 2.3983
64:	[0s / 30s],		train_loss: 2.4146
78:	[0s / 39s],		train_loss: 2.3924
8:	[0s / 6s],		train_loss: 2.5750
65:	[0s / 31s],		train_loss: 2.4027
79:	[0s / 40s],		train_loss: 2.3975
68:	[1s / 1m:14s],		train_loss: 2.3880
9:	[0s / 7s],		train_loss: 2.5638
66:	[0s / 31s],		train_loss: 2.3977
80:	[0s / 40s],		train_loss: 2.3920
67:	[0s / 32s],		train_loss: 2.3960
81:	[0s / 41s],		train_loss: 2.3935
10:	[0s / 7s],		train_loss: 2.5511
68:	[0s / 32s],		train_loss: 2.3978
69:	[1s / 1m:15s],		train_loss: 2.3910
82:	[0s / 41s],		train_loss: 2.3924
69:	[0s / 33s],		train_loss: 2.3973
11:	[0s / 8s],		train_loss: 2.5397
83:	[0s / 42s],		train_loss: 2.3817
70:	[0s / 33s],		train_loss: 2.3955
84:	[0s / 42s],		train_loss: 2.3812
12:	[0s / 9s],		train_loss: 2.5326
70:	[1s / 1m:17s],		train_loss: 2.3919
71:	[0s / 34s],		train_loss: 2.3886
85:	[0s / 43s],		train_loss: 2.3877
72:	[0s / 34s],		train_loss: 2.3998
13:	[0s / 9s],		train_loss: 2.5371
86:	[0s / 43s],		train_loss: 2.3874
73:	[0s / 35s],		train_loss: 2.4029
71:	[1s / 1m:18s],		train_loss: 2.3851
87:	[0s / 44s],		train_loss: 2.3913
14:	[0s / 10s],		train_loss: 2.5271
74:	[0s / 35s],		train_loss: 2.3836
88:	[0s / 44s],		train_loss: 2.3985
75:	[0s / 36s],		train_loss: 2.3983
15:	[0s / 11s],		train_loss: 2.5092
89:	[0s / 45s],		train_loss: 2.3894
72:	[1s / 1m:19s],		train_loss: 2.3901
76:	[0s / 36s],		train_loss: 2.3993
90:	[0s / 45s],		train_loss: 2.3716
16:	[0s / 12s],		train_loss: 2.5125
77:	[0s / 36s],		train_loss: 2.3947
91:	[0s / 46s],		train_loss: 2.3770
78:	[0s / 37s],		train_loss: 2.3902
17:	[0s / 12s],		train_loss: 2.5220
73:	[1s / 1m:20s],		train_loss: 2.3787
92:	[0s / 46s],		train_loss: 2.3700
79:	[0s / 37s],		train_loss: 2.3916
93:	[0s / 47s],		train_loss: 2.3890
18:	[0s / 13s],		train_loss: 2.5026
80:	[0s / 38s],		train_loss: 2.3760
94:	[0s / 47s],		train_loss: 2.3908
81:	[0s / 38s],		train_loss: 2.3791
74:	[1s / 1m:21s],		train_loss: 2.3938
19:	[0s / 14s],		train_loss: 2.5069
82:	[0s / 39s],		train_loss: 2.3864
95:	[0s / 48s],		train_loss: 2.3829
83:	[0s / 39s],		train_loss: 2.3817
20:	[0s / 15s],		train_loss: 2.5020
96:	[0s / 48s],		train_loss: 2.3763
75:	[1s / 1m:23s],		train_loss: 2.3858
84:	[0s / 40s],		train_loss: 2.3879
97:	[0s / 49s],		train_loss: 2.3690
21:	[0s / 15s],		train_loss: 2.4865
85:	[0s / 40s],		train_loss: 2.3851
98:	[0s / 49s],		train_loss: 2.3806
22:	[0s / 16s],		train_loss: 2.4950
86:	[0s / 41s],		train_loss: 2.3790
99:	[0s / 50s],		train_loss: 2.3610
76:	[1s / 1m:24s],		train_loss: 2.3905
87:	[0s / 41s],		train_loss: 2.3830
0:	[0s / 0s],		train_loss: 3.8607
23:	[0s / 17s],		train_loss: 2.4835
88:	[0s / 42s],		train_loss: 2.3794
1:	[0s / 0s],		train_loss: 2.9077
77:	[1s / 1m:25s],		train_loss: 2.3745
89:	[0s / 42s],		train_loss: 2.3803
24:	[0s / 17s],		train_loss: 2.4919
2:	[0s / 1s],		train_loss: 2.7704
90:	[0s / 43s],		train_loss: 2.3718
25:	[0s / 18s],		train_loss: 2.4837
3:	[0s / 1s],		train_loss: 2.7136
91:	[0s / 43s],		train_loss: 2.3724
78:	[1s / 1m:26s],		train_loss: 2.3742
4:	[0s / 2s],		train_loss: 2.6719
92:	[0s / 43s],		train_loss: 2.3856
26:	[0s / 19s],		train_loss: 2.4858
5:	[0s / 2s],		train_loss: 2.6335
93:	[0s / 44s],		train_loss: 2.3754
27:	[0s / 20s],		train_loss: 2.4641
79:	[1s / 1m:27s],		train_loss: 2.3707
6:	[0s / 3s],		train_loss: 2.6111
94:	[0s / 44s],		train_loss: 2.3737
7:	[0s / 3s],		train_loss: 2.5842
95:	[0s / 45s],		train_loss: 2.3765
28:	[0s / 20s],		train_loss: 2.4720
8:	[0s / 4s],		train_loss: 2.5813
96:	[0s / 45s],		train_loss: 2.3460
80:	[1s / 1m:28s],		train_loss: 2.3774
29:	[0s / 21s],		train_loss: 2.4690
9:	[0s / 4s],		train_loss: 2.5742
97:	[0s / 46s],		train_loss: 2.3587
10:	[0s / 5s],		train_loss: 2.5607
98:	[0s / 46s],		train_loss: 2.3761
30:	[0s / 22s],		train_loss: 2.4633
81:	[1s / 1m:30s],		train_loss: 2.3713
11:	[0s / 5s],		train_loss: 2.5499
99:	[0s / 47s],		train_loss: 2.3806
31:	[0s / 23s],		train_loss: 2.4466
12:	[0s / 6s],		train_loss: 2.5321
0:	[0s / 0s],		train_loss: 3.8766
82:	[1s / 1m:31s],		train_loss: 2.3686
32:	[0s / 23s],		train_loss: 2.4500
13:	[0s / 7s],		train_loss: 2.5372
1:	[0s / 0s],		train_loss: 2.9701
14:	[0s / 7s],		train_loss: 2.5225
2:	[0s / 1s],		train_loss: 2.7985
33:	[0s / 24s],		train_loss: 2.4609
15:	[0s / 8s],		train_loss: 2.5155
3:	[0s / 1s],		train_loss: 2.7461
83:	[1s / 1m:32s],		train_loss: 2.3716
4:	[0s / 2s],		train_loss: 2.6729
16:	[0s / 8s],		train_loss: 2.5237
34:	[0s / 25s],		train_loss: 2.4647
5:	[0s / 2s],		train_loss: 2.6330
17:	[0s / 8s],		train_loss: 2.5176
35:	[0s / 25s],		train_loss: 2.4710
84:	[1s / 1m:33s],		train_loss: 2.3616
6:	[0s / 3s],		train_loss: 2.6349
18:	[0s / 9s],		train_loss: 2.5049
7:	[0s / 3s],		train_loss: 2.6235
19:	[0s / 9s],		train_loss: 2.4972
36:	[0s / 26s],		train_loss: 2.4550
8:	[0s / 4s],		train_loss: 2.5973
20:	[0s / 10s],		train_loss: 2.5065
85:	[1s / 1m:34s],		train_loss: 2.3872
37:	[0s / 27s],		train_loss: 2.4609
9:	[0s / 4s],		train_loss: 2.5836
21:	[0s / 10s],		train_loss: 2.4925
10:	[0s / 5s],		train_loss: 2.5687
38:	[0s / 28s],		train_loss: 2.4342
22:	[0s / 11s],		train_loss: 2.4822
11:	[0s / 5s],		train_loss: 2.5628
86:	[1s / 1m:36s],		train_loss: 2.3781
23:	[0s / 11s],		train_loss: 2.4851
39:	[0s / 28s],		train_loss: 2.4602
12:	[0s / 6s],		train_loss: 2.5531
24:	[0s / 12s],		train_loss: 2.4770
13:	[0s / 6s],		train_loss: 2.5448
40:	[0s / 29s],		train_loss: 2.4580
25:	[0s / 12s],		train_loss: 2.4739
87:	[1s / 1m:37s],		train_loss: 2.3786
14:	[0s / 6s],		train_loss: 2.5282
26:	[0s / 13s],		train_loss: 2.4814
41:	[0s / 30s],		train_loss: 2.4397
15:	[0s / 7s],		train_loss: 2.5277
27:	[0s / 13s],		train_loss: 2.4880
16:	[0s / 7s],		train_loss: 2.5292
88:	[1s / 1m:38s],		train_loss: 2.3671
42:	[0s / 30s],		train_loss: 2.4340
28:	[0s / 14s],		train_loss: 2.4648
17:	[0s / 8s],		train_loss: 2.5324
29:	[0s / 14s],		train_loss: 2.4738
43:	[0s / 31s],		train_loss: 2.4337
18:	[0s / 8s],		train_loss: 2.5222
89:	[1s / 1m:39s],		train_loss: 2.3631
30:	[0s / 15s],		train_loss: 2.4727
19:	[0s / 9s],		train_loss: 2.5221
44:	[0s / 32s],		train_loss: 2.4285
31:	[0s / 15s],		train_loss: 2.4673
20:	[0s / 9s],		train_loss: 2.5190
32:	[0s / 16s],		train_loss: 2.4807
45:	[0s / 33s],		train_loss: 2.4455
21:	[0s / 10s],		train_loss: 2.5150
90:	[1s / 1m:40s],		train_loss: 2.3715
33:	[0s / 16s],		train_loss: 2.4613
22:	[0s / 10s],		train_loss: 2.5089
46:	[0s / 33s],		train_loss: 2.4286
34:	[0s / 17s],		train_loss: 2.4604
23:	[0s / 11s],		train_loss: 2.4957
91:	[1s / 1m:41s],		train_loss: 2.3746
35:	[0s / 17s],		train_loss: 2.4544
47:	[0s / 34s],		train_loss: 2.4285
24:	[0s / 11s],		train_loss: 2.4852
36:	[0s / 18s],		train_loss: 2.4474
25:	[0s / 12s],		train_loss: 2.4945
48:	[0s / 35s],		train_loss: 2.4355
37:	[0s / 18s],		train_loss: 2.4581
26:	[0s / 12s],		train_loss: 2.4844
92:	[1s / 1m:43s],		train_loss: 2.3766
49:	[0s / 35s],		train_loss: 2.4387
27:	[0s / 13s],		train_loss: 2.4812
38:	[0s / 19s],		train_loss: 2.4530
28:	[0s / 13s],		train_loss: 2.4818
39:	[0s / 19s],		train_loss: 2.4475
50:	[0s / 36s],		train_loss: 2.4210
29:	[0s / 13s],		train_loss: 2.4720
93:	[1s / 1m:44s],		train_loss: 2.3704
40:	[0s / 20s],		train_loss: 2.4533
51:	[0s / 37s],		train_loss: 2.4185
30:	[0s / 14s],		train_loss: 2.4833
41:	[0s / 20s],		train_loss: 2.4547
31:	[0s / 14s],		train_loss: 2.4794
42:	[0s / 21s],		train_loss: 2.4495
52:	[0s / 38s],		train_loss: 2.4162
94:	[1s / 1m:45s],		train_loss: 2.3580
32:	[0s / 15s],		train_loss: 2.4843
43:	[0s / 21s],		train_loss: 2.4347
33:	[0s / 15s],		train_loss: 2.4785
53:	[0s / 38s],		train_loss: 2.4211
44:	[0s / 22s],		train_loss: 2.4501
34:	[0s / 16s],		train_loss: 2.4848
95:	[1s / 1m:46s],		train_loss: 2.3600
45:	[0s / 22s],		train_loss: 2.4282
54:	[0s / 39s],		train_loss: 2.4225
35:	[0s / 16s],		train_loss: 2.4738
46:	[0s / 23s],		train_loss: 2.4324
36:	[0s / 17s],		train_loss: 2.4767
55:	[0s / 40s],		train_loss: 2.4266
47:	[0s / 23s],		train_loss: 2.4257
96:	[1s / 1m:48s],		train_loss: 2.3650
37:	[0s / 17s],		train_loss: 2.4528
48:	[0s / 24s],		train_loss: 2.4262
56:	[0s / 40s],		train_loss: 2.4198
38:	[0s / 18s],		train_loss: 2.4557
49:	[0s / 24s],		train_loss: 2.4478
39:	[0s / 18s],		train_loss: 2.4649
57:	[0s / 41s],		train_loss: 2.4241
97:	[1s / 1m:49s],		train_loss: 2.3635
50:	[0s / 25s],		train_loss: 2.4479
40:	[0s / 19s],		train_loss: 2.4648
58:	[0s / 42s],		train_loss: 2.4138
51:	[0s / 25s],		train_loss: 2.4344
41:	[0s / 19s],		train_loss: 2.4593
52:	[0s / 26s],		train_loss: 2.4195
42:	[0s / 20s],		train_loss: 2.4605
98:	[1s / 1m:50s],		train_loss: 2.3519
59:	[0s / 43s],		train_loss: 2.4022
53:	[0s / 26s],		train_loss: 2.4202
43:	[0s / 20s],		train_loss: 2.4570
60:	[0s / 44s],		train_loss: 2.4096
54:	[0s / 27s],		train_loss: 2.4279
44:	[0s / 21s],		train_loss: 2.4530
99:	[1s / 1m:51s],		train_loss: 2.3692
45:	[0s / 21s],		train_loss: 2.4533
55:	[0s / 28s],		train_loss: 2.4199
61:	[0s / 44s],		train_loss: 2.4183
46:	[0s / 22s],		train_loss: 2.4570
56:	[0s / 28s],		train_loss: 2.4278
62:	[0s / 45s],		train_loss: 2.4143
47:	[0s / 22s],		train_loss: 2.4481
57:	[0s / 29s],		train_loss: 2.4325
0:	[1s / 1s],		train_loss: 3.6407
48:	[0s / 23s],		train_loss: 2.4572
63:	[0s / 46s],		train_loss: 2.4123
58:	[0s / 29s],		train_loss: 2.4264
49:	[0s / 23s],		train_loss: 2.4471
59:	[0s / 30s],		train_loss: 2.4269
64:	[0s / 47s],		train_loss: 2.4050
50:	[0s / 24s],		train_loss: 2.4439
60:	[0s / 30s],		train_loss: 2.4112
1:	[1s / 2s],		train_loss: 3.0293
51:	[0s / 24s],		train_loss: 2.4318
65:	[0s / 47s],		train_loss: 2.4153
61:	[0s / 31s],		train_loss: 2.4335
52:	[0s / 25s],		train_loss: 2.4444
62:	[0s / 31s],		train_loss: 2.4180
66:	[0s / 48s],		train_loss: 2.3945
2:	[1s / 3s],		train_loss: 2.8704
53:	[0s / 25s],		train_loss: 2.4373
63:	[0s / 32s],		train_loss: 2.4175
54:	[0s / 26s],		train_loss: 2.4320
67:	[0s / 49s],		train_loss: 2.3987
64:	[0s / 32s],		train_loss: 2.4029
55:	[0s / 26s],		train_loss: 2.4302
65:	[0s / 33s],		train_loss: 2.4258
68:	[0s / 49s],		train_loss: 2.3935
3:	[1s / 5s],		train_loss: 2.7838
56:	[0s / 27s],		train_loss: 2.4335
66:	[0s / 33s],		train_loss: 2.4082
69:	[0s / 50s],		train_loss: 2.4015
57:	[0s / 27s],		train_loss: 2.4420
67:	[0s / 33s],		train_loss: 2.4011
58:	[0s / 28s],		train_loss: 2.4414
70:	[0s / 51s],		train_loss: 2.4048
68:	[0s / 34s],		train_loss: 2.4141
4:	[1s / 6s],		train_loss: 2.7252
59:	[0s / 28s],		train_loss: 2.4354
69:	[0s / 34s],		train_loss: 2.4056
60:	[0s / 28s],		train_loss: 2.4209
71:	[0s / 51s],		train_loss: 2.4073
70:	[0s / 35s],		train_loss: 2.3980
61:	[0s / 29s],		train_loss: 2.4281
5:	[1s / 7s],		train_loss: 2.6780
71:	[0s / 35s],		train_loss: 2.4224
72:	[0s / 52s],		train_loss: 2.4109
62:	[0s / 29s],		train_loss: 2.4247
72:	[0s / 36s],		train_loss: 2.4049
63:	[0s / 30s],		train_loss: 2.4344
73:	[0s / 53s],		train_loss: 2.3976
73:	[0s / 36s],		train_loss: 2.4056
64:	[0s / 30s],		train_loss: 2.4245
6:	[1s / 9s],		train_loss: 2.6477
74:	[0s / 54s],		train_loss: 2.4056
74:	[0s / 37s],		train_loss: 2.4028
65:	[0s / 31s],		train_loss: 2.4240
75:	[0s / 37s],		train_loss: 2.3944
66:	[0s / 31s],		train_loss: 2.4304
75:	[0s / 54s],		train_loss: 2.3743
76:	[0s / 38s],		train_loss: 2.3945
7:	[1s / 10s],		train_loss: 2.6132
67:	[0s / 32s],		train_loss: 2.4231
76:	[0s / 55s],		train_loss: 2.3928
68:	[0s / 32s],		train_loss: 2.4265
77:	[0s / 38s],		train_loss: 2.3932
69:	[0s / 33s],		train_loss: 2.4163
78:	[0s / 39s],		train_loss: 2.3953
77:	[0s / 56s],		train_loss: 2.3931
8:	[1s / 11s],		train_loss: 2.5906
70:	[0s / 33s],		train_loss: 2.4107
79:	[0s / 39s],		train_loss: 2.3898
78:	[0s / 57s],		train_loss: 2.3960
71:	[0s / 34s],		train_loss: 2.4194
80:	[0s / 40s],		train_loss: 2.3990
72:	[0s / 34s],		train_loss: 2.4182
81:	[0s / 40s],		train_loss: 2.3896
9:	[1s / 12s],		train_loss: 2.5864
79:	[0s / 57s],		train_loss: 2.4063
73:	[0s / 35s],		train_loss: 2.4227
82:	[0s / 41s],		train_loss: 2.3917
80:	[0s / 58s],		train_loss: 2.3910
74:	[0s / 35s],		train_loss: 2.4304
83:	[0s / 41s],		train_loss: 2.3865
10:	[1s / 14s],		train_loss: 2.5731
75:	[0s / 36s],		train_loss: 2.4020
84:	[0s / 42s],		train_loss: 2.3888
81:	[0s / 59s],		train_loss: 2.3733
76:	[0s / 36s],		train_loss: 2.4208
85:	[0s / 42s],		train_loss: 2.3843
77:	[0s / 36s],		train_loss: 2.4187
82:	[0s / 59s],		train_loss: 2.3904
86:	[0s / 43s],		train_loss: 2.3817
11:	[1s / 15s],		train_loss: 2.5721
78:	[0s / 37s],		train_loss: 2.4041
83:	[0s / 1m:0s],		train_loss: 2.3754
87:	[0s / 43s],		train_loss: 2.3814
79:	[0s / 37s],		train_loss: 2.4147
88:	[0s / 44s],		train_loss: 2.3851
80:	[0s / 38s],		train_loss: 2.4038
84:	[0s / 1m:1s],		train_loss: 2.3779
89:	[0s / 44s],		train_loss: 2.3769
12:	[1s / 16s],		train_loss: 2.5493
81:	[0s / 38s],		train_loss: 2.4040
85:	[0s / 1m:1s],		train_loss: 2.3794
90:	[0s / 45s],		train_loss: 2.3851
82:	[0s / 39s],		train_loss: 2.4048
91:	[0s / 45s],		train_loss: 2.3859
83:	[0s / 39s],		train_loss: 2.3953
86:	[0s / 1m:2s],		train_loss: 2.3694
13:	[1s / 18s],		train_loss: 2.5440
92:	[0s / 46s],		train_loss: 2.3822
84:	[0s / 40s],		train_loss: 2.4055
87:	[0s / 1m:3s],		train_loss: 2.3864
93:	[0s / 46s],		train_loss: 2.3779
85:	[0s / 40s],		train_loss: 2.4111
94:	[0s / 47s],		train_loss: 2.3797
86:	[0s / 41s],		train_loss: 2.4016
88:	[0s / 1m:4s],		train_loss: 2.3716
14:	[1s / 19s],		train_loss: 2.5391
95:	[0s / 47s],		train_loss: 2.3796
87:	[0s / 41s],		train_loss: 2.4057
89:	[0s / 1m:4s],		train_loss: 2.3596
96:	[0s / 48s],		train_loss: 2.3759
88:	[0s / 41s],		train_loss: 2.4082
97:	[0s / 48s],		train_loss: 2.3764
89:	[0s / 42s],		train_loss: 2.3963
15:	[1s / 20s],		train_loss: 2.5411
90:	[0s / 1m:5s],		train_loss: 2.3846
98:	[0s / 49s],		train_loss: 2.3698
90:	[0s / 42s],		train_loss: 2.3847
91:	[0s / 1m:6s],		train_loss: 2.3663
91:	[0s / 43s],		train_loss: 2.3792
99:	[0s / 49s],		train_loss: 2.3757
16:	[1s / 21s],		train_loss: 2.5255
92:	[0s / 43s],		train_loss: 2.3950
0:	[0s / 0s],		train_loss: 3.6733
92:	[0s / 1m:7s],		train_loss: 2.3727
93:	[0s / 44s],		train_loss: 2.3885
1:	[0s / 0s],		train_loss: 3.0492
93:	[0s / 1m:7s],		train_loss: 2.3651
94:	[0s / 44s],		train_loss: 2.3979
2:	[0s / 1s],		train_loss: 2.8469
17:	[1s / 23s],		train_loss: 2.5322
95:	[0s / 45s],		train_loss: 2.3965
94:	[0s / 1m:8s],		train_loss: 2.3780
3:	[0s / 1s],		train_loss: 2.7525
96:	[0s / 45s],		train_loss: 2.3955
4:	[0s / 2s],		train_loss: 2.6736
97:	[0s / 46s],		train_loss: 2.3950
95:	[0s / 1m:9s],		train_loss: 2.3654
18:	[1s / 24s],		train_loss: 2.5161
5:	[0s / 2s],		train_loss: 2.6128
98:	[0s / 46s],		train_loss: 2.3830
96:	[0s / 1m:9s],		train_loss: 2.3642
6:	[0s / 3s],		train_loss: 2.6029
99:	[0s / 47s],		train_loss: 2.3905
7:	[0s / 3s],		train_loss: 2.5645
19:	[1s / 25s],		train_loss: 2.5243
97:	[0s / 1m:10s],		train_loss: 2.3800
0:	[0s / 0s],		train_loss: 3.8871
8:	[0s / 4s],		train_loss: 2.5508
1:	[0s / 0s],		train_loss: 2.9373
98:	[0s / 1m:11s],		train_loss: 2.3731
9:	[0s / 4s],		train_loss: 2.5493
2:	[0s / 1s],		train_loss: 2.7382
20:	[1s / 27s],		train_loss: 2.5057
10:	[0s / 5s],		train_loss: 2.5491
99:	[0s / 1m:12s],		train_loss: 2.3586
3:	[0s / 1s],		train_loss: 2.6615
11:	[0s / 6s],		train_loss: 2.5268
4:	[0s / 2s],		train_loss: 2.6281
0:	[0s / 0s],		train_loss: 4.1249
12:	[0s / 6s],		train_loss: 2.5218
5:	[0s / 2s],		train_loss: 2.5946
21:	[1s / 28s],		train_loss: 2.4967
13:	[0s / 7s],		train_loss: 2.5234
1:	[0s / 1s],		train_loss: 3.1872
6:	[0s / 3s],		train_loss: 2.5887
14:	[0s / 7s],		train_loss: 2.5070
7:	[0s / 3s],		train_loss: 2.5723
2:	[0s / 2s],		train_loss: 2.9384
22:	[1s / 29s],		train_loss: 2.5075
15:	[0s / 8s],		train_loss: 2.4976
8:	[0s / 4s],		train_loss: 2.5726
16:	[0s / 8s],		train_loss: 2.5112
9:	[0s / 4s],		train_loss: 2.5635
3:	[0s / 2s],		train_loss: 2.8017
17:	[0s / 8s],		train_loss: 2.4990
10:	[0s / 5s],		train_loss: 2.5473
4:	[0s / 3s],		train_loss: 2.7342
23:	[1s / 30s],		train_loss: 2.4929
11:	[0s / 5s],		train_loss: 2.5337
18:	[0s / 9s],		train_loss: 2.4981
5:	[0s / 4s],		train_loss: 2.7098
12:	[0s / 6s],		train_loss: 2.5421
19:	[0s / 9s],		train_loss: 2.4963
13:	[0s / 6s],		train_loss: 2.5280
20:	[0s / 10s],		train_loss: 2.4814
24:	[1s / 32s],		train_loss: 2.4923
6:	[0s / 4s],		train_loss: 2.6575
14:	[0s / 7s],		train_loss: 2.5254
21:	[0s / 10s],		train_loss: 2.5027
7:	[0s / 5s],		train_loss: 2.6383
15:	[0s / 7s],		train_loss: 2.5094
22:	[0s / 11s],		train_loss: 2.4886
16:	[0s / 7s],		train_loss: 2.5177
25:	[1s / 33s],		train_loss: 2.4853
23:	[0s / 11s],		train_loss: 2.4721
8:	[0s / 6s],		train_loss: 2.6303
17:	[0s / 8s],		train_loss: 2.5044
24:	[0s / 12s],		train_loss: 2.4750
9:	[0s / 6s],		train_loss: 2.6268
18:	[0s / 8s],		train_loss: 2.4900
25:	[0s / 12s],		train_loss: 2.4690
26:	[1s / 34s],		train_loss: 2.4906
19:	[0s / 9s],		train_loss: 2.4977
10:	[0s / 7s],		train_loss: 2.6073
26:	[0s / 13s],		train_loss: 2.4645
20:	[0s / 9s],		tr