[I 2026-06-28 07:17:51,717] Trial 90 finished with value: 0.7453920937222069 and parameters: {'num_nodes': [64], 'dropout': 0.22813083283408203, 'learning_rate': 0.0001367718823280039, 'batch_norm': True}. Best is trial 62 with value: 0.7726715122519704.
/scratch.hpc/luca.cotugno/Foundation_model_clinical_data/test_tabular_model.py:481: UserWarning: Choices for a categorical distribution should be a tuple of None, bool, int, float and str for persistent storage but contains [32] which is of type list.
  num_nodes  = trial.suggest_categorical("num_nodes", [[32], [64], [128], [64, 32], [128, 64]])
/scratch.hpc/luca.cotugno/Foundation_model_clinical_data/test_tabular_model.py:481: UserWarning: Choices for a categorical distribution should be a tuple of None, bool, int, float and str for persistent storage but contains [64] which is of type list.
  num_nodes  = trial.suggest_categorical("num_nodes", [[32], [64], [128], [64, 32], [128, 64]])
/scratch.hpc/luca.cotugno/Foundation_model_clinical_data/test_tabular_model.py:481: UserWarning: Choices for a categorical distribution should be a tuple of None, bool, int, float and str for persistent storage but contains [128] which is of type list.
  num_nodes  = trial.suggest_categorical("num_nodes", [[32], [64], [128], [64, 32], [128, 64]])
/scratch.hpc/luca.cotugno/Foundation_model_clinical_data/test_tabular_model.py:481: UserWarning: Choices for a categorical distribution should be a tuple of None, bool, int, float and str for persistent storage but contains [64, 32] which is of type list.
  num_nodes  = trial.suggest_categorical("num_nodes", [[32], [64], [128], [64, 32], [128, 64]])
/scratch.hpc/luca.cotugno/Foundation_model_clinical_data/test_tabular_model.py:481: UserWarning: Choices for a categorical distribution should be a tuple of None, bool, int, float and str for persistent storage but contains [128, 64] which is of type list.
  num_nodes  = trial.suggest_categorical("num_nodes", [[32], [64], [128], [64, 32], [128, 64]])

82:	[0s / 10s],		train_loss: 4.1273
68:	[0s / 9s],		train_loss: 4.2979
85:	[0s / 15s],		train_loss: 4.1701
83:	[0s / 10s],		train_loss: 4.1134
55:	[0s / 33s],		train_loss: 4.2417
69:	[0s / 9s],		train_loss: 4.2789
20:	[0s / 6s],		train_loss: 4.2694
84:	[0s / 11s],		train_loss: 4.1255
86:	[0s / 15s],		train_loss: 4.1754
70:	[0s / 9s],		train_loss: 4.2810
85:	[0s / 11s],		train_loss: 4.1047
87:	[0s / 16s],		train_loss: 4.1818
71:	[0s / 9s],		train_loss: 4.2609
86:	[0s / 11s],		train_loss: 4.1361
72:	[0s / 9s],		train_loss: 4.2803
21:	[0s / 7s],		train_loss: 4.2815
87:	[0s / 11s],		train_loss: 4.1017
57:	[0s / 1m:4s],		train_loss: 4.2437
88:	[0s / 16s],		train_loss: 4.1524
43:	[2s / 1m:33s],		train_loss: 4.2169
56:	[0s / 34s],		train_loss: 4.2451
73:	[0s / 10s],		train_loss: 4.2571
88:	[0s / 11s],		train_loss: 4.0936
89:	[0s / 16s],		train_loss: 4.1789
74:	[0s / 10s],		train_loss: 4.2721
89:	[0s / 11s],		train_loss: 4.1037
22:	[0s / 7s],		train_loss: 4.2715
75:	[0s / 10s],		train_loss: 4.2560
90:	[0s / 11s],		train_loss: 4.1368
90:	[0s / 16s],		train_loss: 4.1443
91:	[0s / 11s],		train_loss: 4.1317
76:	[0s / 10s],		train_loss: 4.2630
91:	[0s / 16s],		train_loss: 4.1449
92:	[0s / 11s],		train_loss: 4.1302
77:	[0s / 10s],		train_loss: 4.2691
57:	[0s / 34s],		train_loss: 4.2172
23:	[0s / 7s],		train_loss: 4.2751
92:	[0s / 16s],		train_loss: 4.1300
93:	[0s / 12s],		train_loss: 4.1042
78:	[0s / 10s],		train_loss: 4.2473
94:	[0s / 12s],		train_loss: 4.1200
93:	[0s / 17s],		train_loss: 4.1334
79:	[0s / 10s],		train_loss: 4.2476
24:	[0s / 8s],		train_loss: 4.2613
95:	[0s / 12s],		train_loss: 4.1208
80:	[0s / 11s],		train_loss: 4.2549
94:	[0s / 17s],		train_loss: 4.1838
58:	[1s / 1m:5s],		train_loss: 4.2667
96:	[0s / 12s],		train_loss: 4.1248
81:	[0s / 11s],		train_loss: 4.2724
58:	[0s / 35s],		train_loss: 4.2011
97:	[0s / 12s],		train_loss: 4.0727
95:	[0s / 17s],		train_loss: 4.1921
82:	[0s / 11s],		train_loss: 4.2598
25:	[0s / 8s],		train_loss: 4.2413
98:	[0s / 12s],		train_loss: 4.1201
83:	[0s / 11s],		train_loss: 4.2669
96:	[0s / 17s],		train_loss: 4.1783
99:	[0s / 12s],		train_loss: 4.1409
84:	[0s / 11s],		train_loss: 4.2467
97:	[0s / 17s],		train_loss: 4.1574
26:	[0s / 8s],		train_loss: 4.2174
85:	[0s / 11s],		train_loss: 4.2704
0:	[0s / 0s],		train_loss: 4.8024
59:	[0s / 35s],		train_loss: 4.2392
98:	[0s / 18s],		train_loss: 4.1660
86:	[0s / 11s],		train_loss: 4.2536
1:	[0s / 0s],		train_loss: 4.5536
27:	[0s / 9s],		train_loss: 4.2764
2:	[0s / 0s],		train_loss: 4.5449
87:	[0s / 12s],		train_loss: 4.2704
99:	[0s / 18s],		train_loss: 4.1506
44:	[2s / 1m:35s],		train_loss: 4.1840
3:	[0s / 0s],		train_loss: 4.4960
88:	[0s / 12s],		train_loss: 4.2737
59:	[1s / 1m:6s],		train_loss: 4.2674
60:	[0s / 36s],		train_loss: 4.2390
4:	[0s / 0s],		train_loss: 4.4813
28:	[0s / 9s],		train_loss: 4.2315
89:	[0s / 12s],		train_loss: 4.2247
0:	[0s / 0s],		train_loss: 4.7136
5:	[0s / 0s],		train_loss: 4.4636
90:	[0s / 12s],		train_loss: 4.2683
1:	[0s / 0s],		train_loss: 4.5415
6:	[0s / 0s],		train_loss: 4.4223
91:	[0s / 12s],		train_loss: 4.2584
29:	[0s / 9s],		train_loss: 4.2344
7:	[0s / 1s],		train_loss: 4.4160
2:	[0s / 0s],		train_loss: 4.4677
92:	[0s / 12s],		train_loss: 4.2369
61:	[0s / 36s],		train_loss: 4.2036
8:	[0s / 1s],		train_loss: 4.3925
93:	[0s / 12s],		train_loss: 4.2563
3:	[0s / 0s],		train_loss: 4.4298
30:	[0s / 10s],		train_loss: 4.2298
9:	[0s / 1s],		train_loss: 4.3774
94:	[0s / 13s],		train_loss: 4.2576
4:	[0s / 0s],		train_loss: 4.4021
10:	[0s / 1s],		train_loss: 4.3720
95:	[0s / 13s],		train_loss: 4.2455
11:	[0s / 1s],		train_loss: 4.3780
31:	[0s / 10s],		train_loss: 4.1988
79:	[4s / 4m:53s],		train_loss: 3.4516
5:	[0s / 1s],		train_loss: 4.3895
96:	[0s / 13s],		train_loss: 4.2558
60:	[1s / 1m:7s],		train_loss: 4.2766
12:	[0s / 1s],		train_loss: 4.3892
62:	[0s / 37s],		train_loss: 4.2095
97:	[0s / 13s],		train_loss: 4.2549
6:	[0s / 1s],		train_loss: 4.3458
13:	[0s / 1s],		train_loss: 4.3544
98:	[0s / 13s],		train_loss: 4.2466
32:	[0s / 10s],		train_loss: 4.1791
14:	[0s / 1s],		train_loss: 4.3575
7:	[0s / 1s],		train_loss: 4.3457
99:	[0s / 13s],		train_loss: 4.2650
15:	[0s / 2s],		train_loss: 4.3256
8:	[0s / 1s],		train_loss: 4.3423
33:	[0s / 10s],		train_loss: 4.1842
63:	[0s / 37s],		train_loss: 4.2456
16:	[0s / 2s],		train_loss: 4.3323
0:	[0s / 0s],		train_loss: 4.5597
9:	[0s / 1s],		train_loss: 4.3315
17:	[0s / 2s],		train_loss: 4.3220
1:	[0s / 0s],		train_loss: 4.4201
34:	[0s / 11s],		train_loss: 4.1902
10:	[0s / 1s],		train_loss: 4.3071
18:	[0s / 2s],		train_loss: 4.3175
61:	[0s / 1m:8s],		train_loss: 4.2364
2:	[0s / 0s],		train_loss: 4.3909
19:	[0s / 2s],		train_loss: 4.3242
45:	[2s / 1m:37s],		train_loss: 4.1886
3:	[0s / 0s],		train_loss: 4.3951
11:	[0s / 2s],		train_loss: 4.2879
20:	[0s / 2s],		train_loss: 4.3099
4:	[0s / 0s],		train_loss: 4.3929
35:	[0s / 11s],		train_loss: 4.2208
21:	[0s / 2s],		train_loss: 4.2929
64:	[0s / 38s],		train_loss: 4.2077
12:	[0s / 2s],		train_loss: 4.3007
5:	[0s / 0s],		train_loss: 4.3809
22:	[0s / 2s],		train_loss: 4.3009
13:	[0s / 2s],		train_loss: 4.2938
6:	[0s / 0s],		train_loss: 4.3810
23:	[0s / 3s],		train_loss: 4.2766
36:	[0s / 12s],		train_loss: 4.2038
7:	[0s / 1s],		train_loss: 4.3322
14:	[0s / 2s],		train_loss: 4.2477
24:	[0s / 3s],		train_loss: 4.3034
8:	[0s / 1s],		train_loss: 4.3275
25:	[0s / 3s],		train_loss: 4.2938
15:	[0s / 2s],		train_loss: 4.2869
9:	[0s / 1s],		train_loss: 4.3753
37:	[0s / 12s],		train_loss: 4.2068
65:	[0s / 39s],		train_loss: 4.2008
26:	[0s / 3s],		train_loss: 4.3001
16:	[0s / 3s],		train_loss: 4.2696
10:	[0s / 1s],		train_loss: 4.3553
27:	[0s / 3s],		train_loss: 4.2827
62:	[1s / 1m:9s],		train_loss: 4.2196
17:	[0s / 3s],		train_loss: 4.2686
11:	[0s / 1s],		train_loss: 4.3475
28:	[0s / 3s],		train_loss: 4.2973
38:	[0s / 12s],		train_loss: 4.2090
12:	[0s / 1s],		train_loss: 4.3348
29:	[0s / 3s],		train_loss: 4.2788
18:	[0s / 3s],		train_loss: 4.2407
13:	[0s / 1s],		train_loss: 4.2996
30:	[0s / 4s],		train_loss: 4.2593
66:	[0s / 39s],		train_loss: 4.2393
19:	[0s / 3s],		train_loss: 4.2054
31:	[0s / 4s],		train_loss: 4.2842
14:	[0s / 2s],		train_loss: 4.3195
39:	[0s / 13s],		train_loss: 4.2041
20:	[0s / 3s],		train_loss: 4.2178
32:	[0s / 4s],		train_loss: 4.2580
15:	[0s / 2s],		train_loss: 4.3336
33:	[0s / 4s],		train_loss: 4.2695
16:	[0s / 2s],		train_loss: 4.3219
21:	[0s / 3s],		train_loss: 4.2225
40:	[0s / 13s],		train_loss: 4.2066
34:	[0s / 4s],		train_loss: 4.2391
17:	[0s / 2s],		train_loss: 4.3242
22:	[0s / 4s],		train_loss: 4.2039
35:	[0s / 4s],		train_loss: 4.2531
18:	[0s / 2s],		train_loss: 4.3089
67:	[0s / 40s],		train_loss: 4.2249
23:	[0s / 4s],		train_loss: 4.1680
36:	[0s / 4s],		train_loss: 4.2432
63:	[1s / 1m:11s],		train_loss: 4.2445
46:	[2s / 1m:39s],		train_loss: 4.1898
19:	[0s / 2s],		train_loss: 4.3086
41:	[0s / 13s],		train_loss: 4.1898
80:	[3s / 4m:56s],		train_loss: 3.4663
37:	[0s / 5s],		train_loss: 4.2439
24:	[0s / 4s],		train_loss: 4.1484
20:	[0s / 2s],		train_loss: 4.2995
38:	[0s / 5s],		train_loss: 4.2318
21:	[0s / 3s],		train_loss: 4.2980
25:	[0s / 4s],		train_loss: 4.1543
42:	[0s / 14s],		train_loss: 4.1808
39:	[0s / 5s],		train_loss: 4.2365
22:	[0s / 3s],		train_loss: 4.3013
26:	[0s / 4s],		train_loss: 4.1577
40:	[0s / 5s],		train_loss: 4.2569
68:	[0s / 41s],		train_loss: 4.1914
23:	[0s / 3s],		train_loss: 4.2735
41:	[0s / 5s],		train_loss: 4.2396
27:	[0s / 5s],		train_loss: 4.1320
43:	[0s / 14s],		train_loss: 4.1612
24:	[0s / 3s],		train_loss: 4.2843
42:	[0s / 5s],		train_loss: 4.2421
25:	[0s / 3s],		train_loss: 4.3312
28:	[0s / 5s],		train_loss: 4.1246
43:	[0s / 5s],		train_loss: 4.2026
26:	[0s / 3s],		train_loss: 4.2991
44:	[0s / 14s],		train_loss: 4.1469
29:	[0s / 5s],		train_loss: 4.1152
44:	[0s / 5s],		train_loss: 4.2208
27:	[0s / 3s],		train_loss: 4.2690
69:	[0s / 41s],		train_loss: 4.1981
45:	[0s / 6s],		train_loss: 4.1942
30:	[0s / 5s],		train_loss: 4.0776
28:	[0s / 4s],		train_loss: 4.2892
64:	[1s / 1m:12s],		train_loss: 4.2389
46:	[0s / 6s],		train_loss: 4.1954
45:	[0s / 15s],		train_loss: 4.1324
29:	[0s / 4s],		train_loss: 4.2710
31:	[0s / 5s],		train_loss: 4.0929
47:	[0s / 6s],		train_loss: 4.2307
30:	[0s / 4s],		train_loss: 4.3033
48:	[0s / 6s],		train_loss: 4.1761
32:	[0s / 5s],		train_loss: 4.0667
46:	[0s / 15s],		train_loss: 4.1157
31:	[0s / 4s],		train_loss: 4.2607
49:	[0s / 6s],		train_loss: 4.2111
70:	[0s / 42s],		train_loss: 4.2137
33:	[0s / 6s],		train_loss: 4.0783
32:	[0s / 4s],		train_loss: 4.3091
50:	[0s / 6s],		train_loss: 4.2002
33:	[0s / 4s],		train_loss: 4.2664
51:	[0s / 6s],		train_loss: 4.2049
34:	[0s / 6s],		train_loss: 4.0453
47:	[0s / 15s],		train_loss: 4.1506
52:	[0s / 7s],		train_loss: 4.1898
34:	[0s / 4s],		train_loss: 4.2774
47:	[2s / 1m:41s],		train_loss: 4.1655
35:	[0s / 6s],		train_loss: 4.0464
53:	[0s / 7s],		train_loss: 4.2003
35:	[0s / 5s],		train_loss: 4.2231
71:	[0s / 42s],		train_loss: 4.1977
48:	[0s / 16s],		train_loss: 4.1357
36:	[0s / 6s],		train_loss: 4.0296
65:	[1s / 1m:13s],		train_loss: 4.2377
54:	[0s / 7s],		train_loss: 4.1738
36:	[0s / 5s],		train_loss: 4.2302
37:	[0s / 6s],		train_loss: 3.9988
55:	[0s / 7s],		train_loss: 4.1929
37:	[0s / 5s],		train_loss: 4.2463
56:	[0s / 7s],		train_loss: 4.1907
38:	[0s / 5s],		train_loss: 4.2232
49:	[0s / 16s],		train_loss: 4.1068
38:	[0s / 7s],		train_loss: 4.0016
57:	[0s / 7s],		train_loss: 4.1638
39:	[0s / 5s],		train_loss: 4.2410
39:	[0s / 7s],		train_loss: 3.9964
58:	[0s / 7s],		train_loss: 4.1535
72:	[0s / 43s],		train_loss: 4.2036
40:	[0s / 5s],		train_loss: 4.2646
59:	[0s / 8s],		train_loss: 4.1467
50:	[0s / 16s],		train_loss: 4.1191
41:	[0s / 5s],		train_loss: 4.2626
40:	[0s / 7s],		train_loss: 3.9951
60:	[0s / 8s],		train_loss: 4.1397
42:	[0s / 6s],		train_loss: 4.2343
41:	[0s / 7s],		train_loss: 3.9635
61:	[0s / 8s],		train_loss: 4.1231
43:	[0s / 6s],		train_loss: 4.2554
51:	[0s / 17s],		train_loss: 4.1126
66:	[0s / 1m:14s],		train_loss: 4.2433
62:	[0s / 8s],		train_loss: 4.1437
42:	[0s / 7s],		train_loss: 3.9705
44:	[0s / 6s],		train_loss: 4.2479
73:	[0s / 44s],		train_loss: 4.1857
63:	[0s / 8s],		train_loss: 4.1613
45:	[0s / 6s],		train_loss: 4.2211
43:	[0s / 8s],		train_loss: 3.9494
64:	[0s / 8s],		train_loss: 4.1743
52:	[0s / 17s],		train_loss: 4.0754
46:	[0s / 6s],		train_loss: 4.2456
65:	[0s / 8s],		train_loss: 4.1578
44:	[0s / 8s],		train_loss: 3.9670
47:	[0s / 6s],		train_loss: 4.2379
81:	[3s / 5m:0s],		train_loss: 3.4108
66:	[0s / 8s],		train_loss: 4.1686
45:	[0s / 8s],		train_loss: 3.9215
48:	[0s / 6s],		train_loss: 4.1972
67:	[0s / 8s],		train_loss: 4.1423
74:	[0s / 44s],		train_loss: 4.2301
53:	[0s / 17s],		train_loss: 4.1039
49:	[0s / 6s],		train_loss: 4.2388
68:	[0s / 9s],		train_loss: 4.1297
46:	[0s / 8s],		train_loss: 3.9304
48:	[2s / 1m:43s],		train_loss: 4.1851
50:	[0s / 7s],		train_loss: 4.2520
69:	[0s / 9s],		train_loss: 4.1060
67:	[0s / 1m:15s],		train_loss: 4.2046
47:	[0s / 8s],		train_loss: 3.9337
54:	[0s / 18s],		train_loss: 4.0870
51:	[0s / 7s],		train_loss: 4.2621
70:	[0s / 9s],		train_loss: 4.0970
52:	[0s / 7s],		train_loss: 4.2502
71:	[0s / 9s],		train_loss: 4.1279
48:	[0s / 8s],		train_loss: 3.9640
53:	[0s / 7s],		train_loss: 4.2396
75:	[0s / 45s],		train_loss: 4.2007
72:	[0s / 9s],		train_loss: 4.1336
55:	[0s / 18s],		train_loss: 4.0970
49:	[0s / 9s],		train_loss: 3.9213
54:	[0s / 7s],		train_loss: 4.2326
73:	[0s / 9s],		train_loss: 4.0790
55:	[0s / 7s],		train_loss: 4.2431
74:	[0s / 9s],		train_loss: 4.0824
50:	[0s / 9s],		train_loss: 3.9065
56:	[0s / 7s],		train_loss: 4.2366
75:	[0s / 9s],		train_loss: 4.1353
56:	[0s / 18s],		train_loss: 4.0517
51:	[0s / 9s],		train_loss: 3.8540
57:	[0s / 7s],		train_loss: 4.3126
76:	[0s / 10s],		train_loss: 4.1196
76:	[0s / 45s],		train_loss: 4.1973
77:	[0s / 10s],		train_loss: 4.0721
52:	[0s / 9s],		train_loss: 3.9146
58:	[0s / 8s],		train_loss: 4.2827
57:	[0s / 19s],		train_loss: 4.0601
78:	[0s / 10s],		train_loss: 4.0822
59:	[0s / 8s],		train_loss: 4.2635
53:	[0s / 9s],		train_loss: 3.9109
79:	[0s / 10s],		train_loss: 4.0743
68:	[1s / 1m:16s],		train_loss: 4.2394
60:	[0s / 8s],		train_loss: 4.2690
54:	[0s / 9s],		train_loss: 3.9124
80:	[0s / 10s],		train_loss: 4.0480
58:	[0s / 19s],		train_loss: 4.1073
61:	[0s / 8s],		train_loss: 4.2911
81:	[0s / 10s],		train_loss: 4.0822
55:	[0s / 10s],		train_loss: 3.8595
77:	[0s / 46s],		train_loss: 4.2137
62:	[0s / 8s],		train_loss: 4.2728
82:	[0s / 10s],		train_loss: 4.0632
63:	[0s / 8s],		train_loss: 4.2982
59:	[0s / 19s],		train_loss: 4.0706
56:	[0s / 10s],		train_loss: 3.8661
83:	[0s / 11s],		train_loss: 4.0899
64:	[0s / 8s],		train_loss: 4.2745
84:	[0s / 11s],		train_loss: 4.0783
57:	[0s / 10s],		train_loss: 3.8502
65:	[0s / 9s],		train_loss: 4.3052
60:	[0s / 20s],		train_loss: 4.0657
85:	[0s / 11s],		train_loss: 4.0651
66:	[0s / 9s],		train_loss: 4.3002
58:	[0s / 10s],		train_loss: 3.8175
78:	[0s / 47s],		train_loss: 4.1833
86:	[0s / 11s],		train_loss: 4.0449
49:	[2s / 1m:46s],		train_loss: 4.1960
67:	[0s / 9s],		train_loss: 4.2780
59:	[0s / 10s],		train_loss: 3.8309
87:	[0s / 11s],		train_loss: 4.0895
61:	[0s / 20s],		train_loss: 4.0669
69:	[1s / 1m:17s],		train_loss: 4.2263
68:	[0s / 9s],		train_loss: 4.2761
88:	[0s / 11s],		train_loss: 4.0228
60:	[0s / 11s],		train_loss: 3.8562
69:	[0s / 9s],		train_loss: 4.2561
89:	[0s / 11s],		train_loss: 4.0194
62:	[0s / 20s],		train_loss: 4.0635
61:	[0s / 11s],		train_loss: 3.8646
70:	[0s / 9s],		train_loss: 4.2729
90:	[0s / 11s],		train_loss: 4.0560
79:	[0s / 47s],		train_loss: 4.1780
71:	[0s / 9s],		train_loss: 4.2660
62:	[0s / 11s],		train_loss: 3.8627
91:	[0s / 12s],		train_loss: 4.0268
72:	[0s / 10s],		train_loss: 4.2380
63:	[0s / 20s],		train_loss: 4.0857
92:	[0s / 12s],		train_loss: 4.0174
63:	[0s / 11s],		train_loss: 3.8586
73:	[0s / 10s],		train_loss: 4.2789
93:	[0s / 12s],		train_loss: 4.0195
64:	[0s / 11s],		train_loss: 3.8620
74:	[0s / 10s],		train_loss: 4.2699
94:	[0s / 12s],		train_loss: 4.0274
64:	[0s / 21s],		train_loss: 4.0701
65:	[0s / 11s],		train_loss: 3.8179
75:	[0s / 10s],		train_loss: 4.2818
80:	[0s / 48s],		train_loss: 4.2079
95:	[0s / 12s],		train_loss: 4.0370
76:	[0s / 10s],		train_loss: 4.2834
96:	[0s / 12s],		train_loss: 4.0274
66:	[0s / 12s],		train_loss: 3.8281
70:	[1s / 1m:18s],		train_loss: 4.2310
77:	[0s / 10s],		train_loss: 4.2411
97:	[0s / 12s],		train_loss: 4.0273
67:	[0s / 12s],		train_loss: 3.7770
65:	[0s / 21s],		train_loss: 4.0176
78:	[0s / 10s],		train_loss: 4.2632
98:	[0s / 12s],		train_loss: 4.0452
68:	[0s / 12s],		train_loss: 3.7777
99:	[0s / 13s],		train_loss: 3.9934
79:	[0s / 10s],		train_loss: 4.2575
82:	[4s / 5m:4s],		train_loss: 3.4297
81:	[0s / 48s],		train_loss: 4.1635
80:	[0s / 11s],		train_loss: 4.2488
69:	[0s / 12s],		train_loss: 3.8019
66:	[0s / 22s],		train_loss: 4.0225
50:	[1s / 1m:47s],		train_loss: 4.1932
81:	[0s / 11s],		train_loss: 4.2683
0:	[0s / 0s],		train_loss: 4.6054
70:	[0s / 12s],		train_loss: 3.7954
1:	[0s / 0s],		train_loss: 4.4234
82:	[0s / 11s],		train_loss: 4.2869
67:	[0s / 22s],		train_loss: 3.9980
71:	[0s / 12s],		train_loss: 3.8065
2:	[0s / 0s],		train_loss: 4.4093
83:	[0s / 11s],		train_loss: 4.2776
71:	[0s / 1m:19s],		train_loss: 4.2219
72:	[0s / 13s],		train_loss: 3.7522
3:	[0s / 0s],		train_loss: 4.4086
84:	[0s / 11s],		train_loss: 4.2446
68:	[0s / 22s],		train_loss: 4.0164
82:	[0s / 49s],		train_loss: 4.1522
4:	[0s / 0s],		train_loss: 4.4051
85:	[0s / 11s],		train_loss: 4.2675
73:	[0s / 13s],		train_loss: 3.7629
5:	[0s / 0s],		train_loss: 4.3763
86:	[0s / 11s],		train_loss: 4.2411
74:	[0s / 13s],		train_loss: 3.7701
6:	[0s / 0s],		train_loss: 4.3856
69:	[0s / 22s],		train_loss: 4.0014
87:	[0s / 12s],		train_loss: 4.2375
75:	[0s / 13s],		train_loss: 3.7575
7:	[0s / 1s],		train_loss: 4.3653
88:	[0s / 12s],		train_loss: 4.2400
8:	[0s / 1s],		train_loss: 4.3526
83:	[0s / 50s],		train_loss: 4.1616
76:	[0s / 13s],		train_loss: 3.7379
89:	[0s / 12s],		train_loss: 4.2684
70:	[0s / 23s],		train_loss: 4.0128
9:	[0s / 1s],		train_loss: 4.3759
90:	[0s / 12s],		train_loss: 4.2466
10:	[0s / 1s],		train_loss: 4.3366
77:	[0s / 14s],		train_loss: 3.6843
91:	[0s / 12s],		train_loss: 4.2468
11:	[0s / 1s],		train_loss: 4.3511
71:	[0s / 23s],		train_loss: 4.0274
92:	[0s / 12s],		train_loss: 4.2407
78:	[0s / 14s],		train_loss: 3.6900
12:	[0s / 1s],		train_loss: 4.3363
72:	[1s / 1m:21s],		train_loss: 4.2576
93:	[0s / 12s],		train_loss: 4.2352
79:	[0s / 14s],		train_loss: 3.6795
13:	[0s / 1s],		train_loss: 4.3425
84:	[0s / 50s],		train_loss: 4.2510
94:	[0s / 12s],		train_loss: 4.2452
14:	[0s / 1s],		train_loss: 4.3461
72:	[0s / 24s],		train_loss: 4.0358
80:	[0s / 14s],		train_loss: 3.7114
95:	[0s / 13s],		train_loss: 4.2468
15:	[0s / 2s],		train_loss: 4.3542
96:	[0s / 13s],		train_loss: 4.2233
81:	[0s / 14s],		train_loss: 3.7127
16:	[0s / 2s],		train_loss: 4.3264
97:	[0s / 13s],		train_loss: 4.2379
73:	[0s / 24s],		train_loss: 4.0195
17:	[0s / 2s],		train_loss: 4.3419
82:	[0s / 14s],		train_loss: 3.6664
98:	[0s / 13s],		train_loss: 4.2126
18:	[0s / 2s],		train_loss: 4.3072
83:	[0s / 15s],		train_loss: 3.6718
99:	[0s / 13s],		train_loss: 4.2408
85:	[0s / 51s],		train_loss: 4.2331
51:	[2s / 1m:50s],		train_loss: 4.1932
19:	[0s / 2s],		train_loss: 4.2988
74:	[0s / 24s],		train_loss: 4.0351
84:	[0s / 15s],		train_loss: 3.6717
20:	[0s / 2s],		train_loss: 4.3096
0:	[0s / 0s],		train_loss: 4.8105
21:	[0s / 2s],		train_loss: 4.3183
85:	[0s / 15s],		train_loss: 3.7108
1:	[0s / 0s],		train_loss: 4.6283
73:	[1s / 1m:22s],		train_loss: 4.2112
22:	[0s / 2s],		train_loss: 4.3141
75:	[0s / 25s],		train_loss: 4.0295
2:	[0s / 0s],		train_loss: 4.5866
86:	[0s / 15s],		train_loss: 3.6978
23:	[0s / 3s],		train_loss: 4.3299
86:	[0s / 52s],		train_loss: 4.2293
3:	[0s / 0s],		train_loss: 4.5407
24:	[0s / 3s],		train_loss: 4.2965
87:	[0s / 15s],		train_loss: 3.6905
4:	[0s / 0s],		train_loss: 4.5077
76:	[0s / 25s],		train_loss: 4.0150
25:	[0s / 3s],		train_loss: 4.2836
88:	[0s / 16s],		train_loss: 3.6564
5:	[0s / 0s],		train_loss: 4.4969
26:	[0s / 3s],		train_loss: 4.3132
6:	[0s / 0s],		train_loss: 4.5182
89:	[0s / 16s],		train_loss: 3.6647
27:	[0s / 3s],		train_loss: 4.2759
77:	[0s / 25s],		train_loss: 4.0108
7:	[0s / 1s],		train_loss: 4.4389
28:	[0s / 3s],		train_loss: 4.2711
90:	[0s / 16s],		train_loss: 3.6998
87:	[0s / 52s],		train_loss: 4.1919
8:	[0s / 1s],		train_loss: 4.4354
29:	[0s / 3s],		train_loss: 4.2845
83:	[3s / 5m:8s],		train_loss: 3.4007
91:	[0s / 16s],		train_loss: 3.6708
9:	[0s / 1s],		train_loss: 4.4591
30:	[0s / 3s],		train_loss: 4.2820
78:	[0s / 26s],		train_loss: 4.0167
74:	[1s / 1m:23s],		train_loss: 4.2570
10:	[0s / 1s],		train_loss: 4.4159
92:	[0s / 16s],		train_loss: 3.6768
31:	[0s / 4s],		train_loss: 4.2636
11:	[0s / 1s],		train_loss: 4.3976
32:	[0s / 4s],		train_loss: 4.2429
93:	[0s / 16s],		train_loss: 3.6566
79:	[0s / 26s],		train_loss: 3.9989
12:	[0s / 1s],		train_loss: 4.4213
33:	[0s / 4s],		train_loss: 4.2753
88:	[0s / 53s],		train_loss: 4.2046
94:	[0s / 17s],		train_loss: 3.6230
13:	[0s / 1s],		train_loss: 4.4061
34:	[0s / 4s],		train_loss: 4.3089
95:	[0s / 17s],		train_loss: 3.6658
14:	[0s / 1s],		train_loss: 4.3795
35:	[0s / 4s],		train_loss: 4.2605
80:	[0s / 26s],		train_loss: 3.9689
15:	[0s / 2s],		train_loss: 4.3964
36:	[0s / 4s],		train_loss: 4.2692
52:	[2s / 1m:52s],		train_loss: 4.1819
96:	[0s / 17s],		train_loss: 3.6365
16:	[0s / 2s],		train_loss: 4.3695
37:	[0s / 4s],		train_loss: 4.2737
97:	[0s / 17s],		train_loss: 3.6073
89:	[0s / 53s],		train_loss: 4.2102
17:	[0s / 2s],		train_loss: 4.3985
81:	[0s / 26s],		train_loss: 3.9515
38:	[0s / 4s],		train_loss: 4.2743
98:	[0s / 17s],		train_loss: 3.6014
39:	[0s / 5s],		train_loss: 4.2589
18:	[0s / 2s],		train_loss: 4.3783
75:	[1s / 1m:24s],		train_loss: 4.2245
40:	[0s / 5s],		train_loss: 4.2314
19:	[0s / 2s],		train_loss: 4.3728
99:	[0s / 17s],		train_loss: 3.6051
82:	[0s / 27s],		train_loss: 3.9725
41:	[0s / 5s],		train_loss: 4.2390
20:	[0s / 2s],		train_loss: 4.3814
90:	[0s / 54s],		train_loss: 4.2487
42:	[0s / 5s],		train_loss: 4.2434
2