[I 2026-06-07 00:01:26,425] Trial 21 finished with value: 0.7995213164111016 and parameters: {'num_nodes': [64, 32], 'dropout': 0.16856416891245335, 'learning_rate': 0.00022511472250644923, 'batch_norm': False}. Best is trial 13 with value: 0.8124644084489007.
/scratch.hpc/luca.cotugno/Foundation_model_clinical_data/test_tabular_model_tmp.py:476: UserWarning: Choices for a categorical distribution should be a tuple of None, bool, int, float and str for persistent storage but contains [32] which is of type list.
  num_nodes  = trial.suggest_categorical("num_nodes", [[32], [64], [128], [64, 32], [128, 64]])
/scratch.hpc/luca.cotugno/Foundation_model_clinical_data/test_tabular_model_tmp.py:476: UserWarning: Choices for a categorical distribution should be a tuple of None, bool, int, float and str for persistent storage but contains [64] which is of type list.
  num_nodes  = trial.suggest_categorical("num_nodes", [[32], [64], [128], [64, 32], [128, 64]])
/scratch.hpc/luca.cotugno/Foundation_model_clinical_data/test_tabular_model_tmp.py:476: UserWarning: Choices for a categorical distribution should be a tuple of None, bool, int, float and str for persistent storage but contains [128] which is of type list.
  num_nodes  = trial.suggest_categorical("num_nodes", [[32], [64], [128], [64, 32], [128, 64]])
/scratch.hpc/luca.cotugno/Foundation_model_clinical_data/test_tabular_model_tmp.py:476: UserWarning: Choices for a categorical distribution should be a tuple of None, bool, int, float and str for persistent storage but contains [64, 32] which is of type list.
  num_nodes  = trial.suggest_categorical("num_nodes", [[32], [64], [128], [64, 32], [128, 64]])
/scratch.hpc/luca.cotugno/Foundation_model_clinical_data/test_tabular_model_tmp.py:476: UserWarning: Choices for a categorical distribution should be a tuple of None, bool, int, float and str for persistent storage but contains [128, 64] which is of type list.
  num_nodes  = trial.suggest_categorical("num_nodes", [[32], [64], [128], [64, 32], [128, 64]])

67:	[0s / 1m:3s],		train_loss: 2.5548
30:	[0s / 13s],		train_loss: 2.4544
35:	[0s / 13s],		train_loss: 2.5092
31:	[0s / 13s],		train_loss: 2.4488
17:	[0s / 10s],		train_loss: 2.5465
36:	[0s / 14s],		train_loss: 2.5055
32:	[0s / 14s],		train_loss: 2.4466
68:	[0s / 1m:3s],		train_loss: 2.5512
37:	[0s / 14s],		train_loss: 2.5054
18:	[0s / 11s],		train_loss: 2.5415
33:	[0s / 14s],		train_loss: 2.4578
38:	[0s / 15s],		train_loss: 2.5093
19:	[0s / 11s],		train_loss: 2.5392
34:	[0s / 15s],		train_loss: 2.4477
39:	[0s / 15s],		train_loss: 2.5022
69:	[1s / 1m:5s],		train_loss: 2.5693
40:	[0s / 15s],		train_loss: 2.5153
35:	[0s / 15s],		train_loss: 2.4447
20:	[0s / 12s],		train_loss: 2.5430
41:	[0s / 16s],		train_loss: 2.4991
36:	[0s / 16s],		train_loss: 2.4550
21:	[0s / 13s],		train_loss: 2.5349
42:	[0s / 16s],		train_loss: 2.4952
70:	[0s / 1m:6s],		train_loss: 2.5612
37:	[0s / 16s],		train_loss: 2.4464
43:	[0s / 16s],		train_loss: 2.4940
38:	[0s / 16s],		train_loss: 2.4392
22:	[0s / 13s],		train_loss: 2.5108
44:	[0s / 17s],		train_loss: 2.4978
39:	[0s / 17s],		train_loss: 2.4383
71:	[1s / 1m:7s],		train_loss: 2.5493
23:	[0s / 14s],		train_loss: 2.5290
45:	[0s / 17s],		train_loss: 2.4882
40:	[0s / 17s],		train_loss: 2.4406
46:	[0s / 18s],		train_loss: 2.4877
24:	[0s / 14s],		train_loss: 2.5252
41:	[0s / 18s],		train_loss: 2.4420
47:	[0s / 18s],		train_loss: 2.4884
72:	[0s / 1m:7s],		train_loss: 2.5590
42:	[0s / 18s],		train_loss: 2.4438
25:	[0s / 15s],		train_loss: 2.5259
48:	[0s / 18s],		train_loss: 2.4882
49:	[0s / 19s],		train_loss: 2.4896
43:	[0s / 19s],		train_loss: 2.4383
26:	[0s / 16s],		train_loss: 2.5340
73:	[0s / 1m:8s],		train_loss: 2.5630
50:	[0s / 19s],		train_loss: 2.4841
44:	[0s / 19s],		train_loss: 2.4297
51:	[0s / 19s],		train_loss: 2.4817
27:	[0s / 16s],		train_loss: 2.5260
45:	[0s / 19s],		train_loss: 2.4476
52:	[0s / 20s],		train_loss: 2.4829
74:	[0s / 1m:9s],		train_loss: 2.5658
46:	[0s / 20s],		train_loss: 2.4391
28:	[0s / 17s],		train_loss: 2.5263
53:	[0s / 20s],		train_loss: 2.4861
47:	[0s / 20s],		train_loss: 2.4187
54:	[0s / 21s],		train_loss: 2.4879
29:	[0s / 17s],		train_loss: 2.5312
48:	[0s / 21s],		train_loss: 2.4193
75:	[0s / 1m:10s],		train_loss: 2.5662
55:	[0s / 21s],		train_loss: 2.4842
30:	[0s / 18s],		train_loss: 2.5029
49:	[0s / 21s],		train_loss: 2.4376
56:	[0s / 21s],		train_loss: 2.4828
57:	[0s / 22s],		train_loss: 2.4783
50:	[0s / 22s],		train_loss: 2.4210
76:	[0s / 1m:11s],		train_loss: 2.5470
31:	[0s / 19s],		train_loss: 2.5261
58:	[0s / 22s],		train_loss: 2.4729
51:	[0s / 22s],		train_loss: 2.4350
59:	[0s / 22s],		train_loss: 2.4798
32:	[0s / 19s],		train_loss: 2.5049
52:	[0s / 22s],		train_loss: 2.4308
77:	[0s / 1m:12s],		train_loss: 2.5305
60:	[0s / 23s],		train_loss: 2.4709
53:	[0s / 23s],		train_loss: 2.4244
33:	[0s / 20s],		train_loss: 2.5152
61:	[0s / 23s],		train_loss: 2.4816
54:	[0s / 23s],		train_loss: 2.4355
62:	[0s / 24s],		train_loss: 2.4674
78:	[0s / 1m:13s],		train_loss: 2.5560
34:	[0s / 20s],		train_loss: 2.4926
55:	[0s / 24s],		train_loss: 2.4543
63:	[0s / 24s],		train_loss: 2.4749
35:	[0s / 21s],		train_loss: 2.5118
64:	[0s / 24s],		train_loss: 2.4577
56:	[0s / 24s],		train_loss: 2.4254
79:	[0s / 1m:14s],		train_loss: 2.5588
65:	[0s / 25s],		train_loss: 2.4744
57:	[0s / 25s],		train_loss: 2.4250
36:	[0s / 22s],		train_loss: 2.5019
66:	[0s / 25s],		train_loss: 2.4775
58:	[0s / 25s],		train_loss: 2.4286
67:	[0s / 26s],		train_loss: 2.4628
37:	[0s / 22s],		train_loss: 2.5007
80:	[1s / 1m:15s],		train_loss: 2.5695
59:	[0s / 26s],		train_loss: 2.4253
68:	[0s / 26s],		train_loss: 2.4679
60:	[0s / 26s],		train_loss: 2.4260
38:	[0s / 23s],		train_loss: 2.4956
69:	[0s / 26s],		train_loss: 2.4725
61:	[0s / 26s],		train_loss: 2.4086
81:	[0s / 1m:16s],		train_loss: 2.5655
70:	[0s / 27s],		train_loss: 2.4652
39:	[0s / 23s],		train_loss: 2.4882
62:	[0s / 27s],		train_loss: 2.4288
71:	[0s / 27s],		train_loss: 2.4667
40:	[0s / 24s],		train_loss: 2.4884
63:	[0s / 27s],		train_loss: 2.4237
72:	[0s / 28s],		train_loss: 2.4700
82:	[0s / 1m:17s],		train_loss: 2.5952
73:	[0s / 28s],		train_loss: 2.4652
64:	[0s / 28s],		train_loss: 2.4124
41:	[0s / 25s],		train_loss: 2.4989
74:	[0s / 28s],		train_loss: 2.4636
65:	[0s / 28s],		train_loss: 2.4103
42:	[0s / 25s],		train_loss: 2.4909
83:	[1s / 1m:18s],		train_loss: 2.5497
75:	[0s / 29s],		train_loss: 2.4501
66:	[0s / 29s],		train_loss: 2.4132
76:	[0s / 29s],		train_loss: 2.4613
67:	[0s / 29s],		train_loss: 2.4218
43:	[0s / 26s],		train_loss: 2.4870
77:	[0s / 29s],		train_loss: 2.4602
84:	[0s / 1m:19s],		train_loss: 2.5500
68:	[0s / 30s],		train_loss: 2.4227
44:	[0s / 27s],		train_loss: 2.4897
78:	[0s / 30s],		train_loss: 2.4564
69:	[0s / 30s],		train_loss: 2.4161
79:	[0s / 30s],		train_loss: 2.4662
45:	[0s / 27s],		train_loss: 2.4924
70:	[0s / 30s],		train_loss: 2.4049
80:	[0s / 31s],		train_loss: 2.4592
85:	[1s / 1m:20s],		train_loss: 2.5547
71:	[0s / 31s],		train_loss: 2.4105
46:	[0s / 28s],		train_loss: 2.4893
81:	[0s / 31s],		train_loss: 2.4600
82:	[0s / 31s],		train_loss: 2.4678
72:	[0s / 31s],		train_loss: 2.4075
47:	[0s / 28s],		train_loss: 2.4878
86:	[1s / 1m:21s],		train_loss: 2.5365
83:	[0s / 32s],		train_loss: 2.4498
73:	[0s / 32s],		train_loss: 2.4093
84:	[0s / 32s],		train_loss: 2.4619
48:	[0s / 29s],		train_loss: 2.4723
74:	[0s / 32s],		train_loss: 2.4007
85:	[0s / 33s],		train_loss: 2.4513
87:	[0s / 1m:22s],		train_loss: 2.5576
75:	[0s / 33s],		train_loss: 2.4060
49:	[0s / 29s],		train_loss: 2.4788
86:	[0s / 33s],		train_loss: 2.4485
76:	[0s / 33s],		train_loss: 2.4145
87:	[0s / 33s],		train_loss: 2.4575
50:	[0s / 30s],		train_loss: 2.5021
77:	[0s / 33s],		train_loss: 2.4143
88:	[0s / 1m:23s],		train_loss: 2.5390
88:	[0s / 34s],		train_loss: 2.4497
78:	[0s / 34s],		train_loss: 2.4077
51:	[0s / 31s],		train_loss: 2.4763
89:	[0s / 34s],		train_loss: 2.4542
79:	[0s / 34s],		train_loss: 2.4170
90:	[0s / 34s],		train_loss: 2.4401
89:	[0s / 1m:24s],		train_loss: 2.5650
52:	[0s / 31s],		train_loss: 2.4694
91:	[0s / 35s],		train_loss: 2.4454
80:	[0s / 35s],		train_loss: 2.4019
92:	[0s / 35s],		train_loss: 2.4362
81:	[0s / 35s],		train_loss: 2.4172
53:	[0s / 32s],		train_loss: 2.4639
90:	[0s / 1m:25s],		train_loss: 2.5645
93:	[0s / 36s],		train_loss: 2.4525
82:	[0s / 36s],		train_loss: 2.4065
54:	[0s / 33s],		train_loss: 2.4683
94:	[0s / 36s],		train_loss: 2.4474
83:	[0s / 36s],		train_loss: 2.4098
95:	[0s / 36s],		train_loss: 2.4608
55:	[0s / 33s],		train_loss: 2.4768
91:	[0s / 1m:26s],		train_loss: 2.5415
84:	[0s / 36s],		train_loss: 2.3944
96:	[0s / 37s],		train_loss: 2.4417
85:	[0s / 37s],		train_loss: 2.4110
97:	[0s / 37s],		train_loss: 2.4427
56:	[0s / 34s],		train_loss: 2.4639
92:	[0s / 1m:27s],		train_loss: 2.5480
86:	[0s / 37s],		train_loss: 2.3984
98:	[0s / 37s],		train_loss: 2.4405
57:	[0s / 34s],		train_loss: 2.4676
99:	[0s / 38s],		train_loss: 2.4406
87:	[0s / 38s],		train_loss: 2.4049
93:	[0s / 1m:28s],		train_loss: 2.5591
58:	[0s / 35s],		train_loss: 2.4608
88:	[0s / 38s],		train_loss: 2.4047
0:	[0s / 0s],		train_loss: 3.5303
1:	[0s / 0s],		train_loss: 2.7045
89:	[0s / 39s],		train_loss: 2.4011
59:	[0s / 36s],		train_loss: 2.4751
2:	[0s / 1s],		train_loss: 2.6591
90:	[0s / 39s],		train_loss: 2.4018
94:	[0s / 1m:29s],		train_loss: 2.5419
60:	[0s / 36s],		train_loss: 2.4515
3:	[0s / 1s],		train_loss: 2.6243
91:	[0s / 39s],		train_loss: 2.3867
4:	[0s / 1s],		train_loss: 2.6033
92:	[0s / 40s],		train_loss: 2.4090
61:	[0s / 37s],		train_loss: 2.4557
95:	[1s / 1m:30s],		train_loss: 2.5368
5:	[0s / 2s],		train_loss: 2.5863
93:	[0s / 40s],		train_loss: 2.3998
62:	[0s / 37s],		train_loss: 2.4557
6:	[0s / 2s],		train_loss: 2.5716
94:	[0s / 41s],		train_loss: 2.3999
63:	[0s / 38s],		train_loss: 2.4536
7:	[0s / 3s],		train_loss: 2.5753
95:	[0s / 41s],		train_loss: 2.3840
96:	[0s / 1m:31s],		train_loss: 2.5515
8:	[0s / 3s],		train_loss: 2.5550
64:	[0s / 38s],		train_loss: 2.4703
96:	[0s / 42s],		train_loss: 2.3928
9:	[0s / 4s],		train_loss: 2.5470
97:	[0s / 42s],		train_loss: 2.4049
65:	[0s / 39s],		train_loss: 2.4510
97:	[1s / 1m:32s],		train_loss: 2.5271
10:	[0s / 4s],		train_loss: 2.5235
98:	[0s / 42s],		train_loss: 2.3920
11:	[0s / 4s],		train_loss: 2.5526
66:	[0s / 40s],		train_loss: 2.4452
99:	[0s / 43s],		train_loss: 2.4076
12:	[0s / 5s],		train_loss: 2.5355
98:	[1s / 1m:33s],		train_loss: 2.5263
67:	[0s / 40s],		train_loss: 2.4673
0:	[0s / 0s],		train_loss: 3.5595
13:	[0s / 5s],		train_loss: 2.5351
14:	[0s / 6s],		train_loss: 2.5354
1:	[0s / 1s],		train_loss: 2.7927
68:	[0s / 41s],		train_loss: 2.4513
99:	[0s / 1m:34s],		train_loss: 2.5327
15:	[0s / 6s],		train_loss: 2.5286
2:	[0s / 1s],		train_loss: 2.7050
69:	[0s / 42s],		train_loss: 2.4587
16:	[0s / 6s],		train_loss: 2.5143
3:	[0s / 2s],		train_loss: 2.6685
17:	[0s / 7s],		train_loss: 2.5187
70:	[0s / 42s],		train_loss: 2.4442
0:	[1s / 1s],		train_loss: 2.7968
18:	[0s / 7s],		train_loss: 2.4998
4:	[0s / 2s],		train_loss: 2.6437
19:	[0s / 8s],		train_loss: 2.5021
71:	[0s / 43s],		train_loss: 2.4689
5:	[0s / 3s],		train_loss: 2.6377
20:	[0s / 8s],		train_loss: 2.5120
1:	[1s / 2s],		train_loss: 2.6437
6:	[0s / 3s],		train_loss: 2.6189
72:	[0s / 43s],		train_loss: 2.4470
21:	[0s / 8s],		train_loss: 2.5126
22:	[0s / 9s],		train_loss: 2.5010
7:	[0s / 4s],		train_loss: 2.5857
73:	[0s / 44s],		train_loss: 2.4391
23:	[0s / 9s],		train_loss: 2.5111
8:	[0s / 4s],		train_loss: 2.5884
2:	[1s / 3s],		train_loss: 2.6052
74:	[0s / 45s],		train_loss: 2.4483
24:	[0s / 10s],		train_loss: 2.4917
9:	[0s / 5s],		train_loss: 2.5857
25:	[0s / 10s],		train_loss: 2.4918
75:	[0s / 45s],		train_loss: 2.4386
10:	[0s / 5s],		train_loss: 2.5764
26:	[0s / 10s],		train_loss: 2.4830
3:	[1s / 4s],		train_loss: 2.5610
27:	[0s / 11s],		train_loss: 2.4891
76:	[0s / 46s],		train_loss: 2.4448
11:	[0s / 6s],		train_loss: 2.5700
28:	[0s / 11s],		train_loss: 2.4954
77:	[0s / 47s],		train_loss: 2.4288
12:	[0s / 6s],		train_loss: 2.5691
29:	[0s / 12s],		train_loss: 2.4998
4:	[1s / 5s],		train_loss: 2.5705
13:	[0s / 7s],		train_loss: 2.5577
30:	[0s / 12s],		train_loss: 2.4962
78:	[0s / 47s],		train_loss: 2.4322
31:	[0s / 12s],		train_loss: 2.4898
14:	[0s / 7s],		train_loss: 2.5341
79:	[0s / 48s],		train_loss: 2.4380
32:	[0s / 13s],		train_loss: 2.4649
5:	[1s / 6s],		train_loss: 2.5658
15:	[0s / 8s],		train_loss: 2.5612
33:	[0s / 13s],		train_loss: 2.4779
80:	[0s / 48s],		train_loss: 2.4391
16:	[0s / 8s],		train_loss: 2.5329
34:	[0s / 13s],		train_loss: 2.4760
81:	[0s / 49s],		train_loss: 2.4431
35:	[0s / 14s],		train_loss: 2.4665
17:	[0s / 9s],		train_loss: 2.5328
6:	[1s / 8s],		train_loss: 2.5450
36:	[0s / 14s],		train_loss: 2.4717
82:	[0s / 50s],		train_loss: 2.4225
18:	[0s / 9s],		train_loss: 2.5283
37:	[0s / 15s],		train_loss: 2.4857
19:	[0s / 10s],		train_loss: 2.5365
38:	[0s / 15s],		train_loss: 2.4664
83:	[0s / 50s],		train_loss: 2.4393
7:	[1s / 9s],		train_loss: 2.5228
39:	[0s / 15s],		train_loss: 2.4752
20:	[0s / 10s],		train_loss: 2.5303
84:	[0s / 51s],		train_loss: 2.4323
40:	[0s / 16s],		train_loss: 2.4784
21:	[0s / 11s],		train_loss: 2.5214
41:	[0s / 16s],		train_loss: 2.4678
85:	[0s / 51s],		train_loss: 2.4190
8:	[1s / 10s],		train_loss: 2.5237
22:	[0s / 11s],		train_loss: 2.5161
42:	[0s / 17s],		train_loss: 2.4781
86:	[0s / 52s],		train_loss: 2.4298
43:	[0s / 17s],		train_loss: 2.4600
23:	[0s / 12s],		train_loss: 2.4972
44:	[0s / 17s],		train_loss: 2.4554
87:	[0s / 53s],		train_loss: 2.4321
24:	[0s / 13s],		train_loss: 2.4994
9:	[1s / 11s],		train_loss: 2.5265
45:	[0s / 18s],		train_loss: 2.4623
88:	[0s / 53s],		train_loss: 2.4243
25:	[0s / 13s],		train_loss: 2.5000
46:	[0s / 18s],		train_loss: 2.4429
47:	[0s / 19s],		train_loss: 2.4507
26:	[0s / 14s],		train_loss: 2.4865
89:	[0s / 54s],		train_loss: 2.4216
10:	[1s / 12s],		train_loss: 2.5163
48:	[0s / 19s],		train_loss: 2.4631
27:	[0s / 14s],		train_loss: 2.4931
90:	[0s / 55s],		train_loss: 2.4302
49:	[0s / 19s],		train_loss: 2.4450
28:	[0s / 15s],		train_loss: 2.4818
50:	[0s / 20s],		train_loss: 2.4373
91:	[0s / 55s],		train_loss: 2.4193
11:	[1s / 13s],		train_loss: 2.5136
51:	[0s / 20s],		train_loss: 2.4406
29:	[0s / 15s],		train_loss: 2.4856
52:	[0s / 21s],		train_loss: 2.4412
92:	[0s / 56s],		train_loss: 2.4278
30:	[0s / 16s],		train_loss: 2.4889
53:	[0s / 21s],		train_loss: 2.4394
93:	[0s / 56s],		train_loss: 2.4118
12:	[1s / 15s],		train_loss: 2.5093
31:	[0s / 16s],		train_loss: 2.4800
54:	[0s / 21s],		train_loss: 2.4195
55:	[0s / 22s],		train_loss: 2.4451
32:	[0s / 17s],		train_loss: 2.4962
94:	[0s / 57s],		train_loss: 2.4203
56:	[0s / 22s],		train_loss: 2.4417
33:	[0s / 17s],		train_loss: 2.4913
13:	[1s / 16s],		train_loss: 2.5157
95:	[0s / 58s],		train_loss: 2.4291
57:	[0s / 23s],		train_loss: 2.4546
34:	[0s / 18s],		train_loss: 2.4782
58:	[0s / 23s],		train_loss: 2.4470
96:	[0s / 58s],		train_loss: 2.4357
59:	[0s / 23s],		train_loss: 2.4351
35:	[0s / 18s],		train_loss: 2.4831
14:	[1s / 17s],		train_loss: 2.4986
97:	[0s / 59s],		train_loss: 2.4108
60:	[0s / 24s],		train_loss: 2.4399
36:	[0s / 19s],		train_loss: 2.4771
61:	[0s / 24s],		train_loss: 2.4220
98:	[0s / 59s],		train_loss: 2.4348
37:	[0s / 19s],		train_loss: 2.4827
62:	[0s / 25s],		train_loss: 2.4147
15:	[1s / 18s],		train_loss: 2.4989
63:	[0s / 25s],		train_loss: 2.4514
99:	[0s / 1m:0s],		train_loss: 2.4174
38:	[0s / 20s],		train_loss: 2.4679
64:	[0s / 25s],		train_loss: 2.4340
39:	[0s / 20s],		train_loss: 2.4848
0:	[0s / 0s],		train_loss: 3.0967
65:	[0s / 26s],		train_loss: 2.4186
16:	[1s / 19s],		train_loss: 2.4979
40:	[0s / 21s],		train_loss: 2.4584
66:	[0s / 26s],		train_loss: 2.4297
1:	[0s / 1s],		train_loss: 2.8083
41:	[0s / 21s],		train_loss: 2.4652
67:	[0s / 27s],		train_loss: 2.4199
68:	[0s / 27s],		train_loss: 2.4149
2:	[0s / 1s],		train_loss: 2.7571
17:	[1s / 20s],		train_loss: 2.4865
42:	[0s / 22s],		train_loss: 2.4761
69:	[0s / 27s],		train_loss: 2.4333
3:	[0s / 2s],		train_loss: 2.7633
43:	[0s / 22s],		train_loss: 2.4749
70:	[0s / 28s],		train_loss: 2.4131
44:	[0s / 23s],		train_loss: 2.4657
18:	[1s / 22s],		train_loss: 2.4830
71:	[0s / 28s],		train_loss: 2.4132
4:	[0s / 3s],		train_loss: 2.7297
72:	[0s / 29s],		train_loss: 2.4071
45:	[0s / 24s],		train_loss: 2.4744
5:	[0s / 3s],		train_loss: 2.7262
73:	[0s / 29s],		train_loss: 2.4048
46:	[0s / 24s],		train_loss: 2.4499
19:	[1s / 23s],		train_loss: 2.4754
74:	[0s / 29s],		train_loss: 2.3971
6:	[0s / 4s],		train_loss: 2.7008
75:	[0s / 30s],		train_loss: 2.4136
47:	[0s / 25s],		train_loss: 2.4575
76:	[0s / 30s],		train_loss: 2.4120
7:	[0s / 5s],		train_loss: 2.6972
48:	[0s / 25s],		train_loss: 2.4286
77:	[0s / 30s],		train_loss: 2.4000
20:	[1s / 24s],		train_loss: 2.4745
8:	[0s / 5s],		train_loss: 2.6793
49:	[0s / 26s],		train_loss: 2.4471
78:	[0s / 31s],		train_loss: 2.4079
79:	[0s / 31s],		train_loss: 2.4075
50:	[0s / 26s],		train_loss: 2.4730
9:	[0s / 6s],		train_loss: 2.6698
80:	[0s / 32s],		train_loss: 2.3956
21:	[1s / 25s],		train_loss: 2.4886
51:	[0s / 27s],		train_loss: 2.4503
10:	[0s / 6s],		train_loss: 2.6606
81:	[0s / 32s],		train_loss: 2.4036
52:	[0s / 27s],		train_loss: 2.4357
82:	[0s / 32s],		train_loss: 2.4097
11:	[0s / 7s],		train_loss: 2.6692
83:	[0s / 33s],		train_loss: 2.3876
53:	[0s / 28s],		train_loss: 2.4468
22:	[1s / 26s],		train_loss: 2.4826
84:	[0s / 33s],		train_loss: 2.3783
12:	[0s / 8s],		train_loss: 2.6399
54:	[0s / 28s],		train_loss: 2.4289
85:	[0s / 34s],		train_loss: 2.3912
55:	[0s / 29s],		train_loss: 2.4507
13:	[0s / 8s],		train_loss: 2.6177
86:	[0s / 34s],		train_loss: 2.3949
23:	[1s / 27s],		train_loss: 2.4719
56:	[0s / 29s],		train_loss: 2.4375
87:	[0s / 34s],		train_loss: 2.3961
14:	[0s / 9s],		train_loss: 2.6423
88:	[0s / 35s],		train_loss: 2.3951
57:	[0s / 30s],		train_loss: 2.4186
15:	[0s / 9s],		train_loss: 2.6174
89:	[0s / 35s],		train_loss: 2.3990
58:	[0s / 30s],		train_loss: 2.4282
24:	[1s / 29s],		train_loss: 2.4655
90:	[0s / 35s],		train_loss: 2.3856
16:	[0s / 10s],		train_loss: 2.6066
59:	[0s / 31s],		train_loss: 2.4378
91:	[0s / 36s],		train_loss: 2.3853
92:	[0s / 36s],		train_loss: 2.3845
17:	[0s / 11s],		train_loss: 2.6223
60:	[0s / 31s],		train_loss: 2.4356
25:	[1s / 30s],		train_loss: 2.4780
93:	[0s / 37s],		train_loss: 2.3875
18:	[0s / 11s],		train_loss: 2.5876
61:	[0s / 32s],		train_loss: 2.4154
94:	[0s / 37s],		train_loss: 2.3831
95:	[0s / 37s],		train_loss: 2.3925
62:	[0s / 32s],		train_loss: 2.4076
19:	[0s / 12s],		train_loss: 2.5839
26:	[1s / 31s],		train_loss: 2.4901
96:	[0s / 38s],		train_loss: 2.3880
63:	[0s / 33s],		train_loss: 2.4122
20:	[0s / 13s],		train_loss: 2.5655
97:	[0s / 38s],		train_loss: 2.3864
64:	[0s / 33s],		train_loss: 2.4132
98:	[0s / 39s],		train_loss: 2.3774
21:	[0s / 13s],		train_loss: 2.5738
27:	[1s / 32s],		train_loss: 2.4856
99:	[0s / 39s],		train_loss: 2.3890
65:	[0s / 34s],		train_loss: 2.4250
22:	[0s / 14s],		train_loss: 2.5700
0:	[0s / 0s],		train_loss: 3.2380
66:	[0s / 34s],		train_loss: 2.4264
1:	[0s / 0s],		train_loss: 2.7221
23:	[0s / 14s],		train_loss: 2.5362
28:	[1s / 33s],		train_loss: 2.4585
67:	[0s / 35s],		train_loss: 2.4074
2:	[0s / 1s],		train_loss: 2.6392
24:	[0s / 15s],		train_loss: 2.5293
3:	[0s / 1s],		train_loss: 2.6135
68:	[0s / 36s],		train_loss: 2.4115
4:	[0s / 1s],		train_loss: 2.5848
25:	[0s / 16s],		train_loss: 2.5293
29:	[1s / 35s],		train_loss: 2.4760
69:	[0s / 36s],		train_loss: 2.4222
5:	[0s / 2s],		train_loss: 2.5636
6:	[0s / 2s],		train_loss: 2.5400
26:	[0s / 16s],		train_loss: 2.5382
70:	[0s / 37s],		train_loss: 2.4160
7:	[0s / 2s],		train_loss: 2.5253
27:	[0s / 17s],		train_loss: 2.5276
71:	[0s / 37s],		train_loss: 2.4267
8:	[0s / 3s],		train_loss: 2.5136
30:	[1s / 36s],		train_loss: 2.4765
9:	[0s / 3s],		train_loss: 2.5135
72:	[0s / 38s],		train_loss: 2.4289
28:	[0s / 17s],		train_loss: 2.5212
10:	[0s / 3s],		train_loss: 2.4995
73:	[0s / 38s],		train_loss: 2.4214
29:	[0s / 18s],		train_loss: 2.5146
11:	[0s / 4s],		train_loss: 2.5009
31:	[1s / 37s],		train_loss: 2.4616
12:	[0s / 4s],		train_loss: 2.5022
74:	[0s / 39s],		train_loss: 2.4201
30:	[0s / 18s],		train_loss: 2.5281
13:	[0s / 5s],		train_loss: 2.4986
75:	[0s / 39s],		train_loss: 2.4050
14:	[0s / 5s],		train_loss: 2.5080
31:	[0s / 19s],		train_loss: 2.5069
32:	[1s / 38s],		train_loss: 2.4696
15:	[0s / 5s],		train_loss: 2.4926
76:	[0s / 40s],		train_loss: 2.4106
32:	[0s / 20s],		train_loss: 2.5073
16:	[0s / 6s],		train_loss: 2.4861
77:	[0s / 40s],		train_loss: 2.4129
17:	[0s / 6s],		train_loss: 2.4867
33:	[0s / 20s],		train_loss: 2.5116
18:	[0s / 6s],		train_loss: 2.4989
33:	[1s / 39s],		train_loss: 2.4706
78:	[0s / 41s],		train_loss: 2.3977
34:	[0s / 21s],		train_loss: 2.5122
19:	[0s / 7s],		train_loss: 2.4861
79:	[0s / 41s],		train_loss: 2.3927
20:	[0s / 7s],		train_loss: 2.4861
35:	[0s / 21s],		train_loss: 2.5075
21:	[0s / 7s],		train_loss: 2.4827
80:	[0s / 42s],		train_loss: 2.4050
34:	[1s / 41s],		train_loss: 2.4697
22:	[0s / 8s],		train_loss: 2.4674
36:	[0s / 22s],		train_loss: 2.5094
81:	[0s / 43s],		train_loss: 2.4007
23:	[0s / 8s],		train_loss: 2.4783
37:	[0s / 22s],		train_loss: 2.5116
24:	[0s / 9s],		train_loss: 2.4789
82:	[0s / 43s],		train_loss: 2.3893
35:	[1s / 42s],		train_loss: 2.4666
25:	[0s / 9s],		train_loss: 2.4687
38:	[0s / 23s],		train_loss: 2.4931
83:	[0s / 44s],		train_loss: 2.3934
26:	[0s / 9s],		train_loss: 2.4593
39:	[0s / 24s],		train_loss: 2.4917
27:	[0s / 10s],		train_loss: 2.4710
84:	[0s / 44s],		train_loss: 2.3899
28:	[0s / 10s],		train_loss: 2.4661
36:	[1s / 43s],		train_loss: 2.4662
40:	[0s / 24s],		train_loss: 2.4981
85:	[0s / 45s],		train_loss: 2.3934
29:	[0s / 10s],		train_loss: 2.4627
30:	[0s / 11s],		train_loss: 2.4625
41:	[0s / 25s],		train_loss: 2.4751
86:	[0s / 45s],		train_loss: 2.3916
31:	[0s / 11s],		train_loss: 2.4536
37:	[1s / 44s],		train_loss: 2.4649
87:	[0s / 46s],		train_loss: 2.3675
42:	[0s / 25s],		train_loss: 2.4934
32:	[0s / 11s],		train_loss: 2.4555
33:	[0s / 12s],		train_loss: 2.4508
88:	[0s / 46s],		train_loss: 2.3779
43:	[0s / 26s],		train_loss: 2.4731
34: