[I 2026-07-01 11:31:51,199] Trial 41 finished with value: 0.7576114791302481 and parameters: {'num_nodes': [32], 'dropout': 0.26635986579517623, 'learning_rate': 0.00011136893881303452, 'batch_norm': False}. Best is trial 28 with value: 0.7684124574477873.
/scratch.hpc/luca.cotugno/Foundation_model_clinical_data/test_tabular_model.py:481: UserWarning: Choices for a categorical distribution should be a tuple of None, bool, int, float and str for persistent storage but contains [32] which is of type list.
  num_nodes  = trial.suggest_categorical("num_nodes", [[32], [64], [128], [64, 32], [128, 64]])
/scratch.hpc/luca.cotugno/Foundation_model_clinical_data/test_tabular_model.py:481: UserWarning: Choices for a categorical distribution should be a tuple of None, bool, int, float and str for persistent storage but contains [64] which is of type list.
  num_nodes  = trial.suggest_categorical("num_nodes", [[32], [64], [128], [64, 32], [128, 64]])
/scratch.hpc/luca.cotugno/Foundation_model_clinical_data/test_tabular_model.py:481: UserWarning: Choices for a categorical distribution should be a tuple of None, bool, int, float and str for persistent storage but contains [128] which is of type list.
  num_nodes  = trial.suggest_categorical("num_nodes", [[32], [64], [128], [64, 32], [128, 64]])
/scratch.hpc/luca.cotugno/Foundation_model_clinical_data/test_tabular_model.py:481: UserWarning: Choices for a categorical distribution should be a tuple of None, bool, int, float and str for persistent storage but contains [64, 32] which is of type list.
  num_nodes  = trial.suggest_categorical("num_nodes", [[32], [64], [128], [64, 32], [128, 64]])
/scratch.hpc/luca.cotugno/Foundation_model_clinical_data/test_tabular_model.py:481: UserWarning: Choices for a categorical distribution should be a tuple of None, bool, int, float and str for persistent storage but contains [128, 64] which is of type list.
  num_nodes  = trial.suggest_categorical("num_nodes", [[32], [64], [128], [64, 32], [128, 64]])

28:	[3s / 1m:42s],		train_loss: 4.3240
22:	[0s / 3s],		train_loss: 4.3400
75:	[0s / 11s],		train_loss: 4.3212
71:	[0s / 27s],		train_loss: 3.9195
79:	[1s / 1m:42s],		train_loss: 3.8234
13:	[0s / 2s],		train_loss: 4.2822
23:	[0s / 3s],		train_loss: 4.3356
76:	[0s / 11s],		train_loss: 4.3183
54:	[0s / 37s],		train_loss: 3.9567
14:	[0s / 2s],		train_loss: 4.2930
24:	[0s / 3s],		train_loss: 4.3284
77:	[0s / 12s],		train_loss: 4.3383
72:	[0s / 27s],		train_loss: 3.9093
25:	[0s / 3s],		train_loss: 4.3465
78:	[0s / 12s],		train_loss: 4.3614
15:	[0s / 3s],		train_loss: 4.2731
26:	[0s / 3s],		train_loss: 4.3429
79:	[0s / 12s],		train_loss: 4.3336
16:	[0s / 3s],		train_loss: 4.2653
27:	[0s / 4s],		train_loss: 4.3557
55:	[0s / 38s],		train_loss: 3.9641
80:	[0s / 12s],		train_loss: 4.3222
73:	[0s / 28s],		train_loss: 3.9099
17:	[0s / 3s],		train_loss: 4.2729
28:	[0s / 4s],		train_loss: 4.3497
81:	[0s / 12s],		train_loss: 4.3614
29:	[0s / 4s],		train_loss: 4.3242
18:	[0s / 3s],		train_loss: 4.2632
80:	[1s / 1m:43s],		train_loss: 3.7919
82:	[0s / 12s],		train_loss: 4.3027
30:	[0s / 4s],		train_loss: 4.3465
74:	[0s / 28s],		train_loss: 3.9209
83:	[0s / 13s],		train_loss: 4.3251
19:	[0s / 3s],		train_loss: 4.2518
56:	[0s / 38s],		train_loss: 3.9264
31:	[0s / 4s],		train_loss: 4.3379
84:	[0s / 13s],		train_loss: 4.3068
20:	[0s / 4s],		train_loss: 4.2597
32:	[0s / 4s],		train_loss: 4.3328
85:	[0s / 13s],		train_loss: 4.3836
75:	[0s / 29s],		train_loss: 3.8954
33:	[0s / 4s],		train_loss: 4.3569
21:	[0s / 4s],		train_loss: 4.2402
86:	[0s / 13s],		train_loss: 4.3078
34:	[0s / 5s],		train_loss: 4.3106
47:	[1s / 1m:43s],		train_loss: 3.6415
22:	[0s / 4s],		train_loss: 4.2260
87:	[0s / 13s],		train_loss: 4.3339
35:	[0s / 5s],		train_loss: 4.3595
76:	[0s / 29s],		train_loss: 3.9117
57:	[0s / 39s],		train_loss: 3.9190
88:	[0s / 13s],		train_loss: 4.3068
23:	[0s / 4s],		train_loss: 4.2199
36:	[0s / 5s],		train_loss: 4.2893
89:	[0s / 13s],		train_loss: 4.3756
37:	[0s / 5s],		train_loss: 4.3393
24:	[0s / 4s],		train_loss: 4.2251
81:	[1s / 1m:44s],		train_loss: 3.8418
77:	[0s / 29s],		train_loss: 3.8657
90:	[0s / 14s],		train_loss: 4.2884
38:	[0s / 5s],		train_loss: 4.2945
25:	[0s / 4s],		train_loss: 4.2002
91:	[0s / 14s],		train_loss: 4.3537
39:	[0s / 5s],		train_loss: 4.3598
26:	[0s / 5s],		train_loss: 4.1838
92:	[0s / 14s],		train_loss: 4.3683
40:	[0s / 6s],		train_loss: 4.3080
78:	[0s / 30s],		train_loss: 3.9087
58:	[0s / 40s],		train_loss: 3.9010
93:	[0s / 14s],		train_loss: 4.3453
27:	[0s / 5s],		train_loss: 4.1896
41:	[0s / 6s],		train_loss: 4.2757
94:	[0s / 14s],		train_loss: 4.2857
42:	[0s / 6s],		train_loss: 4.2816
28:	[0s / 5s],		train_loss: 4.1943
79:	[0s / 30s],		train_loss: 3.9196
95:	[0s / 14s],		train_loss: 4.2984
43:	[0s / 6s],		train_loss: 4.3198
29:	[0s / 5s],		train_loss: 4.1972
44:	[0s / 6s],		train_loss: 4.3216
96:	[0s / 15s],		train_loss: 4.2977
59:	[0s / 40s],		train_loss: 3.8950
82:	[1s / 1m:45s],		train_loss: 3.8478
30:	[0s / 5s],		train_loss: 4.1799
45:	[0s / 6s],		train_loss: 4.3180
97:	[0s / 15s],		train_loss: 4.3169
80:	[0s / 30s],		train_loss: 3.9000
48:	[1s / 1m:45s],		train_loss: 3.6708
46:	[0s / 6s],		train_loss: 4.3019
31:	[0s / 6s],		train_loss: 4.1673
98:	[0s / 15s],		train_loss: 4.3195
29:	[3s / 1m:45s],		train_loss: 4.2788
47:	[0s / 7s],		train_loss: 4.3040
99:	[0s / 15s],		train_loss: 4.3136
32:	[0s / 6s],		train_loss: 4.1594
81:	[0s / 31s],		train_loss: 3.8672
48:	[0s / 7s],		train_loss: 4.3568
60:	[0s / 41s],		train_loss: 3.9229
33:	[0s / 6s],		train_loss: 4.1533
49:	[0s / 7s],		train_loss: 4.3228
0:	[0s / 0s],		train_loss: 4.7718
82:	[0s / 31s],		train_loss: 3.8291
50:	[0s / 7s],		train_loss: 4.3244
34:	[0s / 6s],		train_loss: 4.1211
1:	[0s / 0s],		train_loss: 4.5169
51:	[0s / 7s],		train_loss: 4.3363
2:	[0s / 0s],		train_loss: 4.4711
35:	[0s / 6s],		train_loss: 4.1456
52:	[0s / 7s],		train_loss: 4.3123
83:	[1s / 1m:46s],		train_loss: 3.8447
3:	[0s / 0s],		train_loss: 4.4026
83:	[0s / 32s],		train_loss: 3.8235
36:	[0s / 7s],		train_loss: 4.1470
61:	[0s / 42s],		train_loss: 3.8843
53:	[0s / 8s],		train_loss: 4.3093
4:	[0s / 0s],		train_loss: 4.3784
54:	[0s / 8s],		train_loss: 4.3692
37:	[0s / 7s],		train_loss: 4.1452
5:	[0s / 0s],		train_loss: 4.3671
84:	[0s / 32s],		train_loss: 3.8171
55:	[0s / 8s],		train_loss: 4.3344
6:	[0s / 1s],		train_loss: 4.3496
38:	[0s / 7s],		train_loss: 4.1455
56:	[0s / 8s],		train_loss: 4.3244
7:	[0s / 1s],		train_loss: 4.3785
39:	[0s / 7s],		train_loss: 4.1223
57:	[0s / 8s],		train_loss: 4.3362
62:	[0s / 42s],		train_loss: 3.8759
85:	[0s / 32s],		train_loss: 3.8796
8:	[0s / 1s],		train_loss: 4.3308
49:	[1s / 1m:47s],		train_loss: 3.6633
58:	[0s / 8s],		train_loss: 4.3019
40:	[0s / 8s],		train_loss: 4.1179
9:	[0s / 1s],		train_loss: 4.3190
84:	[0s / 1m:47s],		train_loss: 3.7983
59:	[0s / 8s],		train_loss: 4.3056
41:	[0s / 8s],		train_loss: 4.1373
10:	[0s / 1s],		train_loss: 4.3343
60:	[0s / 9s],		train_loss: 4.3078
86:	[0s / 33s],		train_loss: 3.8369
11:	[0s / 1s],		train_loss: 4.3225
42:	[0s / 8s],		train_loss: 4.1379
61:	[0s / 9s],		train_loss: 4.3233
63:	[0s / 43s],		train_loss: 3.8956
12:	[0s / 2s],		train_loss: 4.2989
43:	[0s / 8s],		train_loss: 4.1119
62:	[0s / 9s],		train_loss: 4.3085
87:	[0s / 33s],		train_loss: 3.8281
13:	[0s / 2s],		train_loss: 4.3078
63:	[0s / 9s],		train_loss: 4.3405
44:	[0s / 8s],		train_loss: 4.0980
14:	[0s / 2s],		train_loss: 4.2995
64:	[0s / 9s],		train_loss: 4.3246
45:	[0s / 8s],		train_loss: 4.0920
15:	[0s / 2s],		train_loss: 4.2548
65:	[0s / 9s],		train_loss: 4.3417
88:	[0s / 34s],		train_loss: 3.8233
64:	[0s / 44s],		train_loss: 3.8457
16:	[0s / 2s],		train_loss: 4.2797
85:	[1s / 1m:48s],		train_loss: 3.8180
46:	[0s / 9s],		train_loss: 4.1022
66:	[0s / 10s],		train_loss: 4.3453
17:	[0s / 2s],		train_loss: 4.2714
67:	[0s / 10s],		train_loss: 4.3111
47:	[0s / 9s],		train_loss: 4.0470
89:	[0s / 34s],		train_loss: 3.8084
18:	[0s / 2s],		train_loss: 4.2561
68:	[0s / 10s],		train_loss: 4.2735
48:	[0s / 9s],		train_loss: 4.0438
19:	[0s / 3s],		train_loss: 4.2492
69:	[0s / 10s],		train_loss: 4.2830
49:	[0s / 9s],		train_loss: 4.0516
65:	[0s / 44s],		train_loss: 3.8721
20:	[0s / 3s],		train_loss: 4.2686
70:	[0s / 10s],		train_loss: 4.3225
90:	[0s / 34s],		train_loss: 3.7666
21:	[0s / 3s],		train_loss: 4.2554
71:	[0s / 10s],		train_loss: 4.2793
50:	[0s / 9s],		train_loss: 4.0676
50:	[2s / 1m:49s],		train_loss: 3.6204
22:	[0s / 3s],		train_loss: 4.2286
72:	[0s / 10s],		train_loss: 4.3020
51:	[0s / 10s],		train_loss: 4.0579
23:	[0s / 3s],		train_loss: 4.2656
73:	[0s / 11s],		train_loss: 4.2935
91:	[0s / 35s],		train_loss: 3.7421
30:	[4s / 1m:49s],		train_loss: 4.3163
52:	[0s / 10s],		train_loss: 4.0590
24:	[0s / 3s],		train_loss: 4.2439
66:	[0s / 45s],		train_loss: 3.8251
86:	[1s / 1m:49s],		train_loss: 3.7557
74:	[0s / 11s],		train_loss: 4.2854
75:	[0s / 11s],		train_loss: 4.3014
53:	[0s / 10s],		train_loss: 4.0494
25:	[0s / 4s],		train_loss: 4.2382
92:	[0s / 35s],		train_loss: 3.7546
76:	[0s / 11s],		train_loss: 4.2812
26:	[0s / 4s],		train_loss: 4.2288
54:	[0s / 10s],		train_loss: 4.0531
77:	[0s / 11s],		train_loss: 4.2898
27:	[0s / 4s],		train_loss: 4.2045
55:	[0s / 10s],		train_loss: 4.0128
78:	[0s / 11s],		train_loss: 4.2996
28:	[0s / 4s],		train_loss: 4.2178
67:	[0s / 46s],		train_loss: 3.8467
93:	[0s / 36s],		train_loss: 3.7570
56:	[0s / 11s],		train_loss: 4.0417
79:	[0s / 11s],		train_loss: 4.2795
29:	[0s / 4s],		train_loss: 4.1687
80:	[0s / 12s],		train_loss: 4.3056
57:	[0s / 11s],		train_loss: 4.0569
30:	[0s / 4s],		train_loss: 4.1797
81:	[0s / 12s],		train_loss: 4.2701
94:	[0s / 36s],		train_loss: 3.7511
31:	[0s / 4s],		train_loss: 4.1778
58:	[0s / 11s],		train_loss: 4.0339
82:	[0s / 12s],		train_loss: 4.3398
87:	[1s / 1m:51s],		train_loss: 3.7470
32:	[0s / 5s],		train_loss: 4.1836
59:	[0s / 11s],		train_loss: 4.0050
83:	[0s / 12s],		train_loss: 4.2787
68:	[0s / 46s],		train_loss: 3.8311
33:	[0s / 5s],		train_loss: 4.1559
95:	[0s / 36s],		train_loss: 3.7574
84:	[0s / 12s],		train_loss: 4.2592
60:	[0s / 11s],		train_loss: 4.0120
34:	[0s / 5s],		train_loss: 4.1476
85:	[0s / 12s],		train_loss: 4.2971
51:	[2s / 1m:51s],		train_loss: 3.6185
35:	[0s / 5s],		train_loss: 4.1509
61:	[0s / 12s],		train_loss: 3.9820
86:	[0s / 12s],		train_loss: 4.2724
96:	[0s / 37s],		train_loss: 3.7844
36:	[0s / 5s],		train_loss: 4.1547
69:	[0s / 47s],		train_loss: 3.8079
87:	[0s / 13s],		train_loss: 4.3477
62:	[0s / 12s],		train_loss: 4.0150
37:	[0s / 5s],		train_loss: 4.1560
88:	[0s / 13s],		train_loss: 4.3159
63:	[0s / 12s],		train_loss: 3.9662
38:	[0s / 6s],		train_loss: 4.1689
97:	[0s / 37s],		train_loss: 3.7315
89:	[0s / 13s],		train_loss: 4.2852
88:	[1s / 1m:52s],		train_loss: 3.7452
39:	[0s / 6s],		train_loss: 4.1343
64:	[0s / 12s],		train_loss: 3.9662
90:	[0s / 13s],		train_loss: 4.2996
40:	[0s / 6s],		train_loss: 4.1498
91:	[0s / 13s],		train_loss: 4.2772
70:	[0s / 47s],		train_loss: 3.8250
65:	[0s / 12s],		train_loss: 4.0086
98:	[0s / 37s],		train_loss: 3.7100
92:	[0s / 13s],		train_loss: 4.2690
41:	[0s / 6s],		train_loss: 4.1158
66:	[0s / 13s],		train_loss: 3.9714
93:	[0s / 14s],		train_loss: 4.2618
42:	[0s / 6s],		train_loss: 4.1266
99:	[0s / 38s],		train_loss: 3.6734
94:	[0s / 14s],		train_loss: 4.2182
43:	[0s / 6s],		train_loss: 4.0982
67:	[0s / 13s],		train_loss: 3.9662
31:	[3s / 1m:53s],		train_loss: 4.2895
71:	[0s / 48s],		train_loss: 3.8359
95:	[0s / 14s],		train_loss: 4.2654
44:	[0s / 7s],		train_loss: 4.1261
68:	[0s / 13s],		train_loss: 3.9710
96:	[0s / 14s],		train_loss: 4.2871
89:	[1s / 1m:53s],		train_loss: 3.7359
45:	[0s / 7s],		train_loss: 4.0986
69:	[0s / 13s],		train_loss: 3.9736
97:	[0s / 14s],		train_loss: 4.2803
46:	[0s / 7s],		train_loss: 4.0924
0:	[0s / 0s],		train_loss: 5.4529
98:	[0s / 14s],		train_loss: 4.2963
52:	[2s / 1m:53s],		train_loss: 3.6444
47:	[0s / 7s],		train_loss: 4.0919
70:	[0s / 14s],		train_loss: 3.9509
99:	[0s / 15s],		train_loss: 4.2443
72:	[0s / 49s],		train_loss: 3.8214
48:	[0s / 7s],		train_loss: 4.0921
71:	[0s / 14s],		train_loss: 3.9234
1:	[0s / 0s],		train_loss: 4.7716
49:	[0s / 7s],		train_loss: 4.0698
0:	[0s / 0s],		train_loss: 4.7146
72:	[0s / 14s],		train_loss: 3.9470
50:	[0s / 8s],		train_loss: 4.1372
1:	[0s / 0s],		train_loss: 4.4705
73:	[0s / 14s],		train_loss: 3.9415
2:	[0s / 1s],		train_loss: 4.6152
51:	[0s / 8s],		train_loss: 4.0839
2:	[0s / 0s],		train_loss: 4.4208
52:	[0s / 8s],		train_loss: 4.0583
73:	[0s / 49s],		train_loss: 3.8319
74:	[0s / 14s],		train_loss: 3.9038
90:	[1s / 1m:54s],		train_loss: 3.7654
3:	[0s / 0s],		train_loss: 4.4130
53:	[0s / 8s],		train_loss: 4.0657
3:	[0s / 1s],		train_loss: 4.5429
4:	[0s / 0s],		train_loss: 4.3979
75:	[0s / 15s],		train_loss: 3.9153
54:	[0s / 8s],		train_loss: 4.0270
5:	[0s / 0s],		train_loss: 4.4159
76:	[0s / 15s],		train_loss: 3.9265
55:	[0s / 8s],		train_loss: 4.0852
6:	[0s / 1s],		train_loss: 4.3516
4:	[0s / 1s],		train_loss: 4.5479
77:	[0s / 15s],		train_loss: 3.8951
56:	[0s / 9s],		train_loss: 4.0499
74:	[0s / 50s],		train_loss: 3.7866
7:	[0s / 1s],		train_loss: 4.3845
57:	[0s / 9s],		train_loss: 4.0194
78:	[0s / 15s],		train_loss: 3.9463
8:	[0s / 1s],		train_loss: 4.3885
5:	[0s / 2s],		train_loss: 4.5253
53:	[1s / 1m:55s],		train_loss: 3.5902
9:	[0s / 1s],		train_loss: 4.4055
58:	[0s / 9s],		train_loss: 4.0774
79:	[0s / 15s],		train_loss: 3.9265
91:	[1s / 1m:55s],		train_loss: 3.7286
10:	[0s / 1s],		train_loss: 4.4110
59:	[0s / 9s],		train_loss: 4.0553
75:	[0s / 51s],		train_loss: 3.7734
80:	[0s / 16s],		train_loss: 3.9605
11:	[0s / 1s],		train_loss: 4.4031
6:	[0s / 2s],		train_loss: 4.5272
60:	[0s / 9s],		train_loss: 4.0072
12:	[0s / 1s],		train_loss: 4.4022
81:	[0s / 16s],		train_loss: 3.8941
61:	[0s / 9s],		train_loss: 4.0359
13:	[0s / 2s],		train_loss: 4.4049
62:	[0s / 9s],		train_loss: 4.0326
7:	[0s / 2s],		train_loss: 4.4825
82:	[0s / 16s],		train_loss: 3.9002
14:	[0s / 2s],		train_loss: 4.3578
63:	[0s / 10s],		train_loss: 4.0223
76:	[0s / 51s],		train_loss: 3.7774
83:	[0s / 16s],		train_loss: 3.9068
15:	[0s / 2s],		train_loss: 4.3715
64:	[0s / 10s],		train_loss: 4.0372
8:	[0s / 3s],		train_loss: 4.5020
16:	[0s / 2s],		train_loss: 4.3541
84:	[0s / 16s],		train_loss: 3.8451
92:	[0s / 1m:56s],		train_loss: 3.7528
65:	[0s / 10s],		train_loss: 3.9877
17:	[0s / 2s],		train_loss: 4.3306
85:	[0s / 17s],		train_loss: 3.8842
66:	[0s / 10s],		train_loss: 4.0025
9:	[0s / 3s],		train_loss: 4.4527
18:	[0s / 2s],		train_loss: 4.3820
77:	[0s / 52s],		train_loss: 3.7921
86:	[0s / 17s],		train_loss: 3.8747
67:	[0s / 10s],		train_loss: 3.9835
32:	[3s / 1m:56s],		train_loss: 4.2649
19:	[0s / 2s],		train_loss: 4.3209
68:	[0s / 10s],		train_loss: 3.9931
87:	[0s / 17s],		train_loss: 3.9025
20:	[0s / 3s],		train_loss: 4.3460
10:	[0s / 3s],		train_loss: 4.4607
69:	[0s / 11s],		train_loss: 4.0078
21:	[0s / 3s],		train_loss: 4.3268
88:	[0s / 17s],		train_loss: 3.8759
70:	[0s / 11s],		train_loss: 3.9885
22:	[0s / 3s],		train_loss: 4.3445
54:	[1s / 1m:57s],		train_loss: 3.6376
89:	[0s / 17s],		train_loss: 3.8623
78:	[0s / 52s],		train_loss: 3.7825
11:	[0s / 4s],		train_loss: 4.4666
71:	[0s / 11s],		train_loss: 3.9438
23:	[0s / 3s],		train_loss: 4.3381
90:	[0s / 17s],		train_loss: 3.8823
72:	[0s / 11s],		train_loss: 3.9570
93:	[1s / 1m:57s],		train_loss: 3.7157
24:	[0s / 3s],		train_loss: 4.3677
73:	[0s / 11s],		train_loss: 3.9886
91:	[0s / 18s],		train_loss: 3.8377
12:	[0s / 4s],		train_loss: 4.4287
25:	[0s / 3s],		train_loss: 4.3725
74:	[0s / 11s],		train_loss: 3.9777
26:	[0s / 3s],		train_loss: 4.3632
79:	[0s / 53s],		train_loss: 3.7882
92:	[0s / 18s],		train_loss: 3.8466
75:	[0s / 11s],		train_loss: 3.9645
27:	[0s / 4s],		train_loss: 4.3169
13:	[0s / 4s],		train_loss: 4.3867
93:	[0s / 18s],		train_loss: 3.8409
76:	[0s / 12s],		train_loss: 3.9515
28:	[0s / 4s],		train_loss: 4.3267
94:	[0s / 18s],		train_loss: 3.8388
77:	[0s / 12s],		train_loss: 3.9552
29:	[0s / 4s],		train_loss: 4.3109
14:	[0s / 5s],		train_loss: 4.3964
30:	[0s / 4s],		train_loss: 4.2986
80:	[0s / 53s],		train_loss: 3.7467
78:	[0s / 12s],		train_loss: 3.9227
95:	[0s / 18s],		train_loss: 3.8434
94:	[0s / 1m:58s],		train_loss: 3.7897
31:	[0s / 4s],		train_loss: 4.3244
79:	[0s / 12s],		train_loss: 3.9205
96:	[0s / 19s],		train_loss: 3.8426
15:	[0s / 5s],		train_loss: 4.3997
32:	[0s / 4s],		train_loss: 4.2893
80:	[0s / 12s],		train_loss: 3.9382
97:	[0s / 19s],		train_loss: 3.8547
33:	[0s / 4s],		train_loss: 4.3062
81:	[0s / 12s],		train_loss: 3.8999
81:	[0s / 54s],		train_loss: 3.7509
34:	[0s / 5s],		train_loss: 4.3253
98:	[0s / 19s],		train_loss: 3.8062
16:	[0s / 5s],		train_loss: 4.4021
82:	[0s / 13s],		train_loss: 3.9348
35:	[0s / 5s],		train_loss: 4.3152
83:	[0s / 13s],		train_loss: 3.8621
99:	[0s / 19s],		train_loss: 3.8471
55:	[2s / 1m:59s],		train_loss: 3.5992
36:	[0s / 5s],		train_loss: 4.3197
17:	[0s / 6s],		train_loss: 4.3876
84:	[0s / 13s],		train_loss: 3.8970
37:	[0s / 5s],		train_loss: 4.3290
85:	[0s / 13s],		train_loss: 3.9075
82:	[0s / 55s],		train_loss: 3.7461
95:	[1s / 1m:59s],		train_loss: 3.7678
0:	[0s / 0s],		train_loss: 5.0834
38:	[0s / 5s],		train_loss: 4.3165
86:	[0s / 13s],		train_loss: 3.8755
18:	[0s / 6s],		train_loss: 4.3835
39:	[0s / 5s],		train_loss: 4.2872
1:	[0s / 0s],		train_loss: 4.4687
87:	[0s / 13s],		train_loss: 3.8694
40:	[0s / 6s],		train_loss: 4.2755
2:	[0s / 0s],		train_loss: 4.4044
88:	[0s / 14s],		train_loss: 3.8695
41:	[0s / 6s],		train_loss: 4.2451
83:	[0s / 55s],		train_loss: 3.7652
33:	[3s / 2m:0s],		train_loss: 4.2651
19:	[0s / 7s],		train_loss: 4.3790
3:	[0s / 0s],		train_loss: 4.3754
89:	[0s / 14s],		train_loss: 3.8452
42:	[0s / 6s],		train_loss: 4.2674
90:	[0s / 14s],		train_loss: 3.8663
43:	[0s / 6s],		train_loss: 4.3054
4:	[0s / 1s],		train_loss: 4.3729
20:	[0s / 7s],		train_loss: 4.3827
91:	[0s / 14s],		train_loss: 3.8660
44:	[0s / 6s],		train_loss: 4.2460
5:	[0s / 1s],		train_loss: 4.3343
96:	[1s / 2m:0s],		train_loss: 3.7267
84:	[0s / 56s],		train_loss: 3.7349
45:	[0s / 6s],		train_loss: 4.2969
92:	[0s / 14s],		train_loss: 3.8699
6:	[0s / 1s],		train_loss: 4.3673
46:	[0s / 6s],		train_loss: 4.2656
56:	[1s / 2m:0s],		train_loss: 3.5697
93:	[0s / 14s],		train_loss: 3.8757
21:	[0s / 7s],		train_loss: 4.3782
47:	[0s / 7s],		train_loss: 4.3047
7:	[0s / 1s],		train_loss: 4.3277
94:	[0s / 14s],		train_loss: 3.8269
48:	[0s / 7s],		train_loss: 4.2587
95:	[0s / 15s],		train_loss: 3.8555
22:	[0s / 8s],		train_loss: 4.3626
85:	[0s / 56s],		train_loss: 3.7365
8:	[0s / 1s],		train_loss: 4.3546
49:	[0s / 7s],		train_loss: 4.2478
96:	[0s / 15s],		train_loss: 3.8564
50:	[0s / 7s],		train_loss: 4.2653
9:	[0s / 1s],		train_loss: 4.3511
97:	[0s / 15s],		train_loss: 3.8688
51:	[0s / 7s],		train_loss: 4.2841
23:	[0s / 8s],		train_loss: 4.3595
97:	[0s / 2m:1s],		train_loss: 3.7098
10:	[0s / 2s],		train_loss: 4.3256
98:	[0s / 15s],		train_loss: 3.8181
52:	[0s / 7s],		train_loss: 4.2412
99:	[0s / 15s],		train_loss: 3.8486
11:	[0s / 2s],		train_loss: 4.3614
53:	[0s / 7s],		train_loss: 4.2167
86:	[0s / 57s],		train_loss: 3.7017
24:	[0s / 8s],		train_loss: 4.3391
54:	[0s / 8s],		train_loss: 4.2368
12:	[0s / 2s],		train_loss: 4.3274
0:	[0s / 0s],		train_loss: 4.7790
55:	[0s / 8s],		train_loss: 4.2568
1:	[0s / 0s],		train_loss: 4.4194
13:	[0s / 2s],		train_loss: 4.3072
25:	[0s / 9s],		train_loss: 4.3380
56:	[0s / 8s],		train_loss: 4.2540
2:	[0s / 0s],		train_loss: 4.3516
14:	[0s / 2s],		train_loss: 4.3283
57:	[0s / 8s],		train_loss: 4.2682
98:	[0s / 2m:2s],		train_loss: 3.7407
3:	[0s / 0s],		train_loss: 4.3611
87:	[0s / 57s],		train_loss: 3.7155
15:	[0s / 3s],		train_loss: 4.3154
58:	[0s / 8s],		train_loss: 4.2326
26:	[0s / 9s],		train_loss: 4.3483
4:	[0s / 0s],		train_loss: 4.3641
59:	[0s / 8s],		train_loss: 4.2845
16:	[0s / 3s],		train_loss: 4.2826
5:	[0s / 0s],		train_loss: 4.3442
60:	[0s / 8s],		train_loss: 4.2219
57:	[2s / 2m:2s],		train_loss: 3.5442
27:	[0s / 9s],		train_loss: 4.3261
6:	[0s / 1s],		train_loss: 4.3474
17:	[0s / 3s],		train_loss: 4.3137
61:	[0s / 9s],		train_loss: 4.2691
88:	[0s / 58s],		train_loss: 3.6800
7:	[0s / 1s],		train_loss: 4.3363
62:	[0s / 9s],		train_loss: 4.2365
18:	[0s / 3s],		train_loss: 4.3093
8:	[0s / 1s],		train_loss: 4.3202
28:	[0s / 10s],		train_loss: 4.3331
63:	[0s / 9s],		train_loss: 4.1921
19:	[0s / 3s],		train_loss: 4.2957
9:	[0s / 1s],		train_loss: 4.3109
64:	[0s / 9s],		train_loss: 4.2725
99:	[1s / 2m:3s],		train_loss: 3.6885
20:	[0s / 4s],		train_loss: 4.2803
10:	[0s / 1s],		train_loss: 4.3422
29:	[0s / 10s],		train_loss: 4.3248
65:	[0s / 9s],		train_loss: 4.2064
89:	[0s / 59s],		train_loss: 3.6597
11:	[0s / 1s],		train_loss: 4.3241
66:	[0s / 9s],		train_loss: 4.2201
21:	[0s / 4s],		train_loss: 4.2708
12:	[0s / 2s],		train_loss: 4.3008
67:	[0s / 10s],		train_loss: 4.2710
30:	[0s / 10s],		train_loss: 4.3195
22:	[0s / 4s],		train_loss: 4.2800
13:	[0s / 2s],		train_loss: 4.3154
68:	[0s / 10s],		train_loss: 4.2824
14:	[0s / 2s],		train_loss: 4.2912
23:	[0s / 4s],		train_loss: 4.3064
69:	[0s / 10s],		train_loss: 4.2098
90:	[0s / 59s],		train_loss: 3.6800
31:	[0s / 11s],		train_loss: 4.3352
34:	[4s / 2m:4s],		train_loss: 4.2637
15:	[0s / 2s],		train_loss: 4.3102
70:	[0s / 10s],		train_loss: 4.1933
24:	[0s / 5s],		train_loss: 4.2846
71:	[0s / 10s],		train_loss: 4.2856
16:	[0s / 2s],		train_loss: 4.3157
25:	[0s / 5s],		train_loss: 4.2656
72:	[0s / 10s],		train_loss: 4.2656
17:	[0s / 2s],		train_loss: 4.3178
32:	[0s / 11s],		train_loss: 4.2998
0:	[1s / 1s],		train_loss: 4.9490
58:	[1s / 2m:4s],		train_loss: 3.5467
26:	[0s / 5s],		train_loss: 4.3265
73:	[0s / 10s],		train_loss: 4.2315
18:	[0s / 3s],		train_loss: 4.2966
91:	[0s / 1m:0s],		train_loss: 3.6838
74:	[0s / 11s],		train_loss: 4.2386
27:	[0s / 5s],		train_loss: 4.2830
19:	[0s / 3s],		train_loss: 4.3056
33:	[0s / 11s],		train_loss: 4.3169
75:	[0s / 11s],		train_loss: 4.2019
20:	[0s / 3s],		train_loss: 4.3147
28:	[0s / 5s],		train_loss: 4.2481
76:	[0s / 11s],		train_loss: 4.2160
21:	[0s / 3s],		train_loss: 4.2845
29:	[0s / 5s],		train_loss: 4.2463
34:	[0s / 12s],		train_loss