50:	[0s / 7s],		train_loss: 4.2721[I 2026-07-01 11:35:27,653] Trial 79 finished with value: 0.764078648756402 and parameters: {'num_nodes': [32], 'dropout': 0.2600931617720404, 'learning_rate': 0.00024667610898421703, 'batch_norm': False}. Best is trial 58 with value: 0.7812087895237219.
/scratch.hpc/luca.cotugno/Foundation_model_clinical_data/test_tabular_model.py:481: UserWarning: Choices for a categorical distribution should be a tuple of None, bool, int, float and str for persistent storage but contains [32] which is of type list.
  num_nodes  = trial.suggest_categorical("num_nodes", [[32], [64], [128], [64, 32], [128, 64]])
/scratch.hpc/luca.cotugno/Foundation_model_clinical_data/test_tabular_model.py:481: UserWarning: Choices for a categorical distribution should be a tuple of None, bool, int, float and str for persistent storage but contains [64] which is of type list.
  num_nodes  = trial.suggest_categorical("num_nodes", [[32], [64], [128], [64, 32], [128, 64]])
/scratch.hpc/luca.cotugno/Foundation_model_clinical_data/test_tabular_model.py:481: UserWarning: Choices for a categorical distribution should be a tuple of None, bool, int, float and str for persistent storage but contains [128] which is of type list.
  num_nodes  = trial.suggest_categorical("num_nodes", [[32], [64], [128], [64, 32], [128, 64]])
/scratch.hpc/luca.cotugno/Foundation_model_clinical_data/test_tabular_model.py:481: UserWarning: Choices for a categorical distribution should be a tuple of None, bool, int, float and str for persistent storage but contains [64, 32] which is of type list.
  num_nodes  = trial.suggest_categorical("num_nodes", [[32], [64], [128], [64, 32], [128, 64]])
/scratch.hpc/luca.cotugno/Foundation_model_clinical_data/test_tabular_model.py:481: UserWarning: Choices for a categorical distribution should be a tuple of None, bool, int, float and str for persistent storage but contains [128, 64] which is of type list.
  num_nodes  = trial.suggest_categorical("num_nodes", [[32], [64], [128], [64, 32], [128, 64]])
[I 2026-07-01 11:35:30,688] Trial 91 finished with value: 0.7688379795749379 and parameters: {'num_nodes': [32], 'dropout': 0.29174275012861733, 'learning_rate': 0.00014967900867236372, 'batch_norm': False}. Best is trial 58 with value: 0.7812087895237219.
/scratch.hpc/luca.cotugno/Foundation_model_clinical_data/test_tabular_model.py:481: UserWarning: Choices for a categorical distribution should be a tuple of None, bool, int, float and str for persistent storage but contains [32] which is of type list.
  num_nodes  = trial.suggest_categorical("num_nodes", [[32], [64], [128], [64, 32], [128, 64]])
/scratch.hpc/luca.cotugno/Foundation_model_clinical_data/test_tabular_model.py:481: UserWarning: Choices for a categorical distribution should be a tuple of None, bool, int, float and str for persistent storage but contains [64] which is of type list.
  num_nodes  = trial.suggest_categorical("num_nodes", [[32], [64], [128], [64, 32], [128, 64]])
/scratch.hpc/luca.cotugno/Foundation_model_clinical_data/test_tabular_model.py:481: UserWarning: Choices for a categorical distribution should be a tuple of None, bool, int, float and str for persistent storage but contains [128] which is of type list.
  num_nodes  = trial.suggest_categorical("num_nodes", [[32], [64], [128], [64, 32], [128, 64]])
/scratch.hpc/luca.cotugno/Foundation_model_clinical_data/test_tabular_model.py:481: UserWarning: Choices for a categorical distribution should be a tuple of None, bool, int, float and str for persistent storage but contains [64, 32] which is of type list.
  num_nodes  = trial.suggest_categorical("num_nodes", [[32], [64], [128], [64, 32], [128, 64]])
/scratch.hpc/luca.cotugno/Foundation_model_clinical_data/test_tabular_model.py:481: UserWarning: Choices for a categorical distribution should be a tuple of None, bool, int, float and str for persistent storage but contains [128, 64] which is of type list.
  num_nodes  = trial.suggest_categorical("num_nodes", [[32], [64], [128], [64, 32], [128, 64]])
[I 2026-07-01 11:35:36,584] Trial 93 finished with value: 0.7374145122213022 and parameters: {'num_nodes': [128, 64], 'dropout': 0.11865954626667741, 'learning_rate': 0.00015244798711279802, 'batch_norm': False}. Best is trial 58 with value: 0.7812087895237219.
/scratch.hpc/luca.cotugno/Foundation_model_clinical_data/test_tabular_model.py:481: UserWarning: Choices for a categorical distribution should be a tuple of None, bool, int, float and str for persistent storage but contains [32] which is of type list.
  num_nodes  = trial.suggest_categorical("num_nodes", [[32], [64], [128], [64, 32], [128, 64]])
/scratch.hpc/luca.cotugno/Foundation_model_clinical_data/test_tabular_model.py:481: UserWarning: Choices for a categorical distribution should be a tuple of None, bool, int, float and str for persistent storage but contains [64] which is of type list.
  num_nodes  = trial.suggest_categorical("num_nodes", [[32], [64], [128], [64, 32], [128, 64]])
/scratch.hpc/luca.cotugno/Foundation_model_clinical_data/test_tabular_model.py:481: UserWarning: Choices for a categorical distribution should be a tuple of None, bool, int, float and str for persistent storage but contains [128] which is of type list.
  num_nodes  = trial.suggest_categorical("num_nodes", [[32], [64], [128], [64, 32], [128, 64]])
/scratch.hpc/luca.cotugno/Foundation_model_clinical_data/test_tabular_model.py:481: UserWarning: Choices for a categorical distribution should be a tuple of None, bool, int, float and str for persistent storage but contains [64, 32] which is of type list.
  num_nodes  = trial.suggest_categorical("num_nodes", [[32], [64], [128], [64, 32], [128, 64]])
/scratch.hpc/luca.cotugno/Foundation_model_clinical_data/test_tabular_model.py:481: UserWarning: Choices for a categorical distribution should be a tuple of None, bool, int, float and str for persistent storage but contains [128, 64] which is of type list.
  num_nodes  = trial.suggest_categorical("num_nodes", [[32], [64], [128], [64, 32], [128, 64]])
[I 2026-07-01 11:35:38,398] Trial 92 finished with value: 0.7634672002944153 and parameters: {'num_nodes': [32], 'dropout': 0.24896499358149213, 'learning_rate': 0.0001512549737818696, 'batch_norm': False}. Best is trial 58 with value: 0.7812087895237219.
/scratch.hpc/luca.cotugno/Foundation_model_clinical_data/test_tabular_model.py:481: UserWarning: Choices for a categorical distribution should be a tuple of None, bool, int, float and str for persistent storage but contains [32] which is of type list.
  num_nodes  = trial.suggest_categorical("num_nodes", [[32], [64], [128], [64, 32], [128, 64]])
/scratch.hpc/luca.cotugno/Foundation_model_clinical_data/test_tabular_model.py:481: UserWarning: Choices for a categorical distribution should be a tuple of None, bool, int, float and str for persistent storage but contains [64] which is of type list.
  num_nodes  = trial.suggest_categorical("num_nodes", [[32], [64], [128], [64, 32], [128, 64]])
/scratch.hpc/luca.cotugno/Foundation_model_clinical_data/test_tabular_model.py:481: UserWarning: Choices for a categorical distribution should be a tuple of None, bool, int, float and str for persistent storage but contains [128] which is of type list.
  num_nodes  = trial.suggest_categorical("num_nodes", [[32], [64], [128], [64, 32], [128, 64]])
/scratch.hpc/luca.cotugno/Foundation_model_clinical_data/test_tabular_model.py:481: UserWarning: Choices for a categorical distribution should be a tuple of None, bool, int, float and str for persistent storage but contains [64, 32] which is of type list.
  num_nodes  = trial.suggest_categorical("num_nodes", [[32], [64], [128], [64, 32], [128, 64]])
/scratch.hpc/luca.cotugno/Foundation_model_clinical_data/test_tabular_model.py:481: UserWarning: Choices for a categorical distribution should be a tuple of None, bool, int, float and str for persistent storage but contains [128, 64] which is of type list.
  num_nodes  = trial.suggest_categorical("num_nodes", [[32], [64], [128], [64, 32], [128, 64]])
[I 2026-07-01 11:35:43,100] Trial 3 finished with value: 0.75853919403809 and parameters: {'num_nodes': [32], 'dropout': 0.139602663062737, 'learning_rate': 0.00011369104775509428, 'batch_norm': False}. Best is trial 58 with value: 0.7812087895237219.
/scratch.hpc/luca.cotugno/Foundation_model_clinical_data/test_tabular_model.py:481: UserWarning: Choices for a categorical distribution should be a tuple of None, bool, int, float and str for persistent storage but contains [32] which is of type list.
  num_nodes  = trial.suggest_categorical("num_nodes", [[32], [64], [128], [64, 32], [128, 64]])
/scratch.hpc/luca.cotugno/Foundation_model_clinical_data/test_tabular_model.py:481: UserWarning: Choices for a categorical distribution should be a tuple of None, bool, int, float and str for persistent storage but contains [64] which is of type list.
  num_nodes  = trial.suggest_categorical("num_nodes", [[32], [64], [128], [64, 32], [128, 64]])
/scratch.hpc/luca.cotugno/Foundation_model_clinical_data/test_tabular_model.py:481: UserWarning: Choices for a categorical distribution should be a tuple of None, bool, int, float and str for persistent storage but contains [128] which is of type list.
  num_nodes  = trial.suggest_categorical("num_nodes", [[32], [64], [128], [64, 32], [128, 64]])
/scratch.hpc/luca.cotugno/Foundation_model_clinical_data/test_tabular_model.py:481: UserWarning: Choices for a categorical distribution should be a tuple of None, bool, int, float and str for persistent storage but contains [64, 32] which is of type list.
  num_nodes  = trial.suggest_categorical("num_nodes", [[32], [64], [128], [64, 32], [128, 64]])
/scratch.hpc/luca.cotugno/Foundation_model_clinical_data/test_tabular_model.py:481: UserWarning: Choices for a categorical distribution should be a tuple of None, bool, int, float and str for persistent storage but contains [128, 64] which is of type list.
  num_nodes  = trial.suggest_categorical("num_nodes", [[32], [64], [128], [64, 32], [128, 64]])
[I 2026-07-01 11:35:44,430] Trial 89 finished with value: 0.7546999110620419 and parameters: {'num_nodes': [32], 'dropout': 0.28073048104373666, 'learning_rate': 0.0001513723578077655, 'batch_norm': False}. Best is trial 58 with value: 0.7812087895237219.
/scratch.hpc/luca.cotugno/Foundation_model_clinical_data/test_tabular_model.py:481: UserWarning: Choices for a categorical distribution should be a tuple of None, bool, int, float and str for persistent storage but contains [32] which is of type list.
  num_nodes  = trial.suggest_categorical("num_nodes", [[32], [64], [128], [64, 32], [128, 64]])
/scratch.hpc/luca.cotugno/Foundation_model_clinical_data/test_tabular_model.py:481: UserWarning: Choices for a categorical distribution should be a tuple of None, bool, int, float and str for persistent storage but contains [64] which is of type list.
  num_nodes  = trial.suggest_categorical("num_nodes", [[32], [64], [128], [64, 32], [128, 64]])
/scratch.hpc/luca.cotugno/Foundation_model_clinical_data/test_tabular_model.py:481: UserWarning: Choices for a categorical distribution should be a tuple of None, bool, int, float and str for persistent storage but contains [128] which is of type list.
  num_nodes  = trial.suggest_categorical("num_nodes", [[32], [64], [128], [64, 32], [128, 64]])
/scratch.hpc/luca.cotugno/Foundation_model_clinical_data/test_tabular_model.py:481: UserWarning: Choices for a categorical distribution should be a tuple of None, bool, int, float and str for persistent storage but contains [64, 32] which is of type list.
  num_nodes  = trial.suggest_categorical("num_nodes", [[32], [64], [128], [64, 32], [128, 64]])
/scratch.hpc/luca.cotugno/Foundation_model_clinical_data/test_tabular_model.py:481: UserWarning: Choices for a categorical distribution should be a tuple of None, bool, int, float and str for persistent storage but contains [128, 64] which is of type list.
  num_nodes  = trial.suggest_categorical("num_nodes", [[32], [64], [128], [64, 32], [128, 64]])
[I 2026-07-01 11:35:48,457] Trial 95 finished with value: 0.7475484558530376 and parameters: {'num_nodes': [128, 64], 'dropout': 0.24880114265525577, 'learning_rate': 0.00015192964930357282, 'batch_norm': False}. Best is trial 58 with value: 0.7812087895237219.
[I 2026-07-01 11:35:51,324] Trial 96 finished with value: 0.7717227129144049 and parameters: {'num_nodes': [32], 'dropout': 0.24762378360825496, 'learning_rate': 0.00013827706051549536, 'batch_norm': False}. Best is trial 58 with value: 0.7812087895237219.
[I 2026-07-01 11:35:56,170] Trial 97 finished with value: 0.752717974668016 and parameters: {'num_nodes': [32], 'dropout': 0.29186440649794043, 'learning_rate': 0.0006117805680538243, 'batch_norm': False}. Best is trial 58 with value: 0.7812087895237219.
[I 2026-07-01 11:35:59,025] Trial 52 finished with value: 0.7505366945747846 and parameters: {'num_nodes': [64, 32], 'dropout': 0.2520903455599479, 'learning_rate': 0.0001507084461846804, 'batch_norm': False}. Best is trial 58 with value: 0.7812087895237219.
[I 2026-07-01 11:36:00,891] Trial 99 finished with value: 0.75848744134695 and parameters: {'num_nodes': [32], 'dropout': 0.291730326922075, 'learning_rate': 0.0015041827461252807, 'batch_norm': False}. Best is trial 58 with value: 0.7812087895237219.
[I 2026-07-01 11:36:01,853] Trial 94 finished with value: 0.7503737694360106 and parameters: {'num_nodes': [128, 64], 'dropout': 0.2506601670646119, 'learning_rate': 0.00014165074544494858, 'batch_norm': False}. Best is trial 58 with value: 0.7812087895237219.
[I 2026-07-01 11:36:03,238] Trial 90 finished with value: 0.7585085257766737 and parameters: {'num_nodes': [32], 'dropout': 0.2823450541445631, 'learning_rate': 0.00011013789327583945, 'batch_norm': False}. Best is trial 58 with value: 0.7812087895237219.
[I 2026-07-01 11:36:05,703] Trial 98 finished with value: 0.760896816634465 and parameters: {'num_nodes': [32], 'dropout': 0.27011251753036974, 'learning_rate': 0.00014052124416793913, 'batch_norm': False}. Best is trial 58 with value: 0.7812087895237219.
[I 2026-07-01 11:36:12,568] A new study created in memory with name: rsf_tuning_tabdpt_1_NaN_seed123
[I 2026-07-01 11:37:16,711] Trial 4 finished with value: 0.7686617105361556 and parameters: {'n_estimators': 50, 'max_depth': 3, 'min_samples_split': 7, 'min_samples_leaf': 5, 'max_features': 'log2'}. Best is trial 4 with value: 0.7686617105361556.
[I 2026-07-01 11:38:10,319] Trial 3 finished with value: 0.7698563207921627 and parameters: {'n_estimators': 100, 'max_depth': 3, 'min_samples_split': 16, 'min_samples_leaf': 8, 'max_features': 'log2'}. Best is trial 3 with value: 0.7698563207921627.
[I 2026-07-01 11:44:37,845] Trial 0 finished with value: 0.7759578454063113 and parameters: {'n_estimators': 250, 'max_depth': 6, 'min_samples_split': 10, 'min_samples_leaf': 7, 'max_features': 'log2'}. Best is trial 0 with value: 0.7759578454063113.
[I 2026-07-01 11:45:36,990] Trial 2 finished with value: 0.7751045523663063 and parameters: {'n_estimators': 250, 'max_depth': 7, 'min_samples_split': 7, 'min_samples_leaf': 7, 'max_features': 'log2'}. Best is trial 0 with value: 0.7759578454063113.
[I 2026-07-01 11:46:51,619] Trial 1 finished with value: 0.7770872602390371 and parameters: {'n_estimators': 250, 'max_depth': 8, 'min_samples_split': 5, 'min_samples_leaf': 4, 'max_features': 'log2'}. Best is trial 1 with value: 0.7770872602390371.
[I 2026-07-01 11:47:35,232] Trial 11 finished with value: 0.7698965885536012 and parameters: {'n_estimators': 100, 'max_depth': 3, 'min_samples_split': 19, 'min_samples_leaf': 5, 'max_features': 'log2'}. Best is trial 1 with value: 0.7770872602390371.
[I 2026-07-01 11:51:14,781] Trial 6 finished with value: 0.7748725333599228 and parameters: {'n_estimators': 150, 'max_depth': 6, 'min_samples_split': 17, 'min_samples_leaf': 5, 'max_features': 'sqrt'}. Best is trial 1 with value: 0.7770872602390371.
[I 2026-07-01 11:54:51,437] Trial 13 finished with value: 0.7727498470783821 and parameters: {'n_estimators': 300, 'max_depth': 4, 'min_samples_split': 7, 'min_samples_leaf': 14, 'max_features': 'log2'}. Best is trial 1 with value: 0.7770872602390371.
[I 2026-07-01 11:56:40,729] Trial 12 finished with value: 0.7746826996274273 and parameters: {'n_estimators': 100, 'max_depth': 6, 'min_samples_split': 12, 'min_samples_leaf': 13, 'max_features': 'sqrt'}. Best is trial 1 with value: 0.7770872602390371.
[I 2026-07-01 11:57:45,269] Trial 10 finished with value: 0.7750834597293623 and parameters: {'n_estimators': 150, 'max_depth': 5, 'min_samples_split': 16, 'min_samples_leaf': 3, 'max_features': 'sqrt'}. Best is trial 1 with value: 0.7770872602390371.
[I 2026-07-01 12:02:17,782] Trial 8 finished with value: 0.775380674159027 and parameters: {'n_estimators': 200, 'max_depth': 9, 'min_samples_split': 20, 'min_samples_leaf': 12, 'max_features': 'sqrt'}. Best is trial 1 with value: 0.7770872602390371.
[I 2026-07-01 12:07:17,183] Trial 14 finished with value: 0.7773173617329711 and parameters: {'n_estimators': 150, 'max_depth': 7, 'min_samples_split': 17, 'min_samples_leaf': 14, 'max_features': 'sqrt'}. Best is trial 14 with value: 0.7773173617329711.
[I 2026-07-01 12:09:00,501] Trial 7 finished with value: 0.7756222807276576 and parameters: {'n_estimators': 250, 'max_depth': 9, 'min_samples_split': 6, 'min_samples_leaf': 9, 'max_features': 'sqrt'}. Best is trial 14 with value: 0.7773173617329711.
[I 2026-07-01 12:12:04,372] Trial 5 finished with value: 0.7749511513703503 and parameters: {'n_estimators': 250, 'max_depth': 10, 'min_samples_split': 7, 'min_samples_leaf': 7, 'max_features': 'sqrt'}. Best is trial 14 with value: 0.7773173617329711.
[I 2026-07-01 12:14:06,636] Trial 18 finished with value: 0.7765944595395285 and parameters: {'n_estimators': 300, 'max_depth': 8, 'min_samples_split': 11, 'min_samples_leaf': 10, 'max_features': 'log2'}. Best is trial 14 with value: 0.7773173617329711.
[I 2026-07-01 12:16:12,320] Trial 9 finished with value: 0.7752732934618578 and parameters: {'n_estimators': 300, 'max_depth': 9, 'min_samples_split': 12, 'min_samples_leaf': 11, 'max_features': 'sqrt'}. Best is trial 14 with value: 0.7773173617329711.
[I 2026-07-01 12:16:27,358] Trial 16 finished with value: 0.7760230408295926 and parameters: {'n_estimators': 200, 'max_depth': 6, 'min_samples_split': 8, 'min_samples_leaf': 5, 'max_features': 'sqrt'}. Best is trial 14 with value: 0.7773173617329711.
[I 2026-07-01 12:16:35,080] Trial 15 finished with value: 0.7767248503860912 and parameters: {'n_estimators': 200, 'max_depth': 7, 'min_samples_split': 14, 'min_samples_leaf': 8, 'max_features': 'sqrt'}. Best is trial 14 with value: 0.7773173617329711.
[I 2026-07-01 12:19:53,760] Trial 21 finished with value: 0.774140043604233 and parameters: {'n_estimators': 200, 'max_depth': 8, 'min_samples_split': 13, 'min_samples_leaf': 11, 'max_features': 'log2'}. Best is trial 14 with value: 0.7773173617329711.
[I 2026-07-01 12:22:39,055] Trial 25 finished with value: 0.7766021295893264 and parameters: {'n_estimators': 150, 'max_depth': 8, 'min_samples_split': 14, 'min_samples_leaf': 15, 'max_features': 'log2'}. Best is trial 14 with value: 0.7773173617329711.
[I 2026-07-01 12:23:54,095] Trial 23 finished with value: 0.7750144292811821 and parameters: {'n_estimators': 200, 'max_depth': 7, 'min_samples_split': 14, 'min_samples_leaf': 15, 'max_features': 'log2'}. Best is trial 14 with value: 0.7773173617329711.
[I 2026-07-01 12:26:58,097] Trial 24 finished with value: 0.7770028896912613 and parameters: {'n_estimators': 200, 'max_depth': 8, 'min_samples_split': 14, 'min_samples_leaf': 15, 'max_features': 'log2'}. Best is trial 14 with value: 0.7773173617329711.
[I 2026-07-01 12:27:03,400] Trial 27 finished with value: 0.7693635200926542 and parameters: {'n_estimators': 50, 'max_depth': 10, 'min_samples_split': 9, 'min_samples_leaf': 3, 'max_features': 'log2'}. Best is trial 14 with value: 0.7773173617329711.
[I 2026-07-01 12:27:06,725] Trial 26 finished with value: 0.7725485082711899 and parameters: {'n_estimators': 150, 'max_depth': 8, 'min_samples_split': 5, 'min_samples_leaf': 3, 'max_features': 'log2'}. Best is trial 14 with value: 0.7773173617329711.
[I 2026-07-01 12:37:28,832] Trial 17 finished with value: 0.7769319417306317 and parameters: {'n_estimators': 250, 'max_depth': 10, 'min_samples_split': 5, 'min_samples_leaf': 11, 'max_features': 'sqrt'}. Best is trial 14 with value: 0.7773173617329711.
[I 2026-07-01 12:38:06,731] Trial 30 finished with value: 0.7757814342609619 and parameters: {'n_estimators': 150, 'max_depth': 8, 'min_samples_split': 18, 'min_samples_leaf': 13, 'max_features': 'log2'}. Best is trial 14 with value: 0.7773173617329711.
[I 2026-07-01 12:38:09,763] Trial 20 finished with value: 0.7778350900943224 and parameters: {'n_estimators': 200, 'max_depth': 8, 'min_samples_split': 13, 'min_samples_leaf': 11, 'max_features': 'sqrt'}. Best is trial 20 with value: 0.7778350900943224.
[I 2026-07-01 12:38:16,384] Trial 19 finished with value: 0.7757430840119729 and parameters: {'n_estimators': 200, 'max_depth': 9, 'min_samples_split': 13, 'min_samples_leaf': 11, 'max_features': 'sqrt'}. Best is trial 20 with value: 0.7778350900943224.
[I 2026-07-01 12:38:16,390] Trial 29 finished with value: 0.7769568693924745 and parameters: {'n_estimators': 150, 'max_depth': 10, 'min_samples_split': 18, 'min_samples_leaf': 13, 'max_features': 'log2'}. Best is trial 20 with value: 0.7778350900943224.
[I 2026-07-01 12:38:27,951] Trial 22 finished with value: 0.7757680116738158 and parameters: {'n_estimators': 200, 'max_depth': 8, 'min_samples_split': 14, 'min_samples_leaf': 15, 'max_features': 'sqrt'}. Best is trial 20 with value: 0.7778350900943224.
