[I 2026-07-01 11:29:40,576] Trial 10 finished with value: 0.7322651194528782 and parameters: {'num_nodes': [128], 'dropout': 0.22305588440029428, 'learning_rate': 0.001459756522097755, 'batch_norm': False}. Best is trial 7 with value: 0.7504926089489987.
/scratch.hpc/luca.cotugno/Foundation_model_clinical_data/test_tabular_model.py:481: UserWarning: Choices for a categorical distribution should be a tuple of None, bool, int, float and str for persistent storage but contains [32] which is of type list.
  num_nodes  = trial.suggest_categorical("num_nodes", [[32], [64], [128], [64, 32], [128, 64]])
/scratch.hpc/luca.cotugno/Foundation_model_clinical_data/test_tabular_model.py:481: UserWarning: Choices for a categorical distribution should be a tuple of None, bool, int, float and str for persistent storage but contains [64] which is of type list.
  num_nodes  = trial.suggest_categorical("num_nodes", [[32], [64], [128], [64, 32], [128, 64]])
/scratch.hpc/luca.cotugno/Foundation_model_clinical_data/test_tabular_model.py:481: UserWarning: Choices for a categorical distribution should be a tuple of None, bool, int, float and str for persistent storage but contains [128] which is of type list.
  num_nodes  = trial.suggest_categorical("num_nodes", [[32], [64], [128], [64, 32], [128, 64]])
/scratch.hpc/luca.cotugno/Foundation_model_clinical_data/test_tabular_model.py:481: UserWarning: Choices for a categorical distribution should be a tuple of None, bool, int, float and str for persistent storage but contains [64, 32] which is of type list.
  num_nodes  = trial.suggest_categorical("num_nodes", [[32], [64], [128], [64, 32], [128, 64]])
/scratch.hpc/luca.cotugno/Foundation_model_clinical_data/test_tabular_model.py:481: UserWarning: Choices for a categorical distribution should be a tuple of None, bool, int, float and str for persistent storage but contains [128, 64] which is of type list.
  num_nodes  = trial.suggest_categorical("num_nodes", [[32], [64], [128], [64, 32], [128, 64]])

87:	[0s / 13s],		train_loss: 4.2000
22:	[0s / 4s],		train_loss: 4.3673
17:	[0s / 2s],		train_loss: 4.3560
88:	[0s / 13s],		train_loss: 4.2319
83:	[0s / 28s],		train_loss: 3.9822
23:	[0s / 4s],		train_loss: 4.3637
18:	[0s / 2s],		train_loss: 4.3320
89:	[0s / 13s],		train_loss: 4.2842
99:	[0s / 1m:1s],		train_loss: 4.0212
19:	[0s / 2s],		train_loss: 4.3577
24:	[0s / 4s],		train_loss: 4.3351
90:	[0s / 14s],		train_loss: 4.2346
20:	[0s / 3s],		train_loss: 4.3072
84:	[0s / 29s],		train_loss: 3.9703
25:	[0s / 5s],		train_loss: 4.3490
91:	[0s / 14s],		train_loss: 4.2380
21:	[0s / 3s],		train_loss: 4.3387
26:	[0s / 5s],		train_loss: 4.3335
92:	[0s / 14s],		train_loss: 4.2120
22:	[0s / 3s],		train_loss: 4.3185
40:	[1s / 44s],		train_loss: 4.2047
93:	[0s / 14s],		train_loss: 4.2284
85:	[0s / 29s],		train_loss: 3.9960
27:	[0s / 5s],		train_loss: 4.3155
23:	[0s / 3s],		train_loss: 4.3242
0:	[0s / 0s],		train_loss: 4.7659
94:	[0s / 14s],		train_loss: 4.2475
24:	[0s / 3s],		train_loss: 4.3355
28:	[0s / 5s],		train_loss: 4.3383
95:	[0s / 14s],		train_loss: 4.2385
86:	[0s / 29s],		train_loss: 3.9894
25:	[0s / 3s],		train_loss: 4.3383
29:	[0s / 5s],		train_loss: 4.2924
96:	[0s / 14s],		train_loss: 4.2247
26:	[0s / 4s],		train_loss: 4.3463
30:	[0s / 6s],		train_loss: 4.3117
97:	[0s / 15s],		train_loss: 4.2345
27:	[0s / 4s],		train_loss: 4.3893
87:	[0s / 30s],		train_loss: 3.9652
88:	[1s / 2m:54s],		train_loss: 3.4584
1:	[0s / 1s],		train_loss: 4.5317
98:	[0s / 15s],		train_loss: 4.2258
28:	[0s / 4s],		train_loss: 4.3482
31:	[0s / 6s],		train_loss: 4.2925
99:	[0s / 15s],		train_loss: 4.2296
29:	[0s / 4s],		train_loss: 4.3618
41:	[0s / 45s],		train_loss: 4.2138
32:	[0s / 6s],		train_loss: 4.3116
30:	[0s / 4s],		train_loss: 4.3372
88:	[0s / 30s],		train_loss: 3.9832
31:	[0s / 4s],		train_loss: 4.3326
33:	[0s / 6s],		train_loss: 4.2928
0:	[0s / 0s],		train_loss: 4.7461
32:	[0s / 4s],		train_loss: 4.3233
34:	[0s / 6s],		train_loss: 4.2932
1:	[0s / 0s],		train_loss: 4.6034
89:	[0s / 31s],		train_loss: 3.9721
2:	[0s / 2s],		train_loss: 4.4689
33:	[0s / 5s],		train_loss: 4.3197
99:	[3s / 6m:46s],		train_loss: 4.0614
2:	[0s / 0s],		train_loss: 4.5246
35:	[0s / 7s],		train_loss: 4.2997
34:	[0s / 5s],		train_loss: 4.3246
90:	[0s / 31s],		train_loss: 3.9260
3:	[0s / 0s],		train_loss: 4.5266
35:	[0s / 5s],		train_loss: 4.3667
36:	[0s / 7s],		train_loss: 4.3321
36:	[0s / 5s],		train_loss: 4.3444
4:	[0s / 0s],		train_loss: 4.4864
3:	[0s / 2s],		train_loss: 4.4543
42:	[1s / 46s],		train_loss: 4.2122
91:	[0s / 31s],		train_loss: 3.9272
37:	[0s / 7s],		train_loss: 4.2808
37:	[0s / 5s],		train_loss: 4.3097
5:	[0s / 1s],		train_loss: 4.4720
38:	[0s / 5s],		train_loss: 4.3238
38:	[0s / 7s],		train_loss: 4.2824
6:	[0s / 1s],		train_loss: 4.4402
39:	[0s / 5s],		train_loss: 4.3196
92:	[0s / 32s],		train_loss: 3.9374
39:	[0s / 7s],		train_loss: 4.2884
7:	[0s / 1s],		train_loss: 4.4586
89:	[1s / 2m:56s],		train_loss: 3.4760
40:	[0s / 6s],		train_loss: 4.3422
8:	[0s / 1s],		train_loss: 4.4165
4:	[0s / 3s],		train_loss: 4.4507
40:	[0s / 8s],		train_loss: 4.2715
41:	[0s / 6s],		train_loss: 4.3452
93:	[0s / 32s],		train_loss: 3.9207
9:	[0s / 1s],		train_loss: 4.4087
42:	[0s / 6s],		train_loss: 4.2915
41:	[0s / 8s],		train_loss: 4.2708
10:	[0s / 1s],		train_loss: 4.3768
43:	[0s / 6s],		train_loss: 4.3149
94:	[0s / 32s],		train_loss: 3.9194
42:	[0s / 8s],		train_loss: 4.2679
44:	[0s / 6s],		train_loss: 4.3149
11:	[0s / 2s],		train_loss: 4.4011
43:	[1s / 47s],		train_loss: 4.1838
5:	[0s / 3s],		train_loss: 4.4286
45:	[0s / 6s],		train_loss: 4.2617
43:	[0s / 8s],		train_loss: 4.2583
12:	[0s / 2s],		train_loss: 4.3313
95:	[0s / 33s],		train_loss: 3.8965
46:	[0s / 6s],		train_loss: 4.2983
13:	[0s / 2s],		train_loss: 4.3827
44:	[0s / 8s],		train_loss: 4.2549
47:	[0s / 7s],		train_loss: 4.3176
14:	[0s / 2s],		train_loss: 4.3467
48:	[0s / 7s],		train_loss: 4.3001
45:	[0s / 9s],		train_loss: 4.2386
96:	[0s / 33s],		train_loss: 3.9335
6:	[0s / 4s],		train_loss: 4.4041
15:	[0s / 2s],		train_loss: 4.3435
49:	[0s / 7s],		train_loss: 4.3101
46:	[0s / 9s],		train_loss: 4.2312
50:	[0s / 7s],		train_loss: 4.3059
16:	[0s / 2s],		train_loss: 4.3324
97:	[0s / 33s],		train_loss: 3.9035
47:	[0s / 9s],		train_loss: 4.2415
51:	[0s / 7s],		train_loss: 4.3431
17:	[0s / 3s],		train_loss: 4.3137
52:	[0s / 7s],		train_loss: 4.3693
48:	[0s / 9s],		train_loss: 4.2273
18:	[0s / 3s],		train_loss: 4.3395
44:	[1s / 48s],		train_loss: 4.2017
98:	[0s / 34s],		train_loss: 3.9262
7:	[0s / 4s],		train_loss: 4.4098
53:	[0s / 7s],		train_loss: 4.3095
19:	[0s / 3s],		train_loss: 4.3168
49:	[0s / 10s],		train_loss: 4.2572
54:	[0s / 8s],		train_loss: 4.2865
20:	[0s / 3s],		train_loss: 4.3254
90:	[2s / 2m:58s],		train_loss: 3.4596
55:	[0s / 8s],		train_loss: 4.2620
50:	[0s / 10s],		train_loss: 4.2719
21:	[0s / 3s],		train_loss: 4.3280
99:	[0s / 34s],		train_loss: 3.9071
56:	[0s / 8s],		train_loss: 4.2958
8:	[0s / 5s],		train_loss: 4.3794
51:	[0s / 10s],		train_loss: 4.2387
22:	[0s / 3s],		train_loss: 4.3033
57:	[0s / 8s],		train_loss: 4.3072
52:	[0s / 10s],		train_loss: 4.2347
23:	[0s / 4s],		train_loss: 4.3005
58:	[0s / 8s],		train_loss: 4.2785
0:	[0s / 0s],		train_loss: 5.0708
45:	[0s / 49s],		train_loss: 4.1643
59:	[0s / 8s],		train_loss: 4.3166
24:	[0s / 4s],		train_loss: 4.2944
53:	[0s / 10s],		train_loss: 4.2390
60:	[0s / 8s],		train_loss: 4.3548
25:	[0s / 4s],		train_loss: 4.2992
54:	[0s / 10s],		train_loss: 4.2028
1:	[0s / 0s],		train_loss: 4.6869
9:	[0s / 6s],		train_loss: 4.3616
61:	[0s / 9s],		train_loss: 4.2718
26:	[0s / 4s],		train_loss: 4.3064
0:	[3s / 3s],		train_loss: 4.9187
62:	[0s / 9s],		train_loss: 4.3117
55:	[0s / 11s],		train_loss: 4.2149
27:	[0s / 4s],		train_loss: 4.2971
63:	[0s / 9s],		train_loss: 4.2750
2:	[0s / 0s],		train_loss: 4.6203
56:	[0s / 11s],		train_loss: 4.2081
28:	[0s / 4s],		train_loss: 4.3183
64:	[0s / 9s],		train_loss: 4.2882
29:	[0s / 5s],		train_loss: 4.2690
65:	[0s / 9s],		train_loss: 4.2823
57:	[0s / 11s],		train_loss: 4.2284
10:	[0s / 6s],		train_loss: 4.3831
3:	[0s / 1s],		train_loss: 4.5706
30:	[0s / 5s],		train_loss: 4.3015
66:	[0s / 9s],		train_loss: 4.2560
46:	[1s / 50s],		train_loss: 4.1656
58:	[0s / 11s],		train_loss: 4.1814
67:	[0s / 9s],		train_loss: 4.2677
31:	[0s / 5s],		train_loss: 4.2847
59:	[0s / 12s],		train_loss: 4.1988
4:	[0s / 1s],		train_loss: 4.5586
68:	[0s / 10s],		train_loss: 4.2841
32:	[0s / 5s],		train_loss: 4.2704
69:	[0s / 10s],		train_loss: 4.2805
60:	[0s / 12s],		train_loss: 4.2182
91:	[2s / 3m:0s],		train_loss: 3.4367
33:	[0s / 5s],		train_loss: 4.2556
11:	[0s / 7s],		train_loss: 4.3846
5:	[0s / 1s],		train_loss: 4.5349
70:	[0s / 10s],		train_loss: 4.2628
34:	[0s / 5s],		train_loss: 4.2549
61:	[0s / 12s],		train_loss: 4.2114
71:	[0s / 10s],		train_loss: 4.2527
35:	[0s / 6s],		train_loss: 4.2783
72:	[0s / 10s],		train_loss: 4.2712
6:	[0s / 2s],		train_loss: 4.5120
62:	[0s / 12s],		train_loss: 4.1853
36:	[0s / 6s],		train_loss: 4.2740
73:	[0s / 10s],		train_loss: 4.2456
63:	[0s / 12s],		train_loss: 4.1700
12:	[0s / 7s],		train_loss: 4.3563
74:	[0s / 10s],		train_loss: 4.2792
37:	[0s / 6s],		train_loss: 4.2516
7:	[0s / 2s],		train_loss: 4.4920
47:	[1s / 51s],		train_loss: 4.1688
64:	[0s / 13s],		train_loss: 4.1964
75:	[0s / 11s],		train_loss: 4.2485
38:	[0s / 6s],		train_loss: 4.2433
76:	[0s / 11s],		train_loss: 4.2667
65:	[0s / 13s],		train_loss: 4.1941
39:	[0s / 6s],		train_loss: 4.2427
8:	[0s / 2s],		train_loss: 4.4786
77:	[0s / 11s],		train_loss: 4.2455
66:	[0s / 13s],		train_loss: 4.1954
40:	[0s / 6s],		train_loss: 4.2242
78:	[0s / 11s],		train_loss: 4.2617
13:	[0s / 8s],		train_loss: 4.3600
41:	[0s / 7s],		train_loss: 4.2578
67:	[0s / 13s],		train_loss: 4.1633
9:	[0s / 3s],		train_loss: 4.4627
79:	[0s / 11s],		train_loss: 4.3257
42:	[0s / 7s],		train_loss: 4.2305
80:	[0s / 11s],		train_loss: 4.2644
68:	[0s / 13s],		train_loss: 4.1825
48:	[0s / 52s],		train_loss: 4.1222
81:	[0s / 12s],		train_loss: 4.2502
43:	[0s / 7s],		train_loss: 4.2388
10:	[0s / 3s],		train_loss: 4.4395
69:	[0s / 14s],		train_loss: 4.1702
82:	[0s / 12s],		train_loss: 4.2540
44:	[0s / 7s],		train_loss: 4.2452
14:	[0s / 9s],		train_loss: 4.3807
83:	[0s / 12s],		train_loss: 4.2392
70:	[0s / 14s],		train_loss: 4.1829
92:	[2s / 3m:2s],		train_loss: 3.4546
45:	[0s / 7s],		train_loss: 4.2188
11:	[0s / 3s],		train_loss: 4.4434
84:	[0s / 12s],		train_loss: 4.2050
71:	[0s / 14s],		train_loss: 4.1465
46:	[0s / 7s],		train_loss: 4.2097
85:	[0s / 12s],		train_loss: 4.2744
47:	[0s / 8s],		train_loss: 4.2249
72:	[0s / 14s],		train_loss: 4.1415
86:	[0s / 12s],		train_loss: 4.2456
12:	[0s / 4s],		train_loss: 4.4490
1:	[3s / 7s],		train_loss: 4.6405
48:	[0s / 8s],		train_loss: 4.2322
15:	[0s / 9s],		train_loss: 4.3693
87:	[0s / 12s],		train_loss: 4.2604
73:	[0s / 14s],		train_loss: 4.1378
13:	[0s / 4s],		train_loss: 4.4094
88:	[0s / 13s],		train_loss: 4.2489
49:	[0s / 8s],		train_loss: 4.2134
49:	[1s / 53s],		train_loss: 4.1351
74:	[0s / 15s],		train_loss: 4.1514
89:	[0s / 13s],		train_loss: 4.2272
50:	[0s / 8s],		train_loss: 4.2122
75:	[0s / 15s],		train_loss: 4.1322
90:	[0s / 13s],		train_loss: 4.2171
14:	[0s / 4s],		train_loss: 4.4290
51:	[0s / 8s],		train_loss: 4.1986
16:	[0s / 10s],		train_loss: 4.3349
91:	[0s / 13s],		train_loss: 4.2310
76:	[0s / 15s],		train_loss: 4.1496
52:	[0s / 9s],		train_loss: 4.1914
92:	[0s / 13s],		train_loss: 4.2459
15:	[0s / 5s],		train_loss: 4.4300
77:	[0s / 15s],		train_loss: 4.1646
53:	[0s / 9s],		train_loss: 4.2194
93:	[0s / 13s],		train_loss: 4.2151
78:	[0s / 15s],		train_loss: 4.1569
54:	[0s / 9s],		train_loss: 4.1920
94:	[0s / 13s],		train_loss: 4.2321
16:	[0s / 5s],		train_loss: 4.4171
95:	[0s / 14s],		train_loss: 4.2182
55:	[0s / 9s],		train_loss: 4.1724
79:	[0s / 16s],		train_loss: 4.1299
17:	[0s / 11s],		train_loss: 4.3663
50:	[1s / 55s],		train_loss: 4.1506
96:	[0s / 14s],		train_loss: 4.2879
56:	[0s / 9s],		train_loss: 4.1793
80:	[0s / 16s],		train_loss: 4.1328
17:	[0s / 5s],		train_loss: 4.4168
97:	[0s / 14s],		train_loss: 4.2184
57:	[0s / 9s],		train_loss: 4.1896
93:	[2s / 3m:4s],		train_loss: 3.4803
81:	[0s / 16s],		train_loss: 4.1651
98:	[0s / 14s],		train_loss: 4.1693
58:	[0s / 10s],		train_loss: 4.1777
99:	[0s / 14s],		train_loss: 4.2388
18:	[0s / 6s],		train_loss: 4.4116
59:	[0s / 10s],		train_loss: 4.1825
82:	[0s / 16s],		train_loss: 4.1351
18:	[0s / 11s],		train_loss: 4.3523
60:	[0s / 10s],		train_loss: 4.1743
83:	[0s / 16s],		train_loss: 4.1439
19:	[0s / 6s],		train_loss: 4.3762
61:	[0s / 10s],		train_loss: 4.1719
84:	[0s / 17s],		train_loss: 4.1201
51:	[0s / 56s],		train_loss: 4.1519
19:	[0s / 12s],		train_loss: 4.3296
20:	[0s / 6s],		train_loss: 4.3825
62:	[0s / 10s],		train_loss: 4.1725
85:	[0s / 17s],		train_loss: 4.1124
21:	[0s / 6s],		train_loss: 4.3774
63:	[0s / 10s],		train_loss: 4.1321
86:	[0s / 17s],		train_loss: 4.1393
20:	[0s / 12s],		train_loss: 4.3017
22:	[0s / 7s],		train_loss: 4.3760
64:	[0s / 10s],		train_loss: 4.1392
87:	[0s / 17s],		train_loss: 4.1198
23:	[0s / 7s],		train_loss: 4.3492
65:	[0s / 11s],		train_loss: 4.1365
88:	[0s / 17s],		train_loss: 4.1091
52:	[0s / 56s],		train_loss: 4.1342
66:	[0s / 11s],		train_loss: 4.1382
21:	[0s / 12s],		train_loss: 4.3182
24:	[0s / 7s],		train_loss: 4.3550
94:	[1s / 3m:6s],		train_loss: 3.4482
2:	[3s / 10s],		train_loss: 4.5421
89:	[0s / 17s],		train_loss: 4.0848
67:	[0s / 11s],		train_loss: 4.1459
25:	[0s / 7s],		train_loss: 4.3516
90:	[0s / 17s],		train_loss: 4.0714
68:	[0s / 11s],		train_loss: 4.1172
22:	[0s / 13s],		train_loss: 4.3240
91:	[0s / 18s],		train_loss: 4.0891
26:	[0s / 7s],		train_loss: 4.3641
69:	[0s / 11s],		train_loss: 4.1276
92:	[0s / 18s],		train_loss: 4.1279
27:	[0s / 7s],		train_loss: 4.3642
70:	[0s / 11s],		train_loss: 4.1256
93:	[0s / 18s],		train_loss: 4.0756
28:	[0s / 8s],		train_loss: 4.3130
23:	[0s / 13s],		train_loss: 4.3329
53:	[0s / 57s],		train_loss: 4.1281
71:	[0s / 11s],		train_loss: 4.1221
94:	[0s / 18s],		train_loss: 4.0706
29:	[0s / 8s],		train_loss: 4.3511
72:	[0s / 12s],		train_loss: 4.1326
95:	[0s / 18s],		train_loss: 4.0734
24:	[0s / 13s],		train_loss: 4.3395
30:	[0s / 8s],		train_loss: 4.3094
73:	[0s / 12s],		train_loss: 4.1237
96:	[0s / 18s],		train_loss: 4.0708
74:	[0s / 12s],		train_loss: 4.1314
31:	[0s / 8s],		train_loss: 4.3298
97:	[0s / 19s],		train_loss: 4.0649
95:	[1s / 3m:7s],		train_loss: 3.4370
75:	[0s / 12s],		train_loss: 4.1387
54:	[0s / 58s],		train_loss: 4.1299
32:	[0s / 8s],		train_loss: 4.3362
25:	[0s / 14s],		train_loss: 4.3450
98:	[0s / 19s],		train_loss: 4.0594
76:	[0s / 12s],		train_loss: 4.1385
99:	[0s / 19s],		train_loss: 4.0635
33:	[0s / 8s],		train_loss: 4.3244
77:	[0s / 12s],		train_loss: 4.1164
26:	[0s / 14s],		train_loss: 4.3320
34:	[0s / 9s],		train_loss: 4.3223
78:	[0s / 13s],		train_loss: 4.1284
55:	[0s / 58s],		train_loss: 4.1146
27:	[0s / 14s],		train_loss: 4.3142
35:	[0s / 9s],		train_loss: 4.2988
79:	[0s / 13s],		train_loss: 4.1216
3:	[1s / 12s],		train_loss: 4.5277
28:	[0s / 14s],		train_loss: 4.3184
36:	[0s / 9s],		train_loss: 4.3158
96:	[0s / 3m:8s],		train_loss: 3.4097
80:	[0s / 13s],		train_loss: 4.0949
56:	[0s / 58s],		train_loss: 4.1244
29:	[0s / 14s],		train_loss: 4.2762
37:	[0s / 9s],		train_loss: 4.2928
81:	[0s / 13s],		train_loss: 4.0968
38:	[0s / 9s],		train_loss: 4.3143
30:	[0s / 15s],		train_loss: 4.2888
82:	[0s / 13s],		train_loss: 4.0947
57:	[0s / 59s],		train_loss: 4.1056
39:	[0s / 9s],		train_loss: 4.3044
31:	[0s / 15s],		train_loss: 4.2994
83:	[0s / 13s],		train_loss: 4.1039
40:	[0s / 9s],		train_loss: 4.3119
32:	[0s / 15s],		train_loss: 4.2827
84:	[0s / 13s],		train_loss: 4.0911
41:	[0s / 10s],		train_loss: 4.2830
58:	[0s / 59s],		train_loss: 4.0986
97:	[0s / 3m:8s],		train_loss: 3.4320
85:	[0s / 14s],		train_loss: 4.1043
33:	[0s / 15s],		train_loss: 4.3876
42:	[0s / 10s],		train_loss: 4.2962
86:	[0s / 14s],		train_loss: 4.0813
34:	[0s / 15s],		train_loss: 4.3474
43:	[0s / 10s],		train_loss: 4.2824
87:	[0s / 14s],		train_loss: 4.0828
59:	[0s / 59s],		train_loss: 4.1207
44:	[0s / 10s],		train_loss: 4.2711
35:	[0s / 15s],		train_loss: 4.3256
4:	[1s / 13s],		train_loss: 4.4955
88:	[0s / 14s],		train_loss: 4.0837
45:	[0s / 10s],		train_loss: 4.3030
36:	[0s / 16s],		train_loss: 4.3533
98:	[0s / 3m:9s],		train_loss: 3.4128
89:	[0s / 14s],		train_loss: 4.0611
60:	[0s / 1m:0s],		train_loss: 4.0784
46:	[0s / 10s],		train_loss: 4.2831
37:	[0s / 16s],		train_loss: 4.3164
90:	[0s / 14s],		train_loss: 4.0844
47:	[0s / 10s],		train_loss: 4.2843
38:	[0s / 16s],		train_loss: 4.3508
91:	[0s / 14s],		train_loss: 4.0661
61:	[0s / 1m:0s],		train_loss: 4.0959
48:	[0s / 11s],		train_loss: 4.2711
92:	[0s / 14s],		train_loss: 4.0584
39:	[0s / 16s],		train_loss: 4.3473
49:	[0s / 11s],		train_loss: 4.2576
93:	[0s / 15s],		train_loss: 4.0683
40:	[0s / 16s],		train_loss: 4.3025
50:	[0s / 11s],		train_loss: 4.2815
62:	[0s / 1m:0s],		train_loss: 4.1046
99:	[0s / 3m:10s],		train_loss: 3.4517
94:	[0s / 15s],		train_loss: 4.0562
41:	[0s / 16s],		train_loss: 4.2924
5:	[0s / 14s],		train_loss: 4.4879
51:	[0s / 11s],		train_loss: 4.2576
95:	[0s / 15s],		train_loss: 4.0598
42:	[0s / 17s],		train_loss: 4.2901
63:	[0s / 1m:1s],		train_loss: 4.0975
52:	[0s / 11s],		train_loss: 4.2469
96:	[0s / 15s],		train_loss: 4.0632
43:	[0s / 17s],		train_loss: 4.2990
53:	[0s / 11s],		train_loss: 4.2709
97:	[0s / 15s],		train_loss: 4.0471
44:	[0s / 17s],		train_loss: 4.2898
54:	[0s / 11s],		train_loss: 4.2519
64:	[0s / 1m:1s],		train_loss: 4.0944
98:	[0s / 15s],		train_loss: 4.0470
6:	[0s / 15s],		train_loss: 4.4771
55:	[0s / 12s],		train_loss: 4.2557
45:	[0s / 17s],		train_loss: 4.2845
99:	[0s / 16s],		train_loss: 4.0615
65:	[0s / 1m:1s],		train_loss: 4.0718
56:	[0s / 12s],		train_loss: 4.2391
46:	[0s / 17s],		train_loss: 4.2902
57:	[0s / 12s],		train_loss: 4.2377
66:	[0s / 1m:1s],		train_loss: 4.0893
7:	[0s / 15s],		train_loss: 4.4521
47:	[0s / 17s],		train_loss: 4.2940
58:	[0s / 12s],		train_loss: 4.2670
48:	[0s / 18s],		train_loss: 4.2952
67:	[0s / 1m:1s],		train_loss: 4.0638
59:	[0s / 12s],		train_loss: 4.2417
49:	[0s / 18s],		train_loss: 4.3241
8:	[0s / 15s],		train_loss: 4.4337
68:	[0s / 1m:2s],		train_loss: 4.0763
60:	[0s / 12s],		train_loss: 4.2244
50:	[0s / 18s],		train_loss: 4.2732
61:	[0s / 12s],		train_loss: 4.2436
69:	[0s / 1m:2s],		train_loss: 4.0415
51:	[0s / 18s],		train_loss: 4.3298
9:	[0s / 16s],		train_loss: 4.4348
62:	[0s / 13s],		train_loss: 4.2195
52:	[0s / 18s],		train_loss: 4.2915
70:	[0s / 1m:2s],		train_loss: 4.0254
63:	[0s / 13s],		train_loss: 4.2282
53:	[0s / 18s],		train_loss: 4.3164
71:	[0s / 1m:2s],		train_loss: 4.0564
64:	[0s / 13s],		train_loss: 4.2230
10:	[0s / 16s],		train_loss: 4.4192
54:	[0s / 18s],		train_loss: 4.2632
65:	[0s / 13s],		train_loss: 4.2429
72:	[0s / 1m:2s],		train_loss: 4.0320
55:	[0s / 18s],		train_loss: 4.3017
66:	[0s / 13s],		train_loss: 4.2245
73:	[0s / 1m:2s],		train_loss: 4.0280
56:	[0s / 19s],		train_loss: 4.2864
11:	[0s / 16s],		train_loss: 4.3996
67:	[0s / 13s],		train_loss: 4.2246
74:	[0s / 1m:3s],		train_loss: 4.0302
57:	[0s / 19s],		train_loss: 4.3513
68:	[0s / 13s],		train_loss: 4.2143
75:	[0s / 1m:3s],		train_loss: 4.0350
58:	[0s / 19s],		train_loss: 4.3250
69:	[0s / 13s],		train_loss: 4.2125
12:	[0s / 17s],		train_loss: 4.3966
59:	[0s / 19s],		train_loss: 4.2848
76:	[0s / 1m:3s],		train_loss: 4.0255
70:	[0s / 14s],		train_loss: 4.2251
60:	[0s / 19s],		train_loss: 4.2752
77:	[0s / 1m:3s],		train_loss: 4.0118
71:	[0s / 14s],		train_loss: 4.2271
61:	[0s / 19s],		train_loss: 4.2970
72:	[0s / 14s],		train_loss: 4.1736
78:	[0s / 1m:3s],		train_loss: 4.0171
13:	[0s / 17s],		train_loss: 4.3643
62:	[0s / 19s],		train_loss: 4.3191
73:	[0s / 14s],		train_loss: 4.1980
79:	[0s / 1m:3s],		train_loss: 4.0102
63:	[0s / 19s],		train_loss: 4.2897
74:	[0s / 14s],		train_loss: 4.2073
14:	[0s / 17s],		train_loss: 4.3973
80:	[0s / 1m:3s],		train_loss: 4.0026
64:	[0s / 20s],		train_loss: 4.2933
75:	[0s / 14s],		train_loss: 4.2251
81:	[0s / 1m:4s],		train_loss: 4.0119
65:	[0s / 20s],		train_loss: 4.2770
76:	[0s / 14s],		train_loss: 4.1694
77:	[0s / 14s],		train_loss: 4.2002
66:	[0s / 20s],		train_loss: 4.2988
82:	[0s / 1m:4s],		train_loss: 4.0167
15:	[0s / 18s],		train_loss: 4.3722
78:	[0s / 14s],		train_loss: 4.1862
67:	[0s / 20s],		train_loss: 4.2539
83:	[0s / 1m:4s],		train_loss: 4.0250
79:	[0s / 15s],		train_loss: 4.1792
68:	[0s / 20s],		train_loss: 4.2388
16:	[0s / 18s],		train_loss: 4.3750
80:	[0s / 15s],		train_loss: 4.1889
84:	[0s / 1m:4s],		train_loss: 3.9978
69:	[0s / 20s],		train_loss: 4.2723
81:	[0s / 15s],		train_loss: 4.2260
70:	[0s / 20s],		train_loss: 4.2390
85:	[0s / 1m:4s],		train_loss: 3.9852
17:	[0s / 18s],		train_loss: 4.3666
82:	[0s / 15s],		train_loss: 4.1551
71:	[0s / 20s],		train_loss: 4.2879
86:	[0s / 1m:4s],		train_loss: 3.9622
83:	[0s / 15s],		train_loss: 4.1763
72:	[0s / 21s],		train_loss: 4.2826
18:	[0s / 18s],		train_loss: 4.3432
84:	[0s / 15s],		train_loss: 4.1659
87:	[0s / 1m:5s],		train_loss: 3.9510
73:	[0s / 21s],		train_loss: 4.2618
85:	[0s / 15s],		train_loss: 4.1893
88:	[0s / 1m:5s],		train_loss: 3.9427
74:	[0s / 21s],		train_loss: 4.2247
86:	[0s / 15s],		train_loss: 4.1763
19:	[0s / 19s],		train_loss: 4.3399
75:	[0s / 21s],		train_loss: 4.2342
89:	[0s / 1m:5s],		train_loss: 3.9482
87:	[0s / 16s],		train_loss: 4.1721
76:	[0s / 21s],		train_loss: 4.2260
88:	[0s / 16s],		train_loss: 4.1575
90:	[0s / 1m:5s],		train_loss: 3.9763
77:	[0s / 21s],		train_loss: 4.1974
20:	[0s / 19s],		train_loss: 4.3277
89:	[0s / 16s],		train_loss: 4.1457
91:	[0s / 1m:5s],		train_loss: 3.9751
78:	[0s / 21s],		train_loss: 4.1967
90:	[0s / 16s],		train_loss: 4.1195
91:	[0s / 16s],		train_loss: 4.1565
79:	[0s / 21s],		train_loss: 4.2730
92:	[0s / 1m:5s],		train_loss: 3.9723
21:	[0s / 19s],		train_loss: 4.3503
92:	[0s / 16s],		train_loss: 4.1594
80:	[0s / 22s],		train_loss: 4.2140
93:	[0s / 1m:6s],		train_loss: 3.9229
93:	[0s / 16s],		train_loss: 4.1526
81:	[0s / 22s],		train_loss: 4.2841
94:	[0s / 1m:6s],		train_loss: 3.9396
22:	[0s / 20s],		train_loss: 4.3251
94