[I 2026-06-07 08:22:26,171] Trial 45 finished with value: 0.8031390316599535 and parameters: {'num_nodes': [64], 'dropout': 0.24912832066834323, 'learning_rate': 0.0009267352267227052, 'batch_norm': False}. Best is trial 13 with value: 0.8060522033707737.
/scratch.hpc/luca.cotugno/Foundation_model_clinical_data/test_tabular_model_tmp.py:476: UserWarning: Choices for a categorical distribution should be a tuple of None, bool, int, float and str for persistent storage but contains [32] which is of type list.
  num_nodes  = trial.suggest_categorical("num_nodes", [[32], [64], [128], [64, 32], [128, 64]])
/scratch.hpc/luca.cotugno/Foundation_model_clinical_data/test_tabular_model_tmp.py:476: UserWarning: Choices for a categorical distribution should be a tuple of None, bool, int, float and str for persistent storage but contains [64] which is of type list.
  num_nodes  = trial.suggest_categorical("num_nodes", [[32], [64], [128], [64, 32], [128, 64]])
/scratch.hpc/luca.cotugno/Foundation_model_clinical_data/test_tabular_model_tmp.py:476: UserWarning: Choices for a categorical distribution should be a tuple of None, bool, int, float and str for persistent storage but contains [128] which is of type list.
  num_nodes  = trial.suggest_categorical("num_nodes", [[32], [64], [128], [64, 32], [128, 64]])
/scratch.hpc/luca.cotugno/Foundation_model_clinical_data/test_tabular_model_tmp.py:476: UserWarning: Choices for a categorical distribution should be a tuple of None, bool, int, float and str for persistent storage but contains [64, 32] which is of type list.
  num_nodes  = trial.suggest_categorical("num_nodes", [[32], [64], [128], [64, 32], [128, 64]])
/scratch.hpc/luca.cotugno/Foundation_model_clinical_data/test_tabular_model_tmp.py:476: UserWarning: Choices for a categorical distribution should be a tuple of None, bool, int, float and str for persistent storage but contains [128, 64] which is of type list.
  num_nodes  = trial.suggest_categorical("num_nodes", [[32], [64], [128], [64, 32], [128, 64]])

4:	[0s / 1s],		train_loss: 2.6705
95:	[0s / 38s],		train_loss: 2.4181
5:	[0s / 2s],		train_loss: 2.6435
98:	[0s / 1m:2s],		train_loss: 2.3556
96:	[0s / 39s],		train_loss: 2.4300
6:	[0s / 2s],		train_loss: 2.6177
11:	[0s / 11s],		train_loss: 2.5235
97:	[0s / 39s],		train_loss: 2.4214
7:	[0s / 3s],		train_loss: 2.5909
99:	[0s / 1m:3s],		train_loss: 2.3280
98:	[0s / 40s],		train_loss: 2.4187
8:	[0s / 3s],		train_loss: 2.5796
12:	[0s / 12s],		train_loss: 2.5174
0:	[0s / 0s],		train_loss: 3.0071
99:	[0s / 40s],		train_loss: 2.4168
9:	[0s / 3s],		train_loss: 2.5749
1:	[0s / 1s],		train_loss: 2.6195
10:	[0s / 4s],		train_loss: 2.5652
0:	[0s / 0s],		train_loss: 3.0533
13:	[0s / 13s],		train_loss: 2.5180
11:	[0s / 4s],		train_loss: 2.5536
2:	[0s / 1s],		train_loss: 2.5655
1:	[0s / 0s],		train_loss: 2.6500
12:	[0s / 5s],		train_loss: 2.5430
2:	[0s / 1s],		train_loss: 2.6101
3:	[0s / 2s],		train_loss: 2.5518
14:	[0s / 13s],		train_loss: 2.5026
13:	[0s / 5s],		train_loss: 2.5395
3:	[0s / 1s],		train_loss: 2.5747
4:	[0s / 2s],		train_loss: 2.5263
14:	[0s / 5s],		train_loss: 2.5346
4:	[0s / 2s],		train_loss: 2.5643
15:	[0s / 6s],		train_loss: 2.5250
5:	[0s / 3s],		train_loss: 2.5198
15:	[0s / 14s],		train_loss: 2.5023
5:	[0s / 2s],		train_loss: 2.5531
16:	[0s / 6s],		train_loss: 2.5122
6:	[0s / 3s],		train_loss: 2.5196
6:	[0s / 2s],		train_loss: 2.5255
17:	[0s / 7s],		train_loss: 2.5188
7:	[0s / 3s],		train_loss: 2.5453
16:	[0s / 15s],		train_loss: 2.4991
7:	[0s / 4s],		train_loss: 2.5156
18:	[0s / 7s],		train_loss: 2.5015
8:	[0s / 3s],		train_loss: 2.5535
19:	[0s / 7s],		train_loss: 2.5144
8:	[0s / 4s],		train_loss: 2.5244
9:	[0s / 4s],		train_loss: 2.5420
20:	[0s / 8s],		train_loss: 2.5086
17:	[0s / 16s],		train_loss: 2.4814
9:	[0s / 5s],		train_loss: 2.5116
10:	[0s / 4s],		train_loss: 2.5323
21:	[0s / 8s],		train_loss: 2.5056
10:	[0s / 5s],		train_loss: 2.4948
22:	[0s / 8s],		train_loss: 2.4976
11:	[0s / 4s],		train_loss: 2.5357
18:	[1s / 17s],		train_loss: 2.4799
23:	[0s / 9s],		train_loss: 2.5047
12:	[0s / 5s],		train_loss: 2.5393
11:	[0s / 6s],		train_loss: 2.5002
24:	[0s / 9s],		train_loss: 2.4948
13:	[0s / 5s],		train_loss: 2.5173
12:	[0s / 6s],		train_loss: 2.4934
25:	[0s / 10s],		train_loss: 2.4890
14:	[0s / 6s],		train_loss: 2.5293
19:	[1s / 18s],		train_loss: 2.4836
13:	[0s / 7s],		train_loss: 2.4916
26:	[0s / 10s],		train_loss: 2.4878
15:	[0s / 6s],		train_loss: 2.5200
27:	[0s / 10s],		train_loss: 2.4747
14:	[0s / 7s],		train_loss: 2.5064
16:	[0s / 6s],		train_loss: 2.5272
20:	[0s / 19s],		train_loss: 2.4797
28:	[0s / 11s],		train_loss: 2.4931
17:	[0s / 7s],		train_loss: 2.5292
15:	[0s / 8s],		train_loss: 2.4820
29:	[0s / 11s],		train_loss: 2.4908
18:	[0s / 7s],		train_loss: 2.5227
16:	[0s / 8s],		train_loss: 2.4985
30:	[0s / 12s],		train_loss: 2.4769
21:	[0s / 20s],		train_loss: 2.4904
19:	[0s / 8s],		train_loss: 2.5138
31:	[0s / 12s],		train_loss: 2.4814
17:	[0s / 9s],		train_loss: 2.4905
20:	[0s / 8s],		train_loss: 2.5172
32:	[0s / 12s],		train_loss: 2.4757
18:	[0s / 9s],		train_loss: 2.4816
21:	[0s / 8s],		train_loss: 2.5117
22:	[0s / 21s],		train_loss: 2.4645
33:	[0s / 13s],		train_loss: 2.4838
22:	[0s / 9s],		train_loss: 2.5182
19:	[0s / 10s],		train_loss: 2.4717
34:	[0s / 13s],		train_loss: 2.4820
23:	[0s / 9s],		train_loss: 2.4809
23:	[0s / 22s],		train_loss: 2.4698
35:	[0s / 14s],		train_loss: 2.4783
20:	[0s / 10s],		train_loss: 2.4729
24:	[0s / 10s],		train_loss: 2.4985
36:	[0s / 14s],		train_loss: 2.4889
21:	[0s / 11s],		train_loss: 2.4655
25:	[0s / 10s],		train_loss: 2.5094
37:	[0s / 14s],		train_loss: 2.4720
24:	[0s / 23s],		train_loss: 2.4760
22:	[0s / 11s],		train_loss: 2.4758
26:	[0s / 11s],		train_loss: 2.4853
38:	[0s / 15s],		train_loss: 2.4703
27:	[0s / 11s],		train_loss: 2.4828
39:	[0s / 15s],		train_loss: 2.4754
23:	[0s / 12s],		train_loss: 2.4683
25:	[0s / 24s],		train_loss: 2.4747
40:	[0s / 15s],		train_loss: 2.4717
28:	[0s / 11s],		train_loss: 2.4953
24:	[0s / 12s],		train_loss: 2.4892
41:	[0s / 16s],		train_loss: 2.4731
29:	[0s / 12s],		train_loss: 2.5039
25:	[0s / 13s],		train_loss: 2.4723
26:	[0s / 25s],		train_loss: 2.4797
42:	[0s / 16s],		train_loss: 2.4832
30:	[0s / 12s],		train_loss: 2.5085
26:	[0s / 13s],		train_loss: 2.4700
43:	[0s / 17s],		train_loss: 2.4720
31:	[0s / 13s],		train_loss: 2.4882
44:	[0s / 17s],		train_loss: 2.4716
32:	[0s / 13s],		train_loss: 2.5005
27:	[0s / 14s],		train_loss: 2.4704
27:	[0s / 26s],		train_loss: 2.4552
45:	[0s / 17s],		train_loss: 2.4627
33:	[0s / 13s],		train_loss: 2.4931
28:	[0s / 14s],		train_loss: 2.4551
46:	[0s / 18s],		train_loss: 2.4638
34:	[0s / 14s],		train_loss: 2.4891
47:	[0s / 18s],		train_loss: 2.4679
28:	[0s / 27s],		train_loss: 2.4734
29:	[0s / 15s],		train_loss: 2.4697
35:	[0s / 14s],		train_loss: 2.4953
48:	[0s / 18s],		train_loss: 2.4691
30:	[0s / 15s],		train_loss: 2.4665
36:	[0s / 15s],		train_loss: 2.4819
49:	[0s / 19s],		train_loss: 2.4552
29:	[0s / 27s],		train_loss: 2.4585
37:	[0s / 15s],		train_loss: 2.4876
31:	[0s / 16s],		train_loss: 2.4664
50:	[0s / 19s],		train_loss: 2.4419
38:	[0s / 15s],		train_loss: 2.4816
32:	[0s / 16s],		train_loss: 2.4455
51:	[0s / 20s],		train_loss: 2.4477
39:	[0s / 16s],		train_loss: 2.4802
30:	[0s / 28s],		train_loss: 2.4529
52:	[0s / 20s],		train_loss: 2.4584
33:	[0s / 17s],		train_loss: 2.4793
40:	[0s / 16s],		train_loss: 2.4747
53:	[0s / 20s],		train_loss: 2.4478
34:	[0s / 17s],		train_loss: 2.4530
41:	[0s / 17s],		train_loss: 2.4880
54:	[0s / 21s],		train_loss: 2.4583
31:	[0s / 29s],		train_loss: 2.4524
42:	[0s / 17s],		train_loss: 2.4781
35:	[0s / 18s],		train_loss: 2.4636
55:	[0s / 21s],		train_loss: 2.4453
43:	[0s / 17s],		train_loss: 2.4706
56:	[0s / 22s],		train_loss: 2.4586
36:	[0s / 18s],		train_loss: 2.4549
32:	[0s / 30s],		train_loss: 2.4559
44:	[0s / 18s],		train_loss: 2.4890
57:	[0s / 22s],		train_loss: 2.4459
37:	[0s / 19s],		train_loss: 2.4458
45:	[0s / 18s],		train_loss: 2.4808
58:	[0s / 22s],		train_loss: 2.4623
38:	[0s / 19s],		train_loss: 2.4611
59:	[0s / 23s],		train_loss: 2.4619
46:	[0s / 19s],		train_loss: 2.4770
33:	[0s / 31s],		train_loss: 2.4494
60:	[0s / 23s],		train_loss: 2.4502
47:	[0s / 19s],		train_loss: 2.4902
39:	[0s / 20s],		train_loss: 2.4472
61:	[0s / 24s],		train_loss: 2.4463
48:	[0s / 19s],		train_loss: 2.4770
40:	[0s / 21s],		train_loss: 2.4518
34:	[0s / 32s],		train_loss: 2.4662
62:	[0s / 24s],		train_loss: 2.4463
49:	[0s / 20s],		train_loss: 2.4771
63:	[0s / 24s],		train_loss: 2.4412
41:	[0s / 21s],		train_loss: 2.4364
50:	[0s / 20s],		train_loss: 2.4879
64:	[0s / 25s],		train_loss: 2.4527
35:	[0s / 33s],		train_loss: 2.4459
51:	[0s / 21s],		train_loss: 2.4763
42:	[0s / 22s],		train_loss: 2.4375
65:	[0s / 25s],		train_loss: 2.4407
52:	[0s / 21s],		train_loss: 2.4833
43:	[0s / 22s],		train_loss: 2.4511
66:	[0s / 25s],		train_loss: 2.4464
53:	[0s / 22s],		train_loss: 2.4786
36:	[0s / 34s],		train_loss: 2.4432
67:	[0s / 26s],		train_loss: 2.4544
44:	[0s / 23s],		train_loss: 2.4324
54:	[0s / 22s],		train_loss: 2.4720
68:	[0s / 26s],		train_loss: 2.4581
45:	[0s / 23s],		train_loss: 2.4467
55:	[0s / 22s],		train_loss: 2.4612
37:	[0s / 35s],		train_loss: 2.4374
69:	[0s / 27s],		train_loss: 2.4389
56:	[0s / 23s],		train_loss: 2.4799
46:	[0s / 24s],		train_loss: 2.4472
70:	[0s / 27s],		train_loss: 2.4461
57:	[0s / 23s],		train_loss: 2.4590
71:	[0s / 27s],		train_loss: 2.4361
47:	[0s / 24s],		train_loss: 2.4476
38:	[0s / 36s],		train_loss: 2.4391
58:	[0s / 24s],		train_loss: 2.4839
72:	[0s / 28s],		train_loss: 2.4369
48:	[0s / 25s],		train_loss: 2.4418
59:	[0s / 24s],		train_loss: 2.4677
73:	[0s / 28s],		train_loss: 2.4264
49:	[0s / 25s],		train_loss: 2.4481
60:	[0s / 24s],		train_loss: 2.4758
74:	[0s / 29s],		train_loss: 2.4275
39:	[1s / 37s],		train_loss: 2.4406
61:	[0s / 25s],		train_loss: 2.4612
75:	[0s / 29s],		train_loss: 2.4397
50:	[0s / 26s],		train_loss: 2.4344
62:	[0s / 25s],		train_loss: 2.4412
76:	[0s / 29s],		train_loss: 2.4361
51:	[0s / 26s],		train_loss: 2.4311
40:	[0s / 38s],		train_loss: 2.4368
63:	[0s / 26s],		train_loss: 2.4489
77:	[0s / 30s],		train_loss: 2.4364
52:	[0s / 27s],		train_loss: 2.4348
78:	[0s / 30s],		train_loss: 2.4334
64:	[0s / 26s],		train_loss: 2.4605
41:	[0s / 39s],		train_loss: 2.4388
53:	[0s / 27s],		train_loss: 2.4224
79:	[0s / 30s],		train_loss: 2.4375
65:	[0s / 26s],		train_loss: 2.4639
80:	[0s / 31s],		train_loss: 2.4275
66:	[0s / 27s],		train_loss: 2.4655
54:	[0s / 28s],		train_loss: 2.4446
81:	[0s / 31s],		train_loss: 2.4284
42:	[0s / 40s],		train_loss: 2.4381
67:	[0s / 27s],		train_loss: 2.4592
55:	[0s / 28s],		train_loss: 2.4388
82:	[0s / 32s],		train_loss: 2.4127
68:	[0s / 28s],		train_loss: 2.4628
56:	[0s / 29s],		train_loss: 2.4365
83:	[0s / 32s],		train_loss: 2.4240
69:	[0s / 28s],		train_loss: 2.4594
43:	[0s / 41s],		train_loss: 2.4390
84:	[0s / 32s],		train_loss: 2.4271
57:	[0s / 29s],		train_loss: 2.4174
70:	[0s / 28s],		train_loss: 2.4713
85:	[0s / 33s],		train_loss: 2.4338
71:	[0s / 29s],		train_loss: 2.4703
58:	[0s / 30s],		train_loss: 2.4321
86:	[0s / 33s],		train_loss: 2.4121
44:	[0s / 42s],		train_loss: 2.4369
72:	[0s / 29s],		train_loss: 2.4641
59:	[0s / 30s],		train_loss: 2.4506
87:	[0s / 34s],		train_loss: 2.4265
73:	[0s / 30s],		train_loss: 2.4597
88:	[0s / 34s],		train_loss: 2.4277
60:	[0s / 31s],		train_loss: 2.4532
45:	[0s / 43s],		train_loss: 2.4423
74:	[0s / 30s],		train_loss: 2.4576
89:	[0s / 34s],		train_loss: 2.4146
61:	[0s / 31s],		train_loss: 2.4376
75:	[0s / 31s],		train_loss: 2.4635
90:	[0s / 35s],		train_loss: 2.4198
76:	[0s / 31s],		train_loss: 2.4574
62:	[0s / 32s],		train_loss: 2.4312
91:	[0s / 35s],		train_loss: 2.4187
46:	[1s / 44s],		train_loss: 2.4339
77:	[0s / 31s],		train_loss: 2.4586
92:	[0s / 35s],		train_loss: 2.4103
63:	[0s / 32s],		train_loss: 2.4206
78:	[0s / 32s],		train_loss: 2.4525
93:	[0s / 36s],		train_loss: 2.4263
64:	[0s / 33s],		train_loss: 2.4278
47:	[0s / 45s],		train_loss: 2.4311
94:	[0s / 36s],		train_loss: 2.4303
79:	[0s / 32s],		train_loss: 2.4508
65:	[0s / 33s],		train_loss: 2.4318
95:	[0s / 37s],		train_loss: 2.4301
80:	[0s / 33s],		train_loss: 2.4666
96:	[0s / 37s],		train_loss: 2.4415
81:	[0s / 33s],		train_loss: 2.4758
66:	[0s / 34s],		train_loss: 2.4282
48:	[0s / 46s],		train_loss: 2.4281
97:	[0s / 37s],		train_loss: 2.4268
82:	[0s / 33s],		train_loss: 2.4610
67:	[0s / 34s],		train_loss: 2.4143
98:	[0s / 38s],		train_loss: 2.4226
83:	[0s / 34s],		train_loss: 2.4705
49:	[0s / 47s],		train_loss: 2.4236
68:	[0s / 35s],		train_loss: 2.4214
99:	[0s / 38s],		train_loss: 2.4002
84:	[0s / 34s],		train_loss: 2.4741
69:	[0s / 35s],		train_loss: 2.4229
0:	[0s / 0s],		train_loss: 2.9065
85:	[0s / 35s],		train_loss: 2.4649
50:	[0s / 47s],		train_loss: 2.4164
1:	[0s / 0s],		train_loss: 2.6197
86:	[0s / 35s],		train_loss: 2.4598
70:	[0s / 36s],		train_loss: 2.4138
2:	[0s / 1s],		train_loss: 2.5665
87:	[0s / 36s],		train_loss: 2.4711
71:	[0s / 37s],		train_loss: 2.4225
51:	[0s / 48s],		train_loss: 2.4264
3:	[0s / 1s],		train_loss: 2.5350
88:	[0s / 36s],		train_loss: 2.4505
72:	[0s / 37s],		train_loss: 2.4140
4:	[0s / 1s],		train_loss: 2.5419
89:	[0s / 36s],		train_loss: 2.4519
5:	[0s / 2s],		train_loss: 2.5223
52:	[0s / 49s],		train_loss: 2.4275
73:	[0s / 38s],		train_loss: 2.4251
90:	[0s / 37s],		train_loss: 2.4486
6:	[0s / 2s],		train_loss: 2.5305
91:	[0s / 37s],		train_loss: 2.4612
74:	[0s / 38s],		train_loss: 2.4277
7:	[0s / 3s],		train_loss: 2.5111
92:	[0s / 38s],		train_loss: 2.4524
53:	[0s / 50s],		train_loss: 2.4292
8:	[0s / 3s],		train_loss: 2.5158
75:	[0s / 39s],		train_loss: 2.4270
93:	[0s / 38s],		train_loss: 2.4689
9:	[0s / 3s],		train_loss: 2.5084
76:	[0s / 39s],		train_loss: 2.4079
94:	[0s / 39s],		train_loss: 2.4588
54:	[0s / 51s],		train_loss: 2.4248
10:	[0s / 4s],		train_loss: 2.4979
77:	[0s / 40s],		train_loss: 2.4153
95:	[0s / 39s],		train_loss: 2.4460
11:	[0s / 4s],		train_loss: 2.5027
96:	[0s / 39s],		train_loss: 2.4461
78:	[0s / 40s],		train_loss: 2.4152
12:	[0s / 5s],		train_loss: 2.4979
55:	[0s / 52s],		train_loss: 2.4158
97:	[0s / 40s],		train_loss: 2.4515
13:	[0s / 5s],		train_loss: 2.4916
79:	[0s / 41s],		train_loss: 2.4166
98:	[0s / 40s],		train_loss: 2.4501
14:	[0s / 5s],		train_loss: 2.4909
80:	[0s / 41s],		train_loss: 2.4040
56:	[0s / 53s],		train_loss: 2.4269
15:	[0s / 6s],		train_loss: 2.4884
99:	[0s / 41s],		train_loss: 2.4579
81:	[0s / 42s],		train_loss: 2.4109
16:	[0s / 6s],		train_loss: 2.4795
0:	[0s / 0s],		train_loss: 2.9541
17:	[0s / 7s],		train_loss: 2.4800
57:	[0s / 54s],		train_loss: 2.4191
82:	[0s / 42s],		train_loss: 2.4295
1:	[0s / 0s],		train_loss: 2.6272
18:	[0s / 7s],		train_loss: 2.4827
2:	[0s / 1s],		train_loss: 2.5768
83:	[0s / 43s],		train_loss: 2.4251
19:	[0s / 7s],		train_loss: 2.4766
58:	[0s / 55s],		train_loss: 2.4344
3:	[0s / 1s],		train_loss: 2.5515
84:	[0s / 43s],		train_loss: 2.4145
20:	[0s / 8s],		train_loss: 2.4909
4:	[0s / 2s],		train_loss: 2.5335
21:	[0s / 8s],		train_loss: 2.4817
85:	[0s / 44s],		train_loss: 2.4095
5:	[0s / 2s],		train_loss: 2.5376
59:	[0s / 56s],		train_loss: 2.4164
22:	[0s / 8s],		train_loss: 2.4850
86:	[0s / 44s],		train_loss: 2.4021
6:	[0s / 2s],		train_loss: 2.5461
23:	[0s / 9s],		train_loss: 2.4704
7:	[0s / 3s],		train_loss: 2.5257
87:	[0s / 45s],		train_loss: 2.4079
24:	[0s / 9s],		train_loss: 2.4640
60:	[0s / 57s],		train_loss: 2.4187
8:	[0s / 3s],		train_loss: 2.5231
25:	[0s / 10s],		train_loss: 2.4638
88:	[0s / 45s],		train_loss: 2.4133
9:	[0s / 4s],		train_loss: 2.5186
26:	[0s / 10s],		train_loss: 2.4509
89:	[0s / 46s],		train_loss: 2.4246
61:	[0s / 58s],		train_loss: 2.4240
10:	[0s / 4s],		train_loss: 2.5235
27:	[0s / 10s],		train_loss: 2.4809
90:	[0s / 46s],		train_loss: 2.4070
28:	[0s / 11s],		train_loss: 2.4738
11:	[0s / 4s],		train_loss: 2.5238
29:	[0s / 11s],		train_loss: 2.4623
12:	[0s / 5s],		train_loss: 2.4992
91:	[0s / 47s],		train_loss: 2.4057
62:	[0s / 59s],		train_loss: 2.4153
30:	[0s / 12s],		train_loss: 2.4682
13:	[0s / 5s],		train_loss: 2.5329
92:	[0s / 47s],		train_loss: 2.4013
31:	[0s / 12s],		train_loss: 2.4749
14:	[0s / 6s],		train_loss: 2.5180
93:	[0s / 48s],		train_loss: 2.4121
63:	[0s / 1m:0s],		train_loss: 2.4100
32:	[0s / 12s],		train_loss: 2.4758
15:	[0s / 6s],		train_loss: 2.5116
33:	[0s / 13s],		train_loss: 2.4737
94:	[0s / 48s],		train_loss: 2.4078
16:	[0s / 7s],		train_loss: 2.5167
34:	[0s / 13s],		train_loss: 2.4663
64:	[0s / 1m:1s],		train_loss: 2.3998
95:	[0s / 49s],		train_loss: 2.3900
17:	[0s / 7s],		train_loss: 2.5144
35:	[0s / 14s],		train_loss: 2.4514
18:	[0s / 7s],		train_loss: 2.5136
96:	[0s / 50s],		train_loss: 2.4032
36:	[0s / 14s],		train_loss: 2.4704
19:	[0s / 8s],		train_loss: 2.5230
65:	[0s / 1m:2s],		train_loss: 2.4139
37:	[0s / 14s],		train_loss: 2.4590
97:	[0s / 50s],		train_loss: 2.4005
20:	[0s / 8s],		train_loss: 2.4963
38:	[0s / 15s],		train_loss: 2.4526
98:	[0s / 51s],		train_loss: 2.4032
21:	[0s / 9s],		train_loss: 2.5034
39:	[0s / 15s],		train_loss: 2.4541
66:	[0s / 1m:3s],		train_loss: 2.4013
22:	[0s / 9s],		train_loss: 2.5077
40:	[0s / 15s],		train_loss: 2.4659
99:	[0s / 51s],		train_loss: 2.3843
23:	[0s / 9s],		train_loss: 2.4958
41:	[0s / 16s],		train_loss: 2.4600
67:	[0s / 1m:3s],		train_loss: 2.4030
0:	[0s / 0s],		train_loss: 2.9542
24:	[0s / 10s],		train_loss: 2.5043
42:	[0s / 16s],		train_loss: 2.4556
25:	[0s / 10s],		train_loss: 2.5017
1:	[0s / 1s],		train_loss: 2.6200
43:	[0s / 17s],		train_loss: 2.4503
26:	[0s / 11s],		train_loss: 2.4978
68:	[0s / 1m:4s],		train_loss: 2.4051
44:	[0s / 17s],		train_loss: 2.4627
2:	[0s / 1s],		train_loss: 2.5817
45:	[0s / 17s],		train_loss: 2.4607
27:	[0s / 11s],		train_loss: 2.4926
3:	[0s / 2s],		train_loss: 2.5604
46:	[0s / 18s],		train_loss: 2.4477
28:	[0s / 11s],		train_loss: 2.4926
69:	[0s / 1m:5s],		train_loss: 2.4188
4:	[0s / 2s],		train_loss: 2.5532
47:	[0s / 18s],		train_loss: 2.4591
29:	[0s / 12s],		train_loss: 2.5011
48:	[0s / 19s],		train_loss: 2.4443
5:	[0s / 3s],		train_loss: 2.5636
30:	[0s / 12s],		train_loss: 2.4935
70:	[0s / 1m:6s],		train_loss: 2.4124
49:	[0s / 19s],		train_loss: 2.4488
31:	[0s / 13s],		train_loss: 2.4944
6:	[0s / 3s],		train_loss: 2.5374
50:	[0s / 19s],		train_loss: 2.4450
32:	[0s / 13s],		train_loss: 2.4790
7:	[0s / 4s],		train_loss: 2.5324
51:	[0s / 20s],		train_loss: 2.4471
71:	[0s / 1m:7s],		train_loss: 2.4154
33:	[0s / 14s],		train_loss: 2.4727
52:	[0s / 20s],		train_loss: 2.4416
8:	[0s / 4s],		train_loss: 2.5403
34:	[0s / 14s],		train_loss: 2.4858
53:	[0s / 21s],		train_loss: 2.4266
35:	[0s / 14s],		train_loss: 2.4836
72:	[0s / 1m:8s],		train_loss: 2.4132
9:	[0s / 5s],		train_loss: 2.5316
54:	[0s / 21s],		train_loss: 2.4566
36:	[0s / 15s],		train_loss: 2.4808
10:	[0s / 5s],		train_loss: 2.5385
55:	[0s / 21s],		train_loss: 2.4402
37:	[0s / 15s],		train_loss: 2.4811
73:	[0s / 1m:9s],		train_loss: 2.4094
56:	[0s / 22s],		train_loss: 2.4427
11:	[0s / 6s],		train_loss: 2.5265
38:	[0s / 16s],		train_loss: 2.4871
57:	[0s / 22s],		train_loss: 2.4473
12:	[0s / 6s],		train_loss: 2.5332
39:	[0s / 16s],		train_loss: 2.4862
58:	[0s / 23s],		train_loss: 2.4568
74:	[0s / 1m:10s],		train_loss: 2.4016
40:	[0s / 16s],		train_loss: 2.4691
13:	[0s / 7s],		train_loss: 2.5086
59:	[0s / 23s],		train_loss: 2.4491
41:	[0s / 17s],		train_loss: 2.4677
60:	[0s / 23s],		train_loss: 2.4362
14:	[0s / 7s],		train_loss: 2.5212
75:	[0s / 1m:11s],		train_loss: 2.4153
42:	[0s / 17s],		train_loss: 2.4795
61:	[0s / 24s],		train_loss: 2.4484
15:	[0s / 8s],		train_loss: 2.5424
62:	[0s / 24s],		train_loss: 2.4518
43:	[0s / 18s],		train_loss: 2.4788
16:	[0s / 8s],		train_loss: 2.5151
63:	[0s / 24s],		train_loss: 2.4343
44:	[0s / 18s],		train_loss: 2.4750
76:	[1s / 1m:12s],		train_loss: 2.3936
64:	[0s / 25s],		train_loss: 2.4558
45:	[0s / 18s],		train_loss: 2.4624
17:	[0s / 9s],		train_loss: 2.5173
65:	[0s / 25s],		train_loss: 2.4286
46:	[0s / 19s],		train_loss: 2.4849
18:	[0s / 9s],		train_loss: 2.5191
77:	[0s / 1m:13s],		train_loss: 2.4017
66:	[0s / 26s],		train_loss: 2.4444
47:	[0s / 19s],		train_loss: 2.4766
19:	[0s / 10s],		train_loss: 2.5046
67:	[0s / 26s],		train_loss: 2.4370
48:	[0s / 20s],		train_loss: 2.4942
68:	[0s / 26s],		train_loss: 2.4334
20:	[0s / 10s],		train_loss: 2.5201
49:	[0s / 20s],		train_loss: 2.4747
78:	[1s / 1m:14s],		train_loss: 2.4082
69:	[0s / 27s],		train_loss: 2.4396
50:	[0s / 20s],		train_loss: 2.4732
21:	[0s / 11s],		train_loss: 2.5275
70:	[0s / 27s],		train_loss: 2.4511
51:	[0s / 21s],		train_loss: 2.4620
22:	[0s / 11s],		train_loss: 2.5116
79:	[0s / 1m:15s],		train_loss: 2.3934
71:	[0s / 28s],		train_loss: 2.4480
52:	[0s / 21s],		train_loss: 2.4569
72:	[0s / 28s],		train_loss: 2.4366
23:	[0s / 12s],		train_loss: 2.4978
53:	[0s / 22s],		train_loss: 2.4707
73:	[0s / 28s],		train_loss: 2.4244
80:	[0s / 1m:16s],		train_loss: 2.4043
54:	[0s / 22s],		train_loss: 2.4633
24:	[0s / 12s],		train_loss: 2.4984
74:	[0s / 29s],		train_loss: 2.4351
55:	[0s / 23s],		train_loss: 2.4848
25:	[0s / 13s],		train_loss: 2.4930
75:	[0s / 29s],		train_loss: 2.4202
56:	[0s / 23s],		train_loss: 2.4850
81:	[0s / 1m:17s],		train_loss: 2.3878
76:	[0s / 29s],		train_loss: 2.4195
26:	[0s / 14s],		train_loss: 2.5199
57:	[0s / 23s],		train_loss: 2.4842
77:	[0s / 30s],		train_loss: 2.4378
27:	[0s / 14s],		train_loss: 2.4874
58:	[0s / 24s],		train_loss: 2.4731
78:	[0s / 30s],		train_loss: 2.4290
82:	[0s / 1m:18s],		train_loss: 2.3939
59:	[0s / 24s],		train_loss: 2.4613
28:	[0s / 15s],		train_loss: 2.4841
79:	[0s / 31s],		train_loss: 2.4130
60:	[0s / 25s],		train_loss: 2.4757
80:	[0s / 31s],		train_loss: 2.4302
29:	[0s / 15s],		train_loss: 2.5064
83:	[0s / 1m:19s],		train_loss: 2.4050
81:	[0s / 31s],		train_loss: 2.4243
61:	[0s / 25s],		train_loss: 2.4530
30:	[0s / 16s],		train_loss: 2.4878
82:	[0s / 32s],		train_loss: 2.4201
62:	[0s / 25s],		train_loss: 2.4701
31:	[0s / 16s],		train_loss: 2.5018
83:	[0s / 32s],		train_loss: 2.4167
63:	[0s / 26s],		train_loss: 2.4505
84:	[0s / 1m:20s],		train_loss: 2.3902
84:	[0s / 33s],		train_loss: 2.4270
64:	[0s / 26s]