58:	[0s / 29s],		train_loss: 3.9301[I 2026-07-01 07:26:01,230] Trial 7 finished with value: 0.7891652811771577 and parameters: {'num_nodes': [64], 'dropout': 0.03945649550735374, 'learning_rate': 0.0015818301809162108, 'batch_norm': False}. Best is trial 3 with value: 0.8108369571214855.
/scratch.hpc/luca.cotugno/Foundation_model_clinical_data/test_tabular_model.py:481: UserWarning: Choices for a categorical distribution should be a tuple of None, bool, int, float and str for persistent storage but contains [32] which is of type list.
  num_nodes  = trial.suggest_categorical("num_nodes", [[32], [64], [128], [64, 32], [128, 64]])
/scratch.hpc/luca.cotugno/Foundation_model_clinical_data/test_tabular_model.py:481: UserWarning: Choices for a categorical distribution should be a tuple of None, bool, int, float and str for persistent storage but contains [64] which is of type list.
  num_nodes  = trial.suggest_categorical("num_nodes", [[32], [64], [128], [64, 32], [128, 64]])
/scratch.hpc/luca.cotugno/Foundation_model_clinical_data/test_tabular_model.py:481: UserWarning: Choices for a categorical distribution should be a tuple of None, bool, int, float and str for persistent storage but contains [128] which is of type list.
  num_nodes  = trial.suggest_categorical("num_nodes", [[32], [64], [128], [64, 32], [128, 64]])
/scratch.hpc/luca.cotugno/Foundation_model_clinical_data/test_tabular_model.py:481: UserWarning: Choices for a categorical distribution should be a tuple of None, bool, int, float and str for persistent storage but contains [64, 32] which is of type list.
  num_nodes  = trial.suggest_categorical("num_nodes", [[32], [64], [128], [64, 32], [128, 64]])
/scratch.hpc/luca.cotugno/Foundation_model_clinical_data/test_tabular_model.py:481: UserWarning: Choices for a categorical distribution should be a tuple of None, bool, int, float and str for persistent storage but contains [128, 64] which is of type list.
  num_nodes  = trial.suggest_categorical("num_nodes", [[32], [64], [128], [64, 32], [128, 64]])
[I 2026-07-01 07:26:15,677] Trial 26 finished with value: 0.7656493512577677 and parameters: {'num_nodes': [128, 64], 'dropout': 0.22301178439350075, 'learning_rate': 0.0004245128862010487, 'batch_norm': False}. Best is trial 3 with value: 0.8108369571214855.
/scratch.hpc/luca.cotugno/Foundation_model_clinical_data/test_tabular_model.py:481: UserWarning: Choices for a categorical distribution should be a tuple of None, bool, int, float and str for persistent storage but contains [32] which is of type list.
  num_nodes  = trial.suggest_categorical("num_nodes", [[32], [64], [128], [64, 32], [128, 64]])
/scratch.hpc/luca.cotugno/Foundation_model_clinical_data/test_tabular_model.py:481: UserWarning: Choices for a categorical distribution should be a tuple of None, bool, int, float and str for persistent storage but contains [64] which is of type list.
  num_nodes  = trial.suggest_categorical("num_nodes", [[32], [64], [128], [64, 32], [128, 64]])
/scratch.hpc/luca.cotugno/Foundation_model_clinical_data/test_tabular_model.py:481: UserWarning: Choices for a categorical distribution should be a tuple of None, bool, int, float and str for persistent storage but contains [128] which is of type list.
  num_nodes  = trial.suggest_categorical("num_nodes", [[32], [64], [128], [64, 32], [128, 64]])
/scratch.hpc/luca.cotugno/Foundation_model_clinical_data/test_tabular_model.py:481: UserWarning: Choices for a categorical distribution should be a tuple of None, bool, int, float and str for persistent storage but contains [64, 32] which is of type list.
  num_nodes  = trial.suggest_categorical("num_nodes", [[32], [64], [128], [64, 32], [128, 64]])
/scratch.hpc/luca.cotugno/Foundation_model_clinical_data/test_tabular_model.py:481: UserWarning: Choices for a categorical distribution should be a tuple of None, bool, int, float and str for persistent storage but contains [128, 64] which is of type list.
  num_nodes  = trial.suggest_categorical("num_nodes", [[32], [64], [128], [64, 32], [128, 64]])
[I 2026-07-01 07:26:24,039] Trial 29 finished with value: 0.7946943993603671 and parameters: {'num_nodes': [64], 'dropout': 0.22229098922990687, 'learning_rate': 0.0003577130230774827, 'batch_norm': False}. Best is trial 3 with value: 0.8108369571214855.
/scratch.hpc/luca.cotugno/Foundation_model_clinical_data/test_tabular_model.py:481: UserWarning: Choices for a categorical distribution should be a tuple of None, bool, int, float and str for persistent storage but contains [32] which is of type list.
  num_nodes  = trial.suggest_categorical("num_nodes", [[32], [64], [128], [64, 32], [128, 64]])
/scratch.hpc/luca.cotugno/Foundation_model_clinical_data/test_tabular_model.py:481: UserWarning: Choices for a categorical distribution should be a tuple of None, bool, int, float and str for persistent storage but contains [64] which is of type list.
  num_nodes  = trial.suggest_categorical("num_nodes", [[32], [64], [128], [64, 32], [128, 64]])
/scratch.hpc/luca.cotugno/Foundation_model_clinical_data/test_tabular_model.py:481: UserWarning: Choices for a categorical distribution should be a tuple of None, bool, int, float and str for persistent storage but contains [128] which is of type list.
  num_nodes  = trial.suggest_categorical("num_nodes", [[32], [64], [128], [64, 32], [128, 64]])
/scratch.hpc/luca.cotugno/Foundation_model_clinical_data/test_tabular_model.py:481: UserWarning: Choices for a categorical distribution should be a tuple of None, bool, int, float and str for persistent storage but contains [64, 32] which is of type list.
  num_nodes  = trial.suggest_categorical("num_nodes", [[32], [64], [128], [64, 32], [128, 64]])
/scratch.hpc/luca.cotugno/Foundation_model_clinical_data/test_tabular_model.py:481: UserWarning: Choices for a categorical distribution should be a tuple of None, bool, int, float and str for persistent storage but contains [128, 64] which is of type list.
  num_nodes  = trial.suggest_categorical("num_nodes", [[32], [64], [128], [64, 32], [128, 64]])
[I 2026-07-01 07:26:48,150] Trial 28 finished with value: 0.7647597576807478 and parameters: {'num_nodes': [128, 64], 'dropout': 0.21255569736077956, 'learning_rate': 0.0004608348789250878, 'batch_norm': False}. Best is trial 3 with value: 0.8108369571214855.
/scratch.hpc/luca.cotugno/Foundation_model_clinical_data/test_tabular_model.py:481: UserWarning: Choices for a categorical distribution should be a tuple of None, bool, int, float and str for persistent storage but contains [32] which is of type list.
  num_nodes  = trial.suggest_categorical("num_nodes", [[32], [64], [128], [64, 32], [128, 64]])
/scratch.hpc/luca.cotugno/Foundation_model_clinical_data/test_tabular_model.py:481: UserWarning: Choices for a categorical distribution should be a tuple of None, bool, int, float and str for persistent storage but contains [64] which is of type list.
  num_nodes  = trial.suggest_categorical("num_nodes", [[32], [64], [128], [64, 32], [128, 64]])
/scratch.hpc/luca.cotugno/Foundation_model_clinical_data/test_tabular_model.py:481: UserWarning: Choices for a categorical distribution should be a tuple of None, bool, int, float and str for persistent storage but contains [128] which is of type list.
  num_nodes  = trial.suggest_categorical("num_nodes", [[32], [64], [128], [64, 32], [128, 64]])
/scratch.hpc/luca.cotugno/Foundation_model_clinical_data/test_tabular_model.py:481: UserWarning: Choices for a categorical distribution should be a tuple of None, bool, int, float and str for persistent storage but contains [64, 32] which is of type list.
  num_nodes  = trial.suggest_categorical("num_nodes", [[32], [64], [128], [64, 32], [128, 64]])
/scratch.hpc/luca.cotugno/Foundation_model_clinical_data/test_tabular_model.py:481: UserWarning: Choices for a categorical distribution should be a tuple of None, bool, int, float and str for persistent storage but contains [128, 64] which is of type list.
  num_nodes  = trial.suggest_categorical("num_nodes", [[32], [64], [128], [64, 32], [128, 64]])
[I 2026-07-01 07:26:55,897] Trial 19 finished with value: 0.781907467693022 and parameters: {'num_nodes': [64], 'dropout': 0.2841353399483939, 'learning_rate': 0.00011686299303506971, 'batch_norm': False}. Best is trial 3 with value: 0.8108369571214855.
/scratch.hpc/luca.cotugno/Foundation_model_clinical_data/test_tabular_model.py:481: UserWarning: Choices for a categorical distribution should be a tuple of None, bool, int, float and str for persistent storage but contains [32] which is of type list.
  num_nodes  = trial.suggest_categorical("num_nodes", [[32], [64], [128], [64, 32], [128, 64]])
/scratch.hpc/luca.cotugno/Foundation_model_clinical_data/test_tabular_model.py:481: UserWarning: Choices for a categorical distribution should be a tuple of None, bool, int, float and str for persistent storage but contains [64] which is of type list.
  num_nodes  = trial.suggest_categorical("num_nodes", [[32], [64], [128], [64, 32], [128, 64]])
/scratch.hpc/luca.cotugno/Foundation_model_clinical_data/test_tabular_model.py:481: UserWarning: Choices for a categorical distribution should be a tuple of None, bool, int, float and str for persistent storage but contains [128] which is of type list.
  num_nodes  = trial.suggest_categorical("num_nodes", [[32], [64], [128], [64, 32], [128, 64]])
/scratch.hpc/luca.cotugno/Foundation_model_clinical_data/test_tabular_model.py:481: UserWarning: Choices for a categorical distribution should be a tuple of None, bool, int, float and str for persistent storage but contains [64, 32] which is of type list.
  num_nodes  = trial.suggest_categorical("num_nodes", [[32], [64], [128], [64, 32], [128, 64]])
/scratch.hpc/luca.cotugno/Foundation_model_clinical_data/test_tabular_model.py:481: UserWarning: Choices for a categorical distribution should be a tuple of None, bool, int, float and str for persistent storage but contains [128, 64] which is of type list.
  num_nodes  = trial.suggest_categorical("num_nodes", [[32], [64], [128], [64, 32], [128, 64]])
[I 2026-07-01 07:27:10,554] Trial 31 finished with value: 0.7421969265556957 and parameters: {'num_nodes': [64, 32], 'dropout': 0.08774088220466504, 'learning_rate': 0.0006030647851099804, 'batch_norm': False}. Best is trial 3 with value: 0.8108369571214855.
/scratch.hpc/luca.cotugno/Foundation_model_clinical_data/test_tabular_model.py:481: UserWarning: Choices for a categorical distribution should be a tuple of None, bool, int, float and str for persistent storage but contains [32] which is of type list.
  num_nodes  = trial.suggest_categorical("num_nodes", [[32], [64], [128], [64, 32], [128, 64]])
/scratch.hpc/luca.cotugno/Foundation_model_clinical_data/test_tabular_model.py:481: UserWarning: Choices for a categorical distribution should be a tuple of None, bool, int, float and str for persistent storage but contains [64] which is of type list.
  num_nodes  = trial.suggest_categorical("num_nodes", [[32], [64], [128], [64, 32], [128, 64]])
/scratch.hpc/luca.cotugno/Foundation_model_clinical_data/test_tabular_model.py:481: UserWarning: Choices for a categorical distribution should be a tuple of None, bool, int, float and str for persistent storage but contains [128] which is of type list.
  num_nodes  = trial.suggest_categorical("num_nodes", [[32], [64], [128], [64, 32], [128, 64]])
/scratch.hpc/luca.cotugno/Foundation_model_clinical_data/test_tabular_model.py:481: UserWarning: Choices for a categorical distribution should be a tuple of None, bool, int, float and str for persistent storage but contains [64, 32] which is of type list.
  num_nodes  = trial.suggest_categorical("num_nodes", [[32], [64], [128], [64, 32], [128, 64]])
/scratch.hpc/luca.cotugno/Foundation_model_clinical_data/test_tabular_model.py:481: UserWarning: Choices for a categorical distribution should be a tuple of None, bool, int, float and str for persistent storage but contains [128, 64] which is of type list.
  num_nodes  = trial.suggest_categorical("num_nodes", [[32], [64], [128], [64, 32], [128, 64]])
[I 2026-07-01 07:27:15,307] Trial 32 finished with value: 0.7705465404752064 and parameters: {'num_nodes': [64, 32], 'dropout': 0.0876770146927555, 'learning_rate': 0.0005690997708024487, 'batch_norm': False}. Best is trial 3 with value: 0.8108369571214855.
/scratch.hpc/luca.cotugno/Foundation_model_clinical_data/test_tabular_model.py:481: UserWarning: Choices for a categorical distribution should be a tuple of None, bool, int, float and str for persistent storage but contains [32] which is of type list.
  num_nodes  = trial.suggest_categorical("num_nodes", [[32], [64], [128], [64, 32], [128, 64]])
/scratch.hpc/luca.cotugno/Foundation_model_clinical_data/test_tabular_model.py:481: UserWarning: Choices for a categorical distribution should be a tuple of None, bool, int, float and str for persistent storage but contains [64] which is of type list.
  num_nodes  = trial.suggest_categorical("num_nodes", [[32], [64], [128], [64, 32], [128, 64]])
/scratch.hpc/luca.cotugno/Foundation_model_clinical_data/test_tabular_model.py:481: UserWarning: Choices for a categorical distribution should be a tuple of None, bool, int, float and str for persistent storage but contains [128] which is of type list.
  num_nodes  = trial.suggest_categorical("num_nodes", [[32], [64], [128], [64, 32], [128, 64]])
/scratch.hpc/luca.cotugno/Foundation_model_clinical_data/test_tabular_model.py:481: UserWarning: Choices for a categorical distribution should be a tuple of None, bool, int, float and str for persistent storage but contains [64, 32] which is of type list.
  num_nodes  = trial.suggest_categorical("num_nodes", [[32], [64], [128], [64, 32], [128, 64]])
/scratch.hpc/luca.cotugno/Foundation_model_clinical_data/test_tabular_model.py:481: UserWarning: Choices for a categorical distribution should be a tuple of None, bool, int, float and str for persistent storage but contains [128, 64] which is of type list.
  num_nodes  = trial.suggest_categorical("num_nodes", [[32], [64], [128], [64, 32], [128, 64]])
[I 2026-07-01 07:27:43,159] Trial 27 finished with value: 0.7635508161461495 and parameters: {'num_nodes': [128, 64], 'dropout': 0.21766687258158463, 'learning_rate': 0.0004936049859997794, 'batch_norm': False}. Best is trial 3 with value: 0.8108369571214855.
/scratch.hpc/luca.cotugno/Foundation_model_clinical_data/test_tabular_model.py:481: UserWarning: Choices for a categorical distribution should be a tuple of None, bool, int, float and str for persistent storage but contains [32] which is of type list.
  num_nodes  = trial.suggest_categorical("num_nodes", [[32], [64], [128], [64, 32], [128, 64]])
/scratch.hpc/luca.cotugno/Foundation_model_clinical_data/test_tabular_model.py:481: UserWarning: Choices for a categorical distribution should be a tuple of None, bool, int, float and str for persistent storage but contains [64] which is of type list.
  num_nodes  = trial.suggest_categorical("num_nodes", [[32], [64], [128], [64, 32], [128, 64]])
/scratch.hpc/luca.cotugno/Foundation_model_clinical_data/test_tabular_model.py:481: UserWarning: Choices for a categorical distribution should be a tuple of None, bool, int, float and str for persistent storage but contains [128] which is of type list.
  num_nodes  = trial.suggest_categorical("num_nodes", [[32], [64], [128], [64, 32], [128, 64]])
/scratch.hpc/luca.cotugno/Foundation_model_clinical_data/test_tabular_model.py:481: UserWarning: Choices for a categorical distribution should be a tuple of None, bool, int, float and str for persistent storage but contains [64, 32] which is of type list.
  num_nodes  = trial.suggest_categorical("num_nodes", [[32], [64], [128], [64, 32], [128, 64]])
/scratch.hpc/luca.cotugno/Foundation_model_clinical_data/test_tabular_model.py:481: UserWarning: Choices for a categorical distribution should be a tuple of None, bool, int, float and str for persistent storage but contains [128, 64] which is of type list.
  num_nodes  = trial.suggest_categorical("num_nodes", [[32], [64], [128], [64, 32], [128, 64]])
[I 2026-07-01 07:28:03,849] Trial 35 finished with value: 0.7689149248712458 and parameters: {'num_nodes': [128], 'dropout': 0.24615050924737158, 'learning_rate': 0.00028215344174489863, 'batch_norm': True}. Best is trial 3 with value: 0.8108369571214855.
/scratch.hpc/luca.cotugno/Foundation_model_clinical_data/test_tabular_model.py:481: UserWarning: Choices for a categorical distribution should be a tuple of None, bool, int, float and str for persistent storage but contains [32] which is of type list.
  num_nodes  = trial.suggest_categorical("num_nodes", [[32], [64], [128], [64, 32], [128, 64]])
/scratch.hpc/luca.cotugno/Foundation_model_clinical_data/test_tabular_model.py:481: UserWarning: Choices for a categorical distribution should be a tuple of None, bool, int, float and str for persistent storage but contains [64] which is of type list.
  num_nodes  = trial.suggest_categorical("num_nodes", [[32], [64], [128], [64, 32], [128, 64]])
/scratch.hpc/luca.cotugno/Foundation_model_clinical_data/test_tabular_model.py:481: UserWarning: Choices for a categorical distribution should be a tuple of None, bool, int, float and str for persistent storage but contains [128] which is of type list.
  num_nodes  = trial.suggest_categorical("num_nodes", [[32], [64], [128], [64, 32], [128, 64]])
/scratch.hpc/luca.cotugno/Foundation_model_clinical_data/test_tabular_model.py:481: UserWarning: Choices for a categorical distribution should be a tuple of None, bool, int, float and str for persistent storage but contains [64, 32] which is of type list.
  num_nodes  = trial.suggest_categorical("num_nodes", [[32], [64], [128], [64, 32], [128, 64]])
/scratch.hpc/luca.cotugno/Foundation_model_clinical_data/test_tabular_model.py:481: UserWarning: Choices for a categorical distribution should be a tuple of None, bool, int, float and str for persistent storage but contains [128, 64] which is of type list.
  num_nodes  = trial.suggest_categorical("num_nodes", [[32], [64], [128], [64, 32], [128, 64]])
[I 2026-07-01 07:28:05,742] Trial 36 finished with value: 0.7419015231882534 and parameters: {'num_nodes': [128], 'dropout': 0.250561913719845, 'learning_rate': 0.0002788443305968696, 'batch_norm': True}. Best is trial 3 with value: 0.8108369571214855.
/scratch.hpc/luca.cotugno/Foundation_model_clinical_data/test_tabular_model.py:481: UserWarning: Choices for a categorical distribution should be a tuple of None, bool, int, float and str for persistent storage but contains [32] which is of type list.
  num_nodes  = trial.suggest_categorical("num_nodes", [[32], [64], [128], [64, 32], [128, 64]])
/scratch.hpc/luca.cotugno/Foundation_model_clinical_data/test_tabular_model.py:481: UserWarning: Choices for a categorical distribution should be a tuple of None, bool, int, float and str for persistent storage but contains [64] which is of type list.
  num_nodes  = trial.suggest_categorical("num_nodes", [[32], [64], [128], [64, 32], [128, 64]])
/scratch.hpc/luca.cotugno/Foundation_model_clinical_data/test_tabular_model.py:481: UserWarning: Choices for a categorical distribution should be a tuple of None, bool, int, float and str for persistent storage but contains [128] which is of type list.
  num_nodes  = trial.suggest_categorical("num_nodes", [[32], [64], [128], [64, 32], [128, 64]])
/scratch.hpc/luca.cotugno/Foundation_model_clinical_data/test_tabular_model.py:481: UserWarning: Choices for a categorical distribution should be a tuple of None, bool, int, float and str for persistent storage but contains [64, 32] which is of type list.
  num_nodes  = trial.suggest_categorical("num_nodes", [[32], [64], [128], [64, 32], [128, 64]])
/scratch.hpc/luca.cotugno/Foundation_model_clinical_data/test_tabular_model.py:481: UserWarning: Choices for a categorical distribution should be a tuple of None, bool, int, float and str for persistent storage but contains [128, 64] which is of type list.
  num_nodes  = trial.suggest_categorical("num_nodes", [[32], [64], [128], [64, 32], [128, 64]])
