[I 2026-06-28 07:13:36,938] Trial 21 finished with value: 0.7403212883736621 and parameters: {'num_nodes': [64], 'dropout': 0.1800161632839375, 'learning_rate': 0.002460376272300561, 'batch_norm': False}. Best is trial 1 with value: 0.762489649461772.
/scratch.hpc/luca.cotugno/Foundation_model_clinical_data/test_tabular_model.py:481: UserWarning: Choices for a categorical distribution should be a tuple of None, bool, int, float and str for persistent storage but contains [32] which is of type list.
  num_nodes  = trial.suggest_categorical("num_nodes", [[32], [64], [128], [64, 32], [128, 64]])
/scratch.hpc/luca.cotugno/Foundation_model_clinical_data/test_tabular_model.py:481: UserWarning: Choices for a categorical distribution should be a tuple of None, bool, int, float and str for persistent storage but contains [64] which is of type list.
  num_nodes  = trial.suggest_categorical("num_nodes", [[32], [64], [128], [64, 32], [128, 64]])
/scratch.hpc/luca.cotugno/Foundation_model_clinical_data/test_tabular_model.py:481: UserWarning: Choices for a categorical distribution should be a tuple of None, bool, int, float and str for persistent storage but contains [128] which is of type list.
  num_nodes  = trial.suggest_categorical("num_nodes", [[32], [64], [128], [64, 32], [128, 64]])
/scratch.hpc/luca.cotugno/Foundation_model_clinical_data/test_tabular_model.py:481: UserWarning: Choices for a categorical distribution should be a tuple of None, bool, int, float and str for persistent storage but contains [64, 32] which is of type list.
  num_nodes  = trial.suggest_categorical("num_nodes", [[32], [64], [128], [64, 32], [128, 64]])
/scratch.hpc/luca.cotugno/Foundation_model_clinical_data/test_tabular_model.py:481: UserWarning: Choices for a categorical distribution should be a tuple of None, bool, int, float and str for persistent storage but contains [128, 64] which is of type list.
  num_nodes  = trial.suggest_categorical("num_nodes", [[32], [64], [128], [64, 32], [128, 64]])

40:	[0s / 31s],		train_loss: 4.1907
30:	[0s / 4s],		train_loss: 3.8020
22:	[0s / 3s],		train_loss: 4.1433
68:	[0s / 11s],		train_loss: 4.1826
88:	[0s / 31s],		train_loss: 4.1917
31:	[0s / 4s],		train_loss: 3.8016
23:	[0s / 3s],		train_loss: 4.1329
69:	[0s / 11s],		train_loss: 4.1671
32:	[0s / 4s],		train_loss: 3.7982
24:	[0s / 3s],		train_loss: 4.1089
26:	[1s / 32s],		train_loss: 4.3001
70:	[0s / 11s],		train_loss: 4.1389
33:	[0s / 4s],		train_loss: 3.7727
25:	[0s / 3s],		train_loss: 4.1016
89:	[0s / 32s],		train_loss: 4.1689
71:	[0s / 11s],		train_loss: 4.1382
34:	[0s / 4s],		train_loss: 3.7618
26:	[0s / 3s],		train_loss: 4.1288
41:	[0s / 32s],		train_loss: 4.1944
72:	[0s / 11s],		train_loss: 4.1552
35:	[0s / 4s],		train_loss: 3.7049
27:	[0s / 3s],		train_loss: 4.0696
90:	[0s / 32s],		train_loss: 4.2032
73:	[0s / 11s],		train_loss: 4.1848
36:	[0s / 5s],		train_loss: 3.6952
28:	[0s / 3s],		train_loss: 4.0588
74:	[0s / 12s],		train_loss: 4.1492
37:	[0s / 5s],		train_loss: 3.7246
29:	[0s / 4s],		train_loss: 4.0324
91:	[0s / 32s],		train_loss: 4.1814
75:	[0s / 12s],		train_loss: 4.1340
38:	[0s / 5s],		train_loss: 3.7163
30:	[0s / 4s],		train_loss: 4.0446
42:	[0s / 32s],		train_loss: 4.2104
76:	[0s / 12s],		train_loss: 4.1517
39:	[0s / 5s],		train_loss: 3.7077
31:	[0s / 4s],		train_loss: 4.0279
92:	[0s / 33s],		train_loss: 4.1635
21:	[2s / 33s],		train_loss: 4.1994
40:	[0s / 5s],		train_loss: 3.6794
77:	[0s / 12s],		train_loss: 4.1631
32:	[0s / 4s],		train_loss: 3.9989
41:	[0s / 5s],		train_loss: 3.6518
78:	[0s / 12s],		train_loss: 4.1733
33:	[0s / 4s],		train_loss: 3.9963
27:	[1s / 33s],		train_loss: 4.3003
93:	[0s / 33s],		train_loss: 4.1802
42:	[0s / 5s],		train_loss: 3.6129
34:	[0s / 4s],		train_loss: 4.0391
79:	[0s / 12s],		train_loss: 4.1518
43:	[0s / 33s],		train_loss: 4.1932
43:	[0s / 6s],		train_loss: 3.5987
35:	[0s / 4s],		train_loss: 4.0261
80:	[0s / 13s],		train_loss: 4.1208
94:	[0s / 33s],		train_loss: 4.1797
44:	[0s / 6s],		train_loss: 3.5947
36:	[0s / 5s],		train_loss: 4.0184
81:	[0s / 13s],		train_loss: 4.1290
45:	[0s / 6s],		train_loss: 3.5751
37:	[0s / 5s],		train_loss: 4.0181
82:	[0s / 13s],		train_loss: 4.1298
46:	[0s / 6s],		train_loss: 3.5671
38:	[0s / 5s],		train_loss: 3.9570
95:	[0s / 34s],		train_loss: 4.1795
83:	[0s / 13s],		train_loss: 4.1257
47:	[0s / 6s],		train_loss: 3.5013
39:	[0s / 5s],		train_loss: 3.9677
44:	[0s / 34s],		train_loss: 4.1899
84:	[0s / 13s],		train_loss: 4.1429
48:	[0s / 6s],		train_loss: 3.5281
40:	[0s / 5s],		train_loss: 3.9960
96:	[0s / 34s],		train_loss: 4.1620
85:	[0s / 13s],		train_loss: 4.1386
49:	[0s / 6s],		train_loss: 3.4986
41:	[0s / 5s],		train_loss: 3.9838
86:	[0s / 13s],		train_loss: 4.1207
50:	[0s / 7s],		train_loss: 3.4632
42:	[0s / 5s],		train_loss: 3.9576
28:	[1s / 34s],		train_loss: 4.3061
97:	[0s / 34s],		train_loss: 4.1527
87:	[0s / 14s],		train_loss: 4.1292
51:	[0s / 7s],		train_loss: 3.4643
43:	[0s / 6s],		train_loss: 3.9940
44:	[0s / 6s],		train_loss: 3.9293
52:	[0s / 7s],		train_loss: 3.4419
45:	[0s / 35s],		train_loss: 4.1945
88:	[0s / 14s],		train_loss: 4.1545
98:	[0s / 35s],		train_loss: 4.1568
45:	[0s / 6s],		train_loss: 3.9369
53:	[0s / 7s],		train_loss: 3.4588
89:	[0s / 14s],		train_loss: 4.1227
15:	[5s / 35s],		train_loss: 4.2474
46:	[0s / 6s],		train_loss: 3.9414
54:	[0s / 7s],		train_loss: 3.4049
90:	[0s / 14s],		train_loss: 4.1061
47:	[0s / 6s],		train_loss: 3.9473
55:	[0s / 7s],		train_loss: 3.4382
91:	[0s / 14s],		train_loss: 4.1262
99:	[0s / 35s],		train_loss: 4.1483
48:	[0s / 6s],		train_loss: 3.9427
56:	[0s / 8s],		train_loss: 3.4090
46:	[0s / 35s],		train_loss: 4.1678
49:	[0s / 7s],		train_loss: 3.9113
92:	[0s / 15s],		train_loss: 4.1211
57:	[0s / 8s],		train_loss: 3.4134
22:	[2s / 35s],		train_loss: 4.2109
50:	[0s / 7s],		train_loss: 3.9309
93:	[0s / 15s],		train_loss: 4.0935
58:	[0s / 8s],		train_loss: 3.4305
0:	[0s / 0s],		train_loss: 5.4094
29:	[1s / 36s],		train_loss: 4.3121
51:	[0s / 7s],		train_loss: 3.9155
94:	[0s / 15s],		train_loss: 4.1346
59:	[0s / 8s],		train_loss: 3.3725
52:	[0s / 7s],		train_loss: 3.9040
95:	[0s / 15s],		train_loss: 4.1038
60:	[0s / 8s],		train_loss: 3.3464
1:	[0s / 0s],		train_loss: 4.7397
53:	[0s / 7s],		train_loss: 3.9321
96:	[0s / 15s],		train_loss: 4.1244
61:	[0s / 8s],		train_loss: 3.3478
54:	[0s / 7s],		train_loss: 3.9601
97:	[0s / 15s],		train_loss: 4.1234
47:	[0s / 36s],		train_loss: 4.2004
62:	[0s / 8s],		train_loss: 3.3936
55:	[0s / 7s],		train_loss: 3.9250
2:	[0s / 0s],		train_loss: 4.5965
63:	[0s / 9s],		train_loss: 3.4540
98:	[0s / 15s],		train_loss: 4.0917
56:	[0s / 8s],		train_loss: 3.8653
64:	[0s / 9s],		train_loss: 3.4070
99:	[0s / 16s],		train_loss: 4.0797
57:	[0s / 8s],		train_loss: 3.8902
3:	[0s / 1s],		train_loss: 4.5817
65:	[0s / 9s],		train_loss: 3.4138
0:	[0s / 0s],		train_loss: 4.8900
58:	[0s / 8s],		train_loss: 3.8856
66:	[0s / 9s],		train_loss: 3.3648
48:	[0s / 37s],		train_loss: 4.1754
4:	[0s / 1s],		train_loss: 4.5559
1:	[0s / 0s],		train_loss: 4.6006
59:	[0s / 8s],		train_loss: 3.8917
67:	[0s / 9s],		train_loss: 3.3264
30:	[1s / 37s],		train_loss: 4.3148
2:	[0s / 0s],		train_loss: 4.4961
60:	[0s / 8s],		train_loss: 3.9020
68:	[0s / 9s],		train_loss: 3.2935
5:	[0s / 1s],		train_loss: 4.5069
3:	[0s / 0s],		train_loss: 4.4582
61:	[0s / 8s],		train_loss: 3.9169
69:	[0s / 10s],		train_loss: 3.2770
4:	[0s / 0s],		train_loss: 4.4758
62:	[0s / 9s],		train_loss: 3.9308
70:	[0s / 10s],		train_loss: 3.2863
49:	[0s / 37s],		train_loss: 4.1714
6:	[0s / 2s],		train_loss: 4.4807
5:	[0s / 0s],		train_loss: 4.4142
63:	[0s / 9s],		train_loss: 3.9609
71:	[0s / 10s],		train_loss: 3.3396
6:	[0s / 1s],		train_loss: 4.3912
64:	[0s / 9s],		train_loss: 3.9960
72:	[0s / 10s],		train_loss: 3.2818
7:	[0s / 2s],		train_loss: 4.4773
7:	[0s / 1s],		train_loss: 4.3727
65:	[0s / 9s],		train_loss: 4.0011
73:	[0s / 10s],		train_loss: 3.2885
50:	[0s / 38s],		train_loss: 4.1498
8:	[0s / 1s],		train_loss: 4.3786
66:	[0s / 9s],		train_loss: 4.0017
74:	[0s / 10s],		train_loss: 3.2468
31:	[1s / 38s],		train_loss: 4.2770
8:	[0s / 2s],		train_loss: 4.4444
9:	[0s / 1s],		train_loss: 4.3687
67:	[0s / 9s],		train_loss: 3.9739
75:	[0s / 11s],		train_loss: 3.3158
10:	[0s / 1s],		train_loss: 4.3522
68:	[0s / 9s],		train_loss: 3.9265
76:	[0s / 11s],		train_loss: 3.3016
9:	[0s / 3s],		train_loss: 4.4499
23:	[2s / 38s],		train_loss: 4.1775
11:	[0s / 1s],		train_loss: 4.3400
69:	[0s / 10s],		train_loss: 3.9094
77:	[0s / 11s],		train_loss: 3.2241
51:	[0s / 39s],		train_loss: 4.1618
12:	[0s / 2s],		train_loss: 4.3059
70:	[0s / 10s],		train_loss: 3.8622
78:	[0s / 11s],		train_loss: 3.2347
10:	[0s / 3s],		train_loss: 4.4542
13:	[0s / 2s],		train_loss: 4.3418
71:	[0s / 10s],		train_loss: 3.8794
79:	[0s / 11s],		train_loss: 3.2411
14:	[0s / 2s],		train_loss: 4.3298
72:	[0s / 10s],		train_loss: 3.9135
80:	[0s / 11s],		train_loss: 3.2504
11:	[0s / 3s],		train_loss: 4.4053
15:	[0s / 2s],		train_loss: 4.2982
73:	[0s / 10s],		train_loss: 3.9751
81:	[0s / 11s],		train_loss: 3.2453
52:	[0s / 39s],		train_loss: 4.1545
74:	[0s / 10s],		train_loss: 3.9138
16:	[0s / 2s],		train_loss: 4.2956
82:	[0s / 12s],		train_loss: 3.1936
12:	[0s / 4s],		train_loss: 4.4297
75:	[0s / 11s],		train_loss: 3.8837
17:	[0s / 2s],		train_loss: 4.3564
83:	[0s / 12s],		train_loss: 3.2244
76:	[0s / 11s],		train_loss: 3.8572
18:	[0s / 3s],		train_loss: 4.3167
84:	[0s / 12s],		train_loss: 3.1598
32:	[1s / 40s],		train_loss: 4.3042
13:	[0s / 4s],		train_loss: 4.4067
77:	[0s / 11s],		train_loss: 3.8835
85:	[0s / 12s],		train_loss: 3.1489
19:	[0s / 3s],		train_loss: 4.3200
78:	[0s / 11s],		train_loss: 3.8256
53:	[0s / 40s],		train_loss: 4.1498
86:	[0s / 12s],		train_loss: 3.1421
20:	[0s / 3s],		train_loss: 4.2679
14:	[0s / 4s],		train_loss: 4.3788
79:	[0s / 11s],		train_loss: 3.8596
87:	[0s / 12s],		train_loss: 3.1322
21:	[0s / 3s],		train_loss: 4.2897
80:	[0s / 11s],		train_loss: 3.8222
88:	[0s / 13s],		train_loss: 3.1766
22:	[0s / 3s],		train_loss: 4.2827
15:	[0s / 5s],		train_loss: 4.3497
81:	[0s / 12s],		train_loss: 3.8453
89:	[0s / 13s],		train_loss: 3.1149
23:	[0s / 3s],		train_loss: 4.2856
54:	[0s / 40s],		train_loss: 4.1209
82:	[0s / 12s],		train_loss: 3.8584
90:	[0s / 13s],		train_loss: 3.0817
24:	[0s / 3s],		train_loss: 4.2529
16:	[0s / 5s],		train_loss: 4.3505
83:	[0s / 12s],		train_loss: 3.8232
91:	[0s / 13s],		train_loss: 3.0744
33:	[1s / 41s],		train_loss: 4.2911
25:	[0s / 4s],		train_loss: 4.2736
24:	[2s / 41s],		train_loss: 4.1654
84:	[0s / 12s],		train_loss: 3.7706
92:	[0s / 13s],		train_loss: 3.1568
26:	[0s / 4s],		train_loss: 4.2521
17:	[0s / 5s],		train_loss: 4.3399
85:	[0s / 12s],		train_loss: 3.8014
16:	[6s / 41s],		train_loss: 4.2307
93:	[0s / 13s],		train_loss: 3.0851
27:	[0s / 4s],		train_loss: 4.2498
55:	[0s / 41s],		train_loss: 4.1337
86:	[0s / 12s],		train_loss: 3.7194
94:	[0s / 13s],		train_loss: 3.0939
18:	[0s / 5s],		train_loss: 4.3474
28:	[0s / 4s],		train_loss: 4.2095
87:	[0s / 12s],		train_loss: 3.7490
95:	[0s / 14s],		train_loss: 3.0836
29:	[0s / 4s],		train_loss: 4.2369
88:	[0s / 13s],		train_loss: 3.7405
96:	[0s / 14s],		train_loss: 3.1156
19:	[0s / 6s],		train_loss: 4.3472
30:	[0s / 4s],		train_loss: 4.2202
89:	[0s / 13s],		train_loss: 3.7280
97:	[0s / 14s],		train_loss: 3.0575
56:	[0s / 42s],		train_loss: 4.1548
31:	[0s / 5s],		train_loss: 4.2367
90:	[0s / 13s],		train_loss: 3.7863
98:	[0s / 14s],		train_loss: 3.1089
20:	[0s / 6s],		train_loss: 4.3405
32:	[0s / 5s],		train_loss: 4.2326
34:	[1s / 42s],		train_loss: 4.2963
91:	[0s / 13s],		train_loss: 3.7891
99:	[0s / 14s],		train_loss: 3.1176
33:	[0s / 5s],		train_loss: 4.2468
92:	[0s / 13s],		train_loss: 3.7704
21:	[0s / 6s],		train_loss: 4.3253
34:	[0s / 5s],		train_loss: 4.1961
0:	[0s / 0s],		train_loss: 4.8675
93:	[0s / 13s],		train_loss: 3.6865
35:	[0s / 5s],		train_loss: 4.2103
1:	[0s / 0s],		train_loss: 4.6318
57:	[0s / 42s],		train_loss: 4.1462
94:	[0s / 14s],		train_loss: 3.7213
22:	[0s / 7s],		train_loss: 4.3192
2:	[0s / 0s],		train_loss: 4.5659
36:	[0s / 5s],		train_loss: 4.1905
95:	[0s / 14s],		train_loss: 3.8297
3:	[0s / 0s],		train_loss: 4.5286
37:	[0s / 6s],		train_loss: 4.2132
96:	[0s / 14s],		train_loss: 3.7821
4:	[0s / 0s],		train_loss: 4.5160
23:	[0s / 7s],		train_loss: 4.2820
97:	[0s / 14s],		train_loss: 3.8129
38:	[0s / 6s],		train_loss: 4.2110
5:	[0s / 0s],		train_loss: 4.4908
98:	[0s / 14s],		train_loss: 3.7611
58:	[0s / 43s],		train_loss: 4.1236
39:	[0s / 6s],		train_loss: 4.1984
6:	[0s / 0s],		train_loss: 4.4657
99:	[0s / 14s],		train_loss: 3.7399
35:	[1s / 43s],		train_loss: 4.2914
25:	[2s / 43s],		train_loss: 4.1579
24:	[0s / 7s],		train_loss: 4.2879
7:	[0s / 1s],		train_loss: 4.4766
40:	[0s / 6s],		train_loss: 4.1477
8:	[0s / 1s],		train_loss: 4.4444
0:	[0s / 0s],		train_loss: 4.5618
41:	[0s / 6s],		train_loss: 4.1510
25:	[0s / 8s],		train_loss: 4.3026
9:	[0s / 1s],		train_loss: 4.4599
1:	[0s / 0s],		train_loss: 4.4045
59:	[0s / 44s],		train_loss: 4.0962
42:	[0s / 7s],		train_loss: 4.1917
10:	[0s / 1s],		train_loss: 4.4049
2:	[0s / 0s],		train_loss: 4.3730
43:	[0s / 7s],		train_loss: 4.2073
11:	[0s / 1s],		train_loss: 4.3675
26:	[0s / 8s],		train_loss: 4.2869
3:	[0s / 0s],		train_loss: 4.3612
12:	[0s / 1s],		train_loss: 4.3911
44:	[0s / 7s],		train_loss: 4.1571
4:	[0s / 0s],		train_loss: 4.3471
13:	[0s / 2s],		train_loss: 4.3740
45:	[0s / 7s],		train_loss: 4.1827
5:	[0s / 0s],		train_loss: 4.3613
36:	[1s / 44s],		train_loss: 4.2696
27:	[0s / 8s],		train_loss: 4.2881
14:	[0s / 2s],		train_loss: 4.3741
60:	[0s / 44s],		train_loss: 4.1098
6:	[0s / 1s],		train_loss: 4.3360
46:	[0s / 7s],		train_loss: 4.1386
15:	[0s / 2s],		train_loss: 4.3560
7:	[0s / 1s],		train_loss: 4.3516
47:	[0s / 7s],		train_loss: 4.1427
16:	[0s / 2s],		train_loss: 4.3507
8:	[0s / 1s],		train_loss: 4.3362
28:	[0s / 9s],		train_loss: 4.2653
17:	[0s / 2s],		train_loss: 4.3525
48:	[0s / 8s],		train_loss: 4.1541
9:	[0s / 1s],		train_loss: 4.3373
18:	[0s / 2s],		train_loss: 4.3349
61:	[0s / 45s],		train_loss: 4.1117
49:	[0s / 8s],		train_loss: 4.1254
10:	[0s / 1s],		train_loss: 4.3172
29:	[0s / 9s],		train_loss: 4.2636
19:	[0s / 2s],		train_loss: 4.3343
50:	[0s / 8s],		train_loss: 4.1510
11:	[0s / 1s],		train_loss: 4.3299
20:	[0s / 2s],		train_loss: 4.3360
12:	[0s / 1s],		train_loss: 4.3223
21:	[0s / 3s],		train_loss: 4.3243
51:	[0s / 8s],		train_loss: 4.1245
30:	[0s / 9s],		train_loss: 4.2500
13:	[0s / 1s],		train_loss: 4.3206
22:	[0s / 3s],		train_loss: 4.3264
37:	[1s / 45s],		train_loss: 4.2934
52:	[0s / 8s],		train_loss: 4.1243
62:	[0s / 45s],		train_loss: 4.2043
14:	[0s / 2s],		train_loss: 4.3148
23:	[0s / 3s],		train_loss: 4.2997
53:	[0s / 8s],		train_loss: 4.0953
24:	[0s / 3s],		train_loss: 4.2978
15:	[0s / 2s],		train_loss: 4.3383
31:	[0s / 10s],		train_loss: 4.2363
25:	[0s / 3s],		train_loss: 4.2917
16:	[0s / 2s],		train_loss: 4.2965
54:	[0s / 9s],		train_loss: 4.1490
26:	[2s / 46s],		train_loss: 4.1315
26:	[0s / 3s],		train_loss: 4.3155
17:	[0s / 2s],		train_loss: 4.3105
32:	[0s / 10s],		train_loss: 4.2313
55:	[0s / 9s],		train_loss: 4.1189
27:	[0s / 3s],		train_loss: 4.2778
18:	[0s / 2s],		train_loss: 4.3080
63:	[0s / 46s],		train_loss: 4.1322
56:	[0s / 9s],		train_loss: 4.1401
28:	[0s / 3s],		train_loss: 4.2820
19:	[0s / 2s],		train_loss: 4.2847
33:	[0s / 10s],		train_loss: 4.2289
57:	[0s / 9s],		train_loss: 4.1026
29:	[0s / 4s],		train_loss: 4.2745
17:	[5s / 46s],		train_loss: 4.2482
20:	[0s / 2s],		train_loss: 4.2987
30:	[0s / 4s],		train_loss: 4.2815
58:	[0s / 9s],		train_loss: 4.0907
21:	[0s / 3s],		train_loss: 4.2878
31:	[0s / 4s],		train_loss: 4.2677
38:	[1s / 46s],		train_loss: 4.3103
59:	[0s / 9s],		train_loss: 4.1029
22:	[0s / 3s],		train_loss: 4.2401
34:	[0s / 11s],		train_loss: 4.2218
32:	[0s / 4s],		train_loss: 4.2481
64:	[0s / 46s],		train_loss: 4.0673
23:	[0s / 3s],		train_loss: 4.2822
60:	[0s / 10s],		train_loss: 4.0936
33:	[0s / 4s],		train_loss: 4.2683
24:	[0s / 3s],		train_loss: 4.2742
61:	[0s / 10s],		train_loss: 4.0646
34:	[0s / 4s],		train_loss: 4.2489
35:	[0s / 11s],		train_loss: 4.2001
25:	[0s / 3s],		train_loss: 4.3030
62:	[0s / 10s],		train_loss: 4.0974
35:	[0s / 4s],		train_loss: 4.2739
26:	[0s / 3s],		train_loss: 4.3027
36:	[0s / 5s],		train_loss: 4.2322
63:	[0s / 10s],		train_loss: 4.0557
27:	[0s / 3s],		train_loss: 4.2546
36:	[0s / 11s],		train_loss: 4.2009
37:	[0s / 5s],		train_loss: 4.2541
65:	[0s / 47s],		train_loss: 4.0454
64:	[0s / 10s],		train_loss: 4.0906
28:	[0s / 4s],		train_loss: 4.2624
38:	[0s / 5s],		train_loss: 4.2156
65:	[0s / 10s],		train_loss: 4.1011
29:	[0s / 4s],		train_loss: 4.2734
39:	[0s / 5s],		train_loss: 4.2042
37:	[0s / 12s],		train_loss: 4.1999
30:	[0s / 4s],		train_loss: 4.2768
40:	[0s / 5s],		train_loss: 4.2473
39:	[1s / 48s],		train_loss: 4.2874
66:	[0s / 11s],		train_loss: 4.0889
27:	[2s / 48s],		train_loss: 4.1397
41:	[0s / 5s],		train_loss: 4.2282
31:	[0s / 4s],		train_loss: 4.2896
66:	[0s / 48s],		train_loss: 4.0664
67:	[0s / 11s],		train_loss: 4.0334
38:	[0s / 12s],		train_loss: 4.1491
42:	[0s / 5s],		train_loss: 4.1873
32:	[0s / 4s],		train_loss: 4.2753
68:	[0s / 11s],		train_loss: 4.0888
43:	[0s / 6s],		train_loss: 4.2084
33:	[0s / 4s],		train_loss: 4.2671
44:	[0s / 6s],		train_loss: 4.2033
69:	[0s / 11s],		train_loss: 4.0698
39:	[0s / 12s],		train_loss: 4.1642
34:	[0s / 5s],		train_loss: 4.2625
45:	[0s / 6s],		train_loss: 4.1923
70:	[0s / 11s],		train_loss: 4.0754
35:	[0s / 5s],		train_loss: 4.2383
67:	[0s / 48s],		train_loss: 4.0611
46:	[0s / 6s],		train_loss: 4.1659
36:	[0s / 5s],		train_loss: 4.2505
71:	[0s / 11s],		train_loss: 4.0139
40:	[0s / 13s],		train_loss: 4.1547
47:	[0s / 6s],		train_loss: 4.1763
37:	[0s / 5s],		train_loss: 4.2432
72:	[0s / 12s],		train_loss: 4.0496
48:	[0s / 6s],		train_loss: 4.1636
40:	[1s / 49s],		train_loss: 4.2714
38:	[0s / 5s],		train_loss: 4.2408
41:	[0s / 13s],		train_loss: 4.1583
49:	[0s / 6s],		train_loss: 4.1517
73:	[0s / 12s],		train_loss: 4.0398
39:	[0s / 5s],		train_loss: 4.2390
50:	[0s / 6s],		train_loss: 4.1473
74:	[0s / 12s],		train_loss: 4.0882
40:	[0s / 5s],		train_loss: 4.2427
68:	[0s / 49s],		train_loss: 4.0494
51:	[0s / 7s],		train_loss: 4.1321
42:	[0s / 13s],		train_loss: 4.1294
41:	[0s / 5s],		train_loss: 4.2416
75:	[0s / 12s],		train_loss: 4.0738
52:	[0s / 7s],		train_loss: 4.1201
42:	[0s / 6s],		train_loss: 4.2587
53:	[0s / 7s],		train_loss: 4.1160
76:	[0s / 12s],		train_loss: 4.0449
43:	[0s / 6s],		train_loss: 4.2383
43:	[0s / 14s],		train_loss: 4.1454
54:	[0s / 7s],		train_loss: 4.1133
77:	[0s / 13s],		train_loss: 4.0140
44:	[0s / 6s],		train_loss: 4.2437
55:	[0s / 7s],		train_loss: 4.0949
78:	[0s / 13s],		train_loss: 4.0042
45:	[0s / 6s],		train_loss: 4.2378
41:	[0s / 50s],		train_loss: 4.2266
69:	[0s / 50s],		train_loss: 4.0495
56:	[0s / 7s],		train_loss: 4.1070
28:	[2s / 50s],		train_loss: 4.1179
44:	[0s / 14s],		train_loss: 4.1431
46:	[0s / 6s],		train_loss: 4.2590
79:	[0s / 13s],		train_loss: 3.9741
57:	[0s / 7s],		train_loss: 4.0835
47:	[0s / 6s],		train_loss: 4.2084
58:	[0s / 8s],		train_loss: 4.0887
80:	[0s / 13s],		train_loss: 4.0038
48:	[0s / 6s],		train_loss: 4.1950
45:	[0s / 14s],		train_loss: 4.1284
59:	[0s / 8s],		train_loss: 4.0850
81:	[0s / 13s],		train_loss: 4.0108
49:	[0s / 7s],		train_loss: 4.2093
60:	[0s / 8s],		train_loss: 4.0728
82:	[0s / 13s],		train_loss: 4.0381
50:	[0s / 7s],		train_loss: 4.2183
70:	[0s / 50s],		train_loss: 4.0507
61:	[0s / 8s],		train_loss: 4.0404
83:	[0s / 13s],		train_loss: 4.0225
46:	[0s / 15s],		train_loss: 4.1171
51:	[0s / 7s],		train_loss: 4.2125
62:	[0s / 8s],		train_loss: 4.0306
52:	[0s / 7s],		train_loss: 4.1918
63:	[0s / 8s],		train_loss: 4.0796
84:	[0s / 14s],		train_loss: 3.9908
53:	[0s / 7s],		train_loss: 4.1861
64:	[0s / 8s],		train_loss: 4.0389
47:	[0s / 15s],		train_loss: 4.0832
18:	[4s / 51s],		train_loss: 4.2073
85:	[0s / 14s],		train_loss: 4.0046
65:	[0s / 8s],		train_loss: 4.0194
54:	[0s / 7s],		train_loss: 4.1647
42:	[1s / 51s],		train_loss: 4.3024
86:	[0s / 14s],		train_loss: 3.9592
71:	[0s / 51s],		train_loss: 4.0623
66:	[0s / 9s],		train_loss: 4.0070
55:	[0s / 7s],		train_loss: 4.1800
48:	[0s / 15s],		train_loss: 4.0782
87:	[0s / 14s],		train_loss: 4.0087
67:	[0s / 9s],		train_loss: 4.0210
56:	[0s / 8s],		train_loss: 4.1733
68:	[0s / 9s],		train_loss: 3.9896
88:	[0s / 14s],		train_loss: 3.9874
57:	[0s / 8s],		train_loss: 4.1912
49:	[0s / 16s],		train_loss: 4.0644
69:	[0s / 9s],		train_loss: 3.9996
58:	[0s / 8s],		train_loss: 4.1555
89:	[0s / 14s],		train_loss: 4.0044
70:	[0s / 9s],		train_loss: 4.0191
72:	[0s / 52s],		train_loss: 4.0174
59:	[0s / 8s],		train_loss: 4.1359
90:	[0s / 15s],		train_loss: 3.9466
71:	[0s / 9s],		train_loss: 3.9827
60:	[0s / 8s],		train_loss: 4.1749
50:	[0s / 16s],		train_loss: 4.0600
91:	[0s / 15s],		train_loss: 3.9866
72:	[0s / 9s],		train_loss: 4.0033
61:	[0s / 8s],		train_loss: 4.1428
29:	[2s / 52s],		train_loss: 4.1191
73:	[0s / 9s],		train_loss: 3.9853
92:	[0s / 15s],		train_loss: 3.9869
62:	[0s / 8s],		train_loss: 4.1438
51:	[0s / 16s],		train_loss: 4.0692
43:	[1s / 52s],		train_loss: 4.2662
74:	[0s / 10s],		train_loss: 3.9800
73:	[0s / 52s],		train_loss: 4.0905
93:	[0s / 15s],		train_loss: 3.9266
63:	[0s / 8s],		train_loss: 4.1514
75:	[0s / 10s],		train_loss: 3.9697
64:	[0s / 9s],		train_loss: 4.1381
94:	[0s / 15s],		train_loss: 3.9211
52:	[0s / 17s],		train_loss: 4.0071
76:	[0s / 10s],		train_loss: 3.9598
65:	[0s / 9s],		train_loss: 4.1705
95:	[0s / 15s],		train_loss: 3.9720
77:	[0s / 10s],		train_loss: 3.9377
66:	[0s / 9s],		train_loss: 4.1419
78:	[0s / 10s],		train_loss: 3.9458
96:	[0s / 16s],		train_loss: 3.9790
53:	[0s / 17s],		train_loss: 4.0411
67:	[0s / 9s],		train_loss: 4.1305
79:	[0s / 10s],		train_loss: 3.9522
74:	[0s / 53s],		train_loss: 4.0742
97:	[0s / 16s],		train_loss: 3.9493
68:	[0s / 9s],		train_loss: 4.1603
80:	[0s / 10s],		train_loss: 3.9169
54:	[0s / 17s],		train_loss: 4.0491
69:	[0s / 9s],		train_loss: 4.1557
98:	[0s / 16s],		train_loss: 3.9441
81:	[0s / 11s],		train_loss: 3.9183
44:	[1s / 53s],		train_loss: 4.2866
70:	[0s / 9s],		tr