[I 2026-07-01 11:35:21,158] Trial 88 finished with value: 0.765552642070721 and parameters: {'num_nodes': [32], 'dropout': 0.28324789136041656, 'learning_rate': 0.00011338434866488365, 'batch_norm': False}. Best is trial 58 with value: 0.7812087895237219.
/scratch.hpc/luca.cotugno/Foundation_model_clinical_data/test_tabular_model.py:481: UserWarning: Choices for a categorical distribution should be a tuple of None, bool, int, float and str for persistent storage but contains [32] which is of type list.
  num_nodes  = trial.suggest_categorical("num_nodes", [[32], [64], [128], [64, 32], [128, 64]])
/scratch.hpc/luca.cotugno/Foundation_model_clinical_data/test_tabular_model.py:481: UserWarning: Choices for a categorical distribution should be a tuple of None, bool, int, float and str for persistent storage but contains [64] which is of type list.
  num_nodes  = trial.suggest_categorical("num_nodes", [[32], [64], [128], [64, 32], [128, 64]])
/scratch.hpc/luca.cotugno/Foundation_model_clinical_data/test_tabular_model.py:481: UserWarning: Choices for a categorical distribution should be a tuple of None, bool, int, float and str for persistent storage but contains [128] which is of type list.
  num_nodes  = trial.suggest_categorical("num_nodes", [[32], [64], [128], [64, 32], [128, 64]])
/scratch.hpc/luca.cotugno/Foundation_model_clinical_data/test_tabular_model.py:481: UserWarning: Choices for a categorical distribution should be a tuple of None, bool, int, float and str for persistent storage but contains [64, 32] which is of type list.
  num_nodes  = trial.suggest_categorical("num_nodes", [[32], [64], [128], [64, 32], [128, 64]])
/scratch.hpc/luca.cotugno/Foundation_model_clinical_data/test_tabular_model.py:481: UserWarning: Choices for a categorical distribution should be a tuple of None, bool, int, float and str for persistent storage but contains [128, 64] which is of type list.
  num_nodes  = trial.suggest_categorical("num_nodes", [[32], [64], [128], [64, 32], [128, 64]])

59:	[0s / 8s],		train_loss: 4.2203
95:	[0s / 13s],		train_loss: 4.1029
71:	[0s / 50s],		train_loss: 4.2729
60:	[0s / 9s],		train_loss: 4.2250
25:	[0s / 4s],		train_loss: 4.2851
96:	[0s / 13s],		train_loss: 4.1083
21:	[0s / 7s],		train_loss: 4.3654
61:	[0s / 9s],		train_loss: 4.2421
97:	[0s / 13s],		train_loss: 4.0937
26:	[0s / 4s],		train_loss: 4.2873
62:	[0s / 9s],		train_loss: 4.2181
98:	[0s / 14s],		train_loss: 4.0835
27:	[0s / 5s],		train_loss: 4.2579
22:	[0s / 7s],		train_loss: 4.3290
63:	[0s / 9s],		train_loss: 4.1822
99:	[0s / 14s],		train_loss: 4.0954
64:	[0s / 9s],		train_loss: 4.2083
28:	[0s / 5s],		train_loss: 4.2561
72:	[0s / 51s],		train_loss: 4.2884
65:	[0s / 9s],		train_loss: 4.2037
0:	[0s / 0s],		train_loss: 5.3373
23:	[0s / 8s],		train_loss: 4.3281
29:	[0s / 5s],		train_loss: 4.2554
66:	[0s / 10s],		train_loss: 4.2081
1:	[0s / 0s],		train_loss: 4.8790
30:	[0s / 5s],		train_loss: 4.2461
67:	[0s / 10s],		train_loss: 4.1983
2:	[0s / 0s],		train_loss: 4.6881
40:	[2s / 1m:44s],		train_loss: 4.3484
3:	[0s / 0s],		train_loss: 4.6228
68:	[0s / 10s],		train_loss: 4.1809
24:	[0s / 8s],		train_loss: 4.3258
31:	[0s / 6s],		train_loss: 4.2542
52:	[1s / 1m:17s],		train_loss: 3.9847
4:	[0s / 0s],		train_loss: 4.5598
69:	[0s / 10s],		train_loss: 4.2076
73:	[0s / 52s],		train_loss: 4.2921
32:	[0s / 6s],		train_loss: 4.2521
5:	[0s / 0s],		train_loss: 4.5472
70:	[0s / 10s],		train_loss: 4.2050
25:	[0s / 9s],		train_loss: 4.3376
33:	[0s / 6s],		train_loss: 4.2660
6:	[0s / 1s],		train_loss: 4.5216
71:	[0s / 10s],		train_loss: 4.1744
7:	[0s / 1s],		train_loss: 4.4946
34:	[0s / 6s],		train_loss: 4.2469
72:	[0s / 10s],		train_loss: 4.1839
8:	[0s / 1s],		train_loss: 4.4948
73:	[0s / 11s],		train_loss: 4.1727
26:	[0s / 9s],		train_loss: 4.3195
35:	[0s / 6s],		train_loss: 4.2509
9:	[0s / 1s],		train_loss: 4.5010
74:	[0s / 11s],		train_loss: 4.1710
74:	[0s / 52s],		train_loss: 4.2670
36:	[0s / 6s],		train_loss: 4.2353
10:	[0s / 1s],		train_loss: 4.4757
75:	[0s / 11s],		train_loss: 4.1683
27:	[0s / 9s],		train_loss: 4.3219
11:	[0s / 1s],		train_loss: 4.4653
37:	[0s / 7s],		train_loss: 4.2229
76:	[0s / 11s],		train_loss: 4.1796
12:	[0s / 1s],		train_loss: 4.4430
79:	[4s / 5m:11s],		train_loss: 4.0992
77:	[0s / 11s],		train_loss: 4.1616
38:	[0s / 7s],		train_loss: 4.2364
13:	[0s / 1s],		train_loss: 4.4376
28:	[0s / 10s],		train_loss: 4.3010
78:	[0s / 11s],		train_loss: 4.1670
75:	[0s / 53s],		train_loss: 4.2922
39:	[0s / 7s],		train_loss: 4.2287
14:	[0s / 2s],		train_loss: 4.4129
53:	[1s / 1m:19s],		train_loss: 3.9765
79:	[0s / 11s],		train_loss: 4.1783
15:	[0s / 2s],		train_loss: 4.4145
40:	[0s / 7s],		train_loss: 4.2368
29:	[0s / 10s],		train_loss: 4.3395
80:	[0s / 12s],		train_loss: 4.1801
16:	[0s / 2s],		train_loss: 4.4166
81:	[0s / 12s],		train_loss: 4.1657
41:	[0s / 7s],		train_loss: 4.2050
17:	[0s / 2s],		train_loss: 4.3986
82:	[0s / 12s],		train_loss: 4.1785
18:	[0s / 2s],		train_loss: 4.3955
30:	[0s / 10s],		train_loss: 4.3136
42:	[0s / 7s],		train_loss: 4.2162
76:	[0s / 53s],		train_loss: 4.2718
19:	[0s / 2s],		train_loss: 4.3726
83:	[0s / 12s],		train_loss: 4.1504
43:	[0s / 8s],		train_loss: 4.2217
20:	[0s / 2s],		train_loss: 4.3694
84:	[0s / 12s],		train_loss: 4.1610
31:	[0s / 11s],		train_loss: 4.3016
44:	[0s / 8s],		train_loss: 4.2276
21:	[0s / 2s],		train_loss: 4.3648
85:	[0s / 12s],		train_loss: 4.1364
41:	[2s / 1m:47s],		train_loss: 4.3057
22:	[0s / 3s],		train_loss: 4.3802
45:	[0s / 8s],		train_loss: 4.1951
86:	[0s / 12s],		train_loss: 4.1337
23:	[0s / 3s],		train_loss: 4.3636
32:	[0s / 11s],		train_loss: 4.3005
87:	[0s / 13s],		train_loss: 4.1820
77:	[0s / 54s],		train_loss: 4.2698
46:	[0s / 8s],		train_loss: 4.2084
24:	[0s / 3s],		train_loss: 4.3479
88:	[0s / 13s],		train_loss: 4.1512
54:	[1s / 1m:20s],		train_loss: 4.0142
47:	[0s / 8s],		train_loss: 4.2025
25:	[0s / 3s],		train_loss: 4.3518
89:	[0s / 13s],		train_loss: 4.1677
33:	[0s / 11s],		train_loss: 4.2712
26:	[0s / 3s],		train_loss: 4.3626
48:	[0s / 9s],		train_loss: 4.1707
90:	[0s / 13s],		train_loss: 4.1278
27:	[0s / 3s],		train_loss: 4.3451
91:	[0s / 13s],		train_loss: 4.1575
49:	[0s / 9s],		train_loss: 4.1731
78:	[0s / 55s],		train_loss: 4.2896
28:	[0s / 3s],		train_loss: 4.3371
34:	[0s / 12s],		train_loss: 4.2849
92:	[0s / 13s],		train_loss: 4.1083
50:	[0s / 9s],		train_loss: 4.1721
29:	[0s / 4s],		train_loss: 4.3277
93:	[0s / 13s],		train_loss: 4.1436
30:	[0s / 4s],		train_loss: 4.3259
51:	[0s / 9s],		train_loss: 4.1983
35:	[0s / 12s],		train_loss: 4.2841
94:	[0s / 14s],		train_loss: 4.1294
31:	[0s / 4s],		train_loss: 4.3126
52:	[0s / 9s],		train_loss: 4.1564
79:	[0s / 55s],		train_loss: 4.2342
95:	[0s / 14s],		train_loss: 4.1334
32:	[0s / 4s],		train_loss: 4.3249
36:	[0s / 12s],		train_loss: 4.2863
53:	[0s / 10s],		train_loss: 4.1654
96:	[0s / 14s],		train_loss: 4.1076
33:	[0s / 4s],		train_loss: 4.3142
34:	[0s / 4s],		train_loss: 4.2993
97:	[0s / 14s],		train_loss: 4.1087
54:	[0s / 10s],		train_loss: 4.1745
55:	[1s / 1m:21s],		train_loss: 3.9843
37:	[0s / 13s],		train_loss: 4.2751
35:	[0s / 4s],		train_loss: 4.3231
98:	[0s / 14s],		train_loss: 4.0973
55:	[0s / 10s],		train_loss: 4.1673
36:	[0s / 5s],		train_loss: 4.3017
99:	[0s / 14s],		train_loss: 4.1251
80:	[0s / 56s],		train_loss: 4.2456
56:	[0s / 10s],		train_loss: 4.1373
38:	[0s / 13s],		train_loss: 4.2722
37:	[0s / 5s],		train_loss: 4.2933
57:	[0s / 10s],		train_loss: 4.1414
0:	[0s / 0s],		train_loss: 5.2347
38:	[0s / 5s],		train_loss: 4.2905
42:	[2s / 1m:49s],		train_loss: 4.3216
39:	[0s / 13s],		train_loss: 4.2986
1:	[0s / 0s],		train_loss: 4.6667
39:	[0s / 5s],		train_loss: 4.2905
58:	[0s / 10s],		train_loss: 4.1488
81:	[0s / 56s],		train_loss: 4.2748
2:	[0s / 0s],		train_loss: 4.5459
40:	[0s / 5s],		train_loss: 4.2834
59:	[0s / 11s],		train_loss: 4.1401
41:	[0s / 5s],		train_loss: 4.2700
3:	[0s / 0s],		train_loss: 4.5252
40:	[0s / 14s],		train_loss: 4.2834
60:	[0s / 11s],		train_loss: 4.1518
42:	[0s / 5s],		train_loss: 4.3120
4:	[0s / 0s],		train_loss: 4.5270
43:	[0s / 6s],		train_loss: 4.2863
5:	[0s / 0s],		train_loss: 4.4602
61:	[0s / 11s],		train_loss: 4.1554
56:	[1s / 1m:23s],		train_loss: 3.9850
41:	[0s / 14s],		train_loss: 4.2639
44:	[0s / 6s],		train_loss: 4.2740
82:	[0s / 57s],		train_loss: 4.2265
6:	[0s / 1s],		train_loss: 4.4650
80:	[4s / 5m:15s],		train_loss: 4.0779
62:	[0s / 11s],		train_loss: 4.1368
45:	[0s / 6s],		train_loss: 4.2871
7:	[0s / 1s],		train_loss: 4.4354
63:	[0s / 11s],		train_loss: 4.1284
46:	[0s / 6s],		train_loss: 4.2957
42:	[0s / 14s],		train_loss: 4.2605
8:	[0s / 1s],		train_loss: 4.4234
47:	[0s / 6s],		train_loss: 4.2788
64:	[0s / 12s],		train_loss: 4.1344
9:	[0s / 1s],		train_loss: 4.4070
48:	[0s / 6s],		train_loss: 4.2915
43:	[0s / 14s],		train_loss: 4.2883
65:	[0s / 12s],		train_loss: 4.1231
83:	[0s / 58s],		train_loss: 4.2399
10:	[0s / 1s],		train_loss: 4.4091
49:	[0s / 6s],		train_loss: 4.2599
11:	[0s / 1s],		train_loss: 4.3902
66:	[0s / 12s],		train_loss: 4.1187
50:	[0s / 7s],		train_loss: 4.2417
44:	[0s / 15s],		train_loss: 4.2624
12:	[0s / 1s],		train_loss: 4.3588
51:	[0s / 7s],		train_loss: 4.2625
67:	[0s / 12s],		train_loss: 4.1016
13:	[0s / 2s],		train_loss: 4.3747
57:	[1s / 1m:24s],		train_loss: 3.9700
52:	[0s / 7s],		train_loss: 4.2471
84:	[0s / 58s],		train_loss: 4.2165
68:	[0s / 12s],		train_loss: 4.1204
14:	[0s / 2s],		train_loss: 4.3744
53:	[0s / 7s],		train_loss: 4.2298
45:	[0s / 15s],		train_loss: 4.2613
69:	[0s / 13s],		train_loss: 4.1130
15:	[0s / 2s],		train_loss: 4.3577
54:	[0s / 7s],		train_loss: 4.2522
16:	[0s / 2s],		train_loss: 4.3461
55:	[0s / 7s],		train_loss: 4.2497
70:	[0s / 13s],		train_loss: 4.1037
43:	[2s / 1m:52s],		train_loss: 4.3150
46:	[0s / 16s],		train_loss: 4.2529
17:	[0s / 2s],		train_loss: 4.3470
56:	[0s / 7s],		train_loss: 4.2248
71:	[0s / 13s],		train_loss: 4.0979
57:	[0s / 8s],		train_loss: 4.2430
18:	[0s / 2s],		train_loss: 4.2998
85:	[0s / 59s],		train_loss: 4.2349
47:	[0s / 16s],		train_loss: 4.2610
72:	[0s / 13s],		train_loss: 4.0802
58:	[0s / 8s],		train_loss: 4.2594
19:	[0s / 2s],		train_loss: 4.3356
59:	[0s / 8s],		train_loss: 4.2336
73:	[0s / 13s],		train_loss: 4.0739
20:	[0s / 3s],		train_loss: 4.3280
60:	[0s / 8s],		train_loss: 4.2153
48:	[0s / 16s],		train_loss: 4.2562
21:	[0s / 3s],		train_loss: 4.3234
74:	[0s / 13s],		train_loss: 4.0836
61:	[0s / 8s],		train_loss: 4.2173
22:	[0s / 3s],		train_loss: 4.3106
75:	[0s / 14s],		train_loss: 4.0729
62:	[0s / 8s],		train_loss: 4.2030
58:	[1s / 1m:25s],		train_loss: 3.9456
23:	[0s / 3s],		train_loss: 4.3037
49:	[0s / 17s],		train_loss: 4.2550
86:	[0s / 1m:0s],		train_loss: 4.2320
63:	[0s / 8s],		train_loss: 4.2219
76:	[0s / 14s],		train_loss: 4.0676
24:	[0s / 3s],		train_loss: 4.2906
64:	[0s / 9s],		train_loss: 4.2147
77:	[0s / 14s],		train_loss: 4.0598
25:	[0s / 3s],		train_loss: 4.2969
50:	[0s / 17s],		train_loss: 4.2543
65:	[0s / 9s],		train_loss: 4.2104
26:	[0s / 3s],		train_loss: 4.2627
78:	[0s / 14s],		train_loss: 4.0950
66:	[0s / 9s],		train_loss: 4.2156
27:	[0s / 4s],		train_loss: 4.2734
67:	[0s / 9s],		train_loss: 4.2079
79:	[0s / 14s],		train_loss: 4.0715
51:	[0s / 17s],		train_loss: 4.2369
87:	[0s / 1m:0s],		train_loss: 4.2342
28:	[0s / 4s],		train_loss: 4.2825
68:	[0s / 9s],		train_loss: 4.2280
80:	[0s / 15s],		train_loss: 4.0670
29:	[0s / 4s],		train_loss: 4.2616
69:	[0s / 9s],		train_loss: 4.2070
52:	[0s / 18s],		train_loss: 4.2465
81:	[0s / 15s],		train_loss: 4.0707
30:	[0s / 4s],		train_loss: 4.2834
70:	[0s / 9s],		train_loss: 4.1970
31:	[0s / 4s],		train_loss: 4.2937
71:	[0s / 10s],		train_loss: 4.1929
59:	[1s / 1m:26s],		train_loss: 3.9511
82:	[0s / 15s],		train_loss: 4.0651
53:	[0s / 18s],		train_loss: 4.2325
72:	[0s / 10s],		train_loss: 4.1987
32:	[0s / 4s],		train_loss: 4.2517
88:	[0s / 1m:1s],		train_loss: 4.2335
83:	[0s / 15s],		train_loss: 4.0581
73:	[0s / 10s],		train_loss: 4.2077
81:	[3s / 5m:19s],		train_loss: 4.1126
33:	[0s / 5s],		train_loss: 4.2432
84:	[0s / 15s],		train_loss: 4.0466
54:	[0s / 18s],		train_loss: 4.2149
74:	[0s / 10s],		train_loss: 4.1972
34:	[0s / 5s],		train_loss: 4.2447
85:	[0s / 15s],		train_loss: 4.0238
75:	[0s / 10s],		train_loss: 4.2363
35:	[0s / 5s],		train_loss: 4.2423
44:	[2s / 1m:55s],		train_loss: 4.3200
76:	[0s / 10s],		train_loss: 4.1901
36:	[0s / 5s],		train_loss: 4.2401
55:	[0s / 18s],		train_loss: 4.2266
86:	[0s / 16s],		train_loss: 4.0405
77:	[0s / 10s],		train_loss: 4.1915
89:	[0s / 1m:2s],		train_loss: 4.2257
37:	[0s / 5s],		train_loss: 4.2565
87:	[0s / 16s],		train_loss: 4.0755
78:	[0s / 11s],		train_loss: 4.1864
38:	[0s / 5s],		train_loss: 4.2298
56:	[0s / 19s],		train_loss: 4.2320
88:	[0s / 16s],		train_loss: 4.0494
79:	[0s / 11s],		train_loss: 4.1645
39:	[0s / 5s],		train_loss: 4.2279
80:	[0s / 11s],		train_loss: 4.1599
89:	[0s / 16s],		train_loss: 4.0543
40:	[0s / 6s],		train_loss: 4.2079
57:	[0s / 19s],		train_loss: 4.2417
81:	[0s / 11s],		train_loss: 4.1858
60:	[1s / 1m:28s],		train_loss: 3.9494
41:	[0s / 6s],		train_loss: 4.2116
90:	[0s / 16s],		train_loss: 4.0661
90:	[0s / 1m:2s],		train_loss: 4.2452
82:	[0s / 11s],		train_loss: 4.1519
42:	[0s / 6s],		train_loss: 4.1952
91:	[0s / 17s],		train_loss: 4.0183
83:	[0s / 11s],		train_loss: 4.1693
58:	[0s / 19s],		train_loss: 4.2196
43:	[0s / 6s],		train_loss: 4.2012
84:	[0s / 11s],		train_loss: 4.1576
92:	[0s / 17s],		train_loss: 4.0189
44:	[0s / 6s],		train_loss: 4.1911
85:	[0s / 11s],		train_loss: 4.1316
59:	[0s / 20s],		train_loss: 4.2361
93:	[0s / 17s],		train_loss: 4.0129
45:	[0s / 6s],		train_loss: 4.1883
86:	[0s / 12s],		train_loss: 4.1580
91:	[0s / 1m:3s],		train_loss: 4.2585
46:	[0s / 6s],		train_loss: 4.2026
94:	[0s / 17s],		train_loss: 4.0084
87:	[0s / 12s],		train_loss: 4.1467
60:	[0s / 20s],		train_loss: 4.2386
47:	[0s / 7s],		train_loss: 4.1773
88:	[0s / 12s],		train_loss: 4.1511
95:	[0s / 17s],		train_loss: 4.0178
48:	[0s / 7s],		train_loss: 4.1740
89:	[0s / 12s],		train_loss: 4.1457
61:	[1s / 1m:29s],		train_loss: 3.9441
96:	[0s / 18s],		train_loss: 3.9983
49:	[0s / 7s],		train_loss: 4.1873
61:	[0s / 20s],		train_loss: 4.1797
90:	[0s / 12s],		train_loss: 4.1356
92:	[0s / 1m:4s],		train_loss: 4.2178
50:	[0s / 7s],		train_loss: 4.1529
91:	[0s / 12s],		train_loss: 4.1499
97:	[0s / 18s],		train_loss: 4.0079
92:	[0s / 13s],		train_loss: 4.1345
51:	[0s / 7s],		train_loss: 4.1636
62:	[0s / 21s],		train_loss: 4.1921
98:	[0s / 18s],		train_loss: 3.9988
93:	[0s / 13s],		train_loss: 4.1141
45:	[2s / 1m:57s],		train_loss: 4.3078
52:	[0s / 7s],		train_loss: 4.1839
99:	[0s / 18s],		train_loss: 4.0050
94:	[0s / 13s],		train_loss: 4.1382
53:	[0s / 8s],		train_loss: 4.1759
63:	[0s / 21s],		train_loss: 4.2188
93:	[0s / 1m:4s],		train_loss: 4.2399
95:	[0s / 13s],		train_loss: 4.1228
54:	[0s / 8s],		train_loss: 4.1659
0:	[0s / 0s],		train_loss: 5.4068
96:	[0s / 13s],		train_loss: 4.1558
55:	[0s / 8s],		train_loss: 4.1538
64:	[0s / 21s],		train_loss: 4.1920
97:	[0s / 13s],		train_loss: 4.1117
56:	[0s / 8s],		train_loss: 4.1639
1:	[0s / 0s],		train_loss: 4.7296
62:	[1s / 1m:30s],		train_loss: 3.9345
98:	[0s / 13s],		train_loss: 4.1236
57:	[0s / 8s],		train_loss: 4.1466
2:	[0s / 0s],		train_loss: 4.5847
99:	[0s / 14s],		train_loss: 4.1116
94:	[0s / 1m:5s],		train_loss: 4.2008
65:	[0s / 22s],		train_loss: 4.1813
58:	[0s / 8s],		train_loss: 4.1469
3:	[0s / 0s],		train_loss: 4.5482
59:	[0s / 9s],		train_loss: 4.1361
0:	[0s / 0s],		train_loss: 4.8337
4:	[0s / 0s],		train_loss: 4.5134
60:	[0s / 9s],		train_loss: 4.1415
66:	[0s / 22s],		train_loss: 4.1794
82:	[4s / 5m:24s],		train_loss: 4.1122
1:	[0s / 0s],		train_loss: 4.6306
5:	[0s / 1s],		train_loss: 4.4959
61:	[0s / 9s],		train_loss: 4.1235
2:	[0s / 0s],		train_loss: 4.5596
62:	[0s / 9s],		train_loss: 4.1111
6:	[0s / 1s],		train_loss: 4.4688
95:	[0s / 1m:6s],		train_loss: 4.2285
3:	[0s / 0s],		train_loss: 4.5314
67:	[0s / 23s],		train_loss: 4.1887
63:	[0s / 9s],		train_loss: 4.1172
7:	[0s / 1s],		train_loss: 4.4423
4:	[0s / 0s],		train_loss: 4.5011
64:	[0s / 9s],		train_loss: 4.1121
5:	[0s / 0s],		train_loss: 4.4667
8:	[0s / 1s],		train_loss: 4.4567
68:	[0s / 23s],		train_loss: 4.1951
63:	[1s / 1m:32s],		train_loss: 3.9518
65:	[0s / 10s],		train_loss: 4.1101
6:	[0s / 1s],		train_loss: 4.4419
9:	[0s / 1s],		train_loss: 4.4300
66:	[0s / 10s],		train_loss: 4.0976
7:	[0s / 1s],		train_loss: 4.4207
96:	[0s / 1m:6s],		train_loss: 4.2321
69:	[0s / 23s],		train_loss: 4.1873
10:	[0s / 2s],		train_loss: 4.4114
67:	[0s / 10s],		train_loss: 4.0867
8:	[0s / 1s],		train_loss: 4.4044
68:	[0s / 10s],		train_loss: 4.1034
9:	[0s / 1s],		train_loss: 4.3677
11:	[0s / 2s],		train_loss: 4.3705
70:	[0s / 24s],		train_loss: 4.2015
69:	[0s / 10s],		train_loss: 4.0612
10:	[0s / 1s],		train_loss: 4.3789
12:	[0s / 2s],		train_loss: 4.3861
11:	[0s / 1s],		train_loss: 4.3707
70:	[0s / 10s],		train_loss: 4.0761
13:	[0s / 2s],		train_loss: 4.4272
97:	[0s / 1m:7s],		train_loss: 4.2210
12:	[0s / 1s],		train_loss: 4.3631
71:	[0s / 10s],		train_loss: 4.0996
46:	[3s / 2m:0s],		train_loss: 4.2921
71:	[0s / 24s],		train_loss: 4.1566
13:	[0s / 2s],		train_loss: 4.3461
14:	[0s / 2s],		train_loss: 4.4209
72:	[0s / 11s],		train_loss: 4.0800
14:	[0s / 2s],		train_loss: 4.3461
73:	[0s / 11s],		train_loss: 4.0654
15:	[0s / 3s],		train_loss: 4.3957
72:	[0s / 24s],		train_loss: 4.1805
15:	[0s / 2s],		train_loss: 4.3399
74:	[0s / 11s],		train_loss: 4.0914
16:	[0s / 3s],		train_loss: 4.3654
98:	[0s / 1m:7s],		train_loss: 4.1917
16:	[0s / 2s],		train_loss: 4.3253
75:	[0s / 11s],		train_loss: 4.0692
73:	[0s / 24s],		train_loss: 4.1750
17:	[0s / 2s],		train_loss: 4.3467
17:	[0s / 3s],		train_loss: 4.3562
64:	[1s / 1m:33s],		train_loss: 3.9502
76:	[0s / 11s],		train_loss: 4.0625
18:	[0s / 2s],		train_loss: 4.3482
77:	[0s / 11s],		train_loss: 4.0502
18:	[0s / 3s],		train_loss: 4.3795
74:	[0s / 25s],		train_loss: 4.1761
19:	[0s / 2s],		train_loss: 4.3062
78:	[0s / 11s],		train_loss: 4.0486
19:	[0s / 3s],		train_loss: 4.3400
20:	[0s / 3s],		train_loss: 4.3251
79:	[0s / 12s],		train_loss: 4.0351
99:	[0s / 1m:8s],		train_loss: 4.2317
21:	[0s / 3s],		train_loss: 4.2874
80:	[0s / 12s],		train_loss: 4.0421
20:	[0s / 4s],		train_loss: 4.3236
22:	[0s / 3s],		train_loss: 4.2949
75:	[0s / 25s],		train_loss: 4.1724
23:	[0s / 3s],		train_loss: 4.2979
81:	[0s / 12s],		train_loss: 4.0129
21:	[0s / 4s],		train_loss: 4.3379
24:	[0s / 3s],		train_loss: 4.2806
82:	[0s / 12s],		train_loss: 4.0283
76:	[0s / 26s],		train_loss: 4.1602
22:	[0s / 4s],		train_loss: 4.3330
25:	[0s / 3s],		train_loss: 4.2742
83:	[0s / 12s],		train_loss: 4.0378
0:	[0s / 0s],		train_loss: 5.1357
26:	[0s / 3s],		train_loss: 4.2894
84:	[0s / 12s],		train_loss: 4.0412
23:	[0s / 4s],		train_loss: 4.3236
77:	[0s / 26s],		train_loss: 4.1708
27:	[0s / 4s],		train_loss: 4.2799
85:	[0s / 13s],		train_loss: 4.0199
24:	[0s / 4s],		train_loss: 4.2984
65:	[1s / 1m:35s],		train_loss: 3.9275
28:	[0s / 4s],		train_loss: 4.2672
86:	[0s / 13s],		train_loss: 4.0220
29:	[0s / 4s],		train_loss: 4.2645
25:	[0s / 5s],		train_loss: 4.3044
78:	[0s / 26s],		train_loss: 4.1875
87:	[0s / 13s],		train_loss: 4.0058
30:	[0s / 4s],		train_loss: 4.2778
1:	[0s / 1s],		train_loss: 4.5910
88:	[0s / 13s],		train_loss: 4.0069
26:	[0s / 5s],		train_loss: 4.2793
31:	[0s / 4s],		train_loss: 4.2650
89:	[0s / 13s],		train_loss: 4.0067
79:	[0s / 27s],		train_loss: 4.1704
27:	[0s / 5s],		train_loss: 4.2928
32:	[0s / 4s],		train_loss: 4.2655
90:	[0s / 13s],		train_loss: 4.0316
33:	[0s / 4s],		train_loss: 4.2720
28:	[0s / 5s],		train_loss: 4.3077
91:	[0s / 13s],		train_loss: 3.9934
34:	[0s / 4s],		train_loss: 4.2475
80:	[0s / 27s],		train_loss: 4.1584
47:	[2s / 2m:3s],		train_loss: 4.3061
92:	[0s / 13s],		train_loss: 4.0052
2:	[0s / 1s],		train_loss: 4.5400
29:	[0s / 5s],		train_loss: 4.2919
35:	[0s / 5s],		train_loss: 4.2665
93:	[0s / 14s],		train_loss: 3.9918
36:	[0s / 5s],		train_loss: 4.2692
30:	[0s / 5s],		train_loss: 4.2741
94:	[0s / 14s],		train_loss: 3.9933
81:	[0s / 27s],		train_loss: 4.1805
37:	[0s / 5s],		train_loss: 4.2326
31:	[0s / 6s],		train_loss: 4.2803
95:	[0s / 14s],		train_loss: 3.9856
38:	[0s / 5s],		train_loss: 4.2440
83:	[5s / 5m:29s],		train_loss: 4.0878
96:	[0s / 14s],		train_loss: 3.9779
32:	[0s / 6s],		train_loss: 4.2709
66:	[1s / 1m:36s],		train_loss: 3.9238
39:	[0s / 5s],		train_loss: 4.2253
82:	[0s / 28s],		train_loss: 4.1311
97:	[0s / 14s],		train_loss: 4.0207
40:	[0s / 5s],		train_loss: 4.2348
33:	[0s / 6s],		train_loss: 4.2776
3:	[0s / 2s],		train_loss: 4.4757
98:	[0s / 14s],		train_loss: 3.9837
41:	[0s / 5s],		train_loss: 4.2139
34:	[0s / 6s],		train_loss: 4.2582
83:	[0s / 28s],		train_loss: 4.1521
42:	[0s / 5s],		train_loss: 4.2284
99:	[0s / 14s],		train_loss: 3.9538
35:	[0s / 6s],		train_loss: 4.2497
43:	[0s / 6s],		train_loss: 4.2118
44:	[0s / 6s],		train_loss: 4.2057
84:	[0s / 28s],		train_loss: 4.2108
0:	[0s / 0s],		train_loss: 5.0613
36:	[0s / 7s],		train_loss: 4.2425
45:	[0s / 6s],		train_loss: 4.2047
4:	[0s / 3s],		train_loss: 4.4888
1:	[0s / 0s],		train_loss: 4.6232
37:	[0s / 7s],		train_loss: 4.2452
46:	[0s / 6s],		train_loss: 4.2225
2:	[0s / 0s],		train_loss: 4.5748
85:	[0s / 29s],		train_loss: 4.1538
38:	[0s / 7s],		train_loss: 4.2652
47:	[0s / 6s],		train_loss: 4.2031
3:	[0s / 0s],		train_loss: 4.5293
39:	[0s / 7s],		train_loss: 4.2498
48:	[0s / 6s],		train_loss: 4.2162
4:	[0s / 0s],		train_loss: 4.5055
67:	[1s / 1m:38s],		train_loss: 3.9609
86:	[0s / 29s],		train_loss: 4.1411
49:	[0s / 6s],		train_loss: 4.2063
5:	[0s / 0s],		train_loss: 4.4877
40:	[0s / 7s],		train_loss: 4.2363
5:	[0s / 3s],		train_loss: 4.4760
50:	[0s / 7s],		train_loss: 4.1805
6:	[0s / 0s],		train_loss: 4.4453
41:	[0s / 7s],		train_loss: 4.2424
51:	[0s / 7s],		train_loss: 4.1842
7:	[0s / 1s],		train_loss: 4.4433
87:	[0s / 29s],		train_loss: 4.1469
42:	[0s / 8s],		train_loss: 4.2390
52:	[0s / 7s],		train_loss: 4.1747
8:	[0s / 1s],		train_loss: 4.4076
53:	[0s / 7s],		train_loss: 4.1622
43:	[0s / 8s],		train_loss: 4.2297
9:	[0s / 1s],		train_loss: 4.4149
48:	[2s / 2m:6s],		train_loss: 4.2633
6:	[0s / 4s],		train_loss: 4.4