[I 2026-06-07 15:08:44,729] Trial 74 finished with value: 0.7810068144313489 and parameters: {'n_estimators': 250, 'max_depth': 9, 'min_samples_split': 8, 'min_samples_leaf': 15, 'max_features': 'log2'}. Best is trial 69 with value: 0.7810068144313489.
[I 2026-06-07 15:10:05,228] Trial 75 finished with value: 0.7810068144313489 and parameters: {'n_estimators': 250, 'max_depth': 9, 'min_samples_split': 8, 'min_samples_leaf': 15, 'max_features': 'log2'}. Best is trial 69 with value: 0.7810068144313489.
[I 2026-06-07 15:15:43,855] Trial 76 finished with value: 0.77651115355297 and parameters: {'n_estimators': 250, 'max_depth': 8, 'min_samples_split': 8, 'min_samples_leaf': 15, 'max_features': 'log2'}. Best is trial 69 with value: 0.7810068144313489.
[I 2026-06-07 15:18:29,121] Trial 77 finished with value: 0.77651115355297 and parameters: {'n_estimators': 250, 'max_depth': 8, 'min_samples_split': 8, 'min_samples_leaf': 15, 'max_features': 'log2'}. Best is trial 69 with value: 0.7810068144313489.
[I 2026-06-07 15:28:27,160] Trial 78 finished with value: 0.7762666591276522 and parameters: {'n_estimators': 250, 'max_depth': 8, 'min_samples_split': 8, 'min_samples_leaf': 13, 'max_features': 'log2'}. Best is trial 69 with value: 0.7810068144313489.
[I 2026-06-07 15:29:51,510] Trial 79 finished with value: 0.7762666591276522 and parameters: {'n_estimators': 250, 'max_depth': 8, 'min_samples_split': 8, 'min_samples_leaf': 13, 'max_features': 'log2'}. Best is trial 69 with value: 0.7810068144313489.
[I 2026-06-07 15:31:44,612] Trial 80 finished with value: 0.7732437237705124 and parameters: {'n_estimators': 200, 'max_depth': 8, 'min_samples_split': 8, 'min_samples_leaf': 13, 'max_features': 'log2'}. Best is trial 69 with value: 0.7810068144313489.
[I 2026-06-07 15:34:43,677] Trial 81 finished with value: 0.767828198426859 and parameters: {'n_estimators': 200, 'max_depth': 9, 'min_samples_split': 8, 'min_samples_leaf': 13, 'max_features': 'log2'}. Best is trial 69 with value: 0.7810068144313489.
[I 2026-06-07 15:44:32,757] Trial 82 finished with value: 0.767828198426859 and parameters: {'n_estimators': 200, 'max_depth': 9, 'min_samples_split': 6, 'min_samples_leaf': 13, 'max_features': 'log2'}. Best is trial 69 with value: 0.7810068144313489.
[I 2026-06-07 15:46:23,056] Trial 83 finished with value: 0.7766242387689627 and parameters: {'n_estimators': 200, 'max_depth': 9, 'min_samples_split': 6, 'min_samples_leaf': 10, 'max_features': 'log2'}. Best is trial 69 with value: 0.7810068144313489.
[I 2026-06-07 15:47:53,035] Trial 84 finished with value: 0.7806665116980374 and parameters: {'n_estimators': 200, 'max_depth': 9, 'min_samples_split': 9, 'min_samples_leaf': 15, 'max_features': 'log2'}. Best is trial 69 with value: 0.7810068144313489.
[I 2026-06-07 15:55:17,365] Trial 85 finished with value: 0.7810068144313489 and parameters: {'n_estimators': 250, 'max_depth': 9, 'min_samples_split': 10, 'min_samples_leaf': 15, 'max_features': 'log2'}. Best is trial 69 with value: 0.7810068144313489.
[I 2026-06-07 16:04:45,040] Trial 86 finished with value: 0.7810068144313489 and parameters: {'n_estimators': 250, 'max_depth': 9, 'min_samples_split': 9, 'min_samples_leaf': 15, 'max_features': 'log2'}. Best is trial 69 with value: 0.7810068144313489.
[I 2026-06-07 16:06:28,945] Trial 87 finished with value: 0.7810068144313489 and parameters: {'n_estimators': 250, 'max_depth': 9, 'min_samples_split': 9, 'min_samples_leaf': 15, 'max_features': 'log2'}. Best is trial 69 with value: 0.7810068144313489.
[I 2026-06-07 16:09:00,926] Trial 88 finished with value: 0.7736547047638195 and parameters: {'n_estimators': 250, 'max_depth': 10, 'min_samples_split': 9, 'min_samples_leaf': 15, 'max_features': 'log2'}. Best is trial 69 with value: 0.7810068144313489.
[I 2026-06-07 16:16:26,549] Trial 89 finished with value: 0.7736547047638195 and parameters: {'n_estimators': 250, 'max_depth': 10, 'min_samples_split': 9, 'min_samples_leaf': 15, 'max_features': 'log2'}. Best is trial 69 with value: 0.7810068144313489.
[I 2026-06-07 16:25:24,646] Trial 90 finished with value: 0.7723207180492382 and parameters: {'n_estimators': 250, 'max_depth': 10, 'min_samples_split': 9, 'min_samples_leaf': 14, 'max_features': 'log2'}. Best is trial 69 with value: 0.7810068144313489.
[I 2026-06-07 16:27:00,517] Trial 91 finished with value: 0.7723207180492382 and parameters: {'n_estimators': 250, 'max_depth': 10, 'min_samples_split': 10, 'min_samples_leaf': 14, 'max_features': 'log2'}. Best is trial 69 with value: 0.7810068144313489.
[I 2026-06-07 16:29:32,623] Trial 92 finished with value: 0.7723207180492382 and parameters: {'n_estimators': 250, 'max_depth': 10, 'min_samples_split': 10, 'min_samples_leaf': 14, 'max_features': 'log2'}. Best is trial 69 with value: 0.7810068144313489.
[I 2026-06-07 16:37:07,608] Trial 93 finished with value: 0.7754708742743699 and parameters: {'n_estimators': 250, 'max_depth': 9, 'min_samples_split': 10, 'min_samples_leaf': 14, 'max_features': 'log2'}. Best is trial 69 with value: 0.7810068144313489.
[I 2026-06-07 16:45:58,451] Trial 94 finished with value: 0.7754708742743699 and parameters: {'n_estimators': 250, 'max_depth': 9, 'min_samples_split': 10, 'min_samples_leaf': 14, 'max_features': 'log2'}. Best is trial 69 with value: 0.7810068144313489.
[I 2026-06-07 16:47:14,405] Trial 95 finished with value: 0.7810068144313489 and parameters: {'n_estimators': 250, 'max_depth': 9, 'min_samples_split': 10, 'min_samples_leaf': 15, 'max_features': 'log2'}. Best is trial 69 with value: 0.7810068144313489.
[I 2026-06-07 16:49:53,111] Trial 96 finished with value: 0.7810068144313489 and parameters: {'n_estimators': 250, 'max_depth': 9, 'min_samples_split': 10, 'min_samples_leaf': 15, 'max_features': 'log2'}. Best is trial 69 with value: 0.7810068144313489.
[I 2026-06-07 16:55:39,491] Trial 97 finished with value: 0.7810068144313489 and parameters: {'n_estimators': 250, 'max_depth': 9, 'min_samples_split': 10, 'min_samples_leaf': 15, 'max_features': 'log2'}. Best is trial 69 with value: 0.7810068144313489.
[I 2026-06-07 16:59:52,324] Trial 98 finished with value: 0.7810068144313489 and parameters: {'n_estimators': 250, 'max_depth': 9, 'min_samples_split': 6, 'min_samples_leaf': 15, 'max_features': 'log2'}. Best is trial 69 with value: 0.7810068144313489.
