[I 2026-07-01 09:58:30,413] Trial 81 finished with value: 0.775704733762984 and parameters: {'n_estimators': 200, 'max_depth': 10, 'min_samples_split': 15, 'min_samples_leaf': 15, 'max_features': 'sqrt'}. Best is trial 9 with value: 0.7774726802413765.
[I 2026-07-01 09:58:31,041] Trial 80 finished with value: 0.775704733762984 and parameters: {'n_estimators': 200, 'max_depth': 10, 'min_samples_split': 15, 'min_samples_leaf': 15, 'max_features': 'sqrt'}. Best is trial 9 with value: 0.7774726802413765.
[I 2026-07-01 09:58:31,136] Trial 83 finished with value: 0.775704733762984 and parameters: {'n_estimators': 200, 'max_depth': 10, 'min_samples_split': 16, 'min_samples_leaf': 15, 'max_features': 'sqrt'}. Best is trial 9 with value: 0.7774726802413765.
[I 2026-07-01 09:58:31,280] Trial 79 finished with value: 0.775704733762984 and parameters: {'n_estimators': 200, 'max_depth': 10, 'min_samples_split': 11, 'min_samples_leaf': 15, 'max_features': 'sqrt'}. Best is trial 9 with value: 0.7774726802413765.
[I 2026-07-01 09:58:31,289] Trial 78 finished with value: 0.775704733762984 and parameters: {'n_estimators': 200, 'max_depth': 10, 'min_samples_split': 16, 'min_samples_leaf': 15, 'max_features': 'sqrt'}. Best is trial 9 with value: 0.7774726802413765.
[I 2026-07-01 09:58:31,754] Trial 82 finished with value: 0.775704733762984 and parameters: {'n_estimators': 200, 'max_depth': 10, 'min_samples_split': 11, 'min_samples_leaf': 15, 'max_features': 'sqrt'}. Best is trial 9 with value: 0.7774726802413765.
[I 2026-07-01 09:58:32,978] Trial 76 finished with value: 0.7752809635116557 and parameters: {'n_estimators': 250, 'max_depth': 10, 'min_samples_split': 15, 'min_samples_leaf': 15, 'max_features': 'sqrt'}. Best is trial 9 with value: 0.7774726802413765.
[I 2026-07-01 09:58:33,161] Trial 77 finished with value: 0.7770450749651492 and parameters: {'n_estimators': 250, 'max_depth': 10, 'min_samples_split': 15, 'min_samples_leaf': 14, 'max_features': 'sqrt'}. Best is trial 9 with value: 0.7774726802413765.
[I 2026-07-01 10:40:39,553] Trial 84 finished with value: 0.7755705078915225 and parameters: {'n_estimators': 300, 'max_depth': 10, 'min_samples_split': 11, 'min_samples_leaf': 15, 'max_features': 'sqrt'}. Best is trial 9 with value: 0.7774726802413765.
[I 2026-07-01 10:48:18,734] Trial 85 finished with value: 0.7755705078915225 and parameters: {'n_estimators': 300, 'max_depth': 10, 'min_samples_split': 11, 'min_samples_leaf': 15, 'max_features': 'sqrt'}. Best is trial 9 with value: 0.7774726802413765.
[I 2026-07-01 10:48:50,385] Trial 88 finished with value: 0.7771543731747679 and parameters: {'n_estimators': 300, 'max_depth': 10, 'min_samples_split': 13, 'min_samples_leaf': 14, 'max_features': 'sqrt'}. Best is trial 9 with value: 0.7774726802413765.
[I 2026-07-01 10:48:50,449] Trial 90 finished with value: 0.7771543731747679 and parameters: {'n_estimators': 300, 'max_depth': 10, 'min_samples_split': 13, 'min_samples_leaf': 14, 'max_features': 'sqrt'}. Best is trial 9 with value: 0.7774726802413765.
[I 2026-07-01 10:48:53,006] Trial 89 finished with value: 0.7771543731747679 and parameters: {'n_estimators': 300, 'max_depth': 10, 'min_samples_split': 13, 'min_samples_leaf': 14, 'max_features': 'sqrt'}. Best is trial 9 with value: 0.7774726802413765.
[I 2026-07-01 10:48:57,306] Trial 87 finished with value: 0.7771543731747679 and parameters: {'n_estimators': 300, 'max_depth': 10, 'min_samples_split': 13, 'min_samples_leaf': 14, 'max_features': 'sqrt'}. Best is trial 9 with value: 0.7774726802413765.
[I 2026-07-01 10:49:00,169] Trial 91 finished with value: 0.7717661631918146 and parameters: {'n_estimators': 300, 'max_depth': 10, 'min_samples_split': 13, 'min_samples_leaf': 3, 'max_features': 'sqrt'}. Best is trial 9 with value: 0.7774726802413765.
[I 2026-07-01 10:49:00,437] Trial 86 finished with value: 0.7751313975405986 and parameters: {'n_estimators': 300, 'max_depth': 10, 'min_samples_split': 11, 'min_samples_leaf': 5, 'max_features': 'sqrt'}. Best is trial 9 with value: 0.7774726802413765.
[I 2026-07-01 11:06:23,361] Trial 92 finished with value: 0.7741419611166825 and parameters: {'n_estimators': 300, 'max_depth': 10, 'min_samples_split': 13, 'min_samples_leaf': 5, 'max_features': 'sqrt'}. Best is trial 9 with value: 0.7774726802413765.
[I 2026-07-01 11:22:40,321] Trial 94 finished with value: 0.7727057442920449 and parameters: {'n_estimators': 300, 'max_depth': 5, 'min_samples_split': 13, 'min_samples_leaf': 13, 'max_features': 'sqrt'}. Best is trial 9 with value: 0.7774726802413765.
[I 2026-07-01 11:23:32,347] Trial 96 finished with value: 0.7727057442920449 and parameters: {'n_estimators': 300, 'max_depth': 5, 'min_samples_split': 8, 'min_samples_leaf': 13, 'max_features': 'sqrt'}. Best is trial 9 with value: 0.7774726802413765.
[I 2026-07-01 11:23:33,880] Trial 99 finished with value: 0.7727057442920449 and parameters: {'n_estimators': 300, 'max_depth': 5, 'min_samples_split': 14, 'min_samples_leaf': 13, 'max_features': 'sqrt'}. Best is trial 9 with value: 0.7774726802413765.
[I 2026-07-01 11:23:42,718] Trial 97 finished with value: 0.7709799830875402 and parameters: {'n_estimators': 300, 'max_depth': 5, 'min_samples_split': 18, 'min_samples_leaf': 5, 'max_features': 'sqrt'}. Best is trial 9 with value: 0.7774726802413765.
[I 2026-07-01 11:23:46,197] Trial 93 finished with value: 0.7772943515835776 and parameters: {'n_estimators': 300, 'max_depth': 10, 'min_samples_split': 8, 'min_samples_leaf': 13, 'max_features': 'sqrt'}. Best is trial 9 with value: 0.7774726802413765.
[I 2026-07-01 11:23:46,217] Trial 98 finished with value: 0.7772943515835776 and parameters: {'n_estimators': 300, 'max_depth': 10, 'min_samples_split': 14, 'min_samples_leaf': 13, 'max_features': 'sqrt'}. Best is trial 9 with value: 0.7774726802413765.
[I 2026-07-01 11:23:46,227] Trial 95 finished with value: 0.7772943515835776 and parameters: {'n_estimators': 300, 'max_depth': 10, 'min_samples_split': 13, 'min_samples_leaf': 13, 'max_features': 'sqrt'}. Best is trial 9 with value: 0.7774726802413765.
ENV CHECKPOINT PATH: 
DEFAULT PATH: /scratch.hpc/luca.cotugno/Foundation_model_clinical_data/src/models_diff/tabdpt1_1.pth
ENV CHECKPOINT PATH: 
DEFAULT PATH: /scratch.hpc/luca.cotugno/Foundation_model_clinical_data/src/models_diff/tabdpt1_1.pth
[I 2026-07-01 11:28:58,040] A new study created in memory with name: deepsurv_tuning_tabdpt_1_NaN_seed123
/scratch.hpc/luca.cotugno/Foundation_model_clinical_data/test_tabular_model.py:481: UserWarning: Choices for a categorical distribution should be a tuple of None, bool, int, float and str for persistent storage but contains [32] which is of type list.
  num_nodes  = trial.suggest_categorical("num_nodes", [[32], [64], [128], [64, 32], [128, 64]])
/scratch.hpc/luca.cotugno/Foundation_model_clinical_data/test_tabular_model.py:481: UserWarning: Choices for a categorical distribution should be a tuple of None, bool, int, float and str for persistent storage but contains [64] which is of type list.
  num_nodes  = trial.suggest_categorical("num_nodes", [[32], [64], [128], [64, 32], [128, 64]])
/scratch.hpc/luca.cotugno/Foundation_model_clinical_data/test_tabular_model.py:481: UserWarning: Choices for a categorical distribution should be a tuple of None, bool, int, float and str for persistent storage but contains [128] which is of type list.
  num_nodes  = trial.suggest_categorical("num_nodes", [[32], [64], [128], [64, 32], [128, 64]])
/scratch.hpc/luca.cotugno/Foundation_model_clinical_data/test_tabular_model.py:481: UserWarning: Choices for a categorical distribution should be a tuple of None, bool, int, float and str for persistent storage but contains [64, 32] which is of type list.
  num_nodes  = trial.suggest_categorical("num_nodes", [[32], [64], [128], [64, 32], [128, 64]])
/scratch.hpc/luca.cotugno/Foundation_model_clinical_data/test_tabular_model.py:481: UserWarning: Choices for a categorical distribution should be a tuple of None, bool, int, float and str for persistent storage but contains [128, 64] which is of type list.
  num_nodes  = trial.suggest_categorical("num_nodes", [[32], [64], [128], [64, 32], [128, 64]])
[I 2026-07-01 11:29:17,726] Trial 6 finished with value: 0.7486256785352838 and parameters: {'num_nodes': [64, 32], 'dropout': 0.17563557021758888, 'learning_rate': 0.0019059325320337228, 'batch_norm': False}. Best is trial 6 with value: 0.7486256785352838.
/scratch.hpc/luca.cotugno/Foundation_model_clinical_data/test_tabular_model.py:481: UserWarning: Choices for a categorical distribution should be a tuple of None, bool, int, float and str for persistent storage but contains [32] which is of type list.
  num_nodes  = trial.suggest_categorical("num_nodes", [[32], [64], [128], [64, 32], [128, 64]])
/scratch.hpc/luca.cotugno/Foundation_model_clinical_data/test_tabular_model.py:481: UserWarning: Choices for a categorical distribution should be a tuple of None, bool, int, float and str for persistent storage but contains [64] which is of type list.
  num_nodes  = trial.suggest_categorical("num_nodes", [[32], [64], [128], [64, 32], [128, 64]])
/scratch.hpc/luca.cotugno/Foundation_model_clinical_data/test_tabular_model.py:481: UserWarning: Choices for a categorical distribution should be a tuple of None, bool, int, float and str for persistent storage but contains [128] which is of type list.
  num_nodes  = trial.suggest_categorical("num_nodes", [[32], [64], [128], [64, 32], [128, 64]])
/scratch.hpc/luca.cotugno/Foundation_model_clinical_data/test_tabular_model.py:481: UserWarning: Choices for a categorical distribution should be a tuple of None, bool, int, float and str for persistent storage but contains [64, 32] which is of type list.
  num_nodes  = trial.suggest_categorical("num_nodes", [[32], [64], [128], [64, 32], [128, 64]])
/scratch.hpc/luca.cotugno/Foundation_model_clinical_data/test_tabular_model.py:481: UserWarning: Choices for a categorical distribution should be a tuple of None, bool, int, float and str for persistent storage but contains [128, 64] which is of type list.
  num_nodes  = trial.suggest_categorical("num_nodes", [[32], [64], [128], [64, 32], [128, 64]])
[I 2026-07-01 11:29:17,752] Trial 4 finished with value: 0.7398037614622627 and parameters: {'num_nodes': [128, 64], 'dropout': 0.12884390533128676, 'learning_rate': 0.00010966488436899949, 'batch_norm': True}. Best is trial 6 with value: 0.7486256785352838.
[I 2026-07-01 11:29:19,700] Trial 7 finished with value: 0.7504926089489987 and parameters: {'num_nodes': [128, 64], 'dropout': 0.2956860257384955, 'learning_rate': 0.00017337048778964865, 'batch_norm': False}. Best is trial 7 with value: 0.7504926089489987.
/scratch.hpc/luca.cotugno/Foundation_model_clinical_data/test_tabular_model.py:481: UserWarning: Choices for a categorical distribution should be a tuple of None, bool, int, float and str for persistent storage but contains [32] which is of type list.
  num_nodes  = trial.suggest_categorical("num_nodes", [[32], [64], [128], [64, 32], [128, 64]])
/scratch.hpc/luca.cotugno/Foundation_model_clinical_data/test_tabular_model.py:481: UserWarning: Choices for a categorical distribution should be a tuple of None, bool, int, float and str for persistent storage but contains [64] which is of type list.
  num_nodes  = trial.suggest_categorical("num_nodes", [[32], [64], [128], [64, 32], [128, 64]])
/scratch.hpc/luca.cotugno/Foundation_model_clinical_data/test_tabular_model.py:481: UserWarning: Choices for a categorical distribution should be a tuple of None, bool, int, float and str for persistent storage but contains [128] which is of type list.
  num_nodes  = trial.suggest_categorical("num_nodes", [[32], [64], [128], [64, 32], [128, 64]])
/scratch.hpc/luca.cotugno/Foundation_model_clinical_data/test_tabular_model.py:481: UserWarning: Choices for a categorical distribution should be a tuple of None, bool, int, float and str for persistent storage but contains [64, 32] which is of type list.
  num_nodes  = trial.suggest_categorical("num_nodes", [[32], [64], [128], [64, 32], [128, 64]])
/scratch.hpc/luca.cotugno/Foundation_model_clinical_data/test_tabular_model.py:481: UserWarning: Choices for a categorical distribution should be a tuple of None, bool, int, float and str for persistent storage but contains [128, 64] which is of type list.
  num_nodes  = trial.suggest_categorical("num_nodes", [[32], [64], [128], [64, 32], [128, 64]])
/scratch.hpc/luca.cotugno/Foundation_model_clinical_data/.venv/lib/python3.12/site-packages/pycox/models/cox.py:251: RuntimeWarning: overflow encountered in exp
  expg = np.exp(self.predict(input, batch_size, True, eval_, num_workers=num_workers)).reshape(1, -1)
[I 2026-07-01 11:29:33,023] Trial 9 finished with value: 0.7299889594258901 and parameters: {'num_nodes': [128], 'dropout': 0.19613387838324134, 'learning_rate': 0.0003989122256117869, 'batch_norm': True}. Best is trial 7 with value: 0.7504926089489987.
/scratch.hpc/luca.cotugno/Foundation_model_clinical_data/test_tabular_model.py:481: UserWarning: Choices for a categorical distribution should be a tuple of None, bool, int, float and str for persistent storage but contains [32] which is of type list.
  num_nodes  = trial.suggest_categorical("num_nodes", [[32], [64], [128], [64, 32], [128, 64]])
/scratch.hpc/luca.cotugno/Foundation_model_clinical_data/test_tabular_model.py:481: UserWarning: Choices for a categorical distribution should be a tuple of None, bool, int, float and str for persistent storage but contains [64] which is of type list.
  num_nodes  = trial.suggest_categorical("num_nodes", [[32], [64], [128], [64, 32], [128, 64]])
/scratch.hpc/luca.cotugno/Foundation_model_clinical_data/test_tabular_model.py:481: UserWarning: Choices for a categorical distribution should be a tuple of None, bool, int, float and str for persistent storage but contains [128] which is of type list.
  num_nodes  = trial.suggest_categorical("num_nodes", [[32], [64], [128], [64, 32], [128, 64]])
/scratch.hpc/luca.cotugno/Foundation_model_clinical_data/test_tabular_model.py:481: UserWarning: Choices for a categorical distribution should be a tuple of None, bool, int, float and str for persistent storage but contains [64, 32] which is of type list.
  num_nodes  = trial.suggest_categorical("num_nodes", [[32], [64], [128], [64, 32], [128, 64]])
/scratch.hpc/luca.cotugno/Foundation_model_clinical_data/test_tabular_model.py:481: UserWarning: Choices for a categorical distribution should be a tuple of None, bool, int, float and str for persistent storage but contains [128, 64] which is of type list.
  num_nodes  = trial.suggest_categorical("num_nodes", [[32], [64], [128], [64, 32], [128, 64]])
[I 2026-07-01 11:29:35,465] Trial 0 finished with value: 0.7404305440549576 and parameters: {'num_nodes': [64], 'dropout': 0.16293042055840376, 'learning_rate': 0.0017234247469175995, 'batch_norm': False}. Best is trial 7 with value: 0.7504926089489987.
/scratch.hpc/luca.cotugno/Foundation_model_clinical_data/test_tabular_model.py:481: UserWarning: Choices for a categorical distribution should be a tuple of None, bool, int, float and str for persistent storage but contains [32] which is of type list.
  num_nodes  = trial.suggest_categorical("num_nodes", [[32], [64], [128], [64, 32], [128, 64]])
/scratch.hpc/luca.cotugno/Foundation_model_clinical_data/test_tabular_model.py:481: UserWarning: Choices for a categorical distribution should be a tuple of None, bool, int, float and str for persistent storage but contains [64] which is of type list.
  num_nodes  = trial.suggest_categorical("num_nodes", [[32], [64], [128], [64, 32], [128, 64]])
/scratch.hpc/luca.cotugno/Foundation_model_clinical_data/test_tabular_model.py:481: UserWarning: Choices for a categorical distribution should be a tuple of None, bool, int, float and str for persistent storage but contains [128] which is of type list.
  num_nodes  = trial.suggest_categorical("num_nodes", [[32], [64], [128], [64, 32], [128, 64]])
/scratch.hpc/luca.cotugno/Foundation_model_clinical_data/test_tabular_model.py:481: UserWarning: Choices for a categorical distribution should be a tuple of None, bool, int, float and str for persistent storage but contains [64, 32] which is of type list.
  num_nodes  = trial.suggest_categorical("num_nodes", [[32], [64], [128], [64, 32], [128, 64]])
/scratch.hpc/luca.cotugno/Foundation_model_clinical_data/test_tabular_model.py:481: UserWarning: Choices for a categorical distribution should be a tuple of None, bool, int, float and str for persistent storage but contains [128, 64] which is of type list.
  num_nodes  = trial.suggest_categorical("num_nodes", [[32], [64], [128], [64, 32], [128, 64]])
/scratch.hpc/luca.cotugno/Foundation_model_clinical_data/.venv/lib/python3.12/site-packages/pycox/models/cox.py:251: RuntimeWarning: overflow encountered in exp
  expg = np.exp(self.predict(input, batch_size, True, eval_, num_workers=num_workers)).reshape(1, -1)
[I 2026-07-01 11:29:37,619] Trial 8 finished with value: 0.7090578710092925 and parameters: {'num_nodes': [64, 32], 'dropout': 0.04407923986317702, 'learning_rate': 0.003407723944767373, 'batch_norm': True}. Best is trial 7 with value: 0.7504926089489987.
/scratch.hpc/luca.cotugno/Foundation_model_clinical_data/test_tabular_model.py:481: UserWarning: Choices for a categorical distribution should be a tuple of None, bool, int, float and str for persistent storage but contains [32] which is of type list.
  num_nodes  = trial.suggest_categorical("num_nodes", [[32], [64], [128], [64, 32], [128, 64]])
/scratch.hpc/luca.cotugno/Foundation_model_clinical_data/test_tabular_model.py:481: UserWarning: Choices for a categorical distribution should be a tuple of None, bool, int, float and str for persistent storage but contains [64] which is of type list.
  num_nodes  = trial.suggest_categorical("num_nodes", [[32], [64], [128], [64, 32], [128, 64]])
/scratch.hpc/luca.cotugno/Foundation_model_clinical_data/test_tabular_model.py:481: UserWarning: Choices for a categorical distribution should be a tuple of None, bool, int, float and str for persistent storage but contains [128] which is of type list.
  num_nodes  = trial.suggest_categorical("num_nodes", [[32], [64], [128], [64, 32], [128, 64]])
/scratch.hpc/luca.cotugno/Foundation_model_clinical_data/test_tabular_model.py:481: UserWarning: Choices for a categorical distribution should be a tuple of None, bool, int, float and str for persistent storage but contains [64, 32] which is of type list.
  num_nodes  = trial.suggest_categorical("num_nodes", [[32], [64], [128], [64, 32], [128, 64]])
/scratch.hpc/luca.cotugno/Foundation_model_clinical_data/test_tabular_model.py:481: UserWarning: Choices for a categorical distribution should be a tuple of None, bool, int, float and str for persistent storage but contains [128, 64] which is of type list.
  num_nodes  = trial.suggest_categorical("num_nodes", [[32], [64], [128], [64, 32], [128, 64]])
