[I 2026-06-08 21:04:05,527] Trial 85 finished with value: 0.7959645037067267 and parameters: {'num_nodes': [64, 32], 'dropout': 0.10220621622450184, 'learning_rate': 0.00016242967631026402, 'batch_norm': False}. Best is trial 66 with value: 0.8081241912194147.
/scratch.hpc/luca.cotugno/Foundation_model_clinical_data/test_tabular_model_tmp.py:476: UserWarning: Choices for a categorical distribution should be a tuple of None, bool, int, float and str for persistent storage but contains [32] which is of type list.
  num_nodes  = trial.suggest_categorical("num_nodes", [[32], [64], [128], [64, 32], [128, 64]])
/scratch.hpc/luca.cotugno/Foundation_model_clinical_data/test_tabular_model_tmp.py:476: UserWarning: Choices for a categorical distribution should be a tuple of None, bool, int, float and str for persistent storage but contains [64] which is of type list.
  num_nodes  = trial.suggest_categorical("num_nodes", [[32], [64], [128], [64, 32], [128, 64]])
/scratch.hpc/luca.cotugno/Foundation_model_clinical_data/test_tabular_model_tmp.py:476: UserWarning: Choices for a categorical distribution should be a tuple of None, bool, int, float and str for persistent storage but contains [128] which is of type list.
  num_nodes  = trial.suggest_categorical("num_nodes", [[32], [64], [128], [64, 32], [128, 64]])
/scratch.hpc/luca.cotugno/Foundation_model_clinical_data/test_tabular_model_tmp.py:476: UserWarning: Choices for a categorical distribution should be a tuple of None, bool, int, float and str for persistent storage but contains [64, 32] which is of type list.
  num_nodes  = trial.suggest_categorical("num_nodes", [[32], [64], [128], [64, 32], [128, 64]])
/scratch.hpc/luca.cotugno/Foundation_model_clinical_data/test_tabular_model_tmp.py:476: UserWarning: Choices for a categorical distribution should be a tuple of None, bool, int, float and str for persistent storage but contains [128, 64] which is of type list.
  num_nodes  = trial.suggest_categorical("num_nodes", [[32], [64], [128], [64, 32], [128, 64]])

3:	[0s / 1s],		train_loss: 2.5290
74:	[0s / 36s],		train_loss: 2.4274
4:	[0s / 2s],		train_loss: 2.5121
14:	[0s / 10s],		train_loss: 2.5408
75:	[0s / 37s],		train_loss: 2.4249
5:	[0s / 2s],		train_loss: 2.5139
44:	[1s / 57s],		train_loss: 2.4257
76:	[0s / 37s],		train_loss: 2.4277
6:	[0s / 2s],		train_loss: 2.4971
15:	[0s / 11s],		train_loss: 2.5375
7:	[0s / 3s],		train_loss: 2.4854
77:	[0s / 38s],		train_loss: 2.4371
16:	[0s / 12s],		train_loss: 2.5217
8:	[0s / 3s],		train_loss: 2.4941
45:	[1s / 58s],		train_loss: 2.4383
78:	[0s / 38s],		train_loss: 2.4155
9:	[0s / 4s],		train_loss: 2.4962
17:	[0s / 12s],		train_loss: 2.5384
79:	[0s / 39s],		train_loss: 2.4140
10:	[0s / 4s],		train_loss: 2.4803
80:	[0s / 39s],		train_loss: 2.4033
46:	[1s / 59s],		train_loss: 2.4413
11:	[0s / 4s],		train_loss: 2.4935
18:	[0s / 13s],		train_loss: 2.5189
81:	[0s / 40s],		train_loss: 2.4205
12:	[0s / 5s],		train_loss: 2.4851
13:	[0s / 5s],		train_loss: 2.4741
19:	[0s / 14s],		train_loss: 2.5123
82:	[0s / 40s],		train_loss: 2.4032
47:	[1s / 1m:0s],		train_loss: 2.4256
14:	[0s / 6s],		train_loss: 2.4832
83:	[0s / 41s],		train_loss: 2.4151
20:	[0s / 15s],		train_loss: 2.4971
15:	[0s / 6s],		train_loss: 2.4691
84:	[0s / 41s],		train_loss: 2.4142
16:	[0s / 7s],		train_loss: 2.4814
48:	[1s / 1m:1s],		train_loss: 2.4448
21:	[0s / 15s],		train_loss: 2.5148
85:	[0s / 42s],		train_loss: 2.4125
17:	[0s / 7s],		train_loss: 2.4592
18:	[0s / 8s],		train_loss: 2.4614
86:	[0s / 42s],		train_loss: 2.4167
22:	[0s / 16s],		train_loss: 2.5013
49:	[1s / 1m:2s],		train_loss: 2.4237
19:	[0s / 8s],		train_loss: 2.4660
87:	[0s / 43s],		train_loss: 2.4024
23:	[0s / 17s],		train_loss: 2.4985
20:	[0s / 8s],		train_loss: 2.4694
88:	[0s / 44s],		train_loss: 2.4019
21:	[0s / 9s],		train_loss: 2.4655
50:	[1s / 1m:4s],		train_loss: 2.4396
24:	[0s / 18s],		train_loss: 2.4893
89:	[0s / 44s],		train_loss: 2.4118
22:	[0s / 9s],		train_loss: 2.4445
23:	[0s / 10s],		train_loss: 2.4496
25:	[0s / 18s],		train_loss: 2.4878
90:	[0s / 45s],		train_loss: 2.3974
51:	[1s / 1m:5s],		train_loss: 2.4182
24:	[0s / 10s],		train_loss: 2.4517
91:	[0s / 45s],		train_loss: 2.4136
26:	[0s / 19s],		train_loss: 2.4936
25:	[0s / 11s],		train_loss: 2.4292
92:	[0s / 46s],		train_loss: 2.4157
26:	[0s / 11s],		train_loss: 2.4554
52:	[1s / 1m:6s],		train_loss: 2.4151
27:	[0s / 20s],		train_loss: 2.4852
93:	[0s / 46s],		train_loss: 2.4181
27:	[0s / 12s],		train_loss: 2.4653
28:	[0s / 12s],		train_loss: 2.4548
94:	[0s / 47s],		train_loss: 2.3962
28:	[0s / 21s],		train_loss: 2.4718
29:	[0s / 13s],		train_loss: 2.4440
53:	[1s / 1m:7s],		train_loss: 2.4280
95:	[0s / 47s],		train_loss: 2.4036
29:	[0s / 21s],		train_loss: 2.4770
30:	[0s / 13s],		train_loss: 2.4460
96:	[0s / 48s],		train_loss: 2.4091
31:	[0s / 13s],		train_loss: 2.4464
30:	[0s / 22s],		train_loss: 2.4696
54:	[1s / 1m:8s],		train_loss: 2.4212
97:	[0s / 49s],		train_loss: 2.4034
32:	[0s / 14s],		train_loss: 2.4364
33:	[0s / 14s],		train_loss: 2.4308
31:	[0s / 23s],		train_loss: 2.4807
98:	[0s / 49s],		train_loss: 2.4043
55:	[1s / 1m:9s],		train_loss: 2.4107
34:	[0s / 15s],		train_loss: 2.4398
99:	[0s / 50s],		train_loss: 2.3998
32:	[0s / 24s],		train_loss: 2.4667
35:	[0s / 15s],		train_loss: 2.4445
0:	[0s / 0s],		train_loss: 3.5163
56:	[1s / 1m:10s],		train_loss: 2.4157
36:	[0s / 16s],		train_loss: 2.4442
33:	[0s / 24s],		train_loss: 2.4640
1:	[0s / 1s],		train_loss: 2.7644
37:	[0s / 16s],		train_loss: 2.4475
34:	[0s / 25s],		train_loss: 2.4693
2:	[0s / 1s],		train_loss: 2.6922
38:	[0s / 17s],		train_loss: 2.4406
57:	[1s / 1m:11s],		train_loss: 2.4332
39:	[0s / 17s],		train_loss: 2.4425
3:	[0s / 2s],		train_loss: 2.6494
35:	[0s / 26s],		train_loss: 2.4627
40:	[0s / 18s],		train_loss: 2.4265
4:	[0s / 2s],		train_loss: 2.6211
58:	[1s / 1m:13s],		train_loss: 2.4214
36:	[0s / 27s],		train_loss: 2.4504
41:	[0s / 18s],		train_loss: 2.4414
5:	[0s / 3s],		train_loss: 2.5968
42:	[0s / 19s],		train_loss: 2.4167
37:	[0s / 27s],		train_loss: 2.4546
6:	[0s / 3s],		train_loss: 2.5799
59:	[1s / 1m:14s],		train_loss: 2.4190
43:	[0s / 19s],		train_loss: 2.4296
7:	[0s / 4s],		train_loss: 2.5529
38:	[0s / 28s],		train_loss: 2.4659
44:	[0s / 20s],		train_loss: 2.4337
8:	[0s / 4s],		train_loss: 2.5452
45:	[0s / 20s],		train_loss: 2.4531
60:	[1s / 1m:15s],		train_loss: 2.4130
39:	[0s / 29s],		train_loss: 2.4587
9:	[0s / 5s],		train_loss: 2.5404
46:	[0s / 21s],		train_loss: 2.4128
10:	[0s / 5s],		train_loss: 2.5263
40:	[0s / 29s],		train_loss: 2.4614
47:	[0s / 21s],		train_loss: 2.4343
11:	[0s / 6s],		train_loss: 2.5221
48:	[0s / 21s],		train_loss: 2.4301
61:	[1s / 1m:16s],		train_loss: 2.4151
41:	[0s / 30s],		train_loss: 2.4523
12:	[0s / 6s],		train_loss: 2.5291
49:	[0s / 22s],		train_loss: 2.4297
13:	[0s / 7s],		train_loss: 2.5129
50:	[0s / 22s],		train_loss: 2.4423
42:	[0s / 31s],		train_loss: 2.4526
62:	[1s / 1m:17s],		train_loss: 2.4121
14:	[0s / 7s],		train_loss: 2.5122
51:	[0s / 23s],		train_loss: 2.4255
43:	[0s / 32s],		train_loss: 2.4351
15:	[0s / 7s],		train_loss: 2.4911
52:	[0s / 23s],		train_loss: 2.4152
16:	[0s / 8s],		train_loss: 2.4963
53:	[0s / 24s],		train_loss: 2.4071
44:	[0s / 32s],		train_loss: 2.4551
63:	[1s / 1m:18s],		train_loss: 2.4101
54:	[0s / 24s],		train_loss: 2.4246
17:	[0s / 8s],		train_loss: 2.4766
45:	[0s / 33s],		train_loss: 2.4476
55:	[0s / 25s],		train_loss: 2.4210
18:	[0s / 9s],		train_loss: 2.4857
64:	[1s / 1m:19s],		train_loss: 2.4079
56:	[0s / 25s],		train_loss: 2.4236
19:	[0s / 10s],		train_loss: 2.4776
46:	[0s / 34s],		train_loss: 2.4348
57:	[0s / 25s],		train_loss: 2.4074
20:	[0s / 10s],		train_loss: 2.4695
47:	[0s / 34s],		train_loss: 2.4386
65:	[1s / 1m:20s],		train_loss: 2.4123
58:	[0s / 26s],		train_loss: 2.4136
21:	[0s / 11s],		train_loss: 2.4695
59:	[0s / 26s],		train_loss: 2.4118
48:	[0s / 35s],		train_loss: 2.4561
22:	[0s / 11s],		train_loss: 2.4761
66:	[1s / 1m:21s],		train_loss: 2.4160
60:	[0s / 27s],		train_loss: 2.4050
23:	[0s / 12s],		train_loss: 2.4662
49:	[0s / 36s],		train_loss: 2.4362
61:	[0s / 27s],		train_loss: 2.4113
24:	[0s / 12s],		train_loss: 2.4611
62:	[0s / 28s],		train_loss: 2.4147
67:	[1s / 1m:23s],		train_loss: 2.4094
50:	[0s / 37s],		train_loss: 2.4437
63:	[0s / 28s],		train_loss: 2.4112
25:	[0s / 13s],		train_loss: 2.4597
51:	[0s / 37s],		train_loss: 2.4381
64:	[0s / 29s],		train_loss: 2.4024
26:	[0s / 13s],		train_loss: 2.4576
68:	[1s / 1m:24s],		train_loss: 2.3972
65:	[0s / 29s],		train_loss: 2.4146
27:	[0s / 14s],		train_loss: 2.4459
52:	[0s / 38s],		train_loss: 2.4429
66:	[0s / 30s],		train_loss: 2.4082
28:	[0s / 14s],		train_loss: 2.4526
67:	[0s / 30s],		train_loss: 2.4084
53:	[0s / 39s],		train_loss: 2.4340
69:	[1s / 1m:25s],		train_loss: 2.4056
29:	[0s / 15s],		train_loss: 2.4556
68:	[0s / 31s],		train_loss: 2.4031
30:	[0s / 15s],		train_loss: 2.4428
54:	[0s / 39s],		train_loss: 2.4311
69:	[0s / 31s],		train_loss: 2.4025
31:	[0s / 16s],		train_loss: 2.4497
70:	[1s / 1m:26s],		train_loss: 2.4037
70:	[0s / 31s],		train_loss: 2.4169
55:	[0s / 40s],		train_loss: 2.4176
32:	[0s / 16s],		train_loss: 2.4469
71:	[0s / 32s],		train_loss: 2.4081
33:	[0s / 17s],		train_loss: 2.4408
56:	[0s / 41s],		train_loss: 2.4269
72:	[0s / 32s],		train_loss: 2.4102
71:	[1s / 1m:27s],		train_loss: 2.4047
34:	[0s / 17s],		train_loss: 2.4357
73:	[0s / 33s],		train_loss: 2.3974
57:	[0s / 41s],		train_loss: 2.4305
35:	[0s / 18s],		train_loss: 2.4472
74:	[0s / 33s],		train_loss: 2.3914
72:	[1s / 1m:28s],		train_loss: 2.3918
58:	[0s / 42s],		train_loss: 2.4211
36:	[0s / 18s],		train_loss: 2.4436
75:	[0s / 34s],		train_loss: 2.3999
37:	[0s / 19s],		train_loss: 2.4384
76:	[0s / 34s],		train_loss: 2.4013
59:	[0s / 43s],		train_loss: 2.4118
73:	[1s / 1m:29s],		train_loss: 2.3958
38:	[0s / 19s],		train_loss: 2.4238
77:	[0s / 35s],		train_loss: 2.4092
60:	[0s / 44s],		train_loss: 2.4224
78:	[0s / 35s],		train_loss: 2.3943
39:	[0s / 20s],		train_loss: 2.4214
74:	[1s / 1m:30s],		train_loss: 2.4070
79:	[0s / 36s],		train_loss: 2.3939
40:	[0s / 20s],		train_loss: 2.4264
61:	[0s / 44s],		train_loss: 2.4185
80:	[0s / 36s],		train_loss: 2.3886
41:	[0s / 21s],		train_loss: 2.4299
62:	[0s / 45s],		train_loss: 2.4228
75:	[1s / 1m:31s],		train_loss: 2.3944
81:	[0s / 37s],		train_loss: 2.3971
42:	[0s / 21s],		train_loss: 2.4204
82:	[0s / 37s],		train_loss: 2.3957
63:	[0s / 46s],		train_loss: 2.4218
43:	[0s / 22s],		train_loss: 2.4268
83:	[0s / 38s],		train_loss: 2.4115
76:	[1s / 1m:33s],		train_loss: 2.3892
44:	[0s / 22s],		train_loss: 2.4218
64:	[0s / 47s],		train_loss: 2.4279
84:	[0s / 38s],		train_loss: 2.3947
45:	[0s / 23s],		train_loss: 2.4254
85:	[0s / 39s],		train_loss: 2.3873
65:	[0s / 47s],		train_loss: 2.4254
46:	[0s / 23s],		train_loss: 2.4205
86:	[0s / 39s],		train_loss: 2.3930
77:	[1s / 1m:34s],		train_loss: 2.3880
47:	[0s / 24s],		train_loss: 2.4114
66:	[0s / 48s],		train_loss: 2.4145
87:	[0s / 40s],		train_loss: 2.3868
48:	[0s / 25s],		train_loss: 2.4223
88:	[0s / 40s],		train_loss: 2.3768
78:	[1s / 1m:35s],		train_loss: 2.4019
67:	[0s / 49s],		train_loss: 2.4148
49:	[0s / 25s],		train_loss: 2.3926
89:	[0s / 41s],		train_loss: 2.3924
90:	[0s / 41s],		train_loss: 2.3972
68:	[0s / 50s],		train_loss: 2.4081
50:	[0s / 26s],		train_loss: 2.4191
79:	[1s / 1m:36s],		train_loss: 2.3835
91:	[0s / 42s],		train_loss: 2.4115
51:	[0s / 26s],		train_loss: 2.4063
69:	[0s / 50s],		train_loss: 2.4201
92:	[0s / 42s],		train_loss: 2.3921
52:	[0s / 27s],		train_loss: 2.4077
80:	[1s / 1m:37s],		train_loss: 2.3885
93:	[0s / 43s],		train_loss: 2.3944
70:	[0s / 51s],		train_loss: 2.4105
53:	[0s / 27s],		train_loss: 2.4066
94:	[0s / 43s],		train_loss: 2.4007
54:	[0s / 28s],		train_loss: 2.4035
71:	[0s / 52s],		train_loss: 2.4131
81:	[1s / 1m:38s],		train_loss: 2.3870
95:	[0s / 44s],		train_loss: 2.3879
55:	[0s / 28s],		train_loss: 2.4009
96:	[0s / 44s],		train_loss: 2.3880
72:	[0s / 53s],		train_loss: 2.4123
56:	[0s / 29s],		train_loss: 2.4101
97:	[0s / 45s],		train_loss: 2.3905
82:	[1s / 1m:40s],		train_loss: 2.3962
73:	[0s / 54s],		train_loss: 2.4000
57:	[0s / 30s],		train_loss: 2.3969
98:	[0s / 45s],		train_loss: 2.3694
99:	[0s / 46s],		train_loss: 2.3818
58:	[0s / 30s],		train_loss: 2.4014
74:	[0s / 54s],		train_loss: 2.3910
59:	[0s / 31s],		train_loss: 2.4055
83:	[1s / 1m:41s],		train_loss: 2.3817
0:	[0s / 0s],		train_loss: 3.3252
75:	[0s / 55s],		train_loss: 2.3984
1:	[0s / 0s],		train_loss: 2.8123
60:	[0s / 31s],		train_loss: 2.3950
2:	[0s / 1s],		train_loss: 2.7318
61:	[0s / 31s],		train_loss: 2.3971
76:	[0s / 56s],		train_loss: 2.3990
84:	[1s / 1m:42s],		train_loss: 2.3938
3:	[0s / 1s],		train_loss: 2.6707
62:	[0s / 32s],		train_loss: 2.3933
77:	[0s / 56s],		train_loss: 2.3969
4:	[0s / 2s],		train_loss: 2.6565
63:	[0s / 32s],		train_loss: 2.3930
5:	[0s / 2s],		train_loss: 2.6244
85:	[1s / 1m:43s],		train_loss: 2.3914
64:	[0s / 33s],		train_loss: 2.3961
78:	[0s / 57s],		train_loss: 2.3987
6:	[0s / 3s],		train_loss: 2.5987
65:	[0s / 34s],		train_loss: 2.3868
7:	[0s / 3s],		train_loss: 2.5870
79:	[0s / 58s],		train_loss: 2.3886
66:	[0s / 34s],		train_loss: 2.3813
86:	[1s / 1m:44s],		train_loss: 2.3880
8:	[0s / 4s],		train_loss: 2.5623
67:	[0s / 35s],		train_loss: 2.3956
80:	[0s / 59s],		train_loss: 2.3832
9:	[0s / 4s],		train_loss: 2.5564
68:	[0s / 35s],		train_loss: 2.3942
87:	[1s / 1m:46s],		train_loss: 2.3934
10:	[0s / 5s],		train_loss: 2.5381
81:	[0s / 1m:0s],		train_loss: 2.3845
69:	[0s / 36s],		train_loss: 2.3856
11:	[0s / 5s],		train_loss: 2.5454
82:	[0s / 1m:0s],		train_loss: 2.3938
12:	[0s / 6s],		train_loss: 2.5197
70:	[0s / 36s],		train_loss: 2.3767
88:	[1s / 1m:47s],		train_loss: 2.3805
13:	[0s / 6s],		train_loss: 2.5087
71:	[0s / 37s],		train_loss: 2.3740
83:	[0s / 1m:1s],		train_loss: 2.3958
14:	[0s / 7s],		train_loss: 2.5219
72:	[0s / 37s],		train_loss: 2.3692
15:	[0s / 7s],		train_loss: 2.5078
89:	[1s / 1m:48s],		train_loss: 2.3831
84:	[0s / 1m:2s],		train_loss: 2.3858
73:	[0s / 38s],		train_loss: 2.3762
16:	[0s / 8s],		train_loss: 2.5024
74:	[0s / 39s],		train_loss: 2.3856
85:	[0s / 1m:3s],		train_loss: 2.3873
17:	[0s / 8s],		train_loss: 2.4938
90:	[1s / 1m:49s],		train_loss: 2.3985
75:	[0s / 39s],		train_loss: 2.3931
18:	[0s / 9s],		train_loss: 2.4961
86:	[0s / 1m:4s],		train_loss: 2.3906
76:	[0s / 40s],		train_loss: 2.3745
19:	[0s / 9s],		train_loss: 2.4765
77:	[0s / 40s],		train_loss: 2.3766
20:	[0s / 9s],		train_loss: 2.4857
87:	[0s / 1m:4s],		train_loss: 2.4033
91:	[1s / 1m:50s],		train_loss: 2.3904
78:	[0s / 40s],		train_loss: 2.3725
21:	[0s / 10s],		train_loss: 2.4762
88:	[0s / 1m:5s],		train_loss: 2.3933
79:	[0s / 41s],		train_loss: 2.3710
22:	[0s / 10s],		train_loss: 2.4784
80:	[0s / 41s],		train_loss: 2.3767
23:	[0s / 11s],		train_loss: 2.4653
92:	[1s / 1m:52s],		train_loss: 2.3925
89:	[0s / 1m:6s],		train_loss: 2.3841
81:	[0s / 42s],		train_loss: 2.3644
24:	[0s / 11s],		train_loss: 2.4748
90:	[0s / 1m:6s],		train_loss: 2.3770
25:	[0s / 12s],		train_loss: 2.4727
82:	[0s / 42s],		train_loss: 2.3576
93:	[1s / 1m:53s],		train_loss: 2.3810
26:	[0s / 12s],		train_loss: 2.4513
83:	[0s / 43s],		train_loss: 2.3572
91:	[0s / 1m:7s],		train_loss: 2.3818
27:	[0s / 13s],		train_loss: 2.4670
84:	[0s / 43s],		train_loss: 2.3581
28:	[0s / 13s],		train_loss: 2.4606
92:	[0s / 1m:8s],		train_loss: 2.3754
85:	[0s / 44s],		train_loss: 2.3715
94:	[1s / 1m:54s],		train_loss: 2.3827
29:	[0s / 14s],		train_loss: 2.4368
86:	[0s / 44s],		train_loss: 2.3637
93:	[0s / 1m:9s],		train_loss: 2.3829
30:	[0s / 14s],		train_loss: 2.4493
87:	[0s / 45s],		train_loss: 2.3590
31:	[0s / 14s],		train_loss: 2.4473
95:	[1s / 1m:55s],		train_loss: 2.3792
88:	[0s / 45s],		train_loss: 2.3476
94:	[0s / 1m:10s],		train_loss: 2.3729
32:	[0s / 15s],		train_loss: 2.4456
89:	[0s / 46s],		train_loss: 2.3581
33:	[0s / 15s],		train_loss: 2.4463
95:	[0s / 1m:10s],		train_loss: 2.3834
90:	[0s / 46s],		train_loss: 2.3618
96:	[1s / 1m:57s],		train_loss: 2.3764
34:	[0s / 16s],		train_loss: 2.4489
91:	[0s / 47s],		train_loss: 2.3699
96:	[0s / 1m:11s],		train_loss: 2.3725
35:	[0s / 16s],		train_loss: 2.4287
92:	[0s / 47s],		train_loss: 2.3691
36:	[0s / 17s],		train_loss: 2.4356
97:	[0s / 1m:12s],		train_loss: 2.3719
97:	[1s / 1m:58s],		train_loss: 2.3714
93:	[0s / 48s],		train_loss: 2.3620
37:	[0s / 17s],		train_loss: 2.4395
98:	[0s / 1m:12s],		train_loss: 2.3755
94:	[0s / 48s],		train_loss: 2.3608
38:	[0s / 18s],		train_loss: 2.4220
95:	[0s / 49s],		train_loss: 2.3558
39:	[0s / 18s],		train_loss: 2.4391
99:	[0s / 1m:13s],		train_loss: 2.3856
98:	[1s / 1m:59s],		train_loss: 2.3813
96:	[0s / 49s],		train_loss: 2.3504
40:	[0s / 19s],		train_loss: 2.4321
0:	[0s / 0s],		train_loss: 2.8510
41:	[0s / 19s],		train_loss: 2.4286
97:	[0s / 50s],		train_loss: 2.3459
99:	[1s / 2m:0s],		train_loss: 2.3733
42:	[0s / 20s],		train_loss: 2.4224
1:	[0s / 1s],		train_loss: 2.5853
98:	[0s / 51s],		train_loss: 2.3515
43:	[0s / 20s],		train_loss: 2.4267
99:	[0s / 51s],		train_loss: 2.3551
2:	[0s / 2s],		train_loss: 2.5439
44:	[0s / 21s],		train_loss: 2.4145
0:	[1s / 1s],		train_loss: 3.8990
0:	[0s / 0s],		train_loss: 3.6390
45:	[0s / 21s],		train_loss: 2.4244
3:	[0s / 2s],		train_loss: 2.5402
1:	[0s / 1s],		train_loss: 2.8481
46:	[0s / 22s],		train_loss: 2.4181
4:	[0s / 3s],		train_loss: 2.5767
1:	[1s / 2s],		train_loss: 3.0438
47:	[0s / 22s],		train_loss: 2.4183
2:	[0s / 1s],		train_loss: 2.7463
48:	[0s / 23s],		train_loss: 2.4073
5:	[0s / 4s],		train_loss: 2.5310
3:	[0s / 2s],		train_loss: 2.6755
49:	[0s / 23s],		train_loss: 2.4233
2:	[1s / 3s],		train_loss: 2.8516
4:	[0s / 2s],		train_loss: 2.6252
6:	[0s / 4s],		train_loss: 2.5451
50:	[0s / 24s],		train_loss: 2.4120
5:	[0s / 3s],		train_loss: 2.6116
51:	[0s / 24s],		train_loss: 2.4023
7:	[0s / 5s],		train_loss: 2.5140
6:	[0s / 3s],		train_loss: 2.5901
52:	[0s / 24s],		train_loss: 2.4124
3:	[1s / 4s],		train_loss: 2.7496
8:	[0s / 6s],		train_loss: 2.5111
53:	[0s / 25s],		train_loss: 2.4008
7:	[0s / 4s],		train_loss: 2.5658
54:	[0s / 25s],		train_loss: 2.4180
9:	[0s / 6s],		train_loss: 2.5218
8:	[0s / 4s],		train_loss: 2.5588
4:	[1s / 5s],		train_loss: 2.6914
55:	[0s / 26s],		train_loss: 2.3999
9:	[0s / 5s],		train_loss: 2.5449
10:	[0s / 7s],		train_loss: 2.5015
56:	[0s / 26s],		train_loss: 2.4041
10:	[0s / 5s],		train_loss: 2.5466
57:	[0s / 27s],		train_loss: 2.4006
5:	[1s / 6s],		train_loss: 2.6661
11:	[0s / 8s],		train_loss: 2.4957
58:	[0s / 27s],		train_loss: 2.4093
11:	[0s / 6s],		train_loss: 2.5254
12:	[0s / 8s],		train_loss: 2.4955
59:	[0s / 27s],		train_loss: 2.3838
12:	[0s / 7s],		train_loss: 2.5244
60:	[0s / 28s],		train_loss: 2.3977
6:	[1s / 8s],		train_loss: 2.6087
13:	[0s / 9s],		train_loss: 2.4898
13:	[0s / 7s],		train_loss: 2.5224
61:	[0s / 28s],		train_loss: 2.4019
14:	[0s / 8s],		train_loss: 2.5130
62:	[0s / 29s],		train_loss: 2.4041
14:	[0s / 10s],		train_loss: 2.4794
7:	[1s / 9s],		train_loss: 2.6063
63:	[0s / 29s],		train_loss: 2.3946
15:	[0s / 8s],		train_loss: 2.5033
15:	[0s / 10s],		train_loss: 2.4892
64:	[0s / 30s],		train_loss: 2.3868
16:	[0s / 9s],		train_loss: 2.5015
65:	[0s / 30s],		train_loss: 2.4063
16:	[0s / 11s],		train_loss: 2.4860
17:	[0s / 9s],		train_loss: 2.5103
8:	[1s / 10s],		train_loss: 2.5918
66:	[0s / 30s],		train_loss: 2.3890
18:	[0s / 10s],		train_loss: 2.4854
17:	[0s / 12s],		train_loss: 2.4857
67:	[0s / 31s],		train_loss: 2.3946
19:	[0s / 10s],		train_loss: 2.4862
68:	[0s / 31s],		train_loss: 2.3916
18:	[0s / 12s],		train_loss: 2.4670
9:	[1s / 11s],		train_loss: 2.5877
69:	[0s / 32s],		train_loss: 2.3840
20:	[0s / 11s],		train_loss: 2.4916
19:	[0s / 13s],		train_loss: 2.4712
70:	[0s / 32s],		train_loss: 2.3858
21:	[0s / 11s],		train_loss: 2.4819
71:	[0s / 33s],		train_loss: 2.3863
10:	[1s / 12s],		train_loss: 2.5602
20:	[0s / 14s],		train_loss: 2.4919
22:	[0s / 12s],		train_loss: 2.4902
72:	[0s / 33s],		train_loss: 2.3857
21:	[0s / 14s],		train_loss: 2.4740
23:	[0s / 12s],		train_loss: 2.4756
73:	[0s / 33s],		train_loss: 2.3775
11:	[1s / 13s],		train_loss: 2.5590
74:	[0s / 34s],		train_loss: 2.3665
24:	[0s / 13s],		train_loss: 2.4752
22:	[0s / 15s],		train_loss: 2.4739
75:	[0s / 34s],		train_loss: 2.3804
25:	[0s / 13s],		train_loss: 2.4796
23:	[0s / 16s],		train_loss: 2.4659
76:	[0s / 35s],		train_loss: 2.3752
12:	[1s / 15s],		train_loss: 2.5407
26:	[0s / 14s],		train_loss: 2.4828
77:	[0s / 35s],		train_loss: 2.3772
24:	[0s / 16s],		train_loss: 2.4729
27:	[0s / 14s],		train_loss: 2.4790
78:	[0s / 36s],		train_loss: 2.3753
13:	[1s / 16s],		train_loss: 2.5300
25:	[0s / 17s],		train_loss: 2.4792
79:	[0s / 36s],		train_loss: 2.3576
28:	[0s / 15s],		train_loss: 2.4533
80:	[0s / 36s],		train_loss: 2.3797
26:	[0s / 18s],		train_loss: 2.4779
29:	[0s / 15s],		train_loss: 2.4574
81:	[0s / 37s],		train_loss: 2.3768
14:	[1s / 17s],		train_loss: 2.5323
30:	[0s / 16s],		train_loss: 2.4527
27:	[0s / 18s],		train_loss: 2.4877
82:	[0s / 37s],		train_loss: 2.3694
31:	[0s / 17s],		train_loss: 2.4629
83:	[0s / 38s],		train_loss: 2.3679
28:	[0s / 19s],		train_loss: 2.4790
15:	[1s / 18s],		train_loss: 2.5166
32:	[0s / 17s],		train_loss: 2.4530
84:	[0s / 38s],		train_loss: 2.3739
29:	[0s / 19s],		train_loss: 2.4806
85:	[0s / 39s],		train_loss: 2.3662
33:	[0s / 18s],		train_loss: 2.4511
86:	[0s / 39s],		train_loss: 2.3663
30:	[0s / 20s],		train_loss: 2.4772
34:	[0s / 18s],		train_loss: 2.4410
16:	[1s / 19s],		train_loss: 2.5157
87:	[0s / 39s],		train_loss: 2.3635
35:	[0s / 19s],		train_loss: 2.4521
31:	[0s / 21s],		train_loss: 2.4728
88:	[0s / 40s],		train_loss: 2.3742
36:	[0s / 19s],		train_loss: 2.4413
89:	[0s / 40s],		train_loss: 2.3732
32:	[0s / 21s],		train_loss: 2.4804
17:	[1s / 20s],		train_loss: 2.5036
90:	[0s / 41s],		train_loss: 2.3689
37:	[0s / 20s],		train_loss: 2.4375
33:	[0s / 22s],		train_loss: 2.4727
91:	[0s / 41s],		train_loss: 2.3643
38:	[0s / 20s],		train_loss: 2.4482
92:	[0s / 41s],		train_loss: 2.3587
18:	[1s / 21s],		train_loss: 2.5084
34:	[0s / 23s],		train_loss: 2.4801
39:	[0s / 21s],		train_loss: 2.4363
93:	[0s / 42s],		train_loss: 2.3682
40:	[0s / 21s],		train_l