88:	[0s / 34s],		train_loss: 2.4295[I 2026-06-09 05:56:26,483] Trial 91 finished with value: 0.8083750888812775 and parameters: {'num_nodes': [64, 32], 'dropout': 0.18215872086651297, 'learning_rate': 0.00013392408355546894, 'batch_norm': False}. Best is trial 86 with value: 0.8130645848060124.
/scratch.hpc/luca.cotugno/Foundation_model_clinical_data/test_tabular_model_tmp.py:476: UserWarning: Choices for a categorical distribution should be a tuple of None, bool, int, float and str for persistent storage but contains [32] which is of type list.
  num_nodes  = trial.suggest_categorical("num_nodes", [[32], [64], [128], [64, 32], [128, 64]])
/scratch.hpc/luca.cotugno/Foundation_model_clinical_data/test_tabular_model_tmp.py:476: UserWarning: Choices for a categorical distribution should be a tuple of None, bool, int, float and str for persistent storage but contains [64] which is of type list.
  num_nodes  = trial.suggest_categorical("num_nodes", [[32], [64], [128], [64, 32], [128, 64]])
/scratch.hpc/luca.cotugno/Foundation_model_clinical_data/test_tabular_model_tmp.py:476: UserWarning: Choices for a categorical distribution should be a tuple of None, bool, int, float and str for persistent storage but contains [128] which is of type list.
  num_nodes  = trial.suggest_categorical("num_nodes", [[32], [64], [128], [64, 32], [128, 64]])
/scratch.hpc/luca.cotugno/Foundation_model_clinical_data/test_tabular_model_tmp.py:476: UserWarning: Choices for a categorical distribution should be a tuple of None, bool, int, float and str for persistent storage but contains [64, 32] which is of type list.
  num_nodes  = trial.suggest_categorical("num_nodes", [[32], [64], [128], [64, 32], [128, 64]])
/scratch.hpc/luca.cotugno/Foundation_model_clinical_data/test_tabular_model_tmp.py:476: UserWarning: Choices for a categorical distribution should be a tuple of None, bool, int, float and str for persistent storage but contains [128, 64] which is of type list.
  num_nodes  = trial.suggest_categorical("num_nodes", [[32], [64], [128], [64, 32], [128, 64]])
[I 2026-06-09 05:56:27,618] Trial 96 finished with value: 0.8014457327096635 and parameters: {'num_nodes': [32], 'dropout': 0.24134819786308806, 'learning_rate': 0.001155227309864235, 'batch_norm': False}. Best is trial 86 with value: 0.8130645848060124.
/scratch.hpc/luca.cotugno/Foundation_model_clinical_data/test_tabular_model_tmp.py:476: UserWarning: Choices for a categorical distribution should be a tuple of None, bool, int, float and str for persistent storage but contains [32] which is of type list.
  num_nodes  = trial.suggest_categorical("num_nodes", [[32], [64], [128], [64, 32], [128, 64]])
/scratch.hpc/luca.cotugno/Foundation_model_clinical_data/test_tabular_model_tmp.py:476: UserWarning: Choices for a categorical distribution should be a tuple of None, bool, int, float and str for persistent storage but contains [64] which is of type list.
  num_nodes  = trial.suggest_categorical("num_nodes", [[32], [64], [128], [64, 32], [128, 64]])
/scratch.hpc/luca.cotugno/Foundation_model_clinical_data/test_tabular_model_tmp.py:476: UserWarning: Choices for a categorical distribution should be a tuple of None, bool, int, float and str for persistent storage but contains [128] which is of type list.
  num_nodes  = trial.suggest_categorical("num_nodes", [[32], [64], [128], [64, 32], [128, 64]])
/scratch.hpc/luca.cotugno/Foundation_model_clinical_data/test_tabular_model_tmp.py:476: UserWarning: Choices for a categorical distribution should be a tuple of None, bool, int, float and str for persistent storage but contains [64, 32] which is of type list.
  num_nodes  = trial.suggest_categorical("num_nodes", [[32], [64], [128], [64, 32], [128, 64]])
/scratch.hpc/luca.cotugno/Foundation_model_clinical_data/test_tabular_model_tmp.py:476: UserWarning: Choices for a categorical distribution should be a tuple of None, bool, int, float and str for persistent storage but contains [128, 64] which is of type list.
  num_nodes  = trial.suggest_categorical("num_nodes", [[32], [64], [128], [64, 32], [128, 64]])
[I 2026-06-09 05:56:31,435] Trial 95 finished with value: 0.8093510911966153 and parameters: {'num_nodes': [32], 'dropout': 0.27114261056076877, 'learning_rate': 0.0021673085758672824, 'batch_norm': False}. Best is trial 86 with value: 0.8130645848060124.
[I 2026-06-09 05:56:46,280] Trial 97 finished with value: 0.8080258101860286 and parameters: {'num_nodes': [32], 'dropout': 0.27203759673676053, 'learning_rate': 0.00010529702675752616, 'batch_norm': False}. Best is trial 86 with value: 0.8130645848060124.
[I 2026-06-09 05:57:01,073] Trial 99 finished with value: 0.80394950398261 and parameters: {'num_nodes': [64, 32], 'dropout': 0.1288175302358276, 'learning_rate': 0.00011004647855848446, 'batch_norm': False}. Best is trial 86 with value: 0.8130645848060124.
[I 2026-06-09 05:57:04,166] Trial 98 finished with value: 0.8107351926134063 and parameters: {'num_nodes': [64, 32], 'dropout': 0.1856383047600453, 'learning_rate': 0.0001069142726625213, 'batch_norm': False}. Best is trial 86 with value: 0.8130645848060124.
[I 2026-06-09 05:57:11,992] A new study created in memory with name: rsf_tuning_tabicl_5_NaN_seed789
[I 2026-06-09 06:03:31,492] Trial 3 finished with value: 0.7670994270349056 and parameters: {'n_estimators': 100, 'max_depth': 5, 'min_samples_split': 8, 'min_samples_leaf': 8, 'max_features': 'log2'}. Best is trial 3 with value: 0.7670994270349056.
[I 2026-06-09 06:08:31,388] Trial 1 finished with value: 0.7718709948986002 and parameters: {'n_estimators': 150, 'max_depth': 7, 'min_samples_split': 17, 'min_samples_leaf': 10, 'max_features': 'log2'}. Best is trial 1 with value: 0.7718709948986002.
[I 2026-06-09 06:08:55,675] Trial 4 finished with value: 0.7538375677464211 and parameters: {'n_estimators': 50, 'max_depth': 3, 'min_samples_split': 17, 'min_samples_leaf': 5, 'max_features': 'sqrt'}. Best is trial 1 with value: 0.7718709948986002.
[I 2026-06-09 06:12:12,084] Trial 5 finished with value: 0.7611341818912875 and parameters: {'n_estimators': 50, 'max_depth': 8, 'min_samples_split': 13, 'min_samples_leaf': 8, 'max_features': 'log2'}. Best is trial 1 with value: 0.7718709948986002.
[I 2026-06-09 06:15:07,065] Trial 6 finished with value: 0.7676734915688689 and parameters: {'n_estimators': 100, 'max_depth': 5, 'min_samples_split': 14, 'min_samples_leaf': 9, 'max_features': 'log2'}. Best is trial 1 with value: 0.7718709948986002.
[I 2026-06-09 06:15:32,948] Trial 2 finished with value: 0.7725159994638923 and parameters: {'n_estimators': 250, 'max_depth': 7, 'min_samples_split': 6, 'min_samples_leaf': 6, 'max_features': 'log2'}. Best is trial 2 with value: 0.7725159994638923.
[I 2026-06-09 06:27:59,052] Trial 7 finished with value: 0.7634223251158077 and parameters: {'n_estimators': 100, 'max_depth': 6, 'min_samples_split': 8, 'min_samples_leaf': 9, 'max_features': 'sqrt'}. Best is trial 2 with value: 0.7725159994638923.
[I 2026-06-09 06:33:13,787] Trial 9 finished with value: 0.7785739116595046 and parameters: {'n_estimators': 250, 'max_depth': 6, 'min_samples_split': 11, 'min_samples_leaf': 6, 'max_features': 'log2'}. Best is trial 9 with value: 0.7785739116595046.
[I 2026-06-09 06:36:00,668] Trial 0 finished with value: 0.7608540865646387 and parameters: {'n_estimators': 250, 'max_depth': 6, 'min_samples_split': 14, 'min_samples_leaf': 15, 'max_features': 'sqrt'}. Best is trial 9 with value: 0.7785739116595046.
[I 2026-06-09 06:37:18,440] Trial 11 finished with value: 0.7390247133080358 and parameters: {'n_estimators': 50, 'max_depth': 9, 'min_samples_split': 8, 'min_samples_leaf': 3, 'max_features': 'log2'}. Best is trial 9 with value: 0.7785739116595046.
[I 2026-06-09 06:38:45,392] Trial 10 finished with value: 0.7776938364368943 and parameters: {'n_estimators': 200, 'max_depth': 4, 'min_samples_split': 18, 'min_samples_leaf': 6, 'max_features': 'log2'}. Best is trial 9 with value: 0.7785739116595046.
[I 2026-06-09 06:39:35,038] Trial 8 finished with value: 0.7636314804111276 and parameters: {'n_estimators': 150, 'max_depth': 10, 'min_samples_split': 17, 'min_samples_leaf': 15, 'max_features': 'sqrt'}. Best is trial 9 with value: 0.7785739116595046.
[I 2026-06-09 06:51:48,508] Trial 14 finished with value: 0.7718406294239355 and parameters: {'n_estimators': 300, 'max_depth': 3, 'min_samples_split': 20, 'min_samples_leaf': 5, 'max_features': 'log2'}. Best is trial 9 with value: 0.7785739116595046.
[I 2026-06-09 06:52:45,681] Trial 15 finished with value: 0.7718406294239355 and parameters: {'n_estimators': 300, 'max_depth': 3, 'min_samples_split': 20, 'min_samples_leaf': 5, 'max_features': 'log2'}. Best is trial 9 with value: 0.7785739116595046.
[I 2026-06-09 07:04:04,514] Trial 12 finished with value: 0.7588620067180994 and parameters: {'n_estimators': 150, 'max_depth': 8, 'min_samples_split': 19, 'min_samples_leaf': 4, 'max_features': 'sqrt'}. Best is trial 9 with value: 0.7785739116595046.
[I 2026-06-09 07:05:43,184] Trial 16 finished with value: 0.7792246751941296 and parameters: {'n_estimators': 200, 'max_depth': 4, 'min_samples_split': 11, 'min_samples_leaf': 12, 'max_features': 'log2'}. Best is trial 16 with value: 0.7792246751941296.
[I 2026-06-09 07:09:42,416] Trial 17 finished with value: 0.7745169795357643 and parameters: {'n_estimators': 200, 'max_depth': 5, 'min_samples_split': 10, 'min_samples_leaf': 12, 'max_features': 'log2'}. Best is trial 16 with value: 0.7792246751941296.
[I 2026-06-09 07:22:41,678] Trial 18 finished with value: 0.7792246751941296 and parameters: {'n_estimators': 200, 'max_depth': 4, 'min_samples_split': 11, 'min_samples_leaf': 12, 'max_features': 'log2'}. Best is trial 16 with value: 0.7792246751941296.
[I 2026-06-09 07:30:43,889] Trial 19 finished with value: 0.777765561782223 and parameters: {'n_estimators': 250, 'max_depth': 5, 'min_samples_split': 11, 'min_samples_leaf': 12, 'max_features': 'log2'}. Best is trial 16 with value: 0.7792246751941296.
[I 2026-06-09 07:31:50,716] Trial 20 finished with value: 0.7798702033020883 and parameters: {'n_estimators': 250, 'max_depth': 4, 'min_samples_split': 11, 'min_samples_leaf': 12, 'max_features': 'log2'}. Best is trial 20 with value: 0.7798702033020883.
[I 2026-06-09 07:40:55,963] Trial 21 finished with value: 0.7808628401980248 and parameters: {'n_estimators': 200, 'max_depth': 4, 'min_samples_split': 11, 'min_samples_leaf': 13, 'max_features': 'log2'}. Best is trial 21 with value: 0.7808628401980248.
[I 2026-06-09 07:43:03,308] Trial 13 finished with value: 0.7655952889536686 and parameters: {'n_estimators': 300, 'max_depth': 10, 'min_samples_split': 20, 'min_samples_leaf': 13, 'max_features': 'sqrt'}. Best is trial 21 with value: 0.7808628401980248.
[I 2026-06-09 07:48:02,602] Trial 22 finished with value: 0.7808628401980248 and parameters: {'n_estimators': 200, 'max_depth': 4, 'min_samples_split': 5, 'min_samples_leaf': 13, 'max_features': 'log2'}. Best is trial 21 with value: 0.7808628401980248.
[I 2026-06-09 07:58:01,264] Trial 23 finished with value: 0.7800911383074075 and parameters: {'n_estimators': 300, 'max_depth': 4, 'min_samples_split': 5, 'min_samples_leaf': 13, 'max_features': 'log2'}. Best is trial 21 with value: 0.7808628401980248.
[I 2026-06-09 07:58:51,612] Trial 24 finished with value: 0.7808628401980248 and parameters: {'n_estimators': 200, 'max_depth': 4, 'min_samples_split': 15, 'min_samples_leaf': 13, 'max_features': 'log2'}. Best is trial 21 with value: 0.7808628401980248.
[I 2026-06-09 08:01:18,523] Trial 25 finished with value: 0.7830009884485546 and parameters: {'n_estimators': 200, 'max_depth': 4, 'min_samples_split': 15, 'min_samples_leaf': 14, 'max_features': 'log2'}. Best is trial 25 with value: 0.7830009884485546.
[I 2026-06-09 08:09:21,284] Trial 26 finished with value: 0.7832538595565384 and parameters: {'n_estimators': 250, 'max_depth': 4, 'min_samples_split': 5, 'min_samples_leaf': 14, 'max_features': 'log2'}. Best is trial 26 with value: 0.7832538595565384.
[I 2026-06-09 08:11:37,287] Trial 29 finished with value: 0.7697451499007363 and parameters: {'n_estimators': 150, 'max_depth': 3, 'min_samples_split': 15, 'min_samples_leaf': 14, 'max_features': 'log2'}. Best is trial 26 with value: 0.7832538595565384.
[I 2026-06-09 08:13:11,517] Trial 28 finished with value: 0.7723806636845676 and parameters: {'n_estimators': 200, 'max_depth': 3, 'min_samples_split': 15, 'min_samples_leaf': 14, 'max_features': 'log2'}. Best is trial 26 with value: 0.7832538595565384.
[I 2026-06-09 08:18:44,189] Trial 27 finished with value: 0.7728620611665368 and parameters: {'n_estimators': 300, 'max_depth': 3, 'min_samples_split': 5, 'min_samples_leaf': 14, 'max_features': 'log2'}. Best is trial 26 with value: 0.7832538595565384.
[I 2026-06-09 08:20:16,367] Trial 30 finished with value: 0.7697451499007363 and parameters: {'n_estimators': 150, 'max_depth': 3, 'min_samples_split': 15, 'min_samples_leaf': 14, 'max_features': 'log2'}. Best is trial 26 with value: 0.7832538595565384.
[I 2026-06-09 08:37:41,678] Trial 31 finished with value: 0.7761818452156577 and parameters: {'n_estimators': 250, 'max_depth': 5, 'min_samples_split': 9, 'min_samples_leaf': 14, 'max_features': 'log2'}. Best is trial 26 with value: 0.7832538595565384.
[I 2026-06-09 08:46:02,392] Trial 34 finished with value: 0.7769802477822733 and parameters: {'n_estimators': 250, 'max_depth': 5, 'min_samples_split': 7, 'min_samples_leaf': 15, 'max_features': 'log2'}. Best is trial 26 with value: 0.7832538595565384.
[I 2026-06-09 09:03:54,148] Trial 35 finished with value: 0.775958816039672 and parameters: {'n_estimators': 250, 'max_depth': 5, 'min_samples_split': 6, 'min_samples_leaf': 11, 'max_features': 'log2'}. Best is trial 26 with value: 0.7832538595565384.
[I 2026-06-09 09:07:57,636] Trial 36 finished with value: 0.7682834187754966 and parameters: {'n_estimators': 200, 'max_depth': 6, 'min_samples_split': 6, 'min_samples_leaf': 11, 'max_features': 'log2'}. Best is trial 26 with value: 0.7832538595565384.
[I 2026-06-09 09:13:30,690] Trial 32 finished with value: 0.7690967423081111 and parameters: {'n_estimators': 250, 'max_depth': 5, 'min_samples_split': 13, 'min_samples_leaf': 15, 'max_features': 'sqrt'}. Best is trial 26 with value: 0.7832538595565384.
[I 2026-06-09 09:20:03,313] Trial 33 finished with value: 0.7608540865646387 and parameters: {'n_estimators': 250, 'max_depth': 6, 'min_samples_split': 13, 'min_samples_leaf': 15, 'max_features': 'sqrt'}. Best is trial 26 with value: 0.7832538595565384.
[I 2026-06-09 09:27:31,630] Trial 39 finished with value: 0.7755190401997001 and parameters: {'n_estimators': 150, 'max_depth': 4, 'min_samples_split': 7, 'min_samples_leaf': 10, 'max_features': 'log2'}. Best is trial 26 with value: 0.7832538595565384.
[I 2026-06-09 09:38:31,405] Trial 40 finished with value: 0.7718709948986002 and parameters: {'n_estimators': 150, 'max_depth': 7, 'min_samples_split': 7, 'min_samples_leaf': 10, 'max_features': 'log2'}. Best is trial 26 with value: 0.7832538595565384.
[I 2026-06-09 09:54:04,898] Trial 41 finished with value: 0.774244737349115 and parameters: {'n_estimators': 200, 'max_depth': 7, 'min_samples_split': 5, 'min_samples_leaf': 11, 'max_features': 'log2'}. Best is trial 26 with value: 0.7832538595565384.
[I 2026-06-09 09:57:16,064] Trial 42 finished with value: 0.7808628401980248 and parameters: {'n_estimators': 200, 'max_depth': 4, 'min_samples_split': 16, 'min_samples_leaf': 13, 'max_features': 'log2'}. Best is trial 26 with value: 0.7832538595565384.
[I 2026-06-09 09:58:09,276] Trial 37 finished with value: 0.7613661112926059 and parameters: {'n_estimators': 200, 'max_depth': 7, 'min_samples_split': 6, 'min_samples_leaf': 10, 'max_features': 'sqrt'}. Best is trial 26 with value: 0.7832538595565384.
[I 2026-06-09 09:59:39,238] Trial 38 finished with value: 0.7639602652057732 and parameters: {'n_estimators': 200, 'max_depth': 7, 'min_samples_split': 13, 'min_samples_leaf': 15, 'max_features': 'sqrt'}. Best is trial 26 with value: 0.7832538595565384.
[I 2026-06-09 10:13:49,640] Trial 43 finished with value: 0.7808628401980248 and parameters: {'n_estimators': 200, 'max_depth': 4, 'min_samples_split': 16, 'min_samples_leaf': 13, 'max_features': 'log2'}. Best is trial 26 with value: 0.7832538595565384.
[I 2026-06-09 10:15:40,421] Trial 44 finished with value: 0.7808628401980248 and parameters: {'n_estimators': 200, 'max_depth': 4, 'min_samples_split': 16, 'min_samples_leaf': 13, 'max_features': 'log2'}. Best is trial 26 with value: 0.7832538595565384.
[I 2026-06-09 10:17:12,525] Trial 45 finished with value: 0.7808628401980248 and parameters: {'n_estimators': 200, 'max_depth': 4, 'min_samples_split': 14, 'min_samples_leaf': 13, 'max_features': 'log2'}. Best is trial 26 with value: 0.7832538595565384.
[I 2026-06-09 10:17:40,808] Trial 46 finished with value: 0.7808628401980248 and parameters: {'n_estimators': 200, 'max_depth': 4, 'min_samples_split': 16, 'min_samples_leaf': 13, 'max_features': 'log2'}. Best is trial 26 with value: 0.7832538595565384.
[I 2026-06-09 10:22:13,180] Trial 47 finished with value: 0.7720484758625888 and parameters: {'n_estimators': 100, 'max_depth': 4, 'min_samples_split': 14, 'min_samples_leaf': 13, 'max_features': 'log2'}. Best is trial 26 with value: 0.7832538595565384.
[I 2026-06-09 10:25:29,364] Trial 48 finished with value: 0.7672078003668987 and parameters: {'n_estimators': 100, 'max_depth': 5, 'min_samples_split': 14, 'min_samples_leaf': 14, 'max_features': 'log2'}. Best is trial 26 with value: 0.7832538595565384.
[I 2026-06-09 10:27:19,364] Trial 49 finished with value: 0.7675305644208781 and parameters: {'n_estimators': 100, 'max_depth': 5, 'min_samples_split': 18, 'min_samples_leaf': 8, 'max_features': 'log2'}. Best is trial 26 with value: 0.7832538595565384.
[I 2026-06-09 10:28:25,379] Trial 50 finished with value: 0.7697671386927349 and parameters: {'n_estimators': 150, 'max_depth': 3, 'min_samples_split': 18, 'min_samples_leaf': 8, 'max_features': 'log2'}. Best is trial 26 with value: 0.7832538595565384.
[I 2026-06-09 10:33:58,597] Trial 51 finished with value: 0.7697671386927349 and parameters: {'n_estimators': 150, 'max_depth': 3, 'min_samples_split': 18, 'min_samples_leaf': 8, 'max_features': 'log2'}. Best is trial 26 with value: 0.7832538595565384.
[I 2026-06-09 10:36:53,551] Trial 52 finished with value: 0.770239374178038 and parameters: {'n_estimators': 150, 'max_depth': 3, 'min_samples_split': 18, 'min_samples_leaf': 11, 'max_features': 'log2'}. Best is trial 26 with value: 0.7832538595565384.
[I 2026-06-09 10:47:20,528] Trial 53 finished with value: 0.7724602421698958 and parameters: {'n_estimators': 250, 'max_depth': 3, 'min_samples_split': 12, 'min_samples_leaf': 11, 'max_features': 'log2'}. Best is trial 26 with value: 0.7832538595565384.
[I 2026-06-09 10:51:37,461] Trial 54 finished with value: 0.7832538595565384 and parameters: {'n_estimators': 250, 'max_depth': 4, 'min_samples_split': 17, 'min_samples_leaf': 14, 'max_features': 'log2'}. Best is trial 26 with value: 0.7832538595565384.
[I 2026-06-09 10:58:21,166] Trial 55 finished with value: 0.7832538595565384 and parameters: {'n_estimators': 250, 'max_depth': 4, 'min_samples_split': 17, 'min_samples_leaf': 14, 'max_features': 'log2'}. Best is trial 26 with value: 0.7832538595565384.
[I 2026-06-09 11:01:06,016] Trial 56 finished with value: 0.7798702033020883 and parameters: {'n_estimators': 250, 'max_depth': 4, 'min_samples_split': 17, 'min_samples_leaf': 12, 'max_features': 'log2'}. Best is trial 26 with value: 0.7832538595565384.
[I 2026-06-09 11:07:20,983] Trial 57 finished with value: 0.7792246751941296 and parameters: {'n_estimators': 200, 'max_depth': 4, 'min_samples_split': 16, 'min_samples_leaf': 12, 'max_features': 'log2'}. Best is trial 26 with value: 0.7832538595565384.
[I 2026-06-09 11:25:06,541] Trial 58 finished with value: 0.7680470392615116 and parameters: {'n_estimators': 250, 'max_depth': 9, 'min_samples_split': 17, 'min_samples_leaf': 14, 'max_features': 'log2'}. Best is trial 26 with value: 0.7832538595565384.
[I 2026-06-09 11:27:57,040] Trial 60 finished with value: 0.7761818452156577 and parameters: {'n_estimators': 250, 'max_depth': 5, 'min_samples_split': 19, 'min_samples_leaf': 14, 'max_features': 'log2'}. Best is trial 26 with value: 0.7832538595565384.
[I 2026-06-09 11:32:35,916] Trial 59 finished with value: 0.7680470392615116 and parameters: {'n_estimators': 250, 'max_depth': 9, 'min_samples_split': 17, 'min_samples_leaf': 14, 'max_features': 'log2'}. Best is trial 26 with value: 0.7832538595565384.
[I 2026-06-09 11:38:51,271] Trial 61 finished with value: 0.774577186942427 and parameters: {'n_estimators': 300, 'max_depth': 5, 'min_samples_split': 17, 'min_samples_leaf': 14, 'max_features': 'log2'}. Best is trial 26 with value: 0.7832538595565384.
[I 2026-06-09 11:58:45,414] Trial 64 finished with value: 0.7811382236406739 and parameters: {'n_estimators': 300, 'max_depth': 4, 'min_samples_split': 19, 'min_samples_leaf': 15, 'max_features': 'log2'}. Best is trial 26 with value: 0.7832538595565384.
[I 2026-06-09 12:01:05,461] Trial 65 finished with value: 0.7829151274512267 and parameters: {'n_estimators': 250, 'max_depth': 4, 'min_samples_split': 19, 'min_samples_leaf': 15, 'max_features': 'log2'}. Best is trial 26 with value: 0.7832538595565384.
[I 2026-06-09 12:25:45,752] Trial 66 finished with value: 0.7811382236406739 and parameters: {'n_estimators': 300, 'max_depth': 4, 'min_samples_split': 19, 'min_samples_leaf': 15, 'max_features': 'log2'}. Best is trial 26 with value: 0.7832538595565384.
[I 2026-06-09 12:27:33,116] Trial 67 finished with value: 0.7811382236406739 and parameters: {'n_estimators': 300, 'max_depth': 4, 'min_samples_split': 19, 'min_samples_leaf': 15, 'max_features': 'log2'}. Best is trial 26 with value: 0.7832538595565384.
