[I 2026-06-07 00:20:06,055] Trial 95 finished with value: 0.8013853506997546 and parameters: {'num_nodes': [64, 32], 'dropout': 0.24471381775936202, 'learning_rate': 0.0001410108938418711, 'batch_norm': False}. Best is trial 13 with value: 0.8124644084489007.
/scratch.hpc/luca.cotugno/Foundation_model_clinical_data/test_tabular_model_tmp.py:476: UserWarning: Choices for a categorical distribution should be a tuple of None, bool, int, float and str for persistent storage but contains [32] which is of type list.
  num_nodes  = trial.suggest_categorical("num_nodes", [[32], [64], [128], [64, 32], [128, 64]])
/scratch.hpc/luca.cotugno/Foundation_model_clinical_data/test_tabular_model_tmp.py:476: UserWarning: Choices for a categorical distribution should be a tuple of None, bool, int, float and str for persistent storage but contains [64] which is of type list.
  num_nodes  = trial.suggest_categorical("num_nodes", [[32], [64], [128], [64, 32], [128, 64]])
/scratch.hpc/luca.cotugno/Foundation_model_clinical_data/test_tabular_model_tmp.py:476: UserWarning: Choices for a categorical distribution should be a tuple of None, bool, int, float and str for persistent storage but contains [128] which is of type list.
  num_nodes  = trial.suggest_categorical("num_nodes", [[32], [64], [128], [64, 32], [128, 64]])
/scratch.hpc/luca.cotugno/Foundation_model_clinical_data/test_tabular_model_tmp.py:476: UserWarning: Choices for a categorical distribution should be a tuple of None, bool, int, float and str for persistent storage but contains [64, 32] which is of type list.
  num_nodes  = trial.suggest_categorical("num_nodes", [[32], [64], [128], [64, 32], [128, 64]])
/scratch.hpc/luca.cotugno/Foundation_model_clinical_data/test_tabular_model_tmp.py:476: UserWarning: Choices for a categorical distribution should be a tuple of None, bool, int, float and str for persistent storage but contains [128, 64] which is of type list.
  num_nodes  = trial.suggest_categorical("num_nodes", [[32], [64], [128], [64, 32], [128, 64]])
[I 2026-06-07 00:20:11,744] Trial 96 finished with value: 0.8091329872125478 and parameters: {'num_nodes': [64, 32], 'dropout': 0.2411472377465297, 'learning_rate': 0.00013940778176154903, 'batch_norm': False}. Best is trial 13 with value: 0.8124644084489007.
[I 2026-06-07 00:20:27,608] Trial 97 finished with value: 0.8108226424208606 and parameters: {'num_nodes': [64, 32], 'dropout': 0.27856172498420745, 'learning_rate': 0.0001142774068039156, 'batch_norm': False}. Best is trial 13 with value: 0.8124644084489007.
[I 2026-06-07 00:20:38,138] Trial 99 finished with value: 0.789784717313292 and parameters: {'num_nodes': [64], 'dropout': 0.28097031311736176, 'learning_rate': 0.00011413110225493675, 'batch_norm': False}. Best is trial 13 with value: 0.8124644084489007.
[I 2026-06-07 00:20:45,497] Trial 98 finished with value: 0.7960077080758856 and parameters: {'num_nodes': [64, 32], 'dropout': 0.24218763276117827, 'learning_rate': 0.0003643656587549444, 'batch_norm': False}. Best is trial 13 with value: 0.8124644084489007.
[I 2026-06-07 00:20:54,601] A new study created in memory with name: rsf_tuning_tabicl_4_NaN_seed77
[I 2026-06-07 00:35:41,445] Trial 2 finished with value: 0.7677172073815328 and parameters: {'n_estimators': 200, 'max_depth': 6, 'min_samples_split': 15, 'min_samples_leaf': 12, 'max_features': 'log2'}. Best is trial 2 with value: 0.7677172073815328.
[I 2026-06-07 00:38:22,762] Trial 1 finished with value: 0.7485262273934277 and parameters: {'n_estimators': 100, 'max_depth': 9, 'min_samples_split': 14, 'min_samples_leaf': 11, 'max_features': 'sqrt'}. Best is trial 2 with value: 0.7677172073815328.
[I 2026-06-07 00:49:48,252] Trial 4 finished with value: 0.7707385721106728 and parameters: {'n_estimators': 250, 'max_depth': 4, 'min_samples_split': 12, 'min_samples_leaf': 4, 'max_features': 'log2'}. Best is trial 4 with value: 0.7707385721106728.
[I 2026-06-07 00:59:22,397] Trial 3 finished with value: 0.7540485554410742 and parameters: {'n_estimators': 200, 'max_depth': 9, 'min_samples_split': 12, 'min_samples_leaf': 6, 'max_features': 'sqrt'}. Best is trial 4 with value: 0.7707385721106728.
[I 2026-06-07 01:10:04,064] Trial 6 finished with value: 0.77380234379581 and parameters: {'n_estimators': 300, 'max_depth': 5, 'min_samples_split': 15, 'min_samples_leaf': 8, 'max_features': 'log2'}. Best is trial 6 with value: 0.77380234379581.
[I 2026-06-07 01:13:55,476] Trial 5 finished with value: 0.7563607816282596 and parameters: {'n_estimators': 250, 'max_depth': 4, 'min_samples_split': 19, 'min_samples_leaf': 3, 'max_features': 'sqrt'}. Best is trial 6 with value: 0.77380234379581.
[I 2026-06-07 01:18:07,600] Trial 0 finished with value: 0.7566385210129085 and parameters: {'n_estimators': 300, 'max_depth': 9, 'min_samples_split': 7, 'min_samples_leaf': 9, 'max_features': 'sqrt'}. Best is trial 6 with value: 0.77380234379581.
[I 2026-06-07 01:19:20,379] Trial 9 finished with value: 0.7282397343753927 and parameters: {'n_estimators': 50, 'max_depth': 3, 'min_samples_split': 15, 'min_samples_leaf': 15, 'max_features': 'sqrt'}. Best is trial 6 with value: 0.77380234379581.
[I 2026-06-07 01:26:40,370] Trial 7 finished with value: 0.7440439168530478 and parameters: {'n_estimators': 150, 'max_depth': 8, 'min_samples_split': 11, 'min_samples_leaf': 9, 'max_features': 'sqrt'}. Best is trial 6 with value: 0.77380234379581.
[I 2026-06-07 01:38:21,723] Trial 11 finished with value: 0.7663078305229563 and parameters: {'n_estimators': 250, 'max_depth': 7, 'min_samples_split': 14, 'min_samples_leaf': 10, 'max_features': 'log2'}. Best is trial 6 with value: 0.77380234379581.
[I 2026-06-07 01:39:07,764] Trial 10 finished with value: 0.767484230894881 and parameters: {'n_estimators': 250, 'max_depth': 10, 'min_samples_split': 12, 'min_samples_leaf': 12, 'max_features': 'log2'}. Best is trial 6 with value: 0.77380234379581.
[I 2026-06-07 01:52:55,598] Trial 12 finished with value: 0.7672072768242321 and parameters: {'n_estimators': 300, 'max_depth': 10, 'min_samples_split': 5, 'min_samples_leaf': 9, 'max_features': 'log2'}. Best is trial 6 with value: 0.77380234379581.
[I 2026-06-07 01:58:21,045] Trial 14 finished with value: 0.7719783211452601 and parameters: {'n_estimators': 300, 'max_depth': 5, 'min_samples_split': 19, 'min_samples_leaf': 5, 'max_features': 'log2'}. Best is trial 6 with value: 0.77380234379581.
[I 2026-06-07 01:59:34,782] Trial 13 finished with value: 0.7715181271412895 and parameters: {'n_estimators': 300, 'max_depth': 6, 'min_samples_split': 20, 'min_samples_leaf': 6, 'max_features': 'log2'}. Best is trial 6 with value: 0.77380234379581.
[I 2026-06-07 02:05:34,013] Trial 8 finished with value: 0.7584169954514614 and parameters: {'n_estimators': 300, 'max_depth': 9, 'min_samples_split': 13, 'min_samples_leaf': 6, 'max_features': 'sqrt'}. Best is trial 6 with value: 0.77380234379581.
[I 2026-06-07 02:11:42,408] Trial 15 finished with value: 0.7721154893239179 and parameters: {'n_estimators': 300, 'max_depth': 5, 'min_samples_split': 18, 'min_samples_leaf': 5, 'max_features': 'log2'}. Best is trial 6 with value: 0.77380234379581.
[I 2026-06-07 02:15:08,039] Trial 18 finished with value: 0.7559961341609496 and parameters: {'n_estimators': 150, 'max_depth': 5, 'min_samples_split': 18, 'min_samples_leaf': 5, 'max_features': 'log2'}. Best is trial 6 with value: 0.77380234379581.
[I 2026-06-07 02:17:25,681] Trial 16 finished with value: 0.7720851238492532 and parameters: {'n_estimators': 300, 'max_depth': 5, 'min_samples_split': 20, 'min_samples_leaf': 6, 'max_features': 'log2'}. Best is trial 6 with value: 0.77380234379581.
[I 2026-06-07 02:18:29,152] Trial 17 finished with value: 0.771730161921276 and parameters: {'n_estimators': 300, 'max_depth': 5, 'min_samples_split': 18, 'min_samples_leaf': 6, 'max_features': 'log2'}. Best is trial 6 with value: 0.77380234379581.
[I 2026-06-07 02:21:13,596] Trial 19 finished with value: 0.7576227812261788 and parameters: {'n_estimators': 150, 'max_depth': 5, 'min_samples_split': 17, 'min_samples_leaf': 7, 'max_features': 'log2'}. Best is trial 6 with value: 0.77380234379581.
[I 2026-06-07 02:23:57,748] Trial 20 finished with value: 0.7638429916484474 and parameters: {'n_estimators': 200, 'max_depth': 3, 'min_samples_split': 17, 'min_samples_leaf': 7, 'max_features': 'log2'}. Best is trial 6 with value: 0.77380234379581.
[I 2026-06-07 02:26:16,305] Trial 21 finished with value: 0.7644466363430754 and parameters: {'n_estimators': 200, 'max_depth': 3, 'min_samples_split': 17, 'min_samples_leaf': 8, 'max_features': 'log2'}. Best is trial 6 with value: 0.77380234379581.
[I 2026-06-07 02:27:08,877] Trial 22 finished with value: 0.7644466363430754 and parameters: {'n_estimators': 200, 'max_depth': 3, 'min_samples_split': 17, 'min_samples_leaf': 8, 'max_features': 'log2'}. Best is trial 6 with value: 0.77380234379581.
[I 2026-06-07 02:30:03,198] Trial 23 finished with value: 0.7641173280057632 and parameters: {'n_estimators': 200, 'max_depth': 3, 'min_samples_split': 10, 'min_samples_leaf': 8, 'max_features': 'log2'}. Best is trial 6 with value: 0.77380234379581.
[I 2026-06-07 02:37:46,020] Trial 24 finished with value: 0.769734940818737 and parameters: {'n_estimators': 250, 'max_depth': 4, 'min_samples_split': 16, 'min_samples_leaf': 8, 'max_features': 'log2'}. Best is trial 6 with value: 0.77380234379581.
[I 2026-06-07 02:46:17,485] Trial 25 finished with value: 0.7658884728469831 and parameters: {'n_estimators': 250, 'max_depth': 7, 'min_samples_split': 20, 'min_samples_leaf': 3, 'max_features': 'log2'}. Best is trial 6 with value: 0.77380234379581.
[I 2026-06-07 02:46:43,836] Trial 26 finished with value: 0.7695490831720821 and parameters: {'n_estimators': 250, 'max_depth': 7, 'min_samples_split': 20, 'min_samples_leaf': 4, 'max_features': 'log2'}. Best is trial 6 with value: 0.77380234379581.
[I 2026-06-07 02:49:44,918] Trial 27 finished with value: 0.7658884728469831 and parameters: {'n_estimators': 250, 'max_depth': 7, 'min_samples_split': 20, 'min_samples_leaf': 3, 'max_features': 'log2'}. Best is trial 6 with value: 0.77380234379581.
[I 2026-06-07 02:55:54,241] Trial 28 finished with value: 0.7658523484029854 and parameters: {'n_estimators': 250, 'max_depth': 6, 'min_samples_split': 20, 'min_samples_leaf': 3, 'max_features': 'log2'}. Best is trial 6 with value: 0.77380234379581.
[I 2026-06-07 03:07:58,669] Trial 30 finished with value: 0.7677669439348629 and parameters: {'n_estimators': 300, 'max_depth': 6, 'min_samples_split': 9, 'min_samples_leaf': 5, 'max_features': 'log2'}. Best is trial 6 with value: 0.77380234379581.
[I 2026-06-07 03:08:08,716] Trial 29 finished with value: 0.770160057464043 and parameters: {'n_estimators': 300, 'max_depth': 6, 'min_samples_split': 20, 'min_samples_leaf': 4, 'max_features': 'log2'}. Best is trial 6 with value: 0.77380234379581.
[I 2026-06-07 03:11:30,145] Trial 31 finished with value: 0.7696312793707436 and parameters: {'n_estimators': 300, 'max_depth': 6, 'min_samples_split': 18, 'min_samples_leaf': 5, 'max_features': 'log2'}. Best is trial 6 with value: 0.77380234379581.
[I 2026-06-07 03:12:33,776] Trial 32 finished with value: 0.7768106199582842 and parameters: {'n_estimators': 300, 'max_depth': 4, 'min_samples_split': 8, 'min_samples_leaf': 5, 'max_features': 'log2'}. Best is trial 32 with value: 0.7768106199582842.
[I 2026-06-07 03:23:58,901] Trial 33 finished with value: 0.7732144053811809 and parameters: {'n_estimators': 300, 'max_depth': 4, 'min_samples_split': 16, 'min_samples_leaf': 7, 'max_features': 'log2'}. Best is trial 32 with value: 0.7768106199582842.
[I 2026-06-07 03:27:07,338] Trial 34 finished with value: 0.7721154893239179 and parameters: {'n_estimators': 300, 'max_depth': 5, 'min_samples_split': 18, 'min_samples_leaf': 5, 'max_features': 'log2'}. Best is trial 32 with value: 0.7768106199582842.
[I 2026-06-07 03:28:58,060] Trial 36 finished with value: 0.7724531743438964 and parameters: {'n_estimators': 300, 'max_depth': 4, 'min_samples_split': 7, 'min_samples_leaf': 7, 'max_features': 'log2'}. Best is trial 32 with value: 0.7768106199582842.
[I 2026-06-07 03:30:37,881] Trial 35 finished with value: 0.7703501034520309 and parameters: {'n_estimators': 300, 'max_depth': 5, 'min_samples_split': 19, 'min_samples_leaf': 7, 'max_features': 'log2'}. Best is trial 32 with value: 0.7768106199582842.
[I 2026-06-07 03:30:38,027] Trial 37 finished with value: 0.7421222534951708 and parameters: {'n_estimators': 50, 'max_depth': 4, 'min_samples_split': 7, 'min_samples_leaf': 7, 'max_features': 'sqrt'}. Best is trial 32 with value: 0.7768106199582842.
[I 2026-06-07 03:33:49,344] Trial 38 finished with value: 0.7421222534951708 and parameters: {'n_estimators': 50, 'max_depth': 4, 'min_samples_split': 7, 'min_samples_leaf': 7, 'max_features': 'sqrt'}. Best is trial 32 with value: 0.7768106199582842.
[I 2026-06-07 03:35:36,815] Trial 39 finished with value: 0.7421222534951708 and parameters: {'n_estimators': 50, 'max_depth': 4, 'min_samples_split': 7, 'min_samples_leaf': 7, 'max_features': 'sqrt'}. Best is trial 32 with value: 0.7768106199582842.
[I 2026-06-07 03:41:05,034] Trial 43 finished with value: 0.7679889260255154 and parameters: {'n_estimators': 100, 'max_depth': 4, 'min_samples_split': 5, 'min_samples_leaf': 11, 'max_features': 'log2'}. Best is trial 32 with value: 0.7768106199582842.
[I 2026-06-07 03:47:29,362] Trial 42 finished with value: 0.7425764267584751 and parameters: {'n_estimators': 100, 'max_depth': 4, 'min_samples_split': 8, 'min_samples_leaf': 10, 'max_features': 'sqrt'}. Best is trial 32 with value: 0.7768106199582842.
[I 2026-06-07 03:57:14,015] Trial 44 finished with value: 0.7738070556798097 and parameters: {'n_estimators': 300, 'max_depth': 4, 'min_samples_split': 15, 'min_samples_leaf': 9, 'max_features': 'log2'}. Best is trial 32 with value: 0.7768106199582842.
[I 2026-06-07 04:03:40,674] Trial 41 finished with value: 0.7565756958929125 and parameters: {'n_estimators': 250, 'max_depth': 4, 'min_samples_split': 7, 'min_samples_leaf': 10, 'max_features': 'sqrt'}. Best is trial 32 with value: 0.7768106199582842.
[I 2026-06-07 04:03:46,606] Trial 40 finished with value: 0.7565756958929125 and parameters: {'n_estimators': 250, 'max_depth': 4, 'min_samples_split': 7, 'min_samples_leaf': 10, 'max_features': 'sqrt'}. Best is trial 32 with value: 0.7768106199582842.
[I 2026-06-07 04:04:01,340] Trial 45 finished with value: 0.7726322259358849 and parameters: {'n_estimators': 300, 'max_depth': 4, 'min_samples_split': 14, 'min_samples_leaf': 4, 'max_features': 'log2'}. Best is trial 32 with value: 0.7768106199582842.
[I 2026-06-07 04:10:54,776] Trial 46 finished with value: 0.7717935105839385 and parameters: {'n_estimators': 250, 'max_depth': 4, 'min_samples_split': 14, 'min_samples_leaf': 10, 'max_features': 'log2'}. Best is trial 32 with value: 0.7768106199582842.
[I 2026-06-07 04:16:46,847] Trial 47 finished with value: 0.7715422101039546 and parameters: {'n_estimators': 300, 'max_depth': 3, 'min_samples_split': 14, 'min_samples_leaf': 9, 'max_features': 'log2'}. Best is trial 32 with value: 0.7768106199582842.
[I 2026-06-07 04:16:57,263] Trial 48 finished with value: 0.7715422101039546 and parameters: {'n_estimators': 300, 'max_depth': 3, 'min_samples_split': 14, 'min_samples_leaf': 9, 'max_features': 'log2'}. Best is trial 32 with value: 0.7768106199582842.
[I 2026-06-07 04:17:30,557] Trial 49 finished with value: 0.7748525703850762 and parameters: {'n_estimators': 300, 'max_depth': 3, 'min_samples_split': 14, 'min_samples_leaf': 15, 'max_features': 'log2'}. Best is trial 32 with value: 0.7768106199582842.
[I 2026-06-07 04:23:57,784] Trial 50 finished with value: 0.7741667294917867 and parameters: {'n_estimators': 300, 'max_depth': 3, 'min_samples_split': 13, 'min_samples_leaf': 13, 'max_features': 'log2'}. Best is trial 32 with value: 0.7768106199582842.
[I 2026-06-07 04:29:45,969] Trial 51 finished with value: 0.7741667294917867 and parameters: {'n_estimators': 300, 'max_depth': 3, 'min_samples_split': 13, 'min_samples_leaf': 13, 'max_features': 'log2'}. Best is trial 32 with value: 0.7768106199582842.
[I 2026-06-07 04:31:03,383] Trial 53 finished with value: 0.7748525703850762 and parameters: {'n_estimators': 300, 'max_depth': 3, 'min_samples_split': 15, 'min_samples_leaf': 15, 'max_features': 'log2'}. Best is trial 32 with value: 0.7768106199582842.
[I 2026-06-07 04:36:21,385] Trial 52 finished with value: 0.7715176035986229 and parameters: {'n_estimators': 300, 'max_depth': 5, 'min_samples_split': 13, 'min_samples_leaf': 4, 'max_features': 'log2'}. Best is trial 32 with value: 0.7768106199582842.
[I 2026-06-07 04:36:59,114] Trial 54 finished with value: 0.7748525703850762 and parameters: {'n_estimators': 300, 'max_depth': 3, 'min_samples_split': 15, 'min_samples_leaf': 15, 'max_features': 'log2'}. Best is trial 32 with value: 0.7768106199582842.
[I 2026-06-07 04:42:51,429] Trial 55 finished with value: 0.7748525703850762 and parameters: {'n_estimators': 300, 'max_depth': 3, 'min_samples_split': 13, 'min_samples_leaf': 15, 'max_features': 'log2'}. Best is trial 32 with value: 0.7768106199582842.
[I 2026-06-07 04:44:16,053] Trial 56 finished with value: 0.7748525703850762 and parameters: {'n_estimators': 300, 'max_depth': 3, 'min_samples_split': 13, 'min_samples_leaf': 15, 'max_features': 'log2'}. Best is trial 32 with value: 0.7768106199582842.
[I 2026-06-07 04:49:37,431] Trial 57 finished with value: 0.7748525703850762 and parameters: {'n_estimators': 300, 'max_depth': 3, 'min_samples_split': 11, 'min_samples_leaf': 15, 'max_features': 'log2'}. Best is trial 32 with value: 0.7768106199582842.
[I 2026-06-07 04:50:02,045] Trial 58 finished with value: 0.7748525703850762 and parameters: {'n_estimators': 300, 'max_depth': 3, 'min_samples_split': 11, 'min_samples_leaf': 15, 'max_features': 'log2'}. Best is trial 32 with value: 0.7768106199582842.
[I 2026-06-07 04:55:12,632] Trial 60 finished with value: 0.7722882584039069 and parameters: {'n_estimators': 250, 'max_depth': 3, 'min_samples_split': 11, 'min_samples_leaf': 15, 'max_features': 'log2'}. Best is trial 32 with value: 0.7768106199582842.
[I 2026-06-07 04:55:47,891] Trial 59 finished with value: 0.7748525703850762 and parameters: {'n_estimators': 300, 'max_depth': 3, 'min_samples_split': 11, 'min_samples_leaf': 15, 'max_features': 'log2'}. Best is trial 32 with value: 0.7768106199582842.
[I 2026-06-07 05:00:42,663] Trial 61 finished with value: 0.7723673133465685 and parameters: {'n_estimators': 250, 'max_depth': 3, 'min_samples_split': 12, 'min_samples_leaf': 14, 'max_features': 'log2'}. Best is trial 32 with value: 0.7768106199582842.
[I 2026-06-07 05:00:59,348] Trial 62 finished with value: 0.7723673133465685 and parameters: {'n_estimators': 250, 'max_depth': 3, 'min_samples_split': 15, 'min_samples_leaf': 14, 'max_features': 'log2'}. Best is trial 32 with value: 0.7768106199582842.
[I 2026-06-07 05:06:07,745] Trial 63 finished with value: 0.7723673133465685 and parameters: {'n_estimators': 250, 'max_depth': 3, 'min_samples_split': 12, 'min_samples_leaf': 14, 'max_features': 'log2'}. Best is trial 32 with value: 0.7768106199582842.
[I 2026-06-07 05:08:53,378] Trial 64 finished with value: 0.7745761398570938 and parameters: {'n_estimators': 300, 'max_depth': 3, 'min_samples_split': 12, 'min_samples_leaf': 14, 'max_features': 'log2'}. Best is trial 32 with value: 0.7768106199582842.
[I 2026-06-07 05:13:59,767] Trial 65 finished with value: 0.7745761398570938 and parameters: {'n_estimators': 300, 'max_depth': 3, 'min_samples_split': 16, 'min_samples_leaf': 14, 'max_features': 'log2'}. Best is trial 32 with value: 0.7768106199582842.
[I 2026-06-07 05:14:02,676] Trial 66 finished with value: 0.7745761398570938 and parameters: {'n_estimators': 300, 'max_depth': 3, 'min_samples_split': 16, 'min_samples_leaf': 14, 'max_features': 'log2'}. Best is trial 32 with value: 0.7768106199582842.
[I 2026-06-07 05:19:40,300] Trial 67 finished with value: 0.7745761398570938 and parameters: {'n_estimators': 300, 'max_depth': 3, 'min_samples_split': 16, 'min_samples_leaf': 14, 'max_features': 'log2'}. Best is trial 32 with value: 0.7768106199582842.
[I 2026-06-07 05:21:51,780] Trial 68 finished with value: 0.7741667294917867 and parameters: {'n_estimators': 300, 'max_depth': 3, 'min_samples_split': 16, 'min_samples_leaf': 13, 'max_features': 'log2'}. Best is trial 32 with value: 0.7768106199582842.
[I 2026-06-07 05:27:24,630] Trial 70 finished with value: 0.7741667294917867 and parameters: {'n_estimators': 300, 'max_depth': 3, 'min_samples_split': 10, 'min_samples_leaf': 13, 'max_features': 'log2'}. Best is trial 32 with value: 0.7768106199582842.
[I 2026-06-07 05:32:45,910] Trial 71 finished with value: 0.7748525703850762 and parameters: {'n_estimators': 300, 'max_depth': 3, 'min_samples_split': 10, 'min_samples_leaf': 15, 'max_features': 'log2'}. Best is trial 32 with value: 0.7768106199582842.
[I 2026-06-07 05:38:46,411] Trial 69 finished with value: 0.7760938900476633 and parameters: {'n_estimators': 300, 'max_depth': 8, 'min_samples_split': 15, 'min_samples_leaf': 13, 'max_features': 'log2'}. Best is trial 32 with value: 0.7768106199582842.
[I 2026-06-07 05:45:39,488] Trial 72 finished with value: 0.7775006491929066 and parameters: {'n_estimators': 300, 'max_depth': 8, 'min_samples_split': 15, 'min_samples_leaf': 15, 'max_features': 'log2'}. Best is trial 72 with value: 0.7775006491929066.
[I 2026-06-07 05:45:52,557] Trial 74 finished with value: 0.7748525703850762 and parameters: {'n_estimators': 300, 'max_depth': 3, 'min_samples_split': 13, 'min_samples_leaf': 15, 'max_features': 'log2'}. Best is trial 72 with value: 0.7775006491929066.
