[I 2026-07-01 05:05:57,897] Trial 70 finished with value: 0.8216562376967473 and parameters: {'n_estimators': 300, 'max_depth': 4, 'min_samples_split': 17, 'min_samples_leaf': 14, 'max_features': 'log2'}. Best is trial 54 with value: 0.8236388937752871.
[I 2026-07-01 05:06:37,024] Trial 71 finished with value: 0.8211866199247774 and parameters: {'n_estimators': 300, 'max_depth': 4, 'min_samples_split': 11, 'min_samples_leaf': 9, 'max_features': 'log2'}. Best is trial 54 with value: 0.8236388937752871.
[I 2026-07-01 05:09:19,239] Trial 72 finished with value: 0.823150952009985 and parameters: {'n_estimators': 300, 'max_depth': 5, 'min_samples_split': 17, 'min_samples_leaf': 14, 'max_features': 'log2'}. Best is trial 54 with value: 0.8236388937752871.
[I 2026-07-01 05:16:30,238] Trial 76 finished with value: 0.8228729508540028 and parameters: {'n_estimators': 250, 'max_depth': 5, 'min_samples_split': 15, 'min_samples_leaf': 9, 'max_features': 'log2'}. Best is trial 54 with value: 0.8236388937752871.
[I 2026-07-01 05:16:30,855] Trial 73 finished with value: 0.8233043500113085 and parameters: {'n_estimators': 300, 'max_depth': 5, 'min_samples_split': 17, 'min_samples_leaf': 9, 'max_features': 'log2'}. Best is trial 54 with value: 0.8236388937752871.
[I 2026-07-01 05:17:59,423] Trial 74 finished with value: 0.8233043500113085 and parameters: {'n_estimators': 300, 'max_depth': 5, 'min_samples_split': 11, 'min_samples_leaf': 9, 'max_features': 'log2'}. Best is trial 54 with value: 0.8236388937752871.
[I 2026-07-01 05:18:19,547] Trial 77 finished with value: 0.8228729508540028 and parameters: {'n_estimators': 250, 'max_depth': 5, 'min_samples_split': 11, 'min_samples_leaf': 9, 'max_features': 'log2'}. Best is trial 54 with value: 0.8236388937752871.
[I 2026-07-01 05:18:39,829] Trial 78 finished with value: 0.8228729508540028 and parameters: {'n_estimators': 250, 'max_depth': 5, 'min_samples_split': 15, 'min_samples_leaf': 9, 'max_features': 'log2'}. Best is trial 54 with value: 0.8236388937752871.
[I 2026-07-01 05:21:08,602] Trial 79 finished with value: 0.8234446594459662 and parameters: {'n_estimators': 250, 'max_depth': 5, 'min_samples_split': 15, 'min_samples_leaf': 12, 'max_features': 'log2'}. Best is trial 54 with value: 0.8236388937752871.
[I 2026-07-01 05:23:02,976] Trial 80 finished with value: 0.822167738882048 and parameters: {'n_estimators': 250, 'max_depth': 6, 'min_samples_split': 19, 'min_samples_leaf': 12, 'max_features': 'log2'}. Best is trial 54 with value: 0.8236388937752871.
[I 2026-07-01 05:25:48,653] Trial 81 finished with value: 0.822167738882048 and parameters: {'n_estimators': 250, 'max_depth': 6, 'min_samples_split': 15, 'min_samples_leaf': 12, 'max_features': 'log2'}. Best is trial 54 with value: 0.8236388937752871.
[I 2026-07-01 06:01:17,620] Trial 87 finished with value: 0.8211368833714472 and parameters: {'n_estimators': 200, 'max_depth': 6, 'min_samples_split': 20, 'min_samples_leaf': 11, 'max_features': 'sqrt'}. Best is trial 54 with value: 0.8236388937752871.
[I 2026-07-01 06:05:49,787] Trial 82 finished with value: 0.8242174084219167 and parameters: {'n_estimators': 250, 'max_depth': 6, 'min_samples_split': 19, 'min_samples_leaf': 12, 'max_features': 'sqrt'}. Best is trial 82 with value: 0.8242174084219167.
[I 2026-07-01 06:05:56,537] Trial 83 finished with value: 0.8242174084219167 and parameters: {'n_estimators': 250, 'max_depth': 6, 'min_samples_split': 19, 'min_samples_leaf': 12, 'max_features': 'sqrt'}. Best is trial 82 with value: 0.8242174084219167.
[I 2026-07-01 06:07:27,698] Trial 84 finished with value: 0.8242174084219167 and parameters: {'n_estimators': 250, 'max_depth': 6, 'min_samples_split': 19, 'min_samples_leaf': 12, 'max_features': 'sqrt'}. Best is trial 82 with value: 0.8242174084219167.
[I 2026-07-01 06:07:36,634] Trial 85 finished with value: 0.8242174084219167 and parameters: {'n_estimators': 250, 'max_depth': 6, 'min_samples_split': 19, 'min_samples_leaf': 12, 'max_features': 'sqrt'}. Best is trial 82 with value: 0.8242174084219167.
[I 2026-07-01 06:08:04,604] Trial 86 finished with value: 0.8242174084219167 and parameters: {'n_estimators': 250, 'max_depth': 6, 'min_samples_split': 19, 'min_samples_leaf': 12, 'max_features': 'sqrt'}. Best is trial 82 with value: 0.8242174084219167.
[I 2026-07-01 06:15:41,362] Trial 88 finished with value: 0.8214373968620947 and parameters: {'n_estimators': 250, 'max_depth': 7, 'min_samples_split': 9, 'min_samples_leaf': 11, 'max_features': 'sqrt'}. Best is trial 82 with value: 0.8242174084219167.
[I 2026-07-01 06:18:28,858] Trial 89 finished with value: 0.8214373968620947 and parameters: {'n_estimators': 250, 'max_depth': 7, 'min_samples_split': 14, 'min_samples_leaf': 11, 'max_features': 'sqrt'}. Best is trial 82 with value: 0.8242174084219167.
[I 2026-07-01 06:48:00,715] Trial 95 finished with value: 0.8228708566833363 and parameters: {'n_estimators': 200, 'max_depth': 6, 'min_samples_split': 19, 'min_samples_leaf': 12, 'max_features': 'sqrt'}. Best is trial 82 with value: 0.8242174084219167.
[I 2026-07-01 06:53:38,336] Trial 90 finished with value: 0.8214373968620947 and parameters: {'n_estimators': 250, 'max_depth': 7, 'min_samples_split': 14, 'min_samples_leaf': 11, 'max_features': 'sqrt'}. Best is trial 82 with value: 0.8242174084219167.
[I 2026-07-01 06:55:15,506] Trial 92 finished with value: 0.8219410449073957 and parameters: {'n_estimators': 250, 'max_depth': 6, 'min_samples_split': 18, 'min_samples_leaf': 11, 'max_features': 'sqrt'}. Best is trial 82 with value: 0.8242174084219167.
[I 2026-07-01 06:55:28,819] Trial 96 finished with value: 0.8228708566833363 and parameters: {'n_estimators': 200, 'max_depth': 6, 'min_samples_split': 19, 'min_samples_leaf': 12, 'max_features': 'sqrt'}. Best is trial 82 with value: 0.8242174084219167.
[I 2026-07-01 06:56:23,608] Trial 94 finished with value: 0.8242174084219167 and parameters: {'n_estimators': 250, 'max_depth': 6, 'min_samples_split': 19, 'min_samples_leaf': 12, 'max_features': 'sqrt'}. Best is trial 82 with value: 0.8242174084219167.
[I 2026-07-01 06:56:31,379] Trial 93 finished with value: 0.8219410449073957 and parameters: {'n_estimators': 250, 'max_depth': 6, 'min_samples_split': 19, 'min_samples_leaf': 11, 'max_features': 'sqrt'}. Best is trial 82 with value: 0.8242174084219167.
[I 2026-07-01 06:56:40,756] Trial 91 finished with value: 0.8214373968620947 and parameters: {'n_estimators': 250, 'max_depth': 7, 'min_samples_split': 18, 'min_samples_leaf': 11, 'max_features': 'sqrt'}. Best is trial 82 with value: 0.8242174084219167.
[I 2026-07-01 06:56:53,347] Trial 97 finished with value: 0.8228708566833363 and parameters: {'n_estimators': 200, 'max_depth': 6, 'min_samples_split': 19, 'min_samples_leaf': 12, 'max_features': 'sqrt'}. Best is trial 82 with value: 0.8242174084219167.
[I 2026-07-01 07:06:29,966] Trial 98 finished with value: 0.8242174084219167 and parameters: {'n_estimators': 250, 'max_depth': 6, 'min_samples_split': 18, 'min_samples_leaf': 12, 'max_features': 'sqrt'}. Best is trial 82 with value: 0.8242174084219167.
[I 2026-07-01 07:07:10,712] Trial 99 finished with value: 0.8242174084219167 and parameters: {'n_estimators': 250, 'max_depth': 6, 'min_samples_split': 18, 'min_samples_leaf': 12, 'max_features': 'sqrt'}. Best is trial 82 with value: 0.8242174084219167.
ENV CHECKPOINT PATH: 
DEFAULT PATH: /scratch.hpc/luca.cotugno/Foundation_model_clinical_data/src/models_diff/tabdpt1_1.pth
ENV CHECKPOINT PATH: 
DEFAULT PATH: /scratch.hpc/luca.cotugno/Foundation_model_clinical_data/src/models_diff/tabdpt1_1.pth
[I 2026-07-01 07:19:41,091] A new study created in memory with name: deepsurv_tuning_tabdpt_5_-1_seed456
/scratch.hpc/luca.cotugno/Foundation_model_clinical_data/test_tabular_model.py:481: UserWarning: Choices for a categorical distribution should be a tuple of None, bool, int, float and str for persistent storage but contains [64] which is of type list.
  num_nodes  = trial.suggest_categorical("num_nodes", [[32], [64], [128], [64, 32], [128, 64]])
/scratch.hpc/luca.cotugno/Foundation_model_clinical_data/test_tabular_model.py:481: UserWarning: Choices for a categorical distribution should be a tuple of None, bool, int, float and str for persistent storage but contains [128] which is of type list.
  num_nodes  = trial.suggest_categorical("num_nodes", [[32], [64], [128], [64, 32], [128, 64]])
/scratch.hpc/luca.cotugno/Foundation_model_clinical_data/test_tabular_model.py:481: UserWarning: Choices for a categorical distribution should be a tuple of None, bool, int, float and str for persistent storage but contains [64, 32] which is of type list.
  num_nodes  = trial.suggest_categorical("num_nodes", [[32], [64], [128], [64, 32], [128, 64]])
/scratch.hpc/luca.cotugno/Foundation_model_clinical_data/test_tabular_model.py:481: UserWarning: Choices for a categorical distribution should be a tuple of None, bool, int, float and str for persistent storage but contains [128, 64] which is of type list.
  num_nodes  = trial.suggest_categorical("num_nodes", [[32], [64], [128], [64, 32], [128, 64]])
/scratch.hpc/luca.cotugno/Foundation_model_clinical_data/test_tabular_model.py:481: UserWarning: Choices for a categorical distribution should be a tuple of None, bool, int, float and str for persistent storage but contains [32] which is of type list.
  num_nodes  = trial.suggest_categorical("num_nodes", [[32], [64], [128], [64, 32], [128, 64]])
[I 2026-07-01 07:20:38,146] Trial 1 finished with value: 0.7361043297024312 and parameters: {'num_nodes': [128, 64], 'dropout': 0.05088275542166432, 'learning_rate': 0.006447686478001617, 'batch_norm': False}. Best is trial 1 with value: 0.7361043297024312.
/scratch.hpc/luca.cotugno/Foundation_model_clinical_data/test_tabular_model.py:481: UserWarning: Choices for a categorical distribution should be a tuple of None, bool, int, float and str for persistent storage but contains [32] which is of type list.
  num_nodes  = trial.suggest_categorical("num_nodes", [[32], [64], [128], [64, 32], [128, 64]])
/scratch.hpc/luca.cotugno/Foundation_model_clinical_data/test_tabular_model.py:481: UserWarning: Choices for a categorical distribution should be a tuple of None, bool, int, float and str for persistent storage but contains [64] which is of type list.
  num_nodes  = trial.suggest_categorical("num_nodes", [[32], [64], [128], [64, 32], [128, 64]])
/scratch.hpc/luca.cotugno/Foundation_model_clinical_data/test_tabular_model.py:481: UserWarning: Choices for a categorical distribution should be a tuple of None, bool, int, float and str for persistent storage but contains [128] which is of type list.
  num_nodes  = trial.suggest_categorical("num_nodes", [[32], [64], [128], [64, 32], [128, 64]])
/scratch.hpc/luca.cotugno/Foundation_model_clinical_data/test_tabular_model.py:481: UserWarning: Choices for a categorical distribution should be a tuple of None, bool, int, float and str for persistent storage but contains [64, 32] which is of type list.
  num_nodes  = trial.suggest_categorical("num_nodes", [[32], [64], [128], [64, 32], [128, 64]])
/scratch.hpc/luca.cotugno/Foundation_model_clinical_data/test_tabular_model.py:481: UserWarning: Choices for a categorical distribution should be a tuple of None, bool, int, float and str for persistent storage but contains [128, 64] which is of type list.
  num_nodes  = trial.suggest_categorical("num_nodes", [[32], [64], [128], [64, 32], [128, 64]])
[I 2026-07-01 07:20:40,532] Trial 2 finished with value: 0.7806108160836853 and parameters: {'num_nodes': [32], 'dropout': 0.22298328570298667, 'learning_rate': 0.006932847012178748, 'batch_norm': True}. Best is trial 2 with value: 0.7806108160836853.
/scratch.hpc/luca.cotugno/Foundation_model_clinical_data/test_tabular_model.py:481: UserWarning: Choices for a categorical distribution should be a tuple of None, bool, int, float and str for persistent storage but contains [32] which is of type list.
  num_nodes  = trial.suggest_categorical("num_nodes", [[32], [64], [128], [64, 32], [128, 64]])
/scratch.hpc/luca.cotugno/Foundation_model_clinical_data/test_tabular_model.py:481: UserWarning: Choices for a categorical distribution should be a tuple of None, bool, int, float and str for persistent storage but contains [64] which is of type list.
  num_nodes  = trial.suggest_categorical("num_nodes", [[32], [64], [128], [64, 32], [128, 64]])
/scratch.hpc/luca.cotugno/Foundation_model_clinical_data/test_tabular_model.py:481: UserWarning: Choices for a categorical distribution should be a tuple of None, bool, int, float and str for persistent storage but contains [128] which is of type list.
  num_nodes  = trial.suggest_categorical("num_nodes", [[32], [64], [128], [64, 32], [128, 64]])
/scratch.hpc/luca.cotugno/Foundation_model_clinical_data/test_tabular_model.py:481: UserWarning: Choices for a categorical distribution should be a tuple of None, bool, int, float and str for persistent storage but contains [64, 32] which is of type list.
  num_nodes  = trial.suggest_categorical("num_nodes", [[32], [64], [128], [64, 32], [128, 64]])
/scratch.hpc/luca.cotugno/Foundation_model_clinical_data/test_tabular_model.py:481: UserWarning: Choices for a categorical distribution should be a tuple of None, bool, int, float and str for persistent storage but contains [128, 64] which is of type list.
  num_nodes  = trial.suggest_categorical("num_nodes", [[32], [64], [128], [64, 32], [128, 64]])
[I 2026-07-01 07:20:50,944] Trial 4 finished with value: 0.7562550036385366 and parameters: {'num_nodes': [64], 'dropout': 0.05311820278779412, 'learning_rate': 0.00019634479662418975, 'batch_norm': False}. Best is trial 2 with value: 0.7806108160836853.
/scratch.hpc/luca.cotugno/Foundation_model_clinical_data/test_tabular_model.py:481: UserWarning: Choices for a categorical distribution should be a tuple of None, bool, int, float and str for persistent storage but contains [32] which is of type list.
  num_nodes  = trial.suggest_categorical("num_nodes", [[32], [64], [128], [64, 32], [128, 64]])
/scratch.hpc/luca.cotugno/Foundation_model_clinical_data/test_tabular_model.py:481: UserWarning: Choices for a categorical distribution should be a tuple of None, bool, int, float and str for persistent storage but contains [64] which is of type list.
  num_nodes  = trial.suggest_categorical("num_nodes", [[32], [64], [128], [64, 32], [128, 64]])
/scratch.hpc/luca.cotugno/Foundation_model_clinical_data/test_tabular_model.py:481: UserWarning: Choices for a categorical distribution should be a tuple of None, bool, int, float and str for persistent storage but contains [128] which is of type list.
  num_nodes  = trial.suggest_categorical("num_nodes", [[32], [64], [128], [64, 32], [128, 64]])
/scratch.hpc/luca.cotugno/Foundation_model_clinical_data/test_tabular_model.py:481: UserWarning: Choices for a categorical distribution should be a tuple of None, bool, int, float and str for persistent storage but contains [64, 32] which is of type list.
  num_nodes  = trial.suggest_categorical("num_nodes", [[32], [64], [128], [64, 32], [128, 64]])
/scratch.hpc/luca.cotugno/Foundation_model_clinical_data/test_tabular_model.py:481: UserWarning: Choices for a categorical distribution should be a tuple of None, bool, int, float and str for persistent storage but contains [128, 64] which is of type list.
  num_nodes  = trial.suggest_categorical("num_nodes", [[32], [64], [128], [64, 32], [128, 64]])
[I 2026-07-01 07:21:29,464] Trial 8 finished with value: 0.792627877124692 and parameters: {'num_nodes': [64], 'dropout': 0.18541325905805786, 'learning_rate': 0.00010938594738265278, 'batch_norm': False}. Best is trial 8 with value: 0.792627877124692.
/scratch.hpc/luca.cotugno/Foundation_model_clinical_data/test_tabular_model.py:481: UserWarning: Choices for a categorical distribution should be a tuple of None, bool, int, float and str for persistent storage but contains [32] which is of type list.
  num_nodes  = trial.suggest_categorical("num_nodes", [[32], [64], [128], [64, 32], [128, 64]])
/scratch.hpc/luca.cotugno/Foundation_model_clinical_data/test_tabular_model.py:481: UserWarning: Choices for a categorical distribution should be a tuple of None, bool, int, float and str for persistent storage but contains [64] which is of type list.
  num_nodes  = trial.suggest_categorical("num_nodes", [[32], [64], [128], [64, 32], [128, 64]])
/scratch.hpc/luca.cotugno/Foundation_model_clinical_data/test_tabular_model.py:481: UserWarning: Choices for a categorical distribution should be a tuple of None, bool, int, float and str for persistent storage but contains [128] which is of type list.
  num_nodes  = trial.suggest_categorical("num_nodes", [[32], [64], [128], [64, 32], [128, 64]])
/scratch.hpc/luca.cotugno/Foundation_model_clinical_data/test_tabular_model.py:481: UserWarning: Choices for a categorical distribution should be a tuple of None, bool, int, float and str for persistent storage but contains [64, 32] which is of type list.
  num_nodes  = trial.suggest_categorical("num_nodes", [[32], [64], [128], [64, 32], [128, 64]])
/scratch.hpc/luca.cotugno/Foundation_model_clinical_data/test_tabular_model.py:481: UserWarning: Choices for a categorical distribution should be a tuple of None, bool, int, float and str for persistent storage but contains [128, 64] which is of type list.
  num_nodes  = trial.suggest_categorical("num_nodes", [[32], [64], [128], [64, 32], [128, 64]])
[I 2026-07-01 07:21:35,800] Trial 9 finished with value: 0.790001519960939 and parameters: {'num_nodes': [128], 'dropout': 0.1719156795879286, 'learning_rate': 0.0024207157754889525, 'batch_norm': False}. Best is trial 8 with value: 0.792627877124692.
/scratch.hpc/luca.cotugno/Foundation_model_clinical_data/test_tabular_model.py:481: UserWarning: Choices for a categorical distribution should be a tuple of None, bool, int, float and str for persistent storage but contains [32] which is of type list.
  num_nodes  = trial.suggest_categorical("num_nodes", [[32], [64], [128], [64, 32], [128, 64]])
/scratch.hpc/luca.cotugno/Foundation_model_clinical_data/test_tabular_model.py:481: UserWarning: Choices for a categorical distribution should be a tuple of None, bool, int, float and str for persistent storage but contains [64] which is of type list.
  num_nodes  = trial.suggest_categorical("num_nodes", [[32], [64], [128], [64, 32], [128, 64]])
/scratch.hpc/luca.cotugno/Foundation_model_clinical_data/test_tabular_model.py:481: UserWarning: Choices for a categorical distribution should be a tuple of None, bool, int, float and str for persistent storage but contains [128] which is of type list.
  num_nodes  = trial.suggest_categorical("num_nodes", [[32], [64], [128], [64, 32], [128, 64]])
/scratch.hpc/luca.cotugno/Foundation_model_clinical_data/test_tabular_model.py:481: UserWarning: Choices for a categorical distribution should be a tuple of None, bool, int, float and str for persistent storage but contains [64, 32] which is of type list.
  num_nodes  = trial.suggest_categorical("num_nodes", [[32], [64], [128], [64, 32], [128, 64]])
/scratch.hpc/luca.cotugno/Foundation_model_clinical_data/test_tabular_model.py:481: UserWarning: Choices for a categorical distribution should be a tuple of None, bool, int, float and str for persistent storage but contains [128, 64] which is of type list.
  num_nodes  = trial.suggest_categorical("num_nodes", [[32], [64], [128], [64, 32], [128, 64]])
[I 2026-07-01 07:21:41,795] Trial 5 finished with value: 0.7787579732882481 and parameters: {'num_nodes': [128], 'dropout': 0.19418163335339308, 'learning_rate': 0.0031386031922728606, 'batch_norm': False}. Best is trial 8 with value: 0.792627877124692.
/scratch.hpc/luca.cotugno/Foundation_model_clinical_data/test_tabular_model.py:481: UserWarning: Choices for a categorical distribution should be a tuple of None, bool, int, float and str for persistent storage but contains [32] which is of type list.
  num_nodes  = trial.suggest_categorical("num_nodes", [[32], [64], [128], [64, 32], [128, 64]])
/scratch.hpc/luca.cotugno/Foundation_model_clinical_data/test_tabular_model.py:481: UserWarning: Choices for a categorical distribution should be a tuple of None, bool, int, float and str for persistent storage but contains [64] which is of type list.
  num_nodes  = trial.suggest_categorical("num_nodes", [[32], [64], [128], [64, 32], [128, 64]])
/scratch.hpc/luca.cotugno/Foundation_model_clinical_data/test_tabular_model.py:481: UserWarning: Choices for a categorical distribution should be a tuple of None, bool, int, float and str for persistent storage but contains [128] which is of type list.
  num_nodes  = trial.suggest_categorical("num_nodes", [[32], [64], [128], [64, 32], [128, 64]])
/scratch.hpc/luca.cotugno/Foundation_model_clinical_data/test_tabular_model.py:481: UserWarning: Choices for a categorical distribution should be a tuple of None, bool, int, float and str for persistent storage but contains [64, 32] which is of type list.
  num_nodes  = trial.suggest_categorical("num_nodes", [[32], [64], [128], [64, 32], [128, 64]])
/scratch.hpc/luca.cotugno/Foundation_model_clinical_data/test_tabular_model.py:481: UserWarning: Choices for a categorical distribution should be a tuple of None, bool, int, float and str for persistent storage but contains [128, 64] which is of type list.
  num_nodes  = trial.suggest_categorical("num_nodes", [[32], [64], [128], [64, 32], [128, 64]])
