[I 2026-06-08 18:29:21,851] Trial 62 finished with value: 0.7862082108243493 and parameters: {'n_estimators': 200, 'max_depth': 4, 'min_samples_split': 7, 'min_samples_leaf': 3, 'max_features': 'log2'}. Best is trial 61 with value: 0.7875830338669281.
[I 2026-06-08 18:39:58,314] Trial 65 finished with value: 0.7862082108243493 and parameters: {'n_estimators': 200, 'max_depth': 4, 'min_samples_split': 7, 'min_samples_leaf': 3, 'max_features': 'log2'}. Best is trial 61 with value: 0.7875830338669281.
[I 2026-06-08 18:41:31,576] Trial 66 finished with value: 0.7862082108243493 and parameters: {'n_estimators': 200, 'max_depth': 4, 'min_samples_split': 7, 'min_samples_leaf': 3, 'max_features': 'log2'}. Best is trial 61 with value: 0.7875830338669281.
[I 2026-06-08 18:41:54,629] Trial 68 finished with value: 0.7862082108243493 and parameters: {'n_estimators': 200, 'max_depth': 4, 'min_samples_split': 7, 'min_samples_leaf': 3, 'max_features': 'log2'}. Best is trial 61 with value: 0.7875830338669281.
[I 2026-06-08 18:43:08,537] Trial 67 finished with value: 0.7790660417661398 and parameters: {'n_estimators': 200, 'max_depth': 5, 'min_samples_split': 7, 'min_samples_leaf': 8, 'max_features': 'log2'}. Best is trial 61 with value: 0.7875830338669281.
[I 2026-06-08 18:53:19,871] Trial 72 finished with value: 0.77687501570628 and parameters: {'n_estimators': 200, 'max_depth': 3, 'min_samples_split': 8, 'min_samples_leaf': 4, 'max_features': 'log2'}. Best is trial 61 with value: 0.7875830338669281.
[I 2026-06-08 18:53:40,771] Trial 69 finished with value: 0.7753447004917112 and parameters: {'n_estimators': 200, 'max_depth': 5, 'min_samples_split': 7, 'min_samples_leaf': 3, 'max_features': 'log2'}. Best is trial 61 with value: 0.7875830338669281.
[I 2026-06-08 18:55:41,918] Trial 70 finished with value: 0.7753447004917112 and parameters: {'n_estimators': 200, 'max_depth': 5, 'min_samples_split': 7, 'min_samples_leaf': 3, 'max_features': 'log2'}. Best is trial 61 with value: 0.7875830338669281.
[I 2026-06-08 18:55:58,478] Trial 71 finished with value: 0.7773723812395815 and parameters: {'n_estimators': 200, 'max_depth': 5, 'min_samples_split': 7, 'min_samples_leaf': 4, 'max_features': 'log2'}. Best is trial 61 with value: 0.7875830338669281.
[I 2026-06-08 19:06:03,736] Trial 73 finished with value: 0.7756572554636912 and parameters: {'n_estimators': 250, 'max_depth': 3, 'min_samples_split': 7, 'min_samples_leaf': 4, 'max_features': 'log2'}. Best is trial 61 with value: 0.7875830338669281.
[I 2026-06-08 19:06:08,457] Trial 74 finished with value: 0.7862082108243493 and parameters: {'n_estimators': 200, 'max_depth': 4, 'min_samples_split': 7, 'min_samples_leaf': 3, 'max_features': 'log2'}. Best is trial 61 with value: 0.7875830338669281.
[I 2026-06-08 19:07:53,975] Trial 75 finished with value: 0.7849192487790985 and parameters: {'n_estimators': 200, 'max_depth': 4, 'min_samples_split': 6, 'min_samples_leaf': 3, 'max_features': 'log2'}. Best is trial 61 with value: 0.7875830338669281.
[I 2026-06-08 19:08:29,756] Trial 76 finished with value: 0.7849192487790985 and parameters: {'n_estimators': 200, 'max_depth': 4, 'min_samples_split': 6, 'min_samples_leaf': 3, 'max_features': 'log2'}. Best is trial 61 with value: 0.7875830338669281.
[I 2026-06-08 19:18:16,826] Trial 77 finished with value: 0.7849192487790985 and parameters: {'n_estimators': 200, 'max_depth': 4, 'min_samples_split': 6, 'min_samples_leaf': 3, 'max_features': 'log2'}. Best is trial 61 with value: 0.7875830338669281.
[I 2026-06-08 19:18:30,064] Trial 78 finished with value: 0.7868856750349726 and parameters: {'n_estimators': 200, 'max_depth': 4, 'min_samples_split': 9, 'min_samples_leaf': 3, 'max_features': 'log2'}. Best is trial 61 with value: 0.7875830338669281.
[I 2026-06-08 19:19:44,742] Trial 79 finished with value: 0.7876118287135928 and parameters: {'n_estimators': 200, 'max_depth': 4, 'min_samples_split': 8, 'min_samples_leaf': 3, 'max_features': 'log2'}. Best is trial 79 with value: 0.7876118287135928.
[I 2026-06-08 19:21:08,211] Trial 80 finished with value: 0.7766786872062925 and parameters: {'n_estimators': 250, 'max_depth': 3, 'min_samples_split': 9, 'min_samples_leaf': 12, 'max_features': 'log2'}. Best is trial 79 with value: 0.7876118287135928.
[I 2026-06-08 19:30:41,747] Trial 81 finished with value: 0.7756572554636912 and parameters: {'n_estimators': 250, 'max_depth': 3, 'min_samples_split': 9, 'min_samples_leaf': 4, 'max_features': 'log2'}. Best is trial 79 with value: 0.7876118287135928.
[I 2026-06-08 19:33:45,686] Trial 84 finished with value: 0.7863579440270064 and parameters: {'n_estimators': 200, 'max_depth': 4, 'min_samples_split': 8, 'min_samples_leaf': 4, 'max_features': 'log2'}. Best is trial 79 with value: 0.7876118287135928.
[I 2026-06-08 19:42:37,804] Trial 85 finished with value: 0.7863579440270064 and parameters: {'n_estimators': 200, 'max_depth': 4, 'min_samples_split': 8, 'min_samples_leaf': 4, 'max_features': 'log2'}. Best is trial 79 with value: 0.7876118287135928.
[I 2026-06-08 19:46:14,616] Trial 86 finished with value: 0.7863579440270064 and parameters: {'n_estimators': 200, 'max_depth': 4, 'min_samples_split': 5, 'min_samples_leaf': 4, 'max_features': 'log2'}. Best is trial 79 with value: 0.7876118287135928.
[I 2026-06-08 19:49:17,759] Trial 82 finished with value: 0.76885277142546 and parameters: {'n_estimators': 250, 'max_depth': 3, 'min_samples_split': 9, 'min_samples_leaf': 4, 'max_features': 'sqrt'}. Best is trial 79 with value: 0.7876118287135928.
[I 2026-06-08 19:49:46,329] Trial 83 finished with value: 0.7742156807311169 and parameters: {'n_estimators': 250, 'max_depth': 3, 'min_samples_split': 9, 'min_samples_leaf': 14, 'max_features': 'sqrt'}. Best is trial 79 with value: 0.7876118287135928.
[I 2026-06-08 20:03:41,020] Trial 90 finished with value: 0.7753007229077141 and parameters: {'n_estimators': 200, 'max_depth': 5, 'min_samples_split': 8, 'min_samples_leaf': 5, 'max_features': 'log2'}. Best is trial 79 with value: 0.7876118287135928.
[I 2026-06-08 20:03:57,678] Trial 89 finished with value: 0.7753007229077141 and parameters: {'n_estimators': 200, 'max_depth': 5, 'min_samples_split': 8, 'min_samples_leaf': 5, 'max_features': 'log2'}. Best is trial 79 with value: 0.7876118287135928.
[I 2026-06-08 20:15:09,397] Trial 87 finished with value: 0.7817842752912991 and parameters: {'n_estimators': 200, 'max_depth': 5, 'min_samples_split': 8, 'min_samples_leaf': 4, 'max_features': 'sqrt'}. Best is trial 79 with value: 0.7876118287135928.
[I 2026-06-08 20:16:02,442] Trial 91 finished with value: 0.7881568366295579 and parameters: {'n_estimators': 200, 'max_depth': 4, 'min_samples_split': 10, 'min_samples_leaf': 5, 'max_features': 'log2'}. Best is trial 91 with value: 0.7881568366295579.
[I 2026-06-08 20:16:18,025] Trial 92 finished with value: 0.7856899035843825 and parameters: {'n_estimators': 200, 'max_depth': 4, 'min_samples_split': 10, 'min_samples_leaf': 11, 'max_features': 'log2'}. Best is trial 91 with value: 0.7881568366295579.
[I 2026-06-08 20:19:59,410] Trial 88 finished with value: 0.7817842752912991 and parameters: {'n_estimators': 200, 'max_depth': 5, 'min_samples_split': 8, 'min_samples_leaf': 4, 'max_features': 'sqrt'}. Best is trial 91 with value: 0.7881568366295579.
[I 2026-06-08 20:27:06,008] Trial 93 finished with value: 0.7861035022910227 and parameters: {'n_estimators': 200, 'max_depth': 4, 'min_samples_split': 11, 'min_samples_leaf': 10, 'max_features': 'log2'}. Best is trial 91 with value: 0.7881568366295579.
[I 2026-06-08 20:28:36,393] Trial 94 finished with value: 0.7881568366295579 and parameters: {'n_estimators': 200, 'max_depth': 4, 'min_samples_split': 8, 'min_samples_leaf': 5, 'max_features': 'log2'}. Best is trial 91 with value: 0.7881568366295579.
[I 2026-06-08 20:28:45,752] Trial 95 finished with value: 0.7866809698523191 and parameters: {'n_estimators': 200, 'max_depth': 4, 'min_samples_split': 11, 'min_samples_leaf': 5, 'max_features': 'log2'}. Best is trial 91 with value: 0.7881568366295579.
[I 2026-06-08 20:32:33,611] Trial 96 finished with value: 0.7866809698523191 and parameters: {'n_estimators': 200, 'max_depth': 4, 'min_samples_split': 11, 'min_samples_leaf': 5, 'max_features': 'log2'}. Best is trial 91 with value: 0.7881568366295579.
[I 2026-06-08 20:37:32,654] Trial 97 finished with value: 0.7881568366295579 and parameters: {'n_estimators': 200, 'max_depth': 4, 'min_samples_split': 10, 'min_samples_leaf': 5, 'max_features': 'log2'}. Best is trial 91 with value: 0.7881568366295579.
[I 2026-06-08 20:38:16,052] Trial 98 finished with value: 0.7881568366295579 and parameters: {'n_estimators': 200, 'max_depth': 4, 'min_samples_split': 10, 'min_samples_leaf': 5, 'max_features': 'log2'}. Best is trial 91 with value: 0.7881568366295579.
[I 2026-06-08 20:38:24,257] Trial 99 finished with value: 0.7881568366295579 and parameters: {'n_estimators': 200, 'max_depth': 4, 'min_samples_split': 10, 'min_samples_leaf': 5, 'max_features': 'log2'}. Best is trial 91 with value: 0.7881568366295579.
[I 2026-06-08 20:41:44,075] A new study created in memory with name: deepsurv_tuning_tabicl_4_NaN_seed789
/scratch.hpc/luca.cotugno/Foundation_model_clinical_data/test_tabular_model_tmp.py:476: UserWarning: Choices for a categorical distribution should be a tuple of None, bool, int, float and str for persistent storage but contains [32] which is of type list.
  num_nodes  = trial.suggest_categorical("num_nodes", [[32], [64], [128], [64, 32], [128, 64]])
/scratch.hpc/luca.cotugno/Foundation_model_clinical_data/test_tabular_model_tmp.py:476: UserWarning: Choices for a categorical distribution should be a tuple of None, bool, int, float and str for persistent storage but contains [64] which is of type list.
  num_nodes  = trial.suggest_categorical("num_nodes", [[32], [64], [128], [64, 32], [128, 64]])
/scratch.hpc/luca.cotugno/Foundation_model_clinical_data/test_tabular_model_tmp.py:476: UserWarning: Choices for a categorical distribution should be a tuple of None, bool, int, float and str for persistent storage but contains [64, 32] which is of type list.
  num_nodes  = trial.suggest_categorical("num_nodes", [[32], [64], [128], [64, 32], [128, 64]])
/scratch.hpc/luca.cotugno/Foundation_model_clinical_data/test_tabular_model_tmp.py:476: UserWarning: Choices for a categorical distribution should be a tuple of None, bool, int, float and str for persistent storage but contains [128, 64] which is of type list.
  num_nodes  = trial.suggest_categorical("num_nodes", [[32], [64], [128], [64, 32], [128, 64]])
/scratch.hpc/luca.cotugno/Foundation_model_clinical_data/test_tabular_model_tmp.py:476: UserWarning: Choices for a categorical distribution should be a tuple of None, bool, int, float and str for persistent storage but contains [128] which is of type list.
  num_nodes  = trial.suggest_categorical("num_nodes", [[32], [64], [128], [64, 32], [128, 64]])
[I 2026-06-08 20:42:57,863] Trial 0 finished with value: 0.7374639659945177 and parameters: {'num_nodes': [128, 64], 'dropout': 0.10583394494001995, 'learning_rate': 0.0018835353947832798, 'batch_norm': True}. Best is trial 0 with value: 0.7374639659945177.
/scratch.hpc/luca.cotugno/Foundation_model_clinical_data/test_tabular_model_tmp.py:476: UserWarning: Choices for a categorical distribution should be a tuple of None, bool, int, float and str for persistent storage but contains [32] which is of type list.
  num_nodes  = trial.suggest_categorical("num_nodes", [[32], [64], [128], [64, 32], [128, 64]])
/scratch.hpc/luca.cotugno/Foundation_model_clinical_data/test_tabular_model_tmp.py:476: UserWarning: Choices for a categorical distribution should be a tuple of None, bool, int, float and str for persistent storage but contains [64] which is of type list.
  num_nodes  = trial.suggest_categorical("num_nodes", [[32], [64], [128], [64, 32], [128, 64]])
/scratch.hpc/luca.cotugno/Foundation_model_clinical_data/test_tabular_model_tmp.py:476: UserWarning: Choices for a categorical distribution should be a tuple of None, bool, int, float and str for persistent storage but contains [128] which is of type list.
  num_nodes  = trial.suggest_categorical("num_nodes", [[32], [64], [128], [64, 32], [128, 64]])
/scratch.hpc/luca.cotugno/Foundation_model_clinical_data/test_tabular_model_tmp.py:476: UserWarning: Choices for a categorical distribution should be a tuple of None, bool, int, float and str for persistent storage but contains [64, 32] which is of type list.
  num_nodes  = trial.suggest_categorical("num_nodes", [[32], [64], [128], [64, 32], [128, 64]])
/scratch.hpc/luca.cotugno/Foundation_model_clinical_data/test_tabular_model_tmp.py:476: UserWarning: Choices for a categorical distribution should be a tuple of None, bool, int, float and str for persistent storage but contains [128, 64] which is of type list.
  num_nodes  = trial.suggest_categorical("num_nodes", [[32], [64], [128], [64, 32], [128, 64]])
[I 2026-06-08 20:42:57,921] Trial 2 finished with value: 0.7423130057643998 and parameters: {'num_nodes': [64, 32], 'dropout': 0.12826886504061544, 'learning_rate': 0.00863884481316932, 'batch_norm': True}. Best is trial 2 with value: 0.7423130057643998.
[I 2026-06-08 20:42:57,972] Trial 3 finished with value: 0.774498178649546 and parameters: {'num_nodes': [128, 64], 'dropout': 0.2481546710726297, 'learning_rate': 0.002064876070430278, 'batch_norm': False}. Best is trial 3 with value: 0.774498178649546.
