[I 2026-06-06 23:57:31,521] Trial 4 finished with value: 0.8016719049795378 and parameters: {'num_nodes': [32], 'dropout': 0.25299975983273926, 'learning_rate': 0.00011979520817518701, 'batch_norm': False}. Best is trial 4 with value: 0.8016719049795378.
/scratch.hpc/luca.cotugno/Foundation_model_clinical_data/test_tabular_model_tmp.py:476: UserWarning: Choices for a categorical distribution should be a tuple of None, bool, int, float and str for persistent storage but contains [32] which is of type list.
  num_nodes  = trial.suggest_categorical("num_nodes", [[32], [64], [128], [64, 32], [128, 64]])
/scratch.hpc/luca.cotugno/Foundation_model_clinical_data/test_tabular_model_tmp.py:476: UserWarning: Choices for a categorical distribution should be a tuple of None, bool, int, float and str for persistent storage but contains [64] which is of type list.
  num_nodes  = trial.suggest_categorical("num_nodes", [[32], [64], [128], [64, 32], [128, 64]])
/scratch.hpc/luca.cotugno/Foundation_model_clinical_data/test_tabular_model_tmp.py:476: UserWarning: Choices for a categorical distribution should be a tuple of None, bool, int, float and str for persistent storage but contains [128] which is of type list.
  num_nodes  = trial.suggest_categorical("num_nodes", [[32], [64], [128], [64, 32], [128, 64]])
/scratch.hpc/luca.cotugno/Foundation_model_clinical_data/test_tabular_model_tmp.py:476: UserWarning: Choices for a categorical distribution should be a tuple of None, bool, int, float and str for persistent storage but contains [64, 32] which is of type list.
  num_nodes  = trial.suggest_categorical("num_nodes", [[32], [64], [128], [64, 32], [128, 64]])
/scratch.hpc/luca.cotugno/Foundation_model_clinical_data/test_tabular_model_tmp.py:476: UserWarning: Choices for a categorical distribution should be a tuple of None, bool, int, float and str for persistent storage but contains [128, 64] which is of type list.
  num_nodes  = trial.suggest_categorical("num_nodes", [[32], [64], [128], [64, 32], [128, 64]])
STARTED  model=tabicl  seed=77  tuning=True  shap=False


Preprocess: Replace NaN with -1
Loading existing folds from tmp/splits/OrmoniTirodei_seed77.pkl
X_train shape: (5161, 76), X_test shape: (1291, 76)
Generating TABICL Embeddings...
Warming up TabICL model (triggering checkpoint load)...
ARRIVATO QUI 1
Loading TabICL model checkpoint 'tabicl-classifier-v1.1-0506.ckpt'...
ARRIVATO QUI
Performing dummy prediction to ensure model is loaded...
Warming up TabICL model (triggering checkpoint load)...
ARRIVATO QUI 1
Loading TabICL model checkpoint 'tabicl-classifier-v1.1-0506.ckpt'...
ARRIVATO QUI
Performing dummy prediction to ensure model is loaded...
Successfully generated embeddings with shape: (5161, 512)
  [ckpt] Loading TABICL DeepSurv Tuned from checkpoints/tabicl/OrmoniTirodei/-1/seed77/fold1
C-index train: 0.9107
C-index test:  0.7466
  [ckpt] Loading TABICL RSF Tuned from checkpoints/tabicl/OrmoniTirodei/-1/seed77/fold1
C-index train: 0.9459
C-index test:  0.7378
  [ckpt] Loading DeepSurv Simple from checkpoints/tabicl/OrmoniTirodei/-1/seed77/fold1/tabicl_deepsurv_simple.pt
C-index TRAIN: 0.9220
C-index TEST:  0.7377
  [ckpt] Loading DeepSurv Vanilla from checkpoints/tabicl/OrmoniTirodei/-1/seed77/fold1/tabicl_deepsurv_vanilla.pt
C-index TRAIN: 0.9241
C-index TEST:  0.7388
  [ckpt] Loading TABICL RSF from checkpoints/tabicl/OrmoniTirodei/-1/seed77/fold1/tabicl_rsf.pkl
C-index train: 0.9640
C-index test:  0.7348
  [ckpt] Loading TABICL Cox (embedding) from checkpoints/tabicl/OrmoniTirodei/-1/seed77/fold1/tabicl_tab_cox.pkl
C-index train: 0.9277
C-index test:  0.7558
  [ckpt] Loading DeepSurv Vanilla baseline from checkpoints/tabicl/OrmoniTirodei/-1/seed77/fold1/deepsurv_vanilla_baseline.pt
C-index TRAIN: 0.8043
C-index TEST:  0.7798
  [ckpt] Loading DeepSurv Simple baseline from checkpoints/tabicl/OrmoniTirodei/-1/seed77/fold1/deepsurv_simple_baseline.pt
C-index TRAIN: 0.7993
C-index TEST:  0.7790
  [ckpt] Loading RSF baseline from checkpoints/tabicl/OrmoniTirodei/-1/seed77/fold1/rsf_baseline.pkl
C-index train: 0.9079
C-index test:  0.7946
  [ckpt] Loading Cox baseline from checkpoints/tabicl/OrmoniTirodei/-1/seed77/fold1/tabicl_cox.pkl
C-index train: 0.8025
C-index test:  0.7858
X_train shape: (5161, 76), X_test shape: (1291, 76)
Generating TABICL Embeddings...
Warming up TabICL model (triggering checkpoint load)...
ARRIVATO QUI 1
Loading TabICL model checkpoint 'tabicl-classifier-v1.1-0506.ckpt'...
ARRIVATO QUI
Performing dummy prediction to ensure model is loaded...
Warming up TabICL model (triggering checkpoint load)...
ARRIVATO QUI 1
Loading TabICL model checkpoint 'tabicl-classifier-v1.1-0506.ckpt'...
ARRIVATO QUI
Performing dummy prediction to ensure model is loaded...
Successfully generated embeddings with shape: (5161, 512)
  [ckpt] Loading TABICL DeepSurv Tuned from checkpoints/tabicl/OrmoniTirodei/-1/seed77/fold2
C-index train: 0.9240
C-index test:  0.7471
  [ckpt] Loading TABICL RSF Tuned from checkpoints/tabicl/OrmoniTirodei/-1/seed77/fold2
C-index train: 0.9511
C-index test:  0.7459
  [ckpt] Loading DeepSurv Simple from checkpoints/tabicl/OrmoniTirodei/-1/seed77/fold2/tabicl_deepsurv_simple.pt
C-index TRAIN: 0.9164
C-index TEST:  0.7332
  [ckpt] Loading DeepSurv Vanilla from checkpoints/tabicl/OrmoniTirodei/-1/seed77/fold2/tabicl_deepsurv_vanilla.pt
C-index TRAIN: 0.9213
C-index TEST:  0.7537
  [ckpt] Loading TABICL RSF from checkpoints/tabicl/OrmoniTirodei/-1/seed77/fold2/tabicl_rsf.pkl
C-index train: 0.9627
C-index test:  0.7486
  [ckpt] Loading TABICL Cox (embedding) from checkpoints/tabicl/OrmoniTirodei/-1/seed77/fold2/tabicl_tab_cox.pkl
C-index train: 0.9274
C-index test:  0.7329
  [ckpt] Loading DeepSurv Vanilla baseline from checkpoints/tabicl/OrmoniTirodei/-1/seed77/fold2/deepsurv_vanilla_baseline.pt
C-index TRAIN: 0.7953
C-index TEST:  0.8056
  [ckpt] Loading DeepSurv Simple baseline from checkpoints/tabicl/OrmoniTirodei/-1/seed77/fold2/deepsurv_simple_baseline.pt
C-index TRAIN: 0.7891
C-index TEST:  0.8071
  [ckpt] Loading RSF baseline from checkpoints/tabicl/OrmoniTirodei/-1/seed77/fold2/rsf_baseline.pkl
C-index train: 0.9052
C-index test:  0.8087
  [ckpt] Loading Cox baseline from checkpoints/tabicl/OrmoniTirodei/-1/seed77/fold2/tabicl_cox.pkl
C-index train: 0.7980
C-index test:  0.8055
X_train shape: (5162, 76), X_test shape: (1290, 76)
Generating TABICL Embeddings...
Warming up TabICL model (triggering checkpoint load)...
ARRIVATO QUI 1
Loading TabICL model checkpoint 'tabicl-classifier-v1.1-0506.ckpt'...
ARRIVATO QUI
Performing dummy prediction to ensure model is loaded...
Warming up TabICL model (triggering checkpoint load)...
ARRIVATO QUI 1
Loading TabICL model checkpoint 'tabicl-classifier-v1.1-0506.ckpt'...
ARRIVATO QUI
Performing dummy prediction to ensure model is loaded...
Successfully generated embeddings with shape: (5162, 512)
  [ckpt] Loading TABICL DeepSurv Tuned from checkpoints/tabicl/OrmoniTirodei/-1/seed77/fold3
C-index train: 0.9117
C-index test:  0.7591
  [ckpt] Loading TABICL RSF Tuned from checkpoints/tabicl/OrmoniTirodei/-1/seed77/fold3
C-index train: 0.9593
C-index test:  0.7546
  [ckpt] Loading DeepSurv Simple from checkpoints/tabicl/OrmoniTirodei/-1/seed77/fold3/tabicl_deepsurv_simple.pt
C-index TRAIN: 0.9229
C-index TEST:  0.7469
  [ckpt] Loading DeepSurv Vanilla from checkpoints/tabicl/OrmoniTirodei/-1/seed77/fold3/tabicl_deepsurv_vanilla.pt
C-index TRAIN: 0.9215
C-index TEST:  0.7709
  [ckpt] Loading TABICL RSF from checkpoints/tabicl/OrmoniTirodei/-1/seed77/fold3/tabicl_rsf.pkl
C-index train: 0.9613
C-index test:  0.7563
  [ckpt] Loading TABICL Cox (embedding) from checkpoints/tabicl/OrmoniTirodei/-1/seed77/fold3/tabicl_tab_cox.pkl
C-index train: 0.9262
C-index test:  0.7621
  [ckpt] Loading DeepSurv Vanilla baseline from checkpoints/tabicl/OrmoniTirodei/-1/seed77/fold3/deepsurv_vanilla_baseline.pt
C-index TRAIN: 0.8044
C-index TEST:  0.7958
  [ckpt] Loading DeepSurv Simple baseline from checkpoints/tabicl/OrmoniTirodei/-1/seed77/fold3/deepsurv_simple_baseline.pt
C-index TRAIN: 0.7786
C-index TEST:  0.7872
  [ckpt] Loading RSF baseline from checkpoints/tabicl/OrmoniTirodei/-1/seed77/fold3/rsf_baseline.pkl
C-index train: 0.9061
C-index test:  0.8036
  [ckpt] Loading Cox baseline from checkpoints/tabicl/OrmoniTirodei/-1/seed77/fold3/tabicl_cox.pkl
C-index train: 0.7982
C-index test:  0.8060
X_train shape: (5162, 76), X_test shape: (1290, 76)
Generating TABICL Embeddings...
Warming up TabICL model (triggering checkpoint load)...
ARRIVATO QUI 1
Loading TabICL model checkpoint 'tabicl-classifier-v1.1-0506.ckpt'...
ARRIVATO QUI
Performing dummy prediction to ensure model is loaded...
Warming up TabICL model (triggering checkpoint load)...
ARRIVATO QUI 1
Loading TabICL model checkpoint 'tabicl-classifier-v1.1-0506.ckpt'...
ARRIVATO QUI
Performing dummy prediction to ensure model is loaded...
Successfully generated embeddings with shape: (5162, 512)
  [ckpt] Loading TABICL DeepSurv Tuned from checkpoints/tabicl/OrmoniTirodei/-1/seed77/fold4
C-index train: 0.9149
C-index test:  0.7236
  [ckpt] Loading TABICL RSF Tuned from checkpoints/tabicl/OrmoniTirodei/-1/seed77/fold4
C-index train: 0.9439
C-index test:  0.7219
  [ckpt] Loading DeepSurv Simple from checkpoints/tabicl/OrmoniTirodei/-1/seed77/fold4/tabicl_deepsurv_simple.pt
C-index TRAIN: 0.9198
C-index TEST:  0.7227
  [ckpt] Loading DeepSurv Vanilla from checkpoints/tabicl/OrmoniTirodei/-1/seed77/fold4/tabicl_deepsurv_vanilla.pt
C-index TRAIN: 0.9224
C-index TEST:  0.7440
  [ckpt] Loading TABICL RSF from checkpoints/tabicl/OrmoniTirodei/-1/seed77/fold4/tabicl_rsf.pkl
C-index train: 0.9643
C-index test:  0.7236
  [ckpt] Loading TABICL Cox (embedding) from checkpoints/tabicl/OrmoniTirodei/-1/seed77/fold4/tabicl_tab_cox.pkl
C-index train: 0.9289
C-index test:  0.7341
  [ckpt] Loading DeepSurv Vanilla baseline from checkpoints/tabicl/OrmoniTirodei/-1/seed77/fold4/deepsurv_vanilla_baseline.pt
C-index TRAIN: 0.8109
C-index TEST:  0.7786
  [ckpt] Loading DeepSurv Simple baseline from checkpoints/tabicl/OrmoniTirodei/-1/seed77/fold4/deepsurv_simple_baseline.pt
C-index TRAIN: 0.7855
C-index TEST:  0.7572
  [ckpt] Loading RSF baseline from checkpoints/tabicl/OrmoniTirodei/-1/seed77/fold4/rsf_baseline.pkl
C-index train: 0.9121
C-index test:  0.7834
  [ckpt] Loading Cox baseline from checkpoints/tabicl/OrmoniTirodei/-1/seed77/fold4/tabicl_cox.pkl
C-index train: 0.8041
C-index test:  0.7792
X_train shape: (5162, 76), X_test shape: (1290, 76)
Generating TABICL Embeddings...
Warming up TabICL model (triggering checkpoint load)...
ARRIVATO QUI 1
Loading TabICL model checkpoint 'tabicl-classifier-v1.1-0506.ckpt'...
ARRIVATO QUI
Performing dummy prediction to ensure model is loaded...
Warming up TabICL model (triggering checkpoint load)...
ARRIVATO QUI 1
Loading TabICL model checkpoint 'tabicl-classifier-v1.1-0506.ckpt'...
ARRIVATO QUI
Performing dummy prediction to ensure model is loaded...
Successfully generated embeddings with shape: (5162, 512)
  [ckpt] Loading TABICL DeepSurv Tuned from checkpoints/tabicl/OrmoniTirodei/-1/seed77/fold5
C-index train: 0.9146
C-index test:  0.7318
  [ckpt] Loading TABICL RSF Tuned from checkpoints/tabicl/OrmoniTirodei/-1/seed77/fold5
C-index train: 0.9460
C-index test:  0.7309
  [ckpt] Loading DeepSurv Simple from checkpoints/tabicl/OrmoniTirodei/-1/seed77/fold5/tabicl_deepsurv_simple.pt
C-index TRAIN: 0.9204
C-index TEST:  0.7305
  [ckpt] Loading DeepSurv Vanilla from checkpoints/tabicl/OrmoniTirodei/-1/seed77/fold5/tabicl_deepsurv_vanilla.pt
C-index TRAIN: 0.9193
C-index TEST:  0.7351
  [ckpt] Loading TABICL RSF from checkpoints/tabicl/OrmoniTirodei/-1/seed77/fold5/tabicl_rsf.pkl
C-index train: 0.9659
C-index test:  0.7285
  [ckpt] Loading TABICL Cox (embedding) from checkpoints/tabicl/OrmoniTirodei/-1/seed77/fold5/tabicl_tab_cox.pkl
C-index train: 0.9259
C-index test:  0.7305
  [ckpt] Loading DeepSurv Vanilla baseline from checkpoints/tabicl/OrmoniTirodei/-1/seed77/fold5/deepsurv_vanilla_baseline.pt
C-index TRAIN: 0.8052
C-index TEST:  0.7935
  [ckpt] Loading DeepSurv Simple baseline from checkpoints/tabicl/OrmoniTirodei/-1/seed77/fold5/deepsurv_simple_baseline.pt
C-index TRAIN: 0.7772
C-index TEST:  0.7576
  [ckpt] Loading RSF baseline from checkpoints/tabicl/OrmoniTirodei/-1/seed77/fold5/rsf_baseline.pkl
C-index train: 0.9093
C-index test:  0.7940
  [ckpt] Loading Cox baseline from checkpoints/tabicl/OrmoniTirodei/-1/seed77/fold5/tabicl_cox.pkl
C-index train: 0.8009
C-index test:  0.7926


Preprocess: Keep NaN
Loading existing folds from tmp/splits/OrmoniTirodei_seed77.pkl
X_train shape: (5161, 76), X_test shape: (1291, 76)
Generating TABICL Embeddings...
Warming up TabICL model (triggering checkpoint load)...
ARRIVATO QUI 1
Loading TabICL model checkpoint 'tabicl-classifier-v1.1-0506.ckpt'...
ARRIVATO QUI
Performing dummy prediction to ensure model is loaded...
Warming up TabICL model (triggering checkpoint load)...
ARRIVATO QUI 1
Loading TabICL model checkpoint 'tabicl-classifier-v1.1-0506.ckpt'...
ARRIVATO QUI
Performing dummy prediction to ensure model is loaded...
Successfully generated embeddings with shape: (5161, 512)
  [ckpt] Loading TABICL DeepSurv Tuned from checkpoints/tabicl/OrmoniTirodei/NaN/seed77/fold1
C-index train: 0.9204
C-index test:  0.7532
  [ckpt] Loading TABICL RSF Tuned from checkpoints/tabicl/OrmoniTirodei/NaN/seed77/fold1
C-index train: 0.9541
C-index test:  0.7461
  [ckpt] Loading DeepSurv Simple from checkpoints/tabicl/OrmoniTirodei/NaN/seed77/fold1/tabicl_deepsurv_simple.pt
C-index TRAIN: 0.9242
C-index TEST:  0.7514
  [ckpt] Loading DeepSurv Vanilla from checkpoints/tabicl/OrmoniTirodei/NaN/seed77/fold1/tabicl_deepsurv_vanilla.pt
C-index TRAIN: 0.9163
C-index TEST:  0.7444
  [ckpt] Loading TABICL RSF from checkpoints/tabicl/OrmoniTirodei/NaN/seed77/fold1/tabicl_rsf.pkl
C-index train: 0.9622
C-index test:  0.7409
  [ckpt] Loading TABICL Cox (embedding) from checkpoints/tabicl/OrmoniTirodei/NaN/seed77/fold1/tabicl_tab_cox.pkl
C-index train: 0.9257
C-index test:  0.7458
X_train shape: (5161, 76), X_test shape: (1291, 76)
Generating TABICL Embeddings...
Warming up TabICL model (triggering checkpoint load)...
ARRIVATO QUI 1
Loading TabICL model checkpoint 'tabicl-classifier-v1.1-0506.ckpt'...
ARRIVATO QUI
Performing dummy prediction to ensure model is loaded...
Warming up TabICL model (triggering checkpoint load)...
ARRIVATO QUI 1
Loading TabICL model checkpoint 'tabicl-classifier-v1.1-0506.ckpt'...
ARRIVATO QUI
Performing dummy prediction to ensure model is loaded...
Successfully generated embeddings with shape: (5161, 512)
  [ckpt] Loading TABICL DeepSurv Tuned from checkpoints/tabicl/OrmoniTirodei/NaN/seed77/fold2
C-index train: 0.9233
C-index test:  0.7534
  [ckpt] Loading TABICL RSF Tuned from checkpoints/tabicl/OrmoniTirodei/NaN/seed77/fold2
C-index train: 0.9444
C-index test:  0.7549
  [ckpt] Loading DeepSurv Simple from checkpoints/tabicl/OrmoniTirodei/NaN/seed77/fold2/tabicl_deepsurv_simple.pt
C-index TRAIN: 0.9215
C-index TEST:  0.7496
  [ckpt] Loading DeepSurv Vanilla from checkpoints/tabicl/OrmoniTirodei/NaN/seed77/fold2/tabicl_deepsurv_vanilla.pt
C-index TRAIN: 0.9178
C-index TEST:  0.7545
  [ckpt] Loading TABICL RSF from checkpoints/tabicl/OrmoniTirodei/NaN/seed77/fold2/tabicl_rsf.pkl
C-index train: 0.9615
C-index test:  0.7555
  [ckpt] Loading TABICL Cox (embedding) from checkpoints/tabicl/OrmoniTirodei/NaN/seed77/fold2/tabicl_tab_cox.pkl
C-index train: 0.9240
C-index test:  0.7430
X_train shape: (5162, 76), X_test shape: (1290, 76)
Generating TABICL Embeddings...
Warming up TabICL model (triggering checkpoint load)...
ARRIVATO QUI 1
Loading TabICL model checkpoint 'tabicl-classifier-v1.1-0506.ckpt'...
ARRIVATO QUI
Performing dummy prediction to ensure model is loaded...
Warming up TabICL model (triggering checkpoint load)...
ARRIVATO QUI 1
Loading TabICL model checkpoint 'tabicl-classifier-v1.1-0506.ckpt'...
ARRIVATO QUI
Performing dummy prediction to ensure model is loaded...
Successfully generated embeddings with shape: (5162, 512)
  [ckpt] Loading TABICL DeepSurv Tuned from checkpoints/tabicl/OrmoniTirodei/NaN/seed77/fold3
C-index train: 0.9129
C-index test:  0.7751
  [ckpt] Loading TABICL RSF Tuned from checkpoints/tabicl/OrmoniTirodei/NaN/seed77/fold3
C-index train: 0.9553
C-index test:  0.7664
  [ckpt] Loading DeepSurv Simple from checkpoints/tabicl/OrmoniTirodei/NaN/seed77/fold3/tabicl_deepsurv_simple.pt
C-index TRAIN: 0.9198
C-index TEST:  0.7692
  [ckpt] Loading DeepSurv Vanilla from checkpoints/tabicl/OrmoniTirodei/NaN/seed77/fold3/tabicl_deepsurv_vanilla.pt
C-index TRAIN: 0.9182
C-index TEST:  0.7782
  [ckpt] Loading TABICL RSF from checkpoints/tabicl/OrmoniTirodei/NaN/seed77/fold3/tabicl_rsf.pkl
C-index train: 0.9604
C-index test:  0.7642
  [ckpt] Loading TABICL Cox (embedding) from checkpoints/tabicl/OrmoniTirodei/NaN/seed77/fold3/tabicl_tab_cox.pkl
C-index train: 0.9245
C-index test:  0.7601
X_train shape: (5162, 76), X_test shape: (1290, 76)
Generating TABICL Embeddings...
Warming up TabICL model (triggering checkpoint load)...
ARRIVATO QUI 1
Loading TabICL model checkpoint 'tabicl-classifier-v1.1-0506.ckpt'...
ARRIVATO QUI
Performing dummy prediction to ensure model is loaded...
Warming up TabICL model (triggering checkpoint load)...
ARRIVATO QUI 1
Loading TabICL model checkpoint 'tabicl-classifier-v1.1-0506.ckpt'...
ARRIVATO QUI
Performing dummy prediction to ensure model is loaded...
Successfully generated embeddings with shape: (5162, 512)
  [ckpt] Loading TABICL DeepSurv Tuned from checkpoints/tabicl/OrmoniTirodei/NaN/seed77/fold4
C-index train: 0.9186
C-index test:  0.7437
  [ckpt] Loading TABICL RSF Tuned from checkpoints/tabicl/OrmoniTirodei/NaN/seed77/fold4
C-index train: 0.9582
C-index test:  0.7312
  [ckpt] Loading DeepSurv Simple from checkpoints/tabicl/OrmoniTirodei/NaN/seed77/fold4/tabicl_deepsurv_simple.pt
C-index TRAIN: 0.9240
C-index TEST:  0.7409
  [ckpt] Loading DeepSurv Vanilla from checkpoints/tabicl/OrmoniTirodei/NaN/seed77/fold4/tabicl_deepsurv_vanilla.pt
C-index TRAIN: 0.9192
C-index TEST:  0.7458
  [ckpt] Loading TABICL RSF from checkpoints/tabicl/OrmoniTirodei/NaN/seed77/fold4/tabicl_rsf.pkl
C-index train: 0.9627
C-index test:  0.7339
  [ckpt] Loading TABICL Cox (embedding) from checkpoints/tabicl/OrmoniTirodei/NaN/seed77/fold4/tabicl_tab_cox.pkl
C-index train: 0.9273
C-index test:  0.7392
X_train shape: (5162, 76), X_test shape: (1290, 76)
Generating TABICL Embeddings...
Warming up TabICL model (triggering checkpoint load)...
ARRIVATO QUI 1
Loading TabICL model checkpoint 'tabicl-classifier-v1.1-0506.ckpt'...
ARRIVATO QUI
Performing dummy prediction to ensure model is loaded...
Warming up TabICL model (triggering checkpoint load)...
ARRIVATO QUI 1
Loading TabICL model checkpoint 'tabicl-classifier-v1.1-0506.ckpt'...
ARRIVATO QUI
Performing dummy prediction to ensure model is loaded...
Successfully generated embeddings with shape: (5162, 512)
  [ckpt] Loading TABICL DeepSurv Tuned from checkpoints/tabicl/OrmoniTirodei/NaN/seed77/fold5
C-index train: 0.9133
C-index test:  0.7420
  [ckpt] Loading TABICL RSF Tuned from checkpoints/tabicl/OrmoniTirodei/NaN/seed77/fold5
C-index train: 0.9613
C-index test:  0.7385
  [ckpt] Loading DeepSurv Simple from checkpoints/tabicl/OrmoniTirodei/NaN/seed77/fold5/tabicl_deepsurv_simple.pt
C-index TRAIN: 0.9227
C-index TEST:  0.7256
  [ckpt] Loading DeepSurv Vanilla from checkpoints/tabicl/OrmoniTirodei/NaN/seed77/fold5/tabicl_deepsurv_vanilla.pt
C-index TRAIN: 0.9179
C-index TEST:  0.7489
  [ckpt] Loading TABICL RSF from checkpoints/tabicl/OrmoniTirodei/NaN/seed77/fold5/tabicl_rsf.pkl
C-index train: 0.9635
C-index test:  0.7406
  [ckpt] Loading TABICL Cox (embedding) from checkpoints/tabicl/OrmoniTirodei/NaN/seed77/fold5/tabicl_tab_cox.pkl
C-index train: 0.9243
C-index test:  0.7348

  Preprocess: -1 | Seed: 77
  TABICL Train Tuned DeepSurv → mean: 0.915175 | std: 0.004711 | min: 0.910654 | max: 0.924020
  TABICL Test Tuned DeepSurv → mean: 0.741650 | std: 0.012489 | min: 0.723639 | max: 0.759078
  TABICL Train Tuned RSF → mean: 0.949244 | std: 0.005560 | min: 0.943908 | max: 0.959277
  TABICL Test Tuned RSF → mean: 0.738220 | std: 0.011383 | min: 0.721858 | max: 0.754585
  TABICL Train Vanilla → mean: 0.921730 | std: 0.001571 | min: 0.919311 | max: 0.924146
  TABICL Test Vanilla → mean: 0.748500 | std: 0.012807 | min: 0.735083 | max: 0.770851
  TABICL Train Simple → mean: 0.920311 | std: 0.002237 | min: 0.916421 | max: 0.922937
  TABICL Test Simple → mean: 0.734206 | std: 0.008003 | min: 0.722667 | max: 0.746861
  TABICL Train RSF → mean: 0.963647 | std: 0.001525 | min: 0.961340 | max: 0.965861
  TABICL Test RSF → mean: 0.738357 | std: 0.012278 | min: 0.723575 | max: 0.756263
  TABICL Train Cox → mean: 0.927249 | std: 0.001099 | min: 0.925886 | max: 0.928942
  TABICL Test Cox → mean: 0.743074 | std: 0.013166 | min: 0.730462 | max: 0.762125
  Train DeepSurv Vanilla → mean: 0.804029 | std: 0.004996 | min: 0.795343 | max: 0.810937
  Test DeepSurv Vanilla → mean: 0.790657 | std: 0.010230 | min: 0.778591 | max: 0.805647
  Train DeepSurv Simple → mean: 0.785970 | std: 0.007989 | min: 0.777223 | max: 0.799338
  Test DeepSurv Simple → mean: 0.777619 | std: 0.018905 | min: 0.757153 | max: 0.807134
  Train RSF  → mean: 0.908116 | std: 0.002443 | min: 0.905242 | max: 0.912100
  Test RSF   → mean: 0.796860 | std: 0.008740 | min: 0.783351 | max: 0.808696
  Train Cox  → mean: 0.800737 | std: 0.002377 | min: 0.797973 | max: 0.804055
  Test Cox   → mean: 0.793828 | std: 0.010610 | min: 0.779231 | max: 0.806035

  Preprocess: NaN | Seed: 77
  TABICL Train Tuned DeepSurv → mean: 0.917708 | std: 0.004041 | min: 0.912890 | max: 0.923318
  TABICL Test Tuned DeepSurv → mean: 0.753474 | std: 0.011778 | min: 0.741986 | max: 0.775058
  TABICL Train Tuned RSF → mean: 0.954676 | std: 0.005689 | min: 0.944444 | max: 0.961297
  TABICL Test Tuned RSF → mean: 0.747412 | std: 