[I 2026-06-28 05:49:50,657] Trial 80 finished with value: 0.7700327319375121 and parameters: {'n_estimators': 50, 'max_depth': 9, 'min_samples_split': 8, 'min_samples_leaf': 12, 'max_features': 'sqrt'}. Best is trial 62 with value: 0.7733500284750598.
[I 2026-06-28 05:51:43,188] Trial 82 finished with value: 0.7700327319375121 and parameters: {'n_estimators': 50, 'max_depth': 9, 'min_samples_split': 12, 'min_samples_leaf': 12, 'max_features': 'sqrt'}. Best is trial 62 with value: 0.7733500284750598.
[I 2026-06-28 05:56:05,930] Trial 81 finished with value: 0.771123796521249 and parameters: {'n_estimators': 100, 'max_depth': 9, 'min_samples_split': 12, 'min_samples_leaf': 12, 'max_features': 'sqrt'}. Best is trial 62 with value: 0.7733500284750598.
[I 2026-06-28 06:00:20,275] Trial 85 finished with value: 0.7726501364310108 and parameters: {'n_estimators': 250, 'max_depth': 10, 'min_samples_split': 12, 'min_samples_leaf': 13, 'max_features': 'log2'}. Best is trial 62 with value: 0.7733500284750598.
[I 2026-06-28 06:02:15,658] Trial 86 finished with value: 0.7726501364310108 and parameters: {'n_estimators': 250, 'max_depth': 10, 'min_samples_split': 12, 'min_samples_leaf': 13, 'max_features': 'log2'}. Best is trial 62 with value: 0.7733500284750598.
[I 2026-06-28 06:10:30,451] Trial 76 finished with value: 0.7702724209936933 and parameters: {'n_estimators': 250, 'max_depth': 9, 'min_samples_split': 6, 'min_samples_leaf': 7, 'max_features': 'sqrt'}. Best is trial 62 with value: 0.7733500284750598.
[I 2026-06-28 06:16:12,838] Trial 83 finished with value: 0.7731486896678677 and parameters: {'n_estimators': 250, 'max_depth': 9, 'min_samples_split': 12, 'min_samples_leaf': 11, 'max_features': 'sqrt'}. Best is trial 62 with value: 0.7733500284750598.
[I 2026-06-28 06:16:22,605] Trial 78 finished with value: 0.7733500284750598 and parameters: {'n_estimators': 300, 'max_depth': 9, 'min_samples_split': 8, 'min_samples_leaf': 11, 'max_features': 'sqrt'}. Best is trial 62 with value: 0.7733500284750598.
[I 2026-06-28 06:16:54,745] Trial 79 finished with value: 0.7729032480743381 and parameters: {'n_estimators': 300, 'max_depth': 9, 'min_samples_split': 8, 'min_samples_leaf': 12, 'max_features': 'sqrt'}. Best is trial 62 with value: 0.7733500284750598.
[I 2026-06-28 06:18:04,937] Trial 84 finished with value: 0.7701976380081648 and parameters: {'n_estimators': 250, 'max_depth': 9, 'min_samples_split': 12, 'min_samples_leaf': 13, 'max_features': 'sqrt'}. Best is trial 62 with value: 0.7733500284750598.
[I 2026-06-28 06:27:50,911] Trial 87 finished with value: 0.7737316134525003 and parameters: {'n_estimators': 250, 'max_depth': 10, 'min_samples_split': 8, 'min_samples_leaf': 13, 'max_features': 'sqrt'}. Best is trial 87 with value: 0.7737316134525003.
[I 2026-06-28 06:37:01,022] Trial 88 finished with value: 0.7733500284750598 and parameters: {'n_estimators': 300, 'max_depth': 9, 'min_samples_split': 10, 'min_samples_leaf': 11, 'max_features': 'sqrt'}. Best is trial 87 with value: 0.7737316134525003.
[I 2026-06-28 06:39:01,280] Trial 89 finished with value: 0.7733500284750598 and parameters: {'n_estimators': 300, 'max_depth': 9, 'min_samples_split': 10, 'min_samples_leaf': 11, 'max_features': 'sqrt'}. Best is trial 87 with value: 0.7737316134525003.
[I 2026-06-28 06:47:00,977] Trial 91 finished with value: 0.7731486896678677 and parameters: {'n_estimators': 250, 'max_depth': 9, 'min_samples_split': 20, 'min_samples_leaf': 11, 'max_features': 'sqrt'}. Best is trial 87 with value: 0.7737316134525003.
[I 2026-06-28 06:47:08,651] Trial 90 finished with value: 0.7733500284750598 and parameters: {'n_estimators': 300, 'max_depth': 9, 'min_samples_split': 8, 'min_samples_leaf': 11, 'max_features': 'sqrt'}. Best is trial 87 with value: 0.7737316134525003.
[I 2026-06-28 06:49:04,344] Trial 92 finished with value: 0.7725216630968976 and parameters: {'n_estimators': 250, 'max_depth': 10, 'min_samples_split': 8, 'min_samples_leaf': 11, 'max_features': 'sqrt'}. Best is trial 87 with value: 0.7737316134525003.
[I 2026-06-28 06:50:32,586] Trial 94 finished with value: 0.7725216630968976 and parameters: {'n_estimators': 250, 'max_depth': 10, 'min_samples_split': 8, 'min_samples_leaf': 11, 'max_features': 'sqrt'}. Best is trial 87 with value: 0.7737316134525003.
[I 2026-06-28 06:53:05,999] Trial 93 finished with value: 0.7671679683380345 and parameters: {'n_estimators': 250, 'max_depth': 10, 'min_samples_split': 15, 'min_samples_leaf': 3, 'max_features': 'sqrt'}. Best is trial 87 with value: 0.7737316134525003.
[I 2026-06-28 06:56:57,099] Trial 95 finished with value: 0.7725216630968976 and parameters: {'n_estimators': 250, 'max_depth': 10, 'min_samples_split': 7, 'min_samples_leaf': 11, 'max_features': 'sqrt'}. Best is trial 87 with value: 0.7737316134525003.
[I 2026-06-28 07:01:30,035] Trial 96 finished with value: 0.7725216630968976 and parameters: {'n_estimators': 250, 'max_depth': 10, 'min_samples_split': 20, 'min_samples_leaf': 11, 'max_features': 'sqrt'}. Best is trial 87 with value: 0.7737316134525003.
[I 2026-06-28 07:02:24,101] Trial 97 finished with value: 0.7705715529358075 and parameters: {'n_estimators': 250, 'max_depth': 10, 'min_samples_split': 19, 'min_samples_leaf': 10, 'max_features': 'sqrt'}. Best is trial 87 with value: 0.7737316134525003.
[I 2026-06-28 07:04:21,824] Trial 98 finished with value: 0.7705715529358075 and parameters: {'n_estimators': 250, 'max_depth': 10, 'min_samples_split': 15, 'min_samples_leaf': 10, 'max_features': 'sqrt'}. Best is trial 87 with value: 0.7737316134525003.
[I 2026-06-28 07:05:06,422] Trial 99 finished with value: 0.7707364590064602 and parameters: {'n_estimators': 300, 'max_depth': 10, 'min_samples_split': 7, 'min_samples_leaf': 10, 'max_features': 'sqrt'}. Best is trial 87 with value: 0.7737316134525003.
ENV CHECKPOINT PATH: 
DEFAULT PATH: /scratch.hpc/luca.cotugno/Foundation_model_clinical_data/src/models_diff/tabdpt1_1.pth
ENV CHECKPOINT PATH: 
DEFAULT PATH: /scratch.hpc/luca.cotugno/Foundation_model_clinical_data/src/models_diff/tabdpt1_1.pth
[I 2026-06-28 07:11:54,426] A new study created in memory with name: deepsurv_tuning_tabdpt_4_-1_seed123
/scratch.hpc/luca.cotugno/Foundation_model_clinical_data/test_tabular_model.py:481: UserWarning: Choices for a categorical distribution should be a tuple of None, bool, int, float and str for persistent storage but contains [32] which is of type list.
  num_nodes  = trial.suggest_categorical("num_nodes", [[32], [64], [128], [64, 32], [128, 64]])
/scratch.hpc/luca.cotugno/Foundation_model_clinical_data/test_tabular_model.py:481: UserWarning: Choices for a categorical distribution should be a tuple of None, bool, int, float and str for persistent storage but contains [64] which is of type list.
  num_nodes  = trial.suggest_categorical("num_nodes", [[32], [64], [128], [64, 32], [128, 64]])
/scratch.hpc/luca.cotugno/Foundation_model_clinical_data/test_tabular_model.py:481: UserWarning: Choices for a categorical distribution should be a tuple of None, bool, int, float and str for persistent storage but contains [128] which is of type list.
  num_nodes  = trial.suggest_categorical("num_nodes", [[32], [64], [128], [64, 32], [128, 64]])
/scratch.hpc/luca.cotugno/Foundation_model_clinical_data/test_tabular_model.py:481: UserWarning: Choices for a categorical distribution should be a tuple of None, bool, int, float and str for persistent storage but contains [64, 32] which is of type list.
  num_nodes  = trial.suggest_categorical("num_nodes", [[32], [64], [128], [64, 32], [128, 64]])
/scratch.hpc/luca.cotugno/Foundation_model_clinical_data/test_tabular_model.py:481: UserWarning: Choices for a categorical distribution should be a tuple of None, bool, int, float and str for persistent storage but contains [128, 64] which is of type list.
  num_nodes  = trial.suggest_categorical("num_nodes", [[32], [64], [128], [64, 32], [128, 64]])
[I 2026-06-28 07:12:10,382] Trial 7 finished with value: 0.7451678320606004 and parameters: {'num_nodes': [64, 32], 'dropout': 0.2909889854074658, 'learning_rate': 0.003574977419584075, 'batch_norm': True}. Best is trial 7 with value: 0.7451678320606004.
/scratch.hpc/luca.cotugno/Foundation_model_clinical_data/test_tabular_model.py:481: UserWarning: Choices for a categorical distribution should be a tuple of None, bool, int, float and str for persistent storage but contains [32] which is of type list.
  num_nodes  = trial.suggest_categorical("num_nodes", [[32], [64], [128], [64, 32], [128, 64]])
/scratch.hpc/luca.cotugno/Foundation_model_clinical_data/test_tabular_model.py:481: UserWarning: Choices for a categorical distribution should be a tuple of None, bool, int, float and str for persistent storage but contains [64] which is of type list.
  num_nodes  = trial.suggest_categorical("num_nodes", [[32], [64], [128], [64, 32], [128, 64]])
/scratch.hpc/luca.cotugno/Foundation_model_clinical_data/test_tabular_model.py:481: UserWarning: Choices for a categorical distribution should be a tuple of None, bool, int, float and str for persistent storage but contains [128] which is of type list.
  num_nodes  = trial.suggest_categorical("num_nodes", [[32], [64], [128], [64, 32], [128, 64]])
/scratch.hpc/luca.cotugno/Foundation_model_clinical_data/test_tabular_model.py:481: UserWarning: Choices for a categorical distribution should be a tuple of None, bool, int, float and str for persistent storage but contains [64, 32] which is of type list.
  num_nodes  = trial.suggest_categorical("num_nodes", [[32], [64], [128], [64, 32], [128, 64]])
/scratch.hpc/luca.cotugno/Foundation_model_clinical_data/test_tabular_model.py:481: UserWarning: Choices for a categorical distribution should be a tuple of None, bool, int, float and str for persistent storage but contains [128, 64] which is of type list.
  num_nodes  = trial.suggest_categorical("num_nodes", [[32], [64], [128], [64, 32], [128, 64]])
[I 2026-06-28 07:12:11,151] Trial 3 finished with value: 0.6681483270463398 and parameters: {'num_nodes': [128, 64], 'dropout': 0.008847561060139019, 'learning_rate': 0.005331325616981765, 'batch_norm': True}. Best is trial 7 with value: 0.7451678320606004.
/scratch.hpc/luca.cotugno/Foundation_model_clinical_data/test_tabular_model.py:481: UserWarning: Choices for a categorical distribution should be a tuple of None, bool, int, float and str for persistent storage but contains [32] which is of type list.
  num_nodes  = trial.suggest_categorical("num_nodes", [[32], [64], [128], [64, 32], [128, 64]])
/scratch.hpc/luca.cotugno/Foundation_model_clinical_data/test_tabular_model.py:481: UserWarning: Choices for a categorical distribution should be a tuple of None, bool, int, float and str for persistent storage but contains [64] which is of type list.
  num_nodes  = trial.suggest_categorical("num_nodes", [[32], [64], [128], [64, 32], [128, 64]])
/scratch.hpc/luca.cotugno/Foundation_model_clinical_data/test_tabular_model.py:481: UserWarning: Choices for a categorical distribution should be a tuple of None, bool, int, float and str for persistent storage but contains [128] which is of type list.
  num_nodes  = trial.suggest_categorical("num_nodes", [[32], [64], [128], [64, 32], [128, 64]])
/scratch.hpc/luca.cotugno/Foundation_model_clinical_data/test_tabular_model.py:481: UserWarning: Choices for a categorical distribution should be a tuple of None, bool, int, float and str for persistent storage but contains [64, 32] which is of type list.
  num_nodes  = trial.suggest_categorical("num_nodes", [[32], [64], [128], [64, 32], [128, 64]])
/scratch.hpc/luca.cotugno/Foundation_model_clinical_data/test_tabular_model.py:481: UserWarning: Choices for a categorical distribution should be a tuple of None, bool, int, float and str for persistent storage but contains [128, 64] which is of type list.
  num_nodes  = trial.suggest_categorical("num_nodes", [[32], [64], [128], [64, 32], [128, 64]])
[I 2026-06-28 07:12:15,197] Trial 0 finished with value: 0.7511864783635416 and parameters: {'num_nodes': [64, 32], 'dropout': 0.2298673100709132, 'learning_rate': 0.0002311353416545348, 'batch_norm': False}. Best is trial 0 with value: 0.7511864783635416.
/scratch.hpc/luca.cotugno/Foundation_model_clinical_data/test_tabular_model.py:481: UserWarning: Choices for a categorical distribution should be a tuple of None, bool, int, float and str for persistent storage but contains [32] which is of type list.
  num_nodes  = trial.suggest_categorical("num_nodes", [[32], [64], [128], [64, 32], [128, 64]])
/scratch.hpc/luca.cotugno/Foundation_model_clinical_data/test_tabular_model.py:481: UserWarning: Choices for a categorical distribution should be a tuple of None, bool, int, float and str for persistent storage but contains [64] which is of type list.
  num_nodes  = trial.suggest_categorical("num_nodes", [[32], [64], [128], [64, 32], [128, 64]])
/scratch.hpc/luca.cotugno/Foundation_model_clinical_data/test_tabular_model.py:481: UserWarning: Choices for a categorical distribution should be a tuple of None, bool, int, float and str for persistent storage but contains [128] which is of type list.
  num_nodes  = trial.suggest_categorical("num_nodes", [[32], [64], [128], [64, 32], [128, 64]])
/scratch.hpc/luca.cotugno/Foundation_model_clinical_data/test_tabular_model.py:481: UserWarning: Choices for a categorical distribution should be a tuple of None, bool, int, float and str for persistent storage but contains [64, 32] which is of type list.
  num_nodes  = trial.suggest_categorical("num_nodes", [[32], [64], [128], [64, 32], [128, 64]])
/scratch.hpc/luca.cotugno/Foundation_model_clinical_data/test_tabular_model.py:481: UserWarning: Choices for a categorical distribution should be a tuple of None, bool, int, float and str for persistent storage but contains [128, 64] which is of type list.
  num_nodes  = trial.suggest_categorical("num_nodes", [[32], [64], [128], [64, 32], [128, 64]])
[I 2026-06-28 07:12:22,062] Trial 8 finished with value: 0.7159850645566903 and parameters: {'num_nodes': [128, 64], 'dropout': 0.09090843600714316, 'learning_rate': 0.00022355862702469557, 'batch_norm': False}. Best is trial 0 with value: 0.7511864783635416.
/scratch.hpc/luca.cotugno/Foundation_model_clinical_data/test_tabular_model.py:481: UserWarning: Choices for a categorical distribution should be a tuple of None, bool, int, float and str for persistent storage but contains [32] which is of type list.
  num_nodes  = trial.suggest_categorical("num_nodes", [[32], [64], [128], [64, 32], [128, 64]])
/scratch.hpc/luca.cotugno/Foundation_model_clinical_data/test_tabular_model.py:481: UserWarning: Choices for a categorical distribution should be a tuple of None, bool, int, float and str for persistent storage but contains [64] which is of type list.
  num_nodes  = trial.suggest_categorical("num_nodes", [[32], [64], [128], [64, 32], [128, 64]])
/scratch.hpc/luca.cotugno/Foundation_model_clinical_data/test_tabular_model.py:481: UserWarning: Choices for a categorical distribution should be a tuple of None, bool, int, float and str for persistent storage but contains [128] which is of type list.
  num_nodes  = trial.suggest_categorical("num_nodes", [[32], [64], [128], [64, 32], [128, 64]])
/scratch.hpc/luca.cotugno/Foundation_model_clinical_data/test_tabular_model.py:481: UserWarning: Choices for a categorical distribution should be a tuple of None, bool, int, float and str for persistent storage but contains [64, 32] which is of type list.
  num_nodes  = trial.suggest_categorical("num_nodes", [[32], [64], [128], [64, 32], [128, 64]])
/scratch.hpc/luca.cotugno/Foundation_model_clinical_data/test_tabular_model.py:481: UserWarning: Choices for a categorical distribution should be a tuple of None, bool, int, float and str for persistent storage but contains [128, 64] which is of type list.
  num_nodes  = trial.suggest_categorical("num_nodes", [[32], [64], [128], [64, 32], [128, 64]])
[I 2026-06-28 07:12:23,223] Trial 9 finished with value: 0.7509679670009507 and parameters: {'num_nodes': [32], 'dropout': 0.013573391414230484, 'learning_rate': 0.00012936411492366447, 'batch_norm': True}. Best is trial 0 with value: 0.7511864783635416.
/scratch.hpc/luca.cotugno/Foundation_model_clinical_data/test_tabular_model.py:481: UserWarning: Choices for a categorical distribution should be a tuple of None, bool, int, float and str for persistent storage but contains [32] which is of type list.
  num_nodes  = trial.suggest_categorical("num_nodes", [[32], [64], [128], [64, 32], [128, 64]])
/scratch.hpc/luca.cotugno/Foundation_model_clinical_data/test_tabular_model.py:481: UserWarning: Choices for a categorical distribution should be a tuple of None, bool, int, float and str for persistent storage but contains [64] which is of type list.
  num_nodes  = trial.suggest_categorical("num_nodes", [[32], [64], [128], [64, 32], [128, 64]])
/scratch.hpc/luca.cotugno/Foundation_model_clinical_data/test_tabular_model.py:481: UserWarning: Choices for a categorical distribution should be a tuple of None, bool, int, float and str for persistent storage but contains [128] which is of type list.
  num_nodes  = trial.suggest_categorical("num_nodes", [[32], [64], [128], [64, 32], [128, 64]])
/scratch.hpc/luca.cotugno/Foundation_model_clinical_data/test_tabular_model.py:481: UserWarning: Choices for a categorical distribution should be a tuple of None, bool, int, float and str for persistent storage but contains [64, 32] which is of type list.
  num_nodes  = trial.suggest_categorical("num_nodes", [[32], [64], [128], [64, 32], [128, 64]])
/scratch.hpc/luca.cotugno/Foundation_model_clinical_data/test_tabular_model.py:481: UserWarning: Choices for a categorical distribution should be a tuple of None, bool, int, float and str for persistent storage but contains [128, 64] which is of type list.
  num_nodes  = trial.suggest_categorical("num_nodes", [[32], [64], [128], [64, 32], [128, 64]])
[I 2026-06-28 07:12:30,141] Trial 1 finished with value: 0.762489649461772 and parameters: {'num_nodes': [128], 'dropout': 0.14008775022786923, 'learning_rate': 0.005253948646167869, 'batch_norm': True}. Best is trial 1 with value: 0.762489649461772.
/scratch.hpc/luca.cotugno/Foundation_model_clinical_data/test_tabular_model.py:481: UserWarning: Choices for a categorical distribution should be a tuple of None, bool, int, float and str for persistent storage but contains [32] which is of type list.
  num_nodes  = trial.suggest_categorical("num_nodes", [[32], [64], [128], [64, 32], [128, 64]])
/scratch.hpc/luca.cotugno/Foundation_model_clinical_data/test_tabular_model.py:481: UserWarning: Choices for a categorical distribution should be a tuple of None, bool, int, float and str for persistent storage but contains [64] which is of type list.
  num_nodes  = trial.suggest_categorical("num_nodes", [[32], [64], [128], [64, 32], [128, 64]])
/scratch.hpc/luca.cotugno/Foundation_model_clinical_data/test_tabular_model.py:481: UserWarning: Choices for a categorical distribution should be a tuple of None, bool, int, float and str for persistent storage but contains [128] which is of type list.
  num_nodes  = trial.suggest_categorical("num_nodes", [[32], [64], [128], [64, 32], [128, 64]])
/scratch.hpc/luca.cotugno/Foundation_model_clinical_data/test_tabular_model.py:481: UserWarning: Choices for a categorical distribution should be a tuple of None, bool, int, float and str for persistent storage but contains [64, 32] which is of type list.
  num_nodes  = trial.suggest_categorical("num_nodes", [[32], [64], [128], [64, 32], [128, 64]])
/scratch.hpc/luca.cotugno/Foundation_model_clinical_data/test_tabular_model.py:481: UserWarning: Choices for a categorical distribution should be a tuple of None, bool, int, float and str for persistent storage but contains [128, 64] which is of type list.
  num_nodes  = trial.suggest_categorical("num_nodes", [[32], [64], [128], [64, 32], [128, 64]])
