[I 2026-06-09 05:41:45,528] Trial 30 finished with value: 0.8060227931676714 and parameters: {'num_nodes': [32], 'dropout': 0.2991082286543517, 'learning_rate': 0.00014536088243352337, 'batch_norm': False}. Best is trial 17 with value: 0.8122559343543445.
/scratch.hpc/luca.cotugno/Foundation_model_clinical_data/test_tabular_model_tmp.py:476: UserWarning: Choices for a categorical distribution should be a tuple of None, bool, int, float and str for persistent storage but contains [32] which is of type list.
  num_nodes  = trial.suggest_categorical("num_nodes", [[32], [64], [128], [64, 32], [128, 64]])
/scratch.hpc/luca.cotugno/Foundation_model_clinical_data/test_tabular_model_tmp.py:476: UserWarning: Choices for a categorical distribution should be a tuple of None, bool, int, float and str for persistent storage but contains [64] which is of type list.
  num_nodes  = trial.suggest_categorical("num_nodes", [[32], [64], [128], [64, 32], [128, 64]])
/scratch.hpc/luca.cotugno/Foundation_model_clinical_data/test_tabular_model_tmp.py:476: UserWarning: Choices for a categorical distribution should be a tuple of None, bool, int, float and str for persistent storage but contains [128] which is of type list.
  num_nodes  = trial.suggest_categorical("num_nodes", [[32], [64], [128], [64, 32], [128, 64]])
/scratch.hpc/luca.cotugno/Foundation_model_clinical_data/test_tabular_model_tmp.py:476: UserWarning: Choices for a categorical distribution should be a tuple of None, bool, int, float and str for persistent storage but contains [64, 32] which is of type list.
  num_nodes  = trial.suggest_categorical("num_nodes", [[32], [64], [128], [64, 32], [128, 64]])
/scratch.hpc/luca.cotugno/Foundation_model_clinical_data/test_tabular_model_tmp.py:476: UserWarning: Choices for a categorical distribution should be a tuple of None, bool, int, float and str for persistent storage but contains [128, 64] which is of type list.
  num_nodes  = trial.suggest_categorical("num_nodes", [[32], [64], [128], [64, 32], [128, 64]])

96:	[0s / 44s],		train_loss: 2.4318
32:	[0s / 12s],		train_loss: 2.4735
21:	[0s / 20s],		train_loss: 2.4996
97:	[0s / 45s],		train_loss: 2.4316
40:	[0s / 23s],		train_loss: 2.4468
33:	[0s / 12s],		train_loss: 2.4718
34:	[0s / 13s],		train_loss: 2.4655
98:	[0s / 45s],		train_loss: 2.4410
41:	[0s / 24s],		train_loss: 2.4547
35:	[0s / 13s],		train_loss: 2.4776
99:	[0s / 45s],		train_loss: 2.4595
22:	[0s / 21s],		train_loss: 2.4917
42:	[0s / 25s],		train_loss: 2.4312
36:	[0s / 13s],		train_loss: 2.4731
0:	[0s / 0s],		train_loss: 3.7615
37:	[0s / 14s],		train_loss: 2.4633
43:	[0s / 25s],		train_loss: 2.4344
23:	[0s / 22s],		train_loss: 2.4897
1:	[0s / 0s],		train_loss: 2.9099
38:	[0s / 14s],		train_loss: 2.4606
44:	[0s / 26s],		train_loss: 2.4398
2:	[0s / 1s],		train_loss: 2.8062
39:	[0s / 15s],		train_loss: 2.4619
3:	[0s / 1s],		train_loss: 2.7232
45:	[0s / 26s],		train_loss: 2.4437
24:	[0s / 23s],		train_loss: 2.4892
40:	[0s / 15s],		train_loss: 2.4730
4:	[0s / 2s],		train_loss: 2.7052
41:	[0s / 15s],		train_loss: 2.4359
46:	[0s / 27s],		train_loss: 2.4477
5:	[0s / 2s],		train_loss: 2.6386
42:	[0s / 16s],		train_loss: 2.4587
47:	[0s / 27s],		train_loss: 2.4310
25:	[0s / 24s],		train_loss: 2.4728
6:	[0s / 2s],		train_loss: 2.6119
43:	[0s / 16s],		train_loss: 2.4555
48:	[0s / 28s],		train_loss: 2.4322
7:	[0s / 3s],		train_loss: 2.6007
44:	[0s / 17s],		train_loss: 2.4583
8:	[0s / 3s],		train_loss: 2.5799
26:	[0s / 25s],		train_loss: 2.4910
49:	[0s / 28s],		train_loss: 2.4413
45:	[0s / 17s],		train_loss: 2.4464
9:	[0s / 4s],		train_loss: 2.5770
46:	[0s / 17s],		train_loss: 2.4467
50:	[0s / 29s],		train_loss: 2.4348
10:	[0s / 4s],		train_loss: 2.5754
47:	[0s / 18s],		train_loss: 2.4460
27:	[0s / 26s],		train_loss: 2.4797
51:	[0s / 29s],		train_loss: 2.4395
11:	[0s / 4s],		train_loss: 2.5589
48:	[0s / 18s],		train_loss: 2.4437
49:	[0s / 19s],		train_loss: 2.4411
52:	[0s / 30s],		train_loss: 2.4294
12:	[0s / 5s],		train_loss: 2.5457
28:	[0s / 27s],		train_loss: 2.4825
50:	[0s / 19s],		train_loss: 2.4444
13:	[0s / 5s],		train_loss: 2.5406
53:	[0s / 30s],		train_loss: 2.4384
51:	[0s / 19s],		train_loss: 2.4405
14:	[0s / 6s],		train_loss: 2.5291
54:	[0s / 31s],		train_loss: 2.4261
52:	[0s / 20s],		train_loss: 2.4391
15:	[0s / 6s],		train_loss: 2.5257
29:	[1s / 28s],		train_loss: 2.4863
55:	[0s / 31s],		train_loss: 2.4325
53:	[0s / 20s],		train_loss: 2.4424
16:	[0s / 6s],		train_loss: 2.5129
54:	[0s / 20s],		train_loss: 2.4435
56:	[0s / 32s],		train_loss: 2.4135
17:	[0s / 7s],		train_loss: 2.5082
30:	[0s / 29s],		train_loss: 2.4762
55:	[0s / 21s],		train_loss: 2.4432
18:	[0s / 7s],		train_loss: 2.5183
57:	[0s / 32s],		train_loss: 2.4186
56:	[0s / 21s],		train_loss: 2.4333
19:	[0s / 8s],		train_loss: 2.5133
58:	[0s / 33s],		train_loss: 2.4258
57:	[0s / 22s],		train_loss: 2.4405
31:	[0s / 30s],		train_loss: 2.4715
20:	[0s / 8s],		train_loss: 2.4993
58:	[0s / 22s],		train_loss: 2.4162
59:	[0s / 33s],		train_loss: 2.4310
21:	[0s / 9s],		train_loss: 2.4949
59:	[0s / 22s],		train_loss: 2.4234
60:	[0s / 34s],		train_loss: 2.4108
32:	[0s / 31s],		train_loss: 2.4735
22:	[0s / 9s],		train_loss: 2.4922
60:	[0s / 23s],		train_loss: 2.4267
23:	[0s / 9s],		train_loss: 2.4878
61:	[0s / 34s],		train_loss: 2.4219
61:	[0s / 23s],		train_loss: 2.4268
24:	[0s / 10s],		train_loss: 2.4859
33:	[0s / 32s],		train_loss: 2.4717
62:	[0s / 24s],		train_loss: 2.4310
62:	[0s / 35s],		train_loss: 2.4208
25:	[0s / 10s],		train_loss: 2.4936
63:	[0s / 24s],		train_loss: 2.4291
63:	[0s / 35s],		train_loss: 2.4082
26:	[0s / 11s],		train_loss: 2.4780
64:	[0s / 24s],		train_loss: 2.4219
34:	[0s / 33s],		train_loss: 2.4589
64:	[0s / 36s],		train_loss: 2.4226
27:	[0s / 11s],		train_loss: 2.4810
65:	[0s / 25s],		train_loss: 2.4236
28:	[0s / 11s],		train_loss: 2.4786
65:	[0s / 36s],		train_loss: 2.4170
66:	[0s / 25s],		train_loss: 2.4260
35:	[0s / 34s],		train_loss: 2.4609
29:	[0s / 12s],		train_loss: 2.4659
67:	[0s / 26s],		train_loss: 2.4182
66:	[0s / 37s],		train_loss: 2.4167
68:	[0s / 26s],		train_loss: 2.4176
30:	[0s / 12s],		train_loss: 2.4752
67:	[0s / 37s],		train_loss: 2.4117
36:	[0s / 34s],		train_loss: 2.4587
69:	[0s / 26s],		train_loss: 2.4192
31:	[0s / 13s],		train_loss: 2.4676
68:	[0s / 38s],		train_loss: 2.4210
70:	[0s / 27s],		train_loss: 2.4147
32:	[0s / 13s],		train_loss: 2.4710
71:	[0s / 27s],		train_loss: 2.4179
69:	[0s / 38s],		train_loss: 2.4053
33:	[0s / 14s],		train_loss: 2.4619
37:	[0s / 35s],		train_loss: 2.4698
72:	[0s / 28s],		train_loss: 2.4170
34:	[0s / 14s],		train_loss: 2.4636
70:	[0s / 39s],		train_loss: 2.4159
73:	[0s / 28s],		train_loss: 2.4207
35:	[0s / 14s],		train_loss: 2.4732
71:	[0s / 40s],		train_loss: 2.4199
74:	[0s / 28s],		train_loss: 2.4161
38:	[0s / 36s],		train_loss: 2.4559
36:	[0s / 15s],		train_loss: 2.4601
75:	[0s / 29s],		train_loss: 2.4111
72:	[0s / 40s],		train_loss: 2.4094
37:	[0s / 15s],		train_loss: 2.4745
76:	[0s / 29s],		train_loss: 2.4051
39:	[0s / 37s],		train_loss: 2.4598
38:	[0s / 16s],		train_loss: 2.4462
73:	[0s / 41s],		train_loss: 2.4232
77:	[0s / 30s],		train_loss: 2.4103
39:	[0s / 16s],		train_loss: 2.4477
74:	[0s / 41s],		train_loss: 2.4127
78:	[0s / 30s],		train_loss: 2.4085
40:	[0s / 16s],		train_loss: 2.4494
40:	[0s / 38s],		train_loss: 2.4546
79:	[0s / 30s],		train_loss: 2.4062
75:	[0s / 42s],		train_loss: 2.4001
41:	[0s / 17s],		train_loss: 2.4517
80:	[0s / 31s],		train_loss: 2.4030
76:	[0s / 42s],		train_loss: 2.3939
42:	[0s / 17s],		train_loss: 2.4567
81:	[0s / 31s],		train_loss: 2.4010
41:	[0s / 39s],		train_loss: 2.4559
77:	[0s / 43s],		train_loss: 2.3960
43:	[0s / 18s],		train_loss: 2.4561
82:	[0s / 31s],		train_loss: 2.4012
44:	[0s / 18s],		train_loss: 2.4345
83:	[0s / 32s],		train_loss: 2.4104
78:	[0s / 43s],		train_loss: 2.3991
45:	[0s / 18s],		train_loss: 2.4508
84:	[0s / 32s],		train_loss: 2.4041
42:	[1s / 40s],		train_loss: 2.4560
79:	[0s / 44s],		train_loss: 2.4068
85:	[0s / 33s],		train_loss: 2.4043
46:	[0s / 19s],		train_loss: 2.4331
80:	[0s / 44s],		train_loss: 2.3850
86:	[0s / 33s],		train_loss: 2.4015
47:	[0s / 19s],		train_loss: 2.4342
43:	[0s / 41s],		train_loss: 2.4576
87:	[0s / 33s],		train_loss: 2.4019
48:	[0s / 20s],		train_loss: 2.4413
81:	[0s / 45s],		train_loss: 2.3986
88:	[0s / 34s],		train_loss: 2.3977
49:	[0s / 20s],		train_loss: 2.4327
82:	[0s / 45s],		train_loss: 2.3921
44:	[0s / 42s],		train_loss: 2.4416
89:	[0s / 34s],		train_loss: 2.3975
50:	[0s / 21s],		train_loss: 2.4329
83:	[0s / 46s],		train_loss: 2.3951
90:	[0s / 35s],		train_loss: 2.3945
51:	[0s / 21s],		train_loss: 2.4316
91:	[0s / 35s],		train_loss: 2.3798
84:	[0s / 46s],		train_loss: 2.3949
52:	[0s / 21s],		train_loss: 2.4328
45:	[0s / 43s],		train_loss: 2.4576
92:	[0s / 35s],		train_loss: 2.3979
53:	[0s / 22s],		train_loss: 2.4329
85:	[0s / 47s],		train_loss: 2.3861
93:	[0s / 36s],		train_loss: 2.3918
54:	[0s / 22s],		train_loss: 2.4299
86:	[0s / 47s],		train_loss: 2.3943
46:	[0s / 44s],		train_loss: 2.4443
94:	[0s / 36s],		train_loss: 2.4028
55:	[0s / 23s],		train_loss: 2.4307
95:	[0s / 37s],		train_loss: 2.3873
87:	[0s / 48s],		train_loss: 2.3912
56:	[0s / 23s],		train_loss: 2.4183
96:	[0s / 37s],		train_loss: 2.4050
47:	[0s / 45s],		train_loss: 2.4433
88:	[0s / 48s],		train_loss: 2.4036
57:	[0s / 23s],		train_loss: 2.4136
97:	[0s / 37s],		train_loss: 2.3928
58:	[0s / 24s],		train_loss: 2.4246
89:	[0s / 49s],		train_loss: 2.4020
98:	[0s / 38s],		train_loss: 2.3935
59:	[0s / 24s],		train_loss: 2.4261
48:	[0s / 46s],		train_loss: 2.4598
99:	[0s / 38s],		train_loss: 2.3851
90:	[0s / 49s],		train_loss: 2.3945
60:	[0s / 25s],		train_loss: 2.4229
0:	[0s / 0s],		train_loss: 3.8289
91:	[0s / 50s],		train_loss: 2.3788
61:	[0s / 25s],		train_loss: 2.4230
1:	[0s / 0s],		train_loss: 2.9713
49:	[1s / 47s],		train_loss: 2.4387
92:	[0s / 50s],		train_loss: 2.3850
62:	[0s / 26s],		train_loss: 2.4234
2:	[0s / 1s],		train_loss: 2.8313
63:	[0s / 26s],		train_loss: 2.4248
93:	[0s / 51s],		train_loss: 2.3794
3:	[0s / 1s],		train_loss: 2.7644
50:	[1s / 48s],		train_loss: 2.4302
64:	[0s / 26s],		train_loss: 2.4232
4:	[0s / 1s],		train_loss: 2.6978
94:	[0s / 51s],		train_loss: 2.3811
65:	[0s / 27s],		train_loss: 2.4115
5:	[0s / 2s],		train_loss: 2.6454
95:	[0s / 52s],		train_loss: 2.3918
66:	[0s / 27s],		train_loss: 2.4260
6:	[0s / 2s],		train_loss: 2.6388
51:	[0s / 49s],		train_loss: 2.4295
96:	[0s / 53s],		train_loss: 2.3887
7:	[0s / 3s],		train_loss: 2.6041
67:	[0s / 28s],		train_loss: 2.4157
8:	[0s / 3s],		train_loss: 2.5895
68:	[0s / 28s],		train_loss: 2.4084
97:	[0s / 53s],		train_loss: 2.3822
52:	[0s / 50s],		train_loss: 2.4198
9:	[0s / 3s],		train_loss: 2.5828
69:	[0s / 28s],		train_loss: 2.4116
98:	[0s / 54s],		train_loss: 2.3809
10:	[0s / 4s],		train_loss: 2.5683
70:	[0s / 29s],		train_loss: 2.4118
99:	[0s / 54s],		train_loss: 2.3817
11:	[0s / 4s],		train_loss: 2.5593
71:	[0s / 29s],		train_loss: 2.4152
53:	[1s / 51s],		train_loss: 2.4325
12:	[0s / 5s],		train_loss: 2.5559
72:	[0s / 30s],		train_loss: 2.4020
0:	[0s / 0s],		train_loss: 3.6990
13:	[0s / 5s],		train_loss: 2.5393
73:	[0s / 30s],		train_loss: 2.4011
54:	[0s / 52s],		train_loss: 2.4333
1:	[0s / 1s],		train_loss: 2.9317
14:	[0s / 5s],		train_loss: 2.5397
74:	[0s / 31s],		train_loss: 2.4126
15:	[0s / 6s],		train_loss: 2.5233
2:	[0s / 1s],		train_loss: 2.8143
75:	[0s / 31s],		train_loss: 2.4050
16:	[0s / 6s],		train_loss: 2.5224
55:	[0s / 53s],		train_loss: 2.4365
3:	[0s / 2s],		train_loss: 2.7361
76:	[0s / 31s],		train_loss: 2.4051
17:	[0s / 7s],		train_loss: 2.5103
77:	[0s / 32s],		train_loss: 2.4025
4:	[0s / 2s],		train_loss: 2.7176
18:	[0s / 7s],		train_loss: 2.5023
56:	[0s / 54s],		train_loss: 2.4299
78:	[0s / 32s],		train_loss: 2.3957
5:	[0s / 3s],		train_loss: 2.6436
19:	[0s / 7s],		train_loss: 2.5166
79:	[0s / 33s],		train_loss: 2.4056
20:	[0s / 8s],		train_loss: 2.4980
6:	[0s / 3s],		train_loss: 2.6419
57:	[0s / 55s],		train_loss: 2.4278
80:	[0s / 33s],		train_loss: 2.3858
21:	[0s / 8s],		train_loss: 2.5073
7:	[0s / 4s],		train_loss: 2.6159
81:	[0s / 34s],		train_loss: 2.4033
22:	[0s / 9s],		train_loss: 2.5043
82:	[0s / 34s],		train_loss: 2.3991
8:	[0s / 4s],		train_loss: 2.6034
23:	[0s / 9s],		train_loss: 2.4955
58:	[1s / 56s],		train_loss: 2.4301
24:	[0s / 9s],		train_loss: 2.4897
83:	[0s / 34s],		train_loss: 2.3879
9:	[0s / 5s],		train_loss: 2.5841
25:	[0s / 10s],		train_loss: 2.4886
84:	[0s / 35s],		train_loss: 2.3946
10:	[0s / 5s],		train_loss: 2.5976
59:	[0s / 57s],		train_loss: 2.4207
26:	[0s / 10s],		train_loss: 2.4865
85:	[0s / 35s],		train_loss: 2.3943
11:	[0s / 6s],		train_loss: 2.5652
27:	[0s / 10s],		train_loss: 2.4891
86:	[0s / 36s],		train_loss: 2.3988
28:	[0s / 11s],		train_loss: 2.4745
60:	[0s / 58s],		train_loss: 2.4201
12:	[0s / 6s],		train_loss: 2.5637
87:	[0s / 36s],		train_loss: 2.4009
29:	[0s / 11s],		train_loss: 2.4737
88:	[0s / 36s],		train_loss: 2.3809
13:	[0s / 7s],		train_loss: 2.5449
30:	[0s / 12s],		train_loss: 2.4780
89:	[0s / 37s],		train_loss: 2.4058
61:	[0s / 59s],		train_loss: 2.4139
14:	[0s / 7s],		train_loss: 2.5305
31:	[0s / 12s],		train_loss: 2.4650
90:	[0s / 37s],		train_loss: 2.3788
32:	[0s / 12s],		train_loss: 2.4670
15:	[0s / 8s],		train_loss: 2.5316
91:	[0s / 38s],		train_loss: 2.3902
33:	[0s / 13s],		train_loss: 2.4739
62:	[0s / 1m:0s],		train_loss: 2.4182
16:	[0s / 8s],		train_loss: 2.5324
92:	[0s / 38s],		train_loss: 2.3937
34:	[0s / 13s],		train_loss: 2.4747
93:	[0s / 38s],		train_loss: 2.3993
17:	[0s / 9s],		train_loss: 2.5152
35:	[0s / 14s],		train_loss: 2.4693
63:	[0s / 1m:1s],		train_loss: 2.4160
94:	[0s / 39s],		train_loss: 2.3961
36:	[0s / 14s],		train_loss: 2.4609
18:	[0s / 9s],		train_loss: 2.5214
95:	[0s / 39s],		train_loss: 2.3873
37:	[0s / 14s],		train_loss: 2.4585
19:	[0s / 10s],		train_loss: 2.5147
96:	[0s / 40s],		train_loss: 2.3765
38:	[0s / 15s],		train_loss: 2.4573
64:	[0s / 1m:2s],		train_loss: 2.4247
20:	[0s / 10s],		train_loss: 2.5029
97:	[0s / 40s],		train_loss: 2.3924
39:	[0s / 15s],		train_loss: 2.4627
98:	[0s / 40s],		train_loss: 2.3844
21:	[0s / 11s],		train_loss: 2.5045
40:	[0s / 16s],		train_loss: 2.4587
65:	[1s / 1m:3s],		train_loss: 2.4118
99:	[0s / 41s],		train_loss: 2.3842
41:	[0s / 16s],		train_loss: 2.4567
22:	[0s / 11s],		train_loss: 2.5010
42:	[0s / 16s],		train_loss: 2.4488
0:	[0s / 0s],		train_loss: 3.6576
23:	[0s / 12s],		train_loss: 2.4884
43:	[0s / 17s],		train_loss: 2.4496
66:	[1s / 1m:4s],		train_loss: 2.4221
1:	[0s / 0s],		train_loss: 2.9750
24:	[0s / 12s],		train_loss: 2.4875
44:	[0s / 17s],		train_loss: 2.4564
2:	[0s / 1s],		train_loss: 2.8129
45:	[0s / 18s],		train_loss: 2.4582
25:	[0s / 13s],		train_loss: 2.4853
3:	[0s / 1s],		train_loss: 2.7387
67:	[0s / 1m:5s],		train_loss: 2.4102
46:	[0s / 18s],		train_loss: 2.4493
4:	[0s / 2s],		train_loss: 2.6837
26:	[0s / 13s],		train_loss: 2.4932
47:	[0s / 18s],		train_loss: 2.4471
5:	[0s / 2s],		train_loss: 2.6560
68:	[0s / 1m:6s],		train_loss: 2.4178
27:	[0s / 14s],		train_loss: 2.4853
48:	[0s / 19s],		train_loss: 2.4567
6:	[0s / 2s],		train_loss: 2.6317
49:	[0s / 19s],		train_loss: 2.4389
28:	[0s / 14s],		train_loss: 2.4816
7:	[0s / 3s],		train_loss: 2.6041
50:	[0s / 20s],		train_loss: 2.4340
69:	[0s / 1m:6s],		train_loss: 2.4228
29:	[0s / 15s],		train_loss: 2.4877
8:	[0s / 3s],		train_loss: 2.5870
51:	[0s / 20s],		train_loss: 2.4398
9:	[0s / 4s],		train_loss: 2.5662
30:	[0s / 15s],		train_loss: 2.4818
52:	[0s / 20s],		train_loss: 2.4325
70:	[0s / 1m:7s],		train_loss: 2.4163
10:	[0s / 4s],		train_loss: 2.5656
53:	[0s / 21s],		train_loss: 2.4413
31:	[0s / 16s],		train_loss: 2.4657
11:	[0s / 4s],		train_loss: 2.5465
54:	[0s / 21s],		train_loss: 2.4349
32:	[0s / 17s],		train_loss: 2.4659
12:	[0s / 5s],		train_loss: 2.5551
71:	[0s / 1m:8s],		train_loss: 2.4143
55:	[0s / 22s],		train_loss: 2.4370
33:	[0s / 17s],		train_loss: 2.4740
13:	[0s / 5s],		train_loss: 2.5357
56:	[0s / 22s],		train_loss: 2.4566
57:	[0s / 22s],		train_loss: 2.4256
14:	[0s / 6s],		train_loss: 2.5312
34:	[0s / 18s],		train_loss: 2.4610
72:	[0s / 1m:9s],		train_loss: 2.3957
58:	[0s / 23s],		train_loss: 2.4253
15:	[0s / 6s],		train_loss: 2.5302
35:	[0s / 18s],		train_loss: 2.4735
59:	[0s / 23s],		train_loss: 2.4332
16:	[0s / 7s],		train_loss: 2.5184
36:	[0s / 19s],		train_loss: 2.4669
73:	[0s / 1m:10s],		train_loss: 2.4146
60:	[0s / 23s],		train_loss: 2.4287
17:	[0s / 7s],		train_loss: 2.5167
37:	[0s / 19s],		train_loss: 2.4601
61:	[0s / 24s],		train_loss: 2.4203
18:	[0s / 7s],		train_loss: 2.5132
62:	[0s / 24s],		train_loss: 2.4229
74:	[0s / 1m:11s],		train_loss: 2.4089
38:	[0s / 20s],		train_loss: 2.4508
19:	[0s / 8s],		train_loss: 2.5139
63:	[0s / 25s],		train_loss: 2.4221
20:	[0s / 8s],		train_loss: 2.5046
39:	[0s / 20s],		train_loss: 2.4633
64:	[0s / 25s],		train_loss: 2.4252
21:	[0s / 9s],		train_loss: 2.4995
75:	[0s / 1m:12s],		train_loss: 2.3906
65:	[0s / 25s],		train_loss: 2.4150
40:	[0s / 21s],		train_loss: 2.4568
22:	[0s / 9s],		train_loss: 2.4947
66:	[0s / 26s],		train_loss: 2.4214
41:	[0s / 21s],		train_loss: 2.4425
23:	[0s / 9s],		train_loss: 2.4935
76:	[0s / 1m:13s],		train_loss: 2.4149
67:	[0s / 26s],		train_loss: 2.4260
24:	[0s / 10s],		train_loss: 2.4999
42:	[0s / 22s],		train_loss: 2.4502
68:	[0s / 27s],		train_loss: 2.4217
25:	[0s / 10s],		train_loss: 2.4894
69:	[0s / 27s],		train_loss: 2.4169
77:	[0s / 1m:14s],		train_loss: 2.4002
43:	[0s / 22s],		train_loss: 2.4517
26:	[0s / 11s],		train_loss: 2.4832
70:	[0s / 27s],		train_loss: 2.4170
44:	[0s / 23s],		train_loss: 2.4484
27:	[0s / 11s],		train_loss: 2.4799
71:	[0s / 28s],		train_loss: 2.4221
45:	[0s / 23s],		train_loss: 2.4451
78:	[1s / 1m:15s],		train_loss: 2.4007
28:	[0s / 12s],		train_loss: 2.4905
72:	[0s / 28s],		train_loss: 2.4142
73:	[0s / 29s],		train_loss: 2.4102
29:	[0s / 12s],		train_loss: 2.4829
46:	[0s / 24s],		train_loss: 2.4412
74:	[0s / 29s],		train_loss: 2.4057
30:	[0s / 12s],		train_loss: 2.4652
79:	[0s / 1m:16s],		train_loss: 2.4013
47:	[0s / 24s],		train_loss: 2.4443
75:	[0s / 29s],		train_loss: 2.4113
31:	[0s / 13s],		train_loss: 2.4695
48:	[0s / 25s],		train_loss: 2.4423
76:	[0s / 30s],		train_loss: 2.4060
32:	[0s / 13s],		train_loss: 2.4840
80:	[0s / 1m:17s],		train_loss: 2.3965
77:	[0s / 30s],		train_loss: 2.4056
49:	[0s / 25s],		train_loss: 2.4436
33:	[0s / 14s],		train_loss: 2.4674
78:	[0s / 30s],		train_loss: 2.4113
50:	[0s / 26s],		train_loss: 2.4363
34:	[0s / 14s],		train_loss: 2.4662
81:	[0s / 1m:18s],		train_loss: 2.4040
79:	[0s / 31s],		train_loss: 2.4090
35:	[0s / 14s],		train_loss: 2.4690
51:	[0s / 26s],		train_loss: 2.4416
80:	[0s / 31s],		train_loss: 2.4247
36:	[0s / 15s],		train_loss: 2.4636
52:	[0s / 27s],		train_loss: 2.4252
81:	[0s / 32s],		train_loss: 2.4132
82:	[0s / 1m:19s],		train_loss: 2.4113
37:	[0s / 15s],		train_loss: 2.4665
82:	[0s / 32s],		train_loss: 2.4026
53:	[0s / 27s],		train_loss: 2.4227
38:	[0s / 16s],		train_loss: 2.4642
83:	[0s / 32s],		train_loss: 2.4127
54:	[0s / 28s],		train_loss: 2.4370
39:	[0s / 16s],		train_loss: 2.4601
83:	[1s / 1m:20s],		train_loss: 2.4045
84:	[0s / 33s],		train_loss: 2.4078
40:	[0s / 17s],		train_loss: 2.4434
55:	[0s / 28s],		train_loss: 2.4391
85:	[0s / 33s],		train_loss: 2.4025
41:	[0s / 17s],		train_loss: 2.4641
86:	[0s / 34s],		train_loss: 2.4068
56:	[0s / 29s],		train_loss: 2.4300
84:	[0s / 1m:21s],		train_loss: 2.4082
42:	[0s / 17s],		train_loss: 2.4561
87:	[0s / 34s],		train_loss: 2.4126
57:	[0s / 29s],		train_loss: 2.4331
43:	[0s / 18s],		train_loss: 2.4414
88:	[0s / 34s],		train_loss: 2.4078
85:	[0s / 1m:21s],		train_loss: 2.3920
58:	[0s / 30s],		train_loss: 2.4324
44:	[0s / 18s],		train_loss: 2.4492
89:	[0s / 35s],		train_loss: 2.3981
45:	[0s / 19s],		train_loss: 2.4424
90:	[0s / 35s],		train_loss: 2.4005
59:	[0s / 30s],		train_loss: 2.4353
91:	[0s / 35s],		train_loss: 2.3951
46:	[0s / 19s],		train_loss: 2.4439
86:	[0s / 1m:22s],		train_loss: 2.4006
60:	[0s / 31s],		train_loss: 2.4181
92:	[0s / 36s],		train_loss: 2.3935
47:	[0s / 19s],		train_loss: 2.4377
61:	[0s / 31s],		train_loss: 2.4320
93:	[0s / 36s],		train_loss: 2.3929
48:	[0s / 20s],		train_loss: 2.4449
87:	[0s / 1m:23s],		train_loss: 2.4038
94:	[0s / 37s],		train_loss: 2.3978
49:	[0s / 20s],		train_loss: 2.4479
62:	[0s / 32s],		train_loss: 2.4181
95:	[0s / 37s],		train_loss: 2.3964
50:	[0s / 21s],		train_loss: 2.4385
63:	[0s / 33s],		train_loss: 2.4220
96:	[0s / 37s],		train_loss: 2.3851
88:	[0s / 1m:24s],		train_loss: 2.3934
51:	[0s / 21s],		train_loss: 2.4348
97:	[0s / 38s],		train_loss: 2.3959
64:	[0s / 33s],		train_loss: 2.4206
52:	[0s / 21s],		train_loss: 2.4325
98:	[0s / 38s],		train_loss: 2.3899
65:	[0s / 34s],		train_loss: 2.4338
53:	[0s / 22s],		train_loss: 2.4406
89:	[0s / 1m:25s],		train_loss: 2.3945
99:	[0s / 39s],		train_loss: 2.3937
54:	[0s / 22s],		train_loss: 2.4438
66:	[0s / 34s],		train_loss: 2.4100
0:	[0s / 0s],		train_loss: 3.5458
55:	[0s / 23s],		train_loss: 2.4330
90:	[0s / 1m:26s],		train_loss: 2.4056
67:	[0s / 35s],		train_loss: 2.4270
1:	[0s / 0s],		train_loss: 2.8281
56:	[0s / 23s],		train_loss: 2.4270
2:	[0s / 1s],		train_loss: 2.7177
68:	[0s / 35s],		train_loss: 2.4211
57:	[0s / 24s],		train_loss: 2.4257
91:	[0s / 1m:27s],		train_loss: 2.3885
3:	[0s / 1s],		train_loss: 2.6623
69:	[0s / 36s],		train_loss: 2.4080
58:	[0s / 24s],		train_loss: 2.4146
4:	[0s / 1s],		train_loss: 2.6138
59:	[0s / 24s],		train_loss: 2.4407
70:	[0s / 36s],		train_loss: 2.4197
5:	[0s / 2s],		train_loss: 2.5932
92:	[0s / 1m:28s],		train_loss: 2.3964
60:	[0s / 25s],		train_loss: 2.4225
6:	[0s / 2s],		train_loss: 2.5755
71:	[0s / 37s],		train_loss: 2.4209
61:	[0s / 25s],		train_loss: 2.4368
7:	[0s / 3s],		train_loss: 2.5474
72:	[0s / 37s],		train_loss: 2.4149
93:	[0s / 1m:29s],		train_loss: 2.3803
62:	[0s / 26s],		train_loss: 2.4250
8:	[0s / 3s],		train_loss: 2.5539
73:	[0s / 38s],		train_loss: 2.4089
63:	[0s / 26s],		train_loss: 2.4173
9:	[0s / 3s],		train_loss: 2.5387
64:	[0s / 26s],		train_loss: 2.4036
10:	[0s / 4s],		train_loss: 2.5148
94:	[0s / 1m:30s],		train_loss: 2.3902
74:	[0s / 38s],		train