[I 2026-06-28 07:12:31,442] Trial 10 finished with value: 0.7434925782807372 and parameters: {'num_nodes': [64, 32], 'dropout': 0.22777118134073582, 'learning_rate': 0.0012518699969443746, 'batch_norm': False}. Best is trial 1 with value: 0.762489649461772.
/scratch.hpc/luca.cotugno/Foundation_model_clinical_data/test_tabular_model.py:481: UserWarning: Choices for a categorical distribution should be a tuple of None, bool, int, float and str for persistent storage but contains [32] which is of type list.
  num_nodes  = trial.suggest_categorical("num_nodes", [[32], [64], [128], [64, 32], [128, 64]])
/scratch.hpc/luca.cotugno/Foundation_model_clinical_data/test_tabular_model.py:481: UserWarning: Choices for a categorical distribution should be a tuple of None, bool, int, float and str for persistent storage but contains [64] which is of type list.
  num_nodes  = trial.suggest_categorical("num_nodes", [[32], [64], [128], [64, 32], [128, 64]])
/scratch.hpc/luca.cotugno/Foundation_model_clinical_data/test_tabular_model.py:481: UserWarning: Choices for a categorical distribution should be a tuple of None, bool, int, float and str for persistent storage but contains [128] which is of type list.
  num_nodes  = trial.suggest_categorical("num_nodes", [[32], [64], [128], [64, 32], [128, 64]])
/scratch.hpc/luca.cotugno/Foundation_model_clinical_data/test_tabular_model.py:481: UserWarning: Choices for a categorical distribution should be a tuple of None, bool, int, float and str for persistent storage but contains [64, 32] which is of type list.
  num_nodes  = trial.suggest_categorical("num_nodes", [[32], [64], [128], [64, 32], [128, 64]])
/scratch.hpc/luca.cotugno/Foundation_model_clinical_data/test_tabular_model.py:481: UserWarning: Choices for a categorical distribution should be a tuple of None, bool, int, float and str for persistent storage but contains [128, 64] which is of type list.
  num_nodes  = trial.suggest_categorical("num_nodes", [[32], [64], [128], [64, 32], [128, 64]])

36:	[0s / 5s],		train_loss: 4.2841
7:	[0s / 1s],		train_loss: 4.4461
45:	[0s / 8s],		train_loss: 4.3017
37:	[0s / 5s],		train_loss: 4.3290
8:	[0s / 1s],		train_loss: 4.4058
38:	[0s / 5s],		train_loss: 4.2598
84:	[0s / 29s],		train_loss: 4.2948
49:	[1s / 51s],		train_loss: 4.3999
9:	[0s / 1s],		train_loss: 4.3958
46:	[0s / 8s],		train_loss: 4.3122
39:	[0s / 5s],		train_loss: 4.3129
10:	[0s / 1s],		train_loss: 4.4285
25:	[0s / 14s],		train_loss: 4.2649
47:	[0s / 8s],		train_loss: 4.2699
40:	[0s / 5s],		train_loss: 4.3023
11:	[0s / 1s],		train_loss: 4.3861
85:	[0s / 30s],		train_loss: 4.2761
48:	[0s / 8s],		train_loss: 4.2740
41:	[0s / 5s],		train_loss: 4.2993
12:	[0s / 1s],		train_loss: 4.4179
0:	[1s / 1s],		train_loss: 4.7358
49:	[0s / 8s],		train_loss: 4.2871
13:	[0s / 1s],		train_loss: 4.4269
42:	[0s / 5s],		train_loss: 4.2728
14:	[0s / 2s],		train_loss: 4.3537
50:	[0s / 8s],		train_loss: 4.3215
86:	[0s / 30s],		train_loss: 4.2446
43:	[0s / 6s],		train_loss: 4.2408
26:	[0s / 15s],		train_loss: 4.3176
15:	[0s / 2s],		train_loss: 4.5010
44:	[0s / 6s],		train_loss: 4.2534
51:	[0s / 9s],		train_loss: 4.2630
16:	[0s / 2s],		train_loss: 4.3752
45:	[0s / 6s],		train_loss: 4.2458
52:	[0s / 9s],		train_loss: 4.2701
87:	[0s / 30s],		train_loss: 4.2486
50:	[1s / 52s],		train_loss: 4.4030
17:	[0s / 2s],		train_loss: 4.3730
46:	[0s / 6s],		train_loss: 4.2192
18:	[0s / 2s],		train_loss: 4.3337
53:	[0s / 9s],		train_loss: 4.2889
47:	[0s / 6s],		train_loss: 4.2247
19:	[0s / 2s],		train_loss: 4.3110
27:	[0s / 15s],		train_loss: 4.3675
48:	[0s / 6s],		train_loss: 4.2484
54:	[0s / 9s],		train_loss: 4.2698
88:	[0s / 31s],		train_loss: 4.2895
20:	[0s / 2s],		train_loss: 4.3350
49:	[0s / 6s],		train_loss: 4.2657
55:	[0s / 9s],		train_loss: 4.2792
21:	[0s / 2s],		train_loss: 4.3391
50:	[0s / 7s],		train_loss: 4.2034
22:	[0s / 3s],		train_loss: 4.3348
56:	[0s / 10s],		train_loss: 4.2351
89:	[0s / 31s],		train_loss: 4.2384
51:	[0s / 7s],		train_loss: 4.2582
28:	[0s / 16s],		train_loss: 4.3199
23:	[0s / 3s],		train_loss: 4.3626
52:	[0s / 7s],		train_loss: 4.2660
57:	[0s / 10s],		train_loss: 4.2697
24:	[0s / 3s],		train_loss: 4.3955
51:	[0s / 53s],		train_loss: 4.3985
53:	[0s / 7s],		train_loss: 4.2886
90:	[0s / 31s],		train_loss: 4.3417
58:	[0s / 10s],		train_loss: 4.3112
25:	[0s / 3s],		train_loss: 4.3548
54:	[0s / 7s],		train_loss: 4.3112
26:	[0s / 3s],		train_loss: 4.3520
59:	[0s / 10s],		train_loss: 4.2274
55:	[0s / 7s],		train_loss: 4.2575
27:	[0s / 3s],		train_loss: 4.3180
29:	[0s / 17s],		train_loss: 4.3247
56:	[0s / 7s],		train_loss: 4.2309
60:	[0s / 10s],		train_loss: 4.2947
91:	[0s / 32s],		train_loss: 4.2918
28:	[0s / 3s],		train_loss: 4.3166
1:	[2s / 3s],		train_loss: 4.5077
11:	[3s / 48s],		train_loss: 4.4106
57:	[0s / 8s],		train_loss: 4.2510
29:	[0s / 4s],		train_loss: 4.3469
61:	[0s / 10s],		train_loss: 4.2798
58:	[0s / 8s],		train_loss: 4.2523
30:	[0s / 4s],		train_loss: 4.3298
92:	[0s / 32s],		train_loss: 4.2429
62:	[0s / 11s],		train_loss: 4.2575
59:	[0s / 8s],		train_loss: 4.2251
31:	[0s / 4s],		train_loss: 4.3357
30:	[0s / 17s],		train_loss: 4.2901
60:	[0s / 8s],		train_loss: 4.2169
63:	[0s / 11s],		train_loss: 4.2504
32:	[0s / 4s],		train_loss: 4.3284
52:	[1s / 55s],		train_loss: 4.3544
93:	[0s / 32s],		train_loss: 4.2243
33:	[0s / 4s],		train_loss: 4.3155
61:	[0s / 8s],		train_loss: 4.2574
64:	[0s / 11s],		train_loss: 4.2473
34:	[0s / 4s],		train_loss: 4.3072
62:	[0s / 8s],		train_loss: 4.2577
65:	[0s / 11s],		train_loss: 4.2491
35:	[0s / 4s],		train_loss: 4.3176
63:	[0s / 8s],		train_loss: 4.2096
94:	[0s / 33s],		train_loss: 4.2627
66:	[0s / 11s],		train_loss: 4.2734
31:	[0s / 18s],		train_loss: 4.3117
36:	[0s / 4s],		train_loss: 4.3080
64:	[0s / 8s],		train_loss: 4.2049
37:	[0s / 4s],		train_loss: 4.3305
65:	[0s / 9s],		train_loss: 4.1814
67:	[0s / 11s],		train_loss: 4.2351
38:	[0s / 5s],		train_loss: 4.3107
66:	[0s / 9s],		train_loss: 4.2045
95:	[0s / 33s],		train_loss: 4.2101
68:	[0s / 12s],		train_loss: 4.2344
39:	[0s / 5s],		train_loss: 4.3287
67:	[0s / 9s],		train_loss: 4.2025
40:	[0s / 5s],		train_loss: 4.3286
69:	[0s / 12s],		train_loss: 4.2639
68:	[0s / 9s],		train_loss: 4.2237
53:	[0s / 55s],		train_loss: 4.3390
96:	[0s / 33s],		train_loss: 4.1937
41:	[0s / 5s],		train_loss: 4.3260
32:	[0s / 18s],		train_loss: 4.3127
69:	[0s / 9s],		train_loss: 4.1804
70:	[0s / 12s],		train_loss: 4.2601
42:	[0s / 5s],		train_loss: 4.3195
70:	[0s / 9s],		train_loss: 4.2210
2:	[1s / 5s],		train_loss: 4.4705
71:	[0s / 12s],		train_loss: 4.2716
43:	[0s / 5s],		train_loss: 4.2945
97:	[0s / 34s],		train_loss: 4.2208
71:	[0s / 9s],		train_loss: 4.1786
44:	[0s / 5s],		train_loss: 4.2525
72:	[0s / 12s],		train_loss: 4.2237
72:	[0s / 9s],		train_loss: 4.1667
45:	[0s / 5s],		train_loss: 4.2829
33:	[0s / 19s],		train_loss: 4.3154
73:	[0s / 12s],		train_loss: 4.2153
73:	[0s / 10s],		train_loss: 4.2128
98:	[0s / 34s],		train_loss: 4.2265
46:	[0s / 6s],		train_loss: 4.3222
74:	[0s / 10s],		train_loss: 4.2487
47:	[0s / 6s],		train_loss: 4.2795
74:	[0s / 13s],		train_loss: 4.2442
54:	[0s / 56s],		train_loss: 4.3543
75:	[0s / 10s],		train_loss: 4.2294
48:	[0s / 6s],		train_loss: 4.3220
75:	[0s / 13s],		train_loss: 4.2340
99:	[0s / 34s],		train_loss: 4.2814
76:	[0s / 10s],		train_loss: 4.2834
34:	[0s / 19s],		train_loss: 4.3133
49:	[0s / 6s],		train_loss: 4.2732
76:	[0s / 13s],		train_loss: 4.2419
77:	[0s / 10s],		train_loss: 4.2084
50:	[0s / 6s],		train_loss: 4.2845
78:	[0s / 10s],		train_loss: 4.1980
3:	[1s / 6s],		train_loss: 4.4358
77:	[0s / 13s],		train_loss: 4.1929
51:	[0s / 6s],		train_loss: 4.2689
35:	[0s / 20s],		train_loss: 4.2953
79:	[0s / 10s],		train_loss: 4.1756
55:	[0s / 57s],		train_loss: 4.3420
52:	[0s / 6s],		train_loss: 4.2625
12:	[2s / 51s],		train_loss: 4.3870
78:	[0s / 13s],		train_loss: 4.1931
80:	[0s / 10s],		train_loss: 4.1457
53:	[0s / 6s],		train_loss: 4.2863
81:	[0s / 11s],		train_loss: 4.1628
79:	[0s / 13s],		train_loss: 4.2194
54:	[0s / 7s],		train_loss: 4.2667
36:	[0s / 20s],		train_loss: 4.2737
82:	[0s / 11s],		train_loss: 4.1581
55:	[0s / 7s],		train_loss: 4.2639
80:	[0s / 14s],		train_loss: 4.2232
83:	[0s / 11s],		train_loss: 4.2220
56:	[0s / 7s],		train_loss: 4.2390
56:	[0s / 57s],		train_loss: 4.3291
81:	[0s / 14s],		train_loss: 4.2686
37:	[0s / 20s],		train_loss: 4.2632
57:	[0s / 7s],		train_loss: 4.2753
84:	[0s / 11s],		train_loss: 4.2534
58:	[0s / 7s],		train_loss: 4.3123
82:	[0s / 14s],		train_loss: 4.2168
85:	[0s / 11s],		train_loss: 4.2310
4:	[0s / 7s],		train_loss: 4.4101
38:	[0s / 20s],		train_loss: 4.2648
59:	[0s / 7s],		train_loss: 4.2539
86:	[0s / 11s],		train_loss: 4.2134
83:	[0s / 14s],		train_loss: 4.2034
60:	[0s / 7s],		train_loss: 4.2647
57:	[0s / 58s],		train_loss: 4.3746
87:	[0s / 11s],		train_loss: 4.2003
84:	[0s / 14s],		train_loss: 4.2797
61:	[0s / 7s],		train_loss: 4.2708
88:	[0s / 11s],		train_loss: 4.1897
39:	[0s / 21s],		train_loss: 4.2349
62:	[0s / 8s],		train_loss: 4.2324
85:	[0s / 14s],		train_loss: 4.2365
89:	[0s / 12s],		train_loss: 4.2216
63:	[0s / 8s],		train_loss: 4.2609
90:	[0s / 12s],		train_loss: 4.2314
86:	[0s / 15s],		train_loss: 4.2040
58:	[0s / 58s],		train_loss: 4.3766
40:	[0s / 21s],		train_loss: 4.2803
64:	[0s / 8s],		train_loss: 4.2680
91:	[0s / 12s],		train_loss: 4.1807
87:	[0s / 15s],		train_loss: 4.2743
65:	[0s / 8s],		train_loss: 4.2557
92:	[0s / 12s],		train_loss: 4.1586
66:	[0s / 8s],		train_loss: 4.2668
88:	[0s / 15s],		train_loss: 4.1651
41:	[0s / 21s],		train_loss: 4.3060
5:	[0s / 8s],		train_loss: 4.4166
93:	[0s / 12s],		train_loss: 4.1846
67:	[0s / 8s],		train_loss: 4.2340
13:	[1s / 53s],		train_loss: 4.3816
89:	[0s / 15s],		train_loss: 4.2342
94:	[0s / 12s],		train_loss: 4.2168
59:	[0s / 59s],		train_loss: 4.3899
68:	[0s / 8s],		train_loss: 4.2651
42:	[0s / 22s],		train_loss: 4.2684
95:	[0s / 12s],		train_loss: 4.1608
90:	[0s / 15s],		train_loss: 4.2284
69:	[0s / 8s],		train_loss: 4.2475
96:	[0s / 13s],		train_loss: 4.1519
70:	[0s / 9s],		train_loss: 4.2956
91:	[0s / 15s],		train_loss: 4.2017
97:	[0s / 13s],		train_loss: 4.1792
71:	[0s / 9s],		train_loss: 4.2586
43:	[0s / 22s],		train_loss: 4.2526
92:	[0s / 16s],		train_loss: 4.2127
98:	[0s / 13s],		train_loss: 4.1947
72:	[0s / 9s],		train_loss: 4.2507
60:	[0s / 59s],		train_loss: 4.3351
99:	[0s / 13s],		train_loss: 4.2041
73:	[0s / 9s],		train_loss: 4.2639
93:	[0s / 16s],		train_loss: 4.2069
44:	[0s / 22s],		train_loss: 4.2545
74:	[0s / 9s],		train_loss: 4.2622
6:	[1s / 9s],		train_loss: 4.3727
94:	[0s / 16s],		train_loss: 4.1631
45:	[0s / 22s],		train_loss: 4.2959
75:	[0s / 9s],		train_loss: 4.2246
95:	[0s / 16s],		train_loss: 4.2356
61:	[0s / 1m:0s],		train_loss: 4.2884
76:	[0s / 9s],		train_loss: 4.2181
46:	[0s / 23s],		train_loss: 4.2639
96:	[0s / 16s],		train_loss: 4.2455
77:	[0s / 9s],		train_loss: 4.1792
97:	[0s / 16s],		train_loss: 4.1828
47:	[0s / 23s],		train_loss: 4.2205
62:	[0s / 1m:0s],		train_loss: 4.3781
78:	[0s / 10s],		train_loss: 4.2459
7:	[0s / 9s],		train_loss: 4.3825
98:	[0s / 17s],		train_loss: 4.1681
48:	[0s / 23s],		train_loss: 4.2580
79:	[0s / 10s],		train_loss: 4.2316
14:	[1s / 55s],		train_loss: 4.3506
99:	[0s / 17s],		train_loss: 4.1964
80:	[0s / 10s],		train_loss: 4.2248
63:	[0s / 1m:0s],		train_loss: 4.3830
49:	[0s / 23s],		train_loss: 4.2195
81:	[0s / 10s],		train_loss: 4.2553
50:	[0s / 23s],		train_loss: 4.2132
64:	[0s / 1m:1s],		train_loss: 4.3741
8:	[0s / 10s],		train_loss: 4.3436
82:	[0s / 10s],		train_loss: 4.2405
51:	[0s / 23s],		train_loss: 4.2025
65:	[0s / 1m:1s],		train_loss: 4.3442
83:	[0s / 10s],		train_loss: 4.2257
52:	[0s / 24s],		train_loss: 4.1913
66:	[0s / 1m:1s],		train_loss: 4.3433
84:	[0s / 10s],		train_loss: 4.2063
9:	[0s / 10s],		train_loss: 4.3714
15:	[0s / 55s],		train_loss: 4.3677
53:	[0s / 24s],		train_loss: 4.2869
85:	[0s / 10s],		train_loss: 4.2169
54:	[0s / 24s],		train_loss: 4.2232
67:	[0s / 1m:1s],		train_loss: 4.3773
86:	[0s / 11s],		train_loss: 4.2092
55:	[0s / 24s],		train_loss: 4.1612
68:	[0s / 1m:1s],		train_loss: 4.3376
10:	[0s / 11s],		train_loss: 4.3634
87:	[0s / 11s],		train_loss: 4.2162
56:	[0s / 24s],		train_loss: 4.2015
69:	[0s / 1m:1s],		train_loss: 4.2638
88:	[0s / 11s],		train_loss: 4.2085
57:	[0s / 24s],		train_loss: 4.2183
89:	[0s / 11s],		train_loss: 4.2379
16:	[0s / 56s],		train_loss: 4.3718
70:	[0s / 1m:1s],		train_loss: 4.3532
11:	[0s / 11s],		train_loss: 4.3789
58:	[0s / 24s],		train_loss: 4.1734
90:	[0s / 11s],		train_loss: 4.1975
59:	[0s / 24s],		train_loss: 4.2205
71:	[0s / 1m:2s],		train_loss: 4.2952
91:	[0s / 11s],		train_loss: 4.1907
60:	[0s / 25s],		train_loss: 4.2526
92:	[0s / 11s],		train_loss: 4.2244
12:	[0s / 11s],		train_loss: 4.3812
72:	[0s / 1m:2s],		train_loss: 4.3191
61:	[0s / 25s],		train_loss: 4.2279
93:	[0s / 11s],		train_loss: 4.1965
73:	[0s / 1m:2s],		train_loss: 4.3080
62:	[0s / 25s],		train_loss: 4.1939
94:	[0s / 11s],		train_loss: 4.2231
17:	[0s / 56s],		train_loss: 4.3129
63:	[0s / 25s],		train_loss: 4.1794
95:	[0s / 12s],		train_loss: 4.2424
13:	[0s / 11s],		train_loss: 4.3306
74:	[0s / 1m:2s],		train_loss: 4.3391
96:	[0s / 12s],		train_loss: 4.1587
64:	[0s / 25s],		train_loss: 4.1827
75:	[0s / 1m:2s],		train_loss: 4.3109
97:	[0s / 12s],		train_loss: 4.2401
65:	[0s / 25s],		train_loss: 4.1972
76:	[0s / 1m:2s],		train_loss: 4.3385
14:	[0s / 12s],		train_loss: 4.3388
98:	[0s / 12s],		train_loss: 4.2452
66:	[0s / 25s],		train_loss: 4.2243
99:	[0s / 12s],		train_loss: 4.2450
67:	[0s / 25s],		train_loss: 4.1886
18:	[0s / 57s],		train_loss: 4.3598
77:	[0s / 1m:3s],		train_loss: 4.3230
15:	[0s / 12s],		train_loss: 4.3269
68:	[0s / 25s],		train_loss: 4.1645
78:	[0s / 1m:3s],		train_loss: 4.3234
69:	[0s / 26s],		train_loss: 4.1734
16:	[0s / 12s],		train_loss: 4.3348
79:	[0s / 1m:3s],		train_loss: 4.2615
70:	[0s / 26s],		train_loss: 4.2016
19:	[0s / 57s],		train_loss: 4.2918
17:	[0s / 12s],		train_loss: 4.3463
80:	[0s / 1m:3s],		train_loss: 4.3288
71:	[0s / 26s],		train_loss: 4.1837
81:	[0s / 1m:3s],		train_loss: 4.3137
18:	[0s / 12s],		train_loss: 4.3833
72:	[0s / 26s],		train_loss: 4.1700
82:	[0s / 1m:3s],		train_loss: 4.3180
73:	[0s / 26s],		train_loss: 4.1790
19:	[0s / 13s],		train_loss: 4.3199
20:	[0s / 58s],		train_loss: 4.3235
83:	[0s / 1m:3s],		train_loss: 4.3358
74:	[0s / 26s],		train_loss: 4.1315
20:	[0s / 13s],		train_loss: 4.3317
84:	[0s / 1m:3s],		train_loss: 4.2895
75:	[0s / 26s],		train_loss: 4.1801
21:	[0s / 13s],		train_loss: 4.3248
85:	[0s / 1m:4s],		train_loss: 4.2727
76:	[0s / 26s],		train_loss: 4.1526
21:	[0s / 58s],		train_loss: 4.2864
22:	[0s / 13s],		train_loss: 4.3767
77:	[0s / 26s],		train_loss: 4.1385
86:	[0s / 1m:4s],		train_loss: 4.3040
78:	[0s / 27s],		train_loss: 4.1579
87:	[0s / 1m:4s],		train_loss: 4.3146
23:	[0s / 13s],		train_loss: 4.3029
79:	[0s / 27s],		train_loss: 4.1766
88:	[0s / 1m:4s],		train_loss: 4.2799
22:	[0s / 58s],		train_loss: 4.2963
24:	[0s / 13s],		train_loss: 4.3041
80:	[0s / 27s],		train_loss: 4.1612
89:	[0s / 1m:4s],		train_loss: 4.2676
25:	[0s / 13s],		train_loss: 4.3325
81:	[0s / 27s],		train_loss: 4.1629
90:	[0s / 1m:4s],		train_loss: 4.2841
82:	[0s / 27s],		train_loss: 4.1648
91:	[0s / 1m:4s],		train_loss: 4.3225
26:	[0s / 14s],		train_loss: 4.3001
23:	[0s / 59s],		train_loss: 4.2926
83:	[0s / 27s],		train_loss: 4.1739
92:	[0s / 1m:4s],		train_loss: 4.3165
27:	[0s / 14s],		train_loss: 4.3266
84:	[0s / 27s],		train_loss: 4.1442
93:	[0s / 1m:4s],		train_loss: 4.2732
28:	[0s / 14s],		train_loss: 4.3039
85:	[0s / 27s],		train_loss: 4.1424
94:	[0s / 1m:5s],		train_loss: 4.3031
24:	[0s / 59s],		train_loss: 4.3140
86:	[0s / 27s],		train_loss: 4.1345
29:	[0s / 14s],		train_loss: 4.3230
95:	[0s / 1m:5s],		train_loss: 4.2873
87:	[0s / 27s],		train_loss: 4.1734
96:	[0s / 1m:5s],		train_loss: 4.2394
30:	[0s / 14s],		train_loss: 4.2603
88:	[0s / 28s],		train_loss: 4.1581
97:	[0s / 1m:5s],		train_loss: 4.3127
31:	[0s / 14s],		train_loss: 4.2846
25:	[0s / 59s],		train_loss: 4.2925
89:	[0s / 28s],		train_loss: 4.1733
98:	[0s / 1m:5s],		train_loss: 4.2852
90:	[0s / 28s],		train_loss: 4.1598
32:	[0s / 14s],		train_loss: 4.3292
99:	[0s / 1m:5s],		train_loss: 4.2666
91:	[0s / 28s],		train_loss: 4.1357
33:	[0s / 15s],		train_loss: 4.2905
26:	[0s / 1m:0s],		train_loss: 4.2922
92:	[0s / 28s],		train_loss: 4.1128
34:	[0s / 15s],		train_loss: 4.3044
93:	[0s / 28s],		train_loss: 4.1585
27:	[0s / 1m:0s],		train_loss: 4.3664
35:	[0s / 15s],		train_loss: 4.2760
94:	[0s / 28s],		train_loss: 4.1723
36:	[0s / 15s],		train_loss: 4.3110
28:	[0s / 1m:0s],		train_loss: 4.3574
95:	[0s / 28s],		train_loss: 4.1118
37:	[0s / 15s],		train_loss: 4.3027
96:	[0s / 28s],		train_loss: 4.2007
29:	[0s / 1m:0s],		train_loss: 4.3365
38:	[0s / 15s],		train_loss: 4.2797
97:	[0s / 28s],		train_loss: 4.1560
39:	[0s / 15s],		train_loss: 4.2858
30:	[0s / 1m:0s],		train_loss: 4.3135
98:	[0s / 29s],		train_loss: 4.1881
40:	[0s / 15s],		train_loss: 4.2641
99:	[0s / 29s],		train_loss: 4.1302
41:	[0s / 15s],		train_loss: 4.2488
31:	[0s / 1m:0s],		train_loss: 4.3083
42:	[0s / 15s],		train_loss: 4.2632
32:	[0s / 1m:0s],		train_loss: 4.3418
43:	[0s / 15s],		train_loss: 4.3014
33:	[0s / 1m:1s],		train_loss: 4.3767
44:	[0s / 15s],		train_loss: 4.2873
34:	[0s / 1m:1s],		train_loss: 4.3869
45:	[0s / 16s],		train_loss: 4.2364
35:	[0s / 1m:1s],		train_loss: 4.3411
46:	[0s / 16s],		train_loss: 4.2778
36:	[0s / 1m:1s],		train_loss: 4.3326
47:	[0s / 16s],		train_loss: 4.2999
37:	[0s / 1m:1s],		train_loss: 4.3292
48:	[0s / 16s],		train_loss: 4.2837
38:	[0s / 1m:1s],		train_loss: 4.3047
49:	[0s / 16s],		train_loss: 4.2647
39:	[0s / 1m:1s],		train_loss: 4.3057
50:	[0s / 16s],		train_loss: 4.2366
51:	[0s / 16s],		train_loss: 4.2265
40:	[0s / 1m:1s],		train_loss: 4.3353
52:	[0s / 16s],		train_loss: 4.2764
41:	[0s / 1m:1s],		train_loss: 4.2602
53:	[0s / 16s],		train_loss: 4.2879
42:	[0s / 1m:1s],		train_loss: 4.2650
54:	[0s / 16s],		train_loss: 4.2467
43:	[0s / 1m:1s],		train_loss: 4.2575
55:	[0s / 16s],		train_loss: 4.2538
56:	[0s / 16s],		train_loss: 4.2407
44:	[0s / 1m:1s],		train_loss: 4.2861
57:	[0s / 16s],		train_loss: 4.2616
45:	[0s / 1m:1s],		train_loss: 4.2744
58:	[0s / 16s],		train_loss: 4.2544
46:	[0s / 1m:1s],		train_loss: 4.3019
59:	[0s / 16s],		train_loss: 4.2621
47:	[0s / 1m:2s],		train_loss: 4.3033
60:	[0s / 17s],		train_loss: 4.2650
48:	[0s / 1m:2s],		train_loss: 4.3642
61:	[0s / 17s],		train_loss: 4.2578
49:	[0s / 1m:2s],		train_loss: 4.2974
62:	[0s / 17s],		train_loss: 4.2744
63:	[0s / 17s],		train_loss: 4.2380
50:	[0s / 1m:2s],		train_loss: 4.3079
64:	[0s / 17s],		train_loss: 4.2259
51:	[0s / 1m:2s],		train_loss: 4.2997
65:	[0s / 17s],		train_loss: 4.2846
52:	[0s / 1m:2s],		train_loss: 4.3627
66:	[0s / 17s],		train_loss: 4.2536
53:	[0s / 1m:2s],		train_loss: 4.3897
67:	[0s / 17s],		train_loss: 4.2629
54:	[0s / 1m:2s],		train_loss: 4.3400
68:	[0s / 17s],		train_loss: 4.2605
55:	[0s / 1m:2s],		train_loss: 4.2916
69:	[0s / 17s],		train_loss: 4.2553
70:	[0s / 17s],		train_loss: 4.2651
56:	[0s / 1m:2s],		train_loss: 4.3127
71:	[0s / 17s],		train_loss: 4.2851
57:	[0s / 1m:2s],		train_loss: 4.2584
72:	[0s / 17s],		train_loss: 4.2419
58:	[0s / 1m:2s],		train_loss: 4.2802
73:	[0s / 17s],		train_loss: 4.2529
59:	[0s / 1m:2s],		train_loss: 4.2990
74:	[0s / 17s],		train_loss: 4.2680
75:	[0s / 17s],		train_loss: 4.2863
60:	[0s / 1m:3s],		train_loss: 4.2839
76:	[0s / 18s],		train_loss: 4.2188
61:	[0s / 1m:3s],		train_loss: 4.2671
77:	[0s / 18s],		train_loss: 4.2452
62:	[0s / 1m:3s],		train_loss: 4.2428
78:	[0s / 18s],		train_loss: 4.2587
63:	[0s / 1m:3s],		train_loss: 4.2459
79:	[0s / 18s],		train_loss: 4.2669
64:	[0s / 1m:3s],		train_loss: 4.2612
80:	[0s / 18s],		train_loss: 4.2492
81:	[0s / 18s],		train_loss: 4.2462
65:	[0s / 1m:3s],		train_loss: 4.2513
82:	[0s / 18s],		train_loss: 4.1990
66:	[0s / 1m:3s],		train_loss: 4.2472
83:	[0s / 18s],		train_loss: 4.2175
67:	[0s / 1m:3s],		train_loss: 4.2216
84:	[0s / 18s],		train_loss: 4.2149
68:	[0s / 1m:3s],		train_loss: 4.2456
85:	[0s / 18s],		train_loss: 4.2347
69:	[0s / 1m:3s],		train_loss: 4.2084
86:	[0s / 18s],		train_loss: 4.2260
70:	[0s / 1m:3s],		train_loss: 4.2358
87:	[0s / 18s],		train_loss: 4.2232
71:	[0s / 1m:3s],		train_loss: 4.2579
88:	[0s / 18s],		train_loss: 4.2006
89:	[0s / 18s],		train_loss: 4.2485
72:	[0s / 1m:3s],		train_loss: 4.2020
90:	[0s / 18s],		train_loss: 4.2263
73:	[0s / 1m:4s],		train_loss: 4.2331
91:	[0s / 18s],		train_loss: 4.2559
74:	[0s / 1m:4s],		train_loss: 4.2607
92:	[0s / 19s],		train_loss: 4.1904
75:	[0s / 1m:4s],		train_loss: 4.2494
93:	[0s / 19s],		train_loss: 4.2391
76:	[0s / 1m:4s],		train_loss: 4.2340
94:	[0s / 19s],		train_loss: 4.2022
77:	[0s / 1m:4s],		train_loss: 4.2162
95:	[0s / 19s],		train_loss: 4.2507
78:	[0s / 1m:4s],		train_loss: 4.2763
96:	[0s / 19s],		train_loss: 4.2653
79:	[0s / 1m:4s],		train_loss: 4.2324
97:	[0s / 19s],		train_loss: 4.2343
98:	[0s / 19s],		train_loss: 4.1774
80:	[0s / 1m:4s],		train_loss: 4.2632
99:	[0s / 19s],		train_loss: 4.1925
81:	[0s / 1m:4s],		train_loss: 4.3090
82:	[0s / 1m:4s],		train_loss: 4.2830
83:	[0s / 1m:4s],		train_loss: 4.2658
84:	[0s / 1m:4s],		train_loss: 4.2841
85:	[0s / 1m:4s],		train_loss: 4.3521
86:	[0s / 1m:4s],		train_loss: 4.3315
87:	[0s / 1m:4s],		train_loss: 4.2812
88:	[0s / 1m:4s],		train_loss: 4.2843
89:	[0s / 1m:4s],		train_loss: 4.3115
90:	[0s / 1m:4s],		train_loss: 4.4501
91:	[0s / 1m:5s],		train_loss: 4.2874
92:	[0s / 1m:5s],		train_loss: 4.2762
93:	[0s / 1m:5s],		train_loss: 4.2629
94:	[0s / 1m:5s],		train_loss: 4.3257
95:	[0s / 1m:5s],		train_loss: 4.3285
96:	[0s / 1m:5s],		train_loss: 4.3141
97:	[0s / 1m:5s],		train_loss: 4.2500
98:	[0s / 1m:5s],		train_loss: 4.1777
99:	[0s / 1m:5s],		train_loss: 4.3518
Best parameters: {'num_nodes': [32], 'dropout': 0.2440226889088444, 'learning_rate': 0.004588293672351806, 'batch_norm': True}
  [ckpt] Params saved → checkpoints/tabdpt/OrmoniTirodei/-1/seed123/fold3/tabdpt_deepsurv_tuned_params.json
0:	[0s / 0s],		train_loss: 3.8581,	val_loss: 6.3562
1:	[0s / 0s],		train_loss: 3.7296,	val_loss: 6.3610
2:	[0s / 0s],		tra