[I 2026-07-01 11:34:12,976] Trial 72 finished with value: 0.7594669089459318 and parameters: {'num_nodes': [32], 'dropout': 0.27443652333786794, 'learning_rate': 0.000124831870390937, 'batch_norm': False}. Best is trial 58 with value: 0.7812087895237219.
/scratch.hpc/luca.cotugno/Foundation_model_clinical_data/test_tabular_model.py:481: UserWarning: Choices for a categorical distribution should be a tuple of None, bool, int, float and str for persistent storage but contains [32] which is of type list.
  num_nodes  = trial.suggest_categorical("num_nodes", [[32], [64], [128], [64, 32], [128, 64]])
/scratch.hpc/luca.cotugno/Foundation_model_clinical_data/test_tabular_model.py:481: UserWarning: Choices for a categorical distribution should be a tuple of None, bool, int, float and str for persistent storage but contains [64] which is of type list.
  num_nodes  = trial.suggest_categorical("num_nodes", [[32], [64], [128], [64, 32], [128, 64]])
/scratch.hpc/luca.cotugno/Foundation_model_clinical_data/test_tabular_model.py:481: UserWarning: Choices for a categorical distribution should be a tuple of None, bool, int, float and str for persistent storage but contains [128] which is of type list.
  num_nodes  = trial.suggest_categorical("num_nodes", [[32], [64], [128], [64, 32], [128, 64]])
/scratch.hpc/luca.cotugno/Foundation_model_clinical_data/test_tabular_model.py:481: UserWarning: Choices for a categorical distribution should be a tuple of None, bool, int, float and str for persistent storage but contains [64, 32] which is of type list.
  num_nodes  = trial.suggest_categorical("num_nodes", [[32], [64], [128], [64, 32], [128, 64]])
/scratch.hpc/luca.cotugno/Foundation_model_clinical_data/test_tabular_model.py:481: UserWarning: Choices for a categorical distribution should be a tuple of None, bool, int, float and str for persistent storage but contains [128, 64] which is of type list.
  num_nodes  = trial.suggest_categorical("num_nodes", [[32], [64], [128], [64, 32], [128, 64]])

13:	[0s / 2s],		train_loss: 4.4758
46:	[0s / 22s],		train_loss: 4.1730
23:	[0s / 3s],		train_loss: 4.4666
65:	[3s / 3m:59s],		train_loss: 4.1641
74:	[0s / 48s],		train_loss: 4.0507
14:	[0s / 2s],		train_loss: 4.4995
24:	[0s / 3s],		train_loss: 4.4531
15:	[2s / 34s],		train_loss: 4.5208
4:	[1s / 6s],		train_loss: 4.3594
82:	[0s / 22s],		train_loss: 4.0766
15:	[0s / 2s],		train_loss: 4.4795
25:	[0s / 3s],		train_loss: 4.4500
16:	[0s / 2s],		train_loss: 4.4795
26:	[0s / 3s],		train_loss: 4.4097
83:	[0s / 22s],		train_loss: 4.0622
47:	[0s / 22s],		train_loss: 4.1917
17:	[0s / 2s],		train_loss: 4.4445
27:	[0s / 4s],		train_loss: 4.4234
84:	[0s / 22s],		train_loss: 4.0958
28:	[0s / 4s],		train_loss: 4.4567
18:	[0s / 2s],		train_loss: 4.4719
75:	[0s / 49s],		train_loss: 4.0292
48:	[0s / 23s],		train_loss: 4.2121
29:	[0s / 4s],		train_loss: 4.4343
19:	[0s / 3s],		train_loss: 4.4667
85:	[0s / 22s],		train_loss: 4.0732
30:	[0s / 4s],		train_loss: 4.4235
20:	[0s / 3s],		train_loss: 4.4306
31:	[0s / 4s],		train_loss: 4.3997
21:	[0s / 3s],		train_loss: 4.4514
86:	[0s / 23s],		train_loss: 4.0747
49:	[0s / 23s],		train_loss: 4.1978
32:	[0s / 4s],		train_loss: 4.4126
22:	[0s / 3s],		train_loss: 4.4318
33:	[0s / 4s],		train_loss: 4.3958
87:	[0s / 23s],		train_loss: 4.0702
23:	[0s / 3s],		train_loss: 4.4451
76:	[0s / 50s],		train_loss: 4.0216
34:	[0s / 5s],		train_loss: 4.4054
24:	[0s / 3s],		train_loss: 4.4047
5:	[1s / 8s],		train_loss: 4.3872
50:	[0s / 23s],		train_loss: 4.2006
35:	[0s / 5s],		train_loss: 4.3798
88:	[0s / 23s],		train_loss: 4.0812
25:	[0s / 3s],		train_loss: 4.4113
36:	[0s / 5s],		train_loss: 4.3985
26:	[0s / 4s],		train_loss: 4.4126
89:	[0s / 23s],		train_loss: 4.0418
37:	[0s / 5s],		train_loss: 4.3895
27:	[0s / 4s],		train_loss: 4.4036
38:	[0s / 5s],		train_loss: 4.3641
51:	[0s / 24s],		train_loss: 4.1635
28:	[0s / 4s],		train_loss: 4.4001
90:	[0s / 24s],		train_loss: 4.0408
77:	[0s / 51s],		train_loss: 3.9754
39:	[0s / 5s],		train_loss: 4.4332
29:	[0s / 4s],		train_loss: 4.4010
40:	[0s / 5s],		train_loss: 4.4160
91:	[0s / 24s],		train_loss: 4.0200
30:	[0s / 4s],		train_loss: 4.4000
41:	[0s / 6s],		train_loss: 4.3498
52:	[0s / 24s],		train_loss: 4.1521
31:	[0s / 4s],		train_loss: 4.3741
42:	[0s / 6s],		train_loss: 4.3663
92:	[0s / 24s],		train_loss: 4.0390
32:	[0s / 4s],		train_loss: 4.3859
16:	[2s / 36s],		train_loss: 4.4990
43:	[0s / 6s],		train_loss: 4.3401
33:	[0s / 5s],		train_loss: 4.3790
93:	[0s / 24s],		train_loss: 4.0070
78:	[0s / 51s],		train_loss: 4.0013
44:	[0s / 6s],		train_loss: 4.3740
53:	[0s / 25s],		train_loss: 4.1621
34:	[0s / 5s],		train_loss: 4.3515
6:	[1s / 9s],		train_loss: 4.3448
45:	[0s / 6s],		train_loss: 4.3536
94:	[0s / 25s],		train_loss: 4.0079
35:	[0s / 5s],		train_loss: 4.3741
46:	[0s / 6s],		train_loss: 4.3669
36:	[0s / 5s],		train_loss: 4.3604
95:	[0s / 25s],		train_loss: 4.0259
47:	[0s / 6s],		train_loss: 4.3767
37:	[0s / 5s],		train_loss: 4.3385
54:	[0s / 25s],		train_loss: 4.1568
48:	[0s / 7s],		train_loss: 4.3499
79:	[0s / 52s],		train_loss: 3.9951
38:	[0s / 5s],		train_loss: 4.3707
96:	[0s / 25s],		train_loss: 4.0081
49:	[0s / 7s],		train_loss: 4.3476
39:	[0s / 5s],		train_loss: 4.3435
50:	[0s / 7s],		train_loss: 4.3360
55:	[0s / 26s],		train_loss: 4.1241
97:	[0s / 25s],		train_loss: 4.0089
40:	[0s / 6s],		train_loss: 4.3448
51:	[0s / 7s],		train_loss: 4.3323
41:	[0s / 6s],		train_loss: 4.3394
52:	[0s / 7s],		train_loss: 4.3330
80:	[0s / 52s],		train_loss: 3.9851
98:	[0s / 26s],		train_loss: 3.9879
42:	[0s / 6s],		train_loss: 4.3345
53:	[0s / 7s],		train_loss: 4.3306
56:	[0s / 26s],		train_loss: 4.1556
43:	[0s / 6s],		train_loss: 4.3394
54:	[0s / 7s],		train_loss: 4.3137
99:	[0s / 26s],		train_loss: 3.9853
55:	[0s / 8s],		train_loss: 4.3501
7:	[1s / 11s],		train_loss: 4.3235
44:	[0s / 6s],		train_loss: 4.3195
56:	[0s / 8s],		train_loss: 4.3262
45:	[0s / 6s],		train_loss: 4.3366
0:	[0s / 0s],		train_loss: 5.4863
57:	[0s / 27s],		train_loss: 4.1584
81:	[0s / 53s],		train_loss: 3.9995
57:	[0s / 8s],		train_loss: 4.3002
46:	[0s / 7s],		train_loss: 4.3508
1:	[0s / 0s],		train_loss: 4.8485
58:	[0s / 8s],		train_loss: 4.3169
47:	[0s / 7s],		train_loss: 4.3192
2:	[0s / 0s],		train_loss: 4.6387
66:	[5s / 4m:4s],		train_loss: 4.1546
58:	[0s / 27s],		train_loss: 4.1407
59:	[0s / 8s],		train_loss: 4.3119
48:	[0s / 7s],		train_loss: 4.3206
3:	[0s / 0s],		train_loss: 4.5687
60:	[0s / 8s],		train_loss: 4.3454
49:	[0s / 7s],		train_loss: 4.3058
61:	[0s / 9s],		train_loss: 4.3116
4:	[0s / 0s],		train_loss: 4.5520
50:	[0s / 7s],		train_loss: 4.3131
59:	[0s / 27s],		train_loss: 4.1112
82:	[0s / 54s],		train_loss: 3.9986
62:	[0s / 9s],		train_loss: 4.2932
17:	[2s / 39s],		train_loss: 4.4788
51:	[0s / 7s],		train_loss: 4.3013
5:	[0s / 1s],		train_loss: 4.5350
63:	[0s / 9s],		train_loss: 4.3126
52:	[0s / 8s],		train_loss: 4.3029
6:	[0s / 1s],		train_loss: 4.5266
64:	[0s / 9s],		train_loss: 4.3052
53:	[0s / 8s],		train_loss: 4.2721
60:	[0s / 28s],		train_loss: 4.0944
7:	[0s / 1s],		train_loss: 4.5205
8:	[1s / 12s],		train_loss: 4.3143
65:	[0s / 9s],		train_loss: 4.2644
54:	[0s / 8s],		train_loss: 4.2948
8:	[0s / 1s],		train_loss: 4.4720
66:	[0s / 9s],		train_loss: 4.3002
55:	[0s / 8s],		train_loss: 4.2947
83:	[0s / 55s],		train_loss: 3.9602
67:	[0s / 9s],		train_loss: 4.2512
9:	[0s / 1s],		train_loss: 4.4715
61:	[0s / 28s],		train_loss: 4.1166
56:	[0s / 8s],		train_loss: 4.2953
68:	[0s / 10s],		train_loss: 4.2893
10:	[0s / 2s],		train_loss: 4.4952
57:	[0s / 8s],		train_loss: 4.3014
69:	[0s / 10s],		train_loss: 4.2732
58:	[0s / 8s],		train_loss: 4.2821
11:	[0s / 2s],		train_loss: 4.4567
70:	[0s / 10s],		train_loss: 4.2620
59:	[0s / 9s],		train_loss: 4.2668
62:	[0s / 29s],		train_loss: 4.1589
71:	[0s / 10s],		train_loss: 4.2740
12:	[0s / 2s],		train_loss: 4.4611
60:	[0s / 9s],		train_loss: 4.2735
72:	[0s / 10s],		train_loss: 4.2580
84:	[0s / 56s],		train_loss: 3.9489
13:	[0s / 2s],		train_loss: 4.4649
61:	[0s / 9s],		train_loss: 4.2528
73:	[0s / 10s],		train_loss: 4.2660
63:	[0s / 29s],		train_loss: 4.1128
62:	[0s / 9s],		train_loss: 4.2562
14:	[0s / 2s],		train_loss: 4.4228
74:	[0s / 10s],		train_loss: 4.2532
63:	[0s / 9s],		train_loss: 4.2759
75:	[0s / 11s],		train_loss: 4.2338
15:	[0s / 3s],		train_loss: 4.4102
64:	[0s / 9s],		train_loss: 4.2550
76:	[0s / 11s],		train_loss: 4.2483
9:	[1s / 14s],		train_loss: 4.3126
16:	[0s / 3s],		train_loss: 4.4328
64:	[0s / 30s],		train_loss: 4.1355
77:	[0s / 11s],		train_loss: 4.2313
65:	[0s / 10s],		train_loss: 4.2642
17:	[0s / 3s],		train_loss: 4.4124
85:	[0s / 56s],		train_loss: 3.9522
78:	[0s / 11s],		train_loss: 4.2606
66:	[0s / 10s],		train_loss: 4.2418
18:	[0s / 3s],		train_loss: 4.4108
79:	[0s / 11s],		train_loss: 4.2443
67:	[0s / 10s],		train_loss: 4.2420
80:	[0s / 11s],		train_loss: 4.2138
65:	[0s / 30s],		train_loss: 4.0793
19:	[0s / 3s],		train_loss: 4.3708
68:	[0s / 10s],		train_loss: 4.2504
81:	[0s / 11s],		train_loss: 4.2559
69:	[0s / 10s],		train_loss: 4.2463
20:	[0s / 3s],		train_loss: 4.3939
82:	[0s / 12s],		train_loss: 4.2378
70:	[0s / 10s],		train_loss: 4.2378
21:	[0s / 4s],		train_loss: 4.4069
66:	[0s / 31s],		train_loss: 4.1185
83:	[0s / 12s],		train_loss: 4.2227
86:	[0s / 57s],		train_loss: 3.9493
71:	[0s / 10s],		train_loss: 4.2572
22:	[0s / 4s],		train_loss: 4.3926
84:	[0s / 12s],		train_loss: 4.2129
72:	[0s / 11s],		train_loss: 4.2301
18:	[3s / 43s],		train_loss: 4.4818
23:	[0s / 4s],		train_loss: 4.3888
85:	[0s / 12s],		train_loss: 4.2142
73:	[0s / 11s],		train_loss: 4.2571
67:	[0s / 31s],		train_loss: 4.0703
24:	[0s / 4s],		train_loss: 4.3813
86:	[0s / 12s],		train_loss: 4.2108
74:	[0s / 11s],		train_loss: 4.1977
87:	[0s / 12s],		train_loss: 4.1853
25:	[0s / 4s],		train_loss: 4.3582
75:	[0s / 11s],		train_loss: 4.2228
10:	[1s / 16s],		train_loss: 4.2853
88:	[0s / 13s],		train_loss: 4.2317
26:	[0s / 5s],		train_loss: 4.3682
76:	[0s / 11s],		train_loss: 4.2138
68:	[0s / 31s],		train_loss: 4.1225
87:	[0s / 58s],		train_loss: 3.9378
89:	[0s / 13s],		train_loss: 4.2181
77:	[0s / 11s],		train_loss: 4.1952
27:	[0s / 5s],		train_loss: 4.3794
90:	[0s / 13s],		train_loss: 4.2412
78:	[0s / 12s],		train_loss: 4.2230
91:	[0s / 13s],		train_loss: 4.2144
28:	[0s / 5s],		train_loss: 4.3441
79:	[0s / 12s],		train_loss: 4.2303
92:	[0s / 13s],		train_loss: 4.1670
69:	[0s / 32s],		train_loss: 4.0918
29:	[0s / 5s],		train_loss: 4.3644
80:	[0s / 12s],		train_loss: 4.2162
93:	[0s / 13s],		train_loss: 4.1992
88:	[0s / 59s],		train_loss: 3.9425
30:	[0s / 5s],		train_loss: 4.3660
81:	[0s / 12s],		train_loss: 4.2055
94:	[0s / 13s],		train_loss: 4.1919
82:	[0s / 12s],		train_loss: 4.2411
70:	[0s / 32s],		train_loss: 4.0737
95:	[0s / 14s],		train_loss: 4.1802
31:	[0s / 6s],		train_loss: 4.3306
83:	[0s / 12s],		train_loss: 4.1995
96:	[0s / 14s],		train_loss: 4.1648
32:	[0s / 6s],		train_loss: 4.3344
84:	[0s / 12s],		train_loss: 4.1786
97:	[0s / 14s],		train_loss: 4.1835
67:	[5s / 4m:10s],		train_loss: 4.1454
11:	[1s / 17s],		train_loss: 4.3093
71:	[0s / 33s],		train_loss: 4.0781
33:	[0s / 6s],		train_loss: 4.3596
98:	[0s / 14s],		train_loss: 4.1586
85:	[0s / 13s],		train_loss: 4.2077
89:	[0s / 59s],		train_loss: 3.9234
99:	[0s / 14s],		train_loss: 4.1732
34:	[0s / 6s],		train_loss: 4.3177
86:	[0s / 13s],		train_loss: 4.1535
72:	[0s / 33s],		train_loss: 4.1104
87:	[0s / 13s],		train_loss: 4.1955
35:	[0s / 6s],		train_loss: 4.3209
0:	[0s / 0s],		train_loss: 5.6853
88:	[0s / 13s],		train_loss: 4.1754
36:	[0s / 7s],		train_loss: 4.3537
1:	[0s / 0s],		train_loss: 4.9648
19:	[2s / 45s],		train_loss: 4.4709
89:	[0s / 13s],		train_loss: 4.1591
37:	[0s / 7s],		train_loss: 4.3132
2:	[0s / 0s],		train_loss: 4.7930
90:	[0s / 1m:0s],		train_loss: 3.9157
73:	[0s / 34s],		train_loss: 4.0554
90:	[0s / 14s],		train_loss: 4.1868
3:	[0s / 0s],		train_loss: 4.7147
38:	[0s / 7s],		train_loss: 4.3119
91:	[0s / 14s],		train_loss: 4.1597
4:	[0s / 0s],		train_loss: 4.6951
39:	[0s / 7s],		train_loss: 4.3433
12:	[1s / 19s],		train_loss: 4.2987
92:	[0s / 14s],		train_loss: 4.1383
5:	[0s / 0s],		train_loss: 4.6467
74:	[0s / 34s],		train_loss: 4.0787
40:	[0s / 7s],		train_loss: 4.3087
93:	[0s / 14s],		train_loss: 4.1613
6:	[0s / 1s],		train_loss: 4.6148
7:	[0s / 1s],		train_loss: 4.5877
94:	[0s / 14s],		train_loss: 4.1534
41:	[0s / 8s],		train_loss: 4.2991
91:	[0s / 1m:1s],		train_loss: 3.9357
8:	[0s / 1s],		train_loss: 4.5538
95:	[0s / 14s],		train_loss: 4.1598
42:	[0s / 8s],		train_loss: 4.3177
75:	[0s / 35s],		train_loss: 4.0807
9:	[0s / 1s],		train_loss: 4.5622
96:	[0s / 15s],		train_loss: 4.1601
43:	[0s / 8s],		train_loss: 4.2875
10:	[0s / 1s],		train_loss: 4.5304
97:	[0s / 15s],		train_loss: 4.1295
44:	[0s / 8s],		train_loss: 4.3093
11:	[0s / 1s],		train_loss: 4.5633
76:	[0s / 35s],		train_loss: 4.0497
98:	[0s / 15s],		train_loss: 4.1465
45:	[0s / 8s],		train_loss: 4.2659
12:	[0s / 2s],		train_loss: 4.5356
99:	[0s / 15s],		train_loss: 4.1308
92:	[0s / 1m:2s],		train_loss: 3.8858
46:	[0s / 8s],		train_loss: 4.2918
13:	[0s / 2s],		train_loss: 4.5610
77:	[0s / 35s],		train_loss: 4.0420
14:	[0s / 2s],		train_loss: 4.5128
47:	[0s / 9s],		train_loss: 4.2606
0:	[0s / 0s],		train_loss: 5.5582
15:	[0s / 2s],		train_loss: 4.5052
13:	[1s / 20s],		train_loss: 4.2925
1:	[0s / 0s],		train_loss: 4.8594
48:	[0s / 9s],		train_loss: 4.2600
16:	[0s / 2s],		train_loss: 4.5025
2:	[0s / 0s],		train_loss: 4.7520
78:	[0s / 36s],		train_loss: 4.0938
49:	[0s / 9s],		train_loss: 4.2765
17:	[0s / 2s],		train_loss: 4.4700
3:	[0s / 0s],		train_loss: 4.6845
93:	[0s / 1m:3s],		train_loss: 3.9255
18:	[0s / 2s],		train_loss: 4.4871
50:	[0s / 9s],		train_loss: 4.2797
4:	[0s / 0s],		train_loss: 4.6527
19:	[0s / 3s],		train_loss: 4.4983
79:	[0s / 36s],		train_loss: 4.0530
51:	[0s / 9s],		train_loss: 4.2560
5:	[0s / 1s],		train_loss: 4.6180
20:	[0s / 3s],		train_loss: 4.4649
52:	[0s / 10s],		train_loss: 4.2925
6:	[0s / 1s],		train_loss: 4.5929
21:	[0s / 3s],		train_loss: 4.4940
94:	[0s / 1m:3s],		train_loss: 3.9099
7:	[0s / 1s],		train_loss: 4.5742
53:	[0s / 10s],		train_loss: 4.2656
80:	[0s / 37s],		train_loss: 4.0231
20:	[3s / 49s],		train_loss: 4.4115
22:	[0s / 3s],		train_loss: 4.4798
8:	[0s / 1s],		train_loss: 4.5696
14:	[1s / 21s],		train_loss: 4.2547
23:	[0s / 3s],		train_loss: 4.4540
54:	[0s / 10s],		train_loss: 4.2822
9:	[0s / 1s],		train_loss: 4.5474
24:	[0s / 3s],		train_loss: 4.4409
55:	[0s / 10s],		train_loss: 4.2486
81:	[0s / 37s],		train_loss: 4.0068
10:	[0s / 1s],		train_loss: 4.5803
25:	[0s / 4s],		train_loss: 4.4442
56:	[0s / 10s],		train_loss: 4.2919
11:	[0s / 2s],		train_loss: 4.5220
95:	[0s / 1m:4s],		train_loss: 3.9211
26:	[0s / 4s],		train_loss: 4.4295
57:	[0s / 11s],		train_loss: 4.2628
12:	[0s / 2s],		train_loss: 4.5399
27:	[0s / 4s],		train_loss: 4.4579
82:	[0s / 38s],		train_loss: 4.0258
58:	[0s / 11s],		train_loss: 4.2573
13:	[0s / 2s],		train_loss: 4.5288
28:	[0s / 4s],		train_loss: 4.4287
14:	[0s / 2s],		train_loss: 4.4757
59:	[0s / 11s],		train_loss: 4.2780
29:	[0s / 4s],		train_loss: 4.4013
15:	[0s / 2s],		train_loss: 4.4855
30:	[0s / 4s],		train_loss: 4.4099
60:	[0s / 11s],		train_loss: 4.2676
83:	[0s / 38s],		train_loss: 4.0590
16:	[0s / 2s],		train_loss: 4.4608
31:	[0s / 5s],		train_loss: 4.4011
61:	[0s / 11s],		train_loss: 4.2400
96:	[0s / 1m:5s],		train_loss: 3.8742
32:	[0s / 5s],		train_loss: 4.3987
17:	[0s / 3s],		train_loss: 4.4807
62:	[0s / 12s],		train_loss: 4.2268
15:	[1s / 23s],		train_loss: 4.2385
33:	[0s / 5s],		train_loss: 4.3915
18:	[0s / 3s],		train_loss: 4.4746
84:	[0s / 39s],		train_loss: 4.0045
63:	[0s / 12s],		train_loss: 4.2336
34:	[0s / 5s],		train_loss: 4.4378
19:	[0s / 3s],		train_loss: 4.5039
64:	[0s / 12s],		train_loss: 4.2155
35:	[0s / 5s],		train_loss: 4.3963
20:	[0s / 3s],		train_loss: 4.4598
85:	[0s / 39s],		train_loss: 4.0139
36:	[0s / 5s],		train_loss: 4.3680
65:	[0s / 12s],		train_loss: 4.2589
21:	[0s / 3s],		train_loss: 4.4590
97:	[0s / 1m:6s],		train_loss: 3.8767
68:	[6s / 4m:16s],		train_loss: 4.1246
37:	[0s / 6s],		train_loss: 4.3795
22:	[0s / 3s],		train_loss: 4.4744
66:	[0s / 12s],		train_loss: 4.2643
38:	[0s / 6s],		train_loss: 4.3797
86:	[0s / 39s],		train_loss: 4.0013
23:	[0s / 4s],		train_loss: 4.4633
67:	[0s / 13s],		train_loss: 4.2256
39:	[0s / 6s],		train_loss: 4.3736
24:	[0s / 4s],		train_loss: 4.4547
68:	[0s / 13s],		train_loss: 4.2477
40:	[0s / 6s],		train_loss: 4.3754
25:	[0s / 4s],		train_loss: 4.4292
69:	[0s / 13s],		train_loss: 4.2227
41:	[0s / 6s],		train_loss: 4.3789
87:	[0s / 40s],		train_loss: 3.9853
26:	[0s / 4s],		train_loss: 4.4282
98:	[0s / 1m:6s],		train_loss: 3.9232
42:	[0s / 6s],		train_loss: 4.3691
70:	[0s / 13s],		train_loss: 4.2584
27:	[0s / 4s],		train_loss: 4.4310
43:	[0s / 6s],		train_loss: 4.3589
71:	[0s / 13s],		train_loss: 4.2360
28:	[0s / 4s],		train_loss: 4.4429
44:	[0s / 7s],		train_loss: 4.3463
88:	[0s / 40s],		train_loss: 3.9804
16:	[1s / 25s],		train_loss: 4.2672
72:	[0s / 13s],		train_loss: 4.2150
29:	[0s / 4s],		train_loss: 4.4053
45:	[0s / 7s],		train_loss: 4.3461
21:	[3s / 52s],		train_loss: 4.4676
30:	[0s / 5s],		train_loss: 4.4205
73:	[0s / 14s],		train_loss: 4.2037
46:	[0s / 7s],		train_loss: 4.3445
89:	[0s / 41s],		train_loss: 3.9949
99:	[0s / 1m:7s],		train_loss: 3.9007
47:	[0s / 7s],		train_loss: 4.3059
31:	[0s / 5s],		train_loss: 4.4020
74:	[0s / 14s],		train_loss: 4.1863
48:	[0s / 7s],		train_loss: 4.3256
32:	[0s / 5s],		train_loss: 4.3733
75:	[0s / 14s],		train_loss: 4.2185
49:	[0s / 7s],		train_loss: 4.3160
33:	[0s / 5s],		train_loss: 4.4170
90:	[0s / 41s],		train_loss: 3.9984
76:	[0s / 14s],		train_loss: 4.2317
50:	[0s / 8s],		train_loss: 4.3402
34:	[0s / 5s],		train_loss: 4.4125
77:	[0s / 14s],		train_loss: 4.2390
51:	[0s / 8s],		train_loss: 4.3230
35:	[0s / 6s],		train_loss: 4.3839
91:	[0s / 41s],		train_loss: 3.9358
52:	[0s / 8s],		train_loss: 4.3239
78:	[0s / 15s],		train_loss: 4.2021
36:	[0s / 6s],		train_loss: 4.3709
0:	[0s / 0s],		train_loss: 6.6886
53:	[0s / 8s],		train_loss: 4.3273
17:	[1s / 26s],		train_loss: 4.2649
37:	[0s / 6s],		train_loss: 4.3663
79:	[0s / 15s],		train_loss: 4.1896
54:	[0s / 8s],		train_loss: 4.3000
38:	[0s / 6s],		train_loss: 4.3550
80:	[0s / 15s],		train_loss: 4.2109
55:	[0s / 8s],		train_loss: 4.3063
39:	[0s / 6s],		train_loss: 4.3676
92:	[0s / 42s],		train_loss: 3.9424
81:	[0s / 15s],		train_loss: 4.1978
56:	[0s / 8s],		train_loss: 4.3332
40:	[0s / 6s],		train_loss: 4.3412
82:	[0s / 15s],		train_loss: 4.1726
57:	[0s / 9s],		train_loss: 4.3064
41:	[0s / 6s],		train_loss: 4.3678
1:	[0s / 1s],		train_loss: 5.1878
58:	[0s / 9s],		train_loss: 4.3179
83:	[0s / 16s],		train_loss: 4.2108
93:	[0s / 42s],		train_loss: 4.0063
42:	[0s / 7s],		train_loss: 4.3662
59:	[0s / 9s],		train_loss: 4.2940
84:	[0s / 16s],		train_loss: 4.1886
43:	[0s / 7s],		train_loss: 4.3701
60:	[0s / 9s],		train_loss: 4.2820
44:	[0s / 7s],		train_loss: 4.3394
85:	[0s / 16s],		train_loss: 4.1993
61:	[0s / 9s],		train_loss: 4.2654
94:	[0s / 43s],		train_loss: 3.9620
45:	[0s / 7s],		train_loss: 4.3621
86:	[0s / 16s],		train_loss: 4.2018
62:	[0s / 9s],		train_loss: 4.2966
46:	[0s / 7s],		train_loss: 4.3524
87:	[0s / 16s],		train_loss: 4.1806
63:	[0s / 9s],		train_loss: 4.2788
2:	[0s / 2s],		train_loss: 4.8995
47:	[0s / 7s],		train_loss: 4.3641
64:	[0s / 10s],		train_loss: 4.2837
88:	[0s / 16s],		train_loss: 4.1841
95:	[0s / 43s],		train_loss: 3.9746
48:	[0s / 8s],		train_loss: 4.3446
65:	[0s / 10s],		train_loss: 4.2696
89:	[0s / 17s],		train_loss: 4.2031
22:	[3s / 55s],		train_loss: 4.4272
49:	[0s / 8s],		train_loss: 4.3400
66:	[0s / 10s],		train_loss: 4.2529
18:	[1s / 28s],		train_loss: 4.2517
90:	[0s / 17s],		train_loss: 4.1914
50:	[0s / 8s],		train_loss: 4.2998
67:	[0s / 10s],		train_loss: 4.2689
96:	[0s / 44s],		train_loss: 3.9826
91:	[0s / 17s],		train_loss: 4.1666
51:	[0s / 8s],		train_loss: 4.3199
68:	[0s / 10s],		train_loss: 4.2590
3:	[0s / 3s],		train_loss: 4.8204
52:	[0s / 8s],		train_loss: 4.3481
69:	[0s / 10s],		train_loss: 4.2682
92:	[0s / 17s],		train_loss: 4.1754
53:	[0s / 8s],		train_loss: 4.3141
70:	[0s / 10s],		train_loss: 4.2344
97:	[0s / 44s],		train_loss: 3.9585
93:	[0s / 17s],		train_loss: 4.1929
71:	[0s / 11s],		train_loss: 4.2784
54:	[0s / 8s],		train_loss: 4.3138
94:	[0s / 17s],		train_loss: 4.1778
72:	[0s / 11s],		train_loss: 4.2782
55:	[0s / 9s],		train_loss: 4.3098
95:	[0s / 18s],		train_loss: 4.1771
73:	[0s / 11s],		train_loss: 4.2775
56:	[0s / 9s],		train_loss: 4.3074
98:	[0s / 45s],		train_loss: 3.9654
74:	[0s / 11s],		train_loss: 4.2787
57:	[0s / 9s],		train_loss: 4.3472
96:	[0s / 18s],		train_loss: 4.1954
4:	[0s / 4s],		train_loss: 4.7396
75:	[0s / 11s],		train_loss: 4.2328
58:	[0s / 9s],		train_loss: 4.3189
97:	[0s / 18s],		train_loss: 4.1464
76:	[0s / 11s],		train_loss: 4.2373
69:	[5s / 4m:22s],		train_loss: 4.1724
99:	[0s / 45s],		train_loss: 3.9751
59:	[0s / 9s],		train_loss: 4.3187
19:	[1s / 30s],		train_loss: 4.2364
77:	[0s / 12s],		train_loss: 4.2574
98:	[0s / 18s],		train_loss: 4.1818
60:	[0s / 9s],		train_loss: 4.3055
78:	[0s / 12s],		train_loss: 4.2554
61:	[0s / 10s],		train_loss: 4.3118
99:	[0s / 19s],		train_loss: 4.1534
79:	[0s / 12s],		train_loss: 4.2563
62:	[0s / 10s],		train_loss: 4.3072
5:	[0s / 4s],		train_loss: 4.6920
80:	[0s / 12s],		train_loss: 4.2410
0:	[0s / 0s],		train_loss: 5.1166
63:	[0s / 10s],		train_loss: 4.3048
81:	[0s / 12s],		train_loss: 4.2275
0:	[0s / 0s],		train_loss: 4.8560
82:	[0s / 12s],		train_loss: 4.2253
64:	[0s / 10s],		train_loss: 4.2851
1:	[0s / 0s],		train_loss: 4.6285
83:	[0s / 12s],		train_loss: 4.2279
65:	[0s / 10s],		train_loss: 4.3059
1:	[0s / 0s],		train_loss: 4.6566
2:	[0s / 0s],		train_loss: 4.5396
84:	[0s / 13s],		train_loss: 4.2027
66:	[0s / 10s],		train_loss: 4.2786
85:	[0s / 13s],		train_loss: 4.2136
67:	[0s / 11s],		train_loss: 4.2583
3:	[0s / 0s],		train_loss: 4.4936
6:	[0s / 5s],		train_loss: 4.6815
86:	[0s / 13s],		train_loss: 4.2125
2:	[0s / 1s],		train_loss: 4.5823
68:	[0s / 11s],		train_loss: 4.2803
4:	[0s / 1s],		train_loss: 4.4623
87:	[0s / 13s],		train_loss: 4.2066
69:	[0s / 11s],		train_loss: 4.2933