[I 2026-06-09 05:49:08,216] Trial 61 finished with value: 0.7409028776191998 and parameters: {'num_nodes': [64, 32], 'dropout': 0.14763952859834878, 'learning_rate': 0.001832723989688372, 'batch_norm': True}. Best is trial 17 with value: 0.8122559343543445.
/scratch.hpc/luca.cotugno/Foundation_model_clinical_data/test_tabular_model_tmp.py:476: UserWarning: Choices for a categorical distribution should be a tuple of None, bool, int, float and str for persistent storage but contains [32] which is of type list.
  num_nodes  = trial.suggest_categorical("num_nodes", [[32], [64], [128], [64, 32], [128, 64]])
/scratch.hpc/luca.cotugno/Foundation_model_clinical_data/test_tabular_model_tmp.py:476: UserWarning: Choices for a categorical distribution should be a tuple of None, bool, int, float and str for persistent storage but contains [64] which is of type list.
  num_nodes  = trial.suggest_categorical("num_nodes", [[32], [64], [128], [64, 32], [128, 64]])
/scratch.hpc/luca.cotugno/Foundation_model_clinical_data/test_tabular_model_tmp.py:476: UserWarning: Choices for a categorical distribution should be a tuple of None, bool, int, float and str for persistent storage but contains [128] which is of type list.
  num_nodes  = trial.suggest_categorical("num_nodes", [[32], [64], [128], [64, 32], [128, 64]])
/scratch.hpc/luca.cotugno/Foundation_model_clinical_data/test_tabular_model_tmp.py:476: UserWarning: Choices for a categorical distribution should be a tuple of None, bool, int, float and str for persistent storage but contains [64, 32] which is of type list.
  num_nodes  = trial.suggest_categorical("num_nodes", [[32], [64], [128], [64, 32], [128, 64]])
/scratch.hpc/luca.cotugno/Foundation_model_clinical_data/test_tabular_model_tmp.py:476: UserWarning: Choices for a categorical distribution should be a tuple of None, bool, int, float and str for persistent storage but contains [128, 64] which is of type list.
  num_nodes  = trial.suggest_categorical("num_nodes", [[32], [64], [128], [64, 32], [128, 64]])

65:	[0s / 28s],		train_loss: 2.4504
69:	[0s / 30s],		train_loss: 2.4276
16:	[0s / 9s],		train_loss: 2.6024
66:	[0s / 28s],		train_loss: 2.4486
47:	[1s / 46s],		train_loss: 2.4766
70:	[0s / 30s],		train_loss: 2.4353
67:	[0s / 29s],		train_loss: 2.4534
17:	[0s / 10s],		train_loss: 2.5936
71:	[0s / 31s],		train_loss: 2.4188
68:	[0s / 29s],		train_loss: 2.4445
18:	[0s / 11s],		train_loss: 2.5806
72:	[0s / 31s],		train_loss: 2.4270
48:	[1s / 47s],		train_loss: 2.4822
69:	[0s / 29s],		train_loss: 2.4518
73:	[0s / 31s],		train_loss: 2.4345
70:	[0s / 30s],		train_loss: 2.4567
19:	[0s / 11s],		train_loss: 2.5716
74:	[0s / 32s],		train_loss: 2.4253
71:	[0s / 30s],		train_loss: 2.4373
49:	[0s / 48s],		train_loss: 2.4799
20:	[0s / 12s],		train_loss: 2.5734
75:	[0s / 32s],		train_loss: 2.4202
72:	[0s / 31s],		train_loss: 2.4356
76:	[0s / 33s],		train_loss: 2.4341
21:	[0s / 12s],		train_loss: 2.5537
73:	[0s / 31s],		train_loss: 2.4404
50:	[0s / 49s],		train_loss: 2.4748
77:	[0s / 33s],		train_loss: 2.4357
74:	[0s / 32s],		train_loss: 2.4423
22:	[0s / 13s],		train_loss: 2.5508
78:	[0s / 33s],		train_loss: 2.4338
75:	[0s / 32s],		train_loss: 2.4454
79:	[0s / 34s],		train_loss: 2.4240
23:	[0s / 13s],		train_loss: 2.5573
76:	[0s / 32s],		train_loss: 2.4270
51:	[1s / 50s],		train_loss: 2.4665
80:	[0s / 34s],		train_loss: 2.4175
77:	[0s / 33s],		train_loss: 2.4346
24:	[0s / 14s],		train_loss: 2.5453
81:	[0s / 35s],		train_loss: 2.4356
78:	[0s / 33s],		train_loss: 2.4303
25:	[0s / 15s],		train_loss: 2.5415
52:	[1s / 51s],		train_loss: 2.4761
82:	[0s / 35s],		train_loss: 2.4119
79:	[0s / 34s],		train_loss: 2.4318
83:	[0s / 36s],		train_loss: 2.4064
26:	[0s / 15s],		train_loss: 2.5432
80:	[0s / 34s],		train_loss: 2.4332
84:	[0s / 36s],		train_loss: 2.4222
81:	[0s / 34s],		train_loss: 2.4355
53:	[1s / 52s],		train_loss: 2.4781
27:	[0s / 16s],		train_loss: 2.5291
85:	[0s / 36s],		train_loss: 2.4313
82:	[0s / 35s],		train_loss: 2.4330
28:	[0s / 16s],		train_loss: 2.5239
86:	[0s / 37s],		train_loss: 2.4240
83:	[0s / 35s],		train_loss: 2.4483
54:	[1s / 53s],		train_loss: 2.4737
87:	[0s / 37s],		train_loss: 2.4174
84:	[0s / 36s],		train_loss: 2.4380
29:	[0s / 17s],		train_loss: 2.5378
88:	[0s / 38s],		train_loss: 2.4158
85:	[0s / 36s],		train_loss: 2.4349
30:	[0s / 17s],		train_loss: 2.5409
89:	[0s / 38s],		train_loss: 2.4248
86:	[0s / 37s],		train_loss: 2.4225
55:	[1s / 54s],		train_loss: 2.4702
90:	[0s / 38s],		train_loss: 2.4194
31:	[0s / 18s],		train_loss: 2.5186
87:	[0s / 37s],		train_loss: 2.4246
91:	[0s / 39s],		train_loss: 2.4261
88:	[0s / 37s],		train_loss: 2.4323
32:	[0s / 19s],		train_loss: 2.5278
56:	[1s / 55s],		train_loss: 2.4672
92:	[0s / 39s],		train_loss: 2.4269
89:	[0s / 38s],		train_loss: 2.4228
33:	[0s / 19s],		train_loss: 2.5217
93:	[0s / 40s],		train_loss: 2.4201
90:	[0s / 38s],		train_loss: 2.4356
94:	[0s / 40s],		train_loss: 2.4141
57:	[0s / 56s],		train_loss: 2.4581
91:	[0s / 39s],		train_loss: 2.4148
34:	[0s / 20s],		train_loss: 2.5146
95:	[0s / 41s],		train_loss: 2.4142
92:	[0s / 39s],		train_loss: 2.4373
35:	[0s / 21s],		train_loss: 2.5070
96:	[0s / 41s],		train_loss: 2.4148
93:	[0s / 39s],		train_loss: 2.4318
58:	[1s / 57s],		train_loss: 2.4652
97:	[0s / 41s],		train_loss: 2.4102
94:	[0s / 40s],		train_loss: 2.4349
36:	[0s / 21s],		train_loss: 2.5102
98:	[0s / 42s],		train_loss: 2.4142
95:	[0s / 40s],		train_loss: 2.4081
37:	[0s / 22s],		train_loss: 2.5064
99:	[0s / 42s],		train_loss: 2.4127
59:	[1s / 58s],		train_loss: 2.4631
96:	[0s / 41s],		train_loss: 2.4332
38:	[0s / 22s],		train_loss: 2.5091
97:	[0s / 41s],		train_loss: 2.4257
0:	[0s / 0s],		train_loss: 3.4564
98:	[0s / 42s],		train_loss: 2.4164
1:	[0s / 0s],		train_loss: 2.7866
60:	[1s / 59s],		train_loss: 2.4663
39:	[0s / 23s],		train_loss: 2.5080
99:	[0s / 42s],		train_loss: 2.4380
2:	[0s / 1s],		train_loss: 2.6670
40:	[0s / 24s],		train_loss: 2.5020
0:	[0s / 0s],		train_loss: 4.2058
3:	[0s / 1s],		train_loss: 2.6223
61:	[1s / 1m:0s],		train_loss: 2.4802
1:	[0s / 0s],		train_loss: 3.0015
4:	[0s / 2s],		train_loss: 2.6127
41:	[0s / 24s],		train_loss: 2.4951
2:	[0s / 1s],		train_loss: 2.8740
5:	[0s / 2s],		train_loss: 2.5800
3:	[0s / 1s],		train_loss: 2.8083
6:	[0s / 3s],		train_loss: 2.5816
62:	[0s / 1m:1s],		train_loss: 2.4669
42:	[0s / 25s],		train_loss: 2.4885
4:	[0s / 1s],		train_loss: 2.7664
7:	[0s / 3s],		train_loss: 2.5616
5:	[0s / 2s],		train_loss: 2.7181
43:	[0s / 26s],		train_loss: 2.4910
8:	[0s / 3s],		train_loss: 2.5512
6:	[0s / 2s],		train_loss: 2.6983
63:	[1s / 1m:2s],		train_loss: 2.4661
9:	[0s / 4s],		train_loss: 2.5447
7:	[0s / 2s],		train_loss: 2.6828
44:	[0s / 26s],		train_loss: 2.5041
8:	[0s / 3s],		train_loss: 2.6459
10:	[0s / 4s],		train_loss: 2.5412
64:	[0s / 1m:3s],		train_loss: 2.4581
45:	[0s / 27s],		train_loss: 2.4841
9:	[0s / 3s],		train_loss: 2.6440
11:	[0s / 5s],		train_loss: 2.5381
10:	[0s / 4s],		train_loss: 2.6393
12:	[0s / 5s],		train_loss: 2.5209
46:	[0s / 28s],		train_loss: 2.4875
11:	[0s / 4s],		train_loss: 2.6262
65:	[0s / 1m:4s],		train_loss: 2.4620
13:	[0s / 6s],		train_loss: 2.5235
12:	[0s / 4s],		train_loss: 2.6210
47:	[0s / 28s],		train_loss: 2.4912
14:	[0s / 6s],		train_loss: 2.5384
13:	[0s / 5s],		train_loss: 2.6099
14:	[0s / 5s],		train_loss: 2.6020
15:	[0s / 7s],		train_loss: 2.5210
66:	[1s / 1m:5s],		train_loss: 2.4562
48:	[0s / 29s],		train_loss: 2.4868
15:	[0s / 5s],		train_loss: 2.5948
16:	[0s / 7s],		train_loss: 2.5125
16:	[0s / 6s],		train_loss: 2.5882
49:	[0s / 30s],		train_loss: 2.4899
17:	[0s / 7s],		train_loss: 2.5180
67:	[0s / 1m:6s],		train_loss: 2.4511
17:	[0s / 6s],		train_loss: 2.5815
18:	[0s / 8s],		train_loss: 2.5143
50:	[0s / 30s],		train_loss: 2.4795
18:	[0s / 7s],		train_loss: 2.5723
19:	[0s / 8s],		train_loss: 2.4939
19:	[0s / 7s],		train_loss: 2.5693
68:	[0s / 1m:7s],		train_loss: 2.4608
51:	[0s / 31s],		train_loss: 2.4937
20:	[0s / 9s],		train_loss: 2.5187
20:	[0s / 7s],		train_loss: 2.5669
21:	[0s / 8s],		train_loss: 2.5485
21:	[0s / 9s],		train_loss: 2.5066
52:	[0s / 32s],		train_loss: 2.4806
69:	[0s / 1m:8s],		train_loss: 2.4453
22:	[0s / 8s],		train_loss: 2.5504
22:	[0s / 10s],		train_loss: 2.5100
23:	[0s / 8s],		train_loss: 2.5445
53:	[0s / 32s],		train_loss: 2.4717
23:	[0s / 10s],		train_loss: 2.4989
24:	[0s / 9s],		train_loss: 2.5387
70:	[0s / 1m:9s],		train_loss: 2.4620
24:	[0s / 11s],		train_loss: 2.4912
25:	[0s / 9s],		train_loss: 2.5362
54:	[0s / 33s],		train_loss: 2.4811
25:	[0s / 11s],		train_loss: 2.4933
26:	[0s / 10s],		train_loss: 2.5380
55:	[0s / 34s],		train_loss: 2.4844
27:	[0s / 10s],		train_loss: 2.5251
26:	[0s / 11s],		train_loss: 2.4928
71:	[0s / 1m:10s],		train_loss: 2.4466
28:	[0s / 10s],		train_loss: 2.5288
27:	[0s / 12s],		train_loss: 2.4970
56:	[0s / 34s],		train_loss: 2.4737
29:	[0s / 11s],		train_loss: 2.5345
28:	[0s / 12s],		train_loss: 2.4840
72:	[0s / 1m:11s],		train_loss: 2.4549
30:	[0s / 11s],		train_loss: 2.5404
57:	[0s / 35s],		train_loss: 2.4687
29:	[0s / 13s],		train_loss: 2.4777
31:	[0s / 11s],		train_loss: 2.5388
30:	[0s / 13s],		train_loss: 2.4633
32:	[0s / 12s],		train_loss: 2.5279
58:	[0s / 36s],		train_loss: 2.4630
73:	[0s / 1m:12s],		train_loss: 2.4468
33:	[0s / 12s],		train_loss: 2.5181
31:	[0s / 14s],		train_loss: 2.4943
59:	[0s / 37s],		train_loss: 2.4699
34:	[0s / 13s],		train_loss: 2.5192
32:	[0s / 14s],		train_loss: 2.4947
35:	[0s / 13s],		train_loss: 2.5155
74:	[1s / 1m:13s],		train_loss: 2.4480
33:	[0s / 15s],		train_loss: 2.4700
60:	[0s / 37s],		train_loss: 2.4717
36:	[0s / 13s],		train_loss: 2.5073
34:	[0s / 15s],		train_loss: 2.4724
37:	[0s / 14s],		train_loss: 2.5069
61:	[0s / 38s],		train_loss: 2.4621
75:	[1s / 1m:14s],		train_loss: 2.4675
35:	[0s / 16s],		train_loss: 2.4804
38:	[0s / 14s],		train_loss: 2.5029
36:	[0s / 16s],		train_loss: 2.4742
39:	[0s / 15s],		train_loss: 2.5012
62:	[0s / 39s],		train_loss: 2.4662
40:	[0s / 15s],		train_loss: 2.5008
37:	[0s / 16s],		train_loss: 2.4717
76:	[1s / 1m:15s],		train_loss: 2.4490
41:	[0s / 15s],		train_loss: 2.4952
63:	[0s / 39s],		train_loss: 2.4737
38:	[0s / 17s],		train_loss: 2.4809
42:	[0s / 16s],		train_loss: 2.5074
39:	[0s / 17s],		train_loss: 2.4793
64:	[0s / 40s],		train_loss: 2.4582
43:	[0s / 16s],		train_loss: 2.4939
77:	[1s / 1m:16s],		train_loss: 2.4381
40:	[0s / 18s],		train_loss: 2.4670
44:	[0s / 17s],		train_loss: 2.4776
65:	[0s / 41s],		train_loss: 2.4645
41:	[0s / 18s],		train_loss: 2.4649
45:	[0s / 17s],		train_loss: 2.4969
78:	[1s / 1m:17s],		train_loss: 2.4600
46:	[0s / 17s],		train_loss: 2.4971
42:	[0s / 19s],		train_loss: 2.4660
66:	[0s / 41s],		train_loss: 2.4684
47:	[0s / 18s],		train_loss: 2.4908
43:	[0s / 19s],		train_loss: 2.4549
48:	[0s / 18s],		train_loss: 2.4905
67:	[0s / 42s],		train_loss: 2.4719
79:	[0s / 1m:18s],		train_loss: 2.4429
44:	[0s / 20s],		train_loss: 2.4646
49:	[0s / 18s],		train_loss: 2.4905
45:	[0s / 20s],		train_loss: 2.4539
68:	[0s / 43s],		train_loss: 2.4651
50:	[0s / 19s],		train_loss: 2.4907
46:	[0s / 21s],		train_loss: 2.4452
51:	[0s / 19s],		train_loss: 2.4922
80:	[1s / 1m:19s],		train_loss: 2.4460
69:	[0s / 43s],		train_loss: 2.4537
52:	[0s / 20s],		train_loss: 2.4865
47:	[0s / 21s],		train_loss: 2.4688
53:	[0s / 20s],		train_loss: 2.4882
48:	[0s / 21s],		train_loss: 2.4567
70:	[0s / 44s],		train_loss: 2.4466
81:	[0s / 1m:20s],		train_loss: 2.4398
54:	[0s / 20s],		train_loss: 2.4868
49:	[0s / 22s],		train_loss: 2.4584
55:	[0s / 21s],		train_loss: 2.4888
71:	[0s / 45s],		train_loss: 2.4606
50:	[0s / 22s],		train_loss: 2.4617
56:	[0s / 21s],		train_loss: 2.4869
82:	[0s / 1m:21s],		train_loss: 2.4455
51:	[0s / 23s],		train_loss: 2.4457
57:	[0s / 21s],		train_loss: 2.4779
72:	[0s / 45s],		train_loss: 2.4548
58:	[0s / 22s],		train_loss: 2.4797
52:	[0s / 23s],		train_loss: 2.4460
73:	[0s / 46s],		train_loss: 2.4561
83:	[1s / 1m:22s],		train_loss: 2.4401
59:	[0s / 22s],		train_loss: 2.4787
53:	[0s / 24s],		train_loss: 2.4531
60:	[0s / 23s],		train_loss: 2.4747
54:	[0s / 24s],		train_loss: 2.4594
74:	[0s / 47s],		train_loss: 2.4525
61:	[0s / 23s],		train_loss: 2.4722
84:	[0s / 1m:23s],		train_loss: 2.4569
55:	[0s / 25s],		train_loss: 2.4455
62:	[0s / 23s],		train_loss: 2.4729
75:	[0s / 47s],		train_loss: 2.4449
63:	[0s / 24s],		train_loss: 2.4803
56:	[0s / 25s],		train_loss: 2.4384
64:	[0s / 24s],		train_loss: 2.4655
57:	[0s / 26s],		train_loss: 2.4469
85:	[0s / 1m:24s],		train_loss: 2.4453
76:	[0s / 48s],		train_loss: 2.4530
65:	[0s / 25s],		train_loss: 2.4682
58:	[0s / 26s],		train_loss: 2.4480
77:	[0s / 49s],		train_loss: 2.4542
66:	[0s / 25s],		train_loss: 2.4794
59:	[0s / 27s],		train_loss: 2.4429
67:	[0s / 25s],		train_loss: 2.4672
86:	[1s / 1m:26s],		train_loss: 2.4624
60:	[0s / 27s],		train_loss: 2.4336
78:	[0s / 49s],		train_loss: 2.4327
68:	[0s / 26s],		train_loss: 2.4566
61:	[0s / 27s],		train_loss: 2.4500
69:	[0s / 26s],		train_loss: 2.4737
79:	[0s / 50s],		train_loss: 2.4503
87:	[1s / 1m:27s],		train_loss: 2.4464
70:	[0s / 26s],		train_loss: 2.4780
62:	[0s / 28s],		train_loss: 2.4473
71:	[0s / 27s],		train_loss: 2.4634
63:	[0s / 28s],		train_loss: 2.4454
80:	[0s / 51s],		train_loss: 2.4469
72:	[0s / 27s],		train_loss: 2.4565
64:	[0s / 29s],		train_loss: 2.4300
88:	[1s / 1m:28s],		train_loss: 2.4371
73:	[0s / 28s],		train_loss: 2.4601
81:	[0s / 52s],		train_loss: 2.4473
65:	[0s / 29s],		train_loss: 2.4435
74:	[0s / 28s],		train_loss: 2.4528
66:	[0s / 30s],		train_loss: 2.4330
82:	[0s / 52s],		train_loss: 2.4367
75:	[0s / 28s],		train_loss: 2.4607
89:	[0s / 1m:29s],		train_loss: 2.4512
76:	[0s / 29s],		train_loss: 2.4502
67:	[0s / 30s],		train_loss: 2.4374
83:	[0s / 53s],		train_loss: 2.4381
77:	[0s / 29s],		train_loss: 2.4576
68:	[0s / 31s],		train_loss: 2.4356
90:	[0s / 1m:30s],		train_loss: 2.4446
78:	[0s / 29s],		train_loss: 2.4518
84:	[0s / 53s],		train_loss: 2.4356
69:	[0s / 31s],		train_loss: 2.4490
79:	[0s / 30s],		train_loss: 2.4601
70:	[0s / 31s],		train_loss: 2.4357
80:	[0s / 30s],		train_loss: 2.4434
85:	[0s / 54s],		train_loss: 2.4495
91:	[0s / 1m:31s],		train_loss: 2.4334
71:	[0s / 32s],		train_loss: 2.4337
81:	[0s / 30s],		train_loss: 2.4521
82:	[0s / 31s],		train_loss: 2.4365
86:	[0s / 55s],		train_loss: 2.4425
72:	[0s / 32s],		train_loss: 2.4366
83:	[0s / 31s],		train_loss: 2.4527
92:	[1s / 1m:32s],		train_loss: 2.4321
73:	[0s / 33s],		train_loss: 2.4327
87:	[0s / 55s],		train_loss: 2.4497
84:	[0s / 32s],		train_loss: 2.4494
74:	[0s / 33s],		train_loss: 2.4251
85:	[0s / 32s],		train_loss: 2.4550
88:	[0s / 56s],		train_loss: 2.4413
75:	[0s / 34s],		train_loss: 2.4231
93:	[0s / 1m:33s],		train_loss: 2.4397
86:	[0s / 32s],		train_loss: 2.4450
76:	[0s / 34s],		train_loss: 2.4205
87:	[0s / 33s],		train_loss: 2.4545
89:	[0s / 57s],		train_loss: 2.4341
88:	[0s / 33s],		train_loss: 2.4526
77:	[0s / 34s],		train_loss: 2.4294
94:	[1s / 1m:34s],		train_loss: 2.4522
89:	[0s / 33s],		train_loss: 2.4535
78:	[0s / 35s],		train_loss: 2.4310
90:	[0s / 57s],		train_loss: 2.4514
90:	[0s / 34s],		train_loss: 2.4356
79:	[0s / 35s],		train_loss: 2.4242
91:	[0s / 58s],		train_loss: 2.4493
91:	[0s / 34s],		train_loss: 2.4350
95:	[0s / 1m:34s],		train_loss: 2.4410
80:	[0s / 36s],		train_loss: 2.4263
92:	[0s / 35s],		train_loss: 2.4475
92:	[0s / 59s],		train_loss: 2.4274
81:	[0s / 36s],		train_loss: 2.4191
93:	[0s / 35s],		train_loss: 2.4419
96:	[1s / 1m:36s],		train_loss: 2.4426
94:	[0s / 35s],		train_loss: 2.4536
82:	[0s / 37s],		train_loss: 2.4207
93:	[0s / 59s],		train_loss: 2.4428
95:	[0s / 36s],		train_loss: 2.4382
83:	[0s / 37s],		train_loss: 2.4308
96:	[0s / 36s],		train_loss: 2.4556
94:	[0s / 1m:0s],		train_loss: 2.4354
84:	[0s / 38s],		train_loss: 2.4186
97:	[0s / 1m:37s],		train_loss: 2.4351
97:	[0s / 36s],		train_loss: 2.4292
85:	[0s / 38s],		train_loss: 2.4214
98:	[0s / 37s],		train_loss: 2.4505
95:	[0s / 1m:1s],		train_loss: 2.4397
86:	[0s / 39s],		train_loss: 2.4307
99:	[0s / 37s],		train_loss: 2.4572
98:	[1s / 1m:38s],		train_loss: 2.4346
96:	[0s / 1m:1s],		train_loss: 2.4470
87:	[0s / 39s],		train_loss: 2.4156
0:	[0s / 0s],		train_loss: 2.9584
88:	[0s / 39s],		train_loss: 2.4316
97:	[0s / 1m:2s],		train_loss: 2.4448
1:	[0s / 0s],		train_loss: 2.6650
99:	[1s / 1m:39s],		train_loss: 2.4317
89:	[0s / 40s],		train_loss: 2.4185
2:	[0s / 1s],		train_loss: 2.6386
98:	[0s / 1m:3s],		train_loss: 2.4232
90:	[0s / 40s],		train_loss: 2.4076
3:	[0s / 1s],		train_loss: 2.6227
91:	[0s / 41s],		train_loss: 2.4153
99:	[0s / 1m:3s],		train_loss: 2.4272
4:	[0s / 2s],		train_loss: 2.6189
0:	[1s / 1s],		train_loss: 3.2052
92:	[0s / 41s],		train_loss: 2.4057
5:	[0s / 2s],		train_loss: 2.6085
0:	[0s / 0s],		train_loss: 3.2222
93:	[0s / 42s],		train_loss: 2.3977
6:	[0s / 3s],		train_loss: 2.5664
7:	[0s / 3s],		train_loss: 2.5792
94:	[0s / 42s],		train_loss: 2.4200
1:	[1s / 2s],		train_loss: 2.6717
1:	[0s / 1s],		train_loss: 2.7005
8:	[0s / 3s],		train_loss: 2.5751
95:	[0s / 43s],		train_loss: 2.4073
2:	[0s / 1s],		train_loss: 2.6484
9:	[0s / 4s],		train_loss: 2.5543
96:	[0s / 43s],		train_loss: 2.4185
2:	[1s / 3s],		train_loss: 2.6359
10:	[0s / 4s],		train_loss: 2.5467
97:	[0s / 44s],		train_loss: 2.4081
3:	[0s / 2s],		train_loss: 2.6082
11:	[0s / 5s],		train_loss: 2.5862
98:	[0s / 44s],		train_loss: 2.3912
12:	[0s / 5s],		train_loss: 2.5578
4:	[0s / 3s],		train_loss: 2.5750
99:	[0s / 44s],		train_loss: 2.4157
3:	[1s / 4s],		train_loss: 2.5992
13:	[0s / 6s],		train_loss: 2.5654
0:	[0s / 0s],		train_loss: 3.8529
5:	[0s / 3s],		train_loss: 2.5631
14:	[0s / 6s],		train_loss: 2.5644
1:	[0s / 0s],		train_loss: 2.8601
15:	[0s / 6s],		train_loss: 2.5609
6:	[0s / 4s],		train_loss: 2.5643
2:	[0s / 1s],		train_loss: 2.7263
4:	[1s / 5s],		train_loss: 2.5845
16:	[0s / 7s],		train_loss: 2.5623
3:	[0s / 1s],		train_loss: 2.6765
7:	[0s / 5s],		train_loss: 2.5553
17:	[0s / 7s],		train_loss: 2.5821
4:	[0s / 2s],		train_loss: 2.6666
18:	[0s / 8s],		train_loss: 2.5529
8:	[0s / 5s],		train_loss: 2.5434
5:	[1s / 7s],		train_loss: 2.5575
5:	[0s / 2s],		train_loss: 2.6284
19:	[0s / 8s],		train_loss: 2.5672
6:	[0s / 3s],		train_loss: 2.6240
20:	[0s / 8s],		train_loss: 2.5379
9:	[0s / 6s],		train_loss: 2.5332
7:	[0s / 3s],		train_loss: 2.6182
6:	[1s / 8s],		train_loss: 2.5399
21:	[0s / 9s],		train_loss: 2.5646
10:	[0s / 7s],		train_loss: 2.5202
8:	[0s / 3s],		train_loss: 2.5826
22:	[0s / 9s],		train_loss: 2.5452
9:	[0s / 4s],		train_loss: 2.5732
23:	[0s / 10s],		train_loss: 2.5513
11:	[0s / 7s],		train_loss: 2.5127
10:	[0s / 4s],		train_loss: 2.5583
7:	[1s / 9s],		train_loss: 2.5378
24:	[0s / 10s],		train_loss: 2.5786
12:	[0s / 8s],		train_loss: 2.5132
11:	[0s / 5s],		train_loss: 2.5523
25:	[0s / 10s],		train_loss: 2.5505
12:	[0s / 5s],		train_loss: 2.5590
26:	[0s / 11s],		train_loss: 2.5576
13:	[0s / 9s],		train_loss: 2.5032
8:	[1s / 10s],		train_loss: 2.5382
13:	[0s / 6s],		train_loss: 2.5390
27:	[0s / 11s],		train_loss: 2.5575
14:	[0s / 6s],		train_loss: 2.5369
28:	[0s / 12s],		train_loss: 2.5445
14:	[0s / 9s],		train_loss: 2.5113
15:	[0s / 6s],		train_loss: 2.5318
29:	[0s / 12s],		train_loss: 2.5516
9:	[1s / 11s],		train_loss: 2.5379
15:	[0s / 10s],		train_loss: 2.4940
16:	[0s / 7s],		train_loss: 2.5225
30:	[0s / 13s],		train_loss: 2.5601
17:	[0s / 7s],		train_loss: 2.5148
31:	[0s / 13s],		train_loss: 2.5360
16:	[0s / 11s],		train_loss: 2.5070
10:	[1s / 12s],		train_loss: 2.5290
18:	[0s / 8s],		train_loss: 2.5156
32:	[0s / 13s],		train_loss: 2.5459
17:	[0s / 11s],		train_loss: 2.4974
33:	[0s / 14s],		train_loss: 2.5522
19:	[0s / 8s],		train_loss: 2.5153
34:	[0s / 14s],		train_loss: 2.5470
20:	[0s / 9s],		train_loss: 2.5071
18:	[0s / 12s],		train_loss: 2.4905
11:	[1s / 13s],		train_loss: 2.5200
35:	[0s / 15s],		train_loss: 2.5368
21:	[0s / 9s],		train_loss: 2.5069
19:	[0s / 13s],		train_loss: 2.4946
36:	[0s / 15s],		train_loss: 2.5450
22:	[0s / 9s],		train_loss: 2.5034
37:	[0s / 15s],		train_loss: 2.5568
23:	[0s / 10s],		train_loss: 2.4956
20:	[0s / 13s],		train_loss: 2.5046
12:	[1s / 15s],		train_loss: 2.5202
38:	[0s / 16s],		train_loss: 2.5293
24:	[0s / 10s],		train_loss: 2.5053
21:	[0s / 14s],		train_loss: 2.4864
39:	[0s / 16s],		train_loss: 2.5210
25:	[0s / 11s],		train_loss: 2.5012
40:	[0s / 17s],		train_loss: 2.5332
26:	[0s / 11s],		train_loss: 2.4839
13:	[1s / 16s],		train_loss: 2.5086
22:	[0s / 15s],		train_loss: 2.4739
41:	[0s / 17s],		train_loss: 2.5322
27:	[0s / 11s],		train_loss: 2.4873
42:	[0s / 17s],		train_loss: 2.5343
23:	[0s / 15s],		train_loss: 2.5051
28:	[0s / 12s],		train_loss: 2.5044
43:	[0s / 18s],		train_loss: 2.5394
14:	[1s / 17s],		train_loss: 2.5126
29:	[0s / 12s],		train_loss: 2.4920
24:	[0s / 16s],		train_loss: 2.5107
44:	[0s / 18s],		train_loss: 2.5314
30:	[0s / 13s],		train_loss: 2.4922
45:	[0s / 19s],		train_loss: 2.5319
31:	[0s / 13s],		train_loss: 2.4750
25:	[0s / 17s],		train_loss: 2.4950
15:	[1s / 18s],		train_loss: 2.5097
46:	[0s / 19s],		train_loss: 2.5276
32:	[0s / 14s],		train_loss: 2.4807
47:	[0s / 19s],		train_loss: 2.5320
26:	[0s / 17s],		train_loss: 2.4800
33:	[0s / 14s],		train_loss: 2.4822
48:	[0s / 20s],		train_loss: 2.5220
34:	[0s / 14s],		train_loss: 2.4915
27:	[0s / 18s],		train_loss: 2.4743
16:	[1s / 19s],		train_loss: 2.5068
49:	[0s / 20s],		train_loss: 2.5462
35:	[0s / 15s],		train_loss: 2.4774
50:	[0s / 21s],		train_loss: 2.5340
28:	[0s / 19s],		train_loss: 2.4763
36:	[0s / 15s],		train_loss: 2.4793
51:	[0s / 21s],		train_loss: 2.5453
17:	[1s / 20s],		train_loss: 2.4983
37:	[0s / 16s],		train_loss: 2.4631
29:	[0s / 19s],		train_loss: 2.4858
52:	[0s / 22s],		train_loss: 2.5319
38:	[0s / 16s],		train_loss: 2.4598
53:	[0s / 22s],		train_loss: 2.5220
30:	[0s / 20s],		train_loss: 2.4662
39:	[0s / 17s],		train_loss: 2.4895
54:	[0s / 22s],		train_loss: 2.5304
18:	[1s / 21s],		train_loss: 2.4924
40:	[0s / 17s],		train_loss: 2.4671
55:	[0s / 23s],		train_loss: 2.5348
31:	[0s / 21s],		train_loss: 2.4656
41:	[0s / 17s],		train_loss: 2.4714
56:	[0s / 23s],		train_loss: 2.5627
32:	[0s / 21s],		train_loss: 2.4811
42:	[0s / 18s],		train_loss: 2.4765
57:	[0s / 24s],		train_loss: 2.5279
19:	[1s / 22s]