ENV CHECKPOINT PATH: 
DEFAULT PATH: /scratch.hpc/luca.cotugno/Foundation_model_clinical_data/src/models_diff/tabdpt1_1.pth
ENV CHECKPOINT PATH: 
DEFAULT PATH: /scratch.hpc/luca.cotugno/Foundation_model_clinical_data/src/models_diff/tabdpt1_1.pth
ENV CHECKPOINT PATH: 
DEFAULT PATH: /scratch.hpc/luca.cotugno/Foundation_model_clinical_data/src/models_diff/tabdpt1_1.pth
ENV CHECKPOINT PATH: 
DEFAULT PATH: /scratch.hpc/luca.cotugno/Foundation_model_clinical_data/src/models_diff/tabdpt1_1.pth
ENV CHECKPOINT PATH: 
DEFAULT PATH: /scratch.hpc/luca.cotugno/Foundation_model_clinical_data/src/models_diff/tabdpt1_1.pth
ENV CHECKPOINT PATH: 
DEFAULT PATH: /scratch.hpc/luca.cotugno/Foundation_model_clinical_data/src/models_diff/tabdpt1_1.pth
ENV CHECKPOINT PATH: 
DEFAULT PATH: /scratch.hpc/luca.cotugno/Foundation_model_clinical_data/src/models_diff/tabdpt1_1.pth
ENV CHECKPOINT PATH: 
DEFAULT PATH: /scratch.hpc/luca.cotugno/Foundation_model_clinical_data/src/models_diff/tabdpt1_1.pth
ENV CHECKPOINT PATH: 
DEFAULT PATH: /scratch.hpc/luca.cotugno/Foundation_model_clinical_data/src/models_diff/tabdpt1_1.pth
ENV CHECKPOINT PATH: 
DEFAULT PATH: /scratch.hpc/luca.cotugno/Foundation_model_clinical_data/src/models_diff/tabdpt1_1.pth
ENV CHECKPOINT PATH: 
DEFAULT PATH: /scratch.hpc/luca.cotugno/Foundation_model_clinical_data/src/models_diff/tabdpt1_1.pth
ENV CHECKPOINT PATH: 
DEFAULT PATH: /scratch.hpc/luca.cotugno/Foundation_model_clinical_data/src/models_diff/tabdpt1_1.pth
ENV CHECKPOINT PATH: 
DEFAULT PATH: /scratch.hpc/luca.cotugno/Foundation_model_clinical_data/src/models_diff/tabdpt1_1.pth
ENV CHECKPOINT PATH: 
DEFAULT PATH: /scratch.hpc/luca.cotugno/Foundation_model_clinical_data/src/models_diff/tabdpt1_1.pth
ENV CHECKPOINT PATH: 
DEFAULT PATH: /scratch.hpc/luca.cotugno/Foundation_model_clinical_data/src/models_diff/tabdpt1_1.pth
ENV CHECKPOINT PATH: 
DEFAULT PATH: /scratch.hpc/luca.cotugno/Foundation_model_clinical_data/src/models_diff/tabdpt1_1.pth
ENV CHECKPOINT PATH: 
DEFAULT PATH: /scratch.hpc/luca.cotugno/Foundation_model_clinical_data/src/models_diff/tabdpt1_1.pth
ENV CHECKPOINT PATH: 
DEFAULT PATH: /scratch.hpc/luca.cotugno/Foundation_model_clinical_data/src/models_diff/tabdpt1_1.pth
ENV CHECKPOINT PATH: 
DEFAULT PATH: /scratch.hpc/luca.cotugno/Foundation_model_clinical_data/src/models_diff/tabdpt1_1.pth
ENV CHECKPOINT PATH: 
DEFAULT PATH: /scratch.hpc/luca.cotugno/Foundation_model_clinical_data/src/models_diff/tabdpt1_1.pth
ENV CHECKPOINT PATH: 
DEFAULT PATH: /scratch.hpc/luca.cotugno/Foundation_model_clinical_data/src/models_diff/tabdpt1_1.pth
ENV CHECKPOINT PATH: 
DEFAULT PATH: /scratch.hpc/luca.cotugno/Foundation_model_clinical_data/src/models_diff/tabdpt1_1.pth
ENV CHECKPOINT PATH: 
DEFAULT PATH: /scratch.hpc/luca.cotugno/Foundation_model_clinical_data/src/models_diff/tabdpt1_1.pth
ENV CHECKPOINT PATH: 
DEFAULT PATH: /scratch.hpc/luca.cotugno/Foundation_model_clinical_data/src/models_diff/tabdpt1_1.pth
ENV CHECKPOINT PATH: 
DEFAULT PATH: /scratch.hpc/luca.cotugno/Foundation_model_clinical_data/src/models_diff/tabdpt1_1.pth
ENV CHECKPOINT PATH: 
DEFAULT PATH: /scratch.hpc/luca.cotugno/Foundation_model_clinical_data/src/models_diff/tabdpt1_1.pth
/scratch.hpc/luca.cotugno/Foundation_model_clinical_data/.venv/lib/python3.12/site-packages/pycox/models/cox.py:251: RuntimeWarning: overflow encountered in exp
  expg = np.exp(self.predict(input, batch_size, True, eval_, num_workers=num_workers)).reshape(1, -1)
/scratch.hpc/luca.cotugno/Foundation_model_clinical_data/.venv/lib/python3.12/site-packages/pycox/models/cox.py:252: RuntimeWarning: invalid value encountered in dot
  return pd.DataFrame(bch.values.reshape(-1, 1).dot(expg),
ENV CHECKPOINT PATH: 
DEFAULT PATH: /scratch.hpc/luca.cotugno/Foundation_model_clinical_data/src/models_diff/tabdpt1_1.pth
ENV CHECKPOINT PATH: 
DEFAULT PATH: /scratch.hpc/luca.cotugno/Foundation_model_clinical_data/src/models_diff/tabdpt1_1.pth
[I 2026-07-01 00:54:24,136] A new study created in memory with name: rsf_tuning_tabdpt_4_-1_seed456
[I 2026-07-01 01:02:28,537] Trial 2 finished with value: 0.8196186096382111 and parameters: {'n_estimators': 100, 'max_depth': 9, 'min_samples_split': 15, 'min_samples_leaf': 9, 'max_features': 'log2'}. Best is trial 2 with value: 0.8196186096382111.
[I 2026-07-01 01:04:28,522] Trial 4 finished with value: 0.8216284899354158 and parameters: {'n_estimators': 150, 'max_depth': 6, 'min_samples_split': 6, 'min_samples_leaf': 12, 'max_features': 'log2'}. Best is trial 4 with value: 0.8216284899354158.
[I 2026-07-01 01:06:44,465] Trial 0 finished with value: 0.8227106526273466 and parameters: {'n_estimators': 200, 'max_depth': 5, 'min_samples_split': 19, 'min_samples_leaf': 10, 'max_features': 'log2'}. Best is trial 0 with value: 0.8227106526273466.
[I 2026-07-01 01:07:59,055] Trial 7 finished with value: 0.8218724608180669 and parameters: {'n_estimators': 250, 'max_depth': 4, 'min_samples_split': 15, 'min_samples_leaf': 13, 'max_features': 'log2'}. Best is trial 0 with value: 0.8227106526273466.
[I 2026-07-01 01:16:03,229] Trial 5 finished with value: 0.8197337890248704 and parameters: {'n_estimators': 300, 'max_depth': 7, 'min_samples_split': 16, 'min_samples_leaf': 5, 'max_features': 'log2'}. Best is trial 0 with value: 0.8227106526273466.
[I 2026-07-01 01:16:40,780] Trial 8 finished with value: 0.8207337555181397 and parameters: {'n_estimators': 100, 'max_depth': 3, 'min_samples_split': 17, 'min_samples_leaf': 8, 'max_features': 'sqrt'}. Best is trial 0 with value: 0.8227106526273466.
[I 2026-07-01 01:26:35,152] Trial 10 finished with value: 0.8229342053459989 and parameters: {'n_estimators': 300, 'max_depth': 6, 'min_samples_split': 15, 'min_samples_leaf': 15, 'max_features': 'log2'}. Best is trial 10 with value: 0.8229342053459989.
[I 2026-07-01 01:29:00,585] Trial 11 finished with value: 0.8141879015572253 and parameters: {'n_estimators': 100, 'max_depth': 6, 'min_samples_split': 13, 'min_samples_leaf': 4, 'max_features': 'sqrt'}. Best is trial 10 with value: 0.8229342053459989.
[I 2026-07-01 01:34:53,725] Trial 14 finished with value: 0.8199610065421892 and parameters: {'n_estimators': 150, 'max_depth': 4, 'min_samples_split': 20, 'min_samples_leaf': 5, 'max_features': 'log2'}. Best is trial 10 with value: 0.8229342053459989.
[I 2026-07-01 01:36:09,719] Trial 15 finished with value: 0.8212641042394391 and parameters: {'n_estimators': 100, 'max_depth': 7, 'min_samples_split': 9, 'min_samples_leaf': 13, 'max_features': 'log2'}. Best is trial 10 with value: 0.8229342053459989.
[I 2026-07-01 01:43:12,160] Trial 1 finished with value: 0.8152585463104901 and parameters: {'n_estimators': 200, 'max_depth': 10, 'min_samples_split': 16, 'min_samples_leaf': 12, 'max_features': 'sqrt'}. Best is trial 10 with value: 0.8229342053459989.
[I 2026-07-01 01:46:59,909] Trial 6 finished with value: 0.823453559671299 and parameters: {'n_estimators': 250, 'max_depth': 7, 'min_samples_split': 11, 'min_samples_leaf': 10, 'max_features': 'sqrt'}. Best is trial 6 with value: 0.823453559671299.
[I 2026-07-01 01:57:47,248] Trial 9 finished with value: 0.823453559671299 and parameters: {'n_estimators': 250, 'max_depth': 7, 'min_samples_split': 7, 'min_samples_leaf': 10, 'max_features': 'sqrt'}. Best is trial 6 with value: 0.823453559671299.
[I 2026-07-01 02:00:39,914] Trial 3 finished with value: 0.8222431290260431 and parameters: {'n_estimators': 300, 'max_depth': 8, 'min_samples_split': 14, 'min_samples_leaf': 11, 'max_features': 'sqrt'}. Best is trial 6 with value: 0.823453559671299.
[I 2026-07-01 02:01:20,586] Trial 18 finished with value: 0.8227567243820102 and parameters: {'n_estimators': 300, 'max_depth': 5, 'min_samples_split': 20, 'min_samples_leaf': 15, 'max_features': 'log2'}. Best is trial 6 with value: 0.823453559671299.
[I 2026-07-01 02:11:26,670] Trial 12 finished with value: 0.822661439616683 and parameters: {'n_estimators': 300, 'max_depth': 5, 'min_samples_split': 17, 'min_samples_leaf': 6, 'max_features': 'sqrt'}. Best is trial 6 with value: 0.823453559671299.
[I 2026-07-01 02:16:14,217] Trial 16 finished with value: 0.8230347255379924 and parameters: {'n_estimators': 250, 'max_depth': 4, 'min_samples_split': 18, 'min_samples_leaf': 4, 'max_features': 'sqrt'}. Best is trial 6 with value: 0.823453559671299.
[I 2026-07-01 02:19:43,017] Trial 13 finished with value: 0.8138308454585815 and parameters: {'n_estimators': 250, 'max_depth': 10, 'min_samples_split': 10, 'min_samples_leaf': 5, 'max_features': 'sqrt'}. Best is trial 6 with value: 0.823453559671299.
[I 2026-07-01 02:46:21,364] Trial 17 finished with value: 0.8197688663835347 and parameters: {'n_estimators': 300, 'max_depth': 10, 'min_samples_split': 10, 'min_samples_leaf': 15, 'max_features': 'sqrt'}. Best is trial 6 with value: 0.823453559671299.
[I 2026-07-01 02:52:17,982] Trial 19 finished with value: 0.8220290000753901 and parameters: {'n_estimators': 300, 'max_depth': 8, 'min_samples_split': 10, 'min_samples_leaf': 15, 'max_features': 'sqrt'}. Best is trial 6 with value: 0.823453559671299.
[I 2026-07-01 02:54:16,975] Trial 20 finished with value: 0.8169810016837132 and parameters: {'n_estimators': 250, 'max_depth': 8, 'min_samples_split': 9, 'min_samples_leaf': 8, 'max_features': 'sqrt'}. Best is trial 6 with value: 0.823453559671299.
[I 2026-07-01 02:56:46,801] Trial 21 finished with value: 0.8169810016837132 and parameters: {'n_estimators': 250, 'max_depth': 8, 'min_samples_split': 10, 'min_samples_leaf': 8, 'max_features': 'sqrt'}. Best is trial 6 with value: 0.823453559671299.
[I 2026-07-01 02:58:19,791] Trial 22 finished with value: 0.8164427998224143 and parameters: {'n_estimators': 250, 'max_depth': 8, 'min_samples_split': 10, 'min_samples_leaf': 7, 'max_features': 'sqrt'}. Best is trial 6 with value: 0.823453559671299.
[I 2026-07-01 03:04:53,782] Trial 25 finished with value: 0.8161333861064342 and parameters: {'n_estimators': 200, 'max_depth': 8, 'min_samples_split': 5, 'min_samples_leaf': 8, 'max_features': 'sqrt'}. Best is trial 6 with value: 0.823453559671299.
[I 2026-07-01 03:07:46,308] Trial 23 finished with value: 0.8169810016837132 and parameters: {'n_estimators': 250, 'max_depth': 8, 'min_samples_split': 10, 'min_samples_leaf': 8, 'max_features': 'sqrt'}. Best is trial 6 with value: 0.823453559671299.
[I 2026-07-01 03:12:18,292] Trial 24 finished with value: 0.8169810016837132 and parameters: {'n_estimators': 250, 'max_depth': 8, 'min_samples_split': 10, 'min_samples_leaf': 8, 'max_features': 'sqrt'}. Best is trial 6 with value: 0.823453559671299.
[I 2026-07-01 03:16:47,644] Trial 31 finished with value: 0.8083367887149331 and parameters: {'n_estimators': 50, 'max_depth': 7, 'min_samples_split': 7, 'min_samples_leaf': 3, 'max_features': 'sqrt'}. Best is trial 6 with value: 0.823453559671299.
[I 2026-07-01 03:31:16,628] Trial 26 finished with value: 0.8161333861064342 and parameters: {'n_estimators': 200, 'max_depth': 8, 'min_samples_split': 5, 'min_samples_leaf': 8, 'max_features': 'sqrt'}. Best is trial 6 with value: 0.823453559671299.
[I 2026-07-01 03:36:57,809] Trial 28 finished with value: 0.8216651379220801 and parameters: {'n_estimators': 200, 'max_depth': 7, 'min_samples_split': 5, 'min_samples_leaf': 7, 'max_features': 'sqrt'}. Best is trial 6 with value: 0.823453559671299.
[I 2026-07-01 03:37:06,586] Trial 27 finished with value: 0.8161333861064342 and parameters: {'n_estimators': 200, 'max_depth': 8, 'min_samples_split': 5, 'min_samples_leaf': 8, 'max_features': 'sqrt'}. Best is trial 6 with value: 0.823453559671299.
[I 2026-07-01 03:39:02,334] Trial 29 finished with value: 0.8224436458673636 and parameters: {'n_estimators': 200, 'max_depth': 7, 'min_samples_split': 5, 'min_samples_leaf': 10, 'max_features': 'sqrt'}. Best is trial 6 with value: 0.823453559671299.
[I 2026-07-01 03:43:21,544] Trial 30 finished with value: 0.8165516966970741 and parameters: {'n_estimators': 200, 'max_depth': 7, 'min_samples_split': 5, 'min_samples_leaf': 3, 'max_features': 'sqrt'}. Best is trial 6 with value: 0.823453559671299.
[I 2026-07-01 03:44:16,307] Trial 34 finished with value: 0.8221059608473852 and parameters: {'n_estimators': 200, 'max_depth': 3, 'min_samples_split': 12, 'min_samples_leaf': 10, 'max_features': 'sqrt'}. Best is trial 6 with value: 0.823453559671299.
[I 2026-07-01 03:52:22,163] Trial 32 finished with value: 0.8164689769557459 and parameters: {'n_estimators': 200, 'max_depth': 7, 'min_samples_split': 7, 'min_samples_leaf': 3, 'max_features': 'sqrt'}. Best is trial 6 with value: 0.823453559671299.
[I 2026-07-01 03:55:26,612] Trial 38 finished with value: 0.8233567042779718 and parameters: {'n_estimators': 250, 'max_depth': 6, 'min_samples_split': 12, 'min_samples_leaf': 10, 'max_features': 'log2'}. Best is trial 6 with value: 0.823453559671299.
[I 2026-07-01 03:57:14,225] Trial 33 finished with value: 0.8164689769557459 and parameters: {'n_estimators': 200, 'max_depth': 7, 'min_samples_split': 7, 'min_samples_leaf': 3, 'max_features': 'sqrt'}. Best is trial 6 with value: 0.823453559671299.
[I 2026-07-01 03:57:17,055] Trial 36 finished with value: 0.8210604461421188 and parameters: {'n_estimators': 150, 'max_depth': 3, 'min_samples_split': 12, 'min_samples_leaf': 10, 'max_features': 'sqrt'}. Best is trial 6 with value: 0.823453559671299.
[I 2026-07-01 03:57:35,524] Trial 37 finished with value: 0.8210604461421188 and parameters: {'n_estimators': 150, 'max_depth': 3, 'min_samples_split': 8, 'min_samples_leaf': 10, 'max_features': 'sqrt'}. Best is trial 6 with value: 0.823453559671299.
[I 2026-07-01 03:58:31,654] Trial 35 finished with value: 0.8221059608473852 and parameters: {'n_estimators': 200, 'max_depth': 3, 'min_samples_split': 12, 'min_samples_leaf': 10, 'max_features': 'sqrt'}. Best is trial 6 with value: 0.823453559671299.
[I 2026-07-01 03:59:29,941] Trial 39 finished with value: 0.8233567042779718 and parameters: {'n_estimators': 250, 'max_depth': 6, 'min_samples_split': 12, 'min_samples_leaf': 10, 'max_features': 'log2'}. Best is trial 6 with value: 0.823453559671299.
[I 2026-07-01 04:00:22,444] Trial 40 finished with value: 0.8213829484247648 and parameters: {'n_estimators': 250, 'max_depth': 6, 'min_samples_split': 18, 'min_samples_leaf': 11, 'max_features': 'log2'}. Best is trial 6 with value: 0.823453559671299.
[I 2026-07-01 04:08:46,945] Trial 43 finished with value: 0.8190756958929125 and parameters: {'n_estimators': 150, 'max_depth': 9, 'min_samples_split': 12, 'min_samples_leaf': 11, 'max_features': 'log2'}. Best is trial 6 with value: 0.823453559671299.
[I 2026-07-01 04:08:59,848] Trial 42 finished with value: 0.8213939428207642 and parameters: {'n_estimators': 250, 'max_depth': 4, 'min_samples_split': 13, 'min_samples_leaf': 10, 'max_features': 'log2'}. Best is trial 6 with value: 0.823453559671299.
[I 2026-07-01 04:11:52,746] Trial 41 finished with value: 0.8217321513834092 and parameters: {'n_estimators': 300, 'max_depth': 6, 'min_samples_split': 18, 'min_samples_leaf': 11, 'max_features': 'log2'}. Best is trial 6 with value: 0.823453559671299.
[I 2026-07-01 04:12:25,751] Trial 44 finished with value: 0.8235095787366287 and parameters: {'n_estimators': 250, 'max_depth': 5, 'min_samples_split': 13, 'min_samples_leaf': 11, 'max_features': 'log2'}. Best is trial 44 with value: 0.8235095787366287.
[I 2026-07-01 04:13:44,550] Trial 46 finished with value: 0.8235095787366287 and parameters: {'n_estimators': 250, 'max_depth': 5, 'min_samples_split': 18, 'min_samples_leaf': 11, 'max_features': 'log2'}. Best is trial 44 with value: 0.8235095787366287.
[I 2026-07-01 04:15:31,176] Trial 48 finished with value: 0.8235095787366287 and parameters: {'n_estimators': 250, 'max_depth': 5, 'min_samples_split': 13, 'min_samples_leaf': 11, 'max_features': 'log2'}. Best is trial 44 with value: 0.8235095787366287.
[I 2026-07-01 04:15:56,730] Trial 47 finished with value: 0.8213829484247648 and parameters: {'n_estimators': 250, 'max_depth': 6, 'min_samples_split': 13, 'min_samples_leaf': 11, 'max_features': 'log2'}. Best is trial 44 with value: 0.8235095787366287.
[I 2026-07-01 04:16:45,790] Trial 45 finished with value: 0.8187442933849337 and parameters: {'n_estimators': 250, 'max_depth': 9, 'min_samples_split': 13, 'min_samples_leaf': 11, 'max_features': 'log2'}. Best is trial 44 with value: 0.8235095787366287.
[I 2026-07-01 04:24:00,985] Trial 49 finished with value: 0.8234446594459662 and parameters: {'n_estimators': 250, 'max_depth': 5, 'min_samples_split': 14, 'min_samples_leaf': 12, 'max_features': 'log2'}. Best is trial 44 with value: 0.8235095787366287.
[I 2026-07-01 04:25:29,226] Trial 50 finished with value: 0.822167738882048 and parameters: {'n_estimators': 250, 'max_depth': 6, 'min_samples_split': 13, 'min_samples_leaf': 12, 'max_features': 'log2'}. Best is trial 44 with value: 0.8235095787366287.
[I 2026-07-01 04:27:06,505] Trial 51 finished with value: 0.8228729508540028 and parameters: {'n_estimators': 250, 'max_depth': 5, 'min_samples_split': 14, 'min_samples_leaf': 9, 'max_features': 'log2'}. Best is trial 44 with value: 0.8235095787366287.
[I 2026-07-01 04:27:40,977] Trial 52 finished with value: 0.8234446594459662 and parameters: {'n_estimators': 250, 'max_depth': 5, 'min_samples_split': 14, 'min_samples_leaf': 12, 'max_features': 'log2'}. Best is trial 44 with value: 0.8235095787366287.
[I 2026-07-01 04:28:59,067] Trial 53 finished with value: 0.8234446594459662 and parameters: {'n_estimators': 250, 'max_depth': 5, 'min_samples_split': 14, 'min_samples_leaf': 12, 'max_features': 'log2'}. Best is trial 44 with value: 0.8235095787366287.
[I 2026-07-01 04:33:51,189] Trial 54 finished with value: 0.8236388937752871 and parameters: {'n_estimators': 300, 'max_depth': 5, 'min_samples_split': 16, 'min_samples_leaf': 12, 'max_features': 'log2'}. Best is trial 54 with value: 0.8236388937752871.
[I 2026-07-01 04:34:18,498] Trial 55 finished with value: 0.8236388937752871 and parameters: {'n_estimators': 300, 'max_depth': 5, 'min_samples_split': 16, 'min_samples_leaf': 12, 'max_features': 'log2'}. Best is trial 54 with value: 0.8236388937752871.
[I 2026-07-01 04:35:05,604] Trial 56 finished with value: 0.8236388937752871 and parameters: {'n_estimators': 300, 'max_depth': 5, 'min_samples_split': 15, 'min_samples_leaf': 12, 'max_features': 'log2'}. Best is trial 54 with value: 0.8236388937752871.
[I 2026-07-01 04:42:12,894] Trial 57 finished with value: 0.8231540932659848 and parameters: {'n_estimators': 300, 'max_depth': 5, 'min_samples_split': 15, 'min_samples_leaf': 13, 'max_features': 'log2'}. Best is trial 54 with value: 0.8236388937752871.
[I 2026-07-01 04:43:40,463] Trial 58 finished with value: 0.8231540932659848 and parameters: {'n_estimators': 300, 'max_depth': 5, 'min_samples_split': 14, 'min_samples_leaf': 13, 'max_features': 'log2'}. Best is trial 54 with value: 0.8236388937752871.
[I 2026-07-01 04:44:07,094] Trial 60 finished with value: 0.8218420953434021 and parameters: {'n_estimators': 300, 'max_depth': 4, 'min_samples_split': 16, 'min_samples_leaf': 12, 'max_features': 'log2'}. Best is trial 54 with value: 0.8236388937752871.
[I 2026-07-01 04:45:12,681] Trial 59 finished with value: 0.8231540932659848 and parameters: {'n_estimators': 300, 'max_depth': 5, 'min_samples_split': 15, 'min_samples_leaf': 13, 'max_features': 'log2'}. Best is trial 54 with value: 0.8236388937752871.
[I 2026-07-01 04:47:02,775] Trial 61 finished with value: 0.8231540932659848 and parameters: {'n_estimators': 300, 'max_depth': 5, 'min_samples_split': 16, 'min_samples_leaf': 13, 'max_features': 'log2'}. Best is trial 54 with value: 0.8236388937752871.
[I 2026-07-01 04:49:57,660] Trial 62 finished with value: 0.8220750718300539 and parameters: {'n_estimators': 300, 'max_depth': 4, 'min_samples_split': 19, 'min_samples_leaf': 13, 'max_features': 'log2'}. Best is trial 54 with value: 0.8236388937752871.
[I 2026-07-01 04:50:22,514] Trial 63 finished with value: 0.8220750718300539 and parameters: {'n_estimators': 300, 'max_depth': 4, 'min_samples_split': 17, 'min_samples_leaf': 13, 'max_features': 'log2'}. Best is trial 54 with value: 0.8236388937752871.
[I 2026-07-01 04:51:13,854] Trial 64 finished with value: 0.8220750718300539 and parameters: {'n_estimators': 300, 'max_depth': 4, 'min_samples_split': 16, 'min_samples_leaf': 13, 'max_features': 'log2'}. Best is trial 54 with value: 0.8236388937752871.
[I 2026-07-01 04:58:19,126] Trial 65 finished with value: 0.8216562376967473 and parameters: {'n_estimators': 300, 'max_depth': 4, 'min_samples_split': 16, 'min_samples_leaf': 14, 'max_features': 'log2'}. Best is trial 54 with value: 0.8236388937752871.
[I 2026-07-01 04:59:48,408] Trial 66 finished with value: 0.8216562376967473 and parameters: {'n_estimators': 300, 'max_depth': 4, 'min_samples_split': 16, 'min_samples_leaf': 14, 'max_features': 'log2'}. Best is trial 54 with value: 0.8236388937752871.
[I 2026-07-01 05:00:11,534] Trial 67 finished with value: 0.8216562376967473 and parameters: {'n_estimators': 300, 'max_depth': 4, 'min_samples_split': 17, 'min_samples_leaf': 14, 'max_features': 'log2'}. Best is trial 54 with value: 0.8236388937752871.
[I 2026-07-01 05:01:22,267] Trial 68 finished with value: 0.8216562376967473 and parameters: {'n_estimators': 300, 'max_depth': 4, 'min_samples_split': 17, 'min_samples_leaf': 14, 'max_features': 'log2'}. Best is trial 54 with value: 0.8236388937752871.
[I 2026-07-01 05:03:14,080] Trial 69 finished with value: 0.8215824181807521 and parameters: {'n_estimators': 300, 'max_depth': 4, 'min_samples_split': 11, 'min_samples_leaf': 11, 'max_features': 'log2'}. Best is trial 54 with value: 0.8236388937752871.
[I 2026-07-01 05:03:28,837] Trial 75 finished with value: 0.8196563047102087 and parameters: {'n_estimators': 50, 'max_depth': 5, 'min_samples_split': 11, 'min_samples_leaf': 9, 'max_features': 'log2'}. Best is trial 54 with value: 0.8236388937752871.
