[I 2026-06-28 07:16:48,317] Trial 74 finished with value: 0.7480698162971141 and parameters: {'num_nodes': [32], 'dropout': 0.22700126863166992, 'learning_rate': 0.005193796412675532, 'batch_norm': True}. Best is trial 62 with value: 0.7726715122519704.
/scratch.hpc/luca.cotugno/Foundation_model_clinical_data/test_tabular_model.py:481: UserWarning: Choices for a categorical distribution should be a tuple of None, bool, int, float and str for persistent storage but contains [32] which is of type list.
  num_nodes  = trial.suggest_categorical("num_nodes", [[32], [64], [128], [64, 32], [128, 64]])
/scratch.hpc/luca.cotugno/Foundation_model_clinical_data/test_tabular_model.py:481: UserWarning: Choices for a categorical distribution should be a tuple of None, bool, int, float and str for persistent storage but contains [64] which is of type list.
  num_nodes  = trial.suggest_categorical("num_nodes", [[32], [64], [128], [64, 32], [128, 64]])
/scratch.hpc/luca.cotugno/Foundation_model_clinical_data/test_tabular_model.py:481: UserWarning: Choices for a categorical distribution should be a tuple of None, bool, int, float and str for persistent storage but contains [128] which is of type list.
  num_nodes  = trial.suggest_categorical("num_nodes", [[32], [64], [128], [64, 32], [128, 64]])
/scratch.hpc/luca.cotugno/Foundation_model_clinical_data/test_tabular_model.py:481: UserWarning: Choices for a categorical distribution should be a tuple of None, bool, int, float and str for persistent storage but contains [64, 32] which is of type list.
  num_nodes  = trial.suggest_categorical("num_nodes", [[32], [64], [128], [64, 32], [128, 64]])
/scratch.hpc/luca.cotugno/Foundation_model_clinical_data/test_tabular_model.py:481: UserWarning: Choices for a categorical distribution should be a tuple of None, bool, int, float and str for persistent storage but contains [128, 64] which is of type list.
  num_nodes  = trial.suggest_categorical("num_nodes", [[32], [64], [128], [64, 32], [128, 64]])

51:	[0s / 34s],		train_loss: 4.2828
54:	[0s / 10s],		train_loss: 4.3073
22:	[0s / 3s],		train_loss: 4.2801
31:	[0s / 4s],		train_loss: 4.3083
23:	[0s / 3s],		train_loss: 4.3231
55:	[0s / 10s],		train_loss: 4.2895
32:	[0s / 4s],		train_loss: 4.2831
24:	[0s / 3s],		train_loss: 4.3360
34:	[0s / 11s],		train_loss: 4.2927
33:	[0s / 4s],		train_loss: 4.3322
56:	[0s / 10s],		train_loss: 4.2715
25:	[0s / 3s],		train_loss: 4.2800
34:	[0s / 4s],		train_loss: 4.3253
26:	[0s / 3s],		train_loss: 4.3296
57:	[0s / 11s],		train_loss: 4.2411
52:	[0s / 35s],		train_loss: 4.2744
35:	[0s / 5s],		train_loss: 4.2690
27:	[0s / 3s],		train_loss: 4.2979
35:	[0s / 12s],		train_loss: 4.2693
58:	[0s / 11s],		train_loss: 4.2614
36:	[0s / 5s],		train_loss: 4.2692
28:	[0s / 3s],		train_loss: 4.2708
29:	[0s / 3s],		train_loss: 4.3144
37:	[0s / 5s],		train_loss: 4.2925
59:	[0s / 11s],		train_loss: 4.2441
0:	[0s / 0s],		train_loss: 4.6153
36:	[0s / 12s],		train_loss: 4.2302
30:	[0s / 3s],		train_loss: 4.2959
38:	[0s / 5s],		train_loss: 4.2908
60:	[0s / 11s],		train_loss: 4.2586
31:	[0s / 4s],		train_loss: 4.3125
39:	[0s / 5s],		train_loss: 4.2647
61:	[0s / 11s],		train_loss: 4.2677
32:	[0s / 4s],		train_loss: 4.3089
37:	[0s / 12s],		train_loss: 4.2460
53:	[0s / 35s],		train_loss: 4.2571
40:	[0s / 5s],		train_loss: 4.3057
33:	[0s / 4s],		train_loss: 4.2916
62:	[0s / 11s],		train_loss: 4.2814
41:	[0s / 5s],		train_loss: 4.2671
34:	[0s / 4s],		train_loss: 4.2779
42:	[0s / 5s],		train_loss: 4.2939
63:	[0s / 12s],		train_loss: 4.2522
38:	[0s / 12s],		train_loss: 4.2843
13:	[1s / 30s],		train_loss: 4.2998
35:	[0s / 4s],		train_loss: 4.2660
43:	[0s / 6s],		train_loss: 4.2904
36:	[0s / 4s],		train_loss: 4.2652
64:	[0s / 12s],		train_loss: 4.2836
44:	[0s / 6s],		train_loss: 4.3004
54:	[0s / 36s],		train_loss: 4.2600
37:	[0s / 4s],		train_loss: 4.2779
39:	[0s / 13s],		train_loss: 4.2374
1:	[0s / 1s],		train_loss: 4.4534
45:	[0s / 6s],		train_loss: 4.2856
65:	[0s / 12s],		train_loss: 4.2987
38:	[0s / 4s],		train_loss: 4.3043
46:	[0s / 6s],		train_loss: 4.3053
39:	[0s / 5s],		train_loss: 4.2846
66:	[0s / 12s],		train_loss: 4.2894
47:	[0s / 6s],		train_loss: 4.3044
40:	[0s / 13s],		train_loss: 4.2527
40:	[0s / 5s],		train_loss: 4.2773
67:	[0s / 12s],		train_loss: 4.2488
48:	[0s / 6s],		train_loss: 4.3136
55:	[0s / 37s],		train_loss: 4.2523
41:	[0s / 5s],		train_loss: 4.2541
49:	[0s / 6s],		train_loss: 4.2974
42:	[0s / 5s],		train_loss: 4.2710
41:	[0s / 13s],		train_loss: 4.2353
68:	[0s / 12s],		train_loss: 4.2696
50:	[0s / 7s],		train_loss: 4.3102
43:	[0s / 5s],		train_loss: 4.2803
69:	[0s / 13s],		train_loss: 4.2686
51:	[0s / 7s],		train_loss: 4.2842
44:	[0s / 5s],		train_loss: 4.2638
52:	[0s / 7s],		train_loss: 4.2812
42:	[0s / 14s],		train_loss: 4.2719
70:	[0s / 13s],		train_loss: 4.2564
45:	[0s / 5s],		train_loss: 4.2318
2:	[1s / 3s],		train_loss: 4.3955
53:	[0s / 7s],		train_loss: 4.3367
46:	[0s / 6s],		train_loss: 4.2647
56:	[0s / 37s],		train_loss: 4.2324
71:	[0s / 13s],		train_loss: 4.2415
63:	[3s / 3m:48s],		train_loss: 3.6331
54:	[0s / 7s],		train_loss: 4.2963
47:	[0s / 6s],		train_loss: 4.2774
43:	[0s / 14s],		train_loss: 4.2401
72:	[0s / 13s],		train_loss: 4.2671
55:	[0s / 7s],		train_loss: 4.3125
48:	[0s / 6s],		train_loss: 4.3005
56:	[0s / 7s],		train_loss: 4.3103
49:	[0s / 6s],		train_loss: 4.3010
73:	[0s / 13s],		train_loss: 4.2453
44:	[0s / 14s],		train_loss: 4.2341
57:	[0s / 8s],		train_loss: 4.2812
50:	[0s / 6s],		train_loss: 4.2926
74:	[0s / 14s],		train_loss: 4.2552
58:	[0s / 8s],		train_loss: 4.2666
57:	[0s / 38s],		train_loss: 4.2324
51:	[0s / 6s],		train_loss: 4.2532
14:	[2s / 32s],		train_loss: 4.2814
59:	[0s / 8s],		train_loss: 4.3083
52:	[0s / 6s],		train_loss: 4.2520
75:	[0s / 14s],		train_loss: 4.2313
45:	[0s / 15s],		train_loss: 4.2195
60:	[0s / 8s],		train_loss: 4.2931
53:	[0s / 7s],		train_loss: 4.2829
3:	[1s / 4s],		train_loss: 4.4200
76:	[0s / 14s],		train_loss: 4.2516
61:	[0s / 8s],		train_loss: 4.2751
54:	[0s / 7s],		train_loss: 4.2656
77:	[0s / 14s],		train_loss: 4.2533
55:	[0s / 7s],		train_loss: 4.2769
62:	[0s / 8s],		train_loss: 4.2821
46:	[0s / 15s],		train_loss: 4.2399
58:	[0s / 39s],		train_loss: 4.2511
56:	[0s / 7s],		train_loss: 4.2615
63:	[0s / 8s],		train_loss: 4.2709
78:	[0s / 14s],		train_loss: 4.2586
57:	[0s / 7s],		train_loss: 4.2447
64:	[0s / 9s],		train_loss: 4.2902
79:	[0s / 15s],		train_loss: 4.2413
47:	[0s / 16s],		train_loss: 4.2529
58:	[0s / 7s],		train_loss: 4.2729
65:	[0s / 9s],		train_loss: 4.2989
80:	[0s / 15s],		train_loss: 4.2461
59:	[0s / 7s],		train_loss: 4.2905
66:	[0s / 9s],		train_loss: 4.2767
60:	[0s / 7s],		train_loss: 4.2587
67:	[0s / 9s],		train_loss: 4.2701
81:	[0s / 15s],		train_loss: 4.2498
48:	[0s / 16s],		train_loss: 4.2329
59:	[0s / 39s],		train_loss: 4.2610
61:	[0s / 8s],		train_loss: 4.2503
68:	[0s / 9s],		train_loss: 4.2636
4:	[1s / 5s],		train_loss: 4.4059
82:	[0s / 15s],		train_loss: 4.2546
62:	[0s / 8s],		train_loss: 4.2533
69:	[0s / 9s],		train_loss: 4.2820
49:	[0s / 16s],		train_loss: 4.2594
63:	[0s / 8s],		train_loss: 4.2873
83:	[0s / 15s],		train_loss: 4.2316
70:	[0s / 9s],		train_loss: 4.2726
64:	[0s / 8s],		train_loss: 4.2742
84:	[0s / 16s],		train_loss: 4.2553
71:	[0s / 10s],		train_loss: 4.2573
65:	[0s / 8s],		train_loss: 4.2661
60:	[0s / 40s],		train_loss: 4.2426
50:	[0s / 17s],		train_loss: 4.2469
72:	[0s / 10s],		train_loss: 4.2974
85:	[0s / 16s],		train_loss: 4.2426
66:	[0s / 8s],		train_loss: 4.2622
15:	[2s / 34s],		train_loss: 4.2991
73:	[0s / 10s],		train_loss: 4.2616
67:	[0s / 8s],		train_loss: 4.2703
86:	[0s / 16s],		train_loss: 4.2543
74:	[0s / 10s],		train_loss: 4.2857
51:	[0s / 17s],		train_loss: 4.2524
68:	[0s / 9s],		train_loss: 4.2502
87:	[0s / 16s],		train_loss: 4.2428
75:	[0s / 10s],		train_loss: 4.2838
69:	[0s / 9s],		train_loss: 4.2748
5:	[1s / 6s],		train_loss: 4.3817
61:	[0s / 41s],		train_loss: 4.2451
76:	[0s / 10s],		train_loss: 4.2862
88:	[0s / 16s],		train_loss: 4.2653
52:	[0s / 17s],		train_loss: 4.2352
70:	[0s / 9s],		train_loss: 4.2855
77:	[0s / 10s],		train_loss: 4.2865
71:	[0s / 9s],		train_loss: 4.2796
89:	[0s / 17s],		train_loss: 4.2378
78:	[0s / 11s],		train_loss: 4.2790
72:	[0s / 9s],		train_loss: 4.2745
53:	[0s / 18s],		train_loss: 4.2518
90:	[0s / 17s],		train_loss: 4.2274
73:	[0s / 9s],		train_loss: 4.2748
79:	[0s / 11s],		train_loss: 4.2755
74:	[0s / 9s],		train_loss: 4.2451
91:	[0s / 17s],		train_loss: 4.2077
80:	[0s / 11s],		train_loss: 4.2822
62:	[0s / 41s],		train_loss: 4.2334
54:	[0s / 18s],		train_loss: 4.2075
64:	[3s / 3m:52s],		train_loss: 3.6307
75:	[0s / 10s],		train_loss: 4.2473
81:	[0s / 11s],		train_loss: 4.2918
92:	[0s / 17s],		train_loss: 4.2154
76:	[0s / 10s],		train_loss: 4.2592
82:	[0s / 11s],		train_loss: 4.2533
6:	[1s / 7s],		train_loss: 4.3425
93:	[0s / 17s],		train_loss: 4.2326
77:	[0s / 10s],		train_loss: 4.2424
55:	[0s / 18s],		train_loss: 4.2315
83:	[0s / 11s],		train_loss: 4.2589
78:	[0s / 10s],		train_loss: 4.2072
63:	[0s / 42s],		train_loss: 4.2419
94:	[0s / 18s],		train_loss: 4.2078
84:	[0s / 12s],		train_loss: 4.2836
79:	[0s / 10s],		train_loss: 4.2196
85:	[0s / 12s],		train_loss: 4.2562
95:	[0s / 18s],		train_loss: 4.2186
56:	[0s / 19s],		train_loss: 4.2134
80:	[0s / 10s],		train_loss: 4.2221
86:	[0s / 12s],		train_loss: 4.2867
96:	[0s / 18s],		train_loss: 4.2304
81:	[0s / 10s],		train_loss: 4.2285
87:	[0s / 12s],		train_loss: 4.2761
57:	[0s / 19s],		train_loss: 4.2129
82:	[0s / 11s],		train_loss: 4.2249
97:	[0s / 18s],		train_loss: 4.1933
16:	[2s / 36s],		train_loss: 4.2891
64:	[0s / 42s],		train_loss: 4.2494
88:	[0s / 12s],		train_loss: 4.2586
83:	[0s / 11s],		train_loss: 4.2217
98:	[0s / 18s],		train_loss: 4.2569
89:	[0s / 12s],		train_loss: 4.2643
84:	[0s / 11s],		train_loss: 4.2057
58:	[0s / 19s],		train_loss: 4.2022
90:	[0s / 12s],		train_loss: 4.2692
99:	[0s / 18s],		train_loss: 4.2735
85:	[0s / 11s],		train_loss: 4.1931
7:	[1s / 8s],		train_loss: 4.3684
91:	[0s / 13s],		train_loss: 4.2871
86:	[0s / 11s],		train_loss: 4.1852
65:	[0s / 43s],		train_loss: 4.2322
59:	[0s / 20s],		train_loss: 4.2025
0:	[0s / 0s],		train_loss: 4.6072
92:	[0s / 13s],		train_loss: 4.2751
87:	[0s / 11s],		train_loss: 4.2160
93:	[0s / 13s],		train_loss: 4.2768
88:	[0s / 11s],		train_loss: 4.2162
1:	[0s / 0s],		train_loss: 4.4435
94:	[0s / 13s],		train_loss: 4.2389
89:	[0s / 12s],		train_loss: 4.1822
60:	[0s / 20s],		train_loss: 4.1922
2:	[0s / 0s],		train_loss: 4.4218
95:	[0s / 13s],		train_loss: 4.2642
90:	[0s / 12s],		train_loss: 4.2090
66:	[0s / 44s],		train_loss: 4.2698
3:	[0s / 0s],		train_loss: 4.3957
91:	[0s / 12s],		train_loss: 4.2076
96:	[0s / 13s],		train_loss: 4.2436
61:	[0s / 20s],		train_loss: 4.1643
92:	[0s / 12s],		train_loss: 4.2235
4:	[0s / 0s],		train_loss: 4.4010
97:	[0s / 14s],		train_loss: 4.2710
93:	[0s / 12s],		train_loss: 4.1998
98:	[0s / 14s],		train_loss: 4.2676
5:	[0s / 1s],		train_loss: 4.3155
62:	[0s / 21s],		train_loss: 4.1839
94:	[0s / 12s],		train_loss: 4.2337
8:	[1s / 9s],		train_loss: 4.3548
99:	[0s / 14s],		train_loss: 4.2491
6:	[0s / 1s],		train_loss: 4.3658
67:	[0s / 44s],		train_loss: 4.2885
95:	[0s / 13s],		train_loss: 4.2308
63:	[0s / 21s],		train_loss: 4.2459
96:	[0s / 13s],		train_loss: 4.2135
7:	[0s / 1s],		train_loss: 4.3482
0:	[0s / 0s],		train_loss: 4.6134
17:	[2s / 38s],		train_loss: 4.2836
97:	[0s / 13s],		train_loss: 4.1984
1:	[0s / 0s],		train_loss: 4.4744
8:	[0s / 1s],		train_loss: 4.3563
98:	[0s / 13s],		train_loss: 4.2056
2:	[0s / 0s],		train_loss: 4.4296
64:	[0s / 21s],		train_loss: 4.2545
9:	[0s / 1s],		train_loss: 4.3168
68:	[0s / 45s],		train_loss: 4.2533
99:	[0s / 13s],		train_loss: 4.2367
3:	[0s / 0s],		train_loss: 4.4220
10:	[0s / 2s],		train_loss: 4.3562
9:	[0s / 10s],		train_loss: 4.3561
4:	[0s / 0s],		train_loss: 4.3914
65:	[0s / 22s],		train_loss: 4.2185
65:	[3s / 3m:56s],		train_loss: 3.6104
0:	[0s / 0s],		train_loss: 4.5676
11:	[0s / 2s],		train_loss: 4.3536
5:	[0s / 0s],		train_loss: 4.3946
1:	[0s / 0s],		train_loss: 4.4271
69:	[0s / 45s],		train_loss: 4.2143
6:	[0s / 1s],		train_loss: 4.3781
12:	[0s / 2s],		train_loss: 4.3438
2:	[0s / 0s],		train_loss: 4.4269
66:	[0s / 22s],		train_loss: 4.2179
7:	[0s / 1s],		train_loss: 4.3657
3:	[0s / 0s],		train_loss: 4.4065
13:	[0s / 2s],		train_loss: 4.3551
8:	[0s / 1s],		train_loss: 4.3499
4:	[0s / 0s],		train_loss: 4.3727
67:	[0s / 23s],		train_loss: 4.2155
14:	[0s / 3s],		train_loss: 4.3341
9:	[0s / 1s],		train_loss: 4.3859
5:	[0s / 0s],		train_loss: 4.3724
70:	[0s / 46s],		train_loss: 4.2461
10:	[0s / 1s],		train_loss: 4.3466
6:	[0s / 1s],		train_loss: 4.3688
15:	[0s / 3s],		train_loss: 4.3282
10:	[1s / 12s],		train_loss: 4.3539
11:	[0s / 1s],		train_loss: 4.3488
68:	[0s / 23s],		train_loss: 4.2132
7:	[0s / 1s],		train_loss: 4.3574
16:	[0s / 3s],		train_loss: 4.3344
8:	[0s / 1s],		train_loss: 4.3704
12:	[0s / 2s],		train_loss: 4.3618
17:	[0s / 3s],		train_loss: 4.3234
9:	[0s / 1s],		train_loss: 4.3194
13:	[0s / 2s],		train_loss: 4.3364
18:	[1s / 40s],		train_loss: 4.2658
69:	[0s / 23s],		train_loss: 4.2428
71:	[0s / 47s],		train_loss: 4.2277
10:	[0s / 1s],		train_loss: 4.3746
14:	[0s / 2s],		train_loss: 4.3461
18:	[0s / 3s],		train_loss: 4.3440
11:	[0s / 1s],		train_loss: 4.3190
15:	[0s / 2s],		train_loss: 4.3273
19:	[0s / 4s],		train_loss: 4.3174
12:	[0s / 1s],		train_loss: 4.3433
70:	[0s / 24s],		train_loss: 4.2145
16:	[0s / 2s],		train_loss: 4.3224
13:	[0s / 2s],		train_loss: 4.3228
20:	[0s / 4s],		train_loss: 4.3318
17:	[0s / 2s],		train_loss: 4.3488
14:	[0s / 2s],		train_loss: 4.3159
72:	[0s / 47s],		train_loss: 4.2411
18:	[0s / 2s],		train_loss: 4.3260
21:	[0s / 4s],		train_loss: 4.2918
71:	[0s / 24s],		train_loss: 4.2224
11:	[1s / 13s],		train_loss: 4.3428
15:	[0s / 2s],		train_loss: 4.3135
19:	[0s / 3s],		train_loss: 4.3121
22:	[0s / 4s],		train_loss: 4.3214
16:	[0s / 2s],		train_loss: 4.3476
20:	[0s / 3s],		train_loss: 4.3237
17:	[0s / 2s],		train_loss: 4.3477
72:	[0s / 24s],		train_loss: 4.2350
23:	[0s / 4s],		train_loss: 4.3167
21:	[0s / 3s],		train_loss: 4.3104
18:	[0s / 2s],		train_loss: 4.3117
73:	[0s / 48s],		train_loss: 4.2360
22:	[0s / 3s],		train_loss: 4.2904
24:	[0s / 5s],		train_loss: 4.3116
19:	[0s / 2s],		train_loss: 4.3813
23:	[0s / 3s],		train_loss: 4.3094
73:	[0s / 25s],		train_loss: 4.2264
25:	[0s / 5s],		train_loss: 4.2826
20:	[0s / 3s],		train_loss: 4.3472
24:	[0s / 3s],		train_loss: 4.3205
21:	[0s / 3s],		train_loss: 4.3312
26:	[0s / 5s],		train_loss: 4.2832
25:	[0s / 4s],		train_loss: 4.3127
22:	[0s / 3s],		train_loss: 4.3299
74:	[0s / 25s],		train_loss: 4.2069
27:	[0s / 5s],		train_loss: 4.2951
26:	[0s / 4s],		train_loss: 4.3051
23:	[0s / 3s],		train_loss: 4.3348
74:	[0s / 49s],		train_loss: 4.2443
12:	[1s / 14s],		train_loss: 4.3439
27:	[0s / 4s],		train_loss: 4.2867
24:	[0s / 3s],		train_loss: 4.3356
28:	[0s / 5s],		train_loss: 4.2984
28:	[0s / 4s],		train_loss: 4.3101
25:	[0s / 3s],		train_loss: 4.3357
75:	[0s / 25s],		train_loss: 4.1930
29:	[0s / 6s],		train_loss: 4.2844
26:	[0s / 3s],		train_loss: 4.3229
29:	[0s / 4s],		train_loss: 4.2822
27:	[0s / 3s],		train_loss: 4.3358
30:	[0s / 4s],		train_loss: 4.2806
30:	[0s / 6s],		train_loss: 4.3120
19:	[2s / 43s],		train_loss: 4.2663
76:	[0s / 26s],		train_loss: 4.2327
28:	[0s / 4s],		train_loss: 4.3476
75:	[0s / 49s],		train_loss: 4.1947
31:	[0s / 4s],		train_loss: 4.3013
31:	[0s / 6s],		train_loss: 4.3092
29:	[0s / 4s],		train_loss: 4.3155
32:	[0s / 5s],		train_loss: 4.2867
32:	[0s / 6s],		train_loss: 4.2853
30:	[0s / 4s],		train_loss: 4.3043
77:	[0s / 26s],		train_loss: 4.2381
33:	[0s / 5s],		train_loss: 4.2595
31:	[0s / 4s],		train_loss: 4.3114
34:	[0s / 5s],		train_loss: 4.2451
33:	[0s / 6s],		train_loss: 4.3086
32:	[0s / 4s],		train_loss: 4.3203
35:	[0s / 5s],		train_loss: 4.2590
76:	[0s / 50s],		train_loss: 4.2481
34:	[0s / 6s],		train_loss: 4.2769
78:	[0s / 27s],		train_loss: 4.2150
33:	[0s / 4s],		train_loss: 4.2912
13:	[1s / 15s],		train_loss: 4.3606
36:	[0s / 5s],		train_loss: 4.2852
34:	[0s / 4s],		train_loss: 4.2965
35:	[0s / 7s],		train_loss: 4.2996
37:	[0s / 5s],		train_loss: 4.2988
66:	[4s / 4m:1s],		train_loss: 3.6022
35:	[0s / 5s],		train_loss: 4.3061
79:	[0s / 27s],		train_loss: 4.2247
36:	[0s / 7s],		train_loss: 4.2945
38:	[0s / 5s],		train_loss: 4.2265
36:	[0s / 5s],		train_loss: 4.2910
39:	[0s / 6s],		train_loss: 4.2818
77:	[0s / 50s],		train_loss: 4.2385
37:	[0s / 7s],		train_loss: 4.2732
37:	[0s / 5s],		train_loss: 4.3116
40:	[0s / 6s],		train_loss: 4.2619
80:	[0s / 27s],		train_loss: 4.2232
38:	[0s / 5s],		train_loss: 4.3361
38:	[0s / 7s],		train_loss: 4.2693
41:	[0s / 6s],		train_loss: 4.2366
39:	[0s / 5s],		train_loss: 4.3134
39:	[0s / 7s],		train_loss: 4.2921
42:	[0s / 6s],		train_loss: 4.2810
40:	[0s / 5s],		train_loss: 4.2973
81:	[0s / 28s],		train_loss: 4.2062
43:	[0s / 6s],		train_loss: 4.2735
78:	[0s / 51s],		train_loss: 4.2316
40:	[0s / 8s],		train_loss: 4.2813
41:	[0s / 5s],		train_loss: 4.2861
14:	[1s / 16s],		train_loss: 4.3457
44:	[0s / 6s],		train_loss: 4.2562
42:	[0s / 6s],		train_loss: 4.2810
41:	[0s / 8s],		train_loss: 4.2770
20:	[2s / 45s],		train_loss: 4.2379
82:	[0s / 28s],		train_loss: 4.2057
43:	[0s / 6s],		train_loss: 4.2732
45:	[0s / 7s],		train_loss: 4.2645
42:	[0s / 8s],		train_loss: 4.2695
44:	[0s / 6s],		train_loss: 4.2796
46:	[0s / 7s],		train_loss: 4.2747
45:	[0s / 6s],		train_loss: 4.2705
47:	[0s / 7s],		train_loss: 4.2805
43:	[0s / 8s],		train_loss: 4.2912
79:	[0s / 52s],		train_loss: 4.2493
83:	[0s / 28s],		train_loss: 4.2010
46:	[0s / 6s],		train_loss: 4.2637
48:	[0s / 7s],		train_loss: 4.2409
44:	[0s / 8s],		train_loss: 4.2860
47:	[0s / 6s],		train_loss: 4.2970
49:	[0s / 7s],		train_loss: 4.2277
45:	[0s / 9s],		train_loss: 4.3128
48:	[0s / 6s],		train_loss: 4.2812
50:	[0s / 7s],		train_loss: 4.2282
84:	[0s / 29s],		train_loss: 4.1915
49:	[0s / 7s],		train_loss: 4.2784
51:	[0s / 7s],		train_loss: 4.2365
46:	[0s / 9s],		train_loss: 4.2468
80:	[0s / 52s],		train_loss: 4.2234
50:	[0s / 7s],		train_loss: 4.2550
15:	[1s / 18s],		train_loss: 4.3312
52:	[0s / 7s],		train_loss: 4.2369
47:	[0s / 9s],		train_loss: 4.2632
85:	[0s / 29s],		train_loss: 4.2197
51:	[0s / 7s],		train_loss: 4.3011
53:	[0s / 8s],		train_loss: 4.2238
52:	[0s / 7s],		train_loss: 4.2690
48:	[0s / 9s],		train_loss: 4.2611
54:	[0s / 8s],		train_loss: 4.2275
53:	[0s / 7s],		train_loss: 4.2727
55:	[0s / 8s],		train_loss: 4.2355
86:	[0s / 29s],		train_loss: 4.2144
81:	[0s / 53s],		train_loss: 4.2298
49:	[0s / 9s],		train_loss: 4.2206
54:	[0s / 7s],		train_loss: 4.2502
56:	[0s / 8s],		train_loss: 4.2373
50:	[0s / 10s],		train_loss: 4.2471
55:	[0s / 7s],		train_loss: 4.2650
57:	[0s / 8s],		train_loss: 4.2103
56:	[0s / 8s],		train_loss: 4.2942
87:	[0s / 30s],		train_loss: 4.2298
51:	[0s / 10s],		train_loss: 4.2547
58:	[0s / 8s],		train_loss: 4.2164
57:	[0s / 8s],		train_loss: 4.2919
21:	[2s / 47s],		train_loss: 4.2630
59:	[0s / 9s],		train_loss: 4.2156
52:	[0s / 10s],		train_loss: 4.2622
16:	[1s / 19s],		train_loss: 4.3300
58:	[0s / 8s],		train_loss: 4.2989
82:	[0s / 53s],		train_loss: 4.2329
88:	[0s / 30s],		train_loss: 4.1548
60:	[0s / 9s],		train_loss: 4.2337
59:	[0s / 8s],		train_loss: 4.3103
53:	[0s / 10s],		train_loss: 4.2555
61:	[0s / 9s],		train_loss: 4.2092
60:	[0s / 8s],		train_loss: 4.2696
54:	[0s / 10s],		train_loss: 4.2607
62:	[0s / 9s],		train_loss: 4.2438
61:	[0s / 8s],		train_loss: 4.2751
89:	[0s / 31s],		train_loss: 4.1793
63:	[0s / 9s],		train_loss: 4.2200
83:	[0s / 54s],		train_loss: 4.2059
62:	[0s / 8s],		train_loss: 4.2811
55:	[0s / 11s],		train_loss: 4.2560
67:	[4s / 4m:5s],		train_loss: 3.5770
64:	[0s / 9s],		train_loss: 4.2155
63:	[0s / 9s],		train_loss: 4.2449
90:	[0s / 31s],		train_loss: 4.1492
56:	[0s / 11s],		train_loss: 4.2630
65:	[0s / 10s],		train_loss: 4.2183
64:	[0s / 9s],		train_loss: 4.2723
65:	[0s / 9s],		train_loss: 4.2427
66:	[0s / 10s],		train_loss: 4.1903
57:	[0s / 11s],		train_loss: 4.2283
17:	[1s / 20s],		train_loss: 4.3267
91:	[0s / 31s],		train_loss: 4.1555
66:	[0s / 9s],		train_loss: 4.2873
67:	[0s / 10s],		train_loss: 4.1965
58:	[0s / 11s],		train_loss: 4.2519
84:	[0s / 55s],		train_loss: 4.2385
67:	[0s / 9s],		train_loss: 4.2507
68:	[0s / 10s],		train_loss: 4.2108
68:	[0s / 9s],		train_loss: 4.2593
59:	[0s / 12s],		train_loss: 4.2406
69:	[0s / 10s],		train_loss: 4.1931
92:	[0s / 32s],		train_loss: 4.1724
69:	[0s / 9s],		train_loss: 4.3035
70:	[0s / 10s],		train_loss: 4.2051
60:	[0s / 12s],		train_loss: 4.2456
70:	[0s / 10s],		train_loss: 4.2695
71:	[0s / 10s],		train_loss: 4.1871
93:	[0s / 32s],		train_loss: 4.1694
61:	[0s / 12s],		train_loss: 4.2513
85:	[0s / 55s],		train_loss: 4.2423
71:	[0s / 10s],		train_loss: 4.2862
72:	[0s / 11s],		train_loss: 4.1472
72:	[0s / 10s],		train_loss: 4.2272
62:	[0s / 12s],		train_loss: 4.2419
73:	[0s / 11s],		train_loss: 4.1878
73:	[0s / 10s],		train_loss: 4.2359
63:	[0s / 12s],		train_loss: 4.2425
94:	[0s / 32s],		train_loss: 4.1942
18:	[1s / 21s],		train_loss: 4.3072
74:	[0s / 11s],		train_loss: 4.1918
22:	[2s / 50s],		train_loss: 4.2626
74:	[0s / 10s],		train_loss: 4.2692
75:	[0s / 11s],		train_loss: 4.1873
64:	[0s / 12s],		train_loss: 4.2331
75:	[0s / 10s],		train_loss: 4.2345
86:	[0s / 56s],		train_loss: 4.2038
76:	[0s / 11s],		train_loss: 4.1894
76:	[0s / 10s],		train_loss: 4.2313
65:	[0s / 13s],		train_loss: 4.2384
95:	[0s / 33s],		train_loss: 4.1621
77:	[0s / 11s],		train_loss: 4.2500
77:	[0s / 11s],		train_loss: 4.2468
66:	[0s / 13s],		train_loss: 4.2444
78:	[0s / 11s],		train_loss: 4.2079
78:	[0s / 11s],		train_loss: 4.2465
96:	[0s / 33s],		train_loss: 4.1770
79:	[0s / 12s],		train_loss: 4.1787
67:	[0s / 13s],		train_loss: 4.2488
79:	[0s / 11s],		train_loss: 4.2471
80:	[0s / 12s],		train_loss: 4.1998
80:	[0s / 11s],		train_loss: 4.2191
68:	[0s / 13s],		train_loss: 4.2540
87:	[0s / 57s],		train_loss: 4.2544
19:	[1s / 22s],		train_loss: 4.3185
81:	[0s / 12s],		train_loss: 4.1898
97:	[0s / 33s],		train_loss: 4.1547
81:	[0s / 11s],		train_loss: 4.2306
69:	[0s / 14s],		train_loss: 4.2185
82:	[0s / 12s],		train_loss: 4.2024
82:	[