/scratch.hpc/luca.cotugno/Foundation_model_clinical_data/src/tabicl/embedding.py:142: UserWarning: The given NumPy array is not writable, and PyTorch does not support non-writable tensors. This means writing to this tensor will result in undefined behavior. You may want to copy the array to protect its data or make it writable before converting it to a tensor. This type of warning will be suppressed for the rest of this program. (Triggered internally at /pytorch/torch/csrc/utils/tensor_numpy.cpp:213.)
  y_t = torch.from_numpy(y_ctx).long().unsqueeze(0).to(self.device)    # (1, ctx_size)
/scratch.hpc/luca.cotugno/Foundation_model_clinical_data/.venv/lib/python3.12/site-packages/sklearn/utils/validation.py:2684: UserWarning: X has feature names, but RandomSurvivalForest was fitted without feature names
  warnings.warn(
/scratch.hpc/luca.cotugno/Foundation_model_clinical_data/.venv/lib/python3.12/site-packages/sklearn/utils/validation.py:2684: UserWarning: X has feature names, but RandomSurvivalForest was fitted without feature names
  warnings.warn(
/scratch.hpc/luca.cotugno/Foundation_model_clinical_data/.venv/lib/python3.12/site-packages/sklearn/utils/validation.py:2684: UserWarning: X has feature names, but RandomSurvivalForest was fitted without feature names
  warnings.warn(
/scratch.hpc/luca.cotugno/Foundation_model_clinical_data/.venv/lib/python3.12/site-packages/sklearn/utils/validation.py:2684: UserWarning: X has feature names, but RandomSurvivalForest was fitted without feature names
  warnings.warn(
/scratch.hpc/luca.cotugno/Foundation_model_clinical_data/.venv/lib/python3.12/site-packages/sklearn/utils/validation.py:2684: UserWarning: X has feature names, but RandomSurvivalForest was fitted without feature names
  warnings.warn(
/scratch.hpc/luca.cotugno/Foundation_model_clinical_data/.venv/lib/python3.12/site-packages/sklearn/utils/validation.py:2684: UserWarning: X has feature names, but RandomSurvivalForest was fitted without feature names
  warnings.warn(
/scratch.hpc/luca.cotugno/Foundation_model_clinical_data/.venv/lib/python3.12/site-packages/pycox/models/cox.py:251: RuntimeWarning: overflow encountered in exp
  expg = np.exp(self.predict(input, batch_size, True, eval_, num_workers=num_workers)).reshape(1, -1)
/scratch.hpc/luca.cotugno/Foundation_model_clinical_data/.venv/lib/python3.12/site-packages/sklearn/utils/validation.py:2684: UserWarning: X has feature names, but RandomSurvivalForest was fitted without feature names
  warnings.warn(
/scratch.hpc/luca.cotugno/Foundation_model_clinical_data/.venv/lib/python3.12/site-packages/sklearn/utils/validation.py:2684: UserWarning: X has feature names, but RandomSurvivalForest was fitted without feature names
  warnings.warn(
/scratch.hpc/luca.cotugno/Foundation_model_clinical_data/.venv/lib/python3.12/site-packages/sklearn/utils/validation.py:2684: UserWarning: X has feature names, but RandomSurvivalForest was fitted without feature names
  warnings.warn(
/scratch.hpc/luca.cotugno/Foundation_model_clinical_data/.venv/lib/python3.12/site-packages/sklearn/utils/validation.py:2684: UserWarning: X has feature names, but RandomSurvivalForest was fitted without feature names
  warnings.warn(
/scratch.hpc/luca.cotugno/Foundation_model_clinical_data/.venv/lib/python3.12/site-packages/pycox/models/cox.py:251: RuntimeWarning: overflow encountered in exp
  expg = np.exp(self.predict(input, batch_size, True, eval_, num_workers=num_workers)).reshape(1, -1)
/scratch.hpc/luca.cotugno/Foundation_model_clinical_data/.venv/lib/python3.12/site-packages/pycox/models/cox.py:252: RuntimeWarning: invalid value encountered in dot
  return pd.DataFrame(bch.values.reshape(-1, 1).dot(expg),
/scratch.hpc/luca.cotugno/Foundation_model_clinical_data/.venv/lib/python3.12/site-packages/sklearn/utils/validation.py:2684: UserWarning: X has feature names, but RandomSurvivalForest was fitted without feature names
  warnings.warn(
/scratch.hpc/luca.cotugno/Foundation_model_clinical_data/.venv/lib/python3.12/site-packages/sklearn/utils/validation.py:2684: UserWarning: X has feature names, but RandomSurvivalForest was fitted without feature names
  warnings.warn(
/scratch.hpc/luca.cotugno/Foundation_model_clinical_data/.venv/lib/python3.12/site-packages/pycox/models/cox.py:251: RuntimeWarning: overflow encountered in exp
  expg = np.exp(self.predict(input, batch_size, True, eval_, num_workers=num_workers)).reshape(1, -1)
/scratch.hpc/luca.cotugno/Foundation_model_clinical_data/.venv/lib/python3.12/site-packages/pycox/models/cox.py:252: RuntimeWarning: invalid value encountered in dot
  return pd.DataFrame(bch.values.reshape(-1, 1).dot(expg),
/scratch.hpc/luca.cotugno/Foundation_model_clinical_data/.venv/lib/python3.12/site-packages/sklearn/utils/validation.py:2684: UserWarning: X has feature names, but RandomSurvivalForest was fitted without feature names
  warnings.warn(
/scratch.hpc/luca.cotugno/Foundation_model_clinical_data/.venv/lib/python3.12/site-packages/sklearn/utils/validation.py:2684: UserWarning: X has feature names, but RandomSurvivalForest was fitted without feature names
  warnings.warn(
/scratch.hpc/luca.cotugno/Foundation_model_clinical_data/.venv/lib/python3.12/site-packages/pycox/models/cox.py:251: RuntimeWarning: overflow encountered in exp
  expg = np.exp(self.predict(input, batch_size, True, eval_, num_workers=num_workers)).reshape(1, -1)
/scratch.hpc/luca.cotugno/Foundation_model_clinical_data/.venv/lib/python3.12/site-packages/pycox/models/cox.py:252: RuntimeWarning: invalid value encountered in dot
  return pd.DataFrame(bch.values.reshape(-1, 1).dot(expg),
/scratch.hpc/luca.cotugno/Foundation_model_clinical_data/.venv/lib/python3.12/site-packages/sklearn/utils/validation.py:2684: UserWarning: X has feature names, but RandomSurvivalForest was fitted without feature names
  warnings.warn(
/scratch.hpc/luca.cotugno/Foundation_model_clinical_data/.venv/lib/python3.12/site-packages/sklearn/utils/validation.py:2684: UserWarning: X has feature names, but RandomSurvivalForest was fitted without feature names
  warnings.warn(
/scratch.hpc/luca.cotugno/Foundation_model_clinical_data/.venv/lib/python3.12/site-packages/pycox/models/cox.py:251: RuntimeWarning: overflow encountered in exp
  expg = np.exp(self.predict(input, batch_size, True, eval_, num_workers=num_workers)).reshape(1, -1)
/scratch.hpc/luca.cotugno/Foundation_model_clinical_data/.venv/lib/python3.12/site-packages/pycox/models/cox.py:252: RuntimeWarning: invalid value encountered in dot
  return pd.DataFrame(bch.values.reshape(-1, 1).dot(expg),
/scratch.hpc/luca.cotugno/Foundation_model_clinical_data/.venv/lib/python3.12/site-packages/sklearn/utils/validation.py:2684: UserWarning: X has feature names, but RandomSurvivalForest was fitted without feature names
  warnings.warn(
/scratch.hpc/luca.cotugno/Foundation_model_clinical_data/.venv/lib/python3.12/site-packages/sklearn/utils/validation.py:2684: UserWarning: X has feature names, but RandomSurvivalForest was fitted without feature names
  warnings.warn(
/scratch.hpc/luca.cotugno/Foundation_model_clinical_data/.venv/lib/python3.12/site-packages/pycox/models/cox.py:251: RuntimeWarning: overflow encountered in exp
  expg = np.exp(self.predict(input, batch_size, True, eval_, num_workers=num_workers)).reshape(1, -1)
/scratch.hpc/luca.cotugno/Foundation_model_clinical_data/.venv/lib/python3.12/site-packages/pycox/models/cox.py:252: RuntimeWarning: invalid value encountered in dot
  return pd.DataFrame(bch.values.reshape(-1, 1).dot(expg),
/scratch.hpc/luca.cotugno/Foundation_model_clinical_data/.venv/lib/python3.12/site-packages/sklearn/utils/validation.py:2684: UserWarning: X has feature names, but RandomSurvivalForest was fitted without feature names
  warnings.warn(
/scratch.hpc/luca.cotugno/Foundation_model_clinical_data/.venv/lib/python3.12/site-packages/sklearn/utils/validation.py:2684: UserWarning: X has feature names, but RandomSurvivalForest was fitted without feature names
  warnings.warn(
[I 2026-06-06 15:07:31,208] A new study created in memory with name: rsf_tuning_tabicl_3_NaN_seed77
[I 2026-06-06 15:20:14,500] Trial 3 finished with value: 0.7546427763677028 and parameters: {'n_estimators': 100, 'max_depth': 3, 'min_samples_split': 6, 'min_samples_leaf': 14, 'max_features': 'sqrt'}. Best is trial 3 with value: 0.7546427763677028.
[I 2026-06-06 15:24:45,743] Trial 4 finished with value: 0.7399485043433099 and parameters: {'n_estimators': 50, 'max_depth': 7, 'min_samples_split': 6, 'min_samples_leaf': 11, 'max_features': 'log2'}. Best is trial 3 with value: 0.7546427763677028.
[I 2026-06-06 15:32:54,207] Trial 2 finished with value: 0.7682339439934996 and parameters: {'n_estimators': 250, 'max_depth': 10, 'min_samples_split': 7, 'min_samples_leaf': 6, 'max_features': 'log2'}. Best is trial 2 with value: 0.7682339439934996.
[I 2026-06-06 15:37:20,404] Trial 1 finished with value: 0.7652879694083549 and parameters: {'n_estimators': 300, 'max_depth': 9, 'min_samples_split': 11, 'min_samples_leaf': 5, 'max_features': 'log2'}. Best is trial 2 with value: 0.7682339439934996.
[I 2026-06-06 15:41:11,906] Trial 5 finished with value: 0.7716322594426155 and parameters: {'n_estimators': 250, 'max_depth': 4, 'min_samples_split': 19, 'min_samples_leaf': 15, 'max_features': 'log2'}. Best is trial 5 with value: 0.7716322594426155.
[I 2026-06-06 15:42:34,087] Trial 6 finished with value: 0.7560696919056116 and parameters: {'n_estimators': 150, 'max_depth': 4, 'min_samples_split': 20, 'min_samples_leaf': 9, 'max_features': 'log2'}. Best is trial 5 with value: 0.7716322594426155.
[I 2026-06-06 15:56:17,900] Trial 0 finished with value: 0.7636162976737952 and parameters: {'n_estimators': 250, 'max_depth': 9, 'min_samples_split': 5, 'min_samples_leaf': 7, 'max_features': 'sqrt'}. Best is trial 5 with value: 0.7716322594426155.
[I 2026-06-06 15:58:53,614] Trial 8 finished with value: 0.772036957923923 and parameters: {'n_estimators': 300, 'max_depth': 4, 'min_samples_split': 7, 'min_samples_leaf': 13, 'max_features': 'log2'}. Best is trial 8 with value: 0.772036957923923.
[I 2026-06-06 16:05:14,635] Trial 7 finished with value: 0.7575248787475184 and parameters: {'n_estimators': 150, 'max_depth': 10, 'min_samples_split': 14, 'min_samples_leaf': 7, 'max_features': 'sqrt'}. Best is trial 8 with value: 0.772036957923923.
[I 2026-06-06 16:06:43,215] Trial 10 finished with value: 0.7617231673912497 and parameters: {'n_estimators': 150, 'max_depth': 6, 'min_samples_split': 16, 'min_samples_leaf': 4, 'max_features': 'log2'}. Best is trial 8 with value: 0.772036957923923.
[I 2026-06-06 16:06:56,318] Trial 9 finished with value: 0.749832989889344 and parameters: {'n_estimators': 150, 'max_depth': 6, 'min_samples_split': 14, 'min_samples_leaf': 11, 'max_features': 'sqrt'}. Best is trial 8 with value: 0.772036957923923.
[I 2026-06-06 16:18:51,961] Trial 12 finished with value: 0.763780690071118 and parameters: {'n_estimators': 250, 'max_depth': 4, 'min_samples_split': 14, 'min_samples_leaf': 9, 'max_features': 'log2'}. Best is trial 8 with value: 0.772036957923923.
[I 2026-06-06 16:23:27,020] Trial 14 finished with value: 0.7734939771651631 and parameters: {'n_estimators': 300, 'max_depth': 4, 'min_samples_split': 10, 'min_samples_leaf': 15, 'max_features': 'log2'}. Best is trial 14 with value: 0.7734939771651631.
[I 2026-06-06 16:38:31,683] Trial 15 finished with value: 0.7720599938012548 and parameters: {'n_estimators': 300, 'max_depth': 5, 'min_samples_split': 10, 'min_samples_leaf': 15, 'max_features': 'log2'}. Best is trial 14 with value: 0.7734939771651631.
[I 2026-06-06 16:40:43,965] Trial 11 finished with value: 0.7666512745122677 and parameters: {'n_estimators': 250, 'max_depth': 8, 'min_samples_split': 10, 'min_samples_leaf': 6, 'max_features': 'sqrt'}. Best is trial 14 with value: 0.7734939771651631.
[I 2026-06-06 16:42:40,019] Trial 16 finished with value: 0.7683669238308245 and parameters: {'n_estimators': 300, 'max_depth': 5, 'min_samples_split': 9, 'min_samples_leaf': 13, 'max_features': 'log2'}. Best is trial 14 with value: 0.7734939771651631.
[I 2026-06-06 16:51:20,704] Trial 19 finished with value: 0.7656900501763292 and parameters: {'n_estimators': 200, 'max_depth': 3, 'min_samples_split': 12, 'min_samples_leaf': 15, 'max_features': 'log2'}. Best is trial 14 with value: 0.7734939771651631.
[I 2026-06-06 16:54:54,648] Trial 13 finished with value: 0.7567678360515668 and parameters: {'n_estimators': 300, 'max_depth': 6, 'min_samples_split': 10, 'min_samples_leaf': 12, 'max_features': 'sqrt'}. Best is trial 14 with value: 0.7734939771651631.
[I 2026-06-06 16:57:24,706] Trial 17 finished with value: 0.7688140292681293 and parameters: {'n_estimators': 300, 'max_depth': 5, 'min_samples_split': 10, 'min_samples_leaf': 12, 'max_features': 'log2'}. Best is trial 14 with value: 0.7734939771651631.
[I 2026-06-06 16:59:42,551] Trial 18 finished with value: 0.7683669238308245 and parameters: {'n_estimators': 300, 'max_depth': 5, 'min_samples_split': 10, 'min_samples_leaf': 13, 'max_features': 'log2'}. Best is trial 14 with value: 0.7734939771651631.
[I 2026-06-06 17:03:45,818] Trial 20 finished with value: 0.7653596947536836 and parameters: {'n_estimators': 200, 'max_depth': 5, 'min_samples_split': 9, 'min_samples_leaf': 12, 'max_features': 'log2'}. Best is trial 14 with value: 0.7734939771651631.
[I 2026-06-06 17:07:36,716] Trial 21 finished with value: 0.7667994370869249 and parameters: {'n_estimators': 200, 'max_depth': 5, 'min_samples_split': 8, 'min_samples_leaf': 11, 'max_features': 'log2'}. Best is trial 14 with value: 0.7734939771651631.
[I 2026-06-06 17:09:45,647] Trial 22 finished with value: 0.7704768007773561 and parameters: {'n_estimators': 200, 'max_depth': 5, 'min_samples_split': 17, 'min_samples_leaf': 15, 'max_features': 'log2'}. Best is trial 14 with value: 0.7734939771651631.
[I 2026-06-06 17:13:50,136] Trial 23 finished with value: 0.7764457107196409 and parameters: {'n_estimators': 200, 'max_depth': 7, 'min_samples_split': 8, 'min_samples_leaf': 15, 'max_features': 'log2'}. Best is trial 23 with value: 0.7764457107196409.
[I 2026-06-06 17:16:49,476] Trial 24 finished with value: 0.767051784652242 and parameters: {'n_estimators': 300, 'max_depth': 3, 'min_samples_split': 8, 'min_samples_leaf': 15, 'max_features': 'log2'}. Best is trial 23 with value: 0.7764457107196409.
[I 2026-06-06 17:20:42,659] Trial 27 finished with value: 0.7677857914708617 and parameters: {'n_estimators': 100, 'max_depth': 7, 'min_samples_split': 12, 'min_samples_leaf': 14, 'max_features': 'log2'}. Best is trial 23 with value: 0.7764457107196409.
[I 2026-06-06 17:21:06,023] Trial 25 finished with value: 0.767051784652242 and parameters: {'n_estimators': 300, 'max_depth': 3, 'min_samples_split': 8, 'min_samples_leaf': 15, 'max_features': 'log2'}. Best is trial 23 with value: 0.7764457107196409.
[I 2026-06-06 17:22:43,751] Trial 26 finished with value: 0.7675737566908752 and parameters: {'n_estimators': 300, 'max_depth': 3, 'min_samples_split': 8, 'min_samples_leaf': 14, 'max_features': 'log2'}. Best is trial 23 with value: 0.7764457107196409.
[I 2026-06-06 17:23:44,793] Trial 28 finished with value: 0.7677857914708617 and parameters: {'n_estimators': 100, 'max_depth': 7, 'min_samples_split': 12, 'min_samples_leaf': 14, 'max_features': 'log2'}. Best is trial 23 with value: 0.7764457107196409.
[I 2026-06-06 17:38:53,404] Trial 29 finished with value: 0.7724835398185611 and parameters: {'n_estimators': 250, 'max_depth': 7, 'min_samples_split': 13, 'min_samples_leaf': 14, 'max_features': 'log2'}. Best is trial 23 with value: 0.7764457107196409.
[I 2026-06-06 17:39:46,460] Trial 30 finished with value: 0.7724835398185611 and parameters: {'n_estimators': 250, 'max_depth': 7, 'min_samples_split': 13, 'min_samples_leaf': 14, 'max_features': 'log2'}. Best is trial 23 with value: 0.7764457107196409.
[I 2026-06-06 17:41:20,979] Trial 31 finished with value: 0.7690595707787802 and parameters: {'n_estimators': 250, 'max_depth': 7, 'min_samples_split': 13, 'min_samples_leaf': 10, 'max_features': 'log2'}. Best is trial 23 with value: 0.7764457107196409.
[I 2026-06-06 17:59:06,390] Trial 34 finished with value: 0.764953949187043 and parameters: {'n_estimators': 250, 'max_depth': 8, 'min_samples_split': 13, 'min_samples_leaf': 13, 'max_features': 'log2'}. Best is trial 23 with value: 0.7764457107196409.
[I 2026-06-06 18:00:07,178] Trial 35 finished with value: 0.764953949187043 and parameters: {'n_estimators': 250, 'max_depth': 8, 'min_samples_split': 15, 'min_samples_leaf': 13, 'max_features': 'log2'}. Best is trial 23 with value: 0.7764457107196409.
[I 2026-06-06 18:04:42,288] Trial 32 finished with value: 0.7610671684299584 and parameters: {'n_estimators': 250, 'max_depth': 8, 'min_samples_split': 6, 'min_samples_leaf': 10, 'max_features': 'sqrt'}. Best is trial 23 with value: 0.7764457107196409.
[I 2026-06-06 18:18:49,638] Trial 36 finished with value: 0.7733044547198419 and parameters: {'n_estimators': 250, 'max_depth': 8, 'min_samples_split': 16, 'min_samples_leaf': 14, 'max_features': 'log2'}. Best is trial 23 with value: 0.7764457107196409.
[I 2026-06-06 18:19:33,674] Trial 33 finished with value: 0.7610671684299584 and parameters: {'n_estimators': 250, 'max_depth': 8, 'min_samples_split': 5, 'min_samples_leaf': 10, 'max_features': 'sqrt'}. Best is trial 23 with value: 0.7764457107196409.
[I 2026-06-06 18:20:15,426] Trial 38 finished with value: 0.7691590438854405 and parameters: {'n_estimators': 200, 'max_depth': 9, 'min_samples_split': 11, 'min_samples_leaf': 14, 'max_features': 'log2'}. Best is trial 23 with value: 0.7764457107196409.
[I 2026-06-06 18:32:17,987] Trial 37 finished with value: 0.7623786428098744 and parameters: {'n_estimators': 200, 'max_depth': 8, 'min_samples_split': 5, 'min_samples_leaf': 14, 'max_features': 'sqrt'}. Best is trial 23 with value: 0.7764457107196409.
[I 2026-06-06 18:34:38,472] Trial 39 finished with value: 0.7691590438854405 and parameters: {'n_estimators': 200, 'max_depth': 9, 'min_samples_split': 18, 'min_samples_leaf': 14, 'max_features': 'log2'}. Best is trial 23 with value: 0.7764457107196409.
[I 2026-06-06 18:35:22,793] Trial 40 finished with value: 0.7691590438854405 and parameters: {'n_estimators': 200, 'max_depth': 9, 'min_samples_split': 18, 'min_samples_leaf': 14, 'max_features': 'log2'}. Best is trial 23 with value: 0.7764457107196409.
[I 2026-06-06 18:36:11,500] Trial 41 finished with value: 0.771254785179973 and parameters: {'n_estimators': 200, 'max_depth': 9, 'min_samples_split': 18, 'min_samples_leaf': 8, 'max_features': 'log2'}. Best is trial 23 with value: 0.7764457107196409.
[I 2026-06-06 18:36:26,005] Trial 42 finished with value: 0.7419230455105169 and parameters: {'n_estimators': 50, 'max_depth': 9, 'min_samples_split': 18, 'min_samples_leaf': 7, 'max_features': 'log2'}. Best is trial 23 with value: 0.7764457107196409.
[I 2026-06-06 18:54:00,951] Trial 45 finished with value: 0.7782163320181942 and parameters: {'n_estimators': 250, 'max_depth': 7, 'min_samples_split': 15, 'min_samples_leaf': 15, 'max_features': 'log2'}. Best is trial 45 with value: 0.7782163320181942.
[I 2026-06-06 18:54:19,651] Trial 44 finished with value: 0.7690621884921134 and parameters: {'n_estimators': 250, 'max_depth': 7, 'min_samples_split': 16, 'min_samples_leaf': 8, 'max_features': 'log2'}. Best is trial 45 with value: 0.7782163320181942.
[I 2026-06-06 18:54:21,836] Trial 46 finished with value: 0.7782163320181942 and parameters: {'n_estimators': 250, 'max_depth': 7, 'min_samples_split': 15, 'min_samples_leaf': 15, 'max_features': 'log2'}. Best is trial 45 with value: 0.7782163320181942.
[I 2026-06-06 18:56:33,777] Trial 43 finished with value: 0.7567557945702343 and parameters: {'n_estimators': 250, 'max_depth': 10, 'min_samples_split': 16, 'min_samples_leaf': 3, 'max_features': 'log2'}. Best is trial 45 with value: 0.7782163320181942.
[I 2026-06-06 19:04:52,517] Trial 49 finished with value: 0.7702485361747041 and parameters: {'n_estimators': 150, 'max_depth': 6, 'min_samples_split': 15, 'min_samples_leaf': 15, 'max_features': 'log2'}. Best is trial 45 with value: 0.7782163320181942.
[I 2026-06-06 19:07:08,694] Trial 50 finished with value: 0.7702485361747041 and parameters: {'n_estimators': 150, 'max_depth': 6, 'min_samples_split': 15, 'min_samples_leaf': 15, 'max_features': 'log2'}. Best is trial 45 with value: 0.7782163320181942.
[I 2026-06-06 19:11:34,793] Trial 47 finished with value: 0.7709542716893256 and parameters: {'n_estimators': 250, 'max_depth': 6, 'min_samples_split': 16, 'min_samples_leaf': 3, 'max_features': 'log2'}. Best is trial 45 with value: 0.7782163320181942.
[I 2026-06-06 19:11:48,645] Trial 48 finished with value: 0.7738735455984721 and parameters: {'n_estimators': 250, 'max_depth': 6, 'min_samples_split': 15, 'min_samples_leaf': 15, 'max_features': 'log2'}. Best is trial 45 with value: 0.7782163320181942.
[I 2026-06-06 19:22:23,054] Trial 51 finished with value: 0.7738735455984721 and parameters: {'n_estimators': 250, 'max_depth': 6, 'min_samples_split': 15, 'min_samples_leaf': 15, 'max_features': 'log2'}. Best is trial 45 with value: 0.7782163320181942.
[I 2026-06-06 19:29:59,273] Trial 54 finished with value: 0.7782163320181942 and parameters: {'n_estimators': 250, 'max_depth': 7, 'min_samples_split': 17, 'min_samples_leaf': 15, 'max_features': 'log2'}. Best is trial 45 with value: 0.7782163320181942.
[I 2026-06-06 19:42:47,492] Trial 55 finished with value: 0.7747394851690833 and parameters: {'n_estimators': 300, 'max_depth': 6, 'min_samples_split': 15, 'min_samples_leaf': 15, 'max_features': 'log2'}. Best is trial 45 with value: 0.7782163320181942.
