[I 2026-06-28 07:15:48,769] Trial 58 finished with value: 0.7563272456834422 and parameters: {'num_nodes': [32], 'dropout': 0.2995303447067368, 'learning_rate': 0.004416706285357084, 'batch_norm': True}. Best is trial 49 with value: 0.7684297083448339.
/scratch.hpc/luca.cotugno/Foundation_model_clinical_data/test_tabular_model.py:481: UserWarning: Choices for a categorical distribution should be a tuple of None, bool, int, float and str for persistent storage but contains [32] which is of type list.
  num_nodes  = trial.suggest_categorical("num_nodes", [[32], [64], [128], [64, 32], [128, 64]])
/scratch.hpc/luca.cotugno/Foundation_model_clinical_data/test_tabular_model.py:481: UserWarning: Choices for a categorical distribution should be a tuple of None, bool, int, float and str for persistent storage but contains [64] which is of type list.
  num_nodes  = trial.suggest_categorical("num_nodes", [[32], [64], [128], [64, 32], [128, 64]])
/scratch.hpc/luca.cotugno/Foundation_model_clinical_data/test_tabular_model.py:481: UserWarning: Choices for a categorical distribution should be a tuple of None, bool, int, float and str for persistent storage but contains [128] which is of type list.
  num_nodes  = trial.suggest_categorical("num_nodes", [[32], [64], [128], [64, 32], [128, 64]])
/scratch.hpc/luca.cotugno/Foundation_model_clinical_data/test_tabular_model.py:481: UserWarning: Choices for a categorical distribution should be a tuple of None, bool, int, float and str for persistent storage but contains [64, 32] which is of type list.
  num_nodes  = trial.suggest_categorical("num_nodes", [[32], [64], [128], [64, 32], [128, 64]])
/scratch.hpc/luca.cotugno/Foundation_model_clinical_data/test_tabular_model.py:481: UserWarning: Choices for a categorical distribution should be a tuple of None, bool, int, float and str for persistent storage but contains [128, 64] which is of type list.
  num_nodes  = trial.suggest_categorical("num_nodes", [[32], [64], [128], [64, 32], [128, 64]])

33:	[0s / 6s],		train_loss: 4.2735
53:	[0s / 7s],		train_loss: 4.2524
90:	[0s / 12s],		train_loss: 4.2057
56:	[0s / 17s],		train_loss: 4.2547
54:	[0s / 7s],		train_loss: 4.2561
34:	[0s / 6s],		train_loss: 4.3170
91:	[0s / 12s],		train_loss: 4.2089
55:	[0s / 7s],		train_loss: 4.2738
35:	[0s / 6s],		train_loss: 4.2854
92:	[0s / 12s],		train_loss: 4.2376
56:	[0s / 7s],		train_loss: 4.2572
57:	[0s / 18s],		train_loss: 4.2650
50:	[0s / 30s],		train_loss: 4.2285
42:	[0s / 46s],		train_loss: 4.2725
93:	[0s / 13s],		train_loss: 4.1928
36:	[0s / 6s],		train_loss: 4.2603
57:	[0s / 7s],		train_loss: 4.2404
94:	[0s / 13s],		train_loss: 4.2475
58:	[0s / 7s],		train_loss: 4.2465
37:	[0s / 7s],		train_loss: 4.2680
58:	[0s / 18s],		train_loss: 4.1818
95:	[0s / 13s],		train_loss: 4.2521
59:	[0s / 8s],		train_loss: 4.2483
38:	[0s / 7s],		train_loss: 4.2769
96:	[0s / 13s],		train_loss: 4.2023
60:	[0s / 8s],		train_loss: 4.2763
51:	[0s / 30s],		train_loss: 4.2406
97:	[0s / 13s],		train_loss: 4.1861
39:	[0s / 7s],		train_loss: 4.2996
61:	[0s / 8s],		train_loss: 4.2326
59:	[0s / 18s],		train_loss: 4.2511
98:	[0s / 13s],		train_loss: 4.2018
62:	[0s / 8s],		train_loss: 4.2543
40:	[0s / 7s],		train_loss: 4.2514
81:	[1s / 2m:38s],		train_loss: 4.0773
99:	[0s / 13s],		train_loss: 4.2230
63:	[0s / 8s],		train_loss: 4.2248
41:	[0s / 7s],		train_loss: 4.2577
60:	[0s / 19s],		train_loss: 4.2183
43:	[1s / 47s],		train_loss: 4.2782
52:	[0s / 31s],		train_loss: 4.2421
64:	[0s / 8s],		train_loss: 4.2593
42:	[0s / 8s],		train_loss: 4.2501
0:	[0s / 0s],		train_loss: 4.6681
65:	[0s / 9s],		train_loss: 4.2367
61:	[0s / 19s],		train_loss: 4.2065
66:	[0s / 9s],		train_loss: 4.2657
1:	[0s / 0s],		train_loss: 4.4683
43:	[0s / 8s],		train_loss: 4.2602
67:	[0s / 9s],		train_loss: 4.2749
62:	[0s / 19s],		train_loss: 4.2327
2:	[0s / 0s],		train_loss: 4.4499
53:	[0s / 32s],		train_loss: 4.2119
68:	[0s / 9s],		train_loss: 4.2710
44:	[0s / 8s],		train_loss: 4.2709
3:	[0s / 0s],		train_loss: 4.4171
69:	[0s / 9s],		train_loss: 4.2163
45:	[0s / 8s],		train_loss: 4.2440
63:	[0s / 20s],		train_loss: 4.1988
70:	[0s / 9s],		train_loss: 4.2499
4:	[0s / 0s],		train_loss: 4.3750
71:	[0s / 9s],		train_loss: 4.2608
46:	[0s / 8s],		train_loss: 4.2845
5:	[0s / 1s],		train_loss: 4.3688
72:	[0s / 9s],		train_loss: 4.2394
64:	[0s / 20s],		train_loss: 4.1990
47:	[0s / 9s],		train_loss: 4.2831
54:	[0s / 32s],		train_loss: 4.1953
44:	[1s / 48s],		train_loss: 4.2557
6:	[0s / 1s],		train_loss: 4.3507
73:	[0s / 10s],		train_loss: 4.2348
74:	[0s / 10s],		train_loss: 4.3061
48:	[0s / 9s],		train_loss: 4.2649
7:	[0s / 1s],		train_loss: 4.3589
65:	[0s / 20s],		train_loss: 4.1900
75:	[0s / 10s],		train_loss: 4.2502
8:	[0s / 1s],		train_loss: 4.3680
49:	[0s / 9s],		train_loss: 4.2714
76:	[0s / 10s],		train_loss: 4.2391
46:	[3s / 2m:40s],		train_loss: 3.8580
9:	[0s / 1s],		train_loss: 4.3539
82:	[2s / 2m:40s],		train_loss: 4.0246
77:	[0s / 10s],		train_loss: 4.2295
50:	[0s / 9s],		train_loss: 4.2602
66:	[0s / 21s],		train_loss: 4.1647
55:	[0s / 33s],		train_loss: 4.2491
78:	[0s / 10s],		train_loss: 4.2209
10:	[0s / 1s],		train_loss: 4.3320
51:	[0s / 9s],		train_loss: 4.2622
79:	[0s / 10s],		train_loss: 4.2326
67:	[0s / 21s],		train_loss: 4.1882
11:	[0s / 2s],		train_loss: 4.3176
52:	[0s / 10s],		train_loss: 4.2641
80:	[0s / 11s],		train_loss: 4.2168
12:	[0s / 2s],		train_loss: 4.3063
81:	[0s / 11s],		train_loss: 4.2303
53:	[0s / 10s],		train_loss: 4.2674
45:	[1s / 50s],		train_loss: 4.2512
68:	[0s / 21s],		train_loss: 4.1649
82:	[0s / 11s],		train_loss: 4.2482
13:	[0s / 2s],		train_loss: 4.2788
56:	[0s / 34s],		train_loss: 4.2446
83:	[0s / 11s],		train_loss: 4.2164
54:	[0s / 10s],		train_loss: 4.2556
14:	[0s / 2s],		train_loss: 4.3027
84:	[0s / 11s],		train_loss: 4.2421
69:	[0s / 22s],		train_loss: 4.1739
55:	[0s / 10s],		train_loss: 4.2597
15:	[0s / 2s],		train_loss: 4.3390
85:	[0s / 11s],		train_loss: 4.2441
16:	[0s / 3s],		train_loss: 4.2921
86:	[0s / 11s],		train_loss: 4.2467
56:	[0s / 10s],		train_loss: 4.2452
57:	[0s / 34s],		train_loss: 4.2155
70:	[0s / 22s],		train_loss: 4.1727
87:	[0s / 11s],		train_loss: 4.1884
17:	[0s / 3s],		train_loss: 4.2607
57:	[0s / 11s],		train_loss: 4.2478
88:	[0s / 12s],		train_loss: 4.2153
18:	[0s / 3s],		train_loss: 4.2762
58:	[0s / 11s],		train_loss: 4.2614
89:	[0s / 12s],		train_loss: 4.1952
71:	[0s / 22s],		train_loss: 4.1701
19:	[0s / 3s],		train_loss: 4.2511
46:	[1s / 51s],		train_loss: 4.2436
90:	[0s / 12s],		train_loss: 4.1962
59:	[0s / 11s],		train_loss: 4.2473
20:	[0s / 3s],		train_loss: 4.2662
91:	[0s / 12s],		train_loss: 4.2122
58:	[0s / 35s],		train_loss: 4.2313
72:	[0s / 23s],		train_loss: 4.2274
60:	[0s / 11s],		train_loss: 4.2311
92:	[0s / 12s],		train_loss: 4.2360
21:	[0s / 3s],		train_loss: 4.2210
83:	[2s / 2m:42s],		train_loss: 4.0038
93:	[0s / 12s],		train_loss: 4.2228
61:	[0s / 11s],		train_loss: 4.1949
22:	[0s / 4s],		train_loss: 4.2530
94:	[0s / 12s],		train_loss: 4.2238
73:	[0s / 23s],		train_loss: 4.2435
62:	[0s / 12s],		train_loss: 4.2265
23:	[0s / 4s],		train_loss: 4.2422
95:	[0s / 13s],		train_loss: 4.2233
59:	[0s / 35s],		train_loss: 4.2166
96:	[0s / 13s],		train_loss: 4.2509
24:	[0s / 4s],		train_loss: 4.2294
63:	[0s / 12s],		train_loss: 4.2502
74:	[0s / 23s],		train_loss: 4.1978
97:	[0s / 13s],		train_loss: 4.2239
25:	[0s / 4s],		train_loss: 4.2468
98:	[0s / 13s],		train_loss: 4.2558
64:	[0s / 12s],		train_loss: 4.2587
75:	[0s / 24s],		train_loss: 4.1707
26:	[0s / 4s],		train_loss: 4.2274
99:	[0s / 13s],		train_loss: 4.2510
47:	[1s / 52s],		train_loss: 4.2046
65:	[0s / 12s],		train_loss: 4.2446
60:	[0s / 36s],		train_loss: 4.2093
27:	[0s / 4s],		train_loss: 4.2408
66:	[0s / 12s],		train_loss: 4.2393
0:	[0s / 0s],		train_loss: 4.5374
76:	[0s / 24s],		train_loss: 4.1730
28:	[0s / 5s],		train_loss: 4.2028
1:	[0s / 0s],		train_loss: 4.4005
67:	[0s / 13s],		train_loss: 4.2158
29:	[0s / 5s],		train_loss: 4.1732
2:	[0s / 0s],		train_loss: 4.3801
30:	[0s / 5s],		train_loss: 4.2101
68:	[0s / 13s],		train_loss: 4.1976
77:	[0s / 24s],		train_loss: 4.2091
61:	[0s / 37s],		train_loss: 4.2252
3:	[0s / 0s],		train_loss: 4.3372
31:	[0s / 5s],		train_loss: 4.1718
84:	[1s / 2m:44s],		train_loss: 3.9740
47:	[3s / 2m:44s],		train_loss: 3.8346
4:	[0s / 0s],		train_loss: 4.3117
69:	[0s / 13s],		train_loss: 4.2485
48:	[0s / 53s],		train_loss: 4.2375
32:	[0s / 5s],		train_loss: 4.1867
5:	[0s / 0s],		train_loss: 4.3095
78:	[0s / 25s],		train_loss: 4.1807
70:	[0s / 13s],		train_loss: 4.2547
33:	[0s / 5s],		train_loss: 4.1693
6:	[0s / 1s],		train_loss: 4.2775
71:	[0s / 13s],		train_loss: 4.2158
34:	[0s / 6s],		train_loss: 4.1439
7:	[0s / 1s],		train_loss: 4.2702
62:	[0s / 37s],		train_loss: 4.2024
79:	[0s / 25s],		train_loss: 4.1960
35:	[0s / 6s],		train_loss: 4.1670
8:	[0s / 1s],		train_loss: 4.2524
72:	[0s / 14s],		train_loss: 4.2140
9:	[0s / 1s],		train_loss: 4.2229
36:	[0s / 6s],		train_loss: 4.1671
80:	[0s / 25s],		train_loss: 4.1603
73:	[0s / 14s],		train_loss: 4.2157
10:	[0s / 1s],		train_loss: 4.2659
37:	[0s / 6s],		train_loss: 4.1244
74:	[0s / 14s],		train_loss: 4.1970
11:	[0s / 1s],		train_loss: 4.2128
38:	[0s / 6s],		train_loss: 4.0940
63:	[0s / 38s],		train_loss: 4.2150
81:	[0s / 26s],		train_loss: 4.1904
12:	[0s / 1s],		train_loss: 4.2258
75:	[0s / 14s],		train_loss: 4.2073
39:	[0s / 6s],		train_loss: 4.1292
49:	[1s / 54s],		train_loss: 4.2514
13:	[0s / 2s],		train_loss: 4.2017
40:	[0s / 7s],		train_loss: 4.0846
76:	[0s / 14s],		train_loss: 4.2231
82:	[0s / 26s],		train_loss: 4.1751
14:	[0s / 2s],		train_loss: 4.1490
41:	[0s / 7s],		train_loss: 4.1462
77:	[0s / 15s],		train_loss: 4.2002
15:	[0s / 2s],		train_loss: 4.1688
42:	[0s / 7s],		train_loss: 4.1597
78:	[0s / 15s],		train_loss: 4.2025
16:	[0s / 2s],		train_loss: 4.2065
64:	[0s / 39s],		train_loss: 4.1877
43:	[0s / 7s],		train_loss: 4.1406
83:	[0s / 27s],		train_loss: 4.1390
17:	[0s / 2s],		train_loss: 4.1644
79:	[0s / 15s],		train_loss: 4.1901
44:	[0s / 7s],		train_loss: 4.0735
18:	[0s / 2s],		train_loss: 4.1104
85:	[2s / 2m:46s],		train_loss: 3.9861
45:	[0s / 7s],		train_loss: 4.0817
80:	[0s / 15s],		train_loss: 4.1872
84:	[0s / 27s],		train_loss: 4.1573
19:	[0s / 3s],		train_loss: 4.1317
46:	[0s / 8s],		train_loss: 4.0954
81:	[0s / 16s],		train_loss: 4.1759
20:	[0s / 3s],		train_loss: 4.0581
47:	[0s / 8s],		train_loss: 4.0590
65:	[0s / 39s],		train_loss: 4.1660
21:	[0s / 3s],		train_loss: 4.0552
85:	[0s / 27s],		train_loss: 4.1666
50:	[1s / 56s],		train_loss: 4.2382
82:	[0s / 16s],		train_loss: 4.1804
48:	[0s / 8s],		train_loss: 4.0834
22:	[0s / 3s],		train_loss: 4.0445
83:	[0s / 16s],		train_loss: 4.2322
49:	[0s / 8s],		train_loss: 4.0632
23:	[0s / 3s],		train_loss: 4.0263
86:	[0s / 28s],		train_loss: 4.1795
50:	[0s / 8s],		train_loss: 4.0844
84:	[0s / 16s],		train_loss: 4.2081
24:	[0s / 3s],		train_loss: 4.0178
66:	[0s / 40s],		train_loss: 4.1665
51:	[0s / 8s],		train_loss: 4.0821
25:	[0s / 4s],		train_loss: 3.9982
85:	[0s / 16s],		train_loss: 4.1839
87:	[0s / 28s],		train_loss: 4.1653
52:	[0s / 9s],		train_loss: 4.0579
26:	[0s / 4s],		train_loss: 4.0069
86:	[0s / 17s],		train_loss: 4.1730
53:	[0s / 9s],		train_loss: 4.0702
27:	[0s / 4s],		train_loss: 3.9790
87:	[0s / 17s],		train_loss: 4.1797
28:	[0s / 4s],		train_loss: 3.9775
54:	[0s / 9s],		train_loss: 4.0253
51:	[1s / 57s],		train_loss: 4.2074
88:	[0s / 28s],		train_loss: 4.1349
67:	[0s / 41s],		train_loss: 4.1805
29:	[0s / 4s],		train_loss: 3.9331
88:	[0s / 17s],		train_loss: 4.2067
55:	[0s / 9s],		train_loss: 4.0679
30:	[0s / 4s],		train_loss: 3.9337
56:	[0s / 9s],		train_loss: 4.0426
89:	[0s / 17s],		train_loss: 4.1899
89:	[0s / 29s],		train_loss: 4.1511
31:	[0s / 4s],		train_loss: 3.9144
57:	[0s / 9s],		train_loss: 4.0208
90:	[0s / 17s],		train_loss: 4.1926
32:	[0s / 5s],		train_loss: 3.8761
68:	[0s / 41s],		train_loss: 4.1902
58:	[0s / 10s],		train_loss: 4.0825
90:	[0s / 29s],		train_loss: 4.1549
91:	[0s / 18s],		train_loss: 4.1533
33:	[0s / 5s],		train_loss: 3.8814
86:	[2s / 2m:48s],		train_loss: 3.9818
59:	[0s / 10s],		train_loss: 4.0167
34:	[0s / 5s],		train_loss: 3.9370
48:	[4s / 2m:49s],		train_loss: 3.8745
92:	[0s / 18s],		train_loss: 4.1974
60:	[0s / 10s],		train_loss: 3.9922
35:	[0s / 5s],		train_loss: 3.8771
91:	[0s / 29s],		train_loss: 4.2250
61:	[0s / 10s],		train_loss: 4.0702
93:	[0s / 18s],		train_loss: 4.1857
36:	[0s / 5s],		train_loss: 3.9133
62:	[0s / 10s],		train_loss: 4.0666
94:	[0s / 18s],		train_loss: 4.1945
69:	[0s / 42s],		train_loss: 4.1827
37:	[0s / 5s],		train_loss: 3.8341
52:	[1s / 58s],		train_loss: 4.2147
92:	[0s / 30s],		train_loss: 4.1351
63:	[0s / 10s],		train_loss: 4.0138
38:	[0s / 5s],		train_loss: 3.8068
95:	[0s / 18s],		train_loss: 4.1766
64:	[0s / 10s],		train_loss: 3.9653
39:	[0s / 6s],		train_loss: 3.8685
96:	[0s / 18s],		train_loss: 4.1317
93:	[0s / 30s],		train_loss: 4.1206
65:	[0s / 11s],		train_loss: 3.9720
40:	[0s / 6s],		train_loss: 3.8525
97:	[0s / 19s],		train_loss: 4.1877
70:	[0s / 42s],		train_loss: 4.1700
66:	[0s / 11s],		train_loss: 4.0072
41:	[0s / 6s],		train_loss: 3.8267
98:	[0s / 19s],		train_loss: 4.1634
94:	[0s / 30s],		train_loss: 4.1602
42:	[0s / 6s],		train_loss: 3.8229
67:	[0s / 11s],		train_loss: 3.9638
43:	[0s / 6s],		train_loss: 3.8701
68:	[0s / 11s],		train_loss: 3.9556
99:	[0s / 19s],		train_loss: 4.1421
44:	[0s / 6s],		train_loss: 3.8116
69:	[0s / 11s],		train_loss: 4.0093
95:	[0s / 31s],		train_loss: 4.0933
53:	[1s / 59s],		train_loss: 4.2104
45:	[0s / 7s],		train_loss: 3.7918
71:	[0s / 43s],		train_loss: 4.1944
70:	[0s / 12s],		train_loss: 4.0209
0:	[0s / 0s],		train_loss: 4.6058
46:	[0s / 7s],		train_loss: 3.7612
71:	[0s / 12s],		train_loss: 3.9822
96:	[0s / 31s],		train_loss: 4.1345
47:	[0s / 7s],		train_loss: 3.7766
1:	[0s / 0s],		train_loss: 4.4657
72:	[0s / 12s],		train_loss: 3.9817
48:	[0s / 7s],		train_loss: 3.8269
73:	[0s / 12s],		train_loss: 3.9637
2:	[0s / 0s],		train_loss: 4.4266
49:	[0s / 7s],		train_loss: 3.7544
97:	[0s / 32s],		train_loss: 4.1226
74:	[0s / 12s],		train_loss: 3.9580
50:	[0s / 7s],		train_loss: 3.6904
72:	[0s / 44s],		train_loss: 4.2067
75:	[0s / 12s],		train_loss: 3.9474
3:	[0s / 1s],		train_loss: 4.3449
87:	[2s / 2m:51s],		train_loss: 3.9547
51:	[0s / 8s],		train_loss: 3.6874
76:	[0s / 13s],		train_loss: 3.9545
98:	[0s / 32s],		train_loss: 4.1174
52:	[0s / 8s],		train_loss: 3.6667
4:	[0s / 1s],		train_loss: 4.3625
77:	[0s / 13s],		train_loss: 3.9481
53:	[0s / 8s],		train_loss: 3.6292
54:	[1s / 1m:1s],		train_loss: 4.2040
78:	[0s / 13s],		train_loss: 3.9229
5:	[0s / 1s],		train_loss: 4.3396
99:	[0s / 32s],		train_loss: 4.1255
54:	[0s / 8s],		train_loss: 3.8377
73:	[0s / 45s],		train_loss: 4.1989
79:	[0s / 13s],		train_loss: 3.8919
55:	[0s / 8s],		train_loss: 3.7859
6:	[0s / 1s],		train_loss: 4.2953
80:	[0s / 13s],		train_loss: 3.9002
56:	[0s / 8s],		train_loss: 3.7550
81:	[0s / 13s],		train_loss: 3.9147
57:	[0s / 9s],		train_loss: 3.7806
7:	[0s / 2s],		train_loss: 4.2749
0:	[0s / 0s],		train_loss: 4.5946
82:	[0s / 14s],		train_loss: 3.9246
58:	[0s / 9s],		train_loss: 3.7766
8:	[0s / 2s],		train_loss: 4.2760
83:	[0s / 14s],		train_loss: 4.0090
59:	[0s / 9s],		train_loss: 3.6677
74:	[0s / 45s],		train_loss: 4.2030
60:	[0s / 9s],		train_loss: 3.6697
84:	[0s / 14s],		train_loss: 3.9438
1:	[0s / 0s],		train_loss: 4.4606
9:	[0s / 2s],		train_loss: 4.2735
61:	[0s / 9s],		train_loss: 3.6530
85:	[0s / 14s],		train_loss: 3.9162
55:	[1s / 1m:2s],		train_loss: 4.1883
62:	[0s / 9s],		train_loss: 3.6305
86:	[0s / 14s],		train_loss: 3.8989
10:	[0s / 3s],		train_loss: 4.2378
2:	[0s / 1s],		train_loss: 4.4041
63:	[0s / 10s],		train_loss: 3.6044
75:	[0s / 46s],		train_loss: 4.1515
87:	[0s / 15s],		train_loss: 3.8759
11:	[0s / 3s],		train_loss: 4.2457
64:	[0s / 10s],		train_loss: 3.6353
88:	[0s / 15s],		train_loss: 3.8744
49:	[4s / 2m:53s],		train_loss: 3.8310
65:	[0s / 10s],		train_loss: 3.6366
89:	[0s / 15s],		train_loss: 3.8901
12:	[0s / 3s],		train_loss: 4.2451
3:	[0s / 1s],		train_loss: 4.3703
66:	[0s / 10s],		train_loss: 3.5950
90:	[0s / 15s],		train_loss: 3.8822
88:	[2s / 2m:54s],		train_loss: 3.9750
67:	[0s / 10s],		train_loss: 3.5923
13:	[0s / 3s],		train_loss: 4.2086
91:	[0s / 15s],		train_loss: 3.8425
68:	[0s / 10s],		train_loss: 3.6250
76:	[0s / 47s],		train_loss: 4.2575
4:	[0s / 2s],		train_loss: 4.2946
92:	[0s / 15s],		train_loss: 3.9010
56:	[1s / 1m:3s],		train_loss: 4.2175
14:	[0s / 4s],		train_loss: 4.2033
69:	[0s / 11s],		train_loss: 3.5957
93:	[0s / 16s],		train_loss: 3.9430
70:	[0s / 11s],		train_loss: 3.6348
15:	[0s / 4s],		train_loss: 4.1564
94:	[0s / 16s],		train_loss: 3.8678
5:	[0s / 2s],		train_loss: 4.3251
71:	[0s / 11s],		train_loss: 3.6472
95:	[0s / 16s],		train_loss: 3.8775
16:	[0s / 4s],		train_loss: 4.1351
72:	[0s / 11s],		train_loss: 3.5890
77:	[0s / 48s],		train_loss: 4.1868
96:	[0s / 16s],		train_loss: 3.8382
73:	[0s / 11s],		train_loss: 3.5674
17:	[0s / 4s],		train_loss: 4.1684
6:	[0s / 3s],		train_loss: 4.3102
97:	[0s / 16s],		train_loss: 3.8928
74:	[0s / 11s],		train_loss: 3.5358
98:	[0s / 16s],		train_loss: 3.8397
18:	[0s / 5s],		train_loss: 4.1596
75:	[0s / 11s],		train_loss: 3.5502
99:	[0s / 17s],		train_loss: 3.8288
76:	[0s / 12s],		train_loss: 3.5358
7:	[0s / 3s],		train_loss: 4.3314
19:	[0s / 5s],		train_loss: 4.1280
57:	[1s / 1m:4s],		train_loss: 4.2426
77:	[0s / 12s],		train_loss: 3.5483
20:	[0s / 5s],		train_loss: 4.1121
0:	[0s / 0s],		train_loss: 4.5675
78:	[0s / 48s],		train_loss: 4.1615
78:	[0s / 12s],		train_loss: 3.5517
1:	[0s / 0s],		train_loss: 4.4562
21:	[0s / 5s],		train_loss: 4.1049
8:	[0s / 3s],		train_loss: 4.2436
79:	[0s / 12s],		train_loss: 3.5481
2:	[0s / 0s],		train_loss: 4.4460
80:	[0s / 12s],		train_loss: 3.5995
89:	[2s / 2m:56s],		train_loss: 3.9931
22:	[0s / 5s],		train_loss: 4.0978
3:	[0s / 0s],		train_loss: 4.3915
81:	[0s / 12s],		train_loss: 3.5163
23:	[0s / 6s],		train_loss: 4.0696
4:	[0s / 0s],		train_loss: 4.3876
9:	[0s / 4s],		train_loss: 4.2606
82:	[0s / 13s],		train_loss: 3.5363
5:	[0s / 0s],		train_loss: 4.3535
24:	[0s / 6s],		train_loss: 4.0518
79:	[0s / 49s],		train_loss: 4.1778
83:	[0s / 13s],		train_loss: 3.5530
6:	[0s / 1s],		train_loss: 4.3461
25:	[0s / 6s],		train_loss: 4.0575
84:	[0s / 13s],		train_loss: 3.5181
7:	[0s / 1s],		train_loss: 4.3662
10:	[0s / 4s],		train_loss: 4.2134
85:	[0s / 13s],		train_loss: 3.4803
58:	[1s / 1m:6s],		train_loss: 4.1906
26:	[0s / 6s],		train_loss: 4.0310
8:	[0s / 1s],		train_loss: 4.3693
86:	[0s / 13s],		train_loss: 3.4830
9:	[0s / 1s],		train_loss: 4.3708
27:	[0s / 6s],		train_loss: 4.0012
80:	[0s / 50s],		train_loss: 4.1493
87:	[0s / 13s],		train_loss: 3.4996
11:	[0s / 5s],		train_loss: 4.2646
10:	[0s / 1s],		train_loss: 4.3349
88:	[0s / 14s],		train_loss: 3.5222
28:	[0s / 7s],		train_loss: 4.0155
11:	[0s / 1s],		train_loss: 4.3308
89:	[0s / 14s],		train_loss: 3.4829
29:	[0s / 7s],		train_loss: 4.0269
12:	[0s / 1s],		train_loss: 4.3353
12:	[0s / 5s],		train_loss: 4.2169
90:	[0s / 14s],		train_loss: 3.5319
13:	[0s / 2s],		train_loss: 4.3302
30:	[0s / 7s],		train_loss: 3.9691
91:	[0s / 14s],		train_loss: 3.5151
14:	[0s / 2s],		train_loss: 4.3534
81:	[0s / 51s],		train_loss: 4.1434
92:	[0s / 14s],		train_loss: 3.4947
31:	[0s / 7s],		train_loss: 3.9955
13:	[0s / 5s],		train_loss: 4.2149
15:	[0s / 2s],		train_loss: 4.3314
93:	[0s / 14s],		train_loss: 3.4625
32:	[0s / 7s],		train_loss: 3.9905
16:	[0s / 2s],		train_loss: 4.3232
94:	[0s / 14s],		train_loss: 3.4402
59:	[1s / 1m:7s],		train_loss: 4.2290
17:	[0s / 2s],		train_loss: 4.3138
33:	[0s / 8s],		train_loss: 3.9661
95:	[0s / 15s],		train_loss: 3.4782
14:	[0s / 6s],		train_loss: 4.1502
18:	[0s / 2s],		train_loss: 4.3098
96:	[0s / 15s],		train_loss: 3.4782
34:	[0s / 8s],		train_loss: 3.9273
82:	[0s / 51s],		train_loss: 4.1717
19:	[0s / 3s],		train_loss: 4.3317
97:	[0s / 15s],		train_loss: 3.5159
35:	[0s / 8s],		train_loss: 3.9517
20:	[0s / 3s],		train_loss: 4.3004
98:	[0s / 15s],		train_loss: 3.4068
90:	[2s / 2m:59s],		train_loss: 3.9712
50:	[5s / 2m:59s],		train_loss: 3.8132
15:	[0s / 6s],		train_loss: 4.1663
21:	[0s / 3s],		train_loss: 4.3430
36:	[0s / 8s],		train_loss: 3.9342
99:	[0s / 15s],		train_loss: 3.4519
22:	[0s / 3s],		train_loss: 4.3242
37:	[0s / 8s],		train_loss: 3.9188
83:	[0s / 52s],		train_loss: 4.1425
23:	[0s / 3s],		train_loss: 4.3353
0:	[0s / 0s],		train_loss: 4.5726
16:	[0s / 7s],		train_loss: 4.1687
38:	[0s / 9s],		train_loss: 3.8986
24:	[0s / 3s],		train_loss: 4.3405
1:	[0s / 0s],		train_loss: 4.4229
2:	[0s / 0s],		train_loss: 4.3864
25:	[0s / 3s],		train_loss: 4.3172
39:	[0s / 9s],		train_loss: 3.8911
60:	[1s / 1m:8s],		train_loss: 4.1909
17:	[0s / 7s],		train_loss: 4.1631
3:	[0s / 0s],		train_loss: 4.3912
26:	[0s / 3s],		train_loss: 4.3113
4:	[0s / 0s],		train_loss: 4.3990
27:	[0s / 4s],		train_loss: 4.3222
40:	[0s / 9s],		train_loss: 3.8942
84:	[0s / 52s],		train_loss: 4.1321
5:	[0s / 0s],		train_loss: 4.3538
28:	[0s / 4s],		train_loss: 4.3161
18:	[0s / 7s],		train_loss: 4.1200
6:	[0s / 0s],		train_loss: 4.3657
41:	[0s / 9s],		train_loss: 3.8817
29:	[0s / 4s],		train_loss: 4.3180
7:	[0s / 1s],		train_loss: 4.3537
30:	[0s / 4s],		train_loss: 4.3066
42:	[0s / 9s],		train_loss: 3.9339
8:	[0s / 1s],		train_loss: 4.3536
31:	[0s / 4s],		train_loss: 4.2963
9:	[0s / 1s],		train_loss: 4.3451
32:	[0s / 4s],		train_loss: 4.3558
19:	[0s / 8s],		train_loss: 4.1346
43:	[0s / 10s],		train_loss: 3.9382
10:	[0s / 1s],		train_loss: 4.3548
85:	[0s / 53s],		train_loss: 4.1499
33:	[0s / 4s],		train_loss: 4.3072
61:	[1s / 1m:9s],		train_loss: 4.2395
11:	[0s / 1s],		train_loss: 4.3382
44:	[0s / 10s],		train_loss: 3.9227
34:	[0s / 5s],		train_loss: 4.3087
91:	[1s / 3m:1s],		train_loss: 3.9547
12:	[0s / 1s],		train_loss: 4.3333
20:	[0s / 8s],		train_loss: 4.0568
35:	[0s / 5s],		train_loss: 4.2904
45:	[0s / 10s],		train_loss: 3.9578
13:	[0s / 1s],		train_loss: 4.3311
36:	[0s / 5s],		train_loss: 4.2841
14:	[0s / 1s],		train_loss: 4.3243
37:	[0s / 5s],		train_loss: 4.3058
86:	[0s / 54s],		train_loss: 4.1721
46:	[0s / 10s],		train_loss: 3.9052
21:	[0s / 9s],		train_loss: 4.0744
15: