[I 2026-06-09 05:56:06,354] Trial 94 finished with value: 0.8090850980322752 and parameters: {'num_nodes': [32], 'dropout': 0.2752839487370445, 'learning_rate': 0.0011545361882238762, 'batch_norm': False}. Best is trial 86 with value: 0.8130645848060124.
/scratch.hpc/luca.cotugno/Foundation_model_clinical_data/test_tabular_model_tmp.py:476: UserWarning: Choices for a categorical distribution should be a tuple of None, bool, int, float and str for persistent storage but contains [32] which is of type list.
  num_nodes  = trial.suggest_categorical("num_nodes", [[32], [64], [128], [64, 32], [128, 64]])
/scratch.hpc/luca.cotugno/Foundation_model_clinical_data/test_tabular_model_tmp.py:476: UserWarning: Choices for a categorical distribution should be a tuple of None, bool, int, float and str for persistent storage but contains [64] which is of type list.
  num_nodes  = trial.suggest_categorical("num_nodes", [[32], [64], [128], [64, 32], [128, 64]])
/scratch.hpc/luca.cotugno/Foundation_model_clinical_data/test_tabular_model_tmp.py:476: UserWarning: Choices for a categorical distribution should be a tuple of None, bool, int, float and str for persistent storage but contains [128] which is of type list.
  num_nodes  = trial.suggest_categorical("num_nodes", [[32], [64], [128], [64, 32], [128, 64]])
/scratch.hpc/luca.cotugno/Foundation_model_clinical_data/test_tabular_model_tmp.py:476: UserWarning: Choices for a categorical distribution should be a tuple of None, bool, int, float and str for persistent storage but contains [64, 32] which is of type list.
  num_nodes  = trial.suggest_categorical("num_nodes", [[32], [64], [128], [64, 32], [128, 64]])
/scratch.hpc/luca.cotugno/Foundation_model_clinical_data/test_tabular_model_tmp.py:476: UserWarning: Choices for a categorical distribution should be a tuple of None, bool, int, float and str for persistent storage but contains [128, 64] which is of type list.
  num_nodes  = trial.suggest_categorical("num_nodes", [[32], [64], [128], [64, 32], [128, 64]])

62:	[0s / 24s],		train_loss: 2.4655
62:	[0s / 26s],		train_loss: 2.4615
52:	[0s / 51s],		train_loss: 2.4821
63:	[0s / 25s],		train_loss: 2.4679
23:	[0s / 12s],		train_loss: 2.4901
63:	[0s / 26s],		train_loss: 2.4594
64:	[0s / 25s],		train_loss: 2.4748
24:	[0s / 12s],		train_loss: 2.4878
64:	[0s / 27s],		train_loss: 2.4777
53:	[0s / 52s],		train_loss: 2.4814
65:	[0s / 25s],		train_loss: 2.4695
65:	[0s / 27s],		train_loss: 2.4644
25:	[0s / 13s],		train_loss: 2.4746
66:	[0s / 26s],		train_loss: 2.4707
66:	[0s / 27s],		train_loss: 2.4645
67:	[0s / 26s],		train_loss: 2.4612
26:	[0s / 14s],		train_loss: 2.4790
54:	[0s / 53s],		train_loss: 2.4617
67:	[0s / 28s],		train_loss: 2.4655
68:	[0s / 27s],		train_loss: 2.4855
27:	[0s / 14s],		train_loss: 2.4815
68:	[0s / 28s],		train_loss: 2.4660
69:	[0s / 27s],		train_loss: 2.4730
28:	[0s / 15s],		train_loss: 2.4785
55:	[0s / 54s],		train_loss: 2.4650
69:	[0s / 29s],		train_loss: 2.4664
70:	[0s / 27s],		train_loss: 2.4636
70:	[0s / 29s],		train_loss: 2.4599
29:	[0s / 15s],		train_loss: 2.4662
71:	[0s / 28s],		train_loss: 2.4592
71:	[0s / 30s],		train_loss: 2.4620
72:	[0s / 28s],		train_loss: 2.4720
56:	[0s / 55s],		train_loss: 2.4657
30:	[0s / 16s],		train_loss: 2.4641
72:	[0s / 30s],		train_loss: 2.4534
73:	[0s / 29s],		train_loss: 2.4632
31:	[0s / 16s],		train_loss: 2.4576
74:	[0s / 29s],		train_loss: 2.4569
73:	[0s / 30s],		train_loss: 2.4459
57:	[0s / 56s],		train_loss: 2.4644
32:	[0s / 17s],		train_loss: 2.4757
75:	[0s / 29s],		train_loss: 2.4524
74:	[0s / 31s],		train_loss: 2.4624
76:	[0s / 30s],		train_loss: 2.4635
75:	[0s / 31s],		train_loss: 2.4605
33:	[0s / 17s],		train_loss: 2.4748
58:	[0s / 57s],		train_loss: 2.4598
77:	[0s / 30s],		train_loss: 2.4648
76:	[0s / 32s],		train_loss: 2.4463
34:	[0s / 18s],		train_loss: 2.4672
78:	[0s / 30s],		train_loss: 2.4575
77:	[0s / 32s],		train_loss: 2.4526
35:	[0s / 18s],		train_loss: 2.4764
79:	[0s / 31s],		train_loss: 2.4570
59:	[0s / 58s],		train_loss: 2.4692
78:	[0s / 32s],		train_loss: 2.4450
80:	[0s / 31s],		train_loss: 2.4524
36:	[0s / 19s],		train_loss: 2.4744
79:	[0s / 33s],		train_loss: 2.4536
81:	[0s / 32s],		train_loss: 2.4595
80:	[0s / 33s],		train_loss: 2.4451
37:	[0s / 19s],		train_loss: 2.4721
60:	[0s / 59s],		train_loss: 2.4712
82:	[0s / 32s],		train_loss: 2.4613
81:	[0s / 34s],		train_loss: 2.4426
38:	[0s / 20s],		train_loss: 2.4599
83:	[0s / 32s],		train_loss: 2.4571
82:	[0s / 34s],		train_loss: 2.4530
84:	[0s / 33s],		train_loss: 2.4619
39:	[0s / 20s],		train_loss: 2.4564
61:	[0s / 1m:0s],		train_loss: 2.4648
83:	[0s / 35s],		train_loss: 2.4691
85:	[0s / 33s],		train_loss: 2.4661
40:	[0s / 21s],		train_loss: 2.4784
84:	[0s / 35s],		train_loss: 2.4554
86:	[0s / 34s],		train_loss: 2.4794
85:	[0s / 35s],		train_loss: 2.4514
87:	[0s / 34s],		train_loss: 2.4603
62:	[1s / 1m:1s],		train_loss: 2.4689
41:	[0s / 21s],		train_loss: 2.4651
86:	[0s / 36s],		train_loss: 2.4485
88:	[0s / 34s],		train_loss: 2.4457
42:	[0s / 22s],		train_loss: 2.4720
89:	[0s / 35s],		train_loss: 2.4568
87:	[0s / 36s],		train_loss: 2.4473
63:	[0s / 1m:1s],		train_loss: 2.4590
43:	[0s / 22s],		train_loss: 2.4643
90:	[0s / 35s],		train_loss: 2.4810
88:	[0s / 37s],		train_loss: 2.4543
91:	[0s / 36s],		train_loss: 2.4508
89:	[0s / 37s],		train_loss: 2.4517
44:	[0s / 23s],		train_loss: 2.4633
64:	[1s / 1m:3s],		train_loss: 2.4573
92:	[0s / 36s],		train_loss: 2.4464
90:	[0s / 38s],		train_loss: 2.4472
45:	[0s / 24s],		train_loss: 2.4723
93:	[0s / 36s],		train_loss: 2.4482
91:	[0s / 38s],		train_loss: 2.4388
46:	[0s / 24s],		train_loss: 2.4735
94:	[0s / 37s],		train_loss: 2.4669
92:	[0s / 38s],		train_loss: 2.4563
65:	[0s / 1m:4s],		train_loss: 2.4580
95:	[0s / 37s],		train_loss: 2.4621
47:	[0s / 25s],		train_loss: 2.4584
93:	[0s / 39s],		train_loss: 2.4485
96:	[0s / 38s],		train_loss: 2.4605
48:	[0s / 25s],		train_loss: 2.4623
94:	[0s / 39s],		train_loss: 2.4485
66:	[0s / 1m:4s],		train_loss: 2.4631
97:	[0s / 38s],		train_loss: 2.4525
95:	[0s / 40s],		train_loss: 2.4534
49:	[0s / 26s],		train_loss: 2.4564
98:	[0s / 38s],		train_loss: 2.4446
96:	[0s / 40s],		train_loss: 2.4338
50:	[0s / 26s],		train_loss: 2.4446
99:	[0s / 39s],		train_loss: 2.4451
67:	[1s / 1m:5s],		train_loss: 2.4477
97:	[0s / 41s],		train_loss: 2.4541
0:	[0s / 0s],		train_loss: 2.9450
51:	[0s / 27s],		train_loss: 2.4527
98:	[0s / 41s],		train_loss: 2.4543
1:	[0s / 0s],		train_loss: 2.6070
68:	[0s / 1m:6s],		train_loss: 2.4551
99:	[0s / 41s],		train_loss: 2.4546
52:	[0s / 27s],		train_loss: 2.4497
2:	[0s / 1s],		train_loss: 2.5584
53:	[0s / 28s],		train_loss: 2.4559
0:	[0s / 0s],		train_loss: 3.0103
3:	[0s / 1s],		train_loss: 2.5367
69:	[0s / 1m:7s],		train_loss: 2.4648
1:	[0s / 0s],		train_loss: 2.6492
54:	[0s / 28s],		train_loss: 2.4491
4:	[0s / 2s],		train_loss: 2.5366
2:	[0s / 1s],		train_loss: 2.6158
5:	[0s / 2s],		train_loss: 2.5200
55:	[0s / 29s],		train_loss: 2.4516
70:	[0s / 1m:8s],		train_loss: 2.4398
6:	[0s / 2s],		train_loss: 2.5165
3:	[0s / 1s],		train_loss: 2.5975
56:	[0s / 29s],		train_loss: 2.4638
7:	[0s / 3s],		train_loss: 2.5158
4:	[0s / 2s],		train_loss: 2.5618
8:	[0s / 3s],		train_loss: 2.5086
57:	[0s / 30s],		train_loss: 2.4515
5:	[0s / 2s],		train_loss: 2.5621
71:	[0s / 1m:9s],		train_loss: 2.4504
9:	[0s / 4s],		train_loss: 2.5123
6:	[0s / 2s],		train_loss: 2.5486
58:	[0s / 31s],		train_loss: 2.4549
10:	[0s / 4s],		train_loss: 2.4903
7:	[0s / 3s],		train_loss: 2.5511
59:	[0s / 31s],		train_loss: 2.4371
72:	[0s / 1m:10s],		train_loss: 2.4563
11:	[0s / 4s],		train_loss: 2.4949
8:	[0s / 3s],		train_loss: 2.5400
12:	[0s / 5s],		train_loss: 2.4987
60:	[0s / 32s],		train_loss: 2.4413
9:	[0s / 4s],		train_loss: 2.5522
13:	[0s / 5s],		train_loss: 2.4864
73:	[0s / 1m:11s],		train_loss: 2.4635
10:	[0s / 4s],		train_loss: 2.5384
61:	[0s / 32s],		train_loss: 2.4446
14:	[0s / 5s],		train_loss: 2.4798
11:	[0s / 4s],		train_loss: 2.5235
62:	[0s / 33s],		train_loss: 2.4481
15:	[0s / 6s],		train_loss: 2.4772
12:	[0s / 5s],		train_loss: 2.5404
74:	[0s / 1m:12s],		train_loss: 2.4416
16:	[0s / 6s],		train_loss: 2.4857
63:	[0s / 33s],		train_loss: 2.4406
13:	[0s / 5s],		train_loss: 2.5316
17:	[0s / 7s],		train_loss: 2.4879
64:	[0s / 34s],		train_loss: 2.4285
14:	[0s / 6s],		train_loss: 2.5183
18:	[0s / 7s],		train_loss: 2.4703
75:	[0s / 1m:13s],		train_loss: 2.4551
15:	[0s / 6s],		train_loss: 2.5233
65:	[0s / 34s],		train_loss: 2.4473
19:	[0s / 7s],		train_loss: 2.4726
16:	[0s / 6s],		train_loss: 2.5193
20:	[0s / 8s],		train_loss: 2.4820
66:	[0s / 35s],		train_loss: 2.4306
76:	[0s / 1m:14s],		train_loss: 2.4631
17:	[0s / 7s],		train_loss: 2.4983
21:	[0s / 8s],		train_loss: 2.4731
67:	[0s / 35s],		train_loss: 2.4384
18:	[0s / 7s],		train_loss: 2.5076
22:	[0s / 9s],		train_loss: 2.4775
68:	[0s / 36s],		train_loss: 2.4312
19:	[0s / 8s],		train_loss: 2.5182
23:	[0s / 9s],		train_loss: 2.4700
77:	[0s / 1m:15s],		train_loss: 2.4452
24:	[0s / 9s],		train_loss: 2.4676
20:	[0s / 8s],		train_loss: 2.5253
69:	[0s / 36s],		train_loss: 2.4212
25:	[0s / 10s],		train_loss: 2.4634
21:	[0s / 9s],		train_loss: 2.5185
78:	[0s / 1m:16s],		train_loss: 2.4566
70:	[0s / 37s],		train_loss: 2.4460
26:	[0s / 10s],		train_loss: 2.4686
22:	[0s / 9s],		train_loss: 2.5009
71:	[0s / 37s],		train_loss: 2.4338
27:	[0s / 11s],		train_loss: 2.4469
23:	[0s / 9s],		train_loss: 2.5075
79:	[0s / 1m:17s],		train_loss: 2.4464
28:	[0s / 11s],		train_loss: 2.4568
72:	[0s / 38s],		train_loss: 2.4340
24:	[0s / 10s],		train_loss: 2.5230
29:	[0s / 11s],		train_loss: 2.4460
25:	[0s / 10s],		train_loss: 2.5114
73:	[0s / 38s],		train_loss: 2.4220
30:	[0s / 12s],		train_loss: 2.4689
80:	[0s / 1m:18s],		train_loss: 2.4363
26:	[0s / 11s],		train_loss: 2.4983
74:	[0s / 39s],		train_loss: 2.4448
31:	[0s / 12s],		train_loss: 2.4488
27:	[0s / 11s],		train_loss: 2.4989
32:	[0s / 12s],		train_loss: 2.4498
75:	[0s / 39s],		train_loss: 2.4298
81:	[0s / 1m:19s],		train_loss: 2.4545
28:	[0s / 12s],		train_loss: 2.5097
33:	[0s / 13s],		train_loss: 2.4505
76:	[0s / 40s],		train_loss: 2.4460
29:	[0s / 12s],		train_loss: 2.5010
34:	[0s / 13s],		train_loss: 2.4505
30:	[0s / 12s],		train_loss: 2.4873
77:	[0s / 40s],		train_loss: 2.4284
82:	[0s / 1m:20s],		train_loss: 2.4520
35:	[0s / 14s],		train_loss: 2.4490
31:	[0s / 13s],		train_loss: 2.4944
78:	[0s / 41s],		train_loss: 2.4352
36:	[0s / 14s],		train_loss: 2.4447
32:	[0s / 13s],		train_loss: 2.4951
37:	[0s / 14s],		train_loss: 2.4462
79:	[0s / 41s],		train_loss: 2.4132
83:	[1s / 1m:21s],		train_loss: 2.4325
33:	[0s / 14s],		train_loss: 2.4972
38:	[0s / 15s],		train_loss: 2.4444
80:	[0s / 42s],		train_loss: 2.4153
34:	[0s / 14s],		train_loss: 2.4864
39:	[0s / 15s],		train_loss: 2.4415
35:	[0s / 14s],		train_loss: 2.4735
81:	[0s / 42s],		train_loss: 2.4342
84:	[0s / 1m:22s],		train_loss: 2.4528
40:	[0s / 16s],		train_loss: 2.4529
36:	[0s / 15s],		train_loss: 2.4793
41:	[0s / 16s],		train_loss: 2.4468
82:	[0s / 43s],		train_loss: 2.4226
37:	[0s / 15s],		train_loss: 2.4845
42:	[0s / 16s],		train_loss: 2.4474
85:	[0s / 1m:23s],		train_loss: 2.4450
83:	[0s / 44s],		train_loss: 2.4343
38:	[0s / 16s],		train_loss: 2.5039
43:	[0s / 17s],		train_loss: 2.4241
39:	[0s / 16s],		train_loss: 2.4731
44:	[0s / 17s],		train_loss: 2.4275
84:	[0s / 44s],		train_loss: 2.4216
45:	[0s / 18s],		train_loss: 2.4453
86:	[0s / 1m:24s],		train_loss: 2.4439
40:	[0s / 16s],		train_loss: 2.4959
85:	[0s / 45s],		train_loss: 2.4244
46:	[0s / 18s],		train_loss: 2.4699
41:	[0s / 17s],		train_loss: 2.4950
86:	[0s / 45s],		train_loss: 2.4414
47:	[0s / 18s],		train_loss: 2.4506
42:	[0s / 17s],		train_loss: 2.4757
87:	[0s / 1m:25s],		train_loss: 2.4419
48:	[0s / 19s],		train_loss: 2.4434
87:	[0s / 46s],		train_loss: 2.4392
43:	[0s / 18s],		train_loss: 2.4849
49:	[0s / 19s],		train_loss: 2.4429
44:	[0s / 18s],		train_loss: 2.4749
88:	[0s / 46s],		train_loss: 2.4355
88:	[0s / 1m:25s],		train_loss: 2.4460
50:	[0s / 20s],		train_loss: 2.4426
45:	[0s / 18s],		train_loss: 2.4844
89:	[0s / 47s],		train_loss: 2.4300
51:	[0s / 20s],		train_loss: 2.4271
46:	[0s / 19s],		train_loss: 2.4810
90:	[0s / 47s],		train_loss: 2.4229
52:	[0s / 20s],		train_loss: 2.4334
89:	[0s / 1m:26s],		train_loss: 2.4472
47:	[0s / 19s],		train_loss: 2.4832
53:	[0s / 21s],		train_loss: 2.4329
91:	[0s / 48s],		train_loss: 2.4240
48:	[0s / 20s],		train_loss: 2.4824
54:	[0s / 21s],		train_loss: 2.4342
49:	[0s / 20s],		train_loss: 2.4786
92:	[0s / 48s],		train_loss: 2.4182
90:	[1s / 1m:27s],		train_loss: 2.4371
55:	[0s / 22s],		train_loss: 2.4214
50:	[0s / 21s],		train_loss: 2.4761
56:	[0s / 22s],		train_loss: 2.4128
93:	[0s / 49s],		train_loss: 2.4369
51:	[0s / 21s],		train_loss: 2.4845
57:	[0s / 22s],		train_loss: 2.4296
91:	[0s / 1m:28s],		train_loss: 2.4269
94:	[0s / 49s],		train_loss: 2.4200
52:	[0s / 21s],		train_loss: 2.4957
58:	[0s / 23s],		train_loss: 2.4108
53:	[0s / 22s],		train_loss: 2.4720
95:	[0s / 50s],		train_loss: 2.4191
59:	[0s / 23s],		train_loss: 2.4198
54:	[0s / 22s],		train_loss: 2.4724
92:	[0s / 1m:29s],		train_loss: 2.4456
96:	[0s / 50s],		train_loss: 2.4144
60:	[0s / 24s],		train_loss: 2.4252
55:	[0s / 23s],		train_loss: 2.4848
61:	[0s / 24s],		train_loss: 2.4301
97:	[0s / 51s],		train_loss: 2.4294
56:	[0s / 23s],		train_loss: 2.4878
62:	[0s / 24s],		train_loss: 2.4323
93:	[0s / 1m:30s],		train_loss: 2.4390
98:	[0s / 51s],		train_loss: 2.4272
57:	[0s / 23s],		train_loss: 2.4713
63:	[0s / 25s],		train_loss: 2.4147
99:	[0s / 52s],		train_loss: 2.4185
58:	[0s / 24s],		train_loss: 2.4712
64:	[0s / 25s],		train_loss: 2.4301
94:	[0s / 1m:31s],		train_loss: 2.4284
65:	[0s / 26s],		train_loss: 2.4242
59:	[0s / 24s],		train_loss: 2.4853
0:	[0s / 0s],		train_loss: 3.2090
66:	[0s / 26s],		train_loss: 2.4200
60:	[0s / 25s],		train_loss: 2.4677
1:	[0s / 1s],		train_loss: 2.6516
67:	[0s / 26s],		train_loss: 2.4094
95:	[1s / 1m:32s],		train_loss: 2.4445
61:	[0s / 25s],		train_loss: 2.4745
68:	[0s / 27s],		train_loss: 2.4153
2:	[0s / 1s],		train_loss: 2.6276
62:	[0s / 26s],		train_loss: 2.4615
69:	[0s / 27s],		train_loss: 2.4278
63:	[0s / 26s],		train_loss: 2.4597
3:	[0s / 2s],		train_loss: 2.6040
96:	[1s / 1m:33s],		train_loss: 2.4358
70:	[0s / 27s],		train_loss: 2.4109
64:	[0s / 26s],		train_loss: 2.4760
4:	[0s / 2s],		train_loss: 2.5822
71:	[0s / 28s],		train_loss: 2.4194
65:	[0s / 27s],		train_loss: 2.4701
72:	[0s / 28s],		train_loss: 2.4246
5:	[0s / 3s],		train_loss: 2.5646
97:	[0s / 1m:34s],		train_loss: 2.4344
66:	[0s / 27s],		train_loss: 2.4901
73:	[0s / 29s],		train_loss: 2.4022
67:	[0s / 28s],		train_loss: 2.4748
6:	[0s / 3s],		train_loss: 2.5432
74:	[0s / 29s],		train_loss: 2.4219
68:	[0s / 28s],		train_loss: 2.4790
98:	[1s / 1m:35s],		train_loss: 2.4324
7:	[0s / 4s],		train_loss: 2.5410
75:	[0s / 30s],		train_loss: 2.4098
69:	[0s / 29s],		train_loss: 2.4798
76:	[0s / 30s],		train_loss: 2.4288
8:	[0s / 4s],		train_loss: 2.5351
70:	[0s / 29s],		train_loss: 2.4633
77:	[0s / 30s],		train_loss: 2.4227
99:	[0s / 1m:36s],		train_loss: 2.4362
9:	[0s / 5s],		train_loss: 2.5362
71:	[0s / 29s],		train_loss: 2.4666
78:	[0s / 31s],		train_loss: 2.4132
72:	[0s / 30s],		train_loss: 2.4701
10:	[0s / 5s],		train_loss: 2.5494
79:	[0s / 31s],		train_loss: 2.4293
73:	[0s / 30s],		train_loss: 2.4688
0:	[0s / 0s],		train_loss: 3.1605
80:	[0s / 32s],		train_loss: 2.4080
11:	[0s / 6s],		train_loss: 2.5119
74:	[0s / 31s],		train_loss: 2.4779
81:	[0s / 32s],		train_loss: 2.4022
12:	[0s / 6s],		train_loss: 2.5235
82:	[0s / 32s],		train_loss: 2.4038
75:	[0s / 31s],		train_loss: 2.4660
1:	[1s / 1s],		train_loss: 2.6616
13:	[0s / 7s],		train_loss: 2.5258
83:	[0s / 33s],		train_loss: 2.4127
76:	[0s / 32s],		train_loss: 2.4547
84:	[0s / 33s],		train_loss: 2.4066
14:	[0s / 7s],		train_loss: 2.5068
77:	[0s / 32s],		train_loss: 2.4644
2:	[0s / 2s],		train_loss: 2.6019
85:	[0s / 33s],		train_loss: 2.4034
78:	[0s / 32s],		train_loss: 2.4683
15:	[0s / 8s],		train_loss: 2.5083
86:	[0s / 34s],		train_loss: 2.4046
79:	[0s / 33s],		train_loss: 2.4561
16:	[0s / 9s],		train_loss: 2.5124
87:	[0s / 34s],		train_loss: 2.3959
80:	[0s / 33s],		train_loss: 2.4648
3:	[0s / 3s],		train_loss: 2.5720
88:	[0s / 35s],		train_loss: 2.4021
17:	[0s / 9s],		train_loss: 2.5105
81:	[0s / 34s],		train_loss: 2.4558
89:	[0s / 35s],		train_loss: 2.4024
82:	[0s / 34s],		train_loss: 2.4669
18:	[0s / 10s],		train_loss: 2.5060
4:	[0s / 4s],		train_loss: 2.5609
90:	[0s / 35s],		train_loss: 2.4055
83:	[0s / 34s],		train_loss: 2.4526
19:	[0s / 10s],		train_loss: 2.5115
91:	[0s / 36s],		train_loss: 2.4038
84:	[0s / 35s],		train_loss: 2.4593
92:	[0s / 36s],		train_loss: 2.3993
20:	[0s / 11s],		train_loss: 2.5029
5:	[0s / 5s],		train_loss: 2.5522
85:	[0s / 35s],		train_loss: 2.4648
93:	[0s / 37s],		train_loss: 2.3916
21:	[0s / 11s],		train_loss: 2.4931
86:	[0s / 36s],		train_loss: 2.4629
94:	[0s / 37s],		train_loss: 2.3955
87:	[0s / 36s],		train_loss: 2.4791
6:	[0s / 6s],		train_loss: 2.5398
22:	[0s / 12s],		train_loss: 2.4936
95:	[0s / 37s],		train_loss: 2.3879
88:	[0s / 36s],		train_loss: 2.4617
96:	[0s / 38s],		train_loss: 2.4001
23:	[0s / 12s],		train_loss: 2.5023
89:	[0s / 37s],		train_loss: 2.4662
7:	[0s / 7s],		train_loss: 2.5400
97:	[0s / 38s],		train_loss: 2.4094
24:	[0s / 13s],		train_loss: 2.4945
90:	[0s / 37s],		train_loss: 2.4664
98:	[0s / 39s],		train_loss: 2.3910
25:	[0s / 13s],		train_loss: 2.4786
91:	[0s / 38s],		train_loss: 2.4640
99:	[0s / 39s],		train_loss: 2.4076
8:	[1s / 8s],		train_loss: 2.5342
92:	[0s / 38s],		train_loss: 2.4811
26:	[0s / 14s],		train_loss: 2.4831
0:	[0s / 0s],		train_loss: 2.9402
93:	[0s / 39s],		train_loss: 2.4572
1:	[0s / 0s],		train_loss: 2.6385
27:	[0s / 14s],		train_loss: 2.4850
94:	[0s / 39s],		train_loss: 2.4763
9:	[1s / 9s],		train_loss: 2.5255
2:	[0s / 1s],		train_loss: 2.5997
28:	[0s / 15s],		train_loss: 2.4840
95:	[0s / 39s],		train_loss: 2.4641
3:	[0s / 1s],		train_loss: 2.5777
96:	[0s / 40s],		train_loss: 2.4787
29:	[0s / 15s],		train_loss: 2.4869
4:	[0s / 1s],		train_loss: 2.5542
10:	[0s / 10s],		train_loss: 2.5335
97:	[0s / 40s],		train_loss: 2.4524
5:	[0s / 2s],		train_loss: 2.5387
30:	[0s / 16s],		train_loss: 2.4817
6:	[0s / 2s],		train_loss: 2.5471
98:	[0s / 41s],		train_loss: 2.4567
31:	[0s / 16s],		train_loss: 2.4856
11:	[0s / 11s],		train_loss: 2.5241
7:	[0s / 3s],		train_loss: 2.5248
99:	[0s / 41s],		train_loss: 2.4845
32:	[0s / 17s],		train_loss: 2.4887
8:	[0s / 3s],		train_loss: 2.5329
0:	[0s / 0s],		train_loss: 2.9556
12:	[0s / 12s],		train_loss: 2.5193
9:	[0s / 3s],		train_loss: 2.5497
33:	[0s / 18s],		train_loss: 2.4757
1:	[0s / 0s],		train_loss: 2.6257
10:	[0s / 4s],		train_loss: 2.5290
2:	[0s / 1s],		train_loss: 2.6038
34:	[0s / 18s],		train_loss: 2.4797
13:	[0s / 13s],		train_loss: 2.5163
11:	[0s / 4s],		train_loss: 2.5346
3:	[0s / 1s],		train_loss: 2.5723
35:	[0s / 19s],		train_loss: 2.4939
12:	[0s / 5s],		train_loss: 2.5247
4:	[0s / 2s],		train_loss: 2.5617
13:	[0s / 5s],		train_loss: 2.5275
36:	[0s / 19s],		train_loss: 2.4826
14:	[0s / 14s],		train_loss: 2.5155
5:	[0s / 2s],		train_loss: 2.5420
14:	[0s / 5s],		train_loss: 2.5156
37:	[0s / 20s],		train_loss: 2.4967
6:	[0s / 2s],		train_loss: 2.5391
15:	[0s / 6s],		train_loss: 2.5164
15:	[0s / 15s],		train_loss: 2.5272
7:	[0s / 3s],		train_loss: 2.5434
38:	[0s / 20s],		train_loss: 2.4692
16:	[0s / 6s],		train_loss: 2.5020
8:	[0s / 3s],		train_loss: 2.5381
17:	[0s / 7s],		train_loss: 2.5203
39:	[0s / 21s],		train_loss: 2.4968
9:	[0s / 4s],		train_loss: 2.5199
16:	[0s / 16s],		train_loss: 2.5294
18:	[0s / 7s],		train_loss: 2.5305
40:	[0s / 21s],		train_loss: 2.4860
10:	[0s / 4s],		train_loss: 2.5275
19:	[0s / 7s],		train_loss: 2.5173
41:	[0s / 22s],		train_loss: 2.4644
11:	[0s / 4s],		train_loss: 2.5338
20:	[0s / 8s],		train_loss: 2.4919
17:	[0s / 17s],		train_loss: 2.5110
12:	[0s / 5s],		train_loss: 2.5317
21:	[0s / 8s],		train_loss: 2.5070
42:	[0s / 22s],		train_loss: 2.4748
13:	[0s / 5s],		train_loss: 2.5312
22:	[0s / 9s],		train_loss: 2.5270
43:	[0s / 23s],		train_loss: 2.4890
18:	[0s / 18s],		train_loss: 2.5102
23:	[0s / 9s],		train_loss: 2.5110
14:	[0s / 6s],		train_loss: 2.5253
44:	[0s / 23s],		train_loss: 2.4684
24:	[0s / 9s],		train_loss: 2.5048
15:	[0s / 6s],		train_loss: 2.5146
25:	[0s / 10s],		train_loss: 2.5005
45:	[0s / 24s],		train_loss: 2.4870
16:	[0s / 7s],		train_loss: 2.5258
19:	[1s / 19s],		train_loss: 2.5193
26:	[0s / 10s],		train_loss: 2.5103
17:	[0s / 7s],		train_loss: 2.5185
46:	[0s / 24s],		train_loss: 2.4658
27:	[0s / 11s],		train_loss: 2.5158
18:	[0s / 7s],		train_loss: 2.5158
47:	[0s / 25s],		train_loss: 2.4709
28:	[0s / 11s],		train_loss: 2.5150
20:	[0s / 20s],		train_loss: 2.5194
19:	[0s / 8s],		train_loss: 2.5024
29:	[0s / 11s],		train_loss: 2.4897
48:	[0s / 25s],		train_loss: 2.4725
20:	[0s / 8s],		train_loss: 2.5279
30:	[0s / 12s],		train_loss: 2.4712
49:	[0s / 26s],		train_loss: 2.4724
21:	[0s / 21s],		train_loss: 2.5132
21:	[0s / 9s],		train_loss: 2.5074
31:	[0s / 12s],		train_loss: 2.5054
22:	[0s / 9s],		train_loss: 2.5013
50:	[0s / 26s],		train_loss: 2.4651
32:	[0s / 13s],		train_loss: 2.4972
23:	[0s / 9s],		train_loss: 2.5045
22:	[0s / 22s],		train_loss: 2.5128
51:	[0s / 27s],		train_loss: 2.4640
33:	[0s / 13s],		train_loss: 2.4990
24:	[0s / 10s],		train_loss: 2.4915
34:	[0s / 13s],		train_loss: 2.4954
52:	[0s / 27s],		train_loss: 2.4641
25:	[0s / 10s],		train_loss: 2.5132
35:	[0s / 14s],		train_loss: 2.4885
23:	[0s / 22s],		train_loss: 2.5083
53:	[0s / 28s],		train_loss: 2.4643
26:	[0s / 11s],		train_loss: 2.5023
36:	[0s / 14s],		train_loss: 2.4903
54:	[0s / 28s],		train_loss: 2.4576
27:	[0s / 11s],		train_loss: 2.5056
37:	[0s / 14s],		train_loss: 2.4820
24:	[0s / 23s],		train_loss: 2.5016
28:	[0s / 12s],		train_loss: 2.5170
38:	[0s / 15s],		train_loss: 2.4850
55:	[0s / 29s],		train_loss: 2.4639
29:	[0s / 12s],		train_loss: 2.4905
39:	[0s / 15s],		train_loss: 2.4803
56:	[0s / 29s],		train_loss: 2.4463
40:	[0s / 16s],		train_loss: 2.4786
30:	[0s / 12s],		train_loss: 2.4951
25:	[0s / 24s],		train_loss: 2.4931
57:	[0s / 30s],		train_loss: 2.4567
41