[I 2026-07-01 05:11:12,599] Trial 78 finished with value: 0.7456086883184593 and parameters: {'num_nodes': [32], 'dropout': 0.2596028951354185, 'learning_rate': 0.009329495012064757, 'batch_norm': False}. Best is trial 71 with value: 0.7771644125494526.
/scratch.hpc/luca.cotugno/Foundation_model_clinical_data/test_tabular_model.py:481: UserWarning: Choices for a categorical distribution should be a tuple of None, bool, int, float and str for persistent storage but contains [32] which is of type list.
  num_nodes  = trial.suggest_categorical("num_nodes", [[32], [64], [128], [64, 32], [128, 64]])
/scratch.hpc/luca.cotugno/Foundation_model_clinical_data/test_tabular_model.py:481: UserWarning: Choices for a categorical distribution should be a tuple of None, bool, int, float and str for persistent storage but contains [64] which is of type list.
  num_nodes  = trial.suggest_categorical("num_nodes", [[32], [64], [128], [64, 32], [128, 64]])
/scratch.hpc/luca.cotugno/Foundation_model_clinical_data/test_tabular_model.py:481: UserWarning: Choices for a categorical distribution should be a tuple of None, bool, int, float and str for persistent storage but contains [128] which is of type list.
  num_nodes  = trial.suggest_categorical("num_nodes", [[32], [64], [128], [64, 32], [128, 64]])
/scratch.hpc/luca.cotugno/Foundation_model_clinical_data/test_tabular_model.py:481: UserWarning: Choices for a categorical distribution should be a tuple of None, bool, int, float and str for persistent storage but contains [64, 32] which is of type list.
  num_nodes  = trial.suggest_categorical("num_nodes", [[32], [64], [128], [64, 32], [128, 64]])
/scratch.hpc/luca.cotugno/Foundation_model_clinical_data/test_tabular_model.py:481: UserWarning: Choices for a categorical distribution should be a tuple of None, bool, int, float and str for persistent storage but contains [128, 64] which is of type list.
  num_nodes  = trial.suggest_categorical("num_nodes", [[32], [64], [128], [64, 32], [128, 64]])

18:	[2s / 41s],		train_loss: 4.1980
47:	[0s / 9s],		train_loss: 4.0716
40:	[0s / 6s],		train_loss: 4.2870
85:	[0s / 58s],		train_loss: 3.5431
4:	[0s / 1s],		train_loss: 4.5701
26:	[0s / 3s],		train_loss: 4.4069
41:	[0s / 6s],		train_loss: 4.2876
48:	[0s / 9s],		train_loss: 4.0766
27:	[0s / 4s],		train_loss: 4.3921
42:	[0s / 6s],		train_loss: 4.2660
28:	[0s / 4s],		train_loss: 4.3936
49:	[0s / 9s],		train_loss: 4.0666
5:	[0s / 2s],		train_loss: 4.5753
43:	[0s / 6s],		train_loss: 4.2998
29:	[0s / 4s],		train_loss: 4.3352
44:	[0s / 6s],		train_loss: 4.2657
50:	[0s / 9s],		train_loss: 4.0399
30:	[0s / 4s],		train_loss: 4.3456
86:	[0s / 58s],		train_loss: 3.5805
17:	[1s / 21s],		train_loss: 4.3939
45:	[0s / 7s],		train_loss: 4.2691
31:	[0s / 4s],		train_loss: 4.3487
51:	[0s / 10s],		train_loss: 4.0365
6:	[0s / 2s],		train_loss: 4.5166
46:	[0s / 7s],		train_loss: 4.2732
32:	[0s / 4s],		train_loss: 4.3680
52:	[0s / 10s],		train_loss: 4.0004
33:	[0s / 4s],		train_loss: 4.3801
47:	[0s / 7s],		train_loss: 4.2826
7:	[0s / 2s],		train_loss: 4.4951
53:	[0s / 10s],		train_loss: 4.0293
34:	[0s / 5s],		train_loss: 4.3320
48:	[0s / 7s],		train_loss: 4.2574
87:	[0s / 59s],		train_loss: 3.5642
35:	[0s / 5s],		train_loss: 4.3536
54:	[0s / 10s],		train_loss: 4.0019
49:	[0s / 7s],		train_loss: 4.2669
36:	[0s / 5s],		train_loss: 4.3458
8:	[0s / 3s],		train_loss: 4.5097
50:	[0s / 7s],		train_loss: 4.2588
55:	[0s / 10s],		train_loss: 4.0203
37:	[0s / 5s],		train_loss: 4.3392
18:	[1s / 22s],		train_loss: 4.4057
51:	[0s / 7s],		train_loss: 4.2458
56:	[0s / 11s],		train_loss: 3.9802
38:	[0s / 5s],		train_loss: 4.3421
19:	[1s / 43s],		train_loss: 4.2156
52:	[0s / 8s],		train_loss: 4.2709
9:	[0s / 3s],		train_loss: 4.4994
57:	[0s / 11s],		train_loss: 3.9930
88:	[0s / 1m:0s],		train_loss: 3.5567
39:	[0s / 5s],		train_loss: 4.3290
53:	[0s / 8s],		train_loss: 4.2537
40:	[0s / 5s],		train_loss: 4.3152
58:	[0s / 11s],		train_loss: 3.9821
54:	[0s / 8s],		train_loss: 4.2383
41:	[0s / 6s],		train_loss: 4.3269
10:	[0s / 3s],		train_loss: 4.4762
55:	[0s / 8s],		train_loss: 4.2504
59:	[0s / 11s],		train_loss: 3.9774
42:	[0s / 6s],		train_loss: 4.3132
64:	[3s / 4m:34s],		train_loss: 4.1304
56:	[0s / 8s],		train_loss: 4.2660
60:	[0s / 11s],		train_loss: 3.9721
43:	[0s / 6s],		train_loss: 4.3203
57:	[0s / 8s],		train_loss: 4.2409
11:	[0s / 4s],		train_loss: 4.4535
89:	[0s / 1m:0s],		train_loss: 3.5366
61:	[0s / 11s],		train_loss: 3.9464
44:	[0s / 6s],		train_loss: 4.3012
58:	[0s / 9s],		train_loss: 4.2193
45:	[0s / 6s],		train_loss: 4.3327
19:	[1s / 23s],		train_loss: 4.3997
62:	[0s / 12s],		train_loss: 3.9381
59:	[0s / 9s],		train_loss: 4.2024
46:	[0s / 6s],		train_loss: 4.3048
12:	[0s / 4s],		train_loss: 4.4636
60:	[0s / 9s],		train_loss: 4.2212
63:	[0s / 12s],		train_loss: 3.9342
47:	[0s / 6s],		train_loss: 4.3002
61:	[0s / 9s],		train_loss: 4.2240
64:	[0s / 12s],		train_loss: 3.9420
48:	[0s / 7s],		train_loss: 4.3270
13:	[0s / 4s],		train_loss: 4.4577
90:	[0s / 1m:1s],		train_loss: 3.5856
62:	[0s / 9s],		train_loss: 4.2135
49:	[0s / 7s],		train_loss: 4.3166
65:	[0s / 12s],		train_loss: 3.9301
63:	[0s / 9s],		train_loss: 4.1955
50:	[0s / 7s],		train_loss: 4.2907
66:	[0s / 12s],		train_loss: 3.9362
64:	[0s / 9s],		train_loss: 4.2066
14:	[0s / 5s],		train_loss: 4.4377
51:	[0s / 7s],		train_loss: 4.2893
65:	[0s / 10s],		train_loss: 4.2213
67:	[0s / 13s],		train_loss: 3.9455
52:	[0s / 7s],		train_loss: 4.2808
66:	[0s / 10s],		train_loss: 4.2101
91:	[0s / 1m:2s],		train_loss: 3.5562
53:	[0s / 7s],		train_loss: 4.2891
68:	[0s / 13s],		train_loss: 3.8909
15:	[0s / 5s],		train_loss: 4.4295
20:	[2s / 45s],		train_loss: 4.1937
20:	[1s / 24s],		train_loss: 4.3898
67:	[0s / 10s],		train_loss: 4.2052
54:	[0s / 7s],		train_loss: 4.3175
69:	[0s / 13s],		train_loss: 3.8897
68:	[0s / 10s],		train_loss: 4.1876
55:	[0s / 8s],		train_loss: 4.2754
70:	[0s / 13s],		train_loss: 3.8981
16:	[0s / 6s],		train_loss: 4.4404
69:	[0s / 10s],		train_loss: 4.2024
56:	[0s / 8s],		train_loss: 4.2826
70:	[0s / 10s],		train_loss: 4.2208
57:	[0s / 8s],		train_loss: 4.2921
71:	[0s / 13s],		train_loss: 3.8988
92:	[0s / 1m:2s],		train_loss: 3.5328
71:	[0s / 10s],		train_loss: 4.1945
58:	[0s / 8s],		train_loss: 4.2687
17:	[0s / 6s],		train_loss: 4.4049
72:	[0s / 14s],		train_loss: 3.8925
59:	[0s / 8s],		train_loss: 4.2720
72:	[0s / 11s],		train_loss: 4.1917
73:	[0s / 14s],		train_loss: 3.8750
60:	[0s / 8s],		train_loss: 4.2670
73:	[0s / 11s],		train_loss: 4.1935
18:	[0s / 6s],		train_loss: 4.4035
21:	[1s / 25s],		train_loss: 4.3779
61:	[0s / 8s],		train_loss: 4.2649
74:	[0s / 11s],		train_loss: 4.1713
74:	[0s / 14s],		train_loss: 3.8745
93:	[0s / 1m:3s],		train_loss: 3.5455
62:	[0s / 9s],		train_loss: 4.2598
75:	[0s / 11s],		train_loss: 4.1744
75:	[0s / 14s],		train_loss: 3.8499
19:	[0s / 7s],		train_loss: 4.3994
63:	[0s / 9s],		train_loss: 4.2608
76:	[0s / 11s],		train_loss: 4.2109
64:	[0s / 9s],		train_loss: 4.2612
76:	[0s / 14s],		train_loss: 3.8390
77:	[0s / 11s],		train_loss: 4.1678
20:	[0s / 7s],		train_loss: 4.3810
65:	[0s / 9s],		train_loss: 4.2319
77:	[0s / 15s],		train_loss: 3.8412
78:	[0s / 12s],		train_loss: 4.1788
94:	[0s / 1m:3s],		train_loss: 3.4945
66:	[0s / 9s],		train_loss: 4.2651
79:	[0s / 12s],		train_loss: 4.1614
78:	[0s / 15s],		train_loss: 3.8713
67:	[0s / 9s],		train_loss: 4.2397
21:	[0s / 7s],		train_loss: 4.3702
80:	[0s / 12s],		train_loss: 4.1749
68:	[0s / 9s],		train_loss: 4.2663
79:	[0s / 15s],		train_loss: 3.8280
81:	[0s / 12s],		train_loss: 4.1668
21:	[2s / 47s],		train_loss: 4.1911
22:	[1s / 26s],		train_loss: 4.3883
69:	[0s / 10s],		train_loss: 4.2559
80:	[0s / 15s],		train_loss: 3.8163
22:	[0s / 8s],		train_loss: 4.3467
82:	[0s / 12s],		train_loss: 4.1732
70:	[0s / 10s],		train_loss: 4.2225
95:	[0s / 1m:4s],		train_loss: 3.5250
81:	[0s / 15s],		train_loss: 3.8398
83:	[0s / 12s],		train_loss: 4.1530
71:	[0s / 10s],		train_loss: 4.2530
84:	[0s / 12s],		train_loss: 4.1465
23:	[0s / 8s],		train_loss: 4.3866
82:	[0s / 15s],		train_loss: 3.8196
72:	[0s / 10s],		train_loss: 4.2185
85:	[0s / 13s],		train_loss: 4.1396
73:	[0s / 10s],		train_loss: 4.2346
83:	[0s / 16s],		train_loss: 3.8164
65:	[4s / 4m:39s],		train_loss: 4.1516
86:	[0s / 13s],		train_loss: 4.1745
74:	[0s / 10s],		train_loss: 4.2153
24:	[0s / 8s],		train_loss: 4.3698
96:	[0s / 1m:5s],		train_loss: 3.5414
84:	[0s / 16s],		train_loss: 3.8130
87:	[0s / 13s],		train_loss: 4.1663
75:	[0s / 10s],		train_loss: 4.1916
23:	[0s / 27s],		train_loss: 4.3631
85:	[0s / 16s],		train_loss: 3.8082
88:	[0s / 13s],		train_loss: 4.1496
76:	[0s / 11s],		train_loss: 4.2343
25:	[0s / 9s],		train_loss: 4.3531
89:	[0s / 13s],		train_loss: 4.1264
77:	[0s / 11s],		train_loss: 4.2116
86:	[0s / 16s],		train_loss: 3.8243
90:	[0s / 13s],		train_loss: 4.1386
78:	[0s / 11s],		train_loss: 4.2223
87:	[0s / 16s],		train_loss: 3.7891
79:	[0s / 11s],		train_loss: 4.2115
91:	[0s / 13s],		train_loss: 4.1462
26:	[0s / 9s],		train_loss: 4.3696
97:	[0s / 1m:5s],		train_loss: 3.5392
80:	[0s / 11s],		train_loss: 4.1962
88:	[0s / 17s],		train_loss: 3.7408
92:	[0s / 14s],		train_loss: 4.1155
81:	[0s / 11s],		train_loss: 4.2359
93:	[0s / 14s],		train_loss: 4.1497
89:	[0s / 17s],		train_loss: 3.7620
27:	[0s / 9s],		train_loss: 4.3574
82:	[0s / 11s],		train_loss: 4.1897
94:	[0s / 14s],		train_loss: 4.1329
90:	[0s / 17s],		train_loss: 3.7638
83:	[0s / 12s],		train_loss: 4.2177
24:	[1s / 28s],		train_loss: 4.3694
22:	[2s / 49s],		train_loss: 4.1581
95:	[0s / 14s],		train_loss: 4.1201
98:	[0s / 1m:6s],		train_loss: 3.5490
28:	[0s / 9s],		train_loss: 4.3559
91:	[0s / 17s],		train_loss: 3.7583
84:	[0s / 12s],		train_loss: 4.2127
96:	[0s / 14s],		train_loss: 4.1214
85:	[0s / 12s],		train_loss: 4.1869
92:	[0s / 17s],		train_loss: 3.7232
97:	[0s / 14s],		train_loss: 4.1015
86:	[0s / 12s],		train_loss: 4.2005
29:	[0s / 10s],		train_loss: 4.3511
93:	[0s / 17s],		train_loss: 3.7514
98:	[0s / 15s],		train_loss: 4.0932
87:	[0s / 12s],		train_loss: 4.1868
99:	[0s / 1m:6s],		train_loss: 3.4814
99:	[0s / 15s],		train_loss: 4.0968
94:	[0s / 18s],		train_loss: 3.7241
88:	[0s / 12s],		train_loss: 4.1813
30:	[0s / 10s],		train_loss: 4.3454
95:	[0s / 18s],		train_loss: 3.7467
89:	[0s / 13s],		train_loss: 4.1827
0:	[0s / 0s],		train_loss: 5.3388
90:	[0s / 13s],		train_loss: 4.1939
96:	[0s / 18s],		train_loss: 3.7138
31:	[0s / 11s],		train_loss: 4.3464
25:	[1s / 29s],		train_loss: 4.3852
1:	[0s / 0s],		train_loss: 5.0065
91:	[0s / 13s],		train_loss: 4.1814
97:	[0s / 18s],		train_loss: 3.7104
2:	[0s / 0s],		train_loss: 4.7720
92:	[0s / 13s],		train_loss: 4.1696
0:	[0s / 0s],		train_loss: 5.4663
32:	[0s / 11s],		train_loss: 4.3266
98:	[0s / 19s],		train_loss: 3.7070
3:	[0s / 0s],		train_loss: 4.6536
93:	[0s / 13s],		train_loss: 4.1825
4:	[0s / 0s],		train_loss: 4.6114
99:	[0s / 19s],		train_loss: 3.7259
94:	[0s / 13s],		train_loss: 4.1807
33:	[0s / 11s],		train_loss: 4.3348
5:	[0s / 0s],		train_loss: 4.5819
95:	[0s / 13s],		train_loss: 4.1941
6:	[0s / 1s],		train_loss: 4.5486
0:	[0s / 0s],		train_loss: 5.5155
96:	[0s / 14s],		train_loss: 4.1782
1:	[0s / 1s],		train_loss: 4.9936
23:	[2s / 51s],		train_loss: 4.1724
7:	[0s / 1s],		train_loss: 4.5155
97:	[0s / 14s],		train_loss: 4.1999
34:	[0s / 12s],		train_loss: 4.3262
1:	[0s / 0s],		train_loss: 4.9185
66:	[3s / 4m:42s],		train_loss: 4.1118
8:	[0s / 1s],		train_loss: 4.5395
98:	[0s / 14s],		train_loss: 4.1841
26:	[1s / 31s],		train_loss: 4.3606
2:	[0s / 0s],		train_loss: 4.7092
9:	[0s / 1s],		train_loss: 4.4900
99:	[0s / 14s],		train_loss: 4.1669
35:	[0s / 12s],		train_loss: 4.3042
10:	[0s / 1s],		train_loss: 4.4645
3:	[0s / 0s],		train_loss: 4.6363
2:	[0s / 1s],		train_loss: 4.7665
11:	[0s / 1s],		train_loss: 4.4941
0:	[0s / 0s],		train_loss: 6.1639
4:	[0s / 0s],		train_loss: 4.5665
12:	[0s / 1s],		train_loss: 4.4687
1:	[0s / 0s],		train_loss: 5.2937
36:	[0s / 12s],		train_loss: 4.3423
5:	[0s / 1s],		train_loss: 4.5294
2:	[0s / 0s],		train_loss: 4.8939
13:	[0s / 2s],		train_loss: 4.4627
3:	[0s / 0s],		train_loss: 4.6952
14:	[0s / 2s],		train_loss: 4.4504
6:	[0s / 1s],		train_loss: 4.5363
37:	[0s / 13s],		train_loss: 4.2999
3:	[0s / 2s],		train_loss: 4.6187
4:	[0s / 0s],		train_loss: 4.6521
15:	[0s / 2s],		train_loss: 4.4579
27:	[0s / 32s],		train_loss: 4.3615
7:	[0s / 1s],		train_loss: 4.5175
5:	[0s / 0s],		train_loss: 4.5790
16:	[0s / 2s],		train_loss: 4.4180
8:	[0s / 1s],		train_loss: 4.4990
6:	[0s / 0s],		train_loss: 4.5446
38:	[0s / 13s],		train_loss: 4.2963
17:	[0s / 2s],		train_loss: 4.4604
24:	[1s / 53s],		train_loss: 4.1449
7:	[0s / 1s],		train_loss: 4.5132
9:	[0s / 1s],		train_loss: 4.5122
18:	[0s / 2s],		train_loss: 4.4271
4:	[0s / 2s],		train_loss: 4.5951
8:	[0s / 1s],		train_loss: 4.5305
19:	[0s / 3s],		train_loss: 4.3880
39:	[0s / 13s],		train_loss: 4.3057
10:	[0s / 2s],		train_loss: 4.5007
9:	[0s / 1s],		train_loss: 4.5091
20:	[0s / 3s],		train_loss: 4.4189
10:	[0s / 1s],		train_loss: 4.5162
11:	[0s / 2s],		train_loss: 4.4662
28:	[0s / 33s],		train_loss: 4.3513
21:	[0s / 3s],		train_loss: 4.3912
11:	[0s / 1s],		train_loss: 4.5034
40:	[0s / 14s],		train_loss: 4.2880
22:	[0s / 3s],		train_loss: 4.3999
12:	[0s / 2s],		train_loss: 4.4850
5:	[0s / 3s],		train_loss: 4.5521
12:	[0s / 1s],		train_loss: 4.4736
23:	[0s / 3s],		train_loss: 4.3659
13:	[0s / 2s],		train_loss: 4.4385
13:	[0s / 1s],		train_loss: 4.4701
41:	[0s / 14s],		train_loss: 4.3089
24:	[0s / 3s],		train_loss: 4.3571
14:	[0s / 2s],		train_loss: 4.4659
14:	[0s / 2s],		train_loss: 4.4660
25:	[0s / 3s],		train_loss: 4.3794
15:	[0s / 2s],		train_loss: 4.4622
26:	[0s / 4s],		train_loss: 4.3623
16:	[0s / 2s],		train_loss: 4.4475
42:	[0s / 14s],		train_loss: 4.3036
15:	[0s / 3s],		train_loss: 4.4407
27:	[0s / 4s],		train_loss: 4.3507
6:	[0s / 4s],		train_loss: 4.5127
17:	[0s / 2s],		train_loss: 4.4421
29:	[0s / 33s],		train_loss: 4.3573
16:	[0s / 3s],		train_loss: 4.4462
28:	[0s / 4s],		train_loss: 4.3630
18:	[0s / 2s],		train_loss: 4.4506
67:	[3s / 4m:46s],		train_loss: 4.1097
43:	[0s / 15s],		train_loss: 4.2931
17:	[0s / 3s],		train_loss: 4.4382
29:	[0s / 4s],		train_loss: 4.3402
19:	[0s / 2s],		train_loss: 4.4224
25:	[1s / 55s],		train_loss: 4.1117
18:	[0s / 3s],		train_loss: 4.3997
30:	[0s / 4s],		train_loss: 4.3457
20:	[0s / 2s],		train_loss: 4.4461
7:	[0s / 4s],		train_loss: 4.4956
44:	[0s / 15s],		train_loss: 4.2698
21:	[0s / 3s],		train_loss: 4.4187
31:	[0s / 4s],		train_loss: 4.3459
19:	[0s / 3s],		train_loss: 4.4003
22:	[0s / 3s],		train_loss: 4.3841
32:	[0s / 5s],		train_loss: 4.3455
20:	[0s / 4s],		train_loss: 4.4000
23:	[0s / 3s],		train_loss: 4.4173
33:	[0s / 5s],		train_loss: 4.3254
45:	[0s / 16s],		train_loss: 4.2839
24:	[0s / 3s],		train_loss: 4.4399
21:	[0s / 4s],		train_loss: 4.4117
30:	[0s / 34s],		train_loss: 4.3462
34:	[0s / 5s],		train_loss: 4.3142
8:	[0s / 5s],		train_loss: 4.4833
25:	[0s / 3s],		train_loss: 4.3665
35:	[0s / 5s],		train_loss: 4.3344
22:	[0s / 4s],		train_loss: 4.3876
46:	[0s / 16s],		train_loss: 4.2725
26:	[0s / 3s],		train_loss: 4.3994
36:	[0s / 5s],		train_loss: 4.2678
23:	[0s / 4s],		train_loss: 4.4048
27:	[0s / 3s],		train_loss: 4.3910
37:	[0s / 5s],		train_loss: 4.3251
28:	[0s / 4s],		train_loss: 4.3827
24:	[0s / 4s],		train_loss: 4.3762
47:	[0s / 16s],		train_loss: 4.2960
38:	[0s / 5s],		train_loss: 4.3056
29:	[0s / 4s],		train_loss: 4.3869
39:	[0s / 5s],		train_loss: 4.3032
25:	[0s / 5s],		train_loss: 4.3735
9:	[0s / 6s],		train_loss: 4.5029
30:	[0s / 4s],		train_loss: 4.3769
40:	[0s / 6s],		train_loss: 4.3108
48:	[0s / 16s],		train_loss: 4.2778
31:	[0s / 4s],		train_loss: 4.3712
26:	[0s / 5s],		train_loss: 4.3664
31:	[0s / 35s],		train_loss: 4.3349
41:	[0s / 6s],		train_loss: 4.3193
32:	[0s / 4s],		train_loss: 4.3427
27:	[0s / 5s],		train_loss: 4.3715
42:	[0s / 6s],		train_loss: 4.3141
26:	[1s / 56s],		train_loss: 4.1374
49:	[0s / 17s],		train_loss: 4.2620
33:	[0s / 4s],		train_loss: 4.3627
43:	[0s / 6s],		train_loss: 4.3025
28:	[0s / 5s],		train_loss: 4.3855
10:	[0s / 6s],		train_loss: 4.4626
34:	[0s / 4s],		train_loss: 4.3431
44:	[0s / 6s],		train_loss: 4.3064
35:	[0s / 5s],		train_loss: 4.3485
29:	[0s / 5s],		train_loss: 4.3493
50:	[0s / 17s],		train_loss: 4.2646
45:	[0s / 6s],		train_loss: 4.2511
36:	[0s / 5s],		train_loss: 4.3172
46:	[0s / 6s],		train_loss: 4.2820
30:	[0s / 6s],		train_loss: 4.3442
37:	[0s / 5s],		train_loss: 4.3336
47:	[0s / 7s],		train_loss: 4.2926
51:	[0s / 17s],		train_loss: 4.2697
38:	[0s / 5s],		train_loss: 4.3334
31:	[0s / 6s],		train_loss: 4.3469
11:	[0s / 7s],		train_loss: 4.4472
48:	[0s / 7s],		train_loss: 4.2602
32:	[1s / 36s],		train_loss: 4.3541
39:	[0s / 5s],		train_loss: 4.3548
32:	[0s / 6s],		train_loss: 4.3463
49:	[0s / 7s],		train_loss: 4.2762
40:	[0s / 5s],		train_loss: 4.3275
52:	[0s / 18s],		train_loss: 4.2544
33:	[0s / 6s],		train_loss: 4.3272
50:	[0s / 7s],		train_loss: 4.2846
41:	[0s / 5s],		train_loss: 4.3094
42:	[0s / 5s],		train_loss: 4.3463
51:	[0s / 7s],		train_loss: 4.2756
34:	[0s / 6s],		train_loss: 4.3262
12:	[0s / 7s],		train_loss: 4.4301
53:	[0s / 18s],		train_loss: 4.2730
43:	[0s / 6s],		train_loss: 4.3164
52:	[0s / 7s],		train_loss: 4.2530
35:	[0s / 6s],		train_loss: 4.3023
44:	[0s / 6s],		train_loss: 4.3144
53:	[0s / 7s],		train_loss: 4.2597
36:	[0s / 7s],		train_loss: 4.3349
45:	[0s / 6s],		train_loss: 4.3139
54:	[0s / 18s],		train_loss: 4.2162
54:	[0s / 8s],		train_loss: 4.2793
46:	[0s / 6s],		train_loss: 4.3196
37:	[0s / 7s],		train_loss: 4.3012
27:	[1s / 58s],		train_loss: 4.1178
68:	[3s / 4m:49s],		train_loss: 4.1041
55:	[0s / 8s],		train_loss: 4.2369
13:	[0s / 8s],		train_loss: 4.4328
33:	[1s / 38s],		train_loss: 4.3351
47:	[0s / 6s],		train_loss: 4.3137
38:	[0s / 7s],		train_loss: 4.3245
56:	[0s / 8s],		train_loss: 4.2911
55:	[0s / 19s],		train_loss: 4.2426
48:	[0s / 6s],		train_loss: 4.2882
57:	[0s / 8s],		train_loss: 4.2647
39:	[0s / 7s],		train_loss: 4.2926
49:	[0s / 6s],		train_loss: 4.3139
58:	[0s / 8s],		train_loss: 4.2386
40:	[0s / 7s],		train_loss: 4.3130
50:	[0s / 7s],		train_loss: 4.2937
56:	[0s / 19s],		train_loss: 4.2542
59:	[0s / 8s],		train_loss: 4.2605
51:	[0s / 7s],		train_loss: 4.2965
14:	[0s / 9s],		train_loss: 4.4413
41:	[0s / 8s],		train_loss: 4.3167
60:	[0s / 9s],		train_loss: 4.2438
52:	[0s / 7s],		train_loss: 4.2837
57:	[0s / 19s],		train_loss: 4.2403
42:	[0s / 8s],		train_loss: 4.3091
61:	[0s / 9s],		train_loss: 4.2529
53:	[0s / 7s],		train_loss: 4.3084
62:	[0s / 9s],		train_loss: 4.2341
43:	[0s / 8s],		train_loss: 4.3030
54:	[0s / 7s],		train_loss: 4.2650
34:	[1s / 39s],		train_loss: 4.3501
63:	[0s / 9s],		train_loss: 4.2359
55:	[0s / 7s],		train_loss: 4.2805
58:	[0s / 20s],		train_loss: 4.2328
44:	[0s / 8s],		train_loss: 4.2690
15:	[0s / 9s],		train_loss: 4.4106
64:	[0s / 9s],		train_loss: 4.2542
56:	[0s / 7s],		train_loss: 4.2794
45:	[0s / 8s],		train_loss: 4.2772
65:	[0s / 9s],		train_loss: 4.2323
57:	[0s / 8s],		train_loss: 4.2611
59:	[0s / 20s],		train_loss: 4.2398
46:	[0s / 8s],		train_loss: 4.2594
66:	[0s / 9s],		train_loss: 4.2387
58:	[0s / 8s],		train_loss: 4.2567
28:	[1s / 1m:0s],		train_loss: 4.0997
59:	[0s / 8s],		train_loss: 4.2601
67:	[0s / 10s],		train_loss: 4.2522
47:	[0s / 9s],		train_loss: 4.2783
16:	[0s / 10s],		train_loss: 4.3926
60:	[0s / 8s],		train_loss: 4.2796
60:	[0s / 21s],		train_loss: 4.2230
68:	[0s / 10s],		train_loss: 4.2252
48:	[0s / 9s],		train_loss: 4.2748
61:	[0s / 8s],		train_loss: 4.2568
69:	[0s / 10s],		train_loss: 4.2288
35:	[1s / 40s],		train_loss: 4.2975
49:	[0s / 9s],		train_loss: 4.2537
62:	[0s / 8s],		train_loss: 4.2658
61:	[0s / 21s],		train_loss: 4.2293
70:	[0s / 10s],		train_loss: 4.2081
63:	[0s / 8s],		train_loss: 4.2901
50:	[0s / 9s],		train_loss: 4.2567
17:	[0s / 10s],		train_loss: 4.3814
71:	[0s / 10s],		train_loss: 4.2429
64:	[0s / 9s],		train_loss: 4.2595
62:	[0s / 21s],		train_loss: 4.2574
51:	[0s / 10s],		train_loss: 4.2479
72:	[0s / 10s],		train_loss: 4.2183
65:	[0s / 9s],		train_loss: 4.2631
73:	[0s / 11s],		train_loss: 4.1948
52:	[0s / 10s],		train_loss: 4.2756
66:	[0s / 9s],		train_loss: 4.2712
63:	[0s / 22s],		train_loss: 4.2312
74:	[0s / 11s],		train_loss: 4.2242
67:	[0s / 9s],		train_loss: 4.2408
53:	[0s / 10s],		train_loss: 4.2809
18:	[0s / 11s],		train_loss: 4.3907
75:	[0s / 11s],		train_loss: 4.1946
36:	[1s / 41s],		train_loss: 4.3061
68:	[0s / 9s],		train_loss: 4.2409
54:	[0s / 10s],		train_loss: 4.2710
64:	[0s / 22s],		train_loss: 4.2410
76:	[0s / 11s],		train_loss: 4.2162
69:	[0s / 9s],		train_loss: 4.2207
77:	[0s / 11s],		train_loss: 4.2197
55:	[0s / 10s],		train_loss: 4.2623
70:	[0s / 10s],		train_loss: 4.2585
29:	[1s / 1m:2s],		train_loss: 4.0896
78:	[0s / 11s],		train_loss: 4.2005
65:	[0s / 22s],		train_loss: 4.2017
71:	[0s / 10s],		train_loss: 4.2194
56:	[0s / 11s],		train_loss: 4.2322
19:	[0s / 12s],		train_loss: 4.3895
79:	[0s / 12s],		train_loss: 4.2037
72:	[0s / 10s],		train_loss: 4.2491
57:	[0s / 11s],		train_loss: 4.2409
80:	[0s / 12s],		train_loss: 4.1890
73:	[0s / 10s],		train_loss: 4.2422
66:	[0s / 23s],		train_loss: 4.2288
81:	[0s / 12s],		train_loss: 4.1848
58:	[0s / 11s],		train_loss: 4.2286
74:	[0s / 10s],		train_loss: 4.2308
75:	[0s / 10s],		train_loss: 4.2262
82:	[0s / 12s],		train_loss: 4.2127
59:	[0s / 11s],		train_loss: 4.2351
67:	[0s / 23s],		train_loss: 4.2256
37:	[1s / 42s],		train_loss: 4.3042
69:	[4s / 4m:54s],		train_loss: 4.1173
76:	[0s / 10s],		train_loss: 4.2307
83:	[0s / 12s],		train_loss: 4.1625
60:	[0s / 11s],		train_loss: 4.2289
77:	[0s / 11s],		train_loss: 4.2214
20:	[0s / 12s],		train_loss: 4.3873
84:	[0s / 12s],		train_loss: 4.1932
78:	[0s / 11s],		train_loss: 4.2295
85:	[0s / 12s],		train_loss: 4.2022
61:	[0s / 12s],		train_loss: 4.2382
68:	[0s / 23s],		train_loss: 4.2307
79:	[0s / 11s],		train_loss: 4.2108
86:	[0s / 13s],		train_loss: 4.1774
62:	[0s / 12s],		train_loss: 4.1933
80:	[0s / 11s],		train_loss: 4.2005
87:	[0s / 13s],		train_loss: 4.1668
63:	[0s / 12s],		train_loss: 4.2294
69:	[0s / 24s],		train_loss: 4.2056
81:	[0s / 11s],		train_loss: 4.2266
88:	[0s / 13s],		train_loss: 4.1819
82:	[0s / 11s],		train_loss: