[I 2026-06-07 08:15:34,778] Trial 13 finished with value: 0.8060522033707737 and parameters: {'num_nodes': [64], 'dropout': 0.2967325762035158, 'learning_rate': 0.009684317183625142, 'batch_norm': False}. Best is trial 13 with value: 0.8060522033707737.
/scratch.hpc/luca.cotugno/Foundation_model_clinical_data/test_tabular_model_tmp.py:476: UserWarning: Choices for a categorical distribution should be a tuple of None, bool, int, float and str for persistent storage but contains [32] which is of type list.
  num_nodes  = trial.suggest_categorical("num_nodes", [[32], [64], [128], [64, 32], [128, 64]])
/scratch.hpc/luca.cotugno/Foundation_model_clinical_data/test_tabular_model_tmp.py:476: UserWarning: Choices for a categorical distribution should be a tuple of None, bool, int, float and str for persistent storage but contains [64] which is of type list.
  num_nodes  = trial.suggest_categorical("num_nodes", [[32], [64], [128], [64, 32], [128, 64]])
/scratch.hpc/luca.cotugno/Foundation_model_clinical_data/test_tabular_model_tmp.py:476: UserWarning: Choices for a categorical distribution should be a tuple of None, bool, int, float and str for persistent storage but contains [128] which is of type list.
  num_nodes  = trial.suggest_categorical("num_nodes", [[32], [64], [128], [64, 32], [128, 64]])
/scratch.hpc/luca.cotugno/Foundation_model_clinical_data/test_tabular_model_tmp.py:476: UserWarning: Choices for a categorical distribution should be a tuple of None, bool, int, float and str for persistent storage but contains [64, 32] which is of type list.
  num_nodes  = trial.suggest_categorical("num_nodes", [[32], [64], [128], [64, 32], [128, 64]])
/scratch.hpc/luca.cotugno/Foundation_model_clinical_data/test_tabular_model_tmp.py:476: UserWarning: Choices for a categorical distribution should be a tuple of None, bool, int, float and str for persistent storage but contains [128, 64] which is of type list.
  num_nodes  = trial.suggest_categorical("num_nodes", [[32], [64], [128], [64, 32], [128, 64]])

C-index train: 0.9519
C-index test:  0.8064
  [surv] Saved → survival_predictions/tabicl/HURRAH/NaN/seed77/fold4/tabicl_deepsurv_tuned.pkl
[Trial 0] START
[Trial 1] START
[Trial 1] fitting...
[Trial 2] START
[Trial 2] fitting...
[Trial 3] START
[Trial 3] fitting...
[Trial 0] fitting...
[Trial 2] done
[Trial 4] START
[Trial 4] fitting...
[Trial 1] done
[Trial 5] START
[Trial 5] fitting...
[Trial 4] done
[Trial 6] START
[Trial 6] fitting...
[Trial 3] done
[Trial 7] START
[Trial 7] fitting...
[Trial 6] done
[Trial 8] START
[Trial 8] fitting...
[Trial 5] done
[Trial 9] START
[Trial 9] fitting...
[Trial 0] done
[Trial 10] START
[Trial 10] fitting...
[Trial 9] done
[Trial 11] START
[Trial 11] fitting...
[Trial 7] done
[Trial 12] START
[Trial 12] fitting...
[Trial 11] done
[Trial 13] START
[Trial 13] fitting...
[Trial 10] done
[Trial 14] START
[Trial 14] fitting...
[Trial 12] done
[Trial 15] START
[Trial 15] fitting...
[Trial 14] done
[Trial 16] START
[Trial 16] fitting...
[Trial 13] done
[Trial 17] START
[Trial 17] fitting...
[Trial 8] done
[Trial 18] START
[Trial 18] fitting...
[Trial 15] done
[Trial 19] START
[Trial 19] fitting...
[Trial 18] done
[Trial 20] START
[Trial 20] fitting...
[Trial 16] done
[Trial 21] START
[Trial 21] fitting...
[Trial 17] done
[Trial 22] START
[Trial 22] fitting...
[Trial 19] done
[Trial 23] START
[Trial 23] fitting...
[Trial 20] done
[Trial 24] START
[Trial 24] fitting...
[Trial 21] done
[Trial 25] START
[Trial 25] fitting...
[Trial 22] done
[Trial 26] START
[Trial 26] fitting...
[Trial 23] done
[Trial 27] START
[Trial 27] fitting...
[Trial 24] done
[Trial 28] START
[Trial 28] fitting...
[Trial 25] done
[Trial 29] START
[Trial 29] fitting...
[Trial 26] done
[Trial 30] START
[Trial 30] fitting...
[Trial 27] done
[Trial 31] START
[Trial 31] fitting...
[Trial 28] done
[Trial 32] START
[Trial 32] fitting...
[Trial 30] done
[Trial 33] START
[Trial 33] fitting...
[Trial 29] done
[Trial 34] START
[Trial 34] fitting...
[Trial 31] done
[Trial 35] START
[Trial 35] fitting...
[Trial 32] done
[Trial 36] START
[Trial 36] fitting...
[Trial 33] done
[Trial 37] START
[Trial 37] fitting...
[Trial 34] done
[Trial 38] START
[Trial 38] fitting...
[Trial 36] done
[Trial 39] START
[Trial 39] fitting...
[Trial 35] done
[Trial 37] done
[Trial 40] START
[Trial 40] fitting...
[Trial 41] START
[Trial 41] fitting...
[Trial 38] done
[Trial 42] START
[Trial 42] fitting...
[Trial 39] done
[Trial 43] START
[Trial 43] fitting...
[Trial 43] done
[Trial 44] START
[Trial 44] fitting...
[Trial 42] done
[Trial 45] START
[Trial 45] fitting...
[Trial 44] done
[Trial 46] START
[Trial 46] fitting...
[Trial 41] done
[Trial 47] START
[Trial 47] fitting...
[Trial 40] done
[Trial 48] START
[Trial 48] fitting...
[Trial 45] done
[Trial 49] START
[Trial 49] fitting...
[Trial 46] done
[Trial 50] START
[Trial 50] fitting...
[Trial 47] done
[Trial 51] START
[Trial 51] fitting...
[Trial 48] done
[Trial 52] START
[Trial 52] fitting...
[Trial 49] done
[Trial 53] START
[Trial 53] fitting...
[Trial 50] done
[Trial 54] START
[Trial 54] fitting...
[Trial 51] done
[Trial 55] START
[Trial 55] fitting...
[Trial 53] done
[Trial 56] START
[Trial 56] fitting...
[Trial 52] done
[Trial 57] START
[Trial 57] fitting...
[Trial 54] done
[Trial 58] START
[Trial 58] fitting...
[Trial 55] done
[Trial 59] START
[Trial 59] fitting...
[Trial 56] done
[Trial 60] START
[Trial 60] fitting...
[Trial 57] done
[Trial 61] START
[Trial 61] fitting...
[Trial 58] done
[Trial 62] START
[Trial 62] fitting...
[Trial 60] done
[Trial 63] START
[Trial 63] fitting...
[Trial 59] done
[Trial 64] START
[Trial 64] fitting...
[Trial 61] done
[Trial 65] START
[Trial 65] fitting...
[Trial 62] done
[Trial 66] START
[Trial 66] fitting...
[Trial 63] done
[Trial 67] START
[Trial 67] fitting...
[Trial 64] done
[Trial 68] START
[Trial 68] fitting...
[Trial 65] done
[Trial 66] done
[Trial 69] START
[Trial 69] fitting...
[Trial 70] START
[Trial 70] fitting...
[Trial 67] done
[Trial 71] START
[Trial 71] fitting...
[Trial 68] done
[Trial 72] START
[Trial 72] fitting...
[Trial 70] done
[Trial 73] START
[Trial 73] fitting...
[Trial 71] done
[Trial 74] START
[Trial 74] fitting...
[Trial 69] done
[Trial 75] START
[Trial 75] fitting...
[Trial 72] done
[Trial 76] START
[Trial 76] fitting...
[Trial 74] done
[Trial 77] START
[Trial 77] fitting...
[Trial 73] done
[Trial 78] START
[Trial 78] fitting...
[Trial 75] done
[Trial 79] START
[Trial 79] fitting...
[Trial 76] done
[Trial 80] START
[Trial 80] fitting...
[Trial 77] done
[Trial 81] START
[Trial 81] fitting...
[Trial 78] done
[Trial 82] START
[Trial 82] fitting...
[Trial 79] done
[Trial 83] START
[Trial 83] fitting...
[Trial 80] done
[Trial 84] START
[Trial 84] fitting...
[Trial 81] done
[Trial 85] START
[Trial 85] fitting...
[Trial 82] done
[Trial 86] START
[Trial 86] fitting...
[Trial 83] done
[Trial 87] START
[Trial 87] fitting...
[Trial 85] done
[Trial 88] START
[Trial 88] fitting...
[Trial 86] done
[Trial 89] START
[Trial 89] fitting...
[Trial 84] done
[Trial 90] START
[Trial 90] fitting...
[Trial 87] done
[Trial 91] START
[Trial 91] fitting...
[Trial 88] done
[Trial 92] START
[Trial 92] fitting...
[Trial 89] done
[Trial 93] START
[Trial 93] fitting...
[Trial 90] done
[Trial 94] START
[Trial 94] fitting...
[Trial 91] done
[Trial 95] START
[Trial 95] fitting...
[Trial 93] done
[Trial 96] START
[Trial 96] fitting...
[Trial 92] done
[Trial 97] START
[Trial 97] fitting...
[Trial 94] done
[Trial 98] START
[Trial 98] fitting...
[Trial 95] done
[Trial 99] START
[Trial 99] fitting...
[Trial 97] done
[Trial 96] done
[Trial 98] done
[Trial 99] done
  [ckpt] Params saved → checkpoints/tabicl/HURRAH/NaN/seed77/fold4/tabicl_rsf_tuned_params.json
  [ckpt] TABICL RSF Tuned saved → checkpoints/tabicl/HURRAH/NaN/seed77/fold4/tabicl_rsf_tuned.pkl
C-index train: 0.9769
C-index test:  0.7300
  [surv] Saved → survival_predictions/tabicl/HURRAH/NaN/seed77/fold4/tabicl_rsf_tuned.pkl
  [ckpt] Loading DeepSurv Simple from checkpoints/tabicl/HURRAH/NaN/seed77/fold4/tabicl_deepsurv_simple.pt
C-index TRAIN: 0.9469
C-index TEST:  0.7303
  [ckpt] Loading DeepSurv Vanilla from checkpoints/tabicl/HURRAH/NaN/seed77/fold4/tabicl_deepsurv_vanilla.pt
C-index TRAIN: 0.9474
C-index TEST:  0.7626
  [ckpt] Loading TABICL RSF from checkpoints/tabicl/HURRAH/NaN/seed77/fold4/tabicl_rsf.pkl
C-index train: 0.9572
C-index test:  0.6730
  [ckpt] Loading TABICL Cox (embedding) from checkpoints/tabicl/HURRAH/NaN/seed77/fold4/tabicl_tab_cox.pkl
C-index train: 0.9489
C-index test:  0.7380
X_train shape: (13567, 61), X_test shape: (3391, 61)
Generating TABICL Embeddings...
Warming up TabICL model (triggering checkpoint load)...
ARRIVATO QUI 1
Loading TabICL model checkpoint 'tabicl-classifier-v1.1-0506.ckpt'...
ARRIVATO QUI
Performing dummy prediction to ensure model is loaded...
Warming up TabICL model (triggering checkpoint load)...
ARRIVATO QUI 1
Loading TabICL model checkpoint 'tabicl-classifier-v1.1-0506.ckpt'...
ARRIVATO QUI
Performing dummy prediction to ensure model is loaded...
Successfully generated embeddings with shape: (13567, 512)
0:	[0s / 0s],		train_loss: 3.6084
0:	[0s / 0s],		train_loss: 3.0645
0:	[0s / 0s],		train_loss: 2.8922
0:	[0s / 0s],		train_loss: 2.9384
1:	[0s / 0s],		train_loss: 2.9442
2:	[0s / 1s],		train_loss: 2.8823
1:	[0s / 1s],		train_loss: 2.6133
1:	[0s / 1s],		train_loss: 2.6067
1:	[0s / 1s],		train_loss: 2.7172
3:	[0s / 1s],		train_loss: 2.8288
2:	[0s / 1s],		train_loss: 2.5629
4:	[0s / 2s],		train_loss: 2.7804
3:	[0s / 2s],		train_loss: 2.5409
2:	[0s / 2s],		train_loss: 2.5662
2:	[0s / 2s],		train_loss: 2.6496
5:	[0s / 2s],		train_loss: 2.7638
4:	[0s / 2s],		train_loss: 2.5394
6:	[0s / 3s],		train_loss: 2.7574
5:	[0s / 3s],		train_loss: 2.5153
3:	[0s / 3s],		train_loss: 2.5507
3:	[0s / 3s],		train_loss: 2.6033
7:	[0s / 3s],		train_loss: 2.7462
6:	[0s / 3s],		train_loss: 2.5139
8:	[0s / 4s],		train_loss: 2.7184
4:	[1s / 4s],		train_loss: 2.5828
4:	[1s / 4s],		train_loss: 2.5194
7:	[0s / 4s],		train_loss: 2.5077
9:	[0s / 4s],		train_loss: 2.7030
8:	[0s / 4s],		train_loss: 2.5074
5:	[0s / 4s],		train_loss: 2.5382
5:	[0s / 5s],		train_loss: 2.5488
10:	[0s / 5s],		train_loss: 2.6800
9:	[0s / 5s],		train_loss: 2.4927
6:	[0s / 5s],		train_loss: 2.5364
11:	[0s / 5s],		train_loss: 2.6796
10:	[0s / 5s],		train_loss: 2.4970
6:	[0s / 5s],		train_loss: 2.5419
7:	[0s / 5s],		train_loss: 2.5101
12:	[0s / 6s],		train_loss: 2.6710
11:	[0s / 6s],		train_loss: 2.4995
8:	[0s / 6s],		train_loss: 2.5321
13:	[0s / 6s],		train_loss: 2.6568
7:	[0s / 6s],		train_loss: 2.5341
12:	[0s / 6s],		train_loss: 2.4805
9:	[0s / 6s],		train_loss: 2.5199
14:	[0s / 7s],		train_loss: 2.6714
13:	[0s / 7s],		train_loss: 2.4772
8:	[0s / 7s],		train_loss: 2.5295
10:	[0s / 7s],		train_loss: 2.4970
15:	[0s / 7s],		train_loss: 2.6585
14:	[0s / 7s],		train_loss: 2.4807
11:	[0s / 7s],		train_loss: 2.5102
16:	[0s / 8s],		train_loss: 2.6428
9:	[0s / 8s],		train_loss: 2.5210
15:	[0s / 8s],		train_loss: 2.4804
12:	[0s / 8s],		train_loss: 2.4953
17:	[0s / 8s],		train_loss: 2.6285
16:	[0s / 8s],		train_loss: 2.4745
13:	[0s / 8s],		train_loss: 2.5074
10:	[0s / 9s],		train_loss: 2.5104
18:	[0s / 9s],		train_loss: 2.6423
17:	[0s / 9s],		train_loss: 2.4713
14:	[0s / 9s],		train_loss: 2.5048
19:	[0s / 9s],		train_loss: 2.6253
18:	[0s / 9s],		train_loss: 2.4671
11:	[0s / 9s],		train_loss: 2.5004
15:	[0s / 9s],		train_loss: 2.4992
20:	[0s / 10s],		train_loss: 2.6250
19:	[0s / 10s],		train_loss: 2.4527
16:	[0s / 10s],		train_loss: 2.4961
12:	[0s / 10s],		train_loss: 2.5107
21:	[0s / 10s],		train_loss: 2.6219
20:	[0s / 10s],		train_loss: 2.4535
17:	[0s / 10s],		train_loss: 2.4872
22:	[0s / 10s],		train_loss: 2.6100
21:	[0s / 11s],		train_loss: 2.4461
18:	[0s / 11s],		train_loss: 2.4813
13:	[0s / 11s],		train_loss: 2.4982
23:	[0s / 11s],		train_loss: 2.6112
22:	[0s / 11s],		train_loss: 2.4605
19:	[0s / 11s],		train_loss: 2.4734
24:	[0s / 11s],		train_loss: 2.6189
14:	[0s / 12s],		train_loss: 2.4992
23:	[0s / 12s],		train_loss: 2.4493
20:	[0s / 12s],		train_loss: 2.4926
25:	[0s / 12s],		train_loss: 2.6025
24:	[0s / 12s],		train_loss: 2.4444
21:	[0s / 12s],		train_loss: 2.4716
15:	[0s / 12s],		train_loss: 2.4859
26:	[0s / 12s],		train_loss: 2.6312
25:	[0s / 13s],		train_loss: 2.4509
22:	[0s / 13s],		train_loss: 2.4797
27:	[0s / 13s],		train_loss: 2.6018
26:	[0s / 13s],		train_loss: 2.4486
16:	[0s / 13s],		train_loss: 2.4746
23:	[0s / 13s],		train_loss: 2.4900
28:	[0s / 13s],		train_loss: 2.6044
27:	[0s / 14s],		train_loss: 2.4514
24:	[0s / 14s],		train_loss: 2.4784
29:	[0s / 14s],		train_loss: 2.5987
17:	[0s / 14s],		train_loss: 2.4775
28:	[0s / 14s],		train_loss: 2.4473
25:	[0s / 14s],		train_loss: 2.4763
30:	[0s / 14s],		train_loss: 2.5938
29:	[0s / 15s],		train_loss: 2.4317
26:	[0s / 15s],		train_loss: 2.4857
18:	[0s / 15s],		train_loss: 2.4731
31:	[0s / 15s],		train_loss: 2.5652
30:	[0s / 15s],		train_loss: 2.4358
27:	[0s / 15s],		train_loss: 2.4719
32:	[0s / 15s],		train_loss: 2.6072
31:	[0s / 15s],		train_loss: 2.4360
19:	[0s / 16s],		train_loss: 2.4769
28:	[0s / 16s],		train_loss: 2.4742
33:	[0s / 16s],		train_loss: 2.5778
32:	[0s / 16s],		train_loss: 2.4344
29:	[0s / 16s],		train_loss: 2.4613
34:	[0s / 16s],		train_loss: 2.5664
20:	[0s / 16s],		train_loss: 2.4627
33:	[0s / 16s],		train_loss: 2.4421
30:	[0s / 17s],		train_loss: 2.4698
35:	[0s / 17s],		train_loss: 2.5585
34:	[0s / 17s],		train_loss: 2.4364
21:	[0s / 17s],		train_loss: 2.4771
31:	[0s / 17s],		train_loss: 2.4683
36:	[0s / 17s],		train_loss: 2.5613
35:	[0s / 17s],		train_loss: 2.4389
32:	[0s / 18s],		train_loss: 2.4612
37:	[0s / 18s],		train_loss: 2.5819
36:	[0s / 18s],		train_loss: 2.4313
22:	[0s / 18s],		train_loss: 2.4770
33:	[0s / 18s],		train_loss: 2.4653
38:	[0s / 18s],		train_loss: 2.5755
37:	[0s / 18s],		train_loss: 2.4370
34:	[0s / 19s],		train_loss: 2.4678
39:	[0s / 19s],		train_loss: 2.5965
23:	[0s / 19s],		train_loss: 2.4626
38:	[0s / 19s],		train_loss: 2.4287
35:	[0s / 19s],		train_loss: 2.4629
40:	[0s / 19s],		train_loss: 2.5806
39:	[0s / 19s],		train_loss: 2.4306
24:	[0s / 20s],		train_loss: 2.4646
36:	[0s / 20s],		train_loss: 2.4632
41:	[0s / 20s],		train_loss: 2.6049
40:	[0s / 20s],		train_loss: 2.4144
37:	[0s / 20s],		train_loss: 2.4557
25:	[0s / 20s],		train_loss: 2.4602
42:	[0s / 20s],		train_loss: 2.5688
41:	[0s / 20s],		train_loss: 2.4361
38:	[0s / 21s],		train_loss: 2.4564
43:	[0s / 21s],		train_loss: 2.5526
42:	[0s / 21s],		train_loss: 2.4516
26:	[0s / 21s],		train_loss: 2.4561
39:	[0s / 21s],		train_loss: 2.4512
44:	[0s / 21s],		train_loss: 2.5616
43:	[0s / 21s],		train_loss: 2.4170
40:	[0s / 22s],		train_loss: 2.4788
45:	[0s / 22s],		train_loss: 2.5707
27:	[0s / 22s],		train_loss: 2.4467
44:	[0s / 22s],		train_loss: 2.4335
41:	[0s / 22s],		train_loss: 2.4635
46:	[0s / 22s],		train_loss: 2.5882
45:	[0s / 22s],		train_loss: 2.4331
42:	[0s / 23s],		train_loss: 2.4565
28:	[0s / 23s],		train_loss: 2.4460
47:	[0s / 23s],		train_loss: 2.5443
46:	[0s / 23s],		train_loss: 2.4231
43:	[0s / 23s],		train_loss: 2.4639
48:	[0s / 23s],		train_loss: 2.5531
47:	[0s / 23s],		train_loss: 2.4259
29:	[0s / 23s],		train_loss: 2.4485
44:	[0s / 24s],		train_loss: 2.4515
49:	[0s / 24s],		train_loss: 2.5510
48:	[0s / 24s],		train_loss: 2.4155
45:	[0s / 24s],		train_loss: 2.4585
30:	[0s / 24s],		train_loss: 2.4472
50:	[0s / 24s],		train_loss: 2.5646
49:	[0s / 24s],		train_loss: 2.4318
46:	[0s / 25s],		train_loss: 2.4605
51:	[0s / 25s],		train_loss: 2.5707
50:	[0s / 25s],		train_loss: 2.4191
31:	[0s / 25s],		train_loss: 2.4456
47:	[0s / 25s],		train_loss: 2.4591
52:	[0s / 25s],		train_loss: 2.5642
51:	[0s / 25s],		train_loss: 2.4068
48:	[0s / 26s],		train_loss: 2.4605
53:	[0s / 26s],		train_loss: 2.5427
32:	[0s / 26s],		train_loss: 2.4423
52:	[0s / 26s],		train_loss: 2.4048
49:	[0s / 26s],		train_loss: 2.4557
54:	[0s / 26s],		train_loss: 2.5476
53:	[0s / 26s],		train_loss: 2.4153
33:	[0s / 26s],		train_loss: 2.4355
50:	[0s / 27s],		train_loss: 2.4524
55:	[0s / 27s],		train_loss: 2.5394
54:	[0s / 27s],		train_loss: 2.4325
51:	[0s / 27s],		train_loss: 2.4551
56:	[0s / 27s],		train_loss: 2.5478
34:	[0s / 27s],		train_loss: 2.4340
55:	[0s / 27s],		train_loss: 2.4000
52:	[0s / 27s],		train_loss: 2.4401
57:	[0s / 28s],		train_loss: 2.5297
56:	[0s / 28s],		train_loss: 2.4107
35:	[0s / 28s],		train_loss: 2.4446
53:	[0s / 28s],		train_loss: 2.4257
58:	[0s / 28s],		train_loss: 2.5366
57:	[0s / 28s],		train_loss: 2.4095
54:	[0s / 28s],		train_loss: 2.4516
59:	[0s / 29s],		train_loss: 2.5509
36:	[0s / 29s],		train_loss: 2.4333
58:	[0s / 29s],		train_loss: 2.4128
55:	[0s / 29s],		train_loss: 2.4306
60:	[0s / 29s],		train_loss: 2.5570
59:	[0s / 29s],		train_loss: 2.4096
56:	[0s / 29s],		train_loss: 2.4452
37:	[0s / 29s],		train_loss: 2.4340
61:	[0s / 30s],		train_loss: 2.5214
60:	[0s / 30s],		train_loss: 2.4156
57:	[0s / 30s],		train_loss: 2.4461
62:	[0s / 30s],		train_loss: 2.5560
61:	[0s / 30s],		train_loss: 2.4027
38:	[0s / 30s],		train_loss: 2.4221
58:	[0s / 30s],		train_loss: 2.4443
63:	[0s / 31s],		train_loss: 2.5414
62:	[0s / 31s],		train_loss: 2.4045
59:	[0s / 31s],		train_loss: 2.4373
39:	[0s / 31s],		train_loss: 2.4360
64:	[0s / 31s],		train_loss: 2.5263
63:	[0s / 31s],		train_loss: 2.4166
60:	[0s / 31s],		train_loss: 2.4436
65:	[0s / 31s],		train_loss: 2.5310
64:	[0s / 32s],		train_loss: 2.4086
40:	[0s / 32s],		train_loss: 2.4295
61:	[0s / 32s],		train_loss: 2.4372
66:	[0s / 32s],		train_loss: 2.5350
65:	[0s / 32s],		train_loss: 2.3901
62:	[0s / 32s],		train_loss: 2.4383
67:	[0s / 32s],		train_loss: 2.5424
41:	[0s / 33s],		train_loss: 2.4428
66:	[0s / 33s],		train_loss: 2.4134
63:	[0s / 33s],		train_loss: 2.4444
68:	[0s / 33s],		train_loss: 2.5470
67:	[0s / 33s],		train_loss: 2.4146
42:	[0s / 33s],		train_loss: 2.4204
64:	[0s / 33s],		train_loss: 2.4286
69:	[0s / 33s],		train_loss: 2.5150
68:	[0s / 34s],		train_loss: 2.4026
65:	[0s / 34s],		train_loss: 2.4421
70:	[0s / 34s],		train_loss: 2.5328
69:	[0s / 34s],		train_loss: 2.4018
43:	[0s / 34s],		train_loss: 2.4296
66:	[0s / 34s],		train_loss: 2.4493
71:	[0s / 34s],		train_loss: 2.5328
70:	[0s / 35s],		train_loss: 2.4178
44:	[0s / 35s],		train_loss: 2.4284
67:	[0s / 35s],		train_loss: 2.4430
72:	[0s / 35s],		train_loss: 2.5234
71:	[0s / 35s],		train_loss: 2.4173
68:	[0s / 35s],		train_loss: 2.4443
73:	[0s / 35s],		train_loss: 2.5224
72:	[0s / 36s],		train_loss: 2.4079
45:	[0s / 36s],		train_loss: 2.4337
69:	[0s / 36s],		train_loss: 2.4409
74:	[0s / 36s],		train_loss: 2.5303
73:	[0s / 36s],		train_loss: 2.4133
70:	[0s / 36s],		train_loss: 2.4262
46:	[0s / 36s],		train_loss: 2.4217
75:	[0s / 36s],		train_loss: 2.5323
74:	[0s / 36s],		train_loss: 2.4070
71:	[0s / 37s],		train_loss: 2.4421
76:	[0s / 37s],		train_loss: 2.5096
75:	[0s / 37s],		train_loss: 2.4099
47:	[0s / 37s],		train_loss: 2.4192
72:	[0s / 37s],		train_loss: 2.4582
77:	[0s / 37s],		train_loss: 2.5204
76:	[0s / 37s],		train_loss: 2.3982
73:	[0s / 38s],		train_loss: 2.4240
78:	[0s / 38s],		train_loss: 2.5169
48:	[0s / 38s],		train_loss: 2.4033
77:	[0s / 38s],		train_loss: 2.3952
74:	[0s / 38s],		train_loss: 2.4309
79:	[0s / 38s],		train_loss: 2.5246
78:	[0s / 38s],		train_loss: 2.3948
49:	[0s / 39s],		train_loss: 2.4187
75:	[0s / 39s],		train_loss: 2.4276
80:	[0s / 39s],		train_loss: 2.5237
79:	[0s / 39s],		train_loss: 2.3802
76:	[0s / 39s],		train_loss: 2.4321
81:	[0s / 39s],		train_loss: 2.5038
80:	[0s / 39s],		train_loss: 2.3989
50:	[0s / 39s],		train_loss: 2.4188
77:	[0s / 40s],		train_loss: 2.4107
82:	[0s / 40s],		train_loss: 2.4879
81:	[0s / 40s],		train_loss: 2.3933
51:	[0s / 40s],		train_loss: 2.4115
78:	[0s / 40s],		train_loss: 2.4408
83:	[0s / 40s],		train_loss: 2.5086
82:	[0s / 40s],		train_loss: 2.3801
79:	[0s / 41s],		train_loss: 2.4283
84:	[0s / 41s],		train_loss: 2.4942
83:	[0s / 41s],		train_loss: 2.4030
52:	[0s / 41s],		train_loss: 2.4157
80:	[0s / 41s],		train_loss: 2.4423
85:	[0s / 41s],		train_loss: 2.5199
84:	[0s / 41s],		train_loss: 2.3850
53:	[0s / 42s],		train_loss: 2.4092
81:	[0s / 42s],		train_loss: 2.4325
86:	[0s / 42s],		train_loss: 2.5147
85:	[0s / 42s],		train_loss: 2.3942
87:	[0s / 42s],		train_loss: 2.5077
82:	[0s / 42s],		train_loss: 2.4352
86:	[0s / 42s],		train_loss: 2.3698
54:	[0s / 42s],		train_loss: 2.4298
88:	[0s / 43s],		train_loss: 2.4831
83:	[0s / 43s],		train_loss: 2.4270
87:	[0s / 43s],		train_loss: 2.3903
55:	[0s / 43s],		train_loss: 2.4098
89:	[0s / 43s],		train_loss: 2.4967
84:	[0s / 43s],		train_loss: 2.4144
88:	[0s / 43s],		train_loss: 2.3874
90:	[0s / 44s],		train_loss: 2.4944
85:	[0s / 44s],		train_loss: 2.4283
89:	[0s / 44s],		train_loss: 2.3822
56:	[0s / 44s],		train_loss: 2.4047
91:	[0s / 44s],		train_loss: 2.4999
86:	[0s / 44s],		train_loss: 2.4226
90:	[0s / 44s],		train_loss: 2.3953
57:	[0s / 45s],		train_loss: 2.3957
92:	[0s / 45s],		train_loss: 2.4985
87:	[0s / 45s],		train_loss: 2.4122
91:	[0s / 45s],		train_loss: 2.3891
93:	[0s / 45s],		train_loss: 2.5137
88:	[0s / 45s],		train_loss: 2.4181
92:	[0s / 45s],		train_loss: 2.3816
58:	[0s / 45s],		train_loss: 2.3997
94:	[0s / 46s],		train_loss: 2.4918
89:	[0s / 46s],		train_loss: 2.4137
93:	[0s / 46s],		train_loss: 2.3675
95:	[0s / 46s],		train_loss: 2.4766
90:	[0s / 46s],		train_loss: 2.4150
59:	[0s / 46s],		train_loss: 2.3973
94:	[0s / 46s],		train_loss: 2.3765
96:	[0s / 47s],		train_loss: 2.4935
91:	[0s / 47s],		train_loss: 2.4416
95:	[0s / 47s],		train_loss: 2.3868
60:	[0s / 47s],		train_loss: 2.4067
97:	[0s / 47s],		train_loss: 2.4901
92:	[0s / 47s],		train_loss: 2.4243
96:	[0s / 47s],		train_loss: 2.3913
98:	[0s / 48s],		train_loss: 2.4954
93:	[0s / 48s],		train_loss: 2.4067
97:	[0s / 48s],		train_loss: 2.3828
61:	[0s / 48s],		train_loss: 2.3971
99:	[0s / 48s],		train_loss: 2.4707
94:	[0s / 48s],		train_loss: 2.4148
98:	[0s / 48s],		train_loss: 2.3779
95:	[0s / 49s],		train_loss: 2.4179
0:	[0s / 0s],		train_loss: 2.8914
99:	[0s / 49s],		train_loss: 2.3821
62:	[0s / 49s],		train_loss: 2.4113
1:	[0s / 0s],		train_loss: 2.59