[I 2026-06-08 20:47:11,705] Trial 19 finished with value: 0.781829387507795 and parameters: {'num_nodes': [128], 'dropout': 0.005833673061036687, 'learning_rate': 0.00010840708446402553, 'batch_norm': False}. Best is trial 12 with value: 0.8055886673378092.
/scratch.hpc/luca.cotugno/Foundation_model_clinical_data/test_tabular_model_tmp.py:476: UserWarning: Choices for a categorical distribution should be a tuple of None, bool, int, float and str for persistent storage but contains [32] which is of type list.
  num_nodes  = trial.suggest_categorical("num_nodes", [[32], [64], [128], [64, 32], [128, 64]])
/scratch.hpc/luca.cotugno/Foundation_model_clinical_data/test_tabular_model_tmp.py:476: UserWarning: Choices for a categorical distribution should be a tuple of None, bool, int, float and str for persistent storage but contains [64] which is of type list.
  num_nodes  = trial.suggest_categorical("num_nodes", [[32], [64], [128], [64, 32], [128, 64]])
/scratch.hpc/luca.cotugno/Foundation_model_clinical_data/test_tabular_model_tmp.py:476: UserWarning: Choices for a categorical distribution should be a tuple of None, bool, int, float and str for persistent storage but contains [128] which is of type list.
  num_nodes  = trial.suggest_categorical("num_nodes", [[32], [64], [128], [64, 32], [128, 64]])
/scratch.hpc/luca.cotugno/Foundation_model_clinical_data/test_tabular_model_tmp.py:476: UserWarning: Choices for a categorical distribution should be a tuple of None, bool, int, float and str for persistent storage but contains [64, 32] which is of type list.
  num_nodes  = trial.suggest_categorical("num_nodes", [[32], [64], [128], [64, 32], [128, 64]])
/scratch.hpc/luca.cotugno/Foundation_model_clinical_data/test_tabular_model_tmp.py:476: UserWarning: Choices for a categorical distribution should be a tuple of None, bool, int, float and str for persistent storage but contains [128, 64] which is of type list.
  num_nodes  = trial.suggest_categorical("num_nodes", [[32], [64], [128], [64, 32], [128, 64]])

13:	[0s / 6s],		train_loss: 2.5223
13:	[0s / 7s],		train_loss: 2.4959
14:	[0s / 7s],		train_loss: 2.5158
11:	[0s / 7s],		train_loss: 2.4754
4:	[1s / 5s],		train_loss: 2.6826
14:	[0s / 7s],		train_loss: 2.4872
15:	[0s / 7s],		train_loss: 2.5045
12:	[0s / 7s],		train_loss: 2.4949
15:	[0s / 8s],		train_loss: 2.4838
16:	[0s / 8s],		train_loss: 2.4978
5:	[1s / 6s],		train_loss: 2.6478
13:	[0s / 8s],		train_loss: 2.4814
17:	[0s / 8s],		train_loss: 2.5268
16:	[0s / 8s],		train_loss: 2.4965
14:	[0s / 8s],		train_loss: 2.4688
18:	[0s / 9s],		train_loss: 2.4888
17:	[0s / 9s],		train_loss: 2.4788
6:	[1s / 7s],		train_loss: 2.6503
19:	[0s / 9s],		train_loss: 2.4956
15:	[0s / 9s],		train_loss: 2.4759
18:	[0s / 9s],		train_loss: 2.4858
20:	[0s / 9s],		train_loss: 2.4906
19:	[0s / 10s],		train_loss: 2.4797
16:	[0s / 10s],		train_loss: 2.4673
21:	[0s / 10s],		train_loss: 2.4803
7:	[1s / 9s],		train_loss: 2.6116
20:	[0s / 10s],		train_loss: 2.4774
17:	[0s / 10s],		train_loss: 2.4602
22:	[0s / 10s],		train_loss: 2.4891
21:	[0s / 11s],		train_loss: 2.4701
18:	[0s / 11s],		train_loss: 2.4789
23:	[0s / 11s],		train_loss: 2.4899
22:	[0s / 11s],		train_loss: 2.4717
19:	[0s / 11s],		train_loss: 2.4753
24:	[0s / 11s],		train_loss: 2.4687
8:	[1s / 10s],		train_loss: 2.6178
23:	[0s / 12s],		train_loss: 2.4859
25:	[0s / 12s],		train_loss: 2.4914
20:	[0s / 12s],		train_loss: 2.4639
24:	[0s / 12s],		train_loss: 2.4720
26:	[0s / 12s],		train_loss: 2.4653
21:	[0s / 12s],		train_loss: 2.4671
25:	[0s / 13s],		train_loss: 2.4717
9:	[1s / 11s],		train_loss: 2.6377
27:	[0s / 13s],		train_loss: 2.4752
22:	[0s / 13s],		train_loss: 2.4588
26:	[0s / 13s],		train_loss: 2.4711
28:	[0s / 13s],		train_loss: 2.4600
27:	[0s / 14s],		train_loss: 2.4689
23:	[0s / 14s],		train_loss: 2.4580
10:	[1s / 12s],		train_loss: 2.6175
29:	[0s / 14s],		train_loss: 2.4675
28:	[0s / 14s],		train_loss: 2.4676
30:	[0s / 14s],		train_loss: 2.4580
24:	[0s / 14s],		train_loss: 2.4655
29:	[0s / 15s],		train_loss: 2.4863
31:	[0s / 15s],		train_loss: 2.4669
11:	[1s / 13s],		train_loss: 2.6055
25:	[0s / 15s],		train_loss: 2.4589
30:	[0s / 15s],		train_loss: 2.4694
32:	[0s / 15s],		train_loss: 2.4691
26:	[0s / 15s],		train_loss: 2.4628
33:	[0s / 16s],		train_loss: 2.4777
31:	[0s / 16s],		train_loss: 2.4509
27:	[0s / 16s],		train_loss: 2.4481
12:	[1s / 14s],		train_loss: 2.5777
34:	[0s / 16s],		train_loss: 2.4509
32:	[0s / 16s],		train_loss: 2.4761
35:	[0s / 17s],		train_loss: 2.4568
28:	[0s / 16s],		train_loss: 2.4381
33:	[0s / 17s],		train_loss: 2.4633
36:	[0s / 17s],		train_loss: 2.4473
34:	[0s / 17s],		train_loss: 2.4667
13:	[1s / 16s],		train_loss: 2.5885
29:	[0s / 17s],		train_loss: 2.4517
37:	[0s / 17s],		train_loss: 2.4550
35:	[0s / 18s],		train_loss: 2.4809
30:	[0s / 18s],		train_loss: 2.4452
38:	[0s / 18s],		train_loss: 2.4583
36:	[0s / 18s],		train_loss: 2.4703
14:	[1s / 17s],		train_loss: 2.5647
31:	[0s / 18s],		train_loss: 2.4343
39:	[0s / 18s],		train_loss: 2.4488
37:	[0s / 19s],		train_loss: 2.4581
40:	[0s / 19s],		train_loss: 2.4590
32:	[0s / 19s],		train_loss: 2.4401
38:	[0s / 19s],		train_loss: 2.4573
41:	[0s / 19s],		train_loss: 2.4538
15:	[1s / 18s],		train_loss: 2.5685
33:	[0s / 19s],		train_loss: 2.4447
39:	[0s / 20s],		train_loss: 2.4596
42:	[0s / 20s],		train_loss: 2.4454
34:	[0s / 20s],		train_loss: 2.4322
40:	[0s / 20s],		train_loss: 2.4600
43:	[0s / 20s],		train_loss: 2.4280
16:	[1s / 19s],		train_loss: 2.5707
41:	[0s / 21s],		train_loss: 2.4524
35:	[0s / 21s],		train_loss: 2.4451
44:	[0s / 21s],		train_loss: 2.4436
42:	[0s / 21s],		train_loss: 2.4485
36:	[0s / 21s],		train_loss: 2.4464
45:	[0s / 21s],		train_loss: 2.4245
17:	[1s / 20s],		train_loss: 2.5590
43:	[0s / 22s],		train_loss: 2.4554
46:	[0s / 22s],		train_loss: 2.4263
37:	[0s / 22s],		train_loss: 2.4248
44:	[0s / 22s],		train_loss: 2.4507
47:	[0s / 22s],		train_loss: 2.4348
38:	[0s / 22s],		train_loss: 2.4417
45:	[0s / 23s],		train_loss: 2.4577
18:	[1s / 21s],		train_loss: 2.5541
48:	[0s / 23s],		train_loss: 2.4365
39:	[0s / 23s],		train_loss: 2.4377
46:	[0s / 23s],		train_loss: 2.4636
49:	[0s / 23s],		train_loss: 2.4462
40:	[0s / 24s],		train_loss: 2.4299
50:	[0s / 24s],		train_loss: 2.4224
47:	[0s / 24s],		train_loss: 2.4559
19:	[1s / 22s],		train_loss: 2.5572
51:	[0s / 24s],		train_loss: 2.4212
48:	[0s / 24s],		train_loss: 2.4537
41:	[0s / 24s],		train_loss: 2.4243
52:	[0s / 25s],		train_loss: 2.4288
49:	[0s / 25s],		train_loss: 2.4445
42:	[0s / 25s],		train_loss: 2.4407
20:	[1s / 24s],		train_loss: 2.5438
53:	[0s / 25s],		train_loss: 2.4240
50:	[0s / 25s],		train_loss: 2.4304
43:	[0s / 25s],		train_loss: 2.4262
54:	[0s / 26s],		train_loss: 2.4418
51:	[0s / 26s],		train_loss: 2.4580
55:	[0s / 26s],		train_loss: 2.4288
44:	[0s / 26s],		train_loss: 2.4384
52:	[0s / 26s],		train_loss: 2.4359
21:	[1s / 25s],		train_loss: 2.5274
56:	[0s / 27s],		train_loss: 2.4261
45:	[0s / 27s],		train_loss: 2.4329
53:	[0s / 27s],		train_loss: 2.4649
57:	[0s / 27s],		train_loss: 2.4352
54:	[0s / 27s],		train_loss: 2.4321
46:	[0s / 27s],		train_loss: 2.4215
22:	[1s / 26s],		train_loss: 2.5262
58:	[0s / 27s],		train_loss: 2.4302
55:	[0s / 28s],		train_loss: 2.4447
47:	[0s / 28s],		train_loss: 2.4356
59:	[0s / 28s],		train_loss: 2.4226
56:	[0s / 28s],		train_loss: 2.4432
60:	[0s / 28s],		train_loss: 2.4215
48:	[0s / 28s],		train_loss: 2.4154
23:	[1s / 27s],		train_loss: 2.5376
57:	[0s / 29s],		train_loss: 2.4409
61:	[0s / 29s],		train_loss: 2.4352
49:	[0s / 29s],		train_loss: 2.4198
58:	[0s / 29s],		train_loss: 2.4315
62:	[0s / 29s],		train_loss: 2.3997
50:	[0s / 29s],		train_loss: 2.4270
24:	[1s / 28s],		train_loss: 2.5104
59:	[0s / 30s],		train_loss: 2.4519
63:	[0s / 30s],		train_loss: 2.4190
51:	[0s / 30s],		train_loss: 2.4177
60:	[0s / 30s],		train_loss: 2.4481
64:	[0s / 30s],		train_loss: 2.4244
61:	[0s / 31s],		train_loss: 2.4447
25:	[1s / 29s],		train_loss: 2.5068
65:	[0s / 31s],		train_loss: 2.4243
52:	[0s / 31s],		train_loss: 2.4121
62:	[0s / 31s],		train_loss: 2.4555
66:	[0s / 31s],		train_loss: 2.4193
53:	[0s / 31s],		train_loss: 2.4227
67:	[0s / 32s],		train_loss: 2.4210
63:	[0s / 32s],		train_loss: 2.4375
26:	[1s / 30s],		train_loss: 2.5185
54:	[0s / 32s],		train_loss: 2.4218
68:	[0s / 32s],		train_loss: 2.4136
64:	[0s / 32s],		train_loss: 2.4360
55:	[0s / 32s],		train_loss: 2.4314
69:	[0s / 33s],		train_loss: 2.4029
65:	[0s / 33s],		train_loss: 2.4440
27:	[1s / 31s],		train_loss: 2.5011
70:	[0s / 33s],		train_loss: 2.4234
56:	[0s / 33s],		train_loss: 2.4075
66:	[0s / 33s],		train_loss: 2.4457
71:	[0s / 34s],		train_loss: 2.4017
67:	[0s / 34s],		train_loss: 2.4418
57:	[0s / 34s],		train_loss: 2.4279
72:	[0s / 34s],		train_loss: 2.4077
28:	[1s / 33s],		train_loss: 2.4980
68:	[0s / 34s],		train_loss: 2.4378
58:	[0s / 34s],		train_loss: 2.4210
73:	[0s / 35s],		train_loss: 2.4153
69:	[0s / 35s],		train_loss: 2.4342
59:	[0s / 35s],		train_loss: 2.4140
74:	[0s / 35s],		train_loss: 2.4054
70:	[0s / 35s],		train_loss: 2.4448
29:	[1s / 34s],		train_loss: 2.5011
60:	[0s / 35s],		train_loss: 2.4232
75:	[0s / 35s],		train_loss: 2.4150
71:	[0s / 36s],		train_loss: 2.4142
76:	[0s / 36s],		train_loss: 2.4141
61:	[0s / 36s],		train_loss: 2.4181
72:	[0s / 36s],		train_loss: 2.4470
30:	[1s / 35s],		train_loss: 2.4901
77:	[0s / 36s],		train_loss: 2.4202
62:	[0s / 36s],		train_loss: 2.4071
73:	[0s / 37s],		train_loss: 2.4345
78:	[0s / 37s],		train_loss: 2.4074
63:	[0s / 37s],		train_loss: 2.4170
74:	[0s / 37s],		train_loss: 2.4437
79:	[0s / 37s],		train_loss: 2.4014
31:	[1s / 36s],		train_loss: 2.4907
64:	[0s / 38s],		train_loss: 2.4129
75:	[0s / 38s],		train_loss: 2.4548
80:	[0s / 38s],		train_loss: 2.4159
76:	[0s / 38s],		train_loss: 2.4393
65:	[0s / 38s],		train_loss: 2.4173
81:	[0s / 38s],		train_loss: 2.4089
32:	[1s / 37s],		train_loss: 2.4813
77:	[0s / 39s],		train_loss: 2.4412
82:	[0s / 39s],		train_loss: 2.4143
66:	[0s / 39s],		train_loss: 2.4065
78:	[0s / 39s],		train_loss: 2.4308
83:	[0s / 39s],		train_loss: 2.4059
67:	[0s / 39s],		train_loss: 2.4180
84:	[0s / 40s],		train_loss: 2.4044
79:	[0s / 40s],		train_loss: 2.4472
33:	[1s / 38s],		train_loss: 2.4861
68:	[0s / 40s],		train_loss: 2.3998
85:	[0s / 40s],		train_loss: 2.4073
80:	[0s / 40s],		train_loss: 2.4415
69:	[0s / 40s],		train_loss: 2.4014
86:	[0s / 41s],		train_loss: 2.4175
81:	[0s / 41s],		train_loss: 2.4365
34:	[1s / 39s],		train_loss: 2.4985
87:	[0s / 41s],		train_loss: 2.4085
70:	[0s / 41s],		train_loss: 2.3902
82:	[0s / 41s],		train_loss: 2.4348
88:	[0s / 42s],		train_loss: 2.4021
83:	[0s / 42s],		train_loss: 2.4420
71:	[0s / 42s],		train_loss: 2.4099
89:	[0s / 42s],		train_loss: 2.4079
84:	[0s / 42s],		train_loss: 2.4365
35:	[1s / 41s],		train_loss: 2.4891
72:	[0s / 42s],		train_loss: 2.4106
90:	[0s / 43s],		train_loss: 2.3919
85:	[0s / 43s],		train_loss: 2.4379
73:	[0s / 43s],		train_loss: 2.3962
91:	[0s / 43s],		train_loss: 2.3934
86:	[0s / 43s],		train_loss: 2.4472
36:	[1s / 42s],		train_loss: 2.4736
92:	[0s / 43s],		train_loss: 2.3943
74:	[0s / 43s],		train_loss: 2.4014
87:	[0s / 44s],		train_loss: 2.4227
93:	[0s / 44s],		train_loss: 2.3940
75:	[0s / 44s],		train_loss: 2.3995
88:	[0s / 44s],		train_loss: 2.4127
94:	[0s / 44s],		train_loss: 2.3904
37:	[1s / 43s],		train_loss: 2.4953
89:	[0s / 45s],		train_loss: 2.4361
76:	[0s / 45s],		train_loss: 2.3877
95:	[0s / 45s],		train_loss: 2.3948
90:	[0s / 45s],		train_loss: 2.4292
77:	[0s / 45s],		train_loss: 2.4040
96:	[0s / 45s],		train_loss: 2.3983
38:	[1s / 44s],		train_loss: 2.4735
91:	[0s / 46s],		train_loss: 2.4422
97:	[0s / 46s],		train_loss: 2.3889
78:	[0s / 46s],		train_loss: 2.3870
92:	[0s / 46s],		train_loss: 2.4267
98:	[0s / 46s],		train_loss: 2.3968
79:	[0s / 46s],		train_loss: 2.3864
39:	[1s / 45s],		train_loss: 2.4770
93:	[0s / 47s],		train_loss: 2.4355
99:	[0s / 47s],		train_loss: 2.3902
80:	[0s / 47s],		train_loss: 2.3820
94:	[0s / 47s],		train_loss: 2.4272
0:	[0s / 0s],		train_loss: 3.5078
40:	[1s / 46s],		train_loss: 2.4586
81:	[0s / 48s],		train_loss: 2.3910
95:	[0s / 48s],		train_loss: 2.4228
1:	[0s / 1s],		train_loss: 2.9543
82:	[0s / 48s],		train_loss: 2.3838
96:	[0s / 48s],		train_loss: 2.4483
2:	[0s / 1s],		train_loss: 2.8547
41:	[0s / 47s],		train_loss: 2.4741
83:	[0s / 49s],		train_loss: 2.3877
97:	[0s / 49s],		train_loss: 2.4389
3:	[0s / 2s],		train_loss: 2.8372
84:	[0s / 49s],		train_loss: 2.3806
98:	[0s / 49s],		train_loss: 2.4228
4:	[0s / 2s],		train_loss: 2.7879
42:	[1s / 48s],		train_loss: 2.4696
99:	[0s / 50s],		train_loss: 2.4179
85:	[0s / 50s],		train_loss: 2.3888
5:	[0s / 3s],		train_loss: 2.7496
86:	[0s / 51s],		train_loss: 2.4020
43:	[0s / 49s],		train_loss: 2.4623
0:	[0s / 0s],		train_loss: 2.7705
6:	[0s / 4s],		train_loss: 2.7488
87:	[0s / 51s],		train_loss: 2.3791
1:	[0s / 1s],		train_loss: 2.5924
7:	[0s / 4s],		train_loss: 2.7485
44:	[1s / 50s],		train_loss: 2.4671
88:	[0s / 52s],		train_loss: 2.3792
2:	[0s / 1s],		train_loss: 2.5805
8:	[0s / 5s],		train_loss: 2.7086
3:	[0s / 2s],		train_loss: 2.5544
89:	[0s / 53s],		train_loss: 2.3672
9:	[0s / 5s],		train_loss: 2.7330
45:	[1s / 51s],		train_loss: 2.4508
4:	[0s / 2s],		train_loss: 2.5382
90:	[0s / 53s],		train_loss: 2.3840
10:	[0s / 6s],		train_loss: 2.7334
5:	[0s / 3s],		train_loss: 2.5492
91:	[0s / 54s],		train_loss: 2.3906
46:	[0s / 52s],		train_loss: 2.4688
11:	[0s / 6s],		train_loss: 2.7262
6:	[0s / 4s],		train_loss: 2.5139
92:	[0s / 54s],		train_loss: 2.3720
12:	[0s / 7s],		train_loss: 2.7072
7:	[0s / 4s],		train_loss: 2.5241
93:	[0s / 55s],		train_loss: 2.3946
47:	[1s / 53s],		train_loss: 2.4423
13:	[0s / 8s],		train_loss: 2.6977
8:	[0s / 5s],		train_loss: 2.5095
94:	[0s / 55s],		train_loss: 2.3850
14:	[0s / 8s],		train_loss: 2.6779
48:	[1s / 54s],		train_loss: 2.4463
9:	[0s / 5s],		train_loss: 2.5094
95:	[0s / 56s],		train_loss: 2.3553
15:	[0s / 9s],		train_loss: 2.6250
10:	[0s / 6s],		train_loss: 2.5096
96:	[0s / 57s],		train_loss: 2.3822
16:	[0s / 9s],		train_loss: 2.6484
49:	[1s / 56s],		train_loss: 2.4576
11:	[0s / 6s],		train_loss: 2.4935
97:	[0s / 57s],		train_loss: 2.3789
17:	[0s / 10s],		train_loss: 2.6285
12:	[0s / 7s],		train_loss: 2.4879
98:	[0s / 58s],		train_loss: 2.3663
18:	[0s / 10s],		train_loss: 2.6431
50:	[1s / 57s],		train_loss: 2.4374
13:	[0s / 7s],		train_loss: 2.4812
99:	[0s / 58s],		train_loss: 2.3840
19:	[0s / 11s],		train_loss: 2.6383
14:	[0s / 8s],		train_loss: 2.4883
20:	[0s / 12s],		train_loss: 2.6388
51:	[1s / 58s],		train_loss: 2.4566
0:	[0s / 0s],		train_loss: 2.7862
15:	[0s / 9s],		train_loss: 2.4642
21:	[0s / 12s],		train_loss: 2.6318
16:	[0s / 9s],		train_loss: 2.4807
1:	[0s / 1s],		train_loss: 2.6448
22:	[0s / 13s],		train_loss: 2.6363
17:	[0s / 10s],		train_loss: 2.4592
52:	[1s / 59s],		train_loss: 2.4446
23:	[0s / 13s],		train_loss: 2.6668
2:	[0s / 2s],		train_loss: 2.5928
18:	[0s / 10s],		train_loss: 2.4718
24:	[0s / 14s],		train_loss: 2.6131
19:	[0s / 11s],		train_loss: 2.4711
3:	[0s / 2s],		train_loss: 2.5882
25:	[0s / 14s],		train_loss: 2.6192
53:	[1s / 1m:0s],		train_loss: 2.4523
20:	[0s / 11s],		train_loss: 2.4683
26:	[0s / 15s],		train_loss: 2.6481
4:	[0s / 3s],		train_loss: 2.5526
21:	[0s / 12s],		train_loss: 2.4609
27:	[0s / 15s],		train_loss: 2.6156
5:	[0s / 4s],		train_loss: 2.5536
54:	[1s / 1m:2s],		train_loss: 2.4482
22:	[0s / 12s],		train_loss: 2.4659
28:	[0s / 16s],		train_loss: 2.6143
23:	[0s / 13s],		train_loss: 2.4495
6:	[0s / 5s],		train_loss: 2.5353
29:	[0s / 16s],		train_loss: 2.6175
24:	[0s / 14s],		train_loss: 2.4510
55:	[1s / 1m:3s],		train_loss: 2.4573
30:	[0s / 17s],		train_loss: 2.5855
7:	[0s / 5s],		train_loss: 2.5170
25:	[0s / 14s],		train_loss: 2.4590
31:	[0s / 18s],		train_loss: 2.6080
8:	[0s / 6s],		train_loss: 2.5119
26:	[0s / 15s],		train_loss: 2.4355
32:	[0s / 18s],		train_loss: 2.5898
56:	[1s / 1m:4s],		train_loss: 2.4467
27:	[0s / 15s],		train_loss: 2.4487
9:	[0s / 7s],		train_loss: 2.5151
33:	[0s / 19s],		train_loss: 2.5769
28:	[0s / 16s],		train_loss: 2.4547
34:	[0s / 19s],		train_loss: 2.5970
10:	[0s / 8s],		train_loss: 2.4762
29:	[0s / 16s],		train_loss: 2.4416
57:	[1s / 1m:5s],		train_loss: 2.4432
35:	[0s / 20s],		train_loss: 2.5876
11:	[0s / 8s],		train_loss: 2.4693
30:	[0s / 17s],		train_loss: 2.4531
36:	[0s / 20s],		train_loss: 2.5965
31:	[0s / 17s],		train_loss: 2.4462
58:	[1s / 1m:7s],		train_loss: 2.4611
12:	[0s / 9s],		train_loss: 2.4916
37:	[0s / 21s],		train_loss: 2.5864
32:	[0s / 18s],		train_loss: 2.4443
38:	[0s / 21s],		train_loss: 2.5893
13:	[0s / 10s],		train_loss: 2.4812
33:	[0s / 18s],		train_loss: 2.4330
39:	[0s / 22s],		train_loss: 2.5598
59:	[1s / 1m:8s],		train_loss: 2.4430
14:	[0s / 10s],		train_loss: 2.4928
34:	[0s / 19s],		train_loss: 2.4529
40:	[0s / 22s],		train_loss: 2.5814
35:	[0s / 19s],		train_loss: 2.4403
41:	[0s / 23s],		train_loss: 2.5633
15:	[0s / 11s],		train_loss: 2.4646
60:	[1s / 1m:9s],		train_loss: 2.4432
36:	[0s / 20s],		train_loss: 2.4614
42:	[0s / 23s],		train_loss: 2.5638
16:	[0s / 12s],		train_loss: 2.4668
37:	[0s / 20s],		train_loss: 2.4482
43:	[0s / 24s],		train_loss: 2.5583
38:	[0s / 21s],		train_loss: 2.4398
17:	[0s / 13s],		train_loss: 2.4596
44:	[0s / 24s],		train_loss: 2.5568
61:	[1s / 1m:10s],		train_loss: 2.4471
39:	[0s / 21s],		train_loss: 2.4295
45:	[0s / 25s],		train_loss: 2.5806
18:	[0s / 13s],		train_loss: 2.4581
40:	[0s / 22s],		train_loss: 2.4279
46:	[0s / 25s],		train_loss: 2.5981
19:	[0s / 14s],		train_loss: 2.4697
41:	[0s / 22s],		train_loss: 2.4206
62:	[1s / 1m:12s],		train_loss: 2.4478
47:	[0s / 26s],		train_loss: 2.5739
42:	[0s / 23s],		train_loss: 2.4295
20:	[0s / 15s],		train_loss: 2.4541
48:	[0s / 26s],		train_loss: 2.5768
43:	[0s / 24s],		train_loss: 2.4361
49:	[0s / 27s],		train_loss: 2.5877
21:	[0s / 15s],		train_loss: 2.4583
63:	[1s / 1m:13s],		train_loss: 2.4576
44:	[0s / 24s],		train_loss: 2.4243
50:	[0s / 28s],		train_loss: 2.5651
22:	[0s / 16s],		train_loss: 2.4541
45:	[0s / 25s],		train_loss: 2.4268
51:	[0s / 28s],		train_loss: 2.5767
64:	[1s / 1m:14s],		train_loss: 2.4377
46:	[0s / 25s],		train_loss: 2.4341
23:	[0s / 17s],		train_loss: 2.4566
52:	[0s / 29s],		train_loss: 2.5725
47:	[0s / 26s],		train_loss: 2.4236
53:	[0s / 29s],		train_loss: 2.5683
24:	[0s / 18s],		train_loss: 2.4503
48:	[0s / 26s],		train_loss: 2.4090
65:	[1s / 1m:15s],		train_loss: 2.4494
54:	[0s / 30s],		train_loss: 2.5561
49:	[0s / 27s],		train_loss: 2.4170
25:	[0s / 18s],		train_loss: 2.4375
55:	[0s / 30s],		train_loss: 2.5465
50:	[0s / 27s],		train_loss: 2.4202
56:	[0s / 31s],		train_loss: 2.5478
26:	[0s / 19s],		train_loss: 2.4658
66:	[1s / 1m:17s],		train_loss: 2.4483
51:	[0s / 28s],		train_loss: 2.4148
57:	[0s / 31s],		train_loss: 2.5551
27:	[0s / 20s],		train_loss: 2.4431
52:	[0s / 28s],		train_loss: 2.4243
58:	[0s / 32s],		train_loss: 2.5477
67:	[1s / 1m:18s],		train_loss: 2.4575
53:	[0s / 29s],		train_loss: 2.4433
28:	[0s / 21s],		train_loss: 2.4596
59:	[0s / 32s],		train_loss: 2.5373
54:	[0s / 29s],		train_loss: 2.4357
60:	[0s / 33s],		train_loss: 2.5693
29:	[0s / 21s],		train_loss: 2.4497
55:	[0s / 30s],		train_loss: 2.4209
68:	[1s / 1m:19s],		train_loss: 2.4476
61:	[0s / 33s],		train_loss: 2.5721
30:	[0s / 22s],		train_loss: 2.4401
56:	[0s / 30s],		train_loss: 2.4317
62:	[0s / 34s],		train_loss: 2.5605
57:	[0s / 31s],		train_loss: 2.4145
31:	[0s / 23s],		train_loss: 2.4363
63:	[0s / 34s],		train_loss: 2.5421
69:	[1s / 1m:20s],		train_loss: 2.4420
58:	[0s / 31s],		train_loss: 2.4210
64:	[0s / 35s],		train_loss: 2.5327
32:	[0s / 23s],		train_loss: 2.4393
59:	[0s / 32s],		train_loss: 2.4126
65:	[0s / 35s],		train_loss: 2.5336
70:	[1s / 1m:22s],		train_loss: 2.4332
33:	[0s / 24s],		train_loss: 2.4435
60:	[0s / 32s],		train_loss: 2.4139
66:	[0s / 36s],		train_loss: 2.5424
61:	[0s / 33s],		train_loss: 2.4044
67:	[0s / 36s],		train_loss: 2.5568
34:	[0s / 25s],		train_loss: 2.4529
62:	[0s / 33s],		train_loss: 2.4100
71:	[1s / 1m:23s],		train_loss: 2.4342
68:	[0s / 37s],		train_loss: 2.5488
35:	[0s / 26s],		train_loss: 2.4645
63:	[0s / 34s],		train_loss: 2.4100
69:	[0s / 38s],		train_loss: 2.5349
64:	[0s / 35s],		train_loss: 2.4066
36:	[0s / 26s],		train_loss: 2.4436
72:	[1s / 1m:24s],		train_loss: 2.4268
70:	[0s / 38s],		train_loss: 2.5557
65:	[0s / 35s],		train_loss: 2.4059
71:	[0s / 39s],		train_loss: 2.5426
37:	[0s / 27s],		train_loss: 2.4445
66:	[0s / 36s],		train_loss: 2.4132
72:	[0s / 39s],		train_loss: 2.5311
73:	[1s / 1m:25s],		train_loss: 2.4302
38:	[0s / 28s],		train_loss: 2.4404
67:	[0s / 36s],		train_loss: 2.4046
73:	[0s / 40s],		train_loss: 2.5115
68:	[0s / 37s],		train_loss: 2.4129
39:	[0s / 28s],		train_loss: 2.4473
74:	[0s / 40s],		train_loss: 2.5346
69:	[0s / 37s],		train_loss: 2.4199
74:	[1s / 1m:27s],		train_loss: 2.4311
75:	[0s / 41s],		train_loss: 2.5355
40:	[0s / 29s],		train_loss: 2.4418
70:	[0s / 38s],		train_loss: 2.4113
76:	[0s / 41s],		train_loss: 2.5634
41:	[0s / 30s],		train_loss: 2.4422
71:	[0s / 38s],		train_loss: 2.4119
77:	[0s / 42s],		train_loss: 2.5053
75:	[1s / 1m:28s],		train_loss: 2.4280
72:	[0s / 39s],		train_loss: 2.4085
42:	[0s / 31s],		train_loss: 2.4296
78:	[0s / 42s],		train_loss: 2.5092
73:	[0s / 39s],		train_loss: 2.3967
79:	[0s / 43s],		train_loss: 2.5292
43:	[0s / 31s],		train_loss: 2.4253
74:	[0s / 40s],		train_loss: 2.4017
76:	[1s / 1m:29s],		train_loss: 2.4411
80:	[0s / 43s],		train_loss: 2.5457
44:	[0s / 32s],		train_loss: 2.4283
75:	[0s / 40s],		train_loss: 2.3998
81:	[0s / 44s],		train_loss: 2.5391
76:	[0s / 41s],		train_loss: 2.4140
45:	[0s / 33s],		train_loss: 2.4303
82:	[0s / 44s],		train_loss: 2.5432
77:	[1s / 1m:30s],		train_loss: 2.4441
77:	[0s / 41s],		train_loss: 2.4189
83:	[0s / 45s],		train_loss: 2.5327
46:	[0s / 33s],		train_loss: 2.4407
78:	[0s / 42s],		train_loss: 2.4054
84:	[0s / 45s],		train_loss: 2.5263
79:	[0s / 42s],		train_loss: 2.3997
47:	[0s / 34s],		train_loss: 2.4228
78:	[1s / 1m:32s],		train_loss: 2.4318
85:	[0s / 46s],		train_loss: 2.5404
80:	[0s / 43s],		train_loss: 2.4099
86:	[0s / 46s],		train_loss: 2.5290
48:	[0s / 35s],		train_loss: 2.4172
81:	[0s / 43s],		train_loss