[I 2026-06-28 07:14:38,114] Trial 42 finished with value: 0.7456719416076303 and parameters: {'num_nodes': [32], 'dropout': 0.28364927090833164, 'learning_rate': 0.006384996447379718, 'batch_norm': True}. Best is trial 37 with value: 0.7633636949121354.
/scratch.hpc/luca.cotugno/Foundation_model_clinical_data/test_tabular_model.py:481: UserWarning: Choices for a categorical distribution should be a tuple of None, bool, int, float and str for persistent storage but contains [32] which is of type list.
  num_nodes  = trial.suggest_categorical("num_nodes", [[32], [64], [128], [64, 32], [128, 64]])
/scratch.hpc/luca.cotugno/Foundation_model_clinical_data/test_tabular_model.py:481: UserWarning: Choices for a categorical distribution should be a tuple of None, bool, int, float and str for persistent storage but contains [64] which is of type list.
  num_nodes  = trial.suggest_categorical("num_nodes", [[32], [64], [128], [64, 32], [128, 64]])
/scratch.hpc/luca.cotugno/Foundation_model_clinical_data/test_tabular_model.py:481: UserWarning: Choices for a categorical distribution should be a tuple of None, bool, int, float and str for persistent storage but contains [128] which is of type list.
  num_nodes  = trial.suggest_categorical("num_nodes", [[32], [64], [128], [64, 32], [128, 64]])
/scratch.hpc/luca.cotugno/Foundation_model_clinical_data/test_tabular_model.py:481: UserWarning: Choices for a categorical distribution should be a tuple of None, bool, int, float and str for persistent storage but contains [64, 32] which is of type list.
  num_nodes  = trial.suggest_categorical("num_nodes", [[32], [64], [128], [64, 32], [128, 64]])
/scratch.hpc/luca.cotugno/Foundation_model_clinical_data/test_tabular_model.py:481: UserWarning: Choices for a categorical distribution should be a tuple of None, bool, int, float and str for persistent storage but contains [128, 64] which is of type list.
  num_nodes  = trial.suggest_categorical("num_nodes", [[32], [64], [128], [64, 32], [128, 64]])

52:	[0s / 7s],		train_loss: 4.2190
91:	[0s / 12s],		train_loss: 3.2621
98:	[0s / 20s],		train_loss: 3.5986
75:	[0s / 24s],		train_loss: 4.1048
53:	[0s / 7s],		train_loss: 4.1728
92:	[0s / 12s],		train_loss: 3.2972
51:	[1s / 1m:34s],		train_loss: 4.0916
99:	[0s / 20s],		train_loss: 3.6149
54:	[0s / 7s],		train_loss: 4.1933
47:	[0s / 25s],		train_loss: 4.1218
93:	[0s / 12s],		train_loss: 3.2596
94:	[0s / 12s],		train_loss: 3.2292
76:	[0s / 25s],		train_loss: 4.1660
55:	[0s / 8s],		train_loss: 4.2134
95:	[0s / 12s],		train_loss: 3.2216
0:	[0s / 0s],		train_loss: 4.9754
56:	[0s / 8s],		train_loss: 4.2652
96:	[0s / 12s],		train_loss: 3.2288
57:	[0s / 8s],		train_loss: 4.2151
1:	[0s / 0s],		train_loss: 4.4684
77:	[0s / 25s],		train_loss: 4.1214
97:	[0s / 13s],		train_loss: 3.1498
48:	[0s / 26s],		train_loss: 4.0659
58:	[0s / 8s],		train_loss: 4.1925
98:	[0s / 13s],		train_loss: 3.2163
2:	[0s / 0s],		train_loss: 4.4392
85:	[1s / 1m:35s],		train_loss: 4.2745
59:	[0s / 8s],		train_loss: 4.1943
99:	[0s / 13s],		train_loss: 3.1597
30:	[4s / 1m:35s],		train_loss: 4.0654
78:	[0s / 25s],		train_loss: 4.1218
3:	[0s / 0s],		train_loss: 4.4109
60:	[0s / 8s],		train_loss: 4.1650
4:	[0s / 0s],		train_loss: 4.4279
0:	[0s / 0s],		train_loss: 6.4665
61:	[0s / 8s],		train_loss: 4.2004
49:	[0s / 26s],		train_loss: 4.0935
79:	[0s / 26s],		train_loss: 4.1151
1:	[0s / 0s],		train_loss: 4.7366
5:	[0s / 1s],		train_loss: 4.4183
62:	[0s / 9s],		train_loss: 4.1696
2:	[0s / 0s],		train_loss: 4.6906
63:	[0s / 9s],		train_loss: 4.2376
6:	[0s / 1s],		train_loss: 4.3581
3:	[0s / 0s],		train_loss: 4.6475
80:	[0s / 26s],		train_loss: 4.1348
64:	[0s / 9s],		train_loss: 4.1864
7:	[0s / 1s],		train_loss: 4.4074
4:	[0s / 0s],		train_loss: 4.6027
50:	[0s / 27s],		train_loss: 4.1753
65:	[0s / 9s],		train_loss: 4.1919
86:	[0s / 1m:36s],		train_loss: 4.2840
8:	[0s / 1s],		train_loss: 4.3742
5:	[0s / 0s],		train_loss: 4.5470
66:	[0s / 9s],		train_loss: 4.1813
81:	[0s / 26s],		train_loss: 4.1087
6:	[0s / 0s],		train_loss: 4.5525
9:	[0s / 1s],		train_loss: 4.3547
67:	[0s / 9s],		train_loss: 4.1533
7:	[0s / 1s],		train_loss: 4.5740
68:	[0s / 9s],		train_loss: 4.1431
10:	[0s / 1s],		train_loss: 4.3514
51:	[0s / 27s],		train_loss: 4.1513
8:	[0s / 1s],		train_loss: 4.5476
82:	[0s / 27s],		train_loss: 4.1101
69:	[0s / 10s],		train_loss: 4.1833
52:	[2s / 1m:37s],		train_loss: 4.0656
11:	[0s / 2s],		train_loss: 4.3681
9:	[0s / 1s],		train_loss: 4.5069
70:	[0s / 10s],		train_loss: 4.1487
10:	[0s / 1s],		train_loss: 4.5290
12:	[0s / 2s],		train_loss: 4.3787
83:	[0s / 27s],		train_loss: 4.0849
71:	[0s / 10s],		train_loss: 4.1972
11:	[0s / 1s],		train_loss: 4.5202
13:	[0s / 2s],		train_loss: 4.4009
52:	[0s / 28s],		train_loss: 4.1058
72:	[0s / 10s],		train_loss: 4.1180
12:	[0s / 1s],		train_loss: 4.4805
84:	[0s / 27s],		train_loss: 4.0798
87:	[1s / 1m:37s],		train_loss: 4.2625
13:	[0s / 1s],		train_loss: 4.5267
73:	[0s / 10s],		train_loss: 4.1730
14:	[0s / 2s],		train_loss: 4.3636
14:	[0s / 2s],		train_loss: 4.5010
74:	[0s / 10s],		train_loss: 4.1672
15:	[0s / 2s],		train_loss: 4.3641
15:	[0s / 2s],		train_loss: 4.5195
75:	[0s / 10s],		train_loss: 4.1466
85:	[0s / 28s],		train_loss: 4.1067
16:	[0s / 3s],		train_loss: 4.3388
16:	[0s / 2s],		train_loss: 4.5210
76:	[0s / 11s],		train_loss: 4.1241
53:	[0s / 28s],		train_loss: 4.0980
17:	[0s / 2s],		train_loss: 4.4505
17:	[0s / 3s],		train_loss: 4.3359
77:	[0s / 11s],		train_loss: 4.2056
86:	[0s / 28s],		train_loss: 4.1036
18:	[0s / 2s],		train_loss: 4.5001
78:	[0s / 11s],		train_loss: 4.1852
18:	[0s / 3s],		train_loss: 4.3044
19:	[0s / 2s],		train_loss: 4.5014
88:	[0s / 1m:38s],		train_loss: 4.2940
79:	[0s / 11s],		train_loss: 4.1851
87:	[0s / 28s],		train_loss: 4.0865
20:	[0s / 2s],		train_loss: 4.4841
19:	[0s / 3s],		train_loss: 4.3267
54:	[0s / 29s],		train_loss: 4.0973
80:	[0s / 11s],		train_loss: 4.1336
21:	[0s / 2s],		train_loss: 4.4774
20:	[0s / 3s],		train_loss: 4.3470
81:	[0s / 11s],		train_loss: 4.1575
22:	[0s / 3s],		train_loss: 4.4929
53:	[1s / 1m:39s],		train_loss: 4.1008
21:	[0s / 3s],		train_loss: 4.3353
82:	[0s / 11s],		train_loss: 4.1292
88:	[0s / 29s],		train_loss: 4.0599
23:	[0s / 3s],		train_loss: 4.4501
83:	[0s / 12s],		train_loss: 4.1608
24:	[0s / 3s],		train_loss: 4.4524
22:	[0s / 4s],		train_loss: 4.3196
84:	[0s / 12s],		train_loss: 4.1214
25:	[0s / 3s],		train_loss: 4.4157
55:	[0s / 29s],		train_loss: 4.1391
31:	[3s / 1m:39s],		train_loss: 4.0518
89:	[0s / 29s],		train_loss: 4.0988
23:	[0s / 4s],		train_loss: 4.3391
85:	[0s / 12s],		train_loss: 4.1424
26:	[0s / 3s],		train_loss: 4.4739
24:	[0s / 4s],		train_loss: 4.3060
86:	[0s / 12s],		train_loss: 4.0964
27:	[0s / 3s],		train_loss: 4.5020
90:	[0s / 29s],		train_loss: 4.0823
89:	[1s / 1m:39s],		train_loss: 4.2688
87:	[0s / 12s],		train_loss: 4.1359
28:	[0s / 3s],		train_loss: 4.4839
25:	[0s / 4s],		train_loss: 4.2925
88:	[0s / 12s],		train_loss: 4.1242
29:	[0s / 3s],		train_loss: 4.5043
56:	[0s / 30s],		train_loss: 4.0798
26:	[0s / 4s],		train_loss: 4.2885
30:	[0s / 4s],		train_loss: 4.5003
91:	[0s / 29s],		train_loss: 4.0897
89:	[0s / 12s],		train_loss: 4.1914
31:	[0s / 4s],		train_loss: 4.4510
90:	[0s / 12s],		train_loss: 4.2250
27:	[0s / 4s],		train_loss: 4.2894
32:	[0s / 4s],		train_loss: 4.4665
92:	[0s / 30s],		train_loss: 4.0885
91:	[0s / 13s],		train_loss: 4.1236
28:	[0s / 5s],		train_loss: 4.3051
33:	[0s / 4s],		train_loss: 4.4943
92:	[0s / 13s],		train_loss: 4.1339
29:	[0s / 5s],		train_loss: 4.2814
57:	[0s / 30s],		train_loss: 4.0709
34:	[0s / 4s],		train_loss: 4.4743
93:	[0s / 13s],		train_loss: 4.1008
93:	[0s / 30s],		train_loss: 4.0812
35:	[0s / 4s],		train_loss: 4.5086
94:	[0s / 13s],		train_loss: 4.1048
30:	[0s / 5s],		train_loss: 4.2873
90:	[0s / 1m:40s],		train_loss: 4.2543
36:	[0s / 4s],		train_loss: 4.4883
95:	[0s / 13s],		train_loss: 4.1649
31:	[0s / 5s],		train_loss: 4.2986
37:	[0s / 4s],		train_loss: 4.4408
94:	[0s / 30s],		train_loss: 4.1041
54:	[1s / 1m:40s],		train_loss: 4.0580
96:	[0s / 13s],		train_loss: 4.1585
38:	[0s / 4s],		train_loss: 4.5126
32:	[0s / 5s],		train_loss: 4.3350
97:	[0s / 13s],		train_loss: 4.1227
58:	[0s / 31s],		train_loss: 4.0947
39:	[0s / 5s],		train_loss: 4.4954
33:	[0s / 5s],		train_loss: 4.2645
98:	[0s / 13s],		train_loss: 4.0970
95:	[0s / 31s],		train_loss: 4.1295
40:	[0s / 5s],		train_loss: 4.4709
99:	[0s / 13s],		train_loss: 4.1388
41:	[0s / 5s],		train_loss: 4.4794
34:	[0s / 6s],		train_loss: 4.3217
96:	[0s / 31s],		train_loss: 4.1305
42:	[0s / 5s],		train_loss: 4.4940
91:	[0s / 1m:41s],		train_loss: 4.2490
0:	[0s / 0s],		train_loss: 4.8758
35:	[0s / 6s],		train_loss: 4.3130
59:	[0s / 32s],		train_loss: 4.1228
43:	[0s / 5s],		train_loss: 4.4482
1:	[0s / 0s],		train_loss: 4.5789
44:	[0s / 5s],		train_loss: 4.5064
36:	[0s / 6s],		train_loss: 4.2875
97:	[0s / 31s],		train_loss: 4.1229
2:	[0s / 0s],		train_loss: 4.5417
45:	[0s / 5s],		train_loss: 4.4825
37:	[0s / 6s],		train_loss: 4.2636
3:	[0s / 0s],		train_loss: 4.4936
46:	[0s / 5s],		train_loss: 4.5004
4:	[0s / 0s],		train_loss: 4.4890
38:	[0s / 6s],		train_loss: 4.2609
98:	[0s / 31s],		train_loss: 4.1118
47:	[0s / 6s],		train_loss: 4.4568
60:	[0s / 32s],		train_loss: 4.0728
5:	[0s / 0s],		train_loss: 4.4304
48:	[0s / 6s],		train_loss: 4.4861
39:	[0s / 7s],		train_loss: 4.2666
6:	[0s / 0s],		train_loss: 4.4350
49:	[0s / 6s],		train_loss: 4.4469
99:	[0s / 32s],		train_loss: 4.0335
7:	[0s / 1s],		train_loss: 4.4289
50:	[0s / 6s],		train_loss: 4.4721
40:	[0s / 7s],		train_loss: 4.3364
92:	[1s / 1m:42s],		train_loss: 4.2580
55:	[1s / 1m:42s],		train_loss: 4.0946
32:	[3s / 1m:42s],		train_loss: 4.0418
8:	[0s / 1s],		train_loss: 4.3865
51:	[0s / 6s],		train_loss: 4.5163
41:	[0s / 7s],		train_loss: 4.2718
61:	[0s / 33s],		train_loss: 4.0478
52:	[0s / 6s],		train_loss: 4.4929
9:	[0s / 1s],		train_loss: 4.3897
53:	[0s / 6s],		train_loss: 4.4809
10:	[0s / 1s],		train_loss: 4.3857
42:	[0s / 7s],		train_loss: 4.2610
0:	[0s / 0s],		train_loss: 5.2335
54:	[0s / 7s],		train_loss: 4.4667
11:	[0s / 1s],		train_loss: 4.4041
43:	[0s / 7s],		train_loss: 4.2548
55:	[0s / 7s],		train_loss: 4.4952
12:	[0s / 1s],		train_loss: 4.4008
1:	[0s / 0s],		train_loss: 4.5694
44:	[0s / 7s],		train_loss: 4.2696
56:	[0s / 7s],		train_loss: 4.4365
13:	[0s / 1s],		train_loss: 4.3934
57:	[0s / 7s],		train_loss: 4.4915
14:	[0s / 1s],		train_loss: 4.3791
45:	[0s / 8s],		train_loss: 4.2439
62:	[0s / 33s],		train_loss: 4.0325
58:	[0s / 7s],		train_loss: 4.4970
15:	[0s / 2s],		train_loss: 4.3937
46:	[0s / 8s],		train_loss: 4.2463
2:	[0s / 0s],		train_loss: 4.5751
59:	[0s / 7s],		train_loss: 4.4933
16:	[0s / 2s],		train_loss: 4.3662
93:	[1s / 1m:43s],		train_loss: 4.2885
47:	[0s / 8s],		train_loss: 4.2296
60:	[0s / 7s],		train_loss: 4.4830
17:	[0s / 2s],		train_loss: 4.3403
61:	[0s / 7s],		train_loss: 4.4995
3:	[0s / 1s],		train_loss: 4.5226
18:	[0s / 2s],		train_loss: 4.3785
48:	[0s / 8s],		train_loss: 4.2579
62:	[0s / 7s],		train_loss: 4.4851
63:	[0s / 34s],		train_loss: 4.0232
19:	[0s / 2s],		train_loss: 4.3296
49:	[0s / 8s],		train_loss: 4.1947
63:	[0s / 8s],		train_loss: 4.4742
20:	[0s / 2s],		train_loss: 4.3323
64:	[0s / 8s],		train_loss: 4.4601
4:	[0s / 1s],		train_loss: 4.4989
21:	[0s / 2s],		train_loss: 4.3503
50:	[0s / 9s],		train_loss: 4.2458
65:	[0s / 8s],		train_loss: 4.4486
22:	[0s / 3s],		train_loss: 4.3491
66:	[0s / 8s],		train_loss: 4.4534
51:	[0s / 9s],		train_loss: 4.2258
23:	[0s / 3s],		train_loss: 4.3495
67:	[0s / 8s],		train_loss: 4.4286
5:	[0s / 2s],		train_loss: 4.4732
64:	[0s / 35s],		train_loss: 4.1030
52:	[0s / 9s],		train_loss: 4.2619
56:	[2s / 1m:44s],		train_loss: 4.0712
68:	[0s / 8s],		train_loss: 4.4720
24:	[0s / 3s],		train_loss: 4.3553
94:	[1s / 1m:44s],		train_loss: 4.2411
53:	[0s / 9s],		train_loss: 4.2447
69:	[0s / 8s],		train_loss: 4.4953
25:	[0s / 3s],		train_loss: 4.3230
6:	[0s / 2s],		train_loss: 4.4984
54:	[0s / 9s],		train_loss: 4.2287
70:	[0s / 9s],		train_loss: 4.4362
26:	[0s / 3s],		train_loss: 4.3493
71:	[0s / 9s],		train_loss: 4.4331
55:	[0s / 9s],		train_loss: 4.2500
27:	[0s / 3s],		train_loss: 4.3557
65:	[0s / 35s],		train_loss: 4.0543
72:	[0s / 9s],		train_loss: 4.4500
56:	[0s / 10s],		train_loss: 4.2070
7:	[0s / 2s],		train_loss: 4.5018
28:	[0s / 4s],		train_loss: 4.4325
73:	[0s / 9s],		train_loss: 4.4895
29:	[0s / 4s],		train_loss: 4.3540
57:	[0s / 10s],		train_loss: 4.1996
74:	[0s / 9s],		train_loss: 4.4859
30:	[0s / 4s],		train_loss: 4.3446
58:	[0s / 10s],		train_loss: 4.2458
75:	[0s / 9s],		train_loss: 4.5217
8:	[0s / 3s],		train_loss: 4.4328
31:	[0s / 4s],		train_loss: 4.3595
95:	[1s / 1m:45s],		train_loss: 4.2747
76:	[0s / 9s],		train_loss: 4.5836
59:	[0s / 10s],		train_loss: 4.2703
66:	[0s / 36s],		train_loss: 4.0090
32:	[0s / 4s],		train_loss: 4.3385
77:	[0s / 10s],		train_loss: 4.5254
60:	[0s / 10s],		train_loss: 4.2303
9:	[0s / 3s],		train_loss: 4.4540
33:	[0s / 4s],		train_loss: 4.3824
78:	[0s / 10s],		train_loss: 4.5109
34:	[0s / 4s],		train_loss: 4.3335
61:	[0s / 11s],		train_loss: 4.2267
79:	[0s / 10s],		train_loss: 4.4855
35:	[0s / 5s],		train_loss: 4.3347
62:	[0s / 11s],		train_loss: 4.2272
80:	[0s / 10s],		train_loss: 4.4795
10:	[0s / 3s],		train_loss: 4.4136
67:	[0s / 37s],		train_loss: 4.0231
36:	[0s / 5s],		train_loss: 4.3201
81:	[0s / 10s],		train_loss: 4.4694
63:	[0s / 11s],		train_loss: 4.2773
37:	[0s / 5s],		train_loss: 4.3578
82:	[0s / 10s],		train_loss: 4.4602
33:	[4s / 1m:46s],		train_loss: 4.0257
64:	[0s / 11s],		train_loss: 4.2329
83:	[0s / 10s],		train_loss: 4.4526
38:	[0s / 5s],		train_loss: 4.2984
11:	[0s / 4s],		train_loss: 4.4057
65:	[0s / 11s],		train_loss: 4.2202
84:	[0s / 11s],		train_loss: 4.5035
57:	[2s / 1m:46s],		train_loss: 4.0248
39:	[0s / 5s],		train_loss: 4.3032
85:	[0s / 11s],		train_loss: 4.5266
66:	[0s / 11s],		train_loss: 4.2013
40:	[0s / 5s],		train_loss: 4.2731
96:	[1s / 1m:47s],		train_loss: 4.3002
12:	[0s / 4s],		train_loss: 4.4729
86:	[0s / 11s],		train_loss: 4.4920
68:	[0s / 37s],		train_loss: 4.0544
41:	[0s / 5s],		train_loss: 4.3034
67:	[0s / 12s],		train_loss: 4.2210
87:	[0s / 11s],		train_loss: 4.6545
42:	[0s / 6s],		train_loss: 4.3085
68:	[0s / 12s],		train_loss: 4.2231
88:	[0s / 11s],		train_loss: 4.6264
43:	[0s / 6s],		train_loss: 4.3522
13:	[0s / 5s],		train_loss: 4.4441
89:	[0s / 11s],		train_loss: 4.6114
69:	[0s / 12s],		train_loss: 4.2339
44:	[0s / 6s],		train_loss: 4.3332
90:	[0s / 11s],		train_loss: 4.5957
45:	[0s / 6s],		train_loss: 4.3606
70:	[0s / 12s],		train_loss: 4.2018
91:	[0s / 11s],		train_loss: 4.5370
14:	[0s / 5s],		train_loss: 4.3900
46:	[0s / 6s],		train_loss: 4.3443
69:	[0s / 38s],		train_loss: 4.0318
71:	[0s / 12s],		train_loss: 4.1998
92:	[0s / 12s],		train_loss: 4.5270
47:	[0s / 6s],		train_loss: 4.3185
93:	[0s / 12s],		train_loss: 4.4699
72:	[0s / 13s],		train_loss: 4.2541
48:	[0s / 6s],		train_loss: 4.3422
15:	[0s / 5s],		train_loss: 4.4131
94:	[0s / 12s],		train_loss: 4.4898
97:	[1s / 1m:48s],		train_loss: 4.2560
73:	[0s / 13s],		train_loss: 4.2793
49:	[0s / 7s],		train_loss: 4.3366
95:	[0s / 12s],		train_loss: 4.4958
50:	[0s / 7s],		train_loss: 4.3002
74:	[0s / 13s],		train_loss: 4.1862
96:	[0s / 12s],		train_loss: 4.4637
16:	[0s / 6s],		train_loss: 4.3970
70:	[0s / 39s],		train_loss: 4.0043
51:	[0s / 7s],		train_loss: 4.2783
97:	[0s / 12s],		train_loss: 4.4671
75:	[0s / 13s],		train_loss: 4.1796
52:	[0s / 7s],		train_loss: 4.2758
98:	[0s / 12s],		train_loss: 4.4700
76:	[0s / 13s],		train_loss: 4.2070
53:	[0s / 7s],		train_loss: 4.2715
17:	[0s / 6s],		train_loss: 4.3802
99:	[0s / 13s],		train_loss: 4.4700
77:	[0s / 13s],		train_loss: 4.1794
54:	[0s / 7s],		train_loss: 4.2899
0:	[0s / 0s],		train_loss: 5.3718
55:	[0s / 7s],		train_loss: 4.2903
18:	[0s / 6s],		train_loss: 4.3818
78:	[0s / 14s],		train_loss: 4.2124
1:	[0s / 0s],		train_loss: 4.6106
56:	[0s / 8s],		train_loss: 4.2688
71:	[0s / 40s],		train_loss: 3.9889
58:	[2s / 1m:49s],		train_loss: 4.0828
79:	[0s / 14s],		train_loss: 4.2285
2:	[0s / 0s],		train_loss: 4.5438
57:	[0s / 8s],		train_loss: 4.2488
3:	[0s / 0s],		train_loss: 4.5082
80:	[0s / 14s],		train_loss: 4.2376
58:	[0s / 8s],		train_loss: 4.2846
19:	[0s / 7s],		train_loss: 4.4097
4:	[0s / 0s],		train_loss: 4.4749
98:	[1s / 1m:49s],		train_loss: 4.2257
59:	[0s / 8s],		train_loss: 4.2686
81:	[0s / 14s],		train_loss: 4.2103
5:	[0s / 0s],		train_loss: 4.4630
60:	[0s / 8s],		train_loss: 4.2650
20:	[0s / 7s],		train_loss: 4.3502
82:	[0s / 14s],		train_loss: 4.2068
6:	[0s / 0s],		train_loss: 4.4501
61:	[0s / 8s],		train_loss: 4.3048
72:	[0s / 40s],		train_loss: 4.0021
7:	[0s / 1s],		train_loss: 4.4352
83:	[0s / 15s],		train_loss: 4.1964
62:	[0s / 8s],		train_loss: 4.2687
8:	[0s / 1s],		train_loss: 4.4121
21:	[0s / 7s],		train_loss: 4.4117
63:	[0s / 9s],		train_loss: 4.2423
84:	[0s / 15s],		train_loss: 4.2415
9:	[0s / 1s],		train_loss: 4.4087
64:	[0s / 9s],		train_loss: 4.2699
10:	[0s / 1s],		train_loss: 4.3757
85:	[0s / 15s],		train_loss: 4.2678
65:	[0s / 9s],		train_loss: 4.2253
22:	[0s / 8s],		train_loss: 4.3752
11:	[0s / 1s],		train_loss: 4.4031
86:	[0s / 15s],		train_loss: 4.2478
66:	[0s / 9s],		train_loss: 4.2253
12:	[0s / 1s],		train_loss: 4.3673
73:	[0s / 41s],		train_loss: 3.9622
99:	[1s / 1m:50s],		train_loss: 4.2350
13:	[0s / 1s],		train_loss: 4.3474
87:	[0s / 15s],		train_loss: 4.1755
67:	[0s / 9s],		train_loss: 4.2889
14:	[0s / 2s],		train_loss: 4.3470
23:	[0s / 8s],		train_loss: 4.4273
68:	[0s / 9s],		train_loss: 4.3023
88:	[0s / 16s],		train_loss: 4.1574
15:	[0s / 2s],		train_loss: 4.3825
69:	[0s / 10s],		train_loss: 4.2907
89:	[0s / 16s],		train_loss: 4.1822
16:	[0s / 2s],		train_loss: 4.3420
24:	[0s / 9s],		train_loss: 4.3724
70:	[0s / 10s],		train_loss: 4.2504
74:	[0s / 42s],		train_loss: 3.9928
17:	[0s / 2s],		train_loss: 4.3597
90:	[0s / 16s],		train_loss: 4.1865
59:	[2s / 1m:51s],		train_loss: 4.0622
71:	[0s / 10s],		train_loss: 4.2453
18:	[0s / 2s],		train_loss: 4.3072
72:	[0s / 10s],		train_loss: 4.1946
91:	[0s / 16s],		train_loss: 4.1470
19:	[0s / 2s],		train_loss: 4.3499
25:	[0s / 9s],		train_loss: 4.3968
34:	[5s / 1m:52s],		train_loss: 3.9817
73:	[0s / 10s],		train_loss: 4.2614
20:	[0s / 2s],		train_loss: 4.3223
92:	[0s / 16s],		train_loss: 4.1294
0:	[1s / 1s],		train_loss: 4.5565
74:	[0s / 10s],		train_loss: 4.1997
21:	[0s / 3s],		train_loss: 4.3464
93:	[0s / 17s],		train_loss: 4.1428
75:	[0s / 11s],		train_loss: 4.2432
75:	[0s / 42s],		train_loss: 3.9718
26:	[0s / 9s],		train_loss: 4.3845
22:	[0s / 3s],		train_loss: 4.3199
94:	[0s / 17s],		train_loss: 4.1914
76:	[0s / 11s],		train_loss: 4.2200
23:	[0s / 3s],		train_loss: 4.3218
95:	[0s / 17s],		train_loss: 4.1696
77:	[0s / 11s],		train_loss: 4.2372
24:	[0s / 3s],		train_loss: 4.2950
78:	[0s / 11s],		train_loss: 4.2179
27:	[0s / 10s],		train_loss: 4.3756
25:	[0s / 3s],		train_loss: 4.2518
96:	[0s / 17s],		train_loss: 4.1678
79:	[0s / 11s],		train_loss: 4.2128
26:	[0s / 3s],		train_loss: 4.2782
97:	[0s / 17s],		train_loss: 4.2123
76:	[0s / 43s],		train_loss: 3.9584
80:	[0s / 11s],		train_loss: 4.2016
27:	[0s / 3s],		train_loss: 4.2551
98:	[0s / 18s],		train_loss: 4.2232
28:	[0s / 10s],		train_loss: 4.3625
81:	[0s / 11s],		train_loss: 4.2021
28:	[0s / 4s],		train_loss: 4.2728
99:	[0s / 18s],		train_loss: 4.1936
82:	[0s / 12s],		train_loss: 4.1953
29:	[0s / 4s],		train_loss: 4.2994
83:	[0s / 12s],		train_loss: 4.2168
30:	[0s / 4s],		train_loss: 4.2866
1:	[1s / 2s],		train_loss: 4.4197
29:	[0s / 11s],		train_loss: 4.4042
77:	[0s / 44s],		train_loss: 3.9866
0:	[0s / 0s],		train_loss: 4.5314
84:	[0s / 12s],		train_loss: 4.2308
31:	[0s / 4s],		train_loss: 4.2998
85:	[0s / 12s],		train_loss: 4.1731
32:	[0s / 4s],		train_loss: 4.3220
1:	[0s / 0s],		train_loss: 4.4173
86:	[0s / 12s],		train_loss: 4.2389
33:	[0s / 4s],		train_loss: 4.3013
30:	[0s / 11s],		train_loss: 4.3901
2:	[0s / 0s],		train_loss: 4.4175
60:	[2s / 1m:54s],		train_loss: 4.1044
87:	[0s / 12s],		train_loss: 4.1585
34:	[0s / 5s],		train_loss: 4.2747
35:	[0s / 5s],		train_loss: 4.2726
88:	[0s / 12s],		train_loss: 4.1536
3:	[0s / 0s],		train_loss: 4.3643
78:	[0s / 44s],		train_loss: 3.9487
36:	[0s / 5s],		train_loss: 4.2896
89:	[0s / 13s],		train_loss: 4.2477
31:	[0s / 11s],		train_loss: 4.3568
4:	[0s / 1s],		train_loss: 4.3731
37:	[0s / 5s],		train_loss: 4.3091
90:	[0s / 13s],		train_loss: 4.2805
38:	[0s / 5s],		train_loss: 4.2707
5:	[0s / 1s],		train_loss: 4.3769
91:	[0s / 13s],		train_loss: 4.1934
2:	[1s / 3s],		train_loss: 4.4085
32:	[0s / 12s],		train_loss: 4.4143
39:	[0s / 5s],		train_loss: 4.2963
92:	[0s / 13s],		train_loss: 4.1545
6:	[0s / 1s],		train_loss: 4.3941
79:	[0s / 45s],		train_loss: 3.9609
40:	[0s / 5s],		train_loss: 4.2442
93:	[0s / 13s],		train_loss: 4.1835
41:	[0s / 5s],		train_loss: 4.2798
7:	[0s / 1s],		train_loss: 4.3550
94:	[0s / 13s],		train_loss: 4.2407
33:	[0s / 12s],		train_loss: 4.3741
42:	[0s / 6s],		train_loss: 4.2706
8:	[0s / 1s],		train_loss: 4.3533
95:	[0s / 14s],		train_loss: 4.2103
43:	[0s / 6s],		train_loss: 4.2766
96:	[0s / 14s],		train_loss: 4.1670
44:	[0s / 6s],		train_loss: 4.2560
9:	[0s / 2s],		train_loss: 4.3800
80:	[0s / 46s],		train_loss: 3.9698
34:	[0s / 13s],		train_loss: 4.3630
97:	[0s / 14s],		train_loss: 4.1189
45:	[0s / 6s],		train_loss: 4.3045
10:	[0s / 2s],		train_loss: 4.3576
98:	[0s / 14s],		train_loss: 4.1782
46:	[0s / 6s],		train_loss: 4.2987
3:	[1s / 4s],		train_loss: 4.3676
61:	[1s / 1m:55s],		train_loss: 4.0463
99:	[0s / 14s],		train_loss: 4.1999
11:	[0s / 2s],		train_loss: 4.3443
47:	[0s / 6s],		train_loss: 4.2714
35:	[0s / 13s],		train_loss: 4.4088
48:	[0s / 6s],		train_loss: 4.2040
12:	[0s / 2s],		train_loss: 4.3655
0:	[0s / 0s],		train_loss: 4.6604
81:	[0s / 46s],		train_loss: 3.9649
49:	[0s / 7s],		train_loss: 4.2433
1:	[0s / 0s],		train_loss: 4.4627
13:	[0s / 2s],		train_loss: 4.3377
36:	[0s / 13s],		train_loss: 4.3826
50:	[0s / 7s],		train_loss: 4.2024
35:	[4s / 1m:56s],		train_loss: 4.0250
2:	[0s / 0s],		train_loss: 4.4248
51:	[0s / 7s],		train_loss: 4.2105
14:	[0s / 3s],		train_loss: 4.3332
3:	[0s / 0s],		train_loss: 4.3784
52:	[0s / 7s],		trai