[I 2026-07-01 04:05:04,618] Trial 82 finished with value: 0.776161101725953 and parameters: {'n_estimators': 300, 'max_depth': 10, 'min_samples_split': 18, 'min_samples_leaf': 13, 'max_features': 'sqrt'}. Best is trial 39 with value: 0.7773633820317578.
[I 2026-07-01 04:06:04,985] Trial 83 finished with value: 0.776161101725953 and parameters: {'n_estimators': 300, 'max_depth': 10, 'min_samples_split': 15, 'min_samples_leaf': 13, 'max_features': 'sqrt'}. Best is trial 39 with value: 0.7773633820317578.
[I 2026-07-01 04:27:05,128] Trial 86 finished with value: 0.7764832438174605 and parameters: {'n_estimators': 300, 'max_depth': 8, 'min_samples_split': 15, 'min_samples_leaf': 14, 'max_features': 'sqrt'}. Best is trial 39 with value: 0.7773633820317578.
[I 2026-07-01 04:27:14,547] Trial 85 finished with value: 0.7764832438174605 and parameters: {'n_estimators': 300, 'max_depth': 8, 'min_samples_split': 15, 'min_samples_leaf': 14, 'max_features': 'sqrt'}. Best is trial 39 with value: 0.7773633820317578.
[I 2026-07-01 04:27:16,406] Trial 87 finished with value: 0.7764832438174605 and parameters: {'n_estimators': 300, 'max_depth': 8, 'min_samples_split': 15, 'min_samples_leaf': 14, 'max_features': 'sqrt'}. Best is trial 39 with value: 0.7773633820317578.
[I 2026-07-01 04:27:16,438] Trial 84 finished with value: 0.7764832438174605 and parameters: {'n_estimators': 300, 'max_depth': 8, 'min_samples_split': 15, 'min_samples_leaf': 14, 'max_features': 'sqrt'}. Best is trial 39 with value: 0.7773633820317578.
[I 2026-07-01 04:27:16,861] Trial 88 finished with value: 0.7765848719772813 and parameters: {'n_estimators': 300, 'max_depth': 9, 'min_samples_split': 15, 'min_samples_leaf': 14, 'max_features': 'sqrt'}. Best is trial 39 with value: 0.7773633820317578.
[I 2026-07-01 04:27:18,413] Trial 91 finished with value: 0.7771927234237568 and parameters: {'n_estimators': 250, 'max_depth': 9, 'min_samples_split': 16, 'min_samples_leaf': 14, 'max_features': 'sqrt'}. Best is trial 39 with value: 0.7773633820317578.
[I 2026-07-01 04:27:20,901] Trial 90 finished with value: 0.7765848719772813 and parameters: {'n_estimators': 300, 'max_depth': 9, 'min_samples_split': 15, 'min_samples_leaf': 14, 'max_features': 'sqrt'}. Best is trial 39 with value: 0.7773633820317578.
[I 2026-07-01 04:27:21,188] Trial 89 finished with value: 0.7765848719772813 and parameters: {'n_estimators': 300, 'max_depth': 9, 'min_samples_split': 15, 'min_samples_leaf': 14, 'max_features': 'sqrt'}. Best is trial 39 with value: 0.7773633820317578.
[I 2026-07-01 04:55:39,586] Trial 92 finished with value: 0.7768303135708109 and parameters: {'n_estimators': 250, 'max_depth': 8, 'min_samples_split': 16, 'min_samples_leaf': 14, 'max_features': 'sqrt'}. Best is trial 39 with value: 0.7773633820317578.
[I 2026-07-01 04:59:07,568] Trial 95 finished with value: 0.7768303135708109 and parameters: {'n_estimators': 250, 'max_depth': 8, 'min_samples_split': 13, 'min_samples_leaf': 14, 'max_features': 'sqrt'}. Best is trial 39 with value: 0.7773633820317578.
[I 2026-07-01 04:59:12,260] Trial 93 finished with value: 0.7768303135708109 and parameters: {'n_estimators': 250, 'max_depth': 8, 'min_samples_split': 15, 'min_samples_leaf': 14, 'max_features': 'sqrt'}. Best is trial 39 with value: 0.7773633820317578.
[I 2026-07-01 04:59:12,265] Trial 99 finished with value: 0.7768303135708109 and parameters: {'n_estimators': 250, 'max_depth': 8, 'min_samples_split': 13, 'min_samples_leaf': 14, 'max_features': 'sqrt'}. Best is trial 39 with value: 0.7773633820317578.
[I 2026-07-01 04:59:12,316] Trial 96 finished with value: 0.7768303135708109 and parameters: {'n_estimators': 250, 'max_depth': 8, 'min_samples_split': 13, 'min_samples_leaf': 14, 'max_features': 'sqrt'}. Best is trial 39 with value: 0.7773633820317578.
[I 2026-07-01 04:59:12,330] Trial 94 finished with value: 0.7768303135708109 and parameters: {'n_estimators': 250, 'max_depth': 8, 'min_samples_split': 15, 'min_samples_leaf': 14, 'max_features': 'sqrt'}. Best is trial 39 with value: 0.7773633820317578.
[I 2026-07-01 04:59:12,358] Trial 98 finished with value: 0.7768303135708109 and parameters: {'n_estimators': 250, 'max_depth': 8, 'min_samples_split': 13, 'min_samples_leaf': 14, 'max_features': 'sqrt'}. Best is trial 39 with value: 0.7773633820317578.
[I 2026-07-01 04:59:12,382] Trial 97 finished with value: 0.7768303135708109 and parameters: {'n_estimators': 250, 'max_depth': 8, 'min_samples_split': 13, 'min_samples_leaf': 14, 'max_features': 'sqrt'}. Best is trial 39 with value: 0.7773633820317578.
ENV CHECKPOINT PATH: 
DEFAULT PATH: /scratch.hpc/luca.cotugno/Foundation_model_clinical_data/src/models_diff/tabdpt1_1.pth
ENV CHECKPOINT PATH: 
DEFAULT PATH: /scratch.hpc/luca.cotugno/Foundation_model_clinical_data/src/models_diff/tabdpt1_1.pth
[I 2026-07-01 05:05:28,781] A new study created in memory with name: deepsurv_tuning_tabdpt_5_-1_seed123
/scratch.hpc/luca.cotugno/Foundation_model_clinical_data/test_tabular_model.py:481: UserWarning: Choices for a categorical distribution should be a tuple of None, bool, int, float and str for persistent storage but contains [32] which is of type list.
  num_nodes  = trial.suggest_categorical("num_nodes", [[32], [64], [128], [64, 32], [128, 64]])
/scratch.hpc/luca.cotugno/Foundation_model_clinical_data/test_tabular_model.py:481: UserWarning: Choices for a categorical distribution should be a tuple of None, bool, int, float and str for persistent storage but contains [64] which is of type list.
  num_nodes  = trial.suggest_categorical("num_nodes", [[32], [64], [128], [64, 32], [128, 64]])
/scratch.hpc/luca.cotugno/Foundation_model_clinical_data/test_tabular_model.py:481: UserWarning: Choices for a categorical distribution should be a tuple of None, bool, int, float and str for persistent storage but contains [128] which is of type list.
  num_nodes  = trial.suggest_categorical("num_nodes", [[32], [64], [128], [64, 32], [128, 64]])
/scratch.hpc/luca.cotugno/Foundation_model_clinical_data/test_tabular_model.py:481: UserWarning: Choices for a categorical distribution should be a tuple of None, bool, int, float and str for persistent storage but contains [64, 32] which is of type list.
  num_nodes  = trial.suggest_categorical("num_nodes", [[32], [64], [128], [64, 32], [128, 64]])
/scratch.hpc/luca.cotugno/Foundation_model_clinical_data/test_tabular_model.py:481: UserWarning: Choices for a categorical distribution should be a tuple of None, bool, int, float and str for persistent storage but contains [128, 64] which is of type list.
  num_nodes  = trial.suggest_categorical("num_nodes", [[32], [64], [128], [64, 32], [128, 64]])
[I 2026-07-01 05:05:53,336] Trial 0 finished with value: 0.724612429846352 and parameters: {'num_nodes': [64, 32], 'dropout': 0.034084003654344, 'learning_rate': 0.00047550722721134264, 'batch_norm': True}. Best is trial 0 with value: 0.724612429846352.
/scratch.hpc/luca.cotugno/Foundation_model_clinical_data/test_tabular_model.py:481: UserWarning: Choices for a categorical distribution should be a tuple of None, bool, int, float and str for persistent storage but contains [32] which is of type list.
  num_nodes  = trial.suggest_categorical("num_nodes", [[32], [64], [128], [64, 32], [128, 64]])
/scratch.hpc/luca.cotugno/Foundation_model_clinical_data/test_tabular_model.py:481: UserWarning: Choices for a categorical distribution should be a tuple of None, bool, int, float and str for persistent storage but contains [64] which is of type list.
  num_nodes  = trial.suggest_categorical("num_nodes", [[32], [64], [128], [64, 32], [128, 64]])
/scratch.hpc/luca.cotugno/Foundation_model_clinical_data/test_tabular_model.py:481: UserWarning: Choices for a categorical distribution should be a tuple of None, bool, int, float and str for persistent storage but contains [128] which is of type list.
  num_nodes  = trial.suggest_categorical("num_nodes", [[32], [64], [128], [64, 32], [128, 64]])
/scratch.hpc/luca.cotugno/Foundation_model_clinical_data/test_tabular_model.py:481: UserWarning: Choices for a categorical distribution should be a tuple of None, bool, int, float and str for persistent storage but contains [64, 32] which is of type list.
  num_nodes  = trial.suggest_categorical("num_nodes", [[32], [64], [128], [64, 32], [128, 64]])
/scratch.hpc/luca.cotugno/Foundation_model_clinical_data/test_tabular_model.py:481: UserWarning: Choices for a categorical distribution should be a tuple of None, bool, int, float and str for persistent storage but contains [128, 64] which is of type list.
  num_nodes  = trial.suggest_categorical("num_nodes", [[32], [64], [128], [64, 32], [128, 64]])
[I 2026-07-01 05:05:53,374] Trial 7 finished with value: 0.7664631060815162 and parameters: {'num_nodes': [64, 32], 'dropout': 0.09020098170742308, 'learning_rate': 0.0001554267775307936, 'batch_norm': False}. Best is trial 7 with value: 0.7664631060815162.
[I 2026-07-01 05:05:57,519] Trial 6 finished with value: 0.7295116846075996 and parameters: {'num_nodes': [32], 'dropout': 0.10271844168581325, 'learning_rate': 0.000600121961961986, 'batch_norm': True}. Best is trial 7 with value: 0.7664631060815162.
/scratch.hpc/luca.cotugno/Foundation_model_clinical_data/test_tabular_model.py:481: UserWarning: Choices for a categorical distribution should be a tuple of None, bool, int, float and str for persistent storage but contains [32] which is of type list.
  num_nodes  = trial.suggest_categorical("num_nodes", [[32], [64], [128], [64, 32], [128, 64]])
/scratch.hpc/luca.cotugno/Foundation_model_clinical_data/test_tabular_model.py:481: UserWarning: Choices for a categorical distribution should be a tuple of None, bool, int, float and str for persistent storage but contains [64] which is of type list.
  num_nodes  = trial.suggest_categorical("num_nodes", [[32], [64], [128], [64, 32], [128, 64]])
/scratch.hpc/luca.cotugno/Foundation_model_clinical_data/test_tabular_model.py:481: UserWarning: Choices for a categorical distribution should be a tuple of None, bool, int, float and str for persistent storage but contains [128] which is of type list.
  num_nodes  = trial.suggest_categorical("num_nodes", [[32], [64], [128], [64, 32], [128, 64]])
/scratch.hpc/luca.cotugno/Foundation_model_clinical_data/test_tabular_model.py:481: UserWarning: Choices for a categorical distribution should be a tuple of None, bool, int, float and str for persistent storage but contains [64, 32] which is of type list.
  num_nodes  = trial.suggest_categorical("num_nodes", [[32], [64], [128], [64, 32], [128, 64]])
/scratch.hpc/luca.cotugno/Foundation_model_clinical_data/test_tabular_model.py:481: UserWarning: Choices for a categorical distribution should be a tuple of None, bool, int, float and str for persistent storage but contains [128, 64] which is of type list.
  num_nodes  = trial.suggest_categorical("num_nodes", [[32], [64], [128], [64, 32], [128, 64]])
[I 2026-07-01 05:06:07,709] Trial 8 finished with value: 0.7407880209770908 and parameters: {'num_nodes': [32], 'dropout': 0.0497935306820904, 'learning_rate': 0.0011897695349467514, 'batch_norm': False}. Best is trial 7 with value: 0.7664631060815162.
/scratch.hpc/luca.cotugno/Foundation_model_clinical_data/test_tabular_model.py:481: UserWarning: Choices for a categorical distribution should be a tuple of None, bool, int, float and str for persistent storage but contains [32] which is of type list.
  num_nodes  = trial.suggest_categorical("num_nodes", [[32], [64], [128], [64, 32], [128, 64]])
/scratch.hpc/luca.cotugno/Foundation_model_clinical_data/test_tabular_model.py:481: UserWarning: Choices for a categorical distribution should be a tuple of None, bool, int, float and str for persistent storage but contains [64] which is of type list.
  num_nodes  = trial.suggest_categorical("num_nodes", [[32], [64], [128], [64, 32], [128, 64]])
/scratch.hpc/luca.cotugno/Foundation_model_clinical_data/test_tabular_model.py:481: UserWarning: Choices for a categorical distribution should be a tuple of None, bool, int, float and str for persistent storage but contains [128] which is of type list.
  num_nodes  = trial.suggest_categorical("num_nodes", [[32], [64], [128], [64, 32], [128, 64]])
/scratch.hpc/luca.cotugno/Foundation_model_clinical_data/test_tabular_model.py:481: UserWarning: Choices for a categorical distribution should be a tuple of None, bool, int, float and str for persistent storage but contains [64, 32] which is of type list.
  num_nodes  = trial.suggest_categorical("num_nodes", [[32], [64], [128], [64, 32], [128, 64]])
/scratch.hpc/luca.cotugno/Foundation_model_clinical_data/test_tabular_model.py:481: UserWarning: Choices for a categorical distribution should be a tuple of None, bool, int, float and str for persistent storage but contains [128, 64] which is of type list.
  num_nodes  = trial.suggest_categorical("num_nodes", [[32], [64], [128], [64, 32], [128, 64]])
[I 2026-07-01 05:06:09,948] Trial 9 finished with value: 0.7604272088815285 and parameters: {'num_nodes': [32], 'dropout': 0.03646956385608859, 'learning_rate': 0.006830600652593995, 'batch_norm': True}. Best is trial 7 with value: 0.7664631060815162.
/scratch.hpc/luca.cotugno/Foundation_model_clinical_data/test_tabular_model.py:481: UserWarning: Choices for a categorical distribution should be a tuple of None, bool, int, float and str for persistent storage but contains [32] which is of type list.
  num_nodes  = trial.suggest_categorical("num_nodes", [[32], [64], [128], [64, 32], [128, 64]])
/scratch.hpc/luca.cotugno/Foundation_model_clinical_data/test_tabular_model.py:481: UserWarning: Choices for a categorical distribution should be a tuple of None, bool, int, float and str for persistent storage but contains [64] which is of type list.
  num_nodes  = trial.suggest_categorical("num_nodes", [[32], [64], [128], [64, 32], [128, 64]])
/scratch.hpc/luca.cotugno/Foundation_model_clinical_data/test_tabular_model.py:481: UserWarning: Choices for a categorical distribution should be a tuple of None, bool, int, float and str for persistent storage but contains [128] which is of type list.
  num_nodes  = trial.suggest_categorical("num_nodes", [[32], [64], [128], [64, 32], [128, 64]])
/scratch.hpc/luca.cotugno/Foundation_model_clinical_data/test_tabular_model.py:481: UserWarning: Choices for a categorical distribution should be a tuple of None, bool, int, float and str for persistent storage but contains [64, 32] which is of type list.
  num_nodes  = trial.suggest_categorical("num_nodes", [[32], [64], [128], [64, 32], [128, 64]])
/scratch.hpc/luca.cotugno/Foundation_model_clinical_data/test_tabular_model.py:481: UserWarning: Choices for a categorical distribution should be a tuple of None, bool, int, float and str for persistent storage but contains [128, 64] which is of type list.
  num_nodes  = trial.suggest_categorical("num_nodes", [[32], [64], [128], [64, 32], [128, 64]])
[I 2026-07-01 05:06:12,811] Trial 1 finished with value: 0.738936424694084 and parameters: {'num_nodes': [64], 'dropout': 0.28151260004370204, 'learning_rate': 0.0001862922260976907, 'batch_norm': True}. Best is trial 7 with value: 0.7664631060815162.
/scratch.hpc/luca.cotugno/Foundation_model_clinical_data/test_tabular_model.py:481: UserWarning: Choices for a categorical distribution should be a tuple of None, bool, int, float and str for persistent storage but contains [32] which is of type list.
  num_nodes  = trial.suggest_categorical("num_nodes", [[32], [64], [128], [64, 32], [128, 64]])
/scratch.hpc/luca.cotugno/Foundation_model_clinical_data/test_tabular_model.py:481: UserWarning: Choices for a categorical distribution should be a tuple of None, bool, int, float and str for persistent storage but contains [64] which is of type list.
  num_nodes  = trial.suggest_categorical("num_nodes", [[32], [64], [128], [64, 32], [128, 64]])
/scratch.hpc/luca.cotugno/Foundation_model_clinical_data/test_tabular_model.py:481: UserWarning: Choices for a categorical distribution should be a tuple of None, bool, int, float and str for persistent storage but contains [128] which is of type list.
  num_nodes  = trial.suggest_categorical("num_nodes", [[32], [64], [128], [64, 32], [128, 64]])
/scratch.hpc/luca.cotugno/Foundation_model_clinical_data/test_tabular_model.py:481: UserWarning: Choices for a categorical distribution should be a tuple of None, bool, int, float and str for persistent storage but contains [64, 32] which is of type list.
  num_nodes  = trial.suggest_categorical("num_nodes", [[32], [64], [128], [64, 32], [128, 64]])
/scratch.hpc/luca.cotugno/Foundation_model_clinical_data/test_tabular_model.py:481: UserWarning: Choices for a categorical distribution should be a tuple of None, bool, int, float and str for persistent storage but contains [128, 64] which is of type list.
  num_nodes  = trial.suggest_categorical("num_nodes", [[32], [64], [128], [64, 32], [128, 64]])
[I 2026-07-01 05:06:16,880] Trial 10 finished with value: 0.7554972858588647 and parameters: {'num_nodes': [32], 'dropout': 0.15670904950161066, 'learning_rate': 0.006728266549504485, 'batch_norm': False}. Best is trial 7 with value: 0.7664631060815162.
/scratch.hpc/luca.cotugno/Foundation_model_clinical_data/test_tabular_model.py:481: UserWarning: Choices for a categorical distribution should be a tuple of None, bool, int, float and str for persistent storage but contains [32] which is of type list.
  num_nodes  = trial.suggest_categorical("num_nodes", [[32], [64], [128], [64, 32], [128, 64]])
/scratch.hpc/luca.cotugno/Foundation_model_clinical_data/test_tabular_model.py:481: UserWarning: Choices for a categorical distribution should be a tuple of None, bool, int, float and str for persistent storage but contains [64] which is of type list.
  num_nodes  = trial.suggest_categorical("num_nodes", [[32], [64], [128], [64, 32], [128, 64]])
/scratch.hpc/luca.cotugno/Foundation_model_clinical_data/test_tabular_model.py:481: UserWarning: Choices for a categorical distribution should be a tuple of None, bool, int, float and str for persistent storage but contains [128] which is of type list.
  num_nodes  = trial.suggest_categorical("num_nodes", [[32], [64], [128], [64, 32], [128, 64]])
/scratch.hpc/luca.cotugno/Foundation_model_clinical_data/test_tabular_model.py:481: UserWarning: Choices for a categorical distribution should be a tuple of None, bool, int, float and str for persistent storage but contains [64, 32] which is of type list.
  num_nodes  = trial.suggest_categorical("num_nodes", [[32], [64], [128], [64, 32], [128, 64]])
/scratch.hpc/luca.cotugno/Foundation_model_clinical_data/test_tabular_model.py:481: UserWarning: Choices for a categorical distribution should be a tuple of None, bool, int, float and str for persistent storage but contains [128, 64] which is of type list.
  num_nodes  = trial.suggest_categorical("num_nodes", [[32], [64], [128], [64, 32], [128, 64]])
[I 2026-07-01 05:06:24,624] Trial 11 finished with value: 0.6927040206090717 and parameters: {'num_nodes': [128, 64], 'dropout': 0.0321724895212112, 'learning_rate': 0.0030296795838492966, 'batch_norm': True}. Best is trial 7 with value: 0.7664631060815162.
/scratch.hpc/luca.cotugno/Foundation_model_clinical_data/test_tabular_model.py:481: UserWarning: Choices for a categorical distribution should be a tuple of None, bool, int, float and str for persistent storage but contains [32] which is of type list.
  num_nodes  = trial.suggest_categorical("num_nodes", [[32], [64], [128], [64, 32], [128, 64]])
/scratch.hpc/luca.cotugno/Foundation_model_clinical_data/test_tabular_model.py:481: UserWarning: Choices for a categorical distribution should be a tuple of None, bool, int, float and str for persistent storage but contains [64] which is of type list.
  num_nodes  = trial.suggest_categorical("num_nodes", [[32], [64], [128], [64, 32], [128, 64]])
/scratch.hpc/luca.cotugno/Foundation_model_clinical_data/test_tabular_model.py:481: UserWarning: Choices for a categorical distribution should be a tuple of None, bool, int, float and str for persistent storage but contains [128] which is of type list.
  num_nodes  = trial.suggest_categorical("num_nodes", [[32], [64], [128], [64, 32], [128, 64]])
/scratch.hpc/luca.cotugno/Foundation_model_clinical_data/test_tabular_model.py:481: UserWarning: Choices for a categorical distribution should be a tuple of None, bool, int, float and str for persistent storage but contains [64, 32] which is of type list.
  num_nodes  = trial.suggest_categorical("num_nodes", [[32], [64], [128], [64, 32], [128, 64]])
/scratch.hpc/luca.cotugno/Foundation_model_clinical_data/test_tabular_model.py:481: UserWarning: Choices for a categorical distribution should be a tuple of None, bool, int, float and str for persistent storage but contains [128, 64] which is of type list.
  num_nodes  = trial.suggest_categorical("num_nodes", [[32], [64], [128], [64, 32], [128, 64]])
