/scratch.hpc/luca.cotugno/Foundation_model_clinical_data/.venv/lib/python3.12/site-packages/sklearn/utils/validation.py:2684: UserWarning: X has feature names, but RandomSurvivalForest was fitted without feature names
  warnings.warn(
/scratch.hpc/luca.cotugno/Foundation_model_clinical_data/.venv/lib/python3.12/site-packages/sklearn/utils/validation.py:2684: UserWarning: X has feature names, but RandomSurvivalForest was fitted without feature names
  warnings.warn(
/scratch.hpc/luca.cotugno/Foundation_model_clinical_data/.venv/lib/python3.12/site-packages/sklearn/utils/validation.py:2684: UserWarning: X has feature names, but RandomSurvivalForest was fitted without feature names
  warnings.warn(
/scratch.hpc/luca.cotugno/Foundation_model_clinical_data/.venv/lib/python3.12/site-packages/sklearn/utils/validation.py:2684: UserWarning: X has feature names, but RandomSurvivalForest was fitted without feature names
  warnings.warn(
[I 2026-05-30 11:18:17,975] A new study created in memory with name: rsf_tuning_tabpfn_3_-1_seed77
[I 2026-05-30 11:21:22,725] Trial 0 finished with value: 0.792739914363894 and parameters: {'n_estimators': 100, 'max_depth': 6, 'min_samples_split': 9, 'min_samples_leaf': 12, 'max_features': 'log2'}. Best is trial 0 with value: 0.792739914363894.
[I 2026-05-30 11:23:43,457] Trial 3 finished with value: 0.7884312638899809 and parameters: {'n_estimators': 150, 'max_depth': 10, 'min_samples_split': 13, 'min_samples_leaf': 6, 'max_features': 'log2'}. Best is trial 0 with value: 0.792739914363894.
[I 2026-05-30 11:24:49,608] Trial 1 finished with value: 0.7979708883259925 and parameters: {'n_estimators': 250, 'max_depth': 4, 'min_samples_split': 9, 'min_samples_leaf': 3, 'max_features': 'log2'}. Best is trial 1 with value: 0.7979708883259925.
[I 2026-05-30 11:25:12,718] Trial 2 finished with value: 0.7838944294345831 and parameters: {'n_estimators': 150, 'max_depth': 4, 'min_samples_split': 6, 'min_samples_leaf': 3, 'max_features': 'sqrt'}. Best is trial 1 with value: 0.7979708883259925.
[I 2026-05-30 11:26:22,404] Trial 5 finished with value: 0.7598699159554293 and parameters: {'n_estimators': 50, 'max_depth': 5, 'min_samples_split': 5, 'min_samples_leaf': 11, 'max_features': 'sqrt'}. Best is trial 1 with value: 0.7979708883259925.
[I 2026-05-30 11:26:32,607] Trial 6 finished with value: 0.7840727580923819 and parameters: {'n_estimators': 50, 'max_depth': 9, 'min_samples_split': 16, 'min_samples_leaf': 15, 'max_features': 'log2'}. Best is trial 1 with value: 0.7979708883259925.
[I 2026-05-30 11:27:04,159] Trial 4 finished with value: 0.7976506637469344 and parameters: {'n_estimators': 150, 'max_depth': 10, 'min_samples_split': 13, 'min_samples_leaf': 7, 'max_features': 'log2'}. Best is trial 1 with value: 0.7979708883259925.
[I 2026-05-30 11:29:35,312] Trial 9 finished with value: 0.7953745764694378 and parameters: {'n_estimators': 100, 'max_depth': 5, 'min_samples_split': 7, 'min_samples_leaf': 3, 'max_features': 'log2'}. Best is trial 1 with value: 0.7979708883259925.
[I 2026-05-30 11:35:04,937] Trial 11 finished with value: 0.7972767488192917 and parameters: {'n_estimators': 150, 'max_depth': 8, 'min_samples_split': 5, 'min_samples_leaf': 9, 'max_features': 'log2'}. Best is trial 1 with value: 0.7979708883259925.
[I 2026-05-30 11:37:04,810] Trial 12 finished with value: 0.7824869752966871 and parameters: {'n_estimators': 50, 'max_depth': 8, 'min_samples_split': 13, 'min_samples_leaf': 15, 'max_features': 'log2'}. Best is trial 1 with value: 0.7979708883259925.
[I 2026-05-30 11:37:38,676] Trial 10 finished with value: 0.7994435378871697 and parameters: {'n_estimators': 300, 'max_depth': 6, 'min_samples_split': 15, 'min_samples_leaf': 3, 'max_features': 'log2'}. Best is trial 10 with value: 0.7994435378871697.
[I 2026-05-30 11:39:41,608] Trial 7 finished with value: 0.7928453775486137 and parameters: {'n_estimators': 250, 'max_depth': 8, 'min_samples_split': 18, 'min_samples_leaf': 11, 'max_features': 'sqrt'}. Best is trial 10 with value: 0.7994435378871697.
[I 2026-05-30 11:42:21,061] Trial 8 finished with value: 0.799888400775442 and parameters: {'n_estimators': 300, 'max_depth': 6, 'min_samples_split': 6, 'min_samples_leaf': 11, 'max_features': 'sqrt'}. Best is trial 8 with value: 0.799888400775442.
[I 2026-05-30 11:45:56,198] Trial 15 finished with value: 0.7956717908991024 and parameters: {'n_estimators': 300, 'max_depth': 3, 'min_samples_split': 10, 'min_samples_leaf': 5, 'max_features': 'log2'}. Best is trial 8 with value: 0.799888400775442.
[I 2026-05-30 11:48:04,472] Trial 13 finished with value: 0.7962432096090384 and parameters: {'n_estimators': 300, 'max_depth': 3, 'min_samples_split': 20, 'min_samples_leaf': 6, 'max_features': 'sqrt'}. Best is trial 8 with value: 0.799888400775442.
[I 2026-05-30 11:48:33,639] Trial 14 finished with value: 0.797303593993584 and parameters: {'n_estimators': 300, 'max_depth': 3, 'min_samples_split': 20, 'min_samples_leaf': 5, 'max_features': 'sqrt'}. Best is trial 8 with value: 0.799888400775442.
[I 2026-05-30 11:57:59,317] Trial 16 finished with value: 0.7978232398673848 and parameters: {'n_estimators': 300, 'max_depth': 6, 'min_samples_split': 20, 'min_samples_leaf': 6, 'max_features': 'sqrt'}. Best is trial 8 with value: 0.799888400775442.
[I 2026-05-30 12:00:45,351] Trial 18 finished with value: 0.8000993271448815 and parameters: {'n_estimators': 250, 'max_depth': 6, 'min_samples_split': 16, 'min_samples_leaf': 9, 'max_features': 'sqrt'}. Best is trial 18 with value: 0.8000993271448815.
[I 2026-05-30 12:01:04,866] Trial 17 finished with value: 0.7959939329906099 and parameters: {'n_estimators': 300, 'max_depth': 6, 'min_samples_split': 20, 'min_samples_leaf': 9, 'max_features': 'sqrt'}. Best is trial 18 with value: 0.8000993271448815.
[I 2026-05-30 12:01:48,848] Trial 19 finished with value: 0.7918770337616416 and parameters: {'n_estimators': 250, 'max_depth': 7, 'min_samples_split': 15, 'min_samples_leaf': 9, 'max_features': 'sqrt'}. Best is trial 18 with value: 0.8000993271448815.
[I 2026-05-30 12:11:46,117] Trial 20 finished with value: 0.7918770337616416 and parameters: {'n_estimators': 250, 'max_depth': 7, 'min_samples_split': 16, 'min_samples_leaf': 9, 'max_features': 'sqrt'}. Best is trial 18 with value: 0.8000993271448815.
[I 2026-05-30 12:12:28,932] Trial 23 finished with value: 0.7890026825999168 and parameters: {'n_estimators': 200, 'max_depth': 7, 'min_samples_split': 11, 'min_samples_leaf': 13, 'max_features': 'sqrt'}. Best is trial 18 with value: 0.8000993271448815.
[I 2026-05-30 12:14:04,194] Trial 21 finished with value: 0.7918770337616416 and parameters: {'n_estimators': 250, 'max_depth': 7, 'min_samples_split': 16, 'min_samples_leaf': 9, 'max_features': 'sqrt'}. Best is trial 18 with value: 0.8000993271448815.
[I 2026-05-30 12:14:21,935] Trial 22 finished with value: 0.7931905297895147 and parameters: {'n_estimators': 250, 'max_depth': 7, 'min_samples_split': 16, 'min_samples_leaf': 13, 'max_features': 'sqrt'}. Best is trial 18 with value: 0.8000993271448815.
[I 2026-05-30 12:21:25,480] Trial 24 finished with value: 0.7740192403199178 and parameters: {'n_estimators': 200, 'max_depth': 5, 'min_samples_split': 11, 'min_samples_leaf': 13, 'max_features': 'sqrt'}. Best is trial 18 with value: 0.8000993271448815.
[I 2026-05-30 12:21:59,181] Trial 25 finished with value: 0.7740192403199178 and parameters: {'n_estimators': 200, 'max_depth': 5, 'min_samples_split': 15, 'min_samples_leaf': 13, 'max_features': 'sqrt'}. Best is trial 18 with value: 0.8000993271448815.
[I 2026-05-30 12:23:52,913] Trial 26 finished with value: 0.7771658782494645 and parameters: {'n_estimators': 200, 'max_depth': 5, 'min_samples_split': 18, 'min_samples_leaf': 11, 'max_features': 'sqrt'}. Best is trial 18 with value: 0.8000993271448815.
[I 2026-05-30 12:24:13,485] Trial 27 finished with value: 0.7771658782494645 and parameters: {'n_estimators': 200, 'max_depth': 5, 'min_samples_split': 18, 'min_samples_leaf': 11, 'max_features': 'sqrt'}. Best is trial 18 with value: 0.8000993271448815.
[I 2026-05-30 12:31:06,185] Trial 28 finished with value: 0.7771658782494645 and parameters: {'n_estimators': 200, 'max_depth': 5, 'min_samples_split': 18, 'min_samples_leaf': 11, 'max_features': 'sqrt'}. Best is trial 18 with value: 0.8000993271448815.
[I 2026-05-30 12:31:13,284] Trial 29 finished with value: 0.8006918384917614 and parameters: {'n_estimators': 300, 'max_depth': 6, 'min_samples_split': 14, 'min_samples_leaf': 11, 'max_features': 'log2'}. Best is trial 29 with value: 0.8006918384917614.
[I 2026-05-30 12:33:07,493] Trial 30 finished with value: 0.7967225877214008 and parameters: {'n_estimators': 300, 'max_depth': 6, 'min_samples_split': 18, 'min_samples_leaf': 8, 'max_features': 'log2'}. Best is trial 29 with value: 0.8006918384917614.
[I 2026-05-30 12:33:29,001] Trial 31 finished with value: 0.7983543908158823 and parameters: {'n_estimators': 300, 'max_depth': 6, 'min_samples_split': 14, 'min_samples_leaf': 8, 'max_features': 'log2'}. Best is trial 29 with value: 0.8006918384917614.
[I 2026-05-30 12:40:43,944] Trial 32 finished with value: 0.7983543908158823 and parameters: {'n_estimators': 300, 'max_depth': 6, 'min_samples_split': 8, 'min_samples_leaf': 8, 'max_features': 'log2'}. Best is trial 29 with value: 0.8006918384917614.
[I 2026-05-30 12:40:57,418] Trial 33 finished with value: 0.7983543908158823 and parameters: {'n_estimators': 300, 'max_depth': 6, 'min_samples_split': 9, 'min_samples_leaf': 8, 'max_features': 'log2'}. Best is trial 29 with value: 0.8006918384917614.
[I 2026-05-30 12:41:35,097] Trial 35 finished with value: 0.799299724453461 and parameters: {'n_estimators': 250, 'max_depth': 6, 'min_samples_split': 8, 'min_samples_leaf': 12, 'max_features': 'log2'}. Best is trial 29 with value: 0.8006918384917614.
[I 2026-05-30 12:42:45,958] Trial 34 finished with value: 0.8006343131182779 and parameters: {'n_estimators': 300, 'max_depth': 6, 'min_samples_split': 14, 'min_samples_leaf': 12, 'max_features': 'log2'}. Best is trial 29 with value: 0.8006918384917614.
[I 2026-05-30 12:46:48,300] Trial 36 finished with value: 0.7874840127399527 and parameters: {'n_estimators': 250, 'max_depth': 4, 'min_samples_split': 12, 'min_samples_leaf': 12, 'max_features': 'log2'}. Best is trial 29 with value: 0.8006918384917614.
[I 2026-05-30 12:47:01,932] Trial 37 finished with value: 0.7874840127399527 and parameters: {'n_estimators': 250, 'max_depth': 4, 'min_samples_split': 12, 'min_samples_leaf': 12, 'max_features': 'log2'}. Best is trial 29 with value: 0.8006918384917614.
[I 2026-05-30 12:47:41,222] Trial 38 finished with value: 0.7886230151349257 and parameters: {'n_estimators': 250, 'max_depth': 4, 'min_samples_split': 12, 'min_samples_leaf': 10, 'max_features': 'log2'}. Best is trial 29 with value: 0.8006918384917614.
[I 2026-05-30 12:51:19,461] Trial 39 finished with value: 0.7999881114228135 and parameters: {'n_estimators': 250, 'max_depth': 8, 'min_samples_split': 12, 'min_samples_leaf': 10, 'max_features': 'log2'}. Best is trial 29 with value: 0.8006918384917614.
[I 2026-05-30 12:55:47,241] Trial 40 finished with value: 0.7983179580793428 and parameters: {'n_estimators': 300, 'max_depth': 4, 'min_samples_split': 14, 'min_samples_leaf': 14, 'max_features': 'log2'}. Best is trial 29 with value: 0.8006918384917614.
[I 2026-05-30 12:59:19,693] Trial 41 finished with value: 0.8006822509295142 and parameters: {'n_estimators': 300, 'max_depth': 8, 'min_samples_split': 14, 'min_samples_leaf': 10, 'max_features': 'log2'}. Best is trial 29 with value: 0.8006918384917614.
[I 2026-05-30 13:00:36,741] Trial 42 finished with value: 0.7999823588854651 and parameters: {'n_estimators': 300, 'max_depth': 9, 'min_samples_split': 14, 'min_samples_leaf': 10, 'max_features': 'log2'}. Best is trial 29 with value: 0.8006918384917614.
[I 2026-05-30 13:03:08,944] Trial 43 finished with value: 0.7973783769791125 and parameters: {'n_estimators': 250, 'max_depth': 9, 'min_samples_split': 14, 'min_samples_leaf': 10, 'max_features': 'log2'}. Best is trial 29 with value: 0.8006918384917614.
[I 2026-05-30 13:07:58,027] Trial 44 finished with value: 0.7973783769791125 and parameters: {'n_estimators': 250, 'max_depth': 9, 'min_samples_split': 14, 'min_samples_leaf': 10, 'max_features': 'log2'}. Best is trial 29 with value: 0.8006918384917614.
[I 2026-05-30 13:08:24,018] Trial 47 finished with value: 0.7956315231376639 and parameters: {'n_estimators': 100, 'max_depth': 8, 'min_samples_split': 17, 'min_samples_leaf': 10, 'max_features': 'log2'}. Best is trial 29 with value: 0.8006918384917614.
[I 2026-05-30 13:11:48,472] Trial 45 finished with value: 0.7973783769791125 and parameters: {'n_estimators': 250, 'max_depth': 9, 'min_samples_split': 14, 'min_samples_leaf': 10, 'max_features': 'log2'}. Best is trial 29 with value: 0.8006918384917614.
[I 2026-05-30 13:12:33,605] Trial 48 finished with value: 0.7956315231376639 and parameters: {'n_estimators': 100, 'max_depth': 8, 'min_samples_split': 17, 'min_samples_leaf': 10, 'max_features': 'log2'}. Best is trial 29 with value: 0.8006918384917614.
[I 2026-05-30 13:13:11,699] Trial 46 finished with value: 0.7973783769791125 and parameters: {'n_estimators': 250, 'max_depth': 9, 'min_samples_split': 13, 'min_samples_leaf': 10, 'max_features': 'log2'}. Best is trial 29 with value: 0.8006918384917614.
[I 2026-05-30 13:22:54,739] Trial 49 finished with value: 0.798881706739481 and parameters: {'n_estimators': 300, 'max_depth': 8, 'min_samples_split': 13, 'min_samples_leaf': 7, 'max_features': 'log2'}. Best is trial 29 with value: 0.8006918384917614.
[I 2026-05-30 13:26:02,572] Trial 50 finished with value: 0.8022872088497035 and parameters: {'n_estimators': 300, 'max_depth': 8, 'min_samples_split': 13, 'min_samples_leaf': 12, 'max_features': 'log2'}. Best is trial 50 with value: 0.8022872088497035.
[I 2026-05-30 13:28:09,509] Trial 51 finished with value: 0.8018711086481729 and parameters: {'n_estimators': 300, 'max_depth': 10, 'min_samples_split': 13, 'min_samples_leaf': 7, 'max_features': 'log2'}. Best is trial 50 with value: 0.8022872088497035.
[I 2026-05-30 13:28:49,441] Trial 52 finished with value: 0.8018711086481729 and parameters: {'n_estimators': 300, 'max_depth': 10, 'min_samples_split': 11, 'min_samples_leaf': 7, 'max_features': 'log2'}. Best is trial 50 with value: 0.8022872088497035.
[I 2026-05-30 13:36:49,297] Trial 53 finished with value: 0.7965154963768603 and parameters: {'n_estimators': 300, 'max_depth': 7, 'min_samples_split': 10, 'min_samples_leaf': 14, 'max_features': 'log2'}. Best is trial 50 with value: 0.8022872088497035.
[I 2026-05-30 13:40:22,121] Trial 54 finished with value: 0.797094585136594 and parameters: {'n_estimators': 300, 'max_depth': 8, 'min_samples_split': 11, 'min_samples_leaf': 14, 'max_features': 'log2'}. Best is trial 50 with value: 0.8022872088497035.
[I 2026-05-30 13:42:40,672] Trial 55 finished with value: 0.8011501239671799 and parameters: {'n_estimators': 300, 'max_depth': 10, 'min_samples_split': 15, 'min_samples_leaf': 12, 'max_features': 'log2'}. Best is trial 50 with value: 0.8022872088497035.
[I 2026-05-30 13:44:15,290] Trial 56 finished with value: 0.8018711086481729 and parameters: {'n_estimators': 300, 'max_depth': 10, 'min_samples_split': 13, 'min_samples_leaf': 7, 'max_features': 'log2'}. Best is trial 50 with value: 0.8022872088497035.
[I 2026-05-30 13:52:10,773] Trial 57 finished with value: 0.8018711086481729 and parameters: {'n_estimators': 300, 'max_depth': 10, 'min_samples_split': 11, 'min_samples_leaf': 7, 'max_features': 'log2'}. Best is trial 50 with value: 0.8022872088497035.
[I 2026-05-30 13:55:38,576] Trial 58 finished with value: 0.7930601389429521 and parameters: {'n_estimators': 300, 'max_depth': 10, 'min_samples_split': 15, 'min_samples_leaf': 7, 'max_features': 'log2'}. Best is trial 50 with value: 0.8022872088497035.
[I 2026-05-30 13:58:16,836] Trial 59 finished with value: 0.7930601389429521 and parameters: {'n_estimators': 300, 'max_depth': 10, 'min_samples_split': 15, 'min_samples_leaf': 7, 'max_features': 'log2'}. Best is trial 50 with value: 0.8022872088497035.
[I 2026-05-30 13:59:43,733] Trial 60 finished with value: 0.8018711086481729 and parameters: {'n_estimators': 300, 'max_depth': 10, 'min_samples_split': 10, 'min_samples_leaf': 7, 'max_features': 'log2'}. Best is trial 50 with value: 0.8022872088497035.
[I 2026-05-30 14:08:02,460] Trial 61 finished with value: 0.8018711086481729 and parameters: {'n_estimators': 300, 'max_depth': 10, 'min_samples_split': 10, 'min_samples_leaf': 7, 'max_features': 'log2'}. Best is trial 50 with value: 0.8022872088497035.
[I 2026-05-30 14:12:10,804] Trial 62 finished with value: 0.7981588045460385 and parameters: {'n_estimators': 300, 'max_depth': 10, 'min_samples_split': 10, 'min_samples_leaf': 5, 'max_features': 'log2'}. Best is trial 50 with value: 0.8022872088497035.
[I 2026-05-30 14:14:27,292] Trial 63 finished with value: 0.7981588045460385 and parameters: {'n_estimators': 300, 'max_depth': 10, 'min_samples_split': 10, 'min_samples_leaf': 5, 'max_features': 'log2'}. Best is trial 50 with value: 0.8022872088497035.
[I 2026-05-30 14:15:44,375] Trial 64 finished with value: 0.7981588045460385 and parameters: {'n_estimators': 300, 'max_depth': 10, 'min_samples_split': 10, 'min_samples_leaf': 5, 'max_features': 'log2'}. Best is trial 50 with value: 0.8022872088497035.
[I 2026-05-30 14:24:16,019] Trial 65 finished with value: 0.7981588045460385 and parameters: {'n_estimators': 300, 'max_depth': 10, 'min_samples_split': 10, 'min_samples_leaf': 5, 'max_features': 'log2'}. Best is trial 50 with value: 0.8022872088497035.
[I 2026-05-30 14:27:51,762] Trial 66 finished with value: 0.7912154919665816 and parameters: {'n_estimators': 300, 'max_depth': 10, 'min_samples_split': 11, 'min_samples_leaf': 6, 'max_features': 'log2'}. Best is trial 50 with value: 0.8022872088497035.
[I 2026-05-30 14:30:09,020] Trial 67 finished with value: 0.7912154919665816 and parameters: {'n_estimators': 300, 'max_depth': 10, 'min_samples_split': 11, 'min_samples_leaf': 6, 'max_features': 'log2'}. Best is trial 50 with value: 0.8022872088497035.
[I 2026-05-30 14:31:39,865] Trial 68 finished with value: 0.7912154919665816 and parameters: {'n_estimators': 300, 'max_depth': 10, 'min_samples_split': 11, 'min_samples_leaf': 6, 'max_features': 'log2'}. Best is trial 50 with value: 0.8022872088497035.
[I 2026-05-30 14:31:52,970] Trial 69 finished with value: 0.7881091217984733 and parameters: {'n_estimators': 150, 'max_depth': 9, 'min_samples_split': 11, 'min_samples_leaf': 6, 'max_features': 'log2'}. Best is trial 50 with value: 0.8022872088497035.
[I 2026-05-30 14:38:02,136] Trial 71 finished with value: 0.7838023888370095 and parameters: {'n_estimators': 150, 'max_depth': 9, 'min_samples_split': 9, 'min_samples_leaf': 7, 'max_features': 'log2'}. Best is trial 50 with value: 0.8022872088497035.
[I 2026-05-30 14:39:35,997] Trial 72 finished with value: 0.7838023888370095 and parameters: {'n_estimators': 150, 'max_depth': 9, 'min_samples_split': 9, 'min_samples_leaf': 7, 'max_features': 'log2'}. Best is trial 50 with value: 0.8022872088497035.
[I 2026-05-30 14:43:26,111] Trial 70 finished with value: 0.7932384676007509 and parameters: {'n_estimators': 300, 'max_depth': 9, 'min_samples_split': 9, 'min_samples_leaf': 7, 'max_features': 'log2'}. Best is trial 50 with value: 0.8022872088497035.
[I 2026-05-30 14:48:19,563] Trial 73 finished with value: 0.796714917671603 and parameters: {'n_estimators': 300, 'max_depth': 9, 'min_samples_split': 9, 'min_samples_leaf': 4, 'max_features': 'log2'}. Best is trial 50 with value: 0.8022872088497035.
[I 2026-05-30 14:52:05,185] Trial 74 finished with value: 0.7966669798603667 and parameters: {'n_estimators': 300, 'max_depth': 10, 'min_samples_split': 13, 'min_samples_leaf': 8, 'max_features': 'log2'}. Best is trial 50 with value: 0.8022872088497035.
[I 2026-05-30 14:53:03,224] Trial 75 finished with value: 0.7966669798603667 and parameters: {'n_estimators': 300, 'max_depth': 10, 'min_samples_split': 12, 'min_samples_leaf': 8, 'max_features': 'log2'}. Best is trial 50 with value: 0.8022872088497035.
[I 2026-05-30 14:55:41,488] Trial 76 finished with value: 0.7966669798603667 and parameters: {'n_estimators': 300, 'max_depth': 10, 'min_samples_split': 12, 'min_samples_leaf': 8, 'max_features': 'log2'}. Best is trial 50 with value: 0.8022872088497035.
[I 2026-05-30 14:58:51,288] Trial 77 finished with value: 0.7966669798603667 and parameters: {'n_estimators': 300, 'max_depth': 10, 'min_samples_split': 13, 'min_samples_leaf': 8, 'max_features': 'log2'}. Best is trial 50 with value: 0.8022872088497035.
[I 2026-05-30 15:03:58,864] Trial 78 finished with value: 0.7966669798603667 and parameters: {'n_estimators': 300, 'max_depth': 10, 'min_samples_split': 12, 'min_samples_leaf': 8, 'max_features': 'log2'}. Best is trial 50 with value: 0.8022872088497035.
[I 2026-05-30 15:05:53,781] Trial 79 finished with value: 0.8018711086481729 and parameters: {'n_estimators': 300, 'max_depth': 10, 'min_samples_split': 8, 'min_samples_leaf': 7, 'max_features': 'log2'}. Best is trial 50 with value: 0.8022872088497035.
[I 2026-05-30 15:06:43,542] Trial 82 finished with value: 0.79343309511437 and parameters: {'n_estimators': 50, 'max_depth': 10, 'min_samples_split': 8, 'min_samples_leaf': 7, 'max_features': 'log2'}. Best is trial 50 with value: 0.8022872088497035.
[I 2026-05-30 15:09:32,105] Trial 80 finished with value: 0.8018711086481729 and parameters: {'n_estimators': 300, 'max_depth': 10, 'min_samples_split': 13, 'min_samples_leaf': 7, 'max_features': 'log2'}. Best is trial 50 with value: 0.8022872088497035.
