[I 2026-05-30 15:11:34,477] Trial 81 finished with value: 0.7993936825634841 and parameters: {'n_estimators': 250, 'max_depth': 10, 'min_samples_split': 7, 'min_samples_leaf': 7, 'max_features': 'log2'}. Best is trial 50 with value: 0.8022872088497035.
[I 2026-05-30 15:18:58,369] Trial 83 finished with value: 0.7993936825634841 and parameters: {'n_estimators': 250, 'max_depth': 10, 'min_samples_split': 7, 'min_samples_leaf': 7, 'max_features': 'log2'}. Best is trial 50 with value: 0.8022872088497035.
[I 2026-05-30 15:21:59,205] Trial 84 finished with value: 0.7912154919665816 and parameters: {'n_estimators': 300, 'max_depth': 10, 'min_samples_split': 7, 'min_samples_leaf': 6, 'max_features': 'log2'}. Best is trial 50 with value: 0.8022872088497035.
[I 2026-05-30 15:25:01,122] Trial 85 finished with value: 0.7912154919665816 and parameters: {'n_estimators': 300, 'max_depth': 10, 'min_samples_split': 6, 'min_samples_leaf': 6, 'max_features': 'log2'}. Best is trial 50 with value: 0.8022872088497035.
[I 2026-05-30 15:27:15,156] Trial 86 finished with value: 0.7912154919665816 and parameters: {'n_estimators': 300, 'max_depth': 10, 'min_samples_split': 7, 'min_samples_leaf': 6, 'max_features': 'log2'}. Best is trial 50 with value: 0.8022872088497035.
[I 2026-05-30 15:33:54,961] Trial 87 finished with value: 0.799491475698406 and parameters: {'n_estimators': 300, 'max_depth': 9, 'min_samples_split': 6, 'min_samples_leaf': 6, 'max_features': 'log2'}. Best is trial 50 with value: 0.8022872088497035.
[I 2026-05-30 15:37:21,801] Trial 88 finished with value: 0.799491475698406 and parameters: {'n_estimators': 300, 'max_depth': 9, 'min_samples_split': 6, 'min_samples_leaf': 6, 'max_features': 'log2'}. Best is trial 50 with value: 0.8022872088497035.
[I 2026-05-30 15:40:11,761] Trial 89 finished with value: 0.797738869319609 and parameters: {'n_estimators': 300, 'max_depth': 9, 'min_samples_split': 13, 'min_samples_leaf': 9, 'max_features': 'log2'}. Best is trial 50 with value: 0.8022872088497035.
[I 2026-05-30 15:42:14,430] Trial 90 finished with value: 0.797738869319609 and parameters: {'n_estimators': 300, 'max_depth': 9, 'min_samples_split': 13, 'min_samples_leaf': 9, 'max_features': 'log2'}. Best is trial 50 with value: 0.8022872088497035.
[I 2026-05-30 15:49:03,365] Trial 91 finished with value: 0.797738869319609 and parameters: {'n_estimators': 300, 'max_depth': 9, 'min_samples_split': 13, 'min_samples_leaf': 9, 'max_features': 'log2'}. Best is trial 50 with value: 0.8022872088497035.
[I 2026-05-30 15:52:09,937] Trial 92 finished with value: 0.797738869319609 and parameters: {'n_estimators': 300, 'max_depth': 9, 'min_samples_split': 13, 'min_samples_leaf': 9, 'max_features': 'log2'}. Best is trial 50 with value: 0.8022872088497035.
[I 2026-05-30 15:55:21,256] Trial 93 finished with value: 0.8018711086481729 and parameters: {'n_estimators': 300, 'max_depth': 10, 'min_samples_split': 8, 'min_samples_leaf': 7, 'max_features': 'log2'}. Best is trial 50 with value: 0.8022872088497035.
[I 2026-05-30 15:57:47,882] Trial 94 finished with value: 0.8018711086481729 and parameters: {'n_estimators': 300, 'max_depth': 10, 'min_samples_split': 11, 'min_samples_leaf': 7, 'max_features': 'log2'}. Best is trial 50 with value: 0.8022872088497035.
[I 2026-05-30 16:04:31,670] Trial 95 finished with value: 0.8018711086481729 and parameters: {'n_estimators': 300, 'max_depth': 10, 'min_samples_split': 11, 'min_samples_leaf': 7, 'max_features': 'log2'}. Best is trial 50 with value: 0.8022872088497035.
[I 2026-05-30 16:08:00,606] Trial 96 finished with value: 0.8018711086481729 and parameters: {'n_estimators': 300, 'max_depth': 10, 'min_samples_split': 11, 'min_samples_leaf': 7, 'max_features': 'log2'}. Best is trial 50 with value: 0.8022872088497035.
[I 2026-05-30 16:10:27,573] Trial 97 finished with value: 0.8018711086481729 and parameters: {'n_estimators': 300, 'max_depth': 10, 'min_samples_split': 8, 'min_samples_leaf': 7, 'max_features': 'log2'}. Best is trial 50 with value: 0.8022872088497035.
[I 2026-05-30 16:11:33,710] Trial 98 finished with value: 0.7966669798603667 and parameters: {'n_estimators': 300, 'max_depth': 10, 'min_samples_split': 8, 'min_samples_leaf': 8, 'max_features': 'log2'}. Best is trial 50 with value: 0.8022872088497035.
