[I 2026-06-09 05:38:27,881] Trial 15 finished with value: 0.8024053381861036 and parameters: {'num_nodes': [128], 'dropout': 0.26711947362290195, 'learning_rate': 0.0001051113852160346, 'batch_norm': False}. Best is trial 15 with value: 0.8024053381861036.
/scratch.hpc/luca.cotugno/Foundation_model_clinical_data/test_tabular_model_tmp.py:476: UserWarning: Choices for a categorical distribution should be a tuple of None, bool, int, float and str for persistent storage but contains [32] which is of type list.
  num_nodes  = trial.suggest_categorical("num_nodes", [[32], [64], [128], [64, 32], [128, 64]])
/scratch.hpc/luca.cotugno/Foundation_model_clinical_data/test_tabular_model_tmp.py:476: UserWarning: Choices for a categorical distribution should be a tuple of None, bool, int, float and str for persistent storage but contains [64] which is of type list.
  num_nodes  = trial.suggest_categorical("num_nodes", [[32], [64], [128], [64, 32], [128, 64]])
/scratch.hpc/luca.cotugno/Foundation_model_clinical_data/test_tabular_model_tmp.py:476: UserWarning: Choices for a categorical distribution should be a tuple of None, bool, int, float and str for persistent storage but contains [128] which is of type list.
  num_nodes  = trial.suggest_categorical("num_nodes", [[32], [64], [128], [64, 32], [128, 64]])
/scratch.hpc/luca.cotugno/Foundation_model_clinical_data/test_tabular_model_tmp.py:476: UserWarning: Choices for a categorical distribution should be a tuple of None, bool, int, float and str for persistent storage but contains [64, 32] which is of type list.
  num_nodes  = trial.suggest_categorical("num_nodes", [[32], [64], [128], [64, 32], [128, 64]])
/scratch.hpc/luca.cotugno/Foundation_model_clinical_data/test_tabular_model_tmp.py:476: UserWarning: Choices for a categorical distribution should be a tuple of None, bool, int, float and str for persistent storage but contains [128, 64] which is of type list.
  num_nodes  = trial.suggest_categorical("num_nodes", [[32], [64], [128], [64, 32], [128, 64]])

16:	[0s / 6s],		train_loss: 1.8796,	val_loss: 7.5258
17:	[0s / 7s],		train_loss: 1.8775,	val_loss: 7.5673
18:	[0s / 7s],		train_loss: 1.8640,	val_loss: 7.5726
19:	[0s / 8s],		train_loss: 1.8702,	val_loss: 7.5649
20:	[0s / 8s],		train_loss: 1.8743,	val_loss: 7.5924
21:	[0s / 8s],		train_loss: 1.8642,	val_loss: 7.5623
22:	[0s / 9s],		train_loss: 1.8571,	val_loss: 7.6187
23:	[0s / 9s],		train_loss: 1.8563,	val_loss: 7.6077
24:	[0s / 10s],		train_loss: 1.8590,	val_loss: 7.6510
  [ckpt] DeepSurv Tuned saved → checkpoints/tabicl/HURRAH/NaN/seed789/fold4/tabicl_deepsurv_tuned.pt
C-index train: 0.9623
C-index test:  0.7949
  [surv] Saved → survival_predictions/tabicl/HURRAH/NaN/seed789/fold4/tabicl_deepsurv_tuned.pkl
[Trial 0] START
[Trial 0] fitting...
[Trial 1] START
[Trial 1] fitting...
[Trial 2] START
[Trial 3] START
[Trial 3] fitting...
[Trial 2] fitting...
[Trial 2] done
[Trial 4] START
[Trial 4] fitting...
[Trial 0] done
[Trial 5] START
[Trial 5] fitting...
[Trial 3] done
[Trial 6] START
[Trial 6] fitting...
[Trial 4] done
[Trial 7] START
[Trial 7] fitting...
[Trial 7] done
[Trial 8] START
[Trial 8] fitting...
[Trial 1] done
[Trial 9] START
[Trial 9] fitting...
[Trial 6] done
[Trial 10] START
[Trial 10] fitting...
[Trial 9] done
[Trial 11] START
[Trial 11] fitting...
[Trial 5] done
[Trial 12] START
[Trial 12] fitting...
[Trial 12] done
[Trial 13] START
[Trial 13] fitting...
[Trial 10] done
[Trial 14] START
[Trial 14] fitting...
[Trial 8] done
[Trial 15] START
[Trial 15] fitting...
[Trial 13] done
[Trial 16] START
[Trial 16] fitting...
[Trial 15] done
[Trial 17] START
[Trial 17] fitting...
[Trial 16] done
[Trial 18] START
[Trial 18] fitting...
[Trial 11] done
[Trial 19] START
[Trial 19] fitting...
[Trial 14] done
[Trial 20] START
[Trial 20] fitting...
[Trial 17] done
[Trial 21] START
[Trial 21] fitting...
[Trial 18] done
[Trial 22] START
[Trial 22] fitting...
[Trial 20] done
[Trial 23] START
[Trial 23] fitting...
[Trial 19] done
[Trial 24] START
[Trial 24] fitting...
[Trial 21] done
[Trial 25] START
[Trial 25] fitting...
[Trial 22] done
[Trial 26] START
[Trial 26] fitting...
[Trial 23] done
[Trial 27] START
[Trial 27] fitting...
[Trial 24] done
[Trial 28] START
[Trial 28] fitting...
[Trial 25] done
[Trial 29] START
[Trial 29] fitting...
[Trial 26] done
[Trial 27] done
[Trial 30] START
[Trial 30] fitting...
[Trial 31] START
[Trial 31] fitting...
[Trial 28] done
[Trial 32] START
[Trial 32] fitting...
[Trial 32] done
[Trial 33] START
[Trial 33] fitting...
[Trial 29] done
[Trial 34] START
[Trial 34] fitting...
[Trial 30] done
[Trial 35] START
[Trial 35] fitting...
[Trial 31] done
[Trial 36] START
[Trial 36] fitting...
[Trial 33] done
[Trial 37] START
[Trial 37] fitting...
[Trial 35] done
[Trial 38] START
[Trial 38] fitting...
[Trial 36] done
[Trial 39] START
[Trial 39] fitting...
[Trial 34] done
[Trial 40] START
[Trial 40] fitting...
[Trial 40] done
[Trial 41] START
[Trial 41] fitting...
[Trial 38] done
[Trial 42] START
[Trial 42] fitting...
[Trial 39] done
[Trial 43] START
[Trial 43] fitting...
[Trial 37] done
[Trial 44] START
[Trial 44] fitting...
[Trial 42] done
[Trial 45] START
[Trial 45] fitting...
[Trial 43] done
[Trial 46] START
[Trial 46] fitting...
[Trial 41] done
[Trial 47] START
[Trial 47] fitting...
[Trial 44] done
[Trial 48] START
[Trial 48] fitting...
[Trial 45] done
[Trial 49] START
[Trial 49] fitting...
[Trial 46] done
[Trial 50] START
[Trial 50] fitting...
[Trial 47] done
[Trial 51] START
[Trial 51] fitting...
[Trial 48] done
[Trial 52] START
[Trial 52] fitting...
[Trial 49] done
[Trial 53] START
[Trial 53] fitting...
[Trial 50] done
[Trial 54] START
[Trial 54] fitting...
[Trial 52] done
[Trial 55] START
[Trial 55] fitting...
[Trial 54] done
[Trial 56] START
[Trial 56] fitting...
[Trial 51] done
[Trial 57] START
[Trial 57] fitting...
[Trial 55] done
[Trial 58] START
[Trial 58] fitting...
[Trial 57] done
[Trial 59] START
[Trial 59] fitting...
[Trial 53] done
[Trial 60] START
[Trial 60] fitting...
[Trial 56] done
[Trial 61] START
[Trial 61] fitting...
[Trial 58] done
[Trial 62] START
[Trial 62] fitting...
[Trial 59] done
[Trial 63] START
[Trial 63] fitting...
[Trial 60] done
[Trial 64] START
[Trial 64] fitting...
[Trial 61] done
[Trial 65] START
[Trial 65] fitting...
[Trial 62] done
[Trial 66] START
[Trial 66] fitting...
[Trial 63] done
[Trial 67] START
[Trial 67] fitting...
[Trial 64] done
[Trial 68] START
[Trial 68] fitting...
[Trial 65] done
[Trial 69] START
[Trial 69] fitting...
[Trial 66] done
[Trial 70] START
[Trial 70] fitting...
[Trial 68] done
[Trial 71] START
[Trial 71] fitting...
[Trial 67] done
[Trial 72] START
[Trial 72] fitting...
[Trial 69] done
[Trial 73] START
[Trial 73] fitting...
[Trial 70] done
[Trial 74] START
[Trial 74] fitting...
[Trial 71] done
[Trial 75] START
[Trial 75] fitting...
[Trial 73] done
[Trial 76] START
[Trial 76] fitting...
[Trial 72] done
[Trial 77] START
[Trial 77] fitting...
[Trial 74] done
[Trial 78] START
[Trial 78] fitting...
[Trial 75] done
[Trial 79] START
[Trial 79] fitting...
[Trial 76] done
[Trial 80] START
[Trial 80] fitting...
[Trial 77] done
[Trial 81] START
[Trial 81] fitting...
[Trial 78] done
[Trial 82] START
[Trial 82] fitting...
[Trial 79] done
[Trial 83] START
[Trial 83] fitting...
[Trial 80] done
[Trial 84] START
[Trial 84] fitting...
[Trial 81] done
[Trial 85] START
[Trial 85] fitting...
[Trial 82] done
[Trial 86] START
[Trial 86] fitting...
[Trial 83] done
[Trial 87] START
[Trial 87] fitting...
[Trial 85] done
[Trial 88] START
[Trial 88] fitting...
[Trial 84] done
[Trial 89] START
[Trial 89] fitting...
[Trial 86] done
[Trial 90] START
[Trial 90] fitting...
[Trial 87] done
[Trial 91] START
[Trial 91] fitting...
[Trial 88] done
[Trial 92] START
[Trial 92] fitting...
[Trial 89] done
[Trial 93] START
[Trial 93] fitting...
[Trial 90] done
[Trial 94] START
[Trial 94] fitting...
[Trial 91] done
[Trial 95] START
[Trial 95] fitting...
[Trial 93] done
[Trial 96] START
[Trial 96] fitting...
[Trial 92] done
[Trial 97] START
[Trial 97] fitting...
[Trial 94] done
[Trial 98] START
[Trial 98] fitting...
[Trial 95] done
[Trial 99] START
[Trial 99] fitting...
[Trial 96] done
[Trial 97] done
[Trial 98] done
[Trial 99] done
  [ckpt] Params saved → checkpoints/tabicl/HURRAH/NaN/seed789/fold4/tabicl_rsf_tuned_params.json
  [ckpt] TABICL RSF Tuned saved → checkpoints/tabicl/HURRAH/NaN/seed789/fold4/tabicl_rsf_tuned.pkl
C-index train: 0.9668
C-index test:  0.7397
  [surv] Saved → survival_predictions/tabicl/HURRAH/NaN/seed789/fold4/tabicl_rsf_tuned.pkl
  [ckpt] Loading DeepSurv Simple from checkpoints/tabicl/HURRAH/NaN/seed789/fold4/tabicl_deepsurv_simple.pt
C-index TRAIN: 0.9592
C-index TEST:  0.7568
  [ckpt] Loading DeepSurv Vanilla from checkpoints/tabicl/HURRAH/NaN/seed789/fold4/tabicl_deepsurv_vanilla.pt
C-index TRAIN: 0.9614
C-index TEST:  0.7912
  [ckpt] Loading TABICL RSF from checkpoints/tabicl/HURRAH/NaN/seed789/fold4/tabicl_rsf.pkl
C-index train: 0.9836
C-index test:  0.7151
  [ckpt] Loading TABICL Cox (embedding) from checkpoints/tabicl/HURRAH/NaN/seed789/fold4/tabicl_tab_cox.pkl
C-index train: 0.9633
C-index test:  0.7351
X_train shape: (13567, 61), X_test shape: (3391, 61)
Generating TABICL Embeddings...
Warming up TabICL model (triggering checkpoint load)...
ARRIVATO QUI 1
Loading TabICL model checkpoint 'tabicl-classifier-v1.1-0506.ckpt'...
ARRIVATO QUI
Performing dummy prediction to ensure model is loaded...
Warming up TabICL model (triggering checkpoint load)...
ARRIVATO QUI 1
Loading TabICL model checkpoint 'tabicl-classifier-v1.1-0506.ckpt'...
ARRIVATO QUI
Performing dummy prediction to ensure model is loaded...
Successfully generated embeddings with shape: (13567, 512)
0:	[0s / 0s],		train_loss: 3.0957
0:	[0s / 0s],		train_loss: 3.3401
0:	[0s / 0s],		train_loss: 2.8268
0:	[0s / 0s],		train_loss: 3.3170
1:	[0s / 1s],		train_loss: 2.7592
1:	[0s / 1s],		train_loss: 2.6317
1:	[0s / 1s],		train_loss: 2.6748
1:	[0s / 1s],		train_loss: 2.7178
2:	[0s / 1s],		train_loss: 2.5860
2:	[0s / 1s],		train_loss: 2.6749
2:	[0s / 1s],		train_loss: 2.6535
2:	[0s / 1s],		train_loss: 2.6473
3:	[0s / 2s],		train_loss: 2.5650
3:	[0s / 2s],		train_loss: 2.6366
3:	[0s / 2s],		train_loss: 2.6114
3:	[0s / 2s],		train_loss: 2.6277
4:	[0s / 2s],		train_loss: 2.5899
4:	[0s / 2s],		train_loss: 2.5350
4:	[0s / 2s],		train_loss: 2.5895
4:	[0s / 3s],		train_loss: 2.5906
5:	[0s / 3s],		train_loss: 2.5593
5:	[0s / 3s],		train_loss: 2.5346
5:	[0s / 3s],		train_loss: 2.5879
5:	[0s / 3s],		train_loss: 2.5635
6:	[0s / 3s],		train_loss: 2.4963
6:	[0s / 3s],		train_loss: 2.5519
6:	[0s / 3s],		train_loss: 2.5548
6:	[0s / 4s],		train_loss: 2.5576
7:	[0s / 4s],		train_loss: 2.5068
7:	[0s / 4s],		train_loss: 2.5329
7:	[0s / 4s],		train_loss: 2.5521
7:	[0s / 4s],		train_loss: 2.5462
8:	[0s / 5s],		train_loss: 2.4973
8:	[0s / 5s],		train_loss: 2.5279
8:	[0s / 5s],		train_loss: 2.5339
8:	[0s / 5s],		train_loss: 2.5359
9:	[0s / 5s],		train_loss: 2.4685
9:	[0s / 5s],		train_loss: 2.5001
9:	[0s / 5s],		train_loss: 2.5376
9:	[0s / 6s],		train_loss: 2.5312
10:	[0s / 6s],		train_loss: 2.4852
10:	[0s / 6s],		train_loss: 2.4953
10:	[0s / 6s],		train_loss: 2.5255
10:	[0s / 6s],		train_loss: 2.5088
11:	[0s / 6s],		train_loss: 2.4644
11:	[0s / 6s],		train_loss: 2.4783
11:	[0s / 6s],		train_loss: 2.5201
11:	[0s / 7s],		train_loss: 2.5074
12:	[0s / 7s],		train_loss: 2.4685
12:	[0s / 7s],		train_loss: 2.4955
12:	[0s / 7s],		train_loss: 2.4972
12:	[0s / 7s],		train_loss: 2.5082
13:	[0s / 7s],		train_loss: 2.4657
13:	[0s / 7s],		train_loss: 2.4888
13:	[0s / 8s],		train_loss: 2.5021
13:	[0s / 8s],		train_loss: 2.4956
14:	[0s / 8s],		train_loss: 2.4588
14:	[0s / 8s],		train_loss: 2.4674
14:	[0s / 8s],		train_loss: 2.5188
15:	[0s / 9s],		train_loss: 2.4638
15:	[0s / 9s],		train_loss: 2.4612
15:	[0s / 9s],		train_loss: 2.5080
14:	[0s / 9s],		train_loss: 2.5050
16:	[0s / 9s],		train_loss: 2.4451
16:	[0s / 9s],		train_loss: 2.4738
16:	[0s / 9s],		train_loss: 2.4952
15:	[0s / 9s],		train_loss: 2.4833
17:	[0s / 10s],		train_loss: 2.4696
17:	[0s / 10s],		train_loss: 2.4450
17:	[0s / 10s],		train_loss: 2.4854
16:	[0s / 10s],		train_loss: 2.4825
18:	[0s / 10s],		train_loss: 2.4616
18:	[0s / 10s],		train_loss: 2.4303
18:	[0s / 10s],		train_loss: 2.4890
17:	[0s / 11s],		train_loss: 2.4800
19:	[0s / 11s],		train_loss: 2.4588
19:	[0s / 11s],		train_loss: 2.4465
19:	[0s / 11s],		train_loss: 2.4854
18:	[0s / 11s],		train_loss: 2.4848
20:	[0s / 11s],		train_loss: 2.4503
20:	[0s / 11s],		train_loss: 2.4222
20:	[0s / 11s],		train_loss: 2.4910
19:	[0s / 12s],		train_loss: 2.4705
21:	[0s / 12s],		train_loss: 2.4259
21:	[0s / 12s],		train_loss: 2.4553
21:	[0s / 12s],		train_loss: 2.4953
20:	[0s / 12s],		train_loss: 2.4716
22:	[0s / 13s],		train_loss: 2.4362
22:	[0s / 13s],		train_loss: 2.4414
22:	[0s / 13s],		train_loss: 2.4882
21:	[0s / 13s],		train_loss: 2.4697
23:	[0s / 13s],		train_loss: 2.4438
23:	[0s / 13s],		train_loss: 2.4365
23:	[0s / 13s],		train_loss: 2.4900
22:	[0s / 14s],		train_loss: 2.4649
24:	[0s / 14s],		train_loss: 2.4218
24:	[0s / 14s],		train_loss: 2.4421
24:	[0s / 14s],		train_loss: 2.4726
23:	[0s / 14s],		train_loss: 2.4637
25:	[0s / 14s],		train_loss: 2.4434
25:	[0s / 14s],		train_loss: 2.4207
25:	[0s / 14s],		train_loss: 2.4709
24:	[0s / 15s],		train_loss: 2.4531
26:	[0s / 15s],		train_loss: 2.4367
26:	[0s / 15s],		train_loss: 2.4031
26:	[0s / 15s],		train_loss: 2.4743
27:	[0s / 15s],		train_loss: 2.4330
27:	[0s / 15s],		train_loss: 2.4244
27:	[0s / 15s],		train_loss: 2.4795
25:	[0s / 16s],		train_loss: 2.4604
28:	[0s / 16s],		train_loss: 2.4328
28:	[0s / 16s],		train_loss: 2.4123
28:	[0s / 16s],		train_loss: 2.4716
26:	[0s / 16s],		train_loss: 2.4587
29:	[0s / 17s],		train_loss: 2.4275
29:	[0s / 17s],		train_loss: 2.4162
29:	[0s / 17s],		train_loss: 2.4766
27:	[0s / 17s],		train_loss: 2.4465
30:	[0s / 17s],		train_loss: 2.4067
30:	[0s / 17s],		train_loss: 2.4288
30:	[0s / 17s],		train_loss: 2.4706
28:	[0s / 17s],		train_loss: 2.4550
31:	[0s / 18s],		train_loss: 2.4289
31:	[0s / 18s],		train_loss: 2.4115
31:	[0s / 18s],		train_loss: 2.4903
29:	[0s / 18s],		train_loss: 2.4481
32:	[0s / 18s],		train_loss: 2.4093
32:	[0s / 18s],		train_loss: 2.4031
32:	[0s / 18s],		train_loss: 2.4831
30:	[0s / 19s],		train_loss: 2.4444
33:	[0s / 19s],		train_loss: 2.4003
33:	[0s / 19s],		train_loss: 2.4282
33:	[0s / 19s],		train_loss: 2.4703
31:	[0s / 19s],		train_loss: 2.4450
34:	[0s / 19s],		train_loss: 2.3975
34:	[0s / 19s],		train_loss: 2.4124
34:	[0s / 20s],		train_loss: 2.4698
32:	[0s / 20s],		train_loss: 2.4504
35:	[0s / 20s],		train_loss: 2.4052
35:	[0s / 20s],		train_loss: 2.4019
35:	[0s / 20s],		train_loss: 2.4762
33:	[0s / 20s],		train_loss: 2.4355
36:	[0s / 21s],		train_loss: 2.4123
36:	[0s / 21s],		train_loss: 2.4014
36:	[0s / 21s],		train_loss: 2.4765
34:	[0s / 21s],		train_loss: 2.4358
37:	[0s / 21s],		train_loss: 2.4117
37:	[0s / 21s],		train_loss: 2.3910
37:	[0s / 21s],		train_loss: 2.4677
35:	[0s / 22s],		train_loss: 2.4329
38:	[0s / 22s],		train_loss: 2.3957
38:	[0s / 22s],		train_loss: 2.4071
38:	[0s / 22s],		train_loss: 2.4697
39:	[0s / 22s],		train_loss: 2.3940
39:	[0s / 22s],		train_loss: 2.4061
36:	[0s / 22s],		train_loss: 2.4284
39:	[0s / 22s],		train_loss: 2.4904
40:	[0s / 23s],		train_loss: 2.4146
40:	[0s / 23s],		train_loss: 2.3806
40:	[0s / 23s],		train_loss: 2.4672
37:	[0s / 23s],		train_loss: 2.4318
41:	[0s / 23s],		train_loss: 2.4125
41:	[0s / 23s],		train_loss: 2.3835
41:	[0s / 23s],		train_loss: 2.4591
38:	[0s / 24s],		train_loss: 2.4285
42:	[0s / 24s],		train_loss: 2.4075
42:	[0s / 24s],		train_loss: 2.3874
42:	[0s / 24s],		train_loss: 2.4769
39:	[0s / 24s],		train_loss: 2.4192
43:	[0s / 25s],		train_loss: 2.3838
43:	[0s / 25s],		train_loss: 2.4100
43:	[0s / 25s],		train_loss: 2.4684
40:	[0s / 25s],		train_loss: 2.4299
44:	[0s / 25s],		train_loss: 2.4008
44:	[0s / 25s],		train_loss: 2.3992
44:	[0s / 25s],		train_loss: 2.4695
41:	[0s / 25s],		train_loss: 2.4219
45:	[0s / 26s],		train_loss: 2.3910
45:	[0s / 26s],		train_loss: 2.3805
45:	[0s / 26s],		train_loss: 2.4544
42:	[0s / 26s],		train_loss: 2.4314
46:	[0s / 26s],		train_loss: 2.3722
46:	[0s / 26s],		train_loss: 2.4010
46:	[0s / 26s],		train_loss: 2.4723
43:	[0s / 27s],		train_loss: 2.4185
47:	[0s / 27s],		train_loss: 2.3888
47:	[0s / 27s],		train_loss: 2.3599
47:	[0s / 27s],		train_loss: 2.4436
44:	[0s / 27s],		train_loss: 2.4217
48:	[0s / 27s],		train_loss: 2.3659
48:	[0s / 27s],		train_loss: 2.3920
48:	[0s / 27s],		train_loss: 2.4596
49:	[0s / 28s],		train_loss: 2.3581
49:	[0s / 28s],		train_loss: 2.3922
45:	[0s / 28s],		train_loss: 2.4252
49:	[0s / 28s],		train_loss: 2.4452
50:	[0s / 29s],		train_loss: 2.3766
50:	[0s / 29s],		train_loss: 2.3677
50:	[0s / 29s],		train_loss: 2.4576
46:	[0s / 29s],		train_loss: 2.4217
51:	[0s / 29s],		train_loss: 2.3502
51:	[0s / 29s],		train_loss: 2.3897
51:	[0s / 29s],		train_loss: 2.4516
47:	[0s / 29s],		train_loss: 2.4196
52:	[0s / 30s],		train_loss: 2.3618
52:	[0s / 30s],		train_loss: 2.3999
52:	[0s / 30s],		train_loss: 2.4586
48:	[0s / 30s],		train_loss: 2.4201
53:	[0s / 30s],		train_loss: 2.3587
53:	[0s / 30s],		train_loss: 2.3839
53:	[0s / 30s],		train_loss: 2.4472
49:	[0s / 30s],		train_loss: 2.4125
54:	[0s / 31s],		train_loss: 2.3527
54:	[0s / 31s],		train_loss: 2.3855
54:	[0s / 31s],		train_loss: 2.4504
50:	[0s / 31s],		train_loss: 2.4177
55:	[0s / 31s],		train_loss: 2.3719
55:	[0s / 31s],		train_loss: 2.3859
55:	[0s / 31s],		train_loss: 2.4530
51:	[0s / 32s],		train_loss: 2.4181
56:	[0s / 32s],		train_loss: 2.3552
56:	[0s / 32s],		train_loss: 2.3692
56:	[0s / 32s],		train_loss: 2.4544
52:	[0s / 32s],		train_loss: 2.4104
57:	[0s / 33s],		train_loss: 2.3730
57:	[0s / 33s],		train_loss: 2.3345
57:	[0s / 33s],		train_loss: 2.4570
53:	[0s / 33s],		train_loss: 2.4152
58:	[0s / 33s],		train_loss: 2.3795
58:	[0s / 33s],		train_loss: 2.3628
58:	[0s / 33s],		train_loss: 2.4542
54:	[0s / 33s],		train_loss: 2.4052
59:	[0s / 34s],		train_loss: 2.3780
59:	[0s / 34s],		train_loss: 2.3662
59:	[0s / 34s],		train_loss: 2.4625
55:	[0s / 34s],		train_loss: 2.4064
60:	[0s / 34s],		train_loss: 2.3753
60:	[0s / 34s],		train_loss: 2.3516
60:	[0s / 34s],		train_loss: 2.4554
56:	[0s / 35s],		train_loss: 2.4016
61:	[0s / 35s],		train_loss: 2.3553
61:	[0s / 35s],		train_loss: 2.3741
61:	[0s / 35s],		train_loss: 2.4707
57:	[0s / 35s],		train_loss: 2.4014
62:	[0s / 35s],		train_loss: 2.3498
62:	[0s / 35s],		train_loss: 2.3558
62:	[0s / 35s],		train_loss: 2.4542
58:	[0s / 36s],		train_loss: 2.4153
63:	[0s / 36s],		train_loss: 2.3349
63:	[0s / 36s],		train_loss: 2.3632
63:	[0s / 36s],		train_loss: 2.4606
64:	[0s / 37s],		train_loss: 2.3756
64:	[0s / 37s],		train_loss: 2.3325
59:	[0s / 37s],		train_loss: 2.3958
64:	[0s / 37s],		train_loss: 2.4571
65:	[0s / 37s],		train_loss: 2.3092
65:	[0s / 37s],		train_loss: 2.3665
65:	[0s / 37s],		train_loss: 2.4509
60:	[0s / 37s],		train_loss: 2.4098
66:	[0s / 38s],		train_loss: 2.3593
66:	[0s / 38s],		train_loss: 2.3284
66:	[0s / 38s],		train_loss: 2.4487
61:	[0s / 38s],		train_loss: 2.3917
67:	[0s / 38s],		train_loss: 2.3599
67:	[0s / 38s],		train_loss: 2.3299
67:	[0s / 38s],		train_loss: 2.4431
62:	[0s / 38s],		train_loss: 2.3929
68:	[0s / 39s],		train_loss: 2.3559
68:	[0s / 39s],		train_loss: 2.3155
68:	[0s / 39s],		train_loss: 2.4595
63:	[0s / 39s],		train_loss: 2.4063
69:	[0s / 39s],		train_loss: 2.3197
69:	[0s / 39s],		train_loss: 2.3502
69:	[0s / 39s],		train_loss: 2.4442
64:	[0s / 40s],		train_loss: 2.4119
70:	[0s / 40s],		train_loss: 2.3104
70:	[0s / 40s],		train_loss: 2.3622
70:	[0s / 40s],		train_loss: 2.4442
65:	[0s / 40s],		train_loss: 2.3882
71:	[0s / 41s],		train_loss: 2.3514
71:	[0s / 41s],		train_loss: 2.3215
71:	[0s / 41s],		train_loss: 2.4476
66:	[0s / 41s],		train_loss: 2.3824
72:	[0s / 41s],		train_loss: 2.3164
72:	[0s / 41s],		train_loss: 2.3602
72:	[0s / 41s],		train_loss: 2.4470
67:	[0s / 42s],		train_loss: 2.3829
73:	[0s / 42s],		train_loss: 2.3319
73:	[0s / 42s],		train_loss: 2.3480
73:	[0s / 42s],		train_loss: 2.4585
68:	[0s / 42s],		train_loss: 2.3950
74:	[0s / 42s],		train_loss: 2.3538
74:	[0s / 42s],		train_loss: 2.3161
74:	[0s / 42s],		train_loss: 2.4481
69:	[0s / 43s],		train_loss: 2.3940
75:	[0s / 43s],		train_loss: 2.3463
75:	[0s / 43s],		train_loss: 2.3076
75:	[0s / 43s],		train_loss: 2.4526
70:	[0s / 43s],		train_loss: 2.3918
76:	[0s / 43s],		train_loss: 2.3611
76:	[0s / 43s],		train_loss: 2.3107
76:	[0s / 44s],		train_loss: 2.4532
71:	[0s / 44s],		train_loss: 2.3863
77:	[0s / 44s],		train_loss: 2.3344
77:	[0s / 44s],		train_loss: 2.3051
77:	[0s / 44s],		train_loss: 2.4359
72:	[0s / 45s],		train_loss: 2.3871
78:	[0s / 45s],		train_loss: 2.2925
78:	[0s / 45s],		train_loss: 2.3508
78:	[0s / 45s],		train_loss: 2.4648
79:	[0s / 45s],		train_loss: 2.3533
79:	[0s / 45s],		train_loss: 2.3110
73:	[0s / 45s],		train_loss: 2.3878
79:	[0s / 45s],		train_loss: 2.4555
80:	[0s / 46s],		train_loss: 2.2977
80:	[0s / 46s],		train_loss: 2.3566
80:	[0s / 46s],		train_loss: 2.4459
74:	[0s / 46s],		train_loss: 2.3850
81:	[0s / 46s],		train_loss: 2.3363
81:	[0s / 46s],		train_loss: 2.2995
81:	[0s / 46s],		train_loss: 2.4475
75:	[0s / 46s],		train_loss: 2.3719
82:	[0s / 47s],		train_loss: 2.2963
82:	[0s / 47s],		train_loss: 2.3370
82:	[0s / 47s],		train_loss: 2.4341
76:	[0s / 47s],		train_loss: 2.3841
83:	[0s / 48s],		train_loss: 2.3356
83:	[0s / 48s],		train_loss: 2.2903
83:	[0s / 48s],		train_loss: 2.4530
77:	[0s / 48s],		train_loss: 2.3786
84:	[0s / 48s],		train_loss: 2.3064
84:	[0s / 48s],		train_loss: 2.3449
84:	[0s / 48s],		train_loss: 2.4375
78:	[0s / 48s],		train_loss: 2.3789
85:	[0s / 49s],		train_loss: 2.2921
85:	[0s / 49s],		train_loss: 2.3318
85:	[0s / 49s],		train_loss: 2.4541
79:	[0s / 49s],		train_loss: 2.3876
86:	[0s / 49s],		train_loss: 2.2947
86:	[0s / 49s],		train_loss: 2.3423
86:	[0s / 49s],		train_loss: 2.4556
80:	[0s / 50s],		train_loss: 2.3869
87:	[0s / 50s],		train_loss: 2.3362
87:	[0s / 50s],		train_loss: 2.2982
87:	[0s / 50s],