[I 2026-06-28 01:40:00,815] Trial 78 finished with value: 0.7701126291900512 and parameters: {'num_nodes': [64, 32], 'dropout': 0.2484919754137669, 'learning_rate': 0.0039040307682086696, 'batch_norm': False}. Best is trial 52 with value: 0.779334192044653.
/scratch.hpc/luca.cotugno/Foundation_model_clinical_data/test_tabular_model.py:481: UserWarning: Choices for a categorical distribution should be a tuple of None, bool, int, float and str for persistent storage but contains [32] which is of type list.
  num_nodes  = trial.suggest_categorical("num_nodes", [[32], [64], [128], [64, 32], [128, 64]])
/scratch.hpc/luca.cotugno/Foundation_model_clinical_data/test_tabular_model.py:481: UserWarning: Choices for a categorical distribution should be a tuple of None, bool, int, float and str for persistent storage but contains [64] which is of type list.
  num_nodes  = trial.suggest_categorical("num_nodes", [[32], [64], [128], [64, 32], [128, 64]])
/scratch.hpc/luca.cotugno/Foundation_model_clinical_data/test_tabular_model.py:481: UserWarning: Choices for a categorical distribution should be a tuple of None, bool, int, float and str for persistent storage but contains [128] which is of type list.
  num_nodes  = trial.suggest_categorical("num_nodes", [[32], [64], [128], [64, 32], [128, 64]])
/scratch.hpc/luca.cotugno/Foundation_model_clinical_data/test_tabular_model.py:481: UserWarning: Choices for a categorical distribution should be a tuple of None, bool, int, float and str for persistent storage but contains [64, 32] which is of type list.
  num_nodes  = trial.suggest_categorical("num_nodes", [[32], [64], [128], [64, 32], [128, 64]])
/scratch.hpc/luca.cotugno/Foundation_model_clinical_data/test_tabular_model.py:481: UserWarning: Choices for a categorical distribution should be a tuple of None, bool, int, float and str for persistent storage but contains [128, 64] which is of type list.
  num_nodes  = trial.suggest_categorical("num_nodes", [[32], [64], [128], [64, 32], [128, 64]])

6:	[0s / 1s],		train_loss: 4.3643
54:	[0s / 8s],		train_loss: 4.2297
60:	[0s / 8s],		train_loss: 4.3653
18:	[0s / 6s],		train_loss: 4.3485
55:	[0s / 8s],		train_loss: 4.2258
7:	[0s / 1s],		train_loss: 4.3317
61:	[0s / 8s],		train_loss: 4.3470
56:	[0s / 8s],		train_loss: 4.2072
62:	[0s / 8s],		train_loss: 4.3069
8:	[0s / 1s],		train_loss: 4.3542
23:	[0s / 14s],		train_loss: 4.2707
19:	[0s / 6s],		train_loss: 4.3631
57:	[0s / 8s],		train_loss: 4.2149
63:	[0s / 8s],		train_loss: 4.3654
34:	[1s / 36s],		train_loss: 4.2265
64:	[0s / 8s],		train_loss: 4.3222
58:	[0s / 9s],		train_loss: 4.2075
9:	[0s / 2s],		train_loss: 4.3421
65:	[0s / 8s],		train_loss: 4.3243
59:	[0s / 9s],		train_loss: 4.2061
20:	[0s / 6s],		train_loss: 4.3572
10:	[0s / 2s],		train_loss: 4.3370
66:	[0s / 8s],		train_loss: 4.3345
39:	[1s / 1m:16s],		train_loss: 4.2205
60:	[0s / 9s],		train_loss: 4.1959
24:	[0s / 15s],		train_loss: 4.2453
67:	[0s / 8s],		train_loss: 4.3374
61:	[0s / 9s],		train_loss: 4.2145
11:	[0s / 2s],		train_loss: 4.3325
68:	[0s / 9s],		train_loss: 4.2932
21:	[0s / 7s],		train_loss: 4.3513
62:	[0s / 9s],		train_loss: 4.2012
69:	[0s / 9s],		train_loss: 4.3137
12:	[0s / 2s],		train_loss: 4.3230
63:	[0s / 9s],		train_loss: 4.2060
70:	[0s / 9s],		train_loss: 4.3162
64:	[0s / 9s],		train_loss: 4.2212
13:	[0s / 2s],		train_loss: 4.3005
22:	[0s / 7s],		train_loss: 4.3363
71:	[0s / 9s],		train_loss: 4.3423
25:	[0s / 15s],		train_loss: 4.2786
65:	[0s / 9s],		train_loss: 4.1982
72:	[0s / 9s],		train_loss: 4.3087
35:	[1s / 37s],		train_loss: 4.2111
14:	[0s / 3s],		train_loss: 4.3169
66:	[0s / 10s],		train_loss: 4.2122
73:	[0s / 9s],		train_loss: 4.3224
23:	[0s / 7s],		train_loss: 4.3104
74:	[0s / 9s],		train_loss: 4.2910
67:	[0s / 10s],		train_loss: 4.2024
15:	[0s / 3s],		train_loss: 4.3370
75:	[0s / 9s],		train_loss: 4.3338
68:	[0s / 10s],		train_loss: 4.1837
26:	[0s / 16s],		train_loss: 4.2497
16:	[0s / 3s],		train_loss: 4.3417
24:	[0s / 8s],		train_loss: 4.3355
76:	[0s / 10s],		train_loss: 4.3459
69:	[0s / 10s],		train_loss: 4.1910
80:	[3s / 4m:4s],		train_loss: 4.0987
77:	[0s / 10s],		train_loss: 4.3280
17:	[0s / 3s],		train_loss: 4.3335
70:	[0s / 10s],		train_loss: 4.1776
25:	[0s / 8s],		train_loss: 4.2893
78:	[0s / 10s],		train_loss: 4.3309
71:	[0s / 10s],		train_loss: 4.2188
18:	[0s / 4s],		train_loss: 4.3089
79:	[0s / 10s],		train_loss: 4.2795
72:	[0s / 10s],		train_loss: 4.2244
36:	[1s / 39s],		train_loss: 4.2213
27:	[0s / 16s],		train_loss: 4.2437
80:	[0s / 10s],		train_loss: 4.3768
19:	[0s / 4s],		train_loss: 4.2701
73:	[0s / 11s],		train_loss: 4.2037
26:	[0s / 8s],		train_loss: 4.3339
81:	[0s / 10s],		train_loss: 4.3414
40:	[1s / 1m:18s],		train_loss: 4.2209
74:	[0s / 11s],		train_loss: 4.1919
82:	[0s / 10s],		train_loss: 4.3115
20:	[0s / 4s],		train_loss: 4.2590
83:	[0s / 11s],		train_loss: 4.3681
75:	[0s / 11s],		train_loss: 4.1907
27:	[0s / 9s],		train_loss: 4.3547
21:	[0s / 4s],		train_loss: 4.2923
28:	[0s / 17s],		train_loss: 4.2441
84:	[0s / 11s],		train_loss: 4.3281
76:	[0s / 11s],		train_loss: 4.2227
85:	[0s / 11s],		train_loss: 4.3105
77:	[0s / 11s],		train_loss: 4.1897
22:	[0s / 4s],		train_loss: 4.2635
28:	[0s / 9s],		train_loss: 4.3768
37:	[0s / 39s],		train_loss: 4.2045
86:	[0s / 11s],		train_loss: 4.3055
78:	[0s / 11s],		train_loss: 4.2036
87:	[0s / 11s],		train_loss: 4.3017
23:	[0s / 5s],		train_loss: 4.3206
79:	[0s / 12s],		train_loss: 4.1755
29:	[0s / 17s],		train_loss: 4.2668
88:	[0s / 11s],		train_loss: 4.2837
29:	[0s / 9s],		train_loss: 4.3175
80:	[0s / 12s],		train_loss: 4.1816
89:	[0s / 11s],		train_loss: 4.3559
24:	[0s / 5s],		train_loss: 4.2941
81:	[0s / 12s],		train_loss: 4.1823
90:	[0s / 12s],		train_loss: 4.3385
30:	[0s / 10s],		train_loss: 4.3525
25:	[0s / 5s],		train_loss: 4.2678
82:	[0s / 12s],		train_loss: 4.1905
91:	[0s / 12s],		train_loss: 4.3035
30:	[0s / 18s],		train_loss: 4.2236
83:	[0s / 12s],		train_loss: 4.1497
92:	[0s / 12s],		train_loss: 4.3600
26:	[0s / 5s],		train_loss: 4.2972
93:	[0s / 12s],		train_loss: 4.3697
84:	[0s / 12s],		train_loss: 4.1795
31:	[0s / 10s],		train_loss: 4.3670
38:	[1s / 40s],		train_loss: 4.2359
41:	[1s / 1m:20s],		train_loss: 4.2077
94:	[0s / 12s],		train_loss: 4.3388
85:	[0s / 12s],		train_loss: 4.1838
27:	[0s / 6s],		train_loss: 4.3071
95:	[0s / 12s],		train_loss: 4.2788
86:	[0s / 13s],		train_loss: 4.1655
28:	[0s / 6s],		train_loss: 4.3194
32:	[0s / 10s],		train_loss: 4.3859
31:	[0s / 19s],		train_loss: 4.2405
96:	[0s / 12s],		train_loss: 4.3021
87:	[0s / 13s],		train_loss: 4.2010
97:	[0s / 12s],		train_loss: 4.3029
29:	[0s / 6s],		train_loss: 4.3336
88:	[0s / 13s],		train_loss: 4.1899
33:	[0s / 11s],		train_loss: 4.3296
98:	[0s / 13s],		train_loss: 4.2936
89:	[0s / 13s],		train_loss: 4.1714
30:	[0s / 6s],		train_loss: 4.3027
99:	[0s / 13s],		train_loss: 4.2909
90:	[0s / 13s],		train_loss: 4.1786
32:	[0s / 19s],		train_loss: 4.2541
31:	[0s / 6s],		train_loss: 4.2622
34:	[0s / 11s],		train_loss: 4.3412
91:	[0s / 13s],		train_loss: 4.1586
81:	[3s / 4m:7s],		train_loss: 4.0396
0:	[0s / 0s],		train_loss: 4.9188
32:	[0s / 7s],		train_loss: 4.2411
39:	[1s / 42s],		train_loss: 4.2499
92:	[0s / 14s],		train_loss: 4.2163
1:	[0s / 0s],		train_loss: 4.5397
93:	[0s / 14s],		train_loss: 4.1701
2:	[0s / 0s],		train_loss: 4.4435
33:	[0s / 7s],		train_loss: 4.2428
35:	[0s / 11s],		train_loss: 4.3203
94:	[0s / 14s],		train_loss: 4.1998
3:	[0s / 0s],		train_loss: 4.4257
34:	[0s / 7s],		train_loss: 4.2746
33:	[0s / 20s],		train_loss: 4.2513
95:	[0s / 14s],		train_loss: 4.1726
4:	[0s / 0s],		train_loss: 4.4052
5:	[0s / 0s],		train_loss: 4.4303
96:	[0s / 14s],		train_loss: 4.2358
35:	[0s / 7s],		train_loss: 4.2537
36:	[0s / 12s],		train_loss: 4.2885
6:	[0s / 0s],		train_loss: 4.3885
97:	[0s / 14s],		train_loss: 4.1910
36:	[0s / 7s],		train_loss: 4.2687
7:	[0s / 1s],		train_loss: 4.3507
98:	[0s / 14s],		train_loss: 4.1942
37:	[0s / 12s],		train_loss: 4.2978
8:	[0s / 1s],		train_loss: 4.4147
99:	[0s / 15s],		train_loss: 4.1486
42:	[2s / 1m:22s],		train_loss: 4.1982
40:	[1s / 43s],		train_loss: 4.2302
34:	[0s / 20s],		train_loss: 4.2519
37:	[0s / 8s],		train_loss: 4.2404
9:	[0s / 1s],		train_loss: 4.4247
38:	[0s / 12s],		train_loss: 4.3018
38:	[0s / 8s],		train_loss: 4.2185
0:	[0s / 0s],		train_loss: 5.0169
10:	[0s / 1s],		train_loss: 4.3563
1:	[0s / 0s],		train_loss: 4.5233
11:	[0s / 1s],		train_loss: 4.3305
39:	[0s / 8s],		train_loss: 4.2246
2:	[0s / 0s],		train_loss: 4.4067
12:	[0s / 1s],		train_loss: 4.4175
39:	[0s / 13s],		train_loss: 4.3120
40:	[0s / 8s],		train_loss: 4.2141
35:	[0s / 21s],		train_loss: 4.2364
3:	[0s / 0s],		train_loss: 4.3930
13:	[0s / 2s],		train_loss: 4.3292
41:	[0s / 9s],		train_loss: 4.2272
4:	[0s / 0s],		train_loss: 4.3464
14:	[0s / 2s],		train_loss: 4.3722
40:	[0s / 13s],		train_loss: 4.2831
5:	[0s / 0s],		train_loss: 4.3426
15:	[0s / 2s],		train_loss: 4.3792
42:	[0s / 9s],		train_loss: 4.2244
41:	[1s / 44s],		train_loss: 4.2209
6:	[0s / 0s],		train_loss: 4.3189
16:	[0s / 2s],		train_loss: 4.3377
36:	[0s / 22s],		train_loss: 4.2411
43:	[0s / 9s],		train_loss: 4.1957
7:	[0s / 1s],		train_loss: 4.2843
41:	[0s / 13s],		train_loss: 4.2947
17:	[0s / 2s],		train_loss: 4.3168
44:	[0s / 9s],		train_loss: 4.2152
8:	[0s / 1s],		train_loss: 4.3148
18:	[0s / 2s],		train_loss: 4.2964
9:	[0s / 1s],		train_loss: 4.2861
19:	[0s / 2s],		train_loss: 4.2686
42:	[0s / 14s],		train_loss: 4.2859
45:	[0s / 9s],		train_loss: 4.2189
10:	[0s / 1s],		train_loss: 4.2670
20:	[0s / 2s],		train_loss: 4.2670
37:	[0s / 22s],		train_loss: 4.2102
46:	[0s / 9s],		train_loss: 4.1973
11:	[0s / 1s],		train_loss: 4.2459
21:	[0s / 3s],		train_loss: 4.3324
47:	[0s / 10s],		train_loss: 4.1774
43:	[0s / 14s],		train_loss: 4.2994
22:	[0s / 3s],		train_loss: 4.3290
12:	[0s / 1s],		train_loss: 4.2547
42:	[0s / 45s],		train_loss: 4.2115
23:	[0s / 3s],		train_loss: 4.3119
13:	[0s / 1s],		train_loss: 4.2267
48:	[0s / 10s],		train_loss: 4.2020
43:	[2s / 1m:24s],		train_loss: 4.2240
24:	[0s / 3s],		train_loss: 4.2824
14:	[0s / 2s],		train_loss: 4.2336
44:	[0s / 14s],		train_loss: 4.2582
49:	[0s / 10s],		train_loss: 4.1965
25:	[0s / 3s],		train_loss: 4.2909
38:	[0s / 23s],		train_loss: 4.2172
15:	[0s / 2s],		train_loss: 4.2126
50:	[0s / 10s],		train_loss: 4.2174
82:	[3s / 4m:11s],		train_loss: 4.0906
26:	[0s / 3s],		train_loss: 4.2494
16:	[0s / 2s],		train_loss: 4.1651
45:	[0s / 15s],		train_loss: 4.2893
27:	[0s / 3s],		train_loss: 4.2775
17:	[0s / 2s],		train_loss: 4.1825
51:	[0s / 10s],		train_loss: 4.1404
28:	[0s / 4s],		train_loss: 4.3167
18:	[0s / 2s],		train_loss: 4.1835
52:	[0s / 11s],		train_loss: 4.1331
29:	[0s / 4s],		train_loss: 4.3050
19:	[0s / 2s],		train_loss: 4.1672
46:	[0s / 15s],		train_loss: 4.2745
39:	[0s / 23s],		train_loss: 4.2188
53:	[0s / 11s],		train_loss: 4.1591
30:	[0s / 4s],		train_loss: 4.2796
20:	[0s / 2s],		train_loss: 4.1740
43:	[1s / 46s],		train_loss: 4.1975
31:	[0s / 4s],		train_loss: 4.3170
21:	[0s / 3s],		train_loss: 4.1765
54:	[0s / 11s],		train_loss: 4.1634
47:	[0s / 15s],		train_loss: 4.3057
32:	[0s / 4s],		train_loss: 4.2474
22:	[0s / 3s],		train_loss: 4.1416
55:	[0s / 11s],		train_loss: 4.1671
33:	[0s / 4s],		train_loss: 4.3414
23:	[0s / 3s],		train_loss: 4.1039
48:	[0s / 16s],		train_loss: 4.2647
56:	[0s / 11s],		train_loss: 4.1722
40:	[0s / 24s],		train_loss: 4.2095
34:	[0s / 4s],		train_loss: 4.2557
24:	[0s / 3s],		train_loss: 4.0695
35:	[0s / 5s],		train_loss: 4.2597
57:	[0s / 12s],		train_loss: 4.1605
25:	[0s / 3s],		train_loss: 4.0818
36:	[0s / 5s],		train_loss: 4.2925
26:	[0s / 3s],		train_loss: 4.0839
49:	[0s / 16s],		train_loss: 4.2616
58:	[0s / 12s],		train_loss: 4.1538
37:	[0s / 5s],		train_loss: 4.2835
27:	[0s / 3s],		train_loss: 4.0305
44:	[1s / 47s],		train_loss: 4.2203
59:	[0s / 12s],		train_loss: 4.1611
44:	[2s / 1m:26s],		train_loss: 4.2488
38:	[0s / 5s],		train_loss: 4.2669
41:	[0s / 25s],		train_loss: 4.2007
28:	[0s / 4s],		train_loss: 4.0583
50:	[0s / 16s],		train_loss: 4.2897
39:	[0s / 5s],		train_loss: 4.3030
60:	[0s / 12s],		train_loss: 4.1264
29:	[0s / 4s],		train_loss: 4.0142
40:	[0s / 5s],		train_loss: 4.3558
30:	[0s / 4s],		train_loss: 4.0250
61:	[0s / 12s],		train_loss: 4.1635
51:	[0s / 17s],		train_loss: 4.2703
41:	[0s / 5s],		train_loss: 4.3092
31:	[0s / 4s],		train_loss: 4.0305
62:	[0s / 13s],		train_loss: 4.1349
42:	[0s / 6s],		train_loss: 4.3007
32:	[0s / 4s],		train_loss: 3.9697
42:	[0s / 25s],		train_loss: 4.2205
43:	[0s / 6s],		train_loss: 4.3131
33:	[0s / 4s],		train_loss: 3.9980
63:	[0s / 13s],		train_loss: 4.2283
52:	[0s / 17s],		train_loss: 4.2558
44:	[0s / 6s],		train_loss: 4.3430
34:	[0s / 4s],		train_loss: 3.9983
64:	[0s / 13s],		train_loss: 4.2166
45:	[0s / 48s],		train_loss: 4.2100
45:	[0s / 6s],		train_loss: 4.3558
35:	[0s / 5s],		train_loss: 3.9841
65:	[0s / 13s],		train_loss: 4.1154
46:	[0s / 6s],		train_loss: 4.2731
36:	[0s / 5s],		train_loss: 3.9707
53:	[0s / 18s],		train_loss: 4.2742
47:	[0s / 6s],		train_loss: 4.3003
66:	[0s / 13s],		train_loss: 4.1435
37:	[0s / 5s],		train_loss: 3.9368
43:	[0s / 26s],		train_loss: 4.2355
48:	[0s / 6s],		train_loss: 4.2602
38:	[0s / 5s],		train_loss: 3.9583
67:	[0s / 13s],		train_loss: 4.1231
49:	[0s / 7s],		train_loss: 4.2590
54:	[0s / 18s],		train_loss: 4.2875
39:	[0s / 5s],		train_loss: 3.9025
68:	[0s / 14s],		train_loss: 4.1402
50:	[0s / 7s],		train_loss: 4.3225
40:	[0s / 5s],		train_loss: 3.8948
69:	[0s / 14s],		train_loss: 4.1229
51:	[0s / 7s],		train_loss: 4.2915
41:	[0s / 5s],		train_loss: 3.8589
55:	[0s / 18s],		train_loss: 4.2713
52:	[0s / 7s],		train_loss: 4.2479
45:	[1s / 1m:28s],		train_loss: 4.2308
42:	[0s / 6s],		train_loss: 3.8746
44:	[0s / 27s],		train_loss: 4.2311
70:	[0s / 14s],		train_loss: 4.1194
53:	[0s / 7s],		train_loss: 4.2714
43:	[0s / 6s],		train_loss: 3.9035
46:	[1s / 49s],		train_loss: 4.2411
71:	[0s / 14s],		train_loss: 4.1494
54:	[0s / 7s],		train_loss: 4.2695
44:	[0s / 6s],		train_loss: 3.8392
56:	[0s / 19s],		train_loss: 4.2482
55:	[0s / 7s],		train_loss: 4.2675
72:	[0s / 14s],		train_loss: 4.1383
45:	[0s / 6s],		train_loss: 3.8507
45:	[0s / 27s],		train_loss: 4.1994
56:	[0s / 8s],		train_loss: 4.2693
46:	[0s / 6s],		train_loss: 3.8475
73:	[0s / 15s],		train_loss: 4.1043
57:	[0s / 19s],		train_loss: 4.2499
57:	[0s / 8s],		train_loss: 4.2646
47:	[0s / 6s],		train_loss: 3.8415
74:	[0s / 15s],		train_loss: 4.0964
58:	[0s / 8s],		train_loss: 4.2495
48:	[0s / 6s],		train_loss: 3.8304
59:	[0s / 8s],		train_loss: 4.2612
58:	[0s / 19s],		train_loss: 4.2704
49:	[0s / 7s],		train_loss: 3.7705
75:	[0s / 15s],		train_loss: 4.1035
60:	[0s / 8s],		train_loss: 4.2566
50:	[0s / 7s],		train_loss: 3.7570
83:	[4s / 4m:15s],		train_loss: 4.0235
76:	[0s / 15s],		train_loss: 4.1245
46:	[0s / 28s],		train_loss: 4.2116
61:	[0s / 8s],		train_loss: 4.2933
51:	[0s / 7s],		train_loss: 3.7869
47:	[1s / 50s],		train_loss: 4.2380
59:	[0s / 20s],		train_loss: 4.2603
62:	[0s / 8s],		train_loss: 4.2322
77:	[0s / 15s],		train_loss: 4.1319
52:	[0s / 7s],		train_loss: 3.7962
63:	[0s / 8s],		train_loss: 4.3032
53:	[0s / 7s],		train_loss: 3.7812
78:	[0s / 15s],		train_loss: 4.1288
60:	[0s / 20s],		train_loss: 4.2737
64:	[0s / 9s],		train_loss: 4.2686
54:	[0s / 7s],		train_loss: 3.8048
79:	[0s / 16s],		train_loss: 4.1027
65:	[0s / 9s],		train_loss: 4.2332
55:	[0s / 7s],		train_loss: 3.7536
47:	[0s / 28s],		train_loss: 4.2322
80:	[0s / 16s],		train_loss: 4.0632
66:	[0s / 9s],		train_loss: 4.2470
56:	[0s / 7s],		train_loss: 3.7371
61:	[0s / 20s],		train_loss: 4.2891
67:	[0s / 9s],		train_loss: 4.2262
81:	[0s / 16s],		train_loss: 4.0832
57:	[0s / 8s],		train_loss: 3.7310
68:	[0s / 9s],		train_loss: 4.2510
46:	[2s / 1m:31s],		train_loss: 4.2302
58:	[0s / 8s],		train_loss: 3.7222
82:	[0s / 16s],		train_loss: 4.1110
62:	[0s / 21s],		train_loss: 4.3166
69:	[0s / 9s],		train_loss: 4.2348
48:	[0s / 29s],		train_loss: 4.2204
59:	[0s / 8s],		train_loss: 3.7082
48:	[1s / 51s],		train_loss: 4.2124
70:	[0s / 9s],		train_loss: 4.2146
83:	[0s / 16s],		train_loss: 4.0571
60:	[0s / 8s],		train_loss: 3.7088
71:	[0s / 10s],		train_loss: 4.2125
63:	[0s / 21s],		train_loss: 4.2322
61:	[0s / 8s],		train_loss: 3.6685
84:	[0s / 17s],		train_loss: 4.0792
72:	[0s / 10s],		train_loss: 4.2346
62:	[0s / 8s],		train_loss: 3.6590
85:	[0s / 17s],		train_loss: 4.0860
49:	[0s / 29s],		train_loss: 4.2320
73:	[0s / 10s],		train_loss: 4.2747
63:	[0s / 8s],		train_loss: 3.6934
64:	[0s / 21s],		train_loss: 4.2690
74:	[0s / 10s],		train_loss: 4.2358
86:	[0s / 17s],		train_loss: 4.0835
64:	[0s / 9s],		train_loss: 3.6696
75:	[0s / 10s],		train_loss: 4.2019
87:	[0s / 17s],		train_loss: 4.0679
65:	[0s / 9s],		train_loss: 3.7279
76:	[0s / 10s],		train_loss: 4.1993
65:	[0s / 22s],		train_loss: 4.2657
66:	[0s / 9s],		train_loss: 3.6999
88:	[0s / 17s],		train_loss: 4.0641
50:	[0s / 30s],		train_loss: 4.2456
77:	[0s / 10s],		train_loss: 4.2126
49:	[1s / 52s],		train_loss: 4.1927
67:	[0s / 9s],		train_loss: 3.6547
78:	[0s / 11s],		train_loss: 4.1798
89:	[0s / 18s],		train_loss: 4.0860
68:	[0s / 9s],		train_loss: 3.6667
66:	[0s / 22s],		train_loss: 4.2494
79:	[0s / 11s],		train_loss: 4.2265
69:	[0s / 9s],		train_loss: 3.6533
90:	[0s / 18s],		train_loss: 4.0472
80:	[0s / 11s],		train_loss: 4.2380
70:	[0s / 9s],		train_loss: 3.6499
47:	[1s / 1m:32s],		train_loss: 4.2346
91:	[0s / 18s],		train_loss: 4.0817
51:	[0s / 31s],		train_loss: 4.2404
81:	[0s / 11s],		train_loss: 4.2218
67:	[0s / 22s],		train_loss: 4.2480
71:	[0s / 10s],		train_loss: 3.6033
82:	[0s / 11s],		train_loss: 4.1953
92:	[0s / 18s],		train_loss: 4.1194
72:	[0s / 10s],		train_loss: 3.5842
83:	[0s / 11s],		train_loss: 4.2446
73:	[0s / 10s],		train_loss: 3.5939
93:	[0s / 18s],		train_loss: 4.1478
68:	[0s / 23s],		train_loss: 4.2905
84:	[0s / 11s],		train_loss: 4.2048
74:	[0s / 10s],		train_loss: 3.5708
94:	[0s / 18s],		train_loss: 4.1093
52:	[0s / 31s],		train_loss: 4.2223
85:	[0s / 12s],		train_loss: 4.1947
75:	[0s / 10s],		train_loss: 3.5853
50:	[1s / 53s],		train_loss: 4.2289
84:	[3s / 4m:19s],		train_loss: 4.0439
95:	[0s / 19s],		train_loss: 4.0495
69:	[0s / 23s],		train_loss: 4.2358
86:	[0s / 12s],		train_loss: 4.1843
76:	[0s / 10s],		train_loss: 3.5649
87:	[0s / 12s],		train_loss: 4.1934
77:	[0s / 10s],		train_loss: 3.5533
96:	[0s / 19s],		train_loss: 4.0456
88:	[0s / 12s],		train_loss: 4.1647
78:	[0s / 11s],		train_loss: 3.5296
70:	[0s / 23s],		train_loss: 4.2644
97:	[0s / 19s],		train_loss: 4.0645
89:	[0s / 12s],		train_loss: 4.1999
79:	[0s / 11s],		train_loss: 3.5725
53:	[0s / 32s],		train_loss: 4.2102
98:	[0s / 19s],		train_loss: 4.0355
90:	[0s / 12s],		train_loss: 4.1533
80:	[0s / 11s],		train_loss: 3.5051
91:	[0s / 12s],		train_loss: 4.2234
71:	[0s / 24s],		train_loss: 4.2900
81:	[0s / 11s],		train_loss: 3.5620
99:	[0s / 19s],		train_loss: 4.0552
92:	[0s / 13s],		train_loss: 4.2394
82:	[0s / 11s],		train_loss: 3.5769
93:	[0s / 13s],		train_loss: 4.1999
0:	[0s / 0s],		train_loss: 4.8930
51:	[1s / 55s],		train_loss: 4.1989
72:	[0s / 24s],		train_loss: 4.2527
83:	[0s / 11s],		train_loss: 3.5540
94:	[0s / 13s],		train_loss: 4.2175
54:	[0s / 32s],		train_loss: 4.2446
1:	[0s / 0s],		train_loss: 4.5026
84:	[0s / 12s],		train_loss: 3.5066
95:	[0s / 13s],		train_loss: 4.2081
48:	[2s / 1m:35s],		train_loss: 4.2458
85:	[0s / 12s],		train_loss: 3.4827
2:	[0s / 0s],		train_loss: 4.4201
96:	[0s / 13s],		train_loss: 4.2321
73:	[0s / 24s],		train_loss: 4.2605
86:	[0s / 12s],		train_loss: 3.4693
3:	[0s / 0s],		train_loss: 4.3466
97:	[0s / 13s],		train_loss: 4.2166
87:	[0s / 12s],		train_loss: 3.4613
4:	[0s / 0s],		train_loss: 4.3648
98:	[0s / 13s],		train_loss: 4.1938
88:	[0s / 12s],		train_loss: 3.4764
74:	[0s / 25s],		train_loss: 4.2283
5:	[0s / 0s],		train_loss: 4.3476
99:	[0s / 14s],		train_loss: 4.2087
55:	[0s / 33s],		train_loss: 4.2930
89:	[0s / 12s],		train_loss: 3.5124
6:	[0s / 1s],		train_loss: 4.3331
0:	[0s / 0s],		train_loss: 5.0361
90:	[0s / 12s],		train_loss: 3.5083
75:	[0s / 25s],		train_loss: 4.2210
7:	[0s / 1s],		train_loss: 4.2918
1:	[0s / 0s],		train_loss: 4.5268
91:	[0s / 13s],		train_loss: 3.4561
8:	[0s / 1s],		train_loss: 4.3074
56:	[0s / 34s],		train_loss: 4.2221
52:	[1s / 56s],		train_loss: 4.2010
2:	[0s / 0s],		train_loss: 4.4393
92:	[0s / 13s],		train_loss: 3.4544
76:	[0s / 26s],		train_loss: 4.2252
9:	[0s / 1s],		train_loss: 4.2846
3:	[0s / 0s],		train_loss: 4.4358
93:	[0s / 13s],		train_loss: 3.4936
10:	[0s / 1s],		train_loss: 4.2819
4:	[0s / 0s],		train_loss: 4.4073
94:	[0s / 13s],		train_loss: 3.5024
77:	[0s / 26s],		train_loss: 4.2384
11:	[0s / 1s],		train_loss: 4.2722
5:	[0s / 0s],		train_loss: 4.4045
95:	[0s / 13s],		train_loss: 3.4261
57:	[0s / 34s],		train_loss: 4.2435
6:	[0s / 1s],		train_loss: 4.3630
96:	[0s / 13s],		train_loss: 3.4158
12:	[0s / 2s],		train_loss: 4.2337
7:	[0s / 1s],		train_loss: 4.3712
97:	[0s / 13s],		train_loss: 3.4498
78:	[0s / 26s],		train_loss: 4.2740
13:	[0s / 2s],		train_loss: 4.1993
8:	[0s / 1s],		train_loss: 4.3608
98:	[0s / 14s],		train_loss: 3.4492
14:	[0s / 2s],		train_loss: 4.2152
9:	[0s / 1s],		train_loss: 4.3471
79:	[0s / 26s],		train_loss: 4.2091
99:	[0s / 14s],		train_loss: 3.4799
53:	[1s / 57s],		train_loss: 4.1801
15:	[0s / 2s],		train_loss: 4.2342
58:	[0s / 35s],		train_loss: 4.2730
10:	[0s / 1s],		train_loss: 4.3810
16:	[0s / 2s],		train_loss: 4.2113
80:	[0s / 27s],		train_loss: 4.2232
11:	[0s / 1s],		train_loss: 4.3710
0:	[0s / 0s],		train_loss: 4.9938
49:	[2s / 1m:37s],		train_loss: 4.2329
12:	[0s / 1s],		train_loss: 4.3706
17:	[0s / 2s],		train_loss: 4.1896
1:	[0s / 0s],		train_loss: 4.6208
13:	[0s / 2s],		train_loss: 4.3786
2:	[0s / 0s],		train_loss: 4.5439
81:	[0s / 27s],		train_loss: 4.2575
18:	[0s / 3s],		train_loss: 4.2115
14:	[0s / 2s],		train_loss: 4.3391
3:	[0s / 0s],		train_loss: 4.4989
59:	[0s / 36s],		train_loss: 4.2316
19:	[0s / 3s],		train_loss: 4.1339
15:	[0s / 2s],		train_loss: 4.3363
4:	[0s / 0s],		train_loss: 4.4902
82:	[0s / 27s],		train_loss: 4.2253
20:	[0s / 3s],		train_loss: 4.1702
16:	[0s / 2s],		train_loss: 4.3162
85:	[4s / 4m:23s],		train_loss: 4.0586
5:	[0s / 0s],		train_loss