[I 2026-06-07 08:18:54,108] Trial 29 finished with value: 0.8031010326364764 and parameters: {'num_nodes': [64], 'dropout': 0.22111827583044025, 'learning_rate': 0.0013608233908717412, 'batch_norm': False}. Best is trial 13 with value: 0.8060522033707737.
/scratch.hpc/luca.cotugno/Foundation_model_clinical_data/test_tabular_model_tmp.py:476: UserWarning: Choices for a categorical distribution should be a tuple of None, bool, int, float and str for persistent storage but contains [32] which is of type list.
  num_nodes  = trial.suggest_categorical("num_nodes", [[32], [64], [128], [64, 32], [128, 64]])
/scratch.hpc/luca.cotugno/Foundation_model_clinical_data/test_tabular_model_tmp.py:476: UserWarning: Choices for a categorical distribution should be a tuple of None, bool, int, float and str for persistent storage but contains [64] which is of type list.
  num_nodes  = trial.suggest_categorical("num_nodes", [[32], [64], [128], [64, 32], [128, 64]])
/scratch.hpc/luca.cotugno/Foundation_model_clinical_data/test_tabular_model_tmp.py:476: UserWarning: Choices for a categorical distribution should be a tuple of None, bool, int, float and str for persistent storage but contains [128] which is of type list.
  num_nodes  = trial.suggest_categorical("num_nodes", [[32], [64], [128], [64, 32], [128, 64]])
/scratch.hpc/luca.cotugno/Foundation_model_clinical_data/test_tabular_model_tmp.py:476: UserWarning: Choices for a categorical distribution should be a tuple of None, bool, int, float and str for persistent storage but contains [64, 32] which is of type list.
  num_nodes  = trial.suggest_categorical("num_nodes", [[32], [64], [128], [64, 32], [128, 64]])
/scratch.hpc/luca.cotugno/Foundation_model_clinical_data/test_tabular_model_tmp.py:476: UserWarning: Choices for a categorical distribution should be a tuple of None, bool, int, float and str for persistent storage but contains [128, 64] which is of type list.
  num_nodes  = trial.suggest_categorical("num_nodes", [[32], [64], [128], [64, 32], [128, 64]])

70:	[0s / 25s],		train_loss: 2.6459
37:	[0s / 21s],		train_loss: 2.5827
95:	[0s / 52s],		train_loss: 2.3719
71:	[0s / 26s],		train_loss: 2.6404
38:	[0s / 22s],		train_loss: 2.5760
72:	[0s / 26s],		train_loss: 2.6464
96:	[0s / 52s],		train_loss: 2.3963
4:	[0s / 4s],		train_loss: 2.6386
73:	[0s / 27s],		train_loss: 2.6420
39:	[0s / 22s],		train_loss: 2.5736
97:	[0s / 53s],		train_loss: 2.3997
74:	[0s / 27s],		train_loss: 2.6527
75:	[0s / 27s],		train_loss: 2.6496
5:	[0s / 5s],		train_loss: 2.6104
40:	[0s / 23s],		train_loss: 2.5483
98:	[0s / 54s],		train_loss: 2.3897
76:	[0s / 28s],		train_loss: 2.6282
99:	[0s / 54s],		train_loss: 2.3951
41:	[0s / 24s],		train_loss: 2.5984
77:	[0s / 28s],		train_loss: 2.6330
6:	[1s / 6s],		train_loss: 2.6060
0:	[0s / 0s],		train_loss: 2.8463
42:	[0s / 24s],		train_loss: 2.5717
78:	[0s / 29s],		train_loss: 2.6486
1:	[0s / 0s],		train_loss: 2.6161
79:	[0s / 29s],		train_loss: 2.6300
43:	[0s / 25s],		train_loss: 2.5514
80:	[0s / 29s],		train_loss: 2.6446
2:	[0s / 1s],		train_loss: 2.5857
7:	[1s / 7s],		train_loss: 2.5825
44:	[0s / 25s],		train_loss: 2.5697
81:	[0s / 30s],		train_loss: 2.6379
3:	[0s / 1s],		train_loss: 2.5859
82:	[0s / 30s],		train_loss: 2.6467
45:	[0s / 26s],		train_loss: 2.5728
4:	[0s / 2s],		train_loss: 2.5732
83:	[0s / 30s],		train_loss: 2.6356
8:	[1s / 8s],		train_loss: 2.5885
5:	[0s / 2s],		train_loss: 2.5756
46:	[0s / 26s],		train_loss: 2.5786
84:	[0s / 31s],		train_loss: 2.6464
6:	[0s / 2s],		train_loss: 2.5707
47:	[0s / 27s],		train_loss: 2.5729
85:	[0s / 31s],		train_loss: 2.6410
7:	[0s / 3s],		train_loss: 2.5882
9:	[1s / 10s],		train_loss: 2.6296
86:	[0s / 32s],		train_loss: 2.6611
48:	[0s / 27s],		train_loss: 2.5762
8:	[0s / 3s],		train_loss: 2.5756
87:	[0s / 32s],		train_loss: 2.6437
9:	[0s / 4s],		train_loss: 2.6138
49:	[0s / 28s],		train_loss: 2.5635
88:	[0s / 32s],		train_loss: 2.6238
10:	[0s / 4s],		train_loss: 2.5854
10:	[1s / 11s],		train_loss: 2.5982
50:	[0s / 28s],		train_loss: 2.5557
89:	[0s / 33s],		train_loss: 2.6464
11:	[0s / 4s],		train_loss: 2.5882
90:	[0s / 33s],		train_loss: 2.6461
51:	[0s / 29s],		train_loss: 2.5617
12:	[0s / 5s],		train_loss: 2.5772
91:	[0s / 33s],		train_loss: 2.6398
52:	[0s / 29s],		train_loss: 2.5504
13:	[0s / 5s],		train_loss: 2.5790
11:	[1s / 12s],		train_loss: 2.5787
92:	[0s / 34s],		train_loss: 2.6286
14:	[0s / 6s],		train_loss: 2.5736
53:	[0s / 30s],		train_loss: 2.5643
93:	[0s / 34s],		train_loss: 2.6412
15:	[0s / 6s],		train_loss: 2.5673
94:	[0s / 35s],		train_loss: 2.6404
54:	[0s / 30s],		train_loss: 2.5723
12:	[1s / 13s],		train_loss: 2.5870
16:	[0s / 6s],		train_loss: 2.5729
95:	[0s / 35s],		train_loss: 2.6478
55:	[0s / 31s],		train_loss: 2.5835
17:	[0s / 7s],		train_loss: 2.5826
96:	[0s / 35s],		train_loss: 2.6417
56:	[0s / 31s],		train_loss: 2.5658
18:	[0s / 7s],		train_loss: 2.5792
97:	[0s / 36s],		train_loss: 2.6431
13:	[1s / 14s],		train_loss: 2.6230
19:	[0s / 8s],		train_loss: 2.5863
98:	[0s / 36s],		train_loss: 2.6671
57:	[0s / 32s],		train_loss: 2.5736
99:	[0s / 37s],		train_loss: 2.6679
20:	[0s / 8s],		train_loss: 2.5764
58:	[0s / 32s],		train_loss: 2.5826
14:	[1s / 15s],		train_loss: 2.5738
21:	[0s / 8s],		train_loss: 2.5826
0:	[0s / 0s],		train_loss: 2.8199
59:	[0s / 33s],		train_loss: 2.5628
22:	[0s / 9s],		train_loss: 2.5833
1:	[0s / 0s],		train_loss: 2.6145
60:	[0s / 33s],		train_loss: 2.5742
2:	[0s / 1s],		train_loss: 2.6049
23:	[0s / 9s],		train_loss: 2.5703
15:	[1s / 16s],		train_loss: 2.6010
3:	[0s / 1s],		train_loss: 2.5822
24:	[0s / 10s],		train_loss: 2.5844
61:	[0s / 34s],		train_loss: 2.5749
4:	[0s / 1s],		train_loss: 2.5900
25:	[0s / 10s],		train_loss: 2.5586
62:	[0s / 35s],		train_loss: 2.5463
16:	[1s / 17s],		train_loss: 2.5858
5:	[0s / 2s],		train_loss: 2.6052
26:	[0s / 11s],		train_loss: 2.5666
63:	[0s / 35s],		train_loss: 2.5770
6:	[0s / 2s],		train_loss: 2.5867
27:	[0s / 11s],		train_loss: 2.5939
7:	[0s / 3s],		train_loss: 2.6473
64:	[0s / 36s],		train_loss: 2.5761
28:	[0s / 11s],		train_loss: 2.5616
17:	[1s / 18s],		train_loss: 2.5748
8:	[0s / 3s],		train_loss: 2.6545
29:	[0s / 12s],		train_loss: 2.5717
65:	[0s / 36s],		train_loss: 2.5574
9:	[0s / 3s],		train_loss: 2.6298
30:	[0s / 12s],		train_loss: 2.5631
66:	[0s / 37s],		train_loss: 2.5416
10:	[0s / 4s],		train_loss: 2.5612
18:	[1s / 19s],		train_loss: 2.5883
31:	[0s / 13s],		train_loss: 2.5698
11:	[0s / 4s],		train_loss: 2.6479
67:	[0s / 37s],		train_loss: 2.5561
32:	[0s / 13s],		train_loss: 2.5571
12:	[0s / 5s],		train_loss: 2.5941
33:	[0s / 13s],		train_loss: 2.5622
68:	[0s / 38s],		train_loss: 2.5718
19:	[1s / 20s],		train_loss: 2.5622
13:	[0s / 5s],		train_loss: 2.5982
34:	[0s / 14s],		train_loss: 2.5664
69:	[0s / 38s],		train_loss: 2.5626
14:	[0s / 5s],		train_loss: 2.5805
35:	[0s / 14s],		train_loss: 2.5688
15:	[0s / 6s],		train_loss: 2.5841
70:	[0s / 39s],		train_loss: 2.5521
20:	[0s / 21s],		train_loss: 2.5662
36:	[0s / 15s],		train_loss: 2.5842
16:	[0s / 6s],		train_loss: 2.6017
71:	[0s / 39s],		train_loss: 2.5493
37:	[0s / 15s],		train_loss: 2.5760
17:	[0s / 6s],		train_loss: 2.6351
38:	[0s / 15s],		train_loss: 2.5640
72:	[0s / 40s],		train_loss: 2.5727
18:	[0s / 7s],		train_loss: 2.6398
21:	[1s / 22s],		train_loss: 2.5784
39:	[0s / 16s],		train_loss: 2.5742
19:	[0s / 7s],		train_loss: 2.6054
73:	[0s / 40s],		train_loss: 2.5683
40:	[0s / 16s],		train_loss: 2.5854
20:	[0s / 8s],		train_loss: 2.5736
74:	[0s / 41s],		train_loss: 2.5540
21:	[0s / 8s],		train_loss: 2.5680
41:	[0s / 17s],		train_loss: 2.5761
22:	[1s / 23s],		train_loss: 2.5765
75:	[0s / 41s],		train_loss: 2.5616
22:	[0s / 8s],		train_loss: 2.5917
42:	[0s / 17s],		train_loss: 2.5979
23:	[0s / 9s],		train_loss: 2.5964
43:	[0s / 17s],		train_loss: 2.5924
76:	[0s / 42s],		train_loss: 2.5579
24:	[0s / 9s],		train_loss: 2.6609
23:	[1s / 24s],		train_loss: 2.5602
44:	[0s / 18s],		train_loss: 2.5703
77:	[0s / 42s],		train_loss: 2.5561
25:	[0s / 10s],		train_loss: 2.6493
45:	[0s / 18s],		train_loss: 2.5843
78:	[0s / 43s],		train_loss: 2.5555
26:	[0s / 10s],		train_loss: 2.6552
46:	[0s / 19s],		train_loss: 2.5645
24:	[1s / 25s],		train_loss: 2.5663
27:	[0s / 10s],		train_loss: 2.6435
79:	[0s / 43s],		train_loss: 2.5765
47:	[0s / 19s],		train_loss: 2.5653
28:	[0s / 11s],		train_loss: 2.6313
48:	[0s / 19s],		train_loss: 2.5941
80:	[0s / 44s],		train_loss: 2.5607
29:	[0s / 11s],		train_loss: 2.6401
49:	[0s / 20s],		train_loss: 2.5644
25:	[1s / 26s],		train_loss: 2.5726
30:	[0s / 11s],		train_loss: 2.6376
81:	[0s / 44s],		train_loss: 2.5393
50:	[0s / 20s],		train_loss: 2.5569
31:	[0s / 12s],		train_loss: 2.6432
82:	[0s / 45s],		train_loss: 2.5438
51:	[0s / 21s],		train_loss: 2.5468
32:	[0s / 12s],		train_loss: 2.6298
26:	[1s / 28s],		train_loss: 2.5682
83:	[0s / 45s],		train_loss: 2.5632
52:	[0s / 21s],		train_loss: 2.5590
33:	[0s / 13s],		train_loss: 2.6429
53:	[0s / 21s],		train_loss: 2.5591
84:	[0s / 46s],		train_loss: 2.6014
34:	[0s / 13s],		train_loss: 2.6304
54:	[0s / 22s],		train_loss: 2.5716
35:	[0s / 13s],		train_loss: 2.6424
85:	[0s / 46s],		train_loss: 2.5752
27:	[1s / 29s],		train_loss: 2.5584
55:	[0s / 22s],		train_loss: 2.5790
36:	[0s / 14s],		train_loss: 2.6425
86:	[0s / 47s],		train_loss: 2.5484
56:	[0s / 23s],		train_loss: 2.5749
37:	[0s / 14s],		train_loss: 2.6364
57:	[0s / 23s],		train_loss: 2.5271
38:	[0s / 14s],		train_loss: 2.6390
87:	[0s / 47s],		train_loss: 2.5368
28:	[1s / 30s],		train_loss: 2.5500
58:	[0s / 23s],		train_loss: 2.5791
39:	[0s / 15s],		train_loss: 2.6351
88:	[0s / 48s],		train_loss: 2.5528
59:	[0s / 24s],		train_loss: 2.5380
40:	[0s / 15s],		train_loss: 2.6307
89:	[0s / 48s],		train_loss: 2.5584
60:	[0s / 24s],		train_loss: 2.5829
41:	[0s / 16s],		train_loss: 2.6283
29:	[1s / 31s],		train_loss: 2.5592
42:	[0s / 16s],		train_loss: 2.6379
61:	[0s / 25s],		train_loss: 2.5671
90:	[0s / 49s],		train_loss: 2.5570
43:	[0s / 16s],		train_loss: 2.6364
62:	[0s / 25s],		train_loss: 2.5641
91:	[0s / 49s],		train_loss: 2.5452
44:	[0s / 17s],		train_loss: 2.6335
30:	[1s / 32s],		train_loss: 2.5456
63:	[0s / 25s],		train_loss: 2.5650
92:	[0s / 50s],		train_loss: 2.5510
45:	[0s / 17s],		train_loss: 2.6316
64:	[0s / 26s],		train_loss: 2.5644
46:	[0s / 18s],		train_loss: 2.6340
93:	[0s / 50s],		train_loss: 2.5860
65:	[0s / 26s],		train_loss: 2.5584
31:	[1s / 33s],		train_loss: 2.5746
47:	[0s / 18s],		train_loss: 2.6504
94:	[0s / 51s],		train_loss: 2.5684
66:	[0s / 27s],		train_loss: 2.5327
48:	[0s / 18s],		train_loss: 2.6376
67:	[0s / 27s],		train_loss: 2.5549
95:	[0s / 51s],		train_loss: 2.5565
49:	[0s / 19s],		train_loss: 2.6363
32:	[0s / 34s],		train_loss: 2.5568
68:	[0s / 28s],		train_loss: 2.5400
50:	[0s / 19s],		train_loss: 2.6377
96:	[0s / 52s],		train_loss: 2.5783
69:	[0s / 28s],		train_loss: 2.5478
51:	[0s / 19s],		train_loss: 2.6284
97:	[0s / 52s],		train_loss: 2.5402
70:	[0s / 28s],		train_loss: 2.5492
33:	[1s / 35s],		train_loss: 2.5795
52:	[0s / 20s],		train_loss: 2.6301
98:	[0s / 53s],		train_loss: 2.5521
71:	[0s / 29s],		train_loss: 2.5437
53:	[0s / 20s],		train_loss: 2.6266
72:	[0s / 29s],		train_loss: 2.5640
54:	[0s / 21s],		train_loss: 2.6157
99:	[0s / 53s],		train_loss: 2.5763
34:	[1s / 36s],		train_loss: 2.5941
73:	[0s / 30s],		train_loss: 2.5488
55:	[0s / 21s],		train_loss: 2.6165
0:	[0s / 0s],		train_loss: 2.8885
74:	[0s / 30s],		train_loss: 2.5721
56:	[0s / 21s],		train_loss: 2.6321
75:	[0s / 30s],		train_loss: 2.5448
57:	[0s / 22s],		train_loss: 2.6274
1:	[0s / 1s],		train_loss: 2.5966
35:	[1s / 37s],		train_loss: 2.5847
58:	[0s / 22s],		train_loss: 2.6282
76:	[0s / 31s],		train_loss: 2.5453
2:	[0s / 1s],		train_loss: 2.6010
59:	[0s / 23s],		train_loss: 2.6439
77:	[0s / 31s],		train_loss: 2.5438
3:	[0s / 2s],		train_loss: 2.5731
36:	[1s / 38s],		train_loss: 2.5780
60:	[0s / 23s],		train_loss: 2.6389
78:	[0s / 32s],		train_loss: 2.5784
61:	[0s / 23s],		train_loss: 2.6314
4:	[0s / 2s],		train_loss: 2.6020
79:	[0s / 32s],		train_loss: 2.5485
62:	[0s / 24s],		train_loss: 2.6217
5:	[0s / 3s],		train_loss: 2.5689
80:	[0s / 32s],		train_loss: 2.5637
37:	[1s / 39s],		train_loss: 2.5988
63:	[0s / 24s],		train_loss: 2.6371
81:	[0s / 33s],		train_loss: 2.5425
6:	[0s / 3s],		train_loss: 2.5680
64:	[0s / 24s],		train_loss: 2.6339
82:	[0s / 33s],		train_loss: 2.5477
7:	[0s / 4s],		train_loss: 2.5631
65:	[0s / 25s],		train_loss: 2.6263
38:	[1s / 40s],		train_loss: 2.5819
83:	[0s / 34s],		train_loss: 2.5606
66:	[0s / 25s],		train_loss: 2.6324
8:	[0s / 4s],		train_loss: 2.5729
84:	[0s / 34s],		train_loss: 2.5694
67:	[0s / 26s],		train_loss: 2.6268
9:	[0s / 5s],		train_loss: 2.5613
85:	[0s / 35s],		train_loss: 2.5902
39:	[1s / 41s],		train_loss: 2.5766
68:	[0s / 26s],		train_loss: 2.6394
86:	[0s / 35s],		train_loss: 2.5619
10:	[0s / 5s],		train_loss: 2.5599
69:	[0s / 26s],		train_loss: 2.6261
87:	[0s / 35s],		train_loss: 2.5444
70:	[0s / 27s],		train_loss: 2.6277
11:	[0s / 6s],		train_loss: 2.5568
40:	[1s / 42s],		train_loss: 2.5706
88:	[0s / 36s],		train_loss: 2.5708
71:	[0s / 27s],		train_loss: 2.6410
12:	[0s / 6s],		train_loss: 2.5703
72:	[0s / 28s],		train_loss: 2.6307
89:	[0s / 36s],		train_loss: 2.5554
13:	[0s / 7s],		train_loss: 2.5791
73:	[0s / 28s],		train_loss: 2.6370
90:	[0s / 37s],		train_loss: 2.5666
41:	[1s / 43s],		train_loss: 2.5690
74:	[0s / 28s],		train_loss: 2.6259
91:	[0s / 37s],		train_loss: 2.5579
14:	[0s / 7s],		train_loss: 2.5467
75:	[0s / 29s],		train_loss: 2.6357
92:	[0s / 37s],		train_loss: 2.5448
15:	[0s / 8s],		train_loss: 2.5594
76:	[0s / 29s],		train_loss: 2.6231
42:	[1s / 44s],		train_loss: 2.5746
93:	[0s / 38s],		train_loss: 2.5583
16:	[0s / 8s],		train_loss: 2.5759
77:	[0s / 29s],		train_loss: 2.6280
94:	[0s / 38s],		train_loss: 2.5560
78:	[0s / 30s],		train_loss: 2.6291
17:	[0s / 9s],		train_loss: 2.5669
95:	[0s / 39s],		train_loss: 2.5686
43:	[1s / 45s],		train_loss: 2.5624
79:	[0s / 30s],		train_loss: 2.6445
96:	[0s / 39s],		train_loss: 2.5435
18:	[0s / 9s],		train_loss: 2.5454
80:	[0s / 31s],		train_loss: 2.6250
97:	[0s / 40s],		train_loss: 2.5671
19:	[0s / 10s],		train_loss: 2.5493
81:	[0s / 31s],		train_loss: 2.6323
44:	[1s / 46s],		train_loss: 2.5632
98:	[0s / 40s],		train_loss: 2.5712
82:	[0s / 31s],		train_loss: 2.6393
20:	[0s / 10s],		train_loss: 2.5579
99:	[0s / 40s],		train_loss: 2.5514
83:	[0s / 32s],		train_loss: 2.6386
21:	[0s / 11s],		train_loss: 2.5246
0:	[0s / 0s],		train_loss: 2.8186
45:	[1s / 47s],		train_loss: 2.5570
84:	[0s / 32s],		train_loss: 2.6185
85:	[0s / 33s],		train_loss: 2.6194
1:	[0s / 0s],		train_loss: 2.5852
22:	[0s / 11s],		train_loss: 2.5634
86:	[0s / 33s],		train_loss: 2.6302
2:	[0s / 1s],		train_loss: 2.5527
23:	[0s / 12s],		train_loss: 2.5680
46:	[1s / 48s],		train_loss: 2.5807
87:	[0s / 33s],		train_loss: 2.6252
3:	[0s / 1s],		train_loss: 2.5599
24:	[0s / 12s],		train_loss: 2.5636
88:	[0s / 34s],		train_loss: 2.6147
4:	[0s / 2s],		train_loss: 2.5626
89:	[0s / 34s],		train_loss: 2.6286
25:	[0s / 13s],		train_loss: 2.5349
5:	[0s / 2s],		train_loss: 2.5347
47:	[1s / 50s],		train_loss: 2.5552
90:	[0s / 35s],		train_loss: 2.6202
6:	[0s / 2s],		train_loss: 2.5239
26:	[0s / 13s],		train_loss: 2.5373
91:	[0s / 35s],		train_loss: 2.6200
7:	[0s / 3s],		train_loss: 2.5316
27:	[0s / 14s],		train_loss: 2.5438
92:	[0s / 35s],		train_loss: 2.6326
48:	[1s / 51s],		train_loss: 2.5789
8:	[0s / 3s],		train_loss: 2.5319
28:	[0s / 14s],		train_loss: 2.5503
93:	[0s / 36s],		train_loss: 2.6216
9:	[0s / 4s],		train_loss: 2.5135
94:	[0s / 36s],		train_loss: 2.6378
29:	[0s / 15s],		train_loss: 2.5481
10:	[0s / 4s],		train_loss: 2.5125
49:	[1s / 52s],		train_loss: 2.5667
95:	[0s / 37s],		train_loss: 2.6214
11:	[0s / 4s],		train_loss: 2.5211
30:	[0s / 15s],		train_loss: 2.5633
96:	[0s / 37s],		train_loss: 2.6349
12:	[0s / 5s],		train_loss: 2.5156
31:	[0s / 16s],		train_loss: 2.5583
97:	[0s / 37s],		train_loss: 2.6317
13:	[0s / 5s],		train_loss: 2.5000
50:	[1s / 53s],		train_loss: 2.5716
98:	[0s / 38s],		train_loss: 2.6259
32:	[0s / 17s],		train_loss: 2.5444
14:	[0s / 6s],		train_loss: 2.5073
99:	[0s / 38s],		train_loss: 2.6250
33:	[0s / 17s],		train_loss: 2.5539
15:	[0s / 6s],		train_loss: 2.5375
0:	[0s / 0s],		train_loss: 2.9029
51:	[1s / 54s],		train_loss: 2.5711
34:	[0s / 18s],		train_loss: 2.5412
16:	[0s / 7s],		train_loss: 2.5177
1:	[0s / 0s],		train_loss: 2.5976
17:	[0s / 7s],		train_loss: 2.5061
35:	[0s / 18s],		train_loss: 2.5373
2:	[0s / 1s],		train_loss: 2.6007
18:	[0s / 7s],		train_loss: 2.5007
52:	[0s / 55s],		train_loss: 2.5795
36:	[0s / 18s],		train_loss: 2.5556
3:	[0s / 1s],		train_loss: 2.5618
19:	[0s / 8s],		train_loss: 2.5098
37:	[0s / 19s],		train_loss: 2.5535
4:	[0s / 2s],		train_loss: 2.5580
20:	[0s / 8s],		train_loss: 2.5077
38:	[0s / 19s],		train_loss: 2.5418
53:	[1s / 56s],		train_loss: 2.5690
5:	[0s / 2s],		train_loss: 2.5837
21:	[0s / 9s],		train_loss: 2.4877
39:	[0s / 20s],		train_loss: 2.5257
6:	[0s / 2s],		train_loss: 2.5620
22:	[0s / 9s],		train_loss: 2.5022
7:	[0s / 3s],		train_loss: 2.5857
40:	[0s / 20s],		train_loss: 2.5242
23:	[0s / 9s],		train_loss: 2.5246
54:	[1s / 57s],		train_loss: 2.5686
8:	[0s / 3s],		train_loss: 2.5896
41:	[0s / 21s],		train_loss: 2.5423
24:	[0s / 10s],		train_loss: 2.5122
9:	[0s / 4s],		train_loss: 2.5901
42:	[0s / 21s],		train_loss: 2.5208
25:	[0s / 10s],		train_loss: 2.4866
10:	[0s / 4s],		train_loss: 2.5546
55:	[1s / 58s],		train_loss: 2.5757
43:	[0s / 22s],		train_loss: 2.5623
26:	[0s / 11s],		train_loss: 2.4943
11:	[0s / 5s],		train_loss: 2.5404
27:	[0s / 11s],		train_loss: 2.5078
44:	[0s / 22s],		train_loss: 2.5340
12:	[0s / 5s],		train_loss: 2.5442
28:	[0s / 12s],		train_loss: 2.4965
45:	[0s / 23s],		train_loss: 2.5341
56:	[1s / 59s],		train_loss: 2.5580
13:	[0s / 5s],		train_loss: 2.5430
29:	[0s / 12s],		train_loss: 2.4830
46:	[0s / 23s],		train_loss: 2.5460
14:	[0s / 6s],		train_loss: 2.5208
30:	[0s / 12s],		train_loss: 2.4783
47:	[0s / 24s],		train_loss: 2.5329
15:	[0s / 6s],		train_loss: 2.5151
57:	[1s / 1m:0s],		train_loss: 2.5571
31:	[0s / 13s],		train_loss: 2.4916
16:	[0s / 7s],		train_loss: 2.5555
48:	[0s / 24s],		train_loss: 2.5327
32:	[0s / 13s],		train_loss: 2.4842
17:	[0s / 7s],		train_loss: 2.5542
49:	[0s / 25s],		train_loss: 2.5557
33:	[0s / 14s],		train_loss: 2.5009
18:	[0s / 7s],		train_loss: 2.5372
50:	[0s / 25s],		train_loss: 2.5421
58:	[1s / 1m:2s],		train_loss: 2.5533
34:	[0s / 14s],		train_loss: 2.4961
19:	[0s / 8s],		train_loss: 2.5280
51:	[0s / 25s],		train_loss: 2.5652
35:	[0s / 14s],		train_loss: 2.4901
20:	[0s / 8s],		train_loss: 2.5230
52:	[0s / 26s],		train_loss: 2.5260
36:	[0s / 15s],		train_loss: 2.4845
59:	[1s / 1m:3s],		train_loss: 2.5407
21:	[0s / 9s],		train_loss: 2.5249
53:	[0s / 26s],		train_loss: 2.5257
37:	[0s / 15s],		train_loss: 2.4705
22:	[0s / 9s],		train_loss: 2.5188
38:	[0s / 16s],		train_loss: 2.4845
54:	[0s / 27s],		train_loss: 2.5203
23:	[0s / 10s],		train_loss: 2.5384
39:	[0s / 16s],		train_loss: 2.4933
60:	[1s / 1m:4s],		train_loss: 2.5520
55:	[0s / 27s],		train_loss: 2.5177
24:	[0s / 10s],		train_loss: 2.5233
40:	[0s / 17s],		train_loss: 2.4924
56:	[0s / 28s],		train_loss: 2.5262
25:	[0s / 10s],		train_loss: 2.5177
41:	[0s / 17s],		train_loss: 2.4947
57:	[0s / 28s],		train_loss: 2.5358
61:	[0s / 1m:5s],		train_loss: 2.5610
26:	[0s / 11s],		train_loss: 2.5071
42:	[0s / 17s],		train_loss: 2.4879
27:	[0s / 11s],		train_loss: 2.5046
58:	[0s / 29s],		train_loss: 2.5246
43:	[0s / 18s],		train_loss: 2.4888
28:	[0s / 12s],		train_loss: 2.5164
59:	[0s / 29s],		train_loss: 2.5175
62:	[1s / 1m:6s],		train_loss: 2.5581
44:	[0s / 18s],		train_loss: 2.4727
29:	[0s / 12s],		train_loss: 2.5200
60:	[0s / 30s],		train_loss: 2.5060
45:	[0s / 19s],		train_loss: 2.4664
30:	[0s / 13s],		train_loss: 2.5242
61:	[0s / 30s],		train_loss: 2.5309
46:	[0s / 19s],		train_loss: 2.4771
31:	[0s / 13s],		train_loss: 2.5138
63:	[1s / 1m:7s],		train_loss: 2.5483
62:	[0s / 31s],		train_loss: 2.5193
47:	[0s / 20s],		train_loss: 2.4665
32:	[0s / 13s],		train_loss: 2.5088
48:	[0s / 20s],		train_loss: 2.4841
63:	[0s / 31s],		train_loss: 2.5417
33:	[0s / 14s],		train_loss: 2.5207
49:	[0s / 20s],		train_loss: 2.4669
64:	[1s / 1m:8s],		train_loss: 2.5646
64:	[0s / 32s],		train_loss: 2.5360
34:	[0s / 14s],		train_loss: 2.5069
50:	[0s / 21s],		train_loss: 2.4700
65:	[0s / 32s],		train_loss: 2.5209
35:	[0s / 15s],		train_loss: 2.5136
51:	[0s / 21s],		train_loss: 2.4908
36:	[0s / 15s],		train_loss: 2.5075
66:	[0s / 33s],		train_loss: 2.5257
65:	[1s / 1m:9s],		train_loss: 2.5495
52:	[0s / 22s],		train_loss: 2.4711
37:	[0s / 15s],		train_loss: 2.4967
67:	[0s / 33s],		train_loss: 2.5319
53:	[0s / 22s],		train_loss: 2.4755
38:	[0s / 16s],		train_loss: 2.5132
68:	[0s / 34s],		train_loss: 2.5329
54:	[0s / 23s],		train_loss: 2.4689
66:	[1s / 1m:10s],		train_loss: 2.5578
39:	[0s / 16s],		train_loss: 2.5039
69:	[0s / 34s],		train_loss: 2.5430
55:	[0s / 23s],		train_loss: 2.4728
40:	[0s / 17s],		train_loss: 2.4996
70:	[0s / 34s],		train_loss: 2.5396
56:	[0s / 23s],		train_loss: 2.4660
41:	[0s / 17s],		train_loss: 2.5016
67:	[1s / 1m:11s],		train_loss: 2.5675
71:	[0s / 35s],		train_loss: 2.5314
57:	[0s / 24s],		train_loss: 2.4707
42:	[0s / 18s],		train_loss: 2.5101
58:	[0s / 24s],		train_loss: 2.4750
72:	[0s / 35s],		train_loss: 2.5270
43:	[0s / 18s],		train_loss: 2.4987
59:	[0s / 25s],		train_loss: 2.4660
73:	[0s / 36s],		train_loss: 2.5262
68:	[1s / 1m:12s],		train_loss: 2.5586
44:	[0s / 18s],		train_loss: 2.4936
60:	[0s / 25s],		train_loss: 2.4559
74:	[0s / 36s],		train_loss: 2.5328
45:	[0s / 19s],		train_loss: 2.4948
61:	[0s / 26s],		train_loss: 2.4603
46:	[0s / 19s],		train_loss: 2.5008
75:	[0s / 37s],		train_loss: 2.5154
69:	[1s / 1m:13s],		train_loss: 2.5469
62:	[0s / 26s],		train_loss: 2.4605
47:	[0s / 20s],		train_loss: 2.4970
76:	[0s / 37s],		train_loss: 2.5477
63:	[0s / 26s],		train_loss: 2.4704
48:	[0s / 20s],		train_loss: 2.4861
77:	[0s / 38s],		train_loss: 2.5352
64:	[0s / 27s],		train_loss: 2.4839
70:	[1s / 1m:14s],		train_loss: 2.5561
49:	[0s / 21s],		train_loss: 2.4971
78:	[0s / 38s],		train_loss: