[I 2026-06-07 00:05:17,197] Trial 38 finished with value: 0.7627497134457202 and parameters: {'num_nodes': [64], 'dropout': 0.13157178315073062, 'learning_rate': 0.0002869499939339238, 'batch_norm': False}. Best is trial 13 with value: 0.8124644084489007.
/scratch.hpc/luca.cotugno/Foundation_model_clinical_data/test_tabular_model_tmp.py:476: UserWarning: Choices for a categorical distribution should be a tuple of None, bool, int, float and str for persistent storage but contains [32] which is of type list.
  num_nodes  = trial.suggest_categorical("num_nodes", [[32], [64], [128], [64, 32], [128, 64]])
/scratch.hpc/luca.cotugno/Foundation_model_clinical_data/test_tabular_model_tmp.py:476: UserWarning: Choices for a categorical distribution should be a tuple of None, bool, int, float and str for persistent storage but contains [64] which is of type list.
  num_nodes  = trial.suggest_categorical("num_nodes", [[32], [64], [128], [64, 32], [128, 64]])
/scratch.hpc/luca.cotugno/Foundation_model_clinical_data/test_tabular_model_tmp.py:476: UserWarning: Choices for a categorical distribution should be a tuple of None, bool, int, float and str for persistent storage but contains [128] which is of type list.
  num_nodes  = trial.suggest_categorical("num_nodes", [[32], [64], [128], [64, 32], [128, 64]])
/scratch.hpc/luca.cotugno/Foundation_model_clinical_data/test_tabular_model_tmp.py:476: UserWarning: Choices for a categorical distribution should be a tuple of None, bool, int, float and str for persistent storage but contains [64, 32] which is of type list.
  num_nodes  = trial.suggest_categorical("num_nodes", [[32], [64], [128], [64, 32], [128, 64]])
/scratch.hpc/luca.cotugno/Foundation_model_clinical_data/test_tabular_model_tmp.py:476: UserWarning: Choices for a categorical distribution should be a tuple of None, bool, int, float and str for persistent storage but contains [128, 64] which is of type list.
  num_nodes  = trial.suggest_categorical("num_nodes", [[32], [64], [128], [64, 32], [128, 64]])

74:	[0s / 53s],		train_loss: 2.4048
27:	[0s / 12s],		train_loss: 2.4995
90:	[0s / 40s],		train_loss: 2.3928
75:	[0s / 53s],		train_loss: 2.4062
28:	[0s / 13s],		train_loss: 2.4970
91:	[0s / 40s],		train_loss: 2.3932
59:	[1s / 1m:12s],		train_loss: 2.4709
29:	[0s / 13s],		train_loss: 2.4903
92:	[0s / 41s],		train_loss: 2.3985
76:	[0s / 54s],		train_loss: 2.4056
30:	[0s / 14s],		train_loss: 2.4989
93:	[0s / 41s],		train_loss: 2.3935
77:	[0s / 55s],		train_loss: 2.4016
31:	[0s / 14s],		train_loss: 2.4896
94:	[0s / 41s],		train_loss: 2.3826
60:	[1s / 1m:13s],		train_loss: 2.4659
95:	[0s / 42s],		train_loss: 2.3726
32:	[0s / 15s],		train_loss: 2.4822
78:	[0s / 55s],		train_loss: 2.3988
96:	[0s / 42s],		train_loss: 2.3879
33:	[0s / 15s],		train_loss: 2.4697
79:	[0s / 56s],		train_loss: 2.3910
61:	[1s / 1m:15s],		train_loss: 2.4609
97:	[0s / 43s],		train_loss: 2.3846
34:	[0s / 15s],		train_loss: 2.4764
98:	[0s / 43s],		train_loss: 2.3801
35:	[0s / 16s],		train_loss: 2.4709
80:	[0s / 57s],		train_loss: 2.3958
99:	[0s / 44s],		train_loss: 2.3874
36:	[0s / 16s],		train_loss: 2.4778
62:	[1s / 1m:16s],		train_loss: 2.4750
81:	[0s / 57s],		train_loss: 2.4104
37:	[0s / 17s],		train_loss: 2.4702
0:	[0s / 0s],		train_loss: 3.6019
38:	[0s / 17s],		train_loss: 2.4625
1:	[0s / 0s],		train_loss: 2.8191
82:	[0s / 58s],		train_loss: 2.3949
39:	[0s / 18s],		train_loss: 2.4814
2:	[0s / 1s],		train_loss: 2.6932
63:	[1s / 1m:17s],		train_loss: 2.4571
83:	[0s / 59s],		train_loss: 2.4050
40:	[0s / 18s],		train_loss: 2.4653
3:	[0s / 1s],		train_loss: 2.6525
4:	[0s / 2s],		train_loss: 2.6252
41:	[0s / 19s],		train_loss: 2.4753
84:	[0s / 1m:0s],		train_loss: 2.4013
64:	[1s / 1m:18s],		train_loss: 2.4709
5:	[0s / 2s],		train_loss: 2.5917
42:	[0s / 19s],		train_loss: 2.4698
6:	[0s / 3s],		train_loss: 2.5963
85:	[0s / 1m:0s],		train_loss: 2.3816
43:	[0s / 20s],		train_loss: 2.4615
7:	[0s / 3s],		train_loss: 2.5929
44:	[0s / 20s],		train_loss: 2.4721
86:	[0s / 1m:1s],		train_loss: 2.3971
65:	[1s / 1m:20s],		train_loss: 2.4490
8:	[0s / 3s],		train_loss: 2.5612
45:	[0s / 21s],		train_loss: 2.4756
9:	[0s / 4s],		train_loss: 2.5570
46:	[0s / 21s],		train_loss: 2.4698
87:	[0s / 1m:2s],		train_loss: 2.3899
10:	[0s / 4s],		train_loss: 2.5498
47:	[0s / 21s],		train_loss: 2.4629
66:	[1s / 1m:21s],		train_loss: 2.4558
88:	[0s / 1m:2s],		train_loss: 2.3965
11:	[0s / 5s],		train_loss: 2.5428
48:	[0s / 22s],		train_loss: 2.4518
12:	[0s / 5s],		train_loss: 2.5427
49:	[0s / 22s],		train_loss: 2.4592
89:	[0s / 1m:3s],		train_loss: 2.3867
13:	[0s / 6s],		train_loss: 2.5378
67:	[1s / 1m:22s],		train_loss: 2.4703
50:	[0s / 23s],		train_loss: 2.4720
90:	[0s / 1m:4s],		train_loss: 2.3982
14:	[0s / 6s],		train_loss: 2.5330
51:	[0s / 23s],		train_loss: 2.4476
15:	[0s / 7s],		train_loss: 2.5244
52:	[0s / 24s],		train_loss: 2.4451
91:	[0s / 1m:4s],		train_loss: 2.3942
68:	[1s / 1m:23s],		train_loss: 2.4553
16:	[0s / 7s],		train_loss: 2.5208
53:	[0s / 24s],		train_loss: 2.4514
17:	[0s / 7s],		train_loss: 2.5140
92:	[0s / 1m:5s],		train_loss: 2.3951
54:	[0s / 25s],		train_loss: 2.4533
18:	[0s / 8s],		train_loss: 2.5070
55:	[0s / 25s],		train_loss: 2.4414
93:	[0s / 1m:6s],		train_loss: 2.3799
19:	[0s / 8s],		train_loss: 2.5001
69:	[1s / 1m:25s],		train_loss: 2.4570
56:	[0s / 26s],		train_loss: 2.4332
20:	[0s / 9s],		train_loss: 2.4981
94:	[0s / 1m:7s],		train_loss: 2.3711
57:	[0s / 26s],		train_loss: 2.4374
21:	[0s / 9s],		train_loss: 2.4993
58:	[0s / 26s],		train_loss: 2.4425
95:	[0s / 1m:7s],		train_loss: 2.3848
22:	[0s / 10s],		train_loss: 2.5039
70:	[1s / 1m:26s],		train_loss: 2.4556
59:	[0s / 27s],		train_loss: 2.4550
23:	[0s / 10s],		train_loss: 2.5016
60:	[0s / 27s],		train_loss: 2.4401
96:	[0s / 1m:8s],		train_loss: 2.3631
24:	[0s / 11s],		train_loss: 2.4846
61:	[0s / 28s],		train_loss: 2.4444
71:	[1s / 1m:27s],		train_loss: 2.4476
25:	[0s / 11s],		train_loss: 2.4858
97:	[0s / 1m:9s],		train_loss: 2.3728
62:	[0s / 28s],		train_loss: 2.4534
26:	[0s / 11s],		train_loss: 2.5034
63:	[0s / 29s],		train_loss: 2.4428
98:	[0s / 1m:9s],		train_loss: 2.3893
27:	[0s / 12s],		train_loss: 2.4698
72:	[1s / 1m:28s],		train_loss: 2.4481
64:	[0s / 29s],		train_loss: 2.4349
28:	[0s / 12s],		train_loss: 2.4797
99:	[0s / 1m:10s],		train_loss: 2.3840
65:	[0s / 30s],		train_loss: 2.4458
29:	[0s / 13s],		train_loss: 2.4739
66:	[0s / 30s],		train_loss: 2.4437
30:	[0s / 13s],		train_loss: 2.4778
73:	[1s / 1m:30s],		train_loss: 2.4505
0:	[0s / 0s],		train_loss: 3.8988
67:	[0s / 31s],		train_loss: 2.4502
31:	[0s / 14s],		train_loss: 2.4846
68:	[0s / 31s],		train_loss: 2.4291
1:	[0s / 1s],		train_loss: 3.0653
32:	[0s / 14s],		train_loss: 2.4794
69:	[0s / 32s],		train_loss: 2.4418
74:	[1s / 1m:31s],		train_loss: 2.4427
33:	[0s / 15s],		train_loss: 2.4695
2:	[0s / 2s],		train_loss: 2.8619
70:	[0s / 32s],		train_loss: 2.4203
34:	[0s / 15s],		train_loss: 2.4721
71:	[0s / 32s],		train_loss: 2.4161
35:	[0s / 15s],		train_loss: 2.4617
3:	[0s / 2s],		train_loss: 2.7590
75:	[1s / 1m:32s],		train_loss: 2.4539
72:	[0s / 33s],		train_loss: 2.4292
36:	[0s / 16s],		train_loss: 2.4742
4:	[0s / 3s],		train_loss: 2.6990
73:	[0s / 33s],		train_loss: 2.4208
37:	[0s / 16s],		train_loss: 2.4711
38:	[0s / 17s],		train_loss: 2.4711
74:	[0s / 34s],		train_loss: 2.4116
5:	[0s / 4s],		train_loss: 2.6609
76:	[1s / 1m:33s],		train_loss: 2.4620
39:	[0s / 17s],		train_loss: 2.4620
75:	[0s / 34s],		train_loss: 2.4126
6:	[0s / 4s],		train_loss: 2.6447
40:	[0s / 18s],		train_loss: 2.4509
76:	[0s / 35s],		train_loss: 2.4383
41:	[0s / 18s],		train_loss: 2.4654
77:	[1s / 1m:34s],		train_loss: 2.4544
77:	[0s / 35s],		train_loss: 2.4181
7:	[0s / 5s],		train_loss: 2.6162
42:	[0s / 19s],		train_loss: 2.4482
78:	[0s / 36s],		train_loss: 2.4141
43:	[0s / 19s],		train_loss: 2.4507
8:	[0s / 6s],		train_loss: 2.5961
79:	[0s / 36s],		train_loss: 2.4221
78:	[1s / 1m:36s],		train_loss: 2.4511
44:	[0s / 19s],		train_loss: 2.4489
80:	[0s / 37s],		train_loss: 2.4372
9:	[0s / 7s],		train_loss: 2.6030
45:	[0s / 20s],		train_loss: 2.4534
81:	[0s / 37s],		train_loss: 2.4243
46:	[0s / 20s],		train_loss: 2.4493
82:	[0s / 37s],		train_loss: 2.4096
10:	[0s / 7s],		train_loss: 2.5839
79:	[1s / 1m:37s],		train_loss: 2.4443
47:	[0s / 21s],		train_loss: 2.4568
83:	[0s / 38s],		train_loss: 2.4046
11:	[0s / 8s],		train_loss: 2.5751
48:	[0s / 21s],		train_loss: 2.4617
84:	[0s / 38s],		train_loss: 2.4303
49:	[0s / 22s],		train_loss: 2.4485
85:	[0s / 39s],		train_loss: 2.4187
12:	[0s / 9s],		train_loss: 2.5671
80:	[1s / 1m:38s],		train_loss: 2.4467
50:	[0s / 22s],		train_loss: 2.4597
86:	[0s / 39s],		train_loss: 2.4119
51:	[0s / 23s],		train_loss: 2.4396
13:	[0s / 9s],		train_loss: 2.5674
87:	[0s / 40s],		train_loss: 2.4083
52:	[0s / 23s],		train_loss: 2.4544
81:	[1s / 1m:39s],		train_loss: 2.4430
88:	[0s / 40s],		train_loss: 2.3908
14:	[0s / 10s],		train_loss: 2.5666
53:	[0s / 23s],		train_loss: 2.4291
89:	[0s / 41s],		train_loss: 2.4145
54:	[0s / 24s],		train_loss: 2.4558
15:	[0s / 11s],		train_loss: 2.5420
90:	[0s / 41s],		train_loss: 2.3902
55:	[0s / 24s],		train_loss: 2.4298
82:	[1s / 1m:41s],		train_loss: 2.4376
91:	[0s / 42s],		train_loss: 2.4059
16:	[0s / 11s],		train_loss: 2.5406
56:	[0s / 25s],		train_loss: 2.4343
92:	[0s / 42s],		train_loss: 2.4015
57:	[0s / 25s],		train_loss: 2.4202
17:	[0s / 12s],		train_loss: 2.5347
93:	[0s / 43s],		train_loss: 2.4022
58:	[0s / 26s],		train_loss: 2.4305
83:	[1s / 1m:42s],		train_loss: 2.4494
94:	[0s / 43s],		train_loss: 2.4029
18:	[0s / 13s],		train_loss: 2.5403
59:	[0s / 26s],		train_loss: 2.4308
95:	[0s / 43s],		train_loss: 2.4058
60:	[0s / 27s],		train_loss: 2.4273
19:	[0s / 14s],		train_loss: 2.5223
96:	[0s / 44s],		train_loss: 2.4050
61:	[0s / 27s],		train_loss: 2.4340
84:	[1s / 1m:43s],		train_loss: 2.4368
97:	[0s / 44s],		train_loss: 2.3920
62:	[0s / 27s],		train_loss: 2.4375
20:	[0s / 14s],		train_loss: 2.5109
98:	[0s / 45s],		train_loss: 2.4008
63:	[0s / 28s],		train_loss: 2.4158
21:	[0s / 15s],		train_loss: 2.5253
64:	[0s / 28s],		train_loss: 2.4291
99:	[0s / 45s],		train_loss: 2.3837
85:	[1s / 1m:45s],		train_loss: 2.4485
65:	[0s / 29s],		train_loss: 2.4293
0:	[0s / 0s],		train_loss: 4.4426
22:	[0s / 16s],		train_loss: 2.5125
66:	[0s / 29s],		train_loss: 2.4206
1:	[0s / 0s],		train_loss: 3.0465
86:	[1s / 1m:46s],		train_loss: 2.4297
23:	[0s / 17s],		train_loss: 2.5225
67:	[0s / 30s],		train_loss: 2.4130
2:	[0s / 1s],		train_loss: 2.8488
68:	[0s / 30s],		train_loss: 2.4348
3:	[0s / 1s],		train_loss: 2.7300
24:	[0s / 17s],		train_loss: 2.5267
69:	[0s / 31s],		train_loss: 2.4176
4:	[0s / 2s],		train_loss: 2.6792
87:	[1s / 1m:47s],		train_loss: 2.4369
70:	[0s / 31s],		train_loss: 2.4178
25:	[0s / 18s],		train_loss: 2.4985
5:	[0s / 2s],		train_loss: 2.6545
71:	[0s / 32s],		train_loss: 2.4304
6:	[0s / 3s],		train_loss: 2.6159
26:	[0s / 19s],		train_loss: 2.5015
72:	[0s / 32s],		train_loss: 2.4254
88:	[1s / 1m:48s],		train_loss: 2.4441
7:	[0s / 3s],		train_loss: 2.6015
73:	[0s / 32s],		train_loss: 2.4000
27:	[0s / 20s],		train_loss: 2.4980
8:	[0s / 4s],		train_loss: 2.5843
74:	[0s / 33s],		train_loss: 2.4021
9:	[0s / 4s],		train_loss: 2.5787
75:	[0s / 33s],		train_loss: 2.4146
28:	[0s / 20s],		train_loss: 2.4977
89:	[1s / 1m:50s],		train_loss: 2.4388
10:	[0s / 5s],		train_loss: 2.5584
76:	[0s / 34s],		train_loss: 2.4137
29:	[0s / 21s],		train_loss: 2.5015
11:	[0s / 5s],		train_loss: 2.5584
77:	[0s / 34s],		train_loss: 2.4131
90:	[1s / 1m:51s],		train_loss: 2.4397
12:	[0s / 6s],		train_loss: 2.5428
78:	[0s / 35s],		train_loss: 2.4151
30:	[0s / 22s],		train_loss: 2.5022
13:	[0s / 6s],		train_loss: 2.5349
79:	[0s / 35s],		train_loss: 2.4062
14:	[0s / 6s],		train_loss: 2.5359
80:	[0s / 36s],		train_loss: 2.3899
31:	[0s / 22s],		train_loss: 2.4906
91:	[1s / 1m:52s],		train_loss: 2.4335
15:	[0s / 7s],		train_loss: 2.5276
81:	[0s / 36s],		train_loss: 2.3966
32:	[0s / 23s],		train_loss: 2.5037
16:	[0s / 7s],		train_loss: 2.5287
82:	[0s / 36s],		train_loss: 2.4071
17:	[0s / 8s],		train_loss: 2.5211
83:	[0s / 37s],		train_loss: 2.4006
92:	[1s / 1m:53s],		train_loss: 2.4259
33:	[0s / 24s],		train_loss: 2.4792
84:	[0s / 37s],		train_loss: 2.4123
18:	[0s / 8s],		train_loss: 2.5171
85:	[0s / 38s],		train_loss: 2.4047
19:	[0s / 9s],		train_loss: 2.5112
34:	[0s / 25s],		train_loss: 2.4911
86:	[0s / 38s],		train_loss: 2.4044
20:	[0s / 9s],		train_loss: 2.4976
93:	[1s / 1m:55s],		train_loss: 2.4241
35:	[0s / 25s],		train_loss: 2.4866
87:	[0s / 39s],		train_loss: 2.4136
21:	[0s / 10s],		train_loss: 2.5034
88:	[0s / 39s],		train_loss: 2.3868
22:	[0s / 10s],		train_loss: 2.4922
36:	[0s / 26s],		train_loss: 2.4930
94:	[1s / 1m:56s],		train_loss: 2.4363
89:	[0s / 39s],		train_loss: 2.4001
23:	[0s / 10s],		train_loss: 2.4905
90:	[0s / 40s],		train_loss: 2.3992
37:	[0s / 27s],		train_loss: 2.4894
24:	[0s / 11s],		train_loss: 2.5023
91:	[0s / 40s],		train_loss: 2.3889
25:	[0s / 11s],		train_loss: 2.4810
38:	[0s / 27s],		train_loss: 2.4741
95:	[1s / 1m:57s],		train_loss: 2.4259
92:	[0s / 41s],		train_loss: 2.3932
26:	[0s / 12s],		train_loss: 2.4792
93:	[0s / 41s],		train_loss: 2.3906
39:	[0s / 28s],		train_loss: 2.4766
27:	[0s / 12s],		train_loss: 2.4866
94:	[0s / 42s],		train_loss: 2.4045
28:	[0s / 13s],		train_loss: 2.4965
40:	[0s / 29s],		train_loss: 2.4587
96:	[1s / 1m:58s],		train_loss: 2.4261
95:	[0s / 42s],		train_loss: 2.3893
29:	[0s / 13s],		train_loss: 2.4817
96:	[0s / 43s],		train_loss: 2.3875
41:	[0s / 29s],		train_loss: 2.4888
30:	[0s / 14s],		train_loss: 2.4785
97:	[0s / 43s],		train_loss: 2.3840
97:	[1s / 1m:59s],		train_loss: 2.4231
31:	[0s / 14s],		train_loss: 2.4712
42:	[0s / 30s],		train_loss: 2.4740
98:	[0s / 43s],		train_loss: 2.3951
32:	[0s / 15s],		train_loss: 2.4759
99:	[0s / 44s],		train_loss: 2.3819
43:	[0s / 31s],		train_loss: 2.4647
33:	[0s / 15s],		train_loss: 2.4734
0:	[0s / 0s],		train_loss: 4.0410
98:	[1s / 2m:1s],		train_loss: 2.4330
34:	[0s / 16s],		train_loss: 2.4699
44:	[0s / 32s],		train_loss: 2.4736
1:	[0s / 0s],		train_loss: 3.1187
35:	[0s / 16s],		train_loss: 2.4895
2:	[0s / 1s],		train_loss: 2.8986
45:	[0s / 32s],		train_loss: 2.4781
36:	[0s / 16s],		train_loss: 2.4689
99:	[1s / 2m:2s],		train_loss: 2.4147
3:	[0s / 1s],		train_loss: 2.8273
37:	[0s / 17s],		train_loss: 2.4624
4:	[0s / 2s],		train_loss: 2.7704
46:	[0s / 33s],		train_loss: 2.4783
38:	[0s / 18s],		train_loss: 2.4747
5:	[0s / 2s],		train_loss: 2.7161
47:	[0s / 34s],		train_loss: 2.4739
39:	[0s / 18s],		train_loss: 2.4789
0:	[1s / 1s],		train_loss: 3.9422
6:	[0s / 3s],		train_loss: 2.6795
40:	[0s / 18s],		train_loss: 2.4681
7:	[0s / 3s],		train_loss: 2.6379
48:	[0s / 35s],		train_loss: 2.4581
41:	[0s / 19s],		train_loss: 2.4608
8:	[0s / 3s],		train_loss: 2.6414
1:	[1s / 2s],		train_loss: 2.9978
42:	[0s / 19s],		train_loss: 2.4603
49:	[0s / 35s],		train_loss: 2.4676
9:	[0s / 4s],		train_loss: 2.6114
43:	[0s / 20s],		train_loss: 2.4545
10:	[0s / 4s],		train_loss: 2.5924
50:	[0s / 36s],		train_loss: 2.4602
44:	[0s / 20s],		train_loss: 2.4714
11:	[0s / 5s],		train_loss: 2.5784
2:	[1s / 3s],		train_loss: 2.8404
45:	[0s / 21s],		train_loss: 2.4593
12:	[0s / 5s],		train_loss: 2.5762
51:	[0s / 37s],		train_loss: 2.4678
13:	[0s / 6s],		train_loss: 2.5593
46:	[0s / 21s],		train_loss: 2.4603
52:	[0s / 37s],		train_loss: 2.4533
14:	[0s / 6s],		train_loss: 2.5581
47:	[0s / 22s],		train_loss: 2.4634
3:	[1s / 4s],		train_loss: 2.7520
15:	[0s / 7s],		train_loss: 2.5444
48:	[0s / 22s],		train_loss: 2.4578
53:	[0s / 38s],		train_loss: 2.4568
16:	[0s / 7s],		train_loss: 2.5459
49:	[0s / 22s],		train_loss: 2.4485
4:	[1s / 6s],		train_loss: 2.6946
54:	[1s / 39s],		train_loss: 2.4670
17:	[0s / 8s],		train_loss: 2.5425
50:	[0s / 23s],		train_loss: 2.4491
18:	[0s / 8s],		train_loss: 2.5480
51:	[0s / 24s],		train_loss: 2.4503
55:	[0s / 40s],		train_loss: 2.4674
19:	[0s / 9s],		train_loss: 2.5375
52:	[0s / 24s],		train_loss: 2.4441
5:	[1s / 7s],		train_loss: 2.6478
20:	[0s / 9s],		train_loss: 2.5310
56:	[0s / 40s],		train_loss: 2.4565
53:	[0s / 25s],		train_loss: 2.4423
21:	[0s / 9s],		train_loss: 2.5322
54:	[0s / 25s],		train_loss: 2.4455
57:	[0s / 41s],		train_loss: 2.4469
22:	[0s / 10s],		train_loss: 2.5232
6:	[1s / 8s],		train_loss: 2.6300
55:	[0s / 25s],		train_loss: 2.4448
23:	[0s / 10s],		train_loss: 2.5235
58:	[0s / 42s],		train_loss: 2.4773
56:	[0s / 26s],		train_loss: 2.4390
24:	[0s / 11s],		train_loss: 2.5228
57:	[0s / 26s],		train_loss: 2.4477
59:	[0s / 42s],		train_loss: 2.4625
7:	[1s / 9s],		train_loss: 2.5984
25:	[0s / 11s],		train_loss: 2.5113
58:	[0s / 27s],		train_loss: 2.4410
26:	[0s / 12s],		train_loss: 2.5173
59:	[0s / 27s],		train_loss: 2.4414
60:	[0s / 43s],		train_loss: 2.4533
27:	[0s / 12s],		train_loss: 2.5011
60:	[0s / 28s],		train_loss: 2.4416
8:	[1s / 11s],		train_loss: 2.5977
28:	[0s / 12s],		train_loss: 2.5010
61:	[0s / 44s],		train_loss: 2.4474
61:	[0s / 28s],		train_loss: 2.4545
29:	[0s / 13s],		train_loss: 2.4998
62:	[0s / 29s],		train_loss: 2.4535
62:	[0s / 45s],		train_loss: 2.4431
30:	[0s / 13s],		train_loss: 2.4971
9:	[1s / 12s],		train_loss: 2.5752
63:	[0s / 29s],		train_loss: 2.4285
31:	[0s / 14s],		train_loss: 2.4900
63:	[0s / 45s],		train_loss: 2.4431
64:	[0s / 30s],		train_loss: 2.4284
32:	[0s / 14s],		train_loss: 2.4832
65:	[0s / 30s],		train_loss: 2.4226
64:	[0s / 46s],		train_loss: 2.4394
33:	[0s / 15s],		train_loss: 2.4739
10:	[1s / 13s],		train_loss: 2.5683
66:	[0s / 31s],		train_loss: 2.4400
34:	[0s / 15s],		train_loss: 2.4923
65:	[0s / 47s],		train_loss: 2.4520
67:	[0s / 31s],		train_loss: 2.4415
35:	[0s / 16s],		train_loss: 2.4960
68:	[0s / 31s],		train_loss: 2.4228
66:	[0s / 47s],		train_loss: 2.4330
36:	[0s / 16s],		train_loss: 2.4777
11:	[1s / 14s],		train_loss: 2.5461
69:	[0s / 32s],		train_loss: 2.4102
37:	[0s / 16s],		train_loss: 2.4731
67:	[0s / 48s],		train_loss: 2.4497
70:	[0s / 32s],		train_loss: 2.4263
38:	[0s / 17s],		train_loss: 2.4749
71:	[0s / 33s],		train_loss: 2.4366
39:	[0s / 17s],		train_loss: 2.4747
12:	[1s / 16s],		train_loss: 2.5663
68:	[0s / 49s],		train_loss: 2.4371
40:	[0s / 18s],		train_loss: 2.4817
72:	[0s / 33s],		train_loss: 2.4269
69:	[0s / 49s],		train_loss: 2.4380
41:	[0s / 18s],		train_loss: 2.4607
73:	[0s / 34s],		train_loss: 2.4244
13:	[1s / 17s],		train_loss: 2.5435
42:	[0s / 19s],		train_loss: 2.4682
74:	[0s / 34s],		train_loss: 2.4106
70:	[0s / 50s],		train_loss: 2.4335
43:	[0s / 19s],		train_loss: 2.4560
75:	[0s / 35s],		train_loss: 2.4093
44:	[0s / 19s],		train_loss: 2.4745
71:	[0s / 51s],		train_loss: 2.4318
76:	[0s / 35s],		train_loss: 2.4315
14:	[1s / 18s],		train_loss: 2.5475
45:	[0s / 20s],		train_loss: 2.4647
77:	[0s / 35s],		train_loss: 2.4223
72:	[0s / 52s],		train_loss: 2.4435
46:	[0s / 20s],		train_loss: 2.4696
78:	[0s / 36s],		train_loss: 2.4099
47:	[0s / 21s],		train_loss: 2.4638
79:	[0s / 36s],		train_loss: 2.3972
73:	[0s / 52s],		train_loss: 2.4354
15:	[1s / 19s],		train_loss: 2.5296
48:	[0s / 21s],		train_loss: 2.4673
80:	[0s / 37s],		train_loss: 2.4211
74:	[0s / 53s],		train_loss: 2.4309
49:	[0s / 22s],		train_loss: 2.4596
81:	[0s / 37s],		train_loss: 2.4173
16:	[1s / 20s],		train_loss: 2.5326
50:	[0s / 22s],		train_loss: 2.4588
82:	[0s / 38s],		train_loss: 2.3989
75:	[0s / 54s],		train_loss: 2.4442
51:	[0s / 23s],		train_loss: 2.4556
83:	[0s / 38s],		train_loss: 2.4012
52:	[0s / 23s],		train_loss: 2.4509
76:	[0s / 54s],		train_loss: 2.4313
84:	[0s / 39s],		train_loss: 2.4096
17:	[1s / 21s],		train_loss: 2.5259
53:	[0s / 23s],		train_loss: 2.4593
85:	[0s / 39s],		train_loss: 2.4084
77:	[0s / 55s],		train_loss: 2.4267
54:	[0s / 24s],		train_loss: 2.4618
86:	[0s / 39s],		train_loss: 2.4143
55:	[0s / 24s],		train_loss: 2.4408
78:	[0s / 56s],		train_loss: 2.4299
18:	[1s / 23s],		train_loss: 2.5055
87:	[0s / 40s],		train_loss: 2.4051
56:	[0s / 25s],		train_loss: 2.4429
88:	[0s / 40s],		train_loss: 2.4056
79:	[0s / 56s],		train_loss: 2.4326
57:	[0s / 25s],		train_loss: 2.4498
89:	[0s / 41s],		train_loss: 2.4254
58:	[0s / 26s],		train_loss: 2.4591
19:	[1s / 24s],		train_loss: 2.5079
90:	[0s / 41s],		train_loss: 2.4070
80:	[0s / 57s],		train_loss: 2.4097
59:	[0s / 26s],		train_loss: 2.4502
91:	[0s / 42s],		train_loss: 2.4093
60:	[0s / 26s],		train_loss: 2.4432
81:	[0s / 58s],		train_loss: 2.4130
92:	[0s / 42s],		train_loss: 2.3980
20:	[1s / 25s],		train_loss: 2.5036
61:	[0s / 27s],		train_loss: 2.4451
93:	[0s / 43s],		train_loss: 2.4044
82:	[0s / 59s],		train_loss: 2.4275
62:	[0s / 27s],		train_loss: 2.4345
94:	[0s / 43s],		train_loss: 2.3970
63:	[0s / 28s],		train_loss: 2.4490
83:	[0s / 59s],		train_loss: 2.4382
21:	[1s / 26s],		train_loss: 2.5070
95:	[0s / 44s],		train_loss: 2.3996
64:	[0s / 28s],		train_loss: 2.4311
96:	[0s / 44s],		train_loss: 2.3967
65:	[0s / 29s],		train_loss: 2.4341
84:	[0s / 1m:0s],		train_loss: 2.4192
97:	[0s / 44s],		train_loss: 2.3909
66:	[0s / 29s],		train_loss: 2.4407
22:	[1s / 27s],		train_loss: 2.4984
85:	[0s / 1m:1s],		train_loss: 2.4256
98:	[0s / 45s],		train_loss: 2.3894
67:	[0s / 30s],		train_loss: 2.4285
99:	[0s / 45s],		train_loss: 2.3839
68:	[0s / 30s],		train_loss: 2.4367
86:	[0s / 1m:1s],		train_loss: 2.4348
69:	[0s / 30s],		train_loss: 2.4377
0:	[0s / 0s],		train_loss: 3.7131
23:	[1s / 29s],		train_loss: 2.4923
87:	[0s / 1m:2s],		train_loss: 2.4219
70:	[0s / 31s],		train_loss: 2.4281
1:	[0s / 0s],		train_loss: 2.8543
71:	[0s / 31s],		train_loss: 2.4246
2:	[0s / 1s],		train_loss: 2.7409
88:	[0s / 1m:3s],		train_loss: 2.4222
72:	[0s / 32s],		train_loss: 2.4372
24:	[1s / 30s],		train_loss: 2.4950
3:	[0s / 1s],		train_loss: 2.6634
73:	[0s / 32s],		train_loss: 2.4221
89:	[0s / 1m:4s],		train_loss: 2.4150
4:	[0s / 2s],		train_loss: 2.6317
74:	[0s / 33s],		train_loss: 2.4176
5:	[0s / 2s],		train_loss: 2.6245
90:	[0s / 1m:4s],		train_loss: 2.4150
75:	[0s / 33s],		train_loss: 2.4332
25:	[1s / 31s],		train_loss: 2.4919
6:	[0s / 3s],		train_loss: 2.6194
76:	[0s / 33s],		train_loss: 2.4184
91:	[0s / 1m:5s],		train_loss: 2.4204
7:	[0s / 3s],		train_loss: 2.5967
77:	[0s / 34s],		train_loss: 2.4111
8:	[0s / 4s]