44:	[0s / 7s],		train_loss: 4.3051[I 2026-06-28 01:41:09,851] Trial 97 finished with value: 0.7678776796393413 and parameters: {'num_nodes': [32], 'dropout': 0.2648056529611507, 'learning_rate': 0.005035196153997894, 'batch_norm': False}. Best is trial 52 with value: 0.779334192044653.
[I 2026-06-28 01:41:10,689] Trial 96 finished with value: 0.7675211611003773 and parameters: {'num_nodes': [32], 'dropout': 0.27331513337773655, 'learning_rate': 0.0049885709558205125, 'batch_norm': False}. Best is trial 52 with value: 0.779334192044653.
[I 2026-06-28 01:41:12,986] Trial 98 finished with value: 0.7590001763425032 and parameters: {'num_nodes': [32], 'dropout': 0.24118816256519535, 'learning_rate': 0.007635721955590016, 'batch_norm': False}. Best is trial 52 with value: 0.779334192044653.
[I 2026-06-28 01:41:15,482] Trial 84 finished with value: 0.7768347287392278 and parameters: {'num_nodes': [32], 'dropout': 0.2991511925379172, 'learning_rate': 0.00729166918300559, 'batch_norm': False}. Best is trial 52 with value: 0.779334192044653.
[I 2026-06-28 01:41:16,287] Trial 94 finished with value: 0.7651520379059711 and parameters: {'num_nodes': [32], 'dropout': 0.2036977103849503, 'learning_rate': 0.005143060196244747, 'batch_norm': False}. Best is trial 52 with value: 0.779334192044653.
[I 2026-06-28 01:41:20,029] Trial 99 finished with value: 0.7678278437145398 and parameters: {'num_nodes': [32], 'dropout': 0.23901674135587872, 'learning_rate': 0.007209379220704081, 'batch_norm': False}. Best is trial 52 with value: 0.779334192044653.
[I 2026-06-28 01:41:20,818] Trial 87 finished with value: 0.7697858205293342 and parameters: {'num_nodes': [64, 32], 'dropout': 0.22452330065646753, 'learning_rate': 0.005984651998458582, 'batch_norm': False}. Best is trial 52 with value: 0.779334192044653.
/scratch.hpc/luca.cotugno/Foundation_model_clinical_data/.venv/lib/python3.12/site-packages/torchtuples/tupletree.py:146: UserWarning: The given NumPy array is not writable, and PyTorch does not support non-writable tensors. This means writing to this tensor will result in undefined behavior. You may want to copy the array to protect its data or make it writable before converting it to a tensor. This type of warning will be suppressed for the rest of this program. (Triggered internally at /pytorch/torch/csrc/utils/tensor_numpy.cpp:213.)
  return torch.from_numpy(data)
[I 2026-06-28 01:41:23,354] A new study created in memory with name: rsf_tuning_tabdpt_3_-1_seed123
[I 2026-06-28 01:43:27,208] Trial 7 finished with value: 0.7692312117336422 and parameters: {'n_estimators': 50, 'max_depth': 8, 'min_samples_split': 8, 'min_samples_leaf': 14, 'max_features': 'log2'}. Best is trial 7 with value: 0.7692312117336422.
[I 2026-06-28 01:45:55,914] Trial 6 finished with value: 0.7713308878657895 and parameters: {'n_estimators': 100, 'max_depth': 9, 'min_samples_split': 6, 'min_samples_leaf': 6, 'max_features': 'log2'}. Best is trial 6 with value: 0.7713308878657895.
[I 2026-06-28 01:46:52,834] Trial 1 finished with value: 0.7681152194880625 and parameters: {'n_estimators': 200, 'max_depth': 5, 'min_samples_split': 17, 'min_samples_leaf': 15, 'max_features': 'log2'}. Best is trial 6 with value: 0.7713308878657895.
[I 2026-06-28 01:46:53,776] Trial 5 finished with value: 0.7686789681482007 and parameters: {'n_estimators': 200, 'max_depth': 5, 'min_samples_split': 16, 'min_samples_leaf': 12, 'max_features': 'log2'}. Best is trial 6 with value: 0.7713308878657895.
[I 2026-06-28 01:47:28,657] Trial 9 finished with value: 0.7663434379847711 and parameters: {'n_estimators': 50, 'max_depth': 5, 'min_samples_split': 18, 'min_samples_leaf': 7, 'max_features': 'log2'}. Best is trial 6 with value: 0.7713308878657895.
[I 2026-06-28 01:49:36,602] Trial 8 finished with value: 0.7689723475529665 and parameters: {'n_estimators': 150, 'max_depth': 8, 'min_samples_split': 17, 'min_samples_leaf': 4, 'max_features': 'log2'}. Best is trial 6 with value: 0.7713308878657895.
[I 2026-06-28 01:50:29,797] Trial 4 finished with value: 0.771977089561254 and parameters: {'n_estimators': 200, 'max_depth': 10, 'min_samples_split': 16, 'min_samples_leaf': 7, 'max_features': 'log2'}. Best is trial 4 with value: 0.771977089561254.
[I 2026-06-28 01:51:34,744] Trial 10 finished with value: 0.7658487197728131 and parameters: {'n_estimators': 200, 'max_depth': 4, 'min_samples_split': 16, 'min_samples_leaf': 4, 'max_features': 'log2'}. Best is trial 4 with value: 0.771977089561254.
[I 2026-06-28 01:53:18,644] Trial 13 finished with value: 0.7651852604653036 and parameters: {'n_estimators': 200, 'max_depth': 3, 'min_samples_split': 19, 'min_samples_leaf': 6, 'max_features': 'log2'}. Best is trial 4 with value: 0.771977089561254.
[I 2026-06-28 01:53:49,225] Trial 2 finished with value: 0.769712507358454 and parameters: {'n_estimators': 300, 'max_depth': 8, 'min_samples_split': 9, 'min_samples_leaf': 3, 'max_features': 'log2'}. Best is trial 4 with value: 0.771977089561254.
[I 2026-06-28 01:55:18,737] Trial 15 finished with value: 0.7693424274557102 and parameters: {'n_estimators': 100, 'max_depth': 7, 'min_samples_split': 6, 'min_samples_leaf': 6, 'max_features': 'log2'}. Best is trial 4 with value: 0.771977089561254.
[I 2026-06-28 01:55:59,768] Trial 14 finished with value: 0.7676626865499925 and parameters: {'n_estimators': 150, 'max_depth': 7, 'min_samples_split': 16, 'min_samples_leaf': 5, 'max_features': 'log2'}. Best is trial 4 with value: 0.771977089561254.
[I 2026-06-28 01:57:04,129] Trial 12 finished with value: 0.7687748437706732 and parameters: {'n_estimators': 200, 'max_depth': 10, 'min_samples_split': 10, 'min_samples_leaf': 4, 'max_features': 'log2'}. Best is trial 4 with value: 0.771977089561254.
[I 2026-06-28 02:06:17,351] Trial 11 finished with value: 0.7674019048568673 and parameters: {'n_estimators': 200, 'max_depth': 6, 'min_samples_split': 8, 'min_samples_leaf': 4, 'max_features': 'sqrt'}. Best is trial 4 with value: 0.771977089561254.
[I 2026-06-28 02:09:36,748] Trial 16 finished with value: 0.768458454216514 and parameters: {'n_estimators': 200, 'max_depth': 5, 'min_samples_split': 11, 'min_samples_leaf': 11, 'max_features': 'sqrt'}. Best is trial 4 with value: 0.771977089561254.
[I 2026-06-28 02:11:15,848] Trial 3 finished with value: 0.7727901148398206 and parameters: {'n_estimators': 250, 'max_depth': 9, 'min_samples_split': 7, 'min_samples_leaf': 14, 'max_features': 'sqrt'}. Best is trial 3 with value: 0.7727901148398206.
[I 2026-06-28 02:15:56,889] Trial 0 finished with value: 0.7713558155276323 and parameters: {'n_estimators': 300, 'max_depth': 8, 'min_samples_split': 5, 'min_samples_leaf': 10, 'max_features': 'sqrt'}. Best is trial 3 with value: 0.7727901148398206.
[I 2026-06-28 02:23:25,898] Trial 22 finished with value: 0.7707326239815612 and parameters: {'n_estimators': 100, 'max_depth': 10, 'min_samples_split': 13, 'min_samples_leaf': 9, 'max_features': 'sqrt'}. Best is trial 3 with value: 0.7727901148398206.
[I 2026-06-28 02:34:35,730] Trial 17 finished with value: 0.7726616415057075 and parameters: {'n_estimators': 300, 'max_depth': 10, 'min_samples_split': 12, 'min_samples_leaf': 9, 'max_features': 'sqrt'}. Best is trial 3 with value: 0.7727901148398206.
[I 2026-06-28 02:35:35,966] Trial 18 finished with value: 0.7726616415057075 and parameters: {'n_estimators': 300, 'max_depth': 10, 'min_samples_split': 13, 'min_samples_leaf': 9, 'max_features': 'sqrt'}. Best is trial 3 with value: 0.7727901148398206.
[I 2026-06-28 02:36:10,407] Trial 19 finished with value: 0.7726616415057075 and parameters: {'n_estimators': 300, 'max_depth': 10, 'min_samples_split': 12, 'min_samples_leaf': 9, 'max_features': 'sqrt'}. Best is trial 3 with value: 0.7727901148398206.
[I 2026-06-28 02:37:13,521] Trial 20 finished with value: 0.7726616415057075 and parameters: {'n_estimators': 300, 'max_depth': 10, 'min_samples_split': 13, 'min_samples_leaf': 9, 'max_features': 'sqrt'}. Best is trial 3 with value: 0.7727901148398206.
[I 2026-06-28 02:46:22,797] Trial 21 finished with value: 0.7726616415057075 and parameters: {'n_estimators': 300, 'max_depth': 10, 'min_samples_split': 13, 'min_samples_leaf': 9, 'max_features': 'sqrt'}. Best is trial 3 with value: 0.7727901148398206.
[I 2026-06-28 02:49:59,581] Trial 24 finished with value: 0.7706309958217403 and parameters: {'n_estimators': 250, 'max_depth': 10, 'min_samples_split': 14, 'min_samples_leaf': 8, 'max_features': 'sqrt'}. Best is trial 3 with value: 0.7727901148398206.
[I 2026-06-28 02:51:23,439] Trial 23 finished with value: 0.7726616415057075 and parameters: {'n_estimators': 300, 'max_depth': 10, 'min_samples_split': 13, 'min_samples_leaf': 9, 'max_features': 'sqrt'}. Best is trial 3 with value: 0.7727901148398206.
[I 2026-06-28 02:53:26,810] Trial 25 finished with value: 0.7701976380081648 and parameters: {'n_estimators': 250, 'max_depth': 9, 'min_samples_split': 13, 'min_samples_leaf': 13, 'max_features': 'sqrt'}. Best is trial 3 with value: 0.7727901148398206.
[I 2026-06-28 03:04:41,066] Trial 26 finished with value: 0.7701976380081648 and parameters: {'n_estimators': 250, 'max_depth': 9, 'min_samples_split': 13, 'min_samples_leaf': 13, 'max_features': 'sqrt'}. Best is trial 3 with value: 0.7727901148398206.
[I 2026-06-28 03:05:35,506] Trial 27 finished with value: 0.7701976380081648 and parameters: {'n_estimators': 250, 'max_depth': 9, 'min_samples_split': 12, 'min_samples_leaf': 13, 'max_features': 'sqrt'}. Best is trial 3 with value: 0.7727901148398206.
[I 2026-06-28 03:06:11,458] Trial 28 finished with value: 0.7701976380081648 and parameters: {'n_estimators': 250, 'max_depth': 9, 'min_samples_split': 14, 'min_samples_leaf': 13, 'max_features': 'sqrt'}. Best is trial 3 with value: 0.7727901148398206.
[I 2026-06-28 03:07:17,940] Trial 29 finished with value: 0.7701976380081648 and parameters: {'n_estimators': 250, 'max_depth': 9, 'min_samples_split': 14, 'min_samples_leaf': 13, 'max_features': 'sqrt'}. Best is trial 3 with value: 0.7727901148398206.
[I 2026-06-28 03:16:16,406] Trial 30 finished with value: 0.7701976380081648 and parameters: {'n_estimators': 250, 'max_depth': 9, 'min_samples_split': 14, 'min_samples_leaf': 13, 'max_features': 'sqrt'}. Best is trial 3 with value: 0.7727901148398206.
[I 2026-06-28 03:20:13,559] Trial 31 finished with value: 0.7723088192150087 and parameters: {'n_estimators': 250, 'max_depth': 9, 'min_samples_split': 11, 'min_samples_leaf': 12, 'max_features': 'sqrt'}. Best is trial 3 with value: 0.7727901148398206.
[I 2026-06-28 03:21:20,384] Trial 32 finished with value: 0.7701976380081648 and parameters: {'n_estimators': 250, 'max_depth': 9, 'min_samples_split': 11, 'min_samples_leaf': 13, 'max_features': 'sqrt'}. Best is trial 3 with value: 0.7727901148398206.
[I 2026-06-28 03:24:03,882] Trial 33 finished with value: 0.7731486896678677 and parameters: {'n_estimators': 250, 'max_depth': 9, 'min_samples_split': 11, 'min_samples_leaf': 11, 'max_features': 'sqrt'}. Best is trial 33 with value: 0.7731486896678677.
[I 2026-06-28 03:32:24,463] Trial 36 finished with value: 0.769942608852388 and parameters: {'n_estimators': 250, 'max_depth': 7, 'min_samples_split': 5, 'min_samples_leaf': 11, 'max_features': 'sqrt'}. Best is trial 33 with value: 0.7731486896678677.
[I 2026-06-28 03:35:23,181] Trial 34 finished with value: 0.7731486896678677 and parameters: {'n_estimators': 250, 'max_depth': 9, 'min_samples_split': 11, 'min_samples_leaf': 11, 'max_features': 'sqrt'}. Best is trial 33 with value: 0.7731486896678677.
[I 2026-06-28 03:36:08,667] Trial 35 finished with value: 0.7731486896678677 and parameters: {'n_estimators': 250, 'max_depth': 9, 'min_samples_split': 10, 'min_samples_leaf': 11, 'max_features': 'sqrt'}. Best is trial 33 with value: 0.7731486896678677.
[I 2026-06-28 03:38:24,842] Trial 37 finished with value: 0.7699483613897363 and parameters: {'n_estimators': 300, 'max_depth': 7, 'min_samples_split': 5, 'min_samples_leaf': 11, 'max_features': 'sqrt'}. Best is trial 33 with value: 0.7731486896678677.
[I 2026-06-28 03:52:49,254] Trial 44 finished with value: 0.7717642456793651 and parameters: {'n_estimators': 150, 'max_depth': 8, 'min_samples_split': 9, 'min_samples_leaf': 15, 'max_features': 'sqrt'}. Best is trial 33 with value: 0.7731486896678677.
[I 2026-06-28 03:55:01,886] Trial 45 finished with value: 0.7717642456793651 and parameters: {'n_estimators': 150, 'max_depth': 8, 'min_samples_split': 8, 'min_samples_leaf': 15, 'max_features': 'sqrt'}. Best is trial 33 with value: 0.7731486896678677.
[I 2026-06-28 03:55:06,898] Trial 38 finished with value: 0.7728706503626975 and parameters: {'n_estimators': 300, 'max_depth': 10, 'min_samples_split': 11, 'min_samples_leaf': 11, 'max_features': 'sqrt'}. Best is trial 33 with value: 0.7731486896678677.
[I 2026-06-28 03:55:44,948] Trial 40 finished with value: 0.7713558155276323 and parameters: {'n_estimators': 300, 'max_depth': 8, 'min_samples_split': 5, 'min_samples_leaf': 10, 'max_features': 'sqrt'}. Best is trial 33 with value: 0.7731486896678677.
[I 2026-06-28 03:57:01,343] Trial 41 finished with value: 0.7730508965329458 and parameters: {'n_estimators': 300, 'max_depth': 8, 'min_samples_split': 9, 'min_samples_leaf': 15, 'max_features': 'sqrt'}. Best is trial 33 with value: 0.7731486896678677.
[I 2026-06-28 03:59:33,516] Trial 39 finished with value: 0.7707364590064602 and parameters: {'n_estimators': 300, 'max_depth': 10, 'min_samples_split': 5, 'min_samples_leaf': 10, 'max_features': 'sqrt'}. Best is trial 33 with value: 0.7731486896678677.
[I 2026-06-28 04:06:51,858] Trial 42 finished with value: 0.7713558155276323 and parameters: {'n_estimators': 300, 'max_depth': 8, 'min_samples_split': 10, 'min_samples_leaf': 10, 'max_features': 'sqrt'}. Best is trial 33 with value: 0.7731486896678677.
[I 2026-06-28 04:08:15,850] Trial 43 finished with value: 0.7730508965329458 and parameters: {'n_estimators': 300, 'max_depth': 8, 'min_samples_split': 8, 'min_samples_leaf': 15, 'max_features': 'sqrt'}. Best is trial 33 with value: 0.7731486896678677.
[I 2026-06-28 04:18:02,161] Trial 47 finished with value: 0.7711698168200357 and parameters: {'n_estimators': 200, 'max_depth': 8, 'min_samples_split': 7, 'min_samples_leaf': 10, 'max_features': 'sqrt'}. Best is trial 33 with value: 0.7731486896678677.
[I 2026-06-28 04:21:54,628] Trial 46 finished with value: 0.771311712741295 and parameters: {'n_estimators': 250, 'max_depth': 8, 'min_samples_split': 8, 'min_samples_leaf': 10, 'max_features': 'sqrt'}. Best is trial 33 with value: 0.7731486896678677.
[I 2026-06-28 04:24:03,644] Trial 48 finished with value: 0.771311712741295 and parameters: {'n_estimators': 250, 'max_depth': 8, 'min_samples_split': 10, 'min_samples_leaf': 10, 'max_features': 'sqrt'}. Best is trial 33 with value: 0.7731486896678677.
[I 2026-06-28 04:24:49,197] Trial 49 finished with value: 0.771311712741295 and parameters: {'n_estimators': 250, 'max_depth': 8, 'min_samples_split': 9, 'min_samples_leaf': 10, 'max_features': 'sqrt'}. Best is trial 33 with value: 0.7731486896678677.
[I 2026-06-28 04:31:05,651] Trial 57 finished with value: 0.768151652224602 and parameters: {'n_estimators': 200, 'max_depth': 6, 'min_samples_split': 9, 'min_samples_leaf': 14, 'max_features': 'log2'}. Best is trial 33 with value: 0.7731486896678677.
[I 2026-06-28 04:31:30,230] Trial 53 finished with value: 0.7699828766138264 and parameters: {'n_estimators': 250, 'max_depth': 6, 'min_samples_split': 9, 'min_samples_leaf': 14, 'max_features': 'sqrt'}. Best is trial 33 with value: 0.7731486896678677.
[I 2026-06-28 04:31:38,390] Trial 50 finished with value: 0.7713558155276323 and parameters: {'n_estimators': 300, 'max_depth': 8, 'min_samples_split': 10, 'min_samples_leaf': 10, 'max_features': 'sqrt'}. Best is trial 33 with value: 0.7731486896678677.
[I 2026-06-28 04:33:27,356] Trial 51 finished with value: 0.7727498470783821 and parameters: {'n_estimators': 300, 'max_depth': 8, 'min_samples_split': 10, 'min_samples_leaf': 12, 'max_features': 'sqrt'}. Best is trial 33 with value: 0.7731486896678677.
[I 2026-06-28 04:35:20,301] Trial 52 finished with value: 0.7722647164286714 and parameters: {'n_estimators': 250, 'max_depth': 8, 'min_samples_split': 10, 'min_samples_leaf': 12, 'max_features': 'sqrt'}. Best is trial 33 with value: 0.7731486896678677.
[I 2026-06-28 04:40:04,792] Trial 55 finished with value: 0.7694152929287893 and parameters: {'n_estimators': 200, 'max_depth': 6, 'min_samples_split': 9, 'min_samples_leaf': 14, 'max_features': 'sqrt'}. Best is trial 33 with value: 0.7731486896678677.
[I 2026-06-28 04:41:07,442] Trial 54 finished with value: 0.7699828766138264 and parameters: {'n_estimators': 250, 'max_depth': 6, 'min_samples_split': 9, 'min_samples_leaf': 14, 'max_features': 'sqrt'}. Best is trial 33 with value: 0.7731486896678677.
[I 2026-06-28 04:42:16,488] Trial 56 finished with value: 0.7694152929287893 and parameters: {'n_estimators': 200, 'max_depth': 6, 'min_samples_split': 9, 'min_samples_leaf': 14, 'max_features': 'sqrt'}. Best is trial 33 with value: 0.7731486896678677.
[I 2026-06-28 04:53:57,086] Trial 64 finished with value: 0.7705638828860096 and parameters: {'n_estimators': 300, 'max_depth': 9, 'min_samples_split': 7, 'min_samples_leaf': 8, 'max_features': 'log2'}. Best is trial 33 with value: 0.7731486896678677.
[I 2026-06-28 04:55:06,250] Trial 65 finished with value: 0.7705638828860096 and parameters: {'n_estimators': 300, 'max_depth': 9, 'min_samples_split': 7, 'min_samples_leaf': 8, 'max_features': 'log2'}. Best is trial 33 with value: 0.7731486896678677.
[I 2026-06-28 05:07:26,938] Trial 58 finished with value: 0.7729032480743381 and parameters: {'n_estimators': 300, 'max_depth': 9, 'min_samples_split': 10, 'min_samples_leaf': 12, 'max_features': 'sqrt'}. Best is trial 33 with value: 0.7731486896678677.
[I 2026-06-28 05:07:45,617] Trial 59 finished with value: 0.7729032480743381 and parameters: {'n_estimators': 300, 'max_depth': 9, 'min_samples_split': 10, 'min_samples_leaf': 12, 'max_features': 'sqrt'}. Best is trial 33 with value: 0.7731486896678677.
[I 2026-06-28 05:07:57,001] Trial 60 finished with value: 0.7729032480743381 and parameters: {'n_estimators': 300, 'max_depth': 9, 'min_samples_split': 7, 'min_samples_leaf': 12, 'max_features': 'sqrt'}. Best is trial 33 with value: 0.7731486896678677.
[I 2026-06-28 05:09:44,098] Trial 61 finished with value: 0.7729032480743381 and parameters: {'n_estimators': 300, 'max_depth': 9, 'min_samples_split': 7, 'min_samples_leaf': 12, 'max_features': 'sqrt'}. Best is trial 33 with value: 0.7731486896678677.
[I 2026-06-28 05:12:04,418] Trial 62 finished with value: 0.7733500284750598 and parameters: {'n_estimators': 300, 'max_depth': 9, 'min_samples_split': 7, 'min_samples_leaf': 11, 'max_features': 'sqrt'}. Best is trial 62 with value: 0.7733500284750598.
[I 2026-06-28 05:16:57,554] Trial 63 finished with value: 0.7733500284750598 and parameters: {'n_estimators': 300, 'max_depth': 9, 'min_samples_split': 7, 'min_samples_leaf': 11, 'max_features': 'sqrt'}. Best is trial 62 with value: 0.7733500284750598.
[I 2026-06-28 05:25:12,825] Trial 66 finished with value: 0.7699483613897363 and parameters: {'n_estimators': 300, 'max_depth': 7, 'min_samples_split': 11, 'min_samples_leaf': 11, 'max_features': 'sqrt'}. Best is trial 62 with value: 0.7733500284750598.
[I 2026-06-28 05:26:24,889] Trial 67 finished with value: 0.7699483613897363 and parameters: {'n_estimators': 300, 'max_depth': 7, 'min_samples_split': 11, 'min_samples_leaf': 11, 'max_features': 'sqrt'}. Best is trial 62 with value: 0.7733500284750598.
[I 2026-06-28 05:38:31,409] Trial 70 finished with value: 0.7708265820915843 and parameters: {'n_estimators': 300, 'max_depth': 7, 'min_samples_split': 11, 'min_samples_leaf': 15, 'max_features': 'sqrt'}. Best is trial 62 with value: 0.7733500284750598.
[I 2026-06-28 05:38:43,700] Trial 68 finished with value: 0.7699483613897363 and parameters: {'n_estimators': 300, 'max_depth': 7, 'min_samples_split': 11, 'min_samples_leaf': 11, 'max_features': 'sqrt'}. Best is trial 62 with value: 0.7733500284750598.
[I 2026-06-28 05:39:58,842] Trial 75 finished with value: 0.7651123949922245 and parameters: {'n_estimators': 250, 'max_depth': 3, 'min_samples_split': 6, 'min_samples_leaf': 15, 'max_features': 'sqrt'}. Best is trial 62 with value: 0.7733500284750598.
[I 2026-06-28 05:41:00,073] Trial 71 finished with value: 0.7699483613897363 and parameters: {'n_estimators': 300, 'max_depth': 7, 'min_samples_split': 11, 'min_samples_leaf': 11, 'max_features': 'sqrt'}. Best is trial 62 with value: 0.7733500284750598.
[I 2026-06-28 05:43:19,040] Trial 72 finished with value: 0.7699483613897363 and parameters: {'n_estimators': 300, 'max_depth': 7, 'min_samples_split': 6, 'min_samples_leaf': 11, 'max_features': 'sqrt'}. Best is trial 62 with value: 0.7733500284750598.
[I 2026-06-28 05:43:54,542] Trial 69 finished with value: 0.7729032480743381 and parameters: {'n_estimators': 300, 'max_depth': 9, 'min_samples_split': 8, 'min_samples_leaf': 12, 'max_features': 'sqrt'}. Best is trial 62 with value: 0.7733500284750598.
[I 2026-06-28 05:45:15,303] Trial 74 finished with value: 0.7674766878423959 and parameters: {'n_estimators': 300, 'max_depth': 4, 'min_samples_split': 6, 'min_samples_leaf': 15, 'max_features': 'sqrt'}. Best is trial 62 with value: 0.7733500284750598.
[I 2026-06-28 05:45:36,204] Trial 77 finished with value: 0.769106573424428 and parameters: {'n_estimators': 50, 'max_depth': 9, 'min_samples_split': 6, 'min_samples_leaf': 7, 'max_features': 'sqrt'}. Best is trial 62 with value: 0.7733500284750598.
[I 2026-06-28 05:48:04,686] Trial 73 finished with value: 0.7699483613897363 and parameters: {'n_estimators': 300, 'max_depth': 7, 'min_samples_split': 6, 'min_samples_leaf': 11, 'max_features': 'sqrt'}. Best is trial 62 with value: 0.7733500284750598.
