[I 2026-06-28 01:37:57,291] Trial 44 finished with value: 0.757629688410464 and parameters: {'num_nodes': [128], 'dropout': 0.10261740682507184, 'learning_rate': 0.00754912506002679, 'batch_norm': False}. Best is trial 36 with value: 0.7756980863004876.
/scratch.hpc/luca.cotugno/Foundation_model_clinical_data/test_tabular_model.py:481: UserWarning: Choices for a categorical distribution should be a tuple of None, bool, int, float and str for persistent storage but contains [32] which is of type list.
  num_nodes  = trial.suggest_categorical("num_nodes", [[32], [64], [128], [64, 32], [128, 64]])
/scratch.hpc/luca.cotugno/Foundation_model_clinical_data/test_tabular_model.py:481: UserWarning: Choices for a categorical distribution should be a tuple of None, bool, int, float and str for persistent storage but contains [64] which is of type list.
  num_nodes  = trial.suggest_categorical("num_nodes", [[32], [64], [128], [64, 32], [128, 64]])
/scratch.hpc/luca.cotugno/Foundation_model_clinical_data/test_tabular_model.py:481: UserWarning: Choices for a categorical distribution should be a tuple of None, bool, int, float and str for persistent storage but contains [128] which is of type list.
  num_nodes  = trial.suggest_categorical("num_nodes", [[32], [64], [128], [64, 32], [128, 64]])
/scratch.hpc/luca.cotugno/Foundation_model_clinical_data/test_tabular_model.py:481: UserWarning: Choices for a categorical distribution should be a tuple of None, bool, int, float and str for persistent storage but contains [64, 32] which is of type list.
  num_nodes  = trial.suggest_categorical("num_nodes", [[32], [64], [128], [64, 32], [128, 64]])
/scratch.hpc/luca.cotugno/Foundation_model_clinical_data/test_tabular_model.py:481: UserWarning: Choices for a categorical distribution should be a tuple of None, bool, int, float and str for persistent storage but contains [128, 64] which is of type list.
  num_nodes  = trial.suggest_categorical("num_nodes", [[32], [64], [128], [64, 32], [128, 64]])

49:	[0s / 6s],		train_loss: 4.1776
96:	[0s / 13s],		train_loss: 4.0376
7:	[0s / 4s],		train_loss: 4.3865
50:	[0s / 6s],		train_loss: 4.1612
49:	[0s / 15s],		train_loss: 4.2239
97:	[0s / 13s],		train_loss: 4.0175
46:	[0s / 8s],		train_loss: 4.1999
51:	[0s / 6s],		train_loss: 4.2025
98:	[0s / 13s],		train_loss: 3.9661
47:	[0s / 8s],		train_loss: 4.1565
52:	[0s / 6s],		train_loss: 4.1924
99:	[0s / 14s],		train_loss: 4.0144
50:	[0s / 16s],		train_loss: 4.2262
48:	[0s / 8s],		train_loss: 4.1476
53:	[0s / 7s],		train_loss: 4.1536
8:	[0s / 4s],		train_loss: 4.3283
8:	[0s / 8s],		train_loss: 4.3106
0:	[0s / 0s],		train_loss: 5.4900
54:	[0s / 7s],		train_loss: 4.2307
49:	[0s / 8s],		train_loss: 4.1270
51:	[0s / 16s],		train_loss: 4.1980
1:	[0s / 0s],		train_loss: 4.5228
55:	[0s / 7s],		train_loss: 4.2888
50:	[0s / 9s],		train_loss: 4.1017
56:	[0s / 7s],		train_loss: 4.2087
2:	[0s / 0s],		train_loss: 4.4742
51:	[0s / 9s],		train_loss: 4.1357
57:	[0s / 7s],		train_loss: 4.2189
3:	[0s / 0s],		train_loss: 4.4213
52:	[0s / 16s],		train_loss: 4.2562
9:	[0s / 5s],		train_loss: 4.3112
58:	[0s / 7s],		train_loss: 4.1865
4:	[0s / 0s],		train_loss: 4.3705
52:	[0s / 9s],		train_loss: 4.1085
59:	[0s / 7s],		train_loss: 4.1940
5:	[0s / 0s],		train_loss: 4.3937
53:	[0s / 9s],		train_loss: 4.1408
53:	[0s / 17s],		train_loss: 4.2265
71:	[1s / 1m:58s],		train_loss: 3.8260
60:	[0s / 8s],		train_loss: 4.1856
9:	[0s / 9s],		train_loss: 4.3599
6:	[0s / 0s],		train_loss: 4.4023
44:	[2s / 1m:58s],		train_loss: 4.1681
54:	[0s / 9s],		train_loss: 4.1394
61:	[0s / 8s],		train_loss: 4.1989
7:	[0s / 1s],		train_loss: 4.3350
10:	[0s / 5s],		train_loss: 4.3502
54:	[0s / 17s],		train_loss: 4.1869
62:	[0s / 8s],		train_loss: 4.3073
55:	[0s / 10s],		train_loss: 4.1302
8:	[0s / 1s],		train_loss: 4.3705
63:	[0s / 8s],		train_loss: 4.3202
9:	[0s / 1s],		train_loss: 4.3907
56:	[0s / 10s],		train_loss: 4.0919
64:	[0s / 8s],		train_loss: 4.2445
55:	[0s / 17s],		train_loss: 4.2167
10:	[0s / 1s],		train_loss: 4.3710
65:	[0s / 8s],		train_loss: 4.2208
57:	[0s / 10s],		train_loss: 4.1001
11:	[0s / 1s],		train_loss: 4.3559
11:	[0s / 6s],		train_loss: 4.3124
66:	[0s / 8s],		train_loss: 4.1697
58:	[0s / 10s],		train_loss: 4.0696
56:	[0s / 18s],		train_loss: 4.1775
12:	[0s / 1s],		train_loss: 4.3547
67:	[0s / 9s],		train_loss: 4.1812
10:	[0s / 10s],		train_loss: 4.3453
13:	[0s / 1s],		train_loss: 4.4017
59:	[0s / 10s],		train_loss: 4.0726
68:	[0s / 9s],		train_loss: 4.1698
14:	[0s / 2s],		train_loss: 4.3748
69:	[0s / 9s],		train_loss: 4.2470
60:	[0s / 10s],		train_loss: 4.0891
57:	[0s / 18s],		train_loss: 4.1833
12:	[0s / 6s],		train_loss: 4.3683
15:	[0s / 2s],		train_loss: 4.3757
70:	[0s / 9s],		train_loss: 4.1818
61:	[0s / 11s],		train_loss: 4.0840
16:	[0s / 2s],		train_loss: 4.3227
71:	[0s / 9s],		train_loss: 4.1788
58:	[0s / 18s],		train_loss: 4.1885
17:	[0s / 2s],		train_loss: 4.3160
62:	[0s / 11s],		train_loss: 4.0875
72:	[0s / 9s],		train_loss: 4.1538
18:	[0s / 2s],		train_loss: 4.3221
73:	[0s / 9s],		train_loss: 4.1463
63:	[0s / 11s],		train_loss: 4.0763
72:	[1s / 2m:0s],		train_loss: 3.8666
19:	[0s / 2s],		train_loss: 4.3059
74:	[0s / 9s],		train_loss: 4.1326
59:	[0s / 19s],		train_loss: 4.1593
13:	[0s / 7s],		train_loss: 4.3532
64:	[0s / 11s],		train_loss: 4.0771
75:	[0s / 10s],		train_loss: 4.1687
20:	[0s / 2s],		train_loss: 4.3307
11:	[1s / 11s],		train_loss: 4.3685
65:	[0s / 11s],		train_loss: 4.0702
76:	[0s / 10s],		train_loss: 4.1924
21:	[0s / 3s],		train_loss: 4.2930
60:	[0s / 19s],		train_loss: 4.1906
77:	[0s / 10s],		train_loss: 4.1174
66:	[0s / 11s],		train_loss: 4.0425
22:	[0s / 3s],		train_loss: 4.3540
78:	[0s / 10s],		train_loss: 4.1140
14:	[0s / 8s],		train_loss: 4.3190
23:	[0s / 3s],		train_loss: 4.3005
67:	[0s / 12s],		train_loss: 4.0508
61:	[0s / 19s],		train_loss: 4.1373
79:	[0s / 10s],		train_loss: 4.1333
24:	[0s / 3s],		train_loss: 4.3074
68:	[0s / 12s],		train_loss: 4.0291
80:	[0s / 10s],		train_loss: 4.1471
25:	[0s / 3s],		train_loss: 4.3004
62:	[0s / 20s],		train_loss: 4.1540
69:	[0s / 12s],		train_loss: 4.0433
81:	[0s / 10s],		train_loss: 4.1579
26:	[0s / 3s],		train_loss: 4.2761
82:	[0s / 11s],		train_loss: 4.1388
15:	[0s / 8s],		train_loss: 4.2984
70:	[0s / 12s],		train_loss: 4.0226
27:	[0s / 3s],		train_loss: 4.2754
12:	[0s / 12s],		train_loss: 4.3399
63:	[0s / 20s],		train_loss: 4.1815
83:	[0s / 11s],		train_loss: 4.0759
71:	[0s / 12s],		train_loss: 4.0183
28:	[0s / 4s],		train_loss: 4.3111
45:	[3s / 2m:1s],		train_loss: 4.1541
84:	[0s / 11s],		train_loss: 4.1442
29:	[0s / 4s],		train_loss: 4.3006
72:	[0s / 13s],		train_loss: 4.0628
73:	[1s / 2m:1s],		train_loss: 3.8502
85:	[0s / 11s],		train_loss: 4.1367
64:	[0s / 20s],		train_loss: 4.1161
30:	[0s / 4s],		train_loss: 4.2783
16:	[0s / 9s],		train_loss: 4.3112
73:	[0s / 13s],		train_loss: 4.0063
86:	[0s / 11s],		train_loss: 4.1881
31:	[0s / 4s],		train_loss: 4.2561
87:	[0s / 11s],		train_loss: 4.1391
65:	[0s / 20s],		train_loss: 4.1473
74:	[0s / 13s],		train_loss: 4.0607
32:	[0s / 4s],		train_loss: 4.2605
88:	[0s / 11s],		train_loss: 4.0985
33:	[0s / 4s],		train_loss: 4.2616
75:	[0s / 13s],		train_loss: 4.0396
13:	[0s / 13s],		train_loss: 4.3349
89:	[0s / 11s],		train_loss: 4.1160
17:	[0s / 9s],		train_loss: 4.2997
66:	[0s / 21s],		train_loss: 4.1838
34:	[0s / 4s],		train_loss: 4.2771
90:	[0s / 12s],		train_loss: 4.0784
76:	[0s / 13s],		train_loss: 4.0534
35:	[0s / 5s],		train_loss: 4.2368
91:	[0s / 12s],		train_loss: 4.1212
77:	[0s / 13s],		train_loss: 4.0760
36:	[0s / 5s],		train_loss: 4.2208
67:	[0s / 21s],		train_loss: 4.2422
92:	[0s / 12s],		train_loss: 4.0703
78:	[0s / 14s],		train_loss: 4.0311
37:	[0s / 5s],		train_loss: 4.2687
93:	[0s / 12s],		train_loss: 4.0795
18:	[0s / 10s],		train_loss: 4.3101
38:	[0s / 5s],		train_loss: 4.2575
94:	[0s / 12s],		train_loss: 4.1229
79:	[0s / 14s],		train_loss: 4.0426
68:	[0s / 21s],		train_loss: 4.1399
39:	[0s / 5s],		train_loss: 4.2397
95:	[0s / 12s],		train_loss: 4.1458
80:	[0s / 14s],		train_loss: 4.0542
14:	[0s / 14s],		train_loss: 4.3166
74:	[1s / 2m:3s],		train_loss: 3.8195
40:	[0s / 5s],		train_loss: 4.2350
96:	[0s / 12s],		train_loss: 4.0569
69:	[0s / 22s],		train_loss: 4.1569
81:	[0s / 14s],		train_loss: 4.0196
97:	[0s / 13s],		train_loss: 4.1115
41:	[0s / 5s],		train_loss: 4.2189
19:	[0s / 10s],		train_loss: 4.3242
98:	[0s / 13s],		train_loss: 4.0742
42:	[0s / 6s],		train_loss: 4.2458
82:	[0s / 14s],		train_loss: 4.0005
70:	[0s / 22s],		train_loss: 4.1038
99:	[0s / 13s],		train_loss: 4.0986
43:	[0s / 6s],		train_loss: 4.2098
83:	[0s / 15s],		train_loss: 3.9476
44:	[0s / 6s],		train_loss: 4.2040
0:	[0s / 0s],		train_loss: 4.7173
20:	[0s / 11s],		train_loss: 4.2987
84:	[0s / 15s],		train_loss: 3.9563
45:	[0s / 6s],		train_loss: 4.2132
71:	[0s / 22s],		train_loss: 4.0857
1:	[0s / 0s],		train_loss: 4.4702
85:	[0s / 15s],		train_loss: 3.9623
46:	[0s / 6s],		train_loss: 4.2420
2:	[0s / 0s],		train_loss: 4.4115
15:	[0s / 14s],		train_loss: 4.3657
46:	[2s / 2m:4s],		train_loss: 4.1860
47:	[0s / 6s],		train_loss: 4.2324
86:	[0s / 15s],		train_loss: 4.0011
3:	[0s / 0s],		train_loss: 4.3900
72:	[0s / 23s],		train_loss: 4.0919
48:	[0s / 6s],		train_loss: 4.1936
4:	[0s / 0s],		train_loss: 4.3762
21:	[0s / 11s],		train_loss: 4.2691
87:	[0s / 15s],		train_loss: 4.0044
49:	[0s / 7s],		train_loss: 4.2065
5:	[0s / 0s],		train_loss: 4.3666
73:	[0s / 23s],		train_loss: 4.1134
88:	[0s / 15s],		train_loss: 4.0525
50:	[0s / 7s],		train_loss: 4.2347
6:	[0s / 0s],		train_loss: 4.3727
89:	[0s / 16s],		train_loss: 3.9841
51:	[0s / 7s],		train_loss: 4.2263
7:	[0s / 1s],		train_loss: 4.3222
74:	[0s / 23s],		train_loss: 4.0719
75:	[1s / 2m:4s],		train_loss: 3.8179
52:	[0s / 7s],		train_loss: 4.2146
8:	[0s / 1s],		train_loss: 4.3993
90:	[0s / 16s],		train_loss: 4.0003
22:	[0s / 12s],		train_loss: 4.3079
53:	[0s / 7s],		train_loss: 4.1935
9:	[0s / 1s],		train_loss: 4.3922
91:	[0s / 16s],		train_loss: 4.0240
54:	[0s / 7s],		train_loss: 4.1571
10:	[0s / 1s],		train_loss: 4.3419
75:	[0s / 24s],		train_loss: 4.1220
16:	[1s / 16s],		train_loss: 4.3341
92:	[0s / 16s],		train_loss: 3.9888
55:	[0s / 7s],		train_loss: 4.2116
11:	[0s / 1s],		train_loss: 4.3361
56:	[0s / 7s],		train_loss: 4.2013
93:	[0s / 16s],		train_loss: 3.9485
12:	[0s / 1s],		train_loss: 4.3043
23:	[0s / 12s],		train_loss: 4.3014
76:	[0s / 24s],		train_loss: 4.1436
57:	[0s / 8s],		train_loss: 4.1959
13:	[0s / 1s],		train_loss: 4.3256
94:	[0s / 16s],		train_loss: 3.9692
58:	[0s / 8s],		train_loss: 4.2290
14:	[0s / 1s],		train_loss: 4.3232
77:	[0s / 24s],		train_loss: 4.0828
95:	[0s / 17s],		train_loss: 3.9335
15:	[0s / 1s],		train_loss: 4.2750
59:	[0s / 8s],		train_loss: 4.1956
16:	[0s / 2s],		train_loss: 4.3003
96:	[0s / 17s],		train_loss: 3.9292
60:	[0s / 8s],		train_loss: 4.2270
24:	[0s / 13s],		train_loss: 4.2678
78:	[0s / 24s],		train_loss: 4.1197
17:	[0s / 2s],		train_loss: 4.2903
61:	[0s / 8s],		train_loss: 4.1657
17:	[0s / 16s],		train_loss: 4.2736
97:	[0s / 17s],		train_loss: 3.9206
18:	[0s / 2s],		train_loss: 4.3046
62:	[0s / 8s],		train_loss: 4.1673
98:	[0s / 17s],		train_loss: 3.9406
19:	[0s / 2s],		train_loss: 4.3494
79:	[0s / 25s],		train_loss: 4.1210
63:	[0s / 8s],		train_loss: 4.1837
99:	[0s / 17s],		train_loss: 3.9391
20:	[0s / 2s],		train_loss: 4.3138
64:	[0s / 8s],		train_loss: 4.2242
25:	[0s / 13s],		train_loss: 4.2514
21:	[0s / 2s],		train_loss: 4.3029
65:	[0s / 9s],		train_loss: 4.1757
80:	[0s / 25s],		train_loss: 4.1248
76:	[1s / 2m:6s],		train_loss: 3.8265
0:	[0s / 0s],		train_loss: 5.3823
22:	[0s / 2s],		train_loss: 4.2978
66:	[0s / 9s],		train_loss: 4.1644
23:	[0s / 2s],		train_loss: 4.3116
1:	[0s / 0s],		train_loss: 4.5053
18:	[0s / 17s],		train_loss: 4.2944
67:	[0s / 9s],		train_loss: 4.1472
24:	[0s / 3s],		train_loss: 4.2623
81:	[0s / 25s],		train_loss: 4.1057
2:	[0s / 0s],		train_loss: 4.4912
68:	[0s / 9s],		train_loss: 4.1415
26:	[0s / 14s],		train_loss: 4.2543
25:	[0s / 3s],		train_loss: 4.3035
69:	[0s / 9s],		train_loss: 4.1376
3:	[0s / 0s],		train_loss: 4.4423
26:	[0s / 3s],		train_loss: 4.2714
70:	[0s / 9s],		train_loss: 4.1114
82:	[0s / 26s],		train_loss: 4.0955
27:	[0s / 3s],		train_loss: 4.2969
4:	[0s / 0s],		train_loss: 4.3987
71:	[0s / 9s],		train_loss: 4.1139
28:	[0s / 3s],		train_loss: 4.2939
5:	[0s / 1s],		train_loss: 4.3842
72:	[0s / 10s],		train_loss: 4.1635
29:	[0s / 3s],		train_loss: 4.2803
83:	[0s / 26s],		train_loss: 4.0950
27:	[0s / 14s],		train_loss: 4.2402
73:	[0s / 10s],		train_loss: 4.1452
6:	[0s / 1s],		train_loss: 4.4079
30:	[0s / 3s],		train_loss: 4.2789
47:	[3s / 2m:7s],		train_loss: 4.1662
31:	[0s / 4s],		train_loss: 4.2537
74:	[0s / 10s],		train_loss: 4.1308
7:	[0s / 1s],		train_loss: 4.3899
19:	[1s / 18s],		train_loss: 4.2857
84:	[0s / 26s],		train_loss: 4.0603
32:	[0s / 4s],		train_loss: 4.2895
75:	[0s / 10s],		train_loss: 4.0646
8:	[0s / 1s],		train_loss: 4.3822
33:	[0s / 4s],		train_loss: 4.2698
76:	[0s / 10s],		train_loss: 4.1004
28:	[0s / 15s],		train_loss: 4.2744
34:	[0s / 4s],		train_loss: 4.2614
9:	[0s / 1s],		train_loss: 4.3812
77:	[0s / 10s],		train_loss: 4.1357
85:	[0s / 27s],		train_loss: 4.0735
35:	[0s / 4s],		train_loss: 4.2844
77:	[1s / 2m:8s],		train_loss: 3.7933
78:	[0s / 10s],		train_loss: 4.0944
10:	[0s / 1s],		train_loss: 4.4108
36:	[0s / 4s],		train_loss: 4.2759
79:	[0s / 11s],		train_loss: 4.1282
11:	[0s / 2s],		train_loss: 4.3976
86:	[0s / 27s],		train_loss: 4.0513
37:	[0s / 4s],		train_loss: 4.2490
29:	[0s / 15s],		train_loss: 4.2972
20:	[0s / 19s],		train_loss: 4.2591
80:	[0s / 11s],		train_loss: 4.1226
38:	[0s / 5s],		train_loss: 4.2549
12:	[0s / 2s],		train_loss: 4.3869
81:	[0s / 11s],		train_loss: 4.1004
39:	[0s / 5s],		train_loss: 4.2856
87:	[0s / 27s],		train_loss: 4.1176
82:	[0s / 11s],		train_loss: 4.0969
13:	[0s / 2s],		train_loss: 4.3607
40:	[0s / 5s],		train_loss: 4.2397
83:	[0s / 11s],		train_loss: 4.0972
41:	[0s / 5s],		train_loss: 4.2345
14:	[0s / 2s],		train_loss: 4.4019
30:	[0s / 16s],		train_loss: 4.2604
84:	[0s / 11s],		train_loss: 4.0894
88:	[0s / 28s],		train_loss: 4.0917
42:	[0s / 5s],		train_loss: 4.2101
15:	[0s / 2s],		train_loss: 4.3604
85:	[0s / 11s],		train_loss: 4.1100
43:	[0s / 5s],		train_loss: 4.2267
86:	[0s / 12s],		train_loss: 4.0896
16:	[0s / 3s],		train_loss: 4.3570
44:	[0s / 5s],		train_loss: 4.2305
21:	[0s / 20s],		train_loss: 4.3027
89:	[0s / 28s],		train_loss: 4.0608
87:	[0s / 12s],		train_loss: 4.0729
31:	[0s / 16s],		train_loss: 4.2555
45:	[0s / 6s],		train_loss: 4.2316
17:	[0s / 3s],		train_loss: 4.3735
88:	[0s / 12s],		train_loss: 4.0691
46:	[0s / 6s],		train_loss: 4.2214
78:	[1s / 2m:9s],		train_loss: 3.7948
18:	[0s / 3s],		train_loss: 4.3143
89:	[0s / 12s],		train_loss: 4.1137
47:	[0s / 6s],		train_loss: 4.1992
90:	[0s / 28s],		train_loss: 4.0472
19:	[0s / 3s],		train_loss: 4.3969
90:	[0s / 12s],		train_loss: 4.0938
48:	[0s / 6s],		train_loss: 4.1883
32:	[0s / 17s],		train_loss: 4.2585
91:	[0s / 12s],		train_loss: 4.0756
49:	[0s / 6s],		train_loss: 4.1938
20:	[0s / 3s],		train_loss: 4.3797
91:	[0s / 29s],		train_loss: 4.1231
22:	[0s / 21s],		train_loss: 4.3066
50:	[0s / 6s],		train_loss: 4.2232
92:	[0s / 12s],		train_loss: 4.1226
21:	[0s / 4s],		train_loss: 4.3531
51:	[0s / 6s],		train_loss: 4.1990
93:	[0s / 13s],		train_loss: 4.0773
92:	[0s / 29s],		train_loss: 4.1040
48:	[2s / 2m:10s],		train_loss: 4.1731
22:	[0s / 4s],		train_loss: 4.3585
52:	[0s / 6s],		train_loss: 4.1801
94:	[0s / 13s],		train_loss: 4.1308
33:	[0s / 18s],		train_loss: 4.2529
53:	[0s / 7s],		train_loss: 4.1950
95:	[0s / 13s],		train_loss: 4.0494
23:	[0s / 4s],		train_loss: 4.3534
93:	[0s / 29s],		train_loss: 4.0887
54:	[0s / 7s],		train_loss: 4.1944
96:	[0s / 13s],		train_loss: 4.0501
24:	[0s / 4s],		train_loss: 4.3610
55:	[0s / 7s],		train_loss: 4.2420
97:	[0s / 13s],		train_loss: 4.0937
56:	[0s / 7s],		train_loss: 4.2105
25:	[0s / 4s],		train_loss: 4.2885
98:	[0s / 13s],		train_loss: 4.0957
94:	[0s / 30s],		train_loss: 4.0757
34:	[0s / 18s],		train_loss: 4.2776
57:	[0s / 7s],		train_loss: 4.1301
23:	[1s / 22s],		train_loss: 4.2834
99:	[0s / 14s],		train_loss: 4.0650
26:	[0s / 5s],		train_loss: 4.3252
58:	[0s / 7s],		train_loss: 4.1242
79:	[1s / 2m:11s],		train_loss: 3.7937
95:	[0s / 30s],		train_loss: 4.0644
27:	[0s / 5s],		train_loss: 4.2792
59:	[0s / 7s],		train_loss: 4.1204
0:	[0s / 0s],		train_loss: 4.9631
35:	[0s / 19s],		train_loss: 4.2533
28:	[0s / 5s],		train_loss: 4.3066
60:	[0s / 8s],		train_loss: 4.1045
1:	[0s / 0s],		train_loss: 4.4819
96:	[0s / 30s],		train_loss: 4.0580
61:	[0s / 8s],		train_loss: 4.1008
29:	[0s / 5s],		train_loss: 4.3002
2:	[0s / 0s],		train_loss: 4.4211
62:	[0s / 8s],		train_loss: 4.1707
3:	[0s / 0s],		train_loss: 4.3788
30:	[0s / 5s],		train_loss: 4.3395
63:	[0s / 8s],		train_loss: 4.1940
4:	[0s / 0s],		train_loss: 4.3717
97:	[0s / 31s],		train_loss: 4.0361
31:	[0s / 5s],		train_loss: 4.3224
36:	[0s / 19s],		train_loss: 4.2100
24:	[0s / 23s],		train_loss: 4.2811
64:	[0s / 8s],		train_loss: 4.1610
5:	[0s / 0s],		train_loss: 4.3472
32:	[0s / 6s],		train_loss: 4.2882
65:	[0s / 8s],		train_loss: 4.1452
6:	[0s / 0s],		train_loss: 4.3564
98:	[0s / 31s],		train_loss: 4.0461
66:	[0s / 8s],		train_loss: 4.1237
33:	[0s / 6s],		train_loss: 4.2935
7:	[0s / 1s],		train_loss: 4.3507
67:	[0s / 9s],		train_loss: 4.1725
34:	[0s / 6s],		train_loss: 4.2905
8:	[0s / 1s],		train_loss: 4.3388
37:	[0s / 20s],		train_loss: 4.1922
68:	[0s / 9s],		train_loss: 4.1268
99:	[0s / 31s],		train_loss: 4.0464
9:	[0s / 1s],		train_loss: 4.3185
69:	[0s / 9s],		train_loss: 4.0811
35:	[0s / 6s],		train_loss: 4.3063
80:	[1s / 2m:13s],		train_loss: 3.7712
10:	[0s / 1s],		train_loss: 4.3336
70:	[0s / 9s],		train_loss: 4.1469
25:	[0s / 24s],		train_loss: 4.2567
49:	[2s / 2m:13s],		train_loss: 4.2534
36:	[0s / 6s],		train_loss: 4.3117
71:	[0s / 9s],		train_loss: 4.1268
11:	[0s / 1s],		train_loss: 4.3403
0:	[0s / 0s],		train_loss: 4.8361
37:	[0s / 7s],		train_loss: 4.3561
72:	[0s / 9s],		train_loss: 4.1296
12:	[0s / 1s],		train_loss: 4.3033
38:	[0s / 20s],		train_loss: 4.2203
73:	[0s / 9s],		train_loss: 4.1227
38:	[0s / 7s],		train_loss: 4.3023
13:	[0s / 2s],		train_loss: 4.3267
1:	[0s / 0s],		train_loss: 4.5180
74:	[0s / 10s],		train_loss: 4.1222
14:	[0s / 2s],		train_loss: 4.3441
39:	[0s / 7s],		train_loss: 4.3107
75:	[0s / 10s],		train_loss: 4.0934
15:	[0s / 2s],		train_loss: 4.2921
40:	[0s / 7s],		train_loss: 4.3054
2:	[0s / 0s],		train_loss: 4.4279
76:	[0s / 10s],		train_loss: 4.1105
16:	[0s / 2s],		train_loss: 4.3162
39:	[0s / 21s],		train_loss: 4.1964
41:	[0s / 7s],		train_loss: 4.2914
77:	[0s / 10s],		train_loss: 4.0525
17:	[0s / 2s],		train_loss: 4.3123
26:	[1s / 25s],		train_loss: 4.2756
78:	[0s / 10s],		train_loss: 4.0620
42:	[0s / 7s],		train_loss: 4.3173
18:	[0s / 2s],		train_loss: 4.3189
3:	[0s / 1s],		train_loss: 4.3969
79:	[0s / 10s],		train_loss: 4.1175
19:	[0s / 2s],		train_loss: 4.3208
43:	[0s / 8s],		train_loss: 4.3127
80:	[0s / 10s],		train_loss: 4.1996
20:	[0s / 3s],		train_loss: 4.2731
40:	[0s / 21s],		train_loss: 4.1892
44:	[0s / 8s],		train_loss: 4.2951
4:	[0s / 1s],		train_loss: 4.3596
81:	[0s / 11s],		train_loss: 4.1631
21:	[0s / 3s],		train_loss: 4.2761
82:	[0s / 11s],		train_loss: 4.1172
45:	[0s / 8s],		train_loss: 4.2615
22:	[0s / 3s],		train_loss: 4.2852
83:	[0s / 11s],		train_loss: 4.1479
5:	[0s / 1s],		train_loss: 4.3613
46:	[0s / 8s],		train_loss: 4.2602
23:	[0s / 3s],		train_loss: 4.2612
81:	[1s / 2m:15s],		train_loss: 3.8100
84:	[0s / 11s],		train_loss: 4.1111
27:	[0s / 26s],		train_loss: 4.2852
24:	[0s / 3s],		train_loss: 4.2659
47:	[0s / 8s],		train_loss: 4.2758
41:	[0s / 22s],		train_loss: 4.2666
85:	[0s / 11s],		train_loss: 4.0972
6:	[0s / 2s],		train_loss: 4.3612
25:	[0s / 3s],		train_loss: 4.2234
86:	[0s / 11s],		train_loss: 4.0923
48:	[0s / 9s],		train_loss: 4.2520
26:	[0s / 3s],		train_loss: 4.2493
87:	[0s / 11s],		train_loss: 4.1264
49:	[0s / 9s],		train_loss: 4.2558
27:	[0s / 4s],		train_loss: 4.2269
88:	[0s / 11s],		train_loss: 4.1633
7:	[0s / 2s],		train_loss: 4.3706
42:	[0s / 23s],		train_loss: 4.2747
50:	[0s / 9s],		train_loss: 4.2486
28:	[0s / 4s],		train_loss: 4.2323
89:	[0s / 12s],		train_loss: 4.1008
29:	[0s / 4s],		train_loss: 4.2099
90:	[0s / 12s],		train_loss: 4.0721
51:	[0s / 9s],		train_loss: 4.2815
28:	[0s / 26s],		train_loss: 4.2368
8:	[0s / 2s],		train_loss: 4.3689
30:	[0s / 4s],		train_loss: 4.1786
91:	[0s / 12s],		train_loss: 4.0696
52:	[0s / 9s],		train_loss: 4.2572
92:	[0s / 12s],		train_loss: 4.1525
31:	[0s / 4s],		train_loss: 4.2403
53:	[0s / 9s],		train_loss: 4.2233
9:	[0s / 3s],		train_loss: 4.3504
93:	[0s / 12s],		train_loss: 4.1043
32:	[0s / 4s],		train_loss: 4.2712
43:	[0s / 23s],		train_loss: 4.2242
50:	[3s / 2m:16s],		train_loss: 4.2116
94:	[0s / 12s],		train_loss: 4.1218
33:	[0s / 4s],		train_loss: 4.2934
54:	[0s / 10s],		train_loss: 4.2361
95:	[0s / 12s],		train_loss: 4.1241
34:	[0s / 5s],		train_loss: 4.2416
10:	[0s / 3s],		train_loss: 4.3266
55:	[0s / 10s],		train_loss: 4.2700
82:	[1s / 2m:16s],		train_loss: 3.7799
96:	[0s / 13s],		train_loss: 4.0658
35:	[0s / 5s],		train_loss: 4.2179
29:	[0s / 27s],		train_loss: 4.2478
44:	[0s / 24s],		train_loss: 4.2554
56:	[0s / 10s],		train_loss: 4.2749
97:	[0s / 13s],		train_loss: 4.0879
36:	[0s / 5s],		train_loss: 4.2320
11:	[0s / 3s],		train_loss: 4.3053
98:	[0s / 13s],		train_loss: 4.0418
57:	[0s / 10s],		train_loss: 4.2188
37:	[0s / 5s],		train_loss: 4.2216
99:	[0s / 13s],		train_loss: 4.0819
38:	[0s / 5s],		train_loss: 4.2174
58:	[0s / 10s],		train_loss: 4.2751
12:	[0s / 4s],		train_loss: 4.3111
39:	[0s / 5s],		train_loss: 4.1829
59:	[0s / 11s],		train_loss: 4.2540
45:	[0s / 24s],		train_loss: 4.2359
0:	[0s / 0s],		train_loss: 5.0348
40:	[0s / 5s],		train_loss: 4.1836
1:	[0s / 0s],		train_loss: 4.5136
60:	[0s / 11s],		train_loss: 4.2438
41:	[0s / 6s],		train_loss: 4.1964
13:	[0s / 4s],		train_loss: 4.3182
2:	[0s / 0s],		train_loss: 4.4329
42:	[0s / 6s],		train_loss: 4.1629
30:	[1s / 28s],		train_loss: 4.2744
61:	[0s / 11s],		train_loss: 4.2255
3:	[0s / 0s],		train_loss: 4.4098
14:	[0s / 4s