81:	[0s / 12s],		train_loss: 3.7652[I 2026-07-01 11:29:50,714] Trial 11 finished with value: 0.7484052504063544 and parameters: {'num_nodes': [64, 32], 'dropout': 0.26761652974376177, 'learning_rate': 0.0001397620697498409, 'batch_norm': True}. Best is trial 7 with value: 0.7504926089489987.
/scratch.hpc/luca.cotugno/Foundation_model_clinical_data/test_tabular_model.py:481: UserWarning: Choices for a categorical distribution should be a tuple of None, bool, int, float and str for persistent storage but contains [32] which is of type list.
  num_nodes  = trial.suggest_categorical("num_nodes", [[32], [64], [128], [64, 32], [128, 64]])
/scratch.hpc/luca.cotugno/Foundation_model_clinical_data/test_tabular_model.py:481: UserWarning: Choices for a categorical distribution should be a tuple of None, bool, int, float and str for persistent storage but contains [64] which is of type list.
  num_nodes  = trial.suggest_categorical("num_nodes", [[32], [64], [128], [64, 32], [128, 64]])
/scratch.hpc/luca.cotugno/Foundation_model_clinical_data/test_tabular_model.py:481: UserWarning: Choices for a categorical distribution should be a tuple of None, bool, int, float and str for persistent storage but contains [128] which is of type list.
  num_nodes  = trial.suggest_categorical("num_nodes", [[32], [64], [128], [64, 32], [128, 64]])
/scratch.hpc/luca.cotugno/Foundation_model_clinical_data/test_tabular_model.py:481: UserWarning: Choices for a categorical distribution should be a tuple of None, bool, int, float and str for persistent storage but contains [64, 32] which is of type list.
  num_nodes  = trial.suggest_categorical("num_nodes", [[32], [64], [128], [64, 32], [128, 64]])
/scratch.hpc/luca.cotugno/Foundation_model_clinical_data/test_tabular_model.py:481: UserWarning: Choices for a categorical distribution should be a tuple of None, bool, int, float and str for persistent storage but contains [128, 64] which is of type list.
  num_nodes  = trial.suggest_categorical("num_nodes", [[32], [64], [128], [64, 32], [128, 64]])
[I 2026-07-01 11:29:57,041] Trial 13 finished with value: 0.7246929340325697 and parameters: {'num_nodes': [128, 64], 'dropout': 0.28367624208829356, 'learning_rate': 0.0011158413183690414, 'batch_norm': True}. Best is trial 7 with value: 0.7504926089489987.
/scratch.hpc/luca.cotugno/Foundation_model_clinical_data/test_tabular_model.py:481: UserWarning: Choices for a categorical distribution should be a tuple of None, bool, int, float and str for persistent storage but contains [32] which is of type list.
  num_nodes  = trial.suggest_categorical("num_nodes", [[32], [64], [128], [64, 32], [128, 64]])
/scratch.hpc/luca.cotugno/Foundation_model_clinical_data/test_tabular_model.py:481: UserWarning: Choices for a categorical distribution should be a tuple of None, bool, int, float and str for persistent storage but contains [64] which is of type list.
  num_nodes  = trial.suggest_categorical("num_nodes", [[32], [64], [128], [64, 32], [128, 64]])
/scratch.hpc/luca.cotugno/Foundation_model_clinical_data/test_tabular_model.py:481: UserWarning: Choices for a categorical distribution should be a tuple of None, bool, int, float and str for persistent storage but contains [128] which is of type list.
  num_nodes  = trial.suggest_categorical("num_nodes", [[32], [64], [128], [64, 32], [128, 64]])
/scratch.hpc/luca.cotugno/Foundation_model_clinical_data/test_tabular_model.py:481: UserWarning: Choices for a categorical distribution should be a tuple of None, bool, int, float and str for persistent storage but contains [64, 32] which is of type list.
  num_nodes  = trial.suggest_categorical("num_nodes", [[32], [64], [128], [64, 32], [128, 64]])
/scratch.hpc/luca.cotugno/Foundation_model_clinical_data/test_tabular_model.py:481: UserWarning: Choices for a categorical distribution should be a tuple of None, bool, int, float and str for persistent storage but contains [128, 64] which is of type list.
  num_nodes  = trial.suggest_categorical("num_nodes", [[32], [64], [128], [64, 32], [128, 64]])
[I 2026-07-01 11:30:01,116] Trial 14 finished with value: 0.765014030729598 and parameters: {'num_nodes': [32], 'dropout': 0.19164951598277474, 'learning_rate': 0.00013700546912417963, 'batch_norm': False}. Best is trial 14 with value: 0.765014030729598.
/scratch.hpc/luca.cotugno/Foundation_model_clinical_data/test_tabular_model.py:481: UserWarning: Choices for a categorical distribution should be a tuple of None, bool, int, float and str for persistent storage but contains [32] which is of type list.
  num_nodes  = trial.suggest_categorical("num_nodes", [[32], [64], [128], [64, 32], [128, 64]])
/scratch.hpc/luca.cotugno/Foundation_model_clinical_data/test_tabular_model.py:481: UserWarning: Choices for a categorical distribution should be a tuple of None, bool, int, float and str for persistent storage but contains [64] which is of type list.
  num_nodes  = trial.suggest_categorical("num_nodes", [[32], [64], [128], [64, 32], [128, 64]])
/scratch.hpc/luca.cotugno/Foundation_model_clinical_data/test_tabular_model.py:481: UserWarning: Choices for a categorical distribution should be a tuple of None, bool, int, float and str for persistent storage but contains [128] which is of type list.
  num_nodes  = trial.suggest_categorical("num_nodes", [[32], [64], [128], [64, 32], [128, 64]])
/scratch.hpc/luca.cotugno/Foundation_model_clinical_data/test_tabular_model.py:481: UserWarning: Choices for a categorical distribution should be a tuple of None, bool, int, float and str for persistent storage but contains [64, 32] which is of type list.
  num_nodes  = trial.suggest_categorical("num_nodes", [[32], [64], [128], [64, 32], [128, 64]])
/scratch.hpc/luca.cotugno/Foundation_model_clinical_data/test_tabular_model.py:481: UserWarning: Choices for a categorical distribution should be a tuple of None, bool, int, float and str for persistent storage but contains [128, 64] which is of type list.
  num_nodes  = trial.suggest_categorical("num_nodes", [[32], [64], [128], [64, 32], [128, 64]])
[I 2026-07-01 11:30:02,590] Trial 2 finished with value: 0.7279025592664152 and parameters: {'num_nodes': [32], 'dropout': 0.2308601398764532, 'learning_rate': 0.0014038869983489081, 'batch_norm': False}. Best is trial 14 with value: 0.765014030729598.
/scratch.hpc/luca.cotugno/Foundation_model_clinical_data/test_tabular_model.py:481: UserWarning: Choices for a categorical distribution should be a tuple of None, bool, int, float and str for persistent storage but contains [32] which is of type list.
  num_nodes  = trial.suggest_categorical("num_nodes", [[32], [64], [128], [64, 32], [128, 64]])
/scratch.hpc/luca.cotugno/Foundation_model_clinical_data/test_tabular_model.py:481: UserWarning: Choices for a categorical distribution should be a tuple of None, bool, int, float and str for persistent storage but contains [64] which is of type list.
  num_nodes  = trial.suggest_categorical("num_nodes", [[32], [64], [128], [64, 32], [128, 64]])
/scratch.hpc/luca.cotugno/Foundation_model_clinical_data/test_tabular_model.py:481: UserWarning: Choices for a categorical distribution should be a tuple of None, bool, int, float and str for persistent storage but contains [128] which is of type list.
  num_nodes  = trial.suggest_categorical("num_nodes", [[32], [64], [128], [64, 32], [128, 64]])
/scratch.hpc/luca.cotugno/Foundation_model_clinical_data/test_tabular_model.py:481: UserWarning: Choices for a categorical distribution should be a tuple of None, bool, int, float and str for persistent storage but contains [64, 32] which is of type list.
  num_nodes  = trial.suggest_categorical("num_nodes", [[32], [64], [128], [64, 32], [128, 64]])
/scratch.hpc/luca.cotugno/Foundation_model_clinical_data/test_tabular_model.py:481: UserWarning: Choices for a categorical distribution should be a tuple of None, bool, int, float and str for persistent storage but contains [128, 64] which is of type list.
  num_nodes  = trial.suggest_categorical("num_nodes", [[32], [64], [128], [64, 32], [128, 64]])
[I 2026-07-01 11:30:06,837] Trial 15 finished with value: 0.7448093967552979 and parameters: {'num_nodes': [32], 'dropout': 0.10743793411552584, 'learning_rate': 0.000957272017387673, 'batch_norm': True}. Best is trial 14 with value: 0.765014030729598.
/scratch.hpc/luca.cotugno/Foundation_model_clinical_data/test_tabular_model.py:481: UserWarning: Choices for a categorical distribution should be a tuple of None, bool, int, float and str for persistent storage but contains [32] which is of type list.
  num_nodes  = trial.suggest_categorical("num_nodes", [[32], [64], [128], [64, 32], [128, 64]])
/scratch.hpc/luca.cotugno/Foundation_model_clinical_data/test_tabular_model.py:481: UserWarning: Choices for a categorical distribution should be a tuple of None, bool, int, float and str for persistent storage but contains [64] which is of type list.
  num_nodes  = trial.suggest_categorical("num_nodes", [[32], [64], [128], [64, 32], [128, 64]])
/scratch.hpc/luca.cotugno/Foundation_model_clinical_data/test_tabular_model.py:481: UserWarning: Choices for a categorical distribution should be a tuple of None, bool, int, float and str for persistent storage but contains [128] which is of type list.
  num_nodes  = trial.suggest_categorical("num_nodes", [[32], [64], [128], [64, 32], [128, 64]])
/scratch.hpc/luca.cotugno/Foundation_model_clinical_data/test_tabular_model.py:481: UserWarning: Choices for a categorical distribution should be a tuple of None, bool, int, float and str for persistent storage but contains [64, 32] which is of type list.
  num_nodes  = trial.suggest_categorical("num_nodes", [[32], [64], [128], [64, 32], [128, 64]])
/scratch.hpc/luca.cotugno/Foundation_model_clinical_data/test_tabular_model.py:481: UserWarning: Choices for a categorical distribution should be a tuple of None, bool, int, float and str for persistent storage but contains [128, 64] which is of type list.
  num_nodes  = trial.suggest_categorical("num_nodes", [[32], [64], [128], [64, 32], [128, 64]])
[I 2026-07-01 11:30:12,386] Trial 12 finished with value: 0.7017684086239151 and parameters: {'num_nodes': [64], 'dropout': 0.02592790240407512, 'learning_rate': 0.0038094636502916104, 'batch_norm': True}. Best is trial 14 with value: 0.765014030729598.
/scratch.hpc/luca.cotugno/Foundation_model_clinical_data/test_tabular_model.py:481: UserWarning: Choices for a categorical distribution should be a tuple of None, bool, int, float and str for persistent storage but contains [32] which is of type list.
  num_nodes  = trial.suggest_categorical("num_nodes", [[32], [64], [128], [64, 32], [128, 64]])
/scratch.hpc/luca.cotugno/Foundation_model_clinical_data/test_tabular_model.py:481: UserWarning: Choices for a categorical distribution should be a tuple of None, bool, int, float and str for persistent storage but contains [64] which is of type list.
  num_nodes  = trial.suggest_categorical("num_nodes", [[32], [64], [128], [64, 32], [128, 64]])
/scratch.hpc/luca.cotugno/Foundation_model_clinical_data/test_tabular_model.py:481: UserWarning: Choices for a categorical distribution should be a tuple of None, bool, int, float and str for persistent storage but contains [128] which is of type list.
  num_nodes  = trial.suggest_categorical("num_nodes", [[32], [64], [128], [64, 32], [128, 64]])
/scratch.hpc/luca.cotugno/Foundation_model_clinical_data/test_tabular_model.py:481: UserWarning: Choices for a categorical distribution should be a tuple of None, bool, int, float and str for persistent storage but contains [64, 32] which is of type list.
  num_nodes  = trial.suggest_categorical("num_nodes", [[32], [64], [128], [64, 32], [128, 64]])
/scratch.hpc/luca.cotugno/Foundation_model_clinical_data/test_tabular_model.py:481: UserWarning: Choices for a categorical distribution should be a tuple of None, bool, int, float and str for persistent storage but contains [128, 64] which is of type list.
  num_nodes  = trial.suggest_categorical("num_nodes", [[32], [64], [128], [64, 32], [128, 64]])
[I 2026-07-01 11:30:13,235] Trial 16 finished with value: 0.7579344542582881 and parameters: {'num_nodes': [64], 'dropout': 0.2986035734846134, 'learning_rate': 0.00420331633870716, 'batch_norm': False}. Best is trial 14 with value: 0.765014030729598.
/scratch.hpc/luca.cotugno/Foundation_model_clinical_data/test_tabular_model.py:481: UserWarning: Choices for a categorical distribution should be a tuple of None, bool, int, float and str for persistent storage but contains [32] which is of type list.
  num_nodes  = trial.suggest_categorical("num_nodes", [[32], [64], [128], [64, 32], [128, 64]])
/scratch.hpc/luca.cotugno/Foundation_model_clinical_data/test_tabular_model.py:481: UserWarning: Choices for a categorical distribution should be a tuple of None, bool, int, float and str for persistent storage but contains [64] which is of type list.
  num_nodes  = trial.suggest_categorical("num_nodes", [[32], [64], [128], [64, 32], [128, 64]])
/scratch.hpc/luca.cotugno/Foundation_model_clinical_data/test_tabular_model.py:481: UserWarning: Choices for a categorical distribution should be a tuple of None, bool, int, float and str for persistent storage but contains [128] which is of type list.
  num_nodes  = trial.suggest_categorical("num_nodes", [[32], [64], [128], [64, 32], [128, 64]])
/scratch.hpc/luca.cotugno/Foundation_model_clinical_data/test_tabular_model.py:481: UserWarning: Choices for a categorical distribution should be a tuple of None, bool, int, float and str for persistent storage but contains [64, 32] which is of type list.
  num_nodes  = trial.suggest_categorical("num_nodes", [[32], [64], [128], [64, 32], [128, 64]])
/scratch.hpc/luca.cotugno/Foundation_model_clinical_data/test_tabular_model.py:481: UserWarning: Choices for a categorical distribution should be a tuple of None, bool, int, float and str for persistent storage but contains [128, 64] which is of type list.
  num_nodes  = trial.suggest_categorical("num_nodes", [[32], [64], [128], [64, 32], [128, 64]])
[I 2026-07-01 11:30:18,671] Trial 17 finished with value: 0.7420588370595271 and parameters: {'num_nodes': [32], 'dropout': 0.07643101747485845, 'learning_rate': 0.0004427652994647276, 'batch_norm': False}. Best is trial 14 with value: 0.765014030729598.
/scratch.hpc/luca.cotugno/Foundation_model_clinical_data/test_tabular_model.py:481: UserWarning: Choices for a categorical distribution should be a tuple of None, bool, int, float and str for persistent storage but contains [32] which is of type list.
  num_nodes  = trial.suggest_categorical("num_nodes", [[32], [64], [128], [64, 32], [128, 64]])
/scratch.hpc/luca.cotugno/Foundation_model_clinical_data/test_tabular_model.py:481: UserWarning: Choices for a categorical distribution should be a tuple of None, bool, int, float and str for persistent storage but contains [64] which is of type list.
  num_nodes  = trial.suggest_categorical("num_nodes", [[32], [64], [128], [64, 32], [128, 64]])
/scratch.hpc/luca.cotugno/Foundation_model_clinical_data/test_tabular_model.py:481: UserWarning: Choices for a categorical distribution should be a tuple of None, bool, int, float and str for persistent storage but contains [128] which is of type list.
  num_nodes  = trial.suggest_categorical("num_nodes", [[32], [64], [128], [64, 32], [128, 64]])
/scratch.hpc/luca.cotugno/Foundation_model_clinical_data/test_tabular_model.py:481: UserWarning: Choices for a categorical distribution should be a tuple of None, bool, int, float and str for persistent storage but contains [64, 32] which is of type list.
  num_nodes  = trial.suggest_categorical("num_nodes", [[32], [64], [128], [64, 32], [128, 64]])
/scratch.hpc/luca.cotugno/Foundation_model_clinical_data/test_tabular_model.py:481: UserWarning: Choices for a categorical distribution should be a tuple of None, bool, int, float and str for persistent storage but contains [128, 64] which is of type list.
  num_nodes  = trial.suggest_categorical("num_nodes", [[32], [64], [128], [64, 32], [128, 64]])
[I 2026-07-01 11:30:22,004] Trial 19 finished with value: 0.721608856993897 and parameters: {'num_nodes': [128, 64], 'dropout': 0.07358942211470854, 'learning_rate': 0.0002721442465905046, 'batch_norm': False}. Best is trial 14 with value: 0.765014030729598.
/scratch.hpc/luca.cotugno/Foundation_model_clinical_data/test_tabular_model.py:481: UserWarning: Choices for a categorical distribution should be a tuple of None, bool, int, float and str for persistent storage but contains [32] which is of type list.
  num_nodes  = trial.suggest_categorical("num_nodes", [[32], [64], [128], [64, 32], [128, 64]])
/scratch.hpc/luca.cotugno/Foundation_model_clinical_data/test_tabular_model.py:481: UserWarning: Choices for a categorical distribution should be a tuple of None, bool, int, float and str for persistent storage but contains [64] which is of type list.
  num_nodes  = trial.suggest_categorical("num_nodes", [[32], [64], [128], [64, 32], [128, 64]])
/scratch.hpc/luca.cotugno/Foundation_model_clinical_data/test_tabular_model.py:481: UserWarning: Choices for a categorical distribution should be a tuple of None, bool, int, float and str for persistent storage but contains [128] which is of type list.
  num_nodes  = trial.suggest_categorical("num_nodes", [[32], [64], [128], [64, 32], [128, 64]])
/scratch.hpc/luca.cotugno/Foundation_model_clinical_data/test_tabular_model.py:481: UserWarning: Choices for a categorical distribution should be a tuple of None, bool, int, float and str for persistent storage but contains [64, 32] which is of type list.
  num_nodes  = trial.suggest_categorical("num_nodes", [[32], [64], [128], [64, 32], [128, 64]])
/scratch.hpc/luca.cotugno/Foundation_model_clinical_data/test_tabular_model.py:481: UserWarning: Choices for a categorical distribution should be a tuple of None, bool, int, float and str for persistent storage but contains [128, 64] which is of type list.
  num_nodes  = trial.suggest_categorical("num_nodes", [[32], [64], [128], [64, 32], [128, 64]])
[I 2026-07-01 11:30:28,389] Trial 21 finished with value: 0.7383853543717607 and parameters: {'num_nodes': [32], 'dropout': 0.07809955194728857, 'learning_rate': 0.0003839439440787264, 'batch_norm': False}. Best is trial 14 with value: 0.765014030729598.
/scratch.hpc/luca.cotugno/Foundation_model_clinical_data/test_tabular_model.py:481: UserWarning: Choices for a categorical distribution should be a tuple of None, bool, int, float and str for persistent storage but contains [32] which is of type list.
  num_nodes  = trial.suggest_categorical("num_nodes", [[32], [64], [128], [64, 32], [128, 64]])
/scratch.hpc/luca.cotugno/Foundation_model_clinical_data/test_tabular_model.py:481: UserWarning: Choices for a categorical distribution should be a tuple of None, bool, int, float and str for persistent storage but contains [64] which is of type list.
  num_nodes  = trial.suggest_categorical("num_nodes", [[32], [64], [128], [64, 32], [128, 64]])
/scratch.hpc/luca.cotugno/Foundation_model_clinical_data/test_tabular_model.py:481: UserWarning: Choices for a categorical distribution should be a tuple of None, bool, int, float and str for persistent storage but contains [128] which is of type list.
  num_nodes  = trial.suggest_categorical("num_nodes", [[32], [64], [128], [64, 32], [128, 64]])
/scratch.hpc/luca.cotugno/Foundation_model_clinical_data/test_tabular_model.py:481: UserWarning: Choices for a categorical distribution should be a tuple of None, bool, int, float and str for persistent storage but contains [64, 32] which is of type list.
  num_nodes  = trial.suggest_categorical("num_nodes", [[32], [64], [128], [64, 32], [128, 64]])
/scratch.hpc/luca.cotugno/Foundation_model_clinical_data/test_tabular_model.py:481: UserWarning: Choices for a categorical distribution should be a tuple of None, bool, int, float and str for persistent storage but contains [128, 64] which is of type list.
  num_nodes  = trial.suggest_categorical("num_nodes", [[32], [64], [128], [64, 32], [128, 64]])
