[I 2026-07-01 07:25:37,029] Trial 25 finished with value: 0.7616909461340419 and parameters: {'num_nodes': [128, 64], 'dropout': 0.0031259411502103374, 'learning_rate': 0.004539035652113099, 'batch_norm': False}. Best is trial 3 with value: 0.8108369571214855.
/scratch.hpc/luca.cotugno/Foundation_model_clinical_data/test_tabular_model.py:481: UserWarning: Choices for a categorical distribution should be a tuple of None, bool, int, float and str for persistent storage but contains [32] which is of type list.
  num_nodes  = trial.suggest_categorical("num_nodes", [[32], [64], [128], [64, 32], [128, 64]])
/scratch.hpc/luca.cotugno/Foundation_model_clinical_data/test_tabular_model.py:481: UserWarning: Choices for a categorical distribution should be a tuple of None, bool, int, float and str for persistent storage but contains [64] which is of type list.
  num_nodes  = trial.suggest_categorical("num_nodes", [[32], [64], [128], [64, 32], [128, 64]])
/scratch.hpc/luca.cotugno/Foundation_model_clinical_data/test_tabular_model.py:481: UserWarning: Choices for a categorical distribution should be a tuple of None, bool, int, float and str for persistent storage but contains [128] which is of type list.
  num_nodes  = trial.suggest_categorical("num_nodes", [[32], [64], [128], [64, 32], [128, 64]])
/scratch.hpc/luca.cotugno/Foundation_model_clinical_data/test_tabular_model.py:481: UserWarning: Choices for a categorical distribution should be a tuple of None, bool, int, float and str for persistent storage but contains [64, 32] which is of type list.
  num_nodes  = trial.suggest_categorical("num_nodes", [[32], [64], [128], [64, 32], [128, 64]])
/scratch.hpc/luca.cotugno/Foundation_model_clinical_data/test_tabular_model.py:481: UserWarning: Choices for a categorical distribution should be a tuple of None, bool, int, float and str for persistent storage but contains [128, 64] which is of type list.
  num_nodes  = trial.suggest_categorical("num_nodes", [[32], [64], [128], [64, 32], [128, 64]])

93:	[0s / 51s],		train_loss: 3.9585
28:	[3s / 1m:51s],		train_loss: 4.0803
60:	[0s / 41s],		train_loss: 3.8769
45:	[1s / 1m:51s],		train_loss: 4.2110
90:	[1s / 1m:51s],		train_loss: 4.0610
5:	[0s / 2s],		train_loss: 4.2815
94:	[0s / 52s],		train_loss: 3.9417
6:	[0s / 3s],		train_loss: 4.2616
61:	[0s / 42s],		train_loss: 3.8317
95:	[0s / 52s],		train_loss: 3.9421
7:	[0s / 3s],		train_loss: 4.2294
91:	[1s / 1m:52s],		train_loss: 4.0549
62:	[0s / 42s],		train_loss: 3.8350
96:	[0s / 53s],		train_loss: 3.9555
8:	[0s / 4s],		train_loss: 4.2223
46:	[1s / 1m:52s],		train_loss: 4.2461
97:	[0s / 53s],		train_loss: 3.9918
63:	[0s / 43s],		train_loss: 3.8989
92:	[1s / 1m:53s],		train_loss: 4.0470
9:	[0s / 5s],		train_loss: 4.2124
98:	[0s / 54s],		train_loss: 3.9307
10:	[0s / 5s],		train_loss: 4.1886
64:	[0s / 44s],		train_loss: 3.8631
17:	[6s / 1m:54s],		train_loss: 4.1454
99:	[0s / 55s],		train_loss: 3.9371
11:	[0s / 6s],		train_loss: 4.1793
93:	[1s / 1m:54s],		train_loss: 4.0454
65:	[0s / 45s],		train_loss: 3.8258
29:	[3s / 1m:55s],		train_loss: 4.0531
12:	[0s / 6s],		train_loss: 4.1615
47:	[2s / 1m:55s],		train_loss: 4.2456
0:	[0s / 0s],		train_loss: 4.4684
13:	[0s / 7s],		train_loss: 4.1456
66:	[0s / 45s],		train_loss: 3.8328
94:	[1s / 1m:55s],		train_loss: 4.0310
1:	[0s / 1s],		train_loss: 4.3197
14:	[0s / 7s],		train_loss: 4.1303
67:	[0s / 46s],		train_loss: 3.8578
15:	[0s / 8s],		train_loss: 4.1310
2:	[0s / 2s],		train_loss: 4.2629
95:	[1s / 1m:56s],		train_loss: 4.0564
48:	[1s / 1m:56s],		train_loss: 4.2099
16:	[0s / 8s],		train_loss: 4.1255
68:	[0s / 47s],		train_loss: 3.8493
3:	[0s / 2s],		train_loss: 4.2347
17:	[0s / 9s],		train_loss: 4.1023
96:	[0s / 1m:57s],		train_loss: 4.0231
69:	[0s / 48s],		train_loss: 3.8742
18:	[0s / 9s],		train_loss: 4.1039
4:	[0s / 3s],		train_loss: 4.2152
30:	[3s / 1m:58s],		train_loss: 4.0530
19:	[0s / 10s],		train_loss: 4.0700
70:	[0s / 48s],		train_loss: 3.8204
49:	[1s / 1m:58s],		train_loss: 4.1886
97:	[0s / 1m:58s],		train_loss: 4.0434
5:	[0s / 4s],		train_loss: 4.1828
20:	[0s / 10s],		train_loss: 4.0913
71:	[0s / 49s],		train_loss: 3.7634
21:	[0s / 10s],		train_loss: 4.0510
6:	[0s / 4s],		train_loss: 4.1588
22:	[0s / 11s],		train_loss: 4.0341
98:	[0s / 1m:59s],		train_loss: 4.0345
72:	[0s / 49s],		train_loss: 3.7793
7:	[0s / 5s],		train_loss: 4.1552
23:	[0s / 11s],		train_loss: 4.0367
73:	[0s / 50s],		train_loss: 3.7654
50:	[1s / 2m:0s],		train_loss: 4.2201
8:	[0s / 5s],		train_loss: 4.1241
24:	[0s / 12s],		train_loss: 4.0160
99:	[0s / 2m:0s],		train_loss: 4.0425
18:	[6s / 2m:0s],		train_loss: 4.1267
25:	[0s / 12s],		train_loss: 4.0163
74:	[0s / 51s],		train_loss: 3.8050
9:	[0s / 6s],		train_loss: 4.1143
26:	[0s / 12s],		train_loss: 3.9836
10:	[0s / 6s],		train_loss: 4.1063
75:	[0s / 51s],		train_loss: 3.7853
0:	[0s / 0s],		train_loss: 4.8216
31:	[3s / 2m:1s],		train_loss: 4.0402
27:	[0s / 13s],		train_loss: 3.9746
28:	[0s / 13s],		train_loss: 3.9774
11:	[0s / 7s],		train_loss: 4.0654
11:	[11s / 2m:2s],		train_loss: 4.2429
51:	[1s / 2m:2s],		train_loss: 4.2245
76:	[0s / 52s],		train_loss: 3.7628
29:	[0s / 14s],		train_loss: 3.9749
1:	[1s / 2s],		train_loss: 4.6285
12:	[0s / 8s],		train_loss: 4.0781
77:	[0s / 53s],		train_loss: 3.7714
30:	[0s / 14s],		train_loss: 3.9417
31:	[0s / 15s],		train_loss: 3.9468
13:	[0s / 9s],		train_loss: 4.0537
78:	[0s / 54s],		train_loss: 3.7714
2:	[1s / 3s],		train_loss: 4.5439
32:	[0s / 15s],		train_loss: 3.9137
14:	[0s / 9s],		train_loss: 4.0253
52:	[2s / 2m:4s],		train_loss: 4.1882
33:	[0s / 16s],		train_loss: 3.9018
79:	[0s / 55s],		train_loss: 3.7638
34:	[0s / 16s],		train_loss: 3.8998
15:	[0s / 10s],		train_loss: 4.0321
3:	[1s / 4s],		train_loss: 4.4728
80:	[0s / 55s],		train_loss: 3.7582
32:	[3s / 2m:5s],		train_loss: 4.0352
35:	[0s / 17s],		train_loss: 3.8976
16:	[0s / 11s],		train_loss: 4.0074
36:	[0s / 17s],		train_loss: 3.8823
81:	[0s / 56s],		train_loss: 3.7284
4:	[0s / 5s],		train_loss: 4.4297
37:	[0s / 17s],		train_loss: 3.8429
17:	[0s / 11s],		train_loss: 3.9861
53:	[1s / 2m:6s],		train_loss: 4.1843
82:	[0s / 56s],		train_loss: 3.7086
38:	[0s / 18s],		train_loss: 3.8536
18:	[0s / 12s],		train_loss: 3.9734
39:	[0s / 18s],		train_loss: 3.8610
83:	[0s / 57s],		train_loss: 3.7265
5:	[0s / 6s],		train_loss: 4.4043
19:	[6s / 2m:7s],		train_loss: 4.1129
19:	[0s / 12s],		train_loss: 3.9438
40:	[0s / 19s],		train_loss: 3.8365
84:	[0s / 57s],		train_loss: 3.7587
41:	[0s / 19s],		train_loss: 3.8317
20:	[0s / 13s],		train_loss: 3.9264
6:	[0s / 7s],		train_loss: 4.3801
54:	[1s / 2m:8s],		train_loss: 4.1962
42:	[0s / 19s],		train_loss: 3.8318
85:	[0s / 58s],		train_loss: 3.7528
21:	[0s / 13s],		train_loss: 3.9471
43:	[0s / 20s],		train_loss: 3.7809
33:	[3s / 2m:8s],		train_loss: 4.0325
86:	[0s / 59s],		train_loss: 3.7682
44:	[0s / 20s],		train_loss: 3.7857
7:	[1s / 8s],		train_loss: 4.3644
22:	[0s / 14s],		train_loss: 3.9135
45:	[0s / 21s],		train_loss: 3.7788
87:	[0s / 59s],		train_loss: 3.7422
23:	[0s / 15s],		train_loss: 3.9021
46:	[0s / 21s],		train_loss: 3.7599
55:	[1s / 2m:9s],		train_loss: 4.1951
8:	[1s / 9s],		train_loss: 4.3429
88:	[0s / 1m:0s],		train_loss: 3.7456
47:	[0s / 22s],		train_loss: 3.7512
24:	[0s / 15s],		train_loss: 3.8922
48:	[0s / 22s],		train_loss: 3.7494
89:	[0s / 1m:1s],		train_loss: 3.6897
25:	[0s / 16s],		train_loss: 3.8793
49:	[0s / 22s],		train_loss: 3.7526
9:	[0s / 10s],		train_loss: 4.3366
90:	[0s / 1m:1s],		train_loss: 3.7104
26:	[0s / 16s],		train_loss: 3.8559
50:	[0s / 23s],		train_loss: 3.7233
56:	[1s / 2m:11s],		train_loss: 4.2035
34:	[3s / 2m:11s],		train_loss: 4.0226
51:	[0s / 23s],		train_loss: 3.7099
91:	[0s / 1m:2s],		train_loss: 3.7171
27:	[0s / 17s],		train_loss: 3.8377
10:	[0s / 11s],		train_loss: 4.3362
52:	[0s / 23s],		train_loss: 3.6823
92:	[0s / 1m:2s],		train_loss: 3.6849
28:	[0s / 17s],		train_loss: 3.8165
53:	[0s / 24s],		train_loss: 3.6888
54:	[0s / 24s],		train_loss: 3.6766
11:	[1s / 12s],		train_loss: 4.3097
93:	[0s / 1m:3s],		train_loss: 3.7034
29:	[0s / 18s],		train_loss: 3.8294
55:	[0s / 25s],		train_loss: 3.7132
57:	[1s / 2m:13s],		train_loss: 4.1841
20:	[6s / 2m:13s],		train_loss: 4.1145
30:	[0s / 19s],		train_loss: 3.8174
94:	[0s / 1m:4s],		train_loss: 3.6762
56:	[0s / 25s],		train_loss: 3.6628
12:	[1s / 13s],		train_loss: 4.3202
57:	[0s / 26s],		train_loss: 3.6497
31:	[0s / 19s],		train_loss: 3.8408
95:	[0s / 1m:4s],		train_loss: 3.6613
58:	[0s / 26s],		train_loss: 3.6511
32:	[0s / 20s],		train_loss: 3.7997
96:	[0s / 1m:5s],		train_loss: 3.6703
59:	[0s / 27s],		train_loss: 3.6385
13:	[1s / 14s],		train_loss: 4.3126
12:	[13s / 2m:15s],		train_loss: 4.2418
58:	[1s / 2m:15s],		train_loss: 4.1702
35:	[3s / 2m:15s],		train_loss: 3.9973
60:	[0s / 27s],		train_loss: 3.6367
33:	[0s / 21s],		train_loss: 3.8028
97:	[0s / 1m:5s],		train_loss: 3.6764
61:	[0s / 27s],		train_loss: 3.6345
14:	[0s / 15s],		train_loss: 4.2961
34:	[0s / 21s],		train_loss: 3.7505
98:	[0s / 1m:6s],		train_loss: 3.6568
62:	[0s / 28s],		train_loss: 3.6036
35:	[0s / 22s],		train_loss: 3.7827
63:	[0s / 28s],		train_loss: 3.6288
99:	[0s / 1m:7s],		train_loss: 3.6665
59:	[1s / 2m:17s],		train_loss: 4.1630
64:	[0s / 29s],		train_loss: 3.6321
15:	[1s / 16s],		train_loss: 4.2858
36:	[0s / 22s],		train_loss: 3.7390
65:	[0s / 29s],		train_loss: 3.5769
0:	[0s / 0s],		train_loss: 4.6274
37:	[0s / 23s],		train_loss: 3.7705
66:	[0s / 29s],		train_loss: 3.5816
67:	[0s / 30s],		train_loss: 3.5648
1:	[0s / 1s],		train_loss: 4.4609
38:	[0s / 23s],		train_loss: 3.7495
16:	[1s / 17s],		train_loss: 4.2882
68:	[0s / 30s],		train_loss: 3.5635
36:	[3s / 2m:19s],		train_loss: 4.0174
39:	[0s / 24s],		train_loss: 3.7353
2:	[0s / 2s],		train_loss: 4.3720
69:	[0s / 30s],		train_loss: 3.5397
60:	[2s / 2m:19s],		train_loss: 4.1234
70:	[0s / 31s],		train_loss: 3.5430
40:	[0s / 25s],		train_loss: 3.6886
17:	[1s / 19s],		train_loss: 4.2744
3:	[0s / 2s],		train_loss: 4.3477
71:	[0s / 31s],		train_loss: 3.5396
21:	[6s / 2m:20s],		train_loss: 4.1148
41:	[0s / 25s],		train_loss: 3.7058
72:	[0s / 32s],		train_loss: 3.5438
4:	[0s / 3s],		train_loss: 4.3318
73:	[0s / 32s],		train_loss: 3.5275
42:	[0s / 26s],		train_loss: 3.6724
18:	[1s / 20s],		train_loss: 4.2900
74:	[0s / 32s],		train_loss: 3.4939
61:	[1s / 2m:21s],		train_loss: 4.1643
43:	[0s / 26s],		train_loss: 3.6438
5:	[0s / 4s],		train_loss: 4.3134
75:	[0s / 33s],		train_loss: 3.5201
44:	[0s / 27s],		train_loss: 3.6676
76:	[0s / 33s],		train_loss: 3.4832
6:	[0s / 4s],		train_loss: 4.2917
19:	[1s / 21s],		train_loss: 4.2785
77:	[0s / 33s],		train_loss: 3.4905
45:	[0s / 27s],		train_loss: 3.6920
37:	[3s / 2m:22s],		train_loss: 4.0203
78:	[0s / 34s],		train_loss: 3.4670
7:	[0s / 5s],		train_loss: 4.2623
46:	[0s / 28s],		train_loss: 3.6477
79:	[0s / 34s],		train_loss: 3.4504
62:	[1s / 2m:22s],		train_loss: 4.1523
20:	[1s / 22s],		train_loss: 4.2753
80:	[0s / 34s],		train_loss: 3.5023
47:	[0s / 28s],		train_loss: 3.6433
8:	[0s / 6s],		train_loss: 4.2595
81:	[0s / 35s],		train_loss: 3.4450
48:	[0s / 29s],		train_loss: 3.6571
82:	[0s / 35s],		train_loss: 3.4408
9:	[0s / 6s],		train_loss: 4.2429
21:	[1s / 23s],		train_loss: 4.2700
49:	[0s / 29s],		train_loss: 3.6673
83:	[0s / 36s],		train_loss: 3.4033
63:	[1s / 2m:24s],		train_loss: 4.2389
10:	[0s / 7s],		train_loss: 4.2436
84:	[0s / 36s],		train_loss: 3.4269
50:	[0s / 30s],		train_loss: 3.6685
22:	[1s / 24s],		train_loss: 4.2653
85:	[0s / 37s],		train_loss: 3.4100
38:	[3s / 2m:25s],		train_loss: 3.9941
51:	[0s / 31s],		train_loss: 3.5906
11:	[0s / 8s],		train_loss: 4.2244
86:	[0s / 37s],		train_loss: 3.4223
87:	[0s / 38s],		train_loss: 3.4138
52:	[0s / 31s],		train_loss: 3.5772
22:	[6s / 2m:26s],		train_loss: 4.1037
12:	[1s / 9s],		train_loss: 4.2215
88:	[0s / 38s],		train_loss: 3.4012
23:	[1s / 26s],		train_loss: 4.2597
13:	[11s / 2m:27s],		train_loss: 4.2361
53:	[0s / 32s],		train_loss: 3.5857
64:	[2s / 2m:27s],		train_loss: 4.1757
89:	[0s / 39s],		train_loss: 3.4034
13:	[1s / 10s],		train_loss: 4.1898
54:	[0s / 33s],		train_loss: 3.5990
90:	[0s / 39s],		train_loss: 3.3872
91:	[0s / 40s],		train_loss: 3.3638
24:	[1s / 28s],		train_loss: 4.2508
14:	[0s / 11s],		train_loss: 4.1704
55:	[0s / 34s],		train_loss: 3.6407
92:	[0s / 40s],		train_loss: 3.3233
56:	[0s / 34s],		train_loss: 3.6163
93:	[0s / 41s],		train_loss: 3.3708
15:	[0s / 12s],		train_loss: 4.1863
94:	[0s / 41s],		train_loss: 3.3495
25:	[1s / 29s],		train_loss: 4.2469
57:	[0s / 35s],		train_loss: 3.5904
65:	[2s / 2m:30s],		train_loss: 4.1532
39:	[4s / 2m:30s],		train_loss: 4.0266
16:	[0s / 13s],		train_loss: 4.1891
95:	[0s / 42s],		train_loss: 3.3718
58:	[0s / 36s],		train_loss: 3.5658
96:	[0s / 42s],		train_loss: 3.3676
17:	[0s / 14s],		train_loss: 4.1658
97:	[0s / 43s],		train_loss: 3.3408
59:	[0s / 36s],		train_loss: 3.5354
26:	[1s / 30s],		train_loss: 4.2366
98:	[0s / 43s],		train_loss: 3.3330
60:	[0s / 37s],		train_loss: 3.5102
18:	[0s / 15s],		train_loss: 4.1672
99:	[0s / 43s],		train_loss: 3.3130
66:	[2s / 2m:32s],		train_loss: 4.2253
27:	[1s / 32s],		train_loss: 4.2358
61:	[0s / 38s],		train_loss: 3.5295
0:	[0s / 0s],		train_loss: 4.6025
19:	[0s / 15s],		train_loss: 4.1700
23:	[6s / 2m:33s],		train_loss: 4.0698
1:	[0s / 1s],		train_loss: 4.3837
62:	[0s / 38s],		train_loss: 3.5143
40:	[3s / 2m:33s],		train_loss: 3.9585
2:	[0s / 1s],		train_loss: 4.3622
20:	[0s / 16s],		train_loss: 4.1509
28:	[1s / 33s],		train_loss: 4.2374
63:	[0s / 39s],		train_loss: 3.5252
3:	[0s / 2s],		train_loss: 4.3371
67:	[2s / 2m:34s],		train_loss: 4.1731
4:	[0s / 2s],		train_loss: 4.3093
21:	[0s / 17s],		train_loss: 4.1429
64:	[0s / 40s],		train_loss: 3.5123
5:	[0s / 3s],		train_loss: 4.2793
29:	[1s / 35s],		train_loss: 4.2223
65:	[0s / 41s],		train_loss: 3.4514
22:	[0s / 18s],		train_loss: 4.1317
6:	[0s / 3s],		train_loss: 4.2909
66:	[0s / 41s],		train_loss: 3.4751
7:	[0s / 4s],		train_loss: 4.2573
23:	[0s / 19s],		train_loss: 4.1152
8:	[0s / 4s],		train_loss: 4.2611
30:	[1s / 36s],		train_loss: 4.2310
67:	[0s / 42s],		train_loss: 3.4991
68:	[2s / 2m:37s],		train_loss: 4.1833
9:	[0s / 5s],		train_loss: 4.2434
24:	[0s / 20s],		train_loss: 4.1131
68:	[0s / 43s],		train_loss: 3.4401
10:	[0s / 5s],		train_loss: 4.2218
41:	[4s / 2m:38s],		train_loss: 3.9894
11:	[0s / 6s],		train_loss: 4.2243
69:	[0s / 43s],		train_loss: 3.4429
31:	[1s / 38s],		train_loss: 4.2134
25:	[0s / 21s],		train_loss: 4.0987
12:	[0s / 6s],		train_loss: 4.2000
70:	[0s / 44s],		train_loss: 3.4406
13:	[0s / 7s],		train_loss: 4.2108
69:	[2s / 2m:39s],		train_loss: 4.1420
26:	[0s / 22s],		train_loss: 4.0981
14:	[0s / 7s],		train_loss: 4.2117
71:	[0s / 45s],		train_loss: 3.4633
32:	[1s / 39s],		train_loss: 4.2281
15:	[0s / 8s],		train_loss: 4.1828
27:	[0s / 23s],		train_loss: 4.0963
72:	[0s / 46s],		train_loss: 3.4854
16:	[0s / 8s],		train_loss: 4.1941
14:	[13s / 2m:41s],		train_loss: 4.2061
17:	[0s / 8s],		train_loss: 4.1724
73:	[0s / 46s],		train_loss: 3.4597
28:	[0s / 24s],		train_loss: 4.0781
33:	[1s / 40s],		train_loss: 4.2339
24:	[8s / 2m:41s],		train_loss: 4.0741
18:	[0s / 9s],		train_loss: 4.1644
70:	[2s / 2m:41s],		train_loss: 4.1644
74:	[0s / 47s],		train_loss: 3.3931
42:	[3s / 2m:42s],		train_loss: 3.9641
19:	[0s / 9s],		train_loss: 4.1374
29:	[0s / 25s],		train_loss: 4.0919
75:	[0s / 47s],		train_loss: 3.4455
20:	[0s / 10s],		train_loss: 4.1476
34:	[1s / 42s],		train_loss: 4.2156
21:	[0s / 10s],		train_loss: 4.1653
30:	[0s / 26s],		train_loss: 4.0766
76:	[0s / 48s],		train_loss: 3.4631
22:	[0s / 11s],		train_loss: 4.1328
77:	[0s / 49s],		train_loss: 3.4402
23:	[0s / 11s],		train_loss: 4.1194
31:	[0s / 26s],		train_loss: 4.0812
35:	[1s / 43s],		train_loss: 4.2103
71:	[2s / 2m:44s],		train_loss: 4.1714
24:	[0s / 12s],		train_loss: 4.1135
78:	[0s / 49s],		train_loss: 3.4230
32:	[0s / 27s],		train_loss: 4.0663
25:	[0s / 12s],		train_loss: 4.1229
79:	[0s / 50s],		train_loss: 3.4499
26:	[0s / 12s],		train_loss: 4.1117
36:	[1s / 44s],		train_loss: 4.2167
80:	[0s / 51s],		train_loss: 3.4440
33:	[0s / 28s],		train_loss: 4.0546
27:	[0s / 13s],		train_loss: 4.0938
43:	[3s / 2m:45s],		train_loss: 3.9497
28:	[0s / 13s],		train_loss: 4.0579
81:	[0s / 51s],		train_loss: 3.3820
72:	[2s / 2m:46s],		train_loss: 4.1697
34:	[0s / 29s],		train_loss: 4.0407
29:	[0s / 14s],		train_loss: 4.0897
37:	[1s / 45s],		train_loss: 4.2127
82:	[0s / 52s],		train_loss: 3.3736
30:	[0s / 14s],		train_loss: 4.0553
35:	[1s / 30s],		train_loss: 4.0462
31:	[0s / 15s],		train_loss: 4.0722
83:	[0s / 52s],		train_loss: 3.3673
32:	[0s / 15s],		train_loss: 4.0566
38:	[1s / 47s],		train_loss: 4.2061
36:	[0s / 31s],		train_loss: 4.0545
84:	[0s / 53s],		train_loss: 3.4196
25:	[6s / 2m:48s],		train_loss: 4.0682
33:	[0s / 16s],		train_loss: 4.0255
73:	[2s / 2m:48s],		train_loss: 4.1837
34:	[0s / 16s],		train_loss: 4.0374
85:	[0s / 54s],		train_loss: 3.4130
37:	[0s / 31s],		train_loss: 4.0048
39:	[1s / 48s],		train_loss: 4.2039
35:	[0s / 16s],		train_loss: 4.0096
86:	[0s / 54s],		train_loss: 3.3832
44:	[3s / 2m:49s],		train_loss: 3.9494
36:	[0s / 17s],		train_loss: 4.0109
38:	[0s / 32s],		train_loss: 4.0171
37:	[0s / 17s],		train_loss: 4.0240
87:	[0s / 55s],		train_loss: 3.3673
40:	[1s / 49s],		train_loss: 4.2004
39:	[0s / 33s],		train_loss: 4.0109
38:	[0s / 18s],		train_loss: 4.0180
74:	[2s / 2m:50s],		train_loss: 4.2107
88:	[0s / 56s],		train_loss: 3.3659
39:	[0s / 18s],		train_loss: 4.0253
40:	[0s / 34s],		train_loss: 4.0365
89:	[0s / 56s],		train_loss: 3.3864
40:	[0s / 19s],		train_loss: 3.9893
41:	[1s / 51s],		train_loss: 4.1927
41:	[0s / 19s],		train_loss: 4.0044
90:	[0s / 57s],		train_loss: 3.3389
41:	[0s / 35s],		train_loss: 4.0182
42:	[0s / 19s],		train_loss: 3.9802
91:	[0s / 57s],		train_loss: 3.3779
43:	[0s / 20s],		train_loss: 3.9723
75:	[2s / 2m:52s],		train_loss: 4.1821
42:	[0s / 35s],		train_loss: 4.0189
42:	[1s / 52s],		train_loss: 4.1898
44:	[0s / 20s],		train_loss: 3.9673
92:	[0s / 58s],		train_loss: 3.3094
45:	[3s / 2m:53s],		train_loss: 3.9418
45:	[0s / 21s],		train_loss: 3.9269
43:	[0s / 36s],		train_loss: 4.0106
93:	[0s / 59s],		train_loss: 3.3024
46:	[0s / 21s],		train_loss: 3.9263
43:	[1s / 53s],		train_loss: 4.1885
47:	[0s / 22s],		train_loss: 3.9595
94:	[0s / 59s],		train_loss: 3.3260
44:	[0s / 37s],		train_loss: 3.9779
48:	[0s / 22s],		train_loss: 3.9283
76:	[2s / 2m:55s],		train_loss: 4.1353
95:	[0s / 1m:0s],		train_loss: 3.3625
49:	[0s / 23s],		train_loss: 3.9238
45:	[0s / 38s],		train_loss: 3.9711
44:	[1s / 54s],		train_loss: 4.1863
96:	[0s / 1m:1s],		train_loss: 3.3642
26:	[7s / 2m:55s],		train_loss: 4.0676
50:	[0s / 23s],		train_loss: 3.9082
46:	[0s / 39s],		train_loss: 4.0004
51:	[0s / 24s],		train_loss: 3.9350
15:	[15s / 2m:56s],		train_loss: 4.1947
97:	[0s / 1m:1s],		train_loss: 3.3858
52:	[0s / 24s],		train_loss: 3.9125
45:	[1s / 56s],		train_loss: 4.1808
47:	[0s / 40s],		train_loss: 3.9971
98:	[0s / 1m:2s],		train_loss: 3.3363
53:	[0s / 25s],		train_loss: 3.9184
77:	[2s / 2m:57s],		train_loss: 4.1324
46:	[4s / 2m:57s],		train_loss: 3.9620
54:	[0s / 25s],		train_loss: 3.9121
99:	[0s / 1m:3s],		train_loss: 3.3373
48:	[0s / 41s],		train_loss: 3.9730
55:	[0s / 26s],		train_loss: 3.8744
46:	[1s / 57s],		train_loss: 4.1955
0:	[0s / 0s],		train_loss: 4.6961
56:	[0s / 26s],		train_loss: 3.9025
49:	[0s / 41s],		train_loss: 3.9529
1:	[0s / 0s],		train_loss: 4.4146
57:	[0s / 26s],		train_loss: 3.8891
78:	[2s / 2m:59s],		train_loss: 4.1569
2:	[0s / 1s],		train_loss: 4.3574
47:	[1s / 59s],		train_loss: 4.1663
50:	[1s / 42s],		train_loss: 3.9486
58:	[0s / 27s],		train_loss: 3.8740
3:	[0s / 2s],		train_loss: 4.3449
59:	[0s / 28s],		train_loss: 3.8567
4:	[0s / 2s],		train_loss: 4.3391
51:	[0s / 43s],		train_loss: 3.9240
60:	[0s / 28s],		train_loss: 3.8709
48:	[1s / 1m:0s],		train_loss: 4.1692
47:	[3s / 3m:1s],		train_loss: 3.9789
5:	[0s / 3s],		train_loss: 4.3174
61:	[0s / 29s],		train_loss: 3.8776
79:	[2s / 3m:1s],		train_loss: 4.1365
52:	[0s / 44s],		train_loss: 3.9634
6:	[0s / 3s],		train_loss: 4.3281
62:	[0s / 29s],		train_loss: 3.8547
49:	[1s / 1m:1s],		train_loss: 4.1722
7:	[0s / 4s],		train_loss: 4.3188
63:	[0s / 30s],		train_loss: 3.8305
27:	[6s / 3m:2s],		train_loss: 4.0722
53:	[0s / 45s],		train_loss: 3.9594
8:	[0s / 4s],		train_loss: 4.2956
64:	[0s / 30s],		train_loss: 3.8865
65:	[0s / 31s],		train_loss: 3.8136
9:	[0s / 5s],		train_loss: 4.2980
50:	[1s / 1m:3s],		train_loss: 4.1654
80:	[1s / 3m:3s],		train_loss: 4.1247
54:	[0s / 46s],		train_loss: 3.9582
66:	[0s / 31s],		train_loss: 3.7879
10:	[0s / 5s],		train_loss: 4.2718
67:	[0s / 32s],		train_loss: 3.8486
55:	[0s / 47s],		train_loss: 3.9400
11:	[0s / 6s],		train_loss: 4.3068
51:	[1s / 1m:4s],		train_loss: 4.1499
68:	[0s / 32s],		train_loss: 3.8145
48:	[3s / 3m:5s],		train_loss: 3.9106
12:	[0s / 7s],		train_loss: 4.2634
56:	[0s / 48s],		train_loss: 3.9432
69:	[0s / 33s],		train_loss: 3.8389
13:	[0s / 7s],		train_loss: 4.2657
81:	[2s / 3m:5s],		train_loss: 4.1165
70:	[0s / 33s],		train_loss: 3.7741
52:	[1s / 1m:5s],		train_loss: 4.1486
14:	[0s / 7s],		train_loss: 4.2531
57:	[0s / 49s],		train_loss: 3.9470
71:	[0s / 33s],		train_loss: 3.7546
15:	[0s / 8s],		train_loss: 4.3089
72:	[0s / 34s],		train_loss: 3.7797
58:	[0s / 49s],		train_loss: 3.9229
16:	[0s / 8s],		train_loss: 4.2475
53:	[1s / 1m:6s],		train_loss: 4.1479
73:	[0s / 34s],		train_loss: 3.7534
17:	[0s / 9s],		train_loss: 4.2464
82:	[1s / 3m:7s],		train_loss: 4.1370
74:	[0s / 35s],		train_loss: 3.7503
59:	[0s / 50s],		train_loss: 3.9070
18:	[0s / 10s],		train_loss: 4.2246
75:	[0s / 35s],		train_loss: 3.7581
54:	[1s / 1m:7s],		train_loss: 4.1505
19:	[0s / 10s],		train_loss: 4.2289
49:	[3s / 3m:8s],		train_loss: 3.9157
76:	[0s / 36s],		train_loss: 3.7517
60:	[0s / 51s],		train_loss: 3.9251
20:	[0s / 11s],		train_loss: 4.2276
77:	[0s / 37s],		train_loss: 3.7566
28:	[6s / 3m:9s],		train_loss: 4.0516
83:	[2s / 3m:9s],		train_loss: 4.1257
21:	[0s / 11s],		train_loss: 4.2247
55:	[1s / 1m:9s],		train_loss: 4.1413
61:	[1s / 52s],		train_loss: 3.9309
78:	[0s / 37s],		train_loss: 3.7516
16:	[13s / 3m:10s],		train_loss: 4.2096
22:	[0s / 12s],		train_loss: 4.2