[I 2026-07-01 05:08:46,065] Trial 39 finished with value: 0.7706838255589291 and parameters: {'num_nodes': [128], 'dropout': 0.24918294779143305, 'learning_rate': 0.00010299033171451142, 'batch_norm': False}. Best is trial 20 with value: 0.7756578342073788.
/scratch.hpc/luca.cotugno/Foundation_model_clinical_data/test_tabular_model.py:481: UserWarning: Choices for a categorical distribution should be a tuple of None, bool, int, float and str for persistent storage but contains [32] which is of type list.
  num_nodes  = trial.suggest_categorical("num_nodes", [[32], [64], [128], [64, 32], [128, 64]])
/scratch.hpc/luca.cotugno/Foundation_model_clinical_data/test_tabular_model.py:481: UserWarning: Choices for a categorical distribution should be a tuple of None, bool, int, float and str for persistent storage but contains [64] which is of type list.
  num_nodes  = trial.suggest_categorical("num_nodes", [[32], [64], [128], [64, 32], [128, 64]])
/scratch.hpc/luca.cotugno/Foundation_model_clinical_data/test_tabular_model.py:481: UserWarning: Choices for a categorical distribution should be a tuple of None, bool, int, float and str for persistent storage but contains [128] which is of type list.
  num_nodes  = trial.suggest_categorical("num_nodes", [[32], [64], [128], [64, 32], [128, 64]])
/scratch.hpc/luca.cotugno/Foundation_model_clinical_data/test_tabular_model.py:481: UserWarning: Choices for a categorical distribution should be a tuple of None, bool, int, float and str for persistent storage but contains [64, 32] which is of type list.
  num_nodes  = trial.suggest_categorical("num_nodes", [[32], [64], [128], [64, 32], [128, 64]])
/scratch.hpc/luca.cotugno/Foundation_model_clinical_data/test_tabular_model.py:481: UserWarning: Choices for a categorical distribution should be a tuple of None, bool, int, float and str for persistent storage but contains [128, 64] which is of type list.
  num_nodes  = trial.suggest_categorical("num_nodes", [[32], [64], [128], [64, 32], [128, 64]])
[I 2026-07-01 05:08:49,421] Trial 43 finished with value: 0.7617171926273499 and parameters: {'num_nodes': [64, 32], 'dropout': 0.29939251190734084, 'learning_rate': 0.0007545381249444497, 'batch_norm': False}. Best is trial 20 with value: 0.7756578342073788.
/scratch.hpc/luca.cotugno/Foundation_model_clinical_data/test_tabular_model.py:481: UserWarning: Choices for a categorical distribution should be a tuple of None, bool, int, float and str for persistent storage but contains [32] which is of type list.
  num_nodes  = trial.suggest_categorical("num_nodes", [[32], [64], [128], [64, 32], [128, 64]])
/scratch.hpc/luca.cotugno/Foundation_model_clinical_data/test_tabular_model.py:481: UserWarning: Choices for a categorical distribution should be a tuple of None, bool, int, float and str for persistent storage but contains [64] which is of type list.
  num_nodes  = trial.suggest_categorical("num_nodes", [[32], [64], [128], [64, 32], [128, 64]])
/scratch.hpc/luca.cotugno/Foundation_model_clinical_data/test_tabular_model.py:481: UserWarning: Choices for a categorical distribution should be a tuple of None, bool, int, float and str for persistent storage but contains [128] which is of type list.
  num_nodes  = trial.suggest_categorical("num_nodes", [[32], [64], [128], [64, 32], [128, 64]])
/scratch.hpc/luca.cotugno/Foundation_model_clinical_data/test_tabular_model.py:481: UserWarning: Choices for a categorical distribution should be a tuple of None, bool, int, float and str for persistent storage but contains [64, 32] which is of type list.
  num_nodes  = trial.suggest_categorical("num_nodes", [[32], [64], [128], [64, 32], [128, 64]])
/scratch.hpc/luca.cotugno/Foundation_model_clinical_data/test_tabular_model.py:481: UserWarning: Choices for a categorical distribution should be a tuple of None, bool, int, float and str for persistent storage but contains [128, 64] which is of type list.
  num_nodes  = trial.suggest_categorical("num_nodes", [[32], [64], [128], [64, 32], [128, 64]])
[I 2026-07-01 05:08:51,589] Trial 44 finished with value: 0.7340525040635446 and parameters: {'num_nodes': [64, 32], 'dropout': 0.2980692014766923, 'learning_rate': 0.0006074998587555896, 'batch_norm': False}. Best is trial 20 with value: 0.7756578342073788.
/scratch.hpc/luca.cotugno/Foundation_model_clinical_data/test_tabular_model.py:481: UserWarning: Choices for a categorical distribution should be a tuple of None, bool, int, float and str for persistent storage but contains [32] which is of type list.
  num_nodes  = trial.suggest_categorical("num_nodes", [[32], [64], [128], [64, 32], [128, 64]])
/scratch.hpc/luca.cotugno/Foundation_model_clinical_data/test_tabular_model.py:481: UserWarning: Choices for a categorical distribution should be a tuple of None, bool, int, float and str for persistent storage but contains [64] which is of type list.
  num_nodes  = trial.suggest_categorical("num_nodes", [[32], [64], [128], [64, 32], [128, 64]])
/scratch.hpc/luca.cotugno/Foundation_model_clinical_data/test_tabular_model.py:481: UserWarning: Choices for a categorical distribution should be a tuple of None, bool, int, float and str for persistent storage but contains [128] which is of type list.
  num_nodes  = trial.suggest_categorical("num_nodes", [[32], [64], [128], [64, 32], [128, 64]])
/scratch.hpc/luca.cotugno/Foundation_model_clinical_data/test_tabular_model.py:481: UserWarning: Choices for a categorical distribution should be a tuple of None, bool, int, float and str for persistent storage but contains [64, 32] which is of type list.
  num_nodes  = trial.suggest_categorical("num_nodes", [[32], [64], [128], [64, 32], [128, 64]])
/scratch.hpc/luca.cotugno/Foundation_model_clinical_data/test_tabular_model.py:481: UserWarning: Choices for a categorical distribution should be a tuple of None, bool, int, float and str for persistent storage but contains [128, 64] which is of type list.
  num_nodes  = trial.suggest_categorical("num_nodes", [[32], [64], [128], [64, 32], [128, 64]])
