[I 2026-07-01 05:06:39,623] Trial 14 finished with value: 0.7554857852608335 and parameters: {'num_nodes': [128, 64], 'dropout': 0.269031308691139, 'learning_rate': 0.0001444671879243047, 'batch_norm': False}. Best is trial 7 with value: 0.7664631060815162.
/scratch.hpc/luca.cotugno/Foundation_model_clinical_data/test_tabular_model.py:481: UserWarning: Choices for a categorical distribution should be a tuple of None, bool, int, float and str for persistent storage but contains [32] which is of type list.
  num_nodes  = trial.suggest_categorical("num_nodes", [[32], [64], [128], [64, 32], [128, 64]])
/scratch.hpc/luca.cotugno/Foundation_model_clinical_data/test_tabular_model.py:481: UserWarning: Choices for a categorical distribution should be a tuple of None, bool, int, float and str for persistent storage but contains [64] which is of type list.
  num_nodes  = trial.suggest_categorical("num_nodes", [[32], [64], [128], [64, 32], [128, 64]])
/scratch.hpc/luca.cotugno/Foundation_model_clinical_data/test_tabular_model.py:481: UserWarning: Choices for a categorical distribution should be a tuple of None, bool, int, float and str for persistent storage but contains [128] which is of type list.
  num_nodes  = trial.suggest_categorical("num_nodes", [[32], [64], [128], [64, 32], [128, 64]])
/scratch.hpc/luca.cotugno/Foundation_model_clinical_data/test_tabular_model.py:481: UserWarning: Choices for a categorical distribution should be a tuple of None, bool, int, float and str for persistent storage but contains [64, 32] which is of type list.
  num_nodes  = trial.suggest_categorical("num_nodes", [[32], [64], [128], [64, 32], [128, 64]])
/scratch.hpc/luca.cotugno/Foundation_model_clinical_data/test_tabular_model.py:481: UserWarning: Choices for a categorical distribution should be a tuple of None, bool, int, float and str for persistent storage but contains [128, 64] which is of type list.
  num_nodes  = trial.suggest_categorical("num_nodes", [[32], [64], [128], [64, 32], [128, 64]])
STARTED  model=tabdpt  seed=123  tuning=True  shap=False


Preprocess: Replace NaN with -1
Loading existing folds from tmp/splits/OrmoniTirodei_seed123.pkl
X_train shape: (5161, 76), X_test shape: (1291, 76)
Generating TABDPT Embeddings...
<class 'dict'>
Loaded TabDPTModel from checkpoint.
<class 'dict'>
Loaded TabDPTModel from checkpoint.
Successfully generated embeddings with shape: (5161, 768)
  [ckpt] Loading TABDPT DeepSurv Tuned from checkpoints/tabdpt/OrmoniTirodei/-1/seed123/fold1
C-index train: 0.7911
C-index test:  0.7739
  [ckpt] Loading TABDPT RSF Tuned from checkpoints/tabdpt/OrmoniTirodei/-1/seed123/fold1
C-index train: 0.8675
C-index test:  0.7720
  [ckpt] Loading DeepSurv Simple from checkpoints/tabdpt/OrmoniTirodei/-1/seed123/fold1/tabdpt_deepsurv_simple.pt
C-index TRAIN: 0.7881
C-index TEST:  0.7464
  [ckpt] Loading DeepSurv Vanilla from checkpoints/tabdpt/OrmoniTirodei/-1/seed123/fold1/tabdpt_deepsurv_vanilla.pt
C-index TRAIN: 0.8090
C-index TEST:  0.7716
  [ckpt] Loading TABDPT RSF from checkpoints/tabdpt/OrmoniTirodei/-1/seed123/fold1/tabdpt_rsf.pkl
C-index train: 0.9198
C-index test:  0.7730
  [ckpt] Loading TABDPT Cox (embedding) from checkpoints/tabdpt/OrmoniTirodei/-1/seed123/fold1/tabdpt_tab_cox.pkl
C-index train: 0.8098
C-index test:  0.7713
  [ckpt] Loading DeepSurv Vanilla baseline from checkpoints/tabdpt/OrmoniTirodei/-1/seed123/fold1/deepsurv_vanilla_baseline.pt
C-index TRAIN: 0.8093
C-index TEST:  0.7892
  [ckpt] Loading DeepSurv Simple baseline from checkpoints/tabdpt/OrmoniTirodei/-1/seed123/fold1/deepsurv_simple_baseline.pt
C-index TRAIN: 0.7735
C-index TEST:  0.7463
  [ckpt] RSF baseline saved → checkpoints/tabdpt/OrmoniTirodei/-1/seed123/fold1/rsf_baseline.pkl
C-index train: 0.9008
C-index test:  0.7935
  [ckpt] Loading Cox baseline from checkpoints/tabdpt/OrmoniTirodei/-1/seed123/fold1/tabdpt_cox.pkl
C-index train: 0.8011
C-index test:  0.7873
X_train shape: (5161, 76), X_test shape: (1291, 76)
Generating TABDPT Embeddings...
<class 'dict'>
Loaded TabDPTModel from checkpoint.
<class 'dict'>
Loaded TabDPTModel from checkpoint.
Successfully generated embeddings with shape: (5161, 768)
  [ckpt] Loading TABDPT DeepSurv Tuned from checkpoints/tabdpt/OrmoniTirodei/-1/seed123/fold2
C-index train: 0.8093
C-index test:  0.7783
  [ckpt] Loading TABDPT RSF Tuned from checkpoints/tabdpt/OrmoniTirodei/-1/seed123/fold2
C-index train: 0.8934
C-index test:  0.7644
  [ckpt] Loading DeepSurv Simple from checkpoints/tabdpt/OrmoniTirodei/-1/seed123/fold2/tabdpt_deepsurv_simple.pt
C-index TRAIN: 0.7801
C-index TEST:  0.7497
  [ckpt] Loading DeepSurv Vanilla from checkpoints/tabdpt/OrmoniTirodei/-1/seed123/fold2/tabdpt_deepsurv_vanilla.pt
C-index TRAIN: 0.8101
C-index TEST:  0.7801
  [ckpt] Loading TABDPT RSF from checkpoints/tabdpt/OrmoniTirodei/-1/seed123/fold2/tabdpt_rsf.pkl
C-index train: 0.9197
C-index test:  0.7632
  [ckpt] Loading TABDPT Cox (embedding) from checkpoints/tabdpt/OrmoniTirodei/-1/seed123/fold2/tabdpt_tab_cox.pkl
C-index train: 0.8133
C-index test:  0.7755
  [ckpt] Loading DeepSurv Vanilla baseline from checkpoints/tabdpt/OrmoniTirodei/-1/seed123/fold2/deepsurv_vanilla_baseline.pt
C-index TRAIN: 0.8038
C-index TEST:  0.8003
  [ckpt] Loading DeepSurv Simple baseline from checkpoints/tabdpt/OrmoniTirodei/-1/seed123/fold2/deepsurv_simple_baseline.pt
C-index TRAIN: 0.7903
C-index TEST:  0.7965
  [ckpt] RSF baseline saved → checkpoints/tabdpt/OrmoniTirodei/-1/seed123/fold2/rsf_baseline.pkl
C-index train: 0.9005
C-index test:  0.7951
  [ckpt] Loading Cox baseline from checkpoints/tabdpt/OrmoniTirodei/-1/seed123/fold2/tabdpt_cox.pkl
C-index train: 0.8003
C-index test:  0.7982
X_train shape: (5162, 76), X_test shape: (1290, 76)
Generating TABDPT Embeddings...
<class 'dict'>
Loaded TabDPTModel from checkpoint.
<class 'dict'>
Loaded TabDPTModel from checkpoint.
Successfully generated embeddings with shape: (5162, 768)
  [ckpt] Loading TABDPT DeepSurv Tuned from checkpoints/tabdpt/OrmoniTirodei/-1/seed123/fold3
C-index train: 0.8110
C-index test:  0.7718
  [ckpt] Loading TABDPT RSF Tuned from checkpoints/tabdpt/OrmoniTirodei/-1/seed123/fold3
C-index train: 0.9194
C-index test:  0.7710
  [ckpt] Loading DeepSurv Simple from checkpoints/tabdpt/OrmoniTirodei/-1/seed123/fold3/tabdpt_deepsurv_simple.pt
C-index TRAIN: 0.7868
C-index TEST:  0.7537
  [ckpt] Loading DeepSurv Vanilla from checkpoints/tabdpt/OrmoniTirodei/-1/seed123/fold3/tabdpt_deepsurv_vanilla.pt
C-index TRAIN: 0.8115
C-index TEST:  0.7628
  [ckpt] Loading TABDPT RSF from checkpoints/tabdpt/OrmoniTirodei/-1/seed123/fold3/tabdpt_rsf.pkl
C-index train: 0.9243
C-index test:  0.7691
  [ckpt] Loading TABDPT Cox (embedding) from checkpoints/tabdpt/OrmoniTirodei/-1/seed123/fold3/tabdpt_tab_cox.pkl
C-index train: 0.8168
C-index test:  0.7651
  [ckpt] Loading DeepSurv Vanilla baseline from checkpoints/tabdpt/OrmoniTirodei/-1/seed123/fold3/deepsurv_vanilla_baseline.pt
C-index TRAIN: 0.8047
C-index TEST:  0.7761
  [ckpt] Loading DeepSurv Simple baseline from checkpoints/tabdpt/OrmoniTirodei/-1/seed123/fold3/deepsurv_simple_baseline.pt
C-index TRAIN: 0.7951
C-index TEST:  0.7792
  [ckpt] RSF baseline saved → checkpoints/tabdpt/OrmoniTirodei/-1/seed123/fold3/rsf_baseline.pkl
C-index train: 0.9064
C-index test:  0.7809
  [ckpt] Loading Cox baseline from checkpoints/tabdpt/OrmoniTirodei/-1/seed123/fold3/tabdpt_cox.pkl
C-index train: 0.8032
C-index test:  0.7835
X_train shape: (5162, 76), X_test shape: (1290, 76)
Generating TABDPT Embeddings...
<class 'dict'>
Loaded TabDPTModel from checkpoint.
<class 'dict'>
Loaded TabDPTModel from checkpoint.
Successfully generated embeddings with shape: (5162, 768)
  [ckpt] Loading TABDPT DeepSurv Tuned from checkpoints/tabdpt/OrmoniTirodei/-1/seed123/fold4
C-index train: 0.8003
C-index test:  0.7864
[Trial 0] START
[Trial 0] fitting...
[Trial 1] START
[Trial 1] fitting...
[Trial 2] START
[Trial 2] fitting...
[Trial 3] START
[Trial 3] fitting...
[Trial 4] START
[Trial 4] fitting...
[Trial 5] START
[Trial 5] fitting...
[Trial 6] START
[Trial 6] fitting...
[Trial 7] START
[Trial 7] fitting...
[Trial 4] done
[Trial 8] START
[Trial 8] fitting...
[Trial 1] done
[Trial 9] START
[Trial 9] fitting...
[Trial 2] done
[Trial 10] START
[Trial 10] fitting...
[Trial 0] done
[Trial 11] START
[Trial 11] fitting...
[Trial 7] done
[Trial 12] START
[Trial 12] fitting...
[Trial 3] done
[Trial 6] done
[Trial 8] done
[Trial 13] START
[Trial 13] fitting...
[Trial 14] START
[Trial 14] fitting...
[Trial 15] START
[Trial 15] fitting...
[Trial 11] done
[Trial 16] START
[Trial 16] fitting...
[Trial 14] done
[Trial 17] START
[Trial 17] fitting...
[Trial 10] done
[Trial 18] START
[Trial 18] fitting...
[Trial 12] done
[Trial 15] done
[Trial 19] START
[Trial 19] fitting...
[Trial 20] START
[Trial 20] fitting...
[Trial 9] done
[Trial 21] START
[Trial 21] fitting...
[Trial 17] done
[Trial 22] START
[Trial 22] fitting...
[Trial 16] done
[Trial 23] START
[Trial 23] fitting...
[Trial 20] done
[Trial 19] done
[Trial 21] done
[Trial 24] START
[Trial 24] fitting...
[Trial 25] START
[Trial 25] fitting...
[Trial 26] START
[Trial 26] fitting...
[Trial 13] done
[Trial 27] START
[Trial 27] fitting...
[Trial 18] done
[Trial 28] START
[Trial 28] fitting...
[Trial 5] done
[Trial 29] START
[Trial 29] fitting...
[Trial 22] done
[Trial 30] START
[Trial 30] fitting...
[Trial 25] done
[Trial 31] START
[Trial 31] fitting...
[Trial 26] done
[Trial 32] START
[Trial 32] fitting...
[Trial 24] done
[Trial 33] START
[Trial 33] fitting...
[Trial 23] done
[Trial 34] START
[Trial 34] fitting...
[Trial 27] done
[Trial 35] START
[Trial 35] fitting...
[Trial 28] done
[Trial 36] START
[Trial 36] fitting...
[Trial 31] done
[Trial 32] done
[Trial 33] done
[Trial 29] done
[Trial 34] done
[Trial 35] done
[Trial 30] done
[Trial 37] START
[Trial 37] fitting...
[Trial 38] START
[Trial 39] START
[Trial 39] fitting...
[Trial 38] fitting...
[Trial 40] START
[Trial 40] fitting...
[Trial 41] START
[Trial 41] fitting...
[Trial 42] START
[Trial 42] fitting...
[Trial 43] START
[Trial 43] fitting...
[Trial 36] done
[Trial 44] START
[Trial 44] fitting...
[Trial 37] done
[Trial 45] START
[Trial 45] fitting...
[Trial 38] done
[Trial 46] START
[Trial 46] fitting...
[Trial 39] done
[Trial 47] START
[Trial 47] fitting...
[Trial 40] done
[Trial 42] done
[Trial 41] done
[Trial 43] done
[Trial 48] START
[Trial 48] fitting...
[Trial 49] START
[Trial 49] fitting...
[Trial 50] START
[Trial 50] fitting...
[Trial 51] START
[Trial 51] fitting...
[Trial 44] done
[Trial 52] START
[Trial 52] fitting...
[Trial 45] done
[Trial 53] START
[Trial 53] fitting...
[Trial 46] done
[Trial 54] START
[Trial 54] fitting...
[Trial 53] done
[Trial 55] START
[Trial 55] fitting...
[Trial 47] done
[Trial 56] START
[Trial 56] fitting...
[Trial 50] done
[Trial 48] done
[Trial 49] done
[Trial 57] START
[Trial 58] START
[Trial 57] fitting...
[Trial 58] fitting...
[Trial 54] done
[Trial 59] START
[Trial 59] fitting...
[Trial 60] START
[Trial 60] fitting...
[Trial 52] done
[Trial 61] START
[Trial 61] fitting...
[Trial 57] done
[Trial 62] START
[Trial 62] fitting...
[Trial 51] done
[Trial 63] START
[Trial 63] fitting...
[Trial 56] done
[Trial 64] START
[Trial 64] fitting...
[Trial 59] done
[Trial 65] START
[Trial 65] fitting...
[Trial 61] done
[Trial 66] START
[Trial 66] fitting...
[Trial 64] done
[Trial 67] START
[Trial 67] fitting...
[Trial 55] done
[Trial 68] START
[Trial 68] fitting...
[Trial 62] done
[Trial 69] START
[Trial 69] fitting...
[Trial 60] done
[Trial 70] START
[Trial 70] fitting...
[Trial 58] done
[Trial 71] START
[Trial 71] fitting...
[Trial 66] done
[Trial 72] START
[Trial 72] fitting...
[Trial 63] done
[Trial 65] done
[Trial 67] done
[Trial 68] done
[Trial 69] done
[Trial 70] done
[Trial 71] done
[Trial 72] done
[Trial 73] START
[Trial 73] fitting...
[Trial 74] START
[Trial 74] fitting...
[Trial 75] START
[Trial 76] START
[Trial 77] START
[Trial 75] fitting...
[Trial 78] START
[Trial 76] fitting...
[Trial 78] fitting...
[Trial 77] fitting...
[Trial 79] START
[Trial 79] fitting...
[Trial 80] START
[Trial 80] fitting...
[Trial 73] done
[Trial 81] START
[Trial 81] fitting...
[Trial 74] done
[Trial 82] START
[Trial 82] fitting...
[Trial 75] done
[Trial 83] START
[Trial 83] fitting...
[Trial 78] done
[Trial 76] done
[Trial 80] done
[Trial 79] done
[Trial 77] done
[Trial 84] START
[Trial 84] fitting...
[Trial 85] START
[Trial 85] fitting...
[Trial 86] START
[Trial 86] fitting...
[Trial 87] START
[Trial 87] fitting...
[Trial 88] START
[Trial 88] fitting...
[Trial 81] done
[Trial 89] START
[Trial 89] fitting...
[Trial 82] done
[Trial 90] START
[Trial 90] fitting...
[Trial 83] done
[Trial 91] START
[Trial 91] fitting...
[Trial 85] done
[Trial 84] done
[Trial 87] done
[Trial 86] done
[Trial 88] done
[Trial 91] done
[Trial 89] done
[Trial 90] done
[Trial 92] START
[Trial 92] fitting...
[Trial 93] START
[Trial 93] fitting...
[Trial 94] START
[Trial 95] START
[Trial 94] fitting...
[Trial 96] START
[Trial 95] fitting...
[Trial 96] fitting...
[Trial 97] START
[Trial 97] fitting...
[Trial 98] START
[Trial 98] fitting...
[Trial 99] START
[Trial 99] fitting...
[Trial 92] done
[Trial 95] done
[Trial 96] done
[Trial 99] done
[Trial 94] done
[Trial 98] done
[Trial 93] done
[Trial 97] done
  [ckpt] Params saved → checkpoints/tabdpt/OrmoniTirodei/-1/seed123/fold4/tabdpt_rsf_tuned_params.json
  [ckpt] TABDPT RSF Tuned saved → checkpoints/tabdpt/OrmoniTirodei/-1/seed123/fold4/tabdpt_rsf_tuned.pkl
C-index train: 0.9005
C-index test:  0.7846
  [surv] Saved → survival_predictions/tabdpt/OrmoniTirodei/-1/seed123/fold4/tabdpt_rsf_tuned.pkl
  [ckpt] Loading DeepSurv Simple from checkpoints/tabdpt/OrmoniTirodei/-1/seed123/fold4/tabdpt_deepsurv_simple.pt
C-index TRAIN: 0.7982
C-index TEST:  0.7831
  [ckpt] Loading DeepSurv Vanilla from checkpoints/tabdpt/OrmoniTirodei/-1/seed123/fold4/tabdpt_deepsurv_vanilla.pt
C-index TRAIN: 0.7976
C-index TEST:  0.7876
  [ckpt] Loading TABDPT RSF from checkpoints/tabdpt/OrmoniTirodei/-1/seed123/fold4/tabdpt_rsf.pkl
C-index train: 0.9187
C-index test:  0.7865
  [ckpt] Loading TABDPT Cox (embedding) from checkpoints/tabdpt/OrmoniTirodei/-1/seed123/fold4/tabdpt_tab_cox.pkl
C-index train: 0.8083
C-index test:  0.7803
  [ckpt] Loading DeepSurv Vanilla baseline from checkpoints/tabdpt/OrmoniTirodei/-1/seed123/fold4/deepsurv_vanilla_baseline.pt
C-index TRAIN: 0.7855
C-index TEST:  0.7830
  [ckpt] Loading DeepSurv Simple baseline from checkpoints/tabdpt/OrmoniTirodei/-1/seed123/fold4/deepsurv_simple_baseline.pt
C-index TRAIN: 0.7864
C-index TEST:  0.7859
  [ckpt] RSF baseline saved → checkpoints/tabdpt/OrmoniTirodei/-1/seed123/fold4/rsf_baseline.pkl
C-index train: 0.9020
C-index test:  0.8094
  [ckpt] Loading Cox baseline from checkpoints/tabdpt/OrmoniTirodei/-1/seed123/fold4/tabdpt_cox.pkl
C-index train: 0.7981
C-index test:  0.8023
X_train shape: (5162, 76), X_test shape: (1290, 76)
Generating TABDPT Embeddings...
<class 'dict'>
Loaded TabDPTModel from checkpoint.
<class 'dict'>
Loaded TabDPTModel from checkpoint.
Successfully generated embeddings with shape: (5162, 768)
0:	[3s / 3s],		train_loss: 4.5967
0:	[3s / 3s],		train_loss: 5.1856
1:	[0s / 4s],		train_loss: 4.4049
1:	[0s / 4s],		train_loss: 4.7059
2:	[0s / 4s],		train_loss: 4.3290
2:	[0s / 4s],		train_loss: 4.6140
0:	[4s / 4s],		train_loss: 4.6759
0:	[4s / 4s],		train_loss: 4.7065
0:	[4s / 4s],		train_loss: 4.6096
0:	[4s / 4s],		train_loss: 4.6196
0:	[4s / 4s],		train_loss: 5.0426
0:	[4s / 4s],		train_loss: 4.5102
3:	[0s / 4s],		train_loss: 4.3014
3:	[0s / 4s],		train_loss: 4.5355
4:	[0s / 4s],		train_loss: 4.2466
4:	[0s / 4s],		train_loss: 4.5366
5:	[0s / 4s],		train_loss: 4.2501
5:	[0s / 5s],		train_loss: 4.4986
1:	[0s / 5s],		train_loss: 4.5196
1:	[0s / 5s],		train_loss: 4.4048
1:	[0s / 5s],		train_loss: 4.5276
1:	[0s / 5s],		train_loss: 4.4511
6:	[0s / 5s],		train_loss: 4.2093
6:	[0s / 5s],		train_loss: 4.4807
1:	[0s / 5s],		train_loss: 4.3489
1:	[0s / 5s],		train_loss: 4.5079
7:	[0s / 5s],		train_loss: 4.2124
7:	[0s / 5s],		train_loss: 4.4541
8:	[0s / 5s],		train_loss: 4.1670
8:	[0s / 5s],		train_loss: 4.4258
2:	[0s / 5s],		train_loss: 4.4933
2:	[0s / 5s],		train_loss: 4.4564
2:	[0s / 5s],		train_loss: 4.3749
2:	[0s / 5s],		train_loss: 4.4042
9:	[0s / 5s],		train_loss: 4.1408
9:	[0s / 5s],		train_loss: 4.4308
2:	[0s / 5s],		train_loss: 4.3246
10:	[0s / 6s],		train_loss: 4.1226
10:	[0s / 6s],		train_loss: 4.4151
2:	[0s / 6s],		train_loss: 4.4567
11:	[0s / 6s],		train_loss: 4.0882
11:	[0s / 6s],		train_loss: 4.3710
3:	[0s / 6s],		train_loss: 4.3867
3:	[0s / 6s],		train_loss: 4.3369
3:	[0s / 6s],		train_loss: 4.3373
3:	[0s / 6s],		train_loss: 4.4216
12:	[0s / 6s],		train_loss: 4.0854
12:	[0s / 6s],		train_loss: 4.3558
13:	[0s / 6s],		train_loss: 4.0445
13:	[0s / 6s],		train_loss: 4.3588
3:	[0s / 6s],		train_loss: 4.3055
14:	[0s / 6s],		train_loss: 4.0314
14:	[0s / 6s],		train_loss: 4.3438
4:	[0s / 7s],		train_loss: 4.4322
4:	[0s / 7s],		train_loss: 4.3369
4:	[0s / 7s],		train_loss: 4.3766
4:	[0s / 7s],		train_loss: 4.3135
15:	[0s / 7s],		train_loss: 3.9887
15:	[0s / 7s],		train_loss: 4.3313
3:	[1s / 7s],		train_loss: 4.4100
16:	[0s / 7s],		train_loss: 3.9528
16:	[0s / 7s],		train_loss: 4.3175
4:	[0s / 7s],		train_loss: 4.3054
17:	[0s / 7s],		train_loss: 3.9598
17:	[0s / 7s],		train_loss: 4.3178
5:	[0s / 7s],		train_loss: 4.3083
5:	[0s / 7s],		train_loss: 4.3800
5:	[0s / 7s],		train_loss: 4.3202
5:	[0s / 7s],		train_loss: 4.3698
18:	[0s / 7s],		train_loss: 3.9429
18:	[0s / 7s],		train_loss: 4.2997
19:	[0s / 8s],		train_loss: 3.8844
19:	[0s / 8s],		train_loss: 4.2771
6:	[0s / 8s],		train_loss: 4.2942
20:	[0s / 8s],		train_loss: 3.8704
20:	[0s / 8s],		train_loss: 4.2837
7:	[0s / 8s],		train_loss: 4.3022
6:	[0s / 8s],		train_loss: 4.3488
21:	[0s / 8s],		train_loss: 3.8803
21:	[0s / 8s],		train_loss: 4.2901
6:	[0s / 8s],		train_loss: 4.3409
6:	[0s / 8s],		train_loss: 4.3226
8:	[0s / 8s],		train_loss: 4.2925
5:	[1s / 8s],		train_loss: 4.3090
22:	[0s / 8s],		train_loss: 3.8427
22:	[0s / 8s],		train_loss: 4.2734
9:	[0s / 8s],		train_loss: 4.2795
23:	[0s / 9s],		train_loss: 3.8170
23:	[0s / 9s],		train_loss: 4.2457
7:	[0s / 9s],		train_loss: 4.3886
10:	[0s / 9s],		train_loss: 4.3007
24:	[0s / 9s],		train_loss: 3.8171
24:	[0s / 9s],		train_loss: 4.2468
11:	[0s / 9s],		train_loss: 4.2537
25:	[0s / 9s],		train_loss: 3.7856
25:	[0s / 9s],		train_loss: 4.2338
4:	[2s / 9s],		train_loss: 4.3968
8:	[0s / 9s],		train_loss: 4.3356
12:	[0s / 9s],		train_loss: 4.2965
7:	[0s / 9s],		train_loss: 4.2837
26:	[0s / 9s],		train_loss: 3.7896
26:	[0s / 9s],		train_loss: 4.2399
13:	[0s / 9s],		train_loss: 4.2644
27:	[0s / 9s],		train_loss: 3.7875
27:	[0s / 9s],		train_loss: 4.2047
9:	[0s / 9s],		train_loss: 4.3602
28:	[0s / 10s],		train_loss: 3.7629
28:	[0s / 10s],		train_loss: 4.2336
14:	[0s / 10s],		train_loss: 4.2550
7:	[1s / 10s],		train_loss: 4.3337
29:	[0s / 10s],		train_loss: 3.7161
29:	[0s / 10s],		train_loss: 4.1876
15:	[0s / 10s],		train_loss: 4.2693
10:	[0s / 10s],		train_loss: 4.3204
30:	[0s / 10s],		train_loss: 3.6375
30:	[0s / 10s],		train_loss: 4.2120
16:	[0s / 10s],		train_loss: 4.2586
8:	[0s / 10s],		train_loss: 4.3015
31:	[0s / 10s],		train_loss: 3.7035
31:	[0s / 10s],		train_loss: 4.1968
17:	[0s / 10s],		train_loss: 4.2660
32:	[0s / 10s],		train_loss: 3.7002
32:	[0s / 10s],		train_loss: 4.1856
11:	[0s / 10s],		train_loss: 4.3267
18:	[0s / 10s],		train_loss: 4.2492
33:	[0s / 10s],		train_loss: 3.6459
33:	[0s / 10s],		train_loss: 4.1493
19:	[0s / 10s],		train_loss: 4.2362
34:	[0s / 11s],		train_loss: 3.5914
34:	[0s / 11s],		train_loss: 4.1808
12:	[0s / 11s],		train_loss: 4.3466
9:	[0s / 11s],		train_loss: 4.2851
20:	[0s / 11s],		train_loss: 4.2328
35:	[0s / 11s],		train_loss: 3.5265
35:	[0s / 11s],		train_loss: 4.1786
21:	[0s / 11s],		train_loss: 4.2173
36:	[0s / 11s],		train_loss: 3.5272
36:	[0s / 11s],		train_loss: 4.1545
13:	[0s / 11s],		train_loss: 4.3056
8:	[1s / 11s],		train_loss: 4.3459
22:	[0s / 11s],		train_loss: 4.2210
37:	[0s / 11s],		train_loss: 3.5640
37:	[0s / 11s],		train_loss: 4.1451
6:	[3s / 11s],		train_loss: 4.2820
23:	[0s / 11s],		train_loss: 4.2006
38:	[0s / 11s],		train_loss: 3.5164
38:	[0s / 11s],		train_loss: 4.1258
14:	[0s / 12s],		train_loss: 4.2773
10:	[0s / 12s],		train_loss: 4.2931
24:	[0s / 12s],		train_loss: 4.2179
39:	[0s / 12s],		train_loss: 3.5516
39:	[0s / 12s],		train_loss: 4.1269
40:	[0s / 12s],		train_loss: 3.5589
40:	[0s / 12s],		train_loss: 4.1105
25:	[0s / 12s],		train_loss: 4.1846
15:	[0s / 12s],		train_loss: 4.2959
41:	[0s / 12s],		train_loss: 3.5455
41:	[0s / 12s],		train_loss: 4.1417
26:	[0s / 12s],		train_loss: 4.1879
16:	[0s / 12s],		train_loss: 4.2696
42:	[0s / 12s],		train_loss: 3.5096
42:	[0s / 12s],		train_loss: 4.1147
27:	[0s / 12s],		train_loss: 4.1633
43:	[0s / 13s],		train_loss: 3.4908
43:	[0s / 13s],		train_loss: 4.1173
11:	[0s / 13s],		train_loss: 4.3153
28:	[0s / 13s],		train_loss: 4.1971
44:	[0s / 13s],		train_loss: 3.4761
44:	[0s / 13s],		train_loss: 4.0839
17:	[0s / 13s],		train_loss: 4.2777
29:	[0s / 13s],		train_loss: 4.2016
9:	[1s / 13s],		train_loss: 4.3339
45:	[0s / 13s],		train_loss: 3.4649
45:	[0s / 13s],		train_loss: 4.0661
30:	[0s / 13s],		train_loss: 4.1943
46:	[0s / 13s],		train_loss: 3.4478
46:	[0s / 13s],		train_loss: 4.0595
18:	[0s / 13s],		train_loss: 4.2803
31:	[0s / 13s],		train_loss: 4.1744
12:	[0s / 13s],		train_loss: 4.2656
47:	[0s / 13s],		train_loss: 3.4277
47:	[0s / 13s],		train_loss: 4.0531
32:	[0s / 14s],		train_loss: 4.1662
48:	[0s / 14s],		train_loss: 3.4246
48:	[0s / 14s],		train_loss: 4.0595
19:	[0s / 14s],		train_loss: 4.2672
49:	[0s / 14s],		train_loss: 3.4195
49:	[0s / 14s],		train_loss: 4.0484
33:	[0s / 14s],		train_loss: 4.1416
50:	[0s / 14s],		train_loss: 3.4001
50:	[0s / 14s],		train_loss: 4.0234
34:	[0s / 14s],		train_loss: 4.1492
20:	[0s / 14s],		train_loss: 4.2600
51:	[0s / 14s],		train_loss: 3.3889
13:	[0s / 14s],		train_loss: 4.2658
51:	[0s / 14s],		train_loss: 4.0