[I 2026-07-01 07:29:38,154] Trial 37 finished with value: 0.7108206643895014 and parameters: {'num_nodes': [128], 'dropout': 0.16557409874968676, 'learning_rate': 0.0019278649724825663, 'batch_norm': True}. Best is trial 3 with value: 0.8108369571214855.
/scratch.hpc/luca.cotugno/Foundation_model_clinical_data/test_tabular_model.py:481: UserWarning: Choices for a categorical distribution should be a tuple of None, bool, int, float and str for persistent storage but contains [32] which is of type list.
  num_nodes  = trial.suggest_categorical("num_nodes", [[32], [64], [128], [64, 32], [128, 64]])
/scratch.hpc/luca.cotugno/Foundation_model_clinical_data/test_tabular_model.py:481: UserWarning: Choices for a categorical distribution should be a tuple of None, bool, int, float and str for persistent storage but contains [64] which is of type list.
  num_nodes  = trial.suggest_categorical("num_nodes", [[32], [64], [128], [64, 32], [128, 64]])
/scratch.hpc/luca.cotugno/Foundation_model_clinical_data/test_tabular_model.py:481: UserWarning: Choices for a categorical distribution should be a tuple of None, bool, int, float and str for persistent storage but contains [128] which is of type list.
  num_nodes  = trial.suggest_categorical("num_nodes", [[32], [64], [128], [64, 32], [128, 64]])
/scratch.hpc/luca.cotugno/Foundation_model_clinical_data/test_tabular_model.py:481: UserWarning: Choices for a categorical distribution should be a tuple of None, bool, int, float and str for persistent storage but contains [64, 32] which is of type list.
  num_nodes  = trial.suggest_categorical("num_nodes", [[32], [64], [128], [64, 32], [128, 64]])
/scratch.hpc/luca.cotugno/Foundation_model_clinical_data/test_tabular_model.py:481: UserWarning: Choices for a categorical distribution should be a tuple of None, bool, int, float and str for persistent storage but contains [128, 64] which is of type list.
  num_nodes  = trial.suggest_categorical("num_nodes", [[32], [64], [128], [64, 32], [128, 64]])

75:	[0s / 45s],		train_loss: 4.0652
92:	[0s / 47s],		train_loss: 4.0477
59:	[0s / 30s],		train_loss: 3.9239
85:	[1s / 1m:32s],		train_loss: 4.0643
55:	[1s / 1m:51s],		train_loss: 3.9924
93:	[0s / 48s],		train_loss: 4.0221
76:	[0s / 46s],		train_loss: 4.0832
60:	[0s / 30s],		train_loss: 3.9454
94:	[0s / 48s],		train_loss: 4.0176
61:	[0s / 31s],		train_loss: 3.9375
77:	[0s / 46s],		train_loss: 4.1012
86:	[0s / 1m:33s],		train_loss: 4.0706
95:	[0s / 49s],		train_loss: 3.9978
62:	[0s / 31s],		train_loss: 3.9130
78:	[0s / 47s],		train_loss: 4.0600
96:	[0s / 49s],		train_loss: 4.0099
63:	[0s / 32s],		train_loss: 3.9250
56:	[1s / 1m:53s],		train_loss: 4.0121
87:	[1s / 1m:34s],		train_loss: 4.0622
79:	[0s / 48s],		train_loss: 4.0850
88:	[3s / 5m:36s],		train_loss: 3.6919
64:	[0s / 33s],		train_loss: 3.9000
97:	[0s / 50s],		train_loss: 4.0249
80:	[0s / 48s],		train_loss: 4.0709
65:	[0s / 33s],		train_loss: 3.9496
98:	[0s / 50s],		train_loss: 4.0667
88:	[1s / 1m:35s],		train_loss: 4.0610
81:	[0s / 49s],		train_loss: 4.0550
66:	[0s / 34s],		train_loss: 3.9364
26:	[15s / 5m:37s],		train_loss: 4.1401
99:	[0s / 51s],		train_loss: 4.0292
57:	[2s / 1m:55s],		train_loss: 3.9873
67:	[0s / 34s],		train_loss: 3.9132
89:	[1s / 1m:36s],		train_loss: 4.0552
82:	[0s / 50s],		train_loss: 4.0569
0:	[0s / 0s],		train_loss: 4.8663
68:	[0s / 35s],		train_loss: 3.9009
1:	[0s / 1s],		train_loss: 4.5473
83:	[0s / 50s],		train_loss: 4.0406
69:	[0s / 35s],		train_loss: 3.9082
90:	[1s / 1m:37s],		train_loss: 4.0603
2:	[0s / 1s],		train_loss: 4.4606
84:	[0s / 51s],		train_loss: 4.0647
70:	[0s / 36s],		train_loss: 3.8768
3:	[0s / 2s],		train_loss: 4.4132
58:	[2s / 1m:57s],		train_loss: 3.9753
89:	[4s / 5m:40s],		train_loss: 3.7107
71:	[0s / 37s],		train_loss: 3.8943
85:	[0s / 52s],		train_loss: 4.0518
49:	[7s / 5m:40s],		train_loss: 3.8543
91:	[1s / 1m:38s],		train_loss: 4.0809
4:	[0s / 3s],		train_loss: 4.3901
72:	[0s / 37s],		train_loss: 3.8402
86:	[0s / 53s],		train_loss: 4.0500
5:	[0s / 3s],		train_loss: 4.3567
73:	[0s / 38s],		train_loss: 3.8588
92:	[1s / 1m:40s],		train_loss: 4.0620
87:	[0s / 53s],		train_loss: 4.0381
6:	[0s / 4s],		train_loss: 4.3400
74:	[0s / 38s],		train_loss: 3.8849
59:	[2s / 1m:59s],		train_loss: 3.9591
7:	[0s / 4s],		train_loss: 4.3222
75:	[0s / 39s],		train_loss: 3.8927
88:	[0s / 54s],		train_loss: 4.0710
93:	[1s / 1m:41s],		train_loss: 4.0684
76:	[0s / 39s],		train_loss: 3.8913
8:	[0s / 5s],		train_loss: 4.3057
89:	[0s / 55s],		train_loss: 4.0665
77:	[0s / 40s],		train_loss: 3.8693
9:	[0s / 6s],		train_loss: 4.2774
90:	[0s / 56s],		train_loss: 4.0476
78:	[0s / 41s],		train_loss: 3.8441
94:	[1s / 1m:42s],		train_loss: 4.0731
10:	[0s / 6s],		train_loss: 4.2940
90:	[4s / 5m:44s],		train_loss: 3.7096
91:	[0s / 57s],		train_loss: 4.0552
79:	[0s / 41s],		train_loss: 3.8725
60:	[2s / 2m:2s],		train_loss: 3.9861
11:	[0s / 7s],		train_loss: 4.2651
92:	[0s / 57s],		train_loss: 4.0268
80:	[0s / 42s],		train_loss: 3.8868
12:	[0s / 8s],		train_loss: 4.2379
95:	[1s / 1m:44s],		train_loss: 4.0479
81:	[0s / 42s],		train_loss: 3.8389
93:	[0s / 58s],		train_loss: 4.0427
13:	[0s / 8s],		train_loss: 4.2495
82:	[0s / 43s],		train_loss: 3.8354
94:	[0s / 59s],		train_loss: 4.0801
14:	[0s / 9s],		train_loss: 4.2290
96:	[1s / 1m:45s],		train_loss: 4.0499
61:	[2s / 2m:4s],		train_loss: 3.9602
83:	[0s / 44s],		train_loss: 3.8826
15:	[0s / 10s],		train_loss: 4.2257
95:	[0s / 59s],		train_loss: 4.0325
84:	[0s / 44s],		train_loss: 3.8410
97:	[1s / 1m:46s],		train_loss: 4.0327
16:	[0s / 10s],		train_loss: 4.2306
96:	[0s / 1m:0s],		train_loss: 4.0350
85:	[0s / 45s],		train_loss: 3.8179
17:	[0s / 11s],		train_loss: 4.2146
91:	[4s / 5m:48s],		train_loss: 3.6754
86:	[0s / 45s],		train_loss: 3.8467
97:	[0s / 1m:1s],		train_loss: 4.0520
62:	[1s / 2m:6s],		train_loss: 3.9663
50:	[8s / 5m:49s],		train_loss: 3.8400
18:	[0s / 11s],		train_loss: 4.1848
98:	[1s / 1m:47s],		train_loss: 4.0641
87:	[0s / 46s],		train_loss: 3.8309
98:	[0s / 1m:1s],		train_loss: 4.0421
19:	[0s / 12s],		train_loss: 4.1718
88:	[0s / 46s],		train_loss: 3.8286
99:	[0s / 1m:2s],		train_loss: 4.0063
99:	[1s / 1m:48s],		train_loss: 4.0313
89:	[0s / 47s],		train_loss: 3.8167
20:	[0s / 12s],		train_loss: 4.1651
90:	[0s / 47s],		train_loss: 3.7976
21:	[0s / 13s],		train_loss: 4.1879
0:	[0s / 0s],		train_loss: 4.9827
63:	[2s / 2m:8s],		train_loss: 3.9600
91:	[0s / 48s],		train_loss: 3.7994
22:	[0s / 13s],		train_loss: 4.1555
0:	[1s / 1s],		train_loss: 4.9312
92:	[0s / 48s],		train_loss: 3.8261
1:	[0s / 1s],		train_loss: 4.5561
23:	[0s / 14s],		train_loss: 4.1361
93:	[0s / 49s],		train_loss: 3.8651
24:	[0s / 14s],		train_loss: 4.1395
92:	[3s / 5m:52s],		train_loss: 3.6973
2:	[0s / 2s],		train_loss: 4.4686
94:	[0s / 49s],		train_loss: 3.8043
27:	[15s / 5m:53s],		train_loss: 4.1270
25:	[0s / 15s],		train_loss: 4.1160
1:	[1s / 2s],		train_loss: 4.5577
95:	[0s / 50s],		train_loss: 3.7652
3:	[0s / 2s],		train_loss: 4.4307
26:	[0s / 16s],		train_loss: 4.0989
64:	[2s / 2m:11s],		train_loss: 3.9396
96:	[0s / 50s],		train_loss: 3.8463
27:	[0s / 16s],		train_loss: 4.1046
4:	[0s / 3s],		train_loss: 4.3906
2:	[1s / 3s],		train_loss: 4.4716
97:	[0s / 51s],		train_loss: 3.8134
28:	[0s / 17s],		train_loss: 4.1238
98:	[0s / 51s],		train_loss: 3.7609
5:	[0s / 4s],		train_loss: 4.3586
29:	[0s / 17s],		train_loss: 4.0830
99:	[0s / 52s],		train_loss: 3.7413
6:	[0s / 5s],		train_loss: 4.3176
65:	[1s / 2m:13s],		train_loss: 3.9455
3:	[1s / 5s],		train_loss: 4.4447
30:	[0s / 18s],		train_loss: 4.1082
0:	[0s / 0s],		train_loss: 4.6894
93:	[3s / 5m:56s],		train_loss: 3.6936
31:	[0s / 18s],		train_loss: 4.0649
51:	[7s / 5m:56s],		train_loss: 3.8606
7:	[0s / 5s],		train_loss: 4.3177
1:	[0s / 0s],		train_loss: 4.4598
32:	[0s / 19s],		train_loss: 4.0466
4:	[1s / 6s],		train_loss: 4.3874
2:	[0s / 1s],		train_loss: 4.3825
8:	[0s / 6s],		train_loss: 4.3032
33:	[0s / 19s],		train_loss: 4.0484
3:	[0s / 1s],		train_loss: 4.3661
66:	[1s / 2m:15s],		train_loss: 3.9286
9:	[0s / 7s],		train_loss: 4.2976
4:	[0s / 2s],		train_loss: 4.3469
34:	[0s / 20s],		train_loss: 4.0471
5:	[1s / 7s],		train_loss: 4.3640
5:	[0s / 2s],		train_loss: 4.3144
35:	[0s / 20s],		train_loss: 4.0437
10:	[0s / 7s],		train_loss: 4.2583
6:	[0s / 2s],		train_loss: 4.2955
36:	[0s / 21s],		train_loss: 4.0293
7:	[0s / 3s],		train_loss: 4.2837
11:	[0s / 8s],		train_loss: 4.2478
6:	[1s / 8s],		train_loss: 4.3287
37:	[0s / 21s],		train_loss: 4.0230
8:	[0s / 3s],		train_loss: 4.2726
94:	[3s / 5m:59s],		train_loss: 3.6995
12:	[0s / 9s],		train_loss: 4.2348
67:	[2s / 2m:17s],		train_loss: 3.9357
38:	[0s / 22s],		train_loss: 4.0127
9:	[0s / 4s],		train_loss: 4.2699
7:	[1s / 9s],		train_loss: 4.3267
10:	[0s / 4s],		train_loss: 4.2422
39:	[0s / 22s],		train_loss: 3.9994
13:	[0s / 9s],		train_loss: 4.2279
11:	[0s / 4s],		train_loss: 4.2176
40:	[0s / 23s],		train_loss: 3.9899
12:	[0s / 5s],		train_loss: 4.2082
14:	[0s / 10s],		train_loss: 4.2346
41:	[0s / 23s],		train_loss: 3.9686
8:	[1s / 10s],		train_loss: 4.3282
13:	[0s / 5s],		train_loss: 4.2005
68:	[1s / 2m:18s],		train_loss: 3.9230
15:	[0s / 11s],		train_loss: 4.1957
42:	[0s / 24s],		train_loss: 3.9462
14:	[0s / 6s],		train_loss: 4.1863
43:	[0s / 24s],		train_loss: 3.9341
15:	[0s / 6s],		train_loss: 4.1832
16:	[0s / 11s],		train_loss: 4.2041
52:	[6s / 6m:2s],		train_loss: 3.8410
9:	[1s / 12s],		train_loss: 4.2874
44:	[0s / 25s],		train_loss: 3.9138
16:	[0s / 7s],		train_loss: 4.1547
17:	[0s / 12s],		train_loss: 4.1949
95:	[3s / 6m:3s],		train_loss: 3.6539
17:	[0s / 7s],		train_loss: 4.1632
45:	[0s / 25s],		train_loss: 3.9385
18:	[0s / 8s],		train_loss: 4.1455
69:	[2s / 2m:21s],		train_loss: 3.9292
18:	[0s / 13s],		train_loss: 4.1688
46:	[0s / 26s],		train_loss: 3.9367
10:	[1s / 13s],		train_loss: 4.2747
19:	[0s / 8s],		train_loss: 4.1232
47:	[0s / 26s],		train_loss: 3.9236
19:	[0s / 13s],		train_loss: 4.1477
20:	[0s / 8s],		train_loss: 4.1225
48:	[0s / 27s],		train_loss: 3.9309
11:	[1s / 14s],		train_loss: 4.2933
21:	[0s / 9s],		train_loss: 4.1258
20:	[0s / 14s],		train_loss: 4.1374
49:	[0s / 27s],		train_loss: 3.8962
22:	[0s / 9s],		train_loss: 4.0989
23:	[0s / 10s],		train_loss: 4.1023
50:	[0s / 28s],		train_loss: 3.8782
70:	[2s / 2m:23s],		train_loss: 3.9225
21:	[0s / 15s],		train_loss: 4.1397
12:	[1s / 15s],		train_loss: 4.2916
24:	[0s / 10s],		train_loss: 4.0884
51:	[0s / 28s],		train_loss: 3.9015
22:	[0s / 16s],		train_loss: 4.1215
25:	[0s / 11s],		train_loss: 4.0651
52:	[0s / 29s],		train_loss: 3.8886
26:	[0s / 11s],		train_loss: 4.0762
23:	[0s / 16s],		train_loss: 4.1464
13:	[1s / 16s],		train_loss: 4.2584
53:	[0s / 29s],		train_loss: 3.9137
96:	[4s / 6m:7s],		train_loss: 3.6474
27:	[0s / 11s],		train_loss: 4.0617
28:	[14s / 6m:7s],		train_loss: 4.1251
54:	[0s / 30s],		train_loss: 3.8599
28:	[0s / 12s],		train_loss: 4.0432
24:	[0s / 17s],		train_loss: 4.1197
71:	[2s / 2m:25s],		train_loss: 3.9055
55:	[0s / 31s],		train_loss: 3.8586
29:	[0s / 12s],		train_loss: 4.0287
14:	[1s / 18s],		train_loss: 4.2336
25:	[0s / 18s],		train_loss: 4.1068
30:	[0s / 13s],		train_loss: 4.0228
56:	[0s / 31s],		train_loss: 3.8767
31:	[0s / 13s],		train_loss: 4.0130
26:	[0s / 19s],		train_loss: 4.0882
57:	[0s / 32s],		train_loss: 3.8822
15:	[1s / 19s],		train_loss: 4.2327
32:	[0s / 14s],		train_loss: 4.0306
58:	[0s / 32s],		train_loss: 3.8194
27:	[0s / 19s],		train_loss: 4.0796
33:	[0s / 14s],		train_loss: 3.9968
72:	[2s / 2m:27s],		train_loss: 3.8888
59:	[0s / 33s],		train_loss: 3.8044
34:	[0s / 15s],		train_loss: 3.9916
28:	[0s / 20s],		train_loss: 4.0795
97:	[3s / 6m:11s],		train_loss: 3.6522
53:	[8s / 6m:11s],		train_loss: 3.8405
16:	[1s / 20s],		train_loss: 4.2420
60:	[0s / 33s],		train_loss: 3.7829
35:	[0s / 15s],		train_loss: 3.9861
36:	[0s / 15s],		train_loss: 3.9858
61:	[0s / 34s],		train_loss: 3.7965
29:	[0s / 21s],		train_loss: 4.0549
37:	[0s / 16s],		train_loss: 3.9852
62:	[0s / 34s],		train_loss: 3.7506
30:	[0s / 21s],		train_loss: 4.0412
73:	[1s / 2m:29s],		train_loss: 3.8959
17:	[1s / 21s],		train_loss: 4.2039
38:	[0s / 16s],		train_loss: 3.9730
63:	[0s / 35s],		train_loss: 3.7696
39:	[0s / 17s],		train_loss: 3.9708
31:	[0s / 22s],		train_loss: 3.9902
64:	[0s / 35s],		train_loss: 3.7524
40:	[0s / 17s],		train_loss: 3.9210
18:	[1s / 23s],		train_loss: 4.1760
65:	[0s / 36s],		train_loss: 3.7438
41:	[0s / 18s],		train_loss: 3.9378
32:	[0s / 23s],		train_loss: 4.0159
42:	[0s / 18s],		train_loss: 3.9277
66:	[0s / 36s],		train_loss: 3.7535
33:	[0s / 24s],		train_loss: 4.0126
74:	[2s / 2m:32s],		train_loss: 3.8965
43:	[0s / 19s],		train_loss: 3.9336
67:	[0s / 37s],		train_loss: 3.7471
19:	[1s / 24s],		train_loss: 4.1682
98:	[4s / 6m:15s],		train_loss: 3.5991
44:	[0s / 19s],		train_loss: 3.9109
68:	[0s / 38s],		train_loss: 3.7016
34:	[0s / 25s],		train_loss: 3.9868
45:	[0s / 20s],		train_loss: 3.9111
69:	[0s / 38s],		train_loss: 3.6968
46:	[0s / 20s],		train_loss: 3.8921
35:	[0s / 26s],		train_loss: 3.9678
20:	[1s / 26s],		train_loss: 4.1587
70:	[0s / 39s],		train_loss: 3.7065
47:	[0s / 21s],		train_loss: 3.8909
75:	[2s / 2m:34s],		train_loss: 3.8835
36:	[0s / 26s],		train_loss: 4.0015
48:	[0s / 21s],		train_loss: 3.8832
71:	[0s / 40s],		train_loss: 3.6933
49:	[0s / 22s],		train_loss: 3.8721
21:	[1s / 27s],		train_loss: 4.1901
72:	[0s / 40s],		train_loss: 3.7146
37:	[0s / 27s],		train_loss: 3.9807
50:	[0s / 22s],		train_loss: 3.8543
54:	[7s / 6m:19s],		train_loss: 3.8135
73:	[0s / 41s],		train_loss: 3.6819
38:	[0s / 28s],		train_loss: 3.9543
51:	[0s / 23s],		train_loss: 3.8712
99:	[4s / 6m:19s],		train_loss: 3.6614
74:	[0s / 42s],		train_loss: 3.6778
22:	[1s / 29s],		train_loss: 4.1817
52:	[0s / 24s],		train_loss: 3.8511
76:	[2s / 2m:37s],		train_loss: 3.8819
39:	[1s / 29s],		train_loss: 3.9166
75:	[0s / 42s],		train_loss: 3.6943
53:	[0s / 24s],		train_loss: 3.8315
54:	[0s / 25s],		train_loss: 3.8466
76:	[0s / 43s],		train_loss: 3.6769
40:	[0s / 30s],		train_loss: 3.9282
23:	[1s / 30s],		train_loss: 4.1656
55:	[0s / 25s],		train_loss: 3.8341
77:	[0s / 43s],		train_loss: 3.6679
41:	[0s / 31s],		train_loss: 3.9317
56:	[0s / 26s],		train_loss: 3.8174
77:	[1s / 2m:39s],		train_loss: 3.8837
78:	[0s / 44s],		train_loss: 3.6493
57:	[0s / 26s],		train_loss: 3.8203
24:	[1s / 31s],		train_loss: 4.1524
42:	[0s / 31s],		train_loss: 3.9368
79:	[0s / 44s],		train_loss: 3.6164
58:	[0s / 26s],		train_loss: 3.8186
80:	[0s / 45s],		train_loss: 3.6349
59:	[0s / 27s],		train_loss: 3.8059
43:	[0s / 32s],		train_loss: 3.9173
60:	[0s / 27s],		train_loss: 3.8033
81:	[0s / 45s],		train_loss: 3.6125
25:	[1s / 32s],		train_loss: 4.0996
44:	[0s / 33s],		train_loss: 3.8940
61:	[0s / 28s],		train_loss: 3.7892
29:	[16s / 6m:24s],		train_loss: 4.1337
78:	[2s / 2m:41s],		train_loss: 3.8886
82:	[0s / 46s],		train_loss: 3.6239
0:	[4s / 4s],		train_loss: 4.8730
62:	[0s / 28s],		train_loss: 3.7949
83:	[0s / 46s],		train_loss: 3.5982
45:	[0s / 33s],		train_loss: 3.9012
26:	[1s / 34s],		train_loss: 4.1097
63:	[0s / 29s],		train_loss: 3.8078
84:	[0s / 47s],		train_loss: 3.5979
64:	[0s / 29s],		train_loss: 3.7629
46:	[0s / 34s],		train_loss: 3.8935
85:	[0s / 48s],		train_loss: 3.5925
65:	[0s / 30s],		train_loss: 3.7307
27:	[1s / 35s],		train_loss: 4.1076
47:	[0s / 35s],		train_loss: 3.8482
66:	[0s / 30s],		train_loss: 3.7505
86:	[0s / 48s],		train_loss: 3.5983
79:	[2s / 2m:43s],		train_loss: 3.8694
67:	[0s / 31s],		train_loss: 3.7304
87:	[0s / 49s],		train_loss: 3.5868
48:	[0s / 36s],		train_loss: 3.8616
55:	[8s / 6m:27s],		train_loss: 3.8000
68:	[0s / 31s],		train_loss: 3.7315
28:	[1s / 36s],		train_loss: 4.0932
88:	[0s / 49s],		train_loss: 3.5582
69:	[0s / 32s],		train_loss: 3.7247
49:	[0s / 37s],		train_loss: 3.8368
89:	[0s / 50s],		train_loss: 3.5581
70:	[0s / 32s],		train_loss: 3.7172
1:	[4s / 8s],		train_loss: 4.5950
90:	[0s / 51s],		train_loss: 3.5509
50:	[0s / 38s],		train_loss: 3.8126
71:	[0s / 33s],		train_loss: 3.7347
29:	[1s / 38s],		train_loss: 4.0519
80:	[2s / 2m:46s],		train_loss: 3.8852
91:	[0s / 51s],		train_loss: 3.5285
72:	[0s / 33s],		train_loss: 3.7199
51:	[0s / 39s],		train_loss: 3.8010
73:	[0s / 34s],		train_loss: 3.7388
92:	[0s / 52s],		train_loss: 3.5004
30:	[1s / 39s],		train_loss: 4.0657
74:	[0s / 34s],		train_loss: 3.7051
52:	[0s / 40s],		train_loss: 3.8499
93:	[0s / 53s],		train_loss: 3.5397
75:	[0s / 35s],		train_loss: 3.6903
94:	[0s / 53s],		train_loss: 3.5170
53:	[0s / 40s],		train_loss: 3.8311
81:	[2s / 2m:48s],		train_loss: 3.8520
76:	[0s / 35s],		train_loss: 3.6605
31:	[1s / 40s],		train_loss: 4.0807
95:	[0s / 54s],		train_loss: 3.4491
77:	[0s / 36s],		train_loss: 3.6573
54:	[0s / 41s],		train_loss: 3.7898
96:	[0s / 54s],		train_loss: 3.4417
78:	[0s / 36s],		train_loss: 3.6430
55:	[0s / 42s],		train_loss: 3.7572
32:	[1s / 42s],		train_loss: 4.0879
97:	[0s / 55s],		train_loss: 3.5011
79:	[0s / 37s],		train_loss: 3.6380
2:	[4s / 13s],		train_loss: 4.5045
80:	[0s / 37s],		train_loss: 3.6271
98:	[0s / 55s],		train_loss: 3.4905
82:	[2s / 2m:50s],		train_loss: 3.8455
56:	[0s / 43s],		train_loss: 3.7316
81:	[0s / 38s],		train_loss: 3.6622
33:	[1s / 43s],		train_loss: 4.0401
99:	[0s / 56s],		train_loss: 3.5098
57:	[0s / 43s],		train_loss: 3.7623
82:	[0s / 38s],		train_loss: 3.6393
0:	[0s / 0s],		train_loss: 4.6968
83:	[0s / 39s],		train_loss: 3.6413
58:	[0s / 44s],		train_loss: 3.7689
34:	[1s / 44s],		train_loss: 4.0405
1:	[0s / 1s],		train_loss: 4.4746
84:	[0s / 39s],		train_loss: 3.6461
85:	[0s / 40s],		train_loss: 3.6433
83:	[2s / 2m:53s],		train_loss: 3.8579
2:	[0s / 1s],		train_loss: 4.3826
59:	[0s / 45s],		train_loss: 3.7785
56:	[9s / 6m:36s],		train_loss: 3.8123
86:	[0s / 40s],		train_loss: 3.6236
3:	[0s / 2s],		train_loss: 4.3615
35:	[1s / 46s],		train_loss: 4.0572
60:	[0s / 46s],		train_loss: 3.7314
87:	[0s / 41s],		train_loss: 3.6052
4:	[0s / 2s],		train_loss: 4.3413
88:	[0s / 41s],		train_loss: 3.6054
61:	[0s / 47s],		train_loss: 3.7131
5:	[0s / 3s],		train_loss: 4.3089
3:	[4s / 18s],		train_loss: 4.4466
89:	[0s / 42s],		train_loss: 3.6079
36:	[1s / 47s],		train_loss: 3.9971
6:	[0s / 4s],		train_loss: 4.2889
62:	[0s / 47s],		train_loss: 3.7189
90:	[0s / 42s],		train_loss: 3.5773
84:	[2s / 2m:55s],		train_loss: 3.8435
91:	[0s / 43s],		train_loss: 3.5936
7:	[0s / 4s],		train_loss: 4.2706
63:	[0s / 48s],		train_loss: 3.7696
92:	[0s / 43s],		train_loss: 3.5756
37:	[1s / 48s],		train_loss: 4.0436
8:	[0s / 5s],		train_loss: 4.2583
64:	[0s / 49s],		train_loss: 3.7099
93:	[0s / 44s],		train_loss: 3.5533
9:	[0s / 5s],		train_loss: 4.2689
94:	[0s / 44s],		train_loss: 3.5749
10:	[0s / 6s],		train_loss: 4.2408
85:	[2s / 2m:57s],		train_loss: 3.8492
65:	[0s / 49s],		train_loss: 3.7292
95:	[0s / 45s],		train_loss: 3.5737
38:	[1s / 50s],		train_loss: 4.0228
11:	[0s / 6s],		train_loss: 4.2114
96:	[0s / 45s],		train_loss: 3.5785
66:	[0s / 50s],		train_loss: 3.6959
30:	[17s / 6m:41s],		train_loss: 4.1154
97:	[0s / 45s],		train_loss: 3.5575
12:	[0s / 7s],		train_loss: 4.2274
67:	[0s / 51s],		train_loss: 3.6472
39:	[1s / 51s],		train_loss: 3.9860
98:	[0s / 46s],		train_loss: 3.5241
4:	[4s / 22s],		train_loss: 4.3937
13:	[0s / 7s],		train_loss: 4.1800
99:	[0s / 46s],		train_loss: 3.5413
86:	[1s / 2m:59s],		train_loss: 3.8232
14:	[0s / 8s],		train_loss: 4.1600
68:	[0s / 52s],		train_loss: 3.6941
0:	[0s / 0s],		train_loss: 4.7174
40:	[1s / 52s],		train_loss: 3.9923
15:	[0s / 9s],		train_loss: 4.1370
69:	[0s / 52s],		train_loss: 3.6245
1:	[0s / 1s],		train_loss: 4.5119
16:	[0s / 9s],		train_loss: 4.1519
2:	[0s / 1s],		train_loss: 4.4310
70:	[0s / 53s],		train_loss: 3.6415
57:	[8s / 6m:44s],		train_loss: 3.8067
17:	[0s / 10s],		train_loss: 4.1269
41:	[1s / 54s],		train_loss: 3.9646
3:	[0s / 2s],		train_loss: 4.3965
87:	[2s / 3m:2s],		train_loss: 3.8166
18:	[0s / 10s],		train_loss: 4.1228
71:	[0s / 54s],		train_loss: 3.6391
4:	[0s / 2s],		train_loss: 4.3483
19:	[0s / 11s],		train_loss: 4.1264
72:	[0s / 55s],		train_loss: 3.6377
5:	[0s / 3s],		train_loss: 4.3243
42:	[1s / 55s],		train_loss: 3.9574
20:	[0s / 11s],		train_loss: 4.1016
6:	[0s / 3s],		train_loss: 4.2984
73:	[0s / 55s],		train_loss: 3.5911
21:	[0s / 12s],		train_loss: 4.0831
7:	[0s / 4s],		train_loss: 4.2952
5:	[4s / 26s],		train_loss: 4.3757
22:	[0s / 12s],		train_loss: 4.0693
43:	[1s / 56s],		train_loss: 3.9534
8:	[0s / 4s],		train_loss: 4.2609
74:	[0s / 56s],		train_loss: 3.6093
88:	[2s / 3m:4s],		train_loss: 3.8162
23:	[0s / 13s],		train_loss: 4.0389
9:	[0s / 5s],		train_loss: 4.2700
75:	[0s / 57s],		train_loss: 3.5955
24:	[0s / 13s],		train_loss: 4.0545
10:	[0s / 5s],		train_loss: 4.2554
44:	[1s / 57s],		train_loss: 3.9319
25:	[0s / 14s],		train_loss: 4.0208
11:	[0s / 6s],		train_loss: 4.2462
76:	[0s / 58s],		train_loss: 3.6100
26:	[0s / 15s],		train_loss: 4.0200
12:	[0s / 6s],		train_loss: 4.2327
77:	[0s / 59s],		train_loss: 3.5595
13:	[0s / 7s],		train_loss: 4.2056
27:	[0s / 15s],		train_loss: 4.0107
89:	[2s / 3m:7s],		train_loss: 3.8199
45:	[1s / 59s],		train_loss: 3.9337
78:	[0s / 59s],		train_loss: 3.5531
14:	[0s / 7s],		train_loss: 4.1878
28:	[0s / 16s],		train_loss: 3.9753
15:	[0s / 8s],		train_loss: 4.1788
29:	[0s / 16s],		train_loss: 3.9831
79:	[0s / 1m:0s],		train_loss: 3.5547
46:	[1s / 1m:0s],		train_loss: 3.9001
16:	[0s / 8s],		train_loss: 4.1743
30:	[0s / 17s],		train_loss: 3.9726
17:	[0s / 8s],		train_loss: 4.1678
80:	[0s / 1m:1s],		train_loss: 3.5750
6:	[4s / 31s],		train_loss: 4.3545
31:	[0s / 17s],		train_loss: 3.9805
90:	[2s / 3m:9s],		train_loss: 3.8158
18:	[0s / 9s],		train_loss: 4.1680
81:	[0s / 1m:1s],		train_loss: 3.6149
47:	[1s / 1m:1s],		train_loss: 3.9146
32:	[0s / 18s],		train_loss: 3.9741
19:	[0s / 10s],		train_loss: 4.1412
33:	[0s / 18s],		train_loss: 3.9519
82:	[0s / 1m:2s],		train_loss: 3.5979
20:	[0s / 10s],		train_loss: 4.1154
34:	[0s / 19s],		train_loss: 3.9605
21:	[0s / 11s],		train_loss: 4.1077
48:	[1s / 1m:3s],		train_loss: 3.9045
58:	[9s / 6m:54s],		train_loss: 3.7934
83:	[0s / 1m:3s],		train_loss: 3.6002
35:	[0s / 19s],		train_loss: 3.9475
22:	[0s / 11s],		train_loss: 4.1016
91:	[2s / 3m:11s],		train_loss: 3.7953
84:	[0s / 1m:4s],		train_loss: 3.