[I 2026-06-07 05:51:50,836] Trial 73 finished with value: 0.7775006491929066 and parameters: {'n_estimators': 300, 'max_depth': 8, 'min_samples_split': 15, 'min_samples_leaf': 15, 'max_features': 'log2'}. Best is trial 72 with value: 0.7775006491929066.
[I 2026-06-07 06:02:45,336] Trial 75 finished with value: 0.7775006491929066 and parameters: {'n_estimators': 300, 'max_depth': 8, 'min_samples_split': 15, 'min_samples_leaf': 15, 'max_features': 'log2'}. Best is trial 72 with value: 0.7775006491929066.
[I 2026-06-07 06:09:28,460] Trial 76 finished with value: 0.7775006491929066 and parameters: {'n_estimators': 300, 'max_depth': 8, 'min_samples_split': 15, 'min_samples_leaf': 15, 'max_features': 'log2'}. Best is trial 72 with value: 0.7775006491929066.
[I 2026-06-07 06:10:23,651] Trial 77 finished with value: 0.7644534423977416 and parameters: {'n_estimators': 300, 'max_depth': 9, 'min_samples_split': 15, 'min_samples_leaf': 12, 'max_features': 'log2'}. Best is trial 72 with value: 0.7775006491929066.
[I 2026-06-07 06:16:23,870] Trial 78 finished with value: 0.7689925573174512 and parameters: {'n_estimators': 300, 'max_depth': 8, 'min_samples_split': 15, 'min_samples_leaf': 12, 'max_features': 'log2'}. Best is trial 72 with value: 0.7775006491929066.
[I 2026-06-07 06:26:56,308] Trial 79 finished with value: 0.7689925573174512 and parameters: {'n_estimators': 300, 'max_depth': 8, 'min_samples_split': 15, 'min_samples_leaf': 12, 'max_features': 'log2'}. Best is trial 72 with value: 0.7775006491929066.
[I 2026-06-07 06:29:29,903] Trial 80 finished with value: 0.766324060345622 and parameters: {'n_estimators': 250, 'max_depth': 8, 'min_samples_split': 15, 'min_samples_leaf': 12, 'max_features': 'log2'}. Best is trial 72 with value: 0.7775006491929066.
[I 2026-06-07 06:30:30,354] Trial 81 finished with value: 0.7760153586476684 and parameters: {'n_estimators': 250, 'max_depth': 8, 'min_samples_split': 15, 'min_samples_leaf': 14, 'max_features': 'log2'}. Best is trial 72 with value: 0.7775006491929066.
[I 2026-06-07 06:36:30,555] Trial 82 finished with value: 0.7760153586476684 and parameters: {'n_estimators': 250, 'max_depth': 8, 'min_samples_split': 17, 'min_samples_leaf': 14, 'max_features': 'log2'}. Best is trial 72 with value: 0.7775006491929066.
[I 2026-06-07 06:47:57,430] Trial 83 finished with value: 0.7657397867296594 and parameters: {'n_estimators': 250, 'max_depth': 9, 'min_samples_split': 17, 'min_samples_leaf': 14, 'max_features': 'log2'}. Best is trial 72 with value: 0.7775006491929066.
[I 2026-06-07 06:51:22,603] Trial 85 finished with value: 0.7657397867296594 and parameters: {'n_estimators': 250, 'max_depth': 9, 'min_samples_split': 14, 'min_samples_leaf': 14, 'max_features': 'log2'}. Best is trial 72 with value: 0.7775006491929066.
[I 2026-06-07 06:52:19,149] Trial 86 finished with value: 0.7732416295998459 and parameters: {'n_estimators': 200, 'max_depth': 8, 'min_samples_split': 17, 'min_samples_leaf': 14, 'max_features': 'log2'}. Best is trial 72 with value: 0.7775006491929066.
[I 2026-06-07 06:54:01,631] Trial 84 finished with value: 0.7724296149238978 and parameters: {'n_estimators': 300, 'max_depth': 9, 'min_samples_split': 14, 'min_samples_leaf': 15, 'max_features': 'log2'}. Best is trial 72 with value: 0.7775006491929066.
[I 2026-06-07 07:04:15,874] Trial 87 finished with value: 0.7696386089680765 and parameters: {'n_estimators': 200, 'max_depth': 8, 'min_samples_split': 14, 'min_samples_leaf': 13, 'max_features': 'log2'}. Best is trial 72 with value: 0.7775006491929066.
[I 2026-06-07 07:16:54,147] Trial 88 finished with value: 0.741547665418541 and parameters: {'n_estimators': 150, 'max_depth': 8, 'min_samples_split': 14, 'min_samples_leaf': 13, 'max_features': 'sqrt'}. Best is trial 72 with value: 0.7775006491929066.
[I 2026-06-07 07:16:59,239] Trial 89 finished with value: 0.7538359971184212 and parameters: {'n_estimators': 150, 'max_depth': 7, 'min_samples_split': 14, 'min_samples_leaf': 13, 'max_features': 'sqrt'}. Best is trial 72 with value: 0.7775006491929066.
[I 2026-06-07 07:27:07,907] Trial 90 finished with value: 0.7546181698623711 and parameters: {'n_estimators': 200, 'max_depth': 7, 'min_samples_split': 16, 'min_samples_leaf': 13, 'max_features': 'sqrt'}. Best is trial 72 with value: 0.7775006491929066.
[I 2026-06-07 07:29:11,044] Trial 91 finished with value: 0.7463598078388997 and parameters: {'n_estimators': 150, 'max_depth': 7, 'min_samples_split': 16, 'min_samples_leaf': 11, 'max_features': 'sqrt'}. Best is trial 72 with value: 0.7775006491929066.
[I 2026-06-07 07:35:43,364] Trial 93 finished with value: 0.7708275743640004 and parameters: {'n_estimators': 250, 'max_depth': 7, 'min_samples_split': 16, 'min_samples_leaf': 15, 'max_features': 'log2'}. Best is trial 72 with value: 0.7775006491929066.
[I 2026-06-07 07:35:56,898] Trial 92 finished with value: 0.7760080290503355 and parameters: {'n_estimators': 250, 'max_depth': 7, 'min_samples_split': 16, 'min_samples_leaf': 11, 'max_features': 'log2'}. Best is trial 72 with value: 0.7775006491929066.
[I 2026-06-07 07:50:44,822] Trial 94 finished with value: 0.7775006491929066 and parameters: {'n_estimators': 300, 'max_depth': 8, 'min_samples_split': 16, 'min_samples_leaf': 15, 'max_features': 'log2'}. Best is trial 72 with value: 0.7775006491929066.
[I 2026-06-07 07:52:53,010] Trial 95 finished with value: 0.7775006491929066 and parameters: {'n_estimators': 300, 'max_depth': 8, 'min_samples_split': 15, 'min_samples_leaf': 15, 'max_features': 'log2'}. Best is trial 72 with value: 0.7775006491929066.
[I 2026-06-07 07:56:08,945] Trial 97 finished with value: 0.7760153586476684 and parameters: {'n_estimators': 250, 'max_depth': 8, 'min_samples_split': 17, 'min_samples_leaf': 14, 'max_features': 'log2'}. Best is trial 72 with value: 0.7775006491929066.
[I 2026-06-07 07:58:40,307] Trial 96 finished with value: 0.7775006491929066 and parameters: {'n_estimators': 300, 'max_depth': 8, 'min_samples_split': 15, 'min_samples_leaf': 15, 'max_features': 'log2'}. Best is trial 72 with value: 0.7775006491929066.
[I 2026-06-07 08:04:07,961] Trial 98 finished with value: 0.7760153586476684 and parameters: {'n_estimators': 250, 'max_depth': 8, 'min_samples_split': 17, 'min_samples_leaf': 14, 'max_features': 'log2'}. Best is trial 72 with value: 0.7775006491929066.
