[I 2026-06-09 05:52:33,028] Trial 77 finished with value: 0.7965568720453157 and parameters: {'num_nodes': [32], 'dropout': 0.2892389574242678, 'learning_rate': 0.0012625717520608703, 'batch_norm': False}. Best is trial 17 with value: 0.8122559343543445.
/scratch.hpc/luca.cotugno/Foundation_model_clinical_data/test_tabular_model_tmp.py:476: UserWarning: Choices for a categorical distribution should be a tuple of None, bool, int, float and str for persistent storage but contains [32] which is of type list.
  num_nodes  = trial.suggest_categorical("num_nodes", [[32], [64], [128], [64, 32], [128, 64]])
/scratch.hpc/luca.cotugno/Foundation_model_clinical_data/test_tabular_model_tmp.py:476: UserWarning: Choices for a categorical distribution should be a tuple of None, bool, int, float and str for persistent storage but contains [64] which is of type list.
  num_nodes  = trial.suggest_categorical("num_nodes", [[32], [64], [128], [64, 32], [128, 64]])
/scratch.hpc/luca.cotugno/Foundation_model_clinical_data/test_tabular_model_tmp.py:476: UserWarning: Choices for a categorical distribution should be a tuple of None, bool, int, float and str for persistent storage but contains [128] which is of type list.
  num_nodes  = trial.suggest_categorical("num_nodes", [[32], [64], [128], [64, 32], [128, 64]])
/scratch.hpc/luca.cotugno/Foundation_model_clinical_data/test_tabular_model_tmp.py:476: UserWarning: Choices for a categorical distribution should be a tuple of None, bool, int, float and str for persistent storage but contains [64, 32] which is of type list.
  num_nodes  = trial.suggest_categorical("num_nodes", [[32], [64], [128], [64, 32], [128, 64]])
/scratch.hpc/luca.cotugno/Foundation_model_clinical_data/test_tabular_model_tmp.py:476: UserWarning: Choices for a categorical distribution should be a tuple of None, bool, int, float and str for persistent storage but contains [128, 64] which is of type list.
  num_nodes  = trial.suggest_categorical("num_nodes", [[32], [64], [128], [64, 32], [128, 64]])

49:	[1s / 59s],		train_loss: 2.4203
59:	[0s / 46s],		train_loss: 2.4540
22:	[0s / 10s],		train_loss: 2.5001
69:	[0s / 34s],		train_loss: 2.4557
23:	[0s / 11s],		train_loss: 2.4961
70:	[0s / 35s],		train_loss: 2.4416
60:	[0s / 47s],		train_loss: 2.4707
50:	[1s / 1m:0s],		train_loss: 2.4098
24:	[0s / 11s],		train_loss: 2.4941
71:	[0s / 35s],		train_loss: 2.4515
25:	[0s / 11s],		train_loss: 2.4777
61:	[0s / 48s],		train_loss: 2.4683
72:	[0s / 36s],		train_loss: 2.4400
26:	[0s / 12s],		train_loss: 2.4961
73:	[0s / 36s],		train_loss: 2.4359
51:	[1s / 1m:1s],		train_loss: 2.3913
62:	[0s / 48s],		train_loss: 2.4630
27:	[0s / 12s],		train_loss: 2.4829
74:	[0s / 37s],		train_loss: 2.4432
28:	[0s / 13s],		train_loss: 2.4827
75:	[0s / 37s],		train_loss: 2.4301
63:	[0s / 49s],		train_loss: 2.4599
29:	[0s / 13s],		train_loss: 2.4784
52:	[1s / 1m:2s],		train_loss: 2.4224
76:	[0s / 38s],		train_loss: 2.4460
30:	[0s / 14s],		train_loss: 2.4846
64:	[0s / 50s],		train_loss: 2.4639
77:	[0s / 38s],		train_loss: 2.4530
31:	[0s / 14s],		train_loss: 2.4775
78:	[0s / 39s],		train_loss: 2.4272
53:	[1s / 1m:4s],		train_loss: 2.4056
65:	[0s / 51s],		train_loss: 2.4549
32:	[0s / 15s],		train_loss: 2.4801
79:	[0s / 39s],		train_loss: 2.4410
33:	[0s / 15s],		train_loss: 2.4820
80:	[0s / 40s],		train_loss: 2.4370
66:	[0s / 52s],		train_loss: 2.4442
34:	[0s / 16s],		train_loss: 2.4672
81:	[0s / 40s],		train_loss: 2.4339
54:	[1s / 1m:5s],		train_loss: 2.4200
35:	[0s / 16s],		train_loss: 2.4695
67:	[0s / 52s],		train_loss: 2.4608
82:	[0s / 41s],		train_loss: 2.4543
36:	[0s / 16s],		train_loss: 2.4754
83:	[0s / 41s],		train_loss: 2.4374
37:	[0s / 17s],		train_loss: 2.4737
68:	[0s / 53s],		train_loss: 2.4619
55:	[1s / 1m:6s],		train_loss: 2.4032
84:	[0s / 41s],		train_loss: 2.4300
38:	[0s / 17s],		train_loss: 2.4593
85:	[0s / 42s],		train_loss: 2.4393
69:	[0s / 54s],		train_loss: 2.4552
39:	[0s / 18s],		train_loss: 2.4706
86:	[0s / 42s],		train_loss: 2.4393
40:	[0s / 18s],		train_loss: 2.4498
56:	[1s / 1m:7s],		train_loss: 2.4002
70:	[0s / 55s],		train_loss: 2.4545
87:	[0s / 43s],		train_loss: 2.4315
41:	[0s / 19s],		train_loss: 2.4690
88:	[0s / 43s],		train_loss: 2.4426
42:	[0s / 19s],		train_loss: 2.4768
71:	[0s / 55s],		train_loss: 2.4552
89:	[0s / 44s],		train_loss: 2.4382
43:	[0s / 20s],		train_loss: 2.4578
57:	[1s / 1m:9s],		train_loss: 2.3893
72:	[0s / 56s],		train_loss: 2.4651
90:	[0s / 44s],		train_loss: 2.4257
44:	[0s / 20s],		train_loss: 2.4595
91:	[0s / 45s],		train_loss: 2.4347
45:	[0s / 21s],		train_loss: 2.4649
73:	[0s / 57s],		train_loss: 2.4457
58:	[1s / 1m:10s],		train_loss: 2.4034
92:	[0s / 45s],		train_loss: 2.4245
46:	[0s / 21s],		train_loss: 2.4603
47:	[0s / 22s],		train_loss: 2.4548
93:	[0s / 46s],		train_loss: 2.4247
74:	[0s / 58s],		train_loss: 2.4448
48:	[0s / 22s],		train_loss: 2.4582
94:	[0s / 46s],		train_loss: 2.4225
59:	[1s / 1m:11s],		train_loss: 2.3961
75:	[0s / 59s],		train_loss: 2.4651
49:	[0s / 22s],		train_loss: 2.4614
95:	[0s / 47s],		train_loss: 2.4330
50:	[0s / 23s],		train_loss: 2.4619
96:	[0s / 47s],		train_loss: 2.4150
76:	[0s / 59s],		train_loss: 2.4527
51:	[0s / 23s],		train_loss: 2.4609
97:	[0s / 48s],		train_loss: 2.4291
60:	[1s / 1m:13s],		train_loss: 2.3985
52:	[0s / 24s],		train_loss: 2.4561
98:	[0s / 48s],		train_loss: 2.4296
77:	[0s / 1m:0s],		train_loss: 2.4509
53:	[0s / 24s],		train_loss: 2.4565
99:	[0s / 49s],		train_loss: 2.4177
78:	[0s / 1m:1s],		train_loss: 2.4594
54:	[0s / 25s],		train_loss: 2.4378
0:	[0s / 0s],		train_loss: 2.8850
61:	[1s / 1m:14s],		train_loss: 2.3987
55:	[0s / 25s],		train_loss: 2.4513
79:	[0s / 1m:2s],		train_loss: 2.4654
1:	[0s / 0s],		train_loss: 2.6035
56:	[0s / 26s],		train_loss: 2.4512
2:	[0s / 1s],		train_loss: 2.5873
80:	[0s / 1m:2s],		train_loss: 2.4646
62:	[1s / 1m:15s],		train_loss: 2.4036
57:	[0s / 26s],		train_loss: 2.4588
3:	[0s / 1s],		train_loss: 2.5510
58:	[0s / 27s],		train_loss: 2.4630
4:	[0s / 2s],		train_loss: 2.5356
81:	[0s / 1m:3s],		train_loss: 2.4436
59:	[0s / 27s],		train_loss: 2.4508
5:	[0s / 2s],		train_loss: 2.5494
63:	[1s / 1m:16s],		train_loss: 2.3943
60:	[0s / 28s],		train_loss: 2.4548
82:	[0s / 1m:4s],		train_loss: 2.4607
6:	[0s / 3s],		train_loss: 2.5237
61:	[0s / 28s],		train_loss: 2.4438
7:	[0s / 3s],		train_loss: 2.5272
83:	[0s / 1m:4s],		train_loss: 2.4371
62:	[0s / 28s],		train_loss: 2.4378
64:	[1s / 1m:17s],		train_loss: 2.3724
8:	[0s / 4s],		train_loss: 2.5175
63:	[0s / 29s],		train_loss: 2.4453
84:	[0s / 1m:5s],		train_loss: 2.4411
9:	[0s / 4s],		train_loss: 2.5102
64:	[0s / 29s],		train_loss: 2.4472
10:	[0s / 5s],		train_loss: 2.4997
65:	[1s / 1m:19s],		train_loss: 2.3963
85:	[0s / 1m:6s],		train_loss: 2.4418
65:	[0s / 30s],		train_loss: 2.4481
11:	[0s / 5s],		train_loss: 2.5068
66:	[0s / 30s],		train_loss: 2.4594
86:	[0s / 1m:7s],		train_loss: 2.4530
12:	[0s / 5s],		train_loss: 2.4992
67:	[0s / 31s],		train_loss: 2.4596
66:	[1s / 1m:20s],		train_loss: 2.3981
13:	[0s / 6s],		train_loss: 2.4898
87:	[0s / 1m:7s],		train_loss: 2.4593
68:	[0s / 31s],		train_loss: 2.4393
14:	[0s / 6s],		train_loss: 2.4835
69:	[0s / 32s],		train_loss: 2.4399
88:	[0s / 1m:8s],		train_loss: 2.4378
15:	[0s / 7s],		train_loss: 2.4940
67:	[1s / 1m:21s],		train_loss: 2.3645
70:	[0s / 32s],		train_loss: 2.4589
16:	[0s / 7s],		train_loss: 2.4858
89:	[0s / 1m:9s],		train_loss: 2.4478
71:	[0s / 33s],		train_loss: 2.4471
17:	[0s / 8s],		train_loss: 2.4987
72:	[0s / 33s],		train_loss: 2.4509
68:	[1s / 1m:22s],		train_loss: 2.3926
90:	[0s / 1m:9s],		train_loss: 2.4474
18:	[0s / 8s],		train_loss: 2.4855
73:	[0s / 33s],		train_loss: 2.4404
19:	[0s / 9s],		train_loss: 2.4761
91:	[0s / 1m:10s],		train_loss: 2.4593
74:	[0s / 34s],		train_loss: 2.4393
20:	[0s / 9s],		train_loss: 2.4786
69:	[1s / 1m:23s],		train_loss: 2.3884
75:	[0s / 34s],		train_loss: 2.4566
92:	[0s / 1m:11s],		train_loss: 2.4449
21:	[0s / 10s],		train_loss: 2.4896
76:	[0s / 35s],		train_loss: 2.4293
22:	[0s / 10s],		train_loss: 2.4845
93:	[0s / 1m:11s],		train_loss: 2.4423
77:	[0s / 35s],		train_loss: 2.4419
23:	[0s / 11s],		train_loss: 2.4761
70:	[1s / 1m:25s],		train_loss: 2.3867
78:	[0s / 36s],		train_loss: 2.4398
94:	[0s / 1m:12s],		train_loss: 2.4356
24:	[0s / 11s],		train_loss: 2.4688
79:	[0s / 36s],		train_loss: 2.4404
25:	[0s / 11s],		train_loss: 2.4681
95:	[0s / 1m:13s],		train_loss: 2.4493
80:	[0s / 37s],		train_loss: 2.4511
71:	[1s / 1m:26s],		train_loss: 2.3715
26:	[0s / 12s],		train_loss: 2.4750
81:	[0s / 37s],		train_loss: 2.4423
96:	[0s / 1m:13s],		train_loss: 2.4306
27:	[0s / 12s],		train_loss: 2.4740
82:	[0s / 38s],		train_loss: 2.4429
28:	[0s / 13s],		train_loss: 2.4707
72:	[1s / 1m:27s],		train_loss: 2.3752
97:	[0s / 1m:14s],		train_loss: 2.4427
83:	[0s / 38s],		train_loss: 2.4411
29:	[0s / 13s],		train_loss: 2.4722
84:	[0s / 39s],		train_loss: 2.4281
98:	[0s / 1m:15s],		train_loss: 2.4422
30:	[0s / 14s],		train_loss: 2.4573
85:	[0s / 39s],		train_loss: 2.4392
73:	[1s / 1m:28s],		train_loss: 2.3712
31:	[0s / 14s],		train_loss: 2.4744
99:	[0s / 1m:15s],		train_loss: 2.4347
86:	[0s / 40s],		train_loss: 2.4373
32:	[0s / 15s],		train_loss: 2.4763
87:	[0s / 40s],		train_loss: 2.4315
0:	[0s / 0s],		train_loss: 3.7918
33:	[0s / 15s],		train_loss: 2.4617
74:	[1s / 1m:29s],		train_loss: 2.3830
88:	[0s / 40s],		train_loss: 2.4380
1:	[0s / 1s],		train_loss: 2.9495
34:	[0s / 16s],		train_loss: 2.4634
89:	[0s / 41s],		train_loss: 2.4359
35:	[0s / 16s],		train_loss: 2.4615
2:	[0s / 1s],		train_loss: 2.8365
90:	[0s / 41s],		train_loss: 2.4301
36:	[0s / 17s],		train_loss: 2.4620
75:	[1s / 1m:31s],		train_loss: 2.3737
3:	[0s / 2s],		train_loss: 2.7453
91:	[0s / 42s],		train_loss: 2.4324
37:	[0s / 17s],		train_loss: 2.4616
92:	[0s / 42s],		train_loss: 2.4415
4:	[0s / 2s],		train_loss: 2.7069
38:	[0s / 17s],		train_loss: 2.4735
93:	[0s / 43s],		train_loss: 2.4249
76:	[1s / 1m:32s],		train_loss: 2.3779
5:	[0s / 3s],		train_loss: 2.6680
39:	[0s / 18s],		train_loss: 2.4491
94:	[0s / 43s],		train_loss: 2.4231
40:	[0s / 18s],		train_loss: 2.4562
6:	[0s / 3s],		train_loss: 2.6236
95:	[0s / 44s],		train_loss: 2.4351
41:	[0s / 19s],		train_loss: 2.4424
7:	[0s / 4s],		train_loss: 2.6073
96:	[0s / 44s],		train_loss: 2.4389
77:	[1s / 1m:33s],		train_loss: 2.3769
42:	[0s / 19s],		train_loss: 2.4465
8:	[0s / 5s],		train_loss: 2.5784
97:	[0s / 45s],		train_loss: 2.4482
43:	[0s / 20s],		train_loss: 2.4534
98:	[0s / 45s],		train_loss: 2.4348
9:	[0s / 5s],		train_loss: 2.5632
44:	[0s / 20s],		train_loss: 2.4453
78:	[1s / 1m:34s],		train_loss: 2.3616
99:	[0s / 46s],		train_loss: 2.4402
10:	[0s / 6s],		train_loss: 2.5683
45:	[0s / 21s],		train_loss: 2.4457
0:	[0s / 0s],		train_loss: 3.9056
46:	[0s / 21s],		train_loss: 2.4409
11:	[0s / 6s],		train_loss: 2.5655
1:	[0s / 0s],		train_loss: 3.0627
79:	[1s / 1m:36s],		train_loss: 2.3747
47:	[0s / 22s],		train_loss: 2.4448
2:	[0s / 1s],		train_loss: 2.8685
12:	[0s / 7s],		train_loss: 2.5392
48:	[0s / 22s],		train_loss: 2.4586
3:	[0s / 1s],		train_loss: 2.7872
49:	[0s / 23s],		train_loss: 2.4376
80:	[1s / 1m:37s],		train_loss: 2.3572
13:	[0s / 8s],		train_loss: 2.5300
4:	[0s / 2s],		train_loss: 2.7014
50:	[0s / 23s],		train_loss: 2.4427
5:	[0s / 2s],		train_loss: 2.6615
51:	[0s / 23s],		train_loss: 2.4356
14:	[0s / 8s],		train_loss: 2.5308
6:	[0s / 2s],		train_loss: 2.6379
52:	[0s / 24s],		train_loss: 2.4428
81:	[1s / 1m:38s],		train_loss: 2.3641
7:	[0s / 3s],		train_loss: 2.6335
15:	[0s / 9s],		train_loss: 2.5163
53:	[0s / 24s],		train_loss: 2.4335
8:	[0s / 3s],		train_loss: 2.5857
54:	[0s / 25s],		train_loss: 2.4334
16:	[0s / 10s],		train_loss: 2.5009
9:	[0s / 4s],		train_loss: 2.5943
82:	[1s / 1m:39s],		train_loss: 2.3503
55:	[0s / 25s],		train_loss: 2.4471
10:	[0s / 4s],		train_loss: 2.5784
17:	[0s / 10s],		train_loss: 2.5125
56:	[0s / 26s],		train_loss: 2.4352
11:	[0s / 4s],		train_loss: 2.5730
57:	[0s / 26s],		train_loss: 2.4309
18:	[0s / 11s],		train_loss: 2.5018
12:	[0s / 5s],		train_loss: 2.5517
83:	[1s / 1m:40s],		train_loss: 2.3520
58:	[0s / 26s],		train_loss: 2.4138
13:	[0s / 5s],		train_loss: 2.5530
19:	[0s / 12s],		train_loss: 2.5031
59:	[0s / 27s],		train_loss: 2.4341
14:	[0s / 6s],		train_loss: 2.5336
60:	[0s / 27s],		train_loss: 2.4314
20:	[0s / 12s],		train_loss: 2.4962
15:	[0s / 6s],		train_loss: 2.5379
84:	[1s / 1m:41s],		train_loss: 2.3618
61:	[0s / 28s],		train_loss: 2.4283
16:	[0s / 6s],		train_loss: 2.5280
21:	[0s / 13s],		train_loss: 2.4888
62:	[0s / 28s],		train_loss: 2.4242
17:	[0s / 7s],		train_loss: 2.5261
63:	[0s / 28s],		train_loss: 2.4390
22:	[0s / 14s],		train_loss: 2.4836
85:	[1s / 1m:43s],		train_loss: 2.3625
18:	[0s / 7s],		train_loss: 2.5099
64:	[0s / 29s],		train_loss: 2.4274
19:	[0s / 8s],		train_loss: 2.5130
23:	[0s / 14s],		train_loss: 2.4830
65:	[0s / 29s],		train_loss: 2.4278
20:	[0s / 8s],		train_loss: 2.5059
86:	[1s / 1m:44s],		train_loss: 2.3624
66:	[0s / 30s],		train_loss: 2.4193
21:	[0s / 9s],		train_loss: 2.5044
24:	[0s / 15s],		train_loss: 2.4915
67:	[0s / 30s],		train_loss: 2.4199
22:	[0s / 9s],		train_loss: 2.4990
25:	[0s / 15s],		train_loss: 2.4803
68:	[0s / 31s],		train_loss: 2.4139
23:	[0s / 9s],		train_loss: 2.4993
87:	[1s / 1m:45s],		train_loss: 2.3436
24:	[0s / 10s],		train_loss: 2.4945
69:	[0s / 31s],		train_loss: 2.4180
26:	[0s / 16s],		train_loss: 2.4778
25:	[0s / 10s],		train_loss: 2.4956
70:	[0s / 31s],		train_loss: 2.4340
27:	[0s / 17s],		train_loss: 2.4803
26:	[0s / 11s],		train_loss: 2.4888
71:	[0s / 32s],		train_loss: 2.4183
88:	[1s / 1m:46s],		train_loss: 2.3475
27:	[0s / 11s],		train_loss: 2.4845
72:	[0s / 32s],		train_loss: 2.4275
28:	[0s / 17s],		train_loss: 2.4770
28:	[0s / 11s],		train_loss: 2.4988
73:	[0s / 33s],		train_loss: 2.4059
29:	[0s / 12s],		train_loss: 2.4824
89:	[1s / 1m:47s],		train_loss: 2.3489
29:	[0s / 18s],		train_loss: 2.4695
74:	[0s / 33s],		train_loss: 2.4079
30:	[0s / 12s],		train_loss: 2.4802
75:	[0s / 34s],		train_loss: 2.4091
30:	[0s / 19s],		train_loss: 2.4652
31:	[0s / 13s],		train_loss: 2.4593
76:	[0s / 34s],		train_loss: 2.4061
90:	[1s / 1m:48s],		train_loss: 2.3506
32:	[0s / 13s],		train_loss: 2.4701
31:	[0s / 19s],		train_loss: 2.4626
77:	[0s / 34s],		train_loss: 2.4148
33:	[0s / 13s],		train_loss: 2.4855
78:	[0s / 35s],		train_loss: 2.4110
32:	[0s / 20s],		train_loss: 2.4564
34:	[0s / 14s],		train_loss: 2.4677
79:	[0s / 35s],		train_loss: 2.4018
91:	[1s / 1m:49s],		train_loss: 2.3460
35:	[0s / 14s],		train_loss: 2.4695
33:	[0s / 21s],		train_loss: 2.4584
80:	[0s / 36s],		train_loss: 2.4073
36:	[0s / 15s],		train_loss: 2.4570
81:	[0s / 36s],		train_loss: 2.3996
34:	[0s / 21s],		train_loss: 2.4640
37:	[0s / 15s],		train_loss: 2.4687
92:	[1s / 1m:51s],		train_loss: 2.3345
82:	[0s / 37s],		train_loss: 2.3963
38:	[0s / 16s],		train_loss: 2.4655
83:	[0s / 37s],		train_loss: 2.3994
35:	[0s / 22s],		train_loss: 2.4617
39:	[0s / 16s],		train_loss: 2.4554
84:	[0s / 37s],		train_loss: 2.3908
40:	[0s / 16s],		train_loss: 2.4566
36:	[0s / 23s],		train_loss: 2.4548
93:	[1s / 1m:52s],		train_loss: 2.3417
85:	[0s / 38s],		train_loss: 2.4052
41:	[0s / 17s],		train_loss: 2.4444
86:	[0s / 38s],		train_loss: 2.3945
37:	[0s / 23s],		train_loss: 2.4559
42:	[0s / 17s],		train_loss: 2.4611
87:	[0s / 39s],		train_loss: 2.4147
94:	[1s / 1m:53s],		train_loss: 2.3446
43:	[0s / 18s],		train_loss: 2.4597
38:	[0s / 24s],		train_loss: 2.4636
88:	[0s / 39s],		train_loss: 2.4016
44:	[0s / 18s],		train_loss: 2.4462
89:	[0s / 40s],		train_loss: 2.3925
39:	[0s / 25s],		train_loss: 2.4558
45:	[0s / 18s],		train_loss: 2.4385
95:	[1s / 1m:54s],		train_loss: 2.3491
90:	[0s / 40s],		train_loss: 2.3979
46:	[0s / 19s],		train_loss: 2.4436
40:	[0s / 25s],		train_loss: 2.4466
91:	[0s / 40s],		train_loss: 2.4107
47:	[0s / 19s],		train_loss: 2.4485
92:	[0s / 41s],		train_loss: 2.4058
48:	[0s / 20s],		train_loss: 2.4313
41:	[0s / 26s],		train_loss: 2.4477
96:	[1s / 1m:55s],		train_loss: 2.3449
93:	[0s / 41s],		train_loss: 2.4048
49:	[0s / 20s],		train_loss: 2.4455
42:	[0s / 27s],		train_loss: 2.4383
94:	[0s / 42s],		train_loss: 2.4125
50:	[0s / 21s],		train_loss: 2.4361
51:	[0s / 21s],		train_loss: 2.4267
95:	[0s / 42s],		train_loss: 2.4058
97:	[1s / 1m:56s],		train_loss: 2.3470
43:	[0s / 27s],		train_loss: 2.4327
52:	[0s / 21s],		train_loss: 2.4456
96:	[0s / 43s],		train_loss: 2.3776
44:	[0s / 28s],		train_loss: 2.4274
53:	[0s / 22s],		train_loss: 2.4253
97:	[0s / 43s],		train_loss: 2.3943
98:	[1s / 1m:57s],		train_loss: 2.3345
54:	[0s / 22s],		train_loss: 2.4510
98:	[0s / 43s],		train_loss: 2.3964
45:	[0s / 29s],		train_loss: 2.4456
55:	[0s / 23s],		train_loss: 2.4249
99:	[0s / 44s],		train_loss: 2.3711
56:	[0s / 23s],		train_loss: 2.4373
46:	[0s / 29s],		train_loss: 2.4290
99:	[1s / 1m:58s],		train_loss: 2.3267
0:	[0s / 0s],		train_loss: 3.7419
57:	[0s / 24s],		train_loss: 2.4302
1:	[0s / 0s],		train_loss: 2.8671
47:	[0s / 30s],		train_loss: 2.4549
58:	[0s / 24s],		train_loss: 2.4205
2:	[0s / 1s],		train_loss: 2.7657
59:	[0s / 24s],		train_loss: 2.4243
48:	[0s / 31s],		train_loss: 2.4158
0:	[1s / 1s],		train_loss: 4.3025
3:	[0s / 1s],		train_loss: 2.7306
60:	[0s / 25s],		train_loss: 2.4418
4:	[0s / 2s],		train_loss: 2.6486
49:	[0s / 31s],		train_loss: 2.4294
61:	[0s / 25s],		train_loss: 2.4114
5:	[0s / 2s],		train_loss: 2.6446
62:	[0s / 26s],		train_loss: 2.4229
1:	[1s / 2s],		train_loss: 3.1905
50:	[0s / 32s],		train_loss: 2.4185
6:	[0s / 3s],		train_loss: 2.6303
63:	[0s / 26s],		train_loss: 2.4123
7:	[0s / 3s],		train_loss: 2.6021
51:	[0s / 33s],		train_loss: 2.4307
64:	[0s / 26s],		train_loss: 2.4186
8:	[0s / 3s],		train_loss: 2.5856
2:	[1s / 3s],		train_loss: 2.8908
65:	[0s / 27s],		train_loss: 2.4138
52:	[0s / 33s],		train_loss: 2.4227
9:	[0s / 4s],		train_loss: 2.5796
66:	[0s / 27s],		train_loss: 2.4234
10:	[0s / 4s],		train_loss: 2.5708
67:	[0s / 28s],		train_loss: 2.4127
53:	[0s / 34s],		train_loss: 2.4206
3:	[1s / 4s],		train_loss: 2.8053
11:	[0s / 5s],		train_loss: 2.5465
68:	[0s / 28s],		train_loss: 2.4146
54:	[0s / 35s],		train_loss: 2.4208
12:	[0s / 5s],		train_loss: 2.5425
69:	[0s / 28s],		train_loss: 2.4193
13:	[0s / 5s],		train_loss: 2.5324
70:	[0s / 29s],		train_loss: 2.4130
4:	[1s / 5s],		train_loss: 2.7148
55:	[0s / 35s],		train_loss: 2.4219
14:	[0s / 6s],		train_loss: 2.5195
71:	[0s / 29s],		train_loss: 2.4096
15:	[0s / 6s],		train_loss: 2.5235
72:	[0s / 30s],		train_loss: 2.4187
56:	[0s / 36s],		train_loss: 2.4244
5:	[1s / 6s],		train_loss: 2.6653
73:	[0s / 30s],		train_loss: 2.4076
16:	[0s / 7s],		train_loss: 2.5241
57:	[0s / 37s],		train_loss: 2.4082
74:	[0s / 31s],		train_loss: 2.4089
17:	[0s / 7s],		train_loss: 2.5133
75:	[0s / 31s],		train_loss: 2.4015
18:	[0s / 8s],		train_loss: 2.5169
58:	[0s / 37s],		train_loss: 2.4142
6:	[1s / 7s],		train_loss: 2.6450
76:	[0s / 31s],		train_loss: 2.4156
19:	[0s / 8s],		train_loss: 2.5095
59:	[0s / 38s],		train_loss: 2.4203
77:	[0s / 32s],		train_loss: 2.3953
20:	[0s / 9s],		train_loss: 2.5116
78:	[0s / 32s],		train_loss: 2.4127
21:	[0s / 9s],		train_loss: 2.4987
60:	[0s / 39s],		train_loss: 2.4158
7:	[1s / 9s],		train_loss: 2.6318
79:	[0s / 33s],		train_loss: 2.4011
22:	[0s / 9s],		train_loss: 2.4955
80:	[0s / 33s],		train_loss: 2.4096
61:	[0s / 39s],		train_loss: 2.3952
23:	[0s / 10s],		train_loss: 2.4850
81:	[0s / 33s],		train_loss: 2.4012
24:	[0s / 10s],		train_loss: 2.4918
8:	[1s / 10s],		train_loss: 2.6251
62:	[0s / 40s],		train_loss: 2.4093
82:	[0s / 34s],		train_loss: 2.4073
25:	[0s / 11s],		train_loss: 2.4836
83:	[0s / 34s],		train_loss: 2.3901
63:	[0s / 41s],		train_loss: 2.4082
26:	[0s / 11s],		train_loss: 2.4868
84:	[0s / 35s],		train_loss: 2.3929
27:	[0s / 11s],		train_loss: 2.4732
9:	[1s / 11s],		train_loss: 2.5848
64:	[0s / 41s],		train_loss: 2.4032
85:	[0s / 35s],		train_loss: 2.4071
28:	[0s / 12s],		train_loss: 2.4857
86:	[0s / 36s],		train_loss: 2.3842
29:	[0s / 12s],		train_loss: 2.4713
65:	[0s / 42s],		train_loss: 2.4178
87:	[0s / 36s],		train_loss: 2.3980
10:	[1s / 12s],		train_loss: 2.5810
30:	[0s / 13s],		train_loss: 2.4658
66:	[0s / 43s],		train_loss: 2.3955
88:	[0s / 36s],		train_loss: 2.4011
31:	[0s / 13s],		train_loss: 2.4648
89:	[0s / 37s],		train_loss: 2.3957
32:	[0s / 14s],		train_loss: 2.4781
67:	[0s / 43s],		train_loss: 2.4011
11:	[1s / 13s],		train_loss: 2.5696
90:	[0s / 37s],		train_loss: 2.3862
33:	[0s / 14s],		train_loss: 2.4574
91:	[0s / 38s],		train_loss: 2.3932
68:	[0s / 44s],		train_loss: 2.4061
34:	[0s / 14s],		train_loss: 2.4726
92:	[0s / 38s],		train_loss: 2.3907
35:	[0s / 15s],		train_loss: 2.4575
69:	[0s / 44s],		train_loss: 2.3987
12:	[1s / 14s],		train_loss: 2.5810
93:	[0s / 38s],		train_loss: 2.3683
36:	[0s / 15s],		train_loss: 2.4566
94:	[0s / 39s],		train_loss: 2.3816
70:	[0s / 45s],		train_loss: 2.3958
37:	[0s / 16s],		train_loss: 2.4476
95:	[0s / 39s],		train_loss: 2.3897
13:	[1s / 15s],		train_loss: 2.5686
38:	[0s / 16s],		train_loss: 2.4531
71:	[0s / 46s],		train_loss: 2.3966
96:	[0s / 40s],		train_loss: 2.3885
39:	[0s / 17s],		train_loss: 2.4548
97:	[0s / 40s],		train_loss: 2.3859
72:	[0s / 46s],		train_loss: 2.3959
40:	[0s / 17s],		train_loss: 2.4442
14:	[1s / 17s],		train_loss: 2.5447
98:	[0s / 40s],		train_loss: 2.3865
41:	[0s / 17s],		train_loss: 2.4453
73:	[0s / 47s],		train_loss: 2.3872
99:	[0s / 41s],		train_loss: 2.3867
42:	[0s / 18s],		train_loss: 2.4461
0:	[0s / 0s],		train_loss: 3.8171
15:	[1s / 18s],		train_loss: 2.5604
74:	[0s / 48s],		train_loss: 2.3856
43:	[0s / 18s],		train_loss: 2.4392
1:	[0s / 0s],		train_loss: 2.9931
2:	[0s / 1s],		train_loss: 2.8281
75:	[0s / 48s],		train_loss: 2.3764
44:	[0s / 19s],		train_loss: 2.4295
3:	[0s / 1s],		train_loss: 2.7612
16:	[1s / 19s],		train_loss: 2.5533
45:	[0s / 19s],		train_loss: 2.4317
76:	[0s / 49s],		train_loss: 2.3886
4:	[0s / 1s],		train_loss: 2.7204
46:	[0s / 20s],		train_loss: 2.4233
5:	[0s / 2s],		train_loss: 2.6822
77:	[0s / 50s],		train_loss: 2.3963
47:	[0s / 20s],		train_loss: 2.4381
17:	[1s / 20s],		train_loss: 2.5451
6:	[0s / 2s],		train_loss: 2.6591
48:	[0s / 21s],		train_loss: 2.4194
7:	[0s / 2s],		train_loss