[I 2026-07-01 07:33:09,195] Trial 56 finished with value: 0.78211542125301 and parameters: {'num_nodes': [32], 'dropout': 0.11663838658544572, 'learning_rate': 0.003026962688118636, 'batch_norm': False}. Best is trial 3 with value: 0.8108369571214855.
/scratch.hpc/luca.cotugno/Foundation_model_clinical_data/test_tabular_model.py:481: UserWarning: Choices for a categorical distribution should be a tuple of None, bool, int, float and str for persistent storage but contains [32] which is of type list.
  num_nodes  = trial.suggest_categorical("num_nodes", [[32], [64], [128], [64, 32], [128, 64]])
/scratch.hpc/luca.cotugno/Foundation_model_clinical_data/test_tabular_model.py:481: UserWarning: Choices for a categorical distribution should be a tuple of None, bool, int, float and str for persistent storage but contains [64] which is of type list.
  num_nodes  = trial.suggest_categorical("num_nodes", [[32], [64], [128], [64, 32], [128, 64]])
/scratch.hpc/luca.cotugno/Foundation_model_clinical_data/test_tabular_model.py:481: UserWarning: Choices for a categorical distribution should be a tuple of None, bool, int, float and str for persistent storage but contains [128] which is of type list.
  num_nodes  = trial.suggest_categorical("num_nodes", [[32], [64], [128], [64, 32], [128, 64]])
/scratch.hpc/luca.cotugno/Foundation_model_clinical_data/test_tabular_model.py:481: UserWarning: Choices for a categorical distribution should be a tuple of None, bool, int, float and str for persistent storage but contains [64, 32] which is of type list.
  num_nodes  = trial.suggest_categorical("num_nodes", [[32], [64], [128], [64, 32], [128, 64]])
/scratch.hpc/luca.cotugno/Foundation_model_clinical_data/test_tabular_model.py:481: UserWarning: Choices for a categorical distribution should be a tuple of None, bool, int, float and str for persistent storage but contains [128, 64] which is of type list.
  num_nodes  = trial.suggest_categorical("num_nodes", [[32], [64], [128], [64, 32], [128, 64]])

28:	[0s / 14s],		train_loss: 4.2648
50:	[2s / 2m:10s],		train_loss: 3.9847
24:	[0s / 13s],		train_loss: 4.3059
86:	[0s / 54s],		train_loss: 3.6185
29:	[0s / 14s],		train_loss: 4.2535
25:	[0s / 13s],		train_loss: 4.3172
30:	[0s / 15s],		train_loss: 4.2516
87:	[0s / 54s],		train_loss: 3.6421
73:	[1s / 1m:24s],		train_loss: 4.0229
26:	[0s / 14s],		train_loss: 4.2975
75:	[9s / 9m:26s],		train_loss: 3.6719
31:	[0s / 15s],		train_loss: 4.2835
38:	[4s / 3m:7s],		train_loss: 4.1076
88:	[0s / 55s],		train_loss: 3.6286
27:	[0s / 14s],		train_loss: 4.2551
32:	[0s / 16s],		train_loss: 4.3235
74:	[1s / 1m:25s],		train_loss: 4.0248
28:	[0s / 15s],		train_loss: 4.2570
89:	[0s / 56s],		train_loss: 3.6290
33:	[0s / 16s],		train_loss: 4.3073
51:	[2s / 2m:13s],		train_loss: 4.0029
29:	[0s / 15s],		train_loss: 4.2460
34:	[0s / 17s],		train_loss: 4.2779
90:	[0s / 56s],		train_loss: 3.6257
75:	[1s / 1m:26s],		train_loss: 4.0231
30:	[0s / 16s],		train_loss: 4.2739
35:	[0s / 17s],		train_loss: 4.2875
91:	[0s / 57s],		train_loss: 3.6463
31:	[0s / 16s],		train_loss: 4.2467
36:	[0s / 18s],		train_loss: 4.3193
92:	[0s / 58s],		train_loss: 3.6234
32:	[0s / 17s],		train_loss: 4.2888
37:	[0s / 18s],		train_loss: 4.2591
76:	[1s / 1m:27s],		train_loss: 4.0200
33:	[0s / 18s],		train_loss: 4.3155
38:	[0s / 19s],		train_loss: 4.2708
93:	[0s / 58s],		train_loss: 3.6066
52:	[2s / 2m:15s],		train_loss: 3.9909
39:	[0s / 19s],		train_loss: 4.3115
34:	[0s / 18s],		train_loss: 4.2832
94:	[0s / 59s],		train_loss: 3.6176
77:	[1s / 1m:29s],		train_loss: 3.9936
40:	[0s / 20s],		train_loss: 4.3266
35:	[0s / 19s],		train_loss: 4.2380
95:	[0s / 1m:0s],		train_loss: 3.5888
39:	[4s / 3m:11s],		train_loss: 4.1057
41:	[0s / 20s],		train_loss: 4.2729
36:	[0s / 19s],		train_loss: 4.2529
78:	[1s / 1m:30s],		train_loss: 4.0148
42:	[0s / 21s],		train_loss: 4.2639
96:	[0s / 1m:0s],		train_loss: 3.5771
37:	[0s / 20s],		train_loss: 4.2826
43:	[0s / 21s],		train_loss: 4.2760
53:	[2s / 2m:18s],		train_loss: 3.9708
38:	[0s / 20s],		train_loss: 4.2084
97:	[0s / 1m:1s],		train_loss: 3.5918
79:	[1s / 1m:31s],		train_loss: 4.0225
44:	[0s / 22s],		train_loss: 4.2671
39:	[0s / 21s],		train_loss: 4.2273
98:	[0s / 1m:2s],		train_loss: 3.5829
45:	[0s / 22s],		train_loss: 4.2376
40:	[0s / 21s],		train_loss: 4.2611
46:	[0s / 23s],		train_loss: 4.2223
80:	[1s / 1m:32s],		train_loss: 4.0049
99:	[0s / 1m:3s],		train_loss: 3.5779
41:	[0s / 22s],		train_loss: 4.2284
47:	[0s / 24s],		train_loss: 4.2286
54:	[2s / 2m:21s],		train_loss: 3.9704
42:	[0s / 23s],		train_loss: 4.2491
0:	[0s / 0s],		train_loss: 4.6746
48:	[0s / 24s],		train_loss: 4.2567
76:	[9s / 9m:36s],		train_loss: 3.7008
81:	[1s / 1m:34s],		train_loss: 4.0093
43:	[0s / 24s],		train_loss: 4.2357
49:	[0s / 25s],		train_loss: 4.2793
1:	[0s / 1s],		train_loss: 4.4505
40:	[4s / 3m:16s],		train_loss: 4.1029
44:	[0s / 24s],		train_loss: 4.2135
50:	[0s / 25s],		train_loss: 4.2786
2:	[0s / 2s],		train_loss: 4.4084
82:	[1s / 1m:35s],		train_loss: 4.0135
40:	[19s / 9m:37s],		train_loss: 4.0481
45:	[0s / 25s],		train_loss: 4.2375
51:	[0s / 26s],		train_loss: 4.2177
3:	[0s / 2s],		train_loss: 4.4080
46:	[0s / 25s],		train_loss: 4.2106
52:	[0s / 27s],		train_loss: 4.2621
83:	[1s / 1m:36s],		train_loss: 3.9961
47:	[0s / 26s],		train_loss: 4.2026
55:	[2s / 2m:23s],		train_loss: 3.9566
4:	[0s / 3s],		train_loss: 4.3655
53:	[0s / 27s],		train_loss: 4.2417
48:	[0s / 26s],		train_loss: 4.1786
54:	[0s / 28s],		train_loss: 4.2191
5:	[0s / 4s],		train_loss: 4.3585
84:	[1s / 1m:37s],		train_loss: 3.9992
49:	[0s / 27s],		train_loss: 4.2336
55:	[0s / 28s],		train_loss: 4.2432
6:	[0s / 5s],		train_loss: 4.3535
56:	[0s / 29s],		train_loss: 4.2186
50:	[0s / 27s],		train_loss: 4.1860
7:	[0s / 5s],		train_loss: 4.3505
57:	[0s / 29s],		train_loss: 4.2239
51:	[0s / 28s],		train_loss: 4.2353
85:	[0s / 1m:38s],		train_loss: 3.9859
56:	[2s / 2m:26s],		train_loss: 3.9440
58:	[0s / 29s],		train_loss: 4.2085
52:	[0s / 28s],		train_loss: 4.2124
41:	[4s / 3m:21s],		train_loss: 4.0724
8:	[0s / 6s],		train_loss: 4.3378
59:	[0s / 30s],		train_loss: 4.2078
53:	[0s / 29s],		train_loss: 4.2056
9:	[0s / 6s],		train_loss: 4.3246
86:	[0s / 1m:39s],		train_loss: 4.0025
60:	[0s / 30s],		train_loss: 4.2274
54:	[0s / 29s],		train_loss: 4.1959
61:	[0s / 30s],		train_loss: 4.2276
10:	[0s / 7s],		train_loss: 4.3105
55:	[0s / 29s],		train_loss: 4.2161
62:	[0s / 31s],		train_loss: 4.2126
87:	[1s / 1m:40s],		train_loss: 4.0028
56:	[0s / 30s],		train_loss: 4.1740
11:	[0s / 7s],		train_loss: 4.3171
63:	[0s / 31s],		train_loss: 4.1828
57:	[0s / 30s],		train_loss: 4.2033
12:	[0s / 8s],		train_loss: 4.3270
64:	[0s / 32s],		train_loss: 4.2370
57:	[2s / 2m:28s],		train_loss: 3.9480
58:	[0s / 31s],		train_loss: 4.1755
88:	[1s / 1m:42s],		train_loss: 4.0047
65:	[0s / 32s],		train_loss: 4.1806
13:	[0s / 9s],		train_loss: 4.3662
59:	[0s / 32s],		train_loss: 4.1905
66:	[0s / 33s],		train_loss: 4.1974
14:	[0s / 9s],		train_loss: 4.3414
60:	[0s / 32s],		train_loss: 4.1811
67:	[0s / 33s],		train_loss: 4.1866
89:	[1s / 1m:43s],		train_loss: 3.9944
77:	[9s / 9m:45s],		train_loss: 3.6478
61:	[0s / 32s],		train_loss: 4.1870
15:	[0s / 10s],		train_loss: 4.3341
68:	[0s / 34s],		train_loss: 4.1715
62:	[0s / 33s],		train_loss: 4.1714
69:	[0s / 34s],		train_loss: 4.1770
16:	[0s / 11s],		train_loss: 4.3422
58:	[2s / 2m:31s],		train_loss: 3.9726
90:	[1s / 1m:44s],		train_loss: 3.9813
42:	[5s / 3m:26s],		train_loss: 4.0760
63:	[0s / 34s],		train_loss: 4.2182
70:	[0s / 35s],		train_loss: 4.2042
17:	[0s / 11s],		train_loss: 4.3029
64:	[0s / 34s],		train_loss: 4.2135
71:	[0s / 36s],		train_loss: 4.2411
91:	[1s / 1m:45s],		train_loss: 3.9975
18:	[0s / 12s],		train_loss: 4.3433
65:	[0s / 35s],		train_loss: 4.1895
72:	[0s / 36s],		train_loss: 4.2147
19:	[0s / 13s],		train_loss: 4.2786
66:	[0s / 35s],		train_loss: 4.1804
73:	[0s / 37s],		train_loss: 4.2064
92:	[1s / 1m:46s],		train_loss: 3.9958
74:	[0s / 37s],		train_loss: 4.2463
67:	[0s / 36s],		train_loss: 4.2055
59:	[2s / 2m:34s],		train_loss: 3.9539
20:	[0s / 13s],		train_loss: 4.3013
75:	[0s / 38s],		train_loss: 4.2126
68:	[0s / 37s],		train_loss: 4.1662
21:	[0s / 14s],		train_loss: 4.2830
93:	[1s / 1m:47s],		train_loss: 3.9755
76:	[0s / 38s],		train_loss: 4.1774
69:	[0s / 37s],		train_loss: 4.1785
22:	[0s / 15s],		train_loss: 4.3207
77:	[0s / 39s],		train_loss: 4.2620
70:	[0s / 38s],		train_loss: 4.1818
78:	[0s / 39s],		train_loss: 4.2748
94:	[0s / 1m:48s],		train_loss: 3.9926
23:	[0s / 15s],		train_loss: 4.2607
71:	[0s / 38s],		train_loss: 4.1592
43:	[4s / 3m:31s],		train_loss: 4.0738
60:	[2s / 2m:36s],		train_loss: 3.9329
79:	[0s / 40s],		train_loss: 4.2128
72:	[0s / 39s],		train_loss: 4.1563
24:	[0s / 16s],		train_loss: 4.2805
80:	[0s / 40s],		train_loss: 4.2095
73:	[0s / 39s],		train_loss: 4.1616
95:	[1s / 1m:50s],		train_loss: 3.9615
25:	[0s / 17s],		train_loss: 4.2870
81:	[0s / 41s],		train_loss: 4.2521
74:	[0s / 40s],		train_loss: 4.1654
26:	[0s / 17s],		train_loss: 4.2658
82:	[0s / 41s],		train_loss: 4.1963
75:	[0s / 40s],		train_loss: 4.1449
83:	[0s / 42s],		train_loss: 4.2293
96:	[1s / 1m:51s],		train_loss: 3.9816
27:	[0s / 18s],		train_loss: 4.2848
76:	[0s / 41s],		train_loss: 4.1731
84:	[0s / 42s],		train_loss: 4.2547
28:	[0s / 19s],		train_loss: 4.2340
77:	[0s / 41s],		train_loss: 4.1697
61:	[2s / 2m:39s],		train_loss: 3.9248
85:	[0s / 43s],		train_loss: 4.1982
97:	[1s / 1m:52s],		train_loss: 4.0249
78:	[0s / 42s],		train_loss: 4.1634
29:	[0s / 19s],		train_loss: 4.2590
78:	[9s / 9m:54s],		train_loss: 3.6926
86:	[0s / 43s],		train_loss: 4.2285
79:	[0s / 42s],		train_loss: 4.1506
87:	[0s / 44s],		train_loss: 4.2057
30:	[0s / 20s],		train_loss: 4.2523
98:	[1s / 1m:53s],		train_loss: 4.0064
80:	[0s / 43s],		train_loss: 4.1112
88:	[0s / 44s],		train_loss: 4.2246
41:	[18s / 9m:56s],		train_loss: 4.0401
31:	[0s / 21s],		train_loss: 4.2557
44:	[4s / 3m:36s],		train_loss: 4.0844
81:	[0s / 43s],		train_loss: 4.1266
89:	[0s / 45s],		train_loss: 4.1840
82:	[0s / 44s],		train_loss: 4.1687
32:	[0s / 21s],		train_loss: 4.3096
90:	[0s / 45s],		train_loss: 4.1709
99:	[1s / 1m:54s],		train_loss: 3.9585
62:	[2s / 2m:42s],		train_loss: 3.9331
83:	[0s / 44s],		train_loss: 4.2228
91:	[0s / 46s],		train_loss: 4.1835
33:	[0s / 22s],		train_loss: 4.2335
84:	[0s / 45s],		train_loss: 4.1913
92:	[0s / 46s],		train_loss: 4.1948
34:	[0s / 22s],		train_loss: 4.2394
93:	[0s / 47s],		train_loss: 4.2060
0:	[1s / 1s],		train_loss: 4.6768
85:	[0s / 45s],		train_loss: 4.1920
35:	[0s / 23s],		train_loss: 4.2409
94:	[0s / 47s],		train_loss: 4.2701
86:	[0s / 46s],		train_loss: 4.2161
95:	[0s / 48s],		train_loss: 4.1955
87:	[0s / 46s],		train_loss: 4.1628
36:	[0s / 24s],		train_loss: 4.2707
63:	[2s / 2m:44s],		train_loss: 3.9316
1:	[1s / 2s],		train_loss: 4.4401
96:	[0s / 48s],		train_loss: 4.1904
88:	[0s / 47s],		train_loss: 4.2361
37:	[0s / 25s],		train_loss: 4.2520
97:	[0s / 49s],		train_loss: 4.1624
89:	[0s / 47s],		train_loss: 4.1899
2:	[1s / 3s],		train_loss: 4.4302
98:	[0s / 49s],		train_loss: 4.1833
38:	[0s / 25s],		train_loss: 4.2631
90:	[0s / 48s],		train_loss: 4.1832
99:	[0s / 49s],		train_loss: 4.1650
45:	[4s / 3m:40s],		train_loss: 4.0842
39:	[0s / 26s],		train_loss: 4.2815
91:	[0s / 48s],		train_loss: 4.1826
3:	[0s / 4s],		train_loss: 4.3632
0:	[0s / 0s],		train_loss: 4.8397
64:	[2s / 2m:46s],		train_loss: 3.9201
92:	[0s / 49s],		train_loss: 4.1776
40:	[0s / 26s],		train_loss: 4.2275
1:	[0s / 0s],		train_loss: 4.4902
93:	[0s / 49s],		train_loss: 4.1794
4:	[1s / 5s],		train_loss: 4.3898
41:	[0s / 27s],		train_loss: 4.2414
2:	[0s / 1s],		train_loss: 4.4098
94:	[0s / 50s],		train_loss: 4.1234
3:	[0s / 1s],		train_loss: 4.4191
42:	[0s / 28s],		train_loss: 4.2400
95:	[0s / 50s],		train_loss: 4.1263
79:	[8s / 10m:3s],		train_loss: 3.6907
5:	[1s / 6s],		train_loss: 4.3543
4:	[0s / 2s],		train_loss: 4.4418
43:	[0s / 28s],		train_loss: 4.2288
96:	[0s / 51s],		train_loss: 4.1263
5:	[0s / 2s],		train_loss: 4.3822
97:	[0s / 52s],		train_loss: 4.1288
65:	[2s / 2m:49s],		train_loss: 3.9253
6:	[0s / 3s],		train_loss: 4.3538
44:	[0s / 29s],		train_loss: 4.2238
6:	[1s / 7s],		train_loss: 4.3812
98:	[0s / 52s],		train_loss: 4.1960
7:	[0s / 3s],		train_loss: 4.3882
45:	[0s / 30s],		train_loss: 4.2420
99:	[0s / 53s],		train_loss: 4.1349
8:	[0s / 4s],		train_loss: 4.3579
46:	[0s / 30s],		train_loss: 4.2243
7:	[1s / 8s],		train_loss: 4.3781
9:	[0s / 4s],		train_loss: 4.3657
0:	[0s / 0s],		train_loss: 4.7480
46:	[5s / 3m:46s],		train_loss: 4.0793
47:	[0s / 31s],		train_loss: 4.2141
10:	[0s / 5s],		train_loss: 4.3527
1:	[0s / 0s],		train_loss: 4.4420
66:	[2s / 2m:52s],		train_loss: 3.9288
8:	[1s / 9s],		train_loss: 4.3599
11:	[0s / 5s],		train_loss: 4.3607
48:	[0s / 31s],		train_loss: 4.2342
2:	[0s / 1s],		train_loss: 4.4148
12:	[0s / 6s],		train_loss: 4.3461
3:	[0s / 1s],		train_loss: 4.3809
49:	[0s / 32s],		train_loss: 4.2460
13:	[0s / 6s],		train_loss: 4.3389
9:	[1s / 10s],		train_loss: 4.3301
4:	[0s / 2s],		train_loss: 4.3952
14:	[0s / 7s],		train_loss: 4.3344
50:	[0s / 33s],		train_loss: 4.2517
5:	[0s / 2s],		train_loss: 4.3465
15:	[0s / 7s],		train_loss: 4.3133
51:	[0s / 33s],		train_loss: 4.2935
10:	[1s / 12s],		train_loss: 4.3405
6:	[0s / 3s],		train_loss: 4.3551
16:	[0s / 8s],		train_loss: 4.3413
67:	[2s / 2m:54s],		train_loss: 3.9423
7:	[0s / 4s],		train_loss: 4.3614
52:	[0s / 34s],		train_loss: 4.2675
17:	[0s / 8s],		train_loss: 4.3150
8:	[0s / 4s],		train_loss: 4.3621
11:	[1s / 13s],		train_loss: 4.3811
18:	[0s / 9s],		train_loss: 4.2915
53:	[0s / 35s],		train_loss: 4.3105
9:	[0s / 5s],		train_loss: 4.3179
19:	[0s / 9s],		train_loss: 4.2915
47:	[4s / 3m:50s],		train_loss: 4.0825
54:	[0s / 35s],		train_loss: 4.2395
10:	[0s / 5s],		train_loss: 4.3595
20:	[0s / 9s],		train_loss: 4.3271
12:	[1s / 14s],		train_loss: 4.3546
11:	[0s / 5s],		train_loss: 4.3302
55:	[0s / 36s],		train_loss: 4.2063
21:	[0s / 10s],		train_loss: 4.3165
68:	[2s / 2m:57s],		train_loss: 3.9111
12:	[0s / 6s],		train_loss: 4.3383
22:	[0s / 10s],		train_loss: 4.3129
80:	[8s / 10m:12s],		train_loss: 3.6357
56:	[0s / 37s],		train_loss: 4.2217
13:	[1s / 15s],		train_loss: 4.3591
13:	[0s / 6s],		train_loss: 4.3391
23:	[0s / 11s],		train_loss: 4.2901
42:	[16s / 10m:12s],		train_loss: 4.0307
57:	[0s / 37s],		train_loss: 4.2005
24:	[0s / 11s],		train_loss: 4.3036
14:	[0s / 7s],		train_loss: 4.2874
14:	[1s / 16s],		train_loss: 4.3385
58:	[0s / 38s],		train_loss: 4.2157
25:	[0s / 12s],		train_loss: 4.2737
15:	[0s / 7s],		train_loss: 4.2956
26:	[0s / 12s],		train_loss: 4.3017
16:	[0s / 8s],		train_loss: 4.3229
59:	[0s / 38s],		train_loss: 4.2171
27:	[0s / 13s],		train_loss: 4.3078
17:	[0s / 8s],		train_loss: 4.2950
15:	[1s / 17s],		train_loss: 4.3403
69:	[2s / 2m:59s],		train_loss: 3.9173
60:	[0s / 39s],		train_loss: 4.2111
28:	[0s / 13s],		train_loss: 4.2884
18:	[0s / 9s],		train_loss: 4.2697
29:	[0s / 14s],		train_loss: 4.3122
61:	[0s / 40s],		train_loss: 4.2000
19:	[0s / 9s],		train_loss: 4.2977
48:	[4s / 3m:55s],		train_loss: 4.0747
16:	[1s / 18s],		train_loss: 4.3159
30:	[0s / 14s],		train_loss: 4.3127
62:	[0s / 40s],		train_loss: 4.2140
20:	[0s / 10s],		train_loss: 4.2686
31:	[0s / 14s],		train_loss: 4.2899
21:	[0s / 10s],		train_loss: 4.2660
63:	[0s / 41s],		train_loss: 4.1988
32:	[0s / 15s],		train_loss: 4.3004
17:	[1s / 19s],		train_loss: 4.3051
70:	[2s / 3m:2s],		train_loss: 3.9235
22:	[0s / 11s],		train_loss: 4.2724
33:	[0s / 15s],		train_loss: 4.2496
64:	[0s / 42s],		train_loss: 4.2537
23:	[0s / 11s],		train_loss: 4.2571
34:	[0s / 16s],		train_loss: 4.2548
18:	[1s / 20s],		train_loss: 4.2919
65:	[0s / 42s],		train_loss: 4.2250
24:	[0s / 12s],		train_loss: 4.2459
35:	[0s / 16s],		train_loss: 4.2561
66:	[0s / 43s],		train_loss: 4.2312
25:	[0s / 13s],		train_loss: 4.2501
36:	[0s / 17s],		train_loss: 4.2424
19:	[1s / 21s],		train_loss: 4.3334
26:	[0s / 13s],		train_loss: 4.2594
37:	[0s / 18s],		train_loss: 4.2454
67:	[0s / 44s],		train_loss: 4.1993
71:	[2s / 3m:4s],		train_loss: 3.8644
38:	[0s / 18s],		train_loss: 4.2549
27:	[0s / 14s],		train_loss: 4.2502
68:	[0s / 44s],		train_loss: 4.2082
20:	[1s / 23s],		train_loss: 4.3220
39:	[0s / 19s],		train_loss: 4.3007
28:	[0s / 14s],		train_loss: 4.2279
49:	[5s / 4m:0s],		train_loss: 4.0427
69:	[0s / 45s],		train_loss: 4.2127
40:	[0s / 19s],		train_loss: 4.2664
29:	[0s / 15s],		train_loss: 4.2488
70:	[0s / 46s],		train_loss: 4.2077
41:	[0s / 20s],		train_loss: 4.2342
30:	[0s / 15s],		train_loss: 4.2293
21:	[1s / 24s],		train_loss: 4.3178
81:	[9s / 10m:21s],		train_loss: 3.6418
42:	[0s / 20s],		train_loss: 4.2499
71:	[0s / 46s],		train_loss: 4.1981
31:	[0s / 16s],		train_loss: 4.2681
72:	[2s / 3m:7s],		train_loss: 3.8819
43:	[0s / 21s],		train_loss: 4.2429
32:	[0s / 16s],		train_loss: 4.2227
22:	[1s / 25s],		train_loss: 4.3364
72:	[0s / 47s],		train_loss: 4.2099
44:	[0s / 21s],		train_loss: 4.2257
33:	[0s / 17s],		train_loss: 4.2412
73:	[0s / 48s],		train_loss: 4.2008
45:	[0s / 22s],		train_loss: 4.2423
23:	[1s / 26s],		train_loss: 4.2888
34:	[0s / 17s],		train_loss: 4.2192
46:	[0s / 22s],		train_loss: 4.2023
74:	[0s / 48s],		train_loss: 4.1781
35:	[0s / 18s],		train_loss: 4.2613
47:	[0s / 23s],		train_loss: 4.2348
73:	[2s / 3m:9s],		train_loss: 3.8753
24:	[0s / 27s],		train_loss: 4.3273
75:	[0s / 49s],		train_loss: 4.2039
36:	[0s / 18s],		train_loss: 4.2443
48:	[0s / 23s],		train_loss: 4.2083
50:	[4s / 4m:4s],		train_loss: 4.0448
37:	[0s / 19s],		train_loss: 4.2539
76:	[0s / 50s],		train_loss: 4.1983
49:	[0s / 24s],		train_loss: 4.2328
25:	[1s / 28s],		train_loss: 4.2882
38:	[0s / 20s],		train_loss: 4.2502
50:	[0s / 24s],		train_loss: 4.2309
77:	[0s / 50s],		train_loss: 4.1779
51:	[0s / 24s],		train_loss: 4.2481
39:	[0s / 20s],		train_loss: 4.2517
74:	[1s / 3m:11s],		train_loss: 3.8813
78:	[0s / 51s],		train_loss: 4.1811
26:	[0s / 29s],		train_loss: 4.2873
52:	[0s / 25s],		train_loss: 4.2344
40:	[0s / 20s],		train_loss: 4.2637
53:	[0s / 25s],		train_loss: 4.2377
79:	[0s / 51s],		train_loss: 4.1969
41:	[0s / 21s],		train_loss: 4.2317
27:	[0s / 30s],		train_loss: 4.2900
54:	[0s / 26s],		train_loss: 4.2109
42:	[0s / 21s],		train_loss: 4.2117
80:	[0s / 52s],		train_loss: 4.2118
55:	[0s / 26s],		train_loss: 4.1907
43:	[0s / 22s],		train_loss: 4.2244
75:	[1s / 3m:13s],		train_loss: 3.8673
81:	[0s / 53s],		train_loss: 4.2027
28:	[0s / 31s],		train_loss: 4.3198
56:	[0s / 27s],		train_loss: 4.2257
44:	[0s / 22s],		train_loss: 4.2502
57:	[0s / 27s],		train_loss: 4.2049
51:	[3s / 4m:8s],		train_loss: 4.0413
82:	[0s / 53s],		train_loss: 4.1997
82:	[7s / 10m:28s],		train_loss: 3.6302
45:	[0s / 23s],		train_loss: 4.2636
29:	[0s / 32s],		train_loss: 4.3159
58:	[0s / 27s],		train_loss: 4.2123
83:	[0s / 54s],		train_loss: 4.1789
46:	[0s / 23s],		train_loss: 4.2273
59:	[0s / 28s],		train_loss: 4.1974
43:	[16s / 10m:29s],		train_loss: 4.0483
47:	[0s / 24s],		train_loss: 4.2368
84:	[0s / 54s],		train_loss: 4.1700
76:	[1s / 3m:15s],		train_loss: 3.8618
30:	[1s / 33s],		train_loss: 4.2774
60:	[0s / 28s],		train_loss: 4.2150
48:	[0s / 24s],		train_loss: 4.2557
61:	[0s / 29s],		train_loss: 4.1909
85:	[0s / 55s],		train_loss: 4.2073
49:	[0s / 25s],		train_loss: 4.2945
62:	[0s / 29s],		train_loss: 4.2211
31:	[0s / 33s],		train_loss: 4.3033
86:	[0s / 56s],		train_loss: 4.1424
50:	[0s / 25s],		train_loss: 4.2485
63:	[0s / 30s],		train_loss: 4.2272
51:	[0s / 26s],		train_loss: 4.2132
87:	[0s / 56s],		train_loss: 4.2061
64:	[0s / 30s],		train_loss: 4.2055
32:	[1s / 35s],		train_loss: 4.2895
77:	[2s / 3m:17s],		train_loss: 3.8527
52:	[0s / 26s],		train_loss: 4.2416
65:	[0s / 31s],		train_loss: 4.1875
88:	[0s / 57s],		train_loss: 4.1775
52:	[4s / 4m:12s],		train_loss: 4.0249
66:	[0s / 31s],		train_loss: 4.1715
53:	[0s / 27s],		train_loss: 4.1900
33:	[1s / 36s],		train_loss: 4.2821
89:	[0s / 58s],		train_loss: 4.1688
67:	[0s / 32s],		train_loss: 4.1766
54:	[0s / 27s],		train_loss: 4.2346
90:	[0s / 58s],		train_loss: 4.1603
68:	[0s / 32s],		train_loss: 4.2162
55:	[0s / 28s],		train_loss: 4.2475
34:	[1s / 37s],		train_loss: 4.3045
69:	[0s / 33s],		train_loss: 4.2274
78:	[2s / 3m:19s],		train_loss: 3.8654
91:	[0s / 59s],		train_loss: 4.1506
56:	[0s / 29s],		train_loss: 4.2844
70:	[0s / 33s],		train_loss: 4.1952
92:	[0s / 1m:0s],		train_loss: 4.1640
57:	[0s / 29s],		train_loss: 4.2744
35:	[1s / 38s],		train_loss: 4.2757
71:	[0s / 34s],		train_loss: 4.1737
58:	[0s / 30s],		train_loss: 4.2569
93:	[0s / 1m:1s],		train_loss: 4.1719
72:	[0s / 35s],		train_loss: 4.2028
59:	[0s / 31s],		train_loss: 4.2391
36:	[1s / 39s],		train_loss: 4.2972
73:	[0s / 35s],		train_loss: 4.1806
94:	[0s / 1m:1s],		train_loss: 4.1644
79:	[2s / 3m:22s],		train_loss: 3.8396
60:	[0s / 31s],		train_loss: 4.2613
74:	[0s / 35s],		train_loss: 4.1852
95:	[0s / 1m:2s],		train_loss: 4.1705
53:	[4s / 4m:17s],		train_loss: 3.9988
61:	[0s / 31s],		train_loss: 4.2529
37:	[0s / 40s],		train_loss: 4.2655
83:	[8s / 10m:37s],		train_loss: 3.6069
75:	[0s / 36s],		train_loss: 4.2049
96:	[0s / 1m:2s],		train_loss: 4.1438
62:	[0s / 32s],		train_loss: 4.2367
76:	[0s / 36s],		train_loss: 4.1570
63:	[0s / 32s],		train_loss: 4.2327
38:	[0s / 41s],		train_loss: 4.2456
77:	[0s / 37s],		train_loss: 4.2028
97:	[0s / 1m:3s],		train_loss: 4.1925
78:	[0s / 37s],		train_loss: 4.1918
64:	[0s / 33s],		train_loss: 4.2110
80:	[2s / 3m:24s],		train_loss: 3.8618
98:	[0s / 1m:4s],		train_loss: 4.1519
79:	[0s / 38s],		train_loss: 4.1805
65:	[0s / 33s],		train_loss: 4.2178
39:	[0s / 42s],		train_loss: 4.2772
99:	[0s / 1m:4s],		train_loss: 4.2306
80:	[0s / 38s],		train_loss: 4.1479
66:	[0s / 34s],		train_loss: 4.2264
81:	[0s / 38s],		train_loss: 4.1487
0:	[0s / 0s],		train_loss: 4.7345
67:	[0s / 34s],		train_loss: 4.2586
40:	[0s / 43s],		train_loss: 4.3143
82:	[0s / 39s],		train_loss: 4.1496
68:	[0s / 35s],		train_loss: 4.2459
1:	[0s / 1s],		train_loss: 4.4614
83:	[0s / 39s],		train_loss: 4.1551
69:	[0s / 35s],		train_loss: 4.2141
81:	[2s / 3m:26s],		train_loss: 3.8592
2:	[0s / 1s],		train_loss: 4.4399
41:	[1s / 44s],		train_loss: 4.2622
84:	[0s / 40s],		train_loss: 4.1718
70:	[0s / 36s],	