[I 2026-07-01 09:04:02,155] Trial 21 finished with value: 0.825849814456479 and parameters: {'n_estimators': 250, 'max_depth': 3, 'min_samples_split': 11, 'min_samples_leaf': 15, 'max_features': 'sqrt'}. Best is trial 17 with value: 0.8262670779617856.
[I 2026-07-01 09:07:54,823] Trial 13 finished with value: 0.8175961643170072 and parameters: {'n_estimators': 300, 'max_depth': 9, 'min_samples_split': 20, 'min_samples_leaf': 12, 'max_features': 'sqrt'}. Best is trial 17 with value: 0.8262670779617856.
[I 2026-07-01 09:07:56,097] Trial 24 finished with value: 0.8227839486006752 and parameters: {'n_estimators': 250, 'max_depth': 3, 'min_samples_split': 9, 'min_samples_leaf': 9, 'max_features': 'log2'}. Best is trial 17 with value: 0.8262670779617856.
[I 2026-07-01 09:13:08,010] Trial 22 finished with value: 0.825849814456479 and parameters: {'n_estimators': 250, 'max_depth': 3, 'min_samples_split': 10, 'min_samples_leaf': 15, 'max_features': 'sqrt'}. Best is trial 17 with value: 0.8262670779617856.
[I 2026-07-01 09:26:33,320] Trial 23 finished with value: 0.825849814456479 and parameters: {'n_estimators': 250, 'max_depth': 3, 'min_samples_split': 9, 'min_samples_leaf': 15, 'max_features': 'sqrt'}. Best is trial 17 with value: 0.8262670779617856.
[I 2026-07-01 09:40:54,396] Trial 29 finished with value: 0.8260990207657963 and parameters: {'n_estimators': 200, 'max_depth': 4, 'min_samples_split': 9, 'min_samples_leaf': 11, 'max_features': 'sqrt'}. Best is trial 17 with value: 0.8262670779617856.
[I 2026-07-01 09:41:46,614] Trial 25 finished with value: 0.8259550465324722 and parameters: {'n_estimators': 300, 'max_depth': 3, 'min_samples_split': 10, 'min_samples_leaf': 15, 'max_features': 'sqrt'}. Best is trial 17 with value: 0.8262670779617856.
[I 2026-07-01 09:41:47,199] Trial 30 finished with value: 0.8260471900417996 and parameters: {'n_estimators': 200, 'max_depth': 4, 'min_samples_split': 9, 'min_samples_leaf': 14, 'max_features': 'sqrt'}. Best is trial 17 with value: 0.8262670779617856.
[I 2026-07-01 09:44:04,141] Trial 26 finished with value: 0.8257848951658164 and parameters: {'n_estimators': 300, 'max_depth': 3, 'min_samples_split': 9, 'min_samples_leaf': 9, 'max_features': 'sqrt'}. Best is trial 17 with value: 0.8262670779617856.
[I 2026-07-01 09:46:07,131] Trial 31 finished with value: 0.8261388100084605 and parameters: {'n_estimators': 200, 'max_depth': 4, 'min_samples_split': 5, 'min_samples_leaf': 13, 'max_features': 'sqrt'}. Best is trial 17 with value: 0.8262670779617856.
[I 2026-07-01 09:52:21,508] Trial 28 finished with value: 0.8266330342857622 and parameters: {'n_estimators': 300, 'max_depth': 4, 'min_samples_split': 9, 'min_samples_leaf': 12, 'max_features': 'sqrt'}. Best is trial 28 with value: 0.8266330342857622.
[I 2026-07-01 09:52:33,024] Trial 27 finished with value: 0.8263408974777808 and parameters: {'n_estimators': 300, 'max_depth': 4, 'min_samples_split': 9, 'min_samples_leaf': 9, 'max_features': 'sqrt'}. Best is trial 28 with value: 0.8266330342857622.
[I 2026-07-01 09:59:10,621] Trial 32 finished with value: 0.8261388100084605 and parameters: {'n_estimators': 200, 'max_depth': 4, 'min_samples_split': 5, 'min_samples_leaf': 13, 'max_features': 'sqrt'}. Best is trial 28 with value: 0.8266330342857622.
[I 2026-07-01 10:13:41,991] Trial 33 finished with value: 0.8260990207657963 and parameters: {'n_estimators': 200, 'max_depth': 4, 'min_samples_split': 5, 'min_samples_leaf': 11, 'max_features': 'sqrt'}. Best is trial 28 with value: 0.8266330342857622.
[I 2026-07-01 10:14:35,693] Trial 34 finished with value: 0.8260990207657963 and parameters: {'n_estimators': 200, 'max_depth': 4, 'min_samples_split': 5, 'min_samples_leaf': 11, 'max_features': 'sqrt'}. Best is trial 28 with value: 0.8266330342857622.
[I 2026-07-01 10:14:37,286] Trial 35 finished with value: 0.8256294029938264 and parameters: {'n_estimators': 200, 'max_depth': 4, 'min_samples_split': 5, 'min_samples_leaf': 10, 'max_features': 'sqrt'}. Best is trial 28 with value: 0.8266330342857622.
[I 2026-07-01 10:17:08,880] Trial 36 finished with value: 0.8260990207657963 and parameters: {'n_estimators': 200, 'max_depth': 4, 'min_samples_split': 5, 'min_samples_leaf': 11, 'max_features': 'sqrt'}. Best is trial 28 with value: 0.8266330342857622.
[I 2026-07-01 10:19:05,697] Trial 37 finished with value: 0.8260990207657963 and parameters: {'n_estimators': 200, 'max_depth': 4, 'min_samples_split': 5, 'min_samples_leaf': 11, 'max_features': 'sqrt'}. Best is trial 28 with value: 0.8266330342857622.
[I 2026-07-01 10:25:08,025] Trial 38 finished with value: 0.8260990207657963 and parameters: {'n_estimators': 200, 'max_depth': 4, 'min_samples_split': 5, 'min_samples_leaf': 11, 'max_features': 'sqrt'}. Best is trial 28 with value: 0.8266330342857622.
[I 2026-07-01 10:42:04,907] Trial 39 finished with value: 0.8257545296911517 and parameters: {'n_estimators': 300, 'max_depth': 4, 'min_samples_split': 5, 'min_samples_leaf': 3, 'max_features': 'sqrt'}. Best is trial 28 with value: 0.8266330342857622.
[I 2026-07-01 10:55:14,621] Trial 40 finished with value: 0.8236027693312894 and parameters: {'n_estimators': 300, 'max_depth': 5, 'min_samples_split': 6, 'min_samples_leaf': 3, 'max_features': 'sqrt'}. Best is trial 28 with value: 0.8266330342857622.
[I 2026-07-01 11:09:10,457] Trial 41 finished with value: 0.8239650608565996 and parameters: {'n_estimators': 300, 'max_depth': 5, 'min_samples_split': 7, 'min_samples_leaf': 8, 'max_features': 'sqrt'}. Best is trial 28 with value: 0.8266330342857622.
[I 2026-07-01 11:10:56,743] Trial 42 finished with value: 0.823754596704613 and parameters: {'n_estimators': 300, 'max_depth': 5, 'min_samples_split': 7, 'min_samples_leaf': 3, 'max_features': 'sqrt'}. Best is trial 28 with value: 0.8266330342857622.
[I 2026-07-01 11:10:56,920] Trial 43 finished with value: 0.823754596704613 and parameters: {'n_estimators': 300, 'max_depth': 5, 'min_samples_split': 7, 'min_samples_leaf': 3, 'max_features': 'sqrt'}. Best is trial 28 with value: 0.8266330342857622.
[I 2026-07-01 11:13:33,611] Trial 44 finished with value: 0.823754596704613 and parameters: {'n_estimators': 300, 'max_depth': 5, 'min_samples_split': 7, 'min_samples_leaf': 3, 'max_features': 'sqrt'}. Best is trial 28 with value: 0.8266330342857622.
[I 2026-07-01 11:15:25,821] Trial 45 finished with value: 0.823754596704613 and parameters: {'n_estimators': 300, 'max_depth': 5, 'min_samples_split': 7, 'min_samples_leaf': 3, 'max_features': 'sqrt'}. Best is trial 28 with value: 0.8266330342857622.
[I 2026-07-01 11:20:16,594] Trial 46 finished with value: 0.8239650608565996 and parameters: {'n_estimators': 300, 'max_depth': 5, 'min_samples_split': 7, 'min_samples_leaf': 8, 'max_features': 'sqrt'}. Best is trial 28 with value: 0.8266330342857622.
[I 2026-07-01 11:28:33,204] Trial 54 finished with value: 0.8228661447993366 and parameters: {'n_estimators': 150, 'max_depth': 4, 'min_samples_split': 14, 'min_samples_leaf': 13, 'max_features': 'log2'}. Best is trial 28 with value: 0.8266330342857622.
[I 2026-07-01 11:37:47,350] Trial 47 finished with value: 0.8241797133499191 and parameters: {'n_estimators': 300, 'max_depth': 5, 'min_samples_split': 7, 'min_samples_leaf': 6, 'max_features': 'sqrt'}. Best is trial 28 with value: 0.8266330342857622.
[I 2026-07-01 11:38:41,615] Trial 50 finished with value: 0.8247713165632147 and parameters: {'n_estimators': 150, 'max_depth': 5, 'min_samples_split': 6, 'min_samples_leaf': 13, 'max_features': 'sqrt'}. Best is trial 28 with value: 0.8266330342857622.
[I 2026-07-01 11:39:01,268] Trial 55 finished with value: 0.8202102128515065 and parameters: {'n_estimators': 50, 'max_depth': 6, 'min_samples_split': 6, 'min_samples_leaf': 13, 'max_features': 'sqrt'}. Best is trial 28 with value: 0.8266330342857622.
[I 2026-07-01 11:39:14,976] Trial 49 finished with value: 0.8227504418700107 and parameters: {'n_estimators': 150, 'max_depth': 6, 'min_samples_split': 6, 'min_samples_leaf': 13, 'max_features': 'sqrt'}. Best is trial 28 with value: 0.8266330342857622.
[I 2026-07-01 11:41:05,131] Trial 51 finished with value: 0.8227504418700107 and parameters: {'n_estimators': 150, 'max_depth': 6, 'min_samples_split': 6, 'min_samples_leaf': 13, 'max_features': 'sqrt'}. Best is trial 28 with value: 0.8266330342857622.
[I 2026-07-01 11:42:06,692] Trial 57 finished with value: 0.82223894068471 and parameters: {'n_estimators': 50, 'max_depth': 6, 'min_samples_split': 13, 'min_samples_leaf': 13, 'max_features': 'log2'}. Best is trial 28 with value: 0.8266330342857622.
[I 2026-07-01 11:43:42,504] Trial 52 finished with value: 0.8227504418700107 and parameters: {'n_estimators': 150, 'max_depth': 6, 'min_samples_split': 6, 'min_samples_leaf': 13, 'max_features': 'sqrt'}. Best is trial 28 with value: 0.8266330342857622.
[I 2026-07-01 11:45:30,567] Trial 53 finished with value: 0.8227504418700107 and parameters: {'n_estimators': 150, 'max_depth': 6, 'min_samples_split': 14, 'min_samples_leaf': 13, 'max_features': 'sqrt'}. Best is trial 28 with value: 0.8266330342857622.
[I 2026-07-01 11:47:54,993] Trial 56 finished with value: 0.8202102128515065 and parameters: {'n_estimators': 50, 'max_depth': 6, 'min_samples_split': 6, 'min_samples_leaf': 13, 'max_features': 'sqrt'}. Best is trial 28 with value: 0.8266330342857622.
[I 2026-07-01 11:54:01,791] Trial 48 finished with value: 0.8231577580646512 and parameters: {'n_estimators': 300, 'max_depth': 6, 'min_samples_split': 7, 'min_samples_leaf': 13, 'max_features': 'sqrt'}. Best is trial 28 with value: 0.8266330342857622.
[I 2026-07-01 12:13:59,356] Trial 65 finished with value: 0.8204819314954892 and parameters: {'n_estimators': 250, 'max_depth': 10, 'min_samples_split': 8, 'min_samples_leaf': 12, 'max_features': 'log2'}. Best is trial 28 with value: 0.8266330342857622.
[I 2026-07-01 12:15:50,940] Trial 58 finished with value: 0.8126575863426566 and parameters: {'n_estimators': 150, 'max_depth': 10, 'min_samples_split': 8, 'min_samples_leaf': 12, 'max_features': 'sqrt'}. Best is trial 28 with value: 0.8266330342857622.
[I 2026-07-01 12:20:06,809] Trial 59 finished with value: 0.8265456026604344 and parameters: {'n_estimators': 250, 'max_depth': 4, 'min_samples_split': 8, 'min_samples_leaf': 12, 'max_features': 'sqrt'}. Best is trial 28 with value: 0.8266330342857622.
[I 2026-07-01 12:22:04,225] Trial 60 finished with value: 0.8265456026604344 and parameters: {'n_estimators': 250, 'max_depth': 4, 'min_samples_split': 8, 'min_samples_leaf': 12, 'max_features': 'sqrt'}. Best is trial 28 with value: 0.8266330342857622.
[I 2026-07-01 12:23:03,883] Trial 61 finished with value: 0.8265456026604344 and parameters: {'n_estimators': 250, 'max_depth': 4, 'min_samples_split': 8, 'min_samples_leaf': 12, 'max_features': 'sqrt'}. Best is trial 28 with value: 0.8266330342857622.
[I 2026-07-01 12:24:32,755] Trial 62 finished with value: 0.8265456026604344 and parameters: {'n_estimators': 250, 'max_depth': 4, 'min_samples_split': 8, 'min_samples_leaf': 12, 'max_features': 'sqrt'}. Best is trial 28 with value: 0.8266330342857622.
[I 2026-07-01 12:26:27,420] Trial 63 finished with value: 0.8265456026604344 and parameters: {'n_estimators': 250, 'max_depth': 4, 'min_samples_split': 11, 'min_samples_leaf': 12, 'max_features': 'sqrt'}. Best is trial 28 with value: 0.8266330342857622.
[I 2026-07-01 12:28:30,715] Trial 64 finished with value: 0.8265456026604344 and parameters: {'n_estimators': 250, 'max_depth': 4, 'min_samples_split': 8, 'min_samples_leaf': 12, 'max_features': 'sqrt'}. Best is trial 28 with value: 0.8266330342857622.
[I 2026-07-01 12:48:24,544] Trial 66 finished with value: 0.8258503379991455 and parameters: {'n_estimators': 250, 'max_depth': 3, 'min_samples_split': 11, 'min_samples_leaf': 12, 'max_features': 'sqrt'}. Best is trial 28 with value: 0.8266330342857622.
[I 2026-07-01 12:50:06,816] Trial 67 finished with value: 0.8258273021218138 and parameters: {'n_estimators': 250, 'max_depth': 3, 'min_samples_split': 12, 'min_samples_leaf': 14, 'max_features': 'sqrt'}. Best is trial 28 with value: 0.8266330342857622.
[I 2026-07-01 12:56:44,680] Trial 69 finished with value: 0.8258273021218138 and parameters: {'n_estimators': 250, 'max_depth': 3, 'min_samples_split': 11, 'min_samples_leaf': 14, 'max_features': 'sqrt'}. Best is trial 28 with value: 0.8266330342857622.
[I 2026-07-01 12:57:42,415] Trial 70 finished with value: 0.8258273021218138 and parameters: {'n_estimators': 250, 'max_depth': 3, 'min_samples_split': 11, 'min_samples_leaf': 14, 'max_features': 'sqrt'}. Best is trial 28 with value: 0.8266330342857622.
[I 2026-07-01 12:59:12,581] Trial 71 finished with value: 0.8258503379991455 and parameters: {'n_estimators': 250, 'max_depth': 3, 'min_samples_split': 11, 'min_samples_leaf': 12, 'max_features': 'sqrt'}. Best is trial 28 with value: 0.8266330342857622.
[I 2026-07-01 13:00:25,132] Trial 68 finished with value: 0.826473353772439 and parameters: {'n_estimators': 250, 'max_depth': 4, 'min_samples_split': 11, 'min_samples_leaf': 14, 'max_features': 'sqrt'}. Best is trial 28 with value: 0.8266330342857622.
[I 2026-07-01 13:01:03,091] Trial 72 finished with value: 0.8258503379991455 and parameters: {'n_estimators': 250, 'max_depth': 3, 'min_samples_split': 11, 'min_samples_leaf': 12, 'max_features': 'sqrt'}. Best is trial 28 with value: 0.8266330342857622.
[I 2026-07-01 13:02:58,771] Trial 73 finished with value: 0.8258503379991455 and parameters: {'n_estimators': 250, 'max_depth': 3, 'min_samples_split': 11, 'min_samples_leaf': 12, 'max_features': 'sqrt'}. Best is trial 28 with value: 0.8266330342857622.
[I 2026-07-01 13:10:01,922] Trial 76 finished with value: 0.8237074778646161 and parameters: {'n_estimators': 250, 'max_depth': 4, 'min_samples_split': 8, 'min_samples_leaf': 10, 'max_features': 'log2'}. Best is trial 28 with value: 0.8266330342857622.
[I 2026-07-01 13:11:00,012] Trial 77 finished with value: 0.8237074778646161 and parameters: {'n_estimators': 250, 'max_depth': 4, 'min_samples_split': 8, 'min_samples_leaf': 10, 'max_features': 'log2'}. Best is trial 28 with value: 0.8266330342857622.
[I 2026-07-01 13:16:42,101] Trial 81 finished with value: 0.8237074778646161 and parameters: {'n_estimators': 250, 'max_depth': 4, 'min_samples_split': 8, 'min_samples_leaf': 10, 'max_features': 'log2'}. Best is trial 28 with value: 0.8266330342857622.
[I 2026-07-01 13:23:04,908] Trial 74 finished with value: 0.8258273021218138 and parameters: {'n_estimators': 250, 'max_depth': 3, 'min_samples_split': 11, 'min_samples_leaf': 14, 'max_features': 'sqrt'}. Best is trial 28 with value: 0.8266330342857622.
[I 2026-07-01 13:31:18,784] Trial 75 finished with value: 0.8262801665284514 and parameters: {'n_estimators': 250, 'max_depth': 4, 'min_samples_split': 8, 'min_samples_leaf': 10, 'max_features': 'sqrt'}. Best is trial 28 with value: 0.8266330342857622.
[I 2026-07-01 13:40:15,740] Trial 78 finished with value: 0.8262801665284514 and parameters: {'n_estimators': 250, 'max_depth': 4, 'min_samples_split': 8, 'min_samples_leaf': 10, 'max_features': 'sqrt'}. Best is trial 28 with value: 0.8266330342857622.
[I 2026-07-01 13:41:39,667] Trial 79 finished with value: 0.8262801665284514 and parameters: {'n_estimators': 250, 'max_depth': 4, 'min_samples_split': 8, 'min_samples_leaf': 10, 'max_features': 'sqrt'}. Best is trial 28 with value: 0.8266330342857622.
[I 2026-07-01 13:42:15,965] Trial 80 finished with value: 0.8262801665284514 and parameters: {'n_estimators': 250, 'max_depth': 4, 'min_samples_split': 8, 'min_samples_leaf': 10, 'max_features': 'sqrt'}. Best is trial 28 with value: 0.8266330342857622.
[I 2026-07-01 13:51:11,196] Trial 82 finished with value: 0.8262801665284514 and parameters: {'n_estimators': 250, 'max_depth': 4, 'min_samples_split': 8, 'min_samples_leaf': 10, 'max_features': 'sqrt'}. Best is trial 28 with value: 0.8266330342857622.
[I 2026-07-01 13:51:59,365] Trial 83 finished with value: 0.8265314670084353 and parameters: {'n_estimators': 250, 'max_depth': 4, 'min_samples_split': 10, 'min_samples_leaf': 11, 'max_features': 'sqrt'}. Best is trial 28 with value: 0.8266330342857622.
[I 2026-07-01 13:57:46,907] Trial 84 finished with value: 0.8265314670084353 and parameters: {'n_estimators': 250, 'max_depth': 4, 'min_samples_split': 10, 'min_samples_leaf': 11, 'max_features': 'sqrt'}. Best is trial 28 with value: 0.8266330342857622.
[I 2026-07-01 14:03:42,752] Trial 85 finished with value: 0.8265314670084353 and parameters: {'n_estimators': 250, 'max_depth': 4, 'min_samples_split': 10, 'min_samples_leaf': 11, 'max_features': 'sqrt'}. Best is trial 28 with value: 0.8266330342857622.
[I 2026-07-01 14:12:23,281] Trial 86 finished with value: 0.8265314670084353 and parameters: {'n_estimators': 250, 'max_depth': 4, 'min_samples_split': 10, 'min_samples_leaf': 11, 'max_features': 'sqrt'}. Best is trial 28 with value: 0.8266330342857622.
[I 2026-07-01 14:21:05,389] Trial 87 finished with value: 0.8265314670084353 and parameters: {'n_estimators': 250, 'max_depth': 4, 'min_samples_split': 10, 'min_samples_leaf': 11, 'max_features': 'sqrt'}. Best is trial 28 with value: 0.8266330342857622.
[I 2026-07-01 14:22:28,958] Trial 88 finished with value: 0.8265314670084353 and parameters: {'n_estimators': 250, 'max_depth': 4, 'min_samples_split': 10, 'min_samples_leaf': 11, 'max_features': 'sqrt'}. Best is trial 28 with value: 0.8266330342857622.
[I 2026-07-01 14:24:38,811] Trial 91 finished with value: 0.8260990207657963 and parameters: {'n_estimators': 200, 'max_depth': 4, 'min_samples_split': 10, 'min_samples_leaf': 11, 'max_features': 'sqrt'}. Best is trial 28 with value: 0.8266330342857622.
[I 2026-07-01 14:30:45,537] Trial 89 finished with value: 0.8265843448177652 and parameters: {'n_estimators': 300, 'max_depth': 4, 'min_samples_split': 10, 'min_samples_leaf': 11, 'max_features': 'sqrt'}. Best is trial 28 with value: 0.8266330342857622.
[I 2026-07-01 14:40:43,665] Trial 93 finished with value: 0.8241598187285871 and parameters: {'n_estimators': 200, 'max_depth': 5, 'min_samples_split': 10, 'min_samples_leaf': 12, 'max_features': 'sqrt'}. Best is trial 28 with value: 0.8266330342857622.
[I 2026-07-01 14:40:52,067] Trial 90 finished with value: 0.8265843448177652 and parameters: {'n_estimators': 300, 'max_depth': 4, 'min_samples_split': 10, 'min_samples_leaf': 11, 'max_features': 'sqrt'}. Best is trial 28 with value: 0.8266330342857622.
[I 2026-07-01 14:43:28,013] Trial 92 finished with value: 0.8246404308965564 and parameters: {'n_estimators': 250, 'max_depth': 5, 'min_samples_split': 10, 'min_samples_leaf': 11, 'max_features': 'sqrt'}. Best is trial 28 with value: 0.8266330342857622.
[I 2026-07-01 14:47:13,907] Trial 94 finished with value: 0.8241598187285871 and parameters: {'n_estimators': 200, 'max_depth': 5, 'min_samples_split': 9, 'min_samples_leaf': 12, 'max_features': 'sqrt'}. Best is trial 28 with value: 0.8266330342857622.
[I 2026-07-01 14:52:40,234] Trial 95 finished with value: 0.8241598187285871 and parameters: {'n_estimators': 200, 'max_depth': 5, 'min_samples_split': 9, 'min_samples_leaf': 12, 'max_features': 'sqrt'}. Best is trial 28 with value: 0.8266330342857622.
[I 2026-07-01 14:53:22,668] Trial 96 finished with value: 0.8241598187285871 and parameters: {'n_estimators': 200, 'max_depth': 5, 'min_samples_split': 9, 'min_samples_leaf': 12, 'max_features': 'sqrt'}. Best is trial 28 with value: 0.8266330342857622.
[I 2026-07-01 14:54:02,832] Trial 97 finished with value: 0.8241598187285871 and parameters: {'n_estimators': 200, 'max_depth': 5, 'min_samples_split': 9, 'min_samples_leaf': 12, 'max_features': 'sqrt'}. Best is trial 28 with value: 0.8266330342857622.
slurmstepd-slurmng-n2.cs.unibo.it: error: *** JOB 66120 ON slurmng-n2.cs.unibo.it CANCELLED AT 2026-07-01T14:56:46 ***
