[I 2026-06-09 15:57:19,156] Trial 99 finished with value: 0.7832538595565384 and parameters: {'n_estimators': 250, 'max_depth': 4, 'min_samples_split': 18, 'min_samples_leaf': 14, 'max_features': 'log2'}. Best is trial 26 with value: 0.7832538595565384.

7:	[0s / 4s],		train_loss: 2.5484
45:	[0s / 19s],		train_loss: 2.4748
89:	[0s / 34s],		train_loss: 2.4266
8:	[0s / 4s],		train_loss: 2.5402
46:	[0s / 19s],		train_loss: 2.4751
90:	[0s / 35s],		train_loss: 2.4396
60:	[1s / 1m:4s],		train_loss: 2.4609
47:	[0s / 19s],		train_loss: 2.4768
9:	[0s / 5s],		train_loss: 2.5315
91:	[0s / 35s],		train_loss: 2.4343
48:	[0s / 20s],		train_loss: 2.4780
92:	[0s / 36s],		train_loss: 2.4548
10:	[0s / 5s],		train_loss: 2.5251
49:	[0s / 20s],		train_loss: 2.4757
93:	[0s / 36s],		train_loss: 2.4446
61:	[1s / 1m:5s],		train_loss: 2.4609
11:	[0s / 6s],		train_loss: 2.5071
50:	[0s / 21s],		train_loss: 2.4684
94:	[0s / 36s],		train_loss: 2.4341
51:	[0s / 21s],		train_loss: 2.4554
95:	[0s / 37s],		train_loss: 2.4456
12:	[0s / 6s],		train_loss: 2.5250
52:	[0s / 21s],		train_loss: 2.4725
96:	[0s / 37s],		train_loss: 2.4509
62:	[1s / 1m:6s],		train_loss: 2.4538
13:	[0s / 7s],		train_loss: 2.5362
97:	[0s / 37s],		train_loss: 2.4286
53:	[0s / 22s],		train_loss: 2.4690
14:	[0s / 7s],		train_loss: 2.5109
98:	[0s / 38s],		train_loss: 2.4471
54:	[0s / 22s],		train_loss: 2.4827
99:	[0s / 38s],		train_loss: 2.4523
15:	[0s / 8s],		train_loss: 2.5000
55:	[0s / 23s],		train_loss: 2.4691
63:	[1s / 1m:8s],		train_loss: 2.4439
56:	[0s / 23s],		train_loss: 2.4626
0:	[0s / 0s],		train_loss: 3.1146
16:	[0s / 8s],		train_loss: 2.5168
1:	[0s / 0s],		train_loss: 2.6606
57:	[0s / 24s],		train_loss: 2.4765
17:	[0s / 9s],		train_loss: 2.5011
64:	[1s / 1m:9s],		train_loss: 2.4600
2:	[0s / 1s],		train_loss: 2.6264
58:	[0s / 24s],		train_loss: 2.4643
18:	[0s / 10s],		train_loss: 2.5226
3:	[0s / 1s],		train_loss: 2.5824
59:	[0s / 24s],		train_loss: 2.4620
4:	[0s / 1s],		train_loss: 2.5621
60:	[0s / 25s],		train_loss: 2.4554
19:	[0s / 10s],		train_loss: 2.5012
65:	[1s / 1m:10s],		train_loss: 2.4723
5:	[0s / 2s],		train_loss: 2.5459
61:	[0s / 25s],		train_loss: 2.4578
20:	[0s / 11s],		train_loss: 2.5018
6:	[0s / 2s],		train_loss: 2.5290
62:	[0s / 26s],		train_loss: 2.4407
7:	[0s / 3s],		train_loss: 2.5198
21:	[0s / 11s],		train_loss: 2.5246
63:	[0s / 26s],		train_loss: 2.4681
66:	[1s / 1m:11s],		train_loss: 2.4601
8:	[0s / 3s],		train_loss: 2.5318
22:	[0s / 12s],		train_loss: 2.5216
64:	[0s / 26s],		train_loss: 2.4456
9:	[0s / 3s],		train_loss: 2.5175
65:	[0s / 27s],		train_loss: 2.4586
23:	[0s / 12s],		train_loss: 2.5020
67:	[1s / 1m:12s],		train_loss: 2.4567
10:	[0s / 4s],		train_loss: 2.5082
66:	[0s / 27s],		train_loss: 2.4560
24:	[0s / 13s],		train_loss: 2.5007
11:	[0s / 4s],		train_loss: 2.4937
67:	[0s / 28s],		train_loss: 2.4551
12:	[0s / 5s],		train_loss: 2.5056
25:	[0s / 13s],		train_loss: 2.5012
68:	[0s / 28s],		train_loss: 2.4539
68:	[1s / 1m:13s],		train_loss: 2.4450
13:	[0s / 5s],		train_loss: 2.5107
26:	[0s / 14s],		train_loss: 2.4955
69:	[0s / 29s],		train_loss: 2.4652
14:	[0s / 5s],		train_loss: 2.5166
70:	[0s / 29s],		train_loss: 2.4685
27:	[0s / 14s],		train_loss: 2.5007
15:	[0s / 6s],		train_loss: 2.4932
69:	[1s / 1m:14s],		train_loss: 2.4427
71:	[0s / 29s],		train_loss: 2.4626
16:	[0s / 6s],		train_loss: 2.4921
28:	[0s / 15s],		train_loss: 2.4974
72:	[0s / 30s],		train_loss: 2.4470
17:	[0s / 7s],		train_loss: 2.4880
29:	[0s / 15s],		train_loss: 2.5000
70:	[1s / 1m:15s],		train_loss: 2.4443
73:	[0s / 30s],		train_loss: 2.4450
18:	[0s / 7s],		train_loss: 2.4848
74:	[0s / 31s],		train_loss: 2.4407
30:	[0s / 16s],		train_loss: 2.4942
19:	[0s / 7s],		train_loss: 2.4837
75:	[0s / 31s],		train_loss: 2.4475
20:	[0s / 8s],		train_loss: 2.4935
31:	[0s / 16s],		train_loss: 2.4918
71:	[1s / 1m:16s],		train_loss: 2.4446
76:	[0s / 31s],		train_loss: 2.4738
21:	[0s / 8s],		train_loss: 2.4878
32:	[0s / 17s],		train_loss: 2.4924
22:	[0s / 8s],		train_loss: 2.4814
77:	[0s / 32s],		train_loss: 2.4565
33:	[0s / 17s],		train_loss: 2.4840
23:	[0s / 9s],		train_loss: 2.4859
78:	[0s / 32s],		train_loss: 2.4583
72:	[1s / 1m:17s],		train_loss: 2.4327
24:	[0s / 9s],		train_loss: 2.4793
79:	[0s / 33s],		train_loss: 2.4489
34:	[0s / 18s],		train_loss: 2.4964
25:	[0s / 10s],		train_loss: 2.4869
80:	[0s / 33s],		train_loss: 2.4345
35:	[0s / 18s],		train_loss: 2.4948
26:	[0s / 10s],		train_loss: 2.4838
73:	[1s / 1m:18s],		train_loss: 2.4319
81:	[0s / 33s],		train_loss: 2.4364
36:	[0s / 19s],		train_loss: 2.5170
27:	[0s / 10s],		train_loss: 2.4687
82:	[0s / 34s],		train_loss: 2.4477
28:	[0s / 11s],		train_loss: 2.4855
37:	[0s / 19s],		train_loss: 2.4999
83:	[0s / 34s],		train_loss: 2.4431
74:	[1s / 1m:19s],		train_loss: 2.4415
29:	[0s / 11s],		train_loss: 2.4846
84:	[0s / 35s],		train_loss: 2.4560
38:	[0s / 20s],		train_loss: 2.4915
30:	[0s / 12s],		train_loss: 2.4700
85:	[0s / 35s],		train_loss: 2.4456
39:	[0s / 20s],		train_loss: 2.4928
31:	[0s / 12s],		train_loss: 2.4694
86:	[0s / 35s],		train_loss: 2.4560
75:	[1s / 1m:20s],		train_loss: 2.4329
40:	[0s / 21s],		train_loss: 2.4967
32:	[0s / 12s],		train_loss: 2.4783
87:	[0s / 36s],		train_loss: 2.4485
33:	[0s / 13s],		train_loss: 2.4657
41:	[0s / 22s],		train_loss: 2.4988
88:	[0s / 36s],		train_loss: 2.4425
34:	[0s / 13s],		train_loss: 2.4674
76:	[1s / 1m:21s],		train_loss: 2.4255
89:	[0s / 37s],		train_loss: 2.4428
42:	[0s / 22s],		train_loss: 2.4879
35:	[0s / 14s],		train_loss: 2.4788
90:	[0s / 37s],		train_loss: 2.4524
43:	[0s / 23s],		train_loss: 2.5190
36:	[0s / 14s],		train_loss: 2.4624
91:	[0s / 38s],		train_loss: 2.4494
77:	[1s / 1m:22s],		train_loss: 2.4399
37:	[0s / 14s],		train_loss: 2.4688
44:	[0s / 23s],		train_loss: 2.4938
92:	[0s / 38s],		train_loss: 2.4395
38:	[0s / 15s],		train_loss: 2.4629
45:	[0s / 24s],		train_loss: 2.4887
93:	[0s / 38s],		train_loss: 2.4714
39:	[0s / 15s],		train_loss: 2.4696
78:	[1s / 1m:24s],		train_loss: 2.4337
46:	[0s / 24s],		train_loss: 2.4956
40:	[0s / 16s],		train_loss: 2.4532
94:	[0s / 39s],		train_loss: 2.4466
41:	[0s / 16s],		train_loss: 2.4523
95:	[0s / 39s],		train_loss: 2.4378
47:	[0s / 25s],		train_loss: 2.4832
42:	[0s / 16s],		train_loss: 2.4658
96:	[0s / 40s],		train_loss: 2.4548
79:	[1s / 1m:25s],		train_loss: 2.4350
48:	[0s / 25s],		train_loss: 2.4821
43:	[0s / 17s],		train_loss: 2.4580
97:	[0s / 40s],		train_loss: 2.4425
49:	[0s / 26s],		train_loss: 2.4899
44:	[0s / 17s],		train_loss: 2.4529
98:	[0s / 41s],		train_loss: 2.4335
80:	[1s / 1m:26s],		train_loss: 2.4314
45:	[0s / 18s],		train_loss: 2.4717
50:	[0s / 26s],		train_loss: 2.4901
99:	[0s / 41s],		train_loss: 2.4461
46:	[0s / 18s],		train_loss: 2.4519
51:	[0s / 27s],		train_loss: 2.4867
0:	[0s / 0s],		train_loss: 5.1437
47:	[0s / 18s],		train_loss: 2.4499
1:	[0s / 0s],		train_loss: 3.6357
81:	[1s / 1m:27s],		train_loss: 2.4248
52:	[0s / 27s],		train_loss: 2.4847
48:	[0s / 19s],		train_loss: 2.4459
2:	[0s / 1s],		train_loss: 3.1132
53:	[0s / 28s],		train_loss: 2.4915
49:	[0s / 19s],		train_loss: 2.4546
3:	[0s / 1s],		train_loss: 2.9322
50:	[0s / 20s],		train_loss: 2.4606
54:	[0s / 28s],		train_loss: 2.4908
82:	[1s / 1m:28s],		train_loss: 2.4331
4:	[0s / 2s],		train_loss: 2.8568
51:	[0s / 20s],		train_loss: 2.4524
55:	[0s / 29s],		train_loss: 2.4823
5:	[0s / 2s],		train_loss: 2.8200
52:	[0s / 20s],		train_loss: 2.4463
56:	[0s / 29s],		train_loss: 2.4737
6:	[0s / 2s],		train_loss: 2.7790
53:	[0s / 21s],		train_loss: 2.4532
83:	[1s / 1m:29s],		train_loss: 2.4245
7:	[0s / 3s],		train_loss: 2.7609
54:	[0s / 21s],		train_loss: 2.4565
57:	[0s / 30s],		train_loss: 2.4861
8:	[0s / 3s],		train_loss: 2.7225
55:	[0s / 22s],		train_loss: 2.4390
58:	[0s / 30s],		train_loss: 2.4812
84:	[1s / 1m:30s],		train_loss: 2.4227
56:	[0s / 22s],		train_loss: 2.4518
9:	[0s / 4s],		train_loss: 2.6993
59:	[0s / 31s],		train_loss: 2.4842
57:	[0s / 22s],		train_loss: 2.4345
10:	[0s / 4s],		train_loss: 2.6895
58:	[0s / 23s],		train_loss: 2.4441
60:	[0s / 31s],		train_loss: 2.4743
11:	[0s / 4s],		train_loss: 2.6693
85:	[1s / 1m:31s],		train_loss: 2.4263
59:	[0s / 23s],		train_loss: 2.4527
12:	[0s / 5s],		train_loss: 2.6490
61:	[0s / 32s],		train_loss: 2.4891
60:	[0s / 23s],		train_loss: 2.4448
13:	[0s / 5s],		train_loss: 2.6323
62:	[0s / 32s],		train_loss: 2.4746
61:	[0s / 24s],		train_loss: 2.4533
14:	[0s / 6s],		train_loss: 2.6210
86:	[1s / 1m:32s],		train_loss: 2.4175
62:	[0s / 24s],		train_loss: 2.4624
63:	[0s / 33s],		train_loss: 2.4764
15:	[0s / 6s],		train_loss: 2.6112
63:	[0s / 25s],		train_loss: 2.4424
64:	[0s / 33s],		train_loss: 2.4783
16:	[0s / 7s],		train_loss: 2.5980
64:	[0s / 25s],		train_loss: 2.4337
87:	[1s / 1m:33s],		train_loss: 2.4097
17:	[0s / 7s],		train_loss: 2.5925
65:	[0s / 34s],		train_loss: 2.4791
65:	[0s / 25s],		train_loss: 2.4442
18:	[0s / 7s],		train_loss: 2.5820
66:	[0s / 26s],		train_loss: 2.4384
66:	[0s / 34s],		train_loss: 2.4816
19:	[0s / 8s],		train_loss: 2.5760
88:	[1s / 1m:34s],		train_loss: 2.4228
67:	[0s / 26s],		train_loss: 2.4118
67:	[0s / 35s],		train_loss: 2.4814
20:	[0s / 8s],		train_loss: 2.5758
68:	[0s / 27s],		train_loss: 2.4361
68:	[0s / 35s],		train_loss: 2.4654
21:	[0s / 9s],		train_loss: 2.5713
69:	[0s / 27s],		train_loss: 2.4420
89:	[1s / 1m:35s],		train_loss: 2.4277
69:	[0s / 36s],		train_loss: 2.4854
22:	[0s / 9s],		train_loss: 2.5683
70:	[0s / 27s],		train_loss: 2.4400
23:	[0s / 9s],		train_loss: 2.5522
71:	[0s / 28s],		train_loss: 2.4225
70:	[0s / 36s],		train_loss: 2.4782
72:	[0s / 28s],		train_loss: 2.4609
24:	[0s / 10s],		train_loss: 2.5583
90:	[1s / 1m:36s],		train_loss: 2.4260
71:	[0s / 37s],		train_loss: 2.4824
73:	[0s / 29s],		train_loss: 2.4455
25:	[0s / 10s],		train_loss: 2.5451
72:	[0s / 37s],		train_loss: 2.4779
74:	[0s / 29s],		train_loss: 2.4418
26:	[0s / 11s],		train_loss: 2.5391
91:	[1s / 1m:38s],		train_loss: 2.4318
73:	[0s / 38s],		train_loss: 2.4760
75:	[0s / 29s],		train_loss: 2.4348
27:	[0s / 11s],		train_loss: 2.5375
76:	[0s / 30s],		train_loss: 2.4375
28:	[0s / 12s],		train_loss: 2.5308
74:	[0s / 39s],		train_loss: 2.4851
77:	[0s / 30s],		train_loss: 2.4341
29:	[0s / 12s],		train_loss: 2.5307
92:	[1s / 1m:39s],		train_loss: 2.4178
75:	[0s / 39s],		train_loss: 2.4702
78:	[0s / 31s],		train_loss: 2.4246
30:	[0s / 12s],		train_loss: 2.5313
79:	[0s / 31s],		train_loss: 2.4238
76:	[0s / 40s],		train_loss: 2.4895
31:	[0s / 13s],		train_loss: 2.5331
80:	[0s / 31s],		train_loss: 2.4244
77:	[0s / 40s],		train_loss: 2.4675
93:	[1s / 1m:40s],		train_loss: 2.4194
32:	[0s / 13s],		train_loss: 2.5221
81:	[0s / 32s],		train_loss: 2.4296
33:	[0s / 14s],		train_loss: 2.5223
78:	[0s / 41s],		train_loss: 2.4714
82:	[0s / 32s],		train_loss: 2.4300
34:	[0s / 14s],		train_loss: 2.5239
79:	[0s / 41s],		train_loss: 2.4681
83:	[0s / 33s],		train_loss: 2.4263
94:	[1s / 1m:41s],		train_loss: 2.4146
35:	[0s / 15s],		train_loss: 2.5119
84:	[0s / 33s],		train_loss: 2.4133
80:	[0s / 42s],		train_loss: 2.4650
36:	[0s / 15s],		train_loss: 2.5248
85:	[0s / 33s],		train_loss: 2.4292
81:	[0s / 42s],		train_loss: 2.4769
95:	[1s / 1m:42s],		train_loss: 2.4299
37:	[0s / 15s],		train_loss: 2.5138
86:	[0s / 34s],		train_loss: 2.4206
38:	[0s / 16s],		train_loss: 2.5096
87:	[0s / 34s],		train_loss: 2.4136
82:	[0s / 43s],		train_loss: 2.4744
88:	[0s / 35s],		train_loss: 2.4244
39:	[0s / 16s],		train_loss: 2.5135
83:	[0s / 43s],		train_loss: 2.4817
96:	[1s / 1m:43s],		train_loss: 2.4293
89:	[0s / 35s],		train_loss: 2.4194
40:	[0s / 17s],		train_loss: 2.5155
84:	[0s / 44s],		train_loss: 2.4790
90:	[0s / 35s],		train_loss: 2.4296
41:	[0s / 17s],		train_loss: 2.5018
85:	[0s / 44s],		train_loss: 2.4739
91:	[0s / 36s],		train_loss: 2.4230
97:	[1s / 1m:44s],		train_loss: 2.4147
42:	[0s / 17s],		train_loss: 2.5148
92:	[0s / 36s],		train_loss: 2.4387
43:	[0s / 18s],		train_loss: 2.5084
86:	[0s / 45s],		train_loss: 2.4708
93:	[0s / 36s],		train_loss: 2.4271
44:	[0s / 18s],		train_loss: 2.5195
87:	[0s / 45s],		train_loss: 2.4728
98:	[1s / 1m:45s],		train_loss: 2.4099
94:	[0s / 37s],		train_loss: 2.4218
45:	[0s / 19s],		train_loss: 2.5006
95:	[0s / 37s],		train_loss: 2.4307
88:	[0s / 46s],		train_loss: 2.4721
46:	[0s / 19s],		train_loss: 2.5029
96:	[0s / 38s],		train_loss: 2.4282
99:	[0s / 1m:46s],		train_loss: 2.4166
89:	[0s / 46s],		train_loss: 2.4735
47:	[0s / 20s],		train_loss: 2.5079
97:	[0s / 38s],		train_loss: 2.4206
48:	[0s / 20s],		train_loss: 2.4924
90:	[0s / 47s],		train_loss: 2.4822
98:	[0s / 39s],		train_loss: 2.4185
49:	[0s / 20s],		train_loss: 2.4943
99:	[0s / 39s],		train_loss: 2.4220
91:	[0s / 47s],		train_loss: 2.4491
0:	[1s / 1s],		train_loss: 3.8909
50:	[0s / 21s],		train_loss: 2.5049
92:	[0s / 48s],		train_loss: 2.4660
0:	[0s / 0s],		train_loss: 4.1112
51:	[0s / 21s],		train_loss: 2.5003
93:	[0s / 48s],		train_loss: 2.4579
1:	[0s / 0s],		train_loss: 3.1416
1:	[1s / 2s],		train_loss: 3.1888
52:	[0s / 22s],		train_loss: 2.4988
2:	[0s / 1s],		train_loss: 2.9345
94:	[0s / 49s],		train_loss: 2.4650
53:	[0s / 22s],		train_loss: 2.5005
3:	[0s / 1s],		train_loss: 2.8166
95:	[0s / 49s],		train_loss: 2.4733
54:	[0s / 23s],		train_loss: 2.4853
2:	[1s / 3s],		train_loss: 2.9734
4:	[0s / 2s],		train_loss: 2.7876
96:	[0s / 50s],		train_loss: 2.4430
55:	[0s / 23s],		train_loss: 2.4906
5:	[0s / 2s],		train_loss: 2.7333
97:	[0s / 50s],		train_loss: 2.4763
56:	[0s / 24s],		train_loss: 2.4976
6:	[0s / 2s],		train_loss: 2.6985
3:	[1s / 4s],		train_loss: 2.8202
57:	[0s / 24s],		train_loss: 2.4887
98:	[0s / 51s],		train_loss: 2.4605
7:	[0s / 3s],		train_loss: 2.6717
58:	[0s / 24s],		train_loss: 2.4895
99:	[0s / 51s],		train_loss: 2.4731
8:	[0s / 3s],		train_loss: 2.6575
4:	[0s / 5s],		train_loss: 2.7629
59:	[0s / 25s],		train_loss: 2.4836
9:	[0s / 4s],		train_loss: 2.6410
60:	[0s / 25s],		train_loss: 2.4993
5:	[0s / 5s],		train_loss: 2.7072
10:	[0s / 4s],		train_loss: 2.6201
61:	[0s / 26s],		train_loss: 2.4995
11:	[0s / 4s],		train_loss: 2.6056
6:	[0s / 6s],		train_loss: 2.6801
62:	[0s / 26s],		train_loss: 2.4805
12:	[0s / 5s],		train_loss: 2.6041
7:	[0s / 6s],		train_loss: 2.6647
63:	[0s / 26s],		train_loss: 2.4853
13:	[0s / 5s],		train_loss: 2.5865
64:	[0s / 27s],		train_loss: 2.4930
8:	[0s / 7s],		train_loss: 2.6394
14:	[0s / 6s],		train_loss: 2.5740
65:	[0s / 27s],		train_loss: 2.4724
15:	[0s / 6s],		train_loss: 2.5826
9:	[0s / 7s],		train_loss: 2.6157
66:	[0s / 27s],		train_loss: 2.4958
16:	[0s / 6s],		train_loss: 2.5538
10:	[0s / 8s],		train_loss: 2.6146
67:	[0s / 28s],		train_loss: 2.4756
17:	[0s / 7s],		train_loss: 2.5584
68:	[0s / 28s],		train_loss: 2.4885
11:	[0s / 8s],		train_loss: 2.5915
18:	[0s / 7s],		train_loss: 2.5344
69:	[0s / 28s],		train_loss: 2.4819
19:	[0s / 7s],		train_loss: 2.5346
12:	[0s / 9s],		train_loss: 2.6035
70:	[0s / 29s],		train_loss: 2.4797
20:	[0s / 8s],		train_loss: 2.5344
71:	[0s / 29s],		train_loss: 2.4781
13:	[0s / 9s],		train_loss: 2.5915
21:	[0s / 8s],		train_loss: 2.5320
72:	[0s / 30s],		train_loss: 2.4814
22:	[0s / 8s],		train_loss: 2.5385
14:	[0s / 10s],		train_loss: 2.5808
73:	[0s / 30s],		train_loss: 2.4782
23:	[0s / 9s],		train_loss: 2.5343
15:	[0s / 10s],		train_loss: 2.5623
74:	[0s / 30s],		train_loss: 2.4730
24:	[0s / 9s],		train_loss: 2.5240
75:	[0s / 31s],		train_loss: 2.4675
16:	[0s / 11s],		train_loss: 2.5631
25:	[0s / 9s],		train_loss: 2.5248
76:	[0s / 31s],		train_loss: 2.4747
26:	[0s / 10s],		train_loss: 2.5222
17:	[0s / 11s],		train_loss: 2.5491
77:	[0s / 31s],		train_loss: 2.4721
27:	[0s / 10s],		train_loss: 2.5112
18:	[0s / 11s],		train_loss: 2.5513
78:	[0s / 32s],		train_loss: 2.4693
28:	[0s / 11s],		train_loss: 2.5171
79:	[0s / 32s],		train_loss: 2.4690
19:	[0s / 12s],		train_loss: 2.5580
29:	[0s / 11s],		train_loss: 2.5100
80:	[0s / 32s],		train_loss: 2.4858
30:	[0s / 11s],		train_loss: 2.5152
20:	[0s / 12s],		train_loss: 2.5260
81:	[0s / 33s],		train_loss: 2.4730
31:	[0s / 12s],		train_loss: 2.5009
82:	[0s / 33s],		train_loss: 2.4731
21:	[0s / 13s],		train_loss: 2.5239
32:	[0s / 12s],		train_loss: 2.5120
83:	[0s / 33s],		train_loss: 2.4683
22:	[0s / 13s],		train_loss: 2.5287
33:	[0s / 12s],		train_loss: 2.4982
84:	[0s / 34s],		train_loss: 2.4722
34:	[0s / 13s],		train_loss: 2.5014
23:	[0s / 14s],		train_loss: 2.5227
85:	[0s / 34s],		train_loss: 2.4647
35:	[0s / 13s],		train_loss: 2.4996
86:	[0s / 35s],		train_loss: 2.4737
24:	[0s / 15s],		train_loss: 2.5183
36:	[0s / 13s],		train_loss: 2.4789
87:	[0s / 35s],		train_loss: 2.4659
37:	[0s / 14s],		train_loss: 2.4848
25:	[0s / 15s],		train_loss: 2.5153
88:	[0s / 35s],		train_loss: 2.4608
38:	[0s / 14s],		train_loss: 2.4818
26:	[0s / 15s],		train_loss: 2.5207
89:	[0s / 36s],		train_loss: 2.4732
39:	[0s / 14s],		train_loss: 2.4883
90:	[0s / 36s],		train_loss: 2.4642
27:	[0s / 16s],		train_loss: 2.5185
40:	[0s / 15s],		train_loss: 2.4839
91:	[0s / 36s],		train_loss: 2.4577
41:	[0s / 15s],		train_loss: 2.4719
28:	[0s / 16s],		train_loss: 2.5165
92:	[0s / 37s],		train_loss: 2.4527
42:	[0s / 16s],		train_loss: 2.4878
93:	[0s / 37s],		train_loss: 2.4737
29:	[0s / 17s],		train_loss: 2.5095
43:	[0s / 16s],		train_loss: 2.4634
94:	[0s / 37s],		train_loss: 2.4503
44:	[0s / 16s],		train_loss: 2.4743
30:	[0s / 17s],		train_loss: 2.4822
95:	[0s / 38s],		train_loss: 2.4634
45:	[0s / 17s],		train_loss: 2.4725
31:	[0s / 18s],		train_loss: 2.5025
96:	[0s / 38s],		train_loss: 2.4538
46:	[0s / 17s],		train_loss: 2.4782
97:	[0s / 39s],		train_loss: 2.4592
32:	[0s / 18s],		train_loss: 2.4913
47:	[0s / 17s],		train_loss: 2.4836
98:	[0s / 39s],		train_loss: 2.4760
48:	[0s / 18s],		train_loss: 2.4686
33:	[0s / 19s],		train_loss: 2.5054
99:	[0s / 39s],		train_loss: 2.4738
49:	[0s / 18s],		train_loss: 2.4673
34:	[0s / 19s],		train_loss: 2.4893
50:	[0s / 18s],		train_loss: 2.4641
35:	[0s / 20s],		train_loss: 2.4815
51:	[0s / 19s],		train_loss: 2.4614
36:	[0s / 20s],		train_loss: 2.4825
52:	[0s / 19s],		train_loss: 2.4578
37:	[0s / 20s],		train_loss: 2.4891
53:	[0s / 19s],		train_loss: 2.4559
38:	[0s / 21s],		train_loss: 2.4914
54:	[0s / 20s],		train_loss: 2.4754
39:	[0s / 21s],		train_loss: 2.4843
55:	[0s / 20s],		train_loss: 2.4559
40:	[0s / 21s],		train_loss: 2.4826
56:	[0s / 20s],		train_loss: 2.4601
41:	[0s / 21s],		train_loss: 2.4634
57:	[0s / 21s],		train_loss: 2.4462
42:	[0s / 22s],		train_loss: 2.4859
58:	[0s / 21s],		train_loss: 2.4653
43:	[0s / 22s],		train_loss: 2.4667
59:	[0s / 21s],		train_loss: 2.4581
44:	[0s / 22s],		train_loss: 2.4742
60:	[0s / 21s],		train_loss: 2.4516
45:	[0s / 23s],		train_loss: 2.4790
61:	[0s / 22s],		train_loss: 2.4485
46:	[0s / 23s],		train_loss: 2.4782
62:	[0s / 22s],		train_loss: 2.4493
47:	[0s / 23s],		train_loss: 2.4634
63:	[0s / 22s],		train_loss: 2.4536
48:	[0s / 24s],		train_loss: 2.4466
64:	[0s / 23s],		train_loss: 2.4467
49:	[0s / 24s],		train_loss: 2.4559
65:	[0s / 23s],		train_loss: 2.4506
50:	[0s / 24s],		train_loss: 2.4579
66:	[0s / 23s],		train_loss: 2.4437
51:	[0s / 24s],		train_loss: 2.4690
67:	[0s / 23s],		train_loss: 2.4441
52:	[0s / 25s],		train_loss: 2.4512
68:	[0s / 24s],		train_loss: 2.4502
53:	[0s / 25s],		train_loss: 2.4603
69:	[0s / 24s],		train_loss: 2.4415
54:	[0s / 25s],		train_loss: 2.4615
70:	[0s / 24s],		train_loss: 2.4383
55:	[0s / 26s],		train_loss: 2.4744
71:	[0s / 25s],		train_loss: 2.4448
56:	[0s / 26s],		train_loss: 2.4544
72:	[0s / 25s],		train_loss: 2.4363
57:	[0s / 26s],		train_loss: 2.4466
73:	[0s / 25s],		train_loss: 2.4255
58:	[0s / 27s],		train_loss: 2.4548
74:	[0s / 26s],		train_loss: 2.4348
59:	[0s / 27s],		train_loss: 2.4519
75:	[0s / 26s],		train_loss: 2.4399
60:	[0s / 27s],		train_loss: 2.4633
76:	[0s / 26s],		train_loss: 2.4212
61:	[0s / 27s],		train_loss: 2.4384
77:	[0s / 26s],		train_loss: 2.4328
62:	[0s / 28s],		train_loss: 2.4446
78:	[0s / 27s],		train_loss: 2.4322
63:	[0s / 28s],		train_loss: 2.4361
79:	[0s / 27s],		train_loss: 2.4298
64:	[0s / 28s],		train_loss: 2.4570
80:	[0s / 27s],		train_loss: 2.4311
65:	[0s / 29s],		train_loss: 2.4470
81:	[0s / 28s],		train_loss: 2.4358
66:	[0s / 29s],		train_loss: 2.4496
82:	[0s / 28s],		train_loss: 2.4412
67:	[0s / 29s],		train_loss: 2.4547
83:	[0s / 28s],		train_loss: 2.4225
68:	[0s / 30s],		train_loss: 2.4477
84:	[0s / 29s],		train_loss: 2.4231
69:	[0s / 30s],		train_loss: 2.4396
85:	[0s / 29s],		train_loss: 2.4278
70:	[0s / 30s],		train_loss: 2.4451
86:	[0s / 29s],		train_loss: 2.4308
71:	[0s / 30s],		train_loss: 2.4416
87:	[0s / 29s],		train_loss: 2.4165
72:	[0s / 31s],		train_loss: 2.4292
88:	[0s / 30s],		train_loss: 2.4162
73:	[0s / 31s],		train_loss: 2.4496
89:	[0s / 30s],		train_loss: 2.4202
74:	[0s / 31s],		train_loss: 2.4435
90:	[0s / 30s],		train_loss: 2.4266
75:	[0s / 32s],		train_loss: 2.4299
91:	[0s / 31s],		train_loss: 2.4222
76:	[0s / 32s],		train_loss: 2.4421
92:	[0s / 31s],		train_loss: 2.4066
77:	[0s / 32s],		train_loss: 2.4173
93:	[0s / 31s],		train_loss: 2.4214
78:	[0s / 32s],		train_loss: 2.4352
94:	[0s / 31s],		train_loss: 2.4142
79:	[0s / 33s],		train_loss: 2.4292
95:	[0s / 32s],		train_loss: 2.4119
80:	[0s / 33s],		train_loss: 2.4546
96:	[0s / 32s],		train_loss: 2.4107
81:	[0s / 33s],		train_loss: 2.4409
97:	[0s / 32s],		train_loss: 2.3985
82:	[0s / 34s],		train_loss: 2.4333
98:	[0s / 33s],		train_loss: 2.4005
83:	[0s / 34s],		train_loss: 2.4230
99:	[0s / 33s],		train_loss: 2.4112
84:	[0s / 34s],		train_loss: 2.4475
85:	[0s / 34s],		train_loss: 2.4377
86:	[0s / 35s],		train_loss: 2.4290
87:	[0s / 35s],		train_loss: 2.4176
88:	[0s / 35s],		train_loss: 2.4259
89:	[0s / 35s],		train_loss: 2.4297
90:	[0s / 35s],		train_loss: 2.4171
91:	[0s / 35s],		train_loss: 2.4251
92:	[0s / 36s],		train_loss: 2.4091
93:	[0s / 36s],		train_loss: 2.4191
94:	[0s / 36s],		train_loss: 2.4159
95:	[0s / 36s],		train_loss: 2.4095
96:	[0s / 36s],		train_loss: 2.4191
97:	[0s / 37s],		train_loss: 2.4165
98:	[0s / 37s],		train_loss: 2.4213
99:	[0s / 37s],		train_loss: 2.4103
Best parameters: {'num_nodes': [32], 'dropout': 0.2810481955059012, 'learning_rate': 0.0018008872825311779, 'batch_norm': False}
  [ckpt] Params saved → checkpoints/tabicl/HURRAH/NaN/seed789/fold5/tabicl_deeps