[I 2026-06-07 00:17:08,679] Trial 85 finished with value: 0.8097659572474548 and parameters: {'num_nodes': [64, 32], 'dropout': 0.17343451711711572, 'learning_rate': 0.00011647072264259117, 'batch_norm': False}. Best is trial 13 with value: 0.8124644084489007.
/scratch.hpc/luca.cotugno/Foundation_model_clinical_data/test_tabular_model_tmp.py:476: UserWarning: Choices for a categorical distribution should be a tuple of None, bool, int, float and str for persistent storage but contains [32] which is of type list.
  num_nodes  = trial.suggest_categorical("num_nodes", [[32], [64], [128], [64, 32], [128, 64]])
/scratch.hpc/luca.cotugno/Foundation_model_clinical_data/test_tabular_model_tmp.py:476: UserWarning: Choices for a categorical distribution should be a tuple of None, bool, int, float and str for persistent storage but contains [64] which is of type list.
  num_nodes  = trial.suggest_categorical("num_nodes", [[32], [64], [128], [64, 32], [128, 64]])
/scratch.hpc/luca.cotugno/Foundation_model_clinical_data/test_tabular_model_tmp.py:476: UserWarning: Choices for a categorical distribution should be a tuple of None, bool, int, float and str for persistent storage but contains [128] which is of type list.
  num_nodes  = trial.suggest_categorical("num_nodes", [[32], [64], [128], [64, 32], [128, 64]])
/scratch.hpc/luca.cotugno/Foundation_model_clinical_data/test_tabular_model_tmp.py:476: UserWarning: Choices for a categorical distribution should be a tuple of None, bool, int, float and str for persistent storage but contains [64, 32] which is of type list.
  num_nodes  = trial.suggest_categorical("num_nodes", [[32], [64], [128], [64, 32], [128, 64]])
/scratch.hpc/luca.cotugno/Foundation_model_clinical_data/test_tabular_model_tmp.py:476: UserWarning: Choices for a categorical distribution should be a tuple of None, bool, int, float and str for persistent storage but contains [128, 64] which is of type list.
  num_nodes  = trial.suggest_categorical("num_nodes", [[32], [64], [128], [64, 32], [128, 64]])

12:	[0s / 5s],		train_loss: 2.4686
30:	[0s / 22s],		train_loss: 2.5093
57:	[1s / 1m:12s],		train_loss: 2.4759
13:	[0s / 5s],		train_loss: 2.4753
46:	[0s / 21s],		train_loss: 2.4692
14:	[0s / 5s],		train_loss: 2.4544
47:	[0s / 22s],		train_loss: 2.4778
31:	[0s / 22s],		train_loss: 2.5024
15:	[0s / 6s],		train_loss: 2.4596
48:	[0s / 22s],		train_loss: 2.4813
58:	[1s / 1m:13s],		train_loss: 2.4750
16:	[0s / 6s],		train_loss: 2.4845
32:	[0s / 23s],		train_loss: 2.5125
49:	[0s / 23s],		train_loss: 2.4881
17:	[0s / 7s],		train_loss: 2.4472
50:	[0s / 23s],		train_loss: 2.4684
18:	[0s / 7s],		train_loss: 2.4649
33:	[0s / 24s],		train_loss: 2.5083
19:	[0s / 7s],		train_loss: 2.4569
59:	[1s / 1m:15s],		train_loss: 2.4691
51:	[0s / 24s],		train_loss: 2.4716
20:	[0s / 8s],		train_loss: 2.4549
34:	[0s / 25s],		train_loss: 2.4893
52:	[0s / 24s],		train_loss: 2.4762
21:	[0s / 8s],		train_loss: 2.4688
53:	[0s / 25s],		train_loss: 2.4735
35:	[0s / 25s],		train_loss: 2.5048
60:	[1s / 1m:16s],		train_loss: 2.4673
22:	[0s / 9s],		train_loss: 2.4560
54:	[0s / 25s],		train_loss: 2.4637
23:	[0s / 9s],		train_loss: 2.4531
36:	[0s / 26s],		train_loss: 2.5071
55:	[0s / 26s],		train_loss: 2.4584
24:	[0s / 9s],		train_loss: 2.4493
61:	[1s / 1m:17s],		train_loss: 2.4655
25:	[0s / 10s],		train_loss: 2.4529
56:	[0s / 26s],		train_loss: 2.4599
37:	[0s / 27s],		train_loss: 2.4896
26:	[0s / 10s],		train_loss: 2.4424
57:	[0s / 27s],		train_loss: 2.4539
27:	[0s / 11s],		train_loss: 2.4419
38:	[0s / 27s],		train_loss: 2.4828
58:	[0s / 27s],		train_loss: 2.4615
62:	[1s / 1m:18s],		train_loss: 2.4630
28:	[0s / 11s],		train_loss: 2.4427
59:	[0s / 28s],		train_loss: 2.4684
39:	[0s / 28s],		train_loss: 2.4922
29:	[0s / 11s],		train_loss: 2.4399
60:	[0s / 28s],		train_loss: 2.4527
30:	[0s / 12s],		train_loss: 2.4475
40:	[0s / 29s],		train_loss: 2.4692
63:	[1s / 1m:19s],		train_loss: 2.4606
31:	[0s / 12s],		train_loss: 2.4469
61:	[0s / 28s],		train_loss: 2.4576
32:	[0s / 13s],		train_loss: 2.4374
62:	[0s / 29s],		train_loss: 2.4326
41:	[0s / 30s],		train_loss: 2.4843
33:	[0s / 13s],		train_loss: 2.4388
63:	[0s / 29s],		train_loss: 2.4481
64:	[1s / 1m:21s],		train_loss: 2.4644
34:	[0s / 13s],		train_loss: 2.4337
42:	[0s / 30s],		train_loss: 2.4844
64:	[0s / 30s],		train_loss: 2.4542
35:	[0s / 14s],		train_loss: 2.4340
65:	[0s / 30s],		train_loss: 2.4690
36:	[0s / 14s],		train_loss: 2.4425
43:	[0s / 31s],		train_loss: 2.4906
65:	[1s / 1m:22s],		train_loss: 2.4810
37:	[0s / 15s],		train_loss: 2.4357
66:	[0s / 31s],		train_loss: 2.4589
38:	[0s / 15s],		train_loss: 2.4327
44:	[0s / 32s],		train_loss: 2.4832
67:	[0s / 31s],		train_loss: 2.4479
39:	[0s / 15s],		train_loss: 2.4395
68:	[0s / 32s],		train_loss: 2.4480
66:	[1s / 1m:23s],		train_loss: 2.4546
45:	[0s / 33s],		train_loss: 2.4684
40:	[0s / 16s],		train_loss: 2.4151
69:	[0s / 32s],		train_loss: 2.4375
41:	[0s / 16s],		train_loss: 2.4353
46:	[0s / 33s],		train_loss: 2.4705
70:	[0s / 33s],		train_loss: 2.4528
42:	[0s / 16s],		train_loss: 2.4296
67:	[1s / 1m:24s],		train_loss: 2.4545
43:	[0s / 17s],		train_loss: 2.4403
71:	[0s / 33s],		train_loss: 2.4524
47:	[0s / 34s],		train_loss: 2.4734
44:	[0s / 17s],		train_loss: 2.4226
72:	[0s / 34s],		train_loss: 2.4428
45:	[0s / 18s],		train_loss: 2.4181
68:	[1s / 1m:25s],		train_loss: 2.4403
48:	[0s / 35s],		train_loss: 2.4678
73:	[0s / 34s],		train_loss: 2.4459
46:	[0s / 18s],		train_loss: 2.4262
74:	[0s / 35s],		train_loss: 2.4393
47:	[0s / 18s],		train_loss: 2.4231
49:	[0s / 35s],		train_loss: 2.4856
48:	[0s / 19s],		train_loss: 2.3993
75:	[0s / 35s],		train_loss: 2.4464
69:	[1s / 1m:26s],		train_loss: 2.4561
49:	[0s / 19s],		train_loss: 2.4009
50:	[0s / 36s],		train_loss: 2.4702
76:	[0s / 36s],		train_loss: 2.4386
50:	[0s / 20s],		train_loss: 2.4194
77:	[0s / 36s],		train_loss: 2.4443
51:	[0s / 37s],		train_loss: 2.4709
51:	[0s / 20s],		train_loss: 2.4026
78:	[0s / 37s],		train_loss: 2.4470
70:	[1s / 1m:28s],		train_loss: 2.4403
52:	[0s / 20s],		train_loss: 2.4167
52:	[0s / 38s],		train_loss: 2.4698
79:	[0s / 37s],		train_loss: 2.4241
53:	[0s / 21s],		train_loss: 2.4142
80:	[0s / 38s],		train_loss: 2.4322
54:	[0s / 21s],		train_loss: 2.4079
53:	[0s / 38s],		train_loss: 2.4589
71:	[1s / 1m:29s],		train_loss: 2.4541
55:	[0s / 22s],		train_loss: 2.4039
81:	[0s / 38s],		train_loss: 2.4306
56:	[0s / 22s],		train_loss: 2.4103
54:	[0s / 39s],		train_loss: 2.4573
82:	[0s / 38s],		train_loss: 2.4493
57:	[0s / 22s],		train_loss: 2.3934
83:	[0s / 39s],		train_loss: 2.4321
72:	[1s / 1m:30s],		train_loss: 2.4547
55:	[0s / 40s],		train_loss: 2.4745
58:	[0s / 23s],		train_loss: 2.3924
84:	[0s / 39s],		train_loss: 2.4294
59:	[0s / 23s],		train_loss: 2.3886
56:	[0s / 40s],		train_loss: 2.4758
85:	[0s / 40s],		train_loss: 2.4330
60:	[0s / 24s],		train_loss: 2.4120
73:	[1s / 1m:31s],		train_loss: 2.4270
61:	[0s / 24s],		train_loss: 2.3995
86:	[0s / 40s],		train_loss: 2.4342
57:	[0s / 41s],		train_loss: 2.4693
62:	[0s / 24s],		train_loss: 2.3909
87:	[0s / 41s],		train_loss: 2.4192
63:	[0s / 25s],		train_loss: 2.4110
58:	[0s / 42s],		train_loss: 2.4738
74:	[1s / 1m:32s],		train_loss: 2.4530
88:	[0s / 41s],		train_loss: 2.4299
64:	[0s / 25s],		train_loss: 2.4122
89:	[0s / 42s],		train_loss: 2.4280
59:	[0s / 43s],		train_loss: 2.4641
65:	[0s / 26s],		train_loss: 2.3905
90:	[0s / 42s],		train_loss: 2.4260
66:	[0s / 26s],		train_loss: 2.3821
75:	[1s / 1m:33s],		train_loss: 2.4500
60:	[0s / 43s],		train_loss: 2.4588
67:	[0s / 26s],		train_loss: 2.3886
91:	[0s / 43s],		train_loss: 2.4192
68:	[0s / 27s],		train_loss: 2.3844
92:	[0s / 43s],		train_loss: 2.4319
61:	[0s / 44s],		train_loss: 2.4529
69:	[0s / 27s],		train_loss: 2.4096
76:	[1s / 1m:35s],		train_loss: 2.4501
93:	[0s / 44s],		train_loss: 2.4149
70:	[0s / 28s],		train_loss: 2.3988
62:	[0s / 45s],		train_loss: 2.4637
94:	[0s / 44s],		train_loss: 2.4216
71:	[0s / 28s],		train_loss: 2.3878
95:	[0s / 45s],		train_loss: 2.4211
77:	[1s / 1m:36s],		train_loss: 2.4273
72:	[0s / 28s],		train_loss: 2.3743
63:	[0s / 45s],		train_loss: 2.4565
73:	[0s / 29s],		train_loss: 2.3740
96:	[0s / 45s],		train_loss: 2.4185
74:	[0s / 29s],		train_loss: 2.3836
64:	[0s / 46s],		train_loss: 2.4594
97:	[0s / 46s],		train_loss: 2.4201
75:	[0s / 30s],		train_loss: 2.3920
78:	[1s / 1m:37s],		train_loss: 2.4445
98:	[0s / 46s],		train_loss: 2.4313
65:	[0s / 47s],		train_loss: 2.4590
76:	[0s / 30s],		train_loss: 2.3927
99:	[0s / 47s],		train_loss: 2.4152
77:	[0s / 31s],		train_loss: 2.3818
66:	[0s / 48s],		train_loss: 2.4503
79:	[1s / 1m:38s],		train_loss: 2.4358
78:	[0s / 31s],		train_loss: 2.3937
0:	[0s / 0s],		train_loss: 2.9379
79:	[0s / 31s],		train_loss: 2.3817
67:	[0s / 48s],		train_loss: 2.4680
1:	[0s / 0s],		train_loss: 2.6216
80:	[0s / 32s],		train_loss: 2.3754
2:	[0s / 1s],		train_loss: 2.5920
80:	[1s / 1m:39s],		train_loss: 2.4313
68:	[0s / 49s],		train_loss: 2.4500
81:	[0s / 32s],		train_loss: 2.3835
3:	[0s / 1s],		train_loss: 2.5428
82:	[0s / 33s],		train_loss: 2.3719
69:	[0s / 50s],		train_loss: 2.4558
4:	[0s / 2s],		train_loss: 2.5319
81:	[1s / 1m:40s],		train_loss: 2.4378
83:	[0s / 33s],		train_loss: 2.3767
5:	[0s / 2s],		train_loss: 2.5271
70:	[0s / 50s],		train_loss: 2.4550
84:	[0s / 33s],		train_loss: 2.3831
6:	[0s / 3s],		train_loss: 2.5110
85:	[0s / 34s],		train_loss: 2.3676
7:	[0s / 3s],		train_loss: 2.5150
71:	[0s / 51s],		train_loss: 2.4502
82:	[1s / 1m:41s],		train_loss: 2.4335
86:	[0s / 34s],		train_loss: 2.3754
8:	[0s / 3s],		train_loss: 2.4996
87:	[0s / 35s],		train_loss: 2.3899
72:	[0s / 52s],		train_loss: 2.4514
9:	[0s / 4s],		train_loss: 2.5047
88:	[0s / 35s],		train_loss: 2.3693
83:	[1s / 1m:43s],		train_loss: 2.4361
10:	[0s / 4s],		train_loss: 2.4863
73:	[0s / 52s],		train_loss: 2.4466
89:	[0s / 36s],		train_loss: 2.3674
11:	[0s / 5s],		train_loss: 2.5013
90:	[0s / 36s],		train_loss: 2.3652
74:	[0s / 53s],		train_loss: 2.4440
12:	[0s / 5s],		train_loss: 2.4818
84:	[1s / 1m:44s],		train_loss: 2.4455
91:	[0s / 36s],		train_loss: 2.3515
13:	[0s / 6s],		train_loss: 2.4776
92:	[0s / 37s],		train_loss: 2.3685
75:	[0s / 54s],		train_loss: 2.4479
14:	[0s / 6s],		train_loss: 2.4736
93:	[0s / 37s],		train_loss: 2.3632
85:	[1s / 1m:45s],		train_loss: 2.4405
76:	[0s / 54s],		train_loss: 2.4541
15:	[0s / 7s],		train_loss: 2.4838
94:	[0s / 38s],		train_loss: 2.3520
16:	[0s / 7s],		train_loss: 2.4826
95:	[0s / 38s],		train_loss: 2.3620
77:	[0s / 55s],		train_loss: 2.4330
17:	[0s / 7s],		train_loss: 2.4795
96:	[0s / 38s],		train_loss: 2.3671
86:	[1s / 1m:46s],		train_loss: 2.4401
78:	[0s / 56s],		train_loss: 2.4498
97:	[0s / 39s],		train_loss: 2.3578
18:	[0s / 8s],		train_loss: 2.4756
98:	[0s / 39s],		train_loss: 2.3668
19:	[0s / 8s],		train_loss: 2.4708
79:	[0s / 56s],		train_loss: 2.4507
87:	[1s / 1m:47s],		train_loss: 2.4384
99:	[0s / 40s],		train_loss: 2.3667
20:	[0s / 9s],		train_loss: 2.4627
80:	[0s / 57s],		train_loss: 2.4361
21:	[0s / 9s],		train_loss: 2.4536
0:	[0s / 0s],		train_loss: 4.8421
22:	[0s / 10s],		train_loss: 2.4686
1:	[0s / 0s],		train_loss: 3.1589
81:	[0s / 58s],		train_loss: 2.4486
88:	[1s / 1m:48s],		train_loss: 2.4277
23:	[0s / 10s],		train_loss: 2.4548
2:	[0s / 1s],		train_loss: 2.8473
82:	[0s / 58s],		train_loss: 2.4505
24:	[0s / 11s],		train_loss: 2.4557
3:	[0s / 1s],		train_loss: 2.7684
25:	[0s / 11s],		train_loss: 2.4613
83:	[0s / 59s],		train_loss: 2.4369
89:	[1s / 1m:49s],		train_loss: 2.4328
4:	[0s / 2s],		train_loss: 2.6953
26:	[0s / 11s],		train_loss: 2.4442
5:	[0s / 2s],		train_loss: 2.6631
84:	[0s / 59s],		train_loss: 2.4367
27:	[0s / 12s],		train_loss: 2.4631
6:	[0s / 3s],		train_loss: 2.6533
90:	[1s / 1m:50s],		train_loss: 2.4321
85:	[0s / 1m:0s],		train_loss: 2.4302
28:	[0s / 12s],		train_loss: 2.4549
7:	[0s / 3s],		train_loss: 2.6375
29:	[0s / 13s],		train_loss: 2.4569
8:	[0s / 3s],		train_loss: 2.6158
86:	[0s / 1m:1s],		train_loss: 2.4299
30:	[0s / 13s],		train_loss: 2.4406
9:	[0s / 4s],		train_loss: 2.6156
91:	[1s / 1m:52s],		train_loss: 2.4365
87:	[0s / 1m:1s],		train_loss: 2.4268
31:	[0s / 14s],		train_loss: 2.4548
10:	[0s / 4s],		train_loss: 2.6047
32:	[0s / 14s],		train_loss: 2.4460
88:	[0s / 1m:2s],		train_loss: 2.4389
11:	[0s / 5s],		train_loss: 2.5703
92:	[1s / 1m:53s],		train_loss: 2.4413
33:	[0s / 15s],		train_loss: 2.4397
12:	[0s / 5s],		train_loss: 2.5701
89:	[0s / 1m:3s],		train_loss: 2.4279
34:	[0s / 15s],		train_loss: 2.4455
13:	[0s / 6s],		train_loss: 2.5765
90:	[0s / 1m:3s],		train_loss: 2.4235
35:	[0s / 15s],		train_loss: 2.4458
14:	[0s / 6s],		train_loss: 2.5623
93:	[1s / 1m:54s],		train_loss: 2.4369
36:	[0s / 16s],		train_loss: 2.4387
15:	[0s / 7s],		train_loss: 2.5648
91:	[0s / 1m:4s],		train_loss: 2.4433
37:	[0s / 16s],		train_loss: 2.4279
16:	[0s / 7s],		train_loss: 2.5483
92:	[0s / 1m:4s],		train_loss: 2.4295
38:	[0s / 17s],		train_loss: 2.4295
17:	[0s / 8s],		train_loss: 2.5451
94:	[1s / 1m:55s],		train_loss: 2.4342
93:	[0s / 1m:5s],		train_loss: 2.4303
39:	[0s / 17s],		train_loss: 2.4415
18:	[0s / 8s],		train_loss: 2.5399
40:	[0s / 18s],		train_loss: 2.4352
19:	[0s / 8s],		train_loss: 2.5260
94:	[0s / 1m:6s],		train_loss: 2.4336
41:	[0s / 18s],		train_loss: 2.4407
20:	[0s / 9s],		train_loss: 2.5322
95:	[1s / 1m:57s],		train_loss: 2.4224
95:	[0s / 1m:6s],		train_loss: 2.4384
42:	[0s / 19s],		train_loss: 2.4396
21:	[0s / 9s],		train_loss: 2.5358
43:	[0s / 19s],		train_loss: 2.4167
96:	[0s / 1m:7s],		train_loss: 2.4302
22:	[0s / 10s],		train_loss: 2.5286
44:	[0s / 19s],		train_loss: 2.4295
96:	[1s / 1m:58s],		train_loss: 2.4157
23:	[0s / 10s],		train_loss: 2.5291
97:	[0s / 1m:7s],		train_loss: 2.4211
45:	[0s / 20s],		train_loss: 2.4343
24:	[0s / 11s],		train_loss: 2.5317
98:	[0s / 1m:8s],		train_loss: 2.4178
46:	[0s / 20s],		train_loss: 2.4442
25:	[0s / 11s],		train_loss: 2.5132
97:	[1s / 1m:59s],		train_loss: 2.4253
47:	[0s / 21s],		train_loss: 2.4360
26:	[0s / 12s],		train_loss: 2.5086
99:	[0s / 1m:9s],		train_loss: 2.4263
27:	[0s / 12s],		train_loss: 2.5209
48:	[0s / 21s],		train_loss: 2.4187
0:	[0s / 0s],		train_loss: 4.0026
98:	[1s / 2m:0s],		train_loss: 2.4079
28:	[0s / 13s],		train_loss: 2.5160
49:	[0s / 22s],		train_loss: 2.4202
1:	[0s / 1s],		train_loss: 2.9454
29:	[0s / 13s],		train_loss: 2.4998
50:	[0s / 22s],		train_loss: 2.4141
2:	[0s / 1s],		train_loss: 2.8064
30:	[0s / 13s],		train_loss: 2.5053
51:	[0s / 23s],		train_loss: 2.4246
99:	[1s / 2m:1s],		train_loss: 2.4198
3:	[0s / 2s],		train_loss: 2.7260
31:	[0s / 14s],		train_loss: 2.4993
52:	[0s / 23s],		train_loss: 2.4160
32:	[0s / 14s],		train_loss: 2.4909
53:	[0s / 24s],		train_loss: 2.4224
4:	[0s / 2s],		train_loss: 2.6824
33:	[0s / 15s],		train_loss: 2.4996
54:	[0s / 24s],		train_loss: 2.4028
0:	[1s / 1s],		train_loss: 3.8230
5:	[0s / 3s],		train_loss: 2.6413
34:	[0s / 15s],		train_loss: 2.4877
55:	[0s / 25s],		train_loss: 2.4152
6:	[0s / 3s],		train_loss: 2.6147
35:	[0s / 16s],		train_loss: 2.4919
56:	[0s / 25s],		train_loss: 2.4221
7:	[0s / 4s],		train_loss: 2.5954
1:	[1s / 2s],		train_loss: 3.0198
36:	[0s / 16s],		train_loss: 2.5045
57:	[0s / 26s],		train_loss: 2.4147
8:	[0s / 4s],		train_loss: 2.5753
37:	[0s / 17s],		train_loss: 2.4957
58:	[0s / 26s],		train_loss: 2.4206
9:	[0s / 5s],		train_loss: 2.5728
2:	[1s / 3s],		train_loss: 2.8487
38:	[0s / 17s],		train_loss: 2.5087
59:	[0s / 27s],		train_loss: 2.4295
10:	[0s / 5s],		train_loss: 2.5662
39:	[0s / 18s],		train_loss: 2.4899
60:	[0s / 27s],		train_loss: 2.4175
11:	[0s / 6s],		train_loss: 2.5490
40:	[0s / 18s],		train_loss: 2.4977
61:	[0s / 27s],		train_loss: 2.4211
3:	[1s / 4s],		train_loss: 2.7483
41:	[0s / 19s],		train_loss: 2.4889
62:	[0s / 28s],		train_loss: 2.4162
12:	[0s / 6s],		train_loss: 2.5361
42:	[0s / 19s],		train_loss: 2.4784
63:	[0s / 28s],		train_loss: 2.4106
13:	[0s / 7s],		train_loss: 2.5390
43:	[0s / 20s],		train_loss: 2.4846
64:	[0s / 29s],		train_loss: 2.4200
4:	[1s / 5s],		train_loss: 2.7079
14:	[0s / 7s],		train_loss: 2.5327
44:	[0s / 20s],		train_loss: 2.4843
65:	[0s / 29s],		train_loss: 2.4039
15:	[0s / 8s],		train_loss: 2.5308
45:	[0s / 20s],		train_loss: 2.4716
66:	[0s / 30s],		train_loss: 2.4092
16:	[0s / 8s],		train_loss: 2.5179
5:	[1s / 6s],		train_loss: 2.6631
46:	[0s / 21s],		train_loss: 2.4843
67:	[0s / 30s],		train_loss: 2.4208
17:	[0s / 9s],		train_loss: 2.5279
47:	[0s / 21s],		train_loss: 2.4769
68:	[0s / 31s],		train_loss: 2.4032
18:	[0s / 9s],		train_loss: 2.5057
48:	[0s / 22s],		train_loss: 2.4810
69:	[0s / 31s],		train_loss: 2.4140
6:	[1s / 8s],		train_loss: 2.6399
19:	[0s / 10s],		train_loss: 2.5120
49:	[0s / 22s],		train_loss: 2.4755
70:	[0s / 32s],		train_loss: 2.4078
50:	[0s / 23s],		train_loss: 2.4682
20:	[0s / 11s],		train_loss: 2.5111
71:	[0s / 32s],		train_loss: 2.4001
7:	[1s / 9s],		train_loss: 2.6110
51:	[0s / 23s],		train_loss: 2.4829
72:	[0s / 33s],		train_loss: 2.3916
21:	[0s / 11s],		train_loss: 2.5126
52:	[0s / 24s],		train_loss: 2.4721
73:	[0s / 33s],		train_loss: 2.3942
22:	[0s / 12s],		train_loss: 2.5081
53:	[0s / 24s],		train_loss: 2.4654
74:	[0s / 34s],		train_loss: 2.3876
23:	[0s / 12s],		train_loss: 2.4909
8:	[1s / 10s],		train_loss: 2.6023
54:	[0s / 25s],		train_loss: 2.4629
75:	[0s / 34s],		train_loss: 2.3907
24:	[0s / 13s],		train_loss: 2.5048
55:	[0s / 25s],		train_loss: 2.4652
76:	[0s / 35s],		train_loss: 2.3779
25:	[0s / 13s],		train_loss: 2.4842
56:	[0s / 26s],		train_loss: 2.4662
77:	[0s / 35s],		train_loss: 2.3960
9:	[1s / 11s],		train_loss: 2.5821
26:	[0s / 14s],		train_loss: 2.4860
57:	[0s / 26s],		train_loss: 2.4674
78:	[0s / 36s],		train_loss: 2.3910
27:	[0s / 14s],		train_loss: 2.4860
58:	[0s / 27s],		train_loss: 2.4634
79:	[0s / 36s],		train_loss: 2.3842
10:	[1s / 13s],		train_loss: 2.5801
59:	[0s / 27s],		train_loss: 2.4605
28:	[0s / 15s],		train_loss: 2.4738
80:	[0s / 36s],		train_loss: 2.3866
60:	[0s / 28s],		train_loss: 2.4553
81:	[0s / 37s],		train_loss: 2.3926
29:	[0s / 15s],		train_loss: 2.4821
61:	[0s / 28s],		train_loss: 2.4580
82:	[0s / 37s],		train_loss: 2.3918
30:	[0s / 16s],		train_loss: 2.4850
11:	[1s / 14s],		train_loss: 2.5609
62:	[0s / 28s],		train_loss: 2.4661
83:	[0s / 38s],		train_loss: 2.3960
31:	[0s / 16s],		train_loss: 2.4752
63:	[0s / 29s],		train_loss: 2.4659
84:	[0s / 38s],		train_loss: 2.3936
32:	[0s / 17s],		train_loss: 2.4684
64:	[0s / 29s],		train_loss: 2.4563
85:	[0s / 39s],		train_loss: 2.3941
12:	[1s / 15s],		train_loss: 2.5529
33:	[0s / 17s],		train_loss: 2.4649
65:	[0s / 30s],		train_loss: 2.4435
86:	[0s / 39s],		train_loss: 2.3855
34:	[0s / 18s],		train_loss: 2.4706
66:	[0s / 30s],		train_loss: 2.4575
87:	[0s / 40s],		train_loss: 2.3790
13:	[1s / 16s],		train_loss: 2.5569
35:	[0s / 19s],		train_loss: 2.4622
67:	[0s / 31s],		train_loss: 2.4635
88:	[0s / 40s],		train_loss: 2.3939
68:	[0s / 31s],		train_loss: 2.4377
36:	[0s / 19s],		train_loss: 2.4668
89:	[0s / 41s],		train_loss: 2.3801
69:	[0s / 32s],		train_loss: 2.4514
37:	[0s / 20s],		train_loss: 2.4647
14:	[1s / 18s],		train_loss: 2.5367
90:	[0s / 41s],		train_loss: 2.3781
70:	[0s / 32s],		train_loss: 2.4483
38:	[0s / 20s],		train_loss: 2.4610
91:	[0s / 42s],		train_loss: 2.3811
71:	[0s / 33s],		train_loss: 2.4436
92:	[0s / 42s],		train_loss: 2.3701
39:	[0s / 21s],		train_loss: 2.4608
15:	[1s / 19s],		train_loss: 2.5387
72:	[0s / 33s],		train_loss: 2.4495
93:	[0s / 43s],		train_loss: 2.3741
40:	[0s / 21s],		train_loss: 2.4552
73:	[0s / 34s],		train_loss: 2.4476
94:	[0s / 43s],		train_loss: 2.3779
41:	[0s / 22s],		train_loss: 2.4603
74:	[0s / 34s],		train_loss: 2.4450
95:	[0s / 44s],		train_loss: 2.3788
16:	[1s / 20s],		train_loss: 2.5348
42:	[0s / 22s],		train_loss: 2.4523
75:	[0s / 35s],		train_loss: 2.4584
96:	[0s / 44s],		train_loss: 2.3856
76:	[0s / 35s],		train_loss: 2.4500
43:	[0s / 23s],		train_loss: 2.4563
97:	[0s / 44s],		train_loss: 2.3610
77:	[0s / 35s],		train_loss: 2.4437
17:	[1s / 21s],		train_loss: 2.5230
44:	[0s / 23s],		train_loss: 2.4476
98:	[0s / 45s],		train_loss: 2.3717
78:	[0s / 36s],		train_loss: 2.4342
45:	[0s / 24s],		train_loss: 2.4583
99:	[0s / 45s],		train_loss: 2.3634
79:	[0s / 36s],		train_loss: 2.4397
46:	[0s / 24s],		train_loss: 2.4568
0:	[0s / 0s],		train_loss: 4.3520
18:	[1s / 23s],		train_loss: 2.5192
80:	[0s / 37s],		train_loss: 2.4428
1:	[0s / 0s],		train_loss: 3.0348
47:	[0s / 25s],		train_loss: 2.4491
81:	[0s / 37s],		train_loss: 2.4414
2:	[0s / 1s],		train_loss: 2.8164
82:	[0s / 38s],		train_loss: 2.4314
48:	[0s / 26s],		train_loss: 2.4486
3:	[0s / 1s],		train_loss: 2.7122
19:	[1s / 24s],		train_loss: 2.5173
83:	[0s / 38s],		train_loss: 2.4380
49:	[0s / 26s],		train_loss: 2.4610
4:	[0s / 2s],		train_loss: 2.6864
84:	[0s / 39s],		train_loss: 2.4338
5:	[0s / 2s],		train_loss: 2.6526
50:	[0s / 27s],		train_loss: 2.4340
85:	[0s / 39s],		train_loss: 2.4324
20:	[1s / 25s],		train_loss: 2.5104
6:	[0s / 3s],		train_loss: 2.6404
86:	[0s / 40s],		train_loss: 2.4447
51:	[0s / 27s],		train_loss: 2.4404
7:	[0s / 3s],		train_loss: 2.6249
87:	[0s / 40s],		train_loss: 2.4390
52:	[0s / 28s],		train_loss: 2.4498
88:	[0s / 40s],		train_loss: 2.4331
8:	[0s / 4s],		train_loss: 2.6175
21:	[1s / 26s],		train_loss: 2.5013
53:	[0s / 29s],		train_loss: 2.4388
89:	[0s / 41s],		train_loss: 2.4162
9:	[0s / 4s],		train_loss: 2.5913
90:	[0s / 41s],		train_loss: 2.4282
54:	[0s / 29s],		train_loss: 2.4343
10:	[0s / 5s],		train_loss: 2.5821
91:	[0s / 42s],		train_loss: 2.4254
22:	[1s / 28s],		train_loss: 2.5065
11:	[0s / 5s],		train_loss: 2.5644
55:	[0s / 30s],		train_loss: 2.4394
92:	[0s / 42s],		train_loss: 2.4284
12:	[0s / 6s],		train_loss: 2.5621
56:	[0s / 30s],		train_loss: 2.4340
93:	[0s / 43s],		train_loss: 2.4227
13:	[0s / 6s],		train_loss: 2.5533
23:	[1s / 29s],		train_loss: 2.5069
94:	[0s / 43s],		train_loss: 2.4244
57:	[0s / 31s],		train_loss: 2.4458
14:	[0s / 7s],		train_loss: 2.5484
95:	[0s / 44s],		train_loss: 2.4242
58:	[0s / 31s],		train_loss: 2.4286
15:	[0s / 7s],		train_loss: 2.5363
96:	[0s / 44s],		train_loss: 2.4250
16:	[0s / 7s],		train_loss: 2.5499
59:	[0s / 32s],		train_loss: 2.4336
24:	[1s / 30s],		train_loss: 2.5045
97:	[0s / 44s],		t