[I 2026-06-08 20:55:40,375] Trial 53 finished with value: 0.7699539118693334 and parameters: {'num_nodes': [128, 64], 'dropout': 0.04136497129587631, 'learning_rate': 0.00012058108689928372, 'batch_norm': False}. Best is trial 34 with value: 0.8066104766951468.
/scratch.hpc/luca.cotugno/Foundation_model_clinical_data/test_tabular_model_tmp.py:476: UserWarning: Choices for a categorical distribution should be a tuple of None, bool, int, float and str for persistent storage but contains [32] which is of type list.
  num_nodes  = trial.suggest_categorical("num_nodes", [[32], [64], [128], [64, 32], [128, 64]])
/scratch.hpc/luca.cotugno/Foundation_model_clinical_data/test_tabular_model_tmp.py:476: UserWarning: Choices for a categorical distribution should be a tuple of None, bool, int, float and str for persistent storage but contains [64] which is of type list.
  num_nodes  = trial.suggest_categorical("num_nodes", [[32], [64], [128], [64, 32], [128, 64]])
/scratch.hpc/luca.cotugno/Foundation_model_clinical_data/test_tabular_model_tmp.py:476: UserWarning: Choices for a categorical distribution should be a tuple of None, bool, int, float and str for persistent storage but contains [128] which is of type list.
  num_nodes  = trial.suggest_categorical("num_nodes", [[32], [64], [128], [64, 32], [128, 64]])
/scratch.hpc/luca.cotugno/Foundation_model_clinical_data/test_tabular_model_tmp.py:476: UserWarning: Choices for a categorical distribution should be a tuple of None, bool, int, float and str for persistent storage but contains [64, 32] which is of type list.
  num_nodes  = trial.suggest_categorical("num_nodes", [[32], [64], [128], [64, 32], [128, 64]])
/scratch.hpc/luca.cotugno/Foundation_model_clinical_data/test_tabular_model_tmp.py:476: UserWarning: Choices for a categorical distribution should be a tuple of None, bool, int, float and str for persistent storage but contains [128, 64] which is of type list.
  num_nodes  = trial.suggest_categorical("num_nodes", [[32], [64], [128], [64, 32], [128, 64]])

82:	[0s / 41s],		train_loss: 2.3902
50:	[1s / 57s],		train_loss: 2.4097
38:	[0s / 18s],		train_loss: 2.4380
83:	[0s / 41s],		train_loss: 2.3868
71:	[0s / 52s],		train_loss: 2.4126
39:	[0s / 18s],		train_loss: 2.4461
84:	[0s / 42s],		train_loss: 2.3876
51:	[1s / 58s],		train_loss: 2.4153
40:	[0s / 19s],		train_loss: 2.4296
72:	[0s / 52s],		train_loss: 2.4097
85:	[0s / 42s],		train_loss: 2.3847
41:	[0s / 19s],		train_loss: 2.4235
86:	[0s / 43s],		train_loss: 2.3967
73:	[0s / 53s],		train_loss: 2.4161
42:	[0s / 20s],		train_loss: 2.4344
87:	[0s / 43s],		train_loss: 2.3892
52:	[1s / 59s],		train_loss: 2.4262
43:	[0s / 20s],		train_loss: 2.4228
74:	[0s / 54s],		train_loss: 2.4211
88:	[0s / 44s],		train_loss: 2.3797
44:	[0s / 21s],		train_loss: 2.4273
89:	[0s / 44s],		train_loss: 2.3795
75:	[0s / 55s],		train_loss: 2.4164
53:	[1s / 1m:0s],		train_loss: 2.4115
45:	[0s / 21s],		train_loss: 2.4343
90:	[0s / 45s],		train_loss: 2.3898
46:	[0s / 22s],		train_loss: 2.4306
76:	[0s / 55s],		train_loss: 2.4194
91:	[0s / 45s],		train_loss: 2.3738
47:	[0s / 22s],		train_loss: 2.4416
77:	[0s / 56s],		train_loss: 2.4284
54:	[1s / 1m:1s],		train_loss: 2.4194
92:	[0s / 46s],		train_loss: 2.3689
48:	[0s / 23s],		train_loss: 2.4175
93:	[0s / 46s],		train_loss: 2.3715
49:	[0s / 23s],		train_loss: 2.4193
78:	[0s / 57s],		train_loss: 2.4094
94:	[0s / 47s],		train_loss: 2.3652
50:	[0s / 24s],		train_loss: 2.4138
55:	[1s / 1m:3s],		train_loss: 2.4064
79:	[0s / 58s],		train_loss: 2.4076
95:	[0s / 47s],		train_loss: 2.3748
51:	[0s / 24s],		train_loss: 2.4231
96:	[0s / 48s],		train_loss: 2.3740
52:	[0s / 25s],		train_loss: 2.4232
80:	[0s / 58s],		train_loss: 2.4247
56:	[1s / 1m:4s],		train_loss: 2.4101
97:	[0s / 48s],		train_loss: 2.3690
53:	[0s / 25s],		train_loss: 2.4103
81:	[0s / 59s],		train_loss: 2.4152
98:	[0s / 49s],		train_loss: 2.3782
54:	[0s / 26s],		train_loss: 2.4078
82:	[0s / 1m:0s],		train_loss: 2.4050
99:	[0s / 49s],		train_loss: 2.3632
55:	[0s / 26s],		train_loss: 2.4161
57:	[1s / 1m:5s],		train_loss: 2.4089
56:	[0s / 27s],		train_loss: 2.3967
0:	[0s / 0s],		train_loss: 3.7106
83:	[0s / 1m:0s],		train_loss: 2.4094
57:	[0s / 27s],		train_loss: 2.4245
1:	[0s / 0s],		train_loss: 2.9639
58:	[1s / 1m:6s],		train_loss: 2.3852
84:	[0s / 1m:1s],		train_loss: 2.4041
58:	[0s / 28s],		train_loss: 2.4072
2:	[0s / 1s],		train_loss: 2.8051
59:	[0s / 28s],		train_loss: 2.4006
3:	[0s / 2s],		train_loss: 2.7073
85:	[0s / 1m:2s],		train_loss: 2.3938
60:	[0s / 29s],		train_loss: 2.3941
59:	[1s / 1m:8s],		train_loss: 2.4062
4:	[0s / 2s],		train_loss: 2.6735
86:	[0s / 1m:3s],		train_loss: 2.4011
61:	[0s / 29s],		train_loss: 2.3984
5:	[0s / 3s],		train_loss: 2.6205
62:	[0s / 30s],		train_loss: 2.4011
6:	[0s / 3s],		train_loss: 2.6218
87:	[0s / 1m:3s],		train_loss: 2.4081
60:	[1s / 1m:9s],		train_loss: 2.4008
63:	[0s / 30s],		train_loss: 2.3902
7:	[0s / 4s],		train_loss: 2.5933
64:	[0s / 31s],		train_loss: 2.4036
88:	[0s / 1m:4s],		train_loss: 2.4112
8:	[0s / 4s],		train_loss: 2.5743
65:	[0s / 31s],		train_loss: 2.4034
61:	[1s / 1m:10s],		train_loss: 2.4048
89:	[0s / 1m:5s],		train_loss: 2.4007
9:	[0s / 5s],		train_loss: 2.5616
66:	[0s / 32s],		train_loss: 2.3889
10:	[0s / 5s],		train_loss: 2.5647
67:	[0s / 32s],		train_loss: 2.4033
90:	[0s / 1m:6s],		train_loss: 2.4009
11:	[0s / 6s],		train_loss: 2.5331
62:	[1s / 1m:11s],		train_loss: 2.4166
68:	[0s / 33s],		train_loss: 2.4023
91:	[0s / 1m:6s],		train_loss: 2.4050
12:	[0s / 6s],		train_loss: 2.5414
69:	[0s / 33s],		train_loss: 2.4112
13:	[0s / 7s],		train_loss: 2.5367
70:	[0s / 33s],		train_loss: 2.3977
92:	[0s / 1m:7s],		train_loss: 2.4060
63:	[1s / 1m:13s],		train_loss: 2.3839
14:	[0s / 7s],		train_loss: 2.5213
71:	[0s / 34s],		train_loss: 2.3839
93:	[0s / 1m:8s],		train_loss: 2.4076
15:	[0s / 8s],		train_loss: 2.5275
72:	[0s / 34s],		train_loss: 2.3902
16:	[0s / 8s],		train_loss: 2.5074
64:	[1s / 1m:14s],		train_loss: 2.4025
73:	[0s / 35s],		train_loss: 2.3897
94:	[0s / 1m:9s],		train_loss: 2.3878
17:	[0s / 9s],		train_loss: 2.5102
74:	[0s / 35s],		train_loss: 2.3852
95:	[0s / 1m:9s],		train_loss: 2.4135
18:	[0s / 9s],		train_loss: 2.4945
75:	[0s / 36s],		train_loss: 2.3863
65:	[1s / 1m:15s],		train_loss: 2.4040
19:	[0s / 10s],		train_loss: 2.4960
76:	[0s / 36s],		train_loss: 2.3739
96:	[0s / 1m:10s],		train_loss: 2.4133
20:	[0s / 10s],		train_loss: 2.4990
77:	[0s / 37s],		train_loss: 2.3817
97:	[0s / 1m:11s],		train_loss: 2.4060
66:	[1s / 1m:16s],		train_loss: 2.3982
78:	[0s / 37s],		train_loss: 2.3817
21:	[0s / 11s],		train_loss: 2.4974
79:	[0s / 38s],		train_loss: 2.3754
22:	[0s / 11s],		train_loss: 2.4907
98:	[0s / 1m:12s],		train_loss: 2.3983
80:	[0s / 38s],		train_loss: 2.3817
23:	[0s / 12s],		train_loss: 2.4780
67:	[1s / 1m:18s],		train_loss: 2.3830
99:	[0s / 1m:12s],		train_loss: 2.3987
81:	[0s / 39s],		train_loss: 2.3861
24:	[0s / 12s],		train_loss: 2.4802
82:	[0s / 39s],		train_loss: 2.3713
25:	[0s / 13s],		train_loss: 2.4858
0:	[0s / 0s],		train_loss: 3.8013
68:	[1s / 1m:19s],		train_loss: 2.3981
83:	[0s / 40s],		train_loss: 2.3620
26:	[0s / 13s],		train_loss: 2.4771
84:	[0s / 40s],		train_loss: 2.3745
1:	[0s / 1s],		train_loss: 2.9178
27:	[0s / 14s],		train_loss: 2.4935
85:	[0s / 41s],		train_loss: 2.3615
69:	[1s / 1m:20s],		train_loss: 2.3896
28:	[0s / 14s],		train_loss: 2.4745
2:	[0s / 2s],		train_loss: 2.8101
86:	[0s / 41s],		train_loss: 2.3850
29:	[0s / 15s],		train_loss: 2.4628
87:	[0s / 42s],		train_loss: 2.3731
3:	[0s / 2s],		train_loss: 2.7156
30:	[0s / 15s],		train_loss: 2.4768
70:	[1s / 1m:21s],		train_loss: 2.3872
88:	[0s / 42s],		train_loss: 2.3691
31:	[0s / 16s],		train_loss: 2.4713
4:	[0s / 3s],		train_loss: 2.6766
89:	[0s / 43s],		train_loss: 2.3615
32:	[0s / 16s],		train_loss: 2.4737
90:	[0s / 43s],		train_loss: 2.3655
71:	[1s / 1m:22s],		train_loss: 2.3967
5:	[0s / 4s],		train_loss: 2.6473
33:	[0s / 17s],		train_loss: 2.4817
91:	[0s / 44s],		train_loss: 2.3612
34:	[0s / 17s],		train_loss: 2.4663
6:	[0s / 5s],		train_loss: 2.6041
92:	[0s / 44s],		train_loss: 2.3704
35:	[0s / 18s],		train_loss: 2.4530
72:	[1s / 1m:24s],		train_loss: 2.3971
93:	[0s / 45s],		train_loss: 2.3675
7:	[0s / 5s],		train_loss: 2.5874
36:	[0s / 18s],		train_loss: 2.4584
94:	[0s / 45s],		train_loss: 2.3666
37:	[0s / 19s],		train_loss: 2.4563
8:	[0s / 6s],		train_loss: 2.5684
95:	[0s / 46s],		train_loss: 2.3698
73:	[1s / 1m:25s],		train_loss: 2.3827
38:	[0s / 19s],		train_loss: 2.4597
96:	[0s / 46s],		train_loss: 2.3569
9:	[0s / 7s],		train_loss: 2.5630
39:	[0s / 20s],		train_loss: 2.4527
97:	[0s / 47s],		train_loss: 2.3598
10:	[0s / 8s],		train_loss: 2.5415
40:	[0s / 20s],		train_loss: 2.4576
74:	[1s / 1m:26s],		train_loss: 2.3808
98:	[0s / 47s],		train_loss: 2.3552
41:	[0s / 21s],		train_loss: 2.4456
99:	[0s / 48s],		train_loss: 2.3605
11:	[0s / 8s],		train_loss: 2.5524
42:	[0s / 21s],		train_loss: 2.4471
0:	[0s / 0s],		train_loss: 3.9697
75:	[1s / 1m:27s],		train_loss: 2.3939
12:	[0s / 9s],		train_loss: 2.5322
43:	[0s / 22s],		train_loss: 2.4436
1:	[0s / 0s],		train_loss: 2.8527
44:	[0s / 22s],		train_loss: 2.4379
2:	[0s / 1s],		train_loss: 2.7251
13:	[0s / 10s],		train_loss: 2.5217
76:	[1s / 1m:29s],		train_loss: 2.3865
45:	[0s / 23s],		train_loss: 2.4378
3:	[0s / 1s],		train_loss: 2.6825
14:	[0s / 10s],		train_loss: 2.5269
46:	[0s / 23s],		train_loss: 2.4306
4:	[0s / 2s],		train_loss: 2.6380
47:	[0s / 24s],		train_loss: 2.4447
15:	[0s / 11s],		train_loss: 2.5142
5:	[0s / 2s],		train_loss: 2.6222
77:	[1s / 1m:30s],		train_loss: 2.3793
6:	[0s / 3s],		train_loss: 2.5890
48:	[0s / 24s],		train_loss: 2.4524
16:	[0s / 12s],		train_loss: 2.5051
7:	[0s / 3s],		train_loss: 2.5903
49:	[0s / 25s],		train_loss: 2.4322
78:	[1s / 1m:31s],		train_loss: 2.3729
8:	[0s / 4s],		train_loss: 2.5640
17:	[0s / 13s],		train_loss: 2.4904
50:	[0s / 25s],		train_loss: 2.4268
9:	[0s / 4s],		train_loss: 2.5710
51:	[0s / 26s],		train_loss: 2.4543
18:	[0s / 13s],		train_loss: 2.4942
10:	[0s / 5s],		train_loss: 2.5411
52:	[0s / 26s],		train_loss: 2.4323
79:	[1s / 1m:32s],		train_loss: 2.3622
19:	[0s / 14s],		train_loss: 2.4833
11:	[0s / 5s],		train_loss: 2.5339
53:	[0s / 27s],		train_loss: 2.4250
12:	[0s / 6s],		train_loss: 2.5261
54:	[0s / 27s],		train_loss: 2.4194
20:	[0s / 15s],		train_loss: 2.4958
13:	[0s / 6s],		train_loss: 2.5279
80:	[1s / 1m:33s],		train_loss: 2.3789
55:	[0s / 28s],		train_loss: 2.4188
14:	[0s / 7s],		train_loss: 2.5049
21:	[0s / 15s],		train_loss: 2.4860
56:	[0s / 28s],		train_loss: 2.4212
15:	[0s / 7s],		train_loss: 2.5213
22:	[0s / 16s],		train_loss: 2.4810
57:	[0s / 29s],		train_loss: 2.4117
16:	[0s / 7s],		train_loss: 2.5009
81:	[1s / 1m:35s],		train_loss: 2.3867
58:	[0s / 29s],		train_loss: 2.4210
23:	[0s / 17s],		train_loss: 2.4703
17:	[0s / 8s],		train_loss: 2.5147
59:	[0s / 30s],		train_loss: 2.4205
18:	[0s / 8s],		train_loss: 2.4969
24:	[0s / 17s],		train_loss: 2.4835
82:	[1s / 1m:36s],		train_loss: 2.3869
60:	[0s / 30s],		train_loss: 2.4132
19:	[0s / 9s],		train_loss: 2.5002
61:	[0s / 31s],		train_loss: 2.4230
25:	[0s / 18s],		train_loss: 2.4707
20:	[0s / 9s],		train_loss: 2.4988
62:	[0s / 31s],		train_loss: 2.4116
21:	[0s / 10s],		train_loss: 2.4954
83:	[1s / 1m:37s],		train_loss: 2.3795
26:	[0s / 19s],		train_loss: 2.4601
63:	[0s / 32s],		train_loss: 2.4246
22:	[0s / 10s],		train_loss: 2.4940
64:	[0s / 32s],		train_loss: 2.4212
27:	[0s / 19s],		train_loss: 2.4475
23:	[0s / 11s],		train_loss: 2.4914
84:	[1s / 1m:38s],		train_loss: 2.3721
65:	[0s / 33s],		train_loss: 2.4126
24:	[0s / 11s],		train_loss: 2.4877
28:	[0s / 20s],		train_loss: 2.4482
66:	[0s / 33s],		train_loss: 2.4067
25:	[0s / 12s],		train_loss: 2.4783
26:	[0s / 12s],		train_loss: 2.4764
67:	[0s / 34s],		train_loss: 2.4033
29:	[0s / 21s],		train_loss: 2.4630
85:	[1s / 1m:40s],		train_loss: 2.3683
27:	[0s / 13s],		train_loss: 2.4677
68:	[0s / 34s],		train_loss: 2.4102
30:	[0s / 22s],		train_loss: 2.4673
28:	[0s / 13s],		train_loss: 2.4682
69:	[0s / 35s],		train_loss: 2.4030
31:	[0s / 22s],		train_loss: 2.4478
29:	[0s / 13s],		train_loss: 2.4720
86:	[1s / 1m:41s],		train_loss: 2.3705
70:	[0s / 35s],		train_loss: 2.4034
30:	[0s / 14s],		train_loss: 2.4676
71:	[0s / 36s],		train_loss: 2.4035
32:	[0s / 23s],		train_loss: 2.4497
31:	[0s / 14s],		train_loss: 2.4771
72:	[0s / 36s],		train_loss: 2.3976
87:	[1s / 1m:42s],		train_loss: 2.3522
33:	[0s / 24s],		train_loss: 2.4461
32:	[0s / 15s],		train_loss: 2.4640
73:	[0s / 37s],		train_loss: 2.3875
33:	[0s / 15s],		train_loss: 2.4676
74:	[0s / 37s],		train_loss: 2.3853
34:	[0s / 24s],		train_loss: 2.4366
34:	[0s / 16s],		train_loss: 2.4700
88:	[1s / 1m:43s],		train_loss: 2.3646
75:	[0s / 38s],		train_loss: 2.3970
35:	[0s / 16s],		train_loss: 2.4636
35:	[0s / 25s],		train_loss: 2.4499
76:	[0s / 38s],		train_loss: 2.4049
36:	[0s / 17s],		train_loss: 2.4564
77:	[0s / 38s],		train_loss: 2.3971
36:	[0s / 26s],		train_loss: 2.4324
89:	[1s / 1m:44s],		train_loss: 2.3685
37:	[0s / 17s],		train_loss: 2.4513
78:	[0s / 39s],		train_loss: 2.3837
38:	[0s / 18s],		train_loss: 2.4489
37:	[0s / 27s],		train_loss: 2.4299
79:	[0s / 39s],		train_loss: 2.3942
39:	[0s / 18s],		train_loss: 2.4660
90:	[1s / 1m:46s],		train_loss: 2.3692
80:	[0s / 40s],		train_loss: 2.3958
38:	[0s / 27s],		train_loss: 2.4368
40:	[0s / 19s],		train_loss: 2.4425
81:	[0s / 40s],		train_loss: 2.3795
41:	[0s / 19s],		train_loss: 2.4477
39:	[0s / 28s],		train_loss: 2.4260
82:	[0s / 41s],		train_loss: 2.3930
42:	[0s / 20s],		train_loss: 2.4482
91:	[1s / 1m:47s],		train_loss: 2.3673
40:	[0s / 29s],		train_loss: 2.4365
83:	[0s / 41s],		train_loss: 2.3880
43:	[0s / 20s],		train_loss: 2.4532
84:	[0s / 42s],		train_loss: 2.3907
44:	[0s / 20s],		train_loss: 2.4307
41:	[0s / 29s],		train_loss: 2.4450
92:	[1s / 1m:48s],		train_loss: 2.3684
85:	[0s / 42s],		train_loss: 2.3865
45:	[0s / 21s],		train_loss: 2.4473
42:	[0s / 30s],		train_loss: 2.4263
86:	[0s / 43s],		train_loss: 2.3884
46:	[0s / 21s],		train_loss: 2.4436
87:	[0s / 43s],		train_loss: 2.3671
47:	[0s / 22s],		train_loss: 2.4409
93:	[1s / 1m:49s],		train_loss: 2.3740
43:	[0s / 31s],		train_loss: 2.4151
48:	[0s / 22s],		train_loss: 2.4228
88:	[0s / 44s],		train_loss: 2.4000
44:	[0s / 31s],		train_loss: 2.4170
49:	[0s / 23s],		train_loss: 2.4395
89:	[0s / 44s],		train_loss: 2.3870
94:	[1s / 1m:50s],		train_loss: 2.3678
50:	[0s / 23s],		train_loss: 2.4302
90:	[0s / 45s],		train_loss: 2.3889
45:	[0s / 32s],		train_loss: 2.4206
51:	[0s / 24s],		train_loss: 2.4383
91:	[0s / 45s],		train_loss: 2.3803
46:	[0s / 33s],		train_loss: 2.4090
95:	[1s / 1m:51s],		train_loss: 2.3719
52:	[0s / 24s],		train_loss: 2.4343
92:	[0s / 46s],		train_loss: 2.3774
53:	[0s / 25s],		train_loss: 2.4370
47:	[0s / 34s],		train_loss: 2.4243
93:	[0s / 46s],		train_loss: 2.3766
54:	[0s / 25s],		train_loss: 2.4265
94:	[0s / 47s],		train_loss: 2.3811
96:	[1s / 1m:53s],		train_loss: 2.3569
48:	[0s / 34s],		train_loss: 2.4200
55:	[0s / 26s],		train_loss: 2.4137
95:	[0s / 47s],		train_loss: 2.3749
56:	[0s / 26s],		train_loss: 2.4276
49:	[0s / 35s],		train_loss: 2.4072
96:	[0s / 48s],		train_loss: 2.3735
57:	[0s / 27s],		train_loss: 2.4079
97:	[0s / 48s],		train_loss: 2.3686
97:	[1s / 1m:54s],		train_loss: 2.3698
50:	[0s / 36s],		train_loss: 2.4058
58:	[0s / 27s],		train_loss: 2.4196
98:	[0s / 49s],		train_loss: 2.3628
59:	[0s / 28s],		train_loss: 2.4140
51:	[0s / 37s],		train_loss: 2.4088
99:	[0s / 49s],		train_loss: 2.3667
98:	[1s / 1m:55s],		train_loss: 2.3470
60:	[0s / 28s],		train_loss: 2.4186
0:	[0s / 0s],		train_loss: 4.3888
52:	[0s / 37s],		train_loss: 2.4122
61:	[0s / 29s],		train_loss: 2.4177
1:	[0s / 0s],		train_loss: 2.9574
62:	[0s / 29s],		train_loss: 2.4150
53:	[0s / 38s],		train_loss: 2.4185
99:	[1s / 1m:57s],		train_loss: 2.3467
2:	[0s / 1s],		train_loss: 2.7926
63:	[0s / 30s],		train_loss: 2.4110
54:	[0s / 39s],		train_loss: 2.4113
3:	[0s / 2s],		train_loss: 2.7139
64:	[0s / 30s],		train_loss: 2.4136
4:	[0s / 2s],		train_loss: 2.6899
65:	[0s / 31s],		train_loss: 2.4167
0:	[1s / 1s],		train_loss: 3.4182
55:	[0s / 40s],		train_loss: 2.4173
5:	[0s / 3s],		train_loss: 2.6311
66:	[0s / 31s],		train_loss: 2.4151
56:	[0s / 40s],		train_loss: 2.4070
6:	[0s / 3s],		train_loss: 2.6226
67:	[0s / 32s],		train_loss: 2.4117
1:	[1s / 2s],		train_loss: 2.7575
7:	[0s / 4s],		train_loss: 2.6001
68:	[0s / 32s],		train_loss: 2.4195
57:	[0s / 41s],		train_loss: 2.4004
8:	[0s / 4s],		train_loss: 2.5651
69:	[0s / 33s],		train_loss: 2.4029
58:	[0s / 42s],		train_loss: 2.4011
70:	[0s / 33s],		train_loss: 2.3958
9:	[0s / 5s],		train_loss: 2.5580
2:	[1s / 3s],		train_loss: 2.6531
71:	[0s / 34s],		train_loss: 2.4062
10:	[0s / 5s],		train_loss: 2.5407
59:	[0s / 43s],		train_loss: 2.4009
72:	[0s / 34s],		train_loss: 2.4068
11:	[0s / 6s],		train_loss: 2.5393
60:	[0s / 43s],		train_loss: 2.3941
73:	[0s / 34s],		train_loss: 2.4039
12:	[0s / 6s],		train_loss: 2.5338
3:	[1s / 5s],		train_loss: 2.6011
74:	[0s / 35s],		train_loss: 2.4061
13:	[0s / 7s],		train_loss: 2.5144
61:	[0s / 44s],		train_loss: 2.4001
75:	[0s / 35s],		train_loss: 2.3924
14:	[0s / 7s],		train_loss: 2.5052
4:	[1s / 6s],		train_loss: 2.5780
76:	[0s / 36s],		train_loss: 2.3946
62:	[0s / 45s],		train_loss: 2.3940
15:	[0s / 8s],		train_loss: 2.5131
77:	[0s / 36s],		train_loss: 2.3850
16:	[0s / 8s],		train_loss: 2.5108
63:	[0s / 45s],		train_loss: 2.3999
78:	[0s / 37s],		train_loss: 2.3912
17:	[0s / 9s],		train_loss: 2.5027
5:	[1s / 7s],		train_loss: 2.5448
79:	[0s / 37s],		train_loss: 2.3870
64:	[0s / 46s],		train_loss: 2.3933
18:	[0s / 9s],		train_loss: 2.5015
80:	[0s / 38s],		train_loss: 2.3972
19:	[0s / 10s],		train_loss: 2.4946
65:	[0s / 47s],		train_loss: 2.3907
81:	[0s / 38s],		train_loss: 2.4095
6:	[1s / 9s],		train_loss: 2.5340
20:	[0s / 10s],		train_loss: 2.5017
82:	[0s / 39s],		train_loss: 2.3916
66:	[0s / 48s],		train_loss: 2.3930
21:	[0s / 11s],		train_loss: 2.4866
83:	[0s / 39s],		train_loss: 2.3944
67:	[0s / 48s],		train_loss: 2.3860
22:	[0s / 11s],		train_loss: 2.4689
84:	[0s / 40s],		train_loss: 2.3773
7:	[1s / 10s],		train_loss: 2.5293
23:	[0s / 12s],		train_loss: 2.4707
85:	[0s / 40s],		train_loss: 2.3846
68:	[0s / 49s],		train_loss: 2.3852
24:	[0s / 12s],		train_loss: 2.4710
86:	[0s / 41s],		train_loss: 2.3863
69:	[0s / 50s],		train_loss: 2.3816
25:	[0s / 13s],		train_loss: 2.4698
87:	[0s / 41s],		train_loss: 2.3830
8:	[1s / 11s],		train_loss: 2.5170
26:	[0s / 13s],		train_loss: 2.4656
88:	[0s / 42s],		train_loss: 2.3857
70:	[0s / 51s],		train_loss: 2.3823
27:	[0s / 14s],		train_loss: 2.4553
89:	[0s / 42s],		train_loss: 2.3777
71:	[0s / 51s],		train_loss: 2.3882
28:	[0s / 14s],		train_loss: 2.4631
90:	[0s / 43s],		train_loss: 2.3863
9:	[1s / 13s],		train_loss: 2.5025
91:	[0s / 43s],		train_loss: 2.3715
29:	[0s / 15s],		train_loss: 2.4686
72:	[0s / 52s],		train_loss: 2.3856
92:	[0s / 44s],		train_loss: 2.3763
30:	[0s / 15s],		train_loss: 2.4583
73:	[0s / 53s],		train_loss: 2.3913
93:	[0s / 44s],		train_loss: 2.3922
31:	[0s / 16s],		train_loss: 2.4596
10:	[1s / 14s],		train_loss: 2.5155
94:	[0s / 44s],		train_loss: 2.3945
32:	[0s / 16s],		train_loss: 2.4437
74:	[0s / 53s],		train_loss: 2.3790
95:	[0s / 45s],		train_loss: 2.3746
33:	[0s / 16s],		train_loss: 2.4427
75:	[0s / 54s],		train_loss: 2.3826
11:	[1s / 15s],		train_loss: 2.5016
96:	[0s / 45s],		train_loss: 2.3807
34:	[0s / 17s],		train_loss: 2.4564
97:	[0s / 46s],		train_loss: 2.3711
35:	[0s / 17s],		train_loss: 2.4516
76:	[0s / 55s],		train_loss: 2.3748
98:	[0s / 46s],		train_loss: 2.3731
36:	[0s / 18s],		train_loss: 2.4380
12:	[1s / 17s],		train_loss: 2.5001
77:	[0s / 56s],		train_loss: 2.3685
99:	[0s / 47s],		train_loss: 2.3635
37:	[0s / 18s],		train_loss: 2.4407
78:	[0s / 56s],		train_loss: 2.3632
38:	[0s / 19s],		train_loss: 2.4430
0:	[0s / 0s],		train_loss: 3.6341
39:	[0s / 20s],		train_loss: 2.4336
13:	[1s / 18s],		train_loss: 2.4913
79:	[0s / 57s],		train_loss: 2.3833
1:	[0s / 1s],		train_loss: 2.9566
40:	[0s / 20s],		train_loss: 2.4309
2:	[0s / 1s],		train_loss: 2.8536
80:	[0s / 57s],		train_loss: 2.3704
41:	[0s / 21s],		train_loss: 2.4362
3:	[0s / 2s],		train_loss: 2.8362
81:	[0s / 58s],		train_loss: 2.3742
14:	[1s / 20s],		train_loss: 2.4830
42:	[0s / 21s],		train_loss: 2.4351
4:	[0s / 2s],		train_loss: 2.8054
82:	[0s / 59s],		train_loss: 2.3702
43:	[0s / 22s],		train_loss: 2.4281
5:	[0s / 3s],		train_loss: 2.7426
83:	[0s / 59s],		train_loss: 2.3585
44:	[0s / 22s],		train_loss: 2.4251
6:	[0s / 3s],		train_loss: 2.7479
15:	[1s / 21s],		train_loss: 2.4728
84:	[0s / 1m:0s],		train_loss: 2.3644
45:	[0s / 23s],		train_loss: 2.4281
7:	[0s / 4s],		train_loss: 2.7177
46:	[0s / 23s],		train_loss: 2.4260
85:	[0s / 1m:0s],		train_loss: 2.3522
8:	[0s / 4s],		train_loss: 2.7084
47:	[0s / 24s],		train_loss: 2.4208
16:	[1s / 22s],		train_loss: 2.4866
9:	[0s / 5s],		train_loss: 2.7280
86:	[0s / 1m:1s],		train_loss: 2.3630
48:	[0s / 24s],		train_loss: 2.4271
10:	[0s / 5s],		train_loss: 2.6768
87:	[0s / 1m:2s],		train_loss: 2.3570
49:	[0s / 25s],		train_loss: 2.4223
11:	[0s / 6s],		train_loss: 2.6484
88:	[0s / 1m:2s],		train_loss: 2.3677
17:	[1s / 24s],		train_loss: 2.4758
50:	[0s / 25s],		train_loss: 2.4154
12:	[0s / 6s],		train_loss: 2.6666
89:	[0s / 1m:3s],		train_loss: 2.3549
51:	[0s / 26s],		train_loss: 2.4248
13:	[0s / 7s],		train_loss: 2.6601
90:	[0s / 1m:3s],		train_loss: 2.3572
52:	[0s / 26s],		train_loss: 2.4301
14:	[0s / 7s],		train_loss: 2.6602
18:	[1s / 25s],		train_loss: 2.4749
53:	[0s / 27s],		train_loss: 2.4133
91:	[0s / 1m:4s],		train_loss: 2.3467
15:	[0s / 8s],		train_loss: 2.6462
54:	[0s / 27s],		train_loss: 2.4351
16:	[0s / 8s],		train_loss: 2.6362
92:	[0s / 1m:5s],		train_loss: 2.3565
19:	[1s / 26s],		train_loss: 2.4667
55:	[0s / 28s],		train_loss: 2.4078
17:	[0s / 9s],		train_loss: 2.6405
93:	[0s / 1m:5s],		train_loss: 2.3415
56:	[0s / 28s],		train_loss: 2.4053
18:	[0s / 9s],		train_loss: 2.6354
94:	[0s / 1m:6s],		train_loss: 2.3366
57:	[0s / 29s],		train_loss: 2.4100
19:	[0s / 10s],		train_loss: 2.6237
20:	[1s / 28s],		train_loss: 2.4730
95:	[0s / 1m:7s],		tra