[I 2026-07-01 05:12:18,691] Trial 90 finished with value: 0.767902597601742 and parameters: {'num_nodes': [64], 'dropout': 0.25689033035195236, 'learning_rate': 0.00011892285080705267, 'batch_norm': False}. Best is trial 60 with value: 0.7825486091943448.
/scratch.hpc/luca.cotugno/Foundation_model_clinical_data/test_tabular_model.py:481: UserWarning: Choices for a categorical distribution should be a tuple of None, bool, int, float and str for persistent storage but contains [32] which is of type list.
  num_nodes  = trial.suggest_categorical("num_nodes", [[32], [64], [128], [64, 32], [128, 64]])
/scratch.hpc/luca.cotugno/Foundation_model_clinical_data/test_tabular_model.py:481: UserWarning: Choices for a categorical distribution should be a tuple of None, bool, int, float and str for persistent storage but contains [64] which is of type list.
  num_nodes  = trial.suggest_categorical("num_nodes", [[32], [64], [128], [64, 32], [128, 64]])
/scratch.hpc/luca.cotugno/Foundation_model_clinical_data/test_tabular_model.py:481: UserWarning: Choices for a categorical distribution should be a tuple of None, bool, int, float and str for persistent storage but contains [128] which is of type list.
  num_nodes  = trial.suggest_categorical("num_nodes", [[32], [64], [128], [64, 32], [128, 64]])
/scratch.hpc/luca.cotugno/Foundation_model_clinical_data/test_tabular_model.py:481: UserWarning: Choices for a categorical distribution should be a tuple of None, bool, int, float and str for persistent storage but contains [64, 32] which is of type list.
  num_nodes  = trial.suggest_categorical("num_nodes", [[32], [64], [128], [64, 32], [128, 64]])
/scratch.hpc/luca.cotugno/Foundation_model_clinical_data/test_tabular_model.py:481: UserWarning: Choices for a categorical distribution should be a tuple of None, bool, int, float and str for persistent storage but contains [128, 64] which is of type list.
  num_nodes  = trial.suggest_categorical("num_nodes", [[32], [64], [128], [64, 32], [128, 64]])

84:	[0s / 16s],		train_loss: 4.0040
92:	[0s / 32s],		train_loss: 4.1262
72:	[0s / 10s],		train_loss: 4.0484
65:	[0s / 10s],		train_loss: 4.3721
85:	[0s / 16s],		train_loss: 4.0010
73:	[0s / 10s],		train_loss: 4.0347
66:	[0s / 10s],		train_loss: 4.3787
93:	[0s / 32s],		train_loss: 4.1226
86:	[0s / 16s],		train_loss: 4.0250
74:	[0s / 11s],		train_loss: 4.0153
67:	[0s / 10s],		train_loss: 4.3944
75:	[0s / 11s],		train_loss: 4.0460
92:	[0s / 56s],		train_loss: 4.1316
68:	[0s / 10s],		train_loss: 4.4279
87:	[0s / 16s],		train_loss: 3.9870
53:	[1s / 1m:47s],		train_loss: 3.8468
76:	[0s / 11s],		train_loss: 4.0270
94:	[0s / 32s],		train_loss: 4.1038
69:	[0s / 10s],		train_loss: 4.3518
88:	[0s / 16s],		train_loss: 4.0008
77:	[0s / 11s],		train_loss: 4.0168
79:	[1s / 1m:26s],		train_loss: 4.2318
70:	[0s / 11s],		train_loss: 4.3387
89:	[0s / 17s],		train_loss: 4.0218
78:	[0s / 11s],		train_loss: 4.0312
95:	[0s / 33s],		train_loss: 4.0854
71:	[0s / 11s],		train_loss: 4.3673
79:	[0s / 11s],		train_loss: 4.0093
90:	[0s / 17s],		train_loss: 4.0120
72:	[0s / 11s],		train_loss: 4.3882
93:	[0s / 57s],		train_loss: 4.1109
80:	[0s / 12s],		train_loss: 4.0103
73:	[0s / 11s],		train_loss: 4.3463
91:	[0s / 17s],		train_loss: 3.9916
96:	[0s / 33s],		train_loss: 4.1412
81:	[0s / 12s],		train_loss: 4.0133
74:	[0s / 11s],		train_loss: 4.3446
92:	[0s / 17s],		train_loss: 3.9986
82:	[0s / 12s],		train_loss: 3.9949
75:	[0s / 11s],		train_loss: 4.4796
83:	[0s / 12s],		train_loss: 4.0222
97:	[0s / 33s],		train_loss: 4.1053
93:	[0s / 18s],		train_loss: 3.9882
94:	[0s / 58s],		train_loss: 4.1334
80:	[0s / 1m:27s],		train_loss: 4.2339
76:	[0s / 11s],		train_loss: 4.4139
84:	[0s / 12s],		train_loss: 3.9828
77:	[0s / 12s],		train_loss: 4.3785
94:	[0s / 18s],		train_loss: 3.9638
85:	[0s / 12s],		train_loss: 4.0069
98:	[0s / 34s],		train_loss: 4.1046
78:	[0s / 12s],		train_loss: 4.3643
95:	[0s / 18s],		train_loss: 3.9834
86:	[0s / 12s],		train_loss: 3.9933
54:	[1s / 1m:49s],		train_loss: 3.8214
79:	[0s / 12s],		train_loss: 4.3833
87:	[0s / 13s],		train_loss: 3.9485
96:	[0s / 18s],		train_loss: 3.9571
99:	[0s / 34s],		train_loss: 4.0772
82:	[3s / 5m:40s],		train_loss: 4.0684
95:	[0s / 58s],		train_loss: 4.0929
80:	[0s / 12s],		train_loss: 4.3653
88:	[0s / 13s],		train_loss: 3.9728
81:	[0s / 12s],		train_loss: 4.3576
97:	[0s / 18s],		train_loss: 3.9608
89:	[0s / 13s],		train_loss: 3.9692
82:	[0s / 12s],		train_loss: 4.4066
90:	[0s / 13s],		train_loss: 3.9863
0:	[0s / 0s],		train_loss: 5.4724
98:	[0s / 19s],		train_loss: 3.9684
81:	[1s / 1m:28s],		train_loss: 4.2238
91:	[0s / 13s],		train_loss: 3.9863
83:	[0s / 13s],		train_loss: 4.3449
99:	[0s / 19s],		train_loss: 3.9698
96:	[0s / 59s],		train_loss: 4.1383
92:	[0s / 13s],		train_loss: 3.9906
84:	[0s / 13s],		train_loss: 4.4020
1:	[0s / 0s],		train_loss: 4.8973
93:	[0s / 14s],		train_loss: 3.9580
85:	[0s / 13s],		train_loss: 4.3482
0:	[0s / 0s],		train_loss: 6.2408
94:	[0s / 14s],		train_loss: 3.9511
86:	[0s / 13s],		train_loss: 4.3459
1:	[0s / 0s],		train_loss: 4.9854
2:	[0s / 1s],		train_loss: 4.6916
97:	[0s / 59s],		train_loss: 4.0967
95:	[0s / 14s],		train_loss: 3.9802
87:	[0s / 13s],		train_loss: 4.3758
96:	[0s / 14s],		train_loss: 3.9649
2:	[0s / 0s],		train_loss: 4.6918
88:	[0s / 14s],		train_loss: 4.3584
97:	[0s / 14s],		train_loss: 3.9290
3:	[0s / 1s],		train_loss: 4.5854
3:	[0s / 0s],		train_loss: 4.5991
89:	[0s / 14s],		train_loss: 4.3572
82:	[1s / 1m:29s],		train_loss: 4.2195
98:	[0s / 14s],		train_loss: 3.9371
55:	[1s / 1m:50s],		train_loss: 3.8278
4:	[0s / 0s],		train_loss: 4.5950
90:	[0s / 14s],		train_loss: 4.3697
99:	[0s / 14s],		train_loss: 3.9330
98:	[0s / 1m:0s],		train_loss: 4.0860
4:	[0s / 1s],		train_loss: 4.5323
91:	[0s / 14s],		train_loss: 4.3335
5:	[0s / 1s],		train_loss: 4.5802
0:	[0s / 0s],		train_loss: 5.3014
92:	[0s / 14s],		train_loss: 4.3506
6:	[0s / 1s],		train_loss: 4.5396
1:	[0s / 0s],		train_loss: 4.8135
5:	[0s / 2s],		train_loss: 4.5046
93:	[0s / 14s],		train_loss: 4.4355
7:	[0s / 1s],		train_loss: 4.5098
2:	[0s / 0s],		train_loss: 4.6590
94:	[0s / 14s],		train_loss: 4.3839
99:	[0s / 1m:1s],		train_loss: 4.0844
83:	[0s / 1m:30s],		train_loss: 4.1955
3:	[0s / 0s],		train_loss: 4.5659
8:	[0s / 1s],		train_loss: 4.5039
6:	[0s / 2s],		train_loss: 4.4878
95:	[0s / 15s],		train_loss: 4.3696
4:	[0s / 0s],		train_loss: 4.5313
9:	[0s / 2s],		train_loss: 4.5118
96:	[0s / 15s],		train_loss: 4.3339
5:	[0s / 0s],		train_loss: 4.5394
97:	[0s / 15s],		train_loss: 4.3827
7:	[0s / 2s],		train_loss: 4.4765
6:	[0s / 1s],		train_loss: 4.5163
10:	[0s / 2s],		train_loss: 4.5267
98:	[0s / 15s],		train_loss: 4.3623
7:	[0s / 1s],		train_loss: 4.5053
0:	[0s / 0s],		train_loss: 4.8096
11:	[0s / 2s],		train_loss: 4.4727
99:	[0s / 15s],		train_loss: 4.3869
8:	[0s / 1s],		train_loss: 4.4711
8:	[0s / 3s],		train_loss: 4.4536
12:	[0s / 2s],		train_loss: 4.4851
9:	[0s / 1s],		train_loss: 4.4905
56:	[1s / 1m:52s],		train_loss: 3.8169
0:	[0s / 0s],		train_loss: 5.9978
84:	[1s / 1m:32s],		train_loss: 4.1859
10:	[0s / 1s],		train_loss: 4.4537
13:	[0s / 2s],		train_loss: 4.4440
1:	[0s / 0s],		train_loss: 5.0781
9:	[0s / 3s],		train_loss: 4.4568
1:	[0s / 1s],		train_loss: 4.5395
11:	[0s / 1s],		train_loss: 4.4539
14:	[0s / 3s],		train_loss: 4.4561
2:	[0s / 0s],		train_loss: 4.7948
12:	[0s / 2s],		train_loss: 4.3971
3:	[0s / 0s],		train_loss: 4.6483
83:	[4s / 5m:44s],		train_loss: 4.0786
15:	[0s / 3s],		train_loss: 4.4647
10:	[0s / 4s],		train_loss: 4.4368
13:	[0s / 2s],		train_loss: 4.4536
4:	[0s / 0s],		train_loss: 4.6030
14:	[0s / 2s],		train_loss: 4.4215
16:	[0s / 3s],		train_loss: 4.4465
2:	[0s / 1s],		train_loss: 4.4705
5:	[0s / 0s],		train_loss: 4.5908
15:	[0s / 2s],		train_loss: 4.4001
11:	[0s / 4s],		train_loss: 4.4152
17:	[0s / 3s],		train_loss: 4.4121
6:	[0s / 1s],		train_loss: 4.5489
85:	[1s / 1m:33s],		train_loss: 4.2099
16:	[0s / 2s],		train_loss: 4.3967
7:	[0s / 1s],		train_loss: 4.5214
18:	[0s / 3s],		train_loss: 4.4056
17:	[0s / 2s],		train_loss: 4.4151
8:	[0s / 1s],		train_loss: 4.5293
12:	[0s / 4s],		train_loss: 4.4308
18:	[0s / 3s],		train_loss: 4.4002
19:	[0s / 4s],		train_loss: 4.4278
3:	[0s / 2s],		train_loss: 4.4486
9:	[0s / 1s],		train_loss: 4.5060
19:	[0s / 3s],		train_loss: 4.3887
20:	[0s / 4s],		train_loss: 4.4208
10:	[0s / 1s],		train_loss: 4.4960
20:	[0s / 3s],		train_loss: 4.3770
13:	[0s / 5s],		train_loss: 4.3851
11:	[0s / 1s],		train_loss: 4.4718
21:	[0s / 4s],		train_loss: 4.4014
21:	[0s / 3s],		train_loss: 4.3678
12:	[0s / 2s],		train_loss: 4.4654
22:	[0s / 3s],		train_loss: 4.3767
22:	[0s / 4s],		train_loss: 4.3910
14:	[0s / 5s],		train_loss: 4.4254
57:	[2s / 1m:54s],		train_loss: 3.7634
13:	[0s / 2s],		train_loss: 4.4533
4:	[0s / 3s],		train_loss: 4.4394
23:	[0s / 3s],		train_loss: 4.3458
86:	[1s / 1m:34s],		train_loss: 4.2066
23:	[0s / 4s],		train_loss: 4.3820
14:	[0s / 2s],		train_loss: 4.4408
24:	[0s / 3s],		train_loss: 4.3558
15:	[0s / 2s],		train_loss: 4.4466
24:	[0s / 5s],		train_loss: 4.3740
15:	[0s / 5s],		train_loss: 4.3904
25:	[0s / 4s],		train_loss: 4.3392
16:	[0s / 2s],		train_loss: 4.4191
26:	[0s / 4s],		train_loss: 4.3184
25:	[0s / 5s],		train_loss: 4.4094
17:	[0s / 2s],		train_loss: 4.4566
5:	[0s / 3s],		train_loss: 4.3987
27:	[0s / 4s],		train_loss: 4.3244
16:	[0s / 6s],		train_loss: 4.3848
26:	[0s / 5s],		train_loss: 4.3691
28:	[0s / 4s],		train_loss: 4.3187
18:	[0s / 2s],		train_loss: 4.4324
27:	[0s / 5s],		train_loss: 4.3714
29:	[0s / 4s],		train_loss: 4.3057
19:	[0s / 3s],		train_loss: 4.4075
17:	[0s / 6s],		train_loss: 4.3811
87:	[0s / 1m:35s],		train_loss: 4.1529
30:	[0s / 4s],		train_loss: 4.3187
28:	[0s / 5s],		train_loss: 4.3901
20:	[0s / 3s],		train_loss: 4.4103
31:	[0s / 4s],		train_loss: 4.3388
6:	[0s / 4s],		train_loss: 4.3469
21:	[0s / 3s],		train_loss: 4.4087
29:	[0s / 6s],		train_loss: 4.3778
18:	[0s / 6s],		train_loss: 4.3863
32:	[0s / 5s],		train_loss: 4.3030
22:	[0s / 3s],		train_loss: 4.4126
30:	[0s / 6s],		train_loss: 4.3453
33:	[0s / 5s],		train_loss: 4.3284
23:	[0s / 3s],		train_loss: 4.3916
19:	[0s / 7s],		train_loss: 4.3624
31:	[0s / 6s],		train_loss: 4.3434
34:	[0s / 5s],		train_loss: 4.3042
24:	[0s / 3s],		train_loss: 4.3839
35:	[0s / 5s],		train_loss: 4.2731
32:	[0s / 6s],		train_loss: 4.3341
7:	[0s / 4s],		train_loss: 4.3653
25:	[0s / 4s],		train_loss: 4.3619
36:	[0s / 5s],		train_loss: 4.3012
58:	[1s / 1m:56s],		train_loss: 3.8224
20:	[0s / 7s],		train_loss: 4.3319
26:	[0s / 4s],		train_loss: 4.3808
33:	[0s / 6s],		train_loss: 4.3204
37:	[0s / 5s],		train_loss: 4.2858
88:	[1s / 1m:36s],		train_loss: 4.1967
27:	[0s / 4s],		train_loss: 4.3937
84:	[3s / 5m:48s],		train_loss: 4.1164
38:	[0s / 5s],		train_loss: 4.2950
34:	[0s / 7s],		train_loss: 4.3275
28:	[0s / 4s],		train_loss: 4.3374
21:	[0s / 7s],		train_loss: 4.3455
39:	[0s / 6s],		train_loss: 4.2716
35:	[0s / 7s],		train_loss: 4.3371
8:	[0s / 5s],		train_loss: 4.3394
29:	[0s / 4s],		train_loss: 4.3443
40:	[0s / 6s],		train_loss: 4.2777
36:	[0s / 7s],		train_loss: 4.3027
30:	[0s / 4s],		train_loss: 4.3729
22:	[0s / 8s],		train_loss: 4.3438
41:	[0s / 6s],		train_loss: 4.2899
31:	[0s / 4s],		train_loss: 4.3473
37:	[0s / 7s],		train_loss: 4.3235
42:	[0s / 6s],		train_loss: 4.3093
32:	[0s / 5s],		train_loss: 4.3370
43:	[0s / 6s],		train_loss: 4.2572
38:	[0s / 7s],		train_loss: 4.3110
23:	[0s / 8s],		train_loss: 4.3471
9:	[0s / 6s],		train_loss: 4.3277
33:	[0s / 5s],		train_loss: 4.3357
44:	[0s / 6s],		train_loss: 4.2456
39:	[0s / 7s],		train_loss: 4.3195
34:	[0s / 5s],		train_loss: 4.3601
45:	[0s / 6s],		train_loss: 4.2574
89:	[1s / 1m:37s],		train_loss: 4.2232
24:	[0s / 8s],		train_loss: 4.3424
35:	[0s / 5s],		train_loss: 4.3430
40:	[0s / 8s],		train_loss: 4.3054
46:	[0s / 7s],		train_loss: 4.2750
36:	[0s / 5s],		train_loss: 4.3259
47:	[0s / 7s],		train_loss: 4.2642
41:	[0s / 8s],		train_loss: 4.2824
48:	[0s / 7s],		train_loss: 4.2600
37:	[0s / 5s],		train_loss: 4.3379
25:	[0s / 9s],		train_loss: 4.3137
10:	[0s / 6s],		train_loss: 4.3328
42:	[0s / 8s],		train_loss: 4.2910
59:	[1s / 1m:58s],		train_loss: 3.7965
49:	[0s / 7s],		train_loss: 4.2202
38:	[0s / 5s],		train_loss: 4.2946
50:	[0s / 7s],		train_loss: 4.2602
39:	[0s / 6s],		train_loss: 4.3214
43:	[0s / 8s],		train_loss: 4.2966
26:	[0s / 9s],		train_loss: 4.3155
51:	[0s / 7s],		train_loss: 4.2295
40:	[0s / 6s],		train_loss: 4.3162
44:	[0s / 8s],		train_loss: 4.3322
52:	[0s / 7s],		train_loss: 4.2259
41:	[0s / 6s],		train_loss: 4.3273
11:	[0s / 7s],		train_loss: 4.3482
27:	[0s / 9s],		train_loss: 4.3141
45:	[0s / 9s],		train_loss: 4.2988
53:	[0s / 7s],		train_loss: 4.2340
90:	[1s / 1m:38s],		train_loss: 4.1787
42:	[0s / 6s],		train_loss: 4.3222
54:	[0s / 8s],		train_loss: 4.2309
46:	[0s / 9s],		train_loss: 4.2789
43:	[0s / 6s],		train_loss: 4.3271
55:	[0s / 8s],		train_loss: 4.2164
44:	[0s / 6s],		train_loss: 4.2594
28:	[0s / 10s],		train_loss: 4.3126
47:	[0s / 9s],		train_loss: 4.2712
56:	[0s / 8s],		train_loss: 4.2159
45:	[0s / 6s],		train_loss: 4.2691
12:	[0s / 7s],		train_loss: 4.3435
57:	[0s / 8s],		train_loss: 4.2214
48:	[0s / 9s],		train_loss: 4.3021
46:	[0s / 7s],		train_loss: 4.3101
58:	[0s / 8s],		train_loss: 4.2088
29:	[0s / 10s],		train_loss: 4.3266
47:	[0s / 7s],		train_loss: 4.2891
49:	[0s / 9s],		train_loss: 4.2853
59:	[0s / 8s],		train_loss: 4.2077
48:	[0s / 7s],		train_loss: 4.2672
50:	[0s / 10s],		train_loss: 4.2587
60:	[0s / 8s],		train_loss: 4.2417
30:	[0s / 10s],		train_loss: 4.2843
49:	[0s / 7s],		train_loss: 4.2773
13:	[0s / 8s],		train_loss: 4.3137
61:	[0s / 9s],		train_loss: 4.1618
51:	[0s / 10s],		train_loss: 4.2704
50:	[0s / 7s],		train_loss: 4.2828
91:	[1s / 1m:39s],		train_loss: 4.1813
62:	[0s / 9s],		train_loss: 4.1977
52:	[0s / 10s],		train_loss: 4.2682
51:	[0s / 7s],		train_loss: 4.2690
31:	[0s / 11s],		train_loss: 4.2798
60:	[2s / 2m:0s],		train_loss: 3.7663
63:	[0s / 9s],		train_loss: 4.1678
53:	[0s / 10s],		train_loss: 4.2983
52:	[0s / 7s],		train_loss: 4.2668
64:	[0s / 9s],		train_loss: 4.1897
14:	[0s / 8s],		train_loss: 4.3235
53:	[0s / 8s],		train_loss: 4.2532
54:	[0s / 10s],		train_loss: 4.2549
32:	[0s / 11s],		train_loss: 4.3138
65:	[0s / 9s],		train_loss: 4.1899
54:	[0s / 8s],		train_loss: 4.2814
66:	[0s / 9s],		train_loss: 4.1776
55:	[0s / 11s],		train_loss: 4.2601
55:	[0s / 8s],		train_loss: 4.2269
33:	[0s / 11s],		train_loss: 4.2875
67:	[0s / 10s],		train_loss: 4.1840
56:	[0s / 11s],		train_loss: 4.2551
56:	[0s / 8s],		train_loss: 4.2703
68:	[0s / 10s],		train_loss: 4.1923
15:	[0s / 9s],		train_loss: 4.3149
85:	[4s / 5m:52s],		train_loss: 4.0688
57:	[0s / 11s],		train_loss: 4.2494
57:	[0s / 8s],		train_loss: 4.2530
92:	[1s / 1m:40s],		train_loss: 4.1786
34:	[0s / 12s],		train_loss: 4.2957
69:	[0s / 10s],		train_loss: 4.1706
58:	[0s / 8s],		train_loss: 4.2737
58:	[0s / 11s],		train_loss: 4.2225
70:	[0s / 10s],		train_loss: 4.1618
59:	[0s / 9s],		train_loss: 4.2591
71:	[0s / 10s],		train_loss: 4.2038
59:	[0s / 11s],		train_loss: 4.2836
35:	[0s / 12s],		train_loss: 4.2853
60:	[0s / 9s],		train_loss: 4.2237
72:	[0s / 10s],		train_loss: 4.1521
60:	[0s / 12s],		train_loss: 4.2261
16:	[0s / 10s],		train_loss: 4.3268
73:	[0s / 10s],		train_loss: 4.1422
61:	[0s / 9s],		train_loss: 4.2601
61:	[0s / 12s],		train_loss: 4.2416
36:	[0s / 12s],		train_loss: 4.2798
74:	[0s / 11s],		train_loss: 4.1389
62:	[0s / 9s],		train_loss: 4.2187
62:	[0s / 12s],		train_loss: 4.2575
75:	[0s / 11s],		train_loss: 4.1503
63:	[0s / 9s],		train_loss: 4.2590
37:	[0s / 13s],		train_loss: 4.2744
76:	[0s / 11s],		train_loss: 4.1663
64:	[0s / 9s],		train_loss: 4.2558
63:	[0s / 12s],		train_loss: 4.2140
61:	[2s / 2m:2s],		train_loss: 3.7249
17:	[0s / 10s],		train_loss: 4.2969
93:	[1s / 1m:41s],		train_loss: 4.1824
77:	[0s / 11s],		train_loss: 4.1374
65:	[0s / 10s],		train_loss: 4.2380
64:	[0s / 12s],		train_loss: 4.2259
78:	[0s / 11s],		train_loss: 4.1597
38:	[0s / 13s],		train_loss: 4.2501
66:	[0s / 10s],		train_loss: 4.2305
79:	[0s / 11s],		train_loss: 4.1591
65:	[0s / 12s],		train_loss: 4.2294
67:	[0s / 10s],		train_loss: 4.2238
80:	[0s / 11s],		train_loss: 4.1556
68:	[0s / 10s],		train_loss: 4.2290
66:	[0s / 13s],		train_loss: 4.2253
39:	[0s / 13s],		train_loss: 4.2410
18:	[0s / 11s],		train_loss: 4.3322
81:	[0s / 12s],		train_loss: 4.1363
69:	[0s / 10s],		train_loss: 4.2392
67:	[0s / 13s],		train_loss: 4.1830
82:	[0s / 12s],		train_loss: 4.1492
70:	[0s / 10s],		train_loss: 4.2051
94:	[0s / 1m:42s],		train_loss: 4.2002
40:	[0s / 14s],		train_loss: 4.2539
68:	[0s / 13s],		train_loss: 4.2289
83:	[0s / 12s],		train_loss: 4.1426
71:	[0s / 10s],		train_loss: 4.2232
84:	[0s / 12s],		train_loss: 4.1324
69:	[0s / 13s],		train_loss: 4.2191
72:	[0s / 11s],		train_loss: 4.2258
19:	[0s / 11s],		train_loss: 4.3634
85:	[0s / 12s],		train_loss: 4.1383
41:	[0s / 14s],		train_loss: 4.2506
70:	[0s / 13s],		train_loss: 4.1872
73:	[0s / 11s],		train_loss: 4.2086
86:	[0s / 12s],		train_loss: 4.1376
62:	[1s / 2m:4s],		train_loss: 3.7485
74:	[0s / 11s],		train_loss: 4.2143
71:	[0s / 14s],		train_loss: 4.2154
87:	[0s / 13s],		train_loss: 4.1054
42:	[0s / 14s],		train_loss: 4.2396
75:	[0s / 11s],		train_loss: 4.1998
88:	[0s / 13s],		train_loss: 4.1346
72:	[0s / 14s],		train_loss: 4.1954
76:	[0s / 11s],		train_loss: 4.1942
20:	[0s / 12s],		train_loss: 4.3338
89:	[0s / 13s],		train_loss: 4.1239
73:	[0s / 14s],		train_loss: 4.2213
43:	[0s / 15s],		train_loss: 4.2611
77:	[0s / 11s],		train_loss: 4.2055
90:	[0s / 13s],		train_loss: 4.1157
95:	[1s / 1m:43s],		train_loss: 4.1651
74:	[0s / 14s],		train_loss: 4.1856
78:	[0s / 12s],		train_loss: 4.1724
91:	[0s / 13s],		train_loss: 4.0980
79:	[0s / 12s],		train_loss: 4.1867
75:	[0s / 14s],		train_loss: 4.1977
92:	[0s / 13s],		train_loss: 4.1194
44:	[0s / 15s],		train_loss: 4.2070
80:	[0s / 12s],		train_loss: 4.1946
21:	[0s / 13s],		train_loss: 4.3421
93:	[0s / 13s],		train_loss: 4.0949
76:	[0s / 15s],		train_loss: 4.1962
81:	[0s / 12s],		train_loss: 4.1811
94:	[0s / 14s],		train_loss: 4.0987
45:	[0s / 15s],		train_loss: 4.2293
86:	[3s / 5m:56s],		train_loss: 4.1127
77:	[0s / 15s],		train_loss: 4.1990
82:	[0s / 12s],		train_loss: 4.1686
95:	[0s / 14s],		train_loss: 4.1059
83:	[0s / 12s],		train_loss: 4.1604
78:	[0s / 15s],		train_loss: 4.1988
96:	[0s / 14s],		train_loss: 4.1124
63:	[1s / 2m:5s],		train_loss: 3.7292
46:	[0s / 16s],		train_loss: 4.2387
22:	[0s / 13s],		train_loss: 4.3221
97:	[0s / 14s],		train_loss: 4.0724
84:	[0s / 12s],		train_loss: 4.1849
79:	[0s / 15s],		train_loss: 4.1807
98:	[0s / 14s],		train_loss: 4.0862
96:	[1s / 1m:44s],		train_loss: 4.1843
85:	[0s / 13s],		train_loss: 4.1976
47:	[0s / 16s],		train_loss: 4.2442
80:	[0s / 15s],		train_loss: 4.1725
99:	[0s / 14s],		train_loss: 4.0817
86:	[0s / 13s],		train_loss: 4.1716
23:	[0s / 14s],		train_loss: 4.2973
87:	[0s / 13s],		train_loss: 4.1728
81:	[0s / 16s],		train_loss: 4.1695
48:	[0s / 16s],		train_loss: 4.2233
0:	[0s / 0s],		train_loss: 5.6029
88:	[0s / 13s],		train_loss: 4.1682
82:	[0s / 16s],		train_loss: 4.1661
1:	[0s / 0s],		train_loss: 5.0216
89:	[0s / 13s],		train_loss: 4.1693
49:	[0s / 17s],		train_loss: 4.2530
83:	[0s / 16s],		train_loss: 4.1596
2:	[0s / 0s],		train_loss: 4.7925
90:	[0s / 13s],		train_loss: 4.1426
3:	[0s / 0s],		train_loss: 4.6314
24:	[0s / 14s],		train_loss: 4.2943
84:	[0s / 16s],		train_loss: 4.1887
91:	[0s / 14s],		train_loss: 4.1898
50:	[0s / 17s],		train_loss: 4.2246
4:	[0s / 0s],		train_loss: 4.5809
85:	[0s / 16s],		train_loss: 4.1530
92:	[0s / 14s],		train_loss: 4.1537
97:	[1s / 1m:46s],		train_loss: 4.1779
5:	[0s / 0s],		train_loss: 4.5582
93:	[0s / 14s],		train_loss: 4.1213
86:	[0s / 17s],		train_loss: 4.1512
6:	[0s / 1s],		train_loss: 4.4982
51:	[0s / 17s],		train_loss: 4.2422
25:	[0s / 15s],		train_loss: 4.2834
94:	[0s / 14s],		train_loss: 4.1452
7:	[0s / 1s],		train_loss: 4.5186
64:	[1s / 2m:7s],		train_loss: 3.7261
87:	[0s / 17s],		train_loss: 4.1694
95:	[0s / 14s],		train_loss: 4.1643
8:	[0s / 1s],		train_loss: 4.4921
88:	[0s / 17s],		train_loss: 4.1686
52:	[0s / 18s],		train_loss: 4.2319
9:	[0s / 1s],		train_loss: 4.4761
96:	[0s / 14s],		train_loss: 4.1275
10:	[0s / 1s],		train_loss: 4.4726
89:	[0s / 17s],		train_loss: 4.1244
97:	[0s / 15s],		train_loss: 4.1360
26:	[0s / 16s],		train_loss: 4.2939
11:	[0s / 1s],		train_loss: 4.4366
98:	[0s / 1m:47s],		train_loss: 4.1607
53:	[0s / 18s],		train_loss: 4.2245
98:	[0s / 15s],		train_loss: 4.1335
90:	[0s / 17s],		train_loss: 4.1548
12:	[0s / 1s],		train_loss: 4.4389
99:	[0s / 15s],		train_loss: 4.1265
91:	[0s / 18s],		train_loss: 4.1777
13:	[0s / 2s],		train_loss: 4.4199
54:	[0s / 18s],		train_loss: 4.2078
92:	[0s / 18s],		train_loss: 4.1295
14:	[0s / 2s],		train_loss: 4.3949
0:	[0s / 0s],		train_loss: 4.7976
87:	[3s / 5m:59s],		train_loss: 4.0350
15:	[0s / 2s],		train_loss: 4.4120
1:	[0s / 0s],		train_loss: 4.5461
93:	[0s / 18s],		train_loss: 4.1218
27:	[0s / 16s],		train_loss: 4.2456
16:	[0s / 2s],		train_loss: 4.4091
55:	[0s / 19s],		train_loss: 4.2126
2:	[0s / 0s],		train_loss: 4.4459
94:	[0s / 18s],		train_loss: 4.1557
17:	[0s / 2s],		train_loss: 4.4125
3:	[0s / 0s],		train_loss: 4.4289
95:	[0s / 18s],		train_loss: 4.1457
18:	[0s / 2s],		train_loss: 4.3708
4:	[0s / 0s],		train_loss: 4.4072
56:	[0s / 19s],		train_loss: 4.2073
19:	[0s / 2s],		train_loss: 4.3826
5:	[0s / 0s],		train_loss: 4.3817
96:	[0s / 19s],		train_loss: 4.1260
28:	[0s / 17s],		train_loss: 4.2951
99:	[1s / 1m:48s],		train_loss: 4.1779
20:	[0s / 3s],		train_loss: 4.3544
6:	[0s / 1s],		train_loss: 4.4029
97:	[0s / 19s],		train_loss: 4.1324
21:	[0s / 3s],		train_loss: 4.3650
57:	[0s / 20s],		train_loss: 4.1970
7:	[0s / 1s],		train_loss: 4.3686
65:	[2s / 2m:9s],		train_loss: 3.6976
22:	[0s / 3s],		train_loss: 4.3686
98:	[0s / 19s],		train_loss: 4.1031
8:	[0s / 1s],		train_loss: 4.3394
23:	[0s / 3s],		train_loss: 4.3707
9:	[0s / 1s],		train_loss: 4.3227
58:	[0s / 20s],		train_loss: 4.2033
29:	[0s / 17s],		train_loss: 4.2676
99:	[0s / 19s],		train_loss: 4.1088
24:	[0s / 3s],		train_loss: 4.3478
10:	[0s / 1s],		train_loss: 4.3106
25:	[0s / 3s],		train_loss: 4.3644
59:	[0s / 20