[I 2026-06-09 05:45:08,283] Trial 46 finished with value: 0.8028844902561134 and parameters: {'num_nodes': [64, 32], 'dropout': 0.2584971013603902, 'learning_rate': 0.00044513232979486415, 'batch_norm': False}. Best is trial 17 with value: 0.8122559343543445.
/scratch.hpc/luca.cotugno/Foundation_model_clinical_data/test_tabular_model_tmp.py:476: UserWarning: Choices for a categorical distribution should be a tuple of None, bool, int, float and str for persistent storage but contains [32] which is of type list.
  num_nodes  = trial.suggest_categorical("num_nodes", [[32], [64], [128], [64, 32], [128, 64]])
/scratch.hpc/luca.cotugno/Foundation_model_clinical_data/test_tabular_model_tmp.py:476: UserWarning: Choices for a categorical distribution should be a tuple of None, bool, int, float and str for persistent storage but contains [64] which is of type list.
  num_nodes  = trial.suggest_categorical("num_nodes", [[32], [64], [128], [64, 32], [128, 64]])
/scratch.hpc/luca.cotugno/Foundation_model_clinical_data/test_tabular_model_tmp.py:476: UserWarning: Choices for a categorical distribution should be a tuple of None, bool, int, float and str for persistent storage but contains [128] which is of type list.
  num_nodes  = trial.suggest_categorical("num_nodes", [[32], [64], [128], [64, 32], [128, 64]])
/scratch.hpc/luca.cotugno/Foundation_model_clinical_data/test_tabular_model_tmp.py:476: UserWarning: Choices for a categorical distribution should be a tuple of None, bool, int, float and str for persistent storage but contains [64, 32] which is of type list.
  num_nodes  = trial.suggest_categorical("num_nodes", [[32], [64], [128], [64, 32], [128, 64]])
/scratch.hpc/luca.cotugno/Foundation_model_clinical_data/test_tabular_model_tmp.py:476: UserWarning: Choices for a categorical distribution should be a tuple of None, bool, int, float and str for persistent storage but contains [128, 64] which is of type list.
  num_nodes  = trial.suggest_categorical("num_nodes", [[32], [64], [128], [64, 32], [128, 64]])
30:	[0s / 16s],		train_loss: 2.5030
47:	[0s / 18s],		train_loss: 2.4800
83:	[0s / 34s],		train_loss: 2.4480
33:	[1s / 32s],		train_loss: 2.4575
48:	[0s / 19s],		train_loss: 2.4864
31:	[0s / 16s],		train_loss: 2.5004
84:	[0s / 35s],		train_loss: 2.4221
49:	[0s / 19s],		train_loss: 2.4781
85:	[0s / 35s],		train_loss: 2.4301
32:	[0s / 17s],		train_loss: 2.4859
34:	[0s / 33s],		train_loss: 2.4549
50:	[0s / 20s],		train_loss: 2.4829
86:	[0s / 36s],		train_loss: 2.4201
33:	[0s / 17s],		train_loss: 2.4933
51:	[0s / 20s],		train_loss: 2.4775
87:	[0s / 36s],		train_loss: 2.4291
34:	[0s / 18s],		train_loss: 2.4979
52:	[0s / 20s],		train_loss: 2.4812
35:	[0s / 34s],		train_loss: 2.4635
88:	[0s / 37s],		train_loss: 2.4359
53:	[0s / 21s],		train_loss: 2.4750
35:	[0s / 18s],		train_loss: 2.4842
89:	[0s / 37s],		train_loss: 2.4261
54:	[0s / 21s],		train_loss: 2.4762
36:	[0s / 35s],		train_loss: 2.4672
90:	[0s / 37s],		train_loss: 2.4488
36:	[0s / 19s],		train_loss: 2.4981
55:	[0s / 21s],		train_loss: 2.4709
91:	[0s / 38s],		train_loss: 2.4342
37:	[0s / 19s],		train_loss: 2.4940
56:	[0s / 22s],		train_loss: 2.4703
92:	[0s / 38s],		train_loss: 2.4411
57:	[0s / 22s],		train_loss: 2.4761
37:	[0s / 36s],		train_loss: 2.4513
38:	[0s / 20s],		train_loss: 2.4883
93:	[0s / 39s],		train_loss: 2.4244
58:	[0s / 23s],		train_loss: 2.4603
39:	[0s / 20s],		train_loss: 2.4839
94:	[0s / 39s],		train_loss: 2.4285
59:	[0s / 23s],		train_loss: 2.4752
38:	[0s / 37s],		train_loss: 2.4564
40:	[0s / 21s],		train_loss: 2.4919
95:	[0s / 39s],		train_loss: 2.4254
60:	[0s / 23s],		train_loss: 2.4575
96:	[0s / 40s],		train_loss: 2.4315
61:	[0s / 24s],		train_loss: 2.4816
41:	[0s / 21s],		train_loss: 2.4733
39:	[0s / 38s],		train_loss: 2.4535
62:	[0s / 24s],		train_loss: 2.4682
97:	[0s / 40s],		train_loss: 2.4309
42:	[0s / 22s],		train_loss: 2.4816
63:	[0s / 25s],		train_loss: 2.4668
98:	[0s / 41s],		train_loss: 2.4392
43:	[0s / 22s],		train_loss: 2.4785
64:	[0s / 25s],		train_loss: 2.4831
99:	[0s / 41s],		train_loss: 2.4225
40:	[0s / 39s],		train_loss: 2.4646
65:	[0s / 26s],		train_loss: 2.4564
44:	[0s / 23s],		train_loss: 2.4779
0:	[0s / 0s],		train_loss: 3.3495
66:	[0s / 26s],		train_loss: 2.4671
45:	[0s / 23s],		train_loss: 2.4710
1:	[0s / 0s],		train_loss: 2.7452
41:	[0s / 40s],		train_loss: 2.4617
67:	[0s / 26s],		train_loss: 2.4612
2:	[0s / 1s],		train_loss: 2.6975
46:	[0s / 24s],		train_loss: 2.4710
68:	[0s / 27s],		train_loss: 2.4503
3:	[0s / 1s],		train_loss: 2.6509
47:	[0s / 24s],		train_loss: 2.4714
69:	[0s / 27s],		train_loss: 2.4708
42:	[0s / 41s],		train_loss: 2.4544
4:	[0s / 2s],		train_loss: 2.6131
70:	[0s / 27s],		train_loss: 2.4441
48:	[0s / 25s],		train_loss: 2.4766
5:	[0s / 2s],		train_loss: 2.5845
71:	[0s / 28s],		train_loss: 2.4667
43:	[0s / 42s],		train_loss: 2.4497
49:	[0s / 25s],		train_loss: 2.4820
6:	[0s / 2s],		train_loss: 2.5757
72:	[0s / 28s],		train_loss: 2.4680
7:	[0s / 3s],		train_loss: 2.5485
50:	[0s / 26s],		train_loss: 2.4703
73:	[0s / 29s],		train_loss: 2.4550
44:	[0s / 43s],		train_loss: 2.4559
8:	[0s / 3s],		train_loss: 2.5259
74:	[0s / 29s],		train_loss: 2.4439
51:	[0s / 26s],		train_loss: 2.4679
9:	[0s / 4s],		train_loss: 2.5220
75:	[0s / 29s],		train_loss: 2.4466
52:	[0s / 27s],		train_loss: 2.4566
76:	[0s / 30s],		train_loss: 2.4572
10:	[0s / 4s],		train_loss: 2.5176
45:	[0s / 44s],		train_loss: 2.4787
53:	[0s / 28s],		train_loss: 2.4651
77:	[0s / 30s],		train_loss: 2.4518
11:	[0s / 4s],		train_loss: 2.4985
78:	[0s / 31s],		train_loss: 2.4562
12:	[0s / 5s],		train_loss: 2.5189
54:	[0s / 28s],		train_loss: 2.4614
79:	[0s / 31s],		train_loss: 2.4424
46:	[1s / 45s],		train_loss: 2.4650
13:	[0s / 5s],		train_loss: 2.5035
55:	[0s / 29s],		train_loss: 2.4770
80:	[0s / 31s],		train_loss: 2.4505
14:	[0s / 6s],		train_loss: 2.4966
56:	[0s / 29s],		train_loss: 2.4660
81:	[0s / 32s],		train_loss: 2.4549
15:	[0s / 6s],		train_loss: 2.4890
47:	[0s / 46s],		train_loss: 2.4638
82:	[0s / 32s],		train_loss: 2.4652
57:	[0s / 30s],		train_loss: 2.4742
16:	[0s / 7s],		train_loss: 2.4809
83:	[0s / 33s],		train_loss: 2.4525
17:	[0s / 7s],		train_loss: 2.4676
58:	[0s / 30s],		train_loss: 2.4558
48:	[0s / 47s],		train_loss: 2.4507
84:	[0s / 33s],		train_loss: 2.4445
18:	[0s / 7s],		train_loss: 2.4746
59:	[0s / 31s],		train_loss: 2.4625
85:	[0s / 33s],		train_loss: 2.4590
19:	[0s / 8s],		train_loss: 2.4729
86:	[0s / 34s],		train_loss: 2.4382
49:	[0s / 48s],		train_loss: 2.4452
60:	[0s / 31s],		train_loss: 2.4601
20:	[0s / 8s],		train_loss: 2.4671
87:	[0s / 34s],		train_loss: 2.4382
61:	[0s / 32s],		train_loss: 2.4707
21:	[0s / 9s],		train_loss: 2.4675
88:	[0s / 34s],		train_loss: 2.4482
50:	[0s / 48s],		train_loss: 2.4424
22:	[0s / 9s],		train_loss: 2.4631
62:	[0s / 32s],		train_loss: 2.4635
89:	[0s / 35s],		train_loss: 2.4385
23:	[0s / 9s],		train_loss: 2.4653
90:	[0s / 35s],		train_loss: 2.4447
63:	[0s / 33s],		train_loss: 2.4528
24:	[0s / 10s],		train_loss: 2.4486
51:	[0s / 49s],		train_loss: 2.4502
91:	[0s / 36s],		train_loss: 2.4367
64:	[0s / 33s],		train_loss: 2.4427
25:	[0s / 10s],		train_loss: 2.4515
92:	[0s / 36s],		train_loss: 2.4454
65:	[0s / 34s],		train_loss: 2.4445
26:	[0s / 11s],		train_loss: 2.4439
93:	[0s / 36s],		train_loss: 2.4460
52:	[0s / 50s],		train_loss: 2.4385
94:	[0s / 37s],		train_loss: 2.4478
27:	[0s / 11s],		train_loss: 2.4417
66:	[0s / 34s],		train_loss: 2.4417
95:	[0s / 37s],		train_loss: 2.4549
28:	[0s / 12s],		train_loss: 2.4472
67:	[0s / 35s],		train_loss: 2.4616
53:	[0s / 51s],		train_loss: 2.4499
96:	[0s / 38s],		train_loss: 2.4410
29:	[0s / 12s],		train_loss: 2.4330
68:	[0s / 35s],		train_loss: 2.4477
97:	[0s / 38s],		train_loss: 2.4468
30:	[0s / 12s],		train_loss: 2.4371
69:	[0s / 36s],		train_loss: 2.4509
98:	[0s / 38s],		train_loss: 2.4509
31:	[0s / 13s],		train_loss: 2.4311
54:	[1s / 52s],		train_loss: 2.4422
99:	[0s / 39s],		train_loss: 2.4243
70:	[0s / 36s],		train_loss: 2.4551
32:	[0s / 13s],		train_loss: 2.4215
0:	[0s / 0s],		train_loss: 3.1203
33:	[0s / 14s],		train_loss: 2.4392
55:	[0s / 53s],		train_loss: 2.4421
71:	[0s / 37s],		train_loss: 2.4412
1:	[0s / 0s],		train_loss: 2.7246
34:	[0s / 14s],		train_loss: 2.4256
72:	[0s / 37s],		train_loss: 2.4580
2:	[0s / 1s],		train_loss: 2.6642
35:	[0s / 15s],		train_loss: 2.4350
56:	[0s / 54s],		train_loss: 2.4535
3:	[0s / 1s],		train_loss: 2.6152
73:	[0s / 38s],		train_loss: 2.4558
36:	[0s / 15s],		train_loss: 2.4333
4:	[0s / 1s],		train_loss: 2.5872
74:	[0s / 38s],		train_loss: 2.4588
37:	[0s / 15s],		train_loss: 2.4391
5:	[0s / 2s],		train_loss: 2.5537
57:	[0s / 55s],		train_loss: 2.4545
38:	[0s / 16s],		train_loss: 2.4274
75:	[0s / 39s],		train_loss: 2.4610
6:	[0s / 2s],		train_loss: 2.5434
39:	[0s / 16s],		train_loss: 2.4218
76:	[0s / 39s],		train_loss: 2.4424
7:	[0s / 3s],		train_loss: 2.5286
40:	[0s / 17s],		train_loss: 2.4247
58:	[0s / 56s],		train_loss: 2.4456
8:	[0s / 3s],		train_loss: 2.5241
77:	[0s / 40s],		train_loss: 2.4486
41:	[0s / 17s],		train_loss: 2.4236
9:	[0s / 3s],		train_loss: 2.5187
78:	[0s / 40s],		train_loss: 2.4426
42:	[0s / 17s],		train_loss: 2.4223
10:	[0s / 4s],		train_loss: 2.5028
59:	[1s / 57s],		train_loss: 2.4377
43:	[0s / 18s],		train_loss: 2.4202
79:	[0s / 41s],		train_loss: 2.4505
11:	[0s / 4s],		train_loss: 2.4963
44:	[0s / 18s],		train_loss: 2.4322
12:	[0s / 5s],		train_loss: 2.4868
80:	[0s / 42s],		train_loss: 2.4431
45:	[0s / 19s],		train_loss: 2.4199
13:	[0s / 5s],		train_loss: 2.4869
60:	[1s / 58s],		train_loss: 2.4259
81:	[0s / 42s],		train_loss: 2.4433
46:	[0s / 19s],		train_loss: 2.4338
14:	[0s / 5s],		train_loss: 2.4648
82:	[0s / 43s],		train_loss: 2.4438
15:	[0s / 6s],		train_loss: 2.4660
47:	[0s / 19s],		train_loss: 2.4089
61:	[0s / 59s],		train_loss: 2.4432
16:	[0s / 6s],		train_loss: 2.4840
48:	[0s / 20s],		train_loss: 2.4177
83:	[0s / 43s],		train_loss: 2.4338
17:	[0s / 7s],		train_loss: 2.4626
49:	[0s / 20s],		train_loss: 2.4237
84:	[0s / 44s],		train_loss: 2.4389
62:	[0s / 1m:0s],		train_loss: 2.4452
18:	[0s / 7s],		train_loss: 2.4672
50:	[0s / 21s],		train_loss: 2.4192
85:	[0s / 44s],		train_loss: 2.4553
19:	[0s / 7s],		train_loss: 2.4624
51:	[0s / 21s],		train_loss: 2.4031
20:	[0s / 8s],		train_loss: 2.4632
86:	[0s / 45s],		train_loss: 2.4340
63:	[0s / 1m:1s],		train_loss: 2.4450
52:	[0s / 22s],		train_loss: 2.4054
21:	[0s / 8s],		train_loss: 2.4502
53:	[0s / 22s],		train_loss: 2.4126
87:	[0s / 45s],		train_loss: 2.4374
22:	[0s / 8s],		train_loss: 2.4461
54:	[0s / 22s],		train_loss: 2.4067
88:	[0s / 46s],		train_loss: 2.4308
64:	[0s / 1m:2s],		train_loss: 2.4379
23:	[0s / 9s],		train_loss: 2.4433
55:	[0s / 23s],		train_loss: 2.3996
24:	[0s / 9s],		train_loss: 2.4390
89:	[0s / 46s],		train_loss: 2.4462
56:	[0s / 23s],		train_loss: 2.4044
25:	[0s / 10s],		train_loss: 2.4425
65:	[0s / 1m:3s],		train_loss: 2.4370
90:	[0s / 47s],		train_loss: 2.4386
57:	[0s / 24s],		train_loss: 2.3897
26:	[0s / 10s],		train_loss: 2.4385
91:	[0s / 47s],		train_loss: 2.4346
58:	[0s / 24s],		train_loss: 2.3933
27:	[0s / 10s],		train_loss: 2.4285
66:	[1s / 1m:4s],		train_loss: 2.4273
59:	[0s / 24s],		train_loss: 2.4040
28:	[0s / 11s],		train_loss: 2.4398
92:	[0s / 48s],		train_loss: 2.4352
60:	[0s / 25s],		train_loss: 2.3939
29:	[0s / 11s],		train_loss: 2.4396
93:	[0s / 48s],		train_loss: 2.4386
61:	[0s / 25s],		train_loss: 2.4064
30:	[0s / 12s],		train_loss: 2.4240
67:	[0s / 1m:5s],		train_loss: 2.4241
94:	[0s / 49s],		train_loss: 2.4352
62:	[0s / 26s],		train_loss: 2.3856
31:	[0s / 12s],		train_loss: 2.4212
63:	[0s / 26s],		train_loss: 2.3931
32:	[0s / 12s],		train_loss: 2.4264
95:	[0s / 49s],		train_loss: 2.4348
68:	[0s / 1m:6s],		train_loss: 2.4353
33:	[0s / 13s],		train_loss: 2.4212
64:	[0s / 27s],		train_loss: 2.3975
96:	[0s / 50s],		train_loss: 2.4304
34:	[0s / 13s],		train_loss: 2.4229
65:	[0s / 27s],		train_loss: 2.4100
97:	[0s / 50s],		train_loss: 2.4353
35:	[0s / 14s],		train_loss: 2.4221
69:	[0s / 1m:7s],		train_loss: 2.4465
66:	[0s / 27s],		train_loss: 2.3884
36:	[0s / 14s],		train_loss: 2.4220
98:	[0s / 51s],		train_loss: 2.4388
67:	[0s / 28s],		train_loss: 2.3983
37:	[0s / 14s],		train_loss: 2.4186
68:	[0s / 28s],		train_loss: 2.3826
70:	[0s / 1m:8s],		train_loss: 2.4322
99:	[0s / 51s],		train_loss: 2.4369
38:	[0s / 15s],		train_loss: 2.4229
69:	[0s / 29s],		train_loss: 2.3839
39:	[0s / 15s],		train_loss: 2.4178
0:	[0s / 0s],		train_loss: 3.3265
70:	[0s / 29s],		train_loss: 2.3934
71:	[1s / 1m:9s],		train_loss: 2.4346
40:	[0s / 16s],		train_loss: 2.4097
1:	[0s / 1s],		train_loss: 2.7993
71:	[0s / 29s],		train_loss: 2.3862
41:	[0s / 16s],		train_loss: 2.4036
72:	[0s / 30s],		train_loss: 2.3712
2:	[0s / 1s],		train_loss: 2.7149
42:	[0s / 16s],		train_loss: 2.4072
72:	[0s / 1m:10s],		train_loss: 2.4260
73:	[0s / 30s],		train_loss: 2.3789
43:	[0s / 17s],		train_loss: 2.4156
3:	[0s / 2s],		train_loss: 2.6593
74:	[0s / 31s],		train_loss: 2.3829
44:	[0s / 17s],		train_loss: 2.4204
4:	[0s / 2s],		train_loss: 2.6238
73:	[0s / 1m:11s],		train_loss: 2.4414
75:	[0s / 31s],		train_loss: 2.3876
45:	[0s / 18s],		train_loss: 2.4022
76:	[0s / 32s],		train_loss: 2.3970
5:	[0s / 3s],		train_loss: 2.6025
46:	[0s / 18s],		train_loss: 2.4112
77:	[0s / 32s],		train_loss: 2.3745
74:	[0s / 1m:12s],		train_loss: 2.4184
47:	[0s / 18s],		train_loss: 2.4064
6:	[0s / 3s],		train_loss: 2.5819
78:	[0s / 32s],		train_loss: 2.3732
48:	[0s / 19s],		train_loss: 2.4036
7:	[0s / 4s],		train_loss: 2.5821
79:	[0s / 33s],		train_loss: 2.3756
49:	[0s / 19s],		train_loss: 2.4050
75:	[0s / 1m:12s],		train_loss: 2.4341
8:	[0s / 4s],		train_loss: 2.5648
50:	[0s / 20s],		train_loss: 2.3904
80:	[0s / 33s],		train_loss: 2.3700
51:	[0s / 20s],		train_loss: 2.3986
81:	[0s / 34s],		train_loss: 2.3754
9:	[0s / 5s],		train_loss: 2.5533
76:	[0s / 1m:13s],		train_loss: 2.4261
52:	[0s / 20s],		train_loss: 2.4008
82:	[0s / 34s],		train_loss: 2.3770
10:	[0s / 5s],		train_loss: 2.5405
53:	[0s / 21s],		train_loss: 2.4010
83:	[0s / 35s],		train_loss: 2.3702
77:	[0s / 1m:14s],		train_loss: 2.4190
11:	[0s / 6s],		train_loss: 2.5309
54:	[0s / 21s],		train_loss: 2.3983
84:	[0s / 35s],		train_loss: 2.3751
55:	[0s / 22s],		train_loss: 2.3910
85:	[0s / 35s],		train_loss: 2.3670
12:	[0s / 6s],		train_loss: 2.5293
56:	[0s / 22s],		train_loss: 2.4006
78:	[0s / 1m:15s],		train_loss: 2.4468
86:	[0s / 36s],		train_loss: 2.3695
13:	[0s / 7s],		train_loss: 2.5281
57:	[0s / 22s],		train_loss: 2.3827
87:	[0s / 36s],		train_loss: 2.3576
14:	[0s / 7s],		train_loss: 2.5242
58:	[0s / 23s],		train_loss: 2.3912
88:	[0s / 37s],		train_loss: 2.3577
79:	[0s / 1m:16s],		train_loss: 2.4215
59:	[0s / 23s],		train_loss: 2.3800
15:	[0s / 8s],		train_loss: 2.5173
89:	[0s / 37s],		train_loss: 2.3606
60:	[0s / 24s],		train_loss: 2.3936
90:	[0s / 37s],		train_loss: 2.3640
16:	[0s / 8s],		train_loss: 2.5177
61:	[0s / 24s],		train_loss: 2.3838
80:	[0s / 1m:17s],		train_loss: 2.4310
91:	[0s / 38s],		train_loss: 2.3635
17:	[0s / 9s],		train_loss: 2.5048
62:	[0s / 24s],		train_loss: 2.3860
92:	[0s / 38s],		train_loss: 2.3650
63:	[0s / 25s],		train_loss: 2.3767
18:	[0s / 10s],		train_loss: 2.5094
93:	[0s / 39s],		train_loss: 2.3543
81:	[1s / 1m:18s],		train_loss: 2.4441
64:	[0s / 25s],		train_loss: 2.3764
19:	[0s / 10s],		train_loss: 2.5051
94:	[0s / 39s],		train_loss: 2.3666
65:	[0s / 25s],		train_loss: 2.3825
95:	[0s / 39s],		train_loss: 2.3628
20:	[0s / 11s],		train_loss: 2.5004
82:	[0s / 1m:19s],		train_loss: 2.4092
66:	[0s / 26s],		train_loss: 2.3887
96:	[0s / 40s],		train_loss: 2.3590
67:	[0s / 26s],		train_loss: 2.3765
21:	[0s / 11s],		train_loss: 2.4912
97:	[0s / 40s],		train_loss: 2.3616
68:	[0s / 27s],		train_loss: 2.3844
83:	[0s / 1m:20s],		train_loss: 2.4348
22:	[0s / 12s],		train_loss: 2.4936
98:	[0s / 41s],		train_loss: 2.3544
69:	[0s / 27s],		train_loss: 2.3710
23:	[0s / 12s],		train_loss: 2.4853
99:	[0s / 41s],		train_loss: 2.3558
70:	[0s / 27s],		train_loss: 2.3777
84:	[0s / 1m:21s],		train_loss: 2.4230
24:	[0s / 13s],		train_loss: 2.4822
71:	[0s / 28s],		train_loss: 2.3797
0:	[0s / 0s],		train_loss: 4.2389
72:	[0s / 28s],		train_loss: 2.3898
1:	[0s / 0s],		train_loss: 3.1560
25:	[0s / 13s],		train_loss: 2.4915
73:	[0s / 29s],		train_loss: 2.3794
85:	[0s / 1m:22s],		train_loss: 2.4051
2:	[0s / 1s],		train_loss: 2.9366
26:	[0s / 14s],		train_loss: 2.4802
74:	[0s / 29s],		train_loss: 2.3644
3:	[0s / 1s],		train_loss: 2.8194
27:	[0s / 14s],		train_loss: 2.4880
75:	[0s / 29s],		train_loss: 2.3585
4:	[0s / 2s],		train_loss: 2.7826
86:	[0s / 1m:23s],		train_loss: 2.4172
76:	[0s / 30s],		train_loss: 2.3780
28:	[0s / 15s],		train_loss: 2.4854
5:	[0s / 2s],		train_loss: 2.7424
77:	[0s / 30s],		train_loss: 2.3710
6:	[0s / 2s],		train_loss: 2.7171
29:	[0s / 15s],		train_loss: 2.4795
87:	[0s / 1m:24s],		train_loss: 2.4266
78:	[0s / 31s],		train_loss: 2.3599
7:	[0s / 3s],		train_loss: 2.6722
30:	[0s / 16s],		train_loss: 2.4709
79:	[0s / 31s],		train_loss: 2.3680
8:	[0s / 3s],		train_loss: 2.6584
80:	[0s / 31s],		train_loss: 2.3699
31:	[0s / 16s],		train_loss: 2.4748
88:	[0s / 1m:25s],		train_loss: 2.4156
9:	[0s / 4s],		train_loss: 2.6431
81:	[0s / 32s],		train_loss: 2.3698
32:	[0s / 17s],		train_loss: 2.4802
10:	[0s / 4s],		train_loss: 2.6143
82:	[0s / 32s],		train_loss: 2.3668
33:	[0s / 17s],		train_loss: 2.4789
89:	[1s / 1m:26s],		train_loss: 2.4291
11:	[0s / 4s],		train_loss: 2.5925
83:	[0s / 33s],		train_loss: 2.3486
12:	[0s / 5s],		train_loss: 2.5982
84:	[0s / 33s],		train_loss: 2.3682
34:	[0s / 18s],		train_loss: 2.4721
85:	[0s / 33s],		train_loss: 2.3556
13:	[0s / 5s],		train_loss: 2.5895
90:	[0s / 1m:27s],		train_loss: 2.4099
35:	[0s / 18s],		train_loss: 2.4697
86:	[0s / 34s],		train_loss: 2.3561
14:	[0s / 6s],		train_loss: 2.5843
36:	[0s / 19s],		train_loss: 2.4737
87:	[0s / 34s],		train_loss: 2.3571
15:	[0s / 6s],		train_loss: 2.5675
91:	[0s / 1m:28s],		train_loss: 2.4107
88:	[0s / 35s],		train_loss: 2.3619
37:	[0s / 19s],		train_loss: 2.4638
16:	[0s / 7s],		train_loss: 2.5584
89:	[0s / 35s],		train_loss: 2.3583
17:	[0s / 7s],		train_loss: 2.5519
38:	[0s / 20s],		train_loss: 2.4682
90:	[0s / 35s],		train_loss: 2.3589
18:	[0s / 7s],		train_loss: 2.5467
92:	[1s / 1m:29s],		train_loss: 2.4201
39:	[0s / 20s],		train_loss: 2.4542
91:	[0s / 36s],		train_loss: 2.3585
19:	[0s / 8s],		train_loss: 2.5395
40:	[0s / 21s],		train_loss: 2.4661
92:	[0s / 36s],		train_loss: 2.3565
20:	[0s / 8s],		train_loss: 2.5469
93:	[0s / 1m:30s],		train_loss: 2.4107
93:	[0s / 37s],		train_loss: 2.3430
41:	[0s / 21s],		train_loss: 2.4558
21:	[0s / 9s],		train_loss: 2.5315
94:	[0s / 37s],		train_loss: 2.3452
42:	[0s / 22s],		train_loss: 2.4467
22:	[0s / 9s],		train_loss: 2.5280
94:	[0s / 1m:31s],		train_loss: 2.4168
95:	[0s / 37s],		train_loss: 2.3477
23:	[0s / 9s],		train_loss: 2.5333
43:	[0s / 22s],		train_loss: 2.4621
96:	[0s / 38s],		train_loss: 2.3402
24:	[0s / 10s],		train_loss: 2.5271
97:	[0s / 38s],		train_loss: 2.3508
44:	[0s / 23s],		train_loss: 2.4590
95:	[0s / 1m:32s],		train_loss: 2.4198
25:	[0s / 10s],		train_loss: 2.5227
98:	[0s / 39s],		train_loss: 2.3441
45:	[0s / 23s],		train_loss: 2.4639
26:	[0s / 11s],		train_loss: 2.5259
99:	[0s / 39s],		train_loss: 2.3414
96:	[0s / 1m:32s],		train_loss: 2.4136
46:	[0s / 24s],		train_loss: 2.4689
27:	[0s / 11s],		train_loss: 2.5115
0:	[0s / 0s],		train_loss: 3.9002
28:	[0s / 12s],		train_loss: 2.5160
47:	[0s / 25s],		train_loss: 2.4622
1:	[0s / 0s],		train_loss: 3.0720
97:	[0s / 1m:33s],		train_loss: 2.4034
29:	[0s / 12s],		train_loss: 2.5107
2:	[0s / 1s],		train_loss: 2.8730
48:	[0s / 25s],		train_loss: 2.4570
30:	[0s / 13s],		train_loss: 2.5077
3:	[0s / 1s],		train_loss: 2.7599
49:	[0s / 26s],		train_loss: 2.4496
31:	[0s / 13s],		train_loss: 2.5039
98:	[0s / 1m:34s],		train_loss: 2.4167
4:	[0s / 1s],		train_loss: 2.7184
50:	[0s / 26s],		train_loss: 2.4431
32:	[0s / 13s],		train_loss: 2.5097
5:	[0s / 2s],		train_loss: 2.6753
33:	[0s / 14s],		train_loss: 2.5033
6:	[0s / 2s],		train_loss: 2.6458
51:	[0s / 27s],		train_loss: 2.4455
99:	[0s / 1m:35s],		train_loss: 2.3985
34:	[0s / 14s],		train_loss: 2.5042
7:	[0s / 3s],		train_loss: 2.6452
52:	[0s / 27s],		train_loss: 2.4492
35:	[0s / 15s],		train_loss: 2.4913
8:	[0s / 3s],		train_loss: 2.6200
53:	[0s / 28s],		train_loss: 2.4479
0:	[0s / 0s],		train_loss: 3.7735
9:	[0s / 4s],		train_loss: 2.6089
36:	[0s / 15s],		train_loss: 2.4847
54:	[0s / 28s],		train_loss: 2.4408
10:	[0s / 4s],		train_loss: 2.6053
37:	[0s / 15s],		train_loss: 2.4996
11:	[0s / 4s],		train_loss: 2.5900
38:	[0s / 16s],		train_loss: 2.4855
55:	[0s / 29s],		train_loss: 2.4390
1:	[0s / 1s],		train_loss: 2.8731
12:	[0s / 5s],		train_loss: 2.5784
39:	[0s / 16s],		train_loss: 2.4944
56:	[0s / 29s],		train_loss: 2.4418
13:	[0s / 5s],		train_loss: 2.5705
40:	[0s / 17s],		train_loss: 2.4899
2:	[0s / 2s],		train_loss: 2.7555
57:	[0s / 30s],		train_loss: 2.4547
14:	[0s / 6s],		train_loss: 2.5624
41:	[0s / 17s],		train_loss: 2.4829
15:	[0s / 6s],		train_loss: 2.5580
58:	[0s / 30s],		train_loss: 2.4308
42:	[0s / 18s],		train_loss: 2.4955
16:	[0s / 6s],		train_loss: 2.5596
3:	[0s / 3s],		train_loss: 2.7026
59:	[0s / 31s],		train_loss: 2.4521
43:	[0s / 18s],		train_loss: 2.4795
17:	[0s / 7s],		train_loss: 2.5469
44:	[0s / 18s],		train_loss: 2.4883
60:	[0s / 31s],		train_loss: 2.4574
18:	[0s / 7s],		train_loss: 2.5428
45:	[0s / 19s],		train_loss: 2.4813
4:	[1s / 4s],		train_loss: 2.6258
61:	[0s / 32s],		train_loss: 2.4380
19:	[0s / 8s],		train_loss: 2.5521
46:	[0s / 19s],		train_loss: 2.4681
20:	[0s / 8s],		train_loss: 2.5393
62:	[0s / 32s],		train_loss: 2.4452
47:	[0s / 20s],		train_loss: 2.4595
21:	[0s / 8s],		train_loss: 2.5310
5:	[0s / 5s],		train_loss: 2.6069
48:	[0s / 20s],		train_loss: 2.4819
63:	[0s / 33s],		train_loss: 2.4484
22:	[0s / 9s],		train_loss: 2.5273
49:	[0s / 20s],		train_loss: 2.4740
23:	[0s / 9s],		train_loss: 2.5192
64:	[0s / 33s],		train_loss: 2.4404
6:	[0s / 6s],		train_loss: 2.5860
50:	[0s / 21s],		train_loss: 2.4658
24:	[0s / 9s],		train_loss: 2.5184
65:	[0s / 34s],		train_loss: 2.4418
51:	[0s / 21s],		train_loss: 2