[I 2026-07-01 11:33:02,116] Trial 54 finished with value: 0.7463610191063269 and parameters: {'num_nodes': [64, 32], 'dropout': 0.2575330752425223, 'learning_rate': 0.0001593307152441888, 'batch_norm': True}. Best is trial 43 with value: 0.7748336246818168.
/scratch.hpc/luca.cotugno/Foundation_model_clinical_data/test_tabular_model.py:481: UserWarning: Choices for a categorical distribution should be a tuple of None, bool, int, float and str for persistent storage but contains [32] which is of type list.
  num_nodes  = trial.suggest_categorical("num_nodes", [[32], [64], [128], [64, 32], [128, 64]])
/scratch.hpc/luca.cotugno/Foundation_model_clinical_data/test_tabular_model.py:481: UserWarning: Choices for a categorical distribution should be a tuple of None, bool, int, float and str for persistent storage but contains [64] which is of type list.
  num_nodes  = trial.suggest_categorical("num_nodes", [[32], [64], [128], [64, 32], [128, 64]])
/scratch.hpc/luca.cotugno/Foundation_model_clinical_data/test_tabular_model.py:481: UserWarning: Choices for a categorical distribution should be a tuple of None, bool, int, float and str for persistent storage but contains [128] which is of type list.
  num_nodes  = trial.suggest_categorical("num_nodes", [[32], [64], [128], [64, 32], [128, 64]])
/scratch.hpc/luca.cotugno/Foundation_model_clinical_data/test_tabular_model.py:481: UserWarning: Choices for a categorical distribution should be a tuple of None, bool, int, float and str for persistent storage but contains [64, 32] which is of type list.
  num_nodes  = trial.suggest_categorical("num_nodes", [[32], [64], [128], [64, 32], [128, 64]])
/scratch.hpc/luca.cotugno/Foundation_model_clinical_data/test_tabular_model.py:481: UserWarning: Choices for a categorical distribution should be a tuple of None, bool, int, float and str for persistent storage but contains [128, 64] which is of type list.
  num_nodes  = trial.suggest_categorical("num_nodes", [[32], [64], [128], [64, 32], [128, 64]])

99:	[0s / 15s],		train_loss: 3.9879
46:	[2s / 2m:48s],		train_loss: 4.2046
41:	[0s / 44s],		train_loss: 4.2940
63:	[0s / 38s],		train_loss: 4.0030
68:	[0s / 10s],		train_loss: 4.2076
58:	[0s / 20s],		train_loss: 4.1481
51:	[0s / 10s],		train_loss: 4.2681
69:	[0s / 10s],		train_loss: 4.2039
0:	[0s / 0s],		train_loss: 4.9848
52:	[0s / 10s],		train_loss: 4.3034
70:	[0s / 10s],		train_loss: 4.1763
1:	[0s / 0s],		train_loss: 4.7526
59:	[0s / 20s],		train_loss: 4.1422
53:	[0s / 10s],		train_loss: 4.2939
71:	[0s / 10s],		train_loss: 4.1865
2:	[0s / 0s],		train_loss: 4.6089
64:	[0s / 39s],		train_loss: 3.9595
72:	[0s / 10s],		train_loss: 4.1877
81:	[1s / 2m:49s],		train_loss: 3.3401
54:	[0s / 10s],		train_loss: 4.2675
3:	[0s / 0s],		train_loss: 4.5751
60:	[0s / 21s],		train_loss: 4.1649
73:	[0s / 10s],		train_loss: 4.1764
4:	[0s / 0s],		train_loss: 4.5544
55:	[0s / 11s],		train_loss: 4.2817
42:	[0s / 45s],		train_loss: 4.2871
74:	[0s / 10s],		train_loss: 4.1966
5:	[0s / 0s],		train_loss: 4.5299
56:	[0s / 11s],		train_loss: 4.2751
75:	[0s / 11s],		train_loss: 4.2096
61:	[0s / 21s],		train_loss: 4.1630
65:	[0s / 39s],		train_loss: 3.9760
6:	[0s / 1s],		train_loss: 4.5280
76:	[0s / 11s],		train_loss: 4.1638
57:	[0s / 11s],		train_loss: 4.3057
7:	[0s / 1s],		train_loss: 4.4926
77:	[0s / 11s],		train_loss: 4.1813
8:	[0s / 1s],		train_loss: 4.5176
58:	[0s / 11s],		train_loss: 4.2725
62:	[0s / 21s],		train_loss: 4.1250
78:	[0s / 11s],		train_loss: 4.1550
9:	[0s / 1s],		train_loss: 4.4983
59:	[0s / 11s],		train_loss: 4.2564
66:	[0s / 40s],		train_loss: 3.9654
79:	[0s / 11s],		train_loss: 4.1503
10:	[0s / 1s],		train_loss: 4.4880
63:	[0s / 22s],		train_loss: 4.1550
80:	[0s / 11s],		train_loss: 4.1528
60:	[0s / 12s],		train_loss: 4.2541
11:	[0s / 1s],		train_loss: 4.4659
81:	[0s / 11s],		train_loss: 4.1789
43:	[1s / 46s],		train_loss: 4.2105
61:	[0s / 12s],		train_loss: 4.2499
12:	[0s / 1s],		train_loss: 4.4514
82:	[0s / 12s],		train_loss: 4.1473
64:	[0s / 22s],		train_loss: 4.1488
13:	[0s / 2s],		train_loss: 4.4278
62:	[0s / 12s],		train_loss: 4.2459
83:	[0s / 12s],		train_loss: 4.1475
67:	[0s / 40s],		train_loss: 3.9918
14:	[0s / 2s],		train_loss: 4.4392
84:	[0s / 12s],		train_loss: 4.1448
63:	[0s / 12s],		train_loss: 4.2604
65:	[0s / 22s],		train_loss: 4.1264
15:	[0s / 2s],		train_loss: 4.4451
85:	[0s / 12s],		train_loss: 4.1444
16:	[0s / 2s],		train_loss: 4.4032
86:	[0s / 12s],		train_loss: 4.1463
64:	[0s / 12s],		train_loss: 4.2743
87:	[0s / 12s],		train_loss: 4.1347
66:	[0s / 23s],		train_loss: 4.1043
17:	[0s / 2s],		train_loss: 4.4011
65:	[0s / 12s],		train_loss: 4.2636
82:	[2s / 2m:51s],		train_loss: 3.3173
88:	[0s / 12s],		train_loss: 4.1290
18:	[0s / 2s],		train_loss: 4.4163
68:	[0s / 41s],		train_loss: 3.9820
66:	[0s / 13s],		train_loss: 4.2811
89:	[0s / 12s],		train_loss: 4.1299
19:	[0s / 2s],		train_loss: 4.3908
44:	[1s / 47s],		train_loss: 4.2372
67:	[0s / 23s],		train_loss: 4.1375
67:	[0s / 13s],		train_loss: 4.2400
90:	[0s / 13s],		train_loss: 4.1462
20:	[0s / 3s],		train_loss: 4.3820
91:	[0s / 13s],		train_loss: 4.1568
21:	[0s / 3s],		train_loss: 4.4100
68:	[0s / 13s],		train_loss: 4.2516
92:	[0s / 13s],		train_loss: 4.1627
22:	[0s / 3s],		train_loss: 4.3851
68:	[0s / 23s],		train_loss: 4.0982
69:	[0s / 13s],		train_loss: 4.2749
69:	[0s / 42s],		train_loss: 3.9593
93:	[0s / 13s],		train_loss: 4.1366
23:	[0s / 3s],		train_loss: 4.3816
94:	[0s / 13s],		train_loss: 4.1164
70:	[0s / 13s],		train_loss: 4.2478
24:	[0s / 3s],		train_loss: 4.3740
95:	[0s / 13s],		train_loss: 4.1214
69:	[0s / 24s],		train_loss: 4.1170
25:	[0s / 3s],		train_loss: 4.3262
71:	[0s / 14s],		train_loss: 4.2609
96:	[0s / 13s],		train_loss: 4.1495
47:	[3s / 2m:52s],		train_loss: 4.2214
26:	[0s / 3s],		train_loss: 4.3576
72:	[0s / 14s],		train_loss: 4.2375
97:	[0s / 14s],		train_loss: 4.1255
27:	[0s / 4s],		train_loss: 4.3423
70:	[0s / 42s],		train_loss: 3.9203
70:	[0s / 24s],		train_loss: 4.1239
45:	[1s / 49s],		train_loss: 4.3175
98:	[0s / 14s],		train_loss: 4.1058
73:	[0s / 14s],		train_loss: 4.2318
28:	[0s / 4s],		train_loss: 4.3663
99:	[0s / 14s],		train_loss: 4.1152
74:	[0s / 14s],		train_loss: 4.2154
71:	[0s / 24s],		train_loss: 4.1096
29:	[0s / 4s],		train_loss: 4.3323
0:	[0s / 0s],		train_loss: 4.9088
30:	[0s / 4s],		train_loss: 4.3506
75:	[0s / 14s],		train_loss: 4.2575
83:	[1s / 2m:53s],		train_loss: 3.2908
1:	[0s / 0s],		train_loss: 4.6876
31:	[0s / 4s],		train_loss: 4.3808
71:	[0s / 43s],		train_loss: 3.9554
76:	[0s / 15s],		train_loss: 4.2284
72:	[0s / 25s],		train_loss: 4.1097
2:	[0s / 0s],		train_loss: 4.5832
32:	[0s / 4s],		train_loss: 4.3385
3:	[0s / 0s],		train_loss: 4.5976
77:	[0s / 15s],		train_loss: 4.2236
33:	[0s / 5s],		train_loss: 4.3728
46:	[0s / 50s],		train_loss: 4.2429
4:	[0s / 0s],		train_loss: 4.5472
73:	[0s / 25s],		train_loss: 4.1136
78:	[0s / 15s],		train_loss: 4.2156
34:	[0s / 5s],		train_loss: 4.3475
5:	[0s / 0s],		train_loss: 4.5195
72:	[0s / 44s],		train_loss: 3.9145
79:	[0s / 15s],		train_loss: 4.2405
35:	[0s / 5s],		train_loss: 4.3479
6:	[0s / 1s],		train_loss: 4.5010
36:	[0s / 5s],		train_loss: 4.3238
74:	[0s / 26s],		train_loss: 4.0807
80:	[0s / 15s],		train_loss: 4.2379
7:	[0s / 1s],		train_loss: 4.4805
37:	[0s / 5s],		train_loss: 4.3082
81:	[0s / 16s],		train_loss: 4.2143
8:	[0s / 1s],		train_loss: 4.4587
38:	[0s / 5s],		train_loss: 4.3154
9:	[0s / 1s],		train_loss: 4.4571
82:	[0s / 16s],		train_loss: 4.2102
75:	[0s / 26s],		train_loss: 4.0994
73:	[0s / 44s],		train_loss: 3.9427
39:	[0s / 5s],		train_loss: 4.3403
10:	[0s / 1s],		train_loss: 4.4572
83:	[0s / 16s],		train_loss: 4.2056
40:	[0s / 6s],		train_loss: 4.3061
47:	[1s / 51s],		train_loss: 4.2216
11:	[0s / 1s],		train_loss: 4.4423
76:	[0s / 26s],		train_loss: 4.0997
84:	[0s / 16s],		train_loss: 4.2075
41:	[0s / 6s],		train_loss: 4.3173
12:	[0s / 1s],		train_loss: 4.4642
13:	[0s / 2s],		train_loss: 4.4279
42:	[0s / 6s],		train_loss: 4.3317
85:	[0s / 16s],		train_loss: 4.2253
84:	[1s / 2m:55s],		train_loss: 3.2939
74:	[0s / 45s],		train_loss: 3.9077
77:	[0s / 27s],		train_loss: 4.0927
14:	[0s / 2s],		train_loss: 4.4188
43:	[0s / 6s],		train_loss: 4.3319
86:	[0s / 16s],		train_loss: 4.2159
15:	[0s / 2s],		train_loss: 4.4091
44:	[0s / 6s],		train_loss: 4.3064
87:	[0s / 17s],		train_loss: 4.2199
78:	[0s / 27s],		train_loss: 4.1100
16:	[0s / 2s],		train_loss: 4.3889
45:	[0s / 6s],		train_loss: 4.3133
48:	[3s / 2m:55s],		train_loss: 4.2234
75:	[0s / 45s],		train_loss: 3.9074
17:	[0s / 2s],		train_loss: 4.4001
88:	[0s / 17s],		train_loss: 4.2190
46:	[0s / 7s],		train_loss: 4.2949
48:	[1s / 52s],		train_loss: 4.2469
18:	[0s / 2s],		train_loss: 4.3853
47:	[0s / 7s],		train_loss: 4.3034
79:	[0s / 27s],		train_loss: 4.0820
89:	[0s / 17s],		train_loss: 4.1894
19:	[0s / 2s],		train_loss: 4.3930
48:	[0s / 7s],		train_loss: 4.2775
90:	[0s / 17s],		train_loss: 4.2167
20:	[0s / 3s],		train_loss: 4.4032
49:	[0s / 7s],		train_loss: 4.2781
76:	[0s / 46s],		train_loss: 3.9105
80:	[0s / 28s],		train_loss: 4.1005
21:	[0s / 3s],		train_loss: 4.3630
91:	[0s / 17s],		train_loss: 4.1636
50:	[0s / 7s],		train_loss: 4.2723
22:	[0s / 3s],		train_loss: 4.3942
51:	[0s / 7s],		train_loss: 4.2655
92:	[0s / 18s],		train_loss: 4.2013
81:	[0s / 28s],		train_loss: 4.1016
23:	[0s / 3s],		train_loss: 4.3522
52:	[0s / 7s],		train_loss: 4.3030
93:	[0s / 18s],		train_loss: 4.2025
24:	[0s / 3s],		train_loss: 4.3620
53:	[0s / 8s],		train_loss: 4.2569
49:	[0s / 53s],		train_loss: 4.2451
77:	[0s / 46s],		train_loss: 3.9280
94:	[0s / 18s],		train_loss: 4.1817
25:	[0s / 3s],		train_loss: 4.3691
82:	[0s / 28s],		train_loss: 4.0766
54:	[0s / 8s],		train_loss: 4.2636
26:	[0s / 3s],		train_loss: 4.3576
95:	[0s / 18s],		train_loss: 4.1962
55:	[0s / 8s],		train_loss: 4.2757
27:	[0s / 4s],		train_loss: 4.3594
96:	[0s / 18s],		train_loss: 4.1826
83:	[0s / 29s],		train_loss: 4.0683
56:	[0s / 8s],		train_loss: 4.2740
85:	[2s / 2m:57s],		train_loss: 3.2298
28:	[0s / 4s],		train_loss: 4.3610
78:	[0s / 47s],		train_loss: 3.9142
57:	[0s / 8s],		train_loss: 4.2509
97:	[0s / 19s],		train_loss: 4.1912
29:	[0s / 4s],		train_loss: 4.3414
58:	[0s / 8s],		train_loss: 4.2841
84:	[0s / 29s],		train_loss: 4.0568
30:	[0s / 4s],		train_loss: 4.3127
98:	[0s / 19s],		train_loss: 4.1812
50:	[0s / 54s],		train_loss: 4.2462
59:	[0s / 9s],		train_loss: 4.2681
31:	[0s / 4s],		train_loss: 4.3328
99:	[0s / 19s],		train_loss: 4.1724
32:	[0s / 4s],		train_loss: 4.3206
60:	[0s / 9s],		train_loss: 4.2538
33:	[0s / 4s],		train_loss: 4.3210
85:	[0s / 29s],		train_loss: 4.0684
61:	[0s / 9s],		train_loss: 4.2438
0:	[0s / 0s],		train_loss: 5.6043
79:	[0s / 48s],		train_loss: 3.8919
34:	[0s / 5s],		train_loss: 4.3186
62:	[0s / 9s],		train_loss: 4.2507
1:	[0s / 0s],		train_loss: 4.8369
35:	[0s / 5s],		train_loss: 4.3344
86:	[0s / 30s],		train_loss: 4.0614
63:	[0s / 9s],		train_loss: 4.2609
36:	[0s / 5s],		train_loss: 4.3121
2:	[0s / 0s],		train_loss: 4.6616
64:	[0s / 9s],		train_loss: 4.2830
37:	[0s / 5s],		train_loss: 4.3225
3:	[0s / 0s],		train_loss: 4.5446
65:	[0s / 10s],		train_loss: 4.2777
87:	[0s / 30s],		train_loss: 4.0660
38:	[0s / 5s],		train_loss: 4.3008
51:	[1s / 55s],		train_loss: 4.2168
80:	[0s / 48s],		train_loss: 3.9143
4:	[0s / 0s],		train_loss: 4.4715
66:	[0s / 10s],		train_loss: 4.2354
39:	[0s / 5s],		train_loss: 4.3082
86:	[1s / 2m:59s],		train_loss: 3.2899
67:	[0s / 10s],		train_loss: 4.2738
5:	[0s / 1s],		train_loss: 4.4585
40:	[0s / 5s],		train_loss: 4.3003
88:	[0s / 30s],		train_loss: 4.0255
68:	[0s / 10s],		train_loss: 4.2375
49:	[3s / 2m:59s],		train_loss: 4.2113
41:	[0s / 6s],		train_loss: 4.2960
6:	[0s / 1s],		train_loss: 4.4484
69:	[0s / 10s],		train_loss: 4.2219
42:	[0s / 6s],		train_loss: 4.2817
81:	[0s / 49s],		train_loss: 3.9202
89:	[0s / 31s],		train_loss: 4.0611
7:	[0s / 1s],		train_loss: 4.4172
70:	[0s / 10s],		train_loss: 4.2548
43:	[0s / 6s],		train_loss: 4.2993
71:	[0s / 10s],		train_loss: 4.2086
44:	[0s / 6s],		train_loss: 4.2762
8:	[0s / 1s],		train_loss: 4.3680
90:	[0s / 31s],		train_loss: 4.0554
45:	[0s / 6s],		train_loss: 4.2903
72:	[0s / 11s],		train_loss: 4.1814
9:	[0s / 1s],		train_loss: 4.3865
52:	[1s / 56s],		train_loss: 4.2313
46:	[0s / 6s],		train_loss: 4.2691
73:	[0s / 11s],		train_loss: 4.2183
82:	[0s / 50s],		train_loss: 3.8381
10:	[0s / 2s],		train_loss: 4.3821
47:	[0s / 7s],		train_loss: 4.2603
74:	[0s / 11s],		train_loss: 4.2268
91:	[0s / 32s],		train_loss: 4.0502
48:	[0s / 7s],		train_loss: 4.2654
11:	[0s / 2s],		train_loss: 4.3872
75:	[0s / 11s],		train_loss: 4.2228
49:	[0s / 7s],		train_loss: 4.2815
76:	[0s / 11s],		train_loss: 4.2459
12:	[0s / 2s],		train_loss: 4.3466
50:	[0s / 7s],		train_loss: 4.2715
92:	[0s / 32s],		train_loss: 4.0172
77:	[0s / 11s],		train_loss: 4.2166
83:	[0s / 50s],		train_loss: 3.9060
13:	[0s / 2s],		train_loss: 4.3366
51:	[0s / 7s],		train_loss: 4.2305
78:	[0s / 12s],		train_loss: 4.2065
52:	[0s / 7s],		train_loss: 4.2622
14:	[0s / 2s],		train_loss: 4.3068
79:	[0s / 12s],		train_loss: 4.2317
93:	[0s / 32s],		train_loss: 4.0229
87:	[1s / 3m:0s],		train_loss: 3.3437
53:	[0s / 7s],		train_loss: 4.2734
80:	[0s / 12s],		train_loss: 4.2008
53:	[1s / 57s],		train_loss: 4.2237
15:	[0s / 3s],		train_loss: 4.3040
54:	[0s / 7s],		train_loss: 4.2556
81:	[0s / 12s],		train_loss: 4.2336
94:	[0s / 33s],		train_loss: 4.0349
55:	[0s / 8s],		train_loss: 4.2563
16:	[0s / 3s],		train_loss: 4.3157
84:	[0s / 51s],		train_loss: 3.8579
82:	[0s / 12s],		train_loss: 4.2158
56:	[0s / 8s],		train_loss: 4.2431
17:	[0s / 3s],		train_loss: 4.2915
83:	[0s / 12s],		train_loss: 4.1709
57:	[0s / 8s],		train_loss: 4.2525
95:	[0s / 33s],		train_loss: 4.0537
18:	[0s / 3s],		train_loss: 4.2985
84:	[0s / 12s],		train_loss: 4.1711
58:	[0s / 8s],		train_loss: 4.2356
85:	[0s / 13s],		train_loss: 4.1793
19:	[0s / 3s],		train_loss: 4.2660
59:	[0s / 8s],		train_loss: 4.2438
85:	[0s / 51s],		train_loss: 3.8723
96:	[0s / 33s],		train_loss: 4.0405
86:	[0s / 13s],		train_loss: 4.1940
60:	[0s / 8s],		train_loss: 4.2511
20:	[0s / 4s],		train_loss: 4.2433
54:	[0s / 58s],		train_loss: 4.2180
87:	[0s / 13s],		train_loss: 4.1690
61:	[0s / 8s],		train_loss: 4.2554
21:	[0s / 4s],		train_loss: 4.2740
88:	[0s / 13s],		train_loss: 4.1942
62:	[0s / 9s],		train_loss: 4.2377
97:	[0s / 34s],		train_loss: 4.0091
89:	[0s / 13s],		train_loss: 4.1843
63:	[0s / 9s],		train_loss: 4.2286
22:	[0s / 4s],		train_loss: 4.2521
86:	[0s / 52s],		train_loss: 3.8694
64:	[0s / 9s],		train_loss: 4.2159
90:	[0s / 13s],		train_loss: 4.1976
23:	[0s / 4s],		train_loss: 4.2438
98:	[0s / 34s],		train_loss: 4.0103
50:	[3s / 3m:2s],		train_loss: 4.2006
65:	[0s / 9s],		train_loss: 4.1930
91:	[0s / 13s],		train_loss: 4.1673
24:	[0s / 4s],		train_loss: 4.2483
88:	[1s / 3m:2s],		train_loss: 3.3041
66:	[0s / 9s],		train_loss: 4.2208
92:	[0s / 14s],		train_loss: 4.1922
67:	[0s / 9s],		train_loss: 4.2134
25:	[0s / 4s],		train_loss: 4.2212
93:	[0s / 14s],		train_loss: 4.1954
99:	[0s / 34s],		train_loss: 4.0184
68:	[0s / 10s],		train_loss: 4.2216
94:	[0s / 14s],		train_loss: 4.1455
87:	[0s / 53s],		train_loss: 3.8448
26:	[0s / 5s],		train_loss: 4.2318
55:	[1s / 59s],		train_loss: 4.2010
69:	[0s / 10s],		train_loss: 4.2221
95:	[0s / 14s],		train_loss: 4.1437
27:	[0s / 5s],		train_loss: 4.2193
70:	[0s / 10s],		train_loss: 4.2389
96:	[0s / 14s],		train_loss: 4.1464
0:	[0s / 0s],		train_loss: 5.5551
28:	[0s / 5s],		train_loss: 4.2250
71:	[0s / 10s],		train_loss: 4.2320
97:	[0s / 14s],		train_loss: 4.1339
29:	[0s / 5s],		train_loss: 4.1908
72:	[0s / 10s],		train_loss: 4.2102
98:	[0s / 15s],		train_loss: 4.1464
88:	[0s / 53s],		train_loss: 3.8745
1:	[0s / 0s],		train_loss: 5.0169
73:	[0s / 10s],		train_loss: 4.2139
99:	[0s / 15s],		train_loss: 4.1429
30:	[0s / 5s],		train_loss: 4.1856
74:	[0s / 10s],		train_loss: 4.2190
75:	[0s / 11s],		train_loss: 4.2091
31:	[0s / 6s],		train_loss: 4.1748
0:	[0s / 0s],		train_loss: 5.3543
2:	[0s / 1s],		train_loss: 4.7744
76:	[0s / 11s],		train_loss: 4.2421
32:	[0s / 6s],		train_loss: 4.1769
1:	[0s / 0s],		train_loss: 4.9321
77:	[0s / 11s],		train_loss: 4.2066
89:	[0s / 54s],		train_loss: 3.8502
56:	[1s / 1m:0s],		train_loss: 4.2002
33:	[0s / 6s],		train_loss: 4.1923
2:	[0s / 0s],		train_loss: 4.7058
78:	[0s / 11s],		train_loss: 4.1814
3:	[0s / 1s],		train_loss: 4.6598
3:	[0s / 0s],		train_loss: 4.5803
79:	[0s / 11s],		train_loss: 4.1972
34:	[0s / 6s],		train_loss: 4.1711
80:	[0s / 11s],		train_loss: 4.1971
4:	[0s / 0s],		train_loss: 4.5304
35:	[0s / 6s],		train_loss: 4.1393
4:	[0s / 1s],		train_loss: 4.5997
90:	[0s / 54s],		train_loss: 3.8163
81:	[0s / 11s],		train_loss: 4.1814
5:	[0s / 0s],		train_loss: 4.4855
89:	[2s / 3m:5s],		train_loss: 3.2835
36:	[0s / 7s],		train_loss: 4.1669
82:	[0s / 12s],		train_loss: 4.1854
6:	[0s / 1s],		train_loss: 4.4475
5:	[0s / 2s],		train_loss: 4.5784
83:	[0s / 12s],		train_loss: 4.1971
7:	[0s / 1s],		train_loss: 4.4050
37:	[0s / 7s],		train_loss: 4.1484
84:	[0s / 12s],		train_loss: 4.1940
57:	[1s / 1m:1s],		train_loss: 4.3024
8:	[0s / 1s],		train_loss: 4.4186
38:	[0s / 7s],		train_loss: 4.1357
91:	[0s / 55s],		train_loss: 3.8275
85:	[0s / 12s],		train_loss: 4.1802
6:	[0s / 2s],		train_loss: 4.5609
9:	[0s / 1s],		train_loss: 4.3988
39:	[0s / 7s],		train_loss: 4.1383
86:	[0s / 12s],		train_loss: 4.1647
10:	[0s / 1s],		train_loss: 4.3697
87:	[0s / 12s],		train_loss: 4.1738
40:	[0s / 8s],		train_loss: 4.1053
11:	[0s / 1s],		train_loss: 4.3588
7:	[0s / 2s],		train_loss: 4.5328
88:	[0s / 13s],		train_loss: 4.1787
12:	[0s / 2s],		train_loss: 4.3633
41:	[0s / 8s],		train_loss: 4.1157
92:	[0s / 56s],		train_loss: 3.8080
89:	[0s / 13s],		train_loss: 4.1451
13:	[0s / 2s],		train_loss: 4.3479
42:	[0s / 8s],		train_loss: 4.0815
90:	[0s / 13s],		train_loss: 4.1273
8:	[0s / 3s],		train_loss: 4.5317
51:	[3s / 3m:6s],		train_loss: 4.2139
14:	[0s / 2s],		train_loss: 4.3434
91:	[0s / 13s],		train_loss: 4.1534
58:	[1s / 1m:2s],		train_loss: 4.2703
43:	[0s / 8s],		train_loss: 4.0753
15:	[0s / 2s],		train_loss: 4.3437
92:	[0s / 13s],		train_loss: 4.1782
9:	[0s / 3s],		train_loss: 4.4960
44:	[0s / 8s],		train_loss: 4.0911
16:	[0s / 2s],		train_loss: 4.3447
93:	[0s / 13s],		train_loss: 4.1965
93:	[0s / 56s],		train_loss: 3.8138
17:	[0s / 2s],		train_loss: 4.3390
45:	[0s / 8s],		train_loss: 4.1196
94:	[0s / 13s],		train_loss: 4.1346
90:	[1s / 3m:7s],		train_loss: 3.2304
18:	[0s / 2s],		train_loss: 4.3064
95:	[0s / 13s],		train_loss: 4.1551
10:	[0s / 3s],		train_loss: 4.4981
46:	[0s / 9s],		train_loss: 4.0605
19:	[0s / 3s],		train_loss: 4.3149
96:	[0s / 14s],		train_loss: 4.1583
47:	[0s / 9s],		train_loss: 4.0367
20:	[0s / 3s],		train_loss: 4.3254
97:	[0s / 14s],		train_loss: 4.1642
11:	[0s / 4s],		train_loss: 4.4986
94:	[0s / 57s],		train_loss: 3.8140
21:	[0s / 3s],		train_loss: 4.2856
98:	[0s / 14s],		train_loss: 4.1278
48:	[0s / 9s],		train_loss: 4.0732
59:	[1s / 1m:3s],		train_loss: 4.2199
22:	[0s / 3s],		train_loss: 4.3010
99:	[0s / 14s],		train_loss: 4.1244
49:	[0s / 9s],		train_loss: 4.0268
12:	[0s / 4s],		train_loss: 4.4897
23:	[0s / 3s],		train_loss: 4.2592
50:	[0s / 9s],		train_loss: 4.0492
0:	[0s / 0s],		train_loss: 4.7486
24:	[0s / 3s],		train_loss: 4.2538
13:	[0s / 4s],		train_loss: 4.4872
51:	[0s / 10s],		train_loss: 4.0488
95:	[0s / 58s],		train_loss: 3.8135
1:	[0s / 0s],		train_loss: 4.5808
25:	[0s / 3s],		train_loss: 4.2715
52:	[0s / 10s],		train_loss: 4.0279
2:	[0s / 0s],		train_loss: 4.4747
26:	[0s / 4s],		train_loss: 4.2460
14:	[0s / 5s],		train_loss: 4.4830
3:	[0s / 0s],		train_loss: 4.4216
27:	[0s / 4s],		train_loss: 4.2526
53:	[0s / 10s],		train_loss: 4.0040
4:	[0s / 0s],		train_loss: 4.4039
28:	[0s / 4s],		train_loss: 4.2342
54:	[0s / 10s],		train_loss: 4.0158
5:	[0s / 0s],		train_loss: 4.3866
29:	[0s / 4s],		train_loss: 4.2319
96:	[0s / 58s],		train_loss: 3.8144
60:	[1s / 1m:5s],		train_loss: 4.2327
55:	[0s / 10s],		train_loss: 4.0077
15:	[0s / 5s],		train_loss: 4.4256
6:	[0s / 0s],		train_loss: 4.3697
30:	[0s / 4s],		train_loss: 4.2190
56:	[0s / 10s],		train_loss: 3.9904
7:	[0s / 1s],		train_loss: 4.3764
31:	[0s / 4s],		train_loss: 4.1933
91:	[1s / 3m:8s],		train_loss: 3.2193
57:	[0s / 11s],		train_loss: 3.9927
16:	[0s / 5s],		train_loss: 4.4312
8:	[0s / 1s],		train_loss: 4.3678
32:	[0s / 4s],		train_loss: 4.2091
58:	[0s / 11s],		train_loss: 3.9944
9:	[0s / 1s],		train_loss: 4.3288
33:	[0s / 5s],		train_loss: 4.2060
59:	[0s / 11s],		train_loss: 3.9470
17:	[0s / 6s],		train_loss: 4.4506
97:	[0s / 59s],		train_loss: 3.8146
10:	[0s / 1s],		train_loss: 4.3316
34:	[0s / 5s],		train_loss: 4.2060
60:	[0s / 11s],		train_loss: 3.9905
11:	[0s / 1s],		train_loss: 4.3118
35:	[0s / 5s],		train_loss: 4.2128
61:	[0s / 11s],		train_loss: 3.9488
12:	[0s / 1s],		train_loss: 4.2983
18:	[0s / 6s],		train_loss: 4.4320
36:	[0s / 5s],		train_loss: 4.1825
13:	[0s / 1s],		train_loss: 4.3068
62:	[0s / 11s],		train_loss: 3.9721
37:	[0s / 5s],		train_loss: 4.1884
14:	[0s / 2s],		train_loss: 4.2733
38:	[0s / 5s],		train_loss: 4.1629
63:	[0s / 11s],		train_loss: 3.9462
19:	[0s / 6s],		train_loss: 4.4348
98:	[0s / 59s],		train_loss: 3.8151
52:	[3s / 3m:10s],		train_loss: 4.2102
61:	[1s / 1m:6s],		train_loss: 4.2735
15:	[0s / 2s],		train_loss: 4.2981
39:	[0s / 5s],		train_loss: 4.1742
64:	[0s / 12s],		train_loss: 3.9178
16:	[0s / 2s],		train_loss: 4.2419
40:	[0s / 6s],		train_loss: 4.1582
20:	[0s / 7s],		train_loss: 4.4272
65:	[0s / 12s],		train_loss: 3.9233
17:	[0s / 2s],		train_loss: 4.2715
41:	[0s / 6s],		train_loss: 4.1397
66:	[0s / 12s],		train_loss: 3.9204
18:	[0s / 2s],		train_loss: 4.2482
42:	[0s / 6s],		train_loss: 4.1450
99:	[0s / 1m:0s],		train_loss: 3.8042
19:	[0s / 2s],		train_loss: 4.2563
21:	[0s / 7s],		train_loss: 4.3962
43:	[0s / 6s],		train_loss: 4.1560
67:	[0s / 12s],		train_loss: 3.9304
20:	[0s / 3s],		train_loss: 4.2457
44:	[0s / 6s],		train_loss: 4.1622
68:	[0s / 12s],		train_loss: 3.9077
21:	[0s / 3s],		train_loss: 4.2685
22:	[0s / 7s],		train_loss: 4.3806
45:	[0s / 6s],		train_loss: 4.1388
69:	[0s / 13s],		train_loss: 3.8844
22:	[0s / 3s],		train_loss: 4.2090
46:	[0s / 7s],		train_loss: 4.1329